sentence_good,sentence_bad,field,linguistics_term,UID,simple_LM_method,one_prefix_method,two_prefix_method,lexically_identical,pair_id,good_prob,bad_prob,correct
High schools are interesting to drop by.,High schools are certain to drop by.,syntax_semantics,control_raising,tough_vs_raising_1,True,False,False,False,264,-43.12969970703125,-43.89630126953125,1
Brenda was difficult to work with.,Brenda was unlikely to work with.,syntax_semantics,control_raising,tough_vs_raising_1,True,False,False,False,265,-31.8341064453125,-34.47721481323242,1
Every man is easy to talk about.,Every man is about to talk about.,syntax_semantics,control_raising,tough_vs_raising_1,True,False,False,False,266,-31.782278060913086,-31.029930114746094,0
Matt isn't difficult to complain about.,Matt isn't likely to complain about.,syntax_semantics,control_raising,tough_vs_raising_1,True,False,False,False,267,-34.61343765258789,-34.613990783691406,1
That river wasn't interesting to drive to.,That river wasn't about to drive to.,syntax_semantics,control_raising,tough_vs_raising_1,True,False,False,False,268,-48.958343505859375,-44.418174743652344,0
Those schools weren't pleasant to drop by.,Those schools weren't bound to drop by.,syntax_semantics,control_raising,tough_vs_raising_1,True,False,False,False,269,-50.09004211425781,-49.87497329711914,0
Michelle wasn't hard work to complain about.,Michelle wasn't bound to complain about.,syntax_semantics,control_raising,tough_vs_raising_1,True,False,False,False,270,-40.98374938964844,-36.707542419433594,0
Restaurants aren't exciting to drop by.,Restaurants aren't apt to drop by.,syntax_semantics,control_raising,tough_vs_raising_1,True,False,False,False,271,-58.582481384277344,-60.226959228515625,1
Eva isn't exciting to reference.,Eva isn't about to reference.,syntax_semantics,control_raising,tough_vs_raising_1,True,False,False,False,272,-36.922889709472656,-33.441410064697266,0
Most art galleries weren't enjoyable to drop by.,Most art galleries weren't bound to drop by.,syntax_semantics,control_raising,tough_vs_raising_1,True,False,False,False,273,-66.82588958740234,-64.4093017578125,0
Janet wasn't boring to fire.,Janet wasn't apt to fire.,syntax_semantics,control_raising,tough_vs_raising_1,True,False,False,False,274,-40.437801361083984,-38.332557678222656,0
Spain is difficult to bike to.,Spain is likely to bike to.,syntax_semantics,control_raising,tough_vs_raising_1,True,False,False,False,275,-34.7457160949707,-34.75502014160156,1
These cashiers are tough to work with.,These cashiers are certain to work with.,syntax_semantics,control_raising,tough_vs_raising_1,True,False,False,False,276,-53.9465217590332,-53.701393127441406,0
A lot of college campuses aren't boring to walk through.,A lot of college campuses aren't sure to walk through.,syntax_semantics,control_raising,tough_vs_raising_1,True,False,False,False,277,-69.94419860839844,-67.04627227783203,0
Daniel's grandmother is irritating to cure.,Daniel's grandmother is unlikely to cure.,syntax_semantics,control_raising,tough_vs_raising_1,True,False,False,False,278,-40.08920669555664,-38.11598205566406,0
All girls weren't hard work to care for.,All girls weren't soon to care for.,syntax_semantics,control_raising,tough_vs_raising_1,True,False,False,False,279,-51.753726959228516,-47.57978439331055,0
The nuclei weren't ready to lift.,The nuclei weren't soon to lift.,syntax_semantics,control_raising,tough_vs_raising_1,True,False,False,False,280,-49.83099365234375,-52.68077087402344,1
Eric is enjoyable to return to.,Eric is certain to return to.,syntax_semantics,control_raising,tough_vs_raising_1,True,False,False,False,281,-33.91759490966797,-30.118396759033203,0
Raymond was hard to boast about.,Raymond was about to boast about.,syntax_semantics,control_raising,tough_vs_raising_1,True,False,False,False,282,-39.62154769897461,-39.32830810546875,0
Matt wasn't easy to scare.,Matt wasn't bound to scare.,syntax_semantics,control_raising,tough_vs_raising_1,True,False,False,False,283,-31.81816864013672,-34.05718231201172,1
Some art gallery isn't boring to drive to.,Some art gallery isn't soon to drive to.,syntax_semantics,control_raising,tough_vs_raising_1,True,False,False,False,284,-59.832069396972656,-59.083736419677734,0
Roger wasn't boring to reveal.,Roger wasn't soon to reveal.,syntax_semantics,control_raising,tough_vs_raising_1,True,False,False,False,285,-37.032379150390625,-35.055580139160156,0
The girl isn't pleasant to return to.,The girl isn't apt to return to.,syntax_semantics,control_raising,tough_vs_raising_1,True,False,False,False,286,-41.75776290893555,-43.055824279785156,1
Stephanie isn't pleasant to boast about.,Stephanie isn't likely to boast about.,syntax_semantics,control_raising,tough_vs_raising_1,True,False,False,False,287,-54.484588623046875,-53.484649658203125,0
Leslie wasn't unpleasant to argue about.,Leslie wasn't likely to argue about.,syntax_semantics,control_raising,tough_vs_raising_1,True,False,False,False,288,-48.519287109375,-44.33091735839844,0
Those malls are hard to walk through.,Those malls are about to walk through.,syntax_semantics,control_raising,tough_vs_raising_1,True,False,False,False,289,-41.694740295410156,-43.473976135253906,1
Heather wasn't unpleasant to talk about.,Heather wasn't unlikely to talk about.,syntax_semantics,control_raising,tough_vs_raising_1,True,False,False,False,290,-45.81052017211914,-45.48036575317383,0
Catherine's grandsons are pleasant to examine.,Catherine's grandsons are likely to examine.,syntax_semantics,control_raising,tough_vs_raising_1,True,False,False,False,291,-68.16111755371094,-64.2847671508789,0
Those grocery stores were annoying to drive to.,Those grocery stores were certain to drive to.,syntax_semantics,control_raising,tough_vs_raising_1,True,False,False,False,292,-55.176246643066406,-54.976993560791016,0
Melanie's friends are interesting to listen to.,Melanie's friends are apt to listen to.,syntax_semantics,control_raising,tough_vs_raising_1,True,False,False,False,293,-50.803714752197266,-50.10081481933594,0
The dancers were unpleasant to listen to.,The dancers were soon to listen to.,syntax_semantics,control_raising,tough_vs_raising_1,True,False,False,False,294,-43.17465591430664,-41.285560607910156,0
The cafe is tough to walk through.,The cafe is sure to walk through.,syntax_semantics,control_raising,tough_vs_raising_1,True,False,False,False,295,-42.862667083740234,-42.045814514160156,0
That ice is easy to lift.,That ice is sure to lift.,syntax_semantics,control_raising,tough_vs_raising_1,True,False,False,False,296,-36.312103271484375,-38.860748291015625,1
Waitresses weren't easy to talk about.,Waitresses weren't bound to talk about.,syntax_semantics,control_raising,tough_vs_raising_1,True,False,False,False,297,-44.58197784423828,-46.98540496826172,1
Stacey isn't fun to argue about.,Stacey isn't bound to argue about.,syntax_semantics,control_raising,tough_vs_raising_1,True,False,False,False,298,-44.383148193359375,-46.968074798583984,1
The restaurant was annoying to walk through.,The restaurant was likely to walk through.,syntax_semantics,control_raising,tough_vs_raising_1,True,False,False,False,299,-42.42211151123047,-38.763668060302734,0
Donna's supervisors weren't enjoyable to talk about.,Donna's supervisors weren't certain to talk about.,syntax_semantics,control_raising,tough_vs_raising_1,True,False,False,False,300,-62.72574234008789,-60.88218688964844,0
Scarves aren't enjoyable to wear.,Scarves aren't sure to wear.,syntax_semantics,control_raising,tough_vs_raising_1,True,False,False,False,301,-45.836753845214844,-41.094032287597656,0
The son of Patrick was tough to conceal.,The son of Patrick was certain to conceal.,syntax_semantics,control_raising,tough_vs_raising_1,True,False,False,False,302,-49.17571258544922,-47.22948455810547,0
Some sweaters are enjoyable to wear.,Some sweaters are bound to wear.,syntax_semantics,control_raising,tough_vs_raising_1,True,False,False,False,303,-48.25321960449219,-44.63554382324219,0
Eva was hard work to argue about.,Eva was bound to argue about.,syntax_semantics,control_raising,tough_vs_raising_1,True,False,False,False,304,-36.296417236328125,-30.97265625,0
Pamphlets were hard work to boast about.,Pamphlets were apt to boast about.,syntax_semantics,control_raising,tough_vs_raising_1,True,False,False,False,305,-61.72576141357422,-56.68254852294922,0
Craig isn't pleasant to escape from.,Craig isn't unlikely to escape from.,syntax_semantics,control_raising,tough_vs_raising_1,True,False,False,False,306,-37.80329132080078,-40.486228942871094,1
A screen wasn't hard work to conceal.,A screen wasn't unlikely to conceal.,syntax_semantics,control_raising,tough_vs_raising_1,True,False,False,False,307,-53.79634094238281,-48.0782470703125,0
Many college campuses weren't annoying to escape from.,Many college campuses weren't sure to escape from.,syntax_semantics,control_raising,tough_vs_raising_1,True,False,False,False,308,-64.30950164794922,-61.876243591308594,0
Those libraries were hard to drive to.,Those libraries were unlikely to drive to.,syntax_semantics,control_raising,tough_vs_raising_1,True,False,False,False,309,-40.41100311279297,-44.67876052856445,1
Men were hard work to talk to.,Men were bound to talk to.,syntax_semantics,control_raising,tough_vs_raising_1,True,False,False,False,310,-32.020713806152344,-28.075706481933594,0
A lot of mountains aren't interesting to drive to.,A lot of mountains aren't unlikely to drive to.,syntax_semantics,control_raising,tough_vs_raising_1,True,False,False,False,311,-58.85459899902344,-59.78294372558594,1
Every woman's piano teachers aren't fun to reveal.,Every woman's piano teachers aren't likely to reveal.,syntax_semantics,control_raising,tough_vs_raising_1,True,False,False,False,312,-66.54147338867188,-66.38483428955078,0
Some son of the actresses was easy to complain about.,Some son of the actresses was soon to complain about.,syntax_semantics,control_raising,tough_vs_raising_1,True,False,False,False,313,-56.26566696166992,-59.68230056762695,1
Grocery stores were annoying to walk through.,Grocery stores were certain to walk through.,syntax_semantics,control_raising,tough_vs_raising_1,True,False,False,False,314,-62.35417175292969,-61.54615020751953,0
Chad's classmates aren't hard work to examine.,Chad's classmates aren't bound to examine.,syntax_semantics,control_raising,tough_vs_raising_1,True,False,False,False,315,-61.315818786621094,-57.850807189941406,0
Some college campuses were pleasant to walk through.,Some college campuses were apt to walk through.,syntax_semantics,control_raising,tough_vs_raising_1,True,False,False,False,316,-55.843994140625,-54.857269287109375,0
Theresa wasn't hard work to fire.,Theresa wasn't unlikely to fire.,syntax_semantics,control_raising,tough_vs_raising_1,True,False,False,False,317,-49.47071838378906,-45.676109313964844,0
Sabrina is tough to flee from.,Sabrina is apt to flee from.,syntax_semantics,control_raising,tough_vs_raising_1,True,False,False,False,318,-46.12978744506836,-44.225006103515625,0
Randolf is interesting to scare.,Randolf is unlikely to scare.,syntax_semantics,control_raising,tough_vs_raising_1,True,False,False,False,319,-38.53507995605469,-37.89778518676758,0
That hill wasn't enjoyable to drop by.,That hill wasn't sure to drop by.,syntax_semantics,control_raising,tough_vs_raising_1,True,False,False,False,320,-56.11669921875,-51.64156723022461,0
The Borgias aren't hard to care for.,The Borgias aren't about to care for.,syntax_semantics,control_raising,tough_vs_raising_1,True,False,False,False,321,-57.91114044189453,-58.56187057495117,1
Those mothers of Carolyn were annoying to reference.,Those mothers of Carolyn were sure to reference.,syntax_semantics,control_raising,tough_vs_raising_1,True,False,False,False,322,-58.548545837402344,-55.395774841308594,0
Karla wasn't irritating to fire.,Karla wasn't certain to fire.,syntax_semantics,control_raising,tough_vs_raising_1,True,False,False,False,323,-43.20062255859375,-42.384769439697266,0
Some jackets aren't easy to wear.,Some jackets aren't unlikely to wear.,syntax_semantics,control_raising,tough_vs_raising_1,True,False,False,False,324,-42.735923767089844,-46.01942443847656,1
Those closets were easy to drive to.,Those closets were certain to drive to.,syntax_semantics,control_raising,tough_vs_raising_1,True,False,False,False,325,-48.46952819824219,-51.362762451171875,1
Katherine's tutors weren't fun to flee from.,Katherine's tutors weren't likely to flee from.,syntax_semantics,control_raising,tough_vs_raising_1,True,False,False,False,326,-69.78727722167969,-68.40315246582031,0
A lot of public parks weren't hard work to drop by.,A lot of public parks weren't likely to drop by.,syntax_semantics,control_raising,tough_vs_raising_1,True,False,False,False,327,-74.63656616210938,-66.28965759277344,0
Bradley was boring to conceal.,Bradley was unlikely to conceal.,syntax_semantics,control_raising,tough_vs_raising_1,True,False,False,False,328,-38.407508850097656,-35.52285385131836,0
Tiffany's mentee wasn't hard work to examine.,Tiffany's mentee wasn't about to examine.,syntax_semantics,control_raising,tough_vs_raising_1,True,False,False,False,329,-82.31765747070312,-74.53849029541016,0
Some children are ready to flee from.,Some children are soon to flee from.,syntax_semantics,control_raising,tough_vs_raising_1,True,False,False,False,330,-39.95825958251953,-45.63035583496094,1
Thomas's contractors weren't enjoyable to talk about.,Thomas's contractors weren't unlikely to talk about.,syntax_semantics,control_raising,tough_vs_raising_1,True,False,False,False,331,-54.73664855957031,-53.10511779785156,0
All museums are easy to drop by.,All museums are bound to drop by.,syntax_semantics,control_raising,tough_vs_raising_1,True,False,False,False,332,-44.068260192871094,-46.606544494628906,1
Mitchell wasn't pleasant to conceal.,Mitchell wasn't unlikely to conceal.,syntax_semantics,control_raising,tough_vs_raising_1,True,False,False,False,333,-46.643646240234375,-48.00957107543945,1
These grandsons of Carlos were easy to conceal.,These grandsons of Carlos were soon to conceal.,syntax_semantics,control_raising,tough_vs_raising_1,True,False,False,False,334,-69.51559448242188,-70.55659484863281,1
Some hospitals are irritating to escape from.,Some hospitals are apt to escape from.,syntax_semantics,control_raising,tough_vs_raising_1,True,False,False,False,335,-44.47222137451172,-43.10038375854492,0
This closet was irritating to walk through.,This closet was apt to walk through.,syntax_semantics,control_raising,tough_vs_raising_1,True,False,False,False,336,-44.72515106201172,-42.15032196044922,0
Carolyn's French teacher was fun to talk about.,Carolyn's French teacher was soon to talk about.,syntax_semantics,control_raising,tough_vs_raising_1,True,False,False,False,337,-56.5241584777832,-60.5933837890625,1
Peter's ex-husbands weren't fun to fire.,Peter's ex-husbands weren't sure to fire.,syntax_semantics,control_raising,tough_vs_raising_1,True,False,False,False,338,-69.64493560791016,-70.53987121582031,1
A lot of brothers of a dancer were irritating to fire.,A lot of brothers of a dancer were sure to fire.,syntax_semantics,control_raising,tough_vs_raising_1,True,False,False,False,339,-68.81365966796875,-64.94391632080078,0
That mountain was tough to lift.,That mountain was unlikely to lift.,syntax_semantics,control_raising,tough_vs_raising_1,True,False,False,False,340,-39.06593322753906,-38.656620025634766,0
Dawn is fun to reference.,Dawn is apt to reference.,syntax_semantics,control_raising,tough_vs_raising_1,True,False,False,False,341,-38.75105285644531,-39.024871826171875,1
Cynthia isn't exciting to care for.,Cynthia isn't likely to care for.,syntax_semantics,control_raising,tough_vs_raising_1,True,False,False,False,342,-59.8915901184082,-57.63044738769531,0
Diana's son isn't fun to conceal.,Diana's son isn't about to conceal.,syntax_semantics,control_raising,tough_vs_raising_1,True,False,False,False,343,-54.88164520263672,-55.239158630371094,1
Many people were enjoyable to talk to.,Many people were soon to talk to.,syntax_semantics,control_raising,tough_vs_raising_1,True,False,False,False,344,-34.056617736816406,-32.03125762939453,0
Raymond wasn't pleasant to talk to.,Raymond wasn't unlikely to talk to.,syntax_semantics,control_raising,tough_vs_raising_1,True,False,False,False,345,-39.61293029785156,-41.310638427734375,1
Some public park was tough to bike to.,Some public park was about to bike to.,syntax_semantics,control_raising,tough_vs_raising_1,True,False,False,False,346,-57.51751708984375,-52.44838333129883,0
Heidi's nieces weren't exciting to work with.,Heidi's nieces weren't unlikely to work with.,syntax_semantics,control_raising,tough_vs_raising_1,True,False,False,False,347,-79.63896942138672,-79.08390045166016,0
Closets weren't exciting to arrive at.,Closets weren't unlikely to arrive at.,syntax_semantics,control_raising,tough_vs_raising_1,True,False,False,False,348,-56.34537124633789,-57.7048225402832,1
The senators are boring to cure.,The senators are soon to cure.,syntax_semantics,control_raising,tough_vs_raising_1,True,False,False,False,349,-41.0743408203125,-40.056541442871094,0
Cheryl's tutor was irritating to listen to.,Cheryl's tutor was soon to listen to.,syntax_semantics,control_raising,tough_vs_raising_1,True,False,False,False,350,-68.82760620117188,-68.02859497070312,0
This dancer is enjoyable to argue about.,This dancer is certain to argue about.,syntax_semantics,control_raising,tough_vs_raising_1,True,False,False,False,351,-45.955448150634766,-44.26841735839844,0
This college campus wasn't interesting to arrive at.,This college campus wasn't bound to arrive at.,syntax_semantics,control_raising,tough_vs_raising_1,True,False,False,False,352,-58.946067810058594,-59.813804626464844,1
Some drivers weren't interesting to complain about.,Some drivers weren't bound to complain about.,syntax_semantics,control_raising,tough_vs_raising_1,True,False,False,False,353,-46.70842742919922,-47.423221588134766,1
Carlos's classmate wasn't ready to reference.,Carlos's classmate wasn't certain to reference.,syntax_semantics,control_raising,tough_vs_raising_1,True,False,False,False,354,-59.73881149291992,-62.42168045043945,1
Winston Churchill wasn't hard to listen to.,Winston Churchill wasn't bound to listen to.,syntax_semantics,control_raising,tough_vs_raising_1,True,False,False,False,355,-51.32234191894531,-54.786766052246094,1
Rhonda's grandmothers aren't hard work to escape from.,Rhonda's grandmothers aren't bound to escape from.,syntax_semantics,control_raising,tough_vs_raising_1,True,False,False,False,356,-72.4130859375,-67.87308502197266,0
The restaurant isn't unpleasant to drop by.,The restaurant isn't likely to drop by.,syntax_semantics,control_raising,tough_vs_raising_1,True,False,False,False,357,-50.01343536376953,-46.1839485168457,0
A public park is hard to drive to.,A public park is sure to drive to.,syntax_semantics,control_raising,tough_vs_raising_1,True,False,False,False,358,-45.90919876098633,-50.770870208740234,1
That grocery store wasn't irritating to drop by.,That grocery store wasn't likely to drop by.,syntax_semantics,control_raising,tough_vs_raising_1,True,False,False,False,359,-61.880821228027344,-58.16606140136719,0
Edward isn't boring to listen to.,Edward isn't apt to listen to.,syntax_semantics,control_raising,tough_vs_raising_1,True,False,False,False,360,-35.811424255371094,-35.72029113769531,0
A closet isn't hard to arrive at.,A closet isn't certain to arrive at.,syntax_semantics,control_raising,tough_vs_raising_1,True,False,False,False,361,-45.83779525756836,-49.331199645996094,1
The Borgias' ex-girlfriends were difficult to work with.,The Borgias' ex-girlfriends were bound to work with.,syntax_semantics,control_raising,tough_vs_raising_1,True,False,False,False,362,-82.10804748535156,-83.44500732421875,1
Every mall isn't exciting to drop by.,Every mall isn't soon to drop by.,syntax_semantics,control_raising,tough_vs_raising_1,True,False,False,False,363,-48.70611572265625,-49.623207092285156,1
Claire's grandmothers were hard work to argue about.,Claire's grandmothers were soon to argue about.,syntax_semantics,control_raising,tough_vs_raising_1,True,False,False,False,364,-65.77200317382812,-63.581336975097656,0
Derek wasn't hard work to respect.,Derek wasn't apt to respect.,syntax_semantics,control_raising,tough_vs_raising_1,True,False,False,False,365,-48.09440612792969,-43.49690628051758,0
An essay wasn't difficult to disagree with.,An essay wasn't certain to disagree with.,syntax_semantics,control_raising,tough_vs_raising_1,True,False,False,False,366,-49.59455490112305,-52.30024719238281,1
Raymond is irritating to conceal.,Raymond is unlikely to conceal.,syntax_semantics,control_raising,tough_vs_raising_1,True,False,False,False,367,-39.543155670166016,-38.32878875732422,0
Debra wasn't hard work to talk to.,Debra wasn't unlikely to talk to.,syntax_semantics,control_raising,tough_vs_raising_1,True,False,False,False,368,-45.363624572753906,-41.05223083496094,0
Christopher was tough to cure.,Christopher was bound to cure.,syntax_semantics,control_raising,tough_vs_raising_1,True,False,False,False,369,-28.052982330322266,-25.786643981933594,0
Skirts are annoying to wear.,Skirts are soon to wear.,syntax_semantics,control_raising,tough_vs_raising_1,True,False,False,False,370,-39.332847595214844,-39.91761016845703,1
A lot of pants were tough to reveal.,A lot of pants were unlikely to reveal.,syntax_semantics,control_raising,tough_vs_raising_1,True,False,False,False,371,-53.6650390625,-51.82653045654297,0
That art gallery wasn't easy to arrive at.,That art gallery wasn't certain to arrive at.,syntax_semantics,control_raising,tough_vs_raising_1,True,False,False,False,372,-60.41404724121094,-63.43916702270508,1
Some high school isn't interesting to walk through.,Some high school isn't sure to walk through.,syntax_semantics,control_raising,tough_vs_raising_1,True,False,False,False,373,-48.69395065307617,-48.434181213378906,0
This teenager's nephew is enjoyable to scare.,This teenager's nephew is sure to scare.,syntax_semantics,control_raising,tough_vs_raising_1,True,False,False,False,374,-55.20928192138672,-52.80746078491211,0
Libraries aren't annoying to go to.,Libraries aren't apt to go to.,syntax_semantics,control_raising,tough_vs_raising_1,True,False,False,False,375,-48.400367736816406,-47.727203369140625,0
Joseph wasn't annoying to fire.,Joseph wasn't likely to fire.,syntax_semantics,control_raising,tough_vs_raising_1,True,False,False,False,376,-32.975833892822266,-29.964195251464844,0
The Great Lakes aren't irritating to bike to.,The Great Lakes aren't soon to bike to.,syntax_semantics,control_raising,tough_vs_raising_1,True,False,False,False,377,-64.85888671875,-61.816524505615234,0
Some patients' mentee was exciting to conceal.,Some patients' mentee was about to conceal.,syntax_semantics,control_raising,tough_vs_raising_1,True,False,False,False,378,-67.03038787841797,-64.03140258789062,0
Winston Churchill's friends aren't unpleasant to return to.,Winston Churchill's friends aren't about to return to.,syntax_semantics,control_raising,tough_vs_raising_1,True,False,False,False,379,-67.48810577392578,-64.15855407714844,0
Most cafes weren't ready to bike to.,Most cafes weren't likely to bike to.,syntax_semantics,control_raising,tough_vs_raising_1,True,False,False,False,380,-55.265140533447266,-56.035064697265625,1
Carl was hard to work with.,Carl was soon to work with.,syntax_semantics,control_raising,tough_vs_raising_1,True,False,False,False,381,-27.476852416992188,-31.212448120117188,1
Kenneth's contractors were difficult to return to.,Kenneth's contractors were bound to return to.,syntax_semantics,control_raising,tough_vs_raising_1,True,False,False,False,382,-57.2276725769043,-57.64244842529297,1
Christine is ready to listen to.,Christine is certain to listen to.,syntax_semantics,control_raising,tough_vs_raising_1,True,False,False,False,383,-34.1759147644043,-37.80035400390625,1
Tracy's best friends aren't hard to return to.,Tracy's best friends aren't unlikely to return to.,syntax_semantics,control_raising,tough_vs_raising_1,True,False,False,False,384,-58.55363082885742,-63.751373291015625,1
A lot of drivers' daughter wasn't hard work to complain about.,A lot of drivers' daughter wasn't certain to complain about.,syntax_semantics,control_raising,tough_vs_raising_1,True,False,False,False,385,-77.91307067871094,-72.12482452392578,0
These people weren't boring to reference.,These people weren't about to reference.,syntax_semantics,control_raising,tough_vs_raising_1,True,False,False,False,386,-42.55982208251953,-38.27531433105469,0
Deanna is irritating to cure.,Deanna is bound to cure.,syntax_semantics,control_raising,tough_vs_raising_1,True,False,False,False,387,-38.3348388671875,-36.69449996948242,0
Bill wasn't fun to scare.,Bill wasn't sure to scare.,syntax_semantics,control_raising,tough_vs_raising_1,True,False,False,False,388,-33.45402526855469,-33.63100051879883,1
Most mountains are hard work to bike to.,Most mountains are likely to bike to.,syntax_semantics,control_raising,tough_vs_raising_1,True,False,False,False,389,-50.167503356933594,-43.17384719848633,0
Some hill wasn't exciting to go to.,Some hill wasn't unlikely to go to.,syntax_semantics,control_raising,tough_vs_raising_1,True,False,False,False,390,-44.09682846069336,-45.568607330322266,1
Cheryl is enjoyable to cure.,Cheryl is about to cure.,syntax_semantics,control_raising,tough_vs_raising_1,True,False,False,False,391,-49.607845306396484,-44.3597412109375,0
A lot of nieces of a child aren't difficult to respect.,A lot of nieces of a child aren't sure to respect.,syntax_semantics,control_raising,tough_vs_raising_1,True,False,False,False,392,-83.99722290039062,-85.40480041503906,1
