sentence_good,sentence_bad,field,linguistics_term,UID,simple_LM_method,one_prefix_method,two_prefix_method,lexically_identical,pair_id,good_prob,bad_prob,correct
James is pleasant to flee from.,James is apt to flee from.,syntax_semantics,control_raising,tough_vs_raising_1,True,False,False,False,0,-37.281925201416016,-37.14013671875,0
Samuel's lawyer was easy to reference.,Samuel's lawyer was certain to reference.,syntax_semantics,control_raising,tough_vs_raising_1,True,False,False,False,1,-50.56018829345703,-53.086021423339844,1
Benjamin's tutor was easy to boast about.,Benjamin's tutor was certain to boast about.,syntax_semantics,control_raising,tough_vs_raising_1,True,False,False,False,2,-58.825584411621094,-60.816524505615234,1
Laura isn't interesting to cure.,Laura isn't soon to cure.,syntax_semantics,control_raising,tough_vs_raising_1,True,False,False,False,3,-33.60377502441406,-33.8907585144043,1
Some jacket wasn't ready to wear.,Some jacket wasn't bound to wear.,syntax_semantics,control_raising,tough_vs_raising_1,True,False,False,False,4,-41.11113739013672,-44.0943489074707,1
Many drivers aren't difficult to reference.,Many drivers aren't likely to reference.,syntax_semantics,control_raising,tough_vs_raising_1,True,False,False,False,5,-43.031951904296875,-43.61100769042969,1
Julia wasn't fun to talk to.,Julia wasn't unlikely to talk to.,syntax_semantics,control_raising,tough_vs_raising_1,True,False,False,False,6,-35.5185546875,-39.8165397644043,1
Valerie's colleagues aren't pleasant to respect.,Valerie's colleagues aren't likely to respect.,syntax_semantics,control_raising,tough_vs_raising_1,True,False,False,False,7,-59.40856170654297,-56.747528076171875,0
Veronica isn't boring to conceal.,Veronica isn't unlikely to conceal.,syntax_semantics,control_raising,tough_vs_raising_1,True,False,False,False,8,-48.909515380859375,-48.11963653564453,0
Stacey wasn't interesting to listen to.,Stacey wasn't soon to listen to.,syntax_semantics,control_raising,tough_vs_raising_1,True,False,False,False,9,-43.11665344238281,-43.147056579589844,1
Those glasses aren't hard work to wear.,Those glasses aren't soon to wear.,syntax_semantics,control_raising,tough_vs_raising_1,True,False,False,False,10,-46.14760971069336,-41.85444259643555,0
Linda was interesting to reference.,Linda was soon to reference.,syntax_semantics,control_raising,tough_vs_raising_1,True,False,False,False,11,-36.09739685058594,-39.1202392578125,1
This waitress is exciting to conceal.,This waitress is unlikely to conceal.,syntax_semantics,control_raising,tough_vs_raising_1,True,False,False,False,12,-41.433170318603516,-41.356475830078125,0
Some drivers are tough to listen to.,Some drivers are apt to listen to.,syntax_semantics,control_raising,tough_vs_raising_1,True,False,False,False,13,-40.370384216308594,-40.77873229980469,1
Omar wasn't interesting to reference.,Omar wasn't soon to reference.,syntax_semantics,control_raising,tough_vs_raising_1,True,False,False,False,14,-46.74055862426758,-47.01519775390625,1
Every dress isn't unpleasant to wear.,Every dress isn't likely to wear.,syntax_semantics,control_raising,tough_vs_raising_1,True,False,False,False,15,-42.03411102294922,-38.5814323425293,0
Raymond wasn't hard to argue about.,Raymond wasn't soon to argue about.,syntax_semantics,control_raising,tough_vs_raising_1,True,False,False,False,16,-41.84481430053711,-45.72078323364258,1
Robert wasn't pleasant to respect.,Robert wasn't soon to respect.,syntax_semantics,control_raising,tough_vs_raising_1,True,False,False,False,17,-33.481834411621094,-33.632606506347656,1
Clyde's partners are annoying to respect.,Clyde's partners are apt to respect.,syntax_semantics,control_raising,tough_vs_raising_1,True,False,False,False,18,-64.43423461914062,-60.40340805053711,0
These bikes aren't unpleasant to conceal.,These bikes aren't apt to conceal.,syntax_semantics,control_raising,tough_vs_raising_1,True,False,False,False,19,-48.973365783691406,-48.505836486816406,0
Colleen's girlfriend is irritating to cure.,Colleen's girlfriend is about to cure.,syntax_semantics,control_raising,tough_vs_raising_1,True,False,False,False,20,-48.93193054199219,-45.589744567871094,0
Kayla wasn't pleasant to cure.,Kayla wasn't bound to cure.,syntax_semantics,control_raising,tough_vs_raising_1,True,False,False,False,21,-42.750160217285156,-42.383544921875,0
The restaurant was easy to drive to.,The restaurant was about to drive to.,syntax_semantics,control_raising,tough_vs_raising_1,True,False,False,False,22,-38.613807678222656,-36.99149703979492,0
A school was ready to go to.,A school was apt to go to.,syntax_semantics,control_raising,tough_vs_raising_1,True,False,False,False,23,-31.72230339050293,-35.36665344238281,1
Leslie was tough to escape from.,Leslie was unlikely to escape from.,syntax_semantics,control_raising,tough_vs_raising_1,True,False,False,False,24,-39.40312194824219,-39.23344802856445,0
Some glaciers are unpleasant to return to.,Some glaciers are likely to return to.,syntax_semantics,control_raising,tough_vs_raising_1,True,False,False,False,25,-45.75731658935547,-39.86469650268555,0
Sonia isn't exciting to care for.,Sonia isn't bound to care for.,syntax_semantics,control_raising,tough_vs_raising_1,True,False,False,False,26,-47.467491149902344,-47.13370895385742,0
Kevin isn't irritating to work with.,Kevin isn't bound to work with.,syntax_semantics,control_raising,tough_vs_raising_1,True,False,False,False,27,-37.466766357421875,-35.447608947753906,0
A restaurant was enjoyable to arrive at.,A restaurant was unlikely to arrive at.,syntax_semantics,control_raising,tough_vs_raising_1,True,False,False,False,28,-47.63493728637695,-44.41136932373047,0
Some blouse wasn't irritating to wear.,Some blouse wasn't about to wear.,syntax_semantics,control_raising,tough_vs_raising_1,True,False,False,False,29,-52.163238525390625,-45.880516052246094,0
What wasn't ready to wear.,What wasn't soon to wear.,syntax_semantics,control_raising,tough_vs_raising_1,True,False,False,False,30,-28.713048934936523,-32.9871826171875,1
Daniel's ex-boyfriends weren't exciting to flee from.,Daniel's ex-boyfriends weren't soon to flee from.,syntax_semantics,control_raising,tough_vs_raising_1,True,False,False,False,31,-79.23309326171875,-78.28556823730469,0
The Impressionists were hard work to disagree with.,The Impressionists were likely to disagree with.,syntax_semantics,control_raising,tough_vs_raising_1,True,False,False,False,32,-70.32524108886719,-62.5837516784668,0
Judy is easy to work with.,Judy is certain to work with.,syntax_semantics,control_raising,tough_vs_raising_1,True,False,False,False,33,-31.46991539001465,-35.01687240600586,1
Craig's associates are irritating to talk about.,Craig's associates are about to talk about.,syntax_semantics,control_raising,tough_vs_raising_1,True,False,False,False,34,-45.423309326171875,-40.451393127441406,0
Marie wasn't fun to complain about.,Marie wasn't unlikely to complain about.,syntax_semantics,control_raising,tough_vs_raising_1,True,False,False,False,35,-34.341094970703125,-38.03886413574219,1
The public park isn't pleasant to drive to.,The public park isn't about to drive to.,syntax_semantics,control_raising,tough_vs_raising_1,True,False,False,False,36,-53.66864013671875,-50.377906799316406,0
Rivers were hard work to bike to.,Rivers were bound to bike to.,syntax_semantics,control_raising,tough_vs_raising_1,True,False,False,False,37,-52.96764373779297,-47.0805778503418,0
Christina is annoying to scare.,Christina is about to scare.,syntax_semantics,control_raising,tough_vs_raising_1,True,False,False,False,38,-37.08180236816406,-33.07960510253906,0
A lot of rugs aren't annoying to lift.,A lot of rugs aren't about to lift.,syntax_semantics,control_raising,tough_vs_raising_1,True,False,False,False,39,-59.499542236328125,-54.23567199707031,0
Vanessa is fun to work with.,Vanessa is likely to work with.,syntax_semantics,control_raising,tough_vs_raising_1,True,False,False,False,40,-39.017242431640625,-37.973106384277344,0
A doctor isn't difficult to respect.,A doctor isn't certain to respect.,syntax_semantics,control_raising,tough_vs_raising_1,True,False,False,False,41,-40.70529556274414,-43.25968551635742,1
Karla's handyman is pleasant to reference.,Karla's handyman is sure to reference.,syntax_semantics,control_raising,tough_vs_raising_1,True,False,False,False,42,-63.53623962402344,-63.766788482666016,1
Most actors aren't enjoyable to conceal.,Most actors aren't bound to conceal.,syntax_semantics,control_raising,tough_vs_raising_1,True,False,False,False,43,-51.17218017578125,-47.02851104736328,0
Steven's niece isn't fun to flee from.,Steven's niece isn't sure to flee from.,syntax_semantics,control_raising,tough_vs_raising_1,True,False,False,False,44,-54.75828552246094,-56.16577911376953,1
These sisters of Angela aren't ready to cure.,These sisters of Angela aren't unlikely to cure.,syntax_semantics,control_raising,tough_vs_raising_1,True,False,False,False,45,-56.160430908203125,-60.460182189941406,1
Some banks weren't enjoyable to go to.,Some banks weren't certain to go to.,syntax_semantics,control_raising,tough_vs_raising_1,True,False,False,False,46,-47.902713775634766,-46.28046417236328,0
That glacier was exciting to go to.,That glacier was certain to go to.,syntax_semantics,control_raising,tough_vs_raising_1,True,False,False,False,47,-42.736907958984375,-43.97054672241211,1
That mountain isn't difficult to bike to.,That mountain isn't likely to bike to.,syntax_semantics,control_raising,tough_vs_raising_1,True,False,False,False,48,-51.112648010253906,-51.7611198425293,1
A lot of children aren't exciting to escape from.,A lot of children aren't unlikely to escape from.,syntax_semantics,control_raising,tough_vs_raising_1,True,False,False,False,49,-55.39375305175781,-55.36786651611328,0
Many adults weren't exciting to argue about.,Many adults weren't apt to argue about.,syntax_semantics,control_raising,tough_vs_raising_1,True,False,False,False,50,-49.737579345703125,-50.137062072753906,1
Most shawls weren't interesting to wear.,Most shawls weren't certain to wear.,syntax_semantics,control_raising,tough_vs_raising_1,True,False,False,False,51,-57.57470703125,-57.1693115234375,0
This college campus wasn't exciting to bike to.,This college campus wasn't unlikely to bike to.,syntax_semantics,control_raising,tough_vs_raising_1,True,False,False,False,52,-63.586143493652344,-63.89744567871094,1
Some rivers weren't easy to bike to.,Some rivers weren't bound to bike to.,syntax_semantics,control_raising,tough_vs_raising_1,True,False,False,False,53,-53.18364334106445,-55.44603729248047,1
That grocery store was tough to go to.,That grocery store was apt to go to.,syntax_semantics,control_raising,tough_vs_raising_1,True,False,False,False,54,-48.78936767578125,-47.403621673583984,0
Raymond was fun to complain about.,Raymond was likely to complain about.,syntax_semantics,control_raising,tough_vs_raising_1,True,False,False,False,55,-37.95574951171875,-36.688514709472656,0
Rebecca is ready to cure.,Rebecca is likely to cure.,syntax_semantics,control_raising,tough_vs_raising_1,True,False,False,False,56,-34.990055084228516,-35.212440490722656,1
Heidi's grandfather isn't difficult to examine.,Heidi's grandfather isn't about to examine.,syntax_semantics,control_raising,tough_vs_raising_1,True,False,False,False,57,-56.45982360839844,-56.29219055175781,0
Carl was exciting to listen to.,Carl was soon to listen to.,syntax_semantics,control_raising,tough_vs_raising_1,True,False,False,False,58,-29.441120147705078,-29.436494827270508,0
Rabbits are hard work to reveal.,Rabbits are soon to reveal.,syntax_semantics,control_raising,tough_vs_raising_1,True,False,False,False,59,-51.329856872558594,-47.3980827331543,0
Those brothers of Jeffrey were boring to reference.,Those brothers of Jeffrey were sure to reference.,syntax_semantics,control_raising,tough_vs_raising_1,True,False,False,False,60,-60.027687072753906,-58.083213806152344,0
Carolyn's cousin wasn't hard to respect.,Carolyn's cousin wasn't bound to respect.,syntax_semantics,control_raising,tough_vs_raising_1,True,False,False,False,61,-52.04861068725586,-54.61842346191406,1
Patrick is irritating to respect.,Patrick is about to respect.,syntax_semantics,control_raising,tough_vs_raising_1,True,False,False,False,62,-28.219104766845703,-25.150054931640625,0
April isn't interesting to conceal.,April isn't bound to conceal.,syntax_semantics,control_raising,tough_vs_raising_1,True,False,False,False,63,-37.90175247192383,-36.185672760009766,0
This grocery store was annoying to drive to.,This grocery store was apt to drive to.,syntax_semantics,control_raising,tough_vs_raising_1,True,False,False,False,64,-49.812217712402344,-48.539756774902344,0
Guy is tough to escape from.,Guy is certain to escape from.,syntax_semantics,control_raising,tough_vs_raising_1,True,False,False,False,65,-32.813232421875,-31.215438842773438,0
Some bread is boring to lift.,Some bread is bound to lift.,syntax_semantics,control_raising,tough_vs_raising_1,True,False,False,False,66,-37.24201202392578,-35.35757064819336,0
Jill isn't fun to conceal.,Jill isn't about to conceal.,syntax_semantics,control_raising,tough_vs_raising_1,True,False,False,False,67,-44.10000228881836,-42.83987045288086,0
That bank isn't enjoyable to drop by.,That bank isn't likely to drop by.,syntax_semantics,control_raising,tough_vs_raising_1,True,False,False,False,68,-52.54388427734375,-47.49659729003906,0
Carmen isn't boring to scare.,Carmen isn't apt to scare.,syntax_semantics,control_raising,tough_vs_raising_1,True,False,False,False,69,-49.752742767333984,-49.1631965637207,0
Denise was hard work to reveal.,Denise was bound to reveal.,syntax_semantics,control_raising,tough_vs_raising_1,True,False,False,False,70,-41.7408447265625,-34.407569885253906,0
Elizabeth wasn't boring to flee from.,Elizabeth wasn't about to flee from.,syntax_semantics,control_raising,tough_vs_raising_1,True,False,False,False,71,-43.48628616333008,-38.43363571166992,0
Janice isn't hard to argue about.,Janice isn't soon to argue about.,syntax_semantics,control_raising,tough_vs_raising_1,True,False,False,False,72,-40.598304748535156,-44.67424774169922,1
Kayla isn't fun to fire.,Kayla isn't certain to fire.,syntax_semantics,control_raising,tough_vs_raising_1,True,False,False,False,73,-38.09022521972656,-41.19801330566406,1
Katherine's best friend wasn't hard work to scare.,Katherine's best friend wasn't likely to scare.,syntax_semantics,control_raising,tough_vs_raising_1,True,False,False,False,74,-63.00331497192383,-56.210289001464844,0
Daniel isn't hard work to scare.,Daniel isn't likely to scare.,syntax_semantics,control_raising,tough_vs_raising_1,True,False,False,False,75,-39.5248908996582,-33.5869140625,0
Some friend of Alicia was ready to fire.,Some friend of Alicia was soon to fire.,syntax_semantics,control_raising,tough_vs_raising_1,True,False,False,False,76,-47.128814697265625,-53.4431266784668,1
Naomi is easy to complain about.,Naomi is apt to complain about.,syntax_semantics,control_raising,tough_vs_raising_1,True,False,False,False,77,-37.50212478637695,-39.045509338378906,1
Beth was ready to listen to.,Beth was unlikely to listen to.,syntax_semantics,control_raising,tough_vs_raising_1,True,False,False,False,78,-35.11663818359375,-39.56422805786133,1
Amy's partners were enjoyable to boast about.,Amy's partners were about to boast about.,syntax_semantics,control_raising,tough_vs_raising_1,True,False,False,False,79,-54.79264450073242,-49.32928466796875,0
All offspring aren't ready to complain about.,All offspring aren't certain to complain about.,syntax_semantics,control_raising,tough_vs_raising_1,True,False,False,False,80,-48.015411376953125,-51.63020324707031,1
Katherine is difficult to care for.,Katherine is unlikely to care for.,syntax_semantics,control_raising,tough_vs_raising_1,True,False,False,False,81,-37.81299591064453,-39.23834991455078,1
Teresa wasn't tough to work with.,Teresa wasn't apt to work with.,syntax_semantics,control_raising,tough_vs_raising_1,True,False,False,False,82,-47.45928955078125,-46.4345817565918,0
They were irritating to respect.,They were certain to respect.,syntax_semantics,control_raising,tough_vs_raising_1,True,False,False,False,83,-29.236652374267578,-26.70848846435547,0
Maria is unpleasant to argue about.,Maria is bound to argue about.,syntax_semantics,control_raising,tough_vs_raising_1,True,False,False,False,84,-33.93076705932617,-31.706789016723633,0
A restaurant wasn't ready to drop by.,A restaurant wasn't sure to drop by.,syntax_semantics,control_raising,tough_vs_raising_1,True,False,False,False,85,-47.29145812988281,-49.516685485839844,1
Raymond isn't difficult to talk about.,Raymond isn't apt to talk about.,syntax_semantics,control_raising,tough_vs_raising_1,True,False,False,False,86,-38.51087188720703,-40.61684036254883,1
Laura isn't fun to fire.,Laura isn't likely to fire.,syntax_semantics,control_raising,tough_vs_raising_1,True,False,False,False,87,-29.78885841369629,-30.590545654296875,1
That lady isn't hard to escape from.,That lady isn't sure to escape from.,syntax_semantics,control_raising,tough_vs_raising_1,True,False,False,False,88,-42.20436477661133,-45.45697021484375,1
These essays about the Lutherans were fun to argue about.,These essays about the Lutherans were apt to argue about.,syntax_semantics,control_raising,tough_vs_raising_1,True,False,False,False,89,-73.62055969238281,-72.17877197265625,0
Denise wasn't boring to flee from.,Denise wasn't soon to flee from.,syntax_semantics,control_raising,tough_vs_raising_1,True,False,False,False,90,-51.118629455566406,-48.67076873779297,0
Most nuclei were ready to lift.,Most nuclei were apt to lift.,syntax_semantics,control_raising,tough_vs_raising_1,True,False,False,False,91,-42.47406768798828,-44.47894287109375,1
Amelia isn't boring to talk to.,Amelia isn't about to talk to.,syntax_semantics,control_raising,tough_vs_raising_1,True,False,False,False,92,-42.279693603515625,-38.68416976928711,0
Winston Churchill was tough to conceal.,Winston Churchill was unlikely to conceal.,syntax_semantics,control_raising,tough_vs_raising_1,True,False,False,False,93,-50.42462921142578,-48.49448776245117,0
Ann wasn't tough to conceal.,Ann wasn't likely to conceal.,syntax_semantics,control_raising,tough_vs_raising_1,True,False,False,False,94,-37.10934829711914,-33.8020133972168,0
Elaine is unpleasant to reference.,Elaine is apt to reference.,syntax_semantics,control_raising,tough_vs_raising_1,True,False,False,False,95,-39.67695617675781,-36.8578987121582,0
Victoria isn't pleasant to argue about.,Victoria isn't certain to argue about.,syntax_semantics,control_raising,tough_vs_raising_1,True,False,False,False,96,-39.150390625,-39.8526496887207,1
That skirt is annoying to wear.,That skirt is certain to wear.,syntax_semantics,control_raising,tough_vs_raising_1,True,False,False,False,97,-39.64902114868164,-39.33417510986328,0
Harvard University was ready to drive to.,Harvard University was likely to drive to.,syntax_semantics,control_raising,tough_vs_raising_1,True,False,False,False,98,-49.98223114013672,-50.442848205566406,1
Angela was ready to reference.,Angela was soon to reference.,syntax_semantics,control_raising,tough_vs_raising_1,True,False,False,False,99,-34.75887680053711,-40.75139236450195,1
Bruce is tough to scare.,Bruce is sure to scare.,syntax_semantics,control_raising,tough_vs_raising_1,True,False,False,False,100,-29.159765243530273,-27.70539093017578,0
This father of every actress isn't hard work to respect.,This father of every actress isn't about to respect.,syntax_semantics,control_raising,tough_vs_raising_1,True,False,False,False,101,-68.37066650390625,-63.52798080444336,0
The Great Lakes were boring to bike to.,The Great Lakes were likely to bike to.,syntax_semantics,control_raising,tough_vs_raising_1,True,False,False,False,102,-60.7475471496582,-56.72270965576172,0
That actress is exciting to boast about.,That actress is unlikely to boast about.,syntax_semantics,control_raising,tough_vs_raising_1,True,False,False,False,103,-48.752784729003906,-48.82600402832031,1
Brad is hard to listen to.,Brad is apt to listen to.,syntax_semantics,control_raising,tough_vs_raising_1,True,False,False,False,104,-25.003990173339844,-29.941696166992188,1
Lucille's mothers were interesting to escape from.,Lucille's mothers were certain to escape from.,syntax_semantics,control_raising,tough_vs_raising_1,True,False,False,False,105,-56.14667892456055,-56.599342346191406,1
Holly is annoying to flee from.,Holly is soon to flee from.,syntax_semantics,control_raising,tough_vs_raising_1,True,False,False,False,106,-47.356658935546875,-47.50060272216797,1
Dancers' hairdressers were ready to argue about.,Dancers' hairdressers were apt to argue about.,syntax_semantics,control_raising,tough_vs_raising_1,True,False,False,False,107,-71.61599731445312,-74.88264465332031,1
Most cafes are boring to walk through.,Most cafes are unlikely to walk through.,syntax_semantics,control_raising,tough_vs_raising_1,True,False,False,False,108,-46.709022521972656,-45.72285079956055,0
Elizabeth isn't annoying to work with.,Elizabeth isn't soon to work with.,syntax_semantics,control_raising,tough_vs_raising_1,True,False,False,False,109,-37.232688903808594,-35.2745475769043,0
Denise isn't easy to reveal.,Denise isn't certain to reveal.,syntax_semantics,control_raising,tough_vs_raising_1,True,False,False,False,110,-38.49444580078125,-40.680564880371094,1
Michelle is tough to escape from.,Michelle is about to escape from.,syntax_semantics,control_raising,tough_vs_raising_1,True,False,False,False,111,-32.95466613769531,-30.950275421142578,0
Tamara isn't enjoyable to work with.,Tamara isn't apt to work with.,syntax_semantics,control_raising,tough_vs_raising_1,True,False,False,False,112,-48.3693733215332,-45.2935791015625,0
Dan wasn't hard to boast about.,Dan wasn't likely to boast about.,syntax_semantics,control_raising,tough_vs_raising_1,True,False,False,False,113,-36.08501434326172,-37.81105422973633,1
That oasis is irritating to walk through.,That oasis is likely to walk through.,syntax_semantics,control_raising,tough_vs_raising_1,True,False,False,False,114,-51.89662170410156,-47.03645706176758,0
James was pleasant to reference.,James was apt to reference.,syntax_semantics,control_raising,tough_vs_raising_1,True,False,False,False,115,-29.59930419921875,-28.703914642333984,0
Vanessa's colleague was annoying to cure.,Vanessa's colleague was sure to cure.,syntax_semantics,control_raising,tough_vs_raising_1,True,False,False,False,116,-54.024131774902344,-51.810890197753906,0
Carolyn isn't enjoyable to boast about.,Carolyn isn't about to boast about.,syntax_semantics,control_raising,tough_vs_raising_1,True,False,False,False,117,-53.740440368652344,-47.52613067626953,0
The grandson of those teenagers is pleasant to conceal.,The grandson of those teenagers is likely to conceal.,syntax_semantics,control_raising,tough_vs_raising_1,True,False,False,False,118,-60.37164306640625,-56.26203155517578,0
Monica isn't exciting to escape from.,Monica isn't unlikely to escape from.,syntax_semantics,control_raising,tough_vs_raising_1,True,False,False,False,119,-46.811370849609375,-47.83658218383789,1
Teresa isn't tough to disagree with.,Teresa isn't bound to disagree with.,syntax_semantics,control_raising,tough_vs_raising_1,True,False,False,False,120,-51.041481018066406,-49.464149475097656,0
That customer was fun to listen to.,That customer was sure to listen to.,syntax_semantics,control_raising,tough_vs_raising_1,True,False,False,False,121,-41.85495376586914,-42.306488037109375,1
A lot of blouses are tough to wear.,A lot of blouses are bound to wear.,syntax_semantics,control_raising,tough_vs_raising_1,True,False,False,False,122,-56.58464050292969,-54.46971130371094,0
Many newspaper articles were ready to conceal.,Many newspaper articles were apt to conceal.,syntax_semantics,control_raising,tough_vs_raising_1,True,False,False,False,123,-46.472816467285156,-48.856231689453125,1
Rachelle isn't tough to reveal.,Rachelle isn't certain to reveal.,syntax_semantics,control_raising,tough_vs_raising_1,True,False,False,False,124,-45.22539520263672,-43.76654052734375,0
All grocery stores are boring to drop by.,All grocery stores are unlikely to drop by.,syntax_semantics,control_raising,tough_vs_raising_1,True,False,False,False,125,-55.58128356933594,-54.44490051269531,0
Sheila's employees were hard work to fire.,Sheila's employees were likely to fire.,syntax_semantics,control_raising,tough_vs_raising_1,True,False,False,False,126,-57.89990234375,-50.73645782470703,0
Aaron's friend was pleasant to disagree with.,Aaron's friend was about to disagree with.,syntax_semantics,control_raising,tough_vs_raising_1,True,False,False,False,127,-48.718536376953125,-47.22954559326172,0
Every son of Jerry isn't enjoyable to cure.,Every son of Jerry isn't soon to cure.,syntax_semantics,control_raising,tough_vs_raising_1,True,False,False,False,128,-56.916534423828125,-54.16671371459961,0
Steve's mother was irritating to examine.,Steve's mother was about to examine.,syntax_semantics,control_raising,tough_vs_raising_1,True,False,False,False,129,-41.40345764160156,-37.09486770629883,0
Rachel isn't easy to talk to.,Rachel isn't about to talk to.,syntax_semantics,control_raising,tough_vs_raising_1,True,False,False,False,130,-30.44825553894043,-29.233478546142578,0
All waitresses' electrician isn't fun to reference.,All waitresses' electrician isn't soon to reference.,syntax_semantics,control_raising,tough_vs_raising_1,True,False,False,False,131,-82.27525329589844,-83.51920318603516,1
Andrew isn't exciting to listen to.,Andrew isn't certain to listen to.,syntax_semantics,control_raising,tough_vs_raising_1,True,False,False,False,132,-35.27254867553711,-35.82490158081055,1
