sentence_good,sentence_bad,field,linguistics_term,UID,simple_LM_method,one_prefix_method,two_prefix_method,lexically_identical,pair_id,good_prob,bad_prob,correct
Patricia wasn't pleasant to escape from.,Patricia wasn't unlikely to escape from.,syntax_semantics,control_raising,tough_vs_raising_1,True,False,False,False,656,-48.70002746582031,-50.83104705810547,1
Those glaciers are difficult to go to.,Those glaciers are likely to go to.,syntax_semantics,control_raising,tough_vs_raising_1,True,False,False,False,657,-37.160667419433594,-36.90932083129883,0
Elizabeth isn't tough to boast about.,Elizabeth isn't apt to boast about.,syntax_semantics,control_raising,tough_vs_raising_1,True,False,False,False,658,-42.21977996826172,-41.69053649902344,0
Laurie is tough to conceal.,Laurie is certain to conceal.,syntax_semantics,control_raising,tough_vs_raising_1,True,False,False,False,659,-43.99103927612305,-43.921775817871094,0
Winston Churchill's oncologists are exciting to work with.,Winston Churchill's oncologists are about to work with.,syntax_semantics,control_raising,tough_vs_raising_1,True,False,False,False,660,-82.93057250976562,-80.30634307861328,0
Kimberley's contractor was pleasant to flee from.,Kimberley's contractor was apt to flee from.,syntax_semantics,control_raising,tough_vs_raising_1,True,False,False,False,661,-68.86003875732422,-66.59028625488281,0
A book about the Great Lakes is unpleasant to examine.,A book about the Great Lakes is about to examine.,syntax_semantics,control_raising,tough_vs_raising_1,True,False,False,False,662,-62.461524963378906,-56.57679748535156,0
The movie theater isn't pleasant to bike to.,The movie theater isn't apt to bike to.,syntax_semantics,control_raising,tough_vs_raising_1,True,False,False,False,663,-59.266632080078125,-60.46104431152344,1
Craig wasn't tough to argue about.,Craig wasn't about to argue about.,syntax_semantics,control_raising,tough_vs_raising_1,True,False,False,False,664,-39.909393310546875,-33.228694915771484,0
Some college campus is interesting to drop by.,Some college campus is sure to drop by.,syntax_semantics,control_raising,tough_vs_raising_1,True,False,False,False,665,-50.27163314819336,-52.832130432128906,1
Dan's French teachers aren't ready to reveal.,Dan's French teachers aren't apt to reveal.,syntax_semantics,control_raising,tough_vs_raising_1,True,False,False,False,666,-53.95330810546875,-56.91006088256836,1
Clyde is unpleasant to reference.,Clyde is certain to reference.,syntax_semantics,control_raising,tough_vs_raising_1,True,False,False,False,667,-51.47521209716797,-50.36660385131836,0
Judy wasn't fun to respect.,Judy wasn't soon to respect.,syntax_semantics,control_raising,tough_vs_raising_1,True,False,False,False,668,-34.08080291748047,-36.48291015625,1
A lot of children's brothers aren't difficult to talk to.,A lot of children's brothers aren't soon to talk to.,syntax_semantics,control_raising,tough_vs_raising_1,True,False,False,False,669,-59.25901794433594,-61.37689208984375,1
Deborah isn't interesting to return to.,Deborah isn't certain to return to.,syntax_semantics,control_raising,tough_vs_raising_1,True,False,False,False,670,-48.50931167602539,-48.557640075683594,1
Sheila is unpleasant to cure.,Sheila is soon to cure.,syntax_semantics,control_raising,tough_vs_raising_1,True,False,False,False,671,-39.68803405761719,-40.9498291015625,1
Alice is irritating to flee from.,Alice is apt to flee from.,syntax_semantics,control_raising,tough_vs_raising_1,True,False,False,False,672,-37.57605743408203,-36.51900100708008,0
Julie's sisters weren't hard work to work with.,Julie's sisters weren't likely to work with.,syntax_semantics,control_raising,tough_vs_raising_1,True,False,False,False,673,-60.31084442138672,-54.243919372558594,0
Julia was difficult to talk to.,Julia was apt to talk to.,syntax_semantics,control_raising,tough_vs_raising_1,True,False,False,False,674,-32.521240234375,-33.96509552001953,1
Women aren't boring to reveal.,Women aren't sure to reveal.,syntax_semantics,control_raising,tough_vs_raising_1,True,False,False,False,675,-37.462074279785156,-34.87837600708008,0
The Borgias weren't enjoyable to escape from.,The Borgias weren't sure to escape from.,syntax_semantics,control_raising,tough_vs_raising_1,True,False,False,False,676,-62.79973602294922,-58.970458984375,0
All movie theaters aren't enjoyable to go to.,All movie theaters aren't about to go to.,syntax_semantics,control_raising,tough_vs_raising_1,True,False,False,False,677,-57.875022888183594,-52.32768249511719,0
That driver is unpleasant to conceal.,That driver is unlikely to conceal.,syntax_semantics,control_raising,tough_vs_raising_1,True,False,False,False,678,-43.099491119384766,-42.08740234375,0
Anne wasn't boring to boast about.,Anne wasn't likely to boast about.,syntax_semantics,control_raising,tough_vs_raising_1,True,False,False,False,679,-42.05695724487305,-38.717037200927734,0
Robert is difficult to scare.,Robert is certain to scare.,syntax_semantics,control_raising,tough_vs_raising_1,True,False,False,False,680,-26.827449798583984,-27.80286979675293,1
Jerry wasn't ready to scare.,Jerry wasn't sure to scare.,syntax_semantics,control_raising,tough_vs_raising_1,True,False,False,False,681,-30.173904418945312,-32.560523986816406,1
Those high schools weren't tough to arrive at.,Those high schools weren't bound to arrive at.,syntax_semantics,control_raising,tough_vs_raising_1,True,False,False,False,682,-58.445159912109375,-57.25615310668945,0
The cafe was unpleasant to drop by.,The cafe was apt to drop by.,syntax_semantics,control_raising,tough_vs_raising_1,True,False,False,False,683,-45.10029983520508,-43.41337966918945,0
Every closet wasn't difficult to go to.,Every closet wasn't bound to go to.,syntax_semantics,control_raising,tough_vs_raising_1,True,False,False,False,684,-40.393898010253906,-43.00196075439453,1
The museum wasn't exciting to drop by.,The museum wasn't unlikely to drop by.,syntax_semantics,control_raising,tough_vs_raising_1,True,False,False,False,685,-50.918304443359375,-50.97365188598633,1
Laurie's nephews weren't exciting to flee from.,Laurie's nephews weren't sure to flee from.,syntax_semantics,control_raising,tough_vs_raising_1,True,False,False,False,686,-75.94730377197266,-73.61859130859375,0
Most nephews of Alan weren't boring to flee from.,Most nephews of Alan weren't sure to flee from.,syntax_semantics,control_raising,tough_vs_raising_1,True,False,False,False,687,-77.60096740722656,-74.87401580810547,0
Florence wasn't irritating to scare.,Florence wasn't likely to scare.,syntax_semantics,control_raising,tough_vs_raising_1,True,False,False,False,688,-52.455745697021484,-48.67951202392578,0
The dress isn't interesting to wear.,The dress isn't soon to wear.,syntax_semantics,control_raising,tough_vs_raising_1,True,False,False,False,689,-40.37959289550781,-40.529029846191406,1
This oasis isn't hard work to walk through.,This oasis isn't soon to walk through.,syntax_semantics,control_raising,tough_vs_raising_1,True,False,False,False,690,-59.1214485168457,-54.15782165527344,0
Those malls were ready to drive to.,Those malls were apt to drive to.,syntax_semantics,control_raising,tough_vs_raising_1,True,False,False,False,691,-43.223960876464844,-47.797401428222656,1
Roger's daughters are easy to escape from.,Roger's daughters are sure to escape from.,syntax_semantics,control_raising,tough_vs_raising_1,True,False,False,False,692,-44.05208969116211,-45.845008850097656,1
Teresa isn't tough to complain about.,Teresa isn't sure to complain about.,syntax_semantics,control_raising,tough_vs_raising_1,True,False,False,False,693,-47.783668518066406,-46.20481491088867,0
Jason's best friend wasn't interesting to examine.,Jason's best friend wasn't unlikely to examine.,syntax_semantics,control_raising,tough_vs_raising_1,True,False,False,False,694,-51.746795654296875,-52.28519058227539,1
That bike isn't hard to lift.,That bike isn't likely to lift.,syntax_semantics,control_raising,tough_vs_raising_1,True,False,False,False,695,-39.19812774658203,-41.89909362792969,1
Many photographs of the spotlight aren't annoying to conceal.,Many photographs of the spotlight aren't soon to conceal.,syntax_semantics,control_raising,tough_vs_raising_1,True,False,False,False,696,-66.38099670410156,-64.82369232177734,0
Maria is enjoyable to respect.,Maria is apt to respect.,syntax_semantics,control_raising,tough_vs_raising_1,True,False,False,False,697,-29.486038208007812,-27.399921417236328,0
That mountain wasn't annoying to escape from.,That mountain wasn't unlikely to escape from.,syntax_semantics,control_raising,tough_vs_raising_1,True,False,False,False,698,-51.70317840576172,-50.691734313964844,0
What is boring to walk through.,What is unlikely to walk through.,syntax_semantics,control_raising,tough_vs_raising_1,True,False,False,False,699,-33.62010955810547,-33.88111877441406,1
Most companies are exciting to scare.,Most companies are soon to scare.,syntax_semantics,control_raising,tough_vs_raising_1,True,False,False,False,700,-36.48968505859375,-38.53588104248047,1
Most men are fun to reference.,Most men are unlikely to reference.,syntax_semantics,control_raising,tough_vs_raising_1,True,False,False,False,701,-34.47047424316406,-34.25883483886719,0
Most drawings are hard to conceal.,Most drawings are certain to conceal.,syntax_semantics,control_raising,tough_vs_raising_1,True,False,False,False,702,-37.16056823730469,-40.49385070800781,1
What was enjoyable to bike to.,What was sure to bike to.,syntax_semantics,control_raising,tough_vs_raising_1,True,False,False,False,703,-40.994632720947266,-35.69689178466797,0
Some banks were hard work to arrive at.,Some banks were unlikely to arrive at.,syntax_semantics,control_raising,tough_vs_raising_1,True,False,False,False,704,-48.545875549316406,-45.87498474121094,0
A granddaughter of Christopher isn't pleasant to talk to.,A granddaughter of Christopher isn't likely to talk to.,syntax_semantics,control_raising,tough_vs_raising_1,True,False,False,False,705,-58.17307662963867,-55.949337005615234,0
This popsicle is ready to conceal.,This popsicle is soon to conceal.,syntax_semantics,control_raising,tough_vs_raising_1,True,False,False,False,706,-46.298912048339844,-51.51918029785156,1
Many girls aren't hard to care for.,Many girls aren't certain to care for.,syntax_semantics,control_raising,tough_vs_raising_1,True,False,False,False,707,-40.56594467163086,-44.45525360107422,1
Janet is interesting to escape from.,Janet is certain to escape from.,syntax_semantics,control_raising,tough_vs_raising_1,True,False,False,False,708,-39.58656692504883,-38.39485168457031,0
Many offspring aren't unpleasant to complain about.,Many offspring aren't soon to complain about.,syntax_semantics,control_raising,tough_vs_raising_1,True,False,False,False,709,-50.98484802246094,-49.11189270019531,0
Melinda's mother was hard work to listen to.,Melinda's mother was unlikely to listen to.,syntax_semantics,control_raising,tough_vs_raising_1,True,False,False,False,710,-51.48711395263672,-46.60000228881836,0
This school was easy to drop by.,This school was unlikely to drop by.,syntax_semantics,control_raising,tough_vs_raising_1,True,False,False,False,711,-39.619903564453125,-41.717735290527344,1
Ella wasn't unpleasant to boast about.,Ella wasn't likely to boast about.,syntax_semantics,control_raising,tough_vs_raising_1,True,False,False,False,712,-52.17998504638672,-48.557373046875,0
Beverly's fathers are easy to scare.,Beverly's fathers are apt to scare.,syntax_semantics,control_raising,tough_vs_raising_1,True,False,False,False,713,-53.82194900512695,-54.21570587158203,1
Those grocery stores were difficult to drive to.,Those grocery stores were likely to drive to.,syntax_semantics,control_raising,tough_vs_raising_1,True,False,False,False,714,-51.47617721557617,-50.95612716674805,0
Deanna is annoying to cure.,Deanna is sure to cure.,syntax_semantics,control_raising,tough_vs_raising_1,True,False,False,False,715,-39.53850555419922,-37.87575149536133,0
Most libraries weren't interesting to bike to.,Most libraries weren't apt to bike to.,syntax_semantics,control_raising,tough_vs_raising_1,True,False,False,False,716,-56.79746627807617,-56.99815368652344,1
Steven isn't hard work to conceal.,Steven isn't likely to conceal.,syntax_semantics,control_raising,tough_vs_raising_1,True,False,False,False,717,-41.76634979248047,-35.08882141113281,0
Some glacier isn't hard work to drop by.,Some glacier isn't about to drop by.,syntax_semantics,control_raising,tough_vs_raising_1,True,False,False,False,718,-56.932708740234375,-49.620811462402344,0
What was ready to bike to.,What was bound to bike to.,syntax_semantics,control_raising,tough_vs_raising_1,True,False,False,False,719,-33.095794677734375,-36.715240478515625,1
A lot of oases weren't irritating to bike to.,A lot of oases weren't sure to bike to.,syntax_semantics,control_raising,tough_vs_raising_1,True,False,False,False,720,-75.52828216552734,-71.65091705322266,0
She was irritating to scare.,She was likely to scare.,syntax_semantics,control_raising,tough_vs_raising_1,True,False,False,False,721,-30.495582580566406,-26.816402435302734,0
Every man wasn't boring to flee from.,Every man wasn't certain to flee from.,syntax_semantics,control_raising,tough_vs_raising_1,True,False,False,False,722,-49.73675537109375,-47.61314392089844,0
Carla is irritating to escape from.,Carla is likely to escape from.,syntax_semantics,control_raising,tough_vs_raising_1,True,False,False,False,723,-41.849857330322266,-38.56145095825195,0
Valerie's handymen weren't ready to fire.,Valerie's handymen weren't soon to fire.,syntax_semantics,control_raising,tough_vs_raising_1,True,False,False,False,724,-66.32611846923828,-69.3492431640625,1
Diana was annoying to escape from.,Diana was unlikely to escape from.,syntax_semantics,control_raising,tough_vs_raising_1,True,False,False,False,725,-43.67742156982422,-41.627262115478516,0
These hospitals were hard work to walk through.,These hospitals were unlikely to walk through.,syntax_semantics,control_raising,tough_vs_raising_1,True,False,False,False,726,-44.84635543823242,-42.13208770751953,0
Gary's mother isn't pleasant to scare.,Gary's mother isn't unlikely to scare.,syntax_semantics,control_raising,tough_vs_raising_1,True,False,False,False,727,-43.24447250366211,-45.214935302734375,1
These lakes were fun to arrive at.,These lakes were bound to arrive at.,syntax_semantics,control_raising,tough_vs_raising_1,True,False,False,False,728,-41.86857604980469,-41.01201629638672,0
Cynthia's partner was pleasant to examine.,Cynthia's partner was apt to examine.,syntax_semantics,control_raising,tough_vs_raising_1,True,False,False,False,729,-65.93905639648438,-63.76409912109375,0
Omar isn't ready to care for.,Omar isn't soon to care for.,syntax_semantics,control_raising,tough_vs_raising_1,True,False,False,False,730,-46.355194091796875,-47.99402618408203,1
Charles is hard to care for.,Charles is bound to care for.,syntax_semantics,control_raising,tough_vs_raising_1,True,False,False,False,731,-28.209976196289062,-31.573997497558594,1
Banks aren't easy to arrive at.,Banks aren't sure to arrive at.,syntax_semantics,control_raising,tough_vs_raising_1,True,False,False,False,732,-48.0806770324707,-49.27125930786133,1
A play wasn't unpleasant to examine.,A play wasn't apt to examine.,syntax_semantics,control_raising,tough_vs_raising_1,True,False,False,False,733,-47.39509582519531,-45.97574234008789,0
Brenda's piano teachers weren't unpleasant to escape from.,Brenda's piano teachers weren't unlikely to escape from.,syntax_semantics,control_raising,tough_vs_raising_1,True,False,False,False,734,-70.48785400390625,-68.8754653930664,0
Margaret's grandfathers aren't pleasant to examine.,Margaret's grandfathers aren't apt to examine.,syntax_semantics,control_raising,tough_vs_raising_1,True,False,False,False,735,-62.20148468017578,-63.630760192871094,1
Martha wasn't exciting to disagree with.,Martha wasn't unlikely to disagree with.,syntax_semantics,control_raising,tough_vs_raising_1,True,False,False,False,736,-48.305992126464844,-48.17713165283203,0
The bank isn't easy to go to.,The bank isn't soon to go to.,syntax_semantics,control_raising,tough_vs_raising_1,True,False,False,False,737,-37.666786193847656,-38.99330520629883,1
These mountains were pleasant to go to.,These mountains were soon to go to.,syntax_semantics,control_raising,tough_vs_raising_1,True,False,False,False,738,-36.9260368347168,-35.644676208496094,0
Omar's student is unpleasant to reference.,Omar's student is sure to reference.,syntax_semantics,control_raising,tough_vs_raising_1,True,False,False,False,739,-55.67145538330078,-54.398128509521484,0
A man was boring to respect.,A man was likely to respect.,syntax_semantics,control_raising,tough_vs_raising_1,True,False,False,False,740,-38.664859771728516,-34.177223205566406,0
A glacier is fun to bike to.,A glacier is soon to bike to.,syntax_semantics,control_raising,tough_vs_raising_1,True,False,False,False,741,-51.615665435791016,-53.97832107543945,1
These lice are annoying to lift.,These lice are sure to lift.,syntax_semantics,control_raising,tough_vs_raising_1,True,False,False,False,742,-41.79837417602539,-40.61672592163086,0
That shoe isn't boring to wear.,That shoe isn't apt to wear.,syntax_semantics,control_raising,tough_vs_raising_1,True,False,False,False,743,-44.03935623168945,-43.99539566040039,0
Many museums were annoying to scare.,Many museums were unlikely to scare.,syntax_semantics,control_raising,tough_vs_raising_1,True,False,False,False,744,-42.140296936035156,-40.44369888305664,0
The rug is easy to reveal.,The rug is soon to reveal.,syntax_semantics,control_raising,tough_vs_raising_1,True,False,False,False,745,-35.74382019042969,-40.508644104003906,1
A lot of cafes are difficult to arrive at.,A lot of cafes are certain to arrive at.,syntax_semantics,control_raising,tough_vs_raising_1,True,False,False,False,746,-52.393775939941406,-56.101226806640625,1
That high school was ready to go to.,That high school was bound to go to.,syntax_semantics,control_raising,tough_vs_raising_1,True,False,False,False,747,-38.60605239868164,-41.54371643066406,1
Hospitals are annoying to drive to.,Hospitals are apt to drive to.,syntax_semantics,control_raising,tough_vs_raising_1,True,False,False,False,748,-54.488338470458984,-52.53175354003906,0
Bruce was hard work to care for.,Bruce was sure to care for.,syntax_semantics,control_raising,tough_vs_raising_1,True,False,False,False,749,-35.82844924926758,-28.933666229248047,0
Douglas's spouse is fun to return to.,Douglas's spouse is apt to return to.,syntax_semantics,control_raising,tough_vs_raising_1,True,False,False,False,750,-56.86957550048828,-56.363887786865234,0
Chad is annoying to boast about.,Chad is certain to boast about.,syntax_semantics,control_raising,tough_vs_raising_1,True,False,False,False,751,-44.99555969238281,-41.73442077636719,0
This public park isn't irritating to bike to.,This public park isn't apt to bike to.,syntax_semantics,control_raising,tough_vs_raising_1,True,False,False,False,752,-61.48536682128906,-62.053348541259766,1
That shawl wasn't tough to lift.,That shawl wasn't sure to lift.,syntax_semantics,control_raising,tough_vs_raising_1,True,False,False,False,753,-54.190433502197266,-51.97610092163086,0
A cafe was unpleasant to arrive at.,A cafe was sure to arrive at.,syntax_semantics,control_raising,tough_vs_raising_1,True,False,False,False,754,-47.74530792236328,-45.42578125,0
That cafe isn't tough to bike to.,That cafe isn't sure to bike to.,syntax_semantics,control_raising,tough_vs_raising_1,True,False,False,False,755,-55.268775939941406,-54.09443664550781,0
Some bank is fun to drop by.,Some bank is apt to drop by.,syntax_semantics,control_raising,tough_vs_raising_1,True,False,False,False,756,-43.74549102783203,-44.0751953125,1
Guy wasn't ready to reference.,Guy wasn't sure to reference.,syntax_semantics,control_raising,tough_vs_raising_1,True,False,False,False,757,-32.36922836303711,-34.88951873779297,1
Diane wasn't hard to argue about.,Diane wasn't certain to argue about.,syntax_semantics,control_raising,tough_vs_raising_1,True,False,False,False,758,-45.06690979003906,-48.78286361694336,1
The patients' teachers aren't hard work to complain about.,The patients' teachers aren't about to complain about.,syntax_semantics,control_raising,tough_vs_raising_1,True,False,False,False,759,-66.64736938476562,-60.90118408203125,0
Joseph was tough to reference.,Joseph was apt to reference.,syntax_semantics,control_raising,tough_vs_raising_1,True,False,False,False,760,-31.256980895996094,-28.958572387695312,0
A lot of college campuses aren't difficult to arrive at.,A lot of college campuses aren't apt to arrive at.,syntax_semantics,control_raising,tough_vs_raising_1,True,False,False,False,761,-67.87664794921875,-71.69864654541016,1
Nancy's grandsons aren't exciting to examine.,Nancy's grandsons aren't unlikely to examine.,syntax_semantics,control_raising,tough_vs_raising_1,True,False,False,False,762,-73.62100219726562,-74.45407104492188,1
Diana wasn't easy to listen to.,Diana wasn't sure to listen to.,syntax_semantics,control_raising,tough_vs_raising_1,True,False,False,False,763,-38.962493896484375,-40.44668960571289,1
The river was hard work to arrive at.,The river was certain to arrive at.,syntax_semantics,control_raising,tough_vs_raising_1,True,False,False,False,764,-44.96213912963867,-39.524837493896484,0
Cheryl wasn't ready to escape from.,Cheryl wasn't sure to escape from.,syntax_semantics,control_raising,tough_vs_raising_1,True,False,False,False,765,-54.85852813720703,-55.465538024902344,1
Every analysis is boring to argue about.,Every analysis is about to argue about.,syntax_semantics,control_raising,tough_vs_raising_1,True,False,False,False,766,-46.67264938354492,-41.60097885131836,0
Some father of Martin is ready to scare.,Some father of Martin is soon to scare.,syntax_semantics,control_raising,tough_vs_raising_1,True,False,False,False,767,-51.936859130859375,-58.16504669189453,1
A lot of alumni aren't annoying to reference.,A lot of alumni aren't bound to reference.,syntax_semantics,control_raising,tough_vs_raising_1,True,False,False,False,768,-61.44228744506836,-59.3448486328125,0
Stephen's mothers weren't exciting to reveal.,Stephen's mothers weren't unlikely to reveal.,syntax_semantics,control_raising,tough_vs_raising_1,True,False,False,False,769,-50.21722412109375,-50.73692321777344,1
Those books weren't ready to lift.,Those books weren't sure to lift.,syntax_semantics,control_raising,tough_vs_raising_1,True,False,False,False,770,-38.699241638183594,-42.22444152832031,1
That college campus is difficult to lift.,That college campus is soon to lift.,syntax_semantics,control_raising,tough_vs_raising_1,True,False,False,False,771,-45.26936340332031,-50.784339904785156,1
April's supervisors were interesting to conceal.,April's supervisors were soon to conceal.,syntax_semantics,control_raising,tough_vs_raising_1,True,False,False,False,772,-50.5526123046875,-51.99123764038086,1
These stories about Winston Churchill weren't tough to disagree with.,These stories about Winston Churchill weren't apt to disagree with.,syntax_semantics,control_raising,tough_vs_raising_1,True,False,False,False,773,-77.79163360595703,-77.11848449707031,0
Carrie wasn't interesting to talk about.,Carrie wasn't bound to talk about.,syntax_semantics,control_raising,tough_vs_raising_1,True,False,False,False,774,-43.08952331542969,-43.1015625,1
The jackets aren't irritating to wear.,The jackets aren't likely to wear.,syntax_semantics,control_raising,tough_vs_raising_1,True,False,False,False,775,-46.815643310546875,-42.77122497558594,0
Wendy's dermatologists aren't fun to return to.,Wendy's dermatologists aren't apt to return to.,syntax_semantics,control_raising,tough_vs_raising_1,True,False,False,False,776,-76.61492156982422,-79.30867004394531,1
A lot of high schools weren't unpleasant to arrive at.,A lot of high schools weren't likely to arrive at.,syntax_semantics,control_raising,tough_vs_raising_1,True,False,False,False,777,-66.79121398925781,-61.1036491394043,0
Every guest wasn't easy to conceal.,Every guest wasn't about to conceal.,syntax_semantics,control_raising,tough_vs_raising_1,True,False,False,False,778,-45.271827697753906,-45.660545349121094,1
Some thesis is hard to conceal.,Some thesis is likely to conceal.,syntax_semantics,control_raising,tough_vs_raising_1,True,False,False,False,779,-38.71266174316406,-39.040367126464844,1
A museum was ready to drive to.,A museum was apt to drive to.,syntax_semantics,control_raising,tough_vs_raising_1,True,False,False,False,780,-39.754398345947266,-42.552494049072266,1
An alumnus is boring to cure.,An alumnus is certain to cure.,syntax_semantics,control_raising,tough_vs_raising_1,True,False,False,False,781,-52.90036392211914,-50.305686950683594,0
This niece of Helen isn't annoying to examine.,This niece of Helen isn't apt to examine.,syntax_semantics,control_raising,tough_vs_raising_1,True,False,False,False,782,-62.026634216308594,-60.2592658996582,0
Amanda wasn't boring to return to.,Amanda wasn't soon to return to.,syntax_semantics,control_raising,tough_vs_raising_1,True,False,False,False,783,-45.779422760009766,-43.228485107421875,0
The college campus wasn't annoying to drive to.,The college campus wasn't about to drive to.,syntax_semantics,control_raising,tough_vs_raising_1,True,False,False,False,784,-57.528564453125,-53.386375427246094,0
This public park isn't unpleasant to walk through.,This public park isn't certain to walk through.,syntax_semantics,control_raising,tough_vs_raising_1,True,False,False,False,785,-56.38734436035156,-55.00226593017578,0
Dennis was ready to boast about.,Dennis was bound to boast about.,syntax_semantics,control_raising,tough_vs_raising_1,True,False,False,False,786,-40.80153274536133,-42.50229263305664,1
