sentence_good,sentence_bad,field,linguistics_term,UID,simple_LM_method,one_prefix_method,two_prefix_method,lexically_identical,pair_id,good_prob,bad_prob,correct
This banana isn't tough to lift.,This banana isn't soon to lift.,syntax_semantics,control_raising,tough_vs_raising_1,True,False,False,False,526,-43.93171691894531,-42.68808364868164,0
Holly's cousin was easy to return to.,Holly's cousin was apt to return to.,syntax_semantics,control_raising,tough_vs_raising_1,True,False,False,False,527,-49.96089172363281,-50.26910400390625,1
Some mountain is easy to drive to.,Some mountain is certain to drive to.,syntax_semantics,control_raising,tough_vs_raising_1,True,False,False,False,528,-38.86576461791992,-42.19096374511719,1
The restaurants are fun to go to.,The restaurants are soon to go to.,syntax_semantics,control_raising,tough_vs_raising_1,True,False,False,False,529,-38.0748405456543,-39.74205780029297,1
The pamphlet was irritating to lift.,The pamphlet was about to lift.,syntax_semantics,control_raising,tough_vs_raising_1,True,False,False,False,530,-40.39625549316406,-36.11643600463867,0
Becky wasn't ready to talk about.,Becky wasn't unlikely to talk about.,syntax_semantics,control_raising,tough_vs_raising_1,True,False,False,False,531,-33.094207763671875,-37.84566116333008,1
Cindy was fun to complain about.,Cindy was about to complain about.,syntax_semantics,control_raising,tough_vs_raising_1,True,False,False,False,532,-41.83013916015625,-38.80681610107422,0
Karen wasn't pleasant to reveal.,Karen wasn't about to reveal.,syntax_semantics,control_raising,tough_vs_raising_1,True,False,False,False,533,-39.65461730957031,-37.33171463012695,0
Kristin isn't unpleasant to return to.,Kristin isn't unlikely to return to.,syntax_semantics,control_raising,tough_vs_raising_1,True,False,False,False,534,-46.562843322753906,-46.99018859863281,1
Travis's ex-boyfriend wasn't enjoyable to complain about.,Travis's ex-boyfriend wasn't soon to complain about.,syntax_semantics,control_raising,tough_vs_raising_1,True,False,False,False,535,-82.60272216796875,-80.56305694580078,0
This customer wasn't easy to respect.,This customer wasn't bound to respect.,syntax_semantics,control_raising,tough_vs_raising_1,True,False,False,False,536,-43.17597198486328,-45.20970153808594,1
Allison isn't easy to respect.,Allison isn't apt to respect.,syntax_semantics,control_raising,tough_vs_raising_1,True,False,False,False,537,-41.087562561035156,-44.377601623535156,1
Bethany isn't tough to reference.,Bethany isn't likely to reference.,syntax_semantics,control_raising,tough_vs_raising_1,True,False,False,False,538,-57.67784118652344,-54.179832458496094,0
Many pamphlets about the Clintons were exciting to examine.,Many pamphlets about the Clintons were about to examine.,syntax_semantics,control_raising,tough_vs_raising_1,True,False,False,False,539,-73.25437927246094,-68.24821472167969,0
Some libraries are hard to walk through.,Some libraries are unlikely to walk through.,syntax_semantics,control_raising,tough_vs_raising_1,True,False,False,False,540,-39.61018753051758,-43.363677978515625,1
Glasses are boring to wear.,Glasses are about to wear.,syntax_semantics,control_raising,tough_vs_raising_1,True,False,False,False,541,-40.50753402709961,-36.40593719482422,0
Erin's guests aren't ready to respect.,Erin's guests aren't likely to respect.,syntax_semantics,control_raising,tough_vs_raising_1,True,False,False,False,542,-57.555599212646484,-57.80278778076172,1
A lot of grocery stores are easy to go to.,A lot of grocery stores are unlikely to go to.,syntax_semantics,control_raising,tough_vs_raising_1,True,False,False,False,543,-56.125022888183594,-57.54275131225586,1
Vanessa isn't hard to flee from.,Vanessa isn't soon to flee from.,syntax_semantics,control_raising,tough_vs_raising_1,True,False,False,False,544,-46.888126373291016,-50.97004699707031,1
That dress isn't irritating to wear.,That dress isn't bound to wear.,syntax_semantics,control_raising,tough_vs_raising_1,True,False,False,False,545,-42.70713806152344,-40.48126220703125,0
Lisa's mentee wasn't easy to cure.,Lisa's mentee wasn't unlikely to cure.,syntax_semantics,control_raising,tough_vs_raising_1,True,False,False,False,546,-56.251441955566406,-59.741905212402344,1
All pamphlets about science are hard work to talk about.,All pamphlets about science are about to talk about.,syntax_semantics,control_raising,tough_vs_raising_1,True,False,False,False,547,-72.55244445800781,-66.27745056152344,0
Becca is hard work to flee from.,Becca is bound to flee from.,syntax_semantics,control_raising,tough_vs_raising_1,True,False,False,False,548,-52.66234588623047,-46.43556213378906,0
Some girls weren't easy to work with.,Some girls weren't certain to work with.,syntax_semantics,control_raising,tough_vs_raising_1,True,False,False,False,549,-41.66947555541992,-45.03166198730469,1
A newspaper article about the Clintons was boring to reveal.,A newspaper article about the Clintons was certain to reveal.,syntax_semantics,control_raising,tough_vs_raising_1,True,False,False,False,550,-74.0697021484375,-71.47962951660156,0
Lucille's granddaughters are difficult to argue about.,Lucille's granddaughters are bound to argue about.,syntax_semantics,control_raising,tough_vs_raising_1,True,False,False,False,551,-68.50361633300781,-70.05428314208984,1
Vanessa was interesting to respect.,Vanessa was likely to respect.,syntax_semantics,control_raising,tough_vs_raising_1,True,False,False,False,552,-35.81538009643555,-33.88447189331055,0
Carl wasn't interesting to conceal.,Carl wasn't unlikely to conceal.,syntax_semantics,control_raising,tough_vs_raising_1,True,False,False,False,553,-36.50320816040039,-37.46357727050781,1
Some grandson of Natalie wasn't boring to examine.,Some grandson of Natalie wasn't sure to examine.,syntax_semantics,control_raising,tough_vs_raising_1,True,False,False,False,554,-64.58756256103516,-61.6051025390625,0
The pedestrian isn't hard to care for.,The pedestrian isn't about to care for.,syntax_semantics,control_raising,tough_vs_raising_1,True,False,False,False,555,-47.819305419921875,-48.65252685546875,1
Some banks were annoying to walk through.,Some banks were certain to walk through.,syntax_semantics,control_raising,tough_vs_raising_1,True,False,False,False,556,-44.660465240478516,-43.264564514160156,0
This school isn't exciting to go to.,This school isn't certain to go to.,syntax_semantics,control_raising,tough_vs_raising_1,True,False,False,False,557,-37.959320068359375,-39.96788024902344,1
Jessica is enjoyable to scare.,Jessica is certain to scare.,syntax_semantics,control_raising,tough_vs_raising_1,True,False,False,False,558,-32.16937255859375,-28.03569221496582,0
These offspring are hard work to talk about.,These offspring are certain to talk about.,syntax_semantics,control_raising,tough_vs_raising_1,True,False,False,False,559,-44.4865837097168,-40.85310363769531,0
Dawn was boring to flee from.,Dawn was certain to flee from.,syntax_semantics,control_raising,tough_vs_raising_1,True,False,False,False,560,-49.47954559326172,-45.792301177978516,0
Todd's brothers were annoying to return to.,Todd's brothers were likely to return to.,syntax_semantics,control_raising,tough_vs_raising_1,True,False,False,False,561,-47.70002365112305,-43.05513000488281,0
Grace wasn't tough to cure.,Grace wasn't sure to cure.,syntax_semantics,control_raising,tough_vs_raising_1,True,False,False,False,562,-43.50215530395508,-41.750152587890625,0
Bradley's husband wasn't irritating to examine.,Bradley's husband wasn't sure to examine.,syntax_semantics,control_raising,tough_vs_raising_1,True,False,False,False,563,-53.91669845581055,-51.08091735839844,0
Most waiters aren't easy to fire.,Most waiters aren't soon to fire.,syntax_semantics,control_raising,tough_vs_raising_1,True,False,False,False,564,-48.518310546875,-51.19450759887695,1
The restaurant isn't annoying to escape from.,The restaurant isn't unlikely to escape from.,syntax_semantics,control_raising,tough_vs_raising_1,True,False,False,False,565,-48.03303527832031,-47.36806106567383,0
Marie's mothers are difficult to disagree with.,Marie's mothers are apt to disagree with.,syntax_semantics,control_raising,tough_vs_raising_1,True,False,False,False,566,-46.43128204345703,-47.844337463378906,1
Sheila isn't annoying to flee from.,Sheila isn't unlikely to flee from.,syntax_semantics,control_raising,tough_vs_raising_1,True,False,False,False,567,-53.44775390625,-53.55632781982422,1
These waitresses are hard work to boast about.,These waitresses are soon to boast about.,syntax_semantics,control_raising,tough_vs_raising_1,True,False,False,False,568,-60.20598220825195,-56.453792572021484,0
Those lakes are ready to go to.,Those lakes are about to go to.,syntax_semantics,control_raising,tough_vs_raising_1,True,False,False,False,569,-32.254547119140625,-33.76239013671875,1
A lot of ladies' plumbers were hard work to flee from.,A lot of ladies' plumbers were unlikely to flee from.,syntax_semantics,control_raising,tough_vs_raising_1,True,False,False,False,570,-85.90309143066406,-82.50857543945312,0
Kendra isn't enjoyable to care for.,Kendra isn't likely to care for.,syntax_semantics,control_raising,tough_vs_raising_1,True,False,False,False,571,-52.019065856933594,-47.4292106628418,0
All senators' handyman is fun to examine.,All senators' handyman is about to examine.,syntax_semantics,control_raising,tough_vs_raising_1,True,False,False,False,572,-69.40017700195312,-66.8843765258789,0
Charles is hard work to complain about.,Charles is about to complain about.,syntax_semantics,control_raising,tough_vs_raising_1,True,False,False,False,573,-36.38701629638672,-28.609725952148438,0
A lot of sweaters are hard work to wear.,A lot of sweaters are soon to wear.,syntax_semantics,control_raising,tough_vs_raising_1,True,False,False,False,574,-60.868568420410156,-57.99810028076172,0
Sonia isn't ready to listen to.,Sonia isn't sure to listen to.,syntax_semantics,control_raising,tough_vs_raising_1,True,False,False,False,575,-40.349151611328125,-42.314918518066406,1
Elaine's daughters aren't boring to examine.,Elaine's daughters aren't soon to examine.,syntax_semantics,control_raising,tough_vs_raising_1,True,False,False,False,576,-61.800331115722656,-60.018409729003906,0
Benjamin wasn't unpleasant to respect.,Benjamin wasn't about to respect.,syntax_semantics,control_raising,tough_vs_raising_1,True,False,False,False,577,-44.948604583740234,-40.91099166870117,0
Ella is hard work to complain about.,Ella is sure to complain about.,syntax_semantics,control_raising,tough_vs_raising_1,True,False,False,False,578,-46.589012145996094,-41.415550231933594,0
Those cafes weren't tough to go to.,Those cafes weren't sure to go to.,syntax_semantics,control_raising,tough_vs_raising_1,True,False,False,False,579,-48.347476959228516,-46.792938232421875,0
Some mountain wasn't hard work to flee from.,Some mountain wasn't sure to flee from.,syntax_semantics,control_raising,tough_vs_raising_1,True,False,False,False,580,-56.921451568603516,-51.93896484375,0
Phillip's teachers were easy to fire.,Phillip's teachers were unlikely to fire.,syntax_semantics,control_raising,tough_vs_raising_1,True,False,False,False,581,-47.5203857421875,-50.84300231933594,1
Edward wasn't hard work to listen to.,Edward wasn't likely to listen to.,syntax_semantics,control_raising,tough_vs_raising_1,True,False,False,False,582,-38.76150131225586,-32.82984924316406,0
That pamphlet about art wasn't unpleasant to disagree with.,That pamphlet about art wasn't bound to disagree with.,syntax_semantics,control_raising,tough_vs_raising_1,True,False,False,False,583,-72.86125946044922,-70.8953628540039,0
Douglas was tough to flee from.,Douglas was likely to flee from.,syntax_semantics,control_raising,tough_vs_raising_1,True,False,False,False,584,-46.725276947021484,-43.86390686035156,0
Curtis wasn't enjoyable to reveal.,Curtis wasn't sure to reveal.,syntax_semantics,control_raising,tough_vs_raising_1,True,False,False,False,585,-53.30815124511719,-48.25441360473633,0
Most restaurants are boring to drop by.,Most restaurants are sure to drop by.,syntax_semantics,control_raising,tough_vs_raising_1,True,False,False,False,586,-45.754634857177734,-45.7197151184082,0
Allison is fun to conceal.,Allison is apt to conceal.,syntax_semantics,control_raising,tough_vs_raising_1,True,False,False,False,587,-39.09690856933594,-38.7137451171875,0
Some man's granddaughters are unpleasant to care for.,Some man's granddaughters are soon to care for.,syntax_semantics,control_raising,tough_vs_raising_1,True,False,False,False,588,-71.32946014404297,-72.73356628417969,1
Stephanie's doctor wasn't interesting to disagree with.,Stephanie's doctor wasn't bound to disagree with.,syntax_semantics,control_raising,tough_vs_raising_1,True,False,False,False,589,-68.1260986328125,-67.46640014648438,0
Cats were pleasant to lift.,Cats were bound to lift.,syntax_semantics,control_raising,tough_vs_raising_1,True,False,False,False,590,-38.738563537597656,-37.27302932739258,0
Spain is hard to return to.,Spain is bound to return to.,syntax_semantics,control_raising,tough_vs_raising_1,True,False,False,False,591,-26.748817443847656,-30.570419311523438,1
The bank is hard work to go to.,The bank is apt to go to.,syntax_semantics,control_raising,tough_vs_raising_1,True,False,False,False,592,-40.67420959472656,-37.232643127441406,0
Joseph's tutor isn't difficult to fire.,Joseph's tutor isn't about to fire.,syntax_semantics,control_raising,tough_vs_raising_1,True,False,False,False,593,-43.57576370239258,-43.74729919433594,1
Jill was unpleasant to listen to.,Jill was likely to listen to.,syntax_semantics,control_raising,tough_vs_raising_1,True,False,False,False,594,-40.00837707519531,-37.30656814575195,0
Some drivers were annoying to conceal.,Some drivers were sure to conceal.,syntax_semantics,control_raising,tough_vs_raising_1,True,False,False,False,595,-42.56532287597656,-41.55180358886719,0
These mountains aren't irritating to drop by.,These mountains aren't soon to drop by.,syntax_semantics,control_raising,tough_vs_raising_1,True,False,False,False,596,-51.030189514160156,-48.94660186767578,0
The waitress wasn't hard work to cure.,The waitress wasn't unlikely to cure.,syntax_semantics,control_raising,tough_vs_raising_1,True,False,False,False,597,-49.871665954589844,-45.32379913330078,0
A woman's hairdresser wasn't easy to disagree with.,A woman's hairdresser wasn't sure to disagree with.,syntax_semantics,control_raising,tough_vs_raising_1,True,False,False,False,598,-72.67444610595703,-73.54354095458984,1
Homer was interesting to fire.,Homer was unlikely to fire.,syntax_semantics,control_raising,tough_vs_raising_1,True,False,False,False,599,-34.7440185546875,-35.388877868652344,1
Sabrina wasn't enjoyable to boast about.,Sabrina wasn't apt to boast about.,syntax_semantics,control_raising,tough_vs_raising_1,True,False,False,False,600,-52.37382507324219,-48.769561767578125,0
Winston Churchill isn't tough to talk about.,Winston Churchill isn't bound to talk about.,syntax_semantics,control_raising,tough_vs_raising_1,True,False,False,False,601,-53.44279479980469,-52.029502868652344,0
Jacqueline isn't pleasant to scare.,Jacqueline isn't bound to scare.,syntax_semantics,control_raising,tough_vs_raising_1,True,False,False,False,602,-49.25295639038086,-49.2481689453125,0
Beverly wasn't irritating to talk about.,Beverly wasn't certain to talk about.,syntax_semantics,control_raising,tough_vs_raising_1,True,False,False,False,603,-47.95891571044922,-45.7173957824707,0
This grandfather of Danielle wasn't fun to argue about.,This grandfather of Danielle wasn't likely to argue about.,syntax_semantics,control_raising,tough_vs_raising_1,True,False,False,False,604,-61.786285400390625,-59.67547607421875,0
Some grandson of every person isn't hard to examine.,Some grandson of every person isn't soon to examine.,syntax_semantics,control_raising,tough_vs_raising_1,True,False,False,False,605,-59.31843948364258,-62.78907012939453,1
A person's mentees were irritating to conceal.,A person's mentees were sure to conceal.,syntax_semantics,control_raising,tough_vs_raising_1,True,False,False,False,606,-67.23652648925781,-64.8453369140625,0
Men weren't hard to talk about.,Men weren't bound to talk about.,syntax_semantics,control_raising,tough_vs_raising_1,True,False,False,False,607,-30.726497650146484,-34.71888732910156,1
Christina wasn't annoying to escape from.,Christina wasn't apt to escape from.,syntax_semantics,control_raising,tough_vs_raising_1,True,False,False,False,608,-45.606868743896484,-43.06201934814453,0
Heidi wasn't enjoyable to respect.,Heidi wasn't about to respect.,syntax_semantics,control_raising,tough_vs_raising_1,True,False,False,False,609,-48.073944091796875,-42.129337310791016,0
Some essay isn't tough to talk about.,Some essay isn't unlikely to talk about.,syntax_semantics,control_raising,tough_vs_raising_1,True,False,False,False,610,-45.94709014892578,-46.600791931152344,1
Laura wasn't ready to reveal.,Laura wasn't likely to reveal.,syntax_semantics,control_raising,tough_vs_raising_1,True,False,False,False,611,-31.231609344482422,-32.06584930419922,1
That man isn't ready to argue about.,That man isn't likely to argue about.,syntax_semantics,control_raising,tough_vs_raising_1,True,False,False,False,612,-42.04452133178711,-43.11724090576172,1
Most students' piano teacher was fun to listen to.,Most students' piano teacher was apt to listen to.,syntax_semantics,control_raising,tough_vs_raising_1,True,False,False,False,613,-63.156864166259766,-63.769527435302734,1
That movie theater isn't annoying to arrive at.,That movie theater isn't unlikely to arrive at.,syntax_semantics,control_raising,tough_vs_raising_1,True,False,False,False,614,-59.31077194213867,-59.54232406616211,1
Jodi is ready to reference.,Jodi is sure to reference.,syntax_semantics,control_raising,tough_vs_raising_1,True,False,False,False,615,-37.24544906616211,-40.80585479736328,1
Rose is boring to cure.,Rose is about to cure.,syntax_semantics,control_raising,tough_vs_raising_1,True,False,False,False,616,-30.17009735107422,-26.650142669677734,0
This essay about music isn't easy to boast about.,This essay about music isn't unlikely to boast about.,syntax_semantics,control_raising,tough_vs_raising_1,True,False,False,False,617,-61.10045623779297,-64.78570556640625,1
Emily's fathers are ready to reveal.,Emily's fathers are unlikely to reveal.,syntax_semantics,control_raising,tough_vs_raising_1,True,False,False,False,618,-38.07572555541992,-40.86581802368164,1
Keith's boss isn't pleasant to conceal.,Keith's boss isn't bound to conceal.,syntax_semantics,control_raising,tough_vs_raising_1,True,False,False,False,619,-47.74260330200195,-47.40749740600586,0
Ronald's ex-boyfriend is exciting to talk about.,Ronald's ex-boyfriend is apt to talk about.,syntax_semantics,control_raising,tough_vs_raising_1,True,False,False,False,620,-68.39176940917969,-66.33895111083984,0
This river wasn't enjoyable to arrive at.,This river wasn't about to arrive at.,syntax_semantics,control_raising,tough_vs_raising_1,True,False,False,False,621,-53.31411361694336,-46.484046936035156,0
Elaine was irritating to talk to.,Elaine was sure to talk to.,syntax_semantics,control_raising,tough_vs_raising_1,True,False,False,False,622,-39.11028289794922,-36.35748291015625,0
Debra is easy to reference.,Debra is unlikely to reference.,syntax_semantics,control_raising,tough_vs_raising_1,True,False,False,False,623,-34.84895324707031,-36.76561737060547,1
Andrea isn't interesting to conceal.,Andrea isn't likely to conceal.,syntax_semantics,control_raising,tough_vs_raising_1,True,False,False,False,624,-48.309112548828125,-46.196571350097656,0
Those people aren't exciting to talk to.,Those people aren't unlikely to talk to.,syntax_semantics,control_raising,tough_vs_raising_1,True,False,False,False,625,-37.80992889404297,-39.14702606201172,1
This river isn't fun to drop by.,This river isn't unlikely to drop by.,syntax_semantics,control_raising,tough_vs_raising_1,True,False,False,False,626,-47.63885498046875,-50.99070739746094,1
Bethany wasn't unpleasant to conceal.,Bethany wasn't soon to conceal.,syntax_semantics,control_raising,tough_vs_raising_1,True,False,False,False,627,-58.7236442565918,-58.754432678222656,1
Diana's doctors are enjoyable to complain about.,Diana's doctors are about to complain about.,syntax_semantics,control_raising,tough_vs_raising_1,True,False,False,False,628,-55.954925537109375,-51.946102142333984,0
A newspaper article about the Clintons wasn't unpleasant to examine.,A newspaper article about the Clintons wasn't bound to examine.,syntax_semantics,control_raising,tough_vs_raising_1,True,False,False,False,629,-81.67828369140625,-79.21651458740234,0
Some rice wasn't fun to lift.,Some rice wasn't apt to lift.,syntax_semantics,control_raising,tough_vs_raising_1,True,False,False,False,630,-41.2198371887207,-44.09827423095703,1
A means isn't fun to complain about.,A means isn't apt to complain about.,syntax_semantics,control_raising,tough_vs_raising_1,True,False,False,False,631,-45.18180465698242,-48.48377990722656,1
Mitchell was hard to boast about.,Mitchell was unlikely to boast about.,syntax_semantics,control_raising,tough_vs_raising_1,True,False,False,False,632,-42.563846588134766,-45.779197692871094,1
Essays about Galileo weren't fun to disagree with.,Essays about Galileo weren't about to disagree with.,syntax_semantics,control_raising,tough_vs_raising_1,True,False,False,False,633,-69.18737030029297,-68.69430541992188,0
Glasses were enjoyable to wear.,Glasses were about to wear.,syntax_semantics,control_raising,tough_vs_raising_1,True,False,False,False,634,-43.30657958984375,-37.32361602783203,0
Many lakes aren't unpleasant to drop by.,Many lakes aren't soon to drop by.,syntax_semantics,control_raising,tough_vs_raising_1,True,False,False,False,635,-52.25889205932617,-50.029273986816406,0
Martin was tough to listen to.,Martin was sure to listen to.,syntax_semantics,control_raising,tough_vs_raising_1,True,False,False,False,636,-28.913818359375,-26.615890502929688,0
Elaine isn't hard work to escape from.,Elaine isn't apt to escape from.,syntax_semantics,control_raising,tough_vs_raising_1,True,False,False,False,637,-50.506587982177734,-46.226593017578125,0
Those rivers are tough to walk through.,Those rivers are soon to walk through.,syntax_semantics,control_raising,tough_vs_raising_1,True,False,False,False,638,-40.85152053833008,-40.56629943847656,0
Barbara wasn't interesting to fire.,Barbara wasn't certain to fire.,syntax_semantics,control_raising,tough_vs_raising_1,True,False,False,False,639,-41.712860107421875,-41.97468566894531,1
Randolf's daughter isn't boring to scare.,Randolf's daughter isn't sure to scare.,syntax_semantics,control_raising,tough_vs_raising_1,True,False,False,False,640,-57.879581451416016,-55.84135818481445,0
Many actors weren't irritating to talk to.,Many actors weren't certain to talk to.,syntax_semantics,control_raising,tough_vs_raising_1,True,False,False,False,641,-47.52766799926758,-46.53948211669922,0
The Impressionists are enjoyable to boast about.,The Impressionists are likely to boast about.,syntax_semantics,control_raising,tough_vs_raising_1,True,False,False,False,642,-64.4217529296875,-58.47480392456055,0
Every restaurant isn't hard to bike to.,Every restaurant isn't soon to bike to.,syntax_semantics,control_raising,tough_vs_raising_1,True,False,False,False,643,-47.13367462158203,-51.003814697265625,1
That adult wasn't annoying to flee from.,That adult wasn't bound to flee from.,syntax_semantics,control_raising,tough_vs_raising_1,True,False,False,False,644,-56.21424865722656,-53.79475402832031,0
Most sisters of Rebecca weren't tough to work with.,Most sisters of Rebecca weren't bound to work with.,syntax_semantics,control_raising,tough_vs_raising_1,True,False,False,False,645,-64.1204833984375,-63.10245895385742,0
Walter was difficult to talk to.,Walter was soon to talk to.,syntax_semantics,control_raising,tough_vs_raising_1,True,False,False,False,646,-33.38945007324219,-35.775634765625,1
That coat is difficult to wear.,That coat is bound to wear.,syntax_semantics,control_raising,tough_vs_raising_1,True,False,False,False,647,-35.89439010620117,-38.21694564819336,1
Many glaciers weren't ready to flee from.,Many glaciers weren't about to flee from.,syntax_semantics,control_raising,tough_vs_raising_1,True,False,False,False,648,-54.248870849609375,-54.983848571777344,1
Jane isn't enjoyable to conceal.,Jane isn't apt to conceal.,syntax_semantics,control_raising,tough_vs_raising_1,True,False,False,False,649,-39.09115219116211,-35.96197509765625,0
Colleen is annoying to talk about.,Colleen is likely to talk about.,syntax_semantics,control_raising,tough_vs_raising_1,True,False,False,False,650,-40.110408782958984,-35.5801887512207,0
Shirts weren't tough to wear.,Shirts weren't unlikely to wear.,syntax_semantics,control_raising,tough_vs_raising_1,True,False,False,False,651,-46.49122619628906,-47.146270751953125,1
All art galleries are annoying to respect.,All art galleries are certain to respect.,syntax_semantics,control_raising,tough_vs_raising_1,True,False,False,False,652,-51.886619567871094,-50.32866287231445,0
Elizabeth's bosses aren't interesting to fire.,Elizabeth's bosses aren't unlikely to fire.,syntax_semantics,control_raising,tough_vs_raising_1,True,False,False,False,653,-48.50160598754883,-49.491939544677734,1
Wendy is fun to flee from.,Wendy is about to flee from.,syntax_semantics,control_raising,tough_vs_raising_1,True,False,False,False,654,-45.509368896484375,-43.397735595703125,0
The mountains were hard to lift.,The mountains were soon to lift.,syntax_semantics,control_raising,tough_vs_raising_1,True,False,False,False,655,-31.11890411376953,-33.9779167175293,1
