sentence_good,sentence_bad,field,linguistics_term,UID,simple_LM_method,one_prefix_method,two_prefix_method,lexically_identical,pair_id,good_prob,bad_prob,correct
Every library impresses itself.,Every library impresses themselves.,morphology,anaphor_agreement,anaphor_number_agreement,True,True,False,True,554,-38.3544921875,-38.411048889160156,1
Michelle hasn't concealed herself.,Michelle hasn't concealed themselves.,morphology,anaphor_agreement,anaphor_number_agreement,True,True,False,True,555,-35.59461975097656,-34.03821563720703,0
Linda stunned herself.,Linda stunned themselves.,morphology,anaphor_agreement,anaphor_number_agreement,True,True,False,True,556,-32.786399841308594,-32.4053955078125,0
Some men were approaching themselves.,Some men were approaching herself.,morphology,anaphor_agreement,anaphor_number_agreement,True,True,False,True,557,-31.057903289794922,-32.788673400878906,1
All ladies work with themselves.,All ladies work with itself.,morphology,anaphor_agreement,anaphor_number_agreement,True,True,False,True,558,-31.736085891723633,-31.611188888549805,0
Those guys have concealed themselves.,Those guys have concealed itself.,morphology,anaphor_agreement,anaphor_number_agreement,True,True,False,True,559,-34.44153594970703,-35.49900817871094,1
Homer can find himself.,Homer can find themselves.,morphology,anaphor_agreement,anaphor_number_agreement,True,True,False,True,560,-33.35138702392578,-30.74315643310547,0
Those pedestrians bored themselves.,Those pedestrians bored himself.,morphology,anaphor_agreement,anaphor_number_agreement,True,True,False,True,561,-37.963069915771484,-39.89350128173828,1
Sandra could upset herself.,Sandra could upset themselves.,morphology,anaphor_agreement,anaphor_number_agreement,True,True,False,True,562,-39.011375427246094,-38.14863204956055,0
Heidi has distracted herself.,Heidi has distracted themselves.,morphology,anaphor_agreement,anaphor_number_agreement,True,True,False,True,563,-38.41240692138672,-37.61494827270508,0
Peter isn't kissing himself.,Peter isn't kissing themselves.,morphology,anaphor_agreement,anaphor_number_agreement,True,True,False,True,564,-34.493927001953125,-33.81772232055664,0
These students aren't aggravating themselves.,These students aren't aggravating itself.,morphology,anaphor_agreement,anaphor_number_agreement,True,True,False,True,565,-45.50905990600586,-46.51701354980469,1
Guy bothered himself.,Guy bothered themselves.,morphology,anaphor_agreement,anaphor_number_agreement,True,True,False,True,566,-22.693267822265625,-21.334453582763672,0
Tara wasn't concealing herself.,Tara wasn't concealing themselves.,morphology,anaphor_agreement,anaphor_number_agreement,True,True,False,True,567,-51.21075439453125,-50.41769027709961,0
Most teachers concealed themselves.,Most teachers concealed himself.,morphology,anaphor_agreement,anaphor_number_agreement,True,True,False,True,568,-32.89639663696289,-35.925575256347656,1
The university can't astound itself.,The university can't astound themselves.,morphology,anaphor_agreement,anaphor_number_agreement,True,True,False,True,569,-51.31923294067383,-50.97066879272461,0
Some waiters do visit themselves.,Some waiters do visit itself.,morphology,anaphor_agreement,anaphor_number_agreement,True,True,False,True,570,-44.06035614013672,-43.370540618896484,0
Those cashiers have concealed themselves.,Those cashiers have concealed himself.,morphology,anaphor_agreement,anaphor_number_agreement,True,True,False,True,571,-48.950809478759766,-52.22614288330078,1
The children can know themselves.,The children can know itself.,morphology,anaphor_agreement,anaphor_number_agreement,True,True,False,True,572,-30.559036254882812,-32.17039108276367,1
Jacqueline couldn't love herself.,Jacqueline couldn't love themselves.,morphology,anaphor_agreement,anaphor_number_agreement,True,True,False,True,573,-44.64653778076172,-43.918182373046875,0
All drivers would praise themselves.,All drivers would praise herself.,morphology,anaphor_agreement,anaphor_number_agreement,True,True,False,True,574,-34.284080505371094,-36.21108627319336,1
Catherine does complain about herself.,Catherine does complain about themselves.,morphology,anaphor_agreement,anaphor_number_agreement,True,True,False,True,575,-45.04081726074219,-43.24976348876953,0
Beth had upset herself.,Beth had upset themselves.,morphology,anaphor_agreement,anaphor_number_agreement,True,True,False,True,576,-34.6160774230957,-34.76960372924805,1
These senators had seen themselves.,These senators had seen herself.,morphology,anaphor_agreement,anaphor_number_agreement,True,True,False,True,577,-31.35518455505371,-32.815818786621094,1
Those schools don't irritate themselves.,Those schools don't irritate itself.,morphology,anaphor_agreement,anaphor_number_agreement,True,True,False,True,578,-43.765655517578125,-44.45792770385742,1
Waitresses irritate themselves.,Waitresses irritate himself.,morphology,anaphor_agreement,anaphor_number_agreement,True,True,False,True,579,-39.922515869140625,-41.56331253051758,1
A lot of teenagers have visited themselves.,A lot of teenagers have visited himself.,morphology,anaphor_agreement,anaphor_number_agreement,True,True,False,True,580,-42.7464599609375,-45.21208190917969,1
All adults worked with themselves.,All adults worked with herself.,morphology,anaphor_agreement,anaphor_number_agreement,True,True,False,True,581,-31.515422821044922,-33.807098388671875,1
The teenagers scared themselves.,The teenagers scared itself.,morphology,anaphor_agreement,anaphor_number_agreement,True,True,False,True,582,-33.02463150024414,-33.76881790161133,1
Valerie wasn't embarrassing herself.,Valerie wasn't embarrassing themselves.,morphology,anaphor_agreement,anaphor_number_agreement,True,True,False,True,583,-45.645118713378906,-46.271766662597656,1
Rhonda does flee from herself.,Rhonda does flee from themselves.,morphology,anaphor_agreement,anaphor_number_agreement,True,True,False,True,584,-44.2365837097168,-43.654762268066406,0
All patients care for themselves.,All patients care for herself.,morphology,anaphor_agreement,anaphor_number_agreement,True,True,False,True,585,-29.607295989990234,-32.744468688964844,1
Sara can visit herself.,Sara can visit themselves.,morphology,anaphor_agreement,anaphor_number_agreement,True,True,False,True,586,-34.652862548828125,-33.56850814819336,0
All doctors wouldn't distract themselves.,All doctors wouldn't distract herself.,morphology,anaphor_agreement,anaphor_number_agreement,True,True,False,True,587,-42.992637634277344,-43.79645919799805,1
Russell sounds like himself.,Russell sounds like themselves.,morphology,anaphor_agreement,anaphor_number_agreement,True,True,False,True,588,-24.756961822509766,-24.61591339111328,0
All actresses approached themselves.,All actresses approached himself.,morphology,anaphor_agreement,anaphor_number_agreement,True,True,False,True,589,-33.800071716308594,-34.03119659423828,1
These people had revealed themselves.,These people had revealed himself.,morphology,anaphor_agreement,anaphor_number_agreement,True,True,False,True,590,-30.944278717041016,-32.16331100463867,1
James isn't talking to himself.,James isn't talking to themselves.,morphology,anaphor_agreement,anaphor_number_agreement,True,True,False,True,591,-34.70304870605469,-33.75555419921875,0
Jennifer is concealing herself.,Jennifer is concealing themselves.,morphology,anaphor_agreement,anaphor_number_agreement,True,True,False,True,592,-36.15996551513672,-34.40338134765625,0
Debra is discovering herself.,Debra is discovering themselves.,morphology,anaphor_agreement,anaphor_number_agreement,True,True,False,True,593,-32.22910690307617,-30.06340789794922,0
Brett thought about himself.,Brett thought about themselves.,morphology,anaphor_agreement,anaphor_number_agreement,True,True,False,True,594,-33.21056365966797,-32.190250396728516,0
Jane had upset herself.,Jane had upset themselves.,morphology,anaphor_agreement,anaphor_number_agreement,True,True,False,True,595,-26.39370346069336,-25.577247619628906,0
All doctors haven't respected themselves.,All doctors haven't respected itself.,morphology,anaphor_agreement,anaphor_number_agreement,True,True,False,True,596,-44.11598587036133,-44.50292205810547,1
Marla won't hurt herself.,Marla won't hurt themselves.,morphology,anaphor_agreement,anaphor_number_agreement,True,True,False,True,597,-37.29082489013672,-36.18964385986328,0
These cashiers aren't concealing themselves.,These cashiers aren't concealing himself.,morphology,anaphor_agreement,anaphor_number_agreement,True,True,False,True,598,-60.183555603027344,-61.41358184814453,1
The Impressionists haven't respected themselves.,The Impressionists haven't respected itself.,morphology,anaphor_agreement,anaphor_number_agreement,True,True,False,True,599,-61.1656379699707,-60.68634033203125,0
Teresa has remembered herself.,Teresa has remembered themselves.,morphology,anaphor_agreement,anaphor_number_agreement,True,True,False,True,600,-36.074790954589844,-35.458396911621094,0
Jessica had fired herself.,Jessica had fired themselves.,morphology,anaphor_agreement,anaphor_number_agreement,True,True,False,True,601,-26.77802276611328,-25.378807067871094,0
Mark doesn't flee from himself.,Mark doesn't flee from themselves.,morphology,anaphor_agreement,anaphor_number_agreement,True,True,False,True,602,-34.25379943847656,-33.993927001953125,0
Some museum distracted itself.,Some museum distracted themselves.,morphology,anaphor_agreement,anaphor_number_agreement,True,True,False,True,603,-33.80677032470703,-34.05683517456055,1
Most children aren't upsetting themselves.,Most children aren't upsetting herself.,morphology,anaphor_agreement,anaphor_number_agreement,True,True,False,True,604,-41.54401397705078,-42.16841125488281,1
The company upsets itself.,The company upsets themselves.,morphology,anaphor_agreement,anaphor_number_agreement,True,True,False,True,605,-36.93693923950195,-37.49609375,1
Noah would conceal himself.,Noah would conceal themselves.,morphology,anaphor_agreement,anaphor_number_agreement,True,True,False,True,606,-38.553985595703125,-37.61530303955078,0
Kendra might shock herself.,Kendra might shock themselves.,morphology,anaphor_agreement,anaphor_number_agreement,True,True,False,True,607,-42.012184143066406,-40.755897521972656,0
The teachers weren't arguing about themselves.,The teachers weren't arguing about itself.,morphology,anaphor_agreement,anaphor_number_agreement,True,True,False,True,608,-46.39302444458008,-47.6883544921875,1
Most universities upset themselves.,Most universities upset himself.,morphology,anaphor_agreement,anaphor_number_agreement,True,True,False,True,609,-31.508670806884766,-32.98655319213867,1
Some bank distracts itself.,Some bank distracts themselves.,morphology,anaphor_agreement,anaphor_number_agreement,True,True,False,True,610,-39.17584228515625,-39.733055114746094,1
These students don't boast about themselves.,These students don't boast about itself.,morphology,anaphor_agreement,anaphor_number_agreement,True,True,False,True,611,-40.793556213378906,-42.34169387817383,1
Candice shouldn't know herself.,Candice shouldn't know themselves.,morphology,anaphor_agreement,anaphor_number_agreement,True,True,False,True,612,-37.732566833496094,-35.9687614440918,0
Melinda concealed herself.,Melinda concealed themselves.,morphology,anaphor_agreement,anaphor_number_agreement,True,True,False,True,613,-33.48006820678711,-32.52996826171875,0
Natalie wouldn't hurt herself.,Natalie wouldn't hurt themselves.,morphology,anaphor_agreement,anaphor_number_agreement,True,True,False,True,614,-40.00690460205078,-39.076744079589844,0
Sandra fled from herself.,Sandra fled from themselves.,morphology,anaphor_agreement,anaphor_number_agreement,True,True,False,True,615,-36.74519348144531,-36.61134719848633,0
April kissed herself.,April kissed themselves.,morphology,anaphor_agreement,anaphor_number_agreement,True,True,False,True,616,-23.305150985717773,-23.865352630615234,1
Travis approached himself.,Travis approached themselves.,morphology,anaphor_agreement,anaphor_number_agreement,True,True,False,True,617,-34.27051544189453,-35.276206970214844,1
A lot of senators watched themselves.,A lot of senators watched herself.,morphology,anaphor_agreement,anaphor_number_agreement,True,True,False,True,618,-43.9148063659668,-45.21241760253906,1
Grace cared for herself.,Grace cared for themselves.,morphology,anaphor_agreement,anaphor_number_agreement,True,True,False,True,619,-32.62530517578125,-31.671436309814453,0
That company annoys itself.,That company annoys themselves.,morphology,anaphor_agreement,anaphor_number_agreement,True,True,False,True,620,-36.635093688964844,-37.52769088745117,1
Teenagers were working with themselves.,Teenagers were working with itself.,morphology,anaphor_agreement,anaphor_number_agreement,True,True,False,True,621,-36.049522399902344,-35.5589599609375,0
Children haven't appreciated themselves.,Children haven't appreciated himself.,morphology,anaphor_agreement,anaphor_number_agreement,True,True,False,True,622,-31.94955825805664,-32.98413848876953,1
Candice isn't visiting herself.,Candice isn't visiting themselves.,morphology,anaphor_agreement,anaphor_number_agreement,True,True,False,True,623,-42.133689880371094,-41.737308502197266,0
Many libraries are stunning themselves.,Many libraries are stunning herself.,morphology,anaphor_agreement,anaphor_number_agreement,True,True,False,True,624,-35.69183349609375,-36.04096984863281,1
Matt doesn't find himself.,Matt doesn't find themselves.,morphology,anaphor_agreement,anaphor_number_agreement,True,True,False,True,625,-25.105327606201172,-22.959623336791992,0
The girls hadn't scared themselves.,The girls hadn't scared himself.,morphology,anaphor_agreement,anaphor_number_agreement,True,True,False,True,626,-45.224246978759766,-44.80971908569336,0
Tiffany isn't criticizing herself.,Tiffany isn't criticizing themselves.,morphology,anaphor_agreement,anaphor_number_agreement,True,True,False,True,627,-50.67890167236328,-51.31940460205078,1
Bill can reference himself.,Bill can reference themselves.,morphology,anaphor_agreement,anaphor_number_agreement,True,True,False,True,628,-30.5191707611084,-28.52584457397461,0
Spain worries itself.,Spain worries themselves.,morphology,anaphor_agreement,anaphor_number_agreement,True,True,False,True,629,-21.463756561279297,-21.081565856933594,0
Lawrence had thought about himself.,Lawrence had thought about themselves.,morphology,anaphor_agreement,anaphor_number_agreement,True,True,False,True,630,-38.036922454833984,-37.35768508911133,0
Connie isn't boasting about herself.,Connie isn't boasting about themselves.,morphology,anaphor_agreement,anaphor_number_agreement,True,True,False,True,631,-47.27912902832031,-46.366844177246094,0
Todd isn't revealing himself.,Todd isn't revealing themselves.,morphology,anaphor_agreement,anaphor_number_agreement,True,True,False,True,632,-31.212799072265625,-31.277244567871094,1
Mark had talked about himself.,Mark had talked about themselves.,morphology,anaphor_agreement,anaphor_number_agreement,True,True,False,True,633,-27.768701553344727,-26.715160369873047,0
The Borgias were escaping from themselves.,The Borgias were escaping from himself.,morphology,anaphor_agreement,anaphor_number_agreement,True,True,False,True,634,-51.082496643066406,-51.66997528076172,1
Phillip hasn't impressed himself.,Phillip hasn't impressed themselves.,morphology,anaphor_agreement,anaphor_number_agreement,True,True,False,True,635,-38.96657180786133,-39.14517593383789,1
Beverly hated herself.,Beverly hated themselves.,morphology,anaphor_agreement,anaphor_number_agreement,True,True,False,True,636,-37.86402130126953,-37.356327056884766,0
Students are working with themselves.,Students are working with itself.,morphology,anaphor_agreement,anaphor_number_agreement,True,True,False,True,637,-21.3210391998291,-21.607934951782227,1
The Clintons shouldn't conceal themselves.,The Clintons shouldn't conceal himself.,morphology,anaphor_agreement,anaphor_number_agreement,True,True,False,True,638,-49.5538215637207,-49.540523529052734,0
These men kiss themselves.,These men kiss herself.,morphology,anaphor_agreement,anaphor_number_agreement,True,True,False,True,639,-32.39557647705078,-33.422210693359375,1
That play isn't disagreeing with itself.,That play isn't disagreeing with themselves.,morphology,anaphor_agreement,anaphor_number_agreement,True,True,False,True,640,-53.19773483276367,-54.56781768798828,1
Guests haven't questioned themselves.,Guests haven't questioned herself.,morphology,anaphor_agreement,anaphor_number_agreement,True,True,False,True,641,-44.29977798461914,-45.190921783447266,1
James distracted himself.,James distracted themselves.,morphology,anaphor_agreement,anaphor_number_agreement,True,True,False,True,642,-22.62456512451172,-21.632783889770508,0
Most girls knew themselves.,Most girls knew himself.,morphology,anaphor_agreement,anaphor_number_agreement,True,True,False,True,643,-26.932453155517578,-26.713321685791016,0
All men can hug themselves.,All men can hug himself.,morphology,anaphor_agreement,anaphor_number_agreement,True,True,False,True,644,-35.68266677856445,-36.834320068359375,1
Those actors admired themselves.,Those actors admired itself.,morphology,anaphor_agreement,anaphor_number_agreement,True,True,False,True,645,-32.27537536621094,-32.724037170410156,1
A documentary should disagree with itself.,A documentary should disagree with themselves.,morphology,anaphor_agreement,anaphor_number_agreement,True,True,False,True,646,-41.939002990722656,-42.60051345825195,1
The guy had admired himself.,The guy had admired themselves.,morphology,anaphor_agreement,anaphor_number_agreement,True,True,False,True,647,-33.44127655029297,-33.363704681396484,0
Dancers sounded like themselves.,Dancers sounded like herself.,morphology,anaphor_agreement,anaphor_number_agreement,True,True,False,True,648,-37.09684753417969,-36.8619384765625,0
Lissa might notice herself.,Lissa might notice themselves.,morphology,anaphor_agreement,anaphor_number_agreement,True,True,False,True,649,-40.03024673461914,-37.879615783691406,0
Some essay is disagreeing with itself.,Some essay is disagreeing with themselves.,morphology,anaphor_agreement,anaphor_number_agreement,True,True,False,True,650,-48.65081787109375,-49.93681716918945,1
Susan wasn't talking about herself.,Susan wasn't talking about themselves.,morphology,anaphor_agreement,anaphor_number_agreement,True,True,False,True,651,-34.60230255126953,-33.80570983886719,0
Amanda would stun herself.,Amanda would stun themselves.,morphology,anaphor_agreement,anaphor_number_agreement,True,True,False,True,652,-40.712730407714844,-40.54293441772461,0
Melanie would reference herself.,Melanie would reference themselves.,morphology,anaphor_agreement,anaphor_number_agreement,True,True,False,True,653,-42.28865432739258,-39.569976806640625,0
The cashiers help themselves.,The cashiers help herself.,morphology,anaphor_agreement,anaphor_number_agreement,True,True,False,True,654,-39.5498046875,-42.72577667236328,1
The adults can return to themselves.,The adults can return to itself.,morphology,anaphor_agreement,anaphor_number_agreement,True,True,False,True,655,-36.36884689331055,-37.954532623291016,1
Holly hadn't worked with herself.,Holly hadn't worked with themselves.,morphology,anaphor_agreement,anaphor_number_agreement,True,True,False,True,656,-43.472782135009766,-43.12060546875,0
Jessica won't impress herself.,Jessica won't impress themselves.,morphology,anaphor_agreement,anaphor_number_agreement,True,True,False,True,657,-32.58604431152344,-30.926176071166992,0
A lot of waitresses astound themselves.,A lot of waitresses astound itself.,morphology,anaphor_agreement,anaphor_number_agreement,True,True,False,True,658,-62.01725387573242,-61.00505447387695,0
A lot of actors might visit themselves.,A lot of actors might visit herself.,morphology,anaphor_agreement,anaphor_number_agreement,True,True,False,True,659,-45.98494338989258,-47.426639556884766,1
Actresses hadn't hidden themselves.,Actresses hadn't hidden himself.,morphology,anaphor_agreement,anaphor_number_agreement,True,True,False,True,660,-49.373165130615234,-49.91606903076172,1
Those adults hadn't irritated themselves.,Those adults hadn't irritated itself.,morphology,anaphor_agreement,anaphor_number_agreement,True,True,False,True,661,-44.73017120361328,-45.64539337158203,1
Some actresses discover themselves.,Some actresses discover herself.,morphology,anaphor_agreement,anaphor_number_agreement,True,True,False,True,662,-33.311767578125,-35.706748962402344,1
Stephanie couldn't talk to herself.,Stephanie couldn't talk to themselves.,morphology,anaphor_agreement,anaphor_number_agreement,True,True,False,True,663,-49.79990768432617,-48.71385192871094,0
Many universities haven't worried themselves.,Many universities haven't worried himself.,morphology,anaphor_agreement,anaphor_number_agreement,True,True,False,True,664,-43.938987731933594,-44.70301818847656,1
Dancers hated themselves.,Dancers hated himself.,morphology,anaphor_agreement,anaphor_number_agreement,True,True,False,True,665,-32.38333511352539,-32.541297912597656,1
Homer hadn't remembered himself.,Homer hadn't remembered themselves.,morphology,anaphor_agreement,anaphor_number_agreement,True,True,False,True,666,-44.73497772216797,-46.07512664794922,1
All actors wouldn't forget themselves.,All actors wouldn't forget itself.,morphology,anaphor_agreement,anaphor_number_agreement,True,True,False,True,667,-39.05857467651367,-38.96474838256836,0
A lot of girls hadn't hidden themselves.,A lot of girls hadn't hidden himself.,morphology,anaphor_agreement,anaphor_number_agreement,True,True,False,True,668,-54.57022476196289,-55.316070556640625,1
All dancers discussed themselves.,All dancers discussed herself.,morphology,anaphor_agreement,anaphor_number_agreement,True,True,False,True,669,-33.472267150878906,-35.85621643066406,1
Dana impressed herself.,Dana impressed themselves.,morphology,anaphor_agreement,anaphor_number_agreement,True,True,False,True,670,-30.983665466308594,-31.382434844970703,1
Some waitress did discuss herself.,Some waitress did discuss themselves.,morphology,anaphor_agreement,anaphor_number_agreement,True,True,False,True,671,-43.6014404296875,-41.71856689453125,0
Heather wasn't healing herself.,Heather wasn't healing themselves.,morphology,anaphor_agreement,anaphor_number_agreement,True,True,False,True,672,-47.42198944091797,-46.883323669433594,0
Some ladies aren't worrying themselves.,Some ladies aren't worrying herself.,morphology,anaphor_agreement,anaphor_number_agreement,True,True,False,True,673,-42.5959358215332,-42.86137008666992,1
A lot of drivers fired themselves.,A lot of drivers fired itself.,morphology,anaphor_agreement,anaphor_number_agreement,True,True,False,True,674,-41.096683502197266,-40.863609313964844,0
Most committees had astounded themselves.,Most committees had astounded itself.,morphology,anaphor_agreement,anaphor_number_agreement,True,True,False,True,675,-46.001708984375,-45.448768615722656,0
Most adults disgusted themselves.,Most adults disgusted himself.,morphology,anaphor_agreement,anaphor_number_agreement,True,True,False,True,676,-32.829627990722656,-34.59111022949219,1
Many cashiers cured themselves.,Many cashiers cured himself.,morphology,anaphor_agreement,anaphor_number_agreement,True,True,False,True,677,-44.636234283447266,-46.79672622680664,1
Debra was scaring herself.,Debra was scaring themselves.,morphology,anaphor_agreement,anaphor_number_agreement,True,True,False,True,678,-41.93778610229492,-41.074684143066406,0
Some universities aren't bothering themselves.,Some universities aren't bothering himself.,morphology,anaphor_agreement,anaphor_number_agreement,True,True,False,True,679,-44.68308639526367,-45.75897979736328,1
Vincent astounded himself.,Vincent astounded themselves.,morphology,anaphor_agreement,anaphor_number_agreement,True,True,False,True,680,-42.651031494140625,-42.082054138183594,0
Those students could return to themselves.,Those students could return to herself.,morphology,anaphor_agreement,anaphor_number_agreement,True,True,False,True,681,-32.828006744384766,-36.02809524536133,1
Alice might confuse herself.,Alice might confuse themselves.,morphology,anaphor_agreement,anaphor_number_agreement,True,True,False,True,682,-27.729400634765625,-26.169771194458008,0
All cashiers aggravated themselves.,All cashiers aggravated itself.,morphology,anaphor_agreement,anaphor_number_agreement,True,True,False,True,683,-44.89725875854492,-46.64145278930664,1
Deborah can't conceal herself.,Deborah can't conceal themselves.,morphology,anaphor_agreement,anaphor_number_agreement,True,True,False,True,684,-48.6939697265625,-45.99814987182617,0
A lot of drivers return to themselves.,A lot of drivers return to itself.,morphology,anaphor_agreement,anaphor_number_agreement,True,True,False,True,685,-40.84662628173828,-42.2496452331543,1
Carlos had discussed himself.,Carlos had discussed themselves.,morphology,anaphor_agreement,anaphor_number_agreement,True,True,False,True,686,-38.213504791259766,-36.04814529418945,0
A lot of girls can watch themselves.,A lot of girls can watch herself.,morphology,anaphor_agreement,anaphor_number_agreement,True,True,False,True,687,-39.03660583496094,-41.761619567871094,1
Karla hadn't hurt herself.,Karla hadn't hurt themselves.,morphology,anaphor_agreement,anaphor_number_agreement,True,True,False,True,688,-38.90673828125,-37.983924865722656,0
Jessica escaped from herself.,Jessica escaped from themselves.,morphology,anaphor_agreement,anaphor_number_agreement,True,True,False,True,689,-28.911331176757812,-27.734487533569336,0
The Impressionists weren't appreciating themselves.,The Impressionists weren't appreciating herself.,morphology,anaphor_agreement,anaphor_number_agreement,True,True,False,True,690,-62.578033447265625,-64.03788757324219,1
