sentence_good,sentence_bad,field,linguistics_term,UID,simple_LM_method,one_prefix_method,two_prefix_method,lexically_identical,pair_id,good_prob,bad_prob,correct
Carl can bother himself.,Carl can bother themselves.,morphology,anaphor_agreement,anaphor_number_agreement,True,True,False,True,691,-27.211353302001953,-26.95917510986328,0
Tamara hasn't kissed herself.,Tamara hasn't kissed themselves.,morphology,anaphor_agreement,anaphor_number_agreement,True,True,False,True,692,-41.707786560058594,-42.1556396484375,1
Edward couldn't praise himself.,Edward couldn't praise themselves.,morphology,anaphor_agreement,anaphor_number_agreement,True,True,False,True,693,-31.245723724365234,-31.062255859375,0
Most guys might stun themselves.,Most guys might stun itself.,morphology,anaphor_agreement,anaphor_number_agreement,True,True,False,True,694,-38.53105163574219,-37.75639343261719,0
A lot of teachers will worry themselves.,A lot of teachers will worry itself.,morphology,anaphor_agreement,anaphor_number_agreement,True,True,False,True,695,-44.19198226928711,-45.176090240478516,1
Brenda wasn't concealing herself.,Brenda wasn't concealing themselves.,morphology,anaphor_agreement,anaphor_number_agreement,True,True,False,True,696,-47.15287780761719,-45.761592864990234,0
A lot of women would flee from themselves.,A lot of women would flee from itself.,morphology,anaphor_agreement,anaphor_number_agreement,True,True,False,True,697,-47.74570846557617,-48.30897521972656,1
The Lutherans had scared themselves.,The Lutherans had scared itself.,morphology,anaphor_agreement,anaphor_number_agreement,True,True,False,True,698,-47.55263137817383,-47.827659606933594,1
A lot of girls weren't shocking themselves.,A lot of girls weren't shocking herself.,morphology,anaphor_agreement,anaphor_number_agreement,True,True,False,True,699,-53.51493835449219,-53.34174346923828,0
All adults thought about themselves.,All adults thought about himself.,morphology,anaphor_agreement,anaphor_number_agreement,True,True,False,True,700,-31.79998207092285,-33.93002700805664,1
This dancer shouldn't aggravate herself.,This dancer shouldn't aggravate themselves.,morphology,anaphor_agreement,anaphor_number_agreement,True,True,False,True,701,-50.75236129760742,-48.74110412597656,0
Most doctors are hurting themselves.,Most doctors are hurting itself.,morphology,anaphor_agreement,anaphor_number_agreement,True,True,False,True,702,-29.814563751220703,-31.52229881286621,1
The drivers hadn't returned to themselves.,The drivers hadn't returned to herself.,morphology,anaphor_agreement,anaphor_number_agreement,True,True,False,True,703,-46.59919738769531,-48.6500244140625,1
Nicole should complain about herself.,Nicole should complain about themselves.,morphology,anaphor_agreement,anaphor_number_agreement,True,True,False,True,704,-40.903778076171875,-38.97446060180664,0
Heather remembered herself.,Heather remembered themselves.,morphology,anaphor_agreement,anaphor_number_agreement,True,True,False,True,705,-31.803630828857422,-31.762332916259766,0
The school bothers itself.,The school bothers themselves.,morphology,anaphor_agreement,anaphor_number_agreement,True,True,False,True,706,-31.847763061523438,-31.687381744384766,0
The guy distracted himself.,The guy distracted themselves.,morphology,anaphor_agreement,anaphor_number_agreement,True,True,False,True,707,-31.58654022216797,-31.247634887695312,0
Walter stunned himself.,Walter stunned themselves.,morphology,anaphor_agreement,anaphor_number_agreement,True,True,False,True,708,-30.360252380371094,-29.522075653076172,0
Some guy returned to himself.,Some guy returned to themselves.,morphology,anaphor_agreement,anaphor_number_agreement,True,True,False,True,709,-31.725875854492188,-30.929821014404297,0
Tonya helped herself.,Tonya helped themselves.,morphology,anaphor_agreement,anaphor_number_agreement,True,True,False,True,710,-26.3819580078125,-25.053491592407227,0
Michael was hiding himself.,Michael was hiding themselves.,morphology,anaphor_agreement,anaphor_number_agreement,True,True,False,True,711,-24.89598846435547,-24.62552261352539,0
Many ladies conceal themselves.,Many ladies conceal herself.,morphology,anaphor_agreement,anaphor_number_agreement,True,True,False,True,712,-33.19465637207031,-35.00727081298828,1
Some cashiers talk about themselves.,Some cashiers talk about himself.,morphology,anaphor_agreement,anaphor_number_agreement,True,True,False,True,713,-42.82543182373047,-45.19605255126953,1
All actors will dislike themselves.,All actors will dislike itself.,morphology,anaphor_agreement,anaphor_number_agreement,True,True,False,True,714,-36.16021728515625,-37.73167419433594,1
Margaret healed herself.,Margaret healed themselves.,morphology,anaphor_agreement,anaphor_number_agreement,True,True,False,True,715,-34.21535873413086,-32.996864318847656,0
Most cashiers have distracted themselves.,Most cashiers have distracted himself.,morphology,anaphor_agreement,anaphor_number_agreement,True,True,False,True,716,-47.85962677001953,-49.60509490966797,1
Adults worked with themselves.,Adults worked with itself.,morphology,anaphor_agreement,anaphor_number_agreement,True,True,False,True,717,-35.017547607421875,-34.740909576416016,0
Rose doesn't reveal herself.,Rose doesn't reveal themselves.,morphology,anaphor_agreement,anaphor_number_agreement,True,True,False,True,718,-28.803131103515625,-27.111190795898438,0
Kendra impressed herself.,Kendra impressed themselves.,morphology,anaphor_agreement,anaphor_number_agreement,True,True,False,True,719,-33.182899475097656,-33.9953498840332,1
Melissa will approach herself.,Melissa will approach themselves.,morphology,anaphor_agreement,anaphor_number_agreement,True,True,False,True,720,-38.62702941894531,-35.27880096435547,0
Those cashiers had sounded like themselves.,Those cashiers had sounded like himself.,morphology,anaphor_agreement,anaphor_number_agreement,True,True,False,True,721,-54.2747688293457,-55.12565231323242,1
The teenagers annoyed themselves.,The teenagers annoyed herself.,morphology,anaphor_agreement,anaphor_number_agreement,True,True,False,True,722,-33.8813362121582,-34.269935607910156,1
Most guys were hiding themselves.,Most guys were hiding himself.,morphology,anaphor_agreement,anaphor_number_agreement,True,True,False,True,723,-33.97726058959961,-35.009552001953125,1
Many actors haven't listened to themselves.,Many actors haven't listened to himself.,morphology,anaphor_agreement,anaphor_number_agreement,True,True,False,True,724,-41.89025115966797,-43.06778335571289,1
Most pedestrians might observe themselves.,Most pedestrians might observe itself.,morphology,anaphor_agreement,anaphor_number_agreement,True,True,False,True,725,-36.798580169677734,-37.57276916503906,1
Craig wasn't attacking himself.,Craig wasn't attacking themselves.,morphology,anaphor_agreement,anaphor_number_agreement,True,True,False,True,726,-35.105125427246094,-36.05509567260742,1
Becca has embarrassed herself.,Becca has embarrassed themselves.,morphology,anaphor_agreement,anaphor_number_agreement,True,True,False,True,727,-40.24998474121094,-40.017574310302734,0
Some guests conceal themselves.,Some guests conceal himself.,morphology,anaphor_agreement,anaphor_number_agreement,True,True,False,True,728,-34.00991439819336,-35.184974670410156,1
Tina remembered herself.,Tina remembered themselves.,morphology,anaphor_agreement,anaphor_number_agreement,True,True,False,True,729,-30.89000701904297,-30.898765563964844,1
Thomas couldn't investigate himself.,Thomas couldn't investigate themselves.,morphology,anaphor_agreement,anaphor_number_agreement,True,True,False,True,730,-31.434959411621094,-29.295230865478516,0
Waiters impressed themselves.,Waiters impressed itself.,morphology,anaphor_agreement,anaphor_number_agreement,True,True,False,True,731,-32.821781158447266,-33.210227966308594,1
The Lutherans found themselves.,The Lutherans found itself.,morphology,anaphor_agreement,anaphor_number_agreement,True,True,False,True,732,-37.563575744628906,-37.9130973815918,1
Kristen shouldn't heal herself.,Kristen shouldn't heal themselves.,morphology,anaphor_agreement,anaphor_number_agreement,True,True,False,True,733,-39.0513916015625,-37.797271728515625,0
The Borgias hadn't listened to themselves.,The Borgias hadn't listened to itself.,morphology,anaphor_agreement,anaphor_number_agreement,True,True,False,True,734,-54.66049575805664,-55.437164306640625,1
Dana astounded herself.,Dana astounded themselves.,morphology,anaphor_agreement,anaphor_number_agreement,True,True,False,True,735,-38.905147552490234,-38.950653076171875,1
All people loved themselves.,All people loved itself.,morphology,anaphor_agreement,anaphor_number_agreement,True,True,False,True,736,-24.838916778564453,-26.168453216552734,1
Some guests have fired themselves.,Some guests have fired herself.,morphology,anaphor_agreement,anaphor_number_agreement,True,True,False,True,737,-35.60264205932617,-37.489295959472656,1
Elizabeth hadn't worried herself.,Elizabeth hadn't worried themselves.,morphology,anaphor_agreement,anaphor_number_agreement,True,True,False,True,738,-36.701385498046875,-36.28924560546875,0
Most pedestrians have kissed themselves.,Most pedestrians have kissed herself.,morphology,anaphor_agreement,anaphor_number_agreement,True,True,False,True,739,-40.693389892578125,-40.87350845336914,1
These banks aggravate themselves.,These banks aggravate itself.,morphology,anaphor_agreement,anaphor_number_agreement,True,True,False,True,740,-38.5335578918457,-38.958221435546875,1
The Clintons impressed themselves.,The Clintons impressed itself.,morphology,anaphor_agreement,anaphor_number_agreement,True,True,False,True,741,-38.60335922241211,-38.529178619384766,0
Claire wasn't talking to herself.,Claire wasn't talking to themselves.,morphology,anaphor_agreement,anaphor_number_agreement,True,True,False,True,742,-46.48540496826172,-45.188819885253906,0
Many cashiers hadn't worked with themselves.,Many cashiers hadn't worked with herself.,morphology,anaphor_agreement,anaphor_number_agreement,True,True,False,True,743,-54.53260040283203,-55.855506896972656,1
Alicia concealed herself.,Alicia concealed themselves.,morphology,anaphor_agreement,anaphor_number_agreement,True,True,False,True,744,-43.12433624267578,-41.966827392578125,0
Bradley isn't talking about himself.,Bradley isn't talking about themselves.,morphology,anaphor_agreement,anaphor_number_agreement,True,True,False,True,745,-37.88578414916992,-37.338523864746094,0
Steven has hurt himself.,Steven has hurt themselves.,morphology,anaphor_agreement,anaphor_number_agreement,True,True,False,True,746,-24.320865631103516,-22.677722930908203,0
Many men are impressing themselves.,Many men are impressing himself.,morphology,anaphor_agreement,anaphor_number_agreement,True,True,False,True,747,-37.213104248046875,-38.47195816040039,1
Many boys were healing themselves.,Many boys were healing himself.,morphology,anaphor_agreement,anaphor_number_agreement,True,True,False,True,748,-34.645904541015625,-36.13071823120117,1
Jessica is scaring herself.,Jessica is scaring themselves.,morphology,anaphor_agreement,anaphor_number_agreement,True,True,False,True,749,-32.875938415527344,-31.425254821777344,0
Carol does worry herself.,Carol does worry themselves.,morphology,anaphor_agreement,anaphor_number_agreement,True,True,False,True,750,-36.439918518066406,-35.5225830078125,0
Dennis would watch himself.,Dennis would watch themselves.,morphology,anaphor_agreement,anaphor_number_agreement,True,True,False,True,751,-35.37522888183594,-34.77136993408203,0
Samuel had concealed himself.,Samuel had concealed themselves.,morphology,anaphor_agreement,anaphor_number_agreement,True,True,False,True,752,-42.221473693847656,-40.65221405029297,0
Most senators healed themselves.,Most senators healed itself.,morphology,anaphor_agreement,anaphor_number_agreement,True,True,False,True,753,-32.26362991333008,-32.648536682128906,1
A lot of girls could observe themselves.,A lot of girls could observe herself.,morphology,anaphor_agreement,anaphor_number_agreement,True,True,False,True,754,-42.142852783203125,-46.34114074707031,1
Gerald hasn't astounded himself.,Gerald hasn't astounded themselves.,morphology,anaphor_agreement,anaphor_number_agreement,True,True,False,True,755,-54.258506774902344,-54.08015441894531,0
Elizabeth shouldn't remember herself.,Elizabeth shouldn't remember themselves.,morphology,anaphor_agreement,anaphor_number_agreement,True,True,False,True,756,-29.75737762451172,-28.723783493041992,0
Steve insulted himself.,Steve insulted themselves.,morphology,anaphor_agreement,anaphor_number_agreement,True,True,False,True,757,-21.822898864746094,-22.795345306396484,1
Laurie was hiding herself.,Laurie was hiding themselves.,morphology,anaphor_agreement,anaphor_number_agreement,True,True,False,True,758,-39.06135559082031,-38.94927215576172,0
The Lutherans distracted themselves.,The Lutherans distracted herself.,morphology,anaphor_agreement,anaphor_number_agreement,True,True,False,True,759,-42.78516387939453,-43.13226318359375,1
Regina was upsetting herself.,Regina was upsetting themselves.,morphology,anaphor_agreement,anaphor_number_agreement,True,True,False,True,760,-37.57990264892578,-37.041160583496094,0
Jacqueline disgusted herself.,Jacqueline disgusted themselves.,morphology,anaphor_agreement,anaphor_number_agreement,True,True,False,True,761,-40.211158752441406,-39.738407135009766,0
Carolyn was concealing herself.,Carolyn was concealing themselves.,morphology,anaphor_agreement,anaphor_number_agreement,True,True,False,True,762,-48.07677459716797,-46.63825988769531,0
Senators haven't embarrassed themselves.,Senators haven't embarrassed itself.,morphology,anaphor_agreement,anaphor_number_agreement,True,True,False,True,763,-46.6412353515625,-46.090850830078125,0
Richard disgusted himself.,Richard disgusted themselves.,morphology,anaphor_agreement,anaphor_number_agreement,True,True,False,True,764,-25.122608184814453,-24.539642333984375,0
Kenneth had embarrassed himself.,Kenneth had embarrassed themselves.,morphology,anaphor_agreement,anaphor_number_agreement,True,True,False,True,765,-35.21372985839844,-35.39228820800781,1
Most girls conceal themselves.,Most girls conceal herself.,morphology,anaphor_agreement,anaphor_number_agreement,True,True,False,True,766,-31.48434829711914,-33.1279411315918,1
Paula watched herself.,Paula watched themselves.,morphology,anaphor_agreement,anaphor_number_agreement,True,True,False,True,767,-26.59487533569336,-26.446067810058594,0
The Impressionists escape from themselves.,The Impressionists escape from itself.,morphology,anaphor_agreement,anaphor_number_agreement,True,True,False,True,768,-52.05157470703125,-51.78242492675781,0
The actresses notice themselves.,The actresses notice himself.,morphology,anaphor_agreement,anaphor_number_agreement,True,True,False,True,769,-32.83986282348633,-34.547035217285156,1
Sharon wasn't disgusting herself.,Sharon wasn't disgusting themselves.,morphology,anaphor_agreement,anaphor_number_agreement,True,True,False,True,770,-47.038658142089844,-47.624755859375,1
This company aggravates itself.,This company aggravates themselves.,morphology,anaphor_agreement,anaphor_number_agreement,True,True,False,True,771,-34.10926818847656,-33.952430725097656,0
The fish found themselves.,The fish found himself.,morphology,anaphor_agreement,anaphor_number_agreement,True,True,False,True,772,-28.35254669189453,-28.979429244995117,1
Teenagers hadn't complained about themselves.,Teenagers hadn't complained about itself.,morphology,anaphor_agreement,anaphor_number_agreement,True,True,False,True,773,-47.39581298828125,-48.68205642700195,1
Bill is discovering himself.,Bill is discovering themselves.,morphology,anaphor_agreement,anaphor_number_agreement,True,True,False,True,774,-23.96539306640625,-22.492889404296875,0
Most guys criticize themselves.,Most guys criticize itself.,morphology,anaphor_agreement,anaphor_number_agreement,True,True,False,True,775,-31.39133071899414,-32.63389205932617,1
A lot of cashiers aren't working with themselves.,A lot of cashiers aren't working with himself.,morphology,anaphor_agreement,anaphor_number_agreement,True,True,False,True,776,-59.68855285644531,-62.92730712890625,1
Charles couldn't hate himself.,Charles couldn't hate themselves.,morphology,anaphor_agreement,anaphor_number_agreement,True,True,False,True,777,-30.320131301879883,-30.091449737548828,0
Joseph hasn't disturbed himself.,Joseph hasn't disturbed themselves.,morphology,anaphor_agreement,anaphor_number_agreement,True,True,False,True,778,-31.94522476196289,-31.88478660583496,0
Senators might talk about themselves.,Senators might talk about itself.,morphology,anaphor_agreement,anaphor_number_agreement,True,True,False,True,779,-36.539283752441406,-37.87373733520508,1
Laura hasn't hugged herself.,Laura hasn't hugged themselves.,morphology,anaphor_agreement,anaphor_number_agreement,True,True,False,True,780,-33.3499870300293,-32.83472442626953,0
The teenagers think about themselves.,The teenagers think about herself.,morphology,anaphor_agreement,anaphor_number_agreement,True,True,False,True,781,-32.119049072265625,-33.42304229736328,1
Carlos hasn't referenced himself.,Carlos hasn't referenced themselves.,morphology,anaphor_agreement,anaphor_number_agreement,True,True,False,True,782,-44.03888702392578,-43.08062744140625,0
Steven had returned to himself.,Steven had returned to themselves.,morphology,anaphor_agreement,anaphor_number_agreement,True,True,False,True,783,-24.7101993560791,-23.48273468017578,0
A lot of waiters were listening to themselves.,A lot of waiters were listening to herself.,morphology,anaphor_agreement,anaphor_number_agreement,True,True,False,True,784,-52.45098876953125,-55.09135437011719,1
Steve is helping himself.,Steve is helping themselves.,morphology,anaphor_agreement,anaphor_number_agreement,True,True,False,True,785,-22.24150848388672,-20.18729019165039,0
Colleen will aggravate herself.,Colleen will aggravate themselves.,morphology,anaphor_agreement,anaphor_number_agreement,True,True,False,True,786,-45.96294021606445,-42.86486053466797,0
Noah shouldn't argue about himself.,Noah shouldn't argue about themselves.,morphology,anaphor_agreement,anaphor_number_agreement,True,True,False,True,787,-42.73188781738281,-42.20097351074219,0
Travis won't approach himself.,Travis won't approach themselves.,morphology,anaphor_agreement,anaphor_number_agreement,True,True,False,True,788,-45.886558532714844,-44.914581298828125,0
Candice hadn't thought about herself.,Candice hadn't thought about themselves.,morphology,anaphor_agreement,anaphor_number_agreement,True,True,False,True,789,-44.04003143310547,-42.94544982910156,0
Every waitress boasted about herself.,Every waitress boasted about themselves.,morphology,anaphor_agreement,anaphor_number_agreement,True,True,False,True,790,-39.63302993774414,-38.77177429199219,0
Guests concealed themselves.,Guests concealed herself.,morphology,anaphor_agreement,anaphor_number_agreement,True,True,False,True,791,-33.56257629394531,-35.75970458984375,1
Melissa had bored herself.,Melissa had bored themselves.,morphology,anaphor_agreement,anaphor_number_agreement,True,True,False,True,792,-37.419105529785156,-36.77865219116211,0
Meredith hasn't revealed herself.,Meredith hasn't revealed themselves.,morphology,anaphor_agreement,anaphor_number_agreement,True,True,False,True,793,-44.37104034423828,-43.55152893066406,0
The actors were observing themselves.,The actors were observing herself.,morphology,anaphor_agreement,anaphor_number_agreement,True,True,False,True,794,-32.96117401123047,-34.430076599121094,1
Many teenagers haven't forgotten themselves.,Many teenagers haven't forgotten herself.,morphology,anaphor_agreement,anaphor_number_agreement,True,True,False,True,795,-41.81904602050781,-42.52326202392578,1
Those museums are stunning themselves.,Those museums are stunning himself.,morphology,anaphor_agreement,anaphor_number_agreement,True,True,False,True,796,-37.95453643798828,-39.5024299621582,1
Most girls didn't aggravate themselves.,Most girls didn't aggravate himself.,morphology,anaphor_agreement,anaphor_number_agreement,True,True,False,True,797,-45.49640655517578,-46.35761260986328,1
Kevin wasn't disturbing himself.,Kevin wasn't disturbing themselves.,morphology,anaphor_agreement,anaphor_number_agreement,True,True,False,True,798,-35.182464599609375,-34.8896484375,0
Most patients have investigated themselves.,Most patients have investigated itself.,morphology,anaphor_agreement,anaphor_number_agreement,True,True,False,True,799,-32.66851806640625,-33.56816101074219,1
Gina didn't see herself.,Gina didn't see themselves.,morphology,anaphor_agreement,anaphor_number_agreement,True,True,False,True,800,-35.018314361572266,-33.598388671875,0
The man praised himself.,The man praised themselves.,morphology,anaphor_agreement,anaphor_number_agreement,True,True,False,True,801,-27.667570114135742,-27.910884857177734,1
Rachelle hasn't healed herself.,Rachelle hasn't healed themselves.,morphology,anaphor_agreement,anaphor_number_agreement,True,True,False,True,802,-42.42323303222656,-41.76021194458008,0
Carolyn approached herself.,Carolyn approached themselves.,morphology,anaphor_agreement,anaphor_number_agreement,True,True,False,True,803,-34.226436614990234,-34.22880935668945,1
Gary was scaring himself.,Gary was scaring themselves.,morphology,anaphor_agreement,anaphor_number_agreement,True,True,False,True,804,-32.85236358642578,-32.35559844970703,0
The Borgias were admiring themselves.,The Borgias were admiring herself.,morphology,anaphor_agreement,anaphor_number_agreement,True,True,False,True,805,-53.935760498046875,-53.99110412597656,1
People can't approach themselves.,People can't approach himself.,morphology,anaphor_agreement,anaphor_number_agreement,True,True,False,True,806,-28.70371437072754,-31.35492515563965,1
Those people should remember themselves.,Those people should remember herself.,morphology,anaphor_agreement,anaphor_number_agreement,True,True,False,True,807,-26.189289093017578,-28.59562110900879,1
Most women weren't helping themselves.,Most women weren't helping itself.,morphology,anaphor_agreement,anaphor_number_agreement,True,True,False,True,808,-39.9611930847168,-42.37061309814453,1
Most actors hug themselves.,Most actors hug herself.,morphology,anaphor_agreement,anaphor_number_agreement,True,True,False,True,809,-30.703018188476562,-31.57570457458496,1
The Clintons couldn't conceal themselves.,The Clintons couldn't conceal himself.,morphology,anaphor_agreement,anaphor_number_agreement,True,True,False,True,810,-49.18096923828125,-48.91752243041992,0
All banks had upset themselves.,All banks had upset himself.,morphology,anaphor_agreement,anaphor_number_agreement,True,True,False,True,811,-38.12358474731445,-39.183815002441406,1
Kimberley had cured herself.,Kimberley had cured themselves.,morphology,anaphor_agreement,anaphor_number_agreement,True,True,False,True,812,-46.194297790527344,-45.1414794921875,0
David is questioning himself.,David is questioning themselves.,morphology,anaphor_agreement,anaphor_number_agreement,True,True,False,True,813,-24.456655502319336,-22.925153732299805,0
Most waitresses wouldn't sound like themselves.,Most waitresses wouldn't sound like himself.,morphology,anaphor_agreement,anaphor_number_agreement,True,True,False,True,814,-56.565921783447266,-56.644813537597656,1
Renee bothered herself.,Renee bothered themselves.,morphology,anaphor_agreement,anaphor_number_agreement,True,True,False,True,815,-29.736202239990234,-29.370960235595703,0
Homer fired himself.,Homer fired themselves.,morphology,anaphor_agreement,anaphor_number_agreement,True,True,False,True,816,-34.27650833129883,-34.58513259887695,1
The Impressionists haven't found themselves.,The Impressionists haven't found himself.,morphology,anaphor_agreement,anaphor_number_agreement,True,True,False,True,817,-55.663490295410156,-55.411231994628906,0
Andrea didn't dislike herself.,Andrea didn't dislike themselves.,morphology,anaphor_agreement,anaphor_number_agreement,True,True,False,True,818,-43.00248718261719,-42.134498596191406,0
Girls kiss themselves.,Girls kiss himself.,morphology,anaphor_agreement,anaphor_number_agreement,True,True,False,True,819,-23.05179786682129,-23.443607330322266,1
These organizations stunned themselves.,These organizations stunned himself.,morphology,anaphor_agreement,anaphor_number_agreement,True,True,False,True,820,-32.281063079833984,-34.486419677734375,1
Rebecca hired herself.,Rebecca hired themselves.,morphology,anaphor_agreement,anaphor_number_agreement,True,True,False,True,821,-32.92914581298828,-31.7022762298584,0
Patrick approached himself.,Patrick approached themselves.,morphology,anaphor_agreement,anaphor_number_agreement,True,True,False,True,822,-21.689481735229492,-21.968446731567383,1
Mark hasn't referenced himself.,Mark hasn't referenced themselves.,morphology,anaphor_agreement,anaphor_number_agreement,True,True,False,True,823,-34.75857162475586,-34.269920349121094,0
Many adults have hired themselves.,Many adults have hired herself.,morphology,anaphor_agreement,anaphor_number_agreement,True,True,False,True,824,-30.618316650390625,-33.30624008178711,1
A lot of people escaped from themselves.,A lot of people escaped from itself.,morphology,anaphor_agreement,anaphor_number_agreement,True,True,False,True,825,-38.57794189453125,-38.95967483520508,1
Some students shouldn't remember themselves.,Some students shouldn't remember herself.,morphology,anaphor_agreement,anaphor_number_agreement,True,True,False,True,826,-35.18654251098633,-36.40945816040039,1
Those students listen to themselves.,Those students listen to herself.,morphology,anaphor_agreement,anaphor_number_agreement,True,True,False,True,827,-29.801841735839844,-32.44786834716797,1
Stephanie will hurt herself.,Stephanie will hurt themselves.,morphology,anaphor_agreement,anaphor_number_agreement,True,True,False,True,828,-42.90763473510742,-41.69937515258789,0
