sentence_good,sentence_bad,field,linguistics_term,UID,simple_LM_method,one_prefix_method,two_prefix_method,lexically_identical,pair_id,good_prob,bad_prob,correct
Most actresses flee from themselves.,Most actresses flee from herself.,morphology,anaphor_agreement,anaphor_number_agreement,True,True,False,True,277,-40.39440155029297,-40.78301239013672,1
Gina is listening to herself.,Gina is listening to themselves.,morphology,anaphor_agreement,anaphor_number_agreement,True,True,False,True,278,-35.388145446777344,-33.07598114013672,0
The Impressionists distracted themselves.,The Impressionists distracted himself.,morphology,anaphor_agreement,anaphor_number_agreement,True,True,False,True,279,-47.257625579833984,-48.3521728515625,1
Ann hasn't bothered herself.,Ann hasn't bothered themselves.,morphology,anaphor_agreement,anaphor_number_agreement,True,True,False,True,280,-31.97866439819336,-31.48902130126953,0
Samuel hadn't hated himself.,Samuel hadn't hated themselves.,morphology,anaphor_agreement,anaphor_number_agreement,True,True,False,True,281,-47.176788330078125,-47.28214645385742,1
The cashiers shouldn't worry themselves.,The cashiers shouldn't worry itself.,morphology,anaphor_agreement,anaphor_number_agreement,True,True,False,True,282,-49.93318176269531,-50.39494323730469,1
The Borgias have talked about themselves.,The Borgias have talked about himself.,morphology,anaphor_agreement,anaphor_number_agreement,True,True,False,True,283,-46.309242248535156,-46.82344055175781,1
James isn't watching himself.,James isn't watching themselves.,morphology,anaphor_agreement,anaphor_number_agreement,True,True,False,True,284,-30.930835723876953,-31.389530181884766,1
Ruth wasn't discussing herself.,Ruth wasn't discussing themselves.,morphology,anaphor_agreement,anaphor_number_agreement,True,True,False,True,285,-44.02808380126953,-43.33367156982422,0
All doctors discover themselves.,All doctors discover itself.,morphology,anaphor_agreement,anaphor_number_agreement,True,True,False,True,286,-30.096939086914062,-31.12786865234375,1
The doctors described themselves.,The doctors described itself.,morphology,anaphor_agreement,anaphor_number_agreement,True,True,False,True,287,-30.007049560546875,-29.654727935791016,0
All waitresses hurt themselves.,All waitresses hurt herself.,morphology,anaphor_agreement,anaphor_number_agreement,True,True,False,True,288,-42.03611755371094,-44.399200439453125,1
Those children could think about themselves.,Those children could think about itself.,morphology,anaphor_agreement,anaphor_number_agreement,True,True,False,True,289,-32.59454345703125,-34.49859619140625,1
These senators had hated themselves.,These senators had hated herself.,morphology,anaphor_agreement,anaphor_number_agreement,True,True,False,True,290,-37.402671813964844,-38.55360412597656,1
Karen didn't heal herself.,Karen didn't heal themselves.,morphology,anaphor_agreement,anaphor_number_agreement,True,True,False,True,291,-39.61601638793945,-38.72663497924805,0
Linda does talk to herself.,Linda does talk to themselves.,morphology,anaphor_agreement,anaphor_number_agreement,True,True,False,True,292,-41.95307922363281,-39.66748046875,0
Douglas is visiting himself.,Douglas is visiting themselves.,morphology,anaphor_agreement,anaphor_number_agreement,True,True,False,True,293,-36.566917419433594,-35.571659088134766,0
Todd has aggravated himself.,Todd has aggravated themselves.,morphology,anaphor_agreement,anaphor_number_agreement,True,True,False,True,294,-27.719852447509766,-26.839893341064453,0
Noah can't discover himself.,Noah can't discover themselves.,morphology,anaphor_agreement,anaphor_number_agreement,True,True,False,True,295,-40.76355743408203,-38.57585525512695,0
The organizations bother themselves.,The organizations bother herself.,morphology,anaphor_agreement,anaphor_number_agreement,True,True,False,True,296,-33.13959884643555,-33.81805419921875,1
Boys reference themselves.,Boys reference himself.,morphology,anaphor_agreement,anaphor_number_agreement,True,True,False,True,297,-33.01173782348633,-34.64717102050781,1
Daniel isn't revealing himself.,Daniel isn't revealing themselves.,morphology,anaphor_agreement,anaphor_number_agreement,True,True,False,True,298,-32.20865249633789,-32.320220947265625,1
Tracy hadn't described herself.,Tracy hadn't described themselves.,morphology,anaphor_agreement,anaphor_number_agreement,True,True,False,True,299,-46.558441162109375,-45.48609924316406,0
Tina wasn't curing herself.,Tina wasn't curing themselves.,morphology,anaphor_agreement,anaphor_number_agreement,True,True,False,True,300,-45.13389587402344,-44.19975662231445,0
All dancers have aggravated themselves.,All dancers have aggravated himself.,morphology,anaphor_agreement,anaphor_number_agreement,True,True,False,True,301,-38.520530700683594,-40.5352897644043,1
Cheryl does disgust herself.,Cheryl does disgust themselves.,morphology,anaphor_agreement,anaphor_number_agreement,True,True,False,True,302,-52.88557434082031,-51.5162353515625,0
These boys haven't attacked themselves.,These boys haven't attacked himself.,morphology,anaphor_agreement,anaphor_number_agreement,True,True,False,True,303,-45.318058013916016,-44.68745422363281,0
Steven was hiding himself.,Steven was hiding themselves.,morphology,anaphor_agreement,anaphor_number_agreement,True,True,False,True,304,-25.839923858642578,-25.398178100585938,0
Amelia should notice herself.,Amelia should notice themselves.,morphology,anaphor_agreement,anaphor_number_agreement,True,True,False,True,305,-38.756771087646484,-35.784080505371094,0
Suzanne respected herself.,Suzanne respected themselves.,morphology,anaphor_agreement,anaphor_number_agreement,True,True,False,True,306,-37.037147521972656,-35.70943069458008,0
Sarah had boasted about herself.,Sarah had boasted about themselves.,morphology,anaphor_agreement,anaphor_number_agreement,True,True,False,True,307,-32.98380661010742,-31.73101043701172,0
Many dancers are concealing themselves.,Many dancers are concealing itself.,morphology,anaphor_agreement,anaphor_number_agreement,True,True,False,True,308,-44.117774963378906,-44.479225158691406,1
April attacked herself.,April attacked themselves.,morphology,anaphor_agreement,anaphor_number_agreement,True,True,False,True,309,-23.837844848632812,-23.3717041015625,0
This man had worked with himself.,This man had worked with themselves.,morphology,anaphor_agreement,anaphor_number_agreement,True,True,False,True,310,-34.78936767578125,-34.676666259765625,0
The governments embarrassed themselves.,The governments embarrassed herself.,morphology,anaphor_agreement,anaphor_number_agreement,True,True,False,True,311,-33.5089111328125,-34.69013214111328,1
Most libraries are scaring themselves.,Most libraries are scaring himself.,morphology,anaphor_agreement,anaphor_number_agreement,True,True,False,True,312,-41.08968734741211,-42.73656463623047,1
Jill hadn't irritated herself.,Jill hadn't irritated themselves.,morphology,anaphor_agreement,anaphor_number_agreement,True,True,False,True,313,-45.35601043701172,-44.51399230957031,0
Helen praised herself.,Helen praised themselves.,morphology,anaphor_agreement,anaphor_number_agreement,True,True,False,True,314,-27.45442771911621,-26.675708770751953,0
Most pedestrians aren't referencing themselves.,Most pedestrians aren't referencing herself.,morphology,anaphor_agreement,anaphor_number_agreement,True,True,False,True,315,-46.56719970703125,-48.583702087402344,1
Some ladies do talk to themselves.,Some ladies do talk to itself.,morphology,anaphor_agreement,anaphor_number_agreement,True,True,False,True,316,-39.07445526123047,-40.554222106933594,1
Those pedestrians embarrassed themselves.,Those pedestrians embarrassed itself.,morphology,anaphor_agreement,anaphor_number_agreement,True,True,False,True,317,-38.328121185302734,-38.02154541015625,0
Mary has seen herself.,Mary has seen themselves.,morphology,anaphor_agreement,anaphor_number_agreement,True,True,False,True,318,-20.749094009399414,-18.930416107177734,0
The Impressionists haven't hurt themselves.,The Impressionists haven't hurt itself.,morphology,anaphor_agreement,anaphor_number_agreement,True,True,False,True,319,-55.1875114440918,-55.93708801269531,1
Some waitresses had sounded like themselves.,Some waitresses had sounded like itself.,morphology,anaphor_agreement,anaphor_number_agreement,True,True,False,True,320,-54.23664093017578,-54.55500030517578,1
That woman had criticized herself.,That woman had criticized themselves.,morphology,anaphor_agreement,anaphor_number_agreement,True,True,False,True,321,-34.29832458496094,-34.030704498291016,0
A lady hadn't worked with herself.,A lady hadn't worked with themselves.,morphology,anaphor_agreement,anaphor_number_agreement,True,True,False,True,322,-47.36994171142578,-46.65813446044922,0
Becky astounded herself.,Becky astounded themselves.,morphology,anaphor_agreement,anaphor_number_agreement,True,True,False,True,323,-36.211734771728516,-35.55359649658203,0
Some actors investigate themselves.,Some actors investigate himself.,morphology,anaphor_agreement,anaphor_number_agreement,True,True,False,True,324,-30.21621322631836,-33.05658721923828,1
Omar hated himself.,Omar hated themselves.,morphology,anaphor_agreement,anaphor_number_agreement,True,True,False,True,325,-32.5135498046875,-32.40007781982422,0
The cashiers astounded themselves.,The cashiers astounded itself.,morphology,anaphor_agreement,anaphor_number_agreement,True,True,False,True,326,-51.16655349731445,-49.71281433105469,0
Many teenagers distracted themselves.,Many teenagers distracted herself.,morphology,anaphor_agreement,anaphor_number_agreement,True,True,False,True,327,-30.66912078857422,-32.67485046386719,1
Janice will respect herself.,Janice will respect themselves.,morphology,anaphor_agreement,anaphor_number_agreement,True,True,False,True,328,-39.547359466552734,-36.95642852783203,0
A lot of women worry themselves.,A lot of women worry herself.,morphology,anaphor_agreement,anaphor_number_agreement,True,True,False,True,329,-39.359596252441406,-41.27577590942383,1
Derek should hug himself.,Derek should hug themselves.,morphology,anaphor_agreement,anaphor_number_agreement,True,True,False,True,330,-42.907020568847656,-42.27471923828125,0
A lot of people complain about themselves.,A lot of people complain about itself.,morphology,anaphor_agreement,anaphor_number_agreement,True,True,False,True,331,-37.16638946533203,-38.453392028808594,1
Jill thought about herself.,Jill thought about themselves.,morphology,anaphor_agreement,anaphor_number_agreement,True,True,False,True,332,-32.080406188964844,-31.097335815429688,0
The Lutherans could praise themselves.,The Lutherans could praise itself.,morphology,anaphor_agreement,anaphor_number_agreement,True,True,False,True,333,-46.94625473022461,-47.3809814453125,1
A lot of students astounded themselves.,A lot of students astounded itself.,morphology,anaphor_agreement,anaphor_number_agreement,True,True,False,True,334,-44.895263671875,-45.45087432861328,1
Many teenagers describe themselves.,Many teenagers describe himself.,morphology,anaphor_agreement,anaphor_number_agreement,True,True,False,True,335,-29.257503509521484,-31.274578094482422,1
Anne will discover herself.,Anne will discover themselves.,morphology,anaphor_agreement,anaphor_number_agreement,True,True,False,True,336,-24.217105865478516,-21.212709426879883,0
These guests haven't approached themselves.,These guests haven't approached herself.,morphology,anaphor_agreement,anaphor_number_agreement,True,True,False,True,337,-45.10284423828125,-45.05663299560547,0
Carla annoyed herself.,Carla annoyed themselves.,morphology,anaphor_agreement,anaphor_number_agreement,True,True,False,True,338,-29.1772403717041,-30.024105072021484,1
Edward hasn't bothered himself.,Edward hasn't bothered themselves.,morphology,anaphor_agreement,anaphor_number_agreement,True,True,False,True,339,-31.107826232910156,-30.812332153320312,0
Matt isn't working with himself.,Matt isn't working with themselves.,morphology,anaphor_agreement,anaphor_number_agreement,True,True,False,True,340,-32.58085632324219,-30.846532821655273,0
Guy hadn't left himself.,Guy hadn't left themselves.,morphology,anaphor_agreement,anaphor_number_agreement,True,True,False,True,341,-34.17219161987305,-34.17662048339844,1
The children admired themselves.,The children admired itself.,morphology,anaphor_agreement,anaphor_number_agreement,True,True,False,True,342,-30.0841007232666,-31.680273056030273,1
Larry isn't healing himself.,Larry isn't healing themselves.,morphology,anaphor_agreement,anaphor_number_agreement,True,True,False,True,343,-32.045745849609375,-31.53931427001953,0
A lot of girls discover themselves.,A lot of girls discover itself.,morphology,anaphor_agreement,anaphor_number_agreement,True,True,False,True,344,-37.82660675048828,-38.87902069091797,1
The Clintons worry themselves.,The Clintons worry herself.,morphology,anaphor_agreement,anaphor_number_agreement,True,True,False,True,345,-38.55516052246094,-39.690616607666016,1
These teenagers alarm themselves.,These teenagers alarm itself.,morphology,anaphor_agreement,anaphor_number_agreement,True,True,False,True,346,-33.77175521850586,-32.90140151977539,0
Guy hadn't upset himself.,Guy hadn't upset themselves.,morphology,anaphor_agreement,anaphor_number_agreement,True,True,False,True,347,-35.24478530883789,-35.71873474121094,1
A documentary isn't disagreeing with itself.,A documentary isn't disagreeing with themselves.,morphology,anaphor_agreement,anaphor_number_agreement,True,True,False,True,348,-55.722557067871094,-57.22772216796875,1
Veronica was healing herself.,Veronica was healing themselves.,morphology,anaphor_agreement,anaphor_number_agreement,True,True,False,True,349,-41.631195068359375,-40.04181671142578,0
Some pedestrians don't insult themselves.,Some pedestrians don't insult herself.,morphology,anaphor_agreement,anaphor_number_agreement,True,True,False,True,350,-43.76605224609375,-44.17273712158203,1
A lot of cashiers weren't boring themselves.,A lot of cashiers weren't boring herself.,morphology,anaphor_agreement,anaphor_number_agreement,True,True,False,True,351,-63.53058624267578,-64.0880126953125,1
Those dancers had approached themselves.,Those dancers had approached itself.,morphology,anaphor_agreement,anaphor_number_agreement,True,True,False,True,352,-39.09830856323242,-40.034019470214844,1
Some women will insult themselves.,Some women will insult itself.,morphology,anaphor_agreement,anaphor_number_agreement,True,True,False,True,353,-33.80717849731445,-35.62312698364258,1
Bruce found himself.,Bruce found themselves.,morphology,anaphor_agreement,anaphor_number_agreement,True,True,False,True,354,-18.886245727539062,-18.36778450012207,0
Timothy should cure himself.,Timothy should cure themselves.,morphology,anaphor_agreement,anaphor_number_agreement,True,True,False,True,355,-40.169898986816406,-38.14398956298828,0
Stacey was discovering herself.,Stacey was discovering themselves.,morphology,anaphor_agreement,anaphor_number_agreement,True,True,False,True,356,-36.9136848449707,-35.49207305908203,0
The Lutherans know themselves.,The Lutherans know himself.,morphology,anaphor_agreement,anaphor_number_agreement,True,True,False,True,357,-40.79141616821289,-41.360595703125,1
A lot of drivers do boast about themselves.,A lot of drivers do boast about herself.,morphology,anaphor_agreement,anaphor_number_agreement,True,True,False,True,358,-51.506500244140625,-53.2451171875,1
Roger kissed himself.,Roger kissed themselves.,morphology,anaphor_agreement,anaphor_number_agreement,True,True,False,True,359,-22.429611206054688,-23.326553344726562,1
Laurie has described herself.,Laurie has described themselves.,morphology,anaphor_agreement,anaphor_number_agreement,True,True,False,True,360,-39.11382293701172,-38.08734893798828,0
Deborah alarmed herself.,Deborah alarmed themselves.,morphology,anaphor_agreement,anaphor_number_agreement,True,True,False,True,361,-35.74915313720703,-34.59635925292969,0
Most girls complained about themselves.,Most girls complained about himself.,morphology,anaphor_agreement,anaphor_number_agreement,True,True,False,True,362,-31.214824676513672,-32.71234893798828,1
Waitresses aren't listening to themselves.,Waitresses aren't listening to itself.,morphology,anaphor_agreement,anaphor_number_agreement,True,True,False,True,363,-49.314788818359375,-51.177093505859375,1
Allison wasn't kissing herself.,Allison wasn't kissing themselves.,morphology,anaphor_agreement,anaphor_number_agreement,True,True,False,True,364,-50.329017639160156,-49.70304870605469,0
Melissa hadn't discussed herself.,Melissa hadn't discussed themselves.,morphology,anaphor_agreement,anaphor_number_agreement,True,True,False,True,365,-44.76127243041992,-43.63654327392578,0
These schools confuse themselves.,These schools confuse herself.,morphology,anaphor_agreement,anaphor_number_agreement,True,True,False,True,366,-30.96421241760254,-33.23713302612305,1
Kevin doesn't care for himself.,Kevin doesn't care for themselves.,morphology,anaphor_agreement,anaphor_number_agreement,True,True,False,True,367,-29.539793014526367,-27.83985137939453,0
Michael isn't astounding himself.,Michael isn't astounding themselves.,morphology,anaphor_agreement,anaphor_number_agreement,True,True,False,True,368,-36.70964813232422,-36.22736740112305,0
Many children talk to themselves.,Many children talk to himself.,morphology,anaphor_agreement,anaphor_number_agreement,True,True,False,True,369,-28.7967529296875,-31.156574249267578,1
Many women found themselves.,Many women found itself.,morphology,anaphor_agreement,anaphor_number_agreement,True,True,False,True,370,-22.835166931152344,-24.745399475097656,1
Carlos did talk to himself.,Carlos did talk to themselves.,morphology,anaphor_agreement,anaphor_number_agreement,True,True,False,True,371,-41.41832733154297,-39.81568908691406,0
Heidi was stunning herself.,Heidi was stunning themselves.,morphology,anaphor_agreement,anaphor_number_agreement,True,True,False,True,372,-38.50598907470703,-39.206016540527344,1
Tracy hasn't stunned herself.,Tracy hasn't stunned themselves.,morphology,anaphor_agreement,anaphor_number_agreement,True,True,False,True,373,-43.68478775024414,-42.83536911010742,0
The Lutherans dislike themselves.,The Lutherans dislike itself.,morphology,anaphor_agreement,anaphor_number_agreement,True,True,False,True,374,-43.43532180786133,-43.29979705810547,0
Some men care for themselves.,Some men care for itself.,morphology,anaphor_agreement,anaphor_number_agreement,True,True,False,True,375,-29.13022804260254,-31.395339965820312,1
Many actors are boring themselves.,Many actors are boring himself.,morphology,anaphor_agreement,anaphor_number_agreement,True,True,False,True,376,-33.807861328125,-35.786949157714844,1
Drivers loved themselves.,Drivers loved himself.,morphology,anaphor_agreement,anaphor_number_agreement,True,True,False,True,377,-29.310205459594727,-31.17197608947754,1
Melanie won't kiss herself.,Melanie won't kiss themselves.,morphology,anaphor_agreement,anaphor_number_agreement,True,True,False,True,378,-44.37078857421875,-43.7591438293457,0
Donald hired himself.,Donald hired themselves.,morphology,anaphor_agreement,anaphor_number_agreement,True,True,False,True,379,-22.446552276611328,-21.51714324951172,0
Carlos approached himself.,Carlos approached themselves.,morphology,anaphor_agreement,anaphor_number_agreement,True,True,False,True,380,-30.32040023803711,-30.513452529907227,1
Meredith was escaping from herself.,Meredith was escaping from themselves.,morphology,anaphor_agreement,anaphor_number_agreement,True,True,False,True,381,-40.796390533447266,-40.20940017700195,0
Stacy astounded herself.,Stacy astounded themselves.,morphology,anaphor_agreement,anaphor_number_agreement,True,True,False,True,382,-40.248863220214844,-39.10240173339844,0
The Clintons scared themselves.,The Clintons scared itself.,morphology,anaphor_agreement,anaphor_number_agreement,True,True,False,True,383,-38.48166275024414,-38.51676940917969,1
Customers would discuss themselves.,Customers would discuss itself.,morphology,anaphor_agreement,anaphor_number_agreement,True,True,False,True,384,-29.716846466064453,-31.43131446838379,1
An association impresses itself.,An association impresses themselves.,morphology,anaphor_agreement,anaphor_number_agreement,True,True,False,True,385,-41.1238899230957,-41.049278259277344,0
Those ladies weren't talking to themselves.,Those ladies weren't talking to itself.,morphology,anaphor_agreement,anaphor_number_agreement,True,True,False,True,386,-43.1641845703125,-44.762454986572266,1
Carl is admiring himself.,Carl is admiring themselves.,morphology,anaphor_agreement,anaphor_number_agreement,True,True,False,True,387,-32.69059753417969,-32.42100524902344,0
Sandra hid herself.,Sandra hid themselves.,morphology,anaphor_agreement,anaphor_number_agreement,True,True,False,True,388,-31.908138275146484,-32.27061462402344,1
Those actors can't question themselves.,Those actors can't question itself.,morphology,anaphor_agreement,anaphor_number_agreement,True,True,False,True,389,-42.24480438232422,-40.478660583496094,0
Jerry is finding himself.,Jerry is finding themselves.,morphology,anaphor_agreement,anaphor_number_agreement,True,True,False,True,390,-22.41446304321289,-20.884164810180664,0
Roger does complain about himself.,Roger does complain about themselves.,morphology,anaphor_agreement,anaphor_number_agreement,True,True,False,True,391,-33.314613342285156,-31.93260955810547,0
Amy has concealed herself.,Amy has concealed themselves.,morphology,anaphor_agreement,anaphor_number_agreement,True,True,False,True,392,-29.75723648071289,-27.45303726196289,0
Edward had distracted himself.,Edward had distracted themselves.,morphology,anaphor_agreement,anaphor_number_agreement,True,True,False,True,393,-26.875762939453125,-26.112253189086914,0
A lot of waitresses complained about themselves.,A lot of waitresses complained about himself.,morphology,anaphor_agreement,anaphor_number_agreement,True,True,False,True,394,-58.23192596435547,-60.011348724365234,1
Most customers won't hate themselves.,Most customers won't hate herself.,morphology,anaphor_agreement,anaphor_number_agreement,True,True,False,True,395,-36.54571533203125,-38.52330780029297,1
Candice liked herself.,Candice liked themselves.,morphology,anaphor_agreement,anaphor_number_agreement,True,True,False,True,396,-32.37509536743164,-31.92055892944336,0
Janet complained about herself.,Janet complained about themselves.,morphology,anaphor_agreement,anaphor_number_agreement,True,True,False,True,397,-33.82190704345703,-32.81442642211914,0
Maria was insulting herself.,Maria was insulting themselves.,morphology,anaphor_agreement,anaphor_number_agreement,True,True,False,True,398,-28.634296417236328,-27.98967170715332,0
All guys are approaching themselves.,All guys are approaching himself.,morphology,anaphor_agreement,anaphor_number_agreement,True,True,False,True,399,-32.02626037597656,-34.0885009765625,1
Most children admired themselves.,Most children admired himself.,morphology,anaphor_agreement,anaphor_number_agreement,True,True,False,True,400,-28.704557418823242,-30.43964385986328,1
A lot of committees have astounded themselves.,A lot of committees have astounded itself.,morphology,anaphor_agreement,anaphor_number_agreement,True,True,False,True,401,-53.11455535888672,-52.58513641357422,0
The Borgias investigated themselves.,The Borgias investigated herself.,morphology,anaphor_agreement,anaphor_number_agreement,True,True,False,True,402,-42.53432083129883,-44.161956787109375,1
Those men question themselves.,Those men question herself.,morphology,anaphor_agreement,anaphor_number_agreement,True,True,False,True,403,-31.606403350830078,-33.029258728027344,1
Charles isn't annoying himself.,Charles isn't annoying themselves.,morphology,anaphor_agreement,anaphor_number_agreement,True,True,False,True,404,-34.359806060791016,-33.88923263549805,0
Some guys were concealing themselves.,Some guys were concealing itself.,morphology,anaphor_agreement,anaphor_number_agreement,True,True,False,True,405,-41.83454513549805,-41.76660919189453,0
These guests weren't boring themselves.,These guests weren't boring herself.,morphology,anaphor_agreement,anaphor_number_agreement,True,True,False,True,406,-47.255943298339844,-47.109310150146484,0
Carla can talk to herself.,Carla can talk to themselves.,morphology,anaphor_agreement,anaphor_number_agreement,True,True,False,True,407,-36.350704193115234,-33.751800537109375,0
A lot of teenagers hadn't attacked themselves.,A lot of teenagers hadn't attacked himself.,morphology,anaphor_agreement,anaphor_number_agreement,True,True,False,True,408,-55.547828674316406,-55.22271728515625,0
Some lady couldn't return to herself.,Some lady couldn't return to themselves.,morphology,anaphor_agreement,anaphor_number_agreement,True,True,False,True,409,-43.80052947998047,-41.43547058105469,0
A lot of associations do upset themselves.,A lot of associations do upset himself.,morphology,anaphor_agreement,anaphor_number_agreement,True,True,False,True,410,-50.446571350097656,-52.10076904296875,1
Some boys weren't concealing themselves.,Some boys weren't concealing himself.,morphology,anaphor_agreement,anaphor_number_agreement,True,True,False,True,411,-50.11836624145508,-49.67469024658203,0
Peter worried himself.,Peter worried themselves.,morphology,anaphor_agreement,anaphor_number_agreement,True,True,False,True,412,-22.15008544921875,-21.912168502807617,0
Cindy does praise herself.,Cindy does praise themselves.,morphology,anaphor_agreement,anaphor_number_agreement,True,True,False,True,413,-44.18172836303711,-42.24457931518555,0
A book hasn't disagreed with itself.,A book hasn't disagreed with themselves.,morphology,anaphor_agreement,anaphor_number_agreement,True,True,False,True,414,-43.102108001708984,-43.437469482421875,1
