sentence_good,sentence_bad,field,linguistics_term,UID,simple_LM_method,one_prefix_method,two_prefix_method,lexically_identical,pair_id,good_prob,bad_prob,correct
Susan revealed herself.,Susan revealed themselves.,morphology,anaphor_agreement,anaphor_number_agreement,True,True,False,True,0,-20.173370361328125,-19.928932189941406,0
Renee hasn't hurt herself.,Renee hasn't hurt themselves.,morphology,anaphor_agreement,anaphor_number_agreement,True,True,False,True,1,-34.48012161254883,-33.226966857910156,0
These patients do respect themselves.,These patients do respect himself.,morphology,anaphor_agreement,anaphor_number_agreement,True,True,False,True,2,-34.50634765625,-37.03572082519531,1
Mary should criticize herself.,Mary should criticize themselves.,morphology,anaphor_agreement,anaphor_number_agreement,True,True,False,True,3,-30.109561920166016,-27.331335067749023,0
Kristin irritated herself.,Kristin irritated themselves.,morphology,anaphor_agreement,anaphor_number_agreement,True,True,False,True,4,-29.196475982666016,-29.35003662109375,1
Tracy described herself.,Tracy described themselves.,morphology,anaphor_agreement,anaphor_number_agreement,True,True,False,True,5,-29.64358901977539,-27.889801025390625,0
A lot of girls had bothered themselves.,A lot of girls had bothered himself.,morphology,anaphor_agreement,anaphor_number_agreement,True,True,False,True,6,-46.474857330322266,-47.60089111328125,1
Many teenagers were helping themselves.,Many teenagers were helping herself.,morphology,anaphor_agreement,anaphor_number_agreement,True,True,False,True,7,-31.904315948486328,-34.032527923583984,1
Girls talked to themselves.,Girls talked to itself.,morphology,anaphor_agreement,anaphor_number_agreement,True,True,False,True,8,-24.485088348388672,-26.096527099609375,1
All senators listened to themselves.,All senators listened to itself.,morphology,anaphor_agreement,anaphor_number_agreement,True,True,False,True,9,-34.92134094238281,-36.66499328613281,1
Laura hired herself.,Laura hired themselves.,morphology,anaphor_agreement,anaphor_number_agreement,True,True,False,True,10,-22.208324432373047,-21.120960235595703,0
Claire won't conceal herself.,Claire won't conceal themselves.,morphology,anaphor_agreement,anaphor_number_agreement,True,True,False,True,11,-45.52967071533203,-43.5311279296875,0
Becca shouldn't impress herself.,Becca shouldn't impress themselves.,morphology,anaphor_agreement,anaphor_number_agreement,True,True,False,True,12,-44.07476043701172,-43.48473358154297,0
This woman has criticized herself.,This woman has criticized themselves.,morphology,anaphor_agreement,anaphor_number_agreement,True,True,False,True,13,-34.01835250854492,-33.32740783691406,0
Sonia would cure herself.,Sonia would cure themselves.,morphology,anaphor_agreement,anaphor_number_agreement,True,True,False,True,14,-39.087738037109375,-37.15584945678711,0
Most girls hate themselves.,Most girls hate himself.,morphology,anaphor_agreement,anaphor_number_agreement,True,True,False,True,15,-28.743610382080078,-29.624675750732422,1
This legislature worried itself.,This legislature worried themselves.,morphology,anaphor_agreement,anaphor_number_agreement,True,True,False,True,16,-35.249515533447266,-34.23192596435547,0
Florence had left herself.,Florence had left themselves.,morphology,anaphor_agreement,anaphor_number_agreement,True,True,False,True,17,-43.2097053527832,-42.687984466552734,0
The Borgias scare themselves.,The Borgias scare himself.,morphology,anaphor_agreement,anaphor_number_agreement,True,True,False,True,18,-42.571781158447266,-43.10173416137695,1
The adults hadn't forgotten themselves.,The adults hadn't forgotten himself.,morphology,anaphor_agreement,anaphor_number_agreement,True,True,False,True,19,-45.25489807128906,-45.17603302001953,0
The patients disgusted themselves.,The patients disgusted himself.,morphology,anaphor_agreement,anaphor_number_agreement,True,True,False,True,20,-34.10663604736328,-36.468624114990234,1
Thomas complained about himself.,Thomas complained about themselves.,morphology,anaphor_agreement,anaphor_number_agreement,True,True,False,True,21,-24.574676513671875,-23.234054565429688,0
Randolf knew himself.,Randolf knew themselves.,morphology,anaphor_agreement,anaphor_number_agreement,True,True,False,True,22,-31.310583114624023,-31.96339225769043,1
The students shouldn't upset themselves.,The students shouldn't upset herself.,morphology,anaphor_agreement,anaphor_number_agreement,True,True,False,True,23,-42.04347229003906,-42.5455436706543,1
All waiters couldn't criticize themselves.,All waiters couldn't criticize himself.,morphology,anaphor_agreement,anaphor_number_agreement,True,True,False,True,24,-48.0349235534668,-49.95437240600586,1
Ronald can't reference himself.,Ronald can't reference themselves.,morphology,anaphor_agreement,anaphor_number_agreement,True,True,False,True,25,-46.312110900878906,-44.763671875,0
Julie hadn't revealed herself.,Julie hadn't revealed themselves.,morphology,anaphor_agreement,anaphor_number_agreement,True,True,False,True,26,-38.030975341796875,-37.99390411376953,0
Many people bothered themselves.,Many people bothered itself.,morphology,anaphor_agreement,anaphor_number_agreement,True,True,False,True,27,-25.801189422607422,-27.604412078857422,1
Most girls annoyed themselves.,Most girls annoyed himself.,morphology,anaphor_agreement,anaphor_number_agreement,True,True,False,True,28,-31.249691009521484,-31.30418586730957,1
Most ladies weren't arguing about themselves.,Most ladies weren't arguing about herself.,morphology,anaphor_agreement,anaphor_number_agreement,True,True,False,True,29,-44.57424545288086,-45.81854248046875,1
The waitresses investigated themselves.,The waitresses investigated itself.,morphology,anaphor_agreement,anaphor_number_agreement,True,True,False,True,30,-44.13597106933594,-44.17352294921875,1
Peter won't fire himself.,Peter won't fire themselves.,morphology,anaphor_agreement,anaphor_number_agreement,True,True,False,True,31,-33.67616271972656,-32.90074920654297,0
Those waitresses had loved themselves.,Those waitresses had loved herself.,morphology,anaphor_agreement,anaphor_number_agreement,True,True,False,True,32,-47.26121520996094,-48.65516662597656,1
Cheryl isn't insulting herself.,Cheryl isn't insulting themselves.,morphology,anaphor_agreement,anaphor_number_agreement,True,True,False,True,33,-53.93540573120117,-54.41973114013672,1
Joseph isn't revealing himself.,Joseph isn't revealing themselves.,morphology,anaphor_agreement,anaphor_number_agreement,True,True,False,True,34,-30.13987159729004,-29.994056701660156,0
Most universities aren't scaring themselves.,Most universities aren't scaring herself.,morphology,anaphor_agreement,anaphor_number_agreement,True,True,False,True,35,-51.597564697265625,-52.957557678222656,1
Natalie hadn't fired herself.,Natalie hadn't fired themselves.,morphology,anaphor_agreement,anaphor_number_agreement,True,True,False,True,36,-46.61758804321289,-46.044921875,0
Donald had worked with himself.,Donald had worked with themselves.,morphology,anaphor_agreement,anaphor_number_agreement,True,True,False,True,37,-26.447189331054688,-25.4700927734375,0
Kirsten hasn't admired herself.,Kirsten hasn't admired themselves.,morphology,anaphor_agreement,anaphor_number_agreement,True,True,False,True,38,-49.05464172363281,-48.577049255371094,0
Patricia hadn't hated herself.,Patricia hadn't hated themselves.,morphology,anaphor_agreement,anaphor_number_agreement,True,True,False,True,39,-46.487220764160156,-45.996517181396484,0
Most reports disagreed with themselves.,Most reports disagreed with herself.,morphology,anaphor_agreement,anaphor_number_agreement,True,True,False,True,40,-35.31233215332031,-37.55625915527344,1
Dawn could worry herself.,Dawn could worry themselves.,morphology,anaphor_agreement,anaphor_number_agreement,True,True,False,True,41,-41.660247802734375,-40.316680908203125,0
Randolf might approach himself.,Randolf might approach themselves.,morphology,anaphor_agreement,anaphor_number_agreement,True,True,False,True,42,-40.41303253173828,-38.18238830566406,0
Stacy didn't remember herself.,Stacy didn't remember themselves.,morphology,anaphor_agreement,anaphor_number_agreement,True,True,False,True,43,-38.72139358520508,-37.93916702270508,0
Richard returned to himself.,Richard returned to themselves.,morphology,anaphor_agreement,anaphor_number_agreement,True,True,False,True,44,-23.6534423828125,-22.091461181640625,0
All boys listen to themselves.,All boys listen to herself.,morphology,anaphor_agreement,anaphor_number_agreement,True,True,False,True,45,-32.36034393310547,-34.323612213134766,1
Bruce hadn't discovered himself.,Bruce hadn't discovered themselves.,morphology,anaphor_agreement,anaphor_number_agreement,True,True,False,True,46,-35.24951934814453,-34.913734436035156,0
Many teenagers hadn't found themselves.,Many teenagers hadn't found itself.,morphology,anaphor_agreement,anaphor_number_agreement,True,True,False,True,47,-40.89222717285156,-42.09709548950195,1
Daniel does hate himself.,Daniel does hate themselves.,morphology,anaphor_agreement,anaphor_number_agreement,True,True,False,True,48,-26.719228744506836,-25.967681884765625,0
Most adults have discovered themselves.,Most adults have discovered itself.,morphology,anaphor_agreement,anaphor_number_agreement,True,True,False,True,49,-30.973398208618164,-31.98983383178711,1
Some men could notice themselves.,Some men could notice himself.,morphology,anaphor_agreement,anaphor_number_agreement,True,True,False,True,50,-32.549034118652344,-34.653564453125,1
These museums should insult themselves.,These museums should insult itself.,morphology,anaphor_agreement,anaphor_number_agreement,True,True,False,True,51,-39.898094177246094,-40.72774887084961,1
All actresses flee from themselves.,All actresses flee from herself.,morphology,anaphor_agreement,anaphor_number_agreement,True,True,False,True,52,-40.18760681152344,-40.848167419433594,1
Carol couldn't criticize herself.,Carol couldn't criticize themselves.,morphology,anaphor_agreement,anaphor_number_agreement,True,True,False,True,53,-40.642066955566406,-39.13623046875,0
All girls haven't discussed themselves.,All girls haven't discussed himself.,morphology,anaphor_agreement,anaphor_number_agreement,True,True,False,True,54,-45.49972152709961,-46.759979248046875,1
All senators complained about themselves.,All senators complained about himself.,morphology,anaphor_agreement,anaphor_number_agreement,True,True,False,True,55,-35.372344970703125,-37.06512451171875,1
Some actors shock themselves.,Some actors shock herself.,morphology,anaphor_agreement,anaphor_number_agreement,True,True,False,True,56,-29.984540939331055,-31.90224266052246,1
Jane aggravated herself.,Jane aggravated themselves.,morphology,anaphor_agreement,anaphor_number_agreement,True,True,False,True,57,-24.295970916748047,-23.35565757751465,0
Becca praised herself.,Becca praised themselves.,morphology,anaphor_agreement,anaphor_number_agreement,True,True,False,True,58,-32.9632453918457,-33.109466552734375,1
Those students don't confuse themselves.,Those students don't confuse himself.,morphology,anaphor_agreement,anaphor_number_agreement,True,True,False,True,59,-35.47069549560547,-37.11379623413086,1
Jodi left herself.,Jodi left themselves.,morphology,anaphor_agreement,anaphor_number_agreement,True,True,False,True,60,-32.54426574707031,-31.95526885986328,0
The students have thought about themselves.,The students have thought about itself.,morphology,anaphor_agreement,anaphor_number_agreement,True,True,False,True,61,-32.90034484863281,-33.871559143066406,1
A lot of customers weren't returning to themselves.,A lot of customers weren't returning to herself.,morphology,anaphor_agreement,anaphor_number_agreement,True,True,False,True,62,-52.37158203125,-54.78877258300781,1
Those customers praise themselves.,Those customers praise herself.,morphology,anaphor_agreement,anaphor_number_agreement,True,True,False,True,63,-29.9150390625,-32.248390197753906,1
David stunned himself.,David stunned themselves.,morphology,anaphor_agreement,anaphor_number_agreement,True,True,False,True,64,-22.617633819580078,-22.089704513549805,0
Beverly disturbed herself.,Beverly disturbed themselves.,morphology,anaphor_agreement,anaphor_number_agreement,True,True,False,True,65,-38.98324203491211,-38.92052459716797,0
Thomas was hurting himself.,Thomas was hurting themselves.,morphology,anaphor_agreement,anaphor_number_agreement,True,True,False,True,66,-25.48703956604004,-23.94257354736328,0
Lori attacked herself.,Lori attacked themselves.,morphology,anaphor_agreement,anaphor_number_agreement,True,True,False,True,67,-33.53020095825195,-33.399658203125,0
Joel escaped from himself.,Joel escaped from themselves.,morphology,anaphor_agreement,anaphor_number_agreement,True,True,False,True,68,-33.12495040893555,-32.83757400512695,0
The woman had worried herself.,The woman had worried themselves.,morphology,anaphor_agreement,anaphor_number_agreement,True,True,False,True,69,-32.748748779296875,-32.528587341308594,0
Kayla scared herself.,Kayla scared themselves.,morphology,anaphor_agreement,anaphor_number_agreement,True,True,False,True,70,-30.25790023803711,-29.794391632080078,0
Samuel didn't kiss himself.,Samuel didn't kiss themselves.,morphology,anaphor_agreement,anaphor_number_agreement,True,True,False,True,71,-42.809295654296875,-43.66682434082031,1
This government alarms itself.,This government alarms themselves.,morphology,anaphor_agreement,anaphor_number_agreement,True,True,False,True,72,-32.188568115234375,-32.55799865722656,1
Kristin left herself.,Kristin left themselves.,morphology,anaphor_agreement,anaphor_number_agreement,True,True,False,True,73,-27.421918869018555,-26.782787322998047,0
An association annoys itself.,An association annoys themselves.,morphology,anaphor_agreement,anaphor_number_agreement,True,True,False,True,74,-38.690757751464844,-39.641361236572266,1
Many actors thought about themselves.,Many actors thought about itself.,morphology,anaphor_agreement,anaphor_number_agreement,True,True,False,True,75,-30.36186408996582,-31.34255599975586,1
Teresa has scared herself.,Teresa has scared themselves.,morphology,anaphor_agreement,anaphor_number_agreement,True,True,False,True,76,-39.337890625,-38.06475067138672,0
Russell hadn't complained about himself.,Russell hadn't complained about themselves.,morphology,anaphor_agreement,anaphor_number_agreement,True,True,False,True,77,-38.835655212402344,-38.431190490722656,0
All cashiers liked themselves.,All cashiers liked itself.,morphology,anaphor_agreement,anaphor_number_agreement,True,True,False,True,78,-43.94990921020508,-44.78988265991211,1
Kendra doesn't shock herself.,Kendra doesn't shock themselves.,morphology,anaphor_agreement,anaphor_number_agreement,True,True,False,True,79,-43.408023834228516,-42.46076583862305,0
Jason hasn't stunned himself.,Jason hasn't stunned themselves.,morphology,anaphor_agreement,anaphor_number_agreement,True,True,False,True,80,-33.70880889892578,-33.46802520751953,0
Children did conceal themselves.,Children did conceal itself.,morphology,anaphor_agreement,anaphor_number_agreement,True,True,False,True,81,-30.783998489379883,-31.230690002441406,1
Cheryl did worry herself.,Cheryl did worry themselves.,morphology,anaphor_agreement,anaphor_number_agreement,True,True,False,True,82,-50.634132385253906,-50.0887565612793,0
Colleen can't impress herself.,Colleen can't impress themselves.,morphology,anaphor_agreement,anaphor_number_agreement,True,True,False,True,83,-43.667484283447266,-41.81501388549805,0
Kendra wasn't thinking about herself.,Kendra wasn't thinking about themselves.,morphology,anaphor_agreement,anaphor_number_agreement,True,True,False,True,84,-43.00811767578125,-42.407875061035156,0
The guests respect themselves.,The guests respect herself.,morphology,anaphor_agreement,anaphor_number_agreement,True,True,False,True,85,-33.70185089111328,-36.55820083618164,1
Kenneth was confusing himself.,Kenneth was confusing themselves.,morphology,anaphor_agreement,anaphor_number_agreement,True,True,False,True,86,-32.61866760253906,-32.695701599121094,1
Some children flee from themselves.,Some children flee from itself.,morphology,anaphor_agreement,anaphor_number_agreement,True,True,False,True,87,-33.18389892578125,-33.95248031616211,1
This organization hadn't aggravated itself.,This organization hadn't aggravated themselves.,morphology,anaphor_agreement,anaphor_number_agreement,True,True,False,True,88,-48.81620788574219,-48.003963470458984,0
Michael can't disturb himself.,Michael can't disturb themselves.,morphology,anaphor_agreement,anaphor_number_agreement,True,True,False,True,89,-31.821866989135742,-31.301788330078125,0
Many universities disgust themselves.,Many universities disgust herself.,morphology,anaphor_agreement,anaphor_number_agreement,True,True,False,True,90,-33.472412109375,-35.991554260253906,1
Some museums annoy themselves.,Some museums annoy herself.,morphology,anaphor_agreement,anaphor_number_agreement,True,True,False,True,91,-35.014408111572266,-36.32122802734375,1
All waiters cured themselves.,All waiters cured himself.,morphology,anaphor_agreement,anaphor_number_agreement,True,True,False,True,92,-39.790435791015625,-41.87974548339844,1
The teenagers shouldn't bore themselves.,The teenagers shouldn't bore himself.,morphology,anaphor_agreement,anaphor_number_agreement,True,True,False,True,93,-43.232521057128906,-42.848876953125,0
All cashiers hurt themselves.,All cashiers hurt himself.,morphology,anaphor_agreement,anaphor_number_agreement,True,True,False,True,94,-41.42744445800781,-43.84385681152344,1
The Clintons admired themselves.,The Clintons admired himself.,morphology,anaphor_agreement,anaphor_number_agreement,True,True,False,True,95,-36.92425537109375,-37.08091735839844,1
Cynthia wasn't escaping from herself.,Cynthia wasn't escaping from themselves.,morphology,anaphor_agreement,anaphor_number_agreement,True,True,False,True,96,-62.20183181762695,-62.733184814453125,1
Many banks haven't aggravated themselves.,Many banks haven't aggravated herself.,morphology,anaphor_agreement,anaphor_number_agreement,True,True,False,True,97,-44.40806579589844,-45.60319519042969,1
All organizations have confused themselves.,All organizations have confused herself.,morphology,anaphor_agreement,anaphor_number_agreement,True,True,False,True,98,-34.229610443115234,-37.1284294128418,1
Steven talked about himself.,Steven talked about themselves.,morphology,anaphor_agreement,anaphor_number_agreement,True,True,False,True,99,-23.781063079833984,-22.404478073120117,0
Most men fled from themselves.,Most men fled from itself.,morphology,anaphor_agreement,anaphor_number_agreement,True,True,False,True,100,-34.692874908447266,-34.61764144897461,0
Patrick had cared for himself.,Patrick had cared for themselves.,morphology,anaphor_agreement,anaphor_number_agreement,True,True,False,True,101,-29.452787399291992,-27.512615203857422,0
James can kiss himself.,James can kiss themselves.,morphology,anaphor_agreement,anaphor_number_agreement,True,True,False,True,102,-28.365501403808594,-27.4530029296875,0
Most dancers shouldn't reveal themselves.,Most dancers shouldn't reveal herself.,morphology,anaphor_agreement,anaphor_number_agreement,True,True,False,True,103,-40.905086517333984,-42.758888244628906,1
All waitresses conceal themselves.,All waitresses conceal herself.,morphology,anaphor_agreement,anaphor_number_agreement,True,True,False,True,104,-45.93789291381836,-48.29172134399414,1
Some girls weren't complaining about themselves.,Some girls weren't complaining about itself.,morphology,anaphor_agreement,anaphor_number_agreement,True,True,False,True,105,-44.04115295410156,-45.0343017578125,1
Andrew hugged himself.,Andrew hugged themselves.,morphology,anaphor_agreement,anaphor_number_agreement,True,True,False,True,106,-21.628822326660156,-21.459362030029297,0
These guys are aggravating themselves.,These guys are aggravating himself.,morphology,anaphor_agreement,anaphor_number_agreement,True,True,False,True,107,-37.94100570678711,-40.67561721801758,1
Those teachers are praising themselves.,Those teachers are praising herself.,morphology,anaphor_agreement,anaphor_number_agreement,True,True,False,True,108,-33.19004821777344,-35.322227478027344,1
A lot of actresses visit themselves.,A lot of actresses visit herself.,morphology,anaphor_agreement,anaphor_number_agreement,True,True,False,True,109,-44.38396453857422,-45.260520935058594,1
Carlos attacked himself.,Carlos attacked themselves.,morphology,anaphor_agreement,anaphor_number_agreement,True,True,False,True,110,-30.801000595092773,-30.944255828857422,1
Marla might visit herself.,Marla might visit themselves.,morphology,anaphor_agreement,anaphor_number_agreement,True,True,False,True,111,-35.60590362548828,-35.132965087890625,0
The guests know themselves.,The guests know itself.,morphology,anaphor_agreement,anaphor_number_agreement,True,True,False,True,112,-30.436080932617188,-30.629941940307617,1
Most men hadn't embarrassed themselves.,Most men hadn't embarrassed itself.,morphology,anaphor_agreement,anaphor_number_agreement,True,True,False,True,113,-46.33502197265625,-45.754703521728516,0
Jane hasn't escaped from herself.,Jane hasn't escaped from themselves.,morphology,anaphor_agreement,anaphor_number_agreement,True,True,False,True,114,-39.742523193359375,-38.888763427734375,0
All boys are shocking themselves.,All boys are shocking herself.,morphology,anaphor_agreement,anaphor_number_agreement,True,True,False,True,115,-35.08852005004883,-36.6335563659668,1
Craig hasn't insulted himself.,Craig hasn't insulted themselves.,morphology,anaphor_agreement,anaphor_number_agreement,True,True,False,True,116,-34.10517501831055,-34.790958404541016,1
A lot of ladies impressed themselves.,A lot of ladies impressed itself.,morphology,anaphor_agreement,anaphor_number_agreement,True,True,False,True,117,-42.71466827392578,-42.270965576171875,0
Some school distracts itself.,Some school distracts themselves.,morphology,anaphor_agreement,anaphor_number_agreement,True,True,False,True,118,-36.96692657470703,-38.02215576171875,1
All girls scared themselves.,All girls scared himself.,morphology,anaphor_agreement,anaphor_number_agreement,True,True,False,True,119,-31.843242645263672,-32.596885681152344,1
Homer had worried himself.,Homer had worried themselves.,morphology,anaphor_agreement,anaphor_number_agreement,True,True,False,True,120,-38.669410705566406,-38.57197189331055,0
All men had concealed themselves.,All men had concealed herself.,morphology,anaphor_agreement,anaphor_number_agreement,True,True,False,True,121,-37.51216125488281,-39.3780517578125,1
These pedestrians upset themselves.,These pedestrians upset itself.,morphology,anaphor_agreement,anaphor_number_agreement,True,True,False,True,122,-34.849761962890625,-34.90224075317383,1
These companies wouldn't aggravate themselves.,These companies wouldn't aggravate itself.,morphology,anaphor_agreement,anaphor_number_agreement,True,True,False,True,123,-44.62770080566406,-44.919715881347656,1
Many people hired themselves.,Many people hired herself.,morphology,anaphor_agreement,anaphor_number_agreement,True,True,False,True,124,-22.78656578063965,-25.126766204833984,1
The man won't hate himself.,The man won't hate themselves.,morphology,anaphor_agreement,anaphor_number_agreement,True,True,False,True,125,-37.8353385925293,-38.32863998413086,1
Guy is questioning himself.,Guy is questioning themselves.,morphology,anaphor_agreement,anaphor_number_agreement,True,True,False,True,126,-25.681110382080078,-23.954444885253906,0
These doctors help themselves.,These doctors help herself.,morphology,anaphor_agreement,anaphor_number_agreement,True,True,False,True,127,-26.965845108032227,-30.300418853759766,1
The teachers are talking to themselves.,The teachers are talking to itself.,morphology,anaphor_agreement,anaphor_number_agreement,True,True,False,True,128,-33.394187927246094,-35.21234893798828,1
Alicia admired herself.,Alicia admired themselves.,morphology,anaphor_agreement,anaphor_number_agreement,True,True,False,True,129,-41.14788055419922,-40.637062072753906,0
Edward worked with himself.,Edward worked with themselves.,morphology,anaphor_agreement,anaphor_number_agreement,True,True,False,True,130,-23.223209381103516,-22.313217163085938,0
The men couldn't disagree with themselves.,The men couldn't disagree with herself.,morphology,anaphor_agreement,anaphor_number_agreement,True,True,False,True,131,-43.797386169433594,-44.58213424682617,1
The dancers flee from themselves.,The dancers flee from himself.,morphology,anaphor_agreement,anaphor_number_agreement,True,True,False,True,132,-38.80802917480469,-39.494503021240234,1
Valerie hasn't thought about herself.,Valerie hasn't thought about themselves.,morphology,anaphor_agreement,anaphor_number_agreement,True,True,False,True,133,-42.08594512939453,-41.11704635620117,0
The universities are astounding themselves.,The universities are astounding himself.,morphology,anaphor_agreement,anaphor_number_agreement,True,True,False,True,134,-35.50031661987305,-37.79716491699219,1
These cashiers had concealed themselves.,These cashiers had concealed himself.,morphology,anaphor_agreement,anaphor_number_agreement,True,True,False,True,135,-51.06678009033203,-53.54911804199219,1
Michelle was embarrassing herself.,Michelle was embarrassing themselves.,morphology,anaphor_agreement,anaphor_number_agreement,True,True,False,True,136,-27.130645751953125,-26.01120376586914,0
Omar is concealing himself.,Omar is concealing themselves.,morphology,anaphor_agreement,anaphor_number_agreement,True,True,False,True,137,-46.704376220703125,-45.754669189453125,0
Most teachers hurt themselves.,Most teachers hurt herself.,morphology,anaphor_agreement,anaphor_number_agreement,True,True,False,True,138,-27.532310485839844,-29.77224349975586,1
