sentence_good,sentence_bad,field,linguistics_term,UID,simple_LM_method,one_prefix_method,two_prefix_method,lexically_identical,pair_id,good_prob,bad_prob,correct
There isn't a bank conspiring.,There isn't each bank conspiring.,semantics,quantifiers,existential_there_quantifiers_1,True,False,False,False,490,-39.27716064453125,-48.86882781982422,1
There wasn't a report boring Travis.,There wasn't every report boring Travis.,semantics,quantifiers,existential_there_quantifiers_1,True,False,False,False,491,-49.445125579833984,-58.530277252197266,1
There is a restaurant hurting a lot of doctors.,There is every restaurant hurting a lot of doctors.,semantics,quantifiers,existential_there_quantifiers_1,True,False,False,False,492,-43.756805419921875,-52.002220153808594,1
There weren't few wheelbarrows accelerating.,There weren't most wheelbarrows accelerating.,semantics,quantifiers,existential_there_quantifiers_1,True,False,False,False,493,-55.14827346801758,-57.058937072753906,1
There are no hospitals meeting.,There are most hospitals meeting.,semantics,quantifiers,existential_there_quantifiers_1,True,False,False,False,494,-31.63184356689453,-34.86988830566406,1
There were no computers impressing every patient.,There were most computers impressing every patient.,semantics,quantifiers,existential_there_quantifiers_1,True,False,False,False,495,-55.31421661376953,-60.94976806640625,1
There are no guests astounding that hospital.,There are most guests astounding that hospital.,semantics,quantifiers,existential_there_quantifiers_1,True,False,False,False,496,-53.67572784423828,-58.70344924926758,1
There were some pictures of a light disgusting Heidi.,There were most pictures of a light disgusting Heidi.,semantics,quantifiers,existential_there_quantifiers_1,True,False,False,False,497,-60.88215637207031,-65.68597412109375,1
There weren't many eyes vanishing.,There weren't all eyes vanishing.,semantics,quantifiers,existential_there_quantifiers_1,True,False,False,False,498,-39.26273727416992,-41.94640350341797,1
There were no drivers turning out to irritate Barbara.,There were most drivers turning out to irritate Barbara.,semantics,quantifiers,existential_there_quantifiers_1,True,False,False,False,499,-65.52490234375,-71.22007751464844,1
There were some prints of Bethany vanishing.,There were most prints of Bethany vanishing.,semantics,quantifiers,existential_there_quantifiers_1,True,False,False,False,500,-56.56880187988281,-61.40647888183594,1
There are few children concealing some spotlight.,There are most children concealing some spotlight.,semantics,quantifiers,existential_there_quantifiers_1,True,False,False,False,501,-60.66087341308594,-62.15874099731445,1
There isn't a niece of the Clintons continuing to salute.,There isn't every niece of the Clintons continuing to salute.,semantics,quantifiers,existential_there_quantifiers_1,True,False,False,False,502,-75.47093963623047,-82.91569519042969,1
There wasn't a documentary aggravating Rachelle.,There wasn't every documentary aggravating Rachelle.,semantics,quantifiers,existential_there_quantifiers_1,True,False,False,False,503,-61.572269439697266,-71.40727233886719,1
There are many eggplants charring.,There are all eggplants charring.,semantics,quantifiers,existential_there_quantifiers_1,True,False,False,False,504,-57.595550537109375,-60.95452117919922,1
There are few actors hunting.,There are all actors hunting.,semantics,quantifiers,existential_there_quantifiers_1,True,False,False,False,505,-34.265594482421875,-33.46004104614258,0
There were no sons of Carla surrendering.,There were all sons of Carla surrendering.,semantics,quantifiers,existential_there_quantifiers_1,True,False,False,False,506,-54.598846435546875,-56.59844970703125,1
There is a report bothering Victoria.,There is each report bothering Victoria.,semantics,quantifiers,existential_there_quantifiers_1,True,False,False,False,507,-44.20705032348633,-55.14114761352539,1
There are few high schools impressing Jason.,There are most high schools impressing Jason.,semantics,quantifiers,existential_there_quantifiers_1,True,False,False,False,508,-60.86314392089844,-58.314395904541016,0
There are few candles wasting away.,There are all candles wasting away.,semantics,quantifiers,existential_there_quantifiers_1,True,False,False,False,509,-42.5556755065918,-40.91758728027344,0
There are no committees forcing that lady to sigh.,There are most committees forcing that lady to sigh.,semantics,quantifiers,existential_there_quantifiers_1,True,False,False,False,510,-66.68840026855469,-68.7052001953125,1
There was a skateboard falling.,There was each skateboard falling.,semantics,quantifiers,existential_there_quantifiers_1,True,False,False,False,511,-36.03816604614258,-47.66626739501953,1
There were many patients obligating Candice's supervisors to get a job.,There were most patients obligating Candice's supervisors to get a job.,semantics,quantifiers,existential_there_quantifiers_1,True,False,False,False,512,-95.1749267578125,-98.02406311035156,1
There weren't few gloves twisting.,There weren't most gloves twisting.,semantics,quantifiers,existential_there_quantifiers_1,True,False,False,False,513,-47.633567810058594,-50.56366729736328,1
There was a skateboard wasting away.,There was each skateboard wasting away.,semantics,quantifiers,existential_there_quantifiers_1,True,False,False,False,514,-45.05516815185547,-55.726539611816406,1
There was a scarf confusing that adult.,There was every scarf confusing that adult.,semantics,quantifiers,existential_there_quantifiers_1,True,False,False,False,515,-51.935882568359375,-60.413734436035156,1
There weren't many turtles climbing up those hills.,There weren't all turtles climbing up those hills.,semantics,quantifiers,existential_there_quantifiers_1,True,False,False,False,516,-53.72684860229492,-55.31127166748047,1
There are few organizations confusing Elaine.,There are all organizations confusing Elaine.,semantics,quantifiers,existential_there_quantifiers_1,True,False,False,False,517,-51.411903381347656,-50.61986541748047,0
There are few books boring Martha.,There are all books boring Martha.,semantics,quantifiers,existential_there_quantifiers_1,True,False,False,False,518,-48.56907272338867,-47.77047348022461,0
There was a face stunning Steve.,There was each face stunning Steve.,semantics,quantifiers,existential_there_quantifiers_1,True,False,False,False,519,-43.060943603515625,-53.97096252441406,1
There were some documentaries hurting Jane.,There were most documentaries hurting Jane.,semantics,quantifiers,existential_there_quantifiers_1,True,False,False,False,520,-50.13706588745117,-52.3301887512207,1
There wasn't a drawing appearing.,There wasn't each drawing appearing.,semantics,quantifiers,existential_there_quantifiers_1,True,False,False,False,521,-38.08113098144531,-47.56635665893555,1
There wasn't a plane dropping.,There wasn't each plane dropping.,semantics,quantifiers,existential_there_quantifiers_1,True,False,False,False,522,-32.50523376464844,-44.56568908691406,1
There is a sketch confusing Christine.,There is each sketch confusing Christine.,semantics,quantifiers,existential_there_quantifiers_1,True,False,False,False,523,-45.59723663330078,-56.869937896728516,1
There are no gloves shrinking.,There are all gloves shrinking.,semantics,quantifiers,existential_there_quantifiers_1,True,False,False,False,524,-40.75690460205078,-41.86711120605469,1
There are few boxes annoying the dancer.,There are most boxes annoying the dancer.,semantics,quantifiers,existential_there_quantifiers_1,True,False,False,False,525,-55.14575958251953,-57.764183044433594,1
There weren't many cakes embarrassing Gregory.,There weren't most cakes embarrassing Gregory.,semantics,quantifiers,existential_there_quantifiers_1,True,False,False,False,526,-56.69286346435547,-62.890567779541016,1
There were few pictures of Janice disturbing Christina.,There were most pictures of Janice disturbing Christina.,semantics,quantifiers,existential_there_quantifiers_1,True,False,False,False,527,-66.31416320800781,-66.87252044677734,1
There are some newspaper articles about the Clintons bothering many hospitals.,There are most newspaper articles about the Clintons bothering many hospitals.,semantics,quantifiers,existential_there_quantifiers_1,True,False,False,False,528,-84.2454833984375,-86.86537170410156,1
There was a candle disappearing.,There was every candle disappearing.,semantics,quantifiers,existential_there_quantifiers_1,True,False,False,False,529,-30.50672149658203,-38.094825744628906,1
There is a report vanishing.,There is each report vanishing.,semantics,quantifiers,existential_there_quantifiers_1,True,False,False,False,530,-34.53504180908203,-45.27720260620117,1
There are no children failing to describe Veronica.,There are all children failing to describe Veronica.,semantics,quantifiers,existential_there_quantifiers_1,True,False,False,False,531,-54.65476608276367,-58.062103271484375,1
There are no governments continuing to testify.,There are most governments continuing to testify.,semantics,quantifiers,existential_there_quantifiers_1,True,False,False,False,532,-45.594322204589844,-47.795875549316406,1
There are no cucumbers ripening.,There are most cucumbers ripening.,semantics,quantifiers,existential_there_quantifiers_1,True,False,False,False,533,-43.55133056640625,-45.10797882080078,1
There are some cousins of some men winning.,There are all cousins of some men winning.,semantics,quantifiers,existential_there_quantifiers_1,True,False,False,False,534,-47.841957092285156,-50.96706008911133,1
There wasn't a child moving.,There wasn't every child moving.,semantics,quantifiers,existential_there_quantifiers_1,True,False,False,False,535,-30.847911834716797,-37.872013092041016,1
There was a brother of Janice crying.,There was each brother of Janice crying.,semantics,quantifiers,existential_there_quantifiers_1,True,False,False,False,536,-45.62484359741211,-54.79853057861328,1
There isn't a jacket warping.,There isn't every jacket warping.,semantics,quantifiers,existential_there_quantifiers_1,True,False,False,False,537,-47.86088943481445,-55.65467071533203,1
There is a movie about Galileo disgusting Ronald.,There is every movie about Galileo disgusting Ronald.,semantics,quantifiers,existential_there_quantifiers_1,True,False,False,False,538,-61.06376647949219,-69.4178466796875,1
There were no daughters of Connie running around these glaciers.,There were all daughters of Connie running around these glaciers.,semantics,quantifiers,existential_there_quantifiers_1,True,False,False,False,539,-70.50364685058594,-71.2234115600586,1
There isn't a documentary disagreeing.,There isn't every documentary disagreeing.,semantics,quantifiers,existential_there_quantifiers_1,True,False,False,False,540,-45.30453109741211,-53.67354965209961,1
There are some prints of Frank disturbing an association.,There are most prints of Frank disturbing an association.,semantics,quantifiers,existential_there_quantifiers_1,True,False,False,False,541,-65.40411376953125,-69.98841094970703,1
There weren't few books shocking Galileo.,There weren't all books shocking Galileo.,semantics,quantifiers,existential_there_quantifiers_1,True,False,False,False,542,-57.52589416503906,-57.60527038574219,1
There were few nephews of Andrea threatening to speak up.,There were all nephews of Andrea threatening to speak up.,semantics,quantifiers,existential_there_quantifiers_1,True,False,False,False,543,-71.90382385253906,-68.95476531982422,0
There were no banks appearing to escape from many teachers.,There were all banks appearing to escape from many teachers.,semantics,quantifiers,existential_there_quantifiers_1,True,False,False,False,544,-63.717254638671875,-66.65679931640625,1
There is a mirror wasting away.,There is each mirror wasting away.,semantics,quantifiers,existential_there_quantifiers_1,True,False,False,False,545,-38.34482955932617,-49.64873504638672,1
There aren't few dogs falling.,There aren't most dogs falling.,semantics,quantifiers,existential_there_quantifiers_1,True,False,False,False,546,-37.109336853027344,-42.21543884277344,1
There was a movie theater scaring James.,There was each movie theater scaring James.,semantics,quantifiers,existential_there_quantifiers_1,True,False,False,False,547,-48.9533805847168,-61.18584442138672,1
There was a high school annoying Omar.,There was each high school annoying Omar.,semantics,quantifiers,existential_there_quantifiers_1,True,False,False,False,548,-48.69854736328125,-59.74102020263672,1
There isn't a lady obliging Karla to discuss Paula.,There isn't every lady obliging Karla to discuss Paula.,semantics,quantifiers,existential_there_quantifiers_1,True,False,False,False,549,-83.15076446533203,-89.6119613647461,1
There wasn't a museum approving.,There wasn't each museum approving.,semantics,quantifiers,existential_there_quantifiers_1,True,False,False,False,550,-40.26425552368164,-52.19908142089844,1
There wasn't a book about the Clintons astounding Mary.,There wasn't each book about the Clintons astounding Mary.,semantics,quantifiers,existential_there_quantifiers_1,True,False,False,False,551,-72.23976135253906,-82.26437377929688,1
There is a cashier grinning.,There is every cashier grinning.,semantics,quantifiers,existential_there_quantifiers_1,True,False,False,False,552,-41.308528900146484,-47.36278533935547,1
There isn't a pie confusing many actresses.,There isn't each pie confusing many actresses.,semantics,quantifiers,existential_there_quantifiers_1,True,False,False,False,553,-57.044403076171875,-67.85957336425781,1
There weren't few waitresses corresponding.,There weren't all waitresses corresponding.,semantics,quantifiers,existential_there_quantifiers_1,True,False,False,False,554,-60.48571014404297,-58.14886474609375,0
There isn't a school pushing Marcus to reference Valerie.,There isn't every school pushing Marcus to reference Valerie.,semantics,quantifiers,existential_there_quantifiers_1,True,False,False,False,555,-82.96864318847656,-88.98391723632812,1
There wasn't a son of Brenda winning.,There wasn't every son of Brenda winning.,semantics,quantifiers,existential_there_quantifiers_1,True,False,False,False,556,-50.24418640136719,-55.79401397705078,1
There are many essays impressing these legislatures.,There are all essays impressing these legislatures.,semantics,quantifiers,existential_there_quantifiers_1,True,False,False,False,557,-59.05300521850586,-63.36247634887695,1
There wasn't a waiter considering this cart to crash.,There wasn't every waiter considering this cart to crash.,semantics,quantifiers,existential_there_quantifiers_1,True,False,False,False,558,-63.550941467285156,-71.42568969726562,1
There is a candle astounding the Clintons.,There is each candle astounding the Clintons.,semantics,quantifiers,existential_there_quantifiers_1,True,False,False,False,559,-59.77669906616211,-69.09884643554688,1
There isn't a mouth wasting away.,There isn't every mouth wasting away.,semantics,quantifiers,existential_there_quantifiers_1,True,False,False,False,560,-41.281700134277344,-49.698097229003906,1
There isn't an apple confusing Ella.,There isn't every apple confusing Ella.,semantics,quantifiers,existential_there_quantifiers_1,True,False,False,False,561,-48.526119232177734,-57.65570831298828,1
There weren't many prints alarming Nicole.,There weren't all prints alarming Nicole.,semantics,quantifiers,existential_there_quantifiers_1,True,False,False,False,562,-60.055946350097656,-61.62787628173828,1
There is a candle embarrassing some boys.,There is every candle embarrassing some boys.,semantics,quantifiers,existential_there_quantifiers_1,True,False,False,False,563,-51.097164154052734,-58.17873764038086,1
There was a waitress lifting a lot of cats.,There was each waitress lifting a lot of cats.,semantics,quantifiers,existential_there_quantifiers_1,True,False,False,False,564,-48.526031494140625,-60.10243606567383,1
There isn't a girl commanding Anne to disturb every hospital.,There isn't each girl commanding Anne to disturb every hospital.,semantics,quantifiers,existential_there_quantifiers_1,True,False,False,False,565,-71.35818481445312,-81.50080871582031,1
There is a granddaughter of Vincent running around every mountain.,There is each granddaughter of Vincent running around every mountain.,semantics,quantifiers,existential_there_quantifiers_1,True,False,False,False,566,-62.23316192626953,-72.43667602539062,1
There are some drawings of every cafe impressing Danielle.,There are all drawings of every cafe impressing Danielle.,semantics,quantifiers,existential_there_quantifiers_1,True,False,False,False,567,-71.25909423828125,-74.63410186767578,1
There weren't few books looking like these sketches.,There weren't most books looking like these sketches.,semantics,quantifiers,existential_there_quantifiers_1,True,False,False,False,568,-56.377479553222656,-59.03955078125,1
There wasn't a face irritating Brian.,There wasn't every face irritating Brian.,semantics,quantifiers,existential_there_quantifiers_1,True,False,False,False,569,-47.682674407958984,-56.976627349853516,1
There isn't a book about science disturbing Kirsten.,There isn't every book about science disturbing Kirsten.,semantics,quantifiers,existential_there_quantifiers_1,True,False,False,False,570,-59.56638717651367,-69.15946960449219,1
There are few cucumbers falling.,There are all cucumbers falling.,semantics,quantifiers,existential_there_quantifiers_1,True,False,False,False,571,-38.44281005859375,-37.565155029296875,0
There are some mouths flinging open.,There are most mouths flinging open.,semantics,quantifiers,existential_there_quantifiers_1,True,False,False,False,572,-47.25995635986328,-51.643165588378906,1
There were no windows confusing Ronald.,There were most windows confusing Ronald.,semantics,quantifiers,existential_there_quantifiers_1,True,False,False,False,573,-52.080162048339844,-58.14385986328125,1
There isn't a student running around some lake.,There isn't each student running around some lake.,semantics,quantifiers,existential_there_quantifiers_1,True,False,False,False,574,-54.52299499511719,-63.364593505859375,1
There are no unicycles falling.,There are most unicycles falling.,semantics,quantifiers,existential_there_quantifiers_1,True,False,False,False,575,-45.78319549560547,-47.51249694824219,1
There isn't a dish shattering.,There isn't every dish shattering.,semantics,quantifiers,existential_there_quantifiers_1,True,False,False,False,576,-38.30233383178711,-45.617286682128906,1
There is an eye disappearing.,There is every eye disappearing.,semantics,quantifiers,existential_there_quantifiers_1,True,False,False,False,577,-29.489933013916016,-36.403865814208984,1
There is a pepper irritating some pedestrian.,There is each pepper irritating some pedestrian.,semantics,quantifiers,existential_there_quantifiers_1,True,False,False,False,578,-55.70219039916992,-67.44577026367188,1
There aren't few grandfathers of Kayla turning out to win.,There aren't all grandfathers of Kayla turning out to win.,semantics,quantifiers,existential_there_quantifiers_1,True,False,False,False,579,-81.56269836425781,-77.97569274902344,0
There were some reports wasting away.,There were all reports wasting away.,semantics,quantifiers,existential_there_quantifiers_1,True,False,False,False,580,-41.14781188964844,-42.605224609375,1
There was a grandmother of Jesus spinning around.,There was every grandmother of Jesus spinning around.,semantics,quantifiers,existential_there_quantifiers_1,True,False,False,False,581,-48.949642181396484,-55.47018051147461,1
There wasn't an actress upsetting the teenagers.,There wasn't each actress upsetting the teenagers.,semantics,quantifiers,existential_there_quantifiers_1,True,False,False,False,582,-52.25861740112305,-62.030723571777344,1
There are some pedestrians descending most mountains.,There are most pedestrians descending most mountains.,semantics,quantifiers,existential_there_quantifiers_1,True,False,False,False,583,-54.1928596496582,-55.83154296875,1
There wasn't a teacher whispering.,There wasn't each teacher whispering.,semantics,quantifiers,existential_there_quantifiers_1,True,False,False,False,584,-34.93226623535156,-43.09386444091797,1
There were some coats bothering this man.,There were all coats bothering this man.,semantics,quantifiers,existential_there_quantifiers_1,True,False,False,False,585,-49.15939712524414,-49.307579040527344,1
There isn't a coat shocking Galileo.,There isn't every coat shocking Galileo.,semantics,quantifiers,existential_there_quantifiers_1,True,False,False,False,586,-54.17616653442383,-61.786399841308594,1
There is a cart looking like every painting.,There is each cart looking like every painting.,semantics,quantifiers,existential_there_quantifiers_1,True,False,False,False,587,-50.263954162597656,-60.96221923828125,1
There isn't a boy blinking.,There isn't every boy blinking.,semantics,quantifiers,existential_there_quantifiers_1,True,False,False,False,588,-34.21045684814453,-40.947601318359375,1
There were few dancers reacting.,There were all dancers reacting.,semantics,quantifiers,existential_there_quantifiers_1,True,False,False,False,589,-43.62077331542969,-42.37781524658203,0
There wasn't a lady cheering.,There wasn't each lady cheering.,semantics,quantifiers,existential_there_quantifiers_1,True,False,False,False,590,-35.458919525146484,-45.18347930908203,1
There were few grocery stores bothering all drivers.,There were most grocery stores bothering all drivers.,semantics,quantifiers,existential_there_quantifiers_1,True,False,False,False,591,-65.32682800292969,-66.32319641113281,1
There were some glasses aggravating Carmen.,There were most glasses aggravating Carmen.,semantics,quantifiers,existential_there_quantifiers_1,True,False,False,False,592,-55.84604263305664,-62.34169387817383,1
There was a snake hiding.,There was every snake hiding.,semantics,quantifiers,existential_there_quantifiers_1,True,False,False,False,593,-29.00882339477539,-38.46813201904297,1
There is an actor wishing to boast about Eva.,There is each actor wishing to boast about Eva.,semantics,quantifiers,existential_there_quantifiers_1,True,False,False,False,594,-55.43060302734375,-65.854248046875,1
There aren't few plays stunning Melanie.,There aren't most plays stunning Melanie.,semantics,quantifiers,existential_there_quantifiers_1,True,False,False,False,595,-54.62443542480469,-56.462459564208984,1
There are no lights dimming.,There are all lights dimming.,semantics,quantifiers,existential_there_quantifiers_1,True,False,False,False,596,-42.39287567138672,-44.50126647949219,1
There weren't many books about the Great Lakes impressing the Clintons.,There weren't all books about the Great Lakes impressing the Clintons.,semantics,quantifiers,existential_there_quantifiers_1,True,False,False,False,597,-80.30982971191406,-85.53022766113281,1
There aren't many mothers of Brett upsetting Alan.,There aren't most mothers of Brett upsetting Alan.,semantics,quantifiers,existential_there_quantifiers_1,True,False,False,False,598,-68.38207244873047,-73.00007629394531,1
There were some commentaries about politics boring most teachers.,There were most commentaries about politics boring most teachers.,semantics,quantifiers,existential_there_quantifiers_1,True,False,False,False,599,-82.5900650024414,-86.18833923339844,1
There isn't a daughter of Carla chuckling.,There isn't each daughter of Carla chuckling.,semantics,quantifiers,existential_there_quantifiers_1,True,False,False,False,600,-50.23383331298828,-61.814231872558594,1
There isn't a photograph disgusting Galileo.,There isn't every photograph disgusting Galileo.,semantics,quantifiers,existential_there_quantifiers_1,True,False,False,False,601,-51.69580078125,-61.563472747802734,1
There were some women descending a lot of mountains.,There were all women descending a lot of mountains.,semantics,quantifiers,existential_there_quantifiers_1,True,False,False,False,602,-51.489501953125,-51.827693939208984,1
There are no banks reacting.,There are most banks reacting.,semantics,quantifiers,existential_there_quantifiers_1,True,False,False,False,603,-39.576995849609375,-43.66597366333008,1
There are no closets alarming Dennis.,There are most closets alarming Dennis.,semantics,quantifiers,existential_there_quantifiers_1,True,False,False,False,604,-57.28672790527344,-61.883949279785156,1
There isn't a commentary about the Balkans winning.,There isn't each commentary about the Balkans winning.,semantics,quantifiers,existential_there_quantifiers_1,True,False,False,False,605,-57.22706604003906,-68.08297729492188,1
There wasn't a customer ascending all mountains.,There wasn't every customer ascending all mountains.,semantics,quantifiers,existential_there_quantifiers_1,True,False,False,False,606,-53.27967071533203,-59.25519943237305,1
There are some granddaughters of Gina discovering Omar.,There are most granddaughters of Gina discovering Omar.,semantics,quantifiers,existential_there_quantifiers_1,True,False,False,False,607,-76.01638793945312,-77.11564636230469,1
There isn't a painting of Rodney disturbing many men.,There isn't every painting of Rodney disturbing many men.,semantics,quantifiers,existential_there_quantifiers_1,True,False,False,False,608,-66.25865936279297,-75.64816284179688,1
There are no pants vanishing.,There are most pants vanishing.,semantics,quantifiers,existential_there_quantifiers_1,True,False,False,False,609,-38.356483459472656,-43.957298278808594,1
There isn't a company needing to stun Stacy.,There isn't each company needing to stun Stacy.,semantics,quantifiers,existential_there_quantifiers_1,True,False,False,False,610,-62.055335998535156,-71.09016418457031,1
There is a movie about Spain astounding Amy.,There is every movie about Spain astounding Amy.,semantics,quantifiers,existential_there_quantifiers_1,True,False,False,False,611,-62.38771057128906,-71.93252563476562,1
