sentence_good,sentence_bad,field,linguistics_term,UID,simple_LM_method,one_prefix_method,two_prefix_method,lexically_identical,pair_id,good_prob,bad_prob,correct
There was a documentary about music irritating Allison.,There was each documentary about music irritating Allison.,semantics,quantifiers,existential_there_quantifiers_1,True,False,False,False,0,-59.07879638671875,-71.25455474853516,1
There were no legislatures working hard.,There were most legislatures working hard.,semantics,quantifiers,existential_there_quantifiers_1,True,False,False,False,1,-45.07247543334961,-48.426361083984375,1
There was a sweater shocking David.,There was each sweater shocking David.,semantics,quantifiers,existential_there_quantifiers_1,True,False,False,False,2,-47.515018463134766,-57.660892486572266,1
There are some brothers of Rachel arriving at a library.,There are all brothers of Rachel arriving at a library.,semantics,quantifiers,existential_there_quantifiers_1,True,False,False,False,3,-57.57178497314453,-59.13620376586914,1
There aren't many lights darkening.,There aren't all lights darkening.,semantics,quantifiers,existential_there_quantifiers_1,True,False,False,False,4,-43.61713790893555,-44.979530334472656,1
There are many rugs embarrassing Galileo.,There are most rugs embarrassing Galileo.,semantics,quantifiers,existential_there_quantifiers_1,True,False,False,False,5,-56.21161651611328,-60.016204833984375,1
There is a mother of Theodore imagining those adults responded.,There is each mother of Theodore imagining those adults responded.,semantics,quantifiers,existential_there_quantifiers_1,True,False,False,False,6,-73.53323364257812,-83.23927307128906,1
There wasn't a window chipping.,There wasn't each window chipping.,semantics,quantifiers,existential_there_quantifiers_1,True,False,False,False,7,-39.66303634643555,-50.25081253051758,1
There isn't a dancer slumping over.,There isn't every dancer slumping over.,semantics,quantifiers,existential_there_quantifiers_1,True,False,False,False,8,-51.08477020263672,-58.42045593261719,1
There is a committee coping.,There is every committee coping.,semantics,quantifiers,existential_there_quantifiers_1,True,False,False,False,9,-33.803016662597656,-40.325809478759766,1
There are some sisters of Ann climbing up all ladders.,There are all sisters of Ann climbing up all ladders.,semantics,quantifiers,existential_there_quantifiers_1,True,False,False,False,10,-67.78086853027344,-68.97032165527344,1
There is an essay about Winston Churchill irritating Alexander.,There is each essay about Winston Churchill irritating Alexander.,semantics,quantifiers,existential_there_quantifiers_1,True,False,False,False,11,-70.71329498291016,-81.43040466308594,1
There was a rug disappearing.,There was every rug disappearing.,semantics,quantifiers,existential_there_quantifiers_1,True,False,False,False,12,-32.8597412109375,-40.216285705566406,1
There aren't few documentaries disturbing some actors.,There aren't all documentaries disturbing some actors.,semantics,quantifiers,existential_there_quantifiers_1,True,False,False,False,13,-60.35649490356445,-59.61254119873047,0
There are no peppers upsetting all governments.,There are all peppers upsetting all governments.,semantics,quantifiers,existential_there_quantifiers_1,True,False,False,False,14,-60.00168991088867,-58.540626525878906,0
There was a cat annoying Alice.,There was each cat annoying Alice.,semantics,quantifiers,existential_there_quantifiers_1,True,False,False,False,15,-41.0214958190918,-51.373191833496094,1
There is a coat soaking.,There is every coat soaking.,semantics,quantifiers,existential_there_quantifiers_1,True,False,False,False,16,-35.23183059692383,-41.40768814086914,1
There isn't a student winning.,There isn't each student winning.,semantics,quantifiers,existential_there_quantifiers_1,True,False,False,False,17,-35.49950408935547,-44.305580139160156,1
There were few bicycles shattering.,There were most bicycles shattering.,semantics,quantifiers,existential_there_quantifiers_1,True,False,False,False,18,-42.12178039550781,-44.5388298034668,1
There weren't many eggplants existing.,There weren't all eggplants existing.,semantics,quantifiers,existential_there_quantifiers_1,True,False,False,False,19,-59.8443603515625,-63.53546905517578,1
There aren't many malls existing.,There aren't most malls existing.,semantics,quantifiers,existential_there_quantifiers_1,True,False,False,False,20,-44.897850036621094,-49.890899658203125,1
There weren't many waitresses sitting down.,There weren't all waitresses sitting down.,semantics,quantifiers,existential_there_quantifiers_1,True,False,False,False,21,-53.91534423828125,-53.84960174560547,0
There were many sketches bothering Ruth.,There were all sketches bothering Ruth.,semantics,quantifiers,existential_there_quantifiers_1,True,False,False,False,22,-50.44009780883789,-51.23493194580078,1
There wasn't a commentary worrying some pedestrians.,There wasn't every commentary worrying some pedestrians.,semantics,quantifiers,existential_there_quantifiers_1,True,False,False,False,23,-59.42285919189453,-66.7130355834961,1
There weren't few grandfathers of Beverly returning to the man.,There weren't most grandfathers of Beverly returning to the man.,semantics,quantifiers,existential_there_quantifiers_1,True,False,False,False,24,-74.2945556640625,-75.07711791992188,1
There is a drawing of schools irritating the Clintons.,There is every drawing of schools irritating the Clintons.,semantics,quantifiers,existential_there_quantifiers_1,True,False,False,False,25,-67.02339172363281,-76.05979919433594,1
There is an organization hurting Tammy.,There is every organization hurting Tammy.,semantics,quantifiers,existential_there_quantifiers_1,True,False,False,False,26,-41.344966888427734,-51.42259216308594,1
There were few daughters of Nancy badgering Alicia to see Renee.,There were all daughters of Nancy badgering Alicia to see Renee.,semantics,quantifiers,existential_there_quantifiers_1,True,False,False,False,27,-95.42597961425781,-95.36795043945312,0
There is a boy spinning around.,There is each boy spinning around.,semantics,quantifiers,existential_there_quantifiers_1,True,False,False,False,28,-32.84288787841797,-41.828216552734375,1
There are no mushrooms alarming Winston Churchill.,There are all mushrooms alarming Winston Churchill.,semantics,quantifiers,existential_there_quantifiers_1,True,False,False,False,29,-64.282470703125,-64.211669921875,0
There was a painting of that movie theater scaring many waitresses.,There was every painting of that movie theater scaring many waitresses.,semantics,quantifiers,existential_there_quantifiers_1,True,False,False,False,30,-86.13829803466797,-94.92214965820312,1
There were many lamps wasting away.,There were all lamps wasting away.,semantics,quantifiers,existential_there_quantifiers_1,True,False,False,False,31,-42.47780990600586,-42.281341552734375,0
There weren't few shows about politics upsetting Andrew.,There weren't most shows about politics upsetting Andrew.,semantics,quantifiers,existential_there_quantifiers_1,True,False,False,False,32,-73.08168029785156,-74.55484008789062,1
There isn't a casserole scaring Sharon.,There isn't each casserole scaring Sharon.,semantics,quantifiers,existential_there_quantifiers_1,True,False,False,False,33,-51.266883850097656,-61.953556060791016,1
There were many cousins of Rhonda boycotting most lakes.,There were most cousins of Rhonda boycotting most lakes.,semantics,quantifiers,existential_there_quantifiers_1,True,False,False,False,34,-82.18157958984375,-85.84651184082031,1
There was a book scaring Kimberley.,There was each book scaring Kimberley.,semantics,quantifiers,existential_there_quantifiers_1,True,False,False,False,35,-48.143367767333984,-56.839439392089844,1
There were few rivers disappearing.,There were all rivers disappearing.,semantics,quantifiers,existential_there_quantifiers_1,True,False,False,False,36,-36.937255859375,-36.49379348754883,0
There were few stories about politics astounding Alan.,There were most stories about politics astounding Alan.,semantics,quantifiers,existential_there_quantifiers_1,True,False,False,False,37,-67.8623046875,-69.64952087402344,1
There isn't a truck existing.,There isn't every truck existing.,semantics,quantifiers,existential_there_quantifiers_1,True,False,False,False,38,-39.013858795166016,-47.487548828125,1
There isn't a cashier eating.,There isn't each cashier eating.,semantics,quantifiers,existential_there_quantifiers_1,True,False,False,False,39,-41.468177795410156,-50.32634735107422,1
There are some cats hurting Tiffany.,There are all cats hurting Tiffany.,semantics,quantifiers,existential_there_quantifiers_1,True,False,False,False,40,-45.03736877441406,-45.82267761230469,1
There isn't a grandson of Becky cheering.,There isn't each grandson of Becky cheering.,semantics,quantifiers,existential_there_quantifiers_1,True,False,False,False,41,-54.76494598388672,-64.9707260131836,1
There isn't a daughter of Mitchell astounding some boy.,There isn't each daughter of Mitchell astounding some boy.,semantics,quantifiers,existential_there_quantifiers_1,True,False,False,False,42,-70.06867980957031,-80.00537109375,1
There aren't few guests asking all nieces of Sandra to attack Alicia.,There aren't most guests asking all nieces of Sandra to attack Alicia.,semantics,quantifiers,existential_there_quantifiers_1,True,False,False,False,43,-107.75312042236328,-110.52757263183594,1
There weren't few mushrooms scaring some governments.,There weren't most mushrooms scaring some governments.,semantics,quantifiers,existential_there_quantifiers_1,True,False,False,False,44,-66.29840850830078,-69.2309799194336,1
There are many friends of Charles intending to disagree.,There are all friends of Charles intending to disagree.,semantics,quantifiers,existential_there_quantifiers_1,True,False,False,False,45,-54.603515625,-57.10387420654297,1
There were some associations interacting.,There were all associations interacting.,semantics,quantifiers,existential_there_quantifiers_1,True,False,False,False,46,-39.957942962646484,-40.623592376708984,1
There is a book about the Borgias disturbing Ann.,There is every book about the Borgias disturbing Ann.,semantics,quantifiers,existential_there_quantifiers_1,True,False,False,False,47,-66.5572280883789,-74.97528839111328,1
There weren't many books about Harvard University impressing Daniel.,There weren't most books about Harvard University impressing Daniel.,semantics,quantifiers,existential_there_quantifiers_1,True,False,False,False,48,-72.95233154296875,-79.77584838867188,1
There wasn't a mountain existing.,There wasn't each mountain existing.,semantics,quantifiers,existential_there_quantifiers_1,True,False,False,False,49,-39.67714309692383,-47.87826156616211,1
There wasn't an icicle confusing Martin.,There wasn't every icicle confusing Martin.,semantics,quantifiers,existential_there_quantifiers_1,True,False,False,False,50,-52.901954650878906,-62.780086517333984,1
There weren't many essays about the Impressionists disagreeing with Michelle.,There weren't most essays about the Impressionists disagreeing with Michelle.,semantics,quantifiers,existential_there_quantifiers_1,True,False,False,False,51,-84.474609375,-90.16017150878906,1
There is a muffin boring Winston Churchill.,There is each muffin boring Winston Churchill.,semantics,quantifiers,existential_there_quantifiers_1,True,False,False,False,52,-56.683815002441406,-68.16045379638672,1
There are some reports about Monet disagreeing with Janice.,There are all reports about Monet disagreeing with Janice.,semantics,quantifiers,existential_there_quantifiers_1,True,False,False,False,53,-84.51940155029297,-85.94677734375,1
There is a casserole stunning Carlos.,There is each casserole stunning Carlos.,semantics,quantifiers,existential_there_quantifiers_1,True,False,False,False,54,-53.15483093261719,-65.44009399414062,1
There was a box astounding that doctor.,There was each box astounding that doctor.,semantics,quantifiers,existential_there_quantifiers_1,True,False,False,False,55,-51.91071701049805,-62.75739288330078,1
There was a glove bothering Kristen.,There was every glove bothering Kristen.,semantics,quantifiers,existential_there_quantifiers_1,True,False,False,False,56,-46.475860595703125,-55.95441436767578,1
There were few dresses soaking.,There were most dresses soaking.,semantics,quantifiers,existential_there_quantifiers_1,True,False,False,False,57,-40.88258361816406,-43.00957489013672,1
There were few cakes disgusting Bill.,There were most cakes disgusting Bill.,semantics,quantifiers,existential_there_quantifiers_1,True,False,False,False,58,-53.26246643066406,-55.901268005371094,1
There were some movies about the Clintons boring Amanda.,There were all movies about the Clintons boring Amanda.,semantics,quantifiers,existential_there_quantifiers_1,True,False,False,False,59,-71.92825317382812,-74.4940185546875,1
There isn't a pepper bothering every guy.,There isn't every pepper bothering every guy.,semantics,quantifiers,existential_there_quantifiers_1,True,False,False,False,60,-52.78396987915039,-59.44224548339844,1
There was a son of Monica motivating Kirsten's associate to cry.,There was every son of Monica motivating Kirsten's associate to cry.,semantics,quantifiers,existential_there_quantifiers_1,True,False,False,False,61,-88.06004333496094,-94.94622802734375,1
There is a candle looking like a lot of drawings.,There is every candle looking like a lot of drawings.,semantics,quantifiers,existential_there_quantifiers_1,True,False,False,False,62,-45.984283447265625,-53.51463317871094,1
There were no movies about the Lutherans shocking Dana.,There were most movies about the Lutherans shocking Dana.,semantics,quantifiers,existential_there_quantifiers_1,True,False,False,False,63,-80.29180908203125,-84.58828735351562,1
There were no movies about Harvard University alarming Omar.,There were all movies about Harvard University alarming Omar.,semantics,quantifiers,existential_there_quantifiers_1,True,False,False,False,64,-75.00270080566406,-78.1875228881836,1
There aren't many doors scaring Brian.,There aren't all doors scaring Brian.,semantics,quantifiers,existential_there_quantifiers_1,True,False,False,False,65,-51.12867736816406,-53.017303466796875,1
There weren't many gates looking like most photographs.,There weren't most gates looking like most photographs.,semantics,quantifiers,existential_there_quantifiers_1,True,False,False,False,66,-56.290889739990234,-61.87164306640625,1
There isn't a museum failing to surrender.,There isn't every museum failing to surrender.,semantics,quantifiers,existential_there_quantifiers_1,True,False,False,False,67,-46.76628875732422,-56.99763107299805,1
There is an organization pushing a driver's daughters to have some windows.,There is each organization pushing a driver's daughters to have some windows.,semantics,quantifiers,existential_there_quantifiers_1,True,False,False,False,68,-77.23564147949219,-90.01605987548828,1
There are few prints of a lot of paintings astounding Sabrina.,There are most prints of a lot of paintings astounding Sabrina.,semantics,quantifiers,existential_there_quantifiers_1,True,False,False,False,69,-79.29591369628906,-79.52590942382812,1
There is a man appearing to study.,There is every man appearing to study.,semantics,quantifiers,existential_there_quantifiers_1,True,False,False,False,70,-36.33892059326172,-42.31925964355469,1
There were few pants shocking Charles.,There were all pants shocking Charles.,semantics,quantifiers,existential_there_quantifiers_1,True,False,False,False,71,-57.55940628051758,-55.116458892822266,0
There was a documentary about Harvard University shocking Sheila.,There was every documentary about Harvard University shocking Sheila.,semantics,quantifiers,existential_there_quantifiers_1,True,False,False,False,72,-64.31620788574219,-73.49267578125,1
There weren't many commentaries about Winston Churchill aggravating Eric.,There weren't most commentaries about Winston Churchill aggravating Eric.,semantics,quantifiers,existential_there_quantifiers_1,True,False,False,False,73,-96.87407684326172,-100.67976379394531,1
There wasn't a restaurant existing.,There wasn't every restaurant existing.,semantics,quantifiers,existential_there_quantifiers_1,True,False,False,False,74,-39.331993103027344,-46.893035888671875,1
There were few cars hurting Keith.,There were most cars hurting Keith.,semantics,quantifiers,existential_there_quantifiers_1,True,False,False,False,75,-48.58354949951172,-52.06977462768555,1
There wasn't a lady obliging Victoria to smile.,There wasn't every lady obliging Victoria to smile.,semantics,quantifiers,existential_there_quantifiers_1,True,False,False,False,76,-62.85871124267578,-70.44829559326172,1
There were no actors attacking Jessica.,There were all actors attacking Jessica.,semantics,quantifiers,existential_there_quantifiers_1,True,False,False,False,77,-44.93994140625,-46.6143798828125,1
There are some eggplants disgusting Meredith.,There are all eggplants disgusting Meredith.,semantics,quantifiers,existential_there_quantifiers_1,True,False,False,False,78,-64.26872253417969,-68.06571960449219,1
There are some hats stunning Amanda.,There are most hats stunning Amanda.,semantics,quantifiers,existential_there_quantifiers_1,True,False,False,False,79,-51.80083084106445,-55.91028594970703,1
There are no customers hiding.,There are all customers hiding.,semantics,quantifiers,existential_there_quantifiers_1,True,False,False,False,80,-30.803743362426758,-33.05883026123047,1
There was a shoe astounding Jacqueline.,There was each shoe astounding Jacqueline.,semantics,quantifiers,existential_there_quantifiers_1,True,False,False,False,81,-53.772220611572266,-63.34123992919922,1
There was a glacier shocking Ruth.,There was every glacier shocking Ruth.,semantics,quantifiers,existential_there_quantifiers_1,True,False,False,False,82,-49.771053314208984,-60.27555465698242,1
There weren't many pies alarming Theodore.,There weren't all pies alarming Theodore.,semantics,quantifiers,existential_there_quantifiers_1,True,False,False,False,83,-61.646793365478516,-64.40292358398438,1
There was a couch embarrassing Julia.,There was each couch embarrassing Julia.,semantics,quantifiers,existential_there_quantifiers_1,True,False,False,False,84,-45.9217529296875,-57.08041763305664,1
There isn't a pedestrian arriving at some hills.,There isn't every pedestrian arriving at some hills.,semantics,quantifiers,existential_there_quantifiers_1,True,False,False,False,85,-54.54454803466797,-62.488895416259766,1
There weren't few drawings of Diana worrying Jerry.,There weren't most drawings of Diana worrying Jerry.,semantics,quantifiers,existential_there_quantifiers_1,True,False,False,False,86,-69.17107391357422,-71.44322204589844,1
There isn't a popsicle condensing.,There isn't every popsicle condensing.,semantics,quantifiers,existential_there_quantifiers_1,True,False,False,False,87,-51.70488739013672,-60.138099670410156,1
There was a glass appearing.,There was every glass appearing.,semantics,quantifiers,existential_there_quantifiers_1,True,False,False,False,88,-32.771942138671875,-40.151580810546875,1
There weren't many books existing.,There weren't all books existing.,semantics,quantifiers,existential_there_quantifiers_1,True,False,False,False,89,-40.22542953491211,-44.504127502441406,1
There aren't many mirrors dropping.,There aren't all mirrors dropping.,semantics,quantifiers,existential_there_quantifiers_1,True,False,False,False,90,-40.0942497253418,-41.21654510498047,1
There isn't a university learning who work hard.,There isn't every university learning who work hard.,semantics,quantifiers,existential_there_quantifiers_1,True,False,False,False,91,-56.598487854003906,-63.83087158203125,1
There is a newspaper article existing.,There is each newspaper article existing.,semantics,quantifiers,existential_there_quantifiers_1,True,False,False,False,92,-40.92424392700195,-51.93578338623047,1
There was a print of a rabbit upsetting Brad.,There was every print of a rabbit upsetting Brad.,semantics,quantifiers,existential_there_quantifiers_1,True,False,False,False,93,-60.5765495300293,-68.94822692871094,1
There is a child examining some play.,There is each child examining some play.,semantics,quantifiers,existential_there_quantifiers_1,True,False,False,False,94,-41.994625091552734,-49.28251647949219,1
There is a nose stunning Martin.,There is each nose stunning Martin.,semantics,quantifiers,existential_there_quantifiers_1,True,False,False,False,95,-44.14918518066406,-56.75716018676758,1
There are many planes boring Diane.,There are all planes boring Diane.,semantics,quantifiers,existential_there_quantifiers_1,True,False,False,False,96,-49.26193618774414,-50.451454162597656,1
There were no reports falling.,There were all reports falling.,semantics,quantifiers,existential_there_quantifiers_1,True,False,False,False,97,-33.821044921875,-35.81837463378906,1
There aren't many windows boring Walter.,There aren't most windows boring Walter.,semantics,quantifiers,existential_there_quantifiers_1,True,False,False,False,98,-52.538063049316406,-59.217987060546875,1
There isn't a cashier advising Monica's nephews to argue.,There isn't each cashier advising Monica's nephews to argue.,semantics,quantifiers,existential_there_quantifiers_1,True,False,False,False,99,-84.76173400878906,-92.58866882324219,1
There were no senators arguing about the senator.,There were most senators arguing about the senator.,semantics,quantifiers,existential_there_quantifiers_1,True,False,False,False,100,-47.08319091796875,-51.18894577026367,1
There were no organizations thinking about who shocks this waitress.,There were all organizations thinking about who shocks this waitress.,semantics,quantifiers,existential_there_quantifiers_1,True,False,False,False,101,-73.61255645751953,-74.88562774658203,1
There are some shirts wrinkling.,There are most shirts wrinkling.,semantics,quantifiers,existential_there_quantifiers_1,True,False,False,False,102,-40.908348083496094,-45.774261474609375,1
There were no socks irritating Aaron.,There were most socks irritating Aaron.,semantics,quantifiers,existential_there_quantifiers_1,True,False,False,False,103,-50.80695343017578,-58.74943923950195,1
There was a school fighting.,There was each school fighting.,semantics,quantifiers,existential_there_quantifiers_1,True,False,False,False,104,-30.0684871673584,-39.40313720703125,1
There is a pepper falling.,There is each pepper falling.,semantics,quantifiers,existential_there_quantifiers_1,True,False,False,False,105,-33.6285400390625,-44.69195556640625,1
There wasn't a cake baking.,There wasn't every cake baking.,semantics,quantifiers,existential_there_quantifiers_1,True,False,False,False,106,-34.9638671875,-41.88825225830078,1
There was a cup distracting this driver.,There was every cup distracting this driver.,semantics,quantifiers,existential_there_quantifiers_1,True,False,False,False,107,-50.55601501464844,-58.222572326660156,1
There are no hospitals falling.,There are all hospitals falling.,semantics,quantifiers,existential_there_quantifiers_1,True,False,False,False,108,-33.91585922241211,-35.37565994262695,1
There isn't a movie theater looking like some painting.,There isn't each movie theater looking like some painting.,semantics,quantifiers,existential_there_quantifiers_1,True,False,False,False,109,-55.57111740112305,-68.16378021240234,1
There was a car vanishing.,There was each car vanishing.,semantics,quantifiers,existential_there_quantifiers_1,True,False,False,False,110,-30.15733528137207,-41.160301208496094,1
There was a box distracting Harvard University.,There was each box distracting Harvard University.,semantics,quantifiers,existential_there_quantifiers_1,True,False,False,False,111,-50.26131057739258,-61.984535217285156,1
There are many spotlights alarming Diane.,There are all spotlights alarming Diane.,semantics,quantifiers,existential_there_quantifiers_1,True,False,False,False,112,-62.87187957763672,-66.0108413696289,1
There was a window annoying Phillip.,There was each window annoying Phillip.,semantics,quantifiers,existential_there_quantifiers_1,True,False,False,False,113,-46.908058166503906,-58.995243072509766,1
There are some prints of Ella stunning Valerie.,There are all prints of Ella stunning Valerie.,semantics,quantifiers,existential_there_quantifiers_1,True,False,False,False,114,-66.20341491699219,-68.55503845214844,1
There was a plate falling.,There was each plate falling.,semantics,quantifiers,existential_there_quantifiers_1,True,False,False,False,115,-31.372957229614258,-40.67700958251953,1
There aren't many movies distracting Kristen.,There aren't most movies distracting Kristen.,semantics,quantifiers,existential_there_quantifiers_1,True,False,False,False,116,-52.014678955078125,-57.63449478149414,1
There were many candles worrying Stephanie.,There were most candles worrying Stephanie.,semantics,quantifiers,existential_there_quantifiers_1,True,False,False,False,117,-51.67066192626953,-56.97452163696289,1
There isn't a legislature listening to Sherry.,There isn't every legislature listening to Sherry.,semantics,quantifiers,existential_there_quantifiers_1,True,False,False,False,118,-52.29018020629883,-60.035125732421875,1
There is an adult departing.,There is each adult departing.,semantics,quantifiers,existential_there_quantifiers_1,True,False,False,False,119,-34.527198791503906,-44.08863830566406,1
There are many shoes irritating Brett.,There are most shoes irritating Brett.,semantics,quantifiers,existential_there_quantifiers_1,True,False,False,False,120,-52.8504524230957,-58.37760543823242,1
There are some vases upsetting Janice.,There are all vases upsetting Janice.,semantics,quantifiers,existential_there_quantifiers_1,True,False,False,False,121,-57.99943161010742,-58.98848342895508,1
