sentence_good,sentence_bad,field,linguistics_term,UID,simple_LM_method,one_prefix_method,two_prefix_method,lexically_identical,pair_id,good_prob,bad_prob,correct
There are no turtles distracting Lori.,There are most turtles distracting Lori.,semantics,quantifiers,existential_there_quantifiers_1,True,False,False,False,247,-51.16850280761719,-55.11610412597656,1
There aren't many museums enticing many schools to forget Erin.,There aren't most museums enticing many schools to forget Erin.,semantics,quantifiers,existential_there_quantifiers_1,True,False,False,False,248,-80.28524780273438,-86.76704406738281,1
There was a niece of Erin singing.,There was every niece of Erin singing.,semantics,quantifiers,existential_there_quantifiers_1,True,False,False,False,249,-43.82349395751953,-50.83145523071289,1
There are no casseroles burning.,There are all casseroles burning.,semantics,quantifiers,existential_there_quantifiers_1,True,False,False,False,250,-44.27593231201172,-46.065242767333984,1
There is an eggplant worrying April.,There is each eggplant worrying April.,semantics,quantifiers,existential_there_quantifiers_1,True,False,False,False,251,-53.03089141845703,-64.30020141601562,1
There is a bike aggravating Alexander.,There is each bike aggravating Alexander.,semantics,quantifiers,existential_there_quantifiers_1,True,False,False,False,252,-50.40027618408203,-63.55984878540039,1
There weren't many nephews of Aaron revealing some box.,There weren't most nephews of Aaron revealing some box.,semantics,quantifiers,existential_there_quantifiers_1,True,False,False,False,253,-75.93540954589844,-80.96800231933594,1
There are few jackets disgusting Aaron.,There are all jackets disgusting Aaron.,semantics,quantifiers,existential_there_quantifiers_1,True,False,False,False,254,-55.001495361328125,-52.5294189453125,0
There isn't a mouth disgusting Rachelle.,There isn't every mouth disgusting Rachelle.,semantics,quantifiers,existential_there_quantifiers_1,True,False,False,False,255,-57.688568115234375,-66.58229064941406,1
There were some cashiers examining this book.,There were most cashiers examining this book.,semantics,quantifiers,existential_there_quantifiers_1,True,False,False,False,256,-54.50111389160156,-58.787147521972656,1
There were some men surrendering.,There were most men surrendering.,semantics,quantifiers,existential_there_quantifiers_1,True,False,False,False,257,-36.373573303222656,-38.5342903137207,1
There were some fish looking like a print.,There were most fish looking like a print.,semantics,quantifiers,existential_there_quantifiers_1,True,False,False,False,258,-48.84868240356445,-54.696022033691406,1
There was a lady doubting some senator shouldn't motivate some woman to pass this glacier.,There was each lady doubting some senator shouldn't motivate some woman to pass this glacier.,semantics,quantifiers,existential_there_quantifiers_1,True,False,False,False,259,-113.33753967285156,-123.02755737304688,1
There isn't a library forcing Florence to break a wheelbarrow.,There isn't each library forcing Florence to break a wheelbarrow.,semantics,quantifiers,existential_there_quantifiers_1,True,False,False,False,260,-76.88043212890625,-87.33878326416016,1
There weren't few mountains upsetting Karen.,There weren't most mountains upsetting Karen.,semantics,quantifiers,existential_there_quantifiers_1,True,False,False,False,261,-58.36309814453125,-59.37333297729492,1
There were no stories shocking Natalie.,There were most stories shocking Natalie.,semantics,quantifiers,existential_there_quantifiers_1,True,False,False,False,262,-50.56451416015625,-53.62942123413086,1
There wasn't a grandfather of the teenagers descending this hill.,There wasn't each grandfather of the teenagers descending this hill.,semantics,quantifiers,existential_there_quantifiers_1,True,False,False,False,263,-67.29056549072266,-76.7695541381836,1
There were some movie theaters upsetting Jason.,There were all movie theaters upsetting Jason.,semantics,quantifiers,existential_there_quantifiers_1,True,False,False,False,264,-59.652809143066406,-62.52265548706055,1
There wasn't a grocery store disappearing.,There wasn't every grocery store disappearing.,semantics,quantifiers,existential_there_quantifiers_1,True,False,False,False,265,-40.77668762207031,-49.313087463378906,1
There isn't a grandmother of Eva astounding Rachel.,There isn't each grandmother of Eva astounding Rachel.,semantics,quantifiers,existential_there_quantifiers_1,True,False,False,False,266,-66.71929931640625,-77.80827331542969,1
There aren't few prints of those hats distracting Douglas.,There aren't most prints of those hats distracting Douglas.,semantics,quantifiers,existential_there_quantifiers_1,True,False,False,False,267,-71.37803649902344,-74.549072265625,1
There wasn't a closet astounding Mary.,There wasn't every closet astounding Mary.,semantics,quantifiers,existential_there_quantifiers_1,True,False,False,False,268,-54.4696044921875,-61.858768463134766,1
There was a projector worrying Richard.,There was every projector worrying Richard.,semantics,quantifiers,existential_there_quantifiers_1,True,False,False,False,269,-47.844600677490234,-56.16572952270508,1
There was a sketch bothering Timothy.,There was each sketch bothering Timothy.,semantics,quantifiers,existential_there_quantifiers_1,True,False,False,False,270,-44.89455032348633,-55.16313171386719,1
There weren't few shows about art aggravating Paul.,There weren't most shows about art aggravating Paul.,semantics,quantifiers,existential_there_quantifiers_1,True,False,False,False,271,-73.31538391113281,-74.50041198730469,1
There was a legislature believing waiters to cooperate.,There was every legislature believing waiters to cooperate.,semantics,quantifiers,existential_there_quantifiers_1,True,False,False,False,272,-65.49372100830078,-72.18778228759766,1
There was a public park stunning that government.,There was each public park stunning that government.,semantics,quantifiers,existential_there_quantifiers_1,True,False,False,False,273,-55.05260467529297,-68.61805725097656,1
There was a projector stunning Robert.,There was each projector stunning Robert.,semantics,quantifiers,existential_there_quantifiers_1,True,False,False,False,274,-51.24407958984375,-63.12657928466797,1
There is a rabbit wasting away.,There is each rabbit wasting away.,semantics,quantifiers,existential_there_quantifiers_1,True,False,False,False,275,-38.34236526489258,-48.910438537597656,1
There were no public parks alarming Curtis.,There were all public parks alarming Curtis.,semantics,quantifiers,existential_there_quantifiers_1,True,False,False,False,276,-62.079071044921875,-64.7852783203125,1
There wasn't a sketch aggravating Tiffany.,There wasn't every sketch aggravating Tiffany.,semantics,quantifiers,existential_there_quantifiers_1,True,False,False,False,277,-53.340736389160156,-61.84893798828125,1
There weren't many senators hiring Donna.,There weren't all senators hiring Donna.,semantics,quantifiers,existential_there_quantifiers_1,True,False,False,False,278,-55.56092071533203,-58.581905364990234,1
There are some plays about art disturbing Pamela.,There are most plays about art disturbing Pamela.,semantics,quantifiers,existential_there_quantifiers_1,True,False,False,False,279,-65.15916442871094,-68.18578338623047,1
There isn't a movie theater irritating Edward.,There isn't every movie theater irritating Edward.,semantics,quantifiers,existential_there_quantifiers_1,True,False,False,False,280,-58.77729797363281,-68.86611938476562,1
There is a legislature thinking about who say the carriage hadn't impressed Sara.,There is every legislature thinking about who say the carriage hadn't impressed Sara.,semantics,quantifiers,existential_there_quantifiers_1,True,False,False,False,281,-91.99627685546875,-99.16351318359375,1
There was a school failing to nod.,There was every school failing to nod.,semantics,quantifiers,existential_there_quantifiers_1,True,False,False,False,282,-45.30963134765625,-52.176876068115234,1
There was a grandmother of these doctors pressuring Colleen to heal Homer.,There was every grandmother of these doctors pressuring Colleen to heal Homer.,semantics,quantifiers,existential_there_quantifiers_1,True,False,False,False,283,-91.13614654541016,-97.38832092285156,1
There were no dogs disgusting dancers.,There were all dogs disgusting dancers.,semantics,quantifiers,existential_there_quantifiers_1,True,False,False,False,284,-46.57844543457031,-47.542991638183594,1
There was an essay boring Carla.,There was every essay boring Carla.,semantics,quantifiers,existential_there_quantifiers_1,True,False,False,False,285,-48.13451385498047,-55.45201873779297,1
There were many cafes alarming Sonia.,There were most cafes alarming Sonia.,semantics,quantifiers,existential_there_quantifiers_1,True,False,False,False,286,-57.82721710205078,-61.84424591064453,1
There were some hospitals assembling.,There were most hospitals assembling.,semantics,quantifiers,existential_there_quantifiers_1,True,False,False,False,287,-37.52830123901367,-40.93016815185547,1
There was a print falling.,There was each print falling.,semantics,quantifiers,existential_there_quantifiers_1,True,False,False,False,288,-35.26001739501953,-44.85662841796875,1
There were some nieces of Helen urging Christina's senator to discuss those adults.,There were most nieces of Helen urging Christina's senator to discuss those adults.,semantics,quantifiers,existential_there_quantifiers_1,True,False,False,False,289,-114.2794189453125,-118.6273422241211,1
There was a wheelbarrow vanishing.,There was every wheelbarrow vanishing.,semantics,quantifiers,existential_there_quantifiers_1,True,False,False,False,290,-38.33732223510742,-47.71458435058594,1
There were no sketches of Ann boring every woman.,There were most sketches of Ann boring every woman.,semantics,quantifiers,existential_there_quantifiers_1,True,False,False,False,291,-64.9433822631836,-68.94570922851562,1
There weren't many patients happening to wake up.,There weren't all patients happening to wake up.,semantics,quantifiers,existential_there_quantifiers_1,True,False,False,False,292,-45.660362243652344,-48.75453186035156,1
There is a box bothering Anna.,There is each box bothering Anna.,semantics,quantifiers,existential_there_quantifiers_1,True,False,False,False,293,-39.13114547729492,-49.670318603515625,1
There are no forks slipping.,There are all forks slipping.,semantics,quantifiers,existential_there_quantifiers_1,True,False,False,False,294,-38.564781188964844,-40.02461242675781,1
There wasn't a granddaughter of Ella fixing most wheelbarrows.,There wasn't each granddaughter of Ella fixing most wheelbarrows.,semantics,quantifiers,existential_there_quantifiers_1,True,False,False,False,295,-77.36951446533203,-87.18621826171875,1
There weren't many windows chipping.,There weren't all windows chipping.,semantics,quantifiers,existential_there_quantifiers_1,True,False,False,False,296,-42.60649108886719,-43.787330627441406,1
There isn't a muffin worrying Tamara.,There isn't each muffin worrying Tamara.,semantics,quantifiers,existential_there_quantifiers_1,True,False,False,False,297,-56.04142761230469,-67.39625549316406,1
There are no trucks steering.,There are most trucks steering.,semantics,quantifiers,existential_there_quantifiers_1,True,False,False,False,298,-37.289730072021484,-41.72028350830078,1
There were some committees boring Eric.,There were most committees boring Eric.,semantics,quantifiers,existential_there_quantifiers_1,True,False,False,False,299,-53.650882720947266,-55.677032470703125,1
There is a book annoying Tamara.,There is each book annoying Tamara.,semantics,quantifiers,existential_there_quantifiers_1,True,False,False,False,300,-48.15741729736328,-59.30016326904297,1
There wasn't a play about Spain boring Laura.,There wasn't each play about Spain boring Laura.,semantics,quantifiers,existential_there_quantifiers_1,True,False,False,False,301,-62.30165100097656,-71.78926086425781,1
There were no prints of most cafes disappearing.,There were most prints of most cafes disappearing.,semantics,quantifiers,existential_there_quantifiers_1,True,False,False,False,302,-59.48149108886719,-64.83615112304688,1
There isn't a skirt looking like the photographs.,There isn't each skirt looking like the photographs.,semantics,quantifiers,existential_there_quantifiers_1,True,False,False,False,303,-45.40393829345703,-55.287017822265625,1
There wasn't a drawing aggravating Caroline.,There wasn't each drawing aggravating Caroline.,semantics,quantifiers,existential_there_quantifiers_1,True,False,False,False,304,-51.16901397705078,-62.24461364746094,1
There are many muffins scorching.,There are all muffins scorching.,semantics,quantifiers,existential_there_quantifiers_1,True,False,False,False,305,-41.10139846801758,-42.491607666015625,1
There was a senator hugging Judy.,There was every senator hugging Judy.,semantics,quantifiers,existential_there_quantifiers_1,True,False,False,False,306,-42.80397033691406,-50.86434555053711,1
There weren't many mirrors worrying Frank.,There weren't most mirrors worrying Frank.,semantics,quantifiers,existential_there_quantifiers_1,True,False,False,False,307,-54.32378005981445,-59.523677825927734,1
There wasn't a book about politics bothering Barbara.,There wasn't each book about politics bothering Barbara.,semantics,quantifiers,existential_there_quantifiers_1,True,False,False,False,308,-55.320960998535156,-66.45703887939453,1
There are some chairs distracting Alicia.,There are most chairs distracting Alicia.,semantics,quantifiers,existential_there_quantifiers_1,True,False,False,False,309,-49.80068588256836,-54.05803680419922,1
There aren't few plays about art disagreeing.,There aren't all plays about art disagreeing.,semantics,quantifiers,existential_there_quantifiers_1,True,False,False,False,310,-65.99445343017578,-64.45771026611328,0
There isn't a father of Randolf exiting those restaurants.,There isn't each father of Randolf exiting those restaurants.,semantics,quantifiers,existential_there_quantifiers_1,True,False,False,False,311,-81.61043548583984,-92.35237884521484,1
There are few guests insulting all actresses.,There are all guests insulting all actresses.,semantics,quantifiers,existential_there_quantifiers_1,True,False,False,False,312,-56.049949645996094,-55.02312088012695,0
There isn't a cake astounding Rachel.,There isn't every cake astounding Rachel.,semantics,quantifiers,existential_there_quantifiers_1,True,False,False,False,313,-50.26528549194336,-57.60472869873047,1
There were many fish climbing down mountains.,There were all fish climbing down mountains.,semantics,quantifiers,existential_there_quantifiers_1,True,False,False,False,314,-44.53655242919922,-46.213497161865234,1
There wasn't a cashier boycotting an association.,There wasn't each cashier boycotting an association.,semantics,quantifiers,existential_there_quantifiers_1,True,False,False,False,315,-62.299346923828125,-71.38804626464844,1
There was a drawing of Melissa embarrassing Gregory.,There was every drawing of Melissa embarrassing Gregory.,semantics,quantifiers,existential_there_quantifiers_1,True,False,False,False,316,-58.671295166015625,-67.61634826660156,1
There wasn't a jacket vanishing.,There wasn't every jacket vanishing.,semantics,quantifiers,existential_there_quantifiers_1,True,False,False,False,317,-39.31718444824219,-46.5471305847168,1
There are many reports about the Lutherans impressing many banks.,There are most reports about the Lutherans impressing many banks.,semantics,quantifiers,existential_there_quantifiers_1,True,False,False,False,318,-83.34425354003906,-88.93455505371094,1
There were some lamps shocking Russell.,There were all lamps shocking Russell.,semantics,quantifiers,existential_there_quantifiers_1,True,False,False,False,319,-54.85741424560547,-55.63473129272461,1
There are few doors wasting away.,There are most doors wasting away.,semantics,quantifiers,existential_there_quantifiers_1,True,False,False,False,320,-42.35292053222656,-43.96414566040039,1
There were many nephews of some actor visiting Frank.,There were all nephews of some actor visiting Frank.,semantics,quantifiers,existential_there_quantifiers_1,True,False,False,False,321,-65.90032196044922,-66.6510009765625,1
There are no eyes bothering Grace.,There are most eyes bothering Grace.,semantics,quantifiers,existential_there_quantifiers_1,True,False,False,False,322,-41.71283721923828,-48.207489013671875,1
There are no public parks falling.,There are most public parks falling.,semantics,quantifiers,existential_there_quantifiers_1,True,False,False,False,323,-42.813533782958984,-44.525184631347656,1
There isn't a unicycle disappearing.,There isn't every unicycle disappearing.,semantics,quantifiers,existential_there_quantifiers_1,True,False,False,False,324,-46.02155303955078,-50.97361373901367,1
There were some libraries embarrassing Spain.,There were most libraries embarrassing Spain.,semantics,quantifiers,existential_there_quantifiers_1,True,False,False,False,325,-54.9097900390625,-57.520111083984375,1
There wasn't a mall wasting away.,There wasn't each mall wasting away.,semantics,quantifiers,existential_there_quantifiers_1,True,False,False,False,326,-44.15033721923828,-54.134857177734375,1
There isn't a hill impressing Regina.,There isn't each hill impressing Regina.,semantics,quantifiers,existential_there_quantifiers_1,True,False,False,False,327,-55.08585739135742,-67.20108032226562,1
There weren't few hamsters astounding Nicole.,There weren't all hamsters astounding Nicole.,semantics,quantifiers,existential_there_quantifiers_1,True,False,False,False,328,-66.46458435058594,-64.614990234375,0
There aren't few cars aggravating Laurie.,There aren't most cars aggravating Laurie.,semantics,quantifiers,existential_there_quantifiers_1,True,False,False,False,329,-57.56013870239258,-61.555442810058594,1
There are no chairs falling.,There are most chairs falling.,semantics,quantifiers,existential_there_quantifiers_1,True,False,False,False,330,-33.573265075683594,-37.09352111816406,1
There was a restaurant disturbing Melinda.,There was every restaurant disturbing Melinda.,semantics,quantifiers,existential_there_quantifiers_1,True,False,False,False,331,-47.54077911376953,-56.21148681640625,1
There were few candles worrying Rachel.,There were most candles worrying Rachel.,semantics,quantifiers,existential_there_quantifiers_1,True,False,False,False,332,-51.37667465209961,-54.875648498535156,1
There were some movies disagreeing.,There were most movies disagreeing.,semantics,quantifiers,existential_there_quantifiers_1,True,False,False,False,333,-44.412322998046875,-46.98707580566406,1
There isn't a daughter of Leslie compelling Andrew to talk to Eva.,There isn't every daughter of Leslie compelling Andrew to talk to Eva.,semantics,quantifiers,existential_there_quantifiers_1,True,False,False,False,334,-77.2247085571289,-85.84159851074219,1
There wasn't a sweater twisting.,There wasn't every sweater twisting.,semantics,quantifiers,existential_there_quantifiers_1,True,False,False,False,335,-40.577388763427734,-48.59662628173828,1
There were no candles wasting away.,There were most candles wasting away.,semantics,quantifiers,existential_there_quantifiers_1,True,False,False,False,336,-39.621673583984375,-46.745391845703125,1
There are no daughters of Stacey cooking.,There are all daughters of Stacey cooking.,semantics,quantifiers,existential_there_quantifiers_1,True,False,False,False,337,-49.94490051269531,-51.45058059692383,1
There weren't many drivers responding.,There weren't most drivers responding.,semantics,quantifiers,existential_there_quantifiers_1,True,False,False,False,338,-41.72665786743164,-47.544334411621094,1
There was a grandson of every customer disgusting Sheila.,There was every grandson of every customer disgusting Sheila.,semantics,quantifiers,existential_there_quantifiers_1,True,False,False,False,339,-66.78335571289062,-72.17427062988281,1
There wasn't a pedestrian finding out who didn't bake.,There wasn't every pedestrian finding out who didn't bake.,semantics,quantifiers,existential_there_quantifiers_1,True,False,False,False,340,-61.996395111083984,-70.52645111083984,1
There are few dishes distracting cashiers.,There are most dishes distracting cashiers.,semantics,quantifiers,existential_there_quantifiers_1,True,False,False,False,341,-56.800010681152344,-59.93678283691406,1
There wasn't a light astounding Brad.,There wasn't every light astounding Brad.,semantics,quantifiers,existential_there_quantifiers_1,True,False,False,False,342,-51.218772888183594,-59.24858856201172,1
There weren't many drivers inducing the Borgias to leave Tanya.,There weren't most drivers inducing the Borgias to leave Tanya.,semantics,quantifiers,existential_there_quantifiers_1,True,False,False,False,343,-84.80169677734375,-90.18408203125,1
There was a turtle embarrassing a lot of girls.,There was every turtle embarrassing a lot of girls.,semantics,quantifiers,existential_there_quantifiers_1,True,False,False,False,344,-54.03843307495117,-62.293888092041016,1
There isn't a play about the Lutherans alarming Samantha.,There isn't each play about the Lutherans alarming Samantha.,semantics,quantifiers,existential_there_quantifiers_1,True,False,False,False,345,-81.51121520996094,-90.83187103271484,1
There are few restaurants alarming Stephanie.,There are all restaurants alarming Stephanie.,semantics,quantifiers,existential_there_quantifiers_1,True,False,False,False,346,-56.916015625,-55.830867767333984,0
There were no governments realizing who wasn't spinning around.,There were all governments realizing who wasn't spinning around.,semantics,quantifiers,existential_there_quantifiers_1,True,False,False,False,347,-66.65974426269531,-67.72291564941406,1
There was a sock wasting away.,There was every sock wasting away.,semantics,quantifiers,existential_there_quantifiers_1,True,False,False,False,348,-40.98139190673828,-47.34278106689453,1
There are some prints of Cheryl shocking Edward.,There are most prints of Cheryl shocking Edward.,semantics,quantifiers,existential_there_quantifiers_1,True,False,False,False,349,-66.66285705566406,-70.86402893066406,1
There is a brother of Alan figuring out who shrug.,There is every brother of Alan figuring out who shrug.,semantics,quantifiers,existential_there_quantifiers_1,True,False,False,False,350,-66.03157806396484,-74.0471420288086,1
There is a chair shocking Becca.,There is every chair shocking Becca.,semantics,quantifiers,existential_there_quantifiers_1,True,False,False,False,351,-48.298179626464844,-54.78339767456055,1
There aren't many mountains astounding Florence.,There aren't most mountains astounding Florence.,semantics,quantifiers,existential_there_quantifiers_1,True,False,False,False,352,-54.96916961669922,-61.023040771484375,1
There are few birds alarming Tanya.,There are most birds alarming Tanya.,semantics,quantifiers,existential_there_quantifiers_1,True,False,False,False,353,-53.261207580566406,-53.716392517089844,1
There are no bikes maneuvering.,There are all bikes maneuvering.,semantics,quantifiers,existential_there_quantifiers_1,True,False,False,False,354,-43.59328842163086,-43.35173034667969,0
There are no waitresses curing all teachers.,There are most waitresses curing all teachers.,semantics,quantifiers,existential_there_quantifiers_1,True,False,False,False,355,-66.24019622802734,-70.37268829345703,1
There isn't an art gallery looking like the paintings.,There isn't every art gallery looking like the paintings.,semantics,quantifiers,existential_there_quantifiers_1,True,False,False,False,356,-52.0265007019043,-61.741310119628906,1
There is a college campus disgusting Vanessa.,There is each college campus disgusting Vanessa.,semantics,quantifiers,existential_there_quantifiers_1,True,False,False,False,357,-57.388248443603516,-68.07630920410156,1
There weren't few pants irritating a man.,There weren't all pants irritating a man.,semantics,quantifiers,existential_there_quantifiers_1,True,False,False,False,358,-59.22366714477539,-56.61447525024414,0
There are some muffins disgusting Mary.,There are all muffins disgusting Mary.,semantics,quantifiers,existential_there_quantifiers_1,True,False,False,False,359,-49.510040283203125,-51.008399963378906,1
There aren't few prints of Maria irritating that waitress.,There aren't all prints of Maria irritating that waitress.,semantics,quantifiers,existential_there_quantifiers_1,True,False,False,False,360,-76.25186157226562,-73.48463439941406,0
There wasn't a college campus shocking Beverly.,There wasn't each college campus shocking Beverly.,semantics,quantifiers,existential_there_quantifiers_1,True,False,False,False,361,-61.40250015258789,-72.76805114746094,1
There wasn't a muffin scorching.,There wasn't each muffin scorching.,semantics,quantifiers,existential_there_quantifiers_1,True,False,False,False,362,-40.85600280761719,-52.052589416503906,1
There wasn't a sketch of the rugs embarrassing Tara.,There wasn't each sketch of the rugs embarrassing Tara.,semantics,quantifiers,existential_there_quantifiers_1,True,False,False,False,363,-68.57276916503906,-78.95518493652344,1
There aren't few art galleries impressing Brian.,There aren't most art galleries impressing Brian.,semantics,quantifiers,existential_there_quantifiers_1,True,False,False,False,364,-70.93570709228516,-72.9212646484375,1
There was a son of William wishing to look like a lot of photographs.,There was each son of William wishing to look like a lot of photographs.,semantics,quantifiers,existential_there_quantifiers_1,True,False,False,False,365,-67.98097229003906,-75.03218078613281,1
There were some cousins of Becca thinking the pedestrian wasn't questioning Tamara.,There were all cousins of Becca thinking the pedestrian wasn't questioning Tamara.,semantics,quantifiers,existential_there_quantifiers_1,True,False,False,False,366,-104.7161865234375,-106.48832702636719,1
