sentence_good,sentence_bad,field,linguistics_term,UID,simple_LM_method,one_prefix_method,two_prefix_method,lexically_identical,pair_id,good_prob,bad_prob,correct
There isn't a river disappearing.,There isn't each river disappearing.,semantics,quantifiers,existential_there_quantifiers_1,True,False,False,False,735,-35.153160095214844,-46.09038543701172,1
There aren't few cups upsetting Stacey.,There aren't most cups upsetting Stacey.,semantics,quantifiers,existential_there_quantifiers_1,True,False,False,False,736,-58.34970474243164,-63.11886215209961,1
There was a pie aggravating Samuel.,There was each pie aggravating Samuel.,semantics,quantifiers,existential_there_quantifiers_1,True,False,False,False,737,-50.72061538696289,-61.41999816894531,1
There was a box distracting Tiffany.,There was each box distracting Tiffany.,semantics,quantifiers,existential_there_quantifiers_1,True,False,False,False,738,-45.21695327758789,-56.10051727294922,1
There wasn't a company looking to twist.,There wasn't every company looking to twist.,semantics,quantifiers,existential_there_quantifiers_1,True,False,False,False,739,-44.065338134765625,-52.868404388427734,1
There isn't a sweater disturbing Alexander.,There isn't every sweater disturbing Alexander.,semantics,quantifiers,existential_there_quantifiers_1,True,False,False,False,740,-52.344242095947266,-60.28730392456055,1
There is a hospital intending to argue about Nicole.,There is each hospital intending to argue about Nicole.,semantics,quantifiers,existential_there_quantifiers_1,True,False,False,False,741,-50.27136993408203,-63.625648498535156,1
There are few patients investigating who observed Meredith.,There are all patients investigating who observed Meredith.,semantics,quantifiers,existential_there_quantifiers_1,True,False,False,False,742,-63.123680114746094,-63.342350006103516,1
There are some schools annoying a doctor.,There are all schools annoying a doctor.,semantics,quantifiers,existential_there_quantifiers_1,True,False,False,False,743,-46.70304870605469,-48.6083984375,1
There wasn't a popsicle evaporating.,There wasn't every popsicle evaporating.,semantics,quantifiers,existential_there_quantifiers_1,True,False,False,False,744,-46.04804611206055,-54.73228073120117,1
There isn't a door boring every actress.,There isn't each door boring every actress.,semantics,quantifiers,existential_there_quantifiers_1,True,False,False,False,745,-54.587337493896484,-64.23438262939453,1
There isn't a sketch aggravating Monica.,There isn't every sketch aggravating Monica.,semantics,quantifiers,existential_there_quantifiers_1,True,False,False,False,746,-54.001190185546875,-61.53202819824219,1
There was a library prompting that legislature to donate.,There was each library prompting that legislature to donate.,semantics,quantifiers,existential_there_quantifiers_1,True,False,False,False,747,-67.46334838867188,-77.04974365234375,1
There isn't a screen stunning Brad.,There isn't every screen stunning Brad.,semantics,quantifiers,existential_there_quantifiers_1,True,False,False,False,748,-51.77056121826172,-61.31313705444336,1
There wasn't a legislature arguing.,There wasn't every legislature arguing.,semantics,quantifiers,existential_there_quantifiers_1,True,False,False,False,749,-42.47525405883789,-49.658634185791016,1
There were many icicles aggravating most doctors.,There were all icicles aggravating most doctors.,semantics,quantifiers,existential_there_quantifiers_1,True,False,False,False,750,-63.331398010253906,-63.0040283203125,0
There isn't a story about current events shocking cashiers.,There isn't every story about current events shocking cashiers.,semantics,quantifiers,existential_there_quantifiers_1,True,False,False,False,751,-76.67095184326172,-86.34632873535156,1
There were many cups disturbing Ella.,There were most cups disturbing Ella.,semantics,quantifiers,existential_there_quantifiers_1,True,False,False,False,752,-51.4632568359375,-57.306182861328125,1
There were no turtles looking like most paintings.,There were most turtles looking like most paintings.,semantics,quantifiers,existential_there_quantifiers_1,True,False,False,False,753,-55.14806365966797,-57.2789192199707,1
There were no teachers departing.,There were most teachers departing.,semantics,quantifiers,existential_there_quantifiers_1,True,False,False,False,754,-38.72236633300781,-41.47846221923828,1
There wasn't a child slumping over.,There wasn't each child slumping over.,semantics,quantifiers,existential_there_quantifiers_1,True,False,False,False,755,-44.703006744384766,-52.745025634765625,1
There isn't a banana going bad.,There isn't each banana going bad.,semantics,quantifiers,existential_there_quantifiers_1,True,False,False,False,756,-41.21842956542969,-52.82143783569336,1
There wasn't a print of the horses looking like many drawings.,There wasn't each print of the horses looking like many drawings.,semantics,quantifiers,existential_there_quantifiers_1,True,False,False,False,757,-70.04283142089844,-79.763427734375,1
There are no commentaries about the Impressionists annoying every guy.,There are most commentaries about the Impressionists annoying every guy.,semantics,quantifiers,existential_there_quantifiers_1,True,False,False,False,758,-87.30699157714844,-92.538818359375,1
There weren't many associations encouraging Pamela to love Chad.,There weren't all associations encouraging Pamela to love Chad.,semantics,quantifiers,existential_there_quantifiers_1,True,False,False,False,759,-75.22171783447266,-78.75224304199219,1
There were many skateboards disturbing Sonia.,There were all skateboards disturbing Sonia.,semantics,quantifiers,existential_there_quantifiers_1,True,False,False,False,760,-61.07425308227539,-61.50912094116211,1
There is a drawing of every rug astounding Larry.,There is every drawing of every rug astounding Larry.,semantics,quantifiers,existential_there_quantifiers_1,True,False,False,False,761,-67.301513671875,-74.53866577148438,1
There is a picture alarming Brad.,There is each picture alarming Brad.,semantics,quantifiers,existential_there_quantifiers_1,True,False,False,False,762,-48.08124542236328,-59.56208038330078,1
There are few drawings impressing Laurie.,There are all drawings impressing Laurie.,semantics,quantifiers,existential_there_quantifiers_1,True,False,False,False,763,-56.26023483276367,-54.91729736328125,0
There isn't a patient neglecting to leave Caroline.,There isn't each patient neglecting to leave Caroline.,semantics,quantifiers,existential_there_quantifiers_1,True,False,False,False,764,-56.92320251464844,-68.55310821533203,1
There wasn't a hamster boring some waitress.,There wasn't every hamster boring some waitress.,semantics,quantifiers,existential_there_quantifiers_1,True,False,False,False,765,-59.226253509521484,-67.3172836303711,1
There were no reports about current events aggravating Christopher.,There were most reports about current events aggravating Christopher.,semantics,quantifiers,existential_there_quantifiers_1,True,False,False,False,766,-77.27494812011719,-81.32622528076172,1
There are some plates disappearing.,There are most plates disappearing.,semantics,quantifiers,existential_there_quantifiers_1,True,False,False,False,767,-32.74509811401367,-38.9549560546875,1
There were many convertibles aggravating that waiter.,There were most convertibles aggravating that waiter.,semantics,quantifiers,existential_there_quantifiers_1,True,False,False,False,768,-74.4488525390625,-76.14913940429688,1
There is a doctor yearning to like some muffin.,There is every doctor yearning to like some muffin.,semantics,quantifiers,existential_there_quantifiers_1,True,False,False,False,769,-66.3015365600586,-75.51144409179688,1
There weren't many bicycles upsetting the cashiers.,There weren't all bicycles upsetting the cashiers.,semantics,quantifiers,existential_there_quantifiers_1,True,False,False,False,770,-60.50688171386719,-62.80586242675781,1
There are no students getting a job.,There are most students getting a job.,semantics,quantifiers,existential_there_quantifiers_1,True,False,False,False,771,-37.7747802734375,-39.48681640625,1
There was a plane worrying Martin.,There was each plane worrying Martin.,semantics,quantifiers,existential_there_quantifiers_1,True,False,False,False,772,-41.882835388183594,-54.198204040527344,1
There was a window wasting away.,There was each window wasting away.,semantics,quantifiers,existential_there_quantifiers_1,True,False,False,False,773,-38.34641647338867,-49.09393310546875,1
There isn't an art gallery impressing some customer.,There isn't each art gallery impressing some customer.,semantics,quantifiers,existential_there_quantifiers_1,True,False,False,False,774,-67.1259765625,-78.93109130859375,1
There aren't few cakes bothering Victoria.,There aren't most cakes bothering Victoria.,semantics,quantifiers,existential_there_quantifiers_1,True,False,False,False,775,-54.85370635986328,-59.07281494140625,1
There were no teachers talking about newspaper articles.,There were all teachers talking about newspaper articles.,semantics,quantifiers,existential_there_quantifiers_1,True,False,False,False,776,-48.011173248291016,-47.89556884765625,0
There were no casseroles burning.,There were most casseroles burning.,semantics,quantifiers,existential_there_quantifiers_1,True,False,False,False,777,-43.870906829833984,-49.383262634277344,1
There are no stories about art winning.,There are all stories about art winning.,semantics,quantifiers,existential_there_quantifiers_1,True,False,False,False,778,-45.27367401123047,-45.56965637207031,1
There wasn't a mouth disturbing Omar.,There wasn't every mouth disturbing Omar.,semantics,quantifiers,existential_there_quantifiers_1,True,False,False,False,779,-52.94096755981445,-60.862815856933594,1
There is a child firing Leslie.,There is each child firing Leslie.,semantics,quantifiers,existential_there_quantifiers_1,True,False,False,False,780,-39.28353500366211,-47.51533508300781,1
There were some libraries admiring William.,There were all libraries admiring William.,semantics,quantifiers,existential_there_quantifiers_1,True,False,False,False,781,-55.987640380859375,-55.99646759033203,1
There isn't a government boasting about all doctors.,There isn't every government boasting about all doctors.,semantics,quantifiers,existential_there_quantifiers_1,True,False,False,False,782,-53.65031051635742,-61.990379333496094,1
There are few organizations changing.,There are most organizations changing.,semantics,quantifiers,existential_there_quantifiers_1,True,False,False,False,783,-37.30778884887695,-36.047523498535156,0
There is a couch cracking.,There is each couch cracking.,semantics,quantifiers,existential_there_quantifiers_1,True,False,False,False,784,-32.6844482421875,-45.29792404174805,1
There are no companies buying some paintings.,There are all companies buying some paintings.,semantics,quantifiers,existential_there_quantifiers_1,True,False,False,False,785,-47.45137023925781,-47.20896530151367,0
There wasn't a lamp appearing.,There wasn't every lamp appearing.,semantics,quantifiers,existential_there_quantifiers_1,True,False,False,False,786,-36.84177780151367,-44.524864196777344,1
There are no shirts stunning Chad.,There are all shirts stunning Chad.,semantics,quantifiers,existential_there_quantifiers_1,True,False,False,False,787,-57.378265380859375,-58.85201644897461,1
There isn't a story bothering Alexander.,There isn't each story bothering Alexander.,semantics,quantifiers,existential_there_quantifiers_1,True,False,False,False,788,-44.09178924560547,-53.748783111572266,1
There wasn't a rug upsetting Wayne.,There wasn't each rug upsetting Wayne.,semantics,quantifiers,existential_there_quantifiers_1,True,False,False,False,789,-50.57375717163086,-59.771690368652344,1
There wasn't a photograph irritating most actresses.,There wasn't every photograph irritating most actresses.,semantics,quantifiers,existential_there_quantifiers_1,True,False,False,False,790,-56.91522216796875,-66.98790740966797,1
There are no organizations figuring out who will find out who has laughed.,There are most organizations figuring out who will find out who has laughed.,semantics,quantifiers,existential_there_quantifiers_1,True,False,False,False,791,-69.12580871582031,-69.85430145263672,1
There isn't a book vanishing.,There isn't every book vanishing.,semantics,quantifiers,existential_there_quantifiers_1,True,False,False,False,792,-36.5709228515625,-44.973411560058594,1
There weren't few paintings upsetting Omar.,There weren't most paintings upsetting Omar.,semantics,quantifiers,existential_there_quantifiers_1,True,False,False,False,793,-63.25862121582031,-64.96096801757812,1
There isn't a river impressing Anna.,There isn't every river impressing Anna.,semantics,quantifiers,existential_there_quantifiers_1,True,False,False,False,794,-51.049171447753906,-60.57051086425781,1
There is a plate tipping over.,There is every plate tipping over.,semantics,quantifiers,existential_there_quantifiers_1,True,False,False,False,795,-38.29573059082031,-45.50834655761719,1
There were some mothers of Nicole wearing the blouse.,There were all mothers of Nicole wearing the blouse.,semantics,quantifiers,existential_there_quantifiers_1,True,False,False,False,796,-63.33201599121094,-64.68594360351562,1
There is a niece of Andrea leaving.,There is each niece of Andrea leaving.,semantics,quantifiers,existential_there_quantifiers_1,True,False,False,False,797,-44.57633972167969,-54.79481506347656,1
There are some doors upsetting Alice.,There are all doors upsetting Alice.,semantics,quantifiers,existential_there_quantifiers_1,True,False,False,False,798,-47.358551025390625,-48.09328842163086,1
There is a woman attacking Sabrina.,There is every woman attacking Sabrina.,semantics,quantifiers,existential_there_quantifiers_1,True,False,False,False,799,-43.59250259399414,-49.10859298706055,1
There aren't few couches irritating the libraries.,There aren't all couches irritating the libraries.,semantics,quantifiers,existential_there_quantifiers_1,True,False,False,False,800,-67.43487548828125,-64.99314880371094,0
There is a book stunning Theresa.,There is every book stunning Theresa.,semantics,quantifiers,existential_there_quantifiers_1,True,False,False,False,801,-44.36260223388672,-52.37459182739258,1
There were no grandsons of April appearing to scratch.,There were all grandsons of April appearing to scratch.,semantics,quantifiers,existential_there_quantifiers_1,True,False,False,False,802,-72.80616760253906,-73.85139465332031,1
There were no guys waving.,There were most guys waving.,semantics,quantifiers,existential_there_quantifiers_1,True,False,False,False,803,-32.00769805908203,-37.72254180908203,1
There wasn't a carriage falling apart.,There wasn't each carriage falling apart.,semantics,quantifiers,existential_there_quantifiers_1,True,False,False,False,804,-38.02400588989258,-48.60486602783203,1
There are some daughters of Lucille forgetting who has visited Samantha.,There are all daughters of Lucille forgetting who has visited Samantha.,semantics,quantifiers,existential_there_quantifiers_1,True,False,False,False,805,-79.61951446533203,-81.85372924804688,1
There wasn't a story disagreeing.,There wasn't each story disagreeing.,semantics,quantifiers,existential_there_quantifiers_1,True,False,False,False,806,-43.032867431640625,-51.59646987915039,1
There was a waiter walking through a mountain.,There was each waiter walking through a mountain.,semantics,quantifiers,existential_there_quantifiers_1,True,False,False,False,807,-41.62010192871094,-52.64876937866211,1
There is a shirt flattening.,There is every shirt flattening.,semantics,quantifiers,existential_there_quantifiers_1,True,False,False,False,808,-37.965057373046875,-43.47992706298828,1
There are many children managing to walk through a public park.,There are all children managing to walk through a public park.,semantics,quantifiers,existential_there_quantifiers_1,True,False,False,False,809,-57.516883850097656,-61.116546630859375,1
There are no computers cracking.,There are most computers cracking.,semantics,quantifiers,existential_there_quantifiers_1,True,False,False,False,810,-36.722450256347656,-40.491817474365234,1
There aren't many movie theaters boring Ruth.,There aren't all movie theaters boring Ruth.,semantics,quantifiers,existential_there_quantifiers_1,True,False,False,False,811,-61.51170349121094,-65.82147216796875,1
There were no mothers of Dennis scanning all documentaries.,There were all mothers of Dennis scanning all documentaries.,semantics,quantifiers,existential_there_quantifiers_1,True,False,False,False,812,-68.9051284790039,-70.0389633178711,1
There are many shawls scaring Gina.,There are most shawls scaring Gina.,semantics,quantifiers,existential_there_quantifiers_1,True,False,False,False,813,-58.15171813964844,-62.31859588623047,1
There is a scarf flattening.,There is every scarf flattening.,semantics,quantifiers,existential_there_quantifiers_1,True,False,False,False,814,-37.92195510864258,-45.390846252441406,1
There were no slopes impressing Kristen.,There were most slopes impressing Kristen.,semantics,quantifiers,existential_there_quantifiers_1,True,False,False,False,815,-60.5996208190918,-64.59436798095703,1
There were no drivers advising Harvard University to change.,There were all drivers advising Harvard University to change.,semantics,quantifiers,existential_there_quantifiers_1,True,False,False,False,816,-65.15972900390625,-67.6174545288086,1
There wasn't a dancer talking.,There wasn't each dancer talking.,semantics,quantifiers,existential_there_quantifiers_1,True,False,False,False,817,-34.032135009765625,-43.02241516113281,1
There are some cars disappearing.,There are all cars disappearing.,semantics,quantifiers,existential_there_quantifiers_1,True,False,False,False,818,-34.595577239990234,-34.9920768737793,1
There wasn't a mouth looking like the photograph.,There wasn't every mouth looking like the photograph.,semantics,quantifiers,existential_there_quantifiers_1,True,False,False,False,819,-46.3065299987793,-54.94639587402344,1
There were no scarves distracting Samantha.,There were most scarves distracting Samantha.,semantics,quantifiers,existential_there_quantifiers_1,True,False,False,False,820,-58.302703857421875,-61.80394744873047,1
There are many ladies washing.,There are most ladies washing.,semantics,quantifiers,existential_there_quantifiers_1,True,False,False,False,821,-32.84120178222656,-37.015106201171875,1
There are many malls existing.,There are all malls existing.,semantics,quantifiers,existential_there_quantifiers_1,True,False,False,False,822,-40.15028381347656,-42.32491683959961,1
There was a movie disagreeing.,There was each movie disagreeing.,semantics,quantifiers,existential_there_quantifiers_1,True,False,False,False,823,-39.046897888183594,-49.670955657958984,1
There were few sketches disgusting most guests.,There were most sketches disgusting most guests.,semantics,quantifiers,existential_there_quantifiers_1,True,False,False,False,824,-63.91594314575195,-62.97369384765625,0
There was a sock twirling.,There was every sock twirling.,semantics,quantifiers,existential_there_quantifiers_1,True,False,False,False,825,-38.30907440185547,-44.75927734375,1
There are no sketches of Brian disturbing Samantha.,There are most sketches of Brian disturbing Samantha.,semantics,quantifiers,existential_there_quantifiers_1,True,False,False,False,826,-61.84588623046875,-64.47512817382812,1
There isn't a projector astounding guys.,There isn't every projector astounding guys.,semantics,quantifiers,existential_there_quantifiers_1,True,False,False,False,827,-50.4083366394043,-59.59743118286133,1
There weren't many eyes irritating Joel.,There weren't most eyes irritating Joel.,semantics,quantifiers,existential_there_quantifiers_1,True,False,False,False,828,-53.94487380981445,-61.15543746948242,1
There are some sweaters impressing Elaine.,There are most sweaters impressing Elaine.,semantics,quantifiers,existential_there_quantifiers_1,True,False,False,False,829,-54.54909133911133,-57.33250427246094,1
There wasn't a movie confusing Nicole.,There wasn't every movie confusing Nicole.,semantics,quantifiers,existential_there_quantifiers_1,True,False,False,False,830,-46.7911491394043,-57.24773025512695,1
There are no hills appearing.,There are all hills appearing.,semantics,quantifiers,existential_there_quantifiers_1,True,False,False,False,831,-35.51922607421875,-37.05856704711914,1
There wasn't a girl researching associations.,There wasn't each girl researching associations.,semantics,quantifiers,existential_there_quantifiers_1,True,False,False,False,832,-47.24089050292969,-55.95725631713867,1
There were many fathers of Alice liking to divorce.,There were all fathers of Alice liking to divorce.,semantics,quantifiers,existential_there_quantifiers_1,True,False,False,False,833,-59.538963317871094,-61.453590393066406,1
There is a plate cracking.,There is every plate cracking.,semantics,quantifiers,existential_there_quantifiers_1,True,False,False,False,834,-30.649703979492188,-37.42912292480469,1
There are many movie theaters worrying a lot of students.,There are most movie theaters worrying a lot of students.,semantics,quantifiers,existential_there_quantifiers_1,True,False,False,False,835,-59.270057678222656,-61.65774917602539,1
There were some dogs coming here.,There were most dogs coming here.,semantics,quantifiers,existential_there_quantifiers_1,True,False,False,False,836,-30.893722534179688,-36.39077377319336,1
There were some adults boasting about Gina.,There were all adults boasting about Gina.,semantics,quantifiers,existential_there_quantifiers_1,True,False,False,False,837,-51.167911529541016,-51.87577819824219,1
There are few cars looking like the prints.,There are all cars looking like the prints.,semantics,quantifiers,existential_there_quantifiers_1,True,False,False,False,838,-49.847434997558594,-49.06529235839844,0
There were few commentaries alarming the Clintons.,There were all commentaries alarming the Clintons.,semantics,quantifiers,existential_there_quantifiers_1,True,False,False,False,839,-76.4398193359375,-74.66583251953125,0
There weren't many books scaring schools.,There weren't all books scaring schools.,semantics,quantifiers,existential_there_quantifiers_1,True,False,False,False,840,-47.60909652709961,-52.88227844238281,1
There is a skateboard bothering Timothy.,There is each skateboard bothering Timothy.,semantics,quantifiers,existential_there_quantifiers_1,True,False,False,False,841,-49.16844177246094,-59.875946044921875,1
There wasn't a computer worrying Carla.,There wasn't every computer worrying Carla.,semantics,quantifiers,existential_there_quantifiers_1,True,False,False,False,842,-48.71955871582031,-57.55986022949219,1
There was a popsicle distracting a lot of legislatures.,There was every popsicle distracting a lot of legislatures.,semantics,quantifiers,existential_there_quantifiers_1,True,False,False,False,843,-62.05248260498047,-71.61895751953125,1
There was a rug confusing the patients.,There was every rug confusing the patients.,semantics,quantifiers,existential_there_quantifiers_1,True,False,False,False,844,-53.041893005371094,-60.40032958984375,1
There is a shawl alarming Carlos.,There is each shawl alarming Carlos.,semantics,quantifiers,existential_there_quantifiers_1,True,False,False,False,845,-54.92051696777344,-65.81486511230469,1
There weren't few mushrooms ripening.,There weren't all mushrooms ripening.,semantics,quantifiers,existential_there_quantifiers_1,True,False,False,False,846,-50.027496337890625,-49.192726135253906,0
There wasn't a sock falling.,There wasn't every sock falling.,semantics,quantifiers,existential_there_quantifiers_1,True,False,False,False,847,-36.14339065551758,-42.98363494873047,1
There wasn't a turtle breaking some car.,There wasn't each turtle breaking some car.,semantics,quantifiers,existential_there_quantifiers_1,True,False,False,False,848,-48.325958251953125,-59.83247375488281,1
There aren't few tomatoes charring.,There aren't all tomatoes charring.,semantics,quantifiers,existential_there_quantifiers_1,True,False,False,False,849,-50.954566955566406,-50.37969207763672,0
There was a niece of Gary hiding away.,There was each niece of Gary hiding away.,semantics,quantifiers,existential_there_quantifiers_1,True,False,False,False,850,-50.404151916503906,-60.03204345703125,1
There aren't many hills annoying some child.,There aren't most hills annoying some child.,semantics,quantifiers,existential_there_quantifiers_1,True,False,False,False,851,-57.6099739074707,-63.72127151489258,1
There were no daughters of Wayne passing some college campus.,There were all daughters of Wayne passing some college campus.,semantics,quantifiers,existential_there_quantifiers_1,True,False,False,False,852,-71.5421142578125,-73.30572509765625,1
There was a snake leaving.,There was every snake leaving.,semantics,quantifiers,existential_there_quantifiers_1,True,False,False,False,853,-31.211593627929688,-40.16093444824219,1
There are few bicycles falling apart.,There are all bicycles falling apart.,semantics,quantifiers,existential_there_quantifiers_1,True,False,False,False,854,-39.70319366455078,-38.38229751586914,0
There wasn't a screen alarming Todd.,There wasn't every screen alarming Todd.,semantics,quantifiers,existential_there_quantifiers_1,True,False,False,False,855,-52.754573822021484,-62.73813247680664,1
There are many plays disagreeing with Nicole.,There are most plays disagreeing with Nicole.,semantics,quantifiers,existential_there_quantifiers_1,True,False,False,False,856,-55.820613861083984,-60.683937072753906,1
There isn't a movie hurting Lissa.,There isn't each movie hurting Lissa.,semantics,quantifiers,existential_there_quantifiers_1,True,False,False,False,857,-51.752777099609375,-64.02714538574219,1
