sentence_good,sentence_bad,field,linguistics_term,UID,simple_LM_method,one_prefix_method,two_prefix_method,lexically_identical,pair_id,good_prob,bad_prob,correct
A lot of dancers cured this boy.,A lot of dancers cured this boys.,morphology,determiner_noun_agreement,determiner_noun_agreement_1,True,True,False,True,256,-49.10051345825195,-51.24314498901367,1
Tiffany hadn't distracted this patient.,Tiffany hadn't distracted this patients.,morphology,determiner_noun_agreement,determiner_noun_agreement_1,True,True,False,True,257,-52.95365905761719,-56.87255859375,1
Students sell that rug.,Students sell that rugs.,morphology,determiner_noun_agreement,determiner_noun_agreement_1,True,True,False,True,258,-30.652612686157227,-32.13074493408203,1
Christopher concealed this art gallery.,Christopher concealed this art galleries.,morphology,determiner_noun_agreement,determiner_noun_agreement_1,True,True,False,True,259,-35.3890380859375,-38.10279846191406,1
These guys admired that school.,These guys admired that schools.,morphology,determiner_noun_agreement,determiner_noun_agreement_1,True,True,False,True,260,-39.327842712402344,-43.613616943359375,1
Rugs astound that association.,Rugs astound that associations.,morphology,determiner_noun_agreement,determiner_noun_agreement_1,True,True,False,True,261,-48.808963775634766,-51.183895111083984,1
Robert wasn't scaring these museums.,Robert wasn't scaring these museum.,morphology,determiner_noun_agreement,determiner_noun_agreement_1,True,True,False,True,262,-45.313209533691406,-46.908164978027344,1
Kendra investigates these ladies.,Kendra investigates these lady.,morphology,determiner_noun_agreement,determiner_noun_agreement_1,True,True,False,True,263,-44.60791015625,-50.855953216552734,1
A lot of ladies arrive at that museum.,A lot of ladies arrive at that museums.,morphology,determiner_noun_agreement,determiner_noun_agreement_1,True,True,False,True,264,-46.28784942626953,-51.216514587402344,1
Some pedestrians drive to this movie theater.,Some pedestrians drive to this movie theaters.,morphology,determiner_noun_agreement,determiner_noun_agreement_1,True,True,False,True,265,-44.23951721191406,-45.80448532104492,1
Tonya hasn't remembered that brochure.,Tonya hasn't remembered that brochures.,morphology,determiner_noun_agreement,determiner_noun_agreement_1,True,True,False,True,266,-47.42689895629883,-48.00566101074219,1
Museums hadn't disturbed that patient.,Museums hadn't disturbed that patients.,morphology,determiner_noun_agreement,determiner_noun_agreement_1,True,True,False,True,267,-59.699989318847656,-60.28605651855469,1
Every person left that actress.,Every person left that actresses.,morphology,determiner_noun_agreement,determiner_noun_agreement_1,True,True,False,True,268,-39.25993347167969,-41.51148986816406,1
Sandra should disgust that actor.,Sandra should disgust that actors.,morphology,determiner_noun_agreement,determiner_noun_agreement_1,True,True,False,True,269,-55.8596305847168,-56.5111198425293,1
Amelia is disgusting these ladies.,Amelia is disgusting these lady.,morphology,determiner_noun_agreement,determiner_noun_agreement_1,True,True,False,True,270,-44.50226974487305,-47.66503143310547,1
Carla isn't taking those sketches.,Carla isn't taking those sketch.,morphology,determiner_noun_agreement,determiner_noun_agreement_1,True,True,False,True,271,-46.41797637939453,-48.3463249206543,1
Florence was investigating these actors.,Florence was investigating these actor.,morphology,determiner_noun_agreement,determiner_noun_agreement_1,True,True,False,True,272,-47.687137603759766,-52.20767593383789,1
Many cashiers disagree with those cashiers.,Many cashiers disagree with those cashier.,morphology,determiner_noun_agreement,determiner_noun_agreement_1,True,True,False,True,273,-42.66722869873047,-44.83606719970703,1
These committees argue about this commentary.,These committees argue about this commentaries.,morphology,determiner_noun_agreement,determiner_noun_agreement_1,True,True,False,True,274,-37.57125473022461,-43.34258270263672,1
Brian sees those horses.,Brian sees those horse.,morphology,determiner_noun_agreement,determiner_noun_agreement_1,True,True,False,True,275,-30.02076530456543,-33.0337028503418,1
Candice hasn't explored this art gallery.,Candice hasn't explored this art galleries.,morphology,determiner_noun_agreement,determiner_noun_agreement_1,True,True,False,True,276,-46.69381332397461,-49.17168426513672,1
Aaron walks through those art galleries.,Aaron walks through those art gallery.,morphology,determiner_noun_agreement,determiner_noun_agreement_1,True,True,False,True,277,-38.487388610839844,-42.30162811279297,1
Some books alarm that cashier.,Some books alarm that cashiers.,morphology,determiner_noun_agreement,determiner_noun_agreement_1,True,True,False,True,278,-48.567901611328125,-50.089210510253906,1
Raymond wasn't kissing that guest.,Raymond wasn't kissing that guests.,morphology,determiner_noun_agreement,determiner_noun_agreement_1,True,True,False,True,279,-51.13375473022461,-53.542625427246094,1
Some cashier might boycott that art gallery.,Some cashier might boycott that art galleries.,morphology,determiner_noun_agreement,determiner_noun_agreement_1,True,True,False,True,280,-56.85068893432617,-56.010414123535156,0
Winston Churchill hadn't hidden this adult.,Winston Churchill hadn't hidden this adults.,morphology,determiner_noun_agreement,determiner_noun_agreement_1,True,True,False,True,281,-61.116180419921875,-63.967891693115234,1
Jennifer skates around this public park.,Jennifer skates around this public parks.,morphology,determiner_noun_agreement,determiner_noun_agreement_1,True,True,False,True,282,-43.06062698364258,-45.219268798828125,1
Ruth doesn't flee from those malls.,Ruth doesn't flee from those mall.,morphology,determiner_noun_agreement,determiner_noun_agreement_1,True,True,False,True,283,-51.32096481323242,-54.05337905883789,1
Some waiters have known those guests.,Some waiters have known those guest.,morphology,determiner_noun_agreement,determiner_noun_agreement_1,True,True,False,True,284,-44.594749450683594,-50.64311981201172,1
Patricia thinks about that legislature.,Patricia thinks about that legislatures.,morphology,determiner_noun_agreement,determiner_noun_agreement_1,True,True,False,True,285,-46.44059371948242,-49.96076583862305,1
Every patient shouldn't drive to these schools.,Every patient shouldn't drive to these school.,morphology,determiner_noun_agreement,determiner_noun_agreement_1,True,True,False,True,286,-46.378929138183594,-46.481143951416016,1
Most boys hadn't disagreed with those books.,Most boys hadn't disagreed with those book.,morphology,determiner_noun_agreement,determiner_noun_agreement_1,True,True,False,True,287,-47.17909622192383,-51.23561096191406,1
Mark fled from those guys.,Mark fled from those guy.,morphology,determiner_noun_agreement,determiner_noun_agreement_1,True,True,False,True,288,-30.50687026977539,-36.114036560058594,1
Grace should break these cups.,Grace should break these cup.,morphology,determiner_noun_agreement,determiner_noun_agreement_1,True,True,False,True,289,-40.380043029785156,-43.108646392822266,1
Carrie passes those restaurants.,Carrie passes those restaurant.,morphology,determiner_noun_agreement,determiner_noun_agreement_1,True,True,False,True,290,-41.43907165527344,-44.63435363769531,1
Anne was returning to these guys.,Anne was returning to these guy.,morphology,determiner_noun_agreement,determiner_noun_agreement_1,True,True,False,True,291,-30.25562286376953,-35.168880462646484,1
Craig could disturb those teenagers.,Craig could disturb those teenager.,morphology,determiner_noun_agreement,determiner_noun_agreement_1,True,True,False,True,292,-36.68037414550781,-40.57337188720703,1
Linda has this rabbit.,Linda has this rabbits.,morphology,determiner_noun_agreement,determiner_noun_agreement_1,True,True,False,True,293,-35.870826721191406,-40.77587890625,1
Christopher does pass this hospital.,Christopher does pass this hospitals.,morphology,determiner_noun_agreement,determiner_noun_agreement_1,True,True,False,True,294,-34.5997314453125,-38.28730773925781,1
Mitchell wasn't embarrassing these adults.,Mitchell wasn't embarrassing these adult.,morphology,determiner_noun_agreement,determiner_noun_agreement_1,True,True,False,True,295,-51.3030891418457,-53.4624137878418,1
These senators clean these grocery stores.,These senators clean these grocery store.,morphology,determiner_noun_agreement,determiner_noun_agreement_1,True,True,False,True,296,-45.243003845214844,-46.377891540527344,1
Cynthia should complain about those actresses.,Cynthia should complain about those actress.,morphology,determiner_noun_agreement,determiner_noun_agreement_1,True,True,False,True,297,-56.42146682739258,-57.459083557128906,1
Curtis hasn't praised these boys.,Curtis hasn't praised these boy.,morphology,determiner_noun_agreement,determiner_noun_agreement_1,True,True,False,True,298,-51.91069030761719,-55.24590301513672,1
Florence listened to that patient.,Florence listened to that patients.,morphology,determiner_noun_agreement,determiner_noun_agreement_1,True,True,False,True,299,-43.34809112548828,-46.39010238647461,1
Jodi might break these chairs.,Jodi might break these chair.,morphology,determiner_noun_agreement,determiner_noun_agreement_1,True,True,False,True,300,-48.037296295166016,-50.56748962402344,1
Sherry forgot that play.,Sherry forgot that plays.,morphology,determiner_noun_agreement,determiner_noun_agreement_1,True,True,False,True,301,-42.673282623291016,-47.331703186035156,1
Clyde hasn't loved these boys.,Clyde hasn't loved these boy.,morphology,determiner_noun_agreement,determiner_noun_agreement_1,True,True,False,True,302,-55.21027374267578,-57.48443603515625,1
A lot of hats aggravate that legislature.,A lot of hats aggravate that legislatures.,morphology,determiner_noun_agreement,determiner_noun_agreement_1,True,True,False,True,303,-61.426849365234375,-62.023536682128906,1
Ellen will look like those prints.,Ellen will look like those print.,morphology,determiner_noun_agreement,determiner_noun_agreement_1,True,True,False,True,304,-40.44331359863281,-41.40235137939453,1
April wasn't examining those reports.,April wasn't examining those report.,morphology,determiner_noun_agreement,determiner_noun_agreement_1,True,True,False,True,305,-38.49040222167969,-41.4910888671875,1
Diana isn't selling that car.,Diana isn't selling that cars.,morphology,determiner_noun_agreement,determiner_noun_agreement_1,True,True,False,True,306,-41.94677734375,-43.73402786254883,1
Christina knew this doctor.,Christina knew this doctors.,morphology,determiner_noun_agreement,determiner_noun_agreement_1,True,True,False,True,307,-35.314388275146484,-40.66310119628906,1
Catherine wouldn't research these universities.,Catherine wouldn't research these university.,morphology,determiner_noun_agreement,determiner_noun_agreement_1,True,True,False,True,308,-51.085628509521484,-53.409385681152344,1
Those customers weren't researching this government.,Those customers weren't researching this governments.,morphology,determiner_noun_agreement,determiner_noun_agreement_1,True,True,False,True,309,-44.96457290649414,-50.228580474853516,1
All doctors know that student.,All doctors know that students.,morphology,determiner_noun_agreement,determiner_noun_agreement_1,True,True,False,True,310,-33.537208557128906,-32.48371887207031,0
Tonya has insulted that play.,Tonya has insulted that plays.,morphology,determiner_noun_agreement,determiner_noun_agreement_1,True,True,False,True,311,-43.50645065307617,-46.70013427734375,1
Those documentaries were disagreeing with that lady.,Those documentaries were disagreeing with that ladies.,morphology,determiner_noun_agreement,determiner_noun_agreement_1,True,True,False,True,312,-54.58809280395508,-56.418148040771484,1
An organization had respected that doctor.,An organization had respected that doctors.,morphology,determiner_noun_agreement,determiner_noun_agreement_1,True,True,False,True,313,-49.28507995605469,-49.804443359375,1
Timothy explores this restaurant.,Timothy explores this restaurants.,morphology,determiner_noun_agreement,determiner_noun_agreement_1,True,True,False,True,314,-40.999637603759766,-45.30014419555664,1
Sarah hires this waiter.,Sarah hires this waiters.,morphology,determiner_noun_agreement,determiner_noun_agreement_1,True,True,False,True,315,-33.98833465576172,-37.9168586730957,1
Kendra exits this art gallery.,Kendra exits this art galleries.,morphology,determiner_noun_agreement,determiner_noun_agreement_1,True,True,False,True,316,-49.98717498779297,-51.38257598876953,1
Natalie concealed this hospital.,Natalie concealed this hospitals.,morphology,determiner_noun_agreement,determiner_noun_agreement_1,True,True,False,True,317,-42.01817321777344,-47.2359504699707,1
Amelia was impressing this company.,Amelia was impressing this companies.,morphology,determiner_noun_agreement,determiner_noun_agreement_1,True,True,False,True,318,-42.50579071044922,-49.282188415527344,1
Wendy hadn't scared that bank.,Wendy hadn't scared that banks.,morphology,determiner_noun_agreement,determiner_noun_agreement_1,True,True,False,True,319,-50.34787368774414,-54.35546875,1
Mark will cure those guys.,Mark will cure those guy.,morphology,determiner_noun_agreement,determiner_noun_agreement_1,True,True,False,True,320,-31.454347610473633,-36.331119537353516,1
Spain was describing those actors.,Spain was describing those actor.,morphology,determiner_noun_agreement,determiner_noun_agreement_1,True,True,False,True,321,-36.29491424560547,-40.75798034667969,1
Allison talked about those schools.,Allison talked about those school.,morphology,determiner_noun_agreement,determiner_noun_agreement_1,True,True,False,True,322,-41.0499382019043,-43.02138137817383,1
William buys those jackets.,William buys those jacket.,morphology,determiner_noun_agreement,determiner_noun_agreement_1,True,True,False,True,323,-31.48486328125,-32.72416305541992,1
Timothy escaped from that cashier.,Timothy escaped from that cashiers.,morphology,determiner_noun_agreement,determiner_noun_agreement_1,True,True,False,True,324,-47.9169921875,-52.07263946533203,1
Susan isn't fixing those couches.,Susan isn't fixing those couch.,morphology,determiner_noun_agreement,determiner_noun_agreement_1,True,True,False,True,325,-40.2363166809082,-40.07048034667969,0
Tonya boasts about this patient.,Tonya boasts about this patients.,morphology,determiner_noun_agreement,determiner_noun_agreement_1,True,True,False,True,326,-43.920005798339844,-46.956016540527344,1
Stephanie talked to those cashiers.,Stephanie talked to those cashier.,morphology,determiner_noun_agreement,determiner_noun_agreement_1,True,True,False,True,327,-49.53644943237305,-47.52678680419922,0
Those children describe those pedestrians.,Those children describe those pedestrian.,morphology,determiner_noun_agreement,determiner_noun_agreement_1,True,True,False,True,328,-43.120635986328125,-44.60726547241211,1
Sara would embarrass that guest.,Sara would embarrass that guests.,morphology,determiner_noun_agreement,determiner_noun_agreement_1,True,True,False,True,329,-47.594322204589844,-47.19086456298828,0
Rebecca complained about that brochure.,Rebecca complained about that brochures.,morphology,determiner_noun_agreement,determiner_noun_agreement_1,True,True,False,True,330,-47.464393615722656,-48.83173370361328,1
Amelia has thought about those horses.,Amelia has thought about those horse.,morphology,determiner_noun_agreement,determiner_noun_agreement_1,True,True,False,True,331,-47.72477340698242,-50.84619903564453,1
Those books were astounding that government.,Those books were astounding that governments.,morphology,determiner_noun_agreement,determiner_noun_agreement_1,True,True,False,True,332,-45.54012680053711,-47.739280700683594,1
Most waiters weren't watching that lady.,Most waiters weren't watching that ladies.,morphology,determiner_noun_agreement,determiner_noun_agreement_1,True,True,False,True,333,-46.48675537109375,-49.030006408691406,1
Alan had cleaned that plate.,Alan had cleaned that plates.,morphology,determiner_noun_agreement,determiner_noun_agreement_1,True,True,False,True,334,-33.92859649658203,-36.52873992919922,1
Benjamin cured that turtle.,Benjamin cured that turtles.,morphology,determiner_noun_agreement,determiner_noun_agreement_1,True,True,False,True,335,-48.056190490722656,-52.161136627197266,1
Melanie isn't scanning those reports.,Melanie isn't scanning those report.,morphology,determiner_noun_agreement,determiner_noun_agreement_1,True,True,False,True,336,-47.50123977661133,-50.468544006347656,1
Beverly is hiding this skirt.,Beverly is hiding this skirts.,morphology,determiner_noun_agreement,determiner_noun_agreement_1,True,True,False,True,337,-46.09580993652344,-50.166168212890625,1
Some waiter should praise that newspaper article.,Some waiter should praise that newspaper articles.,morphology,determiner_noun_agreement,determiner_noun_agreement_1,True,True,False,True,338,-56.0601692199707,-56.371307373046875,1
Janet helped these doctors.,Janet helped these doctor.,morphology,determiner_noun_agreement,determiner_noun_agreement_1,True,True,False,True,339,-39.203460693359375,-42.84892654418945,1
Judy impressed these universities.,Judy impressed these university.,morphology,determiner_noun_agreement,determiner_noun_agreement_1,True,True,False,True,340,-42.569950103759766,-44.489463806152344,1
The Impressionists complain about those children.,The Impressionists complain about those child.,morphology,determiner_noun_agreement,determiner_noun_agreement_1,True,True,False,True,341,-46.18787384033203,-49.81637191772461,1
The Clintons help these guys.,The Clintons help these guy.,morphology,determiner_noun_agreement,determiner_noun_agreement_1,True,True,False,True,342,-37.351959228515625,-43.444419860839844,1
These prints look like those art galleries.,These prints look like those art gallery.,morphology,determiner_noun_agreement,determiner_noun_agreement_1,True,True,False,True,343,-40.421627044677734,-41.5351676940918,1
Every picture looks like those scarves.,Every picture looks like those scarf.,morphology,determiner_noun_agreement,determiner_noun_agreement_1,True,True,False,True,344,-39.272422790527344,-39.848182678222656,1
Claire has researched that print.,Claire has researched that prints.,morphology,determiner_noun_agreement,determiner_noun_agreement_1,True,True,False,True,345,-39.22298049926758,-42.84168243408203,1
Roger isn't watching these teachers.,Roger isn't watching these teacher.,morphology,determiner_noun_agreement,determiner_noun_agreement_1,True,True,False,True,346,-35.87971115112305,-38.66667556762695,1
These patients exit these restaurants.,These patients exit these restaurant.,morphology,determiner_noun_agreement,determiner_noun_agreement_1,True,True,False,True,347,-40.059852600097656,-41.1135368347168,1
Stephanie wasn't talking to these cashiers.,Stephanie wasn't talking to these cashier.,morphology,determiner_noun_agreement,determiner_noun_agreement_1,True,True,False,True,348,-55.12944793701172,-53.50007629394531,0
Amelia was scanning those stories.,Amelia was scanning those story.,morphology,determiner_noun_agreement,determiner_noun_agreement_1,True,True,False,True,349,-44.82389450073242,-48.52837371826172,1
Some actor shouldn't care for those senators.,Some actor shouldn't care for those senator.,morphology,determiner_noun_agreement,determiner_noun_agreement_1,True,True,False,True,350,-51.88540267944336,-54.42487335205078,1
Kristin was embarrassing these waitresses.,Kristin was embarrassing these waitress.,morphology,determiner_noun_agreement,determiner_noun_agreement_1,True,True,False,True,351,-51.18069839477539,-48.22471618652344,0
Every committee should dislike those banks.,Every committee should dislike those bank.,morphology,determiner_noun_agreement,determiner_noun_agreement_1,True,True,False,True,352,-45.67604064941406,-48.187435150146484,1
Ruth couldn't scare these patients.,Ruth couldn't scare these patient.,morphology,determiner_noun_agreement,determiner_noun_agreement_1,True,True,False,True,353,-46.3525390625,-50.925628662109375,1
Jerry isn't fixing these glasses.,Jerry isn't fixing these glass.,morphology,determiner_noun_agreement,determiner_noun_agreement_1,True,True,False,True,354,-34.2474250793457,-38.08421325683594,1
Katherine hasn't gone to these banks.,Katherine hasn't gone to these bank.,morphology,determiner_noun_agreement,determiner_noun_agreement_1,True,True,False,True,355,-45.487266540527344,-46.696407318115234,1
That report stuns this organization.,That report stuns this organizations.,morphology,determiner_noun_agreement,determiner_noun_agreement_1,True,True,False,True,356,-43.741355895996094,-49.352813720703125,1
Daniel conceals these waitresses.,Daniel conceals these waitress.,morphology,determiner_noun_agreement,determiner_noun_agreement_1,True,True,False,True,357,-38.31563186645508,-40.050628662109375,1
Stacey disturbed these doctors.,Stacey disturbed these doctor.,morphology,determiner_noun_agreement,determiner_noun_agreement_1,True,True,False,True,358,-44.1722526550293,-47.10875701904297,1
Some teenagers arrived at that bank.,Some teenagers arrived at that banks.,morphology,determiner_noun_agreement,determiner_noun_agreement_1,True,True,False,True,359,-42.290443420410156,-44.51283645629883,1
Jessica has this glove.,Jessica has this gloves.,morphology,determiner_noun_agreement,determiner_noun_agreement_1,True,True,False,True,360,-24.570281982421875,-25.133800506591797,1
Gerald researches that hospital.,Gerald researches that hospitals.,morphology,determiner_noun_agreement,determiner_noun_agreement_1,True,True,False,True,361,-47.581146240234375,-48.75746536254883,1
Julia might think about this waitress.,Julia might think about this waitresses.,morphology,determiner_noun_agreement,determiner_noun_agreement_1,True,True,False,True,362,-44.75837707519531,-50.49170684814453,1
Some pedestrian had worried that guest.,Some pedestrian had worried that guests.,morphology,determiner_noun_agreement,determiner_noun_agreement_1,True,True,False,True,363,-49.0272102355957,-48.82113265991211,0
Colleen did reveal those skirts.,Colleen did reveal those skirt.,morphology,determiner_noun_agreement,determiner_noun_agreement_1,True,True,False,True,364,-49.485755920410156,-51.03554916381836,1
All cashiers clean that snake.,All cashiers clean that snakes.,morphology,determiner_noun_agreement,determiner_noun_agreement_1,True,True,False,True,365,-47.60692596435547,-48.26507568359375,1
Those companies praise that actress.,Those companies praise that actresses.,morphology,determiner_noun_agreement,determiner_noun_agreement_1,True,True,False,True,366,-43.30804443359375,-43.13258361816406,0
Natalie isn't selling this nose.,Natalie isn't selling this noses.,morphology,determiner_noun_agreement,determiner_noun_agreement_1,True,True,False,True,367,-44.31940460205078,-47.11176681518555,1
Samuel will hurt that actor.,Samuel will hurt that actors.,morphology,determiner_noun_agreement,determiner_noun_agreement_1,True,True,False,True,368,-44.32963180541992,-47.180721282958984,1
Thomas has disturbed this boy.,Thomas has disturbed this boys.,morphology,determiner_noun_agreement,determiner_noun_agreement_1,True,True,False,True,369,-34.43185043334961,-38.31459045410156,1
Sally will pass these grocery stores.,Sally will pass these grocery store.,morphology,determiner_noun_agreement,determiner_noun_agreement_1,True,True,False,True,370,-45.171836853027344,-46.57518768310547,1
That convertible annoyed that company.,That convertible annoyed that companies.,morphology,determiner_noun_agreement,determiner_noun_agreement_1,True,True,False,True,371,-45.15826416015625,-47.52796936035156,1
Most guys see those dresses.,Most guys see those dress.,morphology,determiner_noun_agreement,determiner_noun_agreement_1,True,True,False,True,372,-33.67112731933594,-36.42366027832031,1
Most patients had forgotten those actors.,Most patients had forgotten those actor.,morphology,determiner_noun_agreement,determiner_noun_agreement_1,True,True,False,True,373,-45.83687973022461,-47.891822814941406,1
Most vases alarm that driver.,Most vases alarm that drivers.,morphology,determiner_noun_agreement,determiner_noun_agreement_1,True,True,False,True,374,-45.79200744628906,-46.53688430786133,1
This shirt astounded those senators.,This shirt astounded those senator.,morphology,determiner_noun_agreement,determiner_noun_agreement_1,True,True,False,True,375,-55.307613372802734,-57.666465759277344,1
Laura has attacked this teenager.,Laura has attacked this teenagers.,morphology,determiner_noun_agreement,determiner_noun_agreement_1,True,True,False,True,376,-32.505950927734375,-35.14740753173828,1
This senator might boycott that restaurant.,This senator might boycott that restaurants.,morphology,determiner_noun_agreement,determiner_noun_agreement_1,True,True,False,True,377,-52.7653694152832,-55.398921966552734,1
A lot of actors bother those teachers.,A lot of actors bother those teacher.,morphology,determiner_noun_agreement,determiner_noun_agreement_1,True,True,False,True,378,-52.93440246582031,-55.033355712890625,1
A banana embarrassed those actresses.,A banana embarrassed those actress.,morphology,determiner_noun_agreement,determiner_noun_agreement_1,True,True,False,True,379,-52.680965423583984,-53.983158111572266,1
That cucumber did confuse that boy.,That cucumber did confuse that boys.,morphology,determiner_noun_agreement,determiner_noun_agreement_1,True,True,False,True,380,-49.48436737060547,-53.583961486816406,1
Joseph isn't concealing these students.,Joseph isn't concealing these student.,morphology,determiner_noun_agreement,determiner_noun_agreement_1,True,True,False,True,381,-40.046871185302734,-44.89191436767578,1
Linda isn't discussing those waitresses.,Linda isn't discussing those waitress.,morphology,determiner_noun_agreement,determiner_noun_agreement_1,True,True,False,True,382,-54.297462463378906,-54.789093017578125,1
