sentence_good,sentence_bad,field,linguistics_term,UID,simple_LM_method,one_prefix_method,two_prefix_method,lexically_identical,pair_id,good_prob,bad_prob,correct
Had Jerry ever exercised?,Jerry had ever exercised.,semantics,npi_licensing,matrix_question_npi_licensor_present,True,False,True,True,520,-36.13525390625,-26.57536506652832,0
Had that mirror ever looked like every picture?,That mirror had ever looked like every picture.,semantics,npi_licensing,matrix_question_npi_licensor_present,True,False,True,True,521,-52.96424102783203,-53.63954162597656,1
Would Carol ever question Jeffrey?,Carol would ever question Jeffrey.,semantics,npi_licensing,matrix_question_npi_licensor_present,True,False,True,True,522,-44.081298828125,-49.03030014038086,1
Had some teachers ever departed?,Some teachers had ever departed.,semantics,npi_licensing,matrix_question_npi_licensor_present,True,False,True,True,523,-38.3720817565918,-34.78643798828125,0
Should Melinda ever resemble some picture?,Melinda should ever resemble some picture.,semantics,npi_licensing,matrix_question_npi_licensor_present,True,False,True,True,524,-56.277862548828125,-51.27203369140625,0
Would a cup ever tip over?,A cup would ever tip over.,semantics,npi_licensing,matrix_question_npi_licensor_present,True,False,True,True,525,-37.83205032348633,-42.452476501464844,1
Have some legislatures ever conferred?,Some legislatures have ever conferred.,semantics,npi_licensing,matrix_question_npi_licensor_present,True,False,True,True,526,-45.81741714477539,-43.52657699584961,0
Does Carla ever bother Michelle?,Carla does ever bother Michelle.,semantics,npi_licensing,matrix_question_npi_licensor_present,True,False,True,True,527,-48.607688903808594,-46.65700912475586,0
Should this teacher ever dare Jason to yell?,This teacher should ever dare Jason to yell.,semantics,npi_licensing,matrix_question_npi_licensor_present,True,False,True,True,528,-65.03578186035156,-63.8946647644043,0
Might Gregory ever hate Victoria?,Gregory might ever hate Victoria.,semantics,npi_licensing,matrix_question_npi_licensor_present,True,False,True,True,529,-53.65734100341797,-50.15558624267578,0
Had Beth ever tempted Carol to win?,Beth had ever tempted Carol to win.,semantics,npi_licensing,matrix_question_npi_licensor_present,True,False,True,True,530,-60.372230529785156,-56.68811798095703,0
Might the teenagers ever divorce?,The teenagers might ever divorce.,semantics,npi_licensing,matrix_question_npi_licensor_present,True,False,True,True,531,-50.07550048828125,-43.003570556640625,0
Had Raymond ever scratched?,Raymond had ever scratched.,semantics,npi_licensing,matrix_question_npi_licensor_present,True,False,True,True,532,-34.17158508300781,-34.69647216796875,1
Should Kristen ever dare this customer to smile?,Kristen should ever dare this customer to smile.,semantics,npi_licensing,matrix_question_npi_licensor_present,True,False,True,True,533,-63.918304443359375,-61.694358825683594,0
Has a man ever watched Judy?,A man has ever watched Judy.,semantics,npi_licensing,matrix_question_npi_licensor_present,True,False,True,True,534,-39.553855895996094,-44.57846450805664,1
Had Susan ever yearned to litter?,Susan had ever yearned to litter.,semantics,npi_licensing,matrix_question_npi_licensor_present,True,False,True,True,535,-60.069007873535156,-52.6536750793457,0
Had Gerald ever protested?,Gerald had ever protested.,semantics,npi_licensing,matrix_question_npi_licensor_present,True,False,True,True,536,-36.97705841064453,-34.140113830566406,0
Might all carts ever accelerate?,All carts might ever accelerate.,semantics,npi_licensing,matrix_question_npi_licensor_present,True,False,True,True,537,-57.45641326904297,-45.868255615234375,0
Has Clyde ever changed?,Clyde has ever changed.,semantics,npi_licensing,matrix_question_npi_licensor_present,True,False,True,True,538,-32.745643615722656,-44.99602508544922,1
Has Alice ever murmured?,Alice has ever murmured.,semantics,npi_licensing,matrix_question_npi_licensor_present,True,False,True,True,539,-39.945980072021484,-29.325973510742188,0
Had some lakes ever vaporized?,Some lakes had ever vaporized.,semantics,npi_licensing,matrix_question_npi_licensor_present,True,False,True,True,540,-51.60618591308594,-47.43367004394531,0
Has Katherine ever discovered the men?,Katherine has ever discovered the men.,semantics,npi_licensing,matrix_question_npi_licensor_present,True,False,True,True,541,-43.81140899658203,-45.03736114501953,1
Have the Impressionists ever reacted?,The Impressionists have ever reacted.,semantics,npi_licensing,matrix_question_npi_licensor_present,True,False,True,True,542,-60.82298278808594,-56.52412414550781,0
Might a man ever spin around?,A man might ever spin around.,semantics,npi_licensing,matrix_question_npi_licensor_present,True,False,True,True,543,-48.61946105957031,-41.28107833862305,0
Has Beth ever spun around?,Beth has ever spun around.,semantics,npi_licensing,matrix_question_npi_licensor_present,True,False,True,True,544,-38.73523712158203,-39.05561828613281,1
Had Becca ever gone to a lot of banks?,Becca had ever gone to a lot of banks.,semantics,npi_licensing,matrix_question_npi_licensor_present,True,False,True,True,545,-62.585174560546875,-54.764915466308594,0
Had Rachelle ever proven to play?,Rachelle had ever proven to play.,semantics,npi_licensing,matrix_question_npi_licensor_present,True,False,True,True,546,-52.71287536621094,-43.42571258544922,0
Had that chair ever shattered?,That chair had ever shattered.,semantics,npi_licensing,matrix_question_npi_licensor_present,True,False,True,True,547,-37.67809295654297,-37.443397521972656,0
Should all skirts ever stretch?,All skirts should ever stretch.,semantics,npi_licensing,matrix_question_npi_licensor_present,True,False,True,True,548,-42.32436752319336,-39.038368225097656,0
Could this icicle ever evaporate?,This icicle could ever evaporate.,semantics,npi_licensing,matrix_question_npi_licensor_present,True,False,True,True,549,-54.745269775390625,-51.325401306152344,0
Had Martin ever escaped?,Martin had ever escaped.,semantics,npi_licensing,matrix_question_npi_licensor_present,True,False,True,True,550,-34.29861068725586,-24.698177337646484,0
Can the woman ever cook?,The woman can ever cook.,semantics,npi_licensing,matrix_question_npi_licensor_present,True,False,True,True,551,-33.59221267700195,-32.38212203979492,0
Has Diana ever ascended most stairs?,Diana has ever ascended most stairs.,semantics,npi_licensing,matrix_question_npi_licensor_present,True,False,True,True,552,-52.239593505859375,-54.334529876708984,1
Would a scarf ever stretch?,A scarf would ever stretch.,semantics,npi_licensing,matrix_question_npi_licensor_present,True,False,True,True,553,-36.326045989990234,-39.7467041015625,1
Had Danielle ever remembered who shrugs?,Danielle had ever remembered who shrugs.,semantics,npi_licensing,matrix_question_npi_licensor_present,True,False,True,True,554,-56.09158706665039,-53.520172119140625,0
Have these coats ever shrunk?,These coats have ever shrunk.,semantics,npi_licensing,matrix_question_npi_licensor_present,True,False,True,True,555,-41.53287887573242,-40.488555908203125,0
Could this student ever shout?,This student could ever shout.,semantics,npi_licensing,matrix_question_npi_licensor_present,True,False,True,True,556,-38.916534423828125,-36.99626922607422,0
Had all icicles ever bothered Renee?,All icicles had ever bothered Renee.,semantics,npi_licensing,matrix_question_npi_licensor_present,True,False,True,True,557,-69.33393859863281,-66.2077865600586,0
Will Cheryl ever escape from Laura?,Cheryl will ever escape from Laura.,semantics,npi_licensing,matrix_question_npi_licensor_present,True,False,True,True,558,-47.6110954284668,-57.677833557128906,1
Had every legislature ever yearned to embarrass a university?,Every legislature had ever yearned to embarrass a university.,semantics,npi_licensing,matrix_question_npi_licensor_present,True,False,True,True,559,-82.31427764892578,-75.70883178710938,0
Has some unicycle ever stopped?,Some unicycle has ever stopped.,semantics,npi_licensing,matrix_question_npi_licensor_present,True,False,True,True,560,-44.8428955078125,-43.93641662597656,0
Had the cashiers ever appeared to buy those newspaper articles?,The cashiers had ever appeared to buy those newspaper articles.,semantics,npi_licensing,matrix_question_npi_licensor_present,True,False,True,True,561,-80.54711151123047,-79.5172119140625,0
Will Helen ever move?,Helen will ever move.,semantics,npi_licensing,matrix_question_npi_licensor_present,True,False,True,True,562,-31.497926712036133,-29.141921997070312,0
Had a girl ever telephoned?,A girl had ever telephoned.,semantics,npi_licensing,matrix_question_npi_licensor_present,True,False,True,True,563,-48.40259552001953,-49.807411193847656,1
Did Judy ever wear most scarves?,Judy did ever wear most scarves.,semantics,npi_licensing,matrix_question_npi_licensor_present,True,False,True,True,564,-62.62933349609375,-59.050933837890625,0
Could Wendy ever learn who is going fishing?,Wendy could ever learn who is going fishing.,semantics,npi_licensing,matrix_question_npi_licensor_present,True,False,True,True,565,-55.808319091796875,-61.61432647705078,1
Did Steven ever stun Brad?,Steven did ever stun Brad.,semantics,npi_licensing,matrix_question_npi_licensor_present,True,False,True,True,566,-46.23036575317383,-42.693939208984375,0
Would Patrick ever see?,Patrick would ever see.,semantics,npi_licensing,matrix_question_npi_licensor_present,True,False,True,True,567,-28.1940860748291,-20.17041015625,0
Did Jacqueline ever fall asleep?,Jacqueline did ever fall asleep.,semantics,npi_licensing,matrix_question_npi_licensor_present,True,False,True,True,568,-45.94550323486328,-46.46186065673828,1
Has that patient ever departed?,That patient has ever departed.,semantics,npi_licensing,matrix_question_npi_licensor_present,True,False,True,True,569,-39.180442810058594,-37.473201751708984,0
Have these associations ever forgotten about who isn't finding Angela?,These associations have ever forgotten about who isn't finding Angela.,semantics,npi_licensing,matrix_question_npi_licensor_present,True,False,True,True,570,-78.66766357421875,-75.83013916015625,0
Might James ever forget who confer?,James might ever forget who confer.,semantics,npi_licensing,matrix_question_npi_licensor_present,True,False,True,True,571,-59.088172912597656,-47.826202392578125,0
Has Victoria ever lied?,Victoria has ever lied.,semantics,npi_licensing,matrix_question_npi_licensor_present,True,False,True,True,572,-36.912742614746094,-26.12880516052246,0
Will Natalie ever escape?,Natalie will ever escape.,semantics,npi_licensing,matrix_question_npi_licensor_present,True,False,True,True,573,-32.83995056152344,-35.11432647705078,1
Had Becky ever preferred those cashiers to confuse a lot of senators?,Becky had ever preferred those cashiers to confuse a lot of senators.,semantics,npi_licensing,matrix_question_npi_licensor_present,True,False,True,True,574,-98.75520324707031,-94.67408752441406,0
Might a committee ever conspire?,A committee might ever conspire.,semantics,npi_licensing,matrix_question_npi_licensor_present,True,False,True,True,575,-61.93088150024414,-53.55691909790039,0
Had Rhonda ever scanned the commentaries?,Rhonda had ever scanned the commentaries.,semantics,npi_licensing,matrix_question_npi_licensor_present,True,False,True,True,576,-75.90496063232422,-62.687644958496094,0
Has Paul ever described Bradley?,Paul has ever described Bradley.,semantics,npi_licensing,matrix_question_npi_licensor_present,True,False,True,True,577,-45.05387878417969,-37.63923645019531,0
Might pedestrians ever embrace?,Pedestrians might ever embrace.,semantics,npi_licensing,matrix_question_npi_licensor_present,True,False,True,True,578,-46.929351806640625,-51.001441955566406,1
Would most libraries ever manage to protest?,Most libraries would ever manage to protest.,semantics,npi_licensing,matrix_question_npi_licensor_present,True,False,True,True,579,-54.0450325012207,-48.28850555419922,0
Has Kristen ever argued?,Kristen has ever argued.,semantics,npi_licensing,matrix_question_npi_licensor_present,True,False,True,True,580,-33.994781494140625,-30.209386825561523,0
Would the Borgias ever swallow?,The Borgias would ever swallow.,semantics,npi_licensing,matrix_question_npi_licensor_present,True,False,True,True,581,-50.74781799316406,-47.315513610839844,0
Can Curtis ever predict many hills to aggravate Richard?,Curtis can ever predict many hills to aggravate Richard.,semantics,npi_licensing,matrix_question_npi_licensor_present,True,False,True,True,582,-84.77951049804688,-89.73713684082031,1
Have most boys ever regretted David intends to dislike documentaries?,Most boys have ever regretted David intends to dislike documentaries.,semantics,npi_licensing,matrix_question_npi_licensor_present,True,False,True,True,583,-87.24308776855469,-80.94625091552734,0
Had all girls ever commissioned Carl to come here?,All girls had ever commissioned Carl to come here.,semantics,npi_licensing,matrix_question_npi_licensor_present,True,False,True,True,584,-64.45692443847656,-61.667198181152344,0
Did that doctor ever notice Amy?,That doctor did ever notice Amy.,semantics,npi_licensing,matrix_question_npi_licensor_present,True,False,True,True,585,-41.93733215332031,-47.29954147338867,1
Would William ever mutter?,William would ever mutter.,semantics,npi_licensing,matrix_question_npi_licensor_present,True,False,True,True,586,-40.860103607177734,-33.05168533325195,0
Has the river ever frozen?,The river has ever frozen.,semantics,npi_licensing,matrix_question_npi_licensor_present,True,False,True,True,587,-34.372039794921875,-33.87907409667969,0
Can many schools ever clash?,Many schools can ever clash.,semantics,npi_licensing,matrix_question_npi_licensor_present,True,False,True,True,588,-40.74025344848633,-39.100311279296875,0
Has Jill ever looked to dry?,Jill has ever looked to dry.,semantics,npi_licensing,matrix_question_npi_licensor_present,True,False,True,True,589,-44.253013610839844,-44.072166442871094,0
Should Vincent ever hire Brett?,Vincent should ever hire Brett.,semantics,npi_licensing,matrix_question_npi_licensor_present,True,False,True,True,590,-45.000709533691406,-50.94988250732422,1
Would Kimberley ever hide?,Kimberley would ever hide.,semantics,npi_licensing,matrix_question_npi_licensor_present,True,False,True,True,591,-42.81843566894531,-44.12635803222656,1
Can Anna ever like Stacy?,Anna can ever like Stacy.,semantics,npi_licensing,matrix_question_npi_licensor_present,True,False,True,True,592,-40.34297180175781,-35.76873016357422,0
Would Sharon ever long to tour this glacier?,Sharon would ever long to tour this glacier.,semantics,npi_licensing,matrix_question_npi_licensor_present,True,False,True,True,593,-65.80720520019531,-66.26590728759766,1
Has Tammy ever escaped?,Tammy has ever escaped.,semantics,npi_licensing,matrix_question_npi_licensor_present,True,False,True,True,594,-34.55195236206055,-30.41240119934082,0
Had Danielle ever admired the computers?,Danielle had ever admired the computers.,semantics,npi_licensing,matrix_question_npi_licensor_present,True,False,True,True,595,-49.11267852783203,-44.13556671142578,0
Could those organizations ever succeed?,Those organizations could ever succeed.,semantics,npi_licensing,matrix_question_npi_licensor_present,True,False,True,True,596,-41.88481140136719,-37.06329345703125,0
Has Holly ever continued to break that computer?,Holly has ever continued to break that computer.,semantics,npi_licensing,matrix_question_npi_licensor_present,True,False,True,True,597,-55.855140686035156,-55.80998229980469,0
Will the Lutherans ever laugh?,The Lutherans will ever laugh.,semantics,npi_licensing,matrix_question_npi_licensor_present,True,False,True,True,598,-50.043296813964844,-46.705039978027344,0
Has every waiter ever said some guys stretch?,Every waiter has ever said some guys stretch.,semantics,npi_licensing,matrix_question_npi_licensor_present,True,False,True,True,599,-66.67082214355469,-61.378753662109375,0
Had Rodney ever investigated who have disappeared?,Rodney had ever investigated who have disappeared.,semantics,npi_licensing,matrix_question_npi_licensor_present,True,False,True,True,600,-57.026397705078125,-56.65058898925781,0
Had most teachers ever flirted?,Most teachers had ever flirted.,semantics,npi_licensing,matrix_question_npi_licensor_present,True,False,True,True,601,-47.105587005615234,-42.67108917236328,0
Should those doctors ever approve?,Those doctors should ever approve.,semantics,npi_licensing,matrix_question_npi_licensor_present,True,False,True,True,602,-36.30302429199219,-35.481563568115234,0
Will Joseph ever litter?,Joseph will ever litter.,semantics,npi_licensing,matrix_question_npi_licensor_present,True,False,True,True,603,-36.65317916870117,-29.382312774658203,0
Do many adults ever force Sabrina's fathers to debate?,Many adults do ever force Sabrina's fathers to debate.,semantics,npi_licensing,matrix_question_npi_licensor_present,True,False,True,True,604,-89.88902282714844,-87.044677734375,0
Did a doctor ever ascend that mountain?,A doctor did ever ascend that mountain.,semantics,npi_licensing,matrix_question_npi_licensor_present,True,False,True,True,605,-51.63475036621094,-56.65637969970703,1
Will boys ever collaborate?,Boys will ever collaborate.,semantics,npi_licensing,matrix_question_npi_licensor_present,True,False,True,True,606,-35.1308479309082,-40.438941955566406,1
Has Rodney ever distracted Katherine?,Rodney has ever distracted Katherine.,semantics,npi_licensing,matrix_question_npi_licensor_present,True,False,True,True,607,-48.83118438720703,-48.38623809814453,0
Had Dana ever boycotted that legislature?,Dana had ever boycotted that legislature.,semantics,npi_licensing,matrix_question_npi_licensor_present,True,False,True,True,608,-71.84197998046875,-72.5962905883789,1
Had Michael ever hidden that gate?,Michael had ever hidden that gate.,semantics,npi_licensing,matrix_question_npi_licensor_present,True,False,True,True,609,-46.35569381713867,-40.04944610595703,0
Did every cup ever chip?,Every cup did ever chip.,semantics,npi_licensing,matrix_question_npi_licensor_present,True,False,True,True,610,-40.02252197265625,-38.343807220458984,0
Would Bill ever forget Tonya?,Bill would ever forget Tonya.,semantics,npi_licensing,matrix_question_npi_licensor_present,True,False,True,True,611,-51.08872604370117,-45.03539276123047,0
Had this woman ever explored a college campus?,This woman had ever explored a college campus.,semantics,npi_licensing,matrix_question_npi_licensor_present,True,False,True,True,612,-61.25873947143555,-57.796142578125,0
Had Randolf ever climbed up the mountain?,Randolf had ever climbed up the mountain.,semantics,npi_licensing,matrix_question_npi_licensor_present,True,False,True,True,613,-57.80182647705078,-46.91805648803711,0
Has Susan ever protested?,Susan has ever protested.,semantics,npi_licensing,matrix_question_npi_licensor_present,True,False,True,True,614,-34.43051528930664,-27.608455657958984,0
Does Tina ever leave?,Tina does ever leave.,semantics,npi_licensing,matrix_question_npi_licensor_present,True,False,True,True,615,-31.341232299804688,-32.08810806274414,1
Did those waiters ever get a job?,Those waiters did ever get a job.,semantics,npi_licensing,matrix_question_npi_licensor_present,True,False,True,True,616,-52.633201599121094,-49.75370788574219,0
Does Amelia ever exercise?,Amelia does ever exercise.,semantics,npi_licensing,matrix_question_npi_licensor_present,True,False,True,True,617,-34.693931579589844,-38.83525848388672,1
Might a pedestrian ever talk about Becca?,A pedestrian might ever talk about Becca.,semantics,npi_licensing,matrix_question_npi_licensor_present,True,False,True,True,618,-65.20265197753906,-58.48433303833008,0
Have many students ever shrugged?,Many students have ever shrugged.,semantics,npi_licensing,matrix_question_npi_licensor_present,True,False,True,True,619,-38.93803405761719,-35.9726448059082,0
Had William ever imagined Colleen hadn't bothered Marcus?,William had ever imagined Colleen hadn't bothered Marcus.,semantics,npi_licensing,matrix_question_npi_licensor_present,True,False,True,True,620,-88.21726989746094,-81.29318237304688,0
Has Amanda ever proven to turn?,Amanda has ever proven to turn.,semantics,npi_licensing,matrix_question_npi_licensor_present,True,False,True,True,621,-44.228004455566406,-44.82152557373047,1
Had Carlos ever obligated Rodney to wash?,Carlos had ever obligated Rodney to wash.,semantics,npi_licensing,matrix_question_npi_licensor_present,True,False,True,True,622,-68.34939575195312,-64.26356506347656,0
Did coats ever flatten?,Coats did ever flatten.,semantics,npi_licensing,matrix_question_npi_licensor_present,True,False,True,True,623,-42.53302001953125,-43.114078521728516,1
Can Candice ever describe Robert?,Candice can ever describe Robert.,semantics,npi_licensing,matrix_question_npi_licensor_present,True,False,True,True,624,-49.82481384277344,-42.97947692871094,0
Had Rachelle ever watched a lot of pedestrians?,Rachelle had ever watched a lot of pedestrians.,semantics,npi_licensing,matrix_question_npi_licensor_present,True,False,True,True,625,-63.92993927001953,-54.706363677978516,0
Should the broccoli ever blacken?,The broccoli should ever blacken.,semantics,npi_licensing,matrix_question_npi_licensor_present,True,False,True,True,626,-46.32361602783203,-49.07378005981445,1
Has Carrie ever commissioned the niece of Frank to climb up many mountains?,Carrie has ever commissioned the niece of Frank to climb up many mountains.,semantics,npi_licensing,matrix_question_npi_licensor_present,True,False,True,True,627,-94.98890686035156,-94.82540130615234,0
Had Tiffany ever shouted?,Tiffany had ever shouted.,semantics,npi_licensing,matrix_question_npi_licensor_present,True,False,True,True,628,-37.538055419921875,-41.595035552978516,1
Has Nicole ever seemed to profit?,Nicole has ever seemed to profit.,semantics,npi_licensing,matrix_question_npi_licensor_present,True,False,True,True,629,-45.024410247802734,-44.014366149902344,0
Had Marla ever embarrassed all men?,Marla had ever embarrassed all men.,semantics,npi_licensing,matrix_question_npi_licensor_present,True,False,True,True,630,-54.3342170715332,-47.751731872558594,0
Will many jackets ever vanish?,Many jackets will ever vanish.,semantics,npi_licensing,matrix_question_npi_licensor_present,True,False,True,True,631,-45.039215087890625,-40.80245590209961,0
Had many drivers ever obligated the girl to confuse Steve?,Many drivers had ever obligated the girl to confuse Steve.,semantics,npi_licensing,matrix_question_npi_licensor_present,True,False,True,True,632,-80.41773986816406,-77.42977905273438,0
Would Rachel ever remember what can close?,Rachel would ever remember what can close.,semantics,npi_licensing,matrix_question_npi_licensor_present,True,False,True,True,633,-44.57442092895508,-39.633018493652344,0
Can Beverly ever argue?,Beverly can ever argue.,semantics,npi_licensing,matrix_question_npi_licensor_present,True,False,True,True,634,-35.558815002441406,-42.83595275878906,1
Does Dan ever try to scare Derek?,Dan does ever try to scare Derek.,semantics,npi_licensing,matrix_question_npi_licensor_present,True,False,True,True,635,-47.99026870727539,-46.17574691772461,0
Do those forks ever crack?,Those forks do ever crack.,semantics,npi_licensing,matrix_question_npi_licensor_present,True,False,True,True,636,-40.738773345947266,-39.40827941894531,0
Did Edward ever shock a lot of universities?,Edward did ever shock a lot of universities.,semantics,npi_licensing,matrix_question_npi_licensor_present,True,False,True,True,637,-56.8333854675293,-51.29469299316406,0
Had Jason ever complained?,Jason had ever complained.,semantics,npi_licensing,matrix_question_npi_licensor_present,True,False,True,True,638,-33.3780517578125,-25.712217330932617,0
Could Monica ever laugh?,Monica could ever laugh.,semantics,npi_licensing,matrix_question_npi_licensor_present,True,False,True,True,639,-34.65996170043945,-35.46571350097656,1
Can every woman ever vanish?,Every woman can ever vanish.,semantics,npi_licensing,matrix_question_npi_licensor_present,True,False,True,True,640,-40.84008026123047,-37.65510559082031,0
Had Margaret ever seemed to scare Spain?,Margaret had ever seemed to scare Spain.,semantics,npi_licensing,matrix_question_npi_licensor_present,True,False,True,True,641,-49.38197708129883,-50.846168518066406,1
Has Galileo ever spurred Vincent to walk through a lot of public parks?,Galileo has ever spurred Vincent to walk through a lot of public parks.,semantics,npi_licensing,matrix_question_npi_licensor_present,True,False,True,True,642,-93.43663024902344,-96.57503509521484,1
Has Diana ever remembered the lady?,Diana has ever remembered the lady.,semantics,npi_licensing,matrix_question_npi_licensor_present,True,False,True,True,643,-41.63087463378906,-43.40080642700195,1
Has this legislature ever cooperated?,This legislature has ever cooperated.,semantics,npi_licensing,matrix_question_npi_licensor_present,True,False,True,True,644,-52.92864990234375,-47.34814453125,0
Had the Borgias ever bored the Lutherans?,The Borgias had ever bored the Lutherans.,semantics,npi_licensing,matrix_question_npi_licensor_present,True,False,True,True,645,-72.96477508544922,-69.45735168457031,0
Did Barbara ever appear to vaporize?,Barbara did ever appear to vaporize.,semantics,npi_licensing,matrix_question_npi_licensor_present,True,False,True,True,646,-56.02293014526367,-59.09149932861328,1
Has Kenneth ever complained?,Kenneth has ever complained.,semantics,npi_licensing,matrix_question_npi_licensor_present,True,False,True,True,647,-34.64958190917969,-32.63966369628906,0
Could most waitresses ever talk to a patient?,Most waitresses could ever talk to a patient.,semantics,npi_licensing,matrix_question_npi_licensor_present,True,False,True,True,648,-68.7848129272461,-59.24016571044922,0
