sentence_good,sentence_bad,field,linguistics_term,UID,simple_LM_method,one_prefix_method,two_prefix_method,lexically_identical,pair_id,good_prob,bad_prob,correct
Raymond is selling this sketch.,Raymond is selling this sketches.,morphology,determiner_noun_agreement,determiner_noun_agreement_1,True,True,False,True,0,-39.755882263183594,-43.15169143676758,1
Craig explored that grocery store.,Craig explored that grocery stores.,morphology,determiner_noun_agreement,determiner_noun_agreement_1,True,True,False,True,1,-35.800010681152344,-36.789737701416016,1
Eva has scared these children.,Eva has scared these child.,morphology,determiner_noun_agreement,determiner_noun_agreement_1,True,True,False,True,2,-32.075687408447266,-36.0041389465332,1
Marcus would conceal that pamphlet.,Marcus would conceal that pamphlets.,morphology,determiner_noun_agreement,determiner_noun_agreement_1,True,True,False,True,3,-38.92930221557617,-41.63433837890625,1
Carmen hadn't shocked these customers.,Carmen hadn't shocked these customer.,morphology,determiner_noun_agreement,determiner_noun_agreement_1,True,True,False,True,4,-55.10006332397461,-57.505924224853516,1
The Impressionists were walking through this library.,The Impressionists were walking through this libraries.,morphology,determiner_noun_agreement,determiner_noun_agreement_1,True,True,False,True,5,-49.569976806640625,-54.024208068847656,1
Some men weren't touring those cafes.,Some men weren't touring those cafe.,morphology,determiner_noun_agreement,determiner_noun_agreement_1,True,True,False,True,6,-47.274681091308594,-49.6872444152832,1
Leslie isn't firing that actress.,Leslie isn't firing that actresses.,morphology,determiner_noun_agreement,determiner_noun_agreement_1,True,True,False,True,7,-52.01728057861328,-53.709632873535156,1
Jennifer concealed those cups.,Jennifer concealed those cup.,morphology,determiner_noun_agreement,determiner_noun_agreement_1,True,True,False,True,8,-34.045204162597656,-37.871578216552734,1
A waitress does take those hospitals.,A waitress does take those hospital.,morphology,determiner_noun_agreement,determiner_noun_agreement_1,True,True,False,True,9,-49.12667465209961,-49.54703903198242,1
The man walks through those hospitals.,The man walks through those hospital.,morphology,determiner_noun_agreement,determiner_noun_agreement_1,True,True,False,True,10,-42.739009857177734,-43.15324020385742,1
Winston Churchill boycotts these public parks.,Winston Churchill boycotts these public park.,morphology,determiner_noun_agreement,determiner_noun_agreement_1,True,True,False,True,11,-59.32456970214844,-62.32878112792969,1
This sock disturbs that customer.,This sock disturbs that customers.,morphology,determiner_noun_agreement,determiner_noun_agreement_1,True,True,False,True,12,-47.873329162597656,-47.761741638183594,0
William described this movie.,William described this movies.,morphology,determiner_noun_agreement,determiner_noun_agreement_1,True,True,False,True,13,-25.50940704345703,-30.04739761352539,1
Monet dropped by those libraries.,Monet dropped by those library.,morphology,determiner_noun_agreement,determiner_noun_agreement_1,True,True,False,True,14,-46.5411262512207,-48.178768157958984,1
Elaine was biking to this bank.,Elaine was biking to this banks.,morphology,determiner_noun_agreement,determiner_noun_agreement_1,True,True,False,True,15,-49.25945281982422,-53.20552062988281,1
These senators wear that jacket.,These senators wear that jackets.,morphology,determiner_noun_agreement,determiner_noun_agreement_1,True,True,False,True,16,-41.49449157714844,-44.023536682128906,1
The Lutherans notice that drawing.,The Lutherans notice that drawings.,morphology,determiner_noun_agreement,determiner_noun_agreement_1,True,True,False,True,17,-51.76780700683594,-55.60326385498047,1
Cheryl is hurting that teacher.,Cheryl is hurting that teachers.,morphology,determiner_noun_agreement,determiner_noun_agreement_1,True,True,False,True,18,-61.46372985839844,-62.83133316040039,1
Russell might break those cups.,Russell might break those cup.,morphology,determiner_noun_agreement,determiner_noun_agreement_1,True,True,False,True,19,-34.028663635253906,-35.24976348876953,1
A lot of patients resemble these pictures.,A lot of patients resemble these picture.,morphology,determiner_noun_agreement,determiner_noun_agreement_1,True,True,False,True,20,-42.18056869506836,-44.447349548339844,1
Vanessa can talk to these doctors.,Vanessa can talk to these doctor.,morphology,determiner_noun_agreement,determiner_noun_agreement_1,True,True,False,True,21,-41.624935150146484,-43.53643798828125,1
Janice had worn this shawl.,Janice had worn this shawls.,morphology,determiner_noun_agreement,determiner_noun_agreement_1,True,True,False,True,22,-54.041770935058594,-54.43742752075195,1
A lot of waitresses find those jackets.,A lot of waitresses find those jacket.,morphology,determiner_noun_agreement,determiner_noun_agreement_1,True,True,False,True,23,-54.95211410522461,-56.0122184753418,1
Every dancer hasn't admired this skirt.,Every dancer hasn't admired this skirts.,morphology,determiner_noun_agreement,determiner_noun_agreement_1,True,True,False,True,24,-47.776859283447266,-52.8532829284668,1
The adult doesn't hide those malls.,The adult doesn't hide those mall.,morphology,determiner_noun_agreement,determiner_noun_agreement_1,True,True,False,True,25,-46.8994140625,-50.15192794799805,1
Samuel criticizes that art gallery.,Samuel criticizes that art galleries.,morphology,determiner_noun_agreement,determiner_noun_agreement_1,True,True,False,True,26,-51.72624206542969,-51.17169189453125,0
A teacher annoyed those senators.,A teacher annoyed those senator.,morphology,determiner_noun_agreement,determiner_noun_agreement_1,True,True,False,True,27,-47.882015228271484,-49.30176544189453,1
A teacher talked to that customer.,A teacher talked to that customers.,morphology,determiner_noun_agreement,determiner_noun_agreement_1,True,True,False,True,28,-40.90932846069336,-44.53318786621094,1
Mark discovered this face.,Mark discovered this faces.,morphology,determiner_noun_agreement,determiner_noun_agreement_1,True,True,False,True,29,-26.690086364746094,-31.51972198486328,1
Carmen toured these restaurants.,Carmen toured these restaurant.,morphology,determiner_noun_agreement,determiner_noun_agreement_1,True,True,False,True,30,-45.986175537109375,-49.017333984375,1
Eva toured this school.,Eva toured this schools.,morphology,determiner_noun_agreement,determiner_noun_agreement_1,True,True,False,True,31,-27.588396072387695,-31.609418869018555,1
Travis would tour that hospital.,Travis would tour that hospitals.,morphology,determiner_noun_agreement,determiner_noun_agreement_1,True,True,False,True,32,-48.35049057006836,-53.80845642089844,1
Some stories aggravated those libraries.,Some stories aggravated those library.,morphology,determiner_noun_agreement,determiner_noun_agreement_1,True,True,False,True,33,-45.56800079345703,-48.376983642578125,1
These cashiers hate that guest.,These cashiers hate that guests.,morphology,determiner_noun_agreement,determiner_noun_agreement_1,True,True,False,True,34,-47.86799621582031,-47.258846282958984,0
Heather messed up this dish.,Heather messed up this dishs.,morphology,determiner_noun_agreement,determiner_noun_agreement_1,True,True,False,True,35,-36.892635345458984,-49.240509033203125,1
Alan listened to these guests.,Alan listened to these guest.,morphology,determiner_noun_agreement,determiner_noun_agreement_1,True,True,False,True,36,-29.12128448486328,-32.464378356933594,1
Most children examine this pamphlet.,Most children examine this pamphlets.,morphology,determiner_noun_agreement,determiner_noun_agreement_1,True,True,False,True,37,-35.99013137817383,-40.90861129760742,1
Stacey will know these patients.,Stacey will know these patient.,morphology,determiner_noun_agreement,determiner_noun_agreement_1,True,True,False,True,38,-40.17513656616211,-45.04197692871094,1
Jessica sold this rabbit.,Jessica sold this rabbits.,morphology,determiner_noun_agreement,determiner_noun_agreement_1,True,True,False,True,39,-29.762636184692383,-31.84033203125,1
Daniel couldn't hate those cashiers.,Daniel couldn't hate those cashier.,morphology,determiner_noun_agreement,determiner_noun_agreement_1,True,True,False,True,40,-41.26652526855469,-39.809593200683594,0
Those ladies kiss those adults.,Those ladies kiss those adult.,morphology,determiner_noun_agreement,determiner_noun_agreement_1,True,True,False,True,41,-37.967308044433594,-40.216827392578125,1
Diane works with these waiters.,Diane works with these waiter.,morphology,determiner_noun_agreement,determiner_noun_agreement_1,True,True,False,True,42,-48.87287902832031,-49.47267532348633,1
Most women conceal that blouse.,Most women conceal that blouses.,morphology,determiner_noun_agreement,determiner_noun_agreement_1,True,True,False,True,43,-42.946041107177734,-44.21308135986328,1
Senators can't disagree with that newspaper article.,Senators can't disagree with that newspaper articles.,morphology,determiner_noun_agreement,determiner_noun_agreement_1,True,True,False,True,44,-47.90312957763672,-47.843994140625,0
Jane has concealed this book.,Jane has concealed this books.,morphology,determiner_noun_agreement,determiner_noun_agreement_1,True,True,False,True,45,-29.859352111816406,-33.98573303222656,1
Marla took this pamphlet.,Marla took this pamphlets.,morphology,determiner_noun_agreement,determiner_noun_agreement_1,True,True,False,True,46,-37.56769561767578,-43.824180603027344,1
The skirt wasn't annoying those dancers.,The skirt wasn't annoying those dancer.,morphology,determiner_noun_agreement,determiner_noun_agreement_1,True,True,False,True,47,-54.099308013916016,-55.80979919433594,1
Most guys conceal this driver.,Most guys conceal this drivers.,morphology,determiner_noun_agreement,determiner_noun_agreement_1,True,True,False,True,48,-38.015960693359375,-40.263885498046875,1
David wasn't lifting those hats.,David wasn't lifting those hat.,morphology,determiner_noun_agreement,determiner_noun_agreement_1,True,True,False,True,49,-37.44327163696289,-38.38280487060547,1
The dancers are driving to those art galleries.,The dancers are driving to those art gallery.,morphology,determiner_noun_agreement,determiner_noun_agreement_1,True,True,False,True,50,-48.55155563354492,-52.89624786376953,1
Tracy might cure those patients.,Tracy might cure those patient.,morphology,determiner_noun_agreement,determiner_noun_agreement_1,True,True,False,True,51,-38.43330383300781,-43.91687774658203,1
Heather cleans that print.,Heather cleans that prints.,morphology,determiner_noun_agreement,determiner_noun_agreement_1,True,True,False,True,52,-38.49909591674805,-40.2591438293457,1
Rose won't reference these movies.,Rose won't reference these movie.,morphology,determiner_noun_agreement,determiner_noun_agreement_1,True,True,False,True,53,-38.85460662841797,-42.94559097290039,1
Many reports irritate these senators.,Many reports irritate these senator.,morphology,determiner_noun_agreement,determiner_noun_agreement_1,True,True,False,True,54,-48.698638916015625,-53.35547637939453,1
Dan couldn't walk through this public park.,Dan couldn't walk through this public parks.,morphology,determiner_noun_agreement,determiner_noun_agreement_1,True,True,False,True,55,-37.55295944213867,-41.15085220336914,1
Rose hated this girl.,Rose hated this girls.,morphology,determiner_noun_agreement,determiner_noun_agreement_1,True,True,False,True,56,-25.384014129638672,-29.56157875061035,1
Melinda hires that teacher.,Melinda hires that teachers.,morphology,determiner_noun_agreement,determiner_noun_agreement_1,True,True,False,True,57,-45.124752044677734,-44.47240447998047,0
Joseph healed these customers.,Joseph healed these customer.,morphology,determiner_noun_agreement,determiner_noun_agreement_1,True,True,False,True,58,-33.47270202636719,-37.29667663574219,1
A door doesn't distract those students.,A door doesn't distract those student.,morphology,determiner_noun_agreement,determiner_noun_agreement_1,True,True,False,True,59,-42.013084411621094,-45.430267333984375,1
Theodore skated around that art gallery.,Theodore skated around that art galleries.,morphology,determiner_noun_agreement,determiner_noun_agreement_1,True,True,False,True,60,-60.33940124511719,-60.919403076171875,1
These tomatoes shock these dancers.,These tomatoes shock these dancer.,morphology,determiner_noun_agreement,determiner_noun_agreement_1,True,True,False,True,61,-49.80393981933594,-55.17906188964844,1
Guys observe these children.,Guys observe these child.,morphology,determiner_noun_agreement,determiner_noun_agreement_1,True,True,False,True,62,-37.462554931640625,-41.28656768798828,1
Some guests flee from those dancers.,Some guests flee from those dancer.,morphology,determiner_noun_agreement,determiner_noun_agreement_1,True,True,False,True,63,-41.4685173034668,-46.782814025878906,1
Linda isn't embarrassing these waitresses.,Linda isn't embarrassing these waitress.,morphology,determiner_noun_agreement,determiner_noun_agreement_1,True,True,False,True,64,-55.59915542602539,-52.93994903564453,0
Walter hides these dancers.,Walter hides these dancer.,morphology,determiner_noun_agreement,determiner_noun_agreement_1,True,True,False,True,65,-37.802589416503906,-43.2127571105957,1
Sharon investigated those waiters.,Sharon investigated those waiter.,morphology,determiner_noun_agreement,determiner_noun_agreement_1,True,True,False,True,66,-52.43693161010742,-52.497982025146484,1
Bradley should explore this high school.,Bradley should explore this high schools.,morphology,determiner_noun_agreement,determiner_noun_agreement_1,True,True,False,True,67,-37.84731674194336,-41.20618438720703,1
Tanya wears these socks.,Tanya wears these sock.,morphology,determiner_noun_agreement,determiner_noun_agreement_1,True,True,False,True,68,-34.20903396606445,-39.665225982666016,1
That cat had bored those ladies.,That cat had bored those lady.,morphology,determiner_noun_agreement,determiner_noun_agreement_1,True,True,False,True,69,-48.31202697753906,-51.12335205078125,1
Stephen had cleaned this bank.,Stephen had cleaned this banks.,morphology,determiner_noun_agreement,determiner_noun_agreement_1,True,True,False,True,70,-35.593711853027344,-39.787437438964844,1
Waiters have left that driver.,Waiters have left that drivers.,morphology,determiner_noun_agreement,determiner_noun_agreement_1,True,True,False,True,71,-31.50041961669922,-34.90890884399414,1
Heather wasn't criticizing these teachers.,Heather wasn't criticizing these teacher.,morphology,determiner_noun_agreement,determiner_noun_agreement_1,True,True,False,True,72,-48.742374420166016,-51.9234619140625,1
Brian wasn't concealing those cafes.,Brian wasn't concealing those cafe.,morphology,determiner_noun_agreement,determiner_noun_agreement_1,True,True,False,True,73,-45.876708984375,-48.4713020324707,1
Some trucks weren't boring that cashier.,Some trucks weren't boring that cashiers.,morphology,determiner_noun_agreement,determiner_noun_agreement_1,True,True,False,True,74,-46.579105377197266,-51.138736724853516,1
Many eggplants aren't scaring this teacher.,Many eggplants aren't scaring this teachers.,morphology,determiner_noun_agreement,determiner_noun_agreement_1,True,True,False,True,75,-62.1699333190918,-63.98369216918945,1
Children aren't boring this lady.,Children aren't boring this ladies.,morphology,determiner_noun_agreement,determiner_noun_agreement_1,True,True,False,True,76,-34.1033821105957,-37.61287307739258,1
Karla hadn't brought these pictures.,Karla hadn't brought these picture.,morphology,determiner_noun_agreement,determiner_noun_agreement_1,True,True,False,True,77,-40.16685485839844,-43.2730712890625,1
Janice hasn't cared for that waitress.,Janice hasn't cared for that waitresses.,morphology,determiner_noun_agreement,determiner_noun_agreement_1,True,True,False,True,78,-50.412696838378906,-54.21686935424805,1
A lot of doctors exit those art galleries.,A lot of doctors exit those art gallery.,morphology,determiner_noun_agreement,determiner_noun_agreement_1,True,True,False,True,79,-55.174903869628906,-56.49056625366211,1
Thomas should hug this waiter.,Thomas should hug this waiters.,morphology,determiner_noun_agreement,determiner_noun_agreement_1,True,True,False,True,80,-39.639427185058594,-47.075355529785156,1
Candice hasn't attacked that boy.,Candice hasn't attacked that boys.,morphology,determiner_noun_agreement,determiner_noun_agreement_1,True,True,False,True,81,-45.90828323364258,-48.52520751953125,1
Katherine wasn't taking that public park.,Katherine wasn't taking that public parks.,morphology,determiner_noun_agreement,determiner_noun_agreement_1,True,True,False,True,82,-49.63093185424805,-52.484703063964844,1
The Clintons watch those drivers.,The Clintons watch those driver.,morphology,determiner_noun_agreement,determiner_noun_agreement_1,True,True,False,True,83,-44.411067962646484,-48.14054870605469,1
Amelia loves this waiter.,Amelia loves this waiters.,morphology,determiner_noun_agreement,determiner_noun_agreement_1,True,True,False,True,84,-35.80160903930664,-40.682952880859375,1
Caroline hasn't known this boy.,Caroline hasn't known this boys.,morphology,determiner_noun_agreement,determiner_noun_agreement_1,True,True,False,True,85,-44.240970611572266,-47.43339157104492,1
Sheila isn't passing that cafe.,Sheila isn't passing that cafes.,morphology,determiner_noun_agreement,determiner_noun_agreement_1,True,True,False,True,86,-49.13768005371094,-54.0973014831543,1
Claire had cleaned that picture.,Claire had cleaned that pictures.,morphology,determiner_noun_agreement,determiner_noun_agreement_1,True,True,False,True,87,-42.92511749267578,-44.191200256347656,1
The people exit these movie theaters.,The people exit these movie theater.,morphology,determiner_noun_agreement,determiner_noun_agreement_1,True,True,False,True,88,-45.08674240112305,-46.93885040283203,1
Bruce won't mess up that restaurant.,Bruce won't mess up that restaurants.,morphology,determiner_noun_agreement,determiner_noun_agreement_1,True,True,False,True,89,-37.779754638671875,-43.525848388671875,1
Margaret hasn't bought that blouse.,Margaret hasn't bought that blouses.,morphology,determiner_noun_agreement,determiner_noun_agreement_1,True,True,False,True,90,-47.165218353271484,-48.7547492980957,1
Some waitresses remember that driver.,Some waitresses remember that drivers.,morphology,determiner_noun_agreement,determiner_noun_agreement_1,True,True,False,True,91,-41.40162658691406,-42.98065948486328,1
Timothy loved this boy.,Timothy loved this boys.,morphology,determiner_noun_agreement,determiner_noun_agreement_1,True,True,False,True,92,-34.23414611816406,-38.13776779174805,1
A lot of adults help that guy.,A lot of adults help that guys.,morphology,determiner_noun_agreement,determiner_noun_agreement_1,True,True,False,True,93,-43.166717529296875,-45.91221237182617,1
Steven has broken that cup.,Steven has broken that cups.,morphology,determiner_noun_agreement,determiner_noun_agreement_1,True,True,False,True,94,-31.60467529296875,-35.052589416503906,1
Patricia loved those cashiers.,Patricia loved those cashier.,morphology,determiner_noun_agreement,determiner_noun_agreement_1,True,True,False,True,95,-44.922977447509766,-43.030460357666016,0
Many drivers fix that glass.,Many drivers fix that glasses.,morphology,determiner_noun_agreement,determiner_noun_agreement_1,True,True,False,True,96,-37.641666412353516,-36.308250427246094,0
A lot of cashiers mess up that library.,A lot of cashiers mess up that libraries.,morphology,determiner_noun_agreement,determiner_noun_agreement_1,True,True,False,True,97,-58.210853576660156,-61.18483352661133,1
Waitresses drive to that school.,Waitresses drive to that schools.,morphology,determiner_noun_agreement,determiner_noun_agreement_1,True,True,False,True,98,-39.943702697753906,-45.28270721435547,1
Roger should sound like that waitress.,Roger should sound like that waitresses.,morphology,determiner_noun_agreement,determiner_noun_agreement_1,True,True,False,True,99,-41.00590133666992,-42.78995895385742,1
The Impressionists do listen to this waitress.,The Impressionists do listen to this waitresses.,morphology,determiner_noun_agreement,determiner_noun_agreement_1,True,True,False,True,100,-54.98719024658203,-60.4459114074707,1
Theresa bought this drawing.,Theresa bought this drawings.,morphology,determiner_noun_agreement,determiner_noun_agreement_1,True,True,False,True,101,-38.27161407470703,-41.78572463989258,1
The Impressionists walk through this cafe.,The Impressionists walk through this cafes.,morphology,determiner_noun_agreement,determiner_noun_agreement_1,True,True,False,True,102,-45.50440979003906,-50.450870513916016,1
Thomas can boycott these committees.,Thomas can boycott these committee.,morphology,determiner_noun_agreement,determiner_noun_agreement_1,True,True,False,True,103,-34.0634765625,-37.431861877441406,1
Alan had boasted about those girls.,Alan had boasted about those girl.,morphology,determiner_noun_agreement,determiner_noun_agreement_1,True,True,False,True,104,-42.300140380859375,-46.417701721191406,1
Sally isn't escaping from these boys.,Sally isn't escaping from these boy.,morphology,determiner_noun_agreement,determiner_noun_agreement_1,True,True,False,True,105,-52.26216506958008,-55.53724670410156,1
Jesus can run around this high school.,Jesus can run around this high schools.,morphology,determiner_noun_agreement,determiner_noun_agreement_1,True,True,False,True,106,-35.003780364990234,-38.21501922607422,1
Amy wasn't confusing those companies.,Amy wasn't confusing those company.,morphology,determiner_noun_agreement,determiner_noun_agreement_1,True,True,False,True,107,-38.388092041015625,-39.580421447753906,1
Tanya boycotts that university.,Tanya boycotts that universities.,morphology,determiner_noun_agreement,determiner_noun_agreement_1,True,True,False,True,108,-44.48580551147461,-46.22532272338867,1
Roger ran around this school.,Roger ran around this schools.,morphology,determiner_noun_agreement,determiner_noun_agreement_1,True,True,False,True,109,-29.585905075073242,-35.482566833496094,1
These teachers escape from those restaurants.,These teachers escape from those restaurant.,morphology,determiner_noun_agreement,determiner_noun_agreement_1,True,True,False,True,110,-41.70949172973633,-45.07374572753906,1
Maria was talking to this guest.,Maria was talking to this guests.,morphology,determiner_noun_agreement,determiner_noun_agreement_1,True,True,False,True,111,-31.314695358276367,-32.86824417114258,1
Rachel has hugged those boys.,Rachel has hugged those boy.,morphology,determiner_noun_agreement,determiner_noun_agreement_1,True,True,False,True,112,-34.32174301147461,-35.563262939453125,1
The students fire this patient.,The students fire this patients.,morphology,determiner_noun_agreement,determiner_noun_agreement_1,True,True,False,True,113,-39.59149169921875,-43.09648895263672,1
Jennifer helped those guests.,Jennifer helped those guest.,morphology,determiner_noun_agreement,determiner_noun_agreement_1,True,True,False,True,114,-28.00349998474121,-31.796974182128906,1
Some plays disgust this legislature.,Some plays disgust this legislatures.,morphology,determiner_noun_agreement,determiner_noun_agreement_1,True,True,False,True,115,-46.370201110839844,-50.493080139160156,1
Jerry had hidden these cups.,Jerry had hidden these cup.,morphology,determiner_noun_agreement,determiner_noun_agreement_1,True,True,False,True,116,-34.72904968261719,-38.857234954833984,1
Martin has concealed this boy.,Martin has concealed this boys.,morphology,determiner_noun_agreement,determiner_noun_agreement_1,True,True,False,True,117,-34.5283317565918,-38.269615173339844,1
That person hadn't bothered those girls.,That person hadn't bothered those girl.,morphology,determiner_noun_agreement,determiner_noun_agreement_1,True,True,False,True,118,-44.99421691894531,-46.24907684326172,1
Carla has hired those patients.,Carla has hired those patient.,morphology,determiner_noun_agreement,determiner_noun_agreement_1,True,True,False,True,119,-42.91099548339844,-46.999977111816406,1
Noah talks about this doctor.,Noah talks about this doctors.,morphology,determiner_noun_agreement,determiner_noun_agreement_1,True,True,False,True,120,-35.568504333496094,-38.67841720581055,1
Rachel ran around those high schools.,Rachel ran around those high school.,morphology,determiner_noun_agreement,determiner_noun_agreement_1,True,True,False,True,121,-37.30332946777344,-35.37842559814453,0
All waiters run around these malls.,All waiters run around these mall.,morphology,determiner_noun_agreement,determiner_noun_agreement_1,True,True,False,True,122,-44.474212646484375,-46.44823455810547,1
All students didn't buy these schools.,All students didn't buy these school.,morphology,determiner_noun_agreement,determiner_noun_agreement_1,True,True,False,True,123,-37.40287399291992,-38.86540603637695,1
Patricia bikes to those malls.,Patricia bikes to those mall.,morphology,determiner_noun_agreement,determiner_noun_agreement_1,True,True,False,True,124,-49.09877014160156,-53.47846984863281,1
Vanessa hadn't taken those grocery stores.,Vanessa hadn't taken those grocery store.,morphology,determiner_noun_agreement,determiner_noun_agreement_1,True,True,False,True,125,-49.00959396362305,-49.66419219970703,1
Bethany walked through this school.,Bethany walked through this schools.,morphology,determiner_noun_agreement,determiner_noun_agreement_1,True,True,False,True,126,-42.51542663574219,-47.553131103515625,1
Patricia had argued about those children.,Patricia had argued about those child.,morphology,determiner_noun_agreement,determiner_noun_agreement_1,True,True,False,True,127,-50.64049530029297,-53.61798095703125,1
Julie did flee from this waitress.,Julie did flee from this waitresses.,morphology,determiner_noun_agreement,determiner_noun_agreement_1,True,True,False,True,128,-46.21578598022461,-53.52488708496094,1
