sentence_good,sentence_bad,field,linguistics_term,UID,simple_LM_method,one_prefix_method,two_prefix_method,lexically_identical,pair_id,good_prob,bad_prob,correct
Should most dancers ever compete?,Most dancers should ever compete.,semantics,npi_licensing,matrix_question_npi_licensor_present,True,False,True,True,261,-42.70832824707031,-40.459022521972656,0
Would Tammy ever have some mushrooms?,Tammy would ever have some mushrooms.,semantics,npi_licensing,matrix_question_npi_licensor_present,True,False,True,True,262,-39.97229766845703,-38.489845275878906,0
Had Lawrence ever found Helen?,Lawrence had ever found Helen.,semantics,npi_licensing,matrix_question_npi_licensor_present,True,False,True,True,263,-42.375274658203125,-42.867591857910156,1
Has Beverly ever fixed that unicycle?,Beverly has ever fixed that unicycle.,semantics,npi_licensing,matrix_question_npi_licensor_present,True,False,True,True,264,-56.457611083984375,-62.81324768066406,1
Could Phillip ever drive to a mall?,Phillip could ever drive to a mall.,semantics,npi_licensing,matrix_question_npi_licensor_present,True,False,True,True,265,-51.62164306640625,-50.208518981933594,0
Did that patient ever doubt Anna saw?,That patient did ever doubt Anna saw.,semantics,npi_licensing,matrix_question_npi_licensor_present,True,False,True,True,266,-56.86710739135742,-58.30845260620117,1
Has Phillip ever compromised?,Phillip has ever compromised.,semantics,npi_licensing,matrix_question_npi_licensor_present,True,False,True,True,267,-36.951534271240234,-34.644981384277344,0
Will the Lutherans ever describe Chad?,The Lutherans will ever describe Chad.,semantics,npi_licensing,matrix_question_npi_licensor_present,True,False,True,True,268,-60.26557922363281,-57.41531753540039,0
Had Mitchell ever smiled?,Mitchell had ever smiled.,semantics,npi_licensing,matrix_question_npi_licensor_present,True,False,True,True,269,-37.956581115722656,-35.372352600097656,0
Has this dress ever twirled?,This dress has ever twirled.,semantics,npi_licensing,matrix_question_npi_licensor_present,True,False,True,True,270,-47.230445861816406,-43.46148681640625,0
Had Rose ever changed?,Rose had ever changed.,semantics,npi_licensing,matrix_question_npi_licensor_present,True,False,True,True,271,-32.37904357910156,-22.4507999420166,0
Does Richard ever manage to go fishing?,Richard does ever manage to go fishing.,semantics,npi_licensing,matrix_question_npi_licensor_present,True,False,True,True,272,-46.42375946044922,-41.4840202331543,0
Has a bank ever neglected to profit?,A bank has ever neglected to profit.,semantics,npi_licensing,matrix_question_npi_licensor_present,True,False,True,True,273,-50.00346374511719,-49.0554084777832,0
Had all convertibles ever moved?,All convertibles had ever moved.,semantics,npi_licensing,matrix_question_npi_licensor_present,True,False,True,True,274,-53.45189666748047,-48.718109130859375,0
Had Steven ever climbed down this mountain?,Steven had ever climbed down this mountain.,semantics,npi_licensing,matrix_question_npi_licensor_present,True,False,True,True,275,-48.10013961791992,-42.05608367919922,0
Could Carla ever salute?,Carla could ever salute.,semantics,npi_licensing,matrix_question_npi_licensor_present,True,False,True,True,276,-43.350677490234375,-36.153900146484375,0
Might every driver ever appear to know Bethany?,Every driver might ever appear to know Bethany.,semantics,npi_licensing,matrix_question_npi_licensor_present,True,False,True,True,277,-74.41592407226562,-66.12333679199219,0
Had Ruth ever turned out to testify?,Ruth had ever turned out to testify.,semantics,npi_licensing,matrix_question_npi_licensor_present,True,False,True,True,278,-49.060302734375,-46.981266021728516,0
Had Dennis ever found Tiffany?,Dennis had ever found Tiffany.,semantics,npi_licensing,matrix_question_npi_licensor_present,True,False,True,True,279,-43.297035217285156,-45.78453826904297,1
Might those waitresses ever cooperate?,Those waitresses might ever cooperate.,semantics,npi_licensing,matrix_question_npi_licensor_present,True,False,True,True,280,-63.8260498046875,-52.557559967041016,0
Might James ever perform?,James might ever perform.,semantics,npi_licensing,matrix_question_npi_licensor_present,True,False,True,True,281,-42.68254089355469,-29.386154174804688,0
Could Tanya ever return to Mary?,Tanya could ever return to Mary.,semantics,npi_licensing,matrix_question_npi_licensor_present,True,False,True,True,282,-48.59757614135742,-44.47676086425781,0
Can all dancers ever find this skateboard?,All dancers can ever find this skateboard.,semantics,npi_licensing,matrix_question_npi_licensor_present,True,False,True,True,283,-58.47321701049805,-54.63258361816406,0
Had Lawrence ever observed Wayne?,Lawrence had ever observed Wayne.,semantics,npi_licensing,matrix_question_npi_licensor_present,True,False,True,True,284,-47.75996780395508,-47.301597595214844,0
Had that university ever surrendered?,That university had ever surrendered.,semantics,npi_licensing,matrix_question_npi_licensor_present,True,False,True,True,285,-38.802398681640625,-38.051918029785156,0
Has this museum ever revealed who perform?,This museum has ever revealed who perform.,semantics,npi_licensing,matrix_question_npi_licensor_present,True,False,True,True,286,-60.0277099609375,-56.00739288330078,0
Has Jason ever wept?,Jason has ever wept.,semantics,npi_licensing,matrix_question_npi_licensor_present,True,False,True,True,287,-39.71514129638672,-33.81954574584961,0
Have some girls ever descended most steps?,Some girls have ever descended most steps.,semantics,npi_licensing,matrix_question_npi_licensor_present,True,False,True,True,288,-52.16590881347656,-49.45092010498047,0
Had Harvard University ever remembered what might chat?,Harvard University had ever remembered what might chat.,semantics,npi_licensing,matrix_question_npi_licensor_present,True,False,True,True,289,-63.53550720214844,-66.69722747802734,1
Has Rhonda ever read?,Rhonda has ever read.,semantics,npi_licensing,matrix_question_npi_licensor_present,True,False,True,True,290,-45.232662200927734,-35.247222900390625,0
Has Stacey ever woken up?,Stacey has ever woken up.,semantics,npi_licensing,matrix_question_npi_licensor_present,True,False,True,True,291,-46.536766052246094,-41.032203674316406,0
Do gloves ever disappear?,Gloves do ever disappear.,semantics,npi_licensing,matrix_question_npi_licensor_present,True,False,True,True,292,-35.503170013427734,-36.376983642578125,1
Did Samuel ever suffer?,Samuel did ever suffer.,semantics,npi_licensing,matrix_question_npi_licensor_present,True,False,True,True,293,-34.06360626220703,-38.40730667114258,1
Could Carmen ever cough?,Carmen could ever cough.,semantics,npi_licensing,matrix_question_npi_licensor_present,True,False,True,True,294,-35.810447692871094,-40.25737762451172,1
Might the woman ever scratch?,The woman might ever scratch.,semantics,npi_licensing,matrix_question_npi_licensor_present,True,False,True,True,295,-45.039005279541016,-36.58226013183594,0
Can that icicle ever aggravate Tonya?,That icicle can ever aggravate Tonya.,semantics,npi_licensing,matrix_question_npi_licensor_present,True,False,True,True,296,-78.59941864013672,-76.1640625,0
Might Carmen ever hate this guest?,Carmen might ever hate this guest.,semantics,npi_licensing,matrix_question_npi_licensor_present,True,False,True,True,297,-59.494049072265625,-56.36130905151367,0
Should Tracy ever get fired?,Tracy should ever get fired.,semantics,npi_licensing,matrix_question_npi_licensor_present,True,False,True,True,298,-39.76432800292969,-41.35926055908203,1
Does Julie ever drive to grocery stores?,Julie does ever drive to grocery stores.,semantics,npi_licensing,matrix_question_npi_licensor_present,True,False,True,True,299,-58.31151580810547,-56.728797912597656,0
Had some actors ever pushed the girls' supervisor to dislike Larry?,Some actors had ever pushed the girls' supervisor to dislike Larry.,semantics,npi_licensing,matrix_question_npi_licensor_present,True,False,True,True,300,-90.06564331054688,-88.16685485839844,0
Had Russell ever kissed Anna?,Russell had ever kissed Anna.,semantics,npi_licensing,matrix_question_npi_licensor_present,True,False,True,True,301,-46.53266143798828,-33.751094818115234,0
Had a lot of gates ever closed?,A lot of gates had ever closed.,semantics,npi_licensing,matrix_question_npi_licensor_present,True,False,True,True,302,-41.791786193847656,-44.530975341796875,1
Has this adult ever wondered who can debate?,This adult has ever wondered who can debate.,semantics,npi_licensing,matrix_question_npi_licensor_present,True,False,True,True,303,-59.11814880371094,-55.75351333618164,0
Should Maria ever talk about Scott?,Maria should ever talk about Scott.,semantics,npi_licensing,matrix_question_npi_licensor_present,True,False,True,True,304,-43.757415771484375,-36.523651123046875,0
Can some lamp ever darken?,Some lamp can ever darken.,semantics,npi_licensing,matrix_question_npi_licensor_present,True,False,True,True,305,-49.59601593017578,-46.565185546875,0
Had Brian ever believed all couches to slip?,Brian had ever believed all couches to slip.,semantics,npi_licensing,matrix_question_npi_licensor_present,True,False,True,True,306,-68.63533020019531,-57.88176345825195,0
Can the lady ever move?,The lady can ever move.,semantics,npi_licensing,matrix_question_npi_licensor_present,True,False,True,True,307,-29.75794792175293,-30.753543853759766,1
Might Rebecca ever distract Jeffrey?,Rebecca might ever distract Jeffrey.,semantics,npi_licensing,matrix_question_npi_licensor_present,True,False,True,True,308,-55.021583557128906,-52.43462371826172,0
Had Teresa ever gone to a lot of rivers?,Teresa had ever gone to a lot of rivers.,semantics,npi_licensing,matrix_question_npi_licensor_present,True,False,True,True,309,-53.03660202026367,-53.56184387207031,1
Has Tara ever found these mirrors?,Tara has ever found these mirrors.,semantics,npi_licensing,matrix_question_npi_licensor_present,True,False,True,True,310,-46.534698486328125,-46.97075653076172,1
Had Jodi ever written?,Jodi had ever written.,semantics,npi_licensing,matrix_question_npi_licensor_present,True,False,True,True,311,-38.02263641357422,-35.350494384765625,0
Has Gregory ever refused to discuss Becky?,Gregory has ever refused to discuss Becky.,semantics,npi_licensing,matrix_question_npi_licensor_present,True,False,True,True,312,-50.83311462402344,-52.959869384765625,1
Might Roger ever hide away?,Roger might ever hide away.,semantics,npi_licensing,matrix_question_npi_licensor_present,True,False,True,True,313,-47.758331298828125,-32.51722717285156,0
Have some gloves ever flattened?,Some gloves have ever flattened.,semantics,npi_licensing,matrix_question_npi_licensor_present,True,False,True,True,314,-39.997474670410156,-38.02214050292969,0
Can a lot of men ever exist?,A lot of men can ever exist.,semantics,npi_licensing,matrix_question_npi_licensor_present,True,False,True,True,315,-36.63364791870117,-39.27867126464844,1
Has Christina ever nodded?,Christina has ever nodded.,semantics,npi_licensing,matrix_question_npi_licensor_present,True,False,True,True,316,-37.89424514770508,-34.86724853515625,0
Would Leslie ever skate around every public park?,Leslie would ever skate around every public park.,semantics,npi_licensing,matrix_question_npi_licensor_present,True,False,True,True,317,-65.15966796875,-67.75066375732422,1
Has Jane ever practiced?,Jane has ever practiced.,semantics,npi_licensing,matrix_question_npi_licensor_present,True,False,True,True,318,-33.89699172973633,-27.453880310058594,0
Have most actors ever disagreed?,Most actors have ever disagreed.,semantics,npi_licensing,matrix_question_npi_licensor_present,True,False,True,True,319,-43.772056579589844,-40.259620666503906,0
Has the legislature ever profited?,The legislature has ever profited.,semantics,npi_licensing,matrix_question_npi_licensor_present,True,False,True,True,320,-45.37285232543945,-42.96632385253906,0
Will that museum ever reference Ellen?,That museum will ever reference Ellen.,semantics,npi_licensing,matrix_question_npi_licensor_present,True,False,True,True,321,-52.89451217651367,-53.48514938354492,1
Has Peter ever healed Marie?,Peter has ever healed Marie.,semantics,npi_licensing,matrix_question_npi_licensor_present,True,False,True,True,322,-43.40217971801758,-38.68694305419922,0
Has Charles ever needed to cure Julie?,Charles has ever needed to cure Julie.,semantics,npi_licensing,matrix_question_npi_licensor_present,True,False,True,True,323,-50.893516540527344,-44.67418670654297,0
Has Gary ever played?,Gary has ever played.,semantics,npi_licensing,matrix_question_npi_licensor_present,True,False,True,True,324,-30.85761833190918,-23.81489372253418,0
Had Martin ever alarmed Michael?,Martin had ever alarmed Michael.,semantics,npi_licensing,matrix_question_npi_licensor_present,True,False,True,True,325,-44.61582946777344,-37.09712219238281,0
Has Phillip ever preferred Patrick to bake?,Phillip has ever preferred Patrick to bake.,semantics,npi_licensing,matrix_question_npi_licensor_present,True,False,True,True,326,-61.764862060546875,-60.78862762451172,0
Might most teenagers ever win?,Most teenagers might ever win.,semantics,npi_licensing,matrix_question_npi_licensor_present,True,False,True,True,327,-51.803810119628906,-41.382747650146484,0
Could Sheila ever forget what vaporized?,Sheila could ever forget what vaporized.,semantics,npi_licensing,matrix_question_npi_licensor_present,True,False,True,True,328,-58.100460052490234,-59.94660568237305,1
Had a skirt ever stretched?,A skirt had ever stretched.,semantics,npi_licensing,matrix_question_npi_licensor_present,True,False,True,True,329,-36.08350372314453,-40.0767822265625,1
Had Rebecca ever appeared to stun Cheryl?,Rebecca had ever appeared to stun Cheryl.,semantics,npi_licensing,matrix_question_npi_licensor_present,True,False,True,True,330,-60.99003601074219,-60.574424743652344,0
Did Katherine ever convince most nephews of Amelia to cooperate?,Katherine did ever convince most nephews of Amelia to cooperate.,semantics,npi_licensing,matrix_question_npi_licensor_present,True,False,True,True,331,-93.91976928710938,-98.76292419433594,1
Would the Impressionists ever fight?,The Impressionists would ever fight.,semantics,npi_licensing,matrix_question_npi_licensor_present,True,False,True,True,332,-57.866851806640625,-56.15693664550781,0
Could Alice ever nod?,Alice could ever nod.,semantics,npi_licensing,matrix_question_npi_licensor_present,True,False,True,True,333,-34.65337371826172,-27.231908798217773,0
Had Becca ever want to waste away?,Becca had ever want to waste away.,semantics,npi_licensing,matrix_question_npi_licensor_present,True,False,True,True,334,-54.36009216308594,-49.40493392944336,0
Has Kayla ever said the Borgias chuckle?,Kayla has ever said the Borgias chuckle.,semantics,npi_licensing,matrix_question_npi_licensor_present,True,False,True,True,335,-79.56240844726562,-70.65975952148438,0
Should Guy ever listen to Brian?,Guy should ever listen to Brian.,semantics,npi_licensing,matrix_question_npi_licensor_present,True,False,True,True,336,-40.80055236816406,-35.23790740966797,0
Could Charles ever wear a hat?,Charles could ever wear a hat.,semantics,npi_licensing,matrix_question_npi_licensor_present,True,False,True,True,337,-39.056495666503906,-31.038917541503906,0
Has Rachelle ever believed some newspaper article to disagree?,Rachelle has ever believed some newspaper article to disagree.,semantics,npi_licensing,matrix_question_npi_licensor_present,True,False,True,True,338,-83.86344146728516,-74.38330078125,0
Should Samuel ever stretch?,Samuel should ever stretch.,semantics,npi_licensing,matrix_question_npi_licensor_present,True,False,True,True,339,-34.5889892578125,-38.58030700683594,1
Did the doctor ever beg the university to bore Vincent?,The doctor did ever beg the university to bore Vincent.,semantics,npi_licensing,matrix_question_npi_licensor_present,True,False,True,True,340,-76.54999542236328,-77.95793151855469,1
Had George ever died?,George had ever died.,semantics,npi_licensing,matrix_question_npi_licensor_present,True,False,True,True,341,-31.429161071777344,-22.84674072265625,0
Would some wheelbarrow ever shatter?,Some wheelbarrow would ever shatter.,semantics,npi_licensing,matrix_question_npi_licensor_present,True,False,True,True,342,-60.32304382324219,-54.93760681152344,0
Should some ice ever melt?,Some ice should ever melt.,semantics,npi_licensing,matrix_question_npi_licensor_present,True,False,True,True,343,-36.30097961425781,-36.696250915527344,1
Might this jacket ever twist?,This jacket might ever twist.,semantics,npi_licensing,matrix_question_npi_licensor_present,True,False,True,True,344,-49.377357482910156,-41.85095977783203,0
Has Rebecca ever driven to some closet?,Rebecca has ever driven to some closet.,semantics,npi_licensing,matrix_question_npi_licensor_present,True,False,True,True,345,-52.44934844970703,-54.862205505371094,1
Had Mark ever climbed down this mountain?,Mark had ever climbed down this mountain.,semantics,npi_licensing,matrix_question_npi_licensor_present,True,False,True,True,346,-48.48442077636719,-42.67354965209961,0
Has Lisa ever joked around?,Lisa has ever joked around.,semantics,npi_licensing,matrix_question_npi_licensor_present,True,False,True,True,347,-41.16693878173828,-34.272743225097656,0
Could a candle ever dim?,A candle could ever dim.,semantics,npi_licensing,matrix_question_npi_licensor_present,True,False,True,True,348,-36.73313522338867,-41.618446350097656,1
Will all adults ever stretch?,All adults will ever stretch.,semantics,npi_licensing,matrix_question_npi_licensor_present,True,False,True,True,349,-39.0938720703125,-35.49580383300781,0
Have the waiters ever praised Julia?,The waiters have ever praised Julia.,semantics,npi_licensing,matrix_question_npi_licensor_present,True,False,True,True,350,-54.84471130371094,-53.458038330078125,0
Have some icicles ever vaporized?,Some icicles have ever vaporized.,semantics,npi_licensing,matrix_question_npi_licensor_present,True,False,True,True,351,-59.89644241333008,-55.75720977783203,0
Would Deanna ever clean most gloves?,Deanna would ever clean most gloves.,semantics,npi_licensing,matrix_question_npi_licensor_present,True,False,True,True,352,-61.310150146484375,-53.759002685546875,0
Has a mushroom ever charred?,A mushroom has ever charred.,semantics,npi_licensing,matrix_question_npi_licensor_present,True,False,True,True,353,-39.80366897583008,-42.7936897277832,1
Will Vanessa ever commission Connie to escape?,Vanessa will ever commission Connie to escape.,semantics,npi_licensing,matrix_question_npi_licensor_present,True,False,True,True,354,-63.52180480957031,-66.2865219116211,1
Had that art gallery ever existed?,That art gallery had ever existed.,semantics,npi_licensing,matrix_question_npi_licensor_present,True,False,True,True,355,-48.1389274597168,-46.10274887084961,0
Has Victoria ever spun around?,Victoria has ever spun around.,semantics,npi_licensing,matrix_question_npi_licensor_present,True,False,True,True,356,-43.309104919433594,-31.8665714263916,0
Would Jane ever compel Lissa to answer?,Jane would ever compel Lissa to answer.,semantics,npi_licensing,matrix_question_npi_licensor_present,True,False,True,True,357,-64.45647430419922,-54.68684768676758,0
Would every patient ever explain everything?,Every patient would ever explain everything.,semantics,npi_licensing,matrix_question_npi_licensor_present,True,False,True,True,358,-44.35092544555664,-40.481021881103516,0
Did the mouths ever stun Jesus?,The mouths did ever stun Jesus.,semantics,npi_licensing,matrix_question_npi_licensor_present,True,False,True,True,359,-52.65971374511719,-52.13111114501953,0
Has Tara ever stretched?,Tara has ever stretched.,semantics,npi_licensing,matrix_question_npi_licensor_present,True,False,True,True,360,-36.16423416137695,-36.12543487548828,0
Will Kristin ever yearn to remember a teacher?,Kristin will ever yearn to remember a teacher.,semantics,npi_licensing,matrix_question_npi_licensor_present,True,False,True,True,361,-75.11839294433594,-69.55006408691406,0
Can Richard ever pass the hill?,Richard can ever pass the hill.,semantics,npi_licensing,matrix_question_npi_licensor_present,True,False,True,True,362,-41.59871292114258,-34.73471450805664,0
Has Jodi ever cooked?,Jodi has ever cooked.,semantics,npi_licensing,matrix_question_npi_licensor_present,True,False,True,True,363,-41.13099670410156,-37.750579833984375,0
Has this dress ever crumpled?,This dress has ever crumpled.,semantics,npi_licensing,matrix_question_npi_licensor_present,True,False,True,True,364,-54.28046417236328,-52.07817077636719,0
Has Kimberley ever disturbed a lot of teenagers?,Kimberley has ever disturbed a lot of teenagers.,semantics,npi_licensing,matrix_question_npi_licensor_present,True,False,True,True,365,-62.20061492919922,-62.271034240722656,1
Has Danielle ever appeared to fire Theresa?,Danielle has ever appeared to fire Theresa.,semantics,npi_licensing,matrix_question_npi_licensor_present,True,False,True,True,366,-56.355411529541016,-55.456459045410156,0
Would some actors ever benefit?,Some actors would ever benefit.,semantics,npi_licensing,matrix_question_npi_licensor_present,True,False,True,True,367,-38.77330780029297,-36.80167007446289,0
Has Heidi ever sneezed?,Heidi has ever sneezed.,semantics,npi_licensing,matrix_question_npi_licensor_present,True,False,True,True,368,-42.46575927734375,-43.15011978149414,1
Had Candice ever tried to hurt Tara?,Candice had ever tried to hurt Tara.,semantics,npi_licensing,matrix_question_npi_licensor_present,True,False,True,True,369,-61.66764831542969,-52.157615661621094,0
Had Gary ever confused some cashier?,Gary had ever confused some cashier.,semantics,npi_licensing,matrix_question_npi_licensor_present,True,False,True,True,370,-56.847007751464844,-48.74871826171875,0
Could Aaron ever exercise?,Aaron could ever exercise.,semantics,npi_licensing,matrix_question_npi_licensor_present,True,False,True,True,371,-31.77948760986328,-26.608245849609375,0
Should Dawn ever yearn to worry Joseph?,Dawn should ever yearn to worry Joseph.,semantics,npi_licensing,matrix_question_npi_licensor_present,True,False,True,True,372,-72.16378021240234,-75.03521728515625,1
Can Cindy ever leave?,Cindy can ever leave.,semantics,npi_licensing,matrix_question_npi_licensor_present,True,False,True,True,373,-29.872480392456055,-34.733638763427734,1
Has Margaret ever hated Jill?,Margaret has ever hated Jill.,semantics,npi_licensing,matrix_question_npi_licensor_present,True,False,True,True,374,-42.679725646972656,-46.31983184814453,1
Could Elizabeth ever implore every nephew of Karen to disgust that pedestrian?,Elizabeth could ever implore every nephew of Karen to disgust that pedestrian.,semantics,npi_licensing,matrix_question_npi_licensor_present,True,False,True,True,375,-112.7412109375,-106.25575256347656,0
Had some legislature ever testified?,Some legislature had ever testified.,semantics,npi_licensing,matrix_question_npi_licensor_present,True,False,True,True,376,-42.26907730102539,-40.427093505859375,0
Had most organizations ever collaborated?,Most organizations had ever collaborated.,semantics,npi_licensing,matrix_question_npi_licensor_present,True,False,True,True,377,-43.16615295410156,-39.46237564086914,0
Have the Impressionists ever benefited?,The Impressionists have ever benefited.,semantics,npi_licensing,matrix_question_npi_licensor_present,True,False,True,True,378,-61.71361541748047,-57.00440216064453,0
Can Thomas ever alarm Tammy?,Thomas can ever alarm Tammy.,semantics,npi_licensing,matrix_question_npi_licensor_present,True,False,True,True,379,-48.73766326904297,-43.251853942871094,0
Had the Clintons ever forfeited?,The Clintons had ever forfeited.,semantics,npi_licensing,matrix_question_npi_licensor_present,True,False,True,True,380,-52.610260009765625,-49.692176818847656,0
Might Kristen ever joke around?,Kristen might ever joke around.,semantics,npi_licensing,matrix_question_npi_licensor_present,True,False,True,True,381,-51.014034271240234,-42.53885269165039,0
Can the socks ever crumple?,The socks can ever crumple.,semantics,npi_licensing,matrix_question_npi_licensor_present,True,False,True,True,382,-53.05674362182617,-53.230316162109375,1
Does Brian ever fall asleep?,Brian does ever fall asleep.,semantics,npi_licensing,matrix_question_npi_licensor_present,True,False,True,True,383,-37.361183166503906,-31.636857986450195,0
Would Gerald ever break the computer?,Gerald would ever break the computer.,semantics,npi_licensing,matrix_question_npi_licensor_present,True,False,True,True,384,-41.582855224609375,-43.48427963256836,1
Had the rice ever burned?,The rice had ever burned.,semantics,npi_licensing,matrix_question_npi_licensor_present,True,False,True,True,385,-35.62654113769531,-36.317955017089844,1
Has Marla ever departed?,Marla has ever departed.,semantics,npi_licensing,matrix_question_npi_licensor_present,True,False,True,True,386,-41.252315521240234,-34.62372589111328,0
Would an adult ever cough?,An adult would ever cough.,semantics,npi_licensing,matrix_question_npi_licensor_present,True,False,True,True,387,-37.24786376953125,-37.85972213745117,1
Have a lot of governments ever pressed people's contractor to mess up these glasses?,A lot of governments have ever pressed people's contractor to mess up these glasses.,semantics,npi_licensing,matrix_question_npi_licensor_present,True,False,True,True,388,-96.38029479980469,-100.99674987792969,1
Could Matt ever scream?,Matt could ever scream.,semantics,npi_licensing,matrix_question_npi_licensor_present,True,False,True,True,389,-33.57908630371094,-25.692432403564453,0
Can Carmen ever hurt these guys?,Carmen can ever hurt these guys.,semantics,npi_licensing,matrix_question_npi_licensor_present,True,False,True,True,390,-42.709136962890625,-48.319129943847656,1
