sentence_good,sentence_bad,field,linguistics_term,UID,simple_LM_method,one_prefix_method,two_prefix_method,lexically_identical,pair_id,good_prob,bad_prob,correct
Kristin insulted those dancers.,Kristin insulted those dancer.,morphology,determiner_noun_agreement,determiner_noun_agreement_1,True,True,False,True,512,-42.170536041259766,-44.87376403808594,1
Some sketches had looked like this girl.,Some sketches had looked like this girls.,morphology,determiner_noun_agreement,determiner_noun_agreement_1,True,True,False,True,513,-44.7603645324707,-47.389801025390625,1
Pamela hasn't biked to those libraries.,Pamela hasn't biked to those library.,morphology,determiner_noun_agreement,determiner_noun_agreement_1,True,True,False,True,514,-60.863426208496094,-62.131256103515625,1
Ellen can't exit these public parks.,Ellen can't exit these public park.,morphology,determiner_noun_agreement,determiner_noun_agreement_1,True,True,False,True,515,-48.88420867919922,-49.176231384277344,1
Ruth noticed those newspaper articles.,Ruth noticed those newspaper article.,morphology,determiner_noun_agreement,determiner_noun_agreement_1,True,True,False,True,516,-48.65254592895508,-51.81877136230469,1
Most doctors leave these doctors.,Most doctors leave these doctor.,morphology,determiner_noun_agreement,determiner_noun_agreement_1,True,True,False,True,517,-31.274505615234375,-34.031471252441406,1
Stacy has hurt this guest.,Stacy has hurt this guests.,morphology,determiner_noun_agreement,determiner_noun_agreement_1,True,True,False,True,518,-44.119598388671875,-44.875450134277344,1
Carol would admire those movie theaters.,Carol would admire those movie theater.,morphology,determiner_noun_agreement,determiner_noun_agreement_1,True,True,False,True,519,-50.10612487792969,-50.93129348754883,1
Kayla flees from these cafes.,Kayla flees from these cafe.,morphology,determiner_noun_agreement,determiner_noun_agreement_1,True,True,False,True,520,-49.594730377197266,-50.540462493896484,1
Most dancers haven't forgotten this essay.,Most dancers haven't forgotten this essays.,morphology,determiner_noun_agreement,determiner_noun_agreement_1,True,True,False,True,521,-42.764183044433594,-46.493019104003906,1
Customers shouldn't upset these waiters.,Customers shouldn't upset these waiter.,morphology,determiner_noun_agreement,determiner_noun_agreement_1,True,True,False,True,522,-45.315513610839844,-46.39806365966797,1
Wendy appreciates those pamphlets.,Wendy appreciates those pamphlet.,morphology,determiner_noun_agreement,determiner_noun_agreement_1,True,True,False,True,523,-47.36302185058594,-50.71998596191406,1
Victoria boasted about this play.,Victoria boasted about this plays.,morphology,determiner_noun_agreement,determiner_noun_agreement_1,True,True,False,True,524,-33.15828323364258,-37.041297912597656,1
Jacqueline can't scan these essays.,Jacqueline can't scan these essay.,morphology,determiner_noun_agreement,determiner_noun_agreement_1,True,True,False,True,525,-49.578521728515625,-51.93212127685547,1
The Impressionists explore this art gallery.,The Impressionists explore this art galleries.,morphology,determiner_noun_agreement,determiner_noun_agreement_1,True,True,False,True,526,-44.16706466674805,-46.04115676879883,1
Sarah messed up that cafe.,Sarah messed up that cafes.,morphology,determiner_noun_agreement,determiner_noun_agreement_1,True,True,False,True,527,-34.46586608886719,-39.981971740722656,1
Rodney hasn't remembered this art gallery.,Rodney hasn't remembered this art galleries.,morphology,determiner_noun_agreement,determiner_noun_agreement_1,True,True,False,True,528,-50.00716018676758,-52.94853973388672,1
Raymond kissed that guy.,Raymond kissed that guys.,morphology,determiner_noun_agreement,determiner_noun_agreement_1,True,True,False,True,529,-41.381317138671875,-45.69415283203125,1
Ladies hadn't fixed these couches.,Ladies hadn't fixed these couch.,morphology,determiner_noun_agreement,determiner_noun_agreement_1,True,True,False,True,530,-54.28422546386719,-53.38674545288086,0
Guy healed that patient.,Guy healed that patients.,morphology,determiner_noun_agreement,determiner_noun_agreement_1,True,True,False,True,531,-34.13329315185547,-33.70448684692383,0
The Borgias would criticize that story.,The Borgias would criticize that stories.,morphology,determiner_noun_agreement,determiner_noun_agreement_1,True,True,False,True,532,-53.820335388183594,-56.1634407043457,1
Carrie complains about this essay.,Carrie complains about this essays.,morphology,determiner_noun_agreement,determiner_noun_agreement_1,True,True,False,True,533,-38.13233184814453,-42.86187744140625,1
Steve should approach this customer.,Steve should approach this customers.,morphology,determiner_noun_agreement,determiner_noun_agreement_1,True,True,False,True,534,-32.69450378417969,-36.371490478515625,1
The patients didn't skate around those high schools.,The patients didn't skate around those high school.,morphology,determiner_noun_agreement,determiner_noun_agreement_1,True,True,False,True,535,-57.6802978515625,-55.824981689453125,0
Denise bought those prints.,Denise bought those print.,morphology,determiner_noun_agreement,determiner_noun_agreement_1,True,True,False,True,536,-37.04801940917969,-39.52696228027344,1
Susan hadn't hired these guys.,Susan hadn't hired these guy.,morphology,determiner_noun_agreement,determiner_noun_agreement_1,True,True,False,True,537,-32.04764175415039,-37.40221405029297,1
That mushroom is annoying these cashiers.,That mushroom is annoying these cashier.,morphology,determiner_noun_agreement,determiner_noun_agreement_1,True,True,False,True,538,-53.753299713134766,-51.095802307128906,0
Randolf did examine that pamphlet.,Randolf did examine that pamphlets.,morphology,determiner_noun_agreement,determiner_noun_agreement_1,True,True,False,True,539,-51.578277587890625,-54.4473876953125,1
Ellen cared for that teacher.,Ellen cared for that teachers.,morphology,determiner_noun_agreement,determiner_noun_agreement_1,True,True,False,True,540,-40.415740966796875,-42.534523010253906,1
Maria astounded this dancer.,Maria astounded this dancers.,morphology,determiner_noun_agreement,determiner_noun_agreement_1,True,True,False,True,541,-38.77656555175781,-41.5704345703125,1
Holly approaches that pedestrian.,Holly approaches that pedestrians.,morphology,determiner_noun_agreement,determiner_noun_agreement_1,True,True,False,True,542,-44.855987548828125,-44.38975524902344,0
Many waiters investigate these schools.,Many waiters investigate these school.,morphology,determiner_noun_agreement,determiner_noun_agreement_1,True,True,False,True,543,-39.80983352661133,-43.884361267089844,1
Most men explored that school.,Most men explored that schools.,morphology,determiner_noun_agreement,determiner_noun_agreement_1,True,True,False,True,544,-36.72457504272461,-39.588157653808594,1
Ellen wasn't observing these customers.,Ellen wasn't observing these customer.,morphology,determiner_noun_agreement,determiner_noun_agreement_1,True,True,False,True,545,-47.26659393310547,-49.09375,1
Chad isn't concealing those adults.,Chad isn't concealing those adult.,morphology,determiner_noun_agreement,determiner_noun_agreement_1,True,True,False,True,546,-51.2205810546875,-51.762290954589844,1
Those guests bike to this school.,Those guests bike to this schools.,morphology,determiner_noun_agreement,determiner_noun_agreement_1,True,True,False,True,547,-38.86058807373047,-44.039947509765625,1
Most adults hurt these teachers.,Most adults hurt these teacher.,morphology,determiner_noun_agreement,determiner_noun_agreement_1,True,True,False,True,548,-38.620277404785156,-41.94758987426758,1
Paula was listening to those drivers.,Paula was listening to those driver.,morphology,determiner_noun_agreement,determiner_noun_agreement_1,True,True,False,True,549,-39.889278411865234,-42.69941711425781,1
Natalie wasn't researching these college campuses.,Natalie wasn't researching these college campus.,morphology,determiner_noun_agreement,determiner_noun_agreement_1,True,True,False,True,550,-51.88554000854492,-53.980140686035156,1
Gregory is attacking this doctor.,Gregory is attacking this doctors.,morphology,determiner_noun_agreement,determiner_noun_agreement_1,True,True,False,True,551,-41.15386199951172,-44.76611328125,1
Stacy was watching these teachers.,Stacy was watching these teacher.,morphology,determiner_noun_agreement,determiner_noun_agreement_1,True,True,False,True,552,-43.18450164794922,-46.15397262573242,1
Holly wasn't exploring those art galleries.,Holly wasn't exploring those art gallery.,morphology,determiner_noun_agreement,determiner_noun_agreement_1,True,True,False,True,553,-51.17853546142578,-53.82621765136719,1
The Impressionists helped those teenagers.,The Impressionists helped those teenager.,morphology,determiner_noun_agreement,determiner_noun_agreement_1,True,True,False,True,554,-45.96162414550781,-50.058006286621094,1
These universities stunned this association.,These universities stunned this associations.,morphology,determiner_noun_agreement,determiner_noun_agreement_1,True,True,False,True,555,-43.43836212158203,-48.4348030090332,1
All actors know those waitresses.,All actors know those waitress.,morphology,determiner_noun_agreement,determiner_noun_agreement_1,True,True,False,True,556,-45.69245529174805,-45.94183349609375,1
Every woman boycotted those high schools.,Every woman boycotted those high school.,morphology,determiner_noun_agreement,determiner_noun_agreement_1,True,True,False,True,557,-64.03932189941406,-60.62333679199219,0
Nancy cleans this cup.,Nancy cleans this cups.,morphology,determiner_noun_agreement,determiner_noun_agreement_1,True,True,False,True,558,-38.70867919921875,-42.26124572753906,1
Julia is healing these snakes.,Julia is healing these snake.,morphology,determiner_noun_agreement,determiner_noun_agreement_1,True,True,False,True,559,-43.230865478515625,-43.933204650878906,1
Some guys are disagreeing with these essays.,Some guys are disagreeing with these essay.,morphology,determiner_noun_agreement,determiner_noun_agreement_1,True,True,False,True,560,-47.28705596923828,-49.622802734375,1
These doctors scan this pamphlet.,These doctors scan this pamphlets.,morphology,determiner_noun_agreement,determiner_noun_agreement_1,True,True,False,True,561,-38.38170623779297,-42.381752014160156,1
Walter wasn't talking about those children.,Walter wasn't talking about those child.,morphology,determiner_noun_agreement,determiner_noun_agreement_1,True,True,False,True,562,-43.904319763183594,-46.42609405517578,1
Stephen knew that adult.,Stephen knew that adults.,morphology,determiner_noun_agreement,determiner_noun_agreement_1,True,True,False,True,563,-30.979629516601562,-31.396745681762695,1
This patient was concealing that senator.,This patient was concealing that senators.,morphology,determiner_noun_agreement,determiner_noun_agreement_1,True,True,False,True,564,-50.3861198425293,-52.15007781982422,1
That organization bores those pedestrians.,That organization bores those pedestrian.,morphology,determiner_noun_agreement,determiner_noun_agreement_1,True,True,False,True,565,-55.59536361694336,-57.69750213623047,1
Daniel tours this library.,Daniel tours this libraries.,morphology,determiner_noun_agreement,determiner_noun_agreement_1,True,True,False,True,566,-30.82347869873047,-34.02295684814453,1
Patricia runs around these movie theaters.,Patricia runs around these movie theater.,morphology,determiner_noun_agreement,determiner_noun_agreement_1,True,True,False,True,567,-54.571537017822266,-56.97850799560547,1
Dawn alarmed that driver.,Dawn alarmed that drivers.,morphology,determiner_noun_agreement,determiner_noun_agreement_1,True,True,False,True,568,-44.63032150268555,-46.07557678222656,1
All jackets embarrass this teacher.,All jackets embarrass this teachers.,morphology,determiner_noun_agreement,determiner_noun_agreement_1,True,True,False,True,569,-48.00157928466797,-50.27015686035156,1
Natalie will examine those reports.,Natalie will examine those report.,morphology,determiner_noun_agreement,determiner_noun_agreement_1,True,True,False,True,570,-42.84657669067383,-45.741371154785156,1
James was lifting that cup.,James was lifting that cups.,morphology,determiner_noun_agreement,determiner_noun_agreement_1,True,True,False,True,571,-34.14398193359375,-37.4516716003418,1
Scott healed this driver.,Scott healed this drivers.,morphology,determiner_noun_agreement,determiner_noun_agreement_1,True,True,False,True,572,-33.949249267578125,-38.4605598449707,1
Suzanne has hugged that patient.,Suzanne has hugged that patients.,morphology,determiner_noun_agreement,determiner_noun_agreement_1,True,True,False,True,573,-48.67112731933594,-50.233253479003906,1
Erin wasn't listening to those teachers.,Erin wasn't listening to those teacher.,morphology,determiner_noun_agreement,determiner_noun_agreement_1,True,True,False,True,574,-43.05689239501953,-44.48394012451172,1
Jason should investigate these boys.,Jason should investigate these boy.,morphology,determiner_noun_agreement,determiner_noun_agreement_1,True,True,False,True,575,-36.20927429199219,-39.84684753417969,1
Jane could work with this guy.,Jane could work with this guys.,morphology,determiner_noun_agreement,determiner_noun_agreement_1,True,True,False,True,576,-29.09044075012207,-32.09480667114258,1
Omar toured that public park.,Omar toured that public parks.,morphology,determiner_noun_agreement,determiner_noun_agreement_1,True,True,False,True,577,-50.055702209472656,-49.75685501098633,0
Carts bothered these waitresses.,Carts bothered these waitress.,morphology,determiner_noun_agreement,determiner_noun_agreement_1,True,True,False,True,578,-50.990047454833984,-50.741432189941406,0
Becky hid that face.,Becky hid that faces.,morphology,determiner_noun_agreement,determiner_noun_agreement_1,True,True,False,True,579,-40.467498779296875,-43.72556686401367,1
Lori isn't running around these restaurants.,Lori isn't running around these restaurant.,morphology,determiner_noun_agreement,determiner_noun_agreement_1,True,True,False,True,580,-46.76679992675781,-49.09128952026367,1
Liam hasn't healed those cats.,Liam hasn't healed those cat.,morphology,determiner_noun_agreement,determiner_noun_agreement_1,True,True,False,True,581,-47.180076599121094,-49.387332916259766,1
Suzanne is embarrassing that actress.,Suzanne is embarrassing that actresses.,morphology,determiner_noun_agreement,determiner_noun_agreement_1,True,True,False,True,582,-49.667625427246094,-51.804893493652344,1
Ronald explored those schools.,Ronald explored those school.,morphology,determiner_noun_agreement,determiner_noun_agreement_1,True,True,False,True,583,-41.751800537109375,-45.71311950683594,1
A lot of cashiers buy those jackets.,A lot of cashiers buy those jacket.,morphology,determiner_noun_agreement,determiner_noun_agreement_1,True,True,False,True,584,-51.74010467529297,-52.299217224121094,1
The Clintons ran around this public park.,The Clintons ran around this public parks.,morphology,determiner_noun_agreement,determiner_noun_agreement_1,True,True,False,True,585,-53.02605438232422,-54.912567138671875,1
Kirsten stunned that actor.,Kirsten stunned that actors.,morphology,determiner_noun_agreement,determiner_noun_agreement_1,True,True,False,True,586,-49.80213165283203,-52.12665557861328,1
Melissa did wear this hat.,Melissa did wear this hats.,morphology,determiner_noun_agreement,determiner_noun_agreement_1,True,True,False,True,587,-41.493011474609375,-46.092124938964844,1
Peter was observing these girls.,Peter was observing these girl.,morphology,determiner_noun_agreement,determiner_noun_agreement_1,True,True,False,True,588,-35.05512237548828,-38.626792907714844,1
Frank hadn't researched these associations.,Frank hadn't researched these association.,morphology,determiner_noun_agreement,determiner_noun_agreement_1,True,True,False,True,589,-39.15442657470703,-42.50958251953125,1
Christine heals this girl.,Christine heals this girls.,morphology,determiner_noun_agreement,determiner_noun_agreement_1,True,True,False,True,590,-39.237518310546875,-41.90390396118164,1
The Lutherans astounds these pedestrians.,The Lutherans astounds these pedestrian.,morphology,determiner_noun_agreement,determiner_noun_agreement_1,True,True,False,True,591,-61.71284866333008,-63.56703567504883,1
Regina arrived at this art gallery.,Regina arrived at this art galleries.,morphology,determiner_noun_agreement,determiner_noun_agreement_1,True,True,False,True,592,-42.350711822509766,-44.692298889160156,1
All women see this patient.,All women see this patients.,morphology,determiner_noun_agreement,determiner_noun_agreement_1,True,True,False,True,593,-31.595504760742188,-34.51347351074219,1
Those guys hadn't disagreed with this commentary.,Those guys hadn't disagreed with this commentaries.,morphology,determiner_noun_agreement,determiner_noun_agreement_1,True,True,False,True,594,-44.24907684326172,-49.90648651123047,1
Allison didn't visit those museums.,Allison didn't visit those museum.,morphology,determiner_noun_agreement,determiner_noun_agreement_1,True,True,False,True,595,-44.540348052978516,-43.688812255859375,0
Kimberley worried this museum.,Kimberley worried this museums.,morphology,determiner_noun_agreement,determiner_noun_agreement_1,True,True,False,True,596,-44.1403694152832,-48.68660354614258,1
Those forks bother these pedestrians.,Those forks bother these pedestrian.,morphology,determiner_noun_agreement,determiner_noun_agreement_1,True,True,False,True,597,-46.946533203125,-51.0266227722168,1
Some school isn't helping these pedestrians.,Some school isn't helping these pedestrian.,morphology,determiner_noun_agreement,determiner_noun_agreement_1,True,True,False,True,598,-45.3997688293457,-46.515201568603516,1
Many patients notice this dress.,Many patients notice this dresses.,morphology,determiner_noun_agreement,determiner_noun_agreement_1,True,True,False,True,599,-35.171138763427734,-42.49004364013672,1
Most pedestrians attack this lady.,Most pedestrians attack this ladies.,morphology,determiner_noun_agreement,determiner_noun_agreement_1,True,True,False,True,600,-37.670806884765625,-41.50590133666992,1
Paula should visit those museums.,Paula should visit those museum.,morphology,determiner_noun_agreement,determiner_noun_agreement_1,True,True,False,True,601,-39.213539123535156,-39.1229248046875,0
All actresses visit this student.,All actresses visit this students.,morphology,determiner_noun_agreement,determiner_noun_agreement_1,True,True,False,True,602,-39.86441421508789,-42.058292388916016,1
Catherine drove to those banks.,Catherine drove to those bank.,morphology,determiner_noun_agreement,determiner_noun_agreement_1,True,True,False,True,603,-43.810855865478516,-46.33327865600586,1
Jessica helps these boys.,Jessica helps these boy.,morphology,determiner_noun_agreement,determiner_noun_agreement_1,True,True,False,True,604,-29.85548210144043,-32.45142364501953,1
Carrie doesn't annoy this patient.,Carrie doesn't annoy this patients.,morphology,determiner_noun_agreement,determiner_noun_agreement_1,True,True,False,True,605,-44.011009216308594,-48.0823974609375,1
James fired this patient.,James fired this patients.,morphology,determiner_noun_agreement,determiner_noun_agreement_1,True,True,False,True,606,-29.416460037231445,-33.95354080200195,1
Every movie theater aggravated those guys.,Every movie theater aggravated those guy.,morphology,determiner_noun_agreement,determiner_noun_agreement_1,True,True,False,True,607,-49.01447296142578,-52.406646728515625,1
Eric skated around that museum.,Eric skated around that museums.,morphology,determiner_noun_agreement,determiner_noun_agreement_1,True,True,False,True,608,-40.564300537109375,-45.80654525756836,1
Stacy conceals this turtle.,Stacy conceals this turtles.,morphology,determiner_noun_agreement,determiner_noun_agreement_1,True,True,False,True,609,-45.460723876953125,-50.00364685058594,1
A projector could confuse that guest.,A projector could confuse that guests.,morphology,determiner_noun_agreement,determiner_noun_agreement_1,True,True,False,True,610,-49.266632080078125,-48.593849182128906,0
Stacy doesn't leave this guy.,Stacy doesn't leave this guys.,morphology,determiner_noun_agreement,determiner_noun_agreement_1,True,True,False,True,611,-37.708980560302734,-41.79380798339844,1
Some mall wasn't disgusting those universities.,Some mall wasn't disgusting those university.,morphology,determiner_noun_agreement,determiner_noun_agreement_1,True,True,False,True,612,-58.269691467285156,-58.49835205078125,1
Julie might flee from these teachers.,Julie might flee from these teacher.,morphology,determiner_noun_agreement,determiner_noun_agreement_1,True,True,False,True,613,-49.31928253173828,-51.94340515136719,1
Jodi wasn't disgusting those girls.,Jodi wasn't disgusting those girl.,morphology,determiner_noun_agreement,determiner_noun_agreement_1,True,True,False,True,614,-53.032615661621094,-55.10935974121094,1
George isn't bringing this grocery store.,George isn't bringing this grocery stores.,morphology,determiner_noun_agreement,determiner_noun_agreement_1,True,True,False,True,615,-37.46969223022461,-41.591651916503906,1
A boy ran around this museum.,A boy ran around this museums.,morphology,determiner_noun_agreement,determiner_noun_agreement_1,True,True,False,True,616,-42.06520080566406,-47.752601623535156,1
Lori shouldn't break this dish.,Lori shouldn't break this dishs.,morphology,determiner_noun_agreement,determiner_noun_agreement_1,True,True,False,True,617,-40.46526336669922,-52.49760437011719,1
Some cakes embarrass those actresses.,Some cakes embarrass those actress.,morphology,determiner_noun_agreement,determiner_noun_agreement_1,True,True,False,True,618,-51.023399353027344,-51.95661544799805,1
Literature disturbs those universities.,Literature disturbs those university.,morphology,determiner_noun_agreement,determiner_noun_agreement_1,True,True,False,True,619,-47.956459045410156,-48.259864807128906,1
The teachers argue about those guys.,The teachers argue about those guy.,morphology,determiner_noun_agreement,determiner_noun_agreement_1,True,True,False,True,620,-39.97698211669922,-46.25245666503906,1
All pies aren't shocking these dancers.,All pies aren't shocking these dancer.,morphology,determiner_noun_agreement,determiner_noun_agreement_1,True,True,False,True,621,-51.55116271972656,-56.02825164794922,1
Some students weren't disagreeing with these adults.,Some students weren't disagreeing with these adult.,morphology,determiner_noun_agreement,determiner_noun_agreement_1,True,True,False,True,622,-50.2462043762207,-54.6227912902832,1
A woman is looking like those paintings.,A woman is looking like those painting.,morphology,determiner_noun_agreement,determiner_noun_agreement_1,True,True,False,True,623,-45.702857971191406,-47.066070556640625,1
A box alarms these actresses.,A box alarms these actress.,morphology,determiner_noun_agreement,determiner_noun_agreement_1,True,True,False,True,624,-47.580318450927734,-49.992034912109375,1
A lot of ladies can have that pamphlet.,A lot of ladies can have that pamphlets.,morphology,determiner_noun_agreement,determiner_noun_agreement_1,True,True,False,True,625,-49.252418518066406,-50.498146057128906,1
Meredith cured these guys.,Meredith cured these guy.,morphology,determiner_noun_agreement,determiner_noun_agreement_1,True,True,False,True,626,-40.14710998535156,-45.06915283203125,1
Phillip won't think about those students.,Phillip won't think about those student.,morphology,determiner_noun_agreement,determiner_noun_agreement_1,True,True,False,True,627,-47.24064254760742,-52.57725524902344,1
This hat disgusts that boy.,This hat disgusts that boys.,morphology,determiner_noun_agreement,determiner_noun_agreement_1,True,True,False,True,628,-49.80519485473633,-51.34315490722656,1
Raymond has forgotten that guy.,Raymond has forgotten that guys.,morphology,determiner_noun_agreement,determiner_noun_agreement_1,True,True,False,True,629,-42.46063995361328,-44.47240447998047,1
Erin hasn't toured these grocery stores.,Erin hasn't toured these grocery store.,morphology,determiner_noun_agreement,determiner_noun_agreement_1,True,True,False,True,630,-47.1844482421875,-48.64466857910156,1
The pies did alarm these students.,The pies did alarm these student.,morphology,determiner_noun_agreement,determiner_noun_agreement_1,True,True,False,True,631,-55.583011627197266,-61.97340393066406,1
Daniel does exit these public parks.,Daniel does exit these public park.,morphology,determiner_noun_agreement,determiner_noun_agreement_1,True,True,False,True,632,-42.72352981567383,-44.10728454589844,1
Theresa is arriving at that hospital.,Theresa is arriving at that hospitals.,morphology,determiner_noun_agreement,determiner_noun_agreement_1,True,True,False,True,633,-43.4022216796875,-49.14738082885742,1
Emily hasn't exited these grocery stores.,Emily hasn't exited these grocery store.,morphology,determiner_noun_agreement,determiner_noun_agreement_1,True,True,False,True,634,-42.654422760009766,-42.75216293334961,1
Sherry is concealing these brochures.,Sherry is concealing these brochure.,morphology,determiner_noun_agreement,determiner_noun_agreement_1,True,True,False,True,635,-50.808067321777344,-52.453826904296875,1
Jeffrey does complain about those reports.,Jeffrey does complain about those report.,morphology,determiner_noun_agreement,determiner_noun_agreement_1,True,True,False,True,636,-47.46416091918945,-50.16680145263672,1
All girls see that pedestrian.,All girls see that pedestrians.,morphology,determiner_noun_agreement,determiner_noun_agreement_1,True,True,False,True,637,-40.48137664794922,-41.13671875,1
Those actresses approach that student.,Those actresses approach that students.,morphology,determiner_noun_agreement,determiner_noun_agreement_1,True,True,False,True,638,-44.59498977661133,-44.5268440246582,0
