sentence_good,sentence_bad,field,linguistics_term,UID,simple_LM_method,one_prefix_method,two_prefix_method,lexically_identical,pair_id,good_prob,bad_prob,correct
Timothy couldn't disturb that guy.,Timothy couldn't disturb that guys.,morphology,determiner_noun_agreement,determiner_noun_agreement_1,True,True,False,True,639,-41.3970832824707,-43.87860107421875,1
A lot of guys find these guests.,A lot of guys find these guest.,morphology,determiner_noun_agreement,determiner_noun_agreement_1,True,True,False,True,640,-43.669883728027344,-47.07593536376953,1
Many fish can't look like this picture.,Many fish can't look like this pictures.,morphology,determiner_noun_agreement,determiner_noun_agreement_1,True,True,False,True,641,-40.29928970336914,-42.47212219238281,1
Craig drops by these cafes.,Craig drops by these cafe.,morphology,determiner_noun_agreement,determiner_noun_agreement_1,True,True,False,True,642,-38.436492919921875,-41.22012710571289,1
Carlos fired that waitress.,Carlos fired that waitresses.,morphology,determiner_noun_agreement,determiner_noun_agreement_1,True,True,False,True,643,-43.44638442993164,-45.14737319946289,1
Those girls conceal this blouse.,Those girls conceal this blouses.,morphology,determiner_noun_agreement,determiner_noun_agreement_1,True,True,False,True,644,-40.511199951171875,-41.72453308105469,1
The ladies walk through this public park.,The ladies walk through this public parks.,morphology,determiner_noun_agreement,determiner_noun_agreement_1,True,True,False,True,645,-41.79039001464844,-43.91179275512695,1
Irene has hidden those cashiers.,Irene has hidden those cashier.,morphology,determiner_noun_agreement,determiner_noun_agreement_1,True,True,False,True,646,-52.838623046875,-51.235870361328125,0
Nancy wouldn't describe that driver.,Nancy wouldn't describe that drivers.,morphology,determiner_noun_agreement,determiner_noun_agreement_1,True,True,False,True,647,-45.242706298828125,-46.63044738769531,1
A lot of reports didn't disagree with those documentaries.,A lot of reports didn't disagree with those documentary.,morphology,determiner_noun_agreement,determiner_noun_agreement_1,True,True,False,True,648,-54.764190673828125,-57.96235656738281,1
Every projector alarms that teacher.,Every projector alarms that teachers.,morphology,determiner_noun_agreement,determiner_noun_agreement_1,True,True,False,True,649,-47.80964660644531,-47.10163879394531,0
The associations worked with that actor.,The associations worked with that actors.,morphology,determiner_noun_agreement,determiner_noun_agreement_1,True,True,False,True,650,-44.64289093017578,-43.160518646240234,0
Tanya fixed this cup.,Tanya fixed this cups.,morphology,determiner_noun_agreement,determiner_noun_agreement_1,True,True,False,True,651,-38.34389877319336,-41.2367057800293,1
Samuel did sound like this museum.,Samuel did sound like this museums.,morphology,determiner_noun_agreement,determiner_noun_agreement_1,True,True,False,True,652,-42.80971908569336,-47.426658630371094,1
The drawing isn't annoying these waitresses.,The drawing isn't annoying these waitress.,morphology,determiner_noun_agreement,determiner_noun_agreement_1,True,True,False,True,653,-53.16917419433594,-54.701053619384766,1
That fork aggravates this university.,That fork aggravates this universities.,morphology,determiner_noun_agreement,determiner_noun_agreement_1,True,True,False,True,654,-44.684715270996094,-48.94965362548828,1
Amelia has attacked this patient.,Amelia has attacked this patients.,morphology,determiner_noun_agreement,determiner_noun_agreement_1,True,True,False,True,655,-41.246070861816406,-44.9005241394043,1
Margaret praises that student.,Margaret praises that students.,morphology,determiner_noun_agreement,determiner_noun_agreement_1,True,True,False,True,656,-43.978172302246094,-43.578269958496094,0
Dawn could love these essays.,Dawn could love these essay.,morphology,determiner_noun_agreement,determiner_noun_agreement_1,True,True,False,True,657,-40.73950958251953,-43.443519592285156,1
Natalie is finding these hats.,Natalie is finding these hat.,morphology,determiner_noun_agreement,determiner_noun_agreement_1,True,True,False,True,658,-40.5925178527832,-43.69248962402344,1
The Impressionists escape from this library.,The Impressionists escape from this libraries.,morphology,determiner_noun_agreement,determiner_noun_agreement_1,True,True,False,True,659,-46.98494338989258,-51.17348861694336,1
This government dislikes these guys.,This government dislikes these guy.,morphology,determiner_noun_agreement,determiner_noun_agreement_1,True,True,False,True,660,-37.95726013183594,-44.84960174560547,1
Phillip wasn't embarrassing this government.,Phillip wasn't embarrassing this governments.,morphology,determiner_noun_agreement,determiner_noun_agreement_1,True,True,False,True,661,-44.405479431152344,-51.94818878173828,1
Kenneth knew these students.,Kenneth knew these student.,morphology,determiner_noun_agreement,determiner_noun_agreement_1,True,True,False,True,662,-36.69198226928711,-42.126060485839844,1
A lot of lakes disturb that museum.,A lot of lakes disturb that museums.,morphology,determiner_noun_agreement,determiner_noun_agreement_1,True,True,False,True,663,-52.97809600830078,-55.32619857788086,1
Irene was going to that public park.,Irene was going to that public parks.,morphology,determiner_noun_agreement,determiner_noun_agreement_1,True,True,False,True,664,-48.953372955322266,-50.757057189941406,1
Heidi worked with those patients.,Heidi worked with those patient.,morphology,determiner_noun_agreement,determiner_noun_agreement_1,True,True,False,True,665,-37.958518981933594,-43.47242736816406,1
Renee was breaking that glass.,Renee was breaking that glasses.,morphology,determiner_noun_agreement,determiner_noun_agreement_1,True,True,False,True,666,-45.39574432373047,-47.203094482421875,1
Gregory dislikes this adult.,Gregory dislikes this adults.,morphology,determiner_noun_agreement,determiner_noun_agreement_1,True,True,False,True,667,-40.88043975830078,-43.6590461730957,1
Paul isn't taking this painting.,Paul isn't taking this paintings.,morphology,determiner_noun_agreement,determiner_noun_agreement_1,True,True,False,True,668,-32.50762176513672,-37.103126525878906,1
Rose is exiting this bank.,Rose is exiting this banks.,morphology,determiner_noun_agreement,determiner_noun_agreement_1,True,True,False,True,669,-30.139415740966797,-34.05925750732422,1
Lucille wasn't kissing that teenager.,Lucille wasn't kissing that teenagers.,morphology,determiner_noun_agreement,determiner_noun_agreement_1,True,True,False,True,670,-49.54836654663086,-52.354759216308594,1
Ann concealed these guests.,Ann concealed these guest.,morphology,determiner_noun_agreement,determiner_noun_agreement_1,True,True,False,True,671,-33.42852783203125,-36.94442367553711,1
Amanda notices these rabbits.,Amanda notices these rabbit.,morphology,determiner_noun_agreement,determiner_noun_agreement_1,True,True,False,True,672,-42.707767486572266,-46.984230041503906,1
Most pedestrians describe those plays.,Most pedestrians describe those play.,morphology,determiner_noun_agreement,determiner_noun_agreement_1,True,True,False,True,673,-42.166595458984375,-41.1960563659668,0
Guy has escaped from those girls.,Guy has escaped from those girl.,morphology,determiner_noun_agreement,determiner_noun_agreement_1,True,True,False,True,674,-35.46177673339844,-39.583709716796875,1
Naomi returned to this guy.,Naomi returned to this guys.,morphology,determiner_noun_agreement,determiner_noun_agreement_1,True,True,False,True,675,-37.90902328491211,-41.91033172607422,1
Elaine is messing up that glass.,Elaine is messing up that glasses.,morphology,determiner_noun_agreement,determiner_noun_agreement_1,True,True,False,True,676,-49.41218185424805,-50.15923309326172,1
Most banks should look like those drawings.,Most banks should look like those drawing.,morphology,determiner_noun_agreement,determiner_noun_agreement_1,True,True,False,True,677,-44.95661544799805,-44.744049072265625,0
Christopher hasn't hidden that chair.,Christopher hasn't hidden that chairs.,morphology,determiner_noun_agreement,determiner_noun_agreement_1,True,True,False,True,678,-38.58309555053711,-40.274070739746094,1
Florence talked to that doctor.,Florence talked to that doctors.,morphology,determiner_noun_agreement,determiner_noun_agreement_1,True,True,False,True,679,-41.73802947998047,-46.397151947021484,1
Sara had run around this library.,Sara had run around this libraries.,morphology,determiner_noun_agreement,determiner_noun_agreement_1,True,True,False,True,680,-45.25889587402344,-50.13072967529297,1
Helen was biking to these grocery stores.,Helen was biking to these grocery store.,morphology,determiner_noun_agreement,determiner_noun_agreement_1,True,True,False,True,681,-49.839752197265625,-50.03184127807617,1
Some children see these drawings.,Some children see these drawing.,morphology,determiner_noun_agreement,determiner_noun_agreement_1,True,True,False,True,682,-32.80918884277344,-34.03021240234375,1
A lot of pictures have annoyed this actress.,A lot of pictures have annoyed this actresses.,morphology,determiner_noun_agreement,determiner_noun_agreement_1,True,True,False,True,683,-53.42877197265625,-55.494998931884766,1
The Clintons hadn't argued about those boys.,The Clintons hadn't argued about those boy.,morphology,determiner_noun_agreement,determiner_noun_agreement_1,True,True,False,True,684,-58.078792572021484,-60.92399215698242,1
Mitchell healed that adult.,Mitchell healed that adults.,morphology,determiner_noun_agreement,determiner_noun_agreement_1,True,True,False,True,685,-46.147560119628906,-47.21023941040039,1
Omar doesn't forget these students.,Omar doesn't forget these student.,morphology,determiner_noun_agreement,determiner_noun_agreement_1,True,True,False,True,686,-40.86773681640625,-45.74507141113281,1
Carlos drops by that library.,Carlos drops by that libraries.,morphology,determiner_noun_agreement,determiner_noun_agreement_1,True,True,False,True,687,-44.14082717895508,-47.59567642211914,1
Some children were healing these students.,Some children were healing these student.,morphology,determiner_noun_agreement,determiner_noun_agreement_1,True,True,False,True,688,-40.77754592895508,-48.20135498046875,1
A fish isn't irritating this adult.,A fish isn't irritating this adults.,morphology,determiner_noun_agreement,determiner_noun_agreement_1,True,True,False,True,689,-46.621337890625,-48.276634216308594,1
Galileo had those glasses.,Galileo had those glass.,morphology,determiner_noun_agreement,determiner_noun_agreement_1,True,True,False,True,690,-44.571739196777344,-47.20680236816406,1
Candice would sound like these waiters.,Candice would sound like these waiter.,morphology,determiner_noun_agreement,determiner_noun_agreement_1,True,True,False,True,691,-48.111778259277344,-48.99401092529297,1
Tamara does tour those restaurants.,Tamara does tour those restaurant.,morphology,determiner_noun_agreement,determiner_noun_agreement_1,True,True,False,True,692,-44.725791931152344,-47.231719970703125,1
Mitchell will boast about those boys.,Mitchell will boast about those boy.,morphology,determiner_noun_agreement,determiner_noun_agreement_1,True,True,False,True,693,-50.18257522583008,-52.926422119140625,1
Nancy does pass those museums.,Nancy does pass those museum.,morphology,determiner_noun_agreement,determiner_noun_agreement_1,True,True,False,True,694,-51.539878845214844,-52.63154602050781,1
Brad liked those grocery stores.,Brad liked those grocery store.,morphology,determiner_noun_agreement,determiner_noun_agreement_1,True,True,False,True,695,-33.3678092956543,-34.69575500488281,1
Carol insults that actor.,Carol insults that actors.,morphology,determiner_noun_agreement,determiner_noun_agreement_1,True,True,False,True,696,-45.59562683105469,-45.68903732299805,1
Thomas knows those guests.,Thomas knows those guest.,morphology,determiner_noun_agreement,determiner_noun_agreement_1,True,True,False,True,697,-30.052337646484375,-33.89339828491211,1
Angela watched this pedestrian.,Angela watched this pedestrians.,morphology,determiner_noun_agreement,determiner_noun_agreement_1,True,True,False,True,698,-41.16015625,-45.33651351928711,1
Sally hasn't known that waitress.,Sally hasn't known that waitresses.,morphology,determiner_noun_agreement,determiner_noun_agreement_1,True,True,False,True,699,-52.155357360839844,-54.7757568359375,1
Harvard University didn't hate this adult.,Harvard University didn't hate this adults.,morphology,determiner_noun_agreement,determiner_noun_agreement_1,True,True,False,True,700,-49.245628356933594,-50.476959228515625,1
Anna hadn't fled from these restaurants.,Anna hadn't fled from these restaurant.,morphology,determiner_noun_agreement,determiner_noun_agreement_1,True,True,False,True,701,-38.764625549316406,-41.5838623046875,1
The Impressionists hadn't lifted this sweater.,The Impressionists hadn't lifted this sweaters.,morphology,determiner_noun_agreement,determiner_noun_agreement_1,True,True,False,True,702,-57.28074645996094,-60.32818603515625,1
Allison couldn't listen to this guest.,Allison couldn't listen to this guests.,morphology,determiner_noun_agreement,determiner_noun_agreement_1,True,True,False,True,703,-43.30339050292969,-45.504425048828125,1
All teenagers insult these movie theaters.,All teenagers insult these movie theater.,morphology,determiner_noun_agreement,determiner_noun_agreement_1,True,True,False,True,704,-48.94230651855469,-50.460044860839844,1
The carriage scares those senators.,The carriage scares those senator.,morphology,determiner_noun_agreement,determiner_noun_agreement_1,True,True,False,True,705,-48.9913215637207,-52.06069564819336,1
These students didn't disagree with those children.,These students didn't disagree with those child.,morphology,determiner_noun_agreement,determiner_noun_agreement_1,True,True,False,True,706,-39.664161682128906,-42.16978454589844,1
Children bike to those banks.,Children bike to those bank.,morphology,determiner_noun_agreement,determiner_noun_agreement_1,True,True,False,True,707,-33.91728973388672,-36.49388885498047,1
Alice isn't complaining about that waitress.,Alice isn't complaining about that waitresses.,morphology,determiner_noun_agreement,determiner_noun_agreement_1,True,True,False,True,708,-41.12665939331055,-43.81580352783203,1
Some girls clean this car.,Some girls clean this cars.,morphology,determiner_noun_agreement,determiner_noun_agreement_1,True,True,False,True,709,-32.97835922241211,-37.586158752441406,1
Most waiters could break those couches.,Most waiters could break those couch.,morphology,determiner_noun_agreement,determiner_noun_agreement_1,True,True,False,True,710,-46.13990020751953,-45.179161071777344,0
Bruce questions that cashier.,Bruce questions that cashiers.,morphology,determiner_noun_agreement,determiner_noun_agreement_1,True,True,False,True,711,-32.7188720703125,-34.6677360534668,1
George hated these cashiers.,George hated these cashier.,morphology,determiner_noun_agreement,determiner_noun_agreement_1,True,True,False,True,712,-34.940589904785156,-33.509586334228516,0
Ella concealed these teachers.,Ella concealed these teacher.,morphology,determiner_noun_agreement,determiner_noun_agreement_1,True,True,False,True,713,-49.62413787841797,-53.19816589355469,1
Sheila is bringing this hamster.,Sheila is bringing this hamsters.,morphology,determiner_noun_agreement,determiner_noun_agreement_1,True,True,False,True,714,-43.69294738769531,-46.52305603027344,1
Some doctors boast about those patients.,Some doctors boast about those patient.,morphology,determiner_noun_agreement,determiner_noun_agreement_1,True,True,False,True,715,-37.53949737548828,-42.95827865600586,1
Carla has investigated these boys.,Carla has investigated these boy.,morphology,determiner_noun_agreement,determiner_noun_agreement_1,True,True,False,True,716,-46.50314712524414,-49.418819427490234,1
Those actors have taken those libraries.,Those actors have taken those library.,morphology,determiner_noun_agreement,determiner_noun_agreement_1,True,True,False,True,717,-39.8726806640625,-42.301658630371094,1
Some restaurants irritated that lady.,Some restaurants irritated that ladies.,morphology,determiner_noun_agreement,determiner_noun_agreement_1,True,True,False,True,718,-44.75755310058594,-46.24652862548828,1
Marcus couldn't complain about this teacher.,Marcus couldn't complain about this teachers.,morphology,determiner_noun_agreement,determiner_noun_agreement_1,True,True,False,True,719,-34.83601760864258,-38.458030700683594,1
Carmen isn't boasting about this story.,Carmen isn't boasting about this stories.,morphology,determiner_noun_agreement,determiner_noun_agreement_1,True,True,False,True,720,-52.47998809814453,-58.168331146240234,1
That senator is selling that art gallery.,That senator is selling that art galleries.,morphology,determiner_noun_agreement,determiner_noun_agreement_1,True,True,False,True,721,-48.81089401245117,-48.34404373168945,0
Patrick investigates these girls.,Patrick investigates these girl.,morphology,determiner_noun_agreement,determiner_noun_agreement_1,True,True,False,True,722,-33.62002944946289,-39.263484954833984,1
Lucille has stunned this guest.,Lucille has stunned this guests.,morphology,determiner_noun_agreement,determiner_noun_agreement_1,True,True,False,True,723,-43.035491943359375,-44.57353210449219,1
Most men examine these reports.,Most men examine these report.,morphology,determiner_noun_agreement,determiner_noun_agreement_1,True,True,False,True,724,-33.961997985839844,-35.336917877197266,1
This eye embarrasses these ladies.,This eye embarrasses these lady.,morphology,determiner_noun_agreement,determiner_noun_agreement_1,True,True,False,True,725,-45.21818542480469,-50.628135681152344,1
Ella hasn't healed that boy.,Ella hasn't healed that boys.,morphology,determiner_noun_agreement,determiner_noun_agreement_1,True,True,False,True,726,-51.64264678955078,-55.98603820800781,1
Sabrina wasn't talking about this mall.,Sabrina wasn't talking about this malls.,morphology,determiner_noun_agreement,determiner_noun_agreement_1,True,True,False,True,727,-44.505271911621094,-49.996360778808594,1
Ella argued about those patients.,Ella argued about those patient.,morphology,determiner_noun_agreement,determiner_noun_agreement_1,True,True,False,True,728,-49.768775939941406,-53.97496032714844,1
This girl could arrive at those college campuses.,This girl could arrive at those college campus.,morphology,determiner_noun_agreement,determiner_noun_agreement_1,True,True,False,True,729,-50.58765411376953,-51.27617263793945,1
Cheryl wasn't revealing those ladies.,Cheryl wasn't revealing those lady.,morphology,determiner_noun_agreement,determiner_noun_agreement_1,True,True,False,True,730,-60.66751480102539,-63.888587951660156,1
Jodi boasted about that book.,Jodi boasted about that books.,morphology,determiner_noun_agreement,determiner_noun_agreement_1,True,True,False,True,731,-47.229209899902344,-51.547157287597656,1
Colleen has known that pedestrian.,Colleen has known that pedestrians.,morphology,determiner_noun_agreement,determiner_noun_agreement_1,True,True,False,True,732,-44.21318054199219,-44.4404296875,1
David wouldn't sell this plate.,David wouldn't sell this plates.,morphology,determiner_noun_agreement,determiner_noun_agreement_1,True,True,False,True,733,-31.321277618408203,-34.41014862060547,1
This legislature wouldn't help that teenager.,This legislature wouldn't help that teenagers.,morphology,determiner_noun_agreement,determiner_noun_agreement_1,True,True,False,True,734,-47.93506622314453,-48.1073112487793,1
Wayne was driving to this high school.,Wayne was driving to this high schools.,morphology,determiner_noun_agreement,determiner_noun_agreement_1,True,True,False,True,735,-38.02595520019531,-43.51504898071289,1
Dana will discuss this dancer.,Dana will discuss this dancers.,morphology,determiner_noun_agreement,determiner_noun_agreement_1,True,True,False,True,736,-42.51377868652344,-44.51799011230469,1
Candice cared for those teachers.,Candice cared for those teacher.,morphology,determiner_noun_agreement,determiner_noun_agreement_1,True,True,False,True,737,-38.48146057128906,-41.82841110229492,1
Every sketch looks like this brochure.,Every sketch looks like this brochures.,morphology,determiner_noun_agreement,determiner_noun_agreement_1,True,True,False,True,738,-35.83384323120117,-37.46929931640625,1
Most waiters love these documentaries.,Most waiters love these documentary.,morphology,determiner_noun_agreement,determiner_noun_agreement_1,True,True,False,True,739,-38.225547790527344,-41.52691650390625,1
Dancers are researching these pictures.,Dancers are researching these picture.,morphology,determiner_noun_agreement,determiner_noun_agreement_1,True,True,False,True,740,-40.241790771484375,-43.6488037109375,1
Christopher would aggravate these governments.,Christopher would aggravate these government.,morphology,determiner_noun_agreement,determiner_noun_agreement_1,True,True,False,True,741,-39.834251403808594,-41.30420684814453,1
Winston Churchill wasn't criticizing this college campus.,Winston Churchill wasn't criticizing this college campuses.,morphology,determiner_noun_agreement,determiner_noun_agreement_1,True,True,False,True,742,-64.9195556640625,-67.5755844116211,1
Mitchell discussed this teenager.,Mitchell discussed this teenagers.,morphology,determiner_noun_agreement,determiner_noun_agreement_1,True,True,False,True,743,-43.092281341552734,-44.45020294189453,1
Monet fired those waiters.,Monet fired those waiter.,morphology,determiner_noun_agreement,determiner_noun_agreement_1,True,True,False,True,744,-46.95967102050781,-46.611061096191406,0
The chicken shocks those committees.,The chicken shocks those committee.,morphology,determiner_noun_agreement,determiner_noun_agreement_1,True,True,False,True,745,-51.590431213378906,-50.71913146972656,0
The Lutherans approach this adult.,The Lutherans approach this adults.,morphology,determiner_noun_agreement,determiner_noun_agreement_1,True,True,False,True,746,-52.350196838378906,-55.898658752441406,1
Carol didn't return to that boy.,Carol didn't return to that boys.,morphology,determiner_noun_agreement,determiner_noun_agreement_1,True,True,False,True,747,-41.98059844970703,-45.179100036621094,1
Jane arrived at these restaurants.,Jane arrived at these restaurant.,morphology,determiner_noun_agreement,determiner_noun_agreement_1,True,True,False,True,748,-27.954975128173828,-29.725421905517578,1
That teacher revealed these teachers.,That teacher revealed these teacher.,morphology,determiner_noun_agreement,determiner_noun_agreement_1,True,True,False,True,749,-37.45021057128906,-41.069969177246094,1
Every book isn't stunning these banks.,Every book isn't stunning these bank.,morphology,determiner_noun_agreement,determiner_noun_agreement_1,True,True,False,True,750,-48.23774719238281,-50.15568161010742,1
Carla isn't messing up those couches.,Carla isn't messing up those couch.,morphology,determiner_noun_agreement,determiner_noun_agreement_1,True,True,False,True,751,-51.6541633605957,-50.08473205566406,0
Lori hasn't exited that grocery store.,Lori hasn't exited that grocery stores.,morphology,determiner_noun_agreement,determiner_noun_agreement_1,True,True,False,True,752,-50.934913635253906,-52.31304168701172,1
Waitresses lift those socks.,Waitresses lift those sock.,morphology,determiner_noun_agreement,determiner_noun_agreement_1,True,True,False,True,753,-38.88644790649414,-46.066688537597656,1
John wasn't shocking this doctor.,John wasn't shocking this doctors.,morphology,determiner_noun_agreement,determiner_noun_agreement_1,True,True,False,True,754,-37.01478958129883,-42.25823211669922,1
Gerald cleans that scarf.,Gerald cleans that scarves.,morphology,determiner_noun_agreement,determiner_noun_agreement_1,True,True,False,True,755,-45.000953674316406,-45.354530334472656,1
Larry wasn't scaring this legislature.,Larry wasn't scaring this legislatures.,morphology,determiner_noun_agreement,determiner_noun_agreement_1,True,True,False,True,756,-42.47029495239258,-48.195098876953125,1
All ladders wouldn't annoy this girl.,All ladders wouldn't annoy this girls.,morphology,determiner_noun_agreement,determiner_noun_agreement_1,True,True,False,True,757,-52.492679595947266,-54.34959030151367,1
The Borgias haven't cared for those children.,The Borgias haven't cared for those child.,morphology,determiner_noun_agreement,determiner_noun_agreement_1,True,True,False,True,758,-55.33103561401367,-60.56961441040039,1
Emily disagrees with that boy.,Emily disagrees with that boys.,morphology,determiner_noun_agreement,determiner_noun_agreement_1,True,True,False,True,759,-30.47637176513672,-34.37241744995117,1
Guy has cleaned these restaurants.,Guy has cleaned these restaurant.,morphology,determiner_noun_agreement,determiner_noun_agreement_1,True,True,False,True,760,-36.28722381591797,-38.81642150878906,1
Ruth looks like that sketch.,Ruth looks like that sketches.,morphology,determiner_noun_agreement,determiner_noun_agreement_1,True,True,False,True,761,-41.263099670410156,-43.91069412231445,1
Every river shocks this boy.,Every river shocks this boys.,morphology,determiner_noun_agreement,determiner_noun_agreement_1,True,True,False,True,762,-42.01305389404297,-44.37382888793945,1
The sketch wouldn't look like these cups.,The sketch wouldn't look like these cup.,morphology,determiner_noun_agreement,determiner_noun_agreement_1,True,True,False,True,763,-47.891624450683594,-51.522789001464844,1
The cashiers pass this grocery store.,The cashiers pass this grocery stores.,morphology,determiner_noun_agreement,determiner_noun_agreement_1,True,True,False,True,764,-43.036895751953125,-47.05092239379883,1
Those actors hire those waitresses.,Those actors hire those waitress.,morphology,determiner_noun_agreement,determiner_noun_agreement_1,True,True,False,True,765,-48.77882766723633,-47.96939468383789,0
