sentence_good,sentence_bad,field,linguistics_term,UID,simple_LM_method,one_prefix_method,two_prefix_method,lexically_identical,pair_id,good_prob,bad_prob,correct
Who hasn't Gary realized he didn't investigate?,Who hasn't Gary realized who didn't investigate?,syntax,island_effects,wh_island,True,True,False,False,271,-57.13874053955078,-62.67362594604492,1
What has Tracy realized she has sold?,What has Tracy realized who has sold?,syntax,island_effects,wh_island,True,True,False,False,272,-52.21593475341797,-56.2870979309082,1
What will Carrie discover she couldn't love?,What will Carrie discover who couldn't love?,syntax,island_effects,wh_island,True,True,False,False,273,-52.37791442871094,-54.78226089477539,1
What might Homer find out he has?,What might Homer find out who has?,syntax,island_effects,wh_island,True,True,False,False,274,-51.48385238647461,-50.026222229003906,0
What was that actress discovering she respected?,What was that actress discovering who respected?,syntax,island_effects,wh_island,True,True,False,False,275,-53.189762115478516,-56.535919189453125,1
What would Kristen forget she skated around?,What would Kristen forget who skated around?,syntax,island_effects,wh_island,True,True,False,False,276,-58.738582611083984,-61.865745544433594,1
Who were actresses learning they don't hire?,Who were actresses learning who don't hire?,syntax,island_effects,wh_island,True,True,False,False,277,-60.79911804199219,-61.09205627441406,1
What couldn't Janet learn she liked?,What couldn't Janet learn who liked?,syntax,island_effects,wh_island,True,True,False,False,278,-51.38612365722656,-56.926395416259766,1
What has Beth known she examines?,What has Beth known who examines?,syntax,island_effects,wh_island,True,True,False,False,279,-54.49259948730469,-55.73582458496094,1
Who isn't Gina learning she appreciated?,Who isn't Gina learning who appreciated?,syntax,island_effects,wh_island,True,True,False,False,280,-52.29199981689453,-57.243473052978516,1
What hasn't Theresa investigated she sounds like?,What hasn't Theresa investigated who sounds like?,syntax,island_effects,wh_island,True,True,False,False,281,-64.77925872802734,-64.55343627929688,0
Who had a bank remembered it had irritated?,Who had a bank remembered what had irritated?,syntax,island_effects,wh_island,True,True,False,False,282,-60.804534912109375,-60.595245361328125,0
What could George reveal he biked to?,What could George reveal who biked to?,syntax,island_effects,wh_island,True,True,False,False,283,-64.84233093261719,-66.39846801757812,1
Who would Raymond know he hadn't cared for?,Who would Raymond know who hadn't cared for?,syntax,island_effects,wh_island,True,True,False,False,284,-53.676021575927734,-55.099639892578125,1
What wouldn't Diane investigate she escaped from?,What wouldn't Diane investigate who escaped from?,syntax,island_effects,wh_island,True,True,False,False,285,-59.828609466552734,-60.589454650878906,1
Who isn't Samantha discovering she can reveal?,Who isn't Samantha discovering who can reveal?,syntax,island_effects,wh_island,True,True,False,False,286,-57.54302978515625,-61.06275939941406,1
Who isn't Sabrina revealing she should impress?,Who isn't Sabrina revealing what should impress?,syntax,island_effects,wh_island,True,True,False,False,287,-63.71969223022461,-65.08586883544922,1
What can a waitress reveal she breaks?,What can a waitress reveal who breaks?,syntax,island_effects,wh_island,True,True,False,False,288,-56.34668731689453,-57.00120544433594,1
Who wouldn't Kimberley investigate she hugged?,Who wouldn't Kimberley investigate who hugged?,syntax,island_effects,wh_island,True,True,False,False,289,-65.95790100097656,-66.42915344238281,1
Who hasn't Karen learned she was scaring?,Who hasn't Karen learned who was scaring?,syntax,island_effects,wh_island,True,True,False,False,290,-61.809940338134766,-64.97457885742188,1
Who can't Monica find out she wouldn't research?,Who can't Monica find out who wouldn't research?,syntax,island_effects,wh_island,True,True,False,False,291,-64.93386840820312,-64.42415618896484,0
What hadn't Beverly forgotten she has loved?,What hadn't Beverly forgotten who has loved?,syntax,island_effects,wh_island,True,True,False,False,292,-61.003570556640625,-62.21166229248047,1
Who wouldn't Samuel forget he couldn't alarm?,Who wouldn't Samuel forget who couldn't alarm?,syntax,island_effects,wh_island,True,True,False,False,293,-61.560340881347656,-65.55746459960938,1
What has Dennis learned he might fix?,What has Dennis learned who might fix?,syntax,island_effects,wh_island,True,True,False,False,294,-59.29179000854492,-62.25721740722656,1
Who couldn't all teenagers know they astounded?,Who couldn't all teenagers know who astounded?,syntax,island_effects,wh_island,True,True,False,False,295,-59.69817352294922,-58.822906494140625,0
What was Ella figuring out she exits?,What was Ella figuring out who exits?,syntax,island_effects,wh_island,True,True,False,False,296,-63.23065948486328,-61.259178161621094,0
Who hadn't Thomas discovered he isn't thinking about?,Who hadn't Thomas discovered who isn't thinking about?,syntax,island_effects,wh_island,True,True,False,False,297,-60.631317138671875,-63.95088195800781,1
Who hasn't Raymond known he hadn't remembered?,Who hasn't Raymond known who hadn't remembered?,syntax,island_effects,wh_island,True,True,False,False,298,-61.007965087890625,-64.04135131835938,1
What had Kevin realized he can't clean?,What had Kevin realized who can't clean?,syntax,island_effects,wh_island,True,True,False,False,299,-57.2969856262207,-61.56552505493164,1
What had Laura revealed she didn't admire?,What had Laura revealed who didn't admire?,syntax,island_effects,wh_island,True,True,False,False,300,-53.29393005371094,-59.42305374145508,1
What is Bethany discovering she hasn't fled from?,What is Bethany discovering who hasn't fled from?,syntax,island_effects,wh_island,True,True,False,False,301,-63.083221435546875,-64.40686798095703,1
What hadn't Michelle found out she broke?,What hadn't Michelle found out who broke?,syntax,island_effects,wh_island,True,True,False,False,302,-57.93678665161133,-59.61823272705078,1
What might an adult investigate he won't mess up?,What might an adult investigate who won't mess up?,syntax,island_effects,wh_island,True,True,False,False,303,-68.52676391601562,-66.89888763427734,0
What hasn't Rodney discovered he couldn't appreciate?,What hasn't Rodney discovered who couldn't appreciate?,syntax,island_effects,wh_island,True,True,False,False,304,-58.60213088989258,-63.49338150024414,1
Who wasn't Joel learning he had argued about?,Who wasn't Joel learning who had argued about?,syntax,island_effects,wh_island,True,True,False,False,305,-64.82307434082031,-66.66675567626953,1
Who won't Tonya figure out she observes?,Who won't Tonya figure out who observes?,syntax,island_effects,wh_island,True,True,False,False,306,-65.66580963134766,-65.8604736328125,1
Who was Janet revealing she finds?,Who was Janet revealing what finds?,syntax,island_effects,wh_island,True,True,False,False,307,-50.2028923034668,-52.19922637939453,1
Who haven't all libraries concealed they bothered?,Who haven't all libraries concealed what bothered?,syntax,island_effects,wh_island,True,True,False,False,308,-67.33085632324219,-68.18558502197266,1
What has Benjamin forgotten he healed?,What has Benjamin forgotten who healed?,syntax,island_effects,wh_island,True,True,False,False,309,-52.67204284667969,-54.68303298950195,1
Who didn't that child remember he has confused?,Who didn't that child remember who has confused?,syntax,island_effects,wh_island,True,True,False,False,310,-60.89225769042969,-60.99329376220703,1
Who is Tiffany finding out she investigated?,Who is Tiffany finding out who investigated?,syntax,island_effects,wh_island,True,True,False,False,311,-56.51457977294922,-57.29103088378906,1
What didn't Kristen forget she is cleaning?,What didn't Kristen forget who is cleaning?,syntax,island_effects,wh_island,True,True,False,False,312,-59.483558654785156,-61.734375,1
What had a lot of hospitals remembered they took?,What had a lot of hospitals remembered who took?,syntax,island_effects,wh_island,True,True,False,False,313,-57.290809631347656,-59.690887451171875,1
What hadn't Colleen revealed she exited?,What hadn't Colleen revealed who exited?,syntax,island_effects,wh_island,True,True,False,False,314,-65.02839660644531,-68.30084991455078,1
What is Emily investigating she has skated around?,What is Emily investigating who has skated around?,syntax,island_effects,wh_island,True,True,False,False,315,-61.73554992675781,-61.68970489501953,0
What wasn't Jason remembering he boycotted?,What wasn't Jason remembering who boycotted?,syntax,island_effects,wh_island,True,True,False,False,316,-78.13946533203125,-78.23609924316406,1
What isn't Gary forgetting he will have?,What isn't Gary forgetting who will have?,syntax,island_effects,wh_island,True,True,False,False,317,-53.94052505493164,-55.89176940917969,1
What wasn't Cheryl concealing she dropped by?,What wasn't Cheryl concealing who dropped by?,syntax,island_effects,wh_island,True,True,False,False,318,-69.9368896484375,-69.45059204101562,0
Who had Bruce learned he fires?,Who had Bruce learned who fires?,syntax,island_effects,wh_island,True,True,False,False,319,-52.72698974609375,-56.46918487548828,1
Who isn't Alexander realizing he reveals?,Who isn't Alexander realizing who reveals?,syntax,island_effects,wh_island,True,True,False,False,320,-54.318199157714844,-59.41212463378906,1
What will Monica reveal she hasn't descended?,What will Monica reveal what hasn't descended?,syntax,island_effects,wh_island,True,True,False,False,321,-63.005428314208984,-62.07699966430664,0
What is that senator finding out he was lifting?,What is that senator finding out who was lifting?,syntax,island_effects,wh_island,True,True,False,False,322,-63.518959045410156,-61.686927795410156,0
Who will Amelia find out she fires?,Who will Amelia find out who fires?,syntax,island_effects,wh_island,True,True,False,False,323,-51.910587310791016,-52.58778381347656,1
What has Edward forgotten he explores?,What has Edward forgotten who explores?,syntax,island_effects,wh_island,True,True,False,False,324,-53.903995513916016,-55.89138412475586,1
What won't a waitress forget she doesn't lift?,What won't a waitress forget who doesn't lift?,syntax,island_effects,wh_island,True,True,False,False,325,-63.263973236083984,-66.25077819824219,1
Who wasn't Douglas revealing he can talk to?,Who wasn't Douglas revealing who can talk to?,syntax,island_effects,wh_island,True,True,False,False,326,-63.90312957763672,-65.14796447753906,1
Who wasn't Angela learning she kissed?,Who wasn't Angela learning who kissed?,syntax,island_effects,wh_island,True,True,False,False,327,-57.275177001953125,-60.543399810791016,1
Who haven't these waiters revealed they have worked with?,Who haven't these waiters revealed who have worked with?,syntax,island_effects,wh_island,True,True,False,False,328,-64.6678237915039,-68.85588073730469,1
Who can't Sabrina reveal she is aggravating?,Who can't Sabrina reveal who is aggravating?,syntax,island_effects,wh_island,True,True,False,False,329,-69.03804016113281,-69.8179702758789,1
Who did Florence know she did question?,Who did Florence know who did question?,syntax,island_effects,wh_island,True,True,False,False,330,-51.714820861816406,-53.97057342529297,1
Who had Tamara revealed she was annoying?,Who had Tamara revealed what was annoying?,syntax,island_effects,wh_island,True,True,False,False,331,-58.673240661621094,-56.53901672363281,0
What are many patients concealing they have disliked?,What are many patients concealing who have disliked?,syntax,island_effects,wh_island,True,True,False,False,332,-68.91571044921875,-67.70037841796875,0
Who can Catherine investigate she disagrees with?,Who can Catherine investigate who disagrees with?,syntax,island_effects,wh_island,True,True,False,False,333,-51.94536590576172,-54.68111038208008,1
Who has Daniel investigated he disgusted?,Who has Daniel investigated who disgusted?,syntax,island_effects,wh_island,True,True,False,False,334,-61.576751708984375,-60.68370056152344,0
Who didn't Melissa learn she works with?,Who didn't Melissa learn who works with?,syntax,island_effects,wh_island,True,True,False,False,335,-52.012245178222656,-53.9684944152832,1
What had Aaron discovered he ascended?,What had Aaron discovered what ascended?,syntax,island_effects,wh_island,True,True,False,False,336,-51.174415588378906,-55.307456970214844,1
What wasn't Veronica realizing she had admired?,What wasn't Veronica realizing who had admired?,syntax,island_effects,wh_island,True,True,False,False,337,-59.18781661987305,-62.86782455444336,1
Who will Beverly know she discovers?,Who will Beverly know who discovers?,syntax,island_effects,wh_island,True,True,False,False,338,-47.480079650878906,-50.79195785522461,1
Who hadn't Jessica known she knows?,Who hadn't Jessica known who knows?,syntax,island_effects,wh_island,True,True,False,False,339,-49.68294143676758,-52.935157775878906,1
What didn't Tara remember she could argue about?,What didn't Tara remember who could argue about?,syntax,island_effects,wh_island,True,True,False,False,340,-61.05868911743164,-64.44187927246094,1
What aren't women concealing they have messed up?,What aren't women concealing who have messed up?,syntax,island_effects,wh_island,True,True,False,False,341,-64.90569305419922,-63.95039367675781,0
Who wasn't Brian learning he sounds like?,Who wasn't Brian learning what sounds like?,syntax,island_effects,wh_island,True,True,False,False,342,-54.23749542236328,-51.59954071044922,0
What won't this senator realize he would scan?,What won't this senator realize who would scan?,syntax,island_effects,wh_island,True,True,False,False,343,-68.4435806274414,-70.83537292480469,1
What was Stacey remembering she won't reveal?,What was Stacey remembering who won't reveal?,syntax,island_effects,wh_island,True,True,False,False,344,-63.3248291015625,-65.52755737304688,1
Who isn't the organization finding out it was boring?,Who isn't the organization finding out what was boring?,syntax,island_effects,wh_island,True,True,False,False,345,-60.55015563964844,-57.65020751953125,0
Who was Kristin concealing she had argued about?,Who was Kristin concealing who had argued about?,syntax,island_effects,wh_island,True,True,False,False,346,-70.94800567626953,-68.5030517578125,0
Who would Larry learn he isn't visiting?,Who would Larry learn who isn't visiting?,syntax,island_effects,wh_island,True,True,False,False,347,-57.268245697021484,-57.020751953125,0
What hadn't Carl figured out he had hated?,What hadn't Carl figured out who had hated?,syntax,island_effects,wh_island,True,True,False,False,348,-66.92536926269531,-66.40501403808594,0
What couldn't Lawrence realize he has taken?,What couldn't Lawrence realize who has taken?,syntax,island_effects,wh_island,True,True,False,False,349,-57.9095573425293,-60.88808059692383,1
What won't Bethany discover she wasn't visiting?,What won't Bethany discover who wasn't visiting?,syntax,island_effects,wh_island,True,True,False,False,350,-63.324363708496094,-65.78471374511719,1
Who couldn't Donald know he had kissed?,Who couldn't Donald know who had kissed?,syntax,island_effects,wh_island,True,True,False,False,351,-61.11509704589844,-62.31281661987305,1
What might Paula realize she will ascend?,What might Paula realize who will ascend?,syntax,island_effects,wh_island,True,True,False,False,352,-57.655250549316406,-61.156272888183594,1
Who couldn't Marie realize she has questioned?,Who couldn't Marie realize who has questioned?,syntax,island_effects,wh_island,True,True,False,False,353,-57.155860900878906,-60.09973907470703,1
What hasn't Theodore figured out he heals?,What hasn't Theodore figured out who heals?,syntax,island_effects,wh_island,True,True,False,False,354,-62.1029052734375,-61.535892486572266,0
Who does Judy find out she was escaping from?,Who does Judy find out who was escaping from?,syntax,island_effects,wh_island,True,True,False,False,355,-61.68103790283203,-62.08838653564453,1
What has Frank concealed he hasn't remembered?,What has Frank concealed who hasn't remembered?,syntax,island_effects,wh_island,True,True,False,False,356,-61.41884231567383,-64.03987884521484,1
What couldn't Paul investigate he hadn't researched?,What couldn't Paul investigate who hadn't researched?,syntax,island_effects,wh_island,True,True,False,False,357,-60.768096923828125,-62.16704559326172,1
What isn't Mitchell learning he was fixing?,What isn't Mitchell learning who was fixing?,syntax,island_effects,wh_island,True,True,False,False,358,-58.60143280029297,-61.09496307373047,1
Who shouldn't Candice discover she is bothering?,Who shouldn't Candice discover what is bothering?,syntax,island_effects,wh_island,True,True,False,False,359,-69.22608947753906,-65.24559020996094,0
Who aren't some actresses investigating they were bothering?,Who aren't some actresses investigating what were bothering?,syntax,island_effects,wh_island,True,True,False,False,360,-69.04878234863281,-67.79510498046875,0
What isn't Suzanne learning she scanned?,What isn't Suzanne learning who scanned?,syntax,island_effects,wh_island,True,True,False,False,361,-57.81657409667969,-60.24578094482422,1
What hadn't Erin forgotten she hasn't bought?,What hadn't Erin forgotten who hasn't bought?,syntax,island_effects,wh_island,True,True,False,False,362,-60.76031494140625,-63.32160949707031,1
What hasn't Becky known she climbs up?,What hasn't Becky known what climbs up?,syntax,island_effects,wh_island,True,True,False,False,363,-59.97705078125,-59.72721862792969,0
What hadn't Rachelle found out she exited?,What hadn't Rachelle found out who exited?,syntax,island_effects,wh_island,True,True,False,False,364,-67.48616027832031,-68.59954071044922,1
Who is Jessica remembering she cares for?,Who is Jessica remembering who cares for?,syntax,island_effects,wh_island,True,True,False,False,365,-45.87616729736328,-47.3200798034668,1
What hasn't Julia remembered she hadn't returned to?,What hasn't Julia remembered who hadn't returned to?,syntax,island_effects,wh_island,True,True,False,False,366,-59.80723571777344,-63.17916488647461,1
What hasn't Kayla known she cures?,What hasn't Kayla known who cures?,syntax,island_effects,wh_island,True,True,False,False,367,-65.959228515625,-66.62741088867188,1
What hasn't Alan forgotten he was running around?,What hasn't Alan forgotten who was running around?,syntax,island_effects,wh_island,True,True,False,False,368,-56.236358642578125,-57.88934326171875,1
What is Cindy remembering she ran around?,What is Cindy remembering who ran around?,syntax,island_effects,wh_island,True,True,False,False,369,-52.84468460083008,-53.57328796386719,1
Who will Rachelle find out she talks to?,Who will Rachelle find out who talks to?,syntax,island_effects,wh_island,True,True,False,False,370,-60.64014434814453,-61.40533447265625,1
What hasn't this boy figured out he forgets?,What hasn't this boy figured out who forgets?,syntax,island_effects,wh_island,True,True,False,False,371,-63.66239929199219,-62.56930923461914,0
What was Larry concealing he will respect?,What was Larry concealing who will respect?,syntax,island_effects,wh_island,True,True,False,False,372,-63.33730697631836,-61.600528717041016,0
What wouldn't Elizabeth learn she dislikes?,What wouldn't Elizabeth learn who dislikes?,syntax,island_effects,wh_island,True,True,False,False,373,-54.40607452392578,-57.020606994628906,1
Who had Victoria concealed she disturbed?,Who had Victoria concealed what disturbed?,syntax,island_effects,wh_island,True,True,False,False,374,-56.10523223876953,-58.14188003540039,1
Who is April concealing she left?,Who is April concealing who left?,syntax,island_effects,wh_island,True,True,False,False,375,-53.864410400390625,-55.010704040527344,1
What had Elizabeth figured out she doesn't sound like?,What had Elizabeth figured out who doesn't sound like?,syntax,island_effects,wh_island,True,True,False,False,376,-56.83972930908203,-57.68579864501953,1
What wouldn't Carol forget she dropped by?,What wouldn't Carol forget who dropped by?,syntax,island_effects,wh_island,True,True,False,False,377,-59.541500091552734,-62.315895080566406,1
Who couldn't Veronica realize she irritated?,Who couldn't Veronica realize what irritated?,syntax,island_effects,wh_island,True,True,False,False,378,-57.02418518066406,-60.535423278808594,1
Who might some museum discover it didn't astound?,Who might some museum discover who didn't astound?,syntax,island_effects,wh_island,True,True,False,False,379,-68.77243041992188,-70.5520248413086,1
Who can't Carol forget she dislikes?,Who can't Carol forget who dislikes?,syntax,island_effects,wh_island,True,True,False,False,380,-58.66426467895508,-61.35527801513672,1
What didn't Sandra conceal she wouldn't boycott?,What didn't Sandra conceal who wouldn't boycott?,syntax,island_effects,wh_island,True,True,False,False,381,-69.978515625,-71.80917358398438,1
What shouldn't Rachelle realize she examined?,What shouldn't Rachelle realize who examined?,syntax,island_effects,wh_island,True,True,False,False,382,-63.97279739379883,-67.22781372070312,1
Who would Connie remember she fires?,Who would Connie remember who fires?,syntax,island_effects,wh_island,True,True,False,False,383,-51.5533561706543,-54.51578140258789,1
Who would Carrie investigate she hadn't concealed?,Who would Carrie investigate who hadn't concealed?,syntax,island_effects,wh_island,True,True,False,False,384,-60.95370101928711,-63.98957443237305,1
Who hadn't Keith known he didn't know?,Who hadn't Keith known who didn't know?,syntax,island_effects,wh_island,True,True,False,False,385,-51.98404312133789,-55.183162689208984,1
Who hadn't Gina investigated she would alarm?,Who hadn't Gina investigated who would alarm?,syntax,island_effects,wh_island,True,True,False,False,386,-67.96269989013672,-69.37779235839844,1
Who can't Renee find out she can't love?,Who can't Renee find out who can't love?,syntax,island_effects,wh_island,True,True,False,False,387,-59.92826461791992,-57.06739044189453,0
Who is Linda concealing she will listen to?,Who is Linda concealing who will listen to?,syntax,island_effects,wh_island,True,True,False,False,388,-58.30364227294922,-58.3646125793457,1
Who hasn't Eric forgotten he has talked to?,Who hasn't Eric forgotten who has talked to?,syntax,island_effects,wh_island,True,True,False,False,389,-56.15396499633789,-57.165611267089844,1
What can Gerald investigate he broke?,What can Gerald investigate who broke?,syntax,island_effects,wh_island,True,True,False,False,390,-53.33307647705078,-54.4141845703125,1
Who hasn't Pamela found out she was talking to?,Who hasn't Pamela found out who was talking to?,syntax,island_effects,wh_island,True,True,False,False,391,-60.501007080078125,-62.227718353271484,1
Who is Lisa concealing she hasn't remembered?,Who is Lisa concealing who hasn't remembered?,syntax,island_effects,wh_island,True,True,False,False,392,-59.61100769042969,-61.40148162841797,1
What hadn't Susan known she is appreciating?,What hadn't Susan known who is appreciating?,syntax,island_effects,wh_island,True,True,False,False,393,-65.50259399414062,-65.53441619873047,1
What is Steven figuring out he boycotted?,What is Steven figuring out who boycotted?,syntax,island_effects,wh_island,True,True,False,False,394,-71.63703155517578,-68.83262634277344,0
Who has Stacey investigated she could shock?,Who has Stacey investigated what could shock?,syntax,island_effects,wh_island,True,True,False,False,395,-67.6292724609375,-63.851768493652344,0
What was Jeffrey discovering he hadn't run around?,What was Jeffrey discovering who hadn't run around?,syntax,island_effects,wh_island,True,True,False,False,396,-64.32797241210938,-64.47210693359375,1
Who isn't Colleen figuring out she noticed?,Who isn't Colleen figuring out who noticed?,syntax,island_effects,wh_island,True,True,False,False,397,-59.73609161376953,-62.11309814453125,1
Who hasn't Marie found out she notices?,Who hasn't Marie found out who notices?,syntax,island_effects,wh_island,True,True,False,False,398,-56.44764709472656,-59.624671936035156,1
Who has Cheryl learned she talked to?,Who has Cheryl learned who talked to?,syntax,island_effects,wh_island,True,True,False,False,399,-53.025413513183594,-55.891685485839844,1
Who had an actor revealed she hugged?,Who had an actor revealed who hugged?,syntax,island_effects,wh_island,True,True,False,False,400,-53.20098114013672,-55.198219299316406,1
Who can't Alicia learn she has escaped from?,Who can't Alicia learn who has escaped from?,syntax,island_effects,wh_island,True,True,False,False,401,-61.84209442138672,-62.403541564941406,1
What isn't Derek figuring out he hadn't exited?,What isn't Derek figuring out who hadn't exited?,syntax,island_effects,wh_island,True,True,False,False,402,-64.77436065673828,-64.15275573730469,0
Who won't Donna investigate she doesn't bother?,Who won't Donna investigate who doesn't bother?,syntax,island_effects,wh_island,True,True,False,False,403,-58.836368560791016,-60.320960998535156,1
Who is Steve remembering he cared for?,Who is Steve remembering who cared for?,syntax,island_effects,wh_island,True,True,False,False,404,-46.03287887573242,-46.4102783203125,1
Who wasn't Tamara learning she disgusted?,Who wasn't Tamara learning who disgusted?,syntax,island_effects,wh_island,True,True,False,False,405,-65.94027709960938,-66.88741302490234,1
What wasn't Heather revealing she exits?,What wasn't Heather revealing who exits?,syntax,island_effects,wh_island,True,True,False,False,406,-62.51435089111328,-64.11477661132812,1
What will Stacy forget she has fixed?,What will Stacy forget who has fixed?,syntax,island_effects,wh_island,True,True,False,False,407,-56.3819580078125,-59.928184509277344,1
