sentence_good,sentence_bad,field,linguistics_term,UID,simple_LM_method,one_prefix_method,two_prefix_method,lexically_identical,pair_id,good_prob,bad_prob,correct
Had Bruce ever played?,Bruce had ever played.,semantics,npi_licensing,matrix_question_npi_licensor_present,True,False,True,True,0,-31.186607360839844,-22.69352912902832,0
Had Patrick ever answered?,Patrick had ever answered.,semantics,npi_licensing,matrix_question_npi_licensor_present,True,False,True,True,1,-34.04912567138672,-24.327552795410156,0
Do some carts ever accelerate?,Some carts do ever accelerate.,semantics,npi_licensing,matrix_question_npi_licensor_present,True,False,True,True,2,-45.663272857666016,-43.482566833496094,0
Will Dawn ever know Jeffrey?,Dawn will ever know Jeffrey.,semantics,npi_licensing,matrix_question_npi_licensor_present,True,False,True,True,3,-43.09211730957031,-43.460975646972656,1
Should Monica ever grin?,Monica should ever grin.,semantics,npi_licensing,matrix_question_npi_licensor_present,True,False,True,True,4,-37.60856628417969,-39.726226806640625,1
Has Cindy ever anticipated most dancers to study?,Cindy has ever anticipated most dancers to study.,semantics,npi_licensing,matrix_question_npi_licensor_present,True,False,True,True,5,-66.73927307128906,-68.59469604492188,1
Had Denise ever doubted Galileo can't bother to train?,Denise had ever doubted Galileo can't bother to train.,semantics,npi_licensing,matrix_question_npi_licensor_present,True,False,True,True,6,-74.4429702758789,-72.9867172241211,0
Has Jane ever worried Tonya?,Jane has ever worried Tonya.,semantics,npi_licensing,matrix_question_npi_licensor_present,True,False,True,True,7,-52.84267807006836,-46.13489532470703,0
Would many customers ever bake?,Many customers would ever bake.,semantics,npi_licensing,matrix_question_npi_licensor_present,True,False,True,True,8,-39.392635345458984,-38.35681915283203,0
Should Mitchell ever know Eva?,Mitchell should ever know Eva.,semantics,npi_licensing,matrix_question_npi_licensor_present,True,False,True,True,9,-44.499385833740234,-46.621429443359375,1
Could many doctors ever clash?,Many doctors could ever clash.,semantics,npi_licensing,matrix_question_npi_licensor_present,True,False,True,True,10,-41.092681884765625,-39.478607177734375,0
Has Sandra ever planned to get a job?,Sandra has ever planned to get a job.,semantics,npi_licensing,matrix_question_npi_licensor_present,True,False,True,True,11,-47.90180969238281,-48.05893325805664,1
Will the horse ever come here?,The horse will ever come here.,semantics,npi_licensing,matrix_question_npi_licensor_present,True,False,True,True,12,-31.277130126953125,-31.617250442504883,1
Did children ever cope?,Children did ever cope.,semantics,npi_licensing,matrix_question_npi_licensor_present,True,False,True,True,13,-30.80633544921875,-28.96927261352539,0
Did Carolyn ever argue?,Carolyn did ever argue.,semantics,npi_licensing,matrix_question_npi_licensor_present,True,False,True,True,14,-34.059391021728516,-40.587013244628906,1
Did most dresses ever shrink?,Most dresses did ever shrink.,semantics,npi_licensing,matrix_question_npi_licensor_present,True,False,True,True,15,-42.12644958496094,-40.461204528808594,0
Might Sarah ever forget many teachers?,Sarah might ever forget many teachers.,semantics,npi_licensing,matrix_question_npi_licensor_present,True,False,True,True,16,-54.06296157836914,-43.836891174316406,0
Might Frank ever boast about Melanie?,Frank might ever boast about Melanie.,semantics,npi_licensing,matrix_question_npi_licensor_present,True,False,True,True,17,-58.085105895996094,-45.71621322631836,0
Had Dennis ever begged Joel to stretch?,Dennis had ever begged Joel to stretch.,semantics,npi_licensing,matrix_question_npi_licensor_present,True,False,True,True,18,-62.577579498291016,-61.07659912109375,0
Does Eric ever prompt Dawn to write?,Eric does ever prompt Dawn to write.,semantics,npi_licensing,matrix_question_npi_licensor_present,True,False,True,True,19,-61.10835647583008,-55.873497009277344,0
Would Ann ever drink?,Ann would ever drink.,semantics,npi_licensing,matrix_question_npi_licensor_present,True,False,True,True,20,-29.725576400756836,-23.41423797607422,0
Did Sharon ever waste away?,Sharon did ever waste away.,semantics,npi_licensing,matrix_question_npi_licensor_present,True,False,True,True,21,-39.398197174072266,-42.639076232910156,1
Would some screen ever disappear?,Some screen would ever disappear.,semantics,npi_licensing,matrix_question_npi_licensor_present,True,False,True,True,22,-38.66106414794922,-36.18795394897461,0
Does Gary ever believe Dennis to alarm Stephanie?,Gary does ever believe Dennis to alarm Stephanie.,semantics,npi_licensing,matrix_question_npi_licensor_present,True,False,True,True,23,-68.14078521728516,-63.39471435546875,0
Will that coat ever warp?,That coat will ever warp.,semantics,npi_licensing,matrix_question_npi_licensor_present,True,False,True,True,24,-40.258975982666016,-41.206058502197266,1
Had Suzanne ever sat down?,Suzanne had ever sat down.,semantics,npi_licensing,matrix_question_npi_licensor_present,True,False,True,True,25,-37.48246765136719,-37.68986511230469,1
Has Nina ever descended that mountain?,Nina has ever descended that mountain.,semantics,npi_licensing,matrix_question_npi_licensor_present,True,False,True,True,26,-48.7844123840332,-48.20780944824219,0
Did Jill ever die?,Jill did ever die.,semantics,npi_licensing,matrix_question_npi_licensor_present,True,False,True,True,27,-31.875764846801758,-33.37835693359375,1
Will Bradley ever mutter?,Bradley will ever mutter.,semantics,npi_licensing,matrix_question_npi_licensor_present,True,False,True,True,28,-43.4644660949707,-41.64330291748047,0
Have many children ever surrendered?,Many children have ever surrendered.,semantics,npi_licensing,matrix_question_npi_licensor_present,True,False,True,True,29,-35.34546661376953,-32.54042434692383,0
Would Stephen ever hide away?,Stephen would ever hide away.,semantics,npi_licensing,matrix_question_npi_licensor_present,True,False,True,True,30,-36.50193786621094,-29.386241912841797,0
Has Steven ever badgered every man to sound like most senators?,Steven has ever badgered every man to sound like most senators.,semantics,npi_licensing,matrix_question_npi_licensor_present,True,False,True,True,31,-94.65620422363281,-87.78413391113281,0
Might students ever see?,Students might ever see.,semantics,npi_licensing,matrix_question_npi_licensor_present,True,False,True,True,32,-38.053802490234375,-24.636131286621094,0
Will some bank ever profit?,Some bank will ever profit.,semantics,npi_licensing,matrix_question_npi_licensor_present,True,False,True,True,33,-39.31848907470703,-36.95634078979492,0
Would Andrea ever encourage Beth to care for Charles?,Andrea would ever encourage Beth to care for Charles.,semantics,npi_licensing,matrix_question_npi_licensor_present,True,False,True,True,34,-69.60709381103516,-73.1415786743164,1
Has Brad ever insulted Irene?,Brad has ever insulted Irene.,semantics,npi_licensing,matrix_question_npi_licensor_present,True,False,True,True,35,-49.81871795654297,-39.9249153137207,0
Could Vanessa ever dislike Charles?,Vanessa could ever dislike Charles.,semantics,npi_licensing,matrix_question_npi_licensor_present,True,False,True,True,36,-45.036415100097656,-50.409271240234375,1
Had Carl ever kissed Irene?,Carl had ever kissed Irene.,semantics,npi_licensing,matrix_question_npi_licensor_present,True,False,True,True,37,-46.74708557128906,-41.075408935546875,0
Will Christina ever try to observe Dawn?,Christina will ever try to observe Dawn.,semantics,npi_licensing,matrix_question_npi_licensor_present,True,False,True,True,38,-58.67790222167969,-55.722511291503906,0
Did Samuel ever sneeze?,Samuel did ever sneeze.,semantics,npi_licensing,matrix_question_npi_licensor_present,True,False,True,True,39,-42.61294937133789,-48.133949279785156,1
Should a lot of girls ever benefit?,A lot of girls should ever benefit.,semantics,npi_licensing,matrix_question_npi_licensor_present,True,False,True,True,40,-40.21113586425781,-45.12403869628906,1
Could some people ever chat?,Some people could ever chat.,semantics,npi_licensing,matrix_question_npi_licensor_present,True,False,True,True,41,-32.46963882446289,-30.329511642456055,0
Had Colleen ever imagined those actresses have ordered Kevin to talk?,Colleen had ever imagined those actresses have ordered Kevin to talk.,semantics,npi_licensing,matrix_question_npi_licensor_present,True,False,True,True,42,-103.01194763183594,-92.8536605834961,0
Has Sharon ever climbed down a hill?,Sharon has ever climbed down a hill.,semantics,npi_licensing,matrix_question_npi_licensor_present,True,False,True,True,43,-48.822845458984375,-50.35916519165039,1
Might Catherine ever implore Kristin's cousins to speak up?,Catherine might ever implore Kristin's cousins to speak up.,semantics,npi_licensing,matrix_question_npi_licensor_present,True,False,True,True,44,-103.49288940429688,-96.34844207763672,0
Have a lot of teachers ever kissed?,A lot of teachers have ever kissed.,semantics,npi_licensing,matrix_question_npi_licensor_present,True,False,True,True,45,-39.73112869262695,-44.474205017089844,1
Has Gary ever argued?,Gary has ever argued.,semantics,npi_licensing,matrix_question_npi_licensor_present,True,False,True,True,46,-32.465057373046875,-25.135746002197266,0
Have these blouses ever shrunk?,These blouses have ever shrunk.,semantics,npi_licensing,matrix_question_npi_licensor_present,True,False,True,True,47,-49.95761489868164,-47.724205017089844,0
Did Heather ever visit those closets?,Heather did ever visit those closets.,semantics,npi_licensing,matrix_question_npi_licensor_present,True,False,True,True,48,-56.59001159667969,-60.505584716796875,1
Do a lot of legislatures ever profit?,A lot of legislatures do ever profit.,semantics,npi_licensing,matrix_question_npi_licensor_present,True,False,True,True,49,-47.46420669555664,-51.86621856689453,1
Had Raymond ever murmured?,Raymond had ever murmured.,semantics,npi_licensing,matrix_question_npi_licensor_present,True,False,True,True,50,-39.326507568359375,-38.07775115966797,0
Has Amelia ever learned who aren't seeing?,Amelia has ever learned who aren't seeing.,semantics,npi_licensing,matrix_question_npi_licensor_present,True,False,True,True,51,-59.84120559692383,-62.437469482421875,1
Had Frank ever cleaned glasses?,Frank had ever cleaned glasses.,semantics,npi_licensing,matrix_question_npi_licensor_present,True,False,True,True,52,-42.6783447265625,-35.898399353027344,0
Do all hats ever twist?,All hats do ever twist.,semantics,npi_licensing,matrix_question_npi_licensor_present,True,False,True,True,53,-40.01485061645508,-39.2855339050293,0
Does that ice ever evaporate?,That ice does ever evaporate.,semantics,npi_licensing,matrix_question_npi_licensor_present,True,False,True,True,54,-42.01957321166992,-45.08710479736328,1
Had some vase ever tipped over?,Some vase had ever tipped over.,semantics,npi_licensing,matrix_question_npi_licensor_present,True,False,True,True,55,-50.21642303466797,-45.566184997558594,0
Has Steven ever tried to die?,Steven has ever tried to die.,semantics,npi_licensing,matrix_question_npi_licensor_present,True,False,True,True,56,-38.392784118652344,-30.830747604370117,0
Had Amy ever cooked?,Amy had ever cooked.,semantics,npi_licensing,matrix_question_npi_licensor_present,True,False,True,True,57,-31.406658172607422,-24.600345611572266,0
Has Deanna ever learned what won't negotiate?,Deanna has ever learned what won't negotiate.,semantics,npi_licensing,matrix_question_npi_licensor_present,True,False,True,True,58,-64.93527221679688,-62.137550354003906,0
Can Natalie ever criticize the senator?,Natalie can ever criticize the senator.,semantics,npi_licensing,matrix_question_npi_licensor_present,True,False,True,True,59,-48.891693115234375,-52.24488067626953,1
Had some convertibles ever stopped?,Some convertibles had ever stopped.,semantics,npi_licensing,matrix_question_npi_licensor_present,True,False,True,True,60,-53.487937927246094,-48.24046325683594,0
Could Janice ever play?,Janice could ever play.,semantics,npi_licensing,matrix_question_npi_licensor_present,True,False,True,True,61,-38.948570251464844,-33.53015899658203,0
Had Carol ever encouraged Phillip to take a lot of public parks?,Carol had ever encouraged Phillip to take a lot of public parks.,semantics,npi_licensing,matrix_question_npi_licensor_present,True,False,True,True,62,-85.1441650390625,-82.00775146484375,0
Had some government ever clashed?,Some government had ever clashed.,semantics,npi_licensing,matrix_question_npi_licensor_present,True,False,True,True,63,-39.84267044067383,-35.87467575073242,0
Had Christopher ever trained?,Christopher had ever trained.,semantics,npi_licensing,matrix_question_npi_licensor_present,True,False,True,True,64,-35.72801208496094,-25.617237091064453,0
Has Spain ever pushed these daughters of Melinda to go fishing?,Spain has ever pushed these daughters of Melinda to go fishing.,semantics,npi_licensing,matrix_question_npi_licensor_present,True,False,True,True,65,-87.79985046386719,-78.18280029296875,0
Would every bank ever work hard?,Every bank would ever work hard.,semantics,npi_licensing,matrix_question_npi_licensor_present,True,False,True,True,66,-46.23854064941406,-41.214054107666016,0
Might Danielle ever go fishing?,Danielle might ever go fishing.,semantics,npi_licensing,matrix_question_npi_licensor_present,True,False,True,True,67,-46.835880279541016,-40.09929656982422,0
Has that shirt ever flattened?,That shirt has ever flattened.,semantics,npi_licensing,matrix_question_npi_licensor_present,True,False,True,True,68,-39.4111442565918,-38.434814453125,0
Can every committee ever testify?,Every committee can ever testify.,semantics,npi_licensing,matrix_question_npi_licensor_present,True,False,True,True,69,-43.19097900390625,-39.79571533203125,0
Have many movies ever disagreed with Jessica?,Many movies have ever disagreed with Jessica.,semantics,npi_licensing,matrix_question_npi_licensor_present,True,False,True,True,70,-50.21090316772461,-49.271514892578125,0
Should William ever exercise?,William should ever exercise.,semantics,npi_licensing,matrix_question_npi_licensor_present,True,False,True,True,71,-32.45082092285156,-27.405155181884766,0
Had James ever dropped by this museum?,James had ever dropped by this museum.,semantics,npi_licensing,matrix_question_npi_licensor_present,True,False,True,True,72,-49.101680755615234,-41.72187042236328,0
Did Jennifer ever disappear?,Jennifer did ever disappear.,semantics,npi_licensing,matrix_question_npi_licensor_present,True,False,True,True,73,-32.51274490356445,-27.410785675048828,0
Had the doctors ever intended to drop by most movie theaters?,The doctors had ever intended to drop by most movie theaters.,semantics,npi_licensing,matrix_question_npi_licensor_present,True,False,True,True,74,-80.63948822021484,-78.51183319091797,0
Does Liam ever come here?,Liam does ever come here.,semantics,npi_licensing,matrix_question_npi_licensor_present,True,False,True,True,75,-32.832008361816406,-35.96807098388672,1
Should Jodi ever argue?,Jodi should ever argue.,semantics,npi_licensing,matrix_question_npi_licensor_present,True,False,True,True,76,-40.238887786865234,-39.38569641113281,0
Should guests ever seem to suffer?,Guests should ever seem to suffer.,semantics,npi_licensing,matrix_question_npi_licensor_present,True,False,True,True,77,-42.483612060546875,-44.393890380859375,1
Would Julia ever scratch?,Julia would ever scratch.,semantics,npi_licensing,matrix_question_npi_licensor_present,True,False,True,True,78,-32.696502685546875,-32.96882629394531,1
Had Adam ever forgotten about who have hats?,Adam had ever forgotten about who have hats.,semantics,npi_licensing,matrix_question_npi_licensor_present,True,False,True,True,79,-56.507781982421875,-50.1683349609375,0
Has Carol ever declared some ladies to shout?,Carol has ever declared some ladies to shout.,semantics,npi_licensing,matrix_question_npi_licensor_present,True,False,True,True,80,-63.46607971191406,-61.59819793701172,0
Does the jacket ever fold?,The jacket does ever fold.,semantics,npi_licensing,matrix_question_npi_licensor_present,True,False,True,True,81,-36.83514404296875,-40.25595474243164,1
Had some books ever disagreed?,Some books had ever disagreed.,semantics,npi_licensing,matrix_question_npi_licensor_present,True,False,True,True,82,-37.40020751953125,-37.61256790161133,1
Has a waitress ever hoped to take every carriage?,A waitress has ever hoped to take every carriage.,semantics,npi_licensing,matrix_question_npi_licensor_present,True,False,True,True,83,-60.85917282104492,-61.416908264160156,1
Would Edward ever watch Wendy?,Edward would ever watch Wendy.,semantics,npi_licensing,matrix_question_npi_licensor_present,True,False,True,True,84,-40.912025451660156,-34.56780242919922,0
Should Carrie ever answer?,Carrie should ever answer.,semantics,npi_licensing,matrix_question_npi_licensor_present,True,False,True,True,85,-33.665672302246094,-35.53303527832031,1
Have these ladies ever seen Kayla?,These ladies have ever seen Kayla.,semantics,npi_licensing,matrix_question_npi_licensor_present,True,False,True,True,86,-49.10028076171875,-46.310081481933594,0
Had Wendy ever proven to fold?,Wendy had ever proven to fold.,semantics,npi_licensing,matrix_question_npi_licensor_present,True,False,True,True,87,-47.48550796508789,-50.53173065185547,1
Had every child ever left every guest?,Every child had ever left every guest.,semantics,npi_licensing,matrix_question_npi_licensor_present,True,False,True,True,88,-53.415950775146484,-47.92226028442383,0
Had some children ever reunited?,Some children had ever reunited.,semantics,npi_licensing,matrix_question_npi_licensor_present,True,False,True,True,89,-37.392051696777344,-32.80500030517578,0
Have a lot of waiters ever whispered?,A lot of waiters have ever whispered.,semantics,npi_licensing,matrix_question_npi_licensor_present,True,False,True,True,90,-51.641685485839844,-55.0656852722168,1
Has Rebecca ever enticed the waiter to scratch?,Rebecca has ever enticed the waiter to scratch.,semantics,npi_licensing,matrix_question_npi_licensor_present,True,False,True,True,91,-67.32266235351562,-68.265625,1
Had some ladies ever answered?,Some ladies had ever answered.,semantics,npi_licensing,matrix_question_npi_licensor_present,True,False,True,True,92,-37.17162322998047,-32.969696044921875,0
Would the play ever disgust Karen?,The play would ever disgust Karen.,semantics,npi_licensing,matrix_question_npi_licensor_present,True,False,True,True,93,-48.107757568359375,-49.30139923095703,1
Could that child ever tour the malls?,That child could ever tour the malls.,semantics,npi_licensing,matrix_question_npi_licensor_present,True,False,True,True,94,-53.80567169189453,-54.821754455566406,1
Had Nicole ever believed Pamela to cheer?,Nicole had ever believed Pamela to cheer.,semantics,npi_licensing,matrix_question_npi_licensor_present,True,False,True,True,95,-61.03370666503906,-56.887901306152344,0
Would Irene ever attempt to answer?,Irene would ever attempt to answer.,semantics,npi_licensing,matrix_question_npi_licensor_present,True,False,True,True,96,-47.014015197753906,-45.73688507080078,0
Did the actors ever debate?,The actors did ever debate.,semantics,npi_licensing,matrix_question_npi_licensor_present,True,False,True,True,97,-36.339202880859375,-38.99980926513672,1
Does Linda ever insult Sheila?,Linda does ever insult Sheila.,semantics,npi_licensing,matrix_question_npi_licensor_present,True,False,True,True,98,-45.335792541503906,-50.406463623046875,1
Have the schools ever required Edward to argue?,The schools have ever required Edward to argue.,semantics,npi_licensing,matrix_question_npi_licensor_present,True,False,True,True,99,-61.81926345825195,-59.23297119140625,0
Have most chairs ever tipped over?,Most chairs have ever tipped over.,semantics,npi_licensing,matrix_question_npi_licensor_present,True,False,True,True,100,-48.57828903198242,-42.897483825683594,0
Have the Clintons ever worked hard?,The Clintons have ever worked hard.,semantics,npi_licensing,matrix_question_npi_licensor_present,True,False,True,True,101,-50.687889099121094,-46.948001861572266,0
Have most lamps ever dimmed?,Most lamps have ever dimmed.,semantics,npi_licensing,matrix_question_npi_licensor_present,True,False,True,True,102,-52.17209243774414,-47.2921028137207,0
Had Kendra ever yawned?,Kendra had ever yawned.,semantics,npi_licensing,matrix_question_npi_licensor_present,True,False,True,True,103,-50.34027099609375,-45.195945739746094,0
Had Samuel ever wept?,Samuel had ever wept.,semantics,npi_licensing,matrix_question_npi_licensor_present,True,False,True,True,104,-40.36541748046875,-43.83190155029297,1
Might many lights ever darken?,Many lights might ever darken.,semantics,npi_licensing,matrix_question_npi_licensor_present,True,False,True,True,105,-59.8763313293457,-48.92380142211914,0
Will Sally ever escape?,Sally will ever escape.,semantics,npi_licensing,matrix_question_npi_licensor_present,True,False,True,True,106,-30.805768966674805,-33.765167236328125,1
Had Jerry ever observed Rachel?,Jerry had ever observed Rachel.,semantics,npi_licensing,matrix_question_npi_licensor_present,True,False,True,True,107,-43.742271423339844,-35.96112823486328,0
Will a lot of public parks ever irritate Tara?,A lot of public parks will ever irritate Tara.,semantics,npi_licensing,matrix_question_npi_licensor_present,True,False,True,True,108,-70.28823852539062,-72.91465759277344,1
Can a doctor ever observe Amy?,A doctor can ever observe Amy.,semantics,npi_licensing,matrix_question_npi_licensor_present,True,False,True,True,109,-43.37835693359375,-46.70354461669922,1
Has Donald ever yearned to embarrass Tonya?,Donald has ever yearned to embarrass Tonya.,semantics,npi_licensing,matrix_question_npi_licensor_present,True,False,True,True,110,-79.3978042602539,-71.78263854980469,0
Can Amanda ever shock Sarah?,Amanda can ever shock Sarah.,semantics,npi_licensing,matrix_question_npi_licensor_present,True,False,True,True,111,-44.24272918701172,-47.432411193847656,1
Had Lissa ever discovered who has remembered what prodded Kenneth to bake?,Lissa had ever discovered who has remembered what prodded Kenneth to bake.,semantics,npi_licensing,matrix_question_npi_licensor_present,True,False,True,True,112,-117.13334655761719,-111.125244140625,0
Can this mushroom ever go bad?,This mushroom can ever go bad.,semantics,npi_licensing,matrix_question_npi_licensor_present,True,False,True,True,113,-45.8810920715332,-44.19080352783203,0
Might some library ever compete?,Some library might ever compete.,semantics,npi_licensing,matrix_question_npi_licensor_present,True,False,True,True,114,-50.00299072265625,-40.934547424316406,0
Had this cilantro ever charred?,This cilantro had ever charred.,semantics,npi_licensing,matrix_question_npi_licensor_present,True,False,True,True,115,-58.86628341674805,-55.3089714050293,0
Did Monica ever convince Brian to hide?,Monica did ever convince Brian to hide.,semantics,npi_licensing,matrix_question_npi_licensor_present,True,False,True,True,116,-57.1983757019043,-60.025177001953125,1
Had a glove ever unfolded?,A glove had ever unfolded.,semantics,npi_licensing,matrix_question_npi_licensor_present,True,False,True,True,117,-40.20652389526367,-42.02583312988281,1
Can Monet ever donate?,Monet can ever donate.,semantics,npi_licensing,matrix_question_npi_licensor_present,True,False,True,True,118,-43.28227996826172,-38.21097946166992,0
Had the Lutherans ever divorced?,The Lutherans had ever divorced.,semantics,npi_licensing,matrix_question_npi_licensor_present,True,False,True,True,119,-48.131324768066406,-45.881961822509766,0
Should this adult ever command Melanie to forfeit?,This adult should ever command Melanie to forfeit.,semantics,npi_licensing,matrix_question_npi_licensor_present,True,False,True,True,120,-72.47173309326172,-68.67310333251953,0
Had Stacy ever attacked Donald?,Stacy had ever attacked Donald.,semantics,npi_licensing,matrix_question_npi_licensor_present,True,False,True,True,121,-47.45366668701172,-48.517086029052734,1
Can Caroline ever explore these malls?,Caroline can ever explore these malls.,semantics,npi_licensing,matrix_question_npi_licensor_present,True,False,True,True,122,-52.23552322387695,-53.40261459350586,1
Has Randolf ever argued?,Randolf has ever argued.,semantics,npi_licensing,matrix_question_npi_licensor_present,True,False,True,True,123,-45.400535583496094,-35.46294403076172,0
Could Deanna ever see a girl?,Deanna could ever see a girl.,semantics,npi_licensing,matrix_question_npi_licensor_present,True,False,True,True,124,-46.58991622924805,-38.007293701171875,0
Can Martha ever reveal who isn't researching every sketch?,Martha can ever reveal who isn't researching every sketch.,semantics,npi_licensing,matrix_question_npi_licensor_present,True,False,True,True,125,-83.78868103027344,-84.64019775390625,1
Has Patrick ever studied?,Patrick has ever studied.,semantics,npi_licensing,matrix_question_npi_licensor_present,True,False,True,True,126,-33.61899185180664,-25.603839874267578,0
Should a unicycle ever slow?,A unicycle should ever slow.,semantics,npi_licensing,matrix_question_npi_licensor_present,True,False,True,True,127,-47.48403549194336,-48.557037353515625,1
Would Chad ever slump over?,Chad would ever slump over.,semantics,npi_licensing,matrix_question_npi_licensor_present,True,False,True,True,128,-47.216575622558594,-44.480342864990234,0
Has Lawrence ever forced Samuel to smile?,Lawrence has ever forced Samuel to smile.,semantics,npi_licensing,matrix_question_npi_licensor_present,True,False,True,True,129,-64.12367248535156,-59.13328552246094,0
Might the Impressionists ever reunite?,The Impressionists might ever reunite.,semantics,npi_licensing,matrix_question_npi_licensor_present,True,False,True,True,130,-72.42721557617188,-64.07434844970703,0
