sentence_good,sentence_bad,field,linguistics_term,UID,simple_LM_method,one_prefix_method,two_prefix_method,lexically_identical,pair_id,good_prob,bad_prob,correct
Tina revealed Margaret.,The horse revealed Margaret.,syntax,s-selection,animate_subject_trans,True,False,True,False,0,-34.20149230957031,-37.73884582519531,1
Danielle visited Irene.,The eye visited Irene.,syntax,s-selection,animate_subject_trans,True,False,True,False,1,-30.748411178588867,-34.46006774902344,1
Paul runs around the art galleries.,The river runs around the art galleries.,syntax,s-selection,animate_subject_trans,True,False,True,False,2,-35.21282958984375,-44.6426887512207,1
Most banks have praised Raymond.,The jackets have praised Raymond.,syntax,s-selection,animate_subject_trans,True,False,True,False,3,-41.86473846435547,-46.29402542114258,1
Every doctor was selling some restaurants.,A cup was selling some restaurants.,syntax,s-selection,animate_subject_trans,True,False,True,False,4,-39.807861328125,-40.928070068359375,1
Steve bikes to a public park.,Every fork bikes to a public park.,syntax,s-selection,animate_subject_trans,True,False,True,False,5,-33.882667541503906,-43.72039031982422,1
Beth scares Roger.,A carriage scares Roger.,syntax,s-selection,animate_subject_trans,True,False,True,False,6,-37.28679275512695,-39.775901794433594,1
Melissa will clean a gate.,This mouth will clean a gate.,syntax,s-selection,animate_subject_trans,True,False,True,False,7,-39.09031677246094,-40.22288513183594,1
Tanya conceals Adam.,This ice cream conceals Adam.,syntax,s-selection,animate_subject_trans,True,False,True,False,8,-40.5489387512207,-41.96649932861328,1
Renee had praised Eric.,The beef had praised Eric.,syntax,s-selection,animate_subject_trans,True,False,True,False,9,-36.48906707763672,-43.403995513916016,1
Mark hasn't respected a lot of actors.,Every government hasn't respected a lot of actors.,syntax,s-selection,animate_subject_trans,True,False,True,False,10,-41.89152145385742,-49.694332122802734,1
Matt could argue about Bethany.,Every mall could argue about Bethany.,syntax,s-selection,animate_subject_trans,True,False,True,False,11,-34.63600540161133,-48.695953369140625,1
Kathleen can't fix every carriage.,Some newspaper article can't fix every carriage.,syntax,s-selection,animate_subject_trans,True,False,True,False,12,-52.18476104736328,-57.810115814208984,1
Denise wasn't referencing Homer.,Rice wasn't referencing Homer.,syntax,s-selection,animate_subject_trans,True,False,True,False,13,-42.44675064086914,-45.50893783569336,1
Vanessa visits Judy.,The ice cream visits Judy.,syntax,s-selection,animate_subject_trans,True,False,True,False,14,-33.50310134887695,-41.2039794921875,1
Beverly would scan a movie.,A pepper would scan a movie.,syntax,s-selection,animate_subject_trans,True,False,True,False,15,-47.00191879272461,-44.28545379638672,0
Liam has respected many waiters.,That banana has respected many waiters.,syntax,s-selection,animate_subject_trans,True,False,True,False,16,-49.07670211791992,-52.950469970703125,1
Some person hadn't passed all high schools.,That casserole hadn't passed all high schools.,syntax,s-selection,animate_subject_trans,True,False,True,False,17,-47.16187286376953,-51.68492889404297,1
Carlos has sounded like all hospitals.,This ice has sounded like all hospitals.,syntax,s-selection,animate_subject_trans,True,False,True,False,18,-48.11022186279297,-51.59038543701172,1
Wendy walked through some schools.,The spotlight walked through some schools.,syntax,s-selection,animate_subject_trans,True,False,True,False,19,-41.8491325378418,-39.6675910949707,0
Steve hasn't returned to a dancer.,The nose hasn't returned to a dancer.,syntax,s-selection,animate_subject_trans,True,False,True,False,20,-36.67572021484375,-47.42209243774414,1
Anne wasn't thinking about Paula.,Art wasn't thinking about Paula.,syntax,s-selection,animate_subject_trans,True,False,True,False,21,-32.755760192871094,-34.04655456542969,1
Some women were scanning the essay.,A lot of dishes were scanning the essay.,syntax,s-selection,animate_subject_trans,True,False,True,False,22,-36.30464553833008,-49.71521759033203,1
Victoria wouldn't insult a man.,That unicycle wouldn't insult a man.,syntax,s-selection,animate_subject_trans,True,False,True,False,23,-33.28897476196289,-48.76326370239258,1
Peter isn't thinking about a lot of schools.,Some turtle isn't thinking about a lot of schools.,syntax,s-selection,animate_subject_trans,True,False,True,False,24,-37.399757385253906,-51.68391418457031,1
Samuel shouldn't hate Susan.,Art shouldn't hate Susan.,syntax,s-selection,animate_subject_trans,True,False,True,False,25,-43.583351135253906,-36.23448944091797,0
Karla drives to every grocery store.,This chair drives to every grocery store.,syntax,s-selection,animate_subject_trans,True,False,True,False,26,-43.765464782714844,-49.89144515991211,1
Omar isn't talking to Erin.,A legislature isn't talking to Erin.,syntax,s-selection,animate_subject_trans,True,False,True,False,27,-41.75840759277344,-44.55513000488281,1
Galileo had talked to Stephanie.,This car had talked to Stephanie.,syntax,s-selection,animate_subject_trans,True,False,True,False,28,-47.705352783203125,-38.95195770263672,0
Mitchell criticized Amy.,Some art gallery criticized Amy.,syntax,s-selection,animate_subject_trans,True,False,True,False,29,-36.34746551513672,-41.75218963623047,1
Clyde couldn't forget Phillip.,That sketch couldn't forget Phillip.,syntax,s-selection,animate_subject_trans,True,False,True,False,30,-51.539039611816406,-46.18874740600586,0
Most companies have remembered Jesus.,These chairs have remembered Jesus.,syntax,s-selection,animate_subject_trans,True,False,True,False,31,-34.622047424316406,-38.40825653076172,1
Tina hasn't respected Florence.,Art hasn't respected Florence.,syntax,s-selection,animate_subject_trans,True,False,True,False,32,-44.565399169921875,-39.6715087890625,0
Phillip can talk to those waitresses.,This pasta can talk to those waitresses.,syntax,s-selection,animate_subject_trans,True,False,True,False,33,-50.73260498046875,-53.34379577636719,1
Matt discovered a lot of spotlights.,Every ladder discovered a lot of spotlights.,syntax,s-selection,animate_subject_trans,True,False,True,False,34,-31.84003257751465,-45.746376037597656,1
Gina talks to Joseph.,Fish talks to Joseph.,syntax,s-selection,animate_subject_trans,True,False,True,False,35,-33.340518951416016,-27.75019645690918,0
Kendra hasn't attacked some guys.,That window hasn't attacked some guys.,syntax,s-selection,animate_subject_trans,True,False,True,False,36,-48.87397766113281,-46.60393524169922,0
Ella discovered Matt.,This association discovered Matt.,syntax,s-selection,animate_subject_trans,True,False,True,False,37,-37.92845916748047,-37.508506774902344,0
Valerie isn't passing high schools.,A public park isn't passing high schools.,syntax,s-selection,animate_subject_trans,True,False,True,False,38,-45.94847869873047,-48.591392517089844,1
Carrie isn't listening to Jodi.,That movie theater isn't listening to Jodi.,syntax,s-selection,animate_subject_trans,True,False,True,False,39,-43.51948547363281,-48.23797607421875,1
Russell hasn't escaped from some museum.,That picture hasn't escaped from some museum.,syntax,s-selection,animate_subject_trans,True,False,True,False,40,-43.303810119628906,-50.494224548339844,1
This customer was arguing about Karen.,A report was arguing about Karen.,syntax,s-selection,animate_subject_trans,True,False,True,False,41,-44.03764343261719,-42.69081115722656,0
Roger will watch that guest.,Some beef will watch that guest.,syntax,s-selection,animate_subject_trans,True,False,True,False,42,-32.084266662597656,-45.10144805908203,1
Becky tours a lot of banks.,This rug tours a lot of banks.,syntax,s-selection,animate_subject_trans,True,False,True,False,43,-44.8182258605957,-51.4130744934082,1
Chad isn't observing that cashier.,This casserole isn't observing that cashier.,syntax,s-selection,animate_subject_trans,True,False,True,False,44,-50.936737060546875,-56.884002685546875,1
The girls weren't skated around a museum.,All snakes weren't skated around a museum.,syntax,s-selection,animate_subject_trans,True,False,True,False,45,-54.970970153808594,-55.4982795715332,1
Brad hasn't returned to most pedestrians.,This dish hasn't returned to most pedestrians.,syntax,s-selection,animate_subject_trans,True,False,True,False,46,-41.984840393066406,-50.33320617675781,1
Stacey toured the hill.,Some rice toured the hill.,syntax,s-selection,animate_subject_trans,True,False,True,False,47,-33.88725662231445,-37.00059509277344,1
Jodi boycotted the closets.,Every committee boycotted the closets.,syntax,s-selection,animate_subject_trans,True,False,True,False,48,-60.48458480834961,-58.94281005859375,0
Laura doesn't bring some boxes.,The painting doesn't bring some boxes.,syntax,s-selection,animate_subject_trans,True,False,True,False,49,-33.848445892333984,-42.635074615478516,1
Every lady lifts this gate.,This report lifts this gate.,syntax,s-selection,animate_subject_trans,True,False,True,False,50,-39.096763610839844,-37.78566360473633,0
Tanya admires Melanie.,Music admires Melanie.,syntax,s-selection,animate_subject_trans,True,False,True,False,51,-41.90068817138672,-31.7513427734375,0
Erin wouldn't drive to the hill.,The coat wouldn't drive to the hill.,syntax,s-selection,animate_subject_trans,True,False,True,False,52,-38.81517791748047,-44.765647888183594,1
Heidi hadn't concealed all socks.,The movie theater hadn't concealed all socks.,syntax,s-selection,animate_subject_trans,True,False,True,False,53,-54.0311164855957,-59.94648361206055,1
Natalie complains about Caroline.,A rabbit complains about Caroline.,syntax,s-selection,animate_subject_trans,True,False,True,False,54,-34.27788543701172,-39.38677978515625,1
Elaine might flee from Ronald.,That university might flee from Ronald.,syntax,s-selection,animate_subject_trans,True,False,True,False,55,-48.86030578613281,-49.865970611572266,1
Some associations are admiring Alexander.,The dishes are admiring Alexander.,syntax,s-selection,animate_subject_trans,True,False,True,False,56,-44.366424560546875,-44.824989318847656,1
Paula admired Kenneth.,Some river admired Kenneth.,syntax,s-selection,animate_subject_trans,True,False,True,False,57,-36.79279708862305,-43.7856330871582,1
Brenda dropped by a river.,This book dropped by a river.,syntax,s-selection,animate_subject_trans,True,False,True,False,58,-37.16168975830078,-38.275306701660156,1
A senator drops by every lake.,The muffin drops by every lake.,syntax,s-selection,animate_subject_trans,True,False,True,False,59,-53.42445373535156,-50.061710357666016,0
Carla can't watch Sara.,The tomato can't watch Sara.,syntax,s-selection,animate_subject_trans,True,False,True,False,60,-40.594207763671875,-44.94145965576172,1
Pamela reveals Dana.,That carriage reveals Dana.,syntax,s-selection,animate_subject_trans,True,False,True,False,61,-40.12945556640625,-40.52777862548828,1
Steven hasn't talked about Sara.,That window hasn't talked about Sara.,syntax,s-selection,animate_subject_trans,True,False,True,False,62,-33.39434814453125,-45.71388244628906,1
Every library isn't praising Alexander.,The tomato isn't praising Alexander.,syntax,s-selection,animate_subject_trans,True,False,True,False,63,-42.91960525512695,-45.844635009765625,1
Tamara hates Julia.,This ice hates Julia.,syntax,s-selection,animate_subject_trans,True,False,True,False,64,-28.6883602142334,-36.23086166381836,1
Alan messed up some college campus.,A gate messed up some college campus.,syntax,s-selection,animate_subject_trans,True,False,True,False,65,-36.47599411010742,-50.70718765258789,1
Paul fires Russell.,This truck fires Russell.,syntax,s-selection,animate_subject_trans,True,False,True,False,66,-30.768146514892578,-37.11774826049805,1
Beverly wasn't examining books.,The bike wasn't examining books.,syntax,s-selection,animate_subject_trans,True,False,True,False,67,-45.624881744384766,-41.434181213378906,0
Dawn hadn't forgotten Diana.,Some government hadn't forgotten Diana.,syntax,s-selection,animate_subject_trans,True,False,True,False,68,-40.40885925292969,-41.150821685791016,1
Ella has forgotten Michael.,Spain has forgotten Michael.,syntax,s-selection,animate_subject_trans,True,False,True,False,69,-40.51233673095703,-27.64500617980957,0
Alice fires Ruth.,Some plate fires Ruth.,syntax,s-selection,animate_subject_trans,True,False,True,False,70,-29.00823211669922,-39.78211975097656,1
A lot of actors bought mountains.,All horses bought mountains.,syntax,s-selection,animate_subject_trans,True,False,True,False,71,-43.19329071044922,-33.776145935058594,0
Amelia questioned Valerie.,The lake questioned Valerie.,syntax,s-selection,animate_subject_trans,True,False,True,False,72,-36.52281188964844,-40.062747955322266,1
Pamela hadn't attacked a lot of cashiers.,This coat hadn't attacked a lot of cashiers.,syntax,s-selection,animate_subject_trans,True,False,True,False,73,-60.34162902832031,-58.89014434814453,0
Leslie hadn't fixed this cart.,That sweater hadn't fixed this cart.,syntax,s-selection,animate_subject_trans,True,False,True,False,74,-46.967437744140625,-47.68879699707031,1
Douglas hadn't argued about Samuel.,The carriage hadn't argued about Samuel.,syntax,s-selection,animate_subject_trans,True,False,True,False,75,-49.121036529541016,-55.97215270996094,1
Kenneth isn't cleaning a jacket.,Spinach isn't cleaning a jacket.,syntax,s-selection,animate_subject_trans,True,False,True,False,76,-39.834449768066406,-47.198631286621094,1
Florence hadn't fled from banks.,Every university hadn't fled from banks.,syntax,s-selection,animate_subject_trans,True,False,True,False,77,-52.69588851928711,-47.78608703613281,0
Jill cleaned all ladders.,The door cleaned all ladders.,syntax,s-selection,animate_subject_trans,True,False,True,False,78,-40.8565673828125,-40.08106994628906,0
Some cashier isn't complaining about these ladies.,The sketch isn't complaining about these ladies.,syntax,s-selection,animate_subject_trans,True,False,True,False,79,-52.265289306640625,-45.688697814941406,0
Deborah drove to some college campuses.,Some commentary drove to some college campuses.,syntax,s-selection,animate_subject_trans,True,False,True,False,80,-42.86874771118164,-46.65453338623047,1
Theresa visits Patricia.,The nose visits Patricia.,syntax,s-selection,animate_subject_trans,True,False,True,False,81,-36.09192657470703,-41.295623779296875,1
Carl cleans this dress.,Bread cleans this dress.,syntax,s-selection,animate_subject_trans,True,False,True,False,82,-28.764436721801758,-42.55657958984375,1
Melanie won't notice Carol.,This ice cream won't notice Carol.,syntax,s-selection,animate_subject_trans,True,False,True,False,83,-39.423484802246094,-41.04730224609375,1
Russell was running around that school.,The sweater was running around that school.,syntax,s-selection,animate_subject_trans,True,False,True,False,84,-28.995195388793945,-42.02332305908203,1
Candice can't kiss these people.,Some high school can't kiss these people.,syntax,s-selection,animate_subject_trans,True,False,True,False,85,-38.86595916748047,-42.623477935791016,1
Matt was going to restaurants.,The cucumber was going to restaurants.,syntax,s-selection,animate_subject_trans,True,False,True,False,86,-25.71621322631836,-40.99713897705078,1
Every guest isn't leaving Eva.,Art isn't leaving Eva.,syntax,s-selection,animate_subject_trans,True,False,True,False,87,-42.269859313964844,-34.0125846862793,0
Dawn can't go to a mall.,Some window can't go to a mall.,syntax,s-selection,animate_subject_trans,True,False,True,False,88,-40.31902313232422,-42.69987869262695,1
Tonya hadn't healed most horses.,This dish hadn't healed most horses.,syntax,s-selection,animate_subject_trans,True,False,True,False,89,-47.948848724365234,-49.861854553222656,1
Kimberley bikes to the Great Lakes.,Every newspaper article bikes to the Great Lakes.,syntax,s-selection,animate_subject_trans,True,False,True,False,90,-46.50090789794922,-54.33832550048828,1
Wayne was attacking Cindy.,Every plane was attacking Cindy.,syntax,s-selection,animate_subject_trans,True,False,True,False,91,-38.46070098876953,-38.53702163696289,1
Emily hadn't questioned that actor.,Some pepper hadn't questioned that actor.,syntax,s-selection,animate_subject_trans,True,False,True,False,92,-36.230506896972656,-50.52131652832031,1
Deborah can't run around the Great Lakes.,A newspaper article can't run around the Great Lakes.,syntax,s-selection,animate_subject_trans,True,False,True,False,93,-48.256874084472656,-57.65328598022461,1
Aaron messed up these glasses.,That government messed up these glasses.,syntax,s-selection,animate_subject_trans,True,False,True,False,94,-31.38825225830078,-42.70790481567383,1
Lawrence fled from Brad.,Literature fled from Brad.,syntax,s-selection,animate_subject_trans,True,False,True,False,95,-45.1229248046875,-43.37271499633789,0
These dancers should investigate Caroline.,Glaciers should investigate Caroline.,syntax,s-selection,animate_subject_trans,True,False,True,False,96,-44.1005859375,-48.14402770996094,1
Mitchell can't complain about Peter.,This window can't complain about Peter.,syntax,s-selection,animate_subject_trans,True,False,True,False,97,-44.267860412597656,-43.482337951660156,0
Every doctor wasn't describing a river.,This story wasn't describing a river.,syntax,s-selection,animate_subject_trans,True,False,True,False,98,-45.17066955566406,-43.307861328125,0
Sally concealed Kirsten.,This beef concealed Kirsten.,syntax,s-selection,animate_subject_trans,True,False,True,False,99,-39.64704895019531,-42.85543441772461,1
Kendra might bike to a school.,Politics might bike to a school.,syntax,s-selection,animate_subject_trans,True,False,True,False,100,-50.96836471557617,-38.80054473876953,0
A lot of actresses lifted these glaciers.,The documentaries lifted these glaciers.,syntax,s-selection,animate_subject_trans,True,False,True,False,101,-56.171287536621094,-45.3190803527832,0
Many teenagers weren't observing Kathleen.,The museums weren't observing Kathleen.,syntax,s-selection,animate_subject_trans,True,False,True,False,102,-41.3695068359375,-46.414730072021484,1
Elizabeth describes Melissa.,This mushroom describes Melissa.,syntax,s-selection,animate_subject_trans,True,False,True,False,103,-25.909988403320312,-36.72408676147461,1
Janice cares for Melissa.,Every shawl cares for Melissa.,syntax,s-selection,animate_subject_trans,True,False,True,False,104,-35.954063415527344,-42.31524658203125,1
Benjamin wasn't breaking every glass.,This pasta wasn't breaking every glass.,syntax,s-selection,animate_subject_trans,True,False,True,False,105,-51.55537796020508,-48.3465576171875,0
Melanie is escaping from Emily.,Some dress is escaping from Emily.,syntax,s-selection,animate_subject_trans,True,False,True,False,106,-39.9706916809082,-41.654293060302734,1
Andrea forgets Becca.,That turtle forgets Becca.,syntax,s-selection,animate_subject_trans,True,False,True,False,107,-40.57737350463867,-42.62921142578125,1
Ann examines a lot of essays.,That company examines a lot of essays.,syntax,s-selection,animate_subject_trans,True,False,True,False,108,-34.90223693847656,-41.29837417602539,1
Emily had questioned Dennis.,Some company had questioned Dennis.,syntax,s-selection,animate_subject_trans,True,False,True,False,109,-30.524593353271484,-38.325382232666016,1
Most organizations helped Bill.,Most glasses helped Bill.,syntax,s-selection,animate_subject_trans,True,False,True,False,110,-33.533329010009766,-35.453338623046875,1
Andrew talks to Todd.,The cart talks to Todd.,syntax,s-selection,animate_subject_trans,True,False,True,False,111,-27.84998893737793,-38.43989944458008,1
Jacqueline insults all commentaries.,The tomato insults all commentaries.,syntax,s-selection,animate_subject_trans,True,False,True,False,112,-52.548606872558594,-50.20787048339844,0
Melinda hadn't insulted malls.,The ice hadn't insulted malls.,syntax,s-selection,animate_subject_trans,True,False,True,False,113,-45.99592208862305,-50.821861267089844,1
Jesus hugged Paul.,The snake hugged Paul.,syntax,s-selection,animate_subject_trans,True,False,True,False,114,-23.94565200805664,-35.150390625,1
Nicole isn't approaching Sabrina.,The window isn't approaching Sabrina.,syntax,s-selection,animate_subject_trans,True,False,True,False,115,-40.821006774902344,-43.64921188354492,1
The Impressionists were boycotting those cafes.,Most grocery stores were boycotting those cafes.,syntax,s-selection,animate_subject_trans,True,False,True,False,116,-57.962642669677734,-51.58155059814453,0
Melinda has hidden carts.,This high school has hidden carts.,syntax,s-selection,animate_subject_trans,True,False,True,False,117,-35.440101623535156,-37.21990203857422,1
Many girls boasted about Beverly.,Some dishes boasted about Beverly.,syntax,s-selection,animate_subject_trans,True,False,True,False,118,-42.6488151550293,-42.22144317626953,0
Kathleen could bring every rug.,A restaurant could bring every rug.,syntax,s-selection,animate_subject_trans,True,False,True,False,119,-47.38573455810547,-43.631038665771484,0
James examined these documentaries.,That report examined these documentaries.,syntax,s-selection,animate_subject_trans,True,False,True,False,120,-32.23161315917969,-41.17930603027344,1
Colleen walks through these restaurants.,This restaurant walks through these restaurants.,syntax,s-selection,animate_subject_trans,True,False,True,False,121,-38.29814910888672,-36.437896728515625,0
A dancer complained about most boys.,Some hamster complained about most boys.,syntax,s-selection,animate_subject_trans,True,False,True,False,122,-45.97218322753906,-47.126243591308594,1
Colleen was watching Robert.,That rabbit was watching Robert.,syntax,s-selection,animate_subject_trans,True,False,True,False,123,-34.58656311035156,-37.735984802246094,1
Patricia hadn't hidden those scarves.,A cafe hadn't hidden those scarves.,syntax,s-selection,animate_subject_trans,True,False,True,False,124,-52.01271438598633,-56.17148971557617,1
Renee works with Sheila.,That association works with Sheila.,syntax,s-selection,animate_subject_trans,True,False,True,False,125,-30.446643829345703,-38.70424270629883,1
Valerie boycotted a library.,The convertible boycotted a library.,syntax,s-selection,animate_subject_trans,True,False,True,False,126,-56.2797966003418,-58.398189544677734,1
Homer arrived at a mountain.,An eggplant arrived at a mountain.,syntax,s-selection,animate_subject_trans,True,False,True,False,127,-38.36687088012695,-39.02206039428711,1
Marie won't reference many patients.,The bird won't reference many patients.,syntax,s-selection,animate_subject_trans,True,False,True,False,128,-38.61963653564453,-52.479183197021484,1
Stacey investigates Veronica.,Art investigates Veronica.,syntax,s-selection,animate_subject_trans,True,False,True,False,129,-37.93293380737305,-28.441877365112305,0
Brenda was insulting Tina.,Some hair was insulting Tina.,syntax,s-selection,animate_subject_trans,True,False,True,False,130,-38.65113830566406,-42.177757263183594,1
Rachelle wasn't driving to the lake.,The drawing wasn't driving to the lake.,syntax,s-selection,animate_subject_trans,True,False,True,False,131,-41.13878631591797,-40.92229080200195,0
Laurie might watch Kayla.,A print might watch Kayla.,syntax,s-selection,animate_subject_trans,True,False,True,False,132,-44.152381896972656,-41.12404251098633,0
Laurie hides Keith.,Some newspaper article hides Keith.,syntax,s-selection,animate_subject_trans,True,False,True,False,133,-41.03479766845703,-44.94117736816406,1
This woman is referencing the doctor.,That spotlight is referencing the doctor.,syntax,s-selection,animate_subject_trans,True,False,True,False,134,-38.73954391479492,-42.72834396362305,1
Colleen doesn't bring a lot of stairs.,A picture doesn't bring a lot of stairs.,syntax,s-selection,animate_subject_trans,True,False,True,False,135,-41.98987579345703,-41.992431640625,1
Lori is discovering the water.,The beef is discovering the water.,syntax,s-selection,animate_subject_trans,True,False,True,False,136,-38.376407623291016,-38.61022186279297,1
William wasn't concealing Linda.,Some candle wasn't concealing Linda.,syntax,s-selection,animate_subject_trans,True,False,True,False,137,-39.1695556640625,-53.20684051513672,1
Carmen could praise Christopher.,Some closet could praise Christopher.,syntax,s-selection,animate_subject_trans,True,False,True,False,138,-52.75780487060547,-48.17877197265625,0
These adults won't kiss Sheila.,The hospitals won't kiss Sheila.,syntax,s-selection,animate_subject_trans,True,False,True,False,139,-41.41930389404297,-44.02119445800781,1
Tammy ran around every river.,This truck ran around every river.,syntax,s-selection,animate_subject_trans,True,False,True,False,140,-42.69365692138672,-43.06316375732422,1
Emily hadn't kissed Kimberley.,Every coat hadn't kissed Kimberley.,syntax,s-selection,animate_subject_trans,True,False,True,False,141,-38.39960479736328,-50.77978515625,1
Some doctor shouldn't attack the boys.,This ice shouldn't attack the boys.,syntax,s-selection,animate_subject_trans,True,False,True,False,142,-42.513763427734375,-43.59972381591797,1
Veronica descends every mountain.,Some organization descends every mountain.,syntax,s-selection,animate_subject_trans,True,False,True,False,143,-41.448883056640625,-44.180091857910156,1
Janet explores every lake.,Some shawl explores every lake.,syntax,s-selection,animate_subject_trans,True,False,True,False,144,-42.104618072509766,-49.115966796875,1
Leslie had investigated Veronica.,Some eye had investigated Veronica.,syntax,s-selection,animate_subject_trans,True,False,True,False,145,-42.299957275390625,-47.08256149291992,1
Mitchell can't boast about David.,This popsicle can't boast about David.,syntax,s-selection,animate_subject_trans,True,False,True,False,146,-45.76711654663086,-51.66670227050781,1
Christopher talked to Karen.,Some fish talked to Karen.,syntax,s-selection,animate_subject_trans,True,False,True,False,147,-23.387157440185547,-36.30173873901367,1
