sentence_good,sentence_bad,field,linguistics_term,UID,simple_LM_method,one_prefix_method,two_prefix_method,lexically_identical,pair_id,good_prob,bad_prob,correct
Grace is discovering the committees.,A dish is discovering the committees.,syntax,s-selection,animate_subject_trans,True,False,True,False,295,-41.06382751464844,-48.125953674316406,1
Paul isn't walking through that closet.,That light isn't walking through that closet.,syntax,s-selection,animate_subject_trans,True,False,True,False,296,-38.62889862060547,-44.701759338378906,1
Tina explores movie theaters.,That picture explores movie theaters.,syntax,s-selection,animate_subject_trans,True,False,True,False,297,-37.715553283691406,-36.525917053222656,0
Carla wasn't driving to that bank.,That committee wasn't driving to that bank.,syntax,s-selection,animate_subject_trans,True,False,True,False,298,-44.585166931152344,-50.12273406982422,1
Sherry didn't hug Curtis.,Literature didn't hug Curtis.,syntax,s-selection,animate_subject_trans,True,False,True,False,299,-46.50831604003906,-45.58901596069336,0
Cynthia is buying eggplants.,Some play is buying eggplants.,syntax,s-selection,animate_subject_trans,True,False,True,False,300,-51.01155471801758,-44.548744201660156,0
Larry isn't admiring Patrick.,The lake isn't admiring Patrick.,syntax,s-selection,animate_subject_trans,True,False,True,False,301,-35.992530822753906,-48.57423782348633,1
Danielle had worn the shirts.,The essay had worn the shirts.,syntax,s-selection,animate_subject_trans,True,False,True,False,302,-35.947914123535156,-40.13141632080078,1
Guy had talked to Holly.,Some eye had talked to Holly.,syntax,s-selection,animate_subject_trans,True,False,True,False,303,-30.107433319091797,-42.94157791137695,1
This doctor isn't scanning some play.,This projector isn't scanning some play.,syntax,s-selection,animate_subject_trans,True,False,True,False,304,-49.69947052001953,-50.43498229980469,1
Karla isn't lifting a shoe.,Some car isn't lifting a shoe.,syntax,s-selection,animate_subject_trans,True,False,True,False,305,-41.77253341674805,-40.82200622558594,0
Debra hasn't returned to Alexander.,Every eggplant hasn't returned to Alexander.,syntax,s-selection,animate_subject_trans,True,False,True,False,306,-42.04564666748047,-49.0494270324707,1
Ronald approached Carla.,Literature approached Carla.,syntax,s-selection,animate_subject_trans,True,False,True,False,307,-34.64829635620117,-38.73235321044922,1
Sandra can flee from Adam.,Some rice can flee from Adam.,syntax,s-selection,animate_subject_trans,True,False,True,False,308,-41.198516845703125,-43.88212203979492,1
Russell wouldn't complain about Jeffrey.,Every eggplant wouldn't complain about Jeffrey.,syntax,s-selection,animate_subject_trans,True,False,True,False,309,-35.21963119506836,-51.331512451171875,1
Children listened to Susan.,Most rivers listened to Susan.,syntax,s-selection,animate_subject_trans,True,False,True,False,310,-23.911766052246094,-39.33109664916992,1
Nicole wasn't praising Elizabeth.,Some computer wasn't praising Elizabeth.,syntax,s-selection,animate_subject_trans,True,False,True,False,311,-39.99626159667969,-43.715267181396484,1
Scott breaks this screen.,Every high school breaks this screen.,syntax,s-selection,animate_subject_trans,True,False,True,False,312,-28.653182983398438,-37.10047149658203,1
Jane skates around this grocery store.,A bank skates around this grocery store.,syntax,s-selection,animate_subject_trans,True,False,True,False,313,-40.288673400878906,-48.90303039550781,1
Julie attacks Kayla.,Some commentary attacks Kayla.,syntax,s-selection,animate_subject_trans,True,False,True,False,314,-37.398651123046875,-42.26809310913086,1
Monet is hiding some guys.,Every turtle is hiding some guys.,syntax,s-selection,animate_subject_trans,True,False,True,False,315,-36.48265838623047,-41.72134780883789,1
Rhonda isn't fleeing from Connie.,This sketch isn't fleeing from Connie.,syntax,s-selection,animate_subject_trans,True,False,True,False,316,-52.62238311767578,-54.56856918334961,1
Rachelle wasn't boasting about the Borgias.,Every drawing wasn't boasting about the Borgias.,syntax,s-selection,animate_subject_trans,True,False,True,False,317,-63.32942199707031,-61.73960876464844,0
Suzanne saw Teresa.,That sweater saw Teresa.,syntax,s-selection,animate_subject_trans,True,False,True,False,318,-31.781423568725586,-37.0394172668457,1
Debra runs around many movie theaters.,Every ladder runs around many movie theaters.,syntax,s-selection,animate_subject_trans,True,False,True,False,319,-46.42924118041992,-49.586814880371094,1
Nancy hired people.,The dog hired people.,syntax,s-selection,animate_subject_trans,True,False,True,False,320,-33.60445785522461,-33.36317825317383,0
Brenda helps Sharon.,That dog helps Sharon.,syntax,s-selection,animate_subject_trans,True,False,True,False,321,-30.7315673828125,-32.200340270996094,1
Diane hadn't talked to Eric.,This face hadn't talked to Eric.,syntax,s-selection,animate_subject_trans,True,False,True,False,322,-43.16813659667969,-41.335533142089844,0
Some doctor didn't criticize these ladies.,That public park didn't criticize these ladies.,syntax,s-selection,animate_subject_trans,True,False,True,False,323,-42.073936462402344,-50.94972229003906,1
Some dancer isn't helping Catherine.,That rice isn't helping Catherine.,syntax,s-selection,animate_subject_trans,True,False,True,False,324,-43.16999816894531,-43.2242546081543,1
The teachers hadn't examined this newspaper article.,Many glasses hadn't examined this newspaper article.,syntax,s-selection,animate_subject_trans,True,False,True,False,325,-54.334320068359375,-55.66722869873047,1
Meredith conceals Curtis.,This sketch conceals Curtis.,syntax,s-selection,animate_subject_trans,True,False,True,False,326,-41.67815399169922,-44.05793762207031,1
George isn't running around a lot of malls.,A glove isn't running around a lot of malls.,syntax,s-selection,animate_subject_trans,True,False,True,False,327,-39.196189880371094,-52.165836334228516,1
Dawn wouldn't describe Sabrina.,Every skateboard wouldn't describe Sabrina.,syntax,s-selection,animate_subject_trans,True,False,True,False,328,-47.21561813354492,-48.59503936767578,1
Paul did examine some play.,Every university did examine some play.,syntax,s-selection,animate_subject_trans,True,False,True,False,329,-39.28446578979492,-48.86682891845703,1
Martha cured Gregory.,The shoe cured Gregory.,syntax,s-selection,animate_subject_trans,True,False,True,False,330,-38.00627136230469,-40.86854553222656,1
Many people could argue about Homer.,All essays could argue about Homer.,syntax,s-selection,animate_subject_trans,True,False,True,False,331,-35.00727844238281,-45.590232849121094,1
James isn't exiting hills.,This movie theater isn't exiting hills.,syntax,s-selection,animate_subject_trans,True,False,True,False,332,-33.819061279296875,-47.773292541503906,1
Kirsten had kissed the Borgias.,This report had kissed the Borgias.,syntax,s-selection,animate_subject_trans,True,False,True,False,333,-62.34673309326172,-55.80183029174805,0
Alexander walks through some glaciers.,That candle walks through some glaciers.,syntax,s-selection,animate_subject_trans,True,False,True,False,334,-31.882484436035156,-44.070640563964844,1
Keith notices all unicycles.,The glacier notices all unicycles.,syntax,s-selection,animate_subject_trans,True,False,True,False,335,-39.53485870361328,-55.478057861328125,1
Lucille left Larry.,Every college campus left Larry.,syntax,s-selection,animate_subject_trans,True,False,True,False,336,-32.76683044433594,-39.550743103027344,1
Danielle hugged Kristen.,That screen hugged Kristen.,syntax,s-selection,animate_subject_trans,True,False,True,False,337,-34.231197357177734,-37.544395446777344,1
Homer helped Melanie.,A sketch helped Melanie.,syntax,s-selection,animate_subject_trans,True,False,True,False,338,-37.065826416015625,-37.54644775390625,1
Alice ran around some glacier.,An essay ran around some glacier.,syntax,s-selection,animate_subject_trans,True,False,True,False,339,-38.09397888183594,-50.57110595703125,1
George had described the drivers.,This box had described the drivers.,syntax,s-selection,animate_subject_trans,True,False,True,False,340,-29.919795989990234,-40.28213119506836,1
Tamara complains about those drivers.,Every carriage complains about those drivers.,syntax,s-selection,animate_subject_trans,True,False,True,False,341,-37.46209716796875,-45.72859191894531,1
The boy hadn't boasted about Andrea.,The documentary hadn't boasted about Andrea.,syntax,s-selection,animate_subject_trans,True,False,True,False,342,-45.18345642089844,-50.06013870239258,1
Teresa is running around a mall.,This library is running around a mall.,syntax,s-selection,animate_subject_trans,True,False,True,False,343,-40.44524383544922,-36.5161247253418,0
Robert explored these closets.,Every high school explored these closets.,syntax,s-selection,animate_subject_trans,True,False,True,False,344,-31.376232147216797,-40.08952331542969,1
Eric does appreciate Elaine.,Some college campus does appreciate Elaine.,syntax,s-selection,animate_subject_trans,True,False,True,False,345,-30.255508422851562,-46.41525650024414,1
Regina wasn't working with Renee.,A sock wasn't working with Renee.,syntax,s-selection,animate_subject_trans,True,False,True,False,346,-38.84608459472656,-42.69437789916992,1
Alan is wearing the shoe.,This ice is wearing the shoe.,syntax,s-selection,animate_subject_trans,True,False,True,False,347,-23.24843978881836,-37.67796325683594,1
Cynthia had all stairs.,Politics had all stairs.,syntax,s-selection,animate_subject_trans,True,False,True,False,348,-42.666236877441406,-30.5175724029541,0
Carrie hasn't talked to Sheila.,Every government hasn't talked to Sheila.,syntax,s-selection,animate_subject_trans,True,False,True,False,349,-42.405006408691406,-42.07874298095703,0
Kristen biked to a lot of movie theaters.,Some dress biked to a lot of movie theaters.,syntax,s-selection,animate_subject_trans,True,False,True,False,350,-50.24224090576172,-56.53303527832031,1
Colleen insulted Irene.,This college campus insulted Irene.,syntax,s-selection,animate_subject_trans,True,False,True,False,351,-37.40601348876953,-46.83120346069336,1
Naomi has escaped from Michelle.,Every candle has escaped from Michelle.,syntax,s-selection,animate_subject_trans,True,False,True,False,352,-38.961883544921875,-40.30386734008789,1
Rachel could criticize this documentary.,The mushroom could criticize this documentary.,syntax,s-selection,animate_subject_trans,True,False,True,False,353,-31.624588012695312,-45.967742919921875,1
Samuel hasn't gone to most closets.,A muffin hasn't gone to most closets.,syntax,s-selection,animate_subject_trans,True,False,True,False,354,-50.94689178466797,-55.65312194824219,1
That beef looks like the paintings.,Some wheelbarrow looks like the paintings.,syntax,s-selection,animate_subject_trans,True,False,True,False,355,-38.540706634521484,-50.6057014465332,1
Wendy isn't approaching Todd.,Some spinach isn't approaching Todd.,syntax,s-selection,animate_subject_trans,True,False,True,False,356,-46.27356719970703,-46.68772506713867,1
The Lutherans can't remember the patient.,Commentaries can't remember the patient.,syntax,s-selection,animate_subject_trans,True,False,True,False,357,-54.174293518066406,-42.442447662353516,0
Alexander wasn't exploring some rivers.,The computer wasn't exploring some rivers.,syntax,s-selection,animate_subject_trans,True,False,True,False,358,-37.48283386230469,-47.23501968383789,1
Those cashiers were exiting all hospitals.,A lot of stairs were exiting all hospitals.,syntax,s-selection,animate_subject_trans,True,False,True,False,359,-51.699737548828125,-54.53081512451172,1
Melanie hadn't talked to Patrick.,Some mountain hadn't talked to Patrick.,syntax,s-selection,animate_subject_trans,True,False,True,False,360,-40.13335418701172,-45.030120849609375,1
Vanessa wasn't buying most libraries.,That government wasn't buying most libraries.,syntax,s-selection,animate_subject_trans,True,False,True,False,361,-48.60182189941406,-47.59649658203125,0
A guy conceals most waitresses.,This shawl conceals most waitresses.,syntax,s-selection,animate_subject_trans,True,False,True,False,362,-53.52399444580078,-59.17652130126953,1
Eric has escaped from Heather.,That icicle has escaped from Heather.,syntax,s-selection,animate_subject_trans,True,False,True,False,363,-29.908016204833984,-48.63605880737305,1
Ellen ran around that bank.,A legislature ran around that bank.,syntax,s-selection,animate_subject_trans,True,False,True,False,364,-39.58381652832031,-45.91154479980469,1
Lisa scans many plays.,The government scans many plays.,syntax,s-selection,animate_subject_trans,True,False,True,False,365,-31.88159942626953,-42.785377502441406,1
Melanie didn't clean many snakes.,Some hamster didn't clean many snakes.,syntax,s-selection,animate_subject_trans,True,False,True,False,366,-49.925865173339844,-54.04671096801758,1
Dan is scanning a commentary.,Every unicycle is scanning a commentary.,syntax,s-selection,animate_subject_trans,True,False,True,False,367,-31.5797119140625,-49.95279312133789,1
The dancers had these couches.,The couches had these couches.,syntax,s-selection,animate_subject_trans,True,False,True,False,368,-39.0754508972168,-37.983428955078125,0
Barbara helps that teacher.,A glacier helps that teacher.,syntax,s-selection,animate_subject_trans,True,False,True,False,369,-41.704132080078125,-48.151641845703125,1
The man could research most plays.,Some horse could research most plays.,syntax,s-selection,animate_subject_trans,True,False,True,False,370,-48.28007125854492,-51.69518280029297,1
Russell didn't fire those cashiers.,This rice didn't fire those cashiers.,syntax,s-selection,animate_subject_trans,True,False,True,False,371,-43.03167724609375,-57.00567626953125,1
Margaret is bringing many scarves.,The fish is bringing many scarves.,syntax,s-selection,animate_subject_trans,True,False,True,False,372,-43.657920837402344,-42.571929931640625,0
Claire has boycotted some university.,Some steak has boycotted some university.,syntax,s-selection,animate_subject_trans,True,False,True,False,373,-66.11087036132812,-69.61685180664062,1
Noah hadn't listened to Eva.,Some closet hadn't listened to Eva.,syntax,s-selection,animate_subject_trans,True,False,True,False,374,-41.430606842041016,-47.526893615722656,1
Tanya had fixed that fork.,That pie had fixed that fork.,syntax,s-selection,animate_subject_trans,True,False,True,False,375,-47.60393524169922,-43.59327697753906,0
Julie could question Benjamin.,That grocery store could question Benjamin.,syntax,s-selection,animate_subject_trans,True,False,True,False,376,-38.98152160644531,-47.4324951171875,1
Martha is insulting many guys.,Some bike is insulting many guys.,syntax,s-selection,animate_subject_trans,True,False,True,False,377,-41.52647399902344,-43.201271057128906,1
Rodney is driving to those lakes.,A committee is driving to those lakes.,syntax,s-selection,animate_subject_trans,True,False,True,False,378,-44.02485275268555,-47.875877380371094,1
Diana hasn't cared for Meredith.,Fish hasn't cared for Meredith.,syntax,s-selection,animate_subject_trans,True,False,True,False,379,-42.67500305175781,-37.00393295288086,0
Tiffany had healed Matt.,This door had healed Matt.,syntax,s-selection,animate_subject_trans,True,False,True,False,380,-49.671722412109375,-42.45008850097656,0
Bethany is discussing April.,Every mall is discussing April.,syntax,s-selection,animate_subject_trans,True,False,True,False,381,-46.577720642089844,-42.547821044921875,0
All senators kissed Holly.,The pies kissed Holly.,syntax,s-selection,animate_subject_trans,True,False,True,False,382,-38.35305404663086,-39.46437072753906,1
Teresa wasn't skated around that cafe.,A window wasn't skated around that cafe.,syntax,s-selection,animate_subject_trans,True,False,True,False,383,-59.25557327270508,-59.519432067871094,1
Every student might care for those girls.,That public park might care for those girls.,syntax,s-selection,animate_subject_trans,True,False,True,False,384,-41.584556579589844,-50.026519775390625,1
Teresa hadn't remembered Timothy.,The bicycle hadn't remembered Timothy.,syntax,s-selection,animate_subject_trans,True,False,True,False,385,-47.84409713745117,-49.685585021972656,1
The hospital was firing Mitchell.,The water was firing Mitchell.,syntax,s-selection,animate_subject_trans,True,False,True,False,386,-40.70381164550781,-39.8530158996582,0
Tamara will escape from Adam.,Music will escape from Adam.,syntax,s-selection,animate_subject_trans,True,False,True,False,387,-35.175132751464844,-29.996936798095703,0
The driver shouldn't examine a lot of plays.,The skirt shouldn't examine a lot of plays.,syntax,s-selection,animate_subject_trans,True,False,True,False,388,-50.633270263671875,-54.405601501464844,1
Valerie wasn't passing every mountain.,A mushroom wasn't passing every mountain.,syntax,s-selection,animate_subject_trans,True,False,True,False,389,-49.24998474121094,-48.411415100097656,0
Mary fled from Becky.,A door fled from Becky.,syntax,s-selection,animate_subject_trans,True,False,True,False,390,-30.061872482299805,-41.0873908996582,1
Most actors skated around this library.,Many reports skated around this library.,syntax,s-selection,animate_subject_trans,True,False,True,False,391,-46.36040496826172,-48.742095947265625,1
Kayla would discuss Roger.,That plate would discuss Roger.,syntax,s-selection,animate_subject_trans,True,False,True,False,392,-39.95709228515625,-44.246150970458984,1
Every girl discovers Cynthia.,Some sweater discovers Cynthia.,syntax,s-selection,animate_subject_trans,True,False,True,False,393,-32.433528900146484,-43.909423828125,1
Gerald ran around some movie theater.,The apple ran around some movie theater.,syntax,s-selection,animate_subject_trans,True,False,True,False,394,-49.80804443359375,-49.36254119873047,0
Susan is criticizing Guy.,The sock is criticizing Guy.,syntax,s-selection,animate_subject_trans,True,False,True,False,395,-27.893680572509766,-42.51240539550781,1
Melinda had scanned many stories.,A movie had scanned many stories.,syntax,s-selection,animate_subject_trans,True,False,True,False,396,-41.182373046875,-40.60192108154297,0
Liam thought about some association.,The mushroom thought about some association.,syntax,s-selection,animate_subject_trans,True,False,True,False,397,-45.5577392578125,-49.34145736694336,1
Nina will notice those girls.,A sketch will notice those girls.,syntax,s-selection,animate_subject_trans,True,False,True,False,398,-41.061546325683594,-45.775604248046875,1
Gerald isn't biking to a grocery store.,That car isn't biking to a grocery store.,syntax,s-selection,animate_subject_trans,True,False,True,False,399,-50.39039993286133,-45.4415397644043,0
Leslie listens to Keith.,This story listens to Keith.,syntax,s-selection,animate_subject_trans,True,False,True,False,400,-33.313316345214844,-32.06687927246094,0
Rhonda will lift a tomato.,That movie will lift a tomato.,syntax,s-selection,animate_subject_trans,True,False,True,False,401,-42.56188201904297,-42.353458404541016,0
Kristen might bike to those libraries.,Some snake might bike to those libraries.,syntax,s-selection,animate_subject_trans,True,False,True,False,402,-51.26900100708008,-58.57886505126953,1
Diana broke this skateboard.,That cat broke this skateboard.,syntax,s-selection,animate_subject_trans,True,False,True,False,403,-40.685577392578125,-39.50847244262695,0
Karla notices Carolyn.,The college campus notices Carolyn.,syntax,s-selection,animate_subject_trans,True,False,True,False,404,-36.814300537109375,-46.6479377746582,1
Julia discusses a lot of dancers.,A muffin discusses a lot of dancers.,syntax,s-selection,animate_subject_trans,True,False,True,False,405,-40.23785400390625,-48.36774444580078,1
The students haven't cleaned some glasses.,Eggplants haven't cleaned some glasses.,syntax,s-selection,animate_subject_trans,True,False,True,False,406,-42.97825241088867,-60.78190994262695,1
Some ladies were exiting all high schools.,The Balkans were exiting all high schools.,syntax,s-selection,animate_subject_trans,True,False,True,False,407,-46.01158142089844,-48.35755157470703,1
John has healed a lot of actresses.,Music has healed a lot of actresses.,syntax,s-selection,animate_subject_trans,True,False,True,False,408,-38.59458923339844,-39.554622650146484,1
Tanya wouldn't conceal most socks.,A door wouldn't conceal most socks.,syntax,s-selection,animate_subject_trans,True,False,True,False,409,-56.69358825683594,-53.85332107543945,0
Becca might fix this dish.,Every ladder might fix this dish.,syntax,s-selection,animate_subject_trans,True,False,True,False,410,-41.466922760009766,-43.88703155517578,1
April sounded like Amelia.,The museum sounded like Amelia.,syntax,s-selection,animate_subject_trans,True,False,True,False,411,-28.422883987426758,-38.969295501708984,1
Christine hasn't watched Janet.,This plane hasn't watched Janet.,syntax,s-selection,animate_subject_trans,True,False,True,False,412,-38.99956130981445,-45.395755767822266,1
Jeffrey wasn't noticing Aaron.,The mouth wasn't noticing Aaron.,syntax,s-selection,animate_subject_trans,True,False,True,False,413,-42.544429779052734,-45.79610824584961,1
Rebecca has broken some computer.,A unicycle has broken some computer.,syntax,s-selection,animate_subject_trans,True,False,True,False,414,-39.787837982177734,-47.52265167236328,1
An actor discusses Tanya.,Art discusses Tanya.,syntax,s-selection,animate_subject_trans,True,False,True,False,415,-36.86919403076172,-29.176998138427734,0
Those women don't exit these glaciers.,A lot of mushrooms don't exit these glaciers.,syntax,s-selection,animate_subject_trans,True,False,True,False,416,-43.00358963012695,-53.93739318847656,1
Claire hasn't described this documentary.,That ladder hasn't described this documentary.,syntax,s-selection,animate_subject_trans,True,False,True,False,417,-40.666015625,-49.726837158203125,1
Nancy was bringing this wheelbarrow.,The wheelbarrow was bringing this wheelbarrow.,syntax,s-selection,animate_subject_trans,True,False,True,False,418,-56.220420837402344,-58.55403137207031,1
Douglas hasn't appreciated some doctor.,This rug hasn't appreciated some doctor.,syntax,s-selection,animate_subject_trans,True,False,True,False,419,-49.03434371948242,-56.033016204833984,1
Colleen cleans some dish.,Some eye cleans some dish.,syntax,s-selection,animate_subject_trans,True,False,True,False,420,-39.91958236694336,-39.89710998535156,0
Rose is touring all glaciers.,Art is touring all glaciers.,syntax,s-selection,animate_subject_trans,True,False,True,False,421,-34.45564270019531,-34.26948547363281,0
The student will examine the commentary.,This newspaper article will examine the commentary.,syntax,s-selection,animate_subject_trans,True,False,True,False,422,-37.13457489013672,-42.20243453979492,1
Sara exited that bank.,Every photograph exited that bank.,syntax,s-selection,animate_subject_trans,True,False,True,False,423,-39.434486389160156,-42.063941955566406,1
Marla hid Curtis.,A play hid Curtis.,syntax,s-selection,animate_subject_trans,True,False,True,False,424,-36.894691467285156,-39.953155517578125,1
Dawn wouldn't buy some rivers.,Every shawl wouldn't buy some rivers.,syntax,s-selection,animate_subject_trans,True,False,True,False,425,-48.50529479980469,-55.14704132080078,1
Cheryl isn't thinking about the print.,A gate isn't thinking about the print.,syntax,s-selection,animate_subject_trans,True,False,True,False,426,-57.090003967285156,-48.50236892700195,0
Mitchell had hugged Monica.,That university had hugged Monica.,syntax,s-selection,animate_subject_trans,True,False,True,False,427,-42.427711486816406,-43.330299377441406,1
John was observing Michelle.,This hat was observing Michelle.,syntax,s-selection,animate_subject_trans,True,False,True,False,428,-27.50848388671875,-40.24341583251953,1
Lawrence isn't appreciating Martin.,Every bike isn't appreciating Martin.,syntax,s-selection,animate_subject_trans,True,False,True,False,429,-49.55596160888672,-50.061580657958984,1
Some boy had exited the cafes.,Pork had exited the cafes.,syntax,s-selection,animate_subject_trans,True,False,True,False,430,-42.76371383666992,-46.63714599609375,1
Elizabeth isn't approaching Christopher.,Some bird isn't approaching Christopher.,syntax,s-selection,animate_subject_trans,True,False,True,False,431,-35.62416076660156,-46.074886322021484,1
Nancy is talking about Lucille.,This pie is talking about Lucille.,syntax,s-selection,animate_subject_trans,True,False,True,False,432,-40.924705505371094,-42.5754508972168,1
Charles exited those art galleries.,Every school exited those art galleries.,syntax,s-selection,animate_subject_trans,True,False,True,False,433,-35.76841735839844,-46.412376403808594,1
Dan hadn't dropped by many libraries.,That steak hadn't dropped by many libraries.,syntax,s-selection,animate_subject_trans,True,False,True,False,434,-41.16210174560547,-55.45849609375,1
Sara was working with Deborah.,This cucumber was working with Deborah.,syntax,s-selection,animate_subject_trans,True,False,True,False,435,-35.7269401550293,-39.8129997253418,1
Kristin sounds like Rachel.,This fish sounds like Rachel.,syntax,s-selection,animate_subject_trans,True,False,True,False,436,-27.0884952545166,-35.12509536743164,1
Most pedestrians wouldn't hug Patrick.,All legislatures wouldn't hug Patrick.,syntax,s-selection,animate_subject_trans,True,False,True,False,437,-45.33845901489258,-48.772361755371094,1
Jane won't appreciate Candice.,Every skateboard won't appreciate Candice.,syntax,s-selection,animate_subject_trans,True,False,True,False,438,-34.862762451171875,-48.20408630371094,1
Kenneth hated Curtis.,Some bank hated Curtis.,syntax,s-selection,animate_subject_trans,True,False,True,False,439,-31.21965789794922,-38.520530700683594,1
Jesus boasted about a lot of newspaper articles.,This spinach boasted about a lot of newspaper articles.,syntax,s-selection,animate_subject_trans,True,False,True,False,440,-39.09551239013672,-52.3956413269043,1
