sentence_good,sentence_bad,field,linguistics_term,UID,simple_LM_method,one_prefix_method,two_prefix_method,lexically_identical,pair_id,good_prob,bad_prob,correct
Melissa watched Ella.,Some vase watched Ella.,syntax,s-selection,animate_subject_trans,True,False,True,False,441,-30.86396598815918,-40.857574462890625,1
Tiffany should lift cups.,This glove should lift cups.,syntax,s-selection,animate_subject_trans,True,False,True,False,442,-47.350807189941406,-41.218833923339844,0
Dennis scares patients.,The jacket scares patients.,syntax,s-selection,animate_subject_trans,True,False,True,False,443,-37.341007232666016,-38.41740417480469,1
Kathleen is talking about a guy.,The skateboard is talking about a guy.,syntax,s-selection,animate_subject_trans,True,False,True,False,444,-39.37669372558594,-39.72270965576172,1
Roger isn't researching a story.,Some jacket isn't researching a story.,syntax,s-selection,animate_subject_trans,True,False,True,False,445,-32.657352447509766,-45.72687530517578,1
Most committees haven't talked about Maria.,Some glasses haven't talked about Maria.,syntax,s-selection,animate_subject_trans,True,False,True,False,446,-46.38986587524414,-42.95264434814453,0
Douglas respects that doctor.,This cucumber respects that doctor.,syntax,s-selection,animate_subject_trans,True,False,True,False,447,-41.657718658447266,-45.01728057861328,1
Scott resembles some photographs.,That light resembles some photographs.,syntax,s-selection,animate_subject_trans,True,False,True,False,448,-29.940364837646484,-35.946556091308594,1
Pamela had broken these cups.,Some unicycle had broken these cups.,syntax,s-selection,animate_subject_trans,True,False,True,False,449,-46.889244079589844,-50.29305648803711,1
The ice cream looks like these drawings.,This photograph looks like these drawings.,syntax,s-selection,animate_subject_trans,True,False,True,False,450,-41.370887756347656,-33.5285758972168,0
Elaine drives to most art galleries.,This dish drives to most art galleries.,syntax,s-selection,animate_subject_trans,True,False,True,False,451,-52.28169250488281,-47.06077194213867,0
Carmen arrived at some public park.,Literature arrived at some public park.,syntax,s-selection,animate_subject_trans,True,False,True,False,452,-53.720916748046875,-47.44816970825195,0
Raymond has seen Eva.,A documentary has seen Eva.,syntax,s-selection,animate_subject_trans,True,False,True,False,453,-38.00409698486328,-34.90672302246094,0
Becky didn't reveal Marla.,Some truck didn't reveal Marla.,syntax,s-selection,animate_subject_trans,True,False,True,False,454,-43.138153076171875,-47.869842529296875,1
Those organizations had sold all photographs.,Carriages had sold all photographs.,syntax,s-selection,animate_subject_trans,True,False,True,False,455,-39.74468994140625,-40.92964172363281,1
People cleaned the pork.,Most cats cleaned the pork.,syntax,s-selection,animate_subject_trans,True,False,True,False,456,-29.19888687133789,-35.883487701416016,1
Linda wasn't breaking some car.,The cake wasn't breaking some car.,syntax,s-selection,animate_subject_trans,True,False,True,False,457,-42.52241516113281,-46.721771240234375,1
Eric might heal Winston Churchill.,This nose might heal Winston Churchill.,syntax,s-selection,animate_subject_trans,True,False,True,False,458,-37.38420486450195,-48.781715393066406,1
Naomi hasn't sounded like Jennifer.,The bank hasn't sounded like Jennifer.,syntax,s-selection,animate_subject_trans,True,False,True,False,459,-42.465301513671875,-46.04844284057617,1
A cashier fixed those windows.,The lake fixed those windows.,syntax,s-selection,animate_subject_trans,True,False,True,False,460,-48.006126403808594,-43.61659240722656,0
Derek criticizes Julie.,Some fish criticizes Julie.,syntax,s-selection,animate_subject_trans,True,False,True,False,461,-42.157745361328125,-41.3182487487793,0
Elaine examines documentaries.,The dish examines documentaries.,syntax,s-selection,animate_subject_trans,True,False,True,False,462,-39.126644134521484,-39.579139709472656,1
Stacy criticizes Carmen.,That fish criticizes Carmen.,syntax,s-selection,animate_subject_trans,True,False,True,False,463,-39.93571472167969,-44.0884895324707,1
Heather has criticized Dana.,Every unicycle has criticized Dana.,syntax,s-selection,animate_subject_trans,True,False,True,False,464,-43.820037841796875,-49.035987854003906,1
Curtis can talk about Donna.,The cilantro can talk about Donna.,syntax,s-selection,animate_subject_trans,True,False,True,False,465,-45.49126052856445,-46.37159729003906,1
Travis hadn't listened to Gregory.,This plane hadn't listened to Gregory.,syntax,s-selection,animate_subject_trans,True,False,True,False,466,-43.202091217041016,-47.04492950439453,1
The Borgias are selling a plate.,Most photographs are selling a plate.,syntax,s-selection,animate_subject_trans,True,False,True,False,467,-50.194908142089844,-38.68495178222656,0
Theresa wouldn't praise Carlos.,Every lake wouldn't praise Carlos.,syntax,s-selection,animate_subject_trans,True,False,True,False,468,-47.210235595703125,-49.333919525146484,1
Those waitresses hadn't fled from Jesus.,All projectors hadn't fled from Jesus.,syntax,s-selection,animate_subject_trans,True,False,True,False,469,-53.32440948486328,-57.9090690612793,1
Tina heals Russell.,The hair heals Russell.,syntax,s-selection,animate_subject_trans,True,False,True,False,470,-37.205604553222656,-36.2041015625,0
Kayla arrived at these cafes.,That documentary arrived at these cafes.,syntax,s-selection,animate_subject_trans,True,False,True,False,471,-36.470130920410156,-41.05982208251953,1
Sara can't examine most newspaper articles.,This movie theater can't examine most newspaper articles.,syntax,s-selection,animate_subject_trans,True,False,True,False,472,-53.01866149902344,-57.948368072509766,1
Some committee helped Vanessa.,A couch helped Vanessa.,syntax,s-selection,animate_subject_trans,True,False,True,False,473,-35.51530456542969,-36.554264068603516,1
Sara can't scan that story.,Music can't scan that story.,syntax,s-selection,animate_subject_trans,True,False,True,False,474,-44.34879684448242,-35.37382507324219,0
Russell hates Cynthia.,That movie hates Cynthia.,syntax,s-selection,animate_subject_trans,True,False,True,False,475,-26.696449279785156,-34.21771240234375,1
Helen climbs down these hills.,The skirt climbs down these hills.,syntax,s-selection,animate_subject_trans,True,False,True,False,476,-36.52233123779297,-43.88249969482422,1
Derek should dislike Amelia.,A restaurant should dislike Amelia.,syntax,s-selection,animate_subject_trans,True,False,True,False,477,-47.179115295410156,-44.85090255737305,0
April is going to that museum.,The rug is going to that museum.,syntax,s-selection,animate_subject_trans,True,False,True,False,478,-31.285043716430664,-41.883277893066406,1
Laurie flees from Deborah.,A restaurant flees from Deborah.,syntax,s-selection,animate_subject_trans,True,False,True,False,479,-44.8558349609375,-43.70072937011719,0
Robert visits the teachers.,Steak visits the teachers.,syntax,s-selection,animate_subject_trans,True,False,True,False,480,-26.046762466430664,-33.38219451904297,1
Candice had some eyes.,A coat had some eyes.,syntax,s-selection,animate_subject_trans,True,False,True,False,481,-32.16733169555664,-32.91515350341797,1
Randolf exits most glaciers.,A screen exits most glaciers.,syntax,s-selection,animate_subject_trans,True,False,True,False,482,-49.306243896484375,-45.780460357666016,0
A wheelbarrow resembles that painting.,Every tomato resembles that painting.,syntax,s-selection,animate_subject_trans,True,False,True,False,483,-53.25653839111328,-40.09367370605469,0
Marie wasn't discussing books.,The university wasn't discussing books.,syntax,s-selection,animate_subject_trans,True,False,True,False,484,-27.968637466430664,-37.53160095214844,1
Erin had sold all candles.,This closet had sold all candles.,syntax,s-selection,animate_subject_trans,True,False,True,False,485,-37.70133972167969,-44.55790710449219,1
Patricia isn't driving to most high schools.,This chicken isn't driving to most high schools.,syntax,s-selection,animate_subject_trans,True,False,True,False,486,-51.79634094238281,-53.36378479003906,1
George isn't discovering Marla.,Some essay isn't discovering Marla.,syntax,s-selection,animate_subject_trans,True,False,True,False,487,-38.39807891845703,-48.97480773925781,1
Russell was hiding a woman.,That glacier was hiding a woman.,syntax,s-selection,animate_subject_trans,True,False,True,False,488,-27.00884437561035,-41.86426544189453,1
Tamara scanned this story.,Every turtle scanned this story.,syntax,s-selection,animate_subject_trans,True,False,True,False,489,-31.615598678588867,-37.150291442871094,1
Randolf didn't fix the plate.,Every popsicle didn't fix the plate.,syntax,s-selection,animate_subject_trans,True,False,True,False,490,-41.28263854980469,-46.023590087890625,1
Mitchell cleans this college campus.,That unicycle cleans this college campus.,syntax,s-selection,animate_subject_trans,True,False,True,False,491,-50.057640075683594,-57.970088958740234,1
Pamela hadn't seen all computers.,Every report hadn't seen all computers.,syntax,s-selection,animate_subject_trans,True,False,True,False,492,-46.06755065917969,-44.82154846191406,0
Elaine hasn't concealed Aaron.,The horse hasn't concealed Aaron.,syntax,s-selection,animate_subject_trans,True,False,True,False,493,-48.997528076171875,-48.16060256958008,0
Caroline had kissed Carrie.,A cafe had kissed Carrie.,syntax,s-selection,animate_subject_trans,True,False,True,False,494,-42.74177551269531,-42.38072204589844,0
Tammy has skated around every art gallery.,That chicken has skated around every art gallery.,syntax,s-selection,animate_subject_trans,True,False,True,False,495,-59.43193054199219,-62.54161834716797,1
The Clintons are boasting about Stephen.,Those pictures are boasting about Stephen.,syntax,s-selection,animate_subject_trans,True,False,True,False,496,-49.61402893066406,-42.930946350097656,0
Valerie explored some mall.,Every lamp explored some mall.,syntax,s-selection,animate_subject_trans,True,False,True,False,497,-46.91800308227539,-46.36993408203125,0
Barbara won't conceal Julia.,A university won't conceal Julia.,syntax,s-selection,animate_subject_trans,True,False,True,False,498,-44.627723693847656,-46.98439025878906,1
Marie cured Linda.,This tomato cured Linda.,syntax,s-selection,animate_subject_trans,True,False,True,False,499,-24.396007537841797,-36.05139923095703,1
Tracy hadn't hugged Emily.,This sweater hadn't hugged Emily.,syntax,s-selection,animate_subject_trans,True,False,True,False,500,-40.15707778930664,-46.99860763549805,1
Rachel discovered this library.,Every committee discovered this library.,syntax,s-selection,animate_subject_trans,True,False,True,False,501,-24.893714904785156,-36.47628402709961,1
James explores grocery stores.,A government explores grocery stores.,syntax,s-selection,animate_subject_trans,True,False,True,False,502,-28.59210205078125,-37.97826385498047,1
Raymond is attacking Douglas.,That restaurant is attacking Douglas.,syntax,s-selection,animate_subject_trans,True,False,True,False,503,-39.498504638671875,-40.7291259765625,1
Brian hasn't talked to Steve.,This eggplant hasn't talked to Steve.,syntax,s-selection,animate_subject_trans,True,False,True,False,504,-30.978477478027344,-46.828338623046875,1
Linda runs around those art galleries.,A spotlight runs around those art galleries.,syntax,s-selection,animate_subject_trans,True,False,True,False,505,-51.64918518066406,-50.2876091003418,0
Erin had cleaned those public parks.,That door had cleaned those public parks.,syntax,s-selection,animate_subject_trans,True,False,True,False,506,-52.609405517578125,-55.2927360534668,1
Laura is touring many hospitals.,The computer is touring many hospitals.,syntax,s-selection,animate_subject_trans,True,False,True,False,507,-32.25786590576172,-40.13707733154297,1
Regina will discuss Carolyn.,The muffin will discuss Carolyn.,syntax,s-selection,animate_subject_trans,True,False,True,False,508,-36.703651428222656,-46.88787078857422,1
Laura climbs up the hills.,Art climbs up the hills.,syntax,s-selection,animate_subject_trans,True,False,True,False,509,-27.93532943725586,-28.57879066467285,1
Marcus did praise Stephanie.,This cart did praise Stephanie.,syntax,s-selection,animate_subject_trans,True,False,True,False,510,-32.09798812866211,-45.63636016845703,1
Mary could escape from Meredith.,Every muffin could escape from Meredith.,syntax,s-selection,animate_subject_trans,True,False,True,False,511,-30.710521697998047,-45.389076232910156,1
Margaret would love Kayla.,The shawl would love Kayla.,syntax,s-selection,animate_subject_trans,True,False,True,False,512,-37.10340881347656,-44.912227630615234,1
Tonya was talking about Brian.,Some cake was talking about Brian.,syntax,s-selection,animate_subject_trans,True,False,True,False,513,-33.46363067626953,-40.77144241333008,1
Thomas fires the waitresses.,Some sock fires the waitresses.,syntax,s-selection,animate_subject_trans,True,False,True,False,514,-35.92686080932617,-48.210105895996094,1
Patients were firing guys.,Many planes were firing guys.,syntax,s-selection,animate_subject_trans,True,False,True,False,515,-38.332733154296875,-34.3191032409668,0
Amanda can't visit Jason.,Some mall can't visit Jason.,syntax,s-selection,animate_subject_trans,True,False,True,False,516,-37.30506134033203,-45.34492492675781,1
Diane hasn't attacked Charles.,A university hasn't attacked Charles.,syntax,s-selection,animate_subject_trans,True,False,True,False,517,-43.4350471496582,-43.02699661254883,0
Diana hadn't dropped by rivers.,That ladder hadn't dropped by rivers.,syntax,s-selection,animate_subject_trans,True,False,True,False,518,-48.55038070678711,-49.82366943359375,1
Lisa wasn't dropping by every mall.,Every eggplant wasn't dropping by every mall.,syntax,s-selection,animate_subject_trans,True,False,True,False,519,-41.24739074707031,-55.834503173828125,1
Cynthia wouldn't think about most glasses.,Every cart wouldn't think about most glasses.,syntax,s-selection,animate_subject_trans,True,False,True,False,520,-57.40707778930664,-50.70777130126953,0
Barbara examines every essay.,That candle examines every essay.,syntax,s-selection,animate_subject_trans,True,False,True,False,521,-41.671104431152344,-40.91960906982422,0
Timothy messed up the high schools.,Every photograph messed up the high schools.,syntax,s-selection,animate_subject_trans,True,False,True,False,522,-44.169124603271484,-45.6839485168457,1
Dana sees Rodney.,The rug sees Rodney.,syntax,s-selection,animate_subject_trans,True,False,True,False,523,-35.19696044921875,-36.96902084350586,1
Derek hasn't hated Teresa.,Spain hasn't hated Teresa.,syntax,s-selection,animate_subject_trans,True,False,True,False,524,-44.84569549560547,-35.920135498046875,0
Every waitress was driving to that hill.,Every car was driving to that hill.,syntax,s-selection,animate_subject_trans,True,False,True,False,525,-42.23029327392578,-37.735843658447266,0
Leslie should take this mirror.,That screen should take this mirror.,syntax,s-selection,animate_subject_trans,True,False,True,False,526,-39.286094665527344,-37.58935546875,0
Scott did discuss Richard.,That pasta did discuss Richard.,syntax,s-selection,animate_subject_trans,True,False,True,False,527,-34.31660461425781,-48.132904052734375,1
Edward toured Spain.,The book toured Spain.,syntax,s-selection,animate_subject_trans,True,False,True,False,528,-22.303741455078125,-30.90123176574707,1
Customers shouldn't heal Catherine.,Bananas shouldn't heal Catherine.,syntax,s-selection,animate_subject_trans,True,False,True,False,529,-40.46092224121094,-44.40612030029297,1
A legislature described Cheryl.,Some skateboard described Cheryl.,syntax,s-selection,animate_subject_trans,True,False,True,False,530,-38.03863525390625,-39.82489776611328,1
Curtis resembles many pictures.,Every bird resembles many pictures.,syntax,s-selection,animate_subject_trans,True,False,True,False,531,-43.174583435058594,-37.28077697753906,0
Curtis didn't break the chair.,Every muffin didn't break the chair.,syntax,s-selection,animate_subject_trans,True,False,True,False,532,-43.28441619873047,-40.73396301269531,0
Most children had attacked Sheila.,All pictures had attacked Sheila.,syntax,s-selection,animate_subject_trans,True,False,True,False,533,-36.37134552001953,-40.38325119018555,1
Donna questions Elizabeth.,Some school questions Elizabeth.,syntax,s-selection,animate_subject_trans,True,False,True,False,534,-34.64286804199219,-33.45494079589844,0
Jane hasn't lifted that truck.,That glove hasn't lifted that truck.,syntax,s-selection,animate_subject_trans,True,False,True,False,535,-36.375282287597656,-48.36738586425781,1
Sandra hadn't talked to Judy.,The muffin hadn't talked to Judy.,syntax,s-selection,animate_subject_trans,True,False,True,False,536,-42.44189453125,-48.58892059326172,1
Brenda has brought this window.,The book has brought this window.,syntax,s-selection,animate_subject_trans,True,False,True,False,537,-35.44305419921875,-37.15390396118164,1
Caroline isn't exploring closets.,Some fish isn't exploring closets.,syntax,s-selection,animate_subject_trans,True,False,True,False,538,-46.637107849121094,-47.81112289428711,1
Carol isn't observing Jessica.,Some company isn't observing Jessica.,syntax,s-selection,animate_subject_trans,True,False,True,False,539,-41.579994201660156,-42.56584167480469,1
The Clintons haven't explored some cafes.,Some schools haven't explored some cafes.,syntax,s-selection,animate_subject_trans,True,False,True,False,540,-53.40126037597656,-41.72737503051758,0
That doctor hid Victoria.,Every icicle hid Victoria.,syntax,s-selection,animate_subject_trans,True,False,True,False,541,-37.15864562988281,-45.143211364746094,1
Some mushroom disturbs Ellen.,That nose disturbs Ellen.,syntax,s-selection,animate_subject_trans,True,False,True,False,542,-44.855472564697266,-44.38596725463867,0
Florence won't exit this hospital.,Every shawl won't exit this hospital.,syntax,s-selection,animate_subject_trans,True,False,True,False,543,-48.27817153930664,-51.52404022216797,1
Diane doesn't hate Sabrina.,Every government doesn't hate Sabrina.,syntax,s-selection,animate_subject_trans,True,False,True,False,544,-45.20077133178711,-41.06733703613281,0
Tara hasn't helped Maria.,This company hasn't helped Maria.,syntax,s-selection,animate_subject_trans,True,False,True,False,545,-40.2015266418457,-38.36909866333008,0
Donna dislikes some restaurant.,The pasta dislikes some restaurant.,syntax,s-selection,animate_subject_trans,True,False,True,False,546,-46.986183166503906,-48.581504821777344,1
Dan messed up this couch.,This sketch messed up this couch.,syntax,s-selection,animate_subject_trans,True,False,True,False,547,-30.360816955566406,-42.154075622558594,1
Tanya couldn't take these bikes.,That steak couldn't take these bikes.,syntax,s-selection,animate_subject_trans,True,False,True,False,548,-44.13323211669922,-46.00156021118164,1
Gina brought some mouth.,That pie brought some mouth.,syntax,s-selection,animate_subject_trans,True,False,True,False,549,-35.285423278808594,-38.299049377441406,1
Amelia references that book.,The pepper references that book.,syntax,s-selection,animate_subject_trans,True,False,True,False,550,-39.0088996887207,-42.744144439697266,1
Connie appreciated Steve.,That hamster appreciated Steve.,syntax,s-selection,animate_subject_trans,True,False,True,False,551,-31.95140266418457,-40.75523376464844,1
Every dancer cleaned the lights.,That rabbit cleaned the lights.,syntax,s-selection,animate_subject_trans,True,False,True,False,552,-40.04336929321289,-40.39739990234375,1
Eva fixed the carts.,That association fixed the carts.,syntax,s-selection,animate_subject_trans,True,False,True,False,553,-28.583892822265625,-41.979591369628906,1
Irene hadn't fled from Laurie.,This drawing hadn't fled from Laurie.,syntax,s-selection,animate_subject_trans,True,False,True,False,554,-52.00307846069336,-50.100738525390625,0
Every library respected Travis.,Every shirt respected Travis.,syntax,s-selection,animate_subject_trans,True,False,True,False,555,-41.76001739501953,-41.65072250366211,0
All doctors had respected Donna.,A lot of lakes had respected Donna.,syntax,s-selection,animate_subject_trans,True,False,True,False,556,-42.78525924682617,-57.37648010253906,1
Frank was attacking all waitresses.,The river was attacking all waitresses.,syntax,s-selection,animate_subject_trans,True,False,True,False,557,-43.065391540527344,-50.92646408081055,1
Sarah biked to these high schools.,Some casserole biked to these high schools.,syntax,s-selection,animate_subject_trans,True,False,True,False,558,-35.572471618652344,-53.26911926269531,1
Rebecca wasn't bringing some shirts.,Every fish wasn't bringing some shirts.,syntax,s-selection,animate_subject_trans,True,False,True,False,559,-46.17992401123047,-47.53861618041992,1
Karla discussed Caroline.,Every college campus discussed Caroline.,syntax,s-selection,animate_subject_trans,True,False,True,False,560,-35.262939453125,-43.36594772338867,1
Marcus researched all college campuses.,The cafe researched all college campuses.,syntax,s-selection,animate_subject_trans,True,False,True,False,561,-33.458736419677734,-48.96735382080078,1
Kristin went to these malls.,This essay went to these malls.,syntax,s-selection,animate_subject_trans,True,False,True,False,562,-32.65509033203125,-41.26376724243164,1
Tammy isn't biking to that closet.,The cake isn't biking to that closet.,syntax,s-selection,animate_subject_trans,True,False,True,False,563,-50.64426803588867,-52.394691467285156,1
Edward talked to a girl.,Every legislature talked to a girl.,syntax,s-selection,animate_subject_trans,True,False,True,False,564,-25.936744689941406,-38.98905944824219,1
Katherine won't watch Dan.,Every association won't watch Dan.,syntax,s-selection,animate_subject_trans,True,False,True,False,565,-38.4665412902832,-42.68531799316406,1
Emily had fired Tiffany.,Some movie had fired Tiffany.,syntax,s-selection,animate_subject_trans,True,False,True,False,566,-32.784278869628906,-42.71759033203125,1
This patient concealed this hamster.,That high school concealed this hamster.,syntax,s-selection,animate_subject_trans,True,False,True,False,567,-48.86445617675781,-48.38777160644531,0
Patrick revealed Monet.,Some banana revealed Monet.,syntax,s-selection,animate_subject_trans,True,False,True,False,568,-27.645570755004883,-43.548583984375,1
Amy was concealing Bethany.,That high school was concealing Bethany.,syntax,s-selection,animate_subject_trans,True,False,True,False,569,-33.93647003173828,-44.48526382446289,1
Valerie can research some book.,A wheelbarrow can research some book.,syntax,s-selection,animate_subject_trans,True,False,True,False,570,-49.171634674072266,-63.19451141357422,1
Holly helps the drivers.,A rug helps the drivers.,syntax,s-selection,animate_subject_trans,True,False,True,False,571,-35.6014289855957,-38.844970703125,1
Homer is fixing some car.,That window is fixing some car.,syntax,s-selection,animate_subject_trans,True,False,True,False,572,-45.17063522338867,-40.16987609863281,0
Ruth runs around every museum.,This glacier runs around every museum.,syntax,s-selection,animate_subject_trans,True,False,True,False,573,-47.09640884399414,-45.27387237548828,0
Colleen investigates Veronica.,Politics investigates Veronica.,syntax,s-selection,animate_subject_trans,True,False,True,False,574,-37.675323486328125,-29.56418800354004,0
Frank hasn't discussed Jodi.,This government hasn't discussed Jodi.,syntax,s-selection,animate_subject_trans,True,False,True,False,575,-38.123924255371094,-45.6452751159668,1
The drivers will talk to Jerry.,All museums will talk to Jerry.,syntax,s-selection,animate_subject_trans,True,False,True,False,576,-36.34169006347656,-39.131622314453125,1
Roger arrived at the public park.,The newspaper article arrived at the public park.,syntax,s-selection,animate_subject_trans,True,False,True,False,577,-29.45077896118164,-44.84083557128906,1
Judy hadn't cleaned a mall.,The mall hadn't cleaned a mall.,syntax,s-selection,animate_subject_trans,True,False,True,False,578,-45.598628997802734,-46.86351013183594,1
Emily was criticizing Michael.,This broccoli was criticizing Michael.,syntax,s-selection,animate_subject_trans,True,False,True,False,579,-27.917192459106445,-43.975914001464844,1
Jacqueline drove to a lot of mountains.,The art gallery drove to a lot of mountains.,syntax,s-selection,animate_subject_trans,True,False,True,False,580,-49.352481842041016,-49.34614562988281,0
Craig questions Bradley.,Every movie questions Bradley.,syntax,s-selection,animate_subject_trans,True,False,True,False,581,-27.66742706298828,-37.56084442138672,1
Carmen left Kayla.,Some skateboard left Kayla.,syntax,s-selection,animate_subject_trans,True,False,True,False,582,-42.16746520996094,-36.213096618652344,0
James questioned Lissa.,A committee questioned Lissa.,syntax,s-selection,animate_subject_trans,True,False,True,False,583,-35.22010040283203,-44.0765380859375,1
Janice watched Randolf.,This drawing watched Randolf.,syntax,s-selection,animate_subject_trans,True,False,True,False,584,-44.22511672973633,-49.18730926513672,1
Stacey didn't escape from Cynthia.,That glass didn't escape from Cynthia.,syntax,s-selection,animate_subject_trans,True,False,True,False,585,-41.51414108276367,-46.14215087890625,1
Gerald hadn't lifted this cart.,The truck hadn't lifted this cart.,syntax,s-selection,animate_subject_trans,True,False,True,False,586,-50.902061462402344,-48.47427749633789,0
Melanie breaks most glasses.,The shawl breaks most glasses.,syntax,s-selection,animate_subject_trans,True,False,True,False,587,-43.584983825683594,-49.05524826049805,1
Some organizations sold these sweaters.,All muffins sold these sweaters.,syntax,s-selection,animate_subject_trans,True,False,True,False,588,-37.691410064697266,-43.25116729736328,1
