sentence_good,sentence_bad,field,linguistics_term,UID,simple_LM_method,one_prefix_method,two_prefix_method,lexically_identical,pair_id,good_prob,bad_prob,correct
These teenagers weren't walking through Harvard University.,All organizations weren't walking through Harvard University.,syntax,s-selection,animate_subject_trans,True,False,True,False,589,-48.577388763427734,-51.437156677246094,1
Kathleen hadn't hired Keith.,Some glove hadn't hired Keith.,syntax,s-selection,animate_subject_trans,True,False,True,False,590,-44.0050163269043,-47.67744064331055,1
Linda has fixed all bikes.,Some gate has fixed all bikes.,syntax,s-selection,animate_subject_trans,True,False,True,False,591,-43.260406494140625,-46.11838150024414,1
Melinda hasn't sounded like Florence.,Some painting hasn't sounded like Florence.,syntax,s-selection,animate_subject_trans,True,False,True,False,592,-43.74232482910156,-49.138240814208984,1
April is talking to April.,Every essay is talking to April.,syntax,s-selection,animate_subject_trans,True,False,True,False,593,-29.02435302734375,-38.25164794921875,1
Irene had some glove.,Some spotlight had some glove.,syntax,s-selection,animate_subject_trans,True,False,True,False,594,-43.28594970703125,-41.34211730957031,0
Andrea is observing Pamela.,This lake is observing Pamela.,syntax,s-selection,animate_subject_trans,True,False,True,False,595,-41.151145935058594,-44.51311492919922,1
Carolyn fixed some carts.,Every bird fixed some carts.,syntax,s-selection,animate_subject_trans,True,False,True,False,596,-43.93497085571289,-45.76612854003906,1
Frank hasn't cured April.,Ice cream hasn't cured April.,syntax,s-selection,animate_subject_trans,True,False,True,False,597,-36.984153747558594,-44.21870040893555,1
Sally wasn't listening to Cheryl.,The dress wasn't listening to Cheryl.,syntax,s-selection,animate_subject_trans,True,False,True,False,598,-42.931068420410156,-39.627410888671875,0
Nancy hasn't approached Amelia.,Some mushroom hasn't approached Amelia.,syntax,s-selection,animate_subject_trans,True,False,True,False,599,-44.196990966796875,-48.12437438964844,1
Judy talks about Rose.,Some ladder talks about Rose.,syntax,s-selection,animate_subject_trans,True,False,True,False,600,-34.11824417114258,-42.874786376953125,1
Theresa wore those shawls.,The organization wore those shawls.,syntax,s-selection,animate_subject_trans,True,False,True,False,601,-49.198020935058594,-48.24235534667969,0
Theodore cures Christina.,Some broccoli cures Christina.,syntax,s-selection,animate_subject_trans,True,False,True,False,602,-40.84917449951172,-41.076534271240234,1
Christine hadn't talked to Helen.,Some painting hadn't talked to Helen.,syntax,s-selection,animate_subject_trans,True,False,True,False,603,-42.27775573730469,-43.71829605102539,1
Those pedestrians do take this library.,Most books do take this library.,syntax,s-selection,animate_subject_trans,True,False,True,False,604,-42.937477111816406,-39.21649169921875,0
Every guy watches this senator.,The ice watches this senator.,syntax,s-selection,animate_subject_trans,True,False,True,False,605,-40.15119934082031,-46.94816970825195,1
Cheryl was praising Larry.,That plate was praising Larry.,syntax,s-selection,animate_subject_trans,True,False,True,False,606,-49.411808013916016,-39.52094268798828,0
Rodney finds unicycles.,The dress finds unicycles.,syntax,s-selection,animate_subject_trans,True,False,True,False,607,-40.86975860595703,-41.911075592041016,1
Janet bikes to every school.,This window bikes to every school.,syntax,s-selection,animate_subject_trans,True,False,True,False,608,-43.210350036621094,-43.77498245239258,1
Theresa hadn't explored these libraries.,Some box hadn't explored these libraries.,syntax,s-selection,animate_subject_trans,True,False,True,False,609,-47.7742805480957,-44.48103332519531,0
Kayla shouldn't pass a lot of movie theaters.,Every public park shouldn't pass a lot of movie theaters.,syntax,s-selection,animate_subject_trans,True,False,True,False,610,-53.347564697265625,-59.98041915893555,1
Emily walks through the mall.,Every painting walks through the mall.,syntax,s-selection,animate_subject_trans,True,False,True,False,611,-25.531005859375,-36.66737365722656,1
Ellen notices all cakes.,A bicycle notices all cakes.,syntax,s-selection,animate_subject_trans,True,False,True,False,612,-35.89285659790039,-46.85285568237305,1
Anna might hug Tonya.,That steak might hug Tonya.,syntax,s-selection,animate_subject_trans,True,False,True,False,613,-35.538909912109375,-48.823150634765625,1
James wasn't cleaning some chicken.,That window wasn't cleaning some chicken.,syntax,s-selection,animate_subject_trans,True,False,True,False,614,-36.767967224121094,-47.811702728271484,1
Linda could know Holly.,Every bicycle could know Holly.,syntax,s-selection,animate_subject_trans,True,False,True,False,615,-38.95692443847656,-42.195953369140625,1
Raymond had cleaned the book.,This mirror had cleaned the book.,syntax,s-selection,animate_subject_trans,True,False,True,False,616,-42.735721588134766,-43.46778106689453,1
Donna was questioning Douglas.,The bank was questioning Douglas.,syntax,s-selection,animate_subject_trans,True,False,True,False,617,-40.270774841308594,-41.421173095703125,1
Irene hugs Tracy.,This hospital hugs Tracy.,syntax,s-selection,animate_subject_trans,True,False,True,False,618,-36.60313415527344,-35.98441696166992,0
Susan won't care for Adam.,Some fork won't care for Adam.,syntax,s-selection,animate_subject_trans,True,False,True,False,619,-29.83551788330078,-43.2506217956543,1
April visits Theodore.,Every sock visits Theodore.,syntax,s-selection,animate_subject_trans,True,False,True,False,620,-30.655597686767578,-43.349945068359375,1
Sara hadn't approached Janet.,This eggplant hadn't approached Janet.,syntax,s-selection,animate_subject_trans,True,False,True,False,621,-44.44485092163086,-50.03896713256836,1
Some drivers can't discuss Julie.,Some apples can't discuss Julie.,syntax,s-selection,animate_subject_trans,True,False,True,False,622,-43.729827880859375,-46.242271423339844,1
David hasn't complained about Bruce.,A mouth hasn't complained about Bruce.,syntax,s-selection,animate_subject_trans,True,False,True,False,623,-34.17469787597656,-46.320194244384766,1
Jill approaches Lawrence.,The truck approaches Lawrence.,syntax,s-selection,animate_subject_trans,True,False,True,False,624,-37.898841857910156,-39.275123596191406,1
The Clintons hid a high school.,Most cars hid a high school.,syntax,s-selection,animate_subject_trans,True,False,True,False,625,-39.75145721435547,-37.96610641479492,0
Meredith boycotted these college campuses.,The high school boycotted these college campuses.,syntax,s-selection,animate_subject_trans,True,False,True,False,626,-66.62374114990234,-60.0025634765625,0
The Impressionists have cared for George.,A lot of planes have cared for George.,syntax,s-selection,animate_subject_trans,True,False,True,False,627,-46.602996826171875,-50.24952697753906,1
Elaine sees John.,Science sees John.,syntax,s-selection,animate_subject_trans,True,False,True,False,628,-31.726600646972656,-23.476680755615234,0
Denise hadn't listened to the guys.,Every blouse hadn't listened to the guys.,syntax,s-selection,animate_subject_trans,True,False,True,False,629,-40.03626251220703,-48.11253356933594,1
Alan hadn't insulted a customer.,The spinach hadn't insulted a customer.,syntax,s-selection,animate_subject_trans,True,False,True,False,630,-37.67243957519531,-51.98316192626953,1
James lifts some truck.,Some glacier lifts some truck.,syntax,s-selection,animate_subject_trans,True,False,True,False,631,-31.791664123535156,-43.899566650390625,1
Caroline hasn't healed Gregory.,Every hamster hasn't healed Gregory.,syntax,s-selection,animate_subject_trans,True,False,True,False,632,-45.93312454223633,-50.9168586730957,1
Tamara does run around the libraries.,This pepper does run around the libraries.,syntax,s-selection,animate_subject_trans,True,False,True,False,633,-43.49563980102539,-49.74822998046875,1
Rebecca had talked to Sheila.,The sketch had talked to Sheila.,syntax,s-selection,animate_subject_trans,True,False,True,False,634,-36.63613510131836,-42.501182556152344,1
Curtis approached Wendy.,Some college campus approached Wendy.,syntax,s-selection,animate_subject_trans,True,False,True,False,635,-38.77711868286133,-38.28977966308594,0
The patients have worked with Walter.,Spotlights have worked with Walter.,syntax,s-selection,animate_subject_trans,True,False,True,False,636,-37.10307312011719,-40.75286865234375,1
Stacy was arriving at many libraries.,A book was arriving at many libraries.,syntax,s-selection,animate_subject_trans,True,False,True,False,637,-42.27238845825195,-44.750221252441406,1
Leslie has observed Kenneth.,That shoe has observed Kenneth.,syntax,s-selection,animate_subject_trans,True,False,True,False,638,-41.142242431640625,-44.2042350769043,1
Sally doesn't reference John.,Science doesn't reference John.,syntax,s-selection,animate_subject_trans,True,False,True,False,639,-44.833988189697266,-34.55290985107422,0
Every patient should know Brian.,That cat should know Brian.,syntax,s-selection,animate_subject_trans,True,False,True,False,640,-34.28349304199219,-37.68179702758789,1
Michael hadn't known Samuel.,A cat hadn't known Samuel.,syntax,s-selection,animate_subject_trans,True,False,True,False,641,-32.808616638183594,-41.767791748046875,1
David hasn't known this child.,A high school hasn't known this child.,syntax,s-selection,animate_subject_trans,True,False,True,False,642,-33.65506362915039,-41.00830841064453,1
Jerry hid many turtles.,The couch hid many turtles.,syntax,s-selection,animate_subject_trans,True,False,True,False,643,-33.68524169921875,-44.55344009399414,1
Many women fled from Matt.,Tomatoes fled from Matt.,syntax,s-selection,animate_subject_trans,True,False,True,False,644,-35.92741012573242,-41.15138626098633,1
A waiter praised Rachelle.,The box praised Rachelle.,syntax,s-selection,animate_subject_trans,True,False,True,False,645,-40.02315139770508,-39.62193298339844,0
These men can't hate Lawrence.,Some shoes can't hate Lawrence.,syntax,s-selection,animate_subject_trans,True,False,True,False,646,-40.7564582824707,-45.15786361694336,1
Caroline remembers most lakes.,A rabbit remembers most lakes.,syntax,s-selection,animate_subject_trans,True,False,True,False,647,-43.5902099609375,-45.5567741394043,1
Some senators fired Carl.,Those mushrooms fired Carl.,syntax,s-selection,animate_subject_trans,True,False,True,False,648,-34.87803268432617,-40.53676223754883,1
Kimberley cared for Anne.,The ice cream cared for Anne.,syntax,s-selection,animate_subject_trans,True,False,True,False,649,-38.279945373535156,-40.65361785888672,1
Thomas attacks Todd.,Some company attacks Todd.,syntax,s-selection,animate_subject_trans,True,False,True,False,650,-26.75684356689453,-36.9931640625,1
Bruce has cleaned this truck.,That mall has cleaned this truck.,syntax,s-selection,animate_subject_trans,True,False,True,False,651,-28.492467880249023,-42.365699768066406,1
A waitress has broken some vases.,The truck has broken some vases.,syntax,s-selection,animate_subject_trans,True,False,True,False,652,-46.00849914550781,-41.451988220214844,0
Jesus hires Clyde.,Every cart hires Clyde.,syntax,s-selection,animate_subject_trans,True,False,True,False,653,-29.997447967529297,-41.76506042480469,1
Paul did watch Peter.,Some chicken did watch Peter.,syntax,s-selection,animate_subject_trans,True,False,True,False,654,-29.747472763061523,-42.887123107910156,1
Christopher didn't talk about Vanessa.,Some rice didn't talk about Vanessa.,syntax,s-selection,animate_subject_trans,True,False,True,False,655,-30.504281997680664,-42.52619171142578,1
Edward is going to this high school.,That pork is going to this high school.,syntax,s-selection,animate_subject_trans,True,False,True,False,656,-29.416996002197266,-39.782386779785156,1
Ann didn't care for David.,Literature didn't care for David.,syntax,s-selection,animate_subject_trans,True,False,True,False,657,-29.42697525024414,-40.406761169433594,1
Tonya isn't curing Barbara.,This sketch isn't curing Barbara.,syntax,s-selection,animate_subject_trans,True,False,True,False,658,-44.78192138671875,-48.01746368408203,1
Matt had taken the cup.,Every wheelbarrow had taken the cup.,syntax,s-selection,animate_subject_trans,True,False,True,False,659,-23.606002807617188,-50.965946197509766,1
Vincent hasn't researched a lot of books.,Some library hasn't researched a lot of books.,syntax,s-selection,animate_subject_trans,True,False,True,False,660,-46.880332946777344,-44.831443786621094,0
Martha hasn't fixed most unicycles.,Travel hasn't fixed most unicycles.,syntax,s-selection,animate_subject_trans,True,False,True,False,661,-56.03721618652344,-50.909358978271484,0
Leslie noticed Omar.,The face noticed Omar.,syntax,s-selection,animate_subject_trans,True,False,True,False,662,-36.220558166503906,-34.50693130493164,0
Brenda is escaping from all lakes.,That plane is escaping from all lakes.,syntax,s-selection,animate_subject_trans,True,False,True,False,663,-42.27172088623047,-43.906890869140625,1
Benjamin was going to the Great Lakes.,Some high school was going to the Great Lakes.,syntax,s-selection,animate_subject_trans,True,False,True,False,664,-43.15891647338867,-38.92544937133789,0
Bruce was talking to Samantha.,The window was talking to Samantha.,syntax,s-selection,animate_subject_trans,True,False,True,False,665,-25.128421783447266,-39.380531311035156,1
Michelle observes Gregory.,That mirror observes Gregory.,syntax,s-selection,animate_subject_trans,True,False,True,False,666,-29.043617248535156,-41.19263458251953,1
Stacy had appreciated Colleen.,Some glove had appreciated Colleen.,syntax,s-selection,animate_subject_trans,True,False,True,False,667,-40.27629470825195,-51.36583709716797,1
Holly isn't cleaning a lot of restaurants.,That popsicle isn't cleaning a lot of restaurants.,syntax,s-selection,animate_subject_trans,True,False,True,False,668,-46.84178161621094,-54.75791931152344,1
Caroline isn't thinking about Cindy.,This ice cream isn't thinking about Cindy.,syntax,s-selection,animate_subject_trans,True,False,True,False,669,-43.37710952758789,-45.492210388183594,1
This patient hasn't boycotted the organization.,The mall hasn't boycotted the organization.,syntax,s-selection,animate_subject_trans,True,False,True,False,670,-66.30352020263672,-67.5937728881836,1
Katherine disliked some libraries.,This screen disliked some libraries.,syntax,s-selection,animate_subject_trans,True,False,True,False,671,-43.69477081298828,-41.92445755004883,0
Most doctors had some water.,Those glasses had some water.,syntax,s-selection,animate_subject_trans,True,False,True,False,672,-32.936180114746094,-33.20438003540039,1
Randolf referenced Travis.,That shoe referenced Travis.,syntax,s-selection,animate_subject_trans,True,False,True,False,673,-41.47810363769531,-42.418235778808594,1
Harvard University hasn't bought the muffins.,Some bike hasn't bought the muffins.,syntax,s-selection,animate_subject_trans,True,False,True,False,674,-52.50102233886719,-47.46467590332031,0
Some waitress is healing Carmen.,That broccoli is healing Carmen.,syntax,s-selection,animate_subject_trans,True,False,True,False,675,-45.82854461669922,-44.44252395629883,0
Mitchell hasn't investigated many dancers.,That lamp hasn't investigated many dancers.,syntax,s-selection,animate_subject_trans,True,False,True,False,676,-53.5169677734375,-55.64558029174805,1
A lot of patients haven't hired Jessica.,A lot of bicycles haven't hired Jessica.,syntax,s-selection,animate_subject_trans,True,False,True,False,677,-48.839080810546875,-53.61719512939453,1
Dana can attack Aaron.,A dress can attack Aaron.,syntax,s-selection,animate_subject_trans,True,False,True,False,678,-40.93540954589844,-41.26335525512695,1
Amelia hadn't escaped from Daniel.,The steak hadn't escaped from Daniel.,syntax,s-selection,animate_subject_trans,True,False,True,False,679,-44.06489181518555,-47.29576110839844,1
Tara discussed Christopher.,Some sock discussed Christopher.,syntax,s-selection,animate_subject_trans,True,False,True,False,680,-38.58971405029297,-43.45374298095703,1
Carmen skates around a lot of banks.,Every fish skates around a lot of banks.,syntax,s-selection,animate_subject_trans,True,False,True,False,681,-59.732112884521484,-52.950592041015625,0
Jeffrey fires Bradley.,Spain fires Bradley.,syntax,s-selection,animate_subject_trans,True,False,True,False,682,-39.61671829223633,-31.138891220092773,0
Bradley isn't hiring Joel.,Some candle isn't hiring Joel.,syntax,s-selection,animate_subject_trans,True,False,True,False,683,-41.69175720214844,-50.07159423828125,1
This guest watches Bradley.,Every museum watches Bradley.,syntax,s-selection,animate_subject_trans,True,False,True,False,684,-38.71288299560547,-38.248329162597656,0
Kevin doesn't mess up many shoes.,Some restaurant doesn't mess up many shoes.,syntax,s-selection,animate_subject_trans,True,False,True,False,685,-37.36492156982422,-45.56493377685547,1
That committee did fire Gina.,That ice cream did fire Gina.,syntax,s-selection,animate_subject_trans,True,False,True,False,686,-45.63161849975586,-46.21371078491211,1
Alicia is exiting those art galleries.,That movie is exiting those art galleries.,syntax,s-selection,animate_subject_trans,True,False,True,False,687,-59.71955490112305,-48.30226516723633,0
Susan is criticizing Dawn.,The sock is criticizing Dawn.,syntax,s-selection,animate_subject_trans,True,False,True,False,688,-28.278045654296875,-42.791175842285156,1
Charles would kiss Renee.,The plane would kiss Renee.,syntax,s-selection,animate_subject_trans,True,False,True,False,689,-35.827903747558594,-47.99348068237305,1
Benjamin was describing Charles.,That light was describing Charles.,syntax,s-selection,animate_subject_trans,True,False,True,False,690,-40.60251998901367,-35.97505187988281,0
Vanessa drops by those rivers.,Some wheelbarrow drops by those rivers.,syntax,s-selection,animate_subject_trans,True,False,True,False,691,-49.63172912597656,-60.26384735107422,1
This teacher praises Edward.,The water praises Edward.,syntax,s-selection,animate_subject_trans,True,False,True,False,692,-35.60089111328125,-36.994056701660156,1
Tiffany knew Mary.,Some window knew Mary.,syntax,s-selection,animate_subject_trans,True,False,True,False,693,-38.81574249267578,-34.281898498535156,0
Heidi hadn't admired Samuel.,This couch hadn't admired Samuel.,syntax,s-selection,animate_subject_trans,True,False,True,False,694,-45.40126419067383,-49.164241790771484,1
Travis wasn't referencing Natalie.,Every mall wasn't referencing Natalie.,syntax,s-selection,animate_subject_trans,True,False,True,False,695,-46.32914733886719,-49.076961517333984,1
Every customer hasn't described Scott.,A chair hasn't described Scott.,syntax,s-selection,animate_subject_trans,True,False,True,False,696,-39.730552673339844,-44.65138626098633,1
Elaine can't remember Lawrence.,The newspaper article can't remember Lawrence.,syntax,s-selection,animate_subject_trans,True,False,True,False,697,-43.348426818847656,-50.21470642089844,1
David hasn't talked about every commentary.,The movie hasn't talked about every commentary.,syntax,s-selection,animate_subject_trans,True,False,True,False,698,-39.99957275390625,-47.65524673461914,1
Tonya escapes from Christopher.,This dog escapes from Christopher.,syntax,s-selection,animate_subject_trans,True,False,True,False,699,-39.119781494140625,-38.4677848815918,0
Sonia knows Laura.,Every turtle knows Laura.,syntax,s-selection,animate_subject_trans,True,False,True,False,700,-35.3414192199707,-33.44271469116211,0
Dan dropped by some mountain.,The sock dropped by some mountain.,syntax,s-selection,animate_subject_trans,True,False,True,False,701,-34.58552932739258,-45.40991973876953,1
These actresses aren't kissing Eva.,All socks aren't kissing Eva.,syntax,s-selection,animate_subject_trans,True,False,True,False,702,-45.11069869995117,-46.62826919555664,1
Wendy wasn't messing up every rug.,Travel wasn't messing up every rug.,syntax,s-selection,animate_subject_trans,True,False,True,False,703,-53.58430862426758,-43.8485221862793,0
Gregory argued about Deanna.,Some report argued about Deanna.,syntax,s-selection,animate_subject_trans,True,False,True,False,704,-45.340980529785156,-45.52602767944336,1
Patrick had passed a mountain.,The scarf had passed a mountain.,syntax,s-selection,animate_subject_trans,True,False,True,False,705,-27.77714729309082,-39.46634292602539,1
April investigated those boys.,A hamster investigated those boys.,syntax,s-selection,animate_subject_trans,True,False,True,False,706,-32.833229064941406,-47.39461898803711,1
Kendra didn't clean that mouth.,That eye didn't clean that mouth.,syntax,s-selection,animate_subject_trans,True,False,True,False,707,-49.55500793457031,-44.57261657714844,0
Nina referenced Marcus.,Every report referenced Marcus.,syntax,s-selection,animate_subject_trans,True,False,True,False,708,-34.50963592529297,-39.2069091796875,1
Deborah arrives at this cafe.,Ice cream arrives at this cafe.,syntax,s-selection,animate_subject_trans,True,False,True,False,709,-37.79554748535156,-37.53717803955078,0
All legislatures sold a shoe.,Many art galleries sold a shoe.,syntax,s-selection,animate_subject_trans,True,False,True,False,710,-39.76210021972656,-40.989097595214844,1
Waiters don't skate around Spain.,The drawings don't skate around Spain.,syntax,s-selection,animate_subject_trans,True,False,True,False,711,-44.062355041503906,-50.69943618774414,1
Samantha would take the sock.,Some pasta would take the sock.,syntax,s-selection,animate_subject_trans,True,False,True,False,712,-45.51902770996094,-41.249359130859375,0
Jodi shouldn't arrive at every library.,The shirt shouldn't arrive at every library.,syntax,s-selection,animate_subject_trans,True,False,True,False,713,-52.87371063232422,-51.27064514160156,0
David discovered this ice cream.,Every hospital discovered this ice cream.,syntax,s-selection,animate_subject_trans,True,False,True,False,714,-26.87665557861328,-38.46437072753906,1
Brad hadn't worn the coat.,A hamster hadn't worn the coat.,syntax,s-selection,animate_subject_trans,True,False,True,False,715,-30.974164962768555,-47.027427673339844,1
John was wearing every shawl.,This wheelbarrow was wearing every shawl.,syntax,s-selection,animate_subject_trans,True,False,True,False,716,-39.50693893432617,-64.41658782958984,1
Matt skates around that high school.,Some computer skates around that high school.,syntax,s-selection,animate_subject_trans,True,False,True,False,717,-42.71638488769531,-49.7388916015625,1
Patricia sold some apples.,That dish sold some apples.,syntax,s-selection,animate_subject_trans,True,False,True,False,718,-36.29216766357422,-36.91863250732422,1
The Lutherans weren't kissing Marie.,A lot of dishes weren't kissing Marie.,syntax,s-selection,animate_subject_trans,True,False,True,False,719,-58.27587127685547,-54.06101989746094,0
Mary hasn't revealed some computers.,The screen hasn't revealed some computers.,syntax,s-selection,animate_subject_trans,True,False,True,False,720,-38.460880279541016,-43.83213806152344,1
The student sounds like Cheryl.,Every wheelbarrow sounds like Cheryl.,syntax,s-selection,animate_subject_trans,True,False,True,False,721,-33.93185806274414,-50.404850006103516,1
Michelle researched these newspaper articles.,Politics researched these newspaper articles.,syntax,s-selection,animate_subject_trans,True,False,True,False,722,-31.956981658935547,-33.84221649169922,1
John wouldn't approach Carrie.,The couch wouldn't approach Carrie.,syntax,s-selection,animate_subject_trans,True,False,True,False,723,-36.56910705566406,-46.193138122558594,1
Amelia was walking through some art gallery.,The hair was walking through some art gallery.,syntax,s-selection,animate_subject_trans,True,False,True,False,724,-48.29420471191406,-48.822357177734375,1
The pedestrian brought those art galleries.,A turtle brought those art galleries.,syntax,s-selection,animate_subject_trans,True,False,True,False,725,-47.048187255859375,-45.72673034667969,0
A lot of senators weren't fleeing from Leslie.,Some rugs weren't fleeing from Leslie.,syntax,s-selection,animate_subject_trans,True,False,True,False,726,-58.83074951171875,-51.60212326049805,0
This cashier does clean every cup.,That eggplant does clean every cup.,syntax,s-selection,animate_subject_trans,True,False,True,False,727,-49.043663024902344,-47.20198440551758,0
Carolyn hadn't respected Heidi.,Some vase hadn't respected Heidi.,syntax,s-selection,animate_subject_trans,True,False,True,False,728,-47.51444625854492,-56.37733459472656,1
Most governments do talk about Ellen.,Some cakes do talk about Ellen.,syntax,s-selection,animate_subject_trans,True,False,True,False,729,-44.456459045410156,-45.40545654296875,1
Julia cleans most movie theaters.,The door cleans most movie theaters.,syntax,s-selection,animate_subject_trans,True,False,True,False,730,-47.11536407470703,-51.76441192626953,1
Nina couldn't escape from Christina.,A book couldn't escape from Christina.,syntax,s-selection,animate_subject_trans,True,False,True,False,731,-40.875213623046875,-43.073612213134766,1
A library had helped Melanie.,The broccoli had helped Melanie.,syntax,s-selection,animate_subject_trans,True,False,True,False,732,-39.26152801513672,-43.396690368652344,1
Richard was kissing Candice.,Some school was kissing Candice.,syntax,s-selection,animate_subject_trans,True,False,True,False,733,-34.18307113647461,-40.95441818237305,1
Russell was arguing about many books.,A spotlight was arguing about many books.,syntax,s-selection,animate_subject_trans,True,False,True,False,734,-34.86552047729492,-47.058536529541016,1
Omar isn't examining some book.,Some apple isn't examining some book.,syntax,s-selection,animate_subject_trans,True,False,True,False,735,-49.674407958984375,-46.56488800048828,0
Pamela might wear all blouses.,A pepper might wear all blouses.,syntax,s-selection,animate_subject_trans,True,False,True,False,736,-51.73027420043945,-51.4855842590332,0
