sentence_good,sentence_bad,field,linguistics_term,UID,simple_LM_method,one_prefix_method,two_prefix_method,lexically_identical,pair_id,good_prob,bad_prob,correct
Who have those men revealed they helped?,Who have those men revealed who helped?,syntax,island_effects,wh_island,True,True,False,False,0,-53.359893798828125,-55.303829193115234,1
Who isn't Craig realizing he kisses?,Who isn't Craig realizing who kisses?,syntax,island_effects,wh_island,True,True,False,False,1,-56.10863494873047,-59.25723648071289,1
Who are those associations discovering they saw?,Who are those associations discovering who saw?,syntax,island_effects,wh_island,True,True,False,False,2,-54.204795837402344,-56.4918212890625,1
What wasn't Nicole discovering she climbed down?,What wasn't Nicole discovering who climbed down?,syntax,island_effects,wh_island,True,True,False,False,3,-62.73106384277344,-64.12530517578125,1
What could Alan discover he has run around?,What could Alan discover who has run around?,syntax,island_effects,wh_island,True,True,False,False,4,-57.24624252319336,-55.99663543701172,0
Who shouldn't Andrew find out he was embarrassing?,Who shouldn't Andrew find out what was embarrassing?,syntax,island_effects,wh_island,True,True,False,False,5,-61.04292297363281,-57.925113677978516,0
What was this woman revealing she would examine?,What was this woman revealing who would examine?,syntax,island_effects,wh_island,True,True,False,False,6,-55.906124114990234,-58.501487731933594,1
What didn't Edward conceal he hasn't noticed?,What didn't Edward conceal who hasn't noticed?,syntax,island_effects,wh_island,True,True,False,False,7,-65.53594970703125,-65.92130279541016,1
Who hadn't Tanya known she hadn't visited?,Who hadn't Tanya known who hadn't visited?,syntax,island_effects,wh_island,True,True,False,False,8,-62.497955322265625,-64.30355834960938,1
Who wasn't Teresa forgetting she sees?,Who wasn't Teresa forgetting who sees?,syntax,island_effects,wh_island,True,True,False,False,9,-56.19226837158203,-61.87428665161133,1
Who can't Douglas realize he had investigated?,Who can't Douglas realize who had investigated?,syntax,island_effects,wh_island,True,True,False,False,10,-62.69316864013672,-65.5833969116211,1
What had the museums learned they weren't skated around?,What had the museums learned who weren't skated around?,syntax,island_effects,wh_island,True,True,False,False,11,-69.45413208007812,-72.79185485839844,1
Who haven't these associations discovered they could annoy?,Who haven't these associations discovered what could annoy?,syntax,island_effects,wh_island,True,True,False,False,12,-65.40021514892578,-68.30049896240234,1
Who can't some universities forget they aggravated?,Who can't some universities forget what aggravated?,syntax,island_effects,wh_island,True,True,False,False,13,-70.20079040527344,-68.9311752319336,0
What shouldn't these guys remember they are climbing down?,What shouldn't these guys remember what are climbing down?,syntax,island_effects,wh_island,True,True,False,False,14,-54.805694580078125,-55.99077224731445,1
Who shouldn't Janet know she doesn't reveal?,Who shouldn't Janet know who doesn't reveal?,syntax,island_effects,wh_island,True,True,False,False,15,-57.16677474975586,-59.94645690917969,1
What is Connie remembering she can't see?,What is Connie remembering who can't see?,syntax,island_effects,wh_island,True,True,False,False,16,-49.217159271240234,-51.610233306884766,1
What was this actor figuring out she is scanning?,What was this actor figuring out who is scanning?,syntax,island_effects,wh_island,True,True,False,False,17,-63.10917663574219,-59.60016632080078,0
What isn't Dawn revealing she couldn't complain about?,What isn't Dawn revealing who couldn't complain about?,syntax,island_effects,wh_island,True,True,False,False,18,-62.69119644165039,-63.107872009277344,1
Who couldn't Helen conceal she shouldn't leave?,Who couldn't Helen conceal who shouldn't leave?,syntax,island_effects,wh_island,True,True,False,False,19,-67.09706115722656,-69.1480712890625,1
What hadn't Pamela investigated she admired?,What hadn't Pamela investigated who admired?,syntax,island_effects,wh_island,True,True,False,False,20,-63.77297592163086,-66.66800689697266,1
Who wasn't Margaret figuring out she questioned?,Who wasn't Margaret figuring out who questioned?,syntax,island_effects,wh_island,True,True,False,False,21,-58.91633605957031,-58.58675765991211,0
Who would that senator realize she was listening to?,Who would that senator realize who was listening to?,syntax,island_effects,wh_island,True,True,False,False,22,-61.996192932128906,-64.6009521484375,1
Who should Rhonda find out she hugs?,Who should Rhonda find out who hugs?,syntax,island_effects,wh_island,True,True,False,False,23,-63.35836410522461,-60.10053634643555,0
What isn't Keith remembering he hasn't cleaned?,What isn't Keith remembering who hasn't cleaned?,syntax,island_effects,wh_island,True,True,False,False,24,-61.76285171508789,-63.36026382446289,1
Who hasn't Ann known she works with?,Who hasn't Ann known who works with?,syntax,island_effects,wh_island,True,True,False,False,25,-56.96106719970703,-58.15330505371094,1
What was Candice finding out she will mess up?,What was Candice finding out who will mess up?,syntax,island_effects,wh_island,True,True,False,False,26,-65.10331726074219,-62.28523635864258,0
What was Linda concealing she hadn't fixed?,What was Linda concealing who hadn't fixed?,syntax,island_effects,wh_island,True,True,False,False,27,-64.57400512695312,-65.74508666992188,1
Who were the boys revealing they wouldn't impress?,Who were the boys revealing who wouldn't impress?,syntax,island_effects,wh_island,True,True,False,False,28,-56.989871978759766,-58.40340805053711,1
Who hasn't Emily known she won't forget?,Who hasn't Emily known who won't forget?,syntax,island_effects,wh_island,True,True,False,False,29,-58.420162200927734,-61.008331298828125,1
What could Amelia figure out she has left?,What could Amelia figure out who has left?,syntax,island_effects,wh_island,True,True,False,False,30,-51.889686584472656,-52.8082275390625,1
Who won't Barbara investigate she had stunned?,Who won't Barbara investigate what had stunned?,syntax,island_effects,wh_island,True,True,False,False,31,-66.71256256103516,-70.28358459472656,1
Who wouldn't Randolf learn he revealed?,Who wouldn't Randolf learn who revealed?,syntax,island_effects,wh_island,True,True,False,False,32,-68.8625717163086,-70.1800537109375,1
Who does Chad remember he did talk to?,Who does Chad remember who did talk to?,syntax,island_effects,wh_island,True,True,False,False,33,-60.81830596923828,-62.40458297729492,1
Who hadn't Deborah revealed she can scare?,Who hadn't Deborah revealed what can scare?,syntax,island_effects,wh_island,True,True,False,False,34,-65.48899841308594,-65.69903564453125,1
What hadn't Victoria learned she runs around?,What hadn't Victoria learned who runs around?,syntax,island_effects,wh_island,True,True,False,False,35,-63.7391357421875,-63.973995208740234,1
Who is Caroline learning she should cure?,Who is Caroline learning who should cure?,syntax,island_effects,wh_island,True,True,False,False,36,-54.998130798339844,-58.4301872253418,1
What hasn't Eric discovered he is bringing?,What hasn't Eric discovered who is bringing?,syntax,island_effects,wh_island,True,True,False,False,37,-56.03379821777344,-57.855186462402344,1
What hasn't Carlos concealed he buys?,What hasn't Carlos concealed who buys?,syntax,island_effects,wh_island,True,True,False,False,38,-60.22492599487305,-62.09794616699219,1
What would Allison know she didn't drop by?,What would Allison know who didn't drop by?,syntax,island_effects,wh_island,True,True,False,False,39,-54.81753921508789,-57.63460922241211,1
Who hasn't Kristin learned she can care for?,Who hasn't Kristin learned who can care for?,syntax,island_effects,wh_island,True,True,False,False,40,-60.702491760253906,-63.42102813720703,1
Who had Eric found out he astounded?,Who had Eric found out who astounded?,syntax,island_effects,wh_island,True,True,False,False,41,-53.45684051513672,-54.07414627075195,1
What have a lot of cashiers concealed they found?,What have a lot of cashiers concealed who found?,syntax,island_effects,wh_island,True,True,False,False,42,-64.30095672607422,-68.88014221191406,1
What does Regina figure out she wasn't breaking?,What does Regina figure out who wasn't breaking?,syntax,island_effects,wh_island,True,True,False,False,43,-62.58844757080078,-64.81874084472656,1
What did Gregory investigate he couldn't walk through?,What did Gregory investigate who couldn't walk through?,syntax,island_effects,wh_island,True,True,False,False,44,-60.5887336730957,-62.59001541137695,1
What can't Diane find out she isn't wearing?,What can't Diane find out who isn't wearing?,syntax,island_effects,wh_island,True,True,False,False,45,-58.54326629638672,-58.32589340209961,0
What has Florence revealed she drops by?,What has Florence revealed who drops by?,syntax,island_effects,wh_island,True,True,False,False,46,-60.472015380859375,-63.505889892578125,1
What wasn't a teacher finding out she climbs down?,What wasn't a teacher finding out who climbs down?,syntax,island_effects,wh_island,True,True,False,False,47,-62.65532684326172,-60.02357482910156,0
Who doesn't Sarah learn she was attacking?,Who doesn't Sarah learn who was attacking?,syntax,island_effects,wh_island,True,True,False,False,48,-57.2349739074707,-60.1699333190918,1
Who wasn't Becca revealing she kisses?,Who wasn't Becca revealing who kisses?,syntax,island_effects,wh_island,True,True,False,False,49,-66.88233947753906,-65.23147583007812,0
Who couldn't many students forget they weren't concealing?,Who couldn't many students forget who weren't concealing?,syntax,island_effects,wh_island,True,True,False,False,50,-66.33090209960938,-67.88412475585938,1
What can Sandra figure out she can't notice?,What can Sandra figure out who can't notice?,syntax,island_effects,wh_island,True,True,False,False,51,-53.67559814453125,-55.59638214111328,1
Who does Lisa realize she hasn't aggravated?,Who does Lisa realize what hasn't aggravated?,syntax,island_effects,wh_island,True,True,False,False,52,-55.04288101196289,-60.48469543457031,1
Who has Linda forgotten she helps?,Who has Linda forgotten who helps?,syntax,island_effects,wh_island,True,True,False,False,53,-51.13529586791992,-53.20173645019531,1
What wasn't Mitchell figuring out he arrives at?,What wasn't Mitchell figuring out who arrives at?,syntax,island_effects,wh_island,True,True,False,False,54,-65.23039245605469,-63.185943603515625,0
What have these universities figured out they had disliked?,What have these universities figured out who had disliked?,syntax,island_effects,wh_island,True,True,False,False,55,-67.40062713623047,-69.02996826171875,1
Who would Martin remember he isn't impressing?,Who would Martin remember who isn't impressing?,syntax,island_effects,wh_island,True,True,False,False,56,-61.31627655029297,-63.0887336730957,1
Who could Vanessa remember she isn't curing?,Who could Vanessa remember who isn't curing?,syntax,island_effects,wh_island,True,True,False,False,57,-64.44343566894531,-67.80838775634766,1
Who is Emily revealing she isn't worrying?,Who is Emily revealing who isn't worrying?,syntax,island_effects,wh_island,True,True,False,False,58,-54.08382797241211,-56.146156311035156,1
Who hadn't Carla learned she wasn't investigating?,Who hadn't Carla learned who wasn't investigating?,syntax,island_effects,wh_island,True,True,False,False,59,-68.08304595947266,-73.01914978027344,1
What is Grace investigating she goes to?,What is Grace investigating who goes to?,syntax,island_effects,wh_island,True,True,False,False,60,-53.56248474121094,-52.09800720214844,0
Who don't the students realize they bores?,Who don't the students realize what bores?,syntax,island_effects,wh_island,True,True,False,False,61,-58.613372802734375,-59.90448760986328,1
Who could Kimberley learn she wouldn't confuse?,Who could Kimberley learn what wouldn't confuse?,syntax,island_effects,wh_island,True,True,False,False,62,-63.152591705322266,-62.47759246826172,0
Who is Rachel investigating she can listen to?,Who is Rachel investigating who can listen to?,syntax,island_effects,wh_island,True,True,False,False,63,-55.005584716796875,-54.75498962402344,0
Who can't Sharon investigate she scares?,Who can't Sharon investigate who scares?,syntax,island_effects,wh_island,True,True,False,False,64,-60.15704345703125,-60.997093200683594,1
What hasn't Melanie remembered she couldn't leave?,What hasn't Melanie remembered who couldn't leave?,syntax,island_effects,wh_island,True,True,False,False,65,-57.40455627441406,-60.377689361572266,1
What hasn't a person figured out he is skated around?,What hasn't a person figured out who is skated around?,syntax,island_effects,wh_island,True,True,False,False,66,-69.017822265625,-64.88494110107422,0
What had Rebecca forgotten she tours?,What had Rebecca forgotten who tours?,syntax,island_effects,wh_island,True,True,False,False,67,-55.01627731323242,-58.26490783691406,1
Who has some association investigated it hadn't hurt?,Who has some association investigated who hadn't hurt?,syntax,island_effects,wh_island,True,True,False,False,68,-66.21000671386719,-67.55909729003906,1
Who had Alexander realized he observes?,Who had Alexander realized who observes?,syntax,island_effects,wh_island,True,True,False,False,69,-52.574031829833984,-57.13813781738281,1
What can Rhonda forget she was buying?,What can Rhonda forget who was buying?,syntax,island_effects,wh_island,True,True,False,False,70,-60.299095153808594,-62.2796630859375,1
Who should Vanessa know she had aggravated?,Who should Vanessa know what had aggravated?,syntax,island_effects,wh_island,True,True,False,False,71,-60.94737243652344,-64.4013671875,1
What aren't the organizations investigating they had fixed?,What aren't the organizations investigating who had fixed?,syntax,island_effects,wh_island,True,True,False,False,72,-63.83618927001953,-62.9100341796875,0
Who has Sheila discovered she can bother?,Who has Sheila discovered who can bother?,syntax,island_effects,wh_island,True,True,False,False,73,-58.9029655456543,-62.08097839355469,1
What can't Rose realize she is cleaning?,What can't Rose realize who is cleaning?,syntax,island_effects,wh_island,True,True,False,False,74,-56.12886047363281,-57.85699462890625,1
Who was Harvard University investigating it upsets?,Who was Harvard University investigating what upsets?,syntax,island_effects,wh_island,True,True,False,False,75,-64.79451751708984,-64.4766616821289,0
Who hasn't Renee figured out she had confused?,Who hasn't Renee figured out what had confused?,syntax,island_effects,wh_island,True,True,False,False,76,-67.00361633300781,-68.13072204589844,1
What has Marcus known he sold?,What has Marcus known who sold?,syntax,island_effects,wh_island,True,True,False,False,77,-49.574058532714844,-51.336021423339844,1
Who had the company forgotten it bored?,Who had the company forgotten who bored?,syntax,island_effects,wh_island,True,True,False,False,78,-50.39072036743164,-52.135841369628906,1
What had hospitals investigated they are healing?,What had hospitals investigated who are healing?,syntax,island_effects,wh_island,True,True,False,False,79,-63.29261016845703,-62.20745849609375,0
Who wouldn't every boy conceal he doesn't attack?,Who wouldn't every boy conceal who doesn't attack?,syntax,island_effects,wh_island,True,True,False,False,80,-68.53057861328125,-69.01525115966797,1
What can't Jane know she arrived at?,What can't Jane know who arrived at?,syntax,island_effects,wh_island,True,True,False,False,81,-55.71696853637695,-56.47709274291992,1
What doesn't Jill find out she hasn't forgotten?,What doesn't Jill find out who hasn't forgotten?,syntax,island_effects,wh_island,True,True,False,False,82,-59.29045104980469,-58.492820739746094,0
Who were the Lutherans discovering they embarrasses?,Who were the Lutherans discovering what embarrasses?,syntax,island_effects,wh_island,True,True,False,False,83,-75.82449340820312,-72.16246032714844,0
What aren't many legislatures discovering they explored?,What aren't many legislatures discovering who explored?,syntax,island_effects,wh_island,True,True,False,False,84,-64.3598861694336,-66.57897186279297,1
Who can every girl reveal she wasn't discovering?,Who can every girl reveal who wasn't discovering?,syntax,island_effects,wh_island,True,True,False,False,85,-60.53445053100586,-63.17067337036133,1
Who aren't a lot of cashiers investigating they have irritated?,Who aren't a lot of cashiers investigating what have irritated?,syntax,island_effects,wh_island,True,True,False,False,86,-78.3586196899414,-79.20680236816406,1
Who wasn't Leslie investigating she hadn't hated?,Who wasn't Leslie investigating who hadn't hated?,syntax,island_effects,wh_island,True,True,False,False,87,-66.90707397460938,-68.26811981201172,1
Who didn't Mary learn she has listened to?,Who didn't Mary learn who has listened to?,syntax,island_effects,wh_island,True,True,False,False,88,-56.61973571777344,-57.418399810791016,1
Who has Laura realized she would argue about?,Who has Laura realized who would argue about?,syntax,island_effects,wh_island,True,True,False,False,89,-54.90938186645508,-60.921531677246094,1
What hadn't Brett investigated he researches?,What hadn't Brett investigated who researches?,syntax,island_effects,wh_island,True,True,False,False,90,-64.86531066894531,-67.34052276611328,1
What hasn't Jill found out she exited?,What hasn't Jill found out who exited?,syntax,island_effects,wh_island,True,True,False,False,91,-60.35692596435547,-60.403167724609375,1
What hasn't Maria revealed she ran around?,What hasn't Maria revealed who ran around?,syntax,island_effects,wh_island,True,True,False,False,92,-59.083274841308594,-61.82865524291992,1
Who was Melinda finding out she forgot?,Who was Melinda finding out who forgot?,syntax,island_effects,wh_island,True,True,False,False,93,-53.6424674987793,-56.33125305175781,1
Who isn't Colleen discovering she hasn't researched?,Who isn't Colleen discovering who hasn't researched?,syntax,island_effects,wh_island,True,True,False,False,94,-65.135986328125,-66.81245422363281,1
What was Janet concealing she will descend?,What was Janet concealing who will descend?,syntax,island_effects,wh_island,True,True,False,False,95,-64.90311431884766,-64.75764465332031,0
What had James figured out he is biking to?,What had James figured out who is biking to?,syntax,island_effects,wh_island,True,True,False,False,96,-66.09707641601562,-65.19252014160156,0
What hadn't William realized he isn't breaking?,What hadn't William realized what isn't breaking?,syntax,island_effects,wh_island,True,True,False,False,97,-63.21770477294922,-63.85717010498047,1
Who were the schools forgetting they could alarm?,Who were the schools forgetting who could alarm?,syntax,island_effects,wh_island,True,True,False,False,98,-61.478248596191406,-63.0732536315918,1
What has Amanda investigated she fixes?,What has Amanda investigated who fixes?,syntax,island_effects,wh_island,True,True,False,False,99,-59.88945388793945,-61.883567810058594,1
Who were the women concealing they stunned?,Who were the women concealing who stunned?,syntax,island_effects,wh_island,True,True,False,False,100,-60.774169921875,-59.77307891845703,0
Who had Sara found out she admires?,Who had Sara found out who admires?,syntax,island_effects,wh_island,True,True,False,False,101,-55.335811614990234,-56.71315002441406,1
What wasn't Andrea concealing she can conceal?,What wasn't Andrea concealing who can conceal?,syntax,island_effects,wh_island,True,True,False,False,102,-73.10212707519531,-74.31881713867188,1
Who wouldn't most adults discover they are helping?,Who wouldn't most adults discover who are helping?,syntax,island_effects,wh_island,True,True,False,False,103,-58.597373962402344,-58.387237548828125,0
Who is Matt discovering he has hugged?,Who is Matt discovering who has hugged?,syntax,island_effects,wh_island,True,True,False,False,104,-56.46973419189453,-55.61298751831055,0
Who has Brad concealed he hasn't upset?,Who has Brad concealed what hasn't upset?,syntax,island_effects,wh_island,True,True,False,False,105,-62.423583984375,-63.65719223022461,1
Who had Alice discovered she is confusing?,Who had Alice discovered who is confusing?,syntax,island_effects,wh_island,True,True,False,False,106,-52.913124084472656,-55.858009338378906,1
Who was Catherine figuring out she wouldn't annoy?,Who was Catherine figuring out what wouldn't annoy?,syntax,island_effects,wh_island,True,True,False,False,107,-60.53731155395508,-61.540489196777344,1
What has Clyde remembered he appreciates?,What has Clyde remembered who appreciates?,syntax,island_effects,wh_island,True,True,False,False,108,-56.209197998046875,-56.269466400146484,1
Who wouldn't Suzanne conceal she isn't revealing?,Who wouldn't Suzanne conceal who isn't revealing?,syntax,island_effects,wh_island,True,True,False,False,109,-66.3551025390625,-66.5573501586914,1
What should Robert figure out he ascended?,What should Robert figure out what ascended?,syntax,island_effects,wh_island,True,True,False,False,110,-57.14408874511719,-56.25684356689453,0
Who has Russell found out he embarrassed?,Who has Russell found out who embarrassed?,syntax,island_effects,wh_island,True,True,False,False,111,-56.84992218017578,-58.075496673583984,1
What might Raymond realize he hasn't driven to?,What might Raymond realize who hasn't driven to?,syntax,island_effects,wh_island,True,True,False,False,112,-64.06037139892578,-67.27914428710938,1
What could Tammy investigate she explores?,What could Tammy investigate who explores?,syntax,island_effects,wh_island,True,True,False,False,113,-53.291385650634766,-55.456787109375,1
Who isn't Janice concealing she should return to?,Who isn't Janice concealing who should return to?,syntax,island_effects,wh_island,True,True,False,False,114,-70.03363037109375,-68.63773345947266,0
Who is Meredith learning she can't upset?,Who is Meredith learning who can't upset?,syntax,island_effects,wh_island,True,True,False,False,115,-56.02672576904297,-57.940452575683594,1
Who wasn't Irene discovering she had returned to?,Who wasn't Irene discovering who had returned to?,syntax,island_effects,wh_island,True,True,False,False,116,-65.09715270996094,-62.861167907714844,0
Who has Sheila realized she aggravated?,Who has Sheila realized who aggravated?,syntax,island_effects,wh_island,True,True,False,False,117,-57.44241714477539,-62.48936462402344,1
Who hasn't Samuel found out he isn't firing?,Who hasn't Samuel found out who isn't firing?,syntax,island_effects,wh_island,True,True,False,False,118,-66.01588439941406,-67.26293182373047,1
Who had the legislatures learned they won't watch?,Who had the legislatures learned who won't watch?,syntax,island_effects,wh_island,True,True,False,False,119,-62.9433479309082,-67.15816497802734,1
Who have some museums forgotten they had discovered?,Who have some museums forgotten who had discovered?,syntax,island_effects,wh_island,True,True,False,False,120,-60.582611083984375,-62.25567626953125,1
What doesn't Brett figure out he leaves?,What doesn't Brett figure out who leaves?,syntax,island_effects,wh_island,True,True,False,False,121,-54.80281066894531,-54.57395935058594,0
Who haven't students learned they aren't alarming?,Who haven't students learned who aren't alarming?,syntax,island_effects,wh_island,True,True,False,False,122,-58.894962310791016,-60.921058654785156,1
Who isn't John forgetting he is thinking about?,Who isn't John forgetting who is thinking about?,syntax,island_effects,wh_island,True,True,False,False,123,-53.538604736328125,-55.0338020324707,1
Who is Carl discovering he hadn't talked to?,Who is Carl discovering who hadn't talked to?,syntax,island_effects,wh_island,True,True,False,False,124,-59.762245178222656,-59.82360076904297,1
Who wasn't Eric realizing he bored?,Who wasn't Eric realizing what bored?,syntax,island_effects,wh_island,True,True,False,False,125,-52.29081726074219,-56.671966552734375,1
Who could Curtis forget he has bothered?,Who could Curtis forget who has bothered?,syntax,island_effects,wh_island,True,True,False,False,126,-58.81568908691406,-60.4719123840332,1
Who is Janice learning she hadn't observed?,Who is Janice learning who hadn't observed?,syntax,island_effects,wh_island,True,True,False,False,127,-60.58892059326172,-62.895782470703125,1
Who had every waitress revealed she was alarming?,Who had every waitress revealed who was alarming?,syntax,island_effects,wh_island,True,True,False,False,128,-59.9510612487793,-64.70584106445312,1
What hadn't Rachel revealed she would discover?,What hadn't Rachel revealed who would discover?,syntax,island_effects,wh_island,True,True,False,False,129,-59.89930725097656,-64.99549865722656,1
Who haven't many cashiers found out they did dislike?,Who haven't many cashiers found out who did dislike?,syntax,island_effects,wh_island,True,True,False,False,130,-76.0140609741211,-77.36727905273438,1
Who couldn't Tiffany forget she had annoyed?,Who couldn't Tiffany forget what had annoyed?,syntax,island_effects,wh_island,True,True,False,False,131,-60.58771896362305,-66.23526000976562,1
What has Elaine figured out she leaves?,What has Elaine figured out who leaves?,syntax,island_effects,wh_island,True,True,False,False,132,-51.45417022705078,-52.75236511230469,1
What was Nicole learning she had found?,What was Nicole learning who had found?,syntax,island_effects,wh_island,True,True,False,False,133,-49.429222106933594,-53.360782623291016,1
Who should Melinda forget she has attacked?,Who should Melinda forget who has attacked?,syntax,island_effects,wh_island,True,True,False,False,134,-59.948787689208984,-63.95166778564453,1
Who is Valerie figuring out she has helped?,Who is Valerie figuring out who has helped?,syntax,island_effects,wh_island,True,True,False,False,135,-54.757110595703125,-52.983787536621094,0
