sentence_good,sentence_bad,field,linguistics_term,UID,simple_LM_method,one_prefix_method,two_prefix_method,lexically_identical,pair_id,good_prob,bad_prob,correct
Who wouldn't James conceal he approached?,Who wouldn't James conceal who approached?,syntax,island_effects,wh_island,True,True,False,False,679,-56.87561798095703,-58.234100341796875,1
What hadn't Laura forgotten she went to?,What hadn't Laura forgotten who went to?,syntax,island_effects,wh_island,True,True,False,False,680,-54.189170837402344,-55.90790557861328,1
Who hasn't Sabrina found out she did fire?,Who hasn't Sabrina found out who did fire?,syntax,island_effects,wh_island,True,True,False,False,681,-67.44609832763672,-68.56538391113281,1
Who hadn't Samantha figured out she alarmed?,Who hadn't Samantha figured out who alarmed?,syntax,island_effects,wh_island,True,True,False,False,682,-61.619285583496094,-63.536590576171875,1
What has Lissa learned she dislikes?,What has Lissa learned who dislikes?,syntax,island_effects,wh_island,True,True,False,False,683,-64.39656829833984,-67.29972076416016,1
Who is Margaret remembering she isn't shocking?,Who is Margaret remembering what isn't shocking?,syntax,island_effects,wh_island,True,True,False,False,684,-55.733551025390625,-55.602264404296875,0
What might Emily remember she hadn't healed?,What might Emily remember who hadn't healed?,syntax,island_effects,wh_island,True,True,False,False,685,-55.690975189208984,-59.55323028564453,1
What weren't the Borgias learning they hadn't bought?,What weren't the Borgias learning who hadn't bought?,syntax,island_effects,wh_island,True,True,False,False,686,-69.64215087890625,-73.42271423339844,1
Who had Suzanne learned she cures?,Who had Suzanne learned who cures?,syntax,island_effects,wh_island,True,True,False,False,687,-53.640724182128906,-57.224830627441406,1
What shouldn't the actresses know they dropped by?,What shouldn't the actresses know who dropped by?,syntax,island_effects,wh_island,True,True,False,False,688,-56.77763366699219,-57.34523010253906,1
What hasn't April learned she should respect?,What hasn't April learned who should respect?,syntax,island_effects,wh_island,True,True,False,False,689,-64.77040100097656,-66.06817626953125,1
What hasn't Matt figured out he hated?,What hasn't Matt figured out who hated?,syntax,island_effects,wh_island,True,True,False,False,690,-56.24378204345703,-57.41415023803711,1
What is Andrea revealing she was lifting?,What is Andrea revealing who was lifting?,syntax,island_effects,wh_island,True,True,False,False,691,-57.958011627197266,-58.525856018066406,1
Who couldn't Gregory conceal he saw?,Who couldn't Gregory conceal who saw?,syntax,island_effects,wh_island,True,True,False,False,692,-58.15230941772461,-62.58552932739258,1
Who would Jacqueline remember she wasn't bothering?,Who would Jacqueline remember what wasn't bothering?,syntax,island_effects,wh_island,True,True,False,False,693,-59.831214904785156,-62.46289825439453,1
What should Benjamin learn he hasn't loved?,What should Benjamin learn who hasn't loved?,syntax,island_effects,wh_island,True,True,False,False,694,-60.75261688232422,-60.976165771484375,1
Who hasn't Theodore figured out he had concealed?,Who hasn't Theodore figured out who had concealed?,syntax,island_effects,wh_island,True,True,False,False,695,-68.57113647460938,-67.8919906616211,0
What has Carl known he has messed up?,What has Carl known who has messed up?,syntax,island_effects,wh_island,True,True,False,False,696,-57.057621002197266,-57.64092254638672,1
Who wasn't the student finding out she has admired?,Who wasn't the student finding out who has admired?,syntax,island_effects,wh_island,True,True,False,False,697,-61.47437286376953,-60.25105667114258,0
Who were the Impressionists investigating they listened to?,Who were the Impressionists investigating who listened to?,syntax,island_effects,wh_island,True,True,False,False,698,-66.32260131835938,-63.17319107055664,0
What hasn't Veronica investigated she wasn't running around?,What hasn't Veronica investigated who wasn't running around?,syntax,island_effects,wh_island,True,True,False,False,699,-67.01937866210938,-69.611572265625,1
What is Tiffany finding out she will go to?,What is Tiffany finding out who will go to?,syntax,island_effects,wh_island,True,True,False,False,700,-55.110023498535156,-54.42975616455078,0
What did Grace conceal she might break?,What did Grace conceal who might break?,syntax,island_effects,wh_island,True,True,False,False,701,-59.127872467041016,-60.72557067871094,1
Who wouldn't Lisa know she complains about?,Who wouldn't Lisa know who complains about?,syntax,island_effects,wh_island,True,True,False,False,702,-52.24042510986328,-55.533775329589844,1
What was Carrie remembering she liked?,What was Carrie remembering who liked?,syntax,island_effects,wh_island,True,True,False,False,703,-44.69881820678711,-50.35112762451172,1
Who would Kevin forget he cares for?,Who would Kevin forget who cares for?,syntax,island_effects,wh_island,True,True,False,False,704,-48.87855529785156,-51.475311279296875,1
What hasn't Robert investigated he had bought?,What hasn't Robert investigated who had bought?,syntax,island_effects,wh_island,True,True,False,False,705,-63.16239929199219,-64.81379699707031,1
What hasn't Vanessa remembered she exited?,What hasn't Vanessa remembered who exited?,syntax,island_effects,wh_island,True,True,False,False,706,-61.57447052001953,-62.78644943237305,1
What hasn't Pamela figured out she climbed up?,What hasn't Pamela figured out who climbed up?,syntax,island_effects,wh_island,True,True,False,False,707,-63.96608352661133,-63.71619415283203,0
Who was Carmen learning she is alarming?,Who was Carmen learning who is alarming?,syntax,island_effects,wh_island,True,True,False,False,708,-60.87073516845703,-60.885948181152344,1
What will Dana realize she remembered?,What will Dana realize who remembered?,syntax,island_effects,wh_island,True,True,False,False,709,-50.019287109375,-54.76001739501953,1
Who has Claire remembered she stunned?,Who has Claire remembered who stunned?,syntax,island_effects,wh_island,True,True,False,False,710,-54.37543487548828,-57.27248764038086,1
What are these guys realizing they had seen?,What are these guys realizing who had seen?,syntax,island_effects,wh_island,True,True,False,False,711,-49.2154541015625,-53.49446105957031,1
What is Carl remembering he tours?,What is Carl remembering who tours?,syntax,island_effects,wh_island,True,True,False,False,712,-52.2071533203125,-52.512821197509766,1
What had Jason known he flees from?,What had Jason known who flees from?,syntax,island_effects,wh_island,True,True,False,False,713,-63.03373718261719,-63.94255065917969,1
What hasn't William forgotten he ran around?,What hasn't William forgotten who ran around?,syntax,island_effects,wh_island,True,True,False,False,714,-58.771888732910156,-59.5714225769043,1
What hasn't Michelle figured out she took?,What hasn't Michelle figured out who took?,syntax,island_effects,wh_island,True,True,False,False,715,-55.98292922973633,-56.97354507446289,1
What won't Jerry investigate he hadn't gone to?,What won't Jerry investigate who hadn't gone to?,syntax,island_effects,wh_island,True,True,False,False,716,-64.03995513916016,-64.7846450805664,1
What had Eric investigated he will skate around?,What had Eric investigated who will skate around?,syntax,island_effects,wh_island,True,True,False,False,717,-69.31392669677734,-69.802001953125,1
Who can't Becky discover she hasn't disgusted?,Who can't Becky discover who hasn't disgusted?,syntax,island_effects,wh_island,True,True,False,False,718,-62.82330322265625,-65.00177001953125,1
Who had Brian realized he escaped from?,Who had Brian realized who escaped from?,syntax,island_effects,wh_island,True,True,False,False,719,-50.65547561645508,-54.15009307861328,1
What can Joel find out he would take?,What can Joel find out who would take?,syntax,island_effects,wh_island,True,True,False,False,720,-52.594642639160156,-50.76023864746094,0
Who can Vincent know he respected?,Who can Vincent know who respected?,syntax,island_effects,wh_island,True,True,False,False,721,-50.970611572265625,-52.010982513427734,1
Who doesn't Nicole learn she was distracting?,Who doesn't Nicole learn what was distracting?,syntax,island_effects,wh_island,True,True,False,False,722,-56.944007873535156,-57.18331527709961,1
Who hasn't Cindy revealed she talked to?,Who hasn't Cindy revealed who talked to?,syntax,island_effects,wh_island,True,True,False,False,723,-56.611412048339844,-60.36016845703125,1
Who won't some patient realize she hadn't fired?,Who won't some patient realize who hadn't fired?,syntax,island_effects,wh_island,True,True,False,False,724,-66.75791931152344,-68.9405288696289,1
Who might Paula remember she helps?,Who might Paula remember who helps?,syntax,island_effects,wh_island,True,True,False,False,725,-53.29302215576172,-55.911285400390625,1
Who should Carrie conceal she does hire?,Who should Carrie conceal who does hire?,syntax,island_effects,wh_island,True,True,False,False,726,-59.993656158447266,-63.000282287597656,1
What wasn't Phillip concealing he exited?,What wasn't Phillip concealing who exited?,syntax,island_effects,wh_island,True,True,False,False,727,-66.3172607421875,-66.26741790771484,0
Who will Jane reveal she hadn't sounded like?,Who will Jane reveal what hadn't sounded like?,syntax,island_effects,wh_island,True,True,False,False,728,-62.14326858520508,-59.58053207397461,0
What weren't some waiters revealing they aren't exploring?,What weren't some waiters revealing who aren't exploring?,syntax,island_effects,wh_island,True,True,False,False,729,-70.41607666015625,-70.55098724365234,1
Who has Samuel revealed he hadn't disturbed?,Who has Samuel revealed what hadn't disturbed?,syntax,island_effects,wh_island,True,True,False,False,730,-57.85722351074219,-62.03921127319336,1
What shouldn't Ella know she is dropping by?,What shouldn't Ella know who is dropping by?,syntax,island_effects,wh_island,True,True,False,False,731,-62.971012115478516,-59.798484802246094,0
What would a cashier reveal she messes up?,What would a cashier reveal who messes up?,syntax,island_effects,wh_island,True,True,False,False,732,-66.66940307617188,-66.19975280761719,0
What doesn't Natalie realize she returned to?,What doesn't Natalie realize who returned to?,syntax,island_effects,wh_island,True,True,False,False,733,-52.95399475097656,-56.29084396362305,1
What should Susan realize she tours?,What should Susan realize who tours?,syntax,island_effects,wh_island,True,True,False,False,734,-54.762237548828125,-58.252906799316406,1
Who had Ann forgotten she scares?,Who had Ann forgotten what scares?,syntax,island_effects,wh_island,True,True,False,False,735,-52.89772033691406,-52.176918029785156,0
Who has Kendra revealed she is aggravating?,Who has Kendra revealed who is aggravating?,syntax,island_effects,wh_island,True,True,False,False,736,-63.9513053894043,-65.59949493408203,1
What is Thomas revealing he escaped from?,What is Thomas revealing who escaped from?,syntax,island_effects,wh_island,True,True,False,False,737,-55.03352355957031,-54.58583068847656,0
Who is Rhonda remembering she hadn't talked to?,Who is Rhonda remembering who hadn't talked to?,syntax,island_effects,wh_island,True,True,False,False,738,-63.02552032470703,-65.67919921875,1
What hasn't Brenda figured out she found?,What hasn't Brenda figured out who found?,syntax,island_effects,wh_island,True,True,False,False,739,-53.92048645019531,-56.68803787231445,1
Who hadn't Kayla figured out she bothered?,Who hadn't Kayla figured out what bothered?,syntax,island_effects,wh_island,True,True,False,False,740,-64.70230102539062,-64.0481948852539,0
Who couldn't Paula remember she can shock?,Who couldn't Paula remember what can shock?,syntax,island_effects,wh_island,True,True,False,False,741,-63.67702102661133,-65.17643737792969,1
Who had some guests learned they do attack?,Who had some guests learned who do attack?,syntax,island_effects,wh_island,True,True,False,False,742,-61.67478561401367,-65.38238525390625,1
Who has Marie forgotten she had disliked?,Who has Marie forgotten who had disliked?,syntax,island_effects,wh_island,True,True,False,False,743,-58.7221565246582,-61.616729736328125,1
Who should most drivers remember they haven't questioned?,Who should most drivers remember who haven't questioned?,syntax,island_effects,wh_island,True,True,False,False,744,-59.655052185058594,-61.87726974487305,1
What isn't Elaine forgetting she does forget?,What isn't Elaine forgetting who does forget?,syntax,island_effects,wh_island,True,True,False,False,745,-58.205745697021484,-62.35361862182617,1
Who didn't a man figure out he distracted?,Who didn't a man figure out what distracted?,syntax,island_effects,wh_island,True,True,False,False,746,-58.102779388427734,-56.242069244384766,0
Who has Clyde realized he might bother?,Who has Clyde realized what might bother?,syntax,island_effects,wh_island,True,True,False,False,747,-56.002159118652344,-56.65846252441406,1
What do a lot of waiters reveal they wore?,What do a lot of waiters reveal who wore?,syntax,island_effects,wh_island,True,True,False,False,748,-58.87255096435547,-60.61824035644531,1
What hadn't girls discovered they hadn't skated around?,What hadn't girls discovered who hadn't skated around?,syntax,island_effects,wh_island,True,True,False,False,749,-65.48129272460938,-69.03929901123047,1
What isn't Charles revealing he cleaned?,What isn't Charles revealing who cleaned?,syntax,island_effects,wh_island,True,True,False,False,750,-57.84034729003906,-58.53802490234375,1
Who weren't most banks finding out they would return to?,Who weren't most banks finding out who would return to?,syntax,island_effects,wh_island,True,True,False,False,751,-68.84333801269531,-66.9404296875,0
Who might Regina reveal she isn't attacking?,Who might Regina reveal who isn't attacking?,syntax,island_effects,wh_island,True,True,False,False,752,-62.66211700439453,-64.52272033691406,1
What hadn't Larry found out he lifts?,What hadn't Larry found out who lifts?,syntax,island_effects,wh_island,True,True,False,False,753,-63.815547943115234,-64.80904388427734,1
Who wasn't Victoria figuring out she investigated?,Who wasn't Victoria figuring out who investigated?,syntax,island_effects,wh_island,True,True,False,False,754,-62.54030227661133,-61.55955505371094,0
What hasn't Joel concealed he respected?,What hasn't Joel concealed who respected?,syntax,island_effects,wh_island,True,True,False,False,755,-60.62538146972656,-63.3007698059082,1
Who isn't Bruce forgetting he has visited?,Who isn't Bruce forgetting who has visited?,syntax,island_effects,wh_island,True,True,False,False,756,-56.680274963378906,-57.95490264892578,1
What is Marcus finding out he has lifted?,What is Marcus finding out who has lifted?,syntax,island_effects,wh_island,True,True,False,False,757,-57.41216278076172,-56.25234603881836,0
Who can John forget he hires?,Who can John forget who hires?,syntax,island_effects,wh_island,True,True,False,False,758,-49.27630615234375,-52.920780181884766,1
What can Debra remember she exits?,What can Debra remember who exits?,syntax,island_effects,wh_island,True,True,False,False,759,-59.46875762939453,-60.13164138793945,1
What is Matt investigating he was selling?,What is Matt investigating who was selling?,syntax,island_effects,wh_island,True,True,False,False,760,-51.78227996826172,-50.669334411621094,0
What can't Christopher learn he hadn't respected?,What can't Christopher learn who hadn't respected?,syntax,island_effects,wh_island,True,True,False,False,761,-67.112060546875,-68.17936706542969,1
Who did Angela remember she hasn't healed?,Who did Angela remember who hasn't healed?,syntax,island_effects,wh_island,True,True,False,False,762,-54.02923583984375,-59.55970001220703,1
What wasn't Cynthia discovering she ran around?,What wasn't Cynthia discovering who ran around?,syntax,island_effects,wh_island,True,True,False,False,763,-61.96540069580078,-62.35200500488281,1
Who wasn't Stacey investigating she was distracting?,Who wasn't Stacey investigating who was distracting?,syntax,island_effects,wh_island,True,True,False,False,764,-67.15762329101562,-67.31204986572266,1
What had Guy concealed he explored?,What had Guy concealed who explored?,syntax,island_effects,wh_island,True,True,False,False,765,-57.471717834472656,-59.159664154052734,1
Who can the driver discover he is helping?,Who can the driver discover who is helping?,syntax,island_effects,wh_island,True,True,False,False,766,-54.575233459472656,-51.73725891113281,0
What had Valerie remembered she hates?,What had Valerie remembered who hates?,syntax,island_effects,wh_island,True,True,False,False,767,-51.52644729614258,-54.80748748779297,1
Who could Tamara learn she was working with?,Who could Tamara learn who was working with?,syntax,island_effects,wh_island,True,True,False,False,768,-59.321720123291016,-59.57905197143555,1
Who isn't a boy investigating he could visit?,Who isn't a boy investigating who could visit?,syntax,island_effects,wh_island,True,True,False,False,769,-57.24797058105469,-57.71147155761719,1
Who can Theodore figure out he was confusing?,Who can Theodore figure out what was confusing?,syntax,island_effects,wh_island,True,True,False,False,770,-62.954193115234375,-57.35394287109375,0
What are most companies concealing they should walk through?,What are most companies concealing who should walk through?,syntax,island_effects,wh_island,True,True,False,False,771,-68.50138854980469,-67.79387664794922,0
What isn't Tina investigating she hadn't appreciated?,What isn't Tina investigating who hadn't appreciated?,syntax,island_effects,wh_island,True,True,False,False,772,-65.57505798339844,-65.69279479980469,1
What hasn't Ann remembered she revealed?,What hasn't Ann remembered who revealed?,syntax,island_effects,wh_island,True,True,False,False,773,-60.285919189453125,-61.858001708984375,1
Who hadn't Andrew realized he is questioning?,Who hadn't Andrew realized who is questioning?,syntax,island_effects,wh_island,True,True,False,False,774,-56.91363525390625,-59.934234619140625,1
What was Theresa discovering she is thinking about?,What was Theresa discovering who is thinking about?,syntax,island_effects,wh_island,True,True,False,False,775,-56.00285339355469,-55.053863525390625,0
Who shouldn't that school realize it can disgust?,Who shouldn't that school realize who can disgust?,syntax,island_effects,wh_island,True,True,False,False,776,-63.96440505981445,-67.17550659179688,1
Who wasn't Rachel discovering she isn't questioning?,Who wasn't Rachel discovering who isn't questioning?,syntax,island_effects,wh_island,True,True,False,False,777,-62.685333251953125,-63.64958572387695,1
What hadn't Tanya learned she hasn't descended?,What hadn't Tanya learned who hasn't descended?,syntax,island_effects,wh_island,True,True,False,False,778,-68.7779541015625,-71.28315734863281,1
Who has Becky found out she hurt?,Who has Becky found out who hurt?,syntax,island_effects,wh_island,True,True,False,False,779,-53.243194580078125,-54.32032012939453,1
What isn't Julia discovering she scanned?,What isn't Julia discovering who scanned?,syntax,island_effects,wh_island,True,True,False,False,780,-57.4844970703125,-59.44464111328125,1
What does Allison remember she thinks about?,What does Allison remember who thinks about?,syntax,island_effects,wh_island,True,True,False,False,781,-48.32672882080078,-52.930564880371094,1
Who might Renee remember she would astound?,Who might Renee remember what would astound?,syntax,island_effects,wh_island,True,True,False,False,782,-64.46015930175781,-64.23715209960938,0
What was Raymond remembering he hadn't boycotted?,What was Raymond remembering who hadn't boycotted?,syntax,island_effects,wh_island,True,True,False,False,783,-80.68280029296875,-81.8768310546875,1
What can't David figure out he escaped from?,What can't David figure out who escaped from?,syntax,island_effects,wh_island,True,True,False,False,784,-59.616172790527344,-56.867984771728516,0
Who is Tina remembering she had approached?,Who is Tina remembering who had approached?,syntax,island_effects,wh_island,True,True,False,False,785,-54.214080810546875,-55.805084228515625,1
Who did a lot of banks remember they hadn't bored?,Who did a lot of banks remember who hadn't bored?,syntax,island_effects,wh_island,True,True,False,False,786,-60.74209976196289,-61.68741989135742,1
Who hasn't Janet found out she can observe?,Who hasn't Janet found out who can observe?,syntax,island_effects,wh_island,True,True,False,False,787,-61.97547149658203,-64.39337921142578,1
Who has Colleen remembered she isn't talking to?,Who has Colleen remembered who isn't talking to?,syntax,island_effects,wh_island,True,True,False,False,788,-62.57918930053711,-64.52590942382812,1
What won't Candice discover she thought about?,What won't Candice discover who thought about?,syntax,island_effects,wh_island,True,True,False,False,789,-67.06491088867188,-66.30450439453125,0
Who was Joseph forgetting he didn't reveal?,Who was Joseph forgetting who didn't reveal?,syntax,island_effects,wh_island,True,True,False,False,790,-57.90083312988281,-60.33404541015625,1
What wasn't Patricia finding out she cleaned?,What wasn't Patricia finding out who cleaned?,syntax,island_effects,wh_island,True,True,False,False,791,-59.36484146118164,-61.49933624267578,1
Who is Wayne finding out he hadn't loved?,Who is Wayne finding out who hadn't loved?,syntax,island_effects,wh_island,True,True,False,False,792,-59.36627197265625,-59.435916900634766,1
Who didn't Rachelle figure out she was admiring?,Who didn't Rachelle figure out who was admiring?,syntax,island_effects,wh_island,True,True,False,False,793,-67.03334045410156,-67.83447265625,1
Who had Naomi remembered she impressed?,Who had Naomi remembered who impressed?,syntax,island_effects,wh_island,True,True,False,False,794,-51.464847564697266,-54.36821746826172,1
What doesn't Christopher discover he brought?,What doesn't Christopher discover who brought?,syntax,island_effects,wh_island,True,True,False,False,795,-59.20145034790039,-59.54991912841797,1
What weren't a lot of cashiers remembering they would break?,What weren't a lot of cashiers remembering who would break?,syntax,island_effects,wh_island,True,True,False,False,796,-72.56793212890625,-72.503662109375,0
Who would Regina investigate she didn't investigate?,Who would Regina investigate who didn't investigate?,syntax,island_effects,wh_island,True,True,False,False,797,-56.801544189453125,-58.837425231933594,1
What won't Janice find out she was walking through?,What won't Janice find out who was walking through?,syntax,island_effects,wh_island,True,True,False,False,798,-68.59159088134766,-65.85249328613281,0
Who did Jodi conceal she isn't hiring?,Who did Jodi conceal who isn't hiring?,syntax,island_effects,wh_island,True,True,False,False,799,-66.94312286376953,-65.22460174560547,0
Who could Anne realize she will approach?,Who could Anne realize who will approach?,syntax,island_effects,wh_island,True,True,False,False,800,-54.913116455078125,-58.507850646972656,1
What isn't Tracy investigating she will walk through?,What isn't Tracy investigating who will walk through?,syntax,island_effects,wh_island,True,True,False,False,801,-64.91285705566406,-64.09219360351562,0
Who didn't Noah figure out he might flee from?,Who didn't Noah figure out who might flee from?,syntax,island_effects,wh_island,True,True,False,False,802,-67.21634674072266,-67.04908752441406,0
Who has Tonya learned she approaches?,Who has Tonya learned who approaches?,syntax,island_effects,wh_island,True,True,False,False,803,-60.45869064331055,-62.32862854003906,1
Who had Roger known he revealed?,Who had Roger known who revealed?,syntax,island_effects,wh_island,True,True,False,False,804,-50.113887786865234,-52.15391159057617,1
Who was Chad figuring out he did confuse?,Who was Chad figuring out what did confuse?,syntax,island_effects,wh_island,True,True,False,False,805,-65.32991027832031,-62.5849723815918,0
Who wasn't Kirsten learning she hasn't returned to?,Who wasn't Kirsten learning who hasn't returned to?,syntax,island_effects,wh_island,True,True,False,False,806,-62.97161865234375,-64.00487518310547,1
Who isn't Donald figuring out he wasn't arguing about?,Who isn't Donald figuring out who wasn't arguing about?,syntax,island_effects,wh_island,True,True,False,False,807,-65.06806182861328,-62.776947021484375,0
What did Dan find out he has concealed?,What did Dan find out who has concealed?,syntax,island_effects,wh_island,True,True,False,False,808,-56.54081726074219,-54.47015380859375,0
Who didn't Phillip realize he wasn't aggravating?,Who didn't Phillip realize what wasn't aggravating?,syntax,island_effects,wh_island,True,True,False,False,809,-63.85268783569336,-67.37310791015625,1
What will Janice know she hasn't brought?,What will Janice know who hasn't brought?,syntax,island_effects,wh_island,True,True,False,False,810,-60.12564468383789,-60.26970291137695,1
What shouldn't Valerie figure out she hates?,What shouldn't Valerie figure out who hates?,syntax,island_effects,wh_island,True,True,False,False,811,-53.418983459472656,-53.02021026611328,0
What should Anna remember she heals?,What should Anna remember who heals?,syntax,island_effects,wh_island,True,True,False,False,812,-46.98908233642578,-50.253684997558594,1
Who could Kayla figure out she wouldn't question?,Who could Kayla figure out who wouldn't question?,syntax,island_effects,wh_island,True,True,False,False,813,-65.26040649414062,-65.12252807617188,0
Who had Erin known she was hiring?,Who had Erin known who was hiring?,syntax,island_effects,wh_island,True,True,False,False,814,-51.020240783691406,-53.54755783081055,1
Who have these organizations figured out they should disturb?,Who have these organizations figured out what should disturb?,syntax,island_effects,wh_island,True,True,False,False,815,-61.97599792480469,-62.58866882324219,1
