sentence_good,sentence_bad,field,linguistics_term,UID,simple_LM_method,one_prefix_method,two_prefix_method,lexically_identical,pair_id,good_prob,bad_prob,correct
Had these teenagers ever responded?,These teenagers had ever responded.,semantics,npi_licensing,matrix_question_npi_licensor_present,True,False,True,True,649,-42.270416259765625,-39.22345733642578,0
Will those candles ever fall?,Those candles will ever fall.,semantics,npi_licensing,matrix_question_npi_licensor_present,True,False,True,True,650,-37.461830139160156,-33.66190719604492,0
Did these actors ever compete?,These actors did ever compete.,semantics,npi_licensing,matrix_question_npi_licensor_present,True,False,True,True,651,-38.47021484375,-40.13526153564453,1
Has the glacier ever melted?,The glacier has ever melted.,semantics,npi_licensing,matrix_question_npi_licensor_present,True,False,True,True,652,-40.65522766113281,-39.503414154052734,0
Can Deborah ever joke around?,Deborah can ever joke around.,semantics,npi_licensing,matrix_question_npi_licensor_present,True,False,True,True,653,-40.64562225341797,-47.10429000854492,1
Did a lot of waiters ever confer?,A lot of waiters did ever confer.,semantics,npi_licensing,matrix_question_npi_licensor_present,True,False,True,True,654,-54.11024475097656,-61.01140594482422,1
Did some river ever freeze?,Some river did ever freeze.,semantics,npi_licensing,matrix_question_npi_licensor_present,True,False,True,True,655,-40.16020965576172,-39.87675857543945,0
Did Jeffrey ever bother to question Cynthia?,Jeffrey did ever bother to question Cynthia.,semantics,npi_licensing,matrix_question_npi_licensor_present,True,False,True,True,656,-58.01710510253906,-63.47384262084961,1
Did many waitresses ever embrace?,Many waitresses did ever embrace.,semantics,npi_licensing,matrix_question_npi_licensor_present,True,False,True,True,657,-55.27320861816406,-51.691566467285156,0
Have some pictures ever disappeared?,Some pictures have ever disappeared.,semantics,npi_licensing,matrix_question_npi_licensor_present,True,False,True,True,658,-33.482479095458984,-33.54816436767578,1
Had Florence ever remembered some adults?,Florence had ever remembered some adults.,semantics,npi_licensing,matrix_question_npi_licensor_present,True,False,True,True,659,-46.775848388671875,-53.847076416015625,1
Could all shirts ever tighten?,All shirts could ever tighten.,semantics,npi_licensing,matrix_question_npi_licensor_present,True,False,True,True,660,-43.857177734375,-43.26825714111328,0
Had a lot of boys ever argued?,A lot of boys had ever argued.,semantics,npi_licensing,matrix_question_npi_licensor_present,True,False,True,True,661,-37.37744140625,-39.306766510009766,1
Could Kimberley ever hug every waiter?,Kimberley could ever hug every waiter.,semantics,npi_licensing,matrix_question_npi_licensor_present,True,False,True,True,662,-63.41189193725586,-65.72786712646484,1
Should Patricia ever boycott most companies?,Patricia should ever boycott most companies.,semantics,npi_licensing,matrix_question_npi_licensor_present,True,False,True,True,663,-58.196495056152344,-61.3713493347168,1
Has Sabrina ever praised the newspaper articles?,Sabrina has ever praised the newspaper articles.,semantics,npi_licensing,matrix_question_npi_licensor_present,True,False,True,True,664,-70.48112487792969,-57.49360656738281,0
Had some vase ever chipped?,Some vase had ever chipped.,semantics,npi_licensing,matrix_question_npi_licensor_present,True,False,True,True,665,-53.459896087646484,-48.35065841674805,0
Had a lot of vases ever annoyed Paul?,A lot of vases had ever annoyed Paul.,semantics,npi_licensing,matrix_question_npi_licensor_present,True,False,True,True,666,-60.452903747558594,-61.93391036987305,1
Does Rose ever compromise?,Rose does ever compromise.,semantics,npi_licensing,matrix_question_npi_licensor_present,True,False,True,True,667,-34.42083740234375,-30.832557678222656,0
Could that driver ever ask Andrea's handymen to escape from Donald?,That driver could ever ask Andrea's handymen to escape from Donald.,semantics,npi_licensing,matrix_question_npi_licensor_present,True,False,True,True,668,-96.91800689697266,-97.99583435058594,1
Had every couch ever cracked?,Every couch had ever cracked.,semantics,npi_licensing,matrix_question_npi_licensor_present,True,False,True,True,669,-43.106258392333984,-37.09049987792969,0
Will Grace ever criticize Susan?,Grace will ever criticize Susan.,semantics,npi_licensing,matrix_question_npi_licensor_present,True,False,True,True,670,-45.68581008911133,-44.67341613769531,0
Has Emily ever neglected to sneeze?,Emily has ever neglected to sneeze.,semantics,npi_licensing,matrix_question_npi_licensor_present,True,False,True,True,671,-56.37229537963867,-48.91014862060547,0
Might Janice ever push Jessica to kiss Diane?,Janice might ever push Jessica to kiss Diane.,semantics,npi_licensing,matrix_question_npi_licensor_present,True,False,True,True,672,-87.2869873046875,-74.77362823486328,0
Had Suzanne ever laughed?,Suzanne had ever laughed.,semantics,npi_licensing,matrix_question_npi_licensor_present,True,False,True,True,673,-35.9832763671875,-36.720130920410156,1
Had Rhonda ever left Kimberley?,Rhonda had ever left Kimberley.,semantics,npi_licensing,matrix_question_npi_licensor_present,True,False,True,True,674,-63.890419006347656,-52.573699951171875,0
Will Pamela ever reveal Jodi?,Pamela will ever reveal Jodi.,semantics,npi_licensing,matrix_question_npi_licensor_present,True,False,True,True,675,-52.04331970214844,-61.10559844970703,1
Should Bruce ever compromise?,Bruce should ever compromise.,semantics,npi_licensing,matrix_question_npi_licensor_present,True,False,True,True,676,-33.873619079589844,-28.909870147705078,0
Had some bananas ever annoyed Melinda?,Some bananas had ever annoyed Melinda.,semantics,npi_licensing,matrix_question_npi_licensor_present,True,False,True,True,677,-56.4466552734375,-56.14167022705078,0
Do these organizations ever appreciate Becca?,These organizations do ever appreciate Becca.,semantics,npi_licensing,matrix_question_npi_licensor_present,True,False,True,True,678,-57.786163330078125,-57.051937103271484,0
Did this cucumber ever ripen?,This cucumber did ever ripen.,semantics,npi_licensing,matrix_question_npi_licensor_present,True,False,True,True,679,-55.81769561767578,-53.68869400024414,0
Did the jackets ever loosen?,The jackets did ever loosen.,semantics,npi_licensing,matrix_question_npi_licensor_present,True,False,True,True,680,-42.32552719116211,-43.800140380859375,1
Will Tracy ever explain Stacey changes?,Tracy will ever explain Stacey changes.,semantics,npi_licensing,matrix_question_npi_licensor_present,True,False,True,True,681,-62.532501220703125,-60.03425216674805,0
Will those waitresses ever go to some hills?,Those waitresses will ever go to some hills.,semantics,npi_licensing,matrix_question_npi_licensor_present,True,False,True,True,682,-69.93603515625,-62.34471893310547,0
Might every dress ever shrink?,Every dress might ever shrink.,semantics,npi_licensing,matrix_question_npi_licensor_present,True,False,True,True,683,-50.63459396362305,-41.94976806640625,0
Would Gina ever disappear?,Gina would ever disappear.,semantics,npi_licensing,matrix_question_npi_licensor_present,True,False,True,True,684,-33.278953552246094,-31.929216384887695,0
Had Jill ever hired Gina?,Jill had ever hired Gina.,semantics,npi_licensing,matrix_question_npi_licensor_present,True,False,True,True,685,-46.626407623291016,-46.06000518798828,0
Has Tammy ever discovered girls to chat?,Tammy has ever discovered girls to chat.,semantics,npi_licensing,matrix_question_npi_licensor_present,True,False,True,True,686,-57.12955856323242,-52.86980438232422,0
Had women ever fought?,Women had ever fought.,semantics,npi_licensing,matrix_question_npi_licensor_present,True,False,True,True,687,-31.130491256713867,-23.783676147460938,0
Should the school ever collaborate?,The school should ever collaborate.,semantics,npi_licensing,matrix_question_npi_licensor_present,True,False,True,True,688,-37.159080505371094,-37.92080307006836,1
Had a lot of women ever walked through some public park?,A lot of women had ever walked through some public park.,semantics,npi_licensing,matrix_question_npi_licensor_present,True,False,True,True,689,-62.382652282714844,-64.93069458007812,1
Will Dawn ever scan some newspaper article?,Dawn will ever scan some newspaper article.,semantics,npi_licensing,matrix_question_npi_licensor_present,True,False,True,True,690,-61.893070220947266,-60.7846794128418,0
Have the plates ever slipped?,The plates have ever slipped.,semantics,npi_licensing,matrix_question_npi_licensor_present,True,False,True,True,691,-36.52758026123047,-37.10517883300781,1
Had Eva ever sung?,Eva had ever sung.,semantics,npi_licensing,matrix_question_npi_licensor_present,True,False,True,True,692,-33.825931549072266,-26.014171600341797,0
Did Margaret ever imagine Catherine has visited Winston Churchill?,Margaret did ever imagine Catherine has visited Winston Churchill.,semantics,npi_licensing,matrix_question_npi_licensor_present,True,False,True,True,693,-77.63493347167969,-79.45797729492188,1
Had those girls ever drunk?,Those girls had ever drunk.,semantics,npi_licensing,matrix_question_npi_licensor_present,True,False,True,True,694,-32.23090362548828,-29.37903594970703,0
Should Scott ever escape from Maria?,Scott should ever escape from Maria.,semantics,npi_licensing,matrix_question_npi_licensor_present,True,False,True,True,695,-50.24937057495117,-41.19562530517578,0
Will Daniel ever compromise?,Daniel will ever compromise.,semantics,npi_licensing,matrix_question_npi_licensor_present,True,False,True,True,696,-33.538185119628906,-28.45459747314453,0
Should many actors ever exercise?,Many actors should ever exercise.,semantics,npi_licensing,matrix_question_npi_licensor_present,True,False,True,True,697,-37.66123962402344,-37.55276107788086,0
Had Nancy ever chuckled?,Nancy had ever chuckled.,semantics,npi_licensing,matrix_question_npi_licensor_present,True,False,True,True,698,-36.00790023803711,-35.006107330322266,0
Will museums ever communicate?,Museums will ever communicate.,semantics,npi_licensing,matrix_question_npi_licensor_present,True,False,True,True,699,-38.501373291015625,-49.090660095214844,1
Can Carlos ever climb down a hill?,Carlos can ever climb down a hill.,semantics,npi_licensing,matrix_question_npi_licensor_present,True,False,True,True,700,-47.7138786315918,-47.51083755493164,0
Has a casserole ever charred?,A casserole has ever charred.,semantics,npi_licensing,matrix_question_npi_licensor_present,True,False,True,True,701,-56.455623626708984,-56.83725357055664,1
Will Linda ever talk about a hill?,Linda will ever talk about a hill.,semantics,npi_licensing,matrix_question_npi_licensor_present,True,False,True,True,702,-41.79560852050781,-44.329505920410156,1
Had Stacey ever thought some universities have conspired?,Stacey had ever thought some universities have conspired.,semantics,npi_licensing,matrix_question_npi_licensor_present,True,False,True,True,703,-79.3682861328125,-73.41910552978516,0
Had Laurie ever studied?,Laurie had ever studied.,semantics,npi_licensing,matrix_question_npi_licensor_present,True,False,True,True,704,-36.5168571472168,-38.18320083618164,1
Have all bikes ever slipped?,All bikes have ever slipped.,semantics,npi_licensing,matrix_question_npi_licensor_present,True,False,True,True,705,-40.81074523925781,-39.475433349609375,0
Did Helen ever dislike those dancers?,Helen did ever dislike those dancers.,semantics,npi_licensing,matrix_question_npi_licensor_present,True,False,True,True,706,-50.971778869628906,-51.877784729003906,1
Did a lot of boys ever testify?,A lot of boys did ever testify.,semantics,npi_licensing,matrix_question_npi_licensor_present,True,False,True,True,707,-41.342132568359375,-45.521427154541016,1
Have some teenagers ever interacted?,Some teenagers have ever interacted.,semantics,npi_licensing,matrix_question_npi_licensor_present,True,False,True,True,708,-43.470008850097656,-42.703033447265625,0
Will Becca ever yearn to come here?,Becca will ever yearn to come here.,semantics,npi_licensing,matrix_question_npi_licensor_present,True,False,True,True,709,-64.4042739868164,-62.89130401611328,0
Have a lot of pedestrians ever bothered to drink?,A lot of pedestrians have ever bothered to drink.,semantics,npi_licensing,matrix_question_npi_licensor_present,True,False,True,True,710,-52.48485565185547,-56.530433654785156,1
Did these guests ever divorce?,These guests did ever divorce.,semantics,npi_licensing,matrix_question_npi_licensor_present,True,False,True,True,711,-38.68914794921875,-39.405887603759766,1
Would Lawrence ever work with Kathleen?,Lawrence would ever work with Kathleen.,semantics,npi_licensing,matrix_question_npi_licensor_present,True,False,True,True,712,-46.17893981933594,-47.99992370605469,1
Can an actress ever expect Bradley to fall?,An actress can ever expect Bradley to fall.,semantics,npi_licensing,matrix_question_npi_licensor_present,True,False,True,True,713,-64.07765197753906,-59.651485443115234,0
Has the icicle ever evaporated?,The icicle has ever evaporated.,semantics,npi_licensing,matrix_question_npi_licensor_present,True,False,True,True,714,-54.33863067626953,-49.61287307739258,0
Does Tanya ever get fired?,Tanya does ever get fired.,semantics,npi_licensing,matrix_question_npi_licensor_present,True,False,True,True,715,-44.56533432006836,-41.179649353027344,0
Should the associations ever succeed?,The associations should ever succeed.,semantics,npi_licensing,matrix_question_npi_licensor_present,True,False,True,True,716,-39.53556823730469,-37.93424987792969,0
Will Kevin ever think all waiters shouldn't hide away?,Kevin will ever think all waiters shouldn't hide away.,semantics,npi_licensing,matrix_question_npi_licensor_present,True,False,True,True,717,-77.40098571777344,-68.52731323242188,0
Will the skateboards ever steer?,The skateboards will ever steer.,semantics,npi_licensing,matrix_question_npi_licensor_present,True,False,True,True,718,-50.703575134277344,-47.39632034301758,0
Will Wayne ever manage to laugh?,Wayne will ever manage to laugh.,semantics,npi_licensing,matrix_question_npi_licensor_present,True,False,True,True,719,-44.81675720214844,-40.03459167480469,0
Does the waitress ever reveal what talked about most banks?,The waitress does ever reveal what talked about most banks.,semantics,npi_licensing,matrix_question_npi_licensor_present,True,False,True,True,720,-75.20425415039062,-75.918701171875,1
Had Jerry ever considered Christina to salute?,Jerry had ever considered Christina to salute.,semantics,npi_licensing,matrix_question_npi_licensor_present,True,False,True,True,721,-63.428958892822266,-51.93498992919922,0
Does Martha ever arrive at Spain?,Martha does ever arrive at Spain.,semantics,npi_licensing,matrix_question_npi_licensor_present,True,False,True,True,722,-45.09672546386719,-47.732879638671875,1
Does Angela ever discover who has fired Dana?,Angela does ever discover who has fired Dana.,semantics,npi_licensing,matrix_question_npi_licensor_present,True,False,True,True,723,-66.98899841308594,-70.84181213378906,1
Had Bethany ever slumped over?,Bethany had ever slumped over.,semantics,npi_licensing,matrix_question_npi_licensor_present,True,False,True,True,724,-48.93257141113281,-48.80845642089844,0
Had Ronald ever escaped from every grocery store?,Ronald had ever escaped from every grocery store.,semantics,npi_licensing,matrix_question_npi_licensor_present,True,False,True,True,725,-62.27239990234375,-60.55730438232422,0
Had Susan ever imagined these customers discover who are realizing who can't obligate Natalie to drive to this mall?,Susan had ever imagined these customers discover who are realizing who can't obligate Natalie to drive to this mall.,semantics,npi_licensing,matrix_question_npi_licensor_present,True,False,True,True,726,-160.5242156982422,-155.59962463378906,0
Had Margaret ever longed to wear some dresses?,Margaret had ever longed to wear some dresses.,semantics,npi_licensing,matrix_question_npi_licensor_present,True,False,True,True,727,-61.68132781982422,-61.28675079345703,0
Do these cashiers ever communicate?,These cashiers do ever communicate.,semantics,npi_licensing,matrix_question_npi_licensor_present,True,False,True,True,728,-52.02752685546875,-50.3685302734375,0
Have the girls ever distracted Cindy?,The girls have ever distracted Cindy.,semantics,npi_licensing,matrix_question_npi_licensor_present,True,False,True,True,729,-45.113670349121094,-45.94696807861328,1
Had some river ever condensed?,Some river had ever condensed.,semantics,npi_licensing,matrix_question_npi_licensor_present,True,False,True,True,730,-42.89075469970703,-39.087738037109375,0
Had the Clintons ever worked hard?,The Clintons had ever worked hard.,semantics,npi_licensing,matrix_question_npi_licensor_present,True,False,True,True,731,-49.88471221923828,-47.47211456298828,0
Did Sonia ever walk through a college campus?,Sonia did ever walk through a college campus.,semantics,npi_licensing,matrix_question_npi_licensor_present,True,False,True,True,732,-60.18478012084961,-61.52277374267578,1
Can Stacey ever concur?,Stacey can ever concur.,semantics,npi_licensing,matrix_question_npi_licensor_present,True,False,True,True,733,-51.788726806640625,-46.932220458984375,0
Had Tara ever saluted?,Tara had ever saluted.,semantics,npi_licensing,matrix_question_npi_licensor_present,True,False,True,True,734,-40.89739990234375,-38.13212585449219,0
Did that shirt ever exist?,That shirt did ever exist.,semantics,npi_licensing,matrix_question_npi_licensor_present,True,False,True,True,735,-35.13552474975586,-37.776710510253906,1
Had Alexander ever hugged Stacey?,Alexander had ever hugged Stacey.,semantics,npi_licensing,matrix_question_npi_licensor_present,True,False,True,True,736,-51.91905212402344,-44.35218811035156,0
Did Beth ever hide?,Beth did ever hide.,semantics,npi_licensing,matrix_question_npi_licensor_present,True,False,True,True,737,-30.613475799560547,-33.05949401855469,1
Had the driver ever fallen asleep?,The driver had ever fallen asleep.,semantics,npi_licensing,matrix_question_npi_licensor_present,True,False,True,True,738,-39.83649444580078,-40.83574295043945,1
Did some river ever melt?,Some river did ever melt.,semantics,npi_licensing,matrix_question_npi_licensor_present,True,False,True,True,739,-39.047821044921875,-40.17548370361328,1
Had teachers ever descended all steps?,Teachers had ever descended all steps.,semantics,npi_licensing,matrix_question_npi_licensor_present,True,False,True,True,740,-48.65068054199219,-49.21403121948242,1
Had those cups ever cracked?,Those cups had ever cracked.,semantics,npi_licensing,matrix_question_npi_licensor_present,True,False,True,True,741,-40.103694915771484,-36.83009719848633,0
Will the hats ever soak?,The hats will ever soak.,semantics,npi_licensing,matrix_question_npi_licensor_present,True,False,True,True,742,-39.29923629760742,-39.20948028564453,0
Will Mary ever upset Margaret?,Mary will ever upset Margaret.,semantics,npi_licensing,matrix_question_npi_licensor_present,True,False,True,True,743,-40.659423828125,-36.209041595458984,0
Had Andrew ever donated?,Andrew had ever donated.,semantics,npi_licensing,matrix_question_npi_licensor_present,True,False,True,True,744,-35.95344161987305,-27.70431137084961,0
Will Brenda ever hate Christopher?,Brenda will ever hate Christopher.,semantics,npi_licensing,matrix_question_npi_licensor_present,True,False,True,True,745,-42.54069519042969,-42.054786682128906,0
Can these people ever concur?,These people can ever concur.,semantics,npi_licensing,matrix_question_npi_licensor_present,True,False,True,True,746,-44.550201416015625,-40.800201416015625,0
Has Sonia ever hidden away?,Sonia has ever hidden away.,semantics,npi_licensing,matrix_question_npi_licensor_present,True,False,True,True,747,-36.13323211669922,-37.060489654541016,1
Has Gina ever played?,Gina has ever played.,semantics,npi_licensing,matrix_question_npi_licensor_present,True,False,True,True,748,-32.357200622558594,-29.803653717041016,0
Has that person ever listened to Anna?,That person has ever listened to Anna.,semantics,npi_licensing,matrix_question_npi_licensor_present,True,False,True,True,749,-43.696006774902344,-42.48994445800781,0
Should Dawn ever exit hills?,Dawn should ever exit hills.,semantics,npi_licensing,matrix_question_npi_licensor_present,True,False,True,True,750,-50.347862243652344,-51.61740493774414,1
Do the legislatures ever reveal who force Daniel to study?,The legislatures do ever reveal who force Daniel to study.,semantics,npi_licensing,matrix_question_npi_licensor_present,True,False,True,True,751,-88.10538482666016,-86.3309097290039,0
Has Keith ever explained every plane was accelerating?,Keith has ever explained every plane was accelerating.,semantics,npi_licensing,matrix_question_npi_licensor_present,True,False,True,True,752,-66.69935607910156,-59.739402770996094,0
Might Alan ever litter?,Alan might ever litter.,semantics,npi_licensing,matrix_question_npi_licensor_present,True,False,True,True,753,-43.63228225708008,-31.47154998779297,0
Can unicycles ever chip?,Unicycles can ever chip.,semantics,npi_licensing,matrix_question_npi_licensor_present,True,False,True,True,754,-56.72168731689453,-49.499122619628906,0
Could Gregory ever wish to confuse that boy?,Gregory could ever wish to confuse that boy.,semantics,npi_licensing,matrix_question_npi_licensor_present,True,False,True,True,755,-54.83855056762695,-57.6720085144043,1
Had Heidi ever known an actor?,Heidi had ever known an actor.,semantics,npi_licensing,matrix_question_npi_licensor_present,True,False,True,True,756,-46.1834716796875,-45.777339935302734,0
Should these men ever reveal this child?,These men should ever reveal this child.,semantics,npi_licensing,matrix_question_npi_licensor_present,True,False,True,True,757,-43.75889205932617,-43.37995147705078,0
Will this legislature ever boast?,This legislature will ever boast.,semantics,npi_licensing,matrix_question_npi_licensor_present,True,False,True,True,758,-43.42300033569336,-41.26686096191406,0
Could Tamara ever entice Debra to go fishing?,Tamara could ever entice Debra to go fishing.,semantics,npi_licensing,matrix_question_npi_licensor_present,True,False,True,True,759,-88.14698791503906,-80.21977233886719,0
Had Becky ever ascertained Helen to drop by Harvard University?,Becky had ever ascertained Helen to drop by Harvard University.,semantics,npi_licensing,matrix_question_npi_licensor_present,True,False,True,True,760,-92.8568115234375,-83.83229064941406,0
Had Lucille ever looked to hunt?,Lucille had ever looked to hunt.,semantics,npi_licensing,matrix_question_npi_licensor_present,True,False,True,True,761,-55.45591735839844,-45.822364807128906,0
Had the ladies ever revealed that plate?,The ladies had ever revealed that plate.,semantics,npi_licensing,matrix_question_npi_licensor_present,True,False,True,True,762,-46.44435119628906,-46.3677978515625,0
Might Jill ever imagine Tamara won't encourage Alan's father to get fired?,Jill might ever imagine Tamara won't encourage Alan's father to get fired.,semantics,npi_licensing,matrix_question_npi_licensor_present,True,False,True,True,763,-115.41079711914062,-108.26055908203125,0
Could Paula ever escape?,Paula could ever escape.,semantics,npi_licensing,matrix_question_npi_licensor_present,True,False,True,True,764,-33.83991241455078,-31.488943099975586,0
Had those windows ever tipped over?,Those windows had ever tipped over.,semantics,npi_licensing,matrix_question_npi_licensor_present,True,False,True,True,765,-44.31892776489258,-40.323036193847656,0
Has this rice ever upset Nicole?,This rice has ever upset Nicole.,semantics,npi_licensing,matrix_question_npi_licensor_present,True,False,True,True,766,-49.48543930053711,-47.75054168701172,0
Did this documentary ever worry Travis?,This documentary did ever worry Travis.,semantics,npi_licensing,matrix_question_npi_licensor_present,True,False,True,True,767,-52.250938415527344,-51.758522033691406,0
Can Julia ever smile?,Julia can ever smile.,semantics,npi_licensing,matrix_question_npi_licensor_present,True,False,True,True,768,-32.51969909667969,-32.52993392944336,1
Could Sally ever disturb that lady?,Sally could ever disturb that lady.,semantics,npi_licensing,matrix_question_npi_licensor_present,True,False,True,True,769,-42.805091857910156,-48.19644546508789,1
Had Lucille ever wept?,Lucille had ever wept.,semantics,npi_licensing,matrix_question_npi_licensor_present,True,False,True,True,770,-49.733070373535156,-42.66661834716797,0
Has Elaine ever blinked?,Elaine has ever blinked.,semantics,npi_licensing,matrix_question_npi_licensor_present,True,False,True,True,771,-38.481056213378906,-39.10382843017578,1
Had Lissa ever broken some skateboards?,Lissa had ever broken some skateboards.,semantics,npi_licensing,matrix_question_npi_licensor_present,True,False,True,True,772,-65.70951080322266,-59.036888122558594,0
Had these skirts ever frayed?,These skirts had ever frayed.,semantics,npi_licensing,matrix_question_npi_licensor_present,True,False,True,True,773,-51.702903747558594,-45.713653564453125,0
Should Wayne ever bother to sneeze?,Wayne should ever bother to sneeze.,semantics,npi_licensing,matrix_question_npi_licensor_present,True,False,True,True,774,-56.859249114990234,-53.761924743652344,0
Has this man ever respected a lot of rivers?,This man has ever respected a lot of rivers.,semantics,npi_licensing,matrix_question_npi_licensor_present,True,False,True,True,775,-55.02371597290039,-52.89530944824219,0
Has every man ever bothered to listen to Lisa?,Every man has ever bothered to listen to Lisa.,semantics,npi_licensing,matrix_question_npi_licensor_present,True,False,True,True,776,-56.49769592285156,-53.07365036010742,0
Had Robert ever ascended every slope?,Robert had ever ascended every slope.,semantics,npi_licensing,matrix_question_npi_licensor_present,True,False,True,True,777,-53.06682586669922,-41.886878967285156,0
