sentence_good,sentence_bad,field,linguistics_term,UID,simple_LM_method,one_prefix_method,two_prefix_method,lexically_identical,pair_id,good_prob,bad_prob,correct
What hasn't Angela discovered she was curing?,What hasn't Angela discovered who was curing?,syntax,island_effects,wh_island,True,True,False,False,545,-61.40753173828125,-65.22012329101562,1
Who hasn't Donald learned he appreciates?,Who hasn't Donald learned who appreciates?,syntax,island_effects,wh_island,True,True,False,False,546,-56.25058364868164,-58.74346160888672,1
What did this man investigate he notices?,What did this man investigate who notices?,syntax,island_effects,wh_island,True,True,False,False,547,-48.98033142089844,-52.40034103393555,1
Who had Patrick figured out he kissed?,Who had Patrick figured out who kissed?,syntax,island_effects,wh_island,True,True,False,False,548,-54.59370040893555,-54.78797912597656,1
Who had Lawrence discovered he approaches?,Who had Lawrence discovered who approaches?,syntax,island_effects,wh_island,True,True,False,False,549,-53.805641174316406,-58.37665557861328,1
Who should Colleen find out she doesn't watch?,Who should Colleen find out who doesn't watch?,syntax,island_effects,wh_island,True,True,False,False,550,-63.21995162963867,-62.82665252685547,0
Who is Beverly forgetting she was disgusting?,Who is Beverly forgetting who was disgusting?,syntax,island_effects,wh_island,True,True,False,False,551,-56.285362243652344,-58.31938552856445,1
Who does Debra know she hasn't researched?,Who does Debra know who hasn't researched?,syntax,island_effects,wh_island,True,True,False,False,552,-57.014102935791016,-58.90669631958008,1
What wouldn't Lawrence figure out he had returned to?,What wouldn't Lawrence figure out who had returned to?,syntax,island_effects,wh_island,True,True,False,False,553,-64.18354797363281,-62.141822814941406,0
What is Alan finding out he had fixed?,What is Alan finding out who had fixed?,syntax,island_effects,wh_island,True,True,False,False,554,-56.25833511352539,-55.764122009277344,0
Who should Frank remember he watches?,Who should Frank remember who watches?,syntax,island_effects,wh_island,True,True,False,False,555,-53.594276428222656,-56.432647705078125,1
Who was Keith finding out he hadn't listened to?,Who was Keith finding out who hadn't listened to?,syntax,island_effects,wh_island,True,True,False,False,556,-58.956581115722656,-58.904396057128906,0
Who hasn't Derek revealed he watches?,Who hasn't Derek revealed who watches?,syntax,island_effects,wh_island,True,True,False,False,557,-57.023433685302734,-60.26314926147461,1
What had Ella revealed she might drive to?,What had Ella revealed who might drive to?,syntax,island_effects,wh_island,True,True,False,False,558,-67.04438018798828,-69.31301879882812,1
What was Rebecca finding out she isn't walking through?,What was Rebecca finding out who isn't walking through?,syntax,island_effects,wh_island,True,True,False,False,559,-61.704612731933594,-62.34058380126953,1
Who didn't Tammy know she isn't annoying?,Who didn't Tammy know what isn't annoying?,syntax,island_effects,wh_island,True,True,False,False,560,-54.326934814453125,-55.75743103027344,1
What can Tina figure out she hasn't revealed?,What can Tina figure out who hasn't revealed?,syntax,island_effects,wh_island,True,True,False,False,561,-57.95933151245117,-58.39384460449219,1
Who hasn't Phillip revealed he talked to?,Who hasn't Phillip revealed who talked to?,syntax,island_effects,wh_island,True,True,False,False,562,-58.57331848144531,-62.53057098388672,1
Who are the people discovering they wouldn't stun?,Who are the people discovering what wouldn't stun?,syntax,island_effects,wh_island,True,True,False,False,563,-62.008968353271484,-60.4361572265625,0
What has Ella found out she hadn't cleaned?,What has Ella found out who hadn't cleaned?,syntax,island_effects,wh_island,True,True,False,False,564,-66.9599380493164,-68.13092041015625,1
Who don't most committees discover they weren't hugging?,Who don't most committees discover who weren't hugging?,syntax,island_effects,wh_island,True,True,False,False,565,-73.59228515625,-73.82311248779297,1
What has Jill known she had driven to?,What has Jill known who had driven to?,syntax,island_effects,wh_island,True,True,False,False,566,-63.19519805908203,-63.02470397949219,0
What might Todd realize he doesn't hide?,What might Todd realize who doesn't hide?,syntax,island_effects,wh_island,True,True,False,False,567,-57.08959197998047,-60.10380935668945,1
Who had Heather investigated she can't listen to?,Who had Heather investigated who can't listen to?,syntax,island_effects,wh_island,True,True,False,False,568,-63.27391052246094,-64.75277709960938,1
What was Jennifer investigating she is arriving at?,What was Jennifer investigating who is arriving at?,syntax,island_effects,wh_island,True,True,False,False,569,-62.11595153808594,-61.770538330078125,0
Who should Andrew investigate he does respect?,Who should Andrew investigate who does respect?,syntax,island_effects,wh_island,True,True,False,False,570,-56.93475341796875,-57.092350006103516,1
Who hasn't Tiffany figured out she investigated?,Who hasn't Tiffany figured out who investigated?,syntax,island_effects,wh_island,True,True,False,False,571,-60.2662467956543,-61.25742721557617,1
What isn't some patient figuring out she would lift?,What isn't some patient figuring out who would lift?,syntax,island_effects,wh_island,True,True,False,False,572,-68.62825012207031,-65.76069641113281,0
Who can Rhonda investigate she is hurting?,Who can Rhonda investigate what is hurting?,syntax,island_effects,wh_island,True,True,False,False,573,-60.55872344970703,-56.973716735839844,0
Who is Rodney forgetting he should watch?,Who is Rodney forgetting who should watch?,syntax,island_effects,wh_island,True,True,False,False,574,-55.660335540771484,-58.08539962768555,1
Who hadn't Benjamin investigated he hugged?,Who hadn't Benjamin investigated who hugged?,syntax,island_effects,wh_island,True,True,False,False,575,-64.70692443847656,-65.45063018798828,1
Who had Anne figured out she flees from?,Who had Anne figured out who flees from?,syntax,island_effects,wh_island,True,True,False,False,576,-65.56890869140625,-64.4847183227539,0
What didn't a guest discover he has examined?,What didn't a guest discover who has examined?,syntax,island_effects,wh_island,True,True,False,False,577,-64.05488586425781,-61.40997314453125,0
Who has Lissa figured out she hasn't remembered?,Who has Lissa figured out who hasn't remembered?,syntax,island_effects,wh_island,True,True,False,False,578,-66.3701400756836,-68.83419036865234,1
What was Kirsten figuring out she hadn't lifted?,What was Kirsten figuring out who hadn't lifted?,syntax,island_effects,wh_island,True,True,False,False,579,-65.49317932128906,-64.6575698852539,0
What couldn't Regina discover she might climb down?,What couldn't Regina discover what might climb down?,syntax,island_effects,wh_island,True,True,False,False,580,-67.29042053222656,-66.6262435913086,0
What won't Lucille figure out she examined?,What won't Lucille figure out who examined?,syntax,island_effects,wh_island,True,True,False,False,581,-67.79173278808594,-66.11156463623047,0
What had Scott found out he could walk through?,What had Scott found out who could walk through?,syntax,island_effects,wh_island,True,True,False,False,582,-55.59868240356445,-56.87685012817383,1
What did Melinda figure out she buys?,What did Melinda figure out who buys?,syntax,island_effects,wh_island,True,True,False,False,583,-52.80003356933594,-55.00413131713867,1
Who didn't a lot of students realize they have listened to?,Who didn't a lot of students realize who have listened to?,syntax,island_effects,wh_island,True,True,False,False,584,-57.536231994628906,-60.56291198730469,1
Who is Emily revealing she disturbed?,Who is Emily revealing what disturbed?,syntax,island_effects,wh_island,True,True,False,False,585,-50.090877532958984,-52.5578498840332,1
Who isn't Donald concealing he hasn't hired?,Who isn't Donald concealing who hasn't hired?,syntax,island_effects,wh_island,True,True,False,False,586,-64.2509536743164,-63.22271728515625,0
What shouldn't Lissa remember she does skate around?,What shouldn't Lissa remember who does skate around?,syntax,island_effects,wh_island,True,True,False,False,587,-70.95506286621094,-74.29893493652344,1
Who isn't Scott investigating he scares?,Who isn't Scott investigating what scares?,syntax,island_effects,wh_island,True,True,False,False,588,-59.76218032836914,-58.63540267944336,0
What had these hospitals found out they will mess up?,What had these hospitals found out who will mess up?,syntax,island_effects,wh_island,True,True,False,False,589,-65.59130096435547,-66.76264190673828,1
What does Jennifer know she passed?,What does Jennifer know who passed?,syntax,island_effects,wh_island,True,True,False,False,590,-41.95012664794922,-44.12019348144531,1
Who are the libraries discovering they haven't researched?,Who are the libraries discovering who haven't researched?,syntax,island_effects,wh_island,True,True,False,False,591,-61.467044830322266,-61.175689697265625,0
Who hadn't Anna forgotten she wasn't disgusting?,Who hadn't Anna forgotten what wasn't disgusting?,syntax,island_effects,wh_island,True,True,False,False,592,-58.78114700317383,-60.89201354980469,1
Who couldn't the schools find out they did disgust?,Who couldn't the schools find out who did disgust?,syntax,island_effects,wh_island,True,True,False,False,593,-72.12263488769531,-70.85671997070312,0
Who has every pedestrian figured out she will listen to?,Who has every pedestrian figured out who will listen to?,syntax,island_effects,wh_island,True,True,False,False,594,-67.81730651855469,-65.62281799316406,0
What does Carmen remember she concealed?,What does Carmen remember who concealed?,syntax,island_effects,wh_island,True,True,False,False,595,-56.87040710449219,-59.53408432006836,1
What aren't the customers forgetting they arrived at?,What aren't the customers forgetting who arrived at?,syntax,island_effects,wh_island,True,True,False,False,596,-56.277610778808594,-56.73693084716797,1
Who would Kevin learn he had hired?,Who would Kevin learn who had hired?,syntax,island_effects,wh_island,True,True,False,False,597,-52.499298095703125,-53.85548782348633,1
What hadn't Brian realized he tours?,What hadn't Brian realized who tours?,syntax,island_effects,wh_island,True,True,False,False,598,-59.87940216064453,-61.81144332885742,1
What has Sonia discovered she does clean?,What has Sonia discovered who does clean?,syntax,island_effects,wh_island,True,True,False,False,599,-57.543495178222656,-61.278404235839844,1
What can Natalie learn she skates around?,What can Natalie learn who skates around?,syntax,island_effects,wh_island,True,True,False,False,600,-56.55884552001953,-55.98981857299805,0
Who do a lot of teachers reveal they hadn't disagreed with?,Who do a lot of teachers reveal what hadn't disagreed with?,syntax,island_effects,wh_island,True,True,False,False,601,-67.05587768554688,-67.84192657470703,1
Who wasn't Richard realizing he hired?,Who wasn't Richard realizing who hired?,syntax,island_effects,wh_island,True,True,False,False,602,-52.35094451904297,-55.44105911254883,1
Who is Deborah learning she wasn't disturbing?,Who is Deborah learning who wasn't disturbing?,syntax,island_effects,wh_island,True,True,False,False,603,-58.952232360839844,-61.77577209472656,1
What couldn't Alexander find out he arrived at?,What couldn't Alexander find out who arrived at?,syntax,island_effects,wh_island,True,True,False,False,604,-61.82392883300781,-59.80250930786133,0
What is Jerry forgetting he bought?,What is Jerry forgetting who bought?,syntax,island_effects,wh_island,True,True,False,False,605,-49.38764190673828,-50.91602325439453,1
What could every waitress reveal she wasn't researching?,What could every waitress reveal who wasn't researching?,syntax,island_effects,wh_island,True,True,False,False,606,-64.67562866210938,-67.66201782226562,1
Who has Monica learned she hasn't helped?,Who has Monica learned who hasn't helped?,syntax,island_effects,wh_island,True,True,False,False,607,-56.257911682128906,-59.68834686279297,1
Who wasn't Katherine revealing she won't listen to?,Who wasn't Katherine revealing who won't listen to?,syntax,island_effects,wh_island,True,True,False,False,608,-65.26714324951172,-66.4521255493164,1
What couldn't Edward investigate he hadn't exited?,What couldn't Edward investigate who hadn't exited?,syntax,island_effects,wh_island,True,True,False,False,609,-68.7626724243164,-69.48765563964844,1
Who had Laura revealed she discovers?,Who had Laura revealed who discovers?,syntax,island_effects,wh_island,True,True,False,False,610,-49.55070495605469,-56.66789245605469,1
What hasn't that doctor discovered he likes?,What hasn't that doctor discovered who likes?,syntax,island_effects,wh_island,True,True,False,False,611,-55.6778564453125,-59.584197998046875,1
What couldn't Derek find out he broke?,What couldn't Derek find out what broke?,syntax,island_effects,wh_island,True,True,False,False,612,-55.7960319519043,-55.224151611328125,0
Who had Mary investigated she shouldn't leave?,Who had Mary investigated who shouldn't leave?,syntax,island_effects,wh_island,True,True,False,False,613,-61.53570556640625,-62.64548873901367,1
What is Tonya discovering she researched?,What is Tonya discovering who researched?,syntax,island_effects,wh_island,True,True,False,False,614,-57.015525817871094,-57.74155044555664,1
What couldn't Roger learn he is wearing?,What couldn't Roger learn who is wearing?,syntax,island_effects,wh_island,True,True,False,False,615,-57.989566802978516,-57.82121276855469,0
What isn't Karen realizing she has brought?,What isn't Karen realizing who has brought?,syntax,island_effects,wh_island,True,True,False,False,616,-55.523277282714844,-58.84635925292969,1
Who couldn't Nina know she might care for?,Who couldn't Nina know who might care for?,syntax,island_effects,wh_island,True,True,False,False,617,-53.67098617553711,-56.3525505065918,1
Who has Lucille known she hadn't listened to?,Who has Lucille known who hadn't listened to?,syntax,island_effects,wh_island,True,True,False,False,618,-66.86408996582031,-68.07852935791016,1
What could a lot of senators figure out they haven't arrived at?,What could a lot of senators figure out who haven't arrived at?,syntax,island_effects,wh_island,True,True,False,False,619,-71.60858917236328,-72.04071044921875,1
Who won't Becca figure out she was talking to?,Who won't Becca figure out who was talking to?,syntax,island_effects,wh_island,True,True,False,False,620,-66.0898208618164,-64.28849792480469,0
Who is Vanessa realizing she investigates?,Who is Vanessa realizing who investigates?,syntax,island_effects,wh_island,True,True,False,False,621,-52.053489685058594,-56.72903060913086,1
Who will Jodi learn she wasn't upsetting?,Who will Jodi learn who wasn't upsetting?,syntax,island_effects,wh_island,True,True,False,False,622,-67.44866943359375,-68.74871826171875,1
What are all customers discovering they arrived at?,What are all customers discovering who arrived at?,syntax,island_effects,wh_island,True,True,False,False,623,-59.8283805847168,-57.742218017578125,0
What hasn't some dancer investigated she leaves?,What hasn't some dancer investigated who leaves?,syntax,island_effects,wh_island,True,True,False,False,624,-67.6716079711914,-67.90547180175781,1
Who could Jodi figure out she was impressing?,Who could Jodi figure out what was impressing?,syntax,island_effects,wh_island,True,True,False,False,625,-68.64993286132812,-64.44171142578125,0
Who are a lot of patients realizing they weren't embarrassing?,Who are a lot of patients realizing what weren't embarrassing?,syntax,island_effects,wh_island,True,True,False,False,626,-65.18579864501953,-66.56546020507812,1
Who shouldn't April forget she is alarming?,Who shouldn't April forget what is alarming?,syntax,island_effects,wh_island,True,True,False,False,627,-63.323184967041016,-59.171958923339844,0
What can't many customers find out they exited?,What can't many customers find out who exited?,syntax,island_effects,wh_island,True,True,False,False,628,-59.72425842285156,-57.414451599121094,0
Who was a woman revealing she can research?,Who was a woman revealing who can research?,syntax,island_effects,wh_island,True,True,False,False,629,-51.448326110839844,-54.47843933105469,1
What hasn't Omar realized he skates around?,What hasn't Omar realized who skates around?,syntax,island_effects,wh_island,True,True,False,False,630,-66.50741577148438,-68.34913635253906,1
Who had Brian revealed he wasn't hiring?,Who had Brian revealed who wasn't hiring?,syntax,island_effects,wh_island,True,True,False,False,631,-53.63483428955078,-58.865474700927734,1
Who wouldn't this man reveal he hadn't upset?,Who wouldn't this man reveal what hadn't upset?,syntax,island_effects,wh_island,True,True,False,False,632,-61.950035095214844,-64.2022705078125,1
Who hasn't Colleen investigated she worried?,Who hasn't Colleen investigated what worried?,syntax,island_effects,wh_island,True,True,False,False,633,-66.2530517578125,-66.39673614501953,1
What wasn't Bradley discovering he wasn't touring?,What wasn't Bradley discovering who wasn't touring?,syntax,island_effects,wh_island,True,True,False,False,634,-64.02361297607422,-65.75341033935547,1
Who hadn't the Borgias figured out they talked to?,Who hadn't the Borgias figured out who talked to?,syntax,island_effects,wh_island,True,True,False,False,635,-69.7935791015625,-69.13392639160156,0
What hadn't Jessica investigated she messes up?,What hadn't Jessica investigated who messes up?,syntax,island_effects,wh_island,True,True,False,False,636,-69.33451843261719,-70.7562255859375,1
Who could April figure out she won't disturb?,Who could April figure out what won't disturb?,syntax,island_effects,wh_island,True,True,False,False,637,-69.49882507324219,-65.07328796386719,0
What weren't a lot of dancers figuring out they might break?,What weren't a lot of dancers figuring out who might break?,syntax,island_effects,wh_island,True,True,False,False,638,-67.75521850585938,-65.49787902832031,0
Who is Ann investigating she hasn't hidden?,Who is Ann investigating who hasn't hidden?,syntax,island_effects,wh_island,True,True,False,False,639,-60.67853927612305,-60.65630340576172,0
What hasn't a guy discovered he has researched?,What hasn't a guy discovered who has researched?,syntax,island_effects,wh_island,True,True,False,False,640,-58.99287414550781,-60.3899040222168,1
Who weren't some banks revealing they would remember?,Who weren't some banks revealing who would remember?,syntax,island_effects,wh_island,True,True,False,False,641,-62.303550720214844,-63.84434509277344,1
Who won't every company learn it has impressed?,Who won't every company learn what has impressed?,syntax,island_effects,wh_island,True,True,False,False,642,-67.12962341308594,-63.33470916748047,0
Who wasn't the lady remembering she can hire?,Who wasn't the lady remembering who can hire?,syntax,island_effects,wh_island,True,True,False,False,643,-57.00140380859375,-59.972084045410156,1
What aren't a lot of students remembering they can't disagree with?,What aren't a lot of students remembering what can't disagree with?,syntax,island_effects,wh_island,True,True,False,False,644,-63.160987854003906,-65.81460571289062,1
What is some senator discovering he explores?,What is some senator discovering who explores?,syntax,island_effects,wh_island,True,True,False,False,645,-59.4493408203125,-60.98210144042969,1
What haven't these teenagers learned they haven't climbed down?,What haven't these teenagers learned who haven't climbed down?,syntax,island_effects,wh_island,True,True,False,False,646,-66.46348571777344,-70.1373519897461,1
What wouldn't a lot of boys investigate they lifted?,What wouldn't a lot of boys investigate who lifted?,syntax,island_effects,wh_island,True,True,False,False,647,-67.24200439453125,-67.58285522460938,1
What should Tamara reveal she hadn't cleaned?,What should Tamara reveal who hadn't cleaned?,syntax,island_effects,wh_island,True,True,False,False,648,-68.69087982177734,-70.1527328491211,1
Who wouldn't Mitchell investigate he is kissing?,Who wouldn't Mitchell investigate who is kissing?,syntax,island_effects,wh_island,True,True,False,False,649,-62.334800720214844,-60.877113342285156,0
What does Marcus figure out he arrived at?,What does Marcus figure out who arrived at?,syntax,island_effects,wh_island,True,True,False,False,650,-59.00517272949219,-55.935298919677734,0
Who might Martha know she shouldn't disturb?,Who might Martha know what shouldn't disturb?,syntax,island_effects,wh_island,True,True,False,False,651,-60.04066467285156,-63.216033935546875,1
What might this senator conceal she toured?,What might this senator conceal who toured?,syntax,island_effects,wh_island,True,True,False,False,652,-70.42842102050781,-70.48310852050781,1
Who would that guy find out he could love?,Who would that guy find out who could love?,syntax,island_effects,wh_island,True,True,False,False,653,-53.516197204589844,-53.306644439697266,0
Who wasn't Bruce remembering he hurt?,Who wasn't Bruce remembering what hurt?,syntax,island_effects,wh_island,True,True,False,False,654,-54.79130554199219,-54.8513298034668,1
What had Samuel learned he walked through?,What had Samuel learned who walked through?,syntax,island_effects,wh_island,True,True,False,False,655,-51.86064147949219,-54.67018127441406,1
Who wasn't George forgetting he wouldn't hurt?,Who wasn't George forgetting who wouldn't hurt?,syntax,island_effects,wh_island,True,True,False,False,656,-58.35028076171875,-60.61349868774414,1
What will those cashiers figure out they hadn't broken?,What will those cashiers figure out who hadn't broken?,syntax,island_effects,wh_island,True,True,False,False,657,-75.49462890625,-73.68981170654297,0
Who was Tina figuring out she left?,Who was Tina figuring out who left?,syntax,island_effects,wh_island,True,True,False,False,658,-49.15509033203125,-50.70287322998047,1
What does Randolf forget he wasn't running around?,What does Randolf forget who wasn't running around?,syntax,island_effects,wh_island,True,True,False,False,659,-72.28842163085938,-75.60306549072266,1
What should some lady know she messes up?,What should some lady know who messes up?,syntax,island_effects,wh_island,True,True,False,False,660,-57.284000396728516,-59.1300163269043,1
Who is Beth remembering she embarrassed?,Who is Beth remembering who embarrassed?,syntax,island_effects,wh_island,True,True,False,False,661,-50.23426055908203,-53.4776611328125,1
Who isn't Regina discovering she hasn't worked with?,Who isn't Regina discovering who hasn't worked with?,syntax,island_effects,wh_island,True,True,False,False,662,-59.568756103515625,-61.2386474609375,1
What isn't Lawrence discovering he walks through?,What isn't Lawrence discovering who walks through?,syntax,island_effects,wh_island,True,True,False,False,663,-61.168025970458984,-61.647823333740234,1
Who won't Robert know he hadn't distracted?,Who won't Robert know what hadn't distracted?,syntax,island_effects,wh_island,True,True,False,False,664,-59.32086944580078,-63.95892333984375,1
Who hasn't Gregory figured out he hadn't upset?,Who hasn't Gregory figured out what hadn't upset?,syntax,island_effects,wh_island,True,True,False,False,665,-62.88853454589844,-64.96505737304688,1
Who was Diana forgetting she has bothered?,Who was Diana forgetting what has bothered?,syntax,island_effects,wh_island,True,True,False,False,666,-57.52447509765625,-59.48387145996094,1
What had Andrew investigated he is climbing up?,What had Andrew investigated who is climbing up?,syntax,island_effects,wh_island,True,True,False,False,667,-64.63203430175781,-64.44026947021484,0
Who isn't Jodi realizing she annoyed?,Who isn't Jodi realizing what annoyed?,syntax,island_effects,wh_island,True,True,False,False,668,-59.90206527709961,-61.80854415893555,1
What was every man figuring out he climbs up?,What was every man figuring out what climbs up?,syntax,island_effects,wh_island,True,True,False,False,669,-59.94773864746094,-58.66912078857422,0
What wasn't Andrew finding out he isn't wearing?,What wasn't Andrew finding out who isn't wearing?,syntax,island_effects,wh_island,True,True,False,False,670,-61.4549674987793,-60.872520446777344,0
What hasn't Judy remembered she had broken?,What hasn't Judy remembered who had broken?,syntax,island_effects,wh_island,True,True,False,False,671,-58.85102081298828,-61.21467590332031,1
What can't Julia figure out she shouldn't take?,What can't Julia figure out who shouldn't take?,syntax,island_effects,wh_island,True,True,False,False,672,-61.421836853027344,-62.195987701416016,1
Who can't Debra figure out she isn't bothering?,Who can't Debra figure out who isn't bothering?,syntax,island_effects,wh_island,True,True,False,False,673,-69.74976348876953,-66.9488754272461,0
What were a lot of women realizing they have worn?,What were a lot of women realizing who have worn?,syntax,island_effects,wh_island,True,True,False,False,674,-59.05674362182617,-62.29023742675781,1
Who hadn't some committee investigated it should scare?,Who hadn't some committee investigated what should scare?,syntax,island_effects,wh_island,True,True,False,False,675,-71.83837890625,-70.45761108398438,0
What was Keith remembering he admired?,What was Keith remembering who admired?,syntax,island_effects,wh_island,True,True,False,False,676,-52.052860260009766,-54.44770050048828,1
What won't Deanna investigate she would find?,What won't Deanna investigate what would find?,syntax,island_effects,wh_island,True,True,False,False,677,-65.0152816772461,-63.02043533325195,0
Who is Candice remembering she wasn't alarming?,Who is Candice remembering who wasn't alarming?,syntax,island_effects,wh_island,True,True,False,False,678,-70.29056549072266,-70.86032104492188,1
