sentence_good,sentence_bad,field,linguistics_term,UID,simple_LM_method,one_prefix_method,two_prefix_method,lexically_identical,pair_id,good_prob,bad_prob,correct
The actress knows that delighted child.,The actress knows those delighted child.,morphology,determiner_noun_agreement,determiner_noun_agreement_with_adj_irregular_2,True,False,True,True,672,-48.17210388183594,-56.46818542480469,1
That actress had driven to these hidden oases.,That actress had driven to this hidden oases.,morphology,determiner_noun_agreement,determiner_noun_agreement_with_adj_irregular_2,True,False,True,True,673,-70.1501693725586,-71.22541809082031,1
The Lutherans arrive at this cheap oasis.,The Lutherans arrive at these cheap oasis.,morphology,determiner_noun_agreement,determiner_noun_agreement_with_adj_irregular_2,True,False,True,True,674,-53.51724624633789,-60.70287322998047,1
Diane was kissing those lost women.,Diane was kissing that lost women.,morphology,determiner_noun_agreement,determiner_noun_agreement_with_adj_irregular_2,True,False,True,True,675,-54.185081481933594,-57.78125,1
Larry disturbs this employed woman.,Larry disturbs these employed woman.,morphology,determiner_noun_agreement,determiner_noun_agreement_with_adj_irregular_2,True,False,True,True,676,-56.62971115112305,-60.52020263671875,1
Pies shock this upset woman.,Pies shock these upset woman.,morphology,determiner_noun_agreement,determiner_noun_agreement_with_adj_irregular_2,True,False,True,True,677,-59.82406234741211,-63.8563232421875,1
Some waiters hug this content alumnus.,Some waiters hug these content alumnus.,morphology,determiner_noun_agreement,determiner_noun_agreement_with_adj_irregular_2,True,False,True,True,678,-69.39241790771484,-69.81403350830078,1
Anna talked to those unsure men.,Anna talked to that unsure men.,morphology,determiner_noun_agreement,determiner_noun_agreement_with_adj_irregular_2,True,False,True,True,679,-54.42567443847656,-56.11349868774414,1
This school bores this determined man.,This school bores these determined man.,morphology,determiner_noun_agreement,determiner_noun_agreement_with_adj_irregular_2,True,False,True,True,680,-51.03709030151367,-56.402427673339844,1
Omar had thought about these unemployed men.,Omar had thought about this unemployed men.,morphology,determiner_noun_agreement,determiner_noun_agreement_with_adj_irregular_2,True,False,True,True,681,-57.49102783203125,-60.8607177734375,1
Winston Churchill cleaned these big nuclei.,Winston Churchill cleaned this big nuclei.,morphology,determiner_noun_agreement,determiner_noun_agreement_with_adj_irregular_2,True,False,True,True,682,-55.23904800415039,-57.74386978149414,1
These organizations aren't concealing that exposed child.,These organizations aren't concealing those exposed child.,morphology,determiner_noun_agreement,determiner_noun_agreement_with_adj_irregular_2,True,False,True,True,683,-63.748931884765625,-67.93321990966797,1
Erin bought this concealed axis.,Erin bought these concealed axis.,morphology,determiner_noun_agreement,determiner_noun_agreement_with_adj_irregular_2,True,False,True,True,684,-61.5126953125,-64.93498229980469,1
Dan examines this long analysis.,Dan examines these long analysis.,morphology,determiner_noun_agreement,determiner_noun_agreement_with_adj_irregular_2,True,False,True,True,685,-47.33515167236328,-50.69136047363281,1
These drivers concealed these gray oxen.,These drivers concealed this gray oxen.,morphology,determiner_noun_agreement,determiner_noun_agreement_with_adj_irregular_2,True,False,True,True,686,-66.93359375,-66.45591735839844,0
All children impresses this happy man.,All children impresses these happy man.,morphology,determiner_noun_agreement,determiner_noun_agreement_with_adj_irregular_2,True,False,True,True,687,-59.4737548828125,-62.83146667480469,1
People will conceal that concealed man.,People will conceal those concealed man.,morphology,determiner_noun_agreement,determiner_noun_agreement_with_adj_irregular_2,True,False,True,True,688,-53.8298225402832,-54.62443542480469,1
Some patient returns to this old man.,Some patient returns to these old man.,morphology,determiner_noun_agreement,determiner_noun_agreement_with_adj_irregular_2,True,False,True,True,689,-48.09288024902344,-53.20669174194336,1
Many actresses discovered those big oases.,Many actresses discovered that big oases.,morphology,determiner_noun_agreement,determiner_noun_agreement_with_adj_irregular_2,True,False,True,True,690,-57.775474548339844,-59.93694305419922,1
The school talks about those young alumni.,The school talks about that young alumni.,morphology,determiner_noun_agreement,determiner_noun_agreement_with_adj_irregular_2,True,False,True,True,691,-47.130470275878906,-49.46125030517578,1
Omar admired these blue fungi.,Omar admired this blue fungi.,morphology,determiner_noun_agreement,determiner_noun_agreement_with_adj_irregular_2,True,False,True,True,692,-56.33737564086914,-58.078269958496094,1
Some school can't hate these good people.,Some school can't hate this good people.,morphology,determiner_noun_agreement,determiner_noun_agreement_with_adj_irregular_2,True,False,True,True,693,-50.30945587158203,-54.311424255371094,1
A lot of eggplants wouldn't disturb that determined woman.,A lot of eggplants wouldn't disturb those determined woman.,morphology,determiner_noun_agreement,determiner_noun_agreement_with_adj_irregular_2,True,False,True,True,694,-68.41729736328125,-74.08103942871094,1
That cake could annoy these uncertain men.,That cake could annoy this uncertain men.,morphology,determiner_noun_agreement,determiner_noun_agreement_with_adj_irregular_2,True,False,True,True,695,-61.93987274169922,-66.98817443847656,1
Lamps are worrying these hopeful alumni.,Lamps are worrying this hopeful alumni.,morphology,determiner_noun_agreement,determiner_noun_agreement_with_adj_irregular_2,True,False,True,True,696,-66.68563079833984,-70.69010162353516,1
A lot of eggplants bore these excited alumni.,A lot of eggplants bore this excited alumni.,morphology,determiner_noun_agreement,determiner_noun_agreement_with_adj_irregular_2,True,False,True,True,697,-68.78685760498047,-68.92437744140625,1
A lot of teachers arrived at these old oases.,A lot of teachers arrived at this old oases.,morphology,determiner_noun_agreement,determiner_noun_agreement_with_adj_irregular_2,True,False,True,True,698,-58.275001525878906,-58.86311721801758,1
Most sweaters hurt those happy people.,Most sweaters hurt that happy people.,morphology,determiner_noun_agreement,determiner_noun_agreement_with_adj_irregular_2,True,False,True,True,699,-57.92814636230469,-60.40308380126953,1
Tara scans those good analyses.,Tara scans that good analyses.,morphology,determiner_noun_agreement,determiner_noun_agreement_with_adj_irregular_2,True,False,True,True,700,-53.31523895263672,-54.1339111328125,1
The man doesn't reference this out in the open woman.,The man doesn't reference these out in the open woman.,morphology,determiner_noun_agreement,determiner_noun_agreement_with_adj_irregular_2,True,False,True,True,701,-67.16270446777344,-68.92901611328125,1
This cashier is leaving this employed person.,This cashier is leaving these employed person.,morphology,determiner_noun_agreement,determiner_noun_agreement_with_adj_irregular_2,True,False,True,True,702,-53.727210998535156,-59.83772277832031,1
Bananas bother these clever alumni.,Bananas bother this clever alumni.,morphology,determiner_noun_agreement,determiner_noun_agreement_with_adj_irregular_2,True,False,True,True,703,-57.62177658081055,-60.075218200683594,1
Some convertibles had worried those fast men.,Some convertibles had worried that fast men.,morphology,determiner_noun_agreement,determiner_noun_agreement_with_adj_irregular_2,True,False,True,True,704,-66.95320129394531,-64.2127685546875,0
Carl bored those nice women.,Carl bored that nice women.,morphology,determiner_noun_agreement,determiner_noun_agreement_with_adj_irregular_2,True,False,True,True,705,-47.92045974731445,-47.25788116455078,0
These teachers explore these old oases.,These teachers explore this old oases.,morphology,determiner_noun_agreement,determiner_noun_agreement_with_adj_irregular_2,True,False,True,True,706,-56.32830810546875,-57.57748794555664,1
Many waiters work with this scared child.,Many waiters work with these scared child.,morphology,determiner_noun_agreement,determiner_noun_agreement_with_adj_irregular_2,True,False,True,True,707,-54.32054138183594,-59.774192810058594,1
Committees admire that smart child.,Committees admire those smart child.,morphology,determiner_noun_agreement,determiner_noun_agreement_with_adj_irregular_2,True,False,True,True,708,-58.419456481933594,-62.14928436279297,1
Matt approaches this exposed child.,Matt approaches these exposed child.,morphology,determiner_noun_agreement,determiner_noun_agreement_with_adj_irregular_2,True,False,True,True,709,-52.30836486816406,-55.67966079711914,1
Brian talks to this lucky man.,Brian talks to these lucky man.,morphology,determiner_noun_agreement,determiner_noun_agreement_with_adj_irregular_2,True,False,True,True,710,-46.35108947753906,-52.30842208862305,1
A boy isn't talking about that red oasis.,A boy isn't talking about those red oasis.,morphology,determiner_noun_agreement,determiner_noun_agreement_with_adj_irregular_2,True,False,True,True,711,-62.01529312133789,-65.1882095336914,1
Phillip bought those black feet.,Phillip bought that black feet.,morphology,determiner_noun_agreement,determiner_noun_agreement_with_adj_irregular_2,True,False,True,True,712,-52.795196533203125,-55.862937927246094,1
Eric isn't buying those brown geese.,Eric isn't buying that brown geese.,morphology,determiner_noun_agreement,determiner_noun_agreement_with_adj_irregular_2,True,False,True,True,713,-54.24901580810547,-54.29933547973633,1
Elaine remembers this delighted woman.,Elaine remembers these delighted woman.,morphology,determiner_noun_agreement,determiner_noun_agreement_with_adj_irregular_2,True,False,True,True,714,-50.97610855102539,-54.963287353515625,1
This pedestrian arrives at that smooth oasis.,This pedestrian arrives at those smooth oasis.,morphology,determiner_noun_agreement,determiner_noun_agreement_with_adj_irregular_2,True,False,True,True,715,-59.052818298339844,-65.27262115478516,1
Those men forget these smart men.,Those men forget this smart men.,morphology,determiner_noun_agreement,determiner_noun_agreement_with_adj_irregular_2,True,False,True,True,716,-48.663753509521484,-51.19176483154297,1
Tara might alarm this unsure person.,Tara might alarm these unsure person.,morphology,determiner_noun_agreement,determiner_noun_agreement_with_adj_irregular_2,True,False,True,True,717,-61.77251434326172,-66.62872314453125,1
Vanessa was healing those purple geese.,Vanessa was healing that purple geese.,morphology,determiner_noun_agreement,determiner_noun_agreement_with_adj_irregular_2,True,False,True,True,718,-61.09639358520508,-59.335304260253906,0
Steven hasn't questioned those troubled people.,Steven hasn't questioned that troubled people.,morphology,determiner_noun_agreement,determiner_noun_agreement_with_adj_irregular_2,True,False,True,True,719,-54.98805618286133,-56.326026916503906,1
Thomas hides this clever woman.,Thomas hides these clever woman.,morphology,determiner_noun_agreement,determiner_noun_agreement_with_adj_irregular_2,True,False,True,True,720,-48.11689376831055,-52.24281311035156,1
Most eyes confuse these content alumni.,Most eyes confuse this content alumni.,morphology,determiner_noun_agreement,determiner_noun_agreement_with_adj_irregular_2,True,False,True,True,721,-60.49767303466797,-60.273887634277344,0
That dog aggravates this busy child.,That dog aggravates these busy child.,morphology,determiner_noun_agreement,determiner_noun_agreement_with_adj_irregular_2,True,False,True,True,722,-55.810787200927734,-60.40559387207031,1
Karen has attacked this popular child.,Karen has attacked these popular child.,morphology,determiner_noun_agreement,determiner_noun_agreement_with_adj_irregular_2,True,False,True,True,723,-54.64531326293945,-59.39473342895508,1
Heidi might confuse those displeased men.,Heidi might confuse that displeased men.,morphology,determiner_noun_agreement,determiner_noun_agreement_with_adj_irregular_2,True,False,True,True,724,-60.482479095458984,-61.887733459472656,1
Maria kisses this bad person.,Maria kisses these bad person.,morphology,determiner_noun_agreement,determiner_noun_agreement_with_adj_irregular_2,True,False,True,True,725,-49.41187286376953,-54.70726013183594,1
Tanya passes this purple oasis.,Tanya passes these purple oasis.,morphology,determiner_noun_agreement,determiner_noun_agreement_with_adj_irregular_2,True,False,True,True,726,-57.6352424621582,-61.8383674621582,1
Marla has respected those delighted alumni.,Marla has respected that delighted alumni.,morphology,determiner_noun_agreement,determiner_noun_agreement_with_adj_irregular_2,True,False,True,True,727,-67.3970947265625,-63.824249267578125,0
Paula is investigating this employed alumnus.,Paula is investigating these employed alumnus.,morphology,determiner_noun_agreement,determiner_noun_agreement_with_adj_irregular_2,True,False,True,True,728,-57.90741729736328,-61.680419921875,1
Most chairs aren't disgusting those serious women.,Most chairs aren't disgusting that serious women.,morphology,determiner_noun_agreement,determiner_noun_agreement_with_adj_irregular_2,True,False,True,True,729,-68.73165893554688,-67.608642578125,0
Men hadn't run around this purple oasis.,Men hadn't run around these purple oasis.,morphology,determiner_noun_agreement,determiner_noun_agreement_with_adj_irregular_2,True,False,True,True,730,-62.888145446777344,-67.05868530273438,1
Tina hadn't arrived at those green oases.,Tina hadn't arrived at that green oases.,morphology,determiner_noun_agreement,determiner_noun_agreement_with_adj_irregular_2,True,False,True,True,731,-63.078575134277344,-66.35028076171875,1
Karla knew this busy alumnus.,Karla knew these busy alumnus.,morphology,determiner_noun_agreement,determiner_noun_agreement_with_adj_irregular_2,True,False,True,True,732,-57.576812744140625,-61.551483154296875,1
The actors care for these exposed people.,The actors care for this exposed people.,morphology,determiner_noun_agreement,determiner_noun_agreement_with_adj_irregular_2,True,False,True,True,733,-48.629940032958984,-52.25090408325195,1
Michelle might alarm this employed man.,Michelle might alarm these employed man.,morphology,determiner_noun_agreement,determiner_noun_agreement_with_adj_irregular_2,True,False,True,True,734,-62.825340270996094,-66.61986541748047,1
Maria hasn't walked through these hard oases.,Maria hasn't walked through this hard oases.,morphology,determiner_noun_agreement,determiner_noun_agreement_with_adj_irregular_2,True,False,True,True,735,-63.81956100463867,-66.46880340576172,1
That report might disagree with those delighted men.,That report might disagree with that delighted men.,morphology,determiner_noun_agreement,determiner_noun_agreement_with_adj_irregular_2,True,False,True,True,736,-60.411415100097656,-61.879005432128906,1
Actresses discuss this popular person.,Actresses discuss these popular person.,morphology,determiner_noun_agreement,determiner_noun_agreement_with_adj_irregular_2,True,False,True,True,737,-49.78722381591797,-54.33754348754883,1
Holly won't watch these unlucky men.,Holly won't watch this unlucky men.,morphology,determiner_noun_agreement,determiner_noun_agreement_with_adj_irregular_2,True,False,True,True,738,-56.605812072753906,-60.21849822998047,1
Carl was driving to those blue oases.,Carl was driving to that blue oases.,morphology,determiner_noun_agreement,determiner_noun_agreement_with_adj_irregular_2,True,False,True,True,739,-57.506900787353516,-60.63733673095703,1
Bill passes that rough oasis.,Bill passes those rough oasis.,morphology,determiner_noun_agreement,determiner_noun_agreement_with_adj_irregular_2,True,False,True,True,740,-53.54571533203125,-55.936195373535156,1
All men praise this good thesis.,All men praise these good thesis.,morphology,determiner_noun_agreement,determiner_noun_agreement_with_adj_irregular_2,True,False,True,True,741,-51.988983154296875,-56.03364181518555,1
Many doctors should escape from these hopeful women.,Many doctors should escape from this hopeful women.,morphology,determiner_noun_agreement,determiner_noun_agreement_with_adj_irregular_2,True,False,True,True,742,-60.75000762939453,-63.35059356689453,1
Many girls find these nice men.,Many girls find this nice men.,morphology,determiner_noun_agreement,determiner_noun_agreement_with_adj_irregular_2,True,False,True,True,743,-44.47816467285156,-45.38154602050781,1
Every museum helps those concealed children.,Every museum helps that concealed children.,morphology,determiner_noun_agreement,determiner_noun_agreement_with_adj_irregular_2,True,False,True,True,744,-54.191505432128906,-58.686988830566406,1
Marla was distracting these determined people.,Marla was distracting this determined people.,morphology,determiner_noun_agreement,determiner_noun_agreement_with_adj_irregular_2,True,False,True,True,745,-57.608367919921875,-60.4471321105957,1
Those computers might confuse this nice child.,Those computers might confuse these nice child.,morphology,determiner_noun_agreement,determiner_noun_agreement_with_adj_irregular_2,True,False,True,True,746,-57.696712493896484,-61.96863555908203,1
Tanya hasn't loved that content woman.,Tanya hasn't loved those content woman.,morphology,determiner_noun_agreement,determiner_noun_agreement_with_adj_irregular_2,True,False,True,True,747,-59.160274505615234,-62.75722885131836,1
Theresa won't conceal those lost lice.,Theresa won't conceal that lost lice.,morphology,determiner_noun_agreement,determiner_noun_agreement_with_adj_irregular_2,True,False,True,True,748,-66.12513732910156,-66.43206024169922,1
The Borgias do cure these out in the open octopi.,The Borgias do cure this out in the open octopi.,morphology,determiner_noun_agreement,determiner_noun_agreement_with_adj_irregular_2,True,False,True,True,749,-84.08494567871094,-80.94743347167969,0
Kenneth messed up those lost teeth.,Kenneth messed up that lost teeth.,morphology,determiner_noun_agreement,determiner_noun_agreement_with_adj_irregular_2,True,False,True,True,750,-52.1843376159668,-51.03419494628906,0
Jodi doesn't alarm these unsure people.,Jodi doesn't alarm this unsure people.,morphology,determiner_noun_agreement,determiner_noun_agreement_with_adj_irregular_2,True,False,True,True,751,-62.43657684326172,-68.36039733886719,1
This customer scans those good analyses.,This customer scans that good analyses.,morphology,determiner_noun_agreement,determiner_noun_agreement_with_adj_irregular_2,True,False,True,True,752,-57.95360565185547,-57.03856658935547,0
Vincent can't watch this hopeful alumnus.,Vincent can't watch these hopeful alumnus.,morphology,determiner_noun_agreement,determiner_noun_agreement_with_adj_irregular_2,True,False,True,True,753,-62.07870864868164,-66.42134857177734,1
Jodi talked to this unconvinced child.,Jodi talked to these unconvinced child.,morphology,determiner_noun_agreement,determiner_noun_agreement_with_adj_irregular_2,True,False,True,True,754,-58.39191436767578,-64.69001770019531,1
Katherine exited these exposed oases.,Katherine exited this exposed oases.,morphology,determiner_noun_agreement,determiner_noun_agreement_with_adj_irregular_2,True,False,True,True,755,-64.90485382080078,-68.49342346191406,1
Beverly hasn't brought these rough fungi.,Beverly hasn't brought this rough fungi.,morphology,determiner_noun_agreement,determiner_noun_agreement_with_adj_irregular_2,True,False,True,True,756,-63.635398864746094,-63.29380798339844,0
That unicycle is boring those standing children.,That unicycle is boring that standing children.,morphology,determiner_noun_agreement,determiner_noun_agreement_with_adj_irregular_2,True,False,True,True,757,-66.14974975585938,-64.97866821289062,0
That boy can't escape from those unsure children.,That boy can't escape from that unsure children.,morphology,determiner_noun_agreement,determiner_noun_agreement_with_adj_irregular_2,True,False,True,True,758,-60.43654251098633,-60.720130920410156,1
An adult bought these black axes.,An adult bought this black axes.,morphology,determiner_noun_agreement,determiner_noun_agreement_with_adj_irregular_2,True,False,True,True,759,-55.86653137207031,-59.03477478027344,1
Sara isn't kissing this nice woman.,Sara isn't kissing these nice woman.,morphology,determiner_noun_agreement,determiner_noun_agreement_with_adj_irregular_2,True,False,True,True,760,-49.86296081542969,-56.404903411865234,1
Robert couldn't embarrass those scared people.,Robert couldn't embarrass that scared people.,morphology,determiner_noun_agreement,determiner_noun_agreement_with_adj_irregular_2,True,False,True,True,761,-57.88042068481445,-58.90005111694336,1
Deborah had fled from that important woman.,Deborah had fled from those important woman.,morphology,determiner_noun_agreement,determiner_noun_agreement_with_adj_irregular_2,True,False,True,True,762,-50.21177673339844,-57.63584518432617,1
Brenda discussed that serious woman.,Brenda discussed those serious woman.,morphology,determiner_noun_agreement,determiner_noun_agreement_with_adj_irregular_2,True,False,True,True,763,-53.383399963378906,-59.422550201416016,1
Some women questioned that big woman.,Some women questioned those big woman.,morphology,determiner_noun_agreement,determiner_noun_agreement_with_adj_irregular_2,True,False,True,True,764,-42.53766632080078,-51.303531646728516,1
Rodney didn't kiss those displeased women.,Rodney didn't kiss that displeased women.,morphology,determiner_noun_agreement,determiner_noun_agreement_with_adj_irregular_2,True,False,True,True,765,-55.3284797668457,-56.48403549194336,1
Carrie can help those lost alumni.,Carrie can help that lost alumni.,morphology,determiner_noun_agreement,determiner_noun_agreement_with_adj_irregular_2,True,False,True,True,766,-60.198570251464844,-63.37279510498047,1
Many guests approach this lucky man.,Many guests approach these lucky man.,morphology,determiner_noun_agreement,determiner_noun_agreement_with_adj_irregular_2,True,False,True,True,767,-45.23310852050781,-52.02153396606445,1
Some student messes up that hard foot.,Some student messes up those hard foot.,morphology,determiner_noun_agreement,determiner_noun_agreement_with_adj_irregular_2,True,False,True,True,768,-57.32083511352539,-61.96334457397461,1
Some men had skated around these hard oases.,Some men had skated around this hard oases.,morphology,determiner_noun_agreement,determiner_noun_agreement_with_adj_irregular_2,True,False,True,True,769,-67.1695327758789,-70.2751235961914,1
Some light would annoy those happy alumni.,Some light would annoy that happy alumni.,morphology,determiner_noun_agreement,determiner_noun_agreement_with_adj_irregular_2,True,False,True,True,770,-58.684574127197266,-59.48653030395508,1
Many casseroles shock these unconvinced men.,Many casseroles shock this unconvinced men.,morphology,determiner_noun_agreement,determiner_noun_agreement_with_adj_irregular_2,True,False,True,True,771,-68.28067016601562,-66.53950500488281,0
Carl talks about those confident children.,Carl talks about that confident children.,morphology,determiner_noun_agreement,determiner_noun_agreement_with_adj_irregular_2,True,False,True,True,772,-49.420570373535156,-50.663169860839844,1
Timothy was dropping by those new oases.,Timothy was dropping by that new oases.,morphology,determiner_noun_agreement,determiner_noun_agreement_with_adj_irregular_2,True,False,True,True,773,-61.03558349609375,-63.05280303955078,1
Lori has approached these scared people.,Lori has approached this scared people.,morphology,determiner_noun_agreement,determiner_noun_agreement_with_adj_irregular_2,True,False,True,True,774,-54.77507400512695,-55.37199020385742,1
Jodi wouldn't mess up those orange feet.,Jodi wouldn't mess up that orange feet.,morphology,determiner_noun_agreement,determiner_noun_agreement_with_adj_irregular_2,True,False,True,True,775,-61.91002655029297,-65.13920593261719,1
This newspaper article will embarrass this determined child.,This newspaper article will embarrass these determined child.,morphology,determiner_noun_agreement,determiner_noun_agreement_with_adj_irregular_2,True,False,True,True,776,-58.65809631347656,-64.50953674316406,1
A lot of guys conceal this long analysis.,A lot of guys conceal these long analysis.,morphology,determiner_noun_agreement,determiner_noun_agreement_with_adj_irregular_2,True,False,True,True,777,-55.04505157470703,-60.73337936401367,1
Lawrence fired that serious woman.,Lawrence fired those serious woman.,morphology,determiner_noun_agreement,determiner_noun_agreement_with_adj_irregular_2,True,False,True,True,778,-48.13917922973633,-54.11875915527344,1
This story didn't bore this serious man.,This story didn't bore these serious man.,morphology,determiner_noun_agreement,determiner_noun_agreement_with_adj_irregular_2,True,False,True,True,779,-53.23275375366211,-62.034912109375,1
Mary can't remember that clever person.,Mary can't remember those clever person.,morphology,determiner_noun_agreement,determiner_noun_agreement_with_adj_irregular_2,True,False,True,True,780,-46.41667175292969,-56.07217025756836,1
Marie could listen to that big woman.,Marie could listen to those big woman.,morphology,determiner_noun_agreement,determiner_noun_agreement_with_adj_irregular_2,True,False,True,True,781,-48.547325134277344,-54.85646057128906,1
Clyde had those exposed axes.,Clyde had that exposed axes.,morphology,determiner_noun_agreement,determiner_noun_agreement_with_adj_irregular_2,True,False,True,True,782,-61.027008056640625,-61.403114318847656,1
Victoria has left these delighted men.,Victoria has left this delighted men.,morphology,determiner_noun_agreement,determiner_noun_agreement_with_adj_irregular_2,True,False,True,True,783,-51.18132781982422,-53.01492691040039,1
