sentence_good,sentence_bad,field,linguistics_term,UID,simple_LM_method,one_prefix_method,two_prefix_method,lexically_identical,pair_id,good_prob,bad_prob,correct
Would Tammy ever have some mushrooms?,Tammy would ever have some mushrooms.,semantics,npi_licensing,matrix_question_npi_licensor_present,True,False,True,True,262,-51.9064826965332,-50.53675079345703,0
Had Lawrence ever found Helen?,Lawrence had ever found Helen.,semantics,npi_licensing,matrix_question_npi_licensor_present,True,False,True,True,263,-45.2305908203125,-48.05604553222656,1
Has Beverly ever fixed that unicycle?,Beverly has ever fixed that unicycle.,semantics,npi_licensing,matrix_question_npi_licensor_present,True,False,True,True,264,-59.220611572265625,-58.72627639770508,0
Could Phillip ever drive to a mall?,Phillip could ever drive to a mall.,semantics,npi_licensing,matrix_question_npi_licensor_present,True,False,True,True,265,-50.419246673583984,-52.807743072509766,1
Did that patient ever doubt Anna saw?,That patient did ever doubt Anna saw.,semantics,npi_licensing,matrix_question_npi_licensor_present,True,False,True,True,266,-59.5775260925293,-65.72040557861328,1
Has Phillip ever compromised?,Phillip has ever compromised.,semantics,npi_licensing,matrix_question_npi_licensor_present,True,False,True,True,267,-40.75614929199219,-40.106468200683594,0
Will the Lutherans ever describe Chad?,The Lutherans will ever describe Chad.,semantics,npi_licensing,matrix_question_npi_licensor_present,True,False,True,True,268,-53.74657440185547,-59.872806549072266,1
Had Mitchell ever smiled?,Mitchell had ever smiled.,semantics,npi_licensing,matrix_question_npi_licensor_present,True,False,True,True,269,-39.548683166503906,-39.10636901855469,0
Has this dress ever twirled?,This dress has ever twirled.,semantics,npi_licensing,matrix_question_npi_licensor_present,True,False,True,True,270,-39.73957824707031,-43.02305603027344,1
Had Rose ever changed?,Rose had ever changed.,semantics,npi_licensing,matrix_question_npi_licensor_present,True,False,True,True,271,-38.34218215942383,-37.61448669433594,0
Does Richard ever manage to go fishing?,Richard does ever manage to go fishing.,semantics,npi_licensing,matrix_question_npi_licensor_present,True,False,True,True,272,-49.7386360168457,-49.573486328125,0
Has a bank ever neglected to profit?,A bank has ever neglected to profit.,semantics,npi_licensing,matrix_question_npi_licensor_present,True,False,True,True,273,-50.5775260925293,-51.842140197753906,1
Had all convertibles ever moved?,All convertibles had ever moved.,semantics,npi_licensing,matrix_question_npi_licensor_present,True,False,True,True,274,-49.88493728637695,-48.88132858276367,0
Had Steven ever climbed down this mountain?,Steven had ever climbed down this mountain.,semantics,npi_licensing,matrix_question_npi_licensor_present,True,False,True,True,275,-52.077117919921875,-51.74805450439453,0
Could Carla ever salute?,Carla could ever salute.,semantics,npi_licensing,matrix_question_npi_licensor_present,True,False,True,True,276,-48.42210006713867,-48.16622543334961,0
Might every driver ever appear to know Bethany?,Every driver might ever appear to know Bethany.,semantics,npi_licensing,matrix_question_npi_licensor_present,True,False,True,True,277,-69.72219848632812,-63.673805236816406,0
Had Ruth ever turned out to testify?,Ruth had ever turned out to testify.,semantics,npi_licensing,matrix_question_npi_licensor_present,True,False,True,True,278,-53.35646438598633,-54.6406364440918,1
Had Dennis ever found Tiffany?,Dennis had ever found Tiffany.,semantics,npi_licensing,matrix_question_npi_licensor_present,True,False,True,True,279,-50.19121551513672,-49.336021423339844,0
Might those waitresses ever cooperate?,Those waitresses might ever cooperate.,semantics,npi_licensing,matrix_question_npi_licensor_present,True,False,True,True,280,-50.81704330444336,-53.31489562988281,1
Might James ever perform?,James might ever perform.,semantics,npi_licensing,matrix_question_npi_licensor_present,True,False,True,True,281,-42.716766357421875,-39.7054557800293,0
Could Tanya ever return to Mary?,Tanya could ever return to Mary.,semantics,npi_licensing,matrix_question_npi_licensor_present,True,False,True,True,282,-43.887306213378906,-49.413169860839844,1
Can all dancers ever find this skateboard?,All dancers can ever find this skateboard.,semantics,npi_licensing,matrix_question_npi_licensor_present,True,False,True,True,283,-52.87789535522461,-61.26110076904297,1
Had Lawrence ever observed Wayne?,Lawrence had ever observed Wayne.,semantics,npi_licensing,matrix_question_npi_licensor_present,True,False,True,True,284,-52.72673797607422,-53.56096267700195,1
Had that university ever surrendered?,That university had ever surrendered.,semantics,npi_licensing,matrix_question_npi_licensor_present,True,False,True,True,285,-47.065433502197266,-45.56273651123047,0
Has this museum ever revealed who perform?,This museum has ever revealed who perform.,semantics,npi_licensing,matrix_question_npi_licensor_present,True,False,True,True,286,-57.136436462402344,-57.732364654541016,1
Has Jason ever wept?,Jason has ever wept.,semantics,npi_licensing,matrix_question_npi_licensor_present,True,False,True,True,287,-35.222713470458984,-34.820804595947266,0
Have some girls ever descended most steps?,Some girls have ever descended most steps.,semantics,npi_licensing,matrix_question_npi_licensor_present,True,False,True,True,288,-63.30895233154297,-60.845157623291016,0
Had Harvard University ever remembered what might chat?,Harvard University had ever remembered what might chat.,semantics,npi_licensing,matrix_question_npi_licensor_present,True,False,True,True,289,-81.68240356445312,-75.38761901855469,0
Has Rhonda ever read?,Rhonda has ever read.,semantics,npi_licensing,matrix_question_npi_licensor_present,True,False,True,True,290,-37.78562545776367,-40.472206115722656,1
Has Stacey ever woken up?,Stacey has ever woken up.,semantics,npi_licensing,matrix_question_npi_licensor_present,True,False,True,True,291,-35.74079132080078,-39.27861022949219,1
Do gloves ever disappear?,Gloves do ever disappear.,semantics,npi_licensing,matrix_question_npi_licensor_present,True,False,True,True,292,-32.64529037475586,-40.88316345214844,1
Did Samuel ever suffer?,Samuel did ever suffer.,semantics,npi_licensing,matrix_question_npi_licensor_present,True,False,True,True,293,-35.04142761230469,-42.016117095947266,1
Could Carmen ever cough?,Carmen could ever cough.,semantics,npi_licensing,matrix_question_npi_licensor_present,True,False,True,True,294,-37.88198471069336,-43.05609893798828,1
Might the woman ever scratch?,The woman might ever scratch.,semantics,npi_licensing,matrix_question_npi_licensor_present,True,False,True,True,295,-41.495914459228516,-41.11479187011719,0
Can that icicle ever aggravate Tonya?,That icicle can ever aggravate Tonya.,semantics,npi_licensing,matrix_question_npi_licensor_present,True,False,True,True,296,-68.43516540527344,-69.61221313476562,1
Might Carmen ever hate this guest?,Carmen might ever hate this guest.,semantics,npi_licensing,matrix_question_npi_licensor_present,True,False,True,True,297,-61.00526428222656,-54.0745849609375,0
Should Tracy ever get fired?,Tracy should ever get fired.,semantics,npi_licensing,matrix_question_npi_licensor_present,True,False,True,True,298,-37.001800537109375,-38.08076477050781,1
Does Julie ever drive to grocery stores?,Julie does ever drive to grocery stores.,semantics,npi_licensing,matrix_question_npi_licensor_present,True,False,True,True,299,-47.7412109375,-55.336952209472656,1
Had some actors ever pushed the girls' supervisor to dislike Larry?,Some actors had ever pushed the girls' supervisor to dislike Larry.,semantics,npi_licensing,matrix_question_npi_licensor_present,True,False,True,True,300,-90.86296081542969,-89.65831756591797,0
Had Russell ever kissed Anna?,Russell had ever kissed Anna.,semantics,npi_licensing,matrix_question_npi_licensor_present,True,False,True,True,301,-47.18187713623047,-44.886104583740234,0
Had a lot of gates ever closed?,A lot of gates had ever closed.,semantics,npi_licensing,matrix_question_npi_licensor_present,True,False,True,True,302,-45.58781433105469,-46.814117431640625,1
Has this adult ever wondered who can debate?,This adult has ever wondered who can debate.,semantics,npi_licensing,matrix_question_npi_licensor_present,True,False,True,True,303,-58.947975158691406,-60.740814208984375,1
Should Maria ever talk about Scott?,Maria should ever talk about Scott.,semantics,npi_licensing,matrix_question_npi_licensor_present,True,False,True,True,304,-45.006263732910156,-53.13970947265625,1
Can some lamp ever darken?,Some lamp can ever darken.,semantics,npi_licensing,matrix_question_npi_licensor_present,True,False,True,True,305,-48.10349655151367,-45.551910400390625,0
Had Brian ever believed all couches to slip?,Brian had ever believed all couches to slip.,semantics,npi_licensing,matrix_question_npi_licensor_present,True,False,True,True,306,-78.96747589111328,-74.31455993652344,0
Can the lady ever move?,The lady can ever move.,semantics,npi_licensing,matrix_question_npi_licensor_present,True,False,True,True,307,-36.7768669128418,-39.851051330566406,1
Might Rebecca ever distract Jeffrey?,Rebecca might ever distract Jeffrey.,semantics,npi_licensing,matrix_question_npi_licensor_present,True,False,True,True,308,-59.44969177246094,-56.80242156982422,0
Had Teresa ever gone to a lot of rivers?,Teresa had ever gone to a lot of rivers.,semantics,npi_licensing,matrix_question_npi_licensor_present,True,False,True,True,309,-61.205841064453125,-60.64640808105469,0
Has Tara ever found these mirrors?,Tara has ever found these mirrors.,semantics,npi_licensing,matrix_question_npi_licensor_present,True,False,True,True,310,-46.77653121948242,-48.84642791748047,1
Had Jodi ever written?,Jodi had ever written.,semantics,npi_licensing,matrix_question_npi_licensor_present,True,False,True,True,311,-43.28219223022461,-41.27388000488281,0
Has Gregory ever refused to discuss Becky?,Gregory has ever refused to discuss Becky.,semantics,npi_licensing,matrix_question_npi_licensor_present,True,False,True,True,312,-55.707645416259766,-57.42939758300781,1
Might Roger ever hide away?,Roger might ever hide away.,semantics,npi_licensing,matrix_question_npi_licensor_present,True,False,True,True,313,-51.55358123779297,-46.84523010253906,0
Have some gloves ever flattened?,Some gloves have ever flattened.,semantics,npi_licensing,matrix_question_npi_licensor_present,True,False,True,True,314,-45.36363983154297,-45.0323486328125,0
Can a lot of men ever exist?,A lot of men can ever exist.,semantics,npi_licensing,matrix_question_npi_licensor_present,True,False,True,True,315,-39.65812683105469,-43.193931579589844,1
Has Christina ever nodded?,Christina has ever nodded.,semantics,npi_licensing,matrix_question_npi_licensor_present,True,False,True,True,316,-38.48317337036133,-40.807861328125,1
Would Leslie ever skate around every public park?,Leslie would ever skate around every public park.,semantics,npi_licensing,matrix_question_npi_licensor_present,True,False,True,True,317,-65.89065551757812,-64.13326263427734,0
Has Jane ever practiced?,Jane has ever practiced.,semantics,npi_licensing,matrix_question_npi_licensor_present,True,False,True,True,318,-40.55543518066406,-42.667022705078125,1
Have most actors ever disagreed?,Most actors have ever disagreed.,semantics,npi_licensing,matrix_question_npi_licensor_present,True,False,True,True,319,-44.713531494140625,-39.615352630615234,0
Has the legislature ever profited?,The legislature has ever profited.,semantics,npi_licensing,matrix_question_npi_licensor_present,True,False,True,True,320,-40.46392059326172,-44.960716247558594,1
Will that museum ever reference Ellen?,That museum will ever reference Ellen.,semantics,npi_licensing,matrix_question_npi_licensor_present,True,False,True,True,321,-54.12583923339844,-58.76813507080078,1
Has Peter ever healed Marie?,Peter has ever healed Marie.,semantics,npi_licensing,matrix_question_npi_licensor_present,True,False,True,True,322,-49.63652038574219,-51.446537017822266,1
Has Charles ever needed to cure Julie?,Charles has ever needed to cure Julie.,semantics,npi_licensing,matrix_question_npi_licensor_present,True,False,True,True,323,-55.67932891845703,-57.777931213378906,1
Has Gary ever played?,Gary has ever played.,semantics,npi_licensing,matrix_question_npi_licensor_present,True,False,True,True,324,-33.31645965576172,-37.19979476928711,1
Had Martin ever alarmed Michael?,Martin had ever alarmed Michael.,semantics,npi_licensing,matrix_question_npi_licensor_present,True,False,True,True,325,-49.836936950683594,-46.192718505859375,0
Has Phillip ever preferred Patrick to bake?,Phillip has ever preferred Patrick to bake.,semantics,npi_licensing,matrix_question_npi_licensor_present,True,False,True,True,326,-63.80232238769531,-60.37969207763672,0
Might most teenagers ever win?,Most teenagers might ever win.,semantics,npi_licensing,matrix_question_npi_licensor_present,True,False,True,True,327,-48.312255859375,-42.0141487121582,0
Could Sheila ever forget what vaporized?,Sheila could ever forget what vaporized.,semantics,npi_licensing,matrix_question_npi_licensor_present,True,False,True,True,328,-67.58879089355469,-58.885372161865234,0
Had a skirt ever stretched?,A skirt had ever stretched.,semantics,npi_licensing,matrix_question_npi_licensor_present,True,False,True,True,329,-44.642189025878906,-42.788963317871094,0
Had Rebecca ever appeared to stun Cheryl?,Rebecca had ever appeared to stun Cheryl.,semantics,npi_licensing,matrix_question_npi_licensor_present,True,False,True,True,330,-67.18482971191406,-63.93158721923828,0
Did Katherine ever convince most nephews of Amelia to cooperate?,Katherine did ever convince most nephews of Amelia to cooperate.,semantics,npi_licensing,matrix_question_npi_licensor_present,True,False,True,True,331,-78.8764877319336,-86.43889617919922,1
Would the Impressionists ever fight?,The Impressionists would ever fight.,semantics,npi_licensing,matrix_question_npi_licensor_present,True,False,True,True,332,-46.98540115356445,-46.59956359863281,0
Could Alice ever nod?,Alice could ever nod.,semantics,npi_licensing,matrix_question_npi_licensor_present,True,False,True,True,333,-37.67751693725586,-42.94019317626953,1
Had Becca ever want to waste away?,Becca had ever want to waste away.,semantics,npi_licensing,matrix_question_npi_licensor_present,True,False,True,True,334,-57.38229751586914,-53.67644119262695,0
Has Kayla ever said the Borgias chuckle?,Kayla has ever said the Borgias chuckle.,semantics,npi_licensing,matrix_question_npi_licensor_present,True,False,True,True,335,-67.44674682617188,-66.84162139892578,0
Should Guy ever listen to Brian?,Guy should ever listen to Brian.,semantics,npi_licensing,matrix_question_npi_licensor_present,True,False,True,True,336,-49.22826385498047,-47.73106002807617,0
Could Charles ever wear a hat?,Charles could ever wear a hat.,semantics,npi_licensing,matrix_question_npi_licensor_present,True,False,True,True,337,-45.2996711730957,-40.94445037841797,0
Has Rachelle ever believed some newspaper article to disagree?,Rachelle has ever believed some newspaper article to disagree.,semantics,npi_licensing,matrix_question_npi_licensor_present,True,False,True,True,338,-78.5743408203125,-79.71243286132812,1
Should Samuel ever stretch?,Samuel should ever stretch.,semantics,npi_licensing,matrix_question_npi_licensor_present,True,False,True,True,339,-42.75611114501953,-42.59837341308594,0
Did the doctor ever beg the university to bore Vincent?,The doctor did ever beg the university to bore Vincent.,semantics,npi_licensing,matrix_question_npi_licensor_present,True,False,True,True,340,-76.38633728027344,-81.60935974121094,1
Had George ever died?,George had ever died.,semantics,npi_licensing,matrix_question_npi_licensor_present,True,False,True,True,341,-34.393428802490234,-37.132450103759766,1
Would some wheelbarrow ever shatter?,Some wheelbarrow would ever shatter.,semantics,npi_licensing,matrix_question_npi_licensor_present,True,False,True,True,342,-59.06853103637695,-56.04991149902344,0
Should some ice ever melt?,Some ice should ever melt.,semantics,npi_licensing,matrix_question_npi_licensor_present,True,False,True,True,343,-37.24229431152344,-35.76948165893555,0
Might this jacket ever twist?,This jacket might ever twist.,semantics,npi_licensing,matrix_question_npi_licensor_present,True,False,True,True,344,-47.065673828125,-46.85110092163086,0
Has Rebecca ever driven to some closet?,Rebecca has ever driven to some closet.,semantics,npi_licensing,matrix_question_npi_licensor_present,True,False,True,True,345,-57.36933135986328,-61.03085708618164,1
Had Mark ever climbed down this mountain?,Mark had ever climbed down this mountain.,semantics,npi_licensing,matrix_question_npi_licensor_present,True,False,True,True,346,-50.60693359375,-49.78164291381836,0
Has Lisa ever joked around?,Lisa has ever joked around.,semantics,npi_licensing,matrix_question_npi_licensor_present,True,False,True,True,347,-40.36921691894531,-42.639774322509766,1
Could a candle ever dim?,A candle could ever dim.,semantics,npi_licensing,matrix_question_npi_licensor_present,True,False,True,True,348,-42.261436462402344,-40.944190979003906,0
Will all adults ever stretch?,All adults will ever stretch.,semantics,npi_licensing,matrix_question_npi_licensor_present,True,False,True,True,349,-43.21683120727539,-45.737091064453125,1
Have the waiters ever praised Julia?,The waiters have ever praised Julia.,semantics,npi_licensing,matrix_question_npi_licensor_present,True,False,True,True,350,-59.860694885253906,-53.362709045410156,0
Have some icicles ever vaporized?,Some icicles have ever vaporized.,semantics,npi_licensing,matrix_question_npi_licensor_present,True,False,True,True,351,-49.97011947631836,-49.032745361328125,0
Would Deanna ever clean most gloves?,Deanna would ever clean most gloves.,semantics,npi_licensing,matrix_question_npi_licensor_present,True,False,True,True,352,-62.409507751464844,-63.48329162597656,1
Has a mushroom ever charred?,A mushroom has ever charred.,semantics,npi_licensing,matrix_question_npi_licensor_present,True,False,True,True,353,-48.21549987792969,-42.32962417602539,0
Will Vanessa ever commission Connie to escape?,Vanessa will ever commission Connie to escape.,semantics,npi_licensing,matrix_question_npi_licensor_present,True,False,True,True,354,-67.1872787475586,-70.53811645507812,1
Had that art gallery ever existed?,That art gallery had ever existed.,semantics,npi_licensing,matrix_question_npi_licensor_present,True,False,True,True,355,-43.84331130981445,-41.00609588623047,0
Has Victoria ever spun around?,Victoria has ever spun around.,semantics,npi_licensing,matrix_question_npi_licensor_present,True,False,True,True,356,-40.778587341308594,-43.125892639160156,1
Would Jane ever compel Lissa to answer?,Jane would ever compel Lissa to answer.,semantics,npi_licensing,matrix_question_npi_licensor_present,True,False,True,True,357,-66.09815216064453,-66.32582092285156,1
Would every patient ever explain everything?,Every patient would ever explain everything.,semantics,npi_licensing,matrix_question_npi_licensor_present,True,False,True,True,358,-49.191062927246094,-48.03443908691406,0
Did the mouths ever stun Jesus?,The mouths did ever stun Jesus.,semantics,npi_licensing,matrix_question_npi_licensor_present,True,False,True,True,359,-49.349754333496094,-57.48249435424805,1
Has Tara ever stretched?,Tara has ever stretched.,semantics,npi_licensing,matrix_question_npi_licensor_present,True,False,True,True,360,-35.54836654663086,-37.37750244140625,1
Will Kristin ever yearn to remember a teacher?,Kristin will ever yearn to remember a teacher.,semantics,npi_licensing,matrix_question_npi_licensor_present,True,False,True,True,361,-60.957672119140625,-67.00701141357422,1
Can Richard ever pass the hill?,Richard can ever pass the hill.,semantics,npi_licensing,matrix_question_npi_licensor_present,True,False,True,True,362,-47.47631072998047,-49.557830810546875,1
Has Jodi ever cooked?,Jodi has ever cooked.,semantics,npi_licensing,matrix_question_npi_licensor_present,True,False,True,True,363,-37.797401428222656,-39.521697998046875,1
Has this dress ever crumpled?,This dress has ever crumpled.,semantics,npi_licensing,matrix_question_npi_licensor_present,True,False,True,True,364,-39.57933044433594,-42.259033203125,1
Has Kimberley ever disturbed a lot of teenagers?,Kimberley has ever disturbed a lot of teenagers.,semantics,npi_licensing,matrix_question_npi_licensor_present,True,False,True,True,365,-54.1010627746582,-54.54365539550781,1
Has Danielle ever appeared to fire Theresa?,Danielle has ever appeared to fire Theresa.,semantics,npi_licensing,matrix_question_npi_licensor_present,True,False,True,True,366,-63.60395812988281,-64.80178833007812,1
Would some actors ever benefit?,Some actors would ever benefit.,semantics,npi_licensing,matrix_question_npi_licensor_present,True,False,True,True,367,-43.77909469604492,-41.52370834350586,0
Has Heidi ever sneezed?,Heidi has ever sneezed.,semantics,npi_licensing,matrix_question_npi_licensor_present,True,False,True,True,368,-39.72972106933594,-40.12052917480469,1
Had Candice ever tried to hurt Tara?,Candice had ever tried to hurt Tara.,semantics,npi_licensing,matrix_question_npi_licensor_present,True,False,True,True,369,-57.069637298583984,-56.937103271484375,0
Had Gary ever confused some cashier?,Gary had ever confused some cashier.,semantics,npi_licensing,matrix_question_npi_licensor_present,True,False,True,True,370,-62.279876708984375,-63.08642578125,1
Could Aaron ever exercise?,Aaron could ever exercise.,semantics,npi_licensing,matrix_question_npi_licensor_present,True,False,True,True,371,-41.61730194091797,-43.429954528808594,1
Should Dawn ever yearn to worry Joseph?,Dawn should ever yearn to worry Joseph.,semantics,npi_licensing,matrix_question_npi_licensor_present,True,False,True,True,372,-71.02899169921875,-75.05081176757812,1
Can Cindy ever leave?,Cindy can ever leave.,semantics,npi_licensing,matrix_question_npi_licensor_present,True,False,True,True,373,-35.46636199951172,-41.107444763183594,1
Has Margaret ever hated Jill?,Margaret has ever hated Jill.,semantics,npi_licensing,matrix_question_npi_licensor_present,True,False,True,True,374,-47.8634033203125,-44.376129150390625,0
Could Elizabeth ever implore every nephew of Karen to disgust that pedestrian?,Elizabeth could ever implore every nephew of Karen to disgust that pedestrian.,semantics,npi_licensing,matrix_question_npi_licensor_present,True,False,True,True,375,-112.04887390136719,-108.77409362792969,0
Had some legislature ever testified?,Some legislature had ever testified.,semantics,npi_licensing,matrix_question_npi_licensor_present,True,False,True,True,376,-57.77000045776367,-52.00181579589844,0
Had most organizations ever collaborated?,Most organizations had ever collaborated.,semantics,npi_licensing,matrix_question_npi_licensor_present,True,False,True,True,377,-47.16560363769531,-41.63355255126953,0
Have the Impressionists ever benefited?,The Impressionists have ever benefited.,semantics,npi_licensing,matrix_question_npi_licensor_present,True,False,True,True,378,-48.51153564453125,-47.77167892456055,0
Can Thomas ever alarm Tammy?,Thomas can ever alarm Tammy.,semantics,npi_licensing,matrix_question_npi_licensor_present,True,False,True,True,379,-50.70825958251953,-58.74433135986328,1
Had the Clintons ever forfeited?,The Clintons had ever forfeited.,semantics,npi_licensing,matrix_question_npi_licensor_present,True,False,True,True,380,-46.5135498046875,-46.410484313964844,0
Might Kristen ever joke around?,Kristen might ever joke around.,semantics,npi_licensing,matrix_question_npi_licensor_present,True,False,True,True,381,-53.92802429199219,-48.68627166748047,0
Can the socks ever crumple?,The socks can ever crumple.,semantics,npi_licensing,matrix_question_npi_licensor_present,True,False,True,True,382,-42.194580078125,-45.57078552246094,1
Does Brian ever fall asleep?,Brian does ever fall asleep.,semantics,npi_licensing,matrix_question_npi_licensor_present,True,False,True,True,383,-45.31608581542969,-39.68168640136719,0
Would Gerald ever break the computer?,Gerald would ever break the computer.,semantics,npi_licensing,matrix_question_npi_licensor_present,True,False,True,True,384,-53.004302978515625,-51.34715270996094,0
Had the rice ever burned?,The rice had ever burned.,semantics,npi_licensing,matrix_question_npi_licensor_present,True,False,True,True,385,-43.7684326171875,-41.37091827392578,0
Has Marla ever departed?,Marla has ever departed.,semantics,npi_licensing,matrix_question_npi_licensor_present,True,False,True,True,386,-42.00440979003906,-44.99958038330078,1
Would an adult ever cough?,An adult would ever cough.,semantics,npi_licensing,matrix_question_npi_licensor_present,True,False,True,True,387,-38.77635192871094,-45.40571594238281,1
Have a lot of governments ever pressed people's contractor to mess up these glasses?,A lot of governments have ever pressed people's contractor to mess up these glasses.,semantics,npi_licensing,matrix_question_npi_licensor_present,True,False,True,True,388,-105.46257019042969,-98.495361328125,0
Could Matt ever scream?,Matt could ever scream.,semantics,npi_licensing,matrix_question_npi_licensor_present,True,False,True,True,389,-41.69950866699219,-40.3587646484375,0
Can Carmen ever hurt these guys?,Carmen can ever hurt these guys.,semantics,npi_licensing,matrix_question_npi_licensor_present,True,False,True,True,390,-44.64820861816406,-50.3175048828125,1
Will Martin ever walk through most art galleries?,Martin will ever walk through most art galleries.,semantics,npi_licensing,matrix_question_npi_licensor_present,True,False,True,True,391,-54.833106994628906,-61.16082000732422,1
Did Alicia ever wonder what might drop?,Alicia did ever wonder what might drop.,semantics,npi_licensing,matrix_question_npi_licensor_present,True,False,True,True,392,-50.66796112060547,-61.24449157714844,1
