sentence_good,sentence_bad,field,linguistics_term,UID,simple_LM_method,one_prefix_method,two_prefix_method,lexically_identical,pair_id,good_prob,bad_prob,correct
Alexander didn't walk through that new oasis.,Alexander didn't walk through those new oasis.,morphology,determiner_noun_agreement,determiner_noun_agreement_with_adj_irregular_2,True,False,True,True,0,-56.55781555175781,-62.4500617980957,1
This hair irritates these old alumni.,This hair irritates this old alumni.,morphology,determiner_noun_agreement,determiner_noun_agreement_with_adj_irregular_2,True,False,True,True,1,-59.71854019165039,-62.824424743652344,1
Winston Churchill was escaping from this serious person.,Winston Churchill was escaping from these serious person.,morphology,determiner_noun_agreement,determiner_noun_agreement_with_adj_irregular_2,True,False,True,True,2,-56.321441650390625,-62.40652084350586,1
Anna walks through these purple oases.,Anna walks through this purple oases.,morphology,determiner_noun_agreement,determiner_noun_agreement_with_adj_irregular_2,True,False,True,True,3,-54.01116943359375,-56.962005615234375,1
Alicia sounded like this good analysis.,Alicia sounded like these good analysis.,morphology,determiner_noun_agreement,determiner_noun_agreement_with_adj_irregular_2,True,False,True,True,4,-56.39732360839844,-58.956520080566406,1
Jeffrey might complain about this gray thesis.,Jeffrey might complain about these gray thesis.,morphology,determiner_noun_agreement,determiner_noun_agreement_with_adj_irregular_2,True,False,True,True,5,-62.926780700683594,-67.19611358642578,1
Meredith approaches these concealed women.,Meredith approaches this concealed women.,morphology,determiner_noun_agreement,determiner_noun_agreement_with_adj_irregular_2,True,False,True,True,6,-55.33081817626953,-55.70966720581055,1
Julia questioned those small children.,Julia questioned that small children.,morphology,determiner_noun_agreement,determiner_noun_agreement_with_adj_irregular_2,True,False,True,True,7,-48.77478790283203,-50.19279479980469,1
That adult has brought that purple octopus.,That adult has brought those purple octopus.,morphology,determiner_noun_agreement,determiner_noun_agreement_with_adj_irregular_2,True,False,True,True,8,-61.501991271972656,-66.14759826660156,1
The people hug this displeased woman.,The people hug these displeased woman.,morphology,determiner_noun_agreement,determiner_noun_agreement_with_adj_irregular_2,True,False,True,True,9,-50.23533630371094,-55.09300994873047,1
That beef did bore these displeased people.,That beef did bore this displeased people.,morphology,determiner_noun_agreement,determiner_noun_agreement_with_adj_irregular_2,True,False,True,True,10,-67.38199615478516,-66.79840850830078,0
These libraries talk about these long synopses.,These libraries talk about this long synopses.,morphology,determiner_noun_agreement,determiner_noun_agreement_with_adj_irregular_2,True,False,True,True,11,-52.51548767089844,-57.06427001953125,1
Lori wasn't hiring those delighted men.,Lori wasn't hiring that delighted men.,morphology,determiner_noun_agreement,determiner_noun_agreement_with_adj_irregular_2,True,False,True,True,12,-62.53826141357422,-62.689971923828125,1
The teachers are running around this concealed oasis.,The teachers are running around these concealed oasis.,morphology,determiner_noun_agreement,determiner_noun_agreement_with_adj_irregular_2,True,False,True,True,13,-64.97293090820312,-68.25181579589844,1
Those bananas embarrass these delighted people.,Those bananas embarrass this delighted people.,morphology,determiner_noun_agreement,determiner_noun_agreement_with_adj_irregular_2,True,False,True,True,14,-59.38072967529297,-61.064823150634766,1
Mitchell brought those green oases.,Mitchell brought that green oases.,morphology,determiner_noun_agreement,determiner_noun_agreement_with_adj_irregular_2,True,False,True,True,15,-56.51885223388672,-56.820438385009766,1
The actresses complain about this rough thesis.,The actresses complain about these rough thesis.,morphology,determiner_noun_agreement,determiner_noun_agreement_with_adj_irregular_2,True,False,True,True,16,-61.638267517089844,-67.53902435302734,1
Russell investigates these fast women.,Russell investigates this fast women.,morphology,determiner_noun_agreement,determiner_noun_agreement_with_adj_irregular_2,True,False,True,True,17,-52.662933349609375,-54.28491973876953,1
Irene praised those bad synopses.,Irene praised that bad synopses.,morphology,determiner_noun_agreement,determiner_noun_agreement_with_adj_irregular_2,True,False,True,True,18,-58.18840408325195,-56.97798156738281,0
Denise did confuse that important woman.,Denise did confuse those important woman.,morphology,determiner_noun_agreement,determiner_noun_agreement_with_adj_irregular_2,True,False,True,True,19,-54.69568634033203,-61.980342864990234,1
Some patients dislike those nice women.,Some patients dislike that nice women.,morphology,determiner_noun_agreement,determiner_noun_agreement_with_adj_irregular_2,True,False,True,True,20,-46.29460906982422,-44.88783264160156,0
Amelia wasn't observing this hopeful man.,Amelia wasn't observing these hopeful man.,morphology,determiner_noun_agreement,determiner_noun_agreement_with_adj_irregular_2,True,False,True,True,21,-61.2716178894043,-65.81433868408203,1
Grace is hugging these popular women.,Grace is hugging this popular women.,morphology,determiner_noun_agreement,determiner_noun_agreement_with_adj_irregular_2,True,False,True,True,22,-49.757442474365234,-52.27061080932617,1
Julia might describe this long synopsis.,Julia might describe these long synopsis.,morphology,determiner_noun_agreement,determiner_noun_agreement_with_adj_irregular_2,True,False,True,True,23,-54.1933708190918,-56.082489013671875,1
Many pedestrians do return to these happy men.,Many pedestrians do return to this happy men.,morphology,determiner_noun_agreement,determiner_noun_agreement_with_adj_irregular_2,True,False,True,True,24,-58.20848083496094,-61.4665641784668,1
Laura noticed that determined man.,Laura noticed those determined man.,morphology,determiner_noun_agreement,determiner_noun_agreement_with_adj_irregular_2,True,False,True,True,25,-51.50348663330078,-56.148033142089844,1
Julie would pass those red oases.,Julie would pass that red oases.,morphology,determiner_noun_agreement,determiner_noun_agreement_with_adj_irregular_2,True,False,True,True,26,-58.673004150390625,-63.89039611816406,1
These doctors boast about this out in the open child.,These doctors boast about these out in the open child.,morphology,determiner_noun_agreement,determiner_noun_agreement_with_adj_irregular_2,True,False,True,True,27,-74.61485290527344,-74.86553955078125,1
Stephen isn't revealing this brown nucleus.,Stephen isn't revealing these brown nucleus.,morphology,determiner_noun_agreement,determiner_noun_agreement_with_adj_irregular_2,True,False,True,True,28,-65.02729797363281,-70.80829620361328,1
Travel stuns that sick child.,Travel stuns those sick child.,morphology,determiner_noun_agreement,determiner_noun_agreement_with_adj_irregular_2,True,False,True,True,29,-53.36310577392578,-60.03588104248047,1
Amelia healed that unemployed woman.,Amelia healed those unemployed woman.,morphology,determiner_noun_agreement,determiner_noun_agreement_with_adj_irregular_2,True,False,True,True,30,-56.14991760253906,-60.93934631347656,1
Noah attacks that ill child.,Noah attacks those ill child.,morphology,determiner_noun_agreement,determiner_noun_agreement_with_adj_irregular_2,True,False,True,True,31,-52.32280731201172,-54.260250091552734,1
Randolf buys those gray fungi.,Randolf buys that gray fungi.,morphology,determiner_noun_agreement,determiner_noun_agreement_with_adj_irregular_2,True,False,True,True,32,-64.9619140625,-67.48050689697266,1
Some pedestrians disagreed with this big woman.,Some pedestrians disagreed with these big woman.,morphology,determiner_noun_agreement,determiner_noun_agreement_with_adj_irregular_2,True,False,True,True,33,-52.91681671142578,-59.12034606933594,1
Adam might sound like these determined children.,Adam might sound like this determined children.,morphology,determiner_noun_agreement,determiner_noun_agreement_with_adj_irregular_2,True,False,True,True,34,-55.956748962402344,-56.562255859375,1
Bill has stunned this confident man.,Bill has stunned these confident man.,morphology,determiner_noun_agreement,determiner_noun_agreement_with_adj_irregular_2,True,False,True,True,35,-46.84516906738281,-53.726593017578125,1
Rhonda should see these blue oases.,Rhonda should see this blue oases.,morphology,determiner_noun_agreement,determiner_noun_agreement_with_adj_irregular_2,True,False,True,True,36,-57.822269439697266,-61.2041015625,1
Stephen cares for that out in the open alumnus.,Stephen cares for those out in the open alumnus.,morphology,determiner_noun_agreement,determiner_noun_agreement_with_adj_irregular_2,True,False,True,True,37,-67.64678955078125,-67.74369049072266,1
Cheryl has bought this green oasis.,Cheryl has bought these green oasis.,morphology,determiner_noun_agreement,determiner_noun_agreement_with_adj_irregular_2,True,False,True,True,38,-52.24402618408203,-59.29039764404297,1
Every door annoyed this lucky child.,Every door annoyed these lucky child.,morphology,determiner_noun_agreement,determiner_noun_agreement_with_adj_irregular_2,True,False,True,True,39,-53.48324966430664,-58.01142120361328,1
Gerald cures that unlucky child.,Gerald cures those unlucky child.,morphology,determiner_noun_agreement,determiner_noun_agreement_with_adj_irregular_2,True,False,True,True,40,-55.718528747558594,-62.425254821777344,1
Eyes weren't worrying this troubled child.,Eyes weren't worrying these troubled child.,morphology,determiner_noun_agreement,determiner_noun_agreement_with_adj_irregular_2,True,False,True,True,41,-57.64174270629883,-63.49504470825195,1
Michael isn't referencing this long synopsis.,Michael isn't referencing these long synopsis.,morphology,determiner_noun_agreement,determiner_noun_agreement_with_adj_irregular_2,True,False,True,True,42,-53.90996551513672,-57.14033508300781,1
Robert insults this serious man.,Robert insults these serious man.,morphology,determiner_noun_agreement,determiner_noun_agreement_with_adj_irregular_2,True,False,True,True,43,-44.66173553466797,-48.830360412597656,1
Waitresses describe that smart alumnus.,Waitresses describe those smart alumnus.,morphology,determiner_noun_agreement,determiner_noun_agreement_with_adj_irregular_2,True,False,True,True,44,-58.85837173461914,-59.52955627441406,1
Dan doesn't respect this unemployed alumnus.,Dan doesn't respect these unemployed alumnus.,morphology,determiner_noun_agreement,determiner_noun_agreement_with_adj_irregular_2,True,False,True,True,45,-58.20219421386719,-62.559791564941406,1
Eric has upset those scared people.,Eric has upset that scared people.,morphology,determiner_noun_agreement,determiner_noun_agreement_with_adj_irregular_2,True,False,True,True,46,-51.23418426513672,-52.25675964355469,1
Sabrina was biking to this exposed oasis.,Sabrina was biking to these exposed oasis.,morphology,determiner_noun_agreement,determiner_noun_agreement_with_adj_irregular_2,True,False,True,True,47,-69.92272186279297,-73.82744598388672,1
Edward can't think about these exposed mice.,Edward can't think about this exposed mice.,morphology,determiner_noun_agreement,determiner_noun_agreement_with_adj_irregular_2,True,False,True,True,48,-57.132408142089844,-60.4847412109375,1
Phillip listened to this standing alumnus.,Phillip listened to these standing alumnus.,morphology,determiner_noun_agreement,determiner_noun_agreement_with_adj_irregular_2,True,False,True,True,49,-58.675987243652344,-62.75328826904297,1
Those men skate around this small oasis.,Those men skate around these small oasis.,morphology,determiner_noun_agreement,determiner_noun_agreement_with_adj_irregular_2,True,False,True,True,50,-51.590118408203125,-56.842010498046875,1
Rhonda could think about those content children.,Rhonda could think about that content children.,morphology,determiner_noun_agreement,determiner_noun_agreement_with_adj_irregular_2,True,False,True,True,51,-56.96703338623047,-59.34983825683594,1
Melissa had remembered that unsure person.,Melissa had remembered those unsure person.,morphology,determiner_noun_agreement,determiner_noun_agreement_with_adj_irregular_2,True,False,True,True,52,-50.86003875732422,-58.82924270629883,1
The students talk about this upset person.,The students talk about these upset person.,morphology,determiner_noun_agreement,determiner_noun_agreement_with_adj_irregular_2,True,False,True,True,53,-49.00373077392578,-53.44960021972656,1
Leslie insults those upset alumni.,Leslie insults that upset alumni.,morphology,determiner_noun_agreement,determiner_noun_agreement_with_adj_irregular_2,True,False,True,True,54,-58.70301055908203,-53.838050842285156,0
Hats distract this ill man.,Hats distract these ill man.,morphology,determiner_noun_agreement,determiner_noun_agreement_with_adj_irregular_2,True,False,True,True,55,-50.64854431152344,-53.698577880859375,1
Dawn sounded like this determined child.,Dawn sounded like these determined child.,morphology,determiner_noun_agreement,determiner_noun_agreement_with_adj_irregular_2,True,False,True,True,56,-51.33241653442383,-58.62804412841797,1
Carl had run around that brown oasis.,Carl had run around those brown oasis.,morphology,determiner_noun_agreement,determiner_noun_agreement_with_adj_irregular_2,True,False,True,True,57,-60.28636169433594,-62.98680877685547,1
Anna criticizes these concealed children.,Anna criticizes this concealed children.,morphology,determiner_noun_agreement,determiner_noun_agreement_with_adj_irregular_2,True,False,True,True,58,-57.76388168334961,-59.775291442871094,1
The waiter might criticize that unemployed man.,The waiter might criticize those unemployed man.,morphology,determiner_noun_agreement,determiner_noun_agreement_with_adj_irregular_2,True,False,True,True,59,-54.890708923339844,-60.90801239013672,1
Tracy was investigating this troubled alumnus.,Tracy was investigating these troubled alumnus.,morphology,determiner_noun_agreement,determiner_noun_agreement_with_adj_irregular_2,True,False,True,True,60,-55.97877502441406,-58.7017822265625,1
These newspaper articles astound this clever child.,These newspaper articles astound these clever child.,morphology,determiner_noun_agreement,determiner_noun_agreement_with_adj_irregular_2,True,False,True,True,61,-55.74219512939453,-61.1802978515625,1
Dana hadn't attacked this small man.,Dana hadn't attacked these small man.,morphology,determiner_noun_agreement,determiner_noun_agreement_with_adj_irregular_2,True,False,True,True,62,-53.51594161987305,-58.797088623046875,1
Curtis wasn't breaking those hard teeth.,Curtis wasn't breaking that hard teeth.,morphology,determiner_noun_agreement,determiner_noun_agreement_with_adj_irregular_2,True,False,True,True,63,-54.295936584472656,-57.628639221191406,1
All customers attack this employed alumnus.,All customers attack these employed alumnus.,morphology,determiner_noun_agreement,determiner_noun_agreement_with_adj_irregular_2,True,False,True,True,64,-68.85237121582031,-70.06552124023438,1
Most ladies go to those purple oases.,Most ladies go to that purple oases.,morphology,determiner_noun_agreement,determiner_noun_agreement_with_adj_irregular_2,True,False,True,True,65,-57.61736297607422,-60.24919128417969,1
A dancer tours that blue oasis.,A dancer tours those blue oasis.,morphology,determiner_noun_agreement,determiner_noun_agreement_with_adj_irregular_2,True,False,True,True,66,-62.528804779052734,-59.02908706665039,0
Steven irritated this unconvinced woman.,Steven irritated these unconvinced woman.,morphology,determiner_noun_agreement,determiner_noun_agreement_with_adj_irregular_2,True,False,True,True,67,-51.57581329345703,-58.1778678894043,1
Tara wasn't helping that sick man.,Tara wasn't helping those sick man.,morphology,determiner_noun_agreement,determiner_noun_agreement_with_adj_irregular_2,True,False,True,True,68,-48.811832427978516,-55.08831787109375,1
The dancers aren't cleaning that smooth fungus.,The dancers aren't cleaning those smooth fungus.,morphology,determiner_noun_agreement,determiner_noun_agreement_with_adj_irregular_2,True,False,True,True,69,-62.86595916748047,-65.89049530029297,1
Melissa had talked about these white theses.,Melissa had talked about this white theses.,morphology,determiner_noun_agreement,determiner_noun_agreement_with_adj_irregular_2,True,False,True,True,70,-54.99526596069336,-57.830162048339844,1
The man isn't watching those upset men.,The man isn't watching that upset men.,morphology,determiner_noun_agreement,determiner_noun_agreement_with_adj_irregular_2,True,False,True,True,71,-53.023956298828125,-55.54615020751953,1
Sabrina won't worry this out in the open person.,Sabrina won't worry these out in the open person.,morphology,determiner_noun_agreement,determiner_noun_agreement_with_adj_irregular_2,True,False,True,True,72,-72.13056182861328,-74.6495590209961,1
Every bird embarrassed these unemployed men.,Every bird embarrassed this unemployed men.,morphology,determiner_noun_agreement,determiner_noun_agreement_with_adj_irregular_2,True,False,True,True,73,-59.54961013793945,-64.47803497314453,1
The Borgias drive to that small oasis.,The Borgias drive to those small oasis.,morphology,determiner_noun_agreement,determiner_noun_agreement_with_adj_irregular_2,True,False,True,True,74,-64.04951477050781,-70.27816772460938,1
Bradley likes these brown fungi.,Bradley likes this brown fungi.,morphology,determiner_noun_agreement,determiner_noun_agreement_with_adj_irregular_2,True,False,True,True,75,-51.322776794433594,-52.63008499145508,1
Most guys go to that black oasis.,Most guys go to those black oasis.,morphology,determiner_noun_agreement,determiner_noun_agreement_with_adj_irregular_2,True,False,True,True,76,-51.5020866394043,-56.66891098022461,1
A pedestrian hadn't approached these hopeful women.,A pedestrian hadn't approached this hopeful women.,morphology,determiner_noun_agreement,determiner_noun_agreement_with_adj_irregular_2,True,False,True,True,77,-63.631858825683594,-64.71234130859375,1
Some senators aren't healing this unemployed alumnus.,Some senators aren't healing these unemployed alumnus.,morphology,determiner_noun_agreement,determiner_noun_agreement_with_adj_irregular_2,True,False,True,True,78,-68.2186279296875,-72.67584228515625,1
That cart wasn't stunning these exposed men.,That cart wasn't stunning this exposed men.,morphology,determiner_noun_agreement,determiner_noun_agreement_with_adj_irregular_2,True,False,True,True,79,-67.98318481445312,-72.52303314208984,1
Joel can think about this smart man.,Joel can think about these smart man.,morphology,determiner_noun_agreement,determiner_noun_agreement_with_adj_irregular_2,True,False,True,True,80,-47.51009750366211,-54.27949523925781,1
Those prints disgust those good people.,Those prints disgust that good people.,morphology,determiner_noun_agreement,determiner_noun_agreement_with_adj_irregular_2,True,False,True,True,81,-49.09602355957031,-51.63343811035156,1
Beverly hadn't passed these yellow oases.,Beverly hadn't passed this yellow oases.,morphology,determiner_noun_agreement,determiner_noun_agreement_with_adj_irregular_2,True,False,True,True,82,-70.18826293945312,-72.64805603027344,1
A lot of prints irritate this unconvinced woman.,A lot of prints irritate these unconvinced woman.,morphology,determiner_noun_agreement,determiner_noun_agreement_with_adj_irregular_2,True,False,True,True,83,-61.39730453491211,-65.97966003417969,1
Many customers hire those standing alumni.,Many customers hire that standing alumni.,morphology,determiner_noun_agreement,determiner_noun_agreement_with_adj_irregular_2,True,False,True,True,84,-56.959373474121094,-58.02896499633789,1
Some rug isn't irritating that nice woman.,Some rug isn't irritating those nice woman.,morphology,determiner_noun_agreement,determiner_noun_agreement_with_adj_irregular_2,True,False,True,True,85,-63.09546661376953,-68.80876159667969,1
Jill embarrassed those busy men.,Jill embarrassed that busy men.,morphology,determiner_noun_agreement,determiner_noun_agreement_with_adj_irregular_2,True,False,True,True,86,-50.082176208496094,-54.730552673339844,1
Most sketches could hurt this uncertain person.,Most sketches could hurt these uncertain person.,morphology,determiner_noun_agreement,determiner_noun_agreement_with_adj_irregular_2,True,False,True,True,87,-62.5902214050293,-65.38410186767578,1
Patricia lifted those purple feet.,Patricia lifted that purple feet.,morphology,determiner_noun_agreement,determiner_noun_agreement_with_adj_irregular_2,True,False,True,True,88,-48.40746307373047,-53.477622985839844,1
The girls sell this hard fungus.,The girls sell these hard fungus.,morphology,determiner_noun_agreement,determiner_noun_agreement_with_adj_irregular_2,True,False,True,True,89,-56.627685546875,-59.03342056274414,1
Nicole has seen this yellow cactus.,Nicole has seen these yellow cactus.,morphology,determiner_noun_agreement,determiner_noun_agreement_with_adj_irregular_2,True,False,True,True,90,-51.44759750366211,-55.122230529785156,1
Sharon could arrive at those big oases.,Sharon could arrive at that big oases.,morphology,determiner_noun_agreement,determiner_noun_agreement_with_adj_irregular_2,True,False,True,True,91,-65.42440795898438,-68.03437042236328,1
This cashier can fire that good woman.,This cashier can fire those good woman.,morphology,determiner_noun_agreement,determiner_noun_agreement_with_adj_irregular_2,True,False,True,True,92,-57.57184600830078,-60.586456298828125,1
Raymond left those scared children.,Raymond left that scared children.,morphology,determiner_noun_agreement,determiner_noun_agreement_with_adj_irregular_2,True,False,True,True,93,-54.594993591308594,-54.228736877441406,0
Noah could discuss that clever person.,Noah could discuss those clever person.,morphology,determiner_noun_agreement,determiner_noun_agreement_with_adj_irregular_2,True,False,True,True,94,-52.98030471801758,-60.26616668701172,1
Rachelle knew that concealed woman.,Rachelle knew those concealed woman.,morphology,determiner_noun_agreement,determiner_noun_agreement_with_adj_irregular_2,True,False,True,True,95,-53.6349983215332,-58.36374282836914,1
Dawn hasn't cured those gray oxen.,Dawn hasn't cured that gray oxen.,morphology,determiner_noun_agreement,determiner_noun_agreement_with_adj_irregular_2,True,False,True,True,96,-64.03530883789062,-63.7584228515625,0
The Great Lakes haven't disgusted those out in the open people.,The Great Lakes haven't disgusted that out in the open people.,morphology,determiner_noun_agreement,determiner_noun_agreement_with_adj_irregular_2,True,False,True,True,97,-81.64212036132812,-85.06736755371094,1
Wayne doesn't exit those cheap oases.,Wayne doesn't exit that cheap oases.,morphology,determiner_noun_agreement,determiner_noun_agreement_with_adj_irregular_2,True,False,True,True,98,-59.99864196777344,-63.0051383972168,1
These waitresses haven't astounded this fast woman.,These waitresses haven't astounded these fast woman.,morphology,determiner_noun_agreement,determiner_noun_agreement_with_adj_irregular_2,True,False,True,True,99,-69.21187591552734,-73.59381866455078,1
Patrick hasn't lifted this out in the open cactus.,Patrick hasn't lifted these out in the open cactus.,morphology,determiner_noun_agreement,determiner_noun_agreement_with_adj_irregular_2,True,False,True,True,100,-66.81230926513672,-68.06986236572266,1
Angela isn't embarrassing those excited children.,Angela isn't embarrassing that excited children.,morphology,determiner_noun_agreement,determiner_noun_agreement_with_adj_irregular_2,True,False,True,True,101,-58.376426696777344,-60.07228088378906,1
Jennifer hasn't criticized this smart man.,Jennifer hasn't criticized these smart man.,morphology,determiner_noun_agreement,determiner_noun_agreement_with_adj_irregular_2,True,False,True,True,102,-54.57921600341797,-60.94183349609375,1
April watched this big person.,April watched these big person.,morphology,determiner_noun_agreement,determiner_noun_agreement_with_adj_irregular_2,True,False,True,True,103,-47.2372932434082,-53.128143310546875,1
Candice hadn't bothered that serious alumnus.,Candice hadn't bothered those serious alumnus.,morphology,determiner_noun_agreement,determiner_noun_agreement_with_adj_irregular_2,True,False,True,True,104,-66.59710693359375,-70.1133804321289,1
The Clintons observe those happy women.,The Clintons observe that happy women.,morphology,determiner_noun_agreement,determiner_noun_agreement_with_adj_irregular_2,True,False,True,True,105,-49.164798736572266,-50.9306640625,1
The Clintons observe this excited man.,The Clintons observe these excited man.,morphology,determiner_noun_agreement,determiner_noun_agreement_with_adj_irregular_2,True,False,True,True,106,-52.42571258544922,-57.13686752319336,1
Associations were listening to that unlucky child.,Associations were listening to those unlucky child.,morphology,determiner_noun_agreement,determiner_noun_agreement_with_adj_irregular_2,True,False,True,True,107,-59.73899841308594,-62.22670364379883,1
Those committees discussed that busy woman.,Those committees discussed those busy woman.,morphology,determiner_noun_agreement,determiner_noun_agreement_with_adj_irregular_2,True,False,True,True,108,-59.33818817138672,-63.094547271728516,1
Debra isn't discussing that good analysis.,Debra isn't discussing those good analysis.,morphology,determiner_noun_agreement,determiner_noun_agreement_with_adj_irregular_2,True,False,True,True,109,-57.39173889160156,-61.476524353027344,1
The drawing distracts this lucky woman.,The drawing distracts these lucky woman.,morphology,determiner_noun_agreement,determiner_noun_agreement_with_adj_irregular_2,True,False,True,True,110,-51.077239990234375,-57.15983200073242,1
