sentence_good,sentence_bad,field,linguistics_term,UID,simple_LM_method,one_prefix_method,two_prefix_method,lexically_identical,pair_id,good_prob,bad_prob,correct
Irene is discussing those clever alumni.,Irene is discussing that clever alumni.,morphology,determiner_noun_agreement,determiner_noun_agreement_with_adj_irregular_2,True,False,True,True,448,-58.20340347290039,-57.635536193847656,0
Danielle could describe these long analyses.,Danielle could describe this long analyses.,morphology,determiner_noun_agreement,determiner_noun_agreement_with_adj_irregular_2,True,False,True,True,449,-60.512489318847656,-63.55541229248047,1
Eva hasn't praised that lucky woman.,Eva hasn't praised those lucky woman.,morphology,determiner_noun_agreement,determiner_noun_agreement_with_adj_irregular_2,True,False,True,True,450,-54.553443908691406,-61.77934265136719,1
Grace might observe that unlucky woman.,Grace might observe those unlucky woman.,morphology,determiner_noun_agreement,determiner_noun_agreement_with_adj_irregular_2,True,False,True,True,451,-54.708984375,-60.836029052734375,1
The Clintons bothered these clever people.,The Clintons bothered this clever people.,morphology,determiner_noun_agreement,determiner_noun_agreement_with_adj_irregular_2,True,False,True,True,452,-53.44756317138672,-55.17022705078125,1
April hadn't embarrassed those employed alumni.,April hadn't embarrassed that employed alumni.,morphology,determiner_noun_agreement,determiner_noun_agreement_with_adj_irregular_2,True,False,True,True,453,-71.60150909423828,-71.00331115722656,0
Marie shouldn't forget that happy man.,Marie shouldn't forget those happy man.,morphology,determiner_noun_agreement,determiner_noun_agreement_with_adj_irregular_2,True,False,True,True,454,-51.181488037109375,-55.23282241821289,1
Renee isn't breaking that cheap foot.,Renee isn't breaking those cheap foot.,morphology,determiner_noun_agreement,determiner_noun_agreement_with_adj_irregular_2,True,False,True,True,455,-55.586273193359375,-59.720062255859375,1
Monica shouldn't sell those new oases.,Monica shouldn't sell that new oases.,morphology,determiner_noun_agreement,determiner_noun_agreement_with_adj_irregular_2,True,False,True,True,456,-65.05457305908203,-67.14385223388672,1
Every dancer has returned to that troubled man.,Every dancer has returned to those troubled man.,morphology,determiner_noun_agreement,determiner_noun_agreement_with_adj_irregular_2,True,False,True,True,457,-59.11514663696289,-64.2733154296875,1
Those dancers break those green teeth.,Those dancers break that green teeth.,morphology,determiner_noun_agreement,determiner_noun_agreement_with_adj_irregular_2,True,False,True,True,458,-54.751766204833984,-56.59759521484375,1
These teachers talk about these fast women.,These teachers talk about this fast women.,morphology,determiner_noun_agreement,determiner_noun_agreement_with_adj_irregular_2,True,False,True,True,459,-53.671966552734375,-54.63139343261719,1
Spain hasn't praised that happy man.,Spain hasn't praised those happy man.,morphology,determiner_noun_agreement,determiner_noun_agreement_with_adj_irregular_2,True,False,True,True,460,-52.334007263183594,-56.401763916015625,1
Monica does kiss those good people.,Monica does kiss that good people.,morphology,determiner_noun_agreement,determiner_noun_agreement_with_adj_irregular_2,True,False,True,True,461,-49.3156852722168,-51.6735954284668,1
Benjamin can boast about those busy men.,Benjamin can boast about that busy men.,morphology,determiner_noun_agreement,determiner_noun_agreement_with_adj_irregular_2,True,False,True,True,462,-58.29927062988281,-60.47246551513672,1
Donald conceals this lost nucleus.,Donald conceals these lost nucleus.,morphology,determiner_noun_agreement,determiner_noun_agreement_with_adj_irregular_2,True,False,True,True,463,-57.266624450683594,-61.02346420288086,1
Gregory was embarrassing this big woman.,Gregory was embarrassing these big woman.,morphology,determiner_noun_agreement,determiner_noun_agreement_with_adj_irregular_2,True,False,True,True,464,-50.917877197265625,-58.42839431762695,1
The waiter wasn't stunning that hidden child.,The waiter wasn't stunning those hidden child.,morphology,determiner_noun_agreement,determiner_noun_agreement_with_adj_irregular_2,True,False,True,True,465,-67.5257339477539,-73.0119400024414,1
A lot of photographs haven't looked like this red stimulus.,A lot of photographs haven't looked like these red stimulus.,morphology,determiner_noun_agreement,determiner_noun_agreement_with_adj_irregular_2,True,False,True,True,466,-65.20867919921875,-69.22830963134766,1
A patient fixed those cheap feet.,A patient fixed that cheap feet.,morphology,determiner_noun_agreement,determiner_noun_agreement_with_adj_irregular_2,True,False,True,True,467,-60.125431060791016,-56.43859100341797,0
Many gates shouldn't astound these unsure alumni.,Many gates shouldn't astound this unsure alumni.,morphology,determiner_noun_agreement,determiner_noun_agreement_with_adj_irregular_2,True,False,True,True,468,-75.41180419921875,-79.55360412597656,1
That picture hasn't looked like these big men.,That picture hasn't looked like this big men.,morphology,determiner_noun_agreement,determiner_noun_agreement_with_adj_irregular_2,True,False,True,True,469,-51.6795539855957,-53.53858947753906,1
These waitresses talk about this hidden thesis.,These waitresses talk about these hidden thesis.,morphology,determiner_noun_agreement,determiner_noun_agreement_with_adj_irregular_2,True,False,True,True,470,-62.31812286376953,-66.41569519042969,1
Stacy concealed those gray axes.,Stacy concealed that gray axes.,morphology,determiner_noun_agreement,determiner_noun_agreement_with_adj_irregular_2,True,False,True,True,471,-57.30179214477539,-63.40092849731445,1
Nicole remembers those serious alumni.,Nicole remembers that serious alumni.,morphology,determiner_noun_agreement,determiner_noun_agreement_with_adj_irregular_2,True,False,True,True,472,-53.083251953125,-55.91168975830078,1
Leslie hadn't gone to that small oasis.,Leslie hadn't gone to those small oasis.,morphology,determiner_noun_agreement,determiner_noun_agreement_with_adj_irregular_2,True,False,True,True,473,-55.17035675048828,-62.3902587890625,1
Joel wasn't praising this ill person.,Joel wasn't praising these ill person.,morphology,determiner_noun_agreement,determiner_noun_agreement_with_adj_irregular_2,True,False,True,True,474,-58.251502990722656,-63.774452209472656,1
These drivers embarrasses this young alumnus.,These drivers embarrasses these young alumnus.,morphology,determiner_noun_agreement,determiner_noun_agreement_with_adj_irregular_2,True,False,True,True,475,-59.8862419128418,-62.994873046875,1
Beef bores that delighted woman.,Beef bores those delighted woman.,morphology,determiner_noun_agreement,determiner_noun_agreement_with_adj_irregular_2,True,False,True,True,476,-57.98701477050781,-64.88086700439453,1
Mitchell goes to this gray oasis.,Mitchell goes to these gray oasis.,morphology,determiner_noun_agreement,determiner_noun_agreement_with_adj_irregular_2,True,False,True,True,477,-55.594242095947266,-58.914981842041016,1
The mouth bores these upset men.,The mouth bores this upset men.,morphology,determiner_noun_agreement,determiner_noun_agreement_with_adj_irregular_2,True,False,True,True,478,-55.95201873779297,-60.32596969604492,1
Most legislatures discuss those good people.,Most legislatures discuss that good people.,morphology,determiner_noun_agreement,determiner_noun_agreement_with_adj_irregular_2,True,False,True,True,479,-52.72559356689453,-54.228294372558594,1
The boys mess up those purple feet.,The boys mess up that purple feet.,morphology,determiner_noun_agreement,determiner_noun_agreement_with_adj_irregular_2,True,False,True,True,480,-52.88273239135742,-55.337276458740234,1
Cashiers describe these fast children.,Cashiers describe this fast children.,morphology,determiner_noun_agreement,determiner_noun_agreement_with_adj_irregular_2,True,False,True,True,481,-58.59663391113281,-60.77288818359375,1
Roger has fired those unconvinced men.,Roger has fired that unconvinced men.,morphology,determiner_noun_agreement,determiner_noun_agreement_with_adj_irregular_2,True,False,True,True,482,-53.21620178222656,-56.512969970703125,1
Amy wasn't kissing this content man.,Amy wasn't kissing these content man.,morphology,determiner_noun_agreement,determiner_noun_agreement_with_adj_irregular_2,True,False,True,True,483,-57.73649597167969,-61.52183532714844,1
Every dancer hadn't praised those good analyses.,Every dancer hadn't praised that good analyses.,morphology,determiner_noun_agreement,determiner_noun_agreement_with_adj_irregular_2,True,False,True,True,484,-69.87946319580078,-72.96424865722656,1
Rhonda wasn't hiding those red mice.,Rhonda wasn't hiding that red mice.,morphology,determiner_noun_agreement,determiner_noun_agreement_with_adj_irregular_2,True,False,True,True,485,-54.99067687988281,-61.27951431274414,1
Every pedestrian talks about that bad synopsis.,Every pedestrian talks about those bad synopsis.,morphology,determiner_noun_agreement,determiner_noun_agreement_with_adj_irregular_2,True,False,True,True,486,-57.72439193725586,-62.55949401855469,1
The fish shocks these old alumni.,The fish shocks this old alumni.,morphology,determiner_noun_agreement,determiner_noun_agreement_with_adj_irregular_2,True,False,True,True,487,-56.062042236328125,-58.4636344909668,1
Those waitresses visited those scared alumni.,Those waitresses visited that scared alumni.,morphology,determiner_noun_agreement,determiner_noun_agreement_with_adj_irregular_2,True,False,True,True,488,-66.05519104003906,-65.70890045166016,0
That library was listening to this nice man.,That library was listening to these nice man.,morphology,determiner_noun_agreement,determiner_noun_agreement_with_adj_irregular_2,True,False,True,True,489,-54.06671905517578,-60.06926727294922,1
Steve wasn't bringing that blue stimulus.,Steve wasn't bringing those blue stimulus.,morphology,determiner_noun_agreement,determiner_noun_agreement_with_adj_irregular_2,True,False,True,True,490,-56.41741180419922,-59.52078628540039,1
Some guest was hiring that scared woman.,Some guest was hiring those scared woman.,morphology,determiner_noun_agreement,determiner_noun_agreement_with_adj_irregular_2,True,False,True,True,491,-60.63268280029297,-67.7253189086914,1
The spotlights upset this unconvinced alumnus.,The spotlights upset these unconvinced alumnus.,morphology,determiner_noun_agreement,determiner_noun_agreement_with_adj_irregular_2,True,False,True,True,492,-59.6239013671875,-63.02510070800781,1
Todd might observe this lost man.,Todd might observe these lost man.,morphology,determiner_noun_agreement,determiner_noun_agreement_with_adj_irregular_2,True,False,True,True,493,-59.05772399902344,-63.25577926635742,1
People could describe that unconvinced person.,People could describe those unconvinced person.,morphology,determiner_noun_agreement,determiner_noun_agreement_with_adj_irregular_2,True,False,True,True,494,-58.609378814697266,-62.342369079589844,1
That waiter had astounded these lucky people.,That waiter had astounded this lucky people.,morphology,determiner_noun_agreement,determiner_noun_agreement_with_adj_irregular_2,True,False,True,True,495,-59.95185089111328,-61.331687927246094,1
Kendra disgusted these confident women.,Kendra disgusted this confident women.,morphology,determiner_noun_agreement,determiner_noun_agreement_with_adj_irregular_2,True,False,True,True,496,-57.75774002075195,-60.84669494628906,1
Spain hasn't annoyed those old people.,Spain hasn't annoyed that old people.,morphology,determiner_noun_agreement,determiner_noun_agreement_with_adj_irregular_2,True,False,True,True,497,-53.08557891845703,-56.237548828125,1
Steve kisses these out in the open people.,Steve kisses this out in the open people.,morphology,determiner_noun_agreement,determiner_noun_agreement_with_adj_irregular_2,True,False,True,True,498,-59.599365234375,-58.597381591796875,0
Wayne kissed those unconvinced men.,Wayne kissed that unconvinced men.,morphology,determiner_noun_agreement,determiner_noun_agreement_with_adj_irregular_2,True,False,True,True,499,-50.96379852294922,-54.778076171875,1
Douglas has brought those lost cacti.,Douglas has brought that lost cacti.,morphology,determiner_noun_agreement,determiner_noun_agreement_with_adj_irregular_2,True,False,True,True,500,-62.33274841308594,-64.3870620727539,1
Tammy can't reveal that big alumnus.,Tammy can't reveal those big alumnus.,morphology,determiner_noun_agreement,determiner_noun_agreement_with_adj_irregular_2,True,False,True,True,501,-64.16879272460938,-66.26164245605469,1
Deborah fled from those standing children.,Deborah fled from that standing children.,morphology,determiner_noun_agreement,determiner_noun_agreement_with_adj_irregular_2,True,False,True,True,502,-57.7337760925293,-60.04811096191406,1
A man wasn't cleaning that hard fungus.,A man wasn't cleaning those hard fungus.,morphology,determiner_noun_agreement,determiner_noun_agreement_with_adj_irregular_2,True,False,True,True,503,-53.32810974121094,-58.684959411621094,1
Danielle has broken those gray teeth.,Danielle has broken that gray teeth.,morphology,determiner_noun_agreement,determiner_noun_agreement_with_adj_irregular_2,True,False,True,True,504,-50.268287658691406,-54.746726989746094,1
Derek praised this big thesis.,Derek praised these big thesis.,morphology,determiner_noun_agreement,determiner_noun_agreement_with_adj_irregular_2,True,False,True,True,505,-56.11669921875,-59.62604522705078,1
Gary has disgusted those unsure people.,Gary has disgusted that unsure people.,morphology,determiner_noun_agreement,determiner_noun_agreement_with_adj_irregular_2,True,False,True,True,506,-55.511924743652344,-59.28135681152344,1
A senator insulted this bad synopsis.,A senator insulted these bad synopsis.,morphology,determiner_noun_agreement,determiner_noun_agreement_with_adj_irregular_2,True,False,True,True,507,-63.34819030761719,-65.01789093017578,1
A lot of drivers visit these purple oases.,A lot of drivers visit this purple oases.,morphology,determiner_noun_agreement,determiner_noun_agreement_with_adj_irregular_2,True,False,True,True,508,-55.7567253112793,-58.76091766357422,1
Richard isn't attacking this fast child.,Richard isn't attacking these fast child.,morphology,determiner_noun_agreement,determiner_noun_agreement_with_adj_irregular_2,True,False,True,True,509,-56.26078796386719,-63.46192169189453,1
Frank shocked that unsure man.,Frank shocked those unsure man.,morphology,determiner_noun_agreement,determiner_noun_agreement_with_adj_irregular_2,True,False,True,True,510,-50.32048034667969,-52.959075927734375,1
Brett returned to that confident man.,Brett returned to those confident man.,morphology,determiner_noun_agreement,determiner_noun_agreement_with_adj_irregular_2,True,False,True,True,511,-51.84756088256836,-59.77362060546875,1
Many ladies weren't passing these old oases.,Many ladies weren't passing this old oases.,morphology,determiner_noun_agreement,determiner_noun_agreement_with_adj_irregular_2,True,False,True,True,512,-67.81766510009766,-68.34439849853516,1
A waiter brought those purple teeth.,A waiter brought that purple teeth.,morphology,determiner_noun_agreement,determiner_noun_agreement_with_adj_irregular_2,True,False,True,True,513,-47.86207580566406,-52.72384262084961,1
Beverly has fired this fast alumnus.,Beverly has fired these fast alumnus.,morphology,determiner_noun_agreement,determiner_noun_agreement_with_adj_irregular_2,True,False,True,True,514,-58.299705505371094,-60.77684020996094,1
Men haven't observed that standing man.,Men haven't observed those standing man.,morphology,determiner_noun_agreement,determiner_noun_agreement_with_adj_irregular_2,True,False,True,True,515,-53.96571350097656,-57.633338928222656,1
Tiffany admired this ill child.,Tiffany admired these ill child.,morphology,determiner_noun_agreement,determiner_noun_agreement_with_adj_irregular_2,True,False,True,True,516,-48.051353454589844,-56.1481819152832,1
That patient didn't love that unemployed alumnus.,That patient didn't love those unemployed alumnus.,morphology,determiner_noun_agreement,determiner_noun_agreement_with_adj_irregular_2,True,False,True,True,517,-64.50502014160156,-67.05477905273438,1
Aaron reveals that red tooth.,Aaron reveals those red tooth.,morphology,determiner_noun_agreement,determiner_noun_agreement_with_adj_irregular_2,True,False,True,True,518,-47.793609619140625,-53.08539581298828,1
Monica was insulting those bad people.,Monica was insulting that bad people.,morphology,determiner_noun_agreement,determiner_noun_agreement_with_adj_irregular_2,True,False,True,True,519,-51.71460723876953,-53.99580764770508,1
These teenagers watch that old alumnus.,These teenagers watch those old alumnus.,morphology,determiner_noun_agreement,determiner_noun_agreement_with_adj_irregular_2,True,False,True,True,520,-59.55644989013672,-60.036033630371094,1
Tina might confuse this exposed child.,Tina might confuse these exposed child.,morphology,determiner_noun_agreement,determiner_noun_agreement_with_adj_irregular_2,True,False,True,True,521,-59.18042755126953,-62.494361877441406,1
A face was confusing that nice woman.,A face was confusing those nice woman.,morphology,determiner_noun_agreement,determiner_noun_agreement_with_adj_irregular_2,True,False,True,True,522,-53.676673889160156,-62.933570861816406,1
An adult researches that good analysis.,An adult researches those good analysis.,morphology,determiner_noun_agreement,determiner_noun_agreement_with_adj_irregular_2,True,False,True,True,523,-51.52457046508789,-53.79453659057617,1
Some broccoli isn't annoying these unconvinced women.,Some broccoli isn't annoying this unconvinced women.,morphology,determiner_noun_agreement,determiner_noun_agreement_with_adj_irregular_2,True,False,True,True,524,-75.36653137207031,-75.52590942382812,1
Nancy talks about these content children.,Nancy talks about this content children.,morphology,determiner_noun_agreement,determiner_noun_agreement_with_adj_irregular_2,True,False,True,True,525,-50.00274658203125,-51.266807556152344,1
Regina found this lost ox.,Regina found these lost ox.,morphology,determiner_noun_agreement,determiner_noun_agreement_with_adj_irregular_2,True,False,True,True,526,-55.854373931884766,-59.123809814453125,1
Emily had respected that clever man.,Emily had respected those clever man.,morphology,determiner_noun_agreement,determiner_noun_agreement_with_adj_irregular_2,True,False,True,True,527,-50.738948822021484,-58.41777801513672,1
Kathleen has worked with this confident man.,Kathleen has worked with these confident man.,morphology,determiner_noun_agreement,determiner_noun_agreement_with_adj_irregular_2,True,False,True,True,528,-51.11308288574219,-56.31294631958008,1
Most customers are distracting these determined children.,Most customers are distracting this determined children.,morphology,determiner_noun_agreement,determiner_noun_agreement_with_adj_irregular_2,True,False,True,True,529,-60.36530303955078,-62.67092514038086,1
Rachelle didn't cure this black octopus.,Rachelle didn't cure these black octopus.,morphology,determiner_noun_agreement,determiner_noun_agreement_with_adj_irregular_2,True,False,True,True,530,-62.10557556152344,-65.0711441040039,1
Steven hugs these standing men.,Steven hugs this standing men.,morphology,determiner_noun_agreement,determiner_noun_agreement_with_adj_irregular_2,True,False,True,True,531,-50.70901870727539,-53.80894088745117,1
Every popsicle shocked those excited men.,Every popsicle shocked that excited men.,morphology,determiner_noun_agreement,determiner_noun_agreement_with_adj_irregular_2,True,False,True,True,532,-60.08802795410156,-61.73512649536133,1
Sonia lifts that new oasis.,Sonia lifts those new oasis.,morphology,determiner_noun_agreement,determiner_noun_agreement_with_adj_irregular_2,True,False,True,True,533,-54.13929748535156,-56.798431396484375,1
Cheryl might tour that purple oasis.,Cheryl might tour those purple oasis.,morphology,determiner_noun_agreement,determiner_noun_agreement_with_adj_irregular_2,True,False,True,True,534,-63.13621520996094,-67.171142578125,1
This doctor appreciates this bad child.,This doctor appreciates these bad child.,morphology,determiner_noun_agreement,determiner_noun_agreement_with_adj_irregular_2,True,False,True,True,535,-50.998435974121094,-55.700653076171875,1
Leslie breaks those red feet.,Leslie breaks that red feet.,morphology,determiner_noun_agreement,determiner_noun_agreement_with_adj_irregular_2,True,False,True,True,536,-47.43793869018555,-52.45732879638672,1
Bethany hasn't hidden that yellow louse.,Bethany hasn't hidden those yellow louse.,morphology,determiner_noun_agreement,determiner_noun_agreement_with_adj_irregular_2,True,False,True,True,537,-63.235260009765625,-68.73291015625,1
Some people have criticized this brown thesis.,Some people have criticized these brown thesis.,morphology,determiner_noun_agreement,determiner_noun_agreement_with_adj_irregular_2,True,False,True,True,538,-50.80863571166992,-55.26405334472656,1
Noah heals this determined child.,Noah heals these determined child.,morphology,determiner_noun_agreement,determiner_noun_agreement_with_adj_irregular_2,True,False,True,True,539,-54.43191909790039,-58.237510681152344,1
Kevin biked to those big oases.,Kevin biked to that big oases.,morphology,determiner_noun_agreement,determiner_noun_agreement_with_adj_irregular_2,True,False,True,True,540,-63.21760559082031,-66.07807922363281,1
Wayne hadn't bored these sick men.,Wayne hadn't bored this sick men.,morphology,determiner_noun_agreement,determiner_noun_agreement_with_adj_irregular_2,True,False,True,True,541,-55.415523529052734,-59.7613410949707,1
Amy returns to those young alumni.,Amy returns to that young alumni.,morphology,determiner_noun_agreement,determiner_noun_agreement_with_adj_irregular_2,True,False,True,True,542,-49.17437744140625,-51.43399429321289,1
That gate did aggravate this excited woman.,That gate did aggravate these excited woman.,morphology,determiner_noun_agreement,determiner_noun_agreement_with_adj_irregular_2,True,False,True,True,543,-62.572662353515625,-66.82843017578125,1
Melissa observes that bad child.,Melissa observes those bad child.,morphology,determiner_noun_agreement,determiner_noun_agreement_with_adj_irregular_2,True,False,True,True,544,-44.047550201416016,-51.00357437133789,1
Kathleen wasn't scanning those long synopses.,Kathleen wasn't scanning that long synopses.,morphology,determiner_noun_agreement,determiner_noun_agreement_with_adj_irregular_2,True,False,True,True,545,-66.14891052246094,-64.59241485595703,0
That guy dropped by these white oases.,That guy dropped by this white oases.,morphology,determiner_noun_agreement,determiner_noun_agreement_with_adj_irregular_2,True,False,True,True,546,-56.526092529296875,-58.015342712402344,1
Every child might fire this serious child.,Every child might fire these serious child.,morphology,determiner_noun_agreement,determiner_noun_agreement_with_adj_irregular_2,True,False,True,True,547,-55.949058532714844,-63.56081771850586,1
Meredith had concealed that black thesis.,Meredith had concealed those black thesis.,morphology,determiner_noun_agreement,determiner_noun_agreement_with_adj_irregular_2,True,False,True,True,548,-61.389312744140625,-64.85177612304688,1
Randolf didn't see these blue teeth.,Randolf didn't see this blue teeth.,morphology,determiner_noun_agreement,determiner_noun_agreement_with_adj_irregular_2,True,False,True,True,549,-59.22407913208008,-63.73934555053711,1
Some guy passes that rough oasis.,Some guy passes those rough oasis.,morphology,determiner_noun_agreement,determiner_noun_agreement_with_adj_irregular_2,True,False,True,True,550,-56.32865905761719,-60.27208709716797,1
Guys hurts that smart man.,Guys hurts those smart man.,morphology,determiner_noun_agreement,determiner_noun_agreement_with_adj_irregular_2,True,False,True,True,551,-47.49565124511719,-51.67613220214844,1
Many museums should describe this fast man.,Many museums should describe these fast man.,morphology,determiner_noun_agreement,determiner_noun_agreement_with_adj_irregular_2,True,False,True,True,552,-55.37160110473633,-57.9013671875,1
A lot of chairs haven't embarrassed this serious man.,A lot of chairs haven't embarrassed these serious man.,morphology,determiner_noun_agreement,determiner_noun_agreement_with_adj_irregular_2,True,False,True,True,553,-65.70339965820312,-69.73049926757812,1
Emily talked about that ill alumnus.,Emily talked about those ill alumnus.,morphology,determiner_noun_agreement,determiner_noun_agreement_with_adj_irregular_2,True,False,True,True,554,-54.403076171875,-59.191650390625,1
A lot of girls notice these black lice.,A lot of girls notice this black lice.,morphology,determiner_noun_agreement,determiner_noun_agreement_with_adj_irregular_2,True,False,True,True,555,-55.303794860839844,-56.58680725097656,1
Those schools reference that green thesis.,Those schools reference those green thesis.,morphology,determiner_noun_agreement,determiner_noun_agreement_with_adj_irregular_2,True,False,True,True,556,-58.77037811279297,-59.726776123046875,1
Bradley had bored this delighted alumnus.,Bradley had bored these delighted alumnus.,morphology,determiner_noun_agreement,determiner_noun_agreement_with_adj_irregular_2,True,False,True,True,557,-64.6485595703125,-66.54193115234375,1
Melinda scares this good woman.,Melinda scares these good woman.,morphology,determiner_noun_agreement,determiner_noun_agreement_with_adj_irregular_2,True,False,True,True,558,-50.85777282714844,-54.342742919921875,1
Those pedestrians go to those big oases.,Those pedestrians go to that big oases.,morphology,determiner_noun_agreement,determiner_noun_agreement_with_adj_irregular_2,True,False,True,True,559,-60.1047477722168,-62.668731689453125,1
