sentence_good,sentence_bad,field,linguistics_term,UID,simple_LM_method,one_prefix_method,two_prefix_method,lexically_identical,pair_id,good_prob,bad_prob,correct
Connie tours these rough oases.,Connie tours this rough oases.,morphology,determiner_noun_agreement,determiner_noun_agreement_with_adj_irregular_2,True,False,True,True,223,-59.0118293762207,-62.69031524658203,1
Those banks were talking about this lost thesis.,Those banks were talking about these lost thesis.,morphology,determiner_noun_agreement,determiner_noun_agreement_with_adj_irregular_2,True,False,True,True,224,-61.299644470214844,-64.69505310058594,1
Some prints didn't look like this rough louse.,Some prints didn't look like these rough louse.,morphology,determiner_noun_agreement,determiner_noun_agreement_with_adj_irregular_2,True,False,True,True,225,-63.908477783203125,-65.86271667480469,1
All pedestrians like those rough theses.,All pedestrians like that rough theses.,morphology,determiner_noun_agreement,determiner_noun_agreement_with_adj_irregular_2,True,False,True,True,226,-64.11709594726562,-64.39608764648438,1
Douglas saw that black fungus.,Douglas saw those black fungus.,morphology,determiner_noun_agreement,determiner_noun_agreement_with_adj_irregular_2,True,False,True,True,227,-49.02531433105469,-51.31672286987305,1
Sarah examined that bad analysis.,Sarah examined those bad analysis.,morphology,determiner_noun_agreement,determiner_noun_agreement_with_adj_irregular_2,True,False,True,True,228,-46.998687744140625,-49.83681106567383,1
An actress researches this long thesis.,An actress researches these long thesis.,morphology,determiner_noun_agreement,determiner_noun_agreement_with_adj_irregular_2,True,False,True,True,229,-52.22260284423828,-57.22673797607422,1
Those waitresses criticize this hidden child.,Those waitresses criticize these hidden child.,morphology,determiner_noun_agreement,determiner_noun_agreement_with_adj_irregular_2,True,False,True,True,230,-61.477352142333984,-67.75390625,1
Most drivers question these upset alumni.,Most drivers question this upset alumni.,morphology,determiner_noun_agreement,determiner_noun_agreement_with_adj_irregular_2,True,False,True,True,231,-68.03710174560547,-67.14920806884766,0
Phillip isn't working with these small women.,Phillip isn't working with this small women.,morphology,determiner_noun_agreement,determiner_noun_agreement_with_adj_irregular_2,True,False,True,True,232,-53.53727722167969,-57.30049133300781,1
Jennifer can't aggravate that unlucky man.,Jennifer can't aggravate those unlucky man.,morphology,determiner_noun_agreement,determiner_noun_agreement_with_adj_irregular_2,True,False,True,True,233,-56.51953125,-62.5731315612793,1
Essays confuse this good woman.,Essays confuse these good woman.,morphology,determiner_noun_agreement,determiner_noun_agreement_with_adj_irregular_2,True,False,True,True,234,-48.367191314697266,-53.437198638916016,1
Amelia has forgotten those bad analyses.,Amelia has forgotten that bad analyses.,morphology,determiner_noun_agreement,determiner_noun_agreement_with_adj_irregular_2,True,False,True,True,235,-53.90579605102539,-54.0814208984375,1
Michael had explored this brown oasis.,Michael had explored these brown oasis.,morphology,determiner_noun_agreement,determiner_noun_agreement_with_adj_irregular_2,True,False,True,True,236,-57.986663818359375,-60.961143493652344,1
Natalie can aggravate those smart men.,Natalie can aggravate that smart men.,morphology,determiner_noun_agreement,determiner_noun_agreement_with_adj_irregular_2,True,False,True,True,237,-63.02155685424805,-64.13372802734375,1
That patient won't go to these cheap oases.,That patient won't go to this cheap oases.,morphology,determiner_noun_agreement,determiner_noun_agreement_with_adj_irregular_2,True,False,True,True,238,-64.43539428710938,-65.47384643554688,1
Heidi had discovered those black feet.,Heidi had discovered that black feet.,morphology,determiner_noun_agreement,determiner_noun_agreement_with_adj_irregular_2,True,False,True,True,239,-50.68225860595703,-50.43217468261719,0
David hadn't watched those determined men.,David hadn't watched that determined men.,morphology,determiner_noun_agreement,determiner_noun_agreement_with_adj_irregular_2,True,False,True,True,240,-57.79422378540039,-58.82762145996094,1
Some teenager couldn't walk through these green oases.,Some teenager couldn't walk through this green oases.,morphology,determiner_noun_agreement,determiner_noun_agreement_with_adj_irregular_2,True,False,True,True,241,-64.51971435546875,-65.38284301757812,1
Christina shouldn't sell this hard oasis.,Christina shouldn't sell these hard oasis.,morphology,determiner_noun_agreement,determiner_noun_agreement_with_adj_irregular_2,True,False,True,True,242,-66.22088623046875,-71.5828857421875,1
Christopher isn't firing those sick men.,Christopher isn't firing that sick men.,morphology,determiner_noun_agreement,determiner_noun_agreement_with_adj_irregular_2,True,False,True,True,243,-55.58293151855469,-59.959930419921875,1
Most students hide that yellow mouse.,Most students hide those yellow mouse.,morphology,determiner_noun_agreement,determiner_noun_agreement_with_adj_irregular_2,True,False,True,True,244,-53.4379997253418,-58.404998779296875,1
Holly did buy those clean feet.,Holly did buy that clean feet.,morphology,determiner_noun_agreement,determiner_noun_agreement_with_adj_irregular_2,True,False,True,True,245,-54.654571533203125,-55.705657958984375,1
Many actors clean these brown theses.,Many actors clean this brown theses.,morphology,determiner_noun_agreement,determiner_noun_agreement_with_adj_irregular_2,True,False,True,True,246,-59.80944061279297,-61.819427490234375,1
Stacy would hide those lost lice.,Stacy would hide that lost lice.,morphology,determiner_noun_agreement,determiner_noun_agreement_with_adj_irregular_2,True,False,True,True,247,-61.594078063964844,-62.742881774902344,1
Alan drove to that new oasis.,Alan drove to those new oasis.,morphology,determiner_noun_agreement,determiner_noun_agreement_with_adj_irregular_2,True,False,True,True,248,-49.504638671875,-55.30118179321289,1
The Impressionists tour this purple oasis.,The Impressionists tour these purple oasis.,morphology,determiner_noun_agreement,determiner_noun_agreement_with_adj_irregular_2,True,False,True,True,249,-58.878753662109375,-65.52455139160156,1
Wayne is talking to this hidden woman.,Wayne is talking to these hidden woman.,morphology,determiner_noun_agreement,determiner_noun_agreement_with_adj_irregular_2,True,False,True,True,250,-47.25918960571289,-52.84107971191406,1
Christopher forgets this happy child.,Christopher forgets these happy child.,morphology,determiner_noun_agreement,determiner_noun_agreement_with_adj_irregular_2,True,False,True,True,251,-50.87378692626953,-55.4161376953125,1
Julie can boycott those cheap oases.,Julie can boycott that cheap oases.,morphology,determiner_noun_agreement,determiner_noun_agreement_with_adj_irregular_2,True,False,True,True,252,-65.6099853515625,-67.26798248291016,1
Most senators dislike these bad theses.,Most senators dislike this bad theses.,morphology,determiner_noun_agreement,determiner_noun_agreement_with_adj_irregular_2,True,False,True,True,253,-58.388282775878906,-60.59593200683594,1
Denise concealed this content person.,Denise concealed these content person.,morphology,determiner_noun_agreement,determiner_noun_agreement_with_adj_irregular_2,True,False,True,True,254,-55.41472625732422,-60.48825454711914,1
Some bike shocks these nice women.,Some bike shocks this nice women.,morphology,determiner_noun_agreement,determiner_noun_agreement_with_adj_irregular_2,True,False,True,True,255,-57.51853942871094,-56.91363525390625,0
These teenagers fix those hidden feet.,These teenagers fix that hidden feet.,morphology,determiner_noun_agreement,determiner_noun_agreement_with_adj_irregular_2,True,False,True,True,256,-55.83124542236328,-59.68017578125,1
Ella praised that ill woman.,Ella praised those ill woman.,morphology,determiner_noun_agreement,determiner_noun_agreement_with_adj_irregular_2,True,False,True,True,257,-52.683921813964844,-60.517696380615234,1
Current events stun these lost people.,Current events stun this lost people.,morphology,determiner_noun_agreement,determiner_noun_agreement_with_adj_irregular_2,True,False,True,True,258,-58.36602020263672,-64.23927307128906,1
Mary tours this gray oasis.,Mary tours these gray oasis.,morphology,determiner_noun_agreement,determiner_noun_agreement_with_adj_irregular_2,True,False,True,True,259,-53.454193115234375,-57.59593200683594,1
Linda visited those unsure men.,Linda visited that unsure men.,morphology,determiner_noun_agreement,determiner_noun_agreement_with_adj_irregular_2,True,False,True,True,260,-58.21123504638672,-59.86138153076172,1
Dan wouldn't boycott that smooth oasis.,Dan wouldn't boycott those smooth oasis.,morphology,determiner_noun_agreement,determiner_noun_agreement_with_adj_irregular_2,True,False,True,True,261,-66.27226257324219,-71.62214660644531,1
Those men leave that brown oasis.,Those men leave those brown oasis.,morphology,determiner_noun_agreement,determiner_noun_agreement_with_adj_irregular_2,True,False,True,True,262,-53.18132019042969,-54.4892578125,1
Lissa does pass these black oases.,Lissa does pass this black oases.,morphology,determiner_noun_agreement,determiner_noun_agreement_with_adj_irregular_2,True,False,True,True,263,-63.622135162353516,-66.87080383300781,1
Alice had embarrassed this happy man.,Alice had embarrassed these happy man.,morphology,determiner_noun_agreement,determiner_noun_agreement_with_adj_irregular_2,True,False,True,True,264,-53.47560501098633,-57.98681640625,1
Wayne is worrying that hopeful child.,Wayne is worrying those hopeful child.,morphology,determiner_noun_agreement,determiner_noun_agreement_with_adj_irregular_2,True,False,True,True,265,-52.05537414550781,-60.41265106201172,1
Lucille is biking to that green oasis.,Lucille is biking to those green oasis.,morphology,determiner_noun_agreement,determiner_noun_agreement_with_adj_irregular_2,True,False,True,True,266,-61.57984924316406,-66.29723358154297,1
Katherine hadn't skated around this white oasis.,Katherine hadn't skated around these white oasis.,morphology,determiner_noun_agreement,determiner_noun_agreement_with_adj_irregular_2,True,False,True,True,267,-69.30329895019531,-74.06863403320312,1
James observed this hopeful child.,James observed these hopeful child.,morphology,determiner_noun_agreement,determiner_noun_agreement_with_adj_irregular_2,True,False,True,True,268,-46.92982482910156,-53.37640380859375,1
Gerald liked this big child.,Gerald liked these big child.,morphology,determiner_noun_agreement,determiner_noun_agreement_with_adj_irregular_2,True,False,True,True,269,-43.31270980834961,-50.78377151489258,1
That committee wasn't hiring this displeased alumnus.,That committee wasn't hiring these displeased alumnus.,morphology,determiner_noun_agreement,determiner_noun_agreement_with_adj_irregular_2,True,False,True,True,270,-66.1086654663086,-69.0680923461914,1
Gary isn't breaking that white tooth.,Gary isn't breaking those white tooth.,morphology,determiner_noun_agreement,determiner_noun_agreement_with_adj_irregular_2,True,False,True,True,271,-51.87788772583008,-56.55574035644531,1
Walter hasn't seen those content children.,Walter hasn't seen that content children.,morphology,determiner_noun_agreement,determiner_noun_agreement_with_adj_irregular_2,True,False,True,True,272,-55.26097106933594,-59.58460235595703,1
Martha didn't clean these hidden teeth.,Martha didn't clean this hidden teeth.,morphology,determiner_noun_agreement,determiner_noun_agreement_with_adj_irregular_2,True,False,True,True,273,-58.64981460571289,-61.28065490722656,1
These teachers are returning to those lost men.,These teachers are returning to that lost men.,morphology,determiner_noun_agreement,determiner_noun_agreement_with_adj_irregular_2,True,False,True,True,274,-57.25597381591797,-60.85393524169922,1
Ellen hadn't boycotted that hidden oasis.,Ellen hadn't boycotted those hidden oasis.,morphology,determiner_noun_agreement,determiner_noun_agreement_with_adj_irregular_2,True,False,True,True,275,-67.85657501220703,-71.67935180664062,1
Some patients drive to these brown oases.,Some patients drive to this brown oases.,morphology,determiner_noun_agreement,determiner_noun_agreement_with_adj_irregular_2,True,False,True,True,276,-58.64814758300781,-60.378395080566406,1
Nina wasn't referencing this ill person.,Nina wasn't referencing these ill person.,morphology,determiner_noun_agreement,determiner_noun_agreement_with_adj_irregular_2,True,False,True,True,277,-60.475242614746094,-68.17115783691406,1
Denise praises these fast children.,Denise praises this fast children.,morphology,determiner_noun_agreement,determiner_noun_agreement_with_adj_irregular_2,True,False,True,True,278,-61.81554412841797,-63.446449279785156,1
Most customers attack that clever man.,Most customers attack those clever man.,morphology,determiner_noun_agreement,determiner_noun_agreement_with_adj_irregular_2,True,False,True,True,279,-55.22654342651367,-60.427146911621094,1
Every photograph looks like those exposed people.,Every photograph looks like that exposed people.,morphology,determiner_noun_agreement,determiner_noun_agreement_with_adj_irregular_2,True,False,True,True,280,-54.963531494140625,-53.73988342285156,0
Cindy shouldn't cure that confident alumnus.,Cindy shouldn't cure those confident alumnus.,morphology,determiner_noun_agreement,determiner_noun_agreement_with_adj_irregular_2,True,False,True,True,281,-69.73063659667969,-74.78434753417969,1
The Borgias reveal these blue feet.,The Borgias reveal this blue feet.,morphology,determiner_noun_agreement,determiner_noun_agreement_with_adj_irregular_2,True,False,True,True,282,-61.164398193359375,-65.14002990722656,1
Ella lifts these exposed fungi.,Ella lifts this exposed fungi.,morphology,determiner_noun_agreement,determiner_noun_agreement_with_adj_irregular_2,True,False,True,True,283,-58.00733947753906,-61.50377655029297,1
The Lutherans astound that unsure person.,The Lutherans astound those unsure person.,morphology,determiner_noun_agreement,determiner_noun_agreement_with_adj_irregular_2,True,False,True,True,284,-69.16122436523438,-69.2613754272461,1
These cakes bore that determined woman.,These cakes bore those determined woman.,morphology,determiner_noun_agreement,determiner_noun_agreement_with_adj_irregular_2,True,False,True,True,285,-59.647117614746094,-63.052391052246094,1
Nina lifts this orange cactus.,Nina lifts these orange cactus.,morphology,determiner_noun_agreement,determiner_noun_agreement_with_adj_irregular_2,True,False,True,True,286,-53.66779327392578,-56.202552795410156,1
The actors kiss these unconvinced children.,The actors kiss this unconvinced children.,morphology,determiner_noun_agreement,determiner_noun_agreement_with_adj_irregular_2,True,False,True,True,287,-57.50270080566406,-58.77342224121094,1
Sharon dislikes that brown thesis.,Sharon dislikes those brown thesis.,morphology,determiner_noun_agreement,determiner_noun_agreement_with_adj_irregular_2,True,False,True,True,288,-61.449127197265625,-63.904815673828125,1
The customers sell these rough fungi.,The customers sell this rough fungi.,morphology,determiner_noun_agreement,determiner_noun_agreement_with_adj_irregular_2,True,False,True,True,289,-56.102596282958984,-58.127159118652344,1
Janice didn't cure those employed men.,Janice didn't cure that employed men.,morphology,determiner_noun_agreement,determiner_noun_agreement_with_adj_irregular_2,True,False,True,True,290,-68.26367950439453,-65.27278137207031,0
Paula left this uncertain person.,Paula left these uncertain person.,morphology,determiner_noun_agreement,determiner_noun_agreement_with_adj_irregular_2,True,False,True,True,291,-52.877464294433594,-57.065486907958984,1
Those guys had escaped from those employed children.,Those guys had escaped from that employed children.,morphology,determiner_noun_agreement,determiner_noun_agreement_with_adj_irregular_2,True,False,True,True,292,-61.51598358154297,-61.27178192138672,0
Christine wasn't touring that old oasis.,Christine wasn't touring those old oasis.,morphology,determiner_noun_agreement,determiner_noun_agreement_with_adj_irregular_2,True,False,True,True,293,-56.15764236450195,-59.11824035644531,1
These waitresses praise this rough thesis.,These waitresses praise these rough thesis.,morphology,determiner_noun_agreement,determiner_noun_agreement_with_adj_irregular_2,True,False,True,True,294,-68.01018524169922,-72.66889190673828,1
Some girls hadn't passed this concealed oasis.,Some girls hadn't passed these concealed oasis.,morphology,determiner_noun_agreement,determiner_noun_agreement_with_adj_irregular_2,True,False,True,True,295,-70.81613159179688,-75.91365814208984,1
Andrea lifts these small cacti.,Andrea lifts this small cacti.,morphology,determiner_noun_agreement,determiner_noun_agreement_with_adj_irregular_2,True,False,True,True,296,-58.372230529785156,-59.33205795288086,1
Kristen is scanning those bad synopses.,Kristen is scanning that bad synopses.,morphology,determiner_noun_agreement,determiner_noun_agreement_with_adj_irregular_2,True,False,True,True,297,-66.32831573486328,-63.316871643066406,0
Alan is skated around these cheap oases.,Alan is skated around this cheap oases.,morphology,determiner_noun_agreement,determiner_noun_agreement_with_adj_irregular_2,True,False,True,True,298,-63.45948028564453,-65.40108489990234,1
Kayla has investigated these busy people.,Kayla has investigated this busy people.,morphology,determiner_noun_agreement,determiner_noun_agreement_with_adj_irregular_2,True,False,True,True,299,-54.28669357299805,-56.98622131347656,1
Timothy observes that good woman.,Timothy observes those good woman.,morphology,determiner_noun_agreement,determiner_noun_agreement_with_adj_irregular_2,True,False,True,True,300,-43.434165954589844,-48.356964111328125,1
Every museum hadn't discussed those hidden theses.,Every museum hadn't discussed that hidden theses.,morphology,determiner_noun_agreement,determiner_noun_agreement_with_adj_irregular_2,True,False,True,True,301,-73.17678833007812,-79.25374603271484,1
Some cashiers help this troubled person.,Some cashiers help these troubled person.,morphology,determiner_noun_agreement,determiner_noun_agreement_with_adj_irregular_2,True,False,True,True,302,-51.97248077392578,-54.79747772216797,1
Amanda was attacking that displeased woman.,Amanda was attacking those displeased woman.,morphology,determiner_noun_agreement,determiner_noun_agreement_with_adj_irregular_2,True,False,True,True,303,-55.268157958984375,-59.59632873535156,1
This window upsets these lost people.,This window upsets this lost people.,morphology,determiner_noun_agreement,determiner_noun_agreement_with_adj_irregular_2,True,False,True,True,304,-55.060752868652344,-59.21527862548828,1
Cindy wasn't bringing those gray cacti.,Cindy wasn't bringing that gray cacti.,morphology,determiner_noun_agreement,determiner_noun_agreement_with_adj_irregular_2,True,False,True,True,305,-65.3004379272461,-67.6624755859375,1
Peter complained about these good synopses.,Peter complained about this good synopses.,morphology,determiner_noun_agreement,determiner_noun_agreement_with_adj_irregular_2,True,False,True,True,306,-52.72186279296875,-56.380516052246094,1
Danielle was touring those new oases.,Danielle was touring that new oases.,morphology,determiner_noun_agreement,determiner_noun_agreement_with_adj_irregular_2,True,False,True,True,307,-59.48078918457031,-62.02444839477539,1
Elaine discusses that standing person.,Elaine discusses those standing person.,morphology,determiner_noun_agreement,determiner_noun_agreement_with_adj_irregular_2,True,False,True,True,308,-49.958831787109375,-56.99624252319336,1
Jacqueline had healed those rough geese.,Jacqueline had healed that rough geese.,morphology,determiner_noun_agreement,determiner_noun_agreement_with_adj_irregular_2,True,False,True,True,309,-60.93943786621094,-59.217933654785156,0
All rivers were distracting those standing men.,All rivers were distracting that standing men.,morphology,determiner_noun_agreement,determiner_noun_agreement_with_adj_irregular_2,True,False,True,True,310,-70.01344299316406,-69.04553985595703,0
Some people exit those yellow oases.,Some people exit that yellow oases.,morphology,determiner_noun_agreement,determiner_noun_agreement_with_adj_irregular_2,True,False,True,True,311,-57.71062088012695,-57.101097106933594,0
Becca isn't exploring these hard oases.,Becca isn't exploring this hard oases.,morphology,determiner_noun_agreement,determiner_noun_agreement_with_adj_irregular_2,True,False,True,True,312,-63.333038330078125,-64.75437927246094,1
Timothy revealed that big foot.,Timothy revealed those big foot.,morphology,determiner_noun_agreement,determiner_noun_agreement_with_adj_irregular_2,True,False,True,True,313,-47.18238067626953,-50.10225296020508,1
Adam fires these determined men.,Adam fires this determined men.,morphology,determiner_noun_agreement,determiner_noun_agreement_with_adj_irregular_2,True,False,True,True,314,-51.786590576171875,-54.459495544433594,1
The teenagers clean this purple foot.,The teenagers clean these purple foot.,morphology,determiner_noun_agreement,determiner_noun_agreement_with_adj_irregular_2,True,False,True,True,315,-56.652931213378906,-61.59812927246094,1
The Great Lakes could annoy that troubled man.,The Great Lakes could annoy those troubled man.,morphology,determiner_noun_agreement,determiner_noun_agreement_with_adj_irregular_2,True,False,True,True,316,-62.41217041015625,-67.59222412109375,1
Karen discusses those bad men.,Karen discusses that bad men.,morphology,determiner_noun_agreement,determiner_noun_agreement_with_adj_irregular_2,True,False,True,True,317,-46.20143127441406,-47.42472839355469,1
Phillip didn't find those ill alumni.,Phillip didn't find that ill alumni.,morphology,determiner_noun_agreement,determiner_noun_agreement_with_adj_irregular_2,True,False,True,True,318,-66.62680053710938,-64.56272888183594,0
A lot of men reference these good analyses.,A lot of men reference this good analyses.,morphology,determiner_noun_agreement,determiner_noun_agreement_with_adj_irregular_2,True,False,True,True,319,-51.980106353759766,-54.05357360839844,1
Larry had insulted these lucky children.,Larry had insulted this lucky children.,morphology,determiner_noun_agreement,determiner_noun_agreement_with_adj_irregular_2,True,False,True,True,320,-50.314632415771484,-53.887725830078125,1
Debra is firing that determined child.,Debra is firing those determined child.,morphology,determiner_noun_agreement,determiner_noun_agreement_with_adj_irregular_2,True,False,True,True,321,-59.237422943115234,-64.88802337646484,1
Noah was watching that fast woman.,Noah was watching those fast woman.,morphology,determiner_noun_agreement,determiner_noun_agreement_with_adj_irregular_2,True,False,True,True,322,-47.23031997680664,-50.51757049560547,1
Gina works with that displeased person.,Gina works with those displeased person.,morphology,determiner_noun_agreement,determiner_noun_agreement_with_adj_irregular_2,True,False,True,True,323,-53.33515548706055,-59.64697265625,1
Most doctors would bring these big nuclei.,Most doctors would bring this big nuclei.,morphology,determiner_noun_agreement,determiner_noun_agreement_with_adj_irregular_2,True,False,True,True,324,-59.295631408691406,-62.57858657836914,1
All drawings alarm that unconvinced child.,All drawings alarm those unconvinced child.,morphology,determiner_noun_agreement,determiner_noun_agreement_with_adj_irregular_2,True,False,True,True,325,-68.2510757446289,-67.78704833984375,0
Some libraries hate that busy man.,Some libraries hate those busy man.,morphology,determiner_noun_agreement,determiner_noun_agreement_with_adj_irregular_2,True,False,True,True,326,-49.976993560791016,-56.51968002319336,1
Derek disgusted that unemployed child.,Derek disgusted those unemployed child.,morphology,determiner_noun_agreement,determiner_noun_agreement_with_adj_irregular_2,True,False,True,True,327,-61.78221893310547,-68.10865020751953,1
Marla hadn't fired these good men.,Marla hadn't fired this good men.,morphology,determiner_noun_agreement,determiner_noun_agreement_with_adj_irregular_2,True,False,True,True,328,-57.4079475402832,-61.501060485839844,1
Carmen examined that red thesis.,Carmen examined those red thesis.,morphology,determiner_noun_agreement,determiner_noun_agreement_with_adj_irregular_2,True,False,True,True,329,-59.19532775878906,-62.25554275512695,1
Amelia investigates this smart woman.,Amelia investigates these smart woman.,morphology,determiner_noun_agreement,determiner_noun_agreement_with_adj_irregular_2,True,False,True,True,330,-53.43635177612305,-58.87743377685547,1
The Borgias hire that displeased alumnus.,The Borgias hire those displeased alumnus.,morphology,determiner_noun_agreement,determiner_noun_agreement_with_adj_irregular_2,True,False,True,True,331,-68.67547607421875,-72.22608947753906,1
Stacey would arrive at these orange oases.,Stacey would arrive at this orange oases.,morphology,determiner_noun_agreement,determiner_noun_agreement_with_adj_irregular_2,True,False,True,True,332,-63.14441680908203,-66.31061553955078,1
Anna works with this lucky man.,Anna works with these lucky man.,morphology,determiner_noun_agreement,determiner_noun_agreement_with_adj_irregular_2,True,False,True,True,333,-43.36708068847656,-49.55211639404297,1
Walter has scanned this rough thesis.,Walter has scanned these rough thesis.,morphology,determiner_noun_agreement,determiner_noun_agreement_with_adj_irregular_2,True,False,True,True,334,-55.34471130371094,-59.99417495727539,1
Some mushroom bothered that lucky woman.,Some mushroom bothered those lucky woman.,morphology,determiner_noun_agreement,determiner_noun_agreement_with_adj_irregular_2,True,False,True,True,335,-57.32109069824219,-61.95087432861328,1
