sentence_good,sentence_bad,field,linguistics_term,UID,simple_LM_method,one_prefix_method,two_prefix_method,lexically_identical,pair_id,good_prob,bad_prob,correct
Had some teachers ever departed?,Some teachers had ever departed.,semantics,npi_licensing,matrix_question_npi_licensor_present,True,False,True,True,523,-48.22410202026367,-47.65256881713867,0
Should Melinda ever resemble some picture?,Melinda should ever resemble some picture.,semantics,npi_licensing,matrix_question_npi_licensor_present,True,False,True,True,524,-60.201194763183594,-63.77702713012695,1
Would a cup ever tip over?,A cup would ever tip over.,semantics,npi_licensing,matrix_question_npi_licensor_present,True,False,True,True,525,-44.20867919921875,-45.29234313964844,1
Have some legislatures ever conferred?,Some legislatures have ever conferred.,semantics,npi_licensing,matrix_question_npi_licensor_present,True,False,True,True,526,-53.38515853881836,-44.978538513183594,0
Does Carla ever bother Michelle?,Carla does ever bother Michelle.,semantics,npi_licensing,matrix_question_npi_licensor_present,True,False,True,True,527,-45.943912506103516,-53.22876739501953,1
Should this teacher ever dare Jason to yell?,This teacher should ever dare Jason to yell.,semantics,npi_licensing,matrix_question_npi_licensor_present,True,False,True,True,528,-64.05005645751953,-68.4979019165039,1
Might Gregory ever hate Victoria?,Gregory might ever hate Victoria.,semantics,npi_licensing,matrix_question_npi_licensor_present,True,False,True,True,529,-51.93669509887695,-50.36436080932617,0
Had Beth ever tempted Carol to win?,Beth had ever tempted Carol to win.,semantics,npi_licensing,matrix_question_npi_licensor_present,True,False,True,True,530,-61.44702911376953,-64.05767822265625,1
Might the teenagers ever divorce?,The teenagers might ever divorce.,semantics,npi_licensing,matrix_question_npi_licensor_present,True,False,True,True,531,-44.148765563964844,-41.909786224365234,0
Had Raymond ever scratched?,Raymond had ever scratched.,semantics,npi_licensing,matrix_question_npi_licensor_present,True,False,True,True,532,-45.710182189941406,-43.768760681152344,0
Should Kristen ever dare this customer to smile?,Kristen should ever dare this customer to smile.,semantics,npi_licensing,matrix_question_npi_licensor_present,True,False,True,True,533,-66.09672546386719,-68.39739227294922,1
Has a man ever watched Judy?,A man has ever watched Judy.,semantics,npi_licensing,matrix_question_npi_licensor_present,True,False,True,True,534,-45.855064392089844,-48.17393112182617,1
Had Susan ever yearned to litter?,Susan had ever yearned to litter.,semantics,npi_licensing,matrix_question_npi_licensor_present,True,False,True,True,535,-59.151153564453125,-56.702362060546875,0
Had Gerald ever protested?,Gerald had ever protested.,semantics,npi_licensing,matrix_question_npi_licensor_present,True,False,True,True,536,-43.95014953613281,-41.191429138183594,0
Might all carts ever accelerate?,All carts might ever accelerate.,semantics,npi_licensing,matrix_question_npi_licensor_present,True,False,True,True,537,-49.64103698730469,-54.78234100341797,1
Has Clyde ever changed?,Clyde has ever changed.,semantics,npi_licensing,matrix_question_npi_licensor_present,True,False,True,True,538,-33.6886100769043,-35.065284729003906,1
Has Alice ever murmured?,Alice has ever murmured.,semantics,npi_licensing,matrix_question_npi_licensor_present,True,False,True,True,539,-37.183265686035156,-40.82373046875,1
Had some lakes ever vaporized?,Some lakes had ever vaporized.,semantics,npi_licensing,matrix_question_npi_licensor_present,True,False,True,True,540,-52.366859436035156,-47.262779235839844,0
Has Katherine ever discovered the men?,Katherine has ever discovered the men.,semantics,npi_licensing,matrix_question_npi_licensor_present,True,False,True,True,541,-48.2780876159668,-51.867156982421875,1
Have the Impressionists ever reacted?,The Impressionists have ever reacted.,semantics,npi_licensing,matrix_question_npi_licensor_present,True,False,True,True,542,-47.23318099975586,-48.71217346191406,1
Might a man ever spin around?,A man might ever spin around.,semantics,npi_licensing,matrix_question_npi_licensor_present,True,False,True,True,543,-44.11042785644531,-44.695037841796875,1
Has Beth ever spun around?,Beth has ever spun around.,semantics,npi_licensing,matrix_question_npi_licensor_present,True,False,True,True,544,-40.862674713134766,-46.545440673828125,1
Had Becca ever gone to a lot of banks?,Becca had ever gone to a lot of banks.,semantics,npi_licensing,matrix_question_npi_licensor_present,True,False,True,True,545,-64.78105163574219,-58.92301940917969,0
Had Rachelle ever proven to play?,Rachelle had ever proven to play.,semantics,npi_licensing,matrix_question_npi_licensor_present,True,False,True,True,546,-57.52853775024414,-57.21632385253906,0
Had that chair ever shattered?,That chair had ever shattered.,semantics,npi_licensing,matrix_question_npi_licensor_present,True,False,True,True,547,-44.40843963623047,-42.07405471801758,0
Should all skirts ever stretch?,All skirts should ever stretch.,semantics,npi_licensing,matrix_question_npi_licensor_present,True,False,True,True,548,-42.17559051513672,-44.90516662597656,1
Could this icicle ever evaporate?,This icicle could ever evaporate.,semantics,npi_licensing,matrix_question_npi_licensor_present,True,False,True,True,549,-45.035369873046875,-49.85576629638672,1
Had Martin ever escaped?,Martin had ever escaped.,semantics,npi_licensing,matrix_question_npi_licensor_present,True,False,True,True,550,-39.435142517089844,-39.23469543457031,0
Can the woman ever cook?,The woman can ever cook.,semantics,npi_licensing,matrix_question_npi_licensor_present,True,False,True,True,551,-35.3934211730957,-40.586692810058594,1
Has Diana ever ascended most stairs?,Diana has ever ascended most stairs.,semantics,npi_licensing,matrix_question_npi_licensor_present,True,False,True,True,552,-55.54765319824219,-58.70942687988281,1
Would a scarf ever stretch?,A scarf would ever stretch.,semantics,npi_licensing,matrix_question_npi_licensor_present,True,False,True,True,553,-39.79050064086914,-42.06107711791992,1
Had Danielle ever remembered who shrugs?,Danielle had ever remembered who shrugs.,semantics,npi_licensing,matrix_question_npi_licensor_present,True,False,True,True,554,-64.58564758300781,-64.19134521484375,0
Have these coats ever shrunk?,These coats have ever shrunk.,semantics,npi_licensing,matrix_question_npi_licensor_present,True,False,True,True,555,-43.12886047363281,-42.45318603515625,0
Could this student ever shout?,This student could ever shout.,semantics,npi_licensing,matrix_question_npi_licensor_present,True,False,True,True,556,-42.38930892944336,-46.05140686035156,1
Had all icicles ever bothered Renee?,All icicles had ever bothered Renee.,semantics,npi_licensing,matrix_question_npi_licensor_present,True,False,True,True,557,-66.21723937988281,-63.1778450012207,0
Will Cheryl ever escape from Laura?,Cheryl will ever escape from Laura.,semantics,npi_licensing,matrix_question_npi_licensor_present,True,False,True,True,558,-52.9261360168457,-55.060482025146484,1
Had every legislature ever yearned to embarrass a university?,Every legislature had ever yearned to embarrass a university.,semantics,npi_licensing,matrix_question_npi_licensor_present,True,False,True,True,559,-73.1639404296875,-74.6900863647461,1
Has some unicycle ever stopped?,Some unicycle has ever stopped.,semantics,npi_licensing,matrix_question_npi_licensor_present,True,False,True,True,560,-52.54165267944336,-52.37376022338867,0
Had the cashiers ever appeared to buy those newspaper articles?,The cashiers had ever appeared to buy those newspaper articles.,semantics,npi_licensing,matrix_question_npi_licensor_present,True,False,True,True,561,-74.89540100097656,-71.99530792236328,0
Will Helen ever move?,Helen will ever move.,semantics,npi_licensing,matrix_question_npi_licensor_present,True,False,True,True,562,-34.21824645996094,-39.533042907714844,1
Had a girl ever telephoned?,A girl had ever telephoned.,semantics,npi_licensing,matrix_question_npi_licensor_present,True,False,True,True,563,-39.90377426147461,-43.30265808105469,1
Did Judy ever wear most scarves?,Judy did ever wear most scarves.,semantics,npi_licensing,matrix_question_npi_licensor_present,True,False,True,True,564,-51.65726852416992,-60.33020782470703,1
Could Wendy ever learn who is going fishing?,Wendy could ever learn who is going fishing.,semantics,npi_licensing,matrix_question_npi_licensor_present,True,False,True,True,565,-56.056968688964844,-58.11134719848633,1
Did Steven ever stun Brad?,Steven did ever stun Brad.,semantics,npi_licensing,matrix_question_npi_licensor_present,True,False,True,True,566,-51.853553771972656,-57.75387954711914,1
Would Patrick ever see?,Patrick would ever see.,semantics,npi_licensing,matrix_question_npi_licensor_present,True,False,True,True,567,-43.839778900146484,-40.173133850097656,0
Did Jacqueline ever fall asleep?,Jacqueline did ever fall asleep.,semantics,npi_licensing,matrix_question_npi_licensor_present,True,False,True,True,568,-33.03982925415039,-42.275550842285156,1
Has that patient ever departed?,That patient has ever departed.,semantics,npi_licensing,matrix_question_npi_licensor_present,True,False,True,True,569,-40.49641036987305,-42.149993896484375,1
Have these associations ever forgotten about who isn't finding Angela?,These associations have ever forgotten about who isn't finding Angela.,semantics,npi_licensing,matrix_question_npi_licensor_present,True,False,True,True,570,-81.71800994873047,-85.62968444824219,1
Might James ever forget who confer?,James might ever forget who confer.,semantics,npi_licensing,matrix_question_npi_licensor_present,True,False,True,True,571,-66.83465576171875,-62.705562591552734,0
Has Victoria ever lied?,Victoria has ever lied.,semantics,npi_licensing,matrix_question_npi_licensor_present,True,False,True,True,572,-32.22136306762695,-35.78824234008789,1
Will Natalie ever escape?,Natalie will ever escape.,semantics,npi_licensing,matrix_question_npi_licensor_present,True,False,True,True,573,-35.243431091308594,-41.90520095825195,1
Had Becky ever preferred those cashiers to confuse a lot of senators?,Becky had ever preferred those cashiers to confuse a lot of senators.,semantics,npi_licensing,matrix_question_npi_licensor_present,True,False,True,True,574,-91.8305892944336,-88.69828796386719,0
Might a committee ever conspire?,A committee might ever conspire.,semantics,npi_licensing,matrix_question_npi_licensor_present,True,False,True,True,575,-48.44383239746094,-45.50147247314453,0
Had Rhonda ever scanned the commentaries?,Rhonda had ever scanned the commentaries.,semantics,npi_licensing,matrix_question_npi_licensor_present,True,False,True,True,576,-59.61306381225586,-58.77721405029297,0
Has Paul ever described Bradley?,Paul has ever described Bradley.,semantics,npi_licensing,matrix_question_npi_licensor_present,True,False,True,True,577,-43.914833068847656,-46.915977478027344,1
Might pedestrians ever embrace?,Pedestrians might ever embrace.,semantics,npi_licensing,matrix_question_npi_licensor_present,True,False,True,True,578,-45.506256103515625,-44.551456451416016,0
Would most libraries ever manage to protest?,Most libraries would ever manage to protest.,semantics,npi_licensing,matrix_question_npi_licensor_present,True,False,True,True,579,-53.32843017578125,-54.672119140625,1
Has Kristen ever argued?,Kristen has ever argued.,semantics,npi_licensing,matrix_question_npi_licensor_present,True,False,True,True,580,-38.94223403930664,-40.70458221435547,1
Would the Borgias ever swallow?,The Borgias would ever swallow.,semantics,npi_licensing,matrix_question_npi_licensor_present,True,False,True,True,581,-49.39549255371094,-44.72612762451172,0
Can Curtis ever predict many hills to aggravate Richard?,Curtis can ever predict many hills to aggravate Richard.,semantics,npi_licensing,matrix_question_npi_licensor_present,True,False,True,True,582,-82.88587951660156,-88.52531433105469,1
Have most boys ever regretted David intends to dislike documentaries?,Most boys have ever regretted David intends to dislike documentaries.,semantics,npi_licensing,matrix_question_npi_licensor_present,True,False,True,True,583,-95.49855041503906,-89.80546569824219,0
Had all girls ever commissioned Carl to come here?,All girls had ever commissioned Carl to come here.,semantics,npi_licensing,matrix_question_npi_licensor_present,True,False,True,True,584,-74.1295166015625,-75.4441909790039,1
Did that doctor ever notice Amy?,That doctor did ever notice Amy.,semantics,npi_licensing,matrix_question_npi_licensor_present,True,False,True,True,585,-43.34294128417969,-52.51820755004883,1
Would William ever mutter?,William would ever mutter.,semantics,npi_licensing,matrix_question_npi_licensor_present,True,False,True,True,586,-50.478363037109375,-45.87220001220703,0
Has the river ever frozen?,The river has ever frozen.,semantics,npi_licensing,matrix_question_npi_licensor_present,True,False,True,True,587,-32.80554962158203,-33.6971435546875,1
Can many schools ever clash?,Many schools can ever clash.,semantics,npi_licensing,matrix_question_npi_licensor_present,True,False,True,True,588,-40.475040435791016,-45.99603271484375,1
Has Jill ever looked to dry?,Jill has ever looked to dry.,semantics,npi_licensing,matrix_question_npi_licensor_present,True,False,True,True,589,-49.90418243408203,-49.856842041015625,0
Should Vincent ever hire Brett?,Vincent should ever hire Brett.,semantics,npi_licensing,matrix_question_npi_licensor_present,True,False,True,True,590,-47.426090240478516,-52.06260681152344,1
Would Kimberley ever hide?,Kimberley would ever hide.,semantics,npi_licensing,matrix_question_npi_licensor_present,True,False,True,True,591,-41.13909912109375,-43.82263946533203,1
Can Anna ever like Stacy?,Anna can ever like Stacy.,semantics,npi_licensing,matrix_question_npi_licensor_present,True,False,True,True,592,-45.034149169921875,-52.037010192871094,1
Would Sharon ever long to tour this glacier?,Sharon would ever long to tour this glacier.,semantics,npi_licensing,matrix_question_npi_licensor_present,True,False,True,True,593,-64.43730163574219,-66.86882019042969,1
Has Tammy ever escaped?,Tammy has ever escaped.,semantics,npi_licensing,matrix_question_npi_licensor_present,True,False,True,True,594,-41.13554382324219,-40.61801528930664,0
Had Danielle ever admired the computers?,Danielle had ever admired the computers.,semantics,npi_licensing,matrix_question_npi_licensor_present,True,False,True,True,595,-58.763824462890625,-54.75904846191406,0
Could those organizations ever succeed?,Those organizations could ever succeed.,semantics,npi_licensing,matrix_question_npi_licensor_present,True,False,True,True,596,-36.992366790771484,-43.25558853149414,1
Has Holly ever continued to break that computer?,Holly has ever continued to break that computer.,semantics,npi_licensing,matrix_question_npi_licensor_present,True,False,True,True,597,-64.96218872070312,-66.18656921386719,1
Will the Lutherans ever laugh?,The Lutherans will ever laugh.,semantics,npi_licensing,matrix_question_npi_licensor_present,True,False,True,True,598,-42.166988372802734,-45.60945510864258,1
Has every waiter ever said some guys stretch?,Every waiter has ever said some guys stretch.,semantics,npi_licensing,matrix_question_npi_licensor_present,True,False,True,True,599,-66.80718994140625,-67.97250366210938,1
Had Rodney ever investigated who have disappeared?,Rodney had ever investigated who have disappeared.,semantics,npi_licensing,matrix_question_npi_licensor_present,True,False,True,True,600,-68.16389465332031,-66.79798126220703,0
Had most teachers ever flirted?,Most teachers had ever flirted.,semantics,npi_licensing,matrix_question_npi_licensor_present,True,False,True,True,601,-46.60813903808594,-47.166202545166016,1
Should those doctors ever approve?,Those doctors should ever approve.,semantics,npi_licensing,matrix_question_npi_licensor_present,True,False,True,True,602,-41.94169998168945,-44.09192657470703,1
Will Joseph ever litter?,Joseph will ever litter.,semantics,npi_licensing,matrix_question_npi_licensor_present,True,False,True,True,603,-43.67657470703125,-48.115699768066406,1
Do many adults ever force Sabrina's fathers to debate?,Many adults do ever force Sabrina's fathers to debate.,semantics,npi_licensing,matrix_question_npi_licensor_present,True,False,True,True,604,-83.15243530273438,-88.16907501220703,1
Did a doctor ever ascend that mountain?,A doctor did ever ascend that mountain.,semantics,npi_licensing,matrix_question_npi_licensor_present,True,False,True,True,605,-48.9857177734375,-57.0297737121582,1
Will boys ever collaborate?,Boys will ever collaborate.,semantics,npi_licensing,matrix_question_npi_licensor_present,True,False,True,True,606,-35.31796646118164,-37.581825256347656,1
Has Rodney ever distracted Katherine?,Rodney has ever distracted Katherine.,semantics,npi_licensing,matrix_question_npi_licensor_present,True,False,True,True,607,-54.05176544189453,-53.14349365234375,0
Had Dana ever boycotted that legislature?,Dana had ever boycotted that legislature.,semantics,npi_licensing,matrix_question_npi_licensor_present,True,False,True,True,608,-58.17162322998047,-60.230159759521484,1
Had Michael ever hidden that gate?,Michael had ever hidden that gate.,semantics,npi_licensing,matrix_question_npi_licensor_present,True,False,True,True,609,-54.004493713378906,-53.63840103149414,0
Did every cup ever chip?,Every cup did ever chip.,semantics,npi_licensing,matrix_question_npi_licensor_present,True,False,True,True,610,-43.469696044921875,-48.935630798339844,1
Would Bill ever forget Tonya?,Bill would ever forget Tonya.,semantics,npi_licensing,matrix_question_npi_licensor_present,True,False,True,True,611,-49.172203063964844,-48.41545867919922,0
Had this woman ever explored a college campus?,This woman had ever explored a college campus.,semantics,npi_licensing,matrix_question_npi_licensor_present,True,False,True,True,612,-54.86721420288086,-51.679561614990234,0
Had Randolf ever climbed up the mountain?,Randolf had ever climbed up the mountain.,semantics,npi_licensing,matrix_question_npi_licensor_present,True,False,True,True,613,-53.22793960571289,-50.992671966552734,0
Has Susan ever protested?,Susan has ever protested.,semantics,npi_licensing,matrix_question_npi_licensor_present,True,False,True,True,614,-37.22216796875,-39.71574401855469,1
Does Tina ever leave?,Tina does ever leave.,semantics,npi_licensing,matrix_question_npi_licensor_present,True,False,True,True,615,-39.227901458740234,-40.5822868347168,1
Did those waiters ever get a job?,Those waiters did ever get a job.,semantics,npi_licensing,matrix_question_npi_licensor_present,True,False,True,True,616,-43.66957473754883,-49.55975341796875,1
Does Amelia ever exercise?,Amelia does ever exercise.,semantics,npi_licensing,matrix_question_npi_licensor_present,True,False,True,True,617,-37.045631408691406,-44.679161071777344,1
Might a pedestrian ever talk about Becca?,A pedestrian might ever talk about Becca.,semantics,npi_licensing,matrix_question_npi_licensor_present,True,False,True,True,618,-59.27409744262695,-56.04838562011719,0
Have many students ever shrugged?,Many students have ever shrugged.,semantics,npi_licensing,matrix_question_npi_licensor_present,True,False,True,True,619,-46.116668701171875,-43.96140670776367,0
Had William ever imagined Colleen hadn't bothered Marcus?,William had ever imagined Colleen hadn't bothered Marcus.,semantics,npi_licensing,matrix_question_npi_licensor_present,True,False,True,True,620,-80.4261474609375,-75.38491821289062,0
Has Amanda ever proven to turn?,Amanda has ever proven to turn.,semantics,npi_licensing,matrix_question_npi_licensor_present,True,False,True,True,621,-54.03872299194336,-51.923492431640625,0
Had Carlos ever obligated Rodney to wash?,Carlos had ever obligated Rodney to wash.,semantics,npi_licensing,matrix_question_npi_licensor_present,True,False,True,True,622,-80.92843627929688,-77.04927825927734,0
Did coats ever flatten?,Coats did ever flatten.,semantics,npi_licensing,matrix_question_npi_licensor_present,True,False,True,True,623,-39.860042572021484,-48.232730865478516,1
Can Candice ever describe Robert?,Candice can ever describe Robert.,semantics,npi_licensing,matrix_question_npi_licensor_present,True,False,True,True,624,-53.27009582519531,-58.01799774169922,1
Had Rachelle ever watched a lot of pedestrians?,Rachelle had ever watched a lot of pedestrians.,semantics,npi_licensing,matrix_question_npi_licensor_present,True,False,True,True,625,-64.27151489257812,-61.678550720214844,0
Should the broccoli ever blacken?,The broccoli should ever blacken.,semantics,npi_licensing,matrix_question_npi_licensor_present,True,False,True,True,626,-47.18482208251953,-51.113922119140625,1
Has Carrie ever commissioned the niece of Frank to climb up many mountains?,Carrie has ever commissioned the niece of Frank to climb up many mountains.,semantics,npi_licensing,matrix_question_npi_licensor_present,True,False,True,True,627,-94.2568588256836,-93.47935485839844,0
Had Tiffany ever shouted?,Tiffany had ever shouted.,semantics,npi_licensing,matrix_question_npi_licensor_present,True,False,True,True,628,-45.82433319091797,-42.746253967285156,0
Has Nicole ever seemed to profit?,Nicole has ever seemed to profit.,semantics,npi_licensing,matrix_question_npi_licensor_present,True,False,True,True,629,-46.29826736450195,-46.65235900878906,1
Had Marla ever embarrassed all men?,Marla had ever embarrassed all men.,semantics,npi_licensing,matrix_question_npi_licensor_present,True,False,True,True,630,-60.74610900878906,-59.478546142578125,0
Will many jackets ever vanish?,Many jackets will ever vanish.,semantics,npi_licensing,matrix_question_npi_licensor_present,True,False,True,True,631,-40.724788665771484,-42.95343780517578,1
Had many drivers ever obligated the girl to confuse Steve?,Many drivers had ever obligated the girl to confuse Steve.,semantics,npi_licensing,matrix_question_npi_licensor_present,True,False,True,True,632,-89.78936767578125,-88.42158508300781,0
Would Rachel ever remember what can close?,Rachel would ever remember what can close.,semantics,npi_licensing,matrix_question_npi_licensor_present,True,False,True,True,633,-63.66222381591797,-64.41806030273438,1
Can Beverly ever argue?,Beverly can ever argue.,semantics,npi_licensing,matrix_question_npi_licensor_present,True,False,True,True,634,-46.011470794677734,-42.433250427246094,0
Does Dan ever try to scare Derek?,Dan does ever try to scare Derek.,semantics,npi_licensing,matrix_question_npi_licensor_present,True,False,True,True,635,-54.194664001464844,-56.61666488647461,1
Do those forks ever crack?,Those forks do ever crack.,semantics,npi_licensing,matrix_question_npi_licensor_present,True,False,True,True,636,-38.468170166015625,-51.00895690917969,1
Did Edward ever shock a lot of universities?,Edward did ever shock a lot of universities.,semantics,npi_licensing,matrix_question_npi_licensor_present,True,False,True,True,637,-58.8934211730957,-62.80533981323242,1
Had Jason ever complained?,Jason had ever complained.,semantics,npi_licensing,matrix_question_npi_licensor_present,True,False,True,True,638,-38.313079833984375,-37.918418884277344,0
Could Monica ever laugh?,Monica could ever laugh.,semantics,npi_licensing,matrix_question_npi_licensor_present,True,False,True,True,639,-40.684478759765625,-40.77182388305664,1
Can every woman ever vanish?,Every woman can ever vanish.,semantics,npi_licensing,matrix_question_npi_licensor_present,True,False,True,True,640,-38.49937438964844,-39.804466247558594,1
Had Margaret ever seemed to scare Spain?,Margaret had ever seemed to scare Spain.,semantics,npi_licensing,matrix_question_npi_licensor_present,True,False,True,True,641,-61.23443603515625,-58.42328643798828,0
Has Galileo ever spurred Vincent to walk through a lot of public parks?,Galileo has ever spurred Vincent to walk through a lot of public parks.,semantics,npi_licensing,matrix_question_npi_licensor_present,True,False,True,True,642,-92.21116638183594,-92.96143341064453,1
Has Diana ever remembered the lady?,Diana has ever remembered the lady.,semantics,npi_licensing,matrix_question_npi_licensor_present,True,False,True,True,643,-46.37477111816406,-50.777591705322266,1
Has this legislature ever cooperated?,This legislature has ever cooperated.,semantics,npi_licensing,matrix_question_npi_licensor_present,True,False,True,True,644,-41.09275817871094,-45.66801452636719,1
Had the Borgias ever bored the Lutherans?,The Borgias had ever bored the Lutherans.,semantics,npi_licensing,matrix_question_npi_licensor_present,True,False,True,True,645,-65.31018829345703,-59.403656005859375,0
Did Barbara ever appear to vaporize?,Barbara did ever appear to vaporize.,semantics,npi_licensing,matrix_question_npi_licensor_present,True,False,True,True,646,-49.87628173828125,-56.6546630859375,1
Has Kenneth ever complained?,Kenneth has ever complained.,semantics,npi_licensing,matrix_question_npi_licensor_present,True,False,True,True,647,-34.5384407043457,-40.169166564941406,1
Could most waitresses ever talk to a patient?,Most waitresses could ever talk to a patient.,semantics,npi_licensing,matrix_question_npi_licensor_present,True,False,True,True,648,-63.258323669433594,-57.918052673339844,0
Had these teenagers ever responded?,These teenagers had ever responded.,semantics,npi_licensing,matrix_question_npi_licensor_present,True,False,True,True,649,-47.45360565185547,-49.028411865234375,1
Will those candles ever fall?,Those candles will ever fall.,semantics,npi_licensing,matrix_question_npi_licensor_present,True,False,True,True,650,-39.02556610107422,-42.63862991333008,1
Did these actors ever compete?,These actors did ever compete.,semantics,npi_licensing,matrix_question_npi_licensor_present,True,False,True,True,651,-36.315269470214844,-46.66777420043945,1
