sentence_good,sentence_bad,field,linguistics_term,UID,simple_LM_method,one_prefix_method,two_prefix_method,lexically_identical,pair_id,good_prob,bad_prob,correct
Had Bruce ever played?,Bruce had ever played.,semantics,npi_licensing,matrix_question_npi_licensor_present,True,False,True,True,0,-41.17523956298828,-35.646034240722656,0
Had Patrick ever answered?,Patrick had ever answered.,semantics,npi_licensing,matrix_question_npi_licensor_present,True,False,True,True,1,-42.50515365600586,-42.942047119140625,1
Do some carts ever accelerate?,Some carts do ever accelerate.,semantics,npi_licensing,matrix_question_npi_licensor_present,True,False,True,True,2,-42.76719284057617,-47.173179626464844,1
Will Dawn ever know Jeffrey?,Dawn will ever know Jeffrey.,semantics,npi_licensing,matrix_question_npi_licensor_present,True,False,True,True,3,-52.314292907714844,-52.35322570800781,1
Should Monica ever grin?,Monica should ever grin.,semantics,npi_licensing,matrix_question_npi_licensor_present,True,False,True,True,4,-41.990840911865234,-43.085487365722656,1
Has Cindy ever anticipated most dancers to study?,Cindy has ever anticipated most dancers to study.,semantics,npi_licensing,matrix_question_npi_licensor_present,True,False,True,True,5,-75.3977279663086,-73.13712310791016,0
Had Denise ever doubted Galileo can't bother to train?,Denise had ever doubted Galileo can't bother to train.,semantics,npi_licensing,matrix_question_npi_licensor_present,True,False,True,True,6,-84.88853454589844,-84.06721496582031,0
Has Jane ever worried Tonya?,Jane has ever worried Tonya.,semantics,npi_licensing,matrix_question_npi_licensor_present,True,False,True,True,7,-49.601585388183594,-51.61174011230469,1
Would many customers ever bake?,Many customers would ever bake.,semantics,npi_licensing,matrix_question_npi_licensor_present,True,False,True,True,8,-46.62274169921875,-43.608741760253906,0
Should Mitchell ever know Eva?,Mitchell should ever know Eva.,semantics,npi_licensing,matrix_question_npi_licensor_present,True,False,True,True,9,-47.269622802734375,-52.72138595581055,1
Could many doctors ever clash?,Many doctors could ever clash.,semantics,npi_licensing,matrix_question_npi_licensor_present,True,False,True,True,10,-41.830745697021484,-48.66215515136719,1
Has Sandra ever planned to get a job?,Sandra has ever planned to get a job.,semantics,npi_licensing,matrix_question_npi_licensor_present,True,False,True,True,11,-42.05499267578125,-45.892356872558594,1
Will the horse ever come here?,The horse will ever come here.,semantics,npi_licensing,matrix_question_npi_licensor_present,True,False,True,True,12,-35.20820236206055,-39.29129409790039,1
Did children ever cope?,Children did ever cope.,semantics,npi_licensing,matrix_question_npi_licensor_present,True,False,True,True,13,-36.955955505371094,-42.5256462097168,1
Did Carolyn ever argue?,Carolyn did ever argue.,semantics,npi_licensing,matrix_question_npi_licensor_present,True,False,True,True,14,-37.21052551269531,-43.173316955566406,1
Did most dresses ever shrink?,Most dresses did ever shrink.,semantics,npi_licensing,matrix_question_npi_licensor_present,True,False,True,True,15,-43.27978515625,-49.40870666503906,1
Might Sarah ever forget many teachers?,Sarah might ever forget many teachers.,semantics,npi_licensing,matrix_question_npi_licensor_present,True,False,True,True,16,-59.115928649902344,-55.17627716064453,0
Might Frank ever boast about Melanie?,Frank might ever boast about Melanie.,semantics,npi_licensing,matrix_question_npi_licensor_present,True,False,True,True,17,-60.856971740722656,-57.32524490356445,0
Had Dennis ever begged Joel to stretch?,Dennis had ever begged Joel to stretch.,semantics,npi_licensing,matrix_question_npi_licensor_present,True,False,True,True,18,-61.69215393066406,-59.80970001220703,0
Does Eric ever prompt Dawn to write?,Eric does ever prompt Dawn to write.,semantics,npi_licensing,matrix_question_npi_licensor_present,True,False,True,True,19,-59.17369079589844,-63.84318923950195,1
Would Ann ever drink?,Ann would ever drink.,semantics,npi_licensing,matrix_question_npi_licensor_present,True,False,True,True,20,-46.59226608276367,-37.99132537841797,0
Did Sharon ever waste away?,Sharon did ever waste away.,semantics,npi_licensing,matrix_question_npi_licensor_present,True,False,True,True,21,-42.494667053222656,-49.466732025146484,1
Would some screen ever disappear?,Some screen would ever disappear.,semantics,npi_licensing,matrix_question_npi_licensor_present,True,False,True,True,22,-45.78663635253906,-43.93076705932617,0
Does Gary ever believe Dennis to alarm Stephanie?,Gary does ever believe Dennis to alarm Stephanie.,semantics,npi_licensing,matrix_question_npi_licensor_present,True,False,True,True,23,-83.27581787109375,-83.51080322265625,1
Will that coat ever warp?,That coat will ever warp.,semantics,npi_licensing,matrix_question_npi_licensor_present,True,False,True,True,24,-41.101905822753906,-45.04285430908203,1
Had Suzanne ever sat down?,Suzanne had ever sat down.,semantics,npi_licensing,matrix_question_npi_licensor_present,True,False,True,True,25,-45.47211456298828,-46.133392333984375,1
Has Nina ever descended that mountain?,Nina has ever descended that mountain.,semantics,npi_licensing,matrix_question_npi_licensor_present,True,False,True,True,26,-50.271690368652344,-53.00627899169922,1
Did Jill ever die?,Jill did ever die.,semantics,npi_licensing,matrix_question_npi_licensor_present,True,False,True,True,27,-31.300655364990234,-38.393333435058594,1
Will Bradley ever mutter?,Bradley will ever mutter.,semantics,npi_licensing,matrix_question_npi_licensor_present,True,False,True,True,28,-45.00281524658203,-50.020103454589844,1
Have many children ever surrendered?,Many children have ever surrendered.,semantics,npi_licensing,matrix_question_npi_licensor_present,True,False,True,True,29,-41.98003387451172,-41.00105285644531,0
Would Stephen ever hide away?,Stephen would ever hide away.,semantics,npi_licensing,matrix_question_npi_licensor_present,True,False,True,True,30,-50.22651672363281,-46.06319046020508,0
Has Steven ever badgered every man to sound like most senators?,Steven has ever badgered every man to sound like most senators.,semantics,npi_licensing,matrix_question_npi_licensor_present,True,False,True,True,31,-89.85298156738281,-87.05492401123047,0
Might students ever see?,Students might ever see.,semantics,npi_licensing,matrix_question_npi_licensor_present,True,False,True,True,32,-39.8851432800293,-36.17030334472656,0
Will some bank ever profit?,Some bank will ever profit.,semantics,npi_licensing,matrix_question_npi_licensor_present,True,False,True,True,33,-41.253173828125,-44.595191955566406,1
Would Andrea ever encourage Beth to care for Charles?,Andrea would ever encourage Beth to care for Charles.,semantics,npi_licensing,matrix_question_npi_licensor_present,True,False,True,True,34,-68.25830078125,-66.23577880859375,0
Has Brad ever insulted Irene?,Brad has ever insulted Irene.,semantics,npi_licensing,matrix_question_npi_licensor_present,True,False,True,True,35,-48.65013885498047,-50.412296295166016,1
Could Vanessa ever dislike Charles?,Vanessa could ever dislike Charles.,semantics,npi_licensing,matrix_question_npi_licensor_present,True,False,True,True,36,-47.557472229003906,-49.01648712158203,1
Had Carl ever kissed Irene?,Carl had ever kissed Irene.,semantics,npi_licensing,matrix_question_npi_licensor_present,True,False,True,True,37,-50.012306213378906,-47.88671875,0
Will Christina ever try to observe Dawn?,Christina will ever try to observe Dawn.,semantics,npi_licensing,matrix_question_npi_licensor_present,True,False,True,True,38,-57.82832336425781,-62.79155731201172,1
Did Samuel ever sneeze?,Samuel did ever sneeze.,semantics,npi_licensing,matrix_question_npi_licensor_present,True,False,True,True,39,-40.5169677734375,-43.68182373046875,1
Should a lot of girls ever benefit?,A lot of girls should ever benefit.,semantics,npi_licensing,matrix_question_npi_licensor_present,True,False,True,True,40,-45.9329948425293,-47.30658721923828,1
Could some people ever chat?,Some people could ever chat.,semantics,npi_licensing,matrix_question_npi_licensor_present,True,False,True,True,41,-37.161094665527344,-37.81468200683594,1
Had Colleen ever imagined those actresses have ordered Kevin to talk?,Colleen had ever imagined those actresses have ordered Kevin to talk.,semantics,npi_licensing,matrix_question_npi_licensor_present,True,False,True,True,42,-95.45292663574219,-93.2892074584961,0
Has Sharon ever climbed down a hill?,Sharon has ever climbed down a hill.,semantics,npi_licensing,matrix_question_npi_licensor_present,True,False,True,True,43,-46.481849670410156,-48.677757263183594,1
Might Catherine ever implore Kristin's cousins to speak up?,Catherine might ever implore Kristin's cousins to speak up.,semantics,npi_licensing,matrix_question_npi_licensor_present,True,False,True,True,44,-92.93335723876953,-75.13694763183594,0
Have a lot of teachers ever kissed?,A lot of teachers have ever kissed.,semantics,npi_licensing,matrix_question_npi_licensor_present,True,False,True,True,45,-43.423683166503906,-43.49626159667969,1
Has Gary ever argued?,Gary has ever argued.,semantics,npi_licensing,matrix_question_npi_licensor_present,True,False,True,True,46,-37.19732666015625,-39.55324935913086,1
Have these blouses ever shrunk?,These blouses have ever shrunk.,semantics,npi_licensing,matrix_question_npi_licensor_present,True,False,True,True,47,-46.12010955810547,-46.289825439453125,1
Did Heather ever visit those closets?,Heather did ever visit those closets.,semantics,npi_licensing,matrix_question_npi_licensor_present,True,False,True,True,48,-48.221466064453125,-56.85639190673828,1
Do a lot of legislatures ever profit?,A lot of legislatures do ever profit.,semantics,npi_licensing,matrix_question_npi_licensor_present,True,False,True,True,49,-55.4000358581543,-55.98408126831055,1
Had Raymond ever murmured?,Raymond had ever murmured.,semantics,npi_licensing,matrix_question_npi_licensor_present,True,False,True,True,50,-48.37348175048828,-46.37947082519531,0
Has Amelia ever learned who aren't seeing?,Amelia has ever learned who aren't seeing.,semantics,npi_licensing,matrix_question_npi_licensor_present,True,False,True,True,51,-68.59098815917969,-70.8714599609375,1
Had Frank ever cleaned glasses?,Frank had ever cleaned glasses.,semantics,npi_licensing,matrix_question_npi_licensor_present,True,False,True,True,52,-50.650184631347656,-45.07587432861328,0
Do all hats ever twist?,All hats do ever twist.,semantics,npi_licensing,matrix_question_npi_licensor_present,True,False,True,True,53,-40.512779235839844,-53.06189727783203,1
Does that ice ever evaporate?,That ice does ever evaporate.,semantics,npi_licensing,matrix_question_npi_licensor_present,True,False,True,True,54,-39.30038070678711,-44.7554931640625,1
Had some vase ever tipped over?,Some vase had ever tipped over.,semantics,npi_licensing,matrix_question_npi_licensor_present,True,False,True,True,55,-52.6633186340332,-49.053009033203125,0
Has Steven ever tried to die?,Steven has ever tried to die.,semantics,npi_licensing,matrix_question_npi_licensor_present,True,False,True,True,56,-41.10657501220703,-43.50746154785156,1
Had Amy ever cooked?,Amy had ever cooked.,semantics,npi_licensing,matrix_question_npi_licensor_present,True,False,True,True,57,-38.69544982910156,-40.651145935058594,1
Has Deanna ever learned what won't negotiate?,Deanna has ever learned what won't negotiate.,semantics,npi_licensing,matrix_question_npi_licensor_present,True,False,True,True,58,-58.576568603515625,-65.5741195678711,1
Can Natalie ever criticize the senator?,Natalie can ever criticize the senator.,semantics,npi_licensing,matrix_question_npi_licensor_present,True,False,True,True,59,-48.974205017089844,-56.431739807128906,1
Had some convertibles ever stopped?,Some convertibles had ever stopped.,semantics,npi_licensing,matrix_question_npi_licensor_present,True,False,True,True,60,-51.70568084716797,-46.3821907043457,0
Could Janice ever play?,Janice could ever play.,semantics,npi_licensing,matrix_question_npi_licensor_present,True,False,True,True,61,-34.931392669677734,-40.76013946533203,1
Had Carol ever encouraged Phillip to take a lot of public parks?,Carol had ever encouraged Phillip to take a lot of public parks.,semantics,npi_licensing,matrix_question_npi_licensor_present,True,False,True,True,62,-82.87593078613281,-78.80191802978516,0
Had some government ever clashed?,Some government had ever clashed.,semantics,npi_licensing,matrix_question_npi_licensor_present,True,False,True,True,63,-54.05067443847656,-47.82077407836914,0
Had Christopher ever trained?,Christopher had ever trained.,semantics,npi_licensing,matrix_question_npi_licensor_present,True,False,True,True,64,-44.207489013671875,-40.69940185546875,0
Has Spain ever pushed these daughters of Melinda to go fishing?,Spain has ever pushed these daughters of Melinda to go fishing.,semantics,npi_licensing,matrix_question_npi_licensor_present,True,False,True,True,65,-81.69720458984375,-80.0591049194336,0
Would every bank ever work hard?,Every bank would ever work hard.,semantics,npi_licensing,matrix_question_npi_licensor_present,True,False,True,True,66,-46.80292510986328,-47.66605758666992,1
Might Danielle ever go fishing?,Danielle might ever go fishing.,semantics,npi_licensing,matrix_question_npi_licensor_present,True,False,True,True,67,-50.79478073120117,-45.55802917480469,0
Has that shirt ever flattened?,That shirt has ever flattened.,semantics,npi_licensing,matrix_question_npi_licensor_present,True,False,True,True,68,-42.69416427612305,-45.10987091064453,1
Can every committee ever testify?,Every committee can ever testify.,semantics,npi_licensing,matrix_question_npi_licensor_present,True,False,True,True,69,-44.32349395751953,-47.26902770996094,1
Have many movies ever disagreed with Jessica?,Many movies have ever disagreed with Jessica.,semantics,npi_licensing,matrix_question_npi_licensor_present,True,False,True,True,70,-63.857582092285156,-59.16740417480469,0
Should William ever exercise?,William should ever exercise.,semantics,npi_licensing,matrix_question_npi_licensor_present,True,False,True,True,71,-41.82767868041992,-43.75497817993164,1
Had James ever dropped by this museum?,James had ever dropped by this museum.,semantics,npi_licensing,matrix_question_npi_licensor_present,True,False,True,True,72,-57.1037712097168,-57.5689697265625,1
Did Jennifer ever disappear?,Jennifer did ever disappear.,semantics,npi_licensing,matrix_question_npi_licensor_present,True,False,True,True,73,-33.68236541748047,-41.96427917480469,1
Had the doctors ever intended to drop by most movie theaters?,The doctors had ever intended to drop by most movie theaters.,semantics,npi_licensing,matrix_question_npi_licensor_present,True,False,True,True,74,-72.2414321899414,-70.99263763427734,0
Does Liam ever come here?,Liam does ever come here.,semantics,npi_licensing,matrix_question_npi_licensor_present,True,False,True,True,75,-34.160396575927734,-41.545448303222656,1
Should Jodi ever argue?,Jodi should ever argue.,semantics,npi_licensing,matrix_question_npi_licensor_present,True,False,True,True,76,-41.66306686401367,-43.00103759765625,1
Should guests ever seem to suffer?,Guests should ever seem to suffer.,semantics,npi_licensing,matrix_question_npi_licensor_present,True,False,True,True,77,-43.51980209350586,-50.157562255859375,1
Would Julia ever scratch?,Julia would ever scratch.,semantics,npi_licensing,matrix_question_npi_licensor_present,True,False,True,True,78,-42.27016830444336,-41.46662521362305,0
Had Adam ever forgotten about who have hats?,Adam had ever forgotten about who have hats.,semantics,npi_licensing,matrix_question_npi_licensor_present,True,False,True,True,79,-65.62898254394531,-64.29830932617188,0
Has Carol ever declared some ladies to shout?,Carol has ever declared some ladies to shout.,semantics,npi_licensing,matrix_question_npi_licensor_present,True,False,True,True,80,-72.88736724853516,-69.23213958740234,0
Does the jacket ever fold?,The jacket does ever fold.,semantics,npi_licensing,matrix_question_npi_licensor_present,True,False,True,True,81,-35.703636169433594,-41.811119079589844,1
Had some books ever disagreed?,Some books had ever disagreed.,semantics,npi_licensing,matrix_question_npi_licensor_present,True,False,True,True,82,-46.756980895996094,-45.47325134277344,0
Has a waitress ever hoped to take every carriage?,A waitress has ever hoped to take every carriage.,semantics,npi_licensing,matrix_question_npi_licensor_present,True,False,True,True,83,-68.53523254394531,-69.72673034667969,1
Would Edward ever watch Wendy?,Edward would ever watch Wendy.,semantics,npi_licensing,matrix_question_npi_licensor_present,True,False,True,True,84,-47.71725082397461,-49.448158264160156,1
Should Carrie ever answer?,Carrie should ever answer.,semantics,npi_licensing,matrix_question_npi_licensor_present,True,False,True,True,85,-38.51475524902344,-42.25653839111328,1
Have these ladies ever seen Kayla?,These ladies have ever seen Kayla.,semantics,npi_licensing,matrix_question_npi_licensor_present,True,False,True,True,86,-45.54608154296875,-48.05463409423828,1
Had Wendy ever proven to fold?,Wendy had ever proven to fold.,semantics,npi_licensing,matrix_question_npi_licensor_present,True,False,True,True,87,-56.65391540527344,-58.87849807739258,1
Had every child ever left every guest?,Every child had ever left every guest.,semantics,npi_licensing,matrix_question_npi_licensor_present,True,False,True,True,88,-58.256927490234375,-59.84233093261719,1
Had some children ever reunited?,Some children had ever reunited.,semantics,npi_licensing,matrix_question_npi_licensor_present,True,False,True,True,89,-45.94834899902344,-47.983001708984375,1
Have a lot of waiters ever whispered?,A lot of waiters have ever whispered.,semantics,npi_licensing,matrix_question_npi_licensor_present,True,False,True,True,90,-56.331390380859375,-50.795166015625,0
Has Rebecca ever enticed the waiter to scratch?,Rebecca has ever enticed the waiter to scratch.,semantics,npi_licensing,matrix_question_npi_licensor_present,True,False,True,True,91,-63.04374313354492,-64.74323272705078,1
Had some ladies ever answered?,Some ladies had ever answered.,semantics,npi_licensing,matrix_question_npi_licensor_present,True,False,True,True,92,-48.64540100097656,-48.013771057128906,0
Would the play ever disgust Karen?,The play would ever disgust Karen.,semantics,npi_licensing,matrix_question_npi_licensor_present,True,False,True,True,93,-55.437347412109375,-53.254600524902344,0
Could that child ever tour the malls?,That child could ever tour the malls.,semantics,npi_licensing,matrix_question_npi_licensor_present,True,False,True,True,94,-52.253849029541016,-53.61674880981445,1
Had Nicole ever believed Pamela to cheer?,Nicole had ever believed Pamela to cheer.,semantics,npi_licensing,matrix_question_npi_licensor_present,True,False,True,True,95,-72.010498046875,-66.50312805175781,0
Would Irene ever attempt to answer?,Irene would ever attempt to answer.,semantics,npi_licensing,matrix_question_npi_licensor_present,True,False,True,True,96,-49.83049011230469,-48.38408279418945,0
Did the actors ever debate?,The actors did ever debate.,semantics,npi_licensing,matrix_question_npi_licensor_present,True,False,True,True,97,-39.330078125,-43.522254943847656,1
Does Linda ever insult Sheila?,Linda does ever insult Sheila.,semantics,npi_licensing,matrix_question_npi_licensor_present,True,False,True,True,98,-49.22471618652344,-57.49676513671875,1
Have the schools ever required Edward to argue?,The schools have ever required Edward to argue.,semantics,npi_licensing,matrix_question_npi_licensor_present,True,False,True,True,99,-64.81056213378906,-63.92779541015625,0
Have most chairs ever tipped over?,Most chairs have ever tipped over.,semantics,npi_licensing,matrix_question_npi_licensor_present,True,False,True,True,100,-47.912723541259766,-40.61464309692383,0
Have the Clintons ever worked hard?,The Clintons have ever worked hard.,semantics,npi_licensing,matrix_question_npi_licensor_present,True,False,True,True,101,-40.55110168457031,-35.39302062988281,0
Have most lamps ever dimmed?,Most lamps have ever dimmed.,semantics,npi_licensing,matrix_question_npi_licensor_present,True,False,True,True,102,-44.51092529296875,-39.65373992919922,0
Had Kendra ever yawned?,Kendra had ever yawned.,semantics,npi_licensing,matrix_question_npi_licensor_present,True,False,True,True,103,-42.71030807495117,-46.10668182373047,1
Had Samuel ever wept?,Samuel had ever wept.,semantics,npi_licensing,matrix_question_npi_licensor_present,True,False,True,True,104,-40.191017150878906,-37.998207092285156,0
Might many lights ever darken?,Many lights might ever darken.,semantics,npi_licensing,matrix_question_npi_licensor_present,True,False,True,True,105,-53.347877502441406,-44.814510345458984,0
Will Sally ever escape?,Sally will ever escape.,semantics,npi_licensing,matrix_question_npi_licensor_present,True,False,True,True,106,-33.36122131347656,-37.2656135559082,1
Had Jerry ever observed Rachel?,Jerry had ever observed Rachel.,semantics,npi_licensing,matrix_question_npi_licensor_present,True,False,True,True,107,-56.54899978637695,-49.587982177734375,0
Will a lot of public parks ever irritate Tara?,A lot of public parks will ever irritate Tara.,semantics,npi_licensing,matrix_question_npi_licensor_present,True,False,True,True,108,-63.924095153808594,-67.38899230957031,1
Can a doctor ever observe Amy?,A doctor can ever observe Amy.,semantics,npi_licensing,matrix_question_npi_licensor_present,True,False,True,True,109,-45.55900192260742,-53.87057876586914,1
Has Donald ever yearned to embarrass Tonya?,Donald has ever yearned to embarrass Tonya.,semantics,npi_licensing,matrix_question_npi_licensor_present,True,False,True,True,110,-69.69709014892578,-64.07344055175781,0
Can Amanda ever shock Sarah?,Amanda can ever shock Sarah.,semantics,npi_licensing,matrix_question_npi_licensor_present,True,False,True,True,111,-48.06256866455078,-53.16573715209961,1
Had Lissa ever discovered who has remembered what prodded Kenneth to bake?,Lissa had ever discovered who has remembered what prodded Kenneth to bake.,semantics,npi_licensing,matrix_question_npi_licensor_present,True,False,True,True,112,-111.59821319580078,-110.91177368164062,0
Can this mushroom ever go bad?,This mushroom can ever go bad.,semantics,npi_licensing,matrix_question_npi_licensor_present,True,False,True,True,113,-40.45187759399414,-43.35701370239258,1
Might some library ever compete?,Some library might ever compete.,semantics,npi_licensing,matrix_question_npi_licensor_present,True,False,True,True,114,-50.29861068725586,-48.03510284423828,0
Had this cilantro ever charred?,This cilantro had ever charred.,semantics,npi_licensing,matrix_question_npi_licensor_present,True,False,True,True,115,-60.31755447387695,-54.20554733276367,0
Did Monica ever convince Brian to hide?,Monica did ever convince Brian to hide.,semantics,npi_licensing,matrix_question_npi_licensor_present,True,False,True,True,116,-53.18842315673828,-60.71553039550781,1
Had a glove ever unfolded?,A glove had ever unfolded.,semantics,npi_licensing,matrix_question_npi_licensor_present,True,False,True,True,117,-45.378475189208984,-45.46746826171875,1
Can Monet ever donate?,Monet can ever donate.,semantics,npi_licensing,matrix_question_npi_licensor_present,True,False,True,True,118,-39.56940460205078,-45.838165283203125,1
Had the Lutherans ever divorced?,The Lutherans had ever divorced.,semantics,npi_licensing,matrix_question_npi_licensor_present,True,False,True,True,119,-47.83037567138672,-46.10053253173828,0
Should this adult ever command Melanie to forfeit?,This adult should ever command Melanie to forfeit.,semantics,npi_licensing,matrix_question_npi_licensor_present,True,False,True,True,120,-76.62195587158203,-80.11105346679688,1
Had Stacy ever attacked Donald?,Stacy had ever attacked Donald.,semantics,npi_licensing,matrix_question_npi_licensor_present,True,False,True,True,121,-51.76506042480469,-52.77755355834961,1
Can Caroline ever explore these malls?,Caroline can ever explore these malls.,semantics,npi_licensing,matrix_question_npi_licensor_present,True,False,True,True,122,-55.51026153564453,-59.200077056884766,1
Has Randolf ever argued?,Randolf has ever argued.,semantics,npi_licensing,matrix_question_npi_licensor_present,True,False,True,True,123,-46.11128234863281,-43.30583190917969,0
Could Deanna ever see a girl?,Deanna could ever see a girl.,semantics,npi_licensing,matrix_question_npi_licensor_present,True,False,True,True,124,-46.00202941894531,-48.77226257324219,1
Can Martha ever reveal who isn't researching every sketch?,Martha can ever reveal who isn't researching every sketch.,semantics,npi_licensing,matrix_question_npi_licensor_present,True,False,True,True,125,-81.74929809570312,-85.55351257324219,1
Has Patrick ever studied?,Patrick has ever studied.,semantics,npi_licensing,matrix_question_npi_licensor_present,True,False,True,True,126,-38.19580078125,-39.039222717285156,1
Should a unicycle ever slow?,A unicycle should ever slow.,semantics,npi_licensing,matrix_question_npi_licensor_present,True,False,True,True,127,-41.969627380371094,-49.87333679199219,1
Would Chad ever slump over?,Chad would ever slump over.,semantics,npi_licensing,matrix_question_npi_licensor_present,True,False,True,True,128,-50.37804412841797,-55.14844512939453,1
Has Lawrence ever forced Samuel to smile?,Lawrence has ever forced Samuel to smile.,semantics,npi_licensing,matrix_question_npi_licensor_present,True,False,True,True,129,-51.29290008544922,-56.865814208984375,1
Might the Impressionists ever reunite?,The Impressionists might ever reunite.,semantics,npi_licensing,matrix_question_npi_licensor_present,True,False,True,True,130,-53.399803161621094,-48.8428955078125,0
Had glaciers ever frozen?,Glaciers had ever frozen.,semantics,npi_licensing,matrix_question_npi_licensor_present,True,False,True,True,131,-39.80332946777344,-42.05453109741211,1
