sentence_good,sentence_bad,field,linguistics_term,UID,simple_LM_method,one_prefix_method,two_prefix_method,lexically_identical,pair_id,good_prob,bad_prob,correct
Kenneth worked with himself.,Kenneth worked with herself.,morphology,anaphor_agreement,anaphor_gender_agreement,True,True,False,False,434,-27.61432456970215,-28.22367286682129,1
Christina hadn't discussed herself.,Christina hadn't discussed itself.,morphology,anaphor_agreement,anaphor_gender_agreement,True,True,False,False,435,-37.35093307495117,-37.1385498046875,0
Robert has hidden himself.,Robert has hidden itself.,morphology,anaphor_agreement,anaphor_gender_agreement,True,True,False,False,436,-23.741287231445312,-24.073345184326172,1
Bill isn't disgusting himself.,Bill isn't disgusting herself.,morphology,anaphor_agreement,anaphor_gender_agreement,True,True,False,False,437,-32.14370346069336,-31.685245513916016,0
Richard argued about himself.,Richard argued about itself.,morphology,anaphor_agreement,anaphor_gender_agreement,True,True,False,False,438,-25.502540588378906,-27.177078247070312,1
The lady referenced herself.,The lady referenced itself.,morphology,anaphor_agreement,anaphor_gender_agreement,True,True,False,False,439,-31.965452194213867,-32.22868347167969,1
Cynthia can't criticize herself.,Cynthia can't criticize itself.,morphology,anaphor_agreement,anaphor_gender_agreement,True,True,False,False,440,-52.59431457519531,-52.7035026550293,1
Marie helped herself.,Marie helped himself.,morphology,anaphor_agreement,anaphor_gender_agreement,True,True,False,False,441,-18.996200561523438,-17.703895568847656,0
Bruce has upset himself.,Bruce has upset herself.,morphology,anaphor_agreement,anaphor_gender_agreement,True,True,False,False,442,-24.366907119750977,-24.941089630126953,1
Bill was insulting himself.,Bill was insulting herself.,morphology,anaphor_agreement,anaphor_gender_agreement,True,True,False,False,443,-24.175418853759766,-25.719890594482422,1
Grace hadn't confused herself.,Grace hadn't confused himself.,morphology,anaphor_agreement,anaphor_gender_agreement,True,True,False,False,444,-39.03630065917969,-38.10773468017578,0
This documentary has disagreed with itself.,This documentary has disagreed with himself.,morphology,anaphor_agreement,anaphor_gender_agreement,True,True,False,False,445,-41.810577392578125,-41.74235534667969,0
Jennifer described herself.,Jennifer described himself.,morphology,anaphor_agreement,anaphor_gender_agreement,True,True,False,False,446,-20.685436248779297,-19.408710479736328,0
Jane has shocked herself.,Jane has shocked itself.,morphology,anaphor_agreement,anaphor_gender_agreement,True,True,False,False,447,-26.718103408813477,-26.96013641357422,1
Rachel wasn't curing herself.,Rachel wasn't curing itself.,morphology,anaphor_agreement,anaphor_gender_agreement,True,True,False,False,448,-31.11505889892578,-30.981674194335938,0
Judy disturbed herself.,Judy disturbed himself.,morphology,anaphor_agreement,anaphor_gender_agreement,True,True,False,False,449,-26.151912689208984,-25.567047119140625,0
Ruth can't observe herself.,Ruth can't observe itself.,morphology,anaphor_agreement,anaphor_gender_agreement,True,True,False,False,450,-36.446022033691406,-35.561607360839844,0
Chad hurt himself.,Chad hurt herself.,morphology,anaphor_agreement,anaphor_gender_agreement,True,True,False,False,451,-26.51211929321289,-27.763935089111328,1
Diana describes herself.,Diana describes himself.,morphology,anaphor_agreement,anaphor_gender_agreement,True,True,False,False,452,-32.38642883300781,-30.127330780029297,0
Carol might complain about herself.,Carol might complain about himself.,morphology,anaphor_agreement,anaphor_gender_agreement,True,True,False,False,453,-39.675071716308594,-37.935455322265625,0
Andrew was annoying himself.,Andrew was annoying herself.,morphology,anaphor_agreement,anaphor_gender_agreement,True,True,False,False,454,-24.682205200195312,-25.285974502563477,1
Derek isn't referencing himself.,Derek isn't referencing itself.,morphology,anaphor_agreement,anaphor_gender_agreement,True,True,False,False,455,-42.33548355102539,-43.796913146972656,1
Regina had scared herself.,Regina had scared himself.,morphology,anaphor_agreement,anaphor_gender_agreement,True,True,False,False,456,-31.60528564453125,-31.354022979736328,0
Roger isn't helping himself.,Roger isn't helping herself.,morphology,anaphor_agreement,anaphor_gender_agreement,True,True,False,False,457,-25.959888458251953,-27.35726547241211,1
Carrie does cure herself.,Carrie does cure himself.,morphology,anaphor_agreement,anaphor_gender_agreement,True,True,False,False,458,-37.79248809814453,-36.721519470214844,0
This newspaper article disagreed with itself.,This newspaper article disagreed with herself.,morphology,anaphor_agreement,anaphor_gender_agreement,True,True,False,False,459,-45.39739227294922,-46.731666564941406,1
Carl had known himself.,Carl had known itself.,morphology,anaphor_agreement,anaphor_gender_agreement,True,True,False,False,460,-20.05206298828125,-22.449893951416016,1
Jodi was bothering herself.,Jodi was bothering itself.,morphology,anaphor_agreement,anaphor_gender_agreement,True,True,False,False,461,-34.661865234375,-35.69580841064453,1
Kevin wasn't upsetting himself.,Kevin wasn't upsetting itself.,morphology,anaphor_agreement,anaphor_gender_agreement,True,True,False,False,462,-28.925363540649414,-30.101436614990234,1
Kenneth had hurt himself.,Kenneth had hurt itself.,morphology,anaphor_agreement,anaphor_gender_agreement,True,True,False,False,463,-25.897743225097656,-29.256332397460938,1
Brad wasn't bothering himself.,Brad wasn't bothering itself.,morphology,anaphor_agreement,anaphor_gender_agreement,True,True,False,False,464,-27.659107208251953,-30.468236923217773,1
April fires herself.,April fires himself.,morphology,anaphor_agreement,anaphor_gender_agreement,True,True,False,False,465,-23.214584350585938,-22.614280700683594,0
Theresa isn't healing herself.,Theresa isn't healing itself.,morphology,anaphor_agreement,anaphor_gender_agreement,True,True,False,False,466,-43.50776290893555,-42.22453308105469,0
Steven remembered himself.,Steven remembered itself.,morphology,anaphor_agreement,anaphor_gender_agreement,True,True,False,False,467,-18.884204864501953,-21.213014602661133,1
Tina wasn't talking about herself.,Tina wasn't talking about itself.,morphology,anaphor_agreement,anaphor_gender_agreement,True,True,False,False,468,-35.415679931640625,-36.35793685913086,1
Christine loves herself.,Christine loves himself.,morphology,anaphor_agreement,anaphor_gender_agreement,True,True,False,False,469,-26.253395080566406,-24.46552276611328,0
That actress describes herself.,That actress describes itself.,morphology,anaphor_agreement,anaphor_gender_agreement,True,True,False,False,470,-33.42807388305664,-33.572479248046875,1
Bruce shouldn't argue about himself.,Bruce shouldn't argue about itself.,morphology,anaphor_agreement,anaphor_gender_agreement,True,True,False,False,471,-31.015880584716797,-31.920944213867188,1
Caroline would help herself.,Caroline would help itself.,morphology,anaphor_agreement,anaphor_gender_agreement,True,True,False,False,472,-27.63196563720703,-29.315597534179688,1
Bradley couldn't upset himself.,Bradley couldn't upset herself.,morphology,anaphor_agreement,anaphor_gender_agreement,True,True,False,False,473,-33.34674835205078,-34.41519546508789,1
Eva bored herself.,Eva bored himself.,morphology,anaphor_agreement,anaphor_gender_agreement,True,True,False,False,474,-24.3511962890625,-23.348600387573242,0
David hires himself.,David hires itself.,morphology,anaphor_agreement,anaphor_gender_agreement,True,True,False,False,475,-22.648672103881836,-23.72557830810547,1
Becca hadn't astounded herself.,Becca hadn't astounded himself.,morphology,anaphor_agreement,anaphor_gender_agreement,True,True,False,False,476,-48.64889144897461,-47.508827209472656,0
Harvard University wasn't disturbing itself.,Harvard University wasn't disturbing herself.,morphology,anaphor_agreement,anaphor_gender_agreement,True,True,False,False,477,-50.8525390625,-51.007564544677734,1
Phillip hadn't watched himself.,Phillip hadn't watched herself.,morphology,anaphor_agreement,anaphor_gender_agreement,True,True,False,False,478,-33.641090393066406,-35.52318572998047,1
Joel forgets himself.,Joel forgets itself.,morphology,anaphor_agreement,anaphor_gender_agreement,True,True,False,False,479,-33.553462982177734,-34.1159553527832,1
Linda could forget herself.,Linda could forget himself.,morphology,anaphor_agreement,anaphor_gender_agreement,True,True,False,False,480,-32.79840850830078,-31.29269790649414,0
Laura can't criticize herself.,Laura can't criticize itself.,morphology,anaphor_agreement,anaphor_gender_agreement,True,True,False,False,481,-28.074790954589844,-28.12976837158203,1
Amelia watches herself.,Amelia watches itself.,morphology,anaphor_agreement,anaphor_gender_agreement,True,True,False,False,482,-29.10292625427246,-29.340652465820312,1
Kayla insults herself.,Kayla insults itself.,morphology,anaphor_agreement,anaphor_gender_agreement,True,True,False,False,483,-33.06123352050781,-31.46644401550293,0
Larry didn't heal himself.,Larry didn't heal herself.,morphology,anaphor_agreement,anaphor_gender_agreement,True,True,False,False,484,-26.428546905517578,-28.195419311523438,1
Maria hated herself.,Maria hated itself.,morphology,anaphor_agreement,anaphor_gender_agreement,True,True,False,False,485,-20.822242736816406,-21.561737060546875,1
Walter wouldn't investigate himself.,Walter wouldn't investigate herself.,morphology,anaphor_agreement,anaphor_gender_agreement,True,True,False,False,486,-34.67840576171875,-36.15507888793945,1
Chad will alarm himself.,Chad will alarm herself.,morphology,anaphor_agreement,anaphor_gender_agreement,True,True,False,False,487,-37.1613655090332,-37.71672439575195,1
Renee hadn't fled from herself.,Renee hadn't fled from himself.,morphology,anaphor_agreement,anaphor_gender_agreement,True,True,False,False,488,-42.063072204589844,-39.927162170410156,0
Tina doesn't think about herself.,Tina doesn't think about itself.,morphology,anaphor_agreement,anaphor_gender_agreement,True,True,False,False,489,-33.66236877441406,-34.31440734863281,1
Russell thought about himself.,Russell thought about herself.,morphology,anaphor_agreement,anaphor_gender_agreement,True,True,False,False,490,-19.953201293945312,-21.4516658782959,1
Theresa remembered herself.,Theresa remembered itself.,morphology,anaphor_agreement,anaphor_gender_agreement,True,True,False,False,491,-31.635456085205078,-32.51291275024414,1
Kenneth insulted himself.,Kenneth insulted itself.,morphology,anaphor_agreement,anaphor_gender_agreement,True,True,False,False,492,-24.960865020751953,-27.89600372314453,1
Eric admired himself.,Eric admired herself.,morphology,anaphor_agreement,anaphor_gender_agreement,True,True,False,False,493,-20.51416778564453,-21.992420196533203,1
The guy doesn't think about himself.,The guy doesn't think about itself.,morphology,anaphor_agreement,anaphor_gender_agreement,True,True,False,False,494,-33.332069396972656,-34.5444450378418,1
Emily won't confuse herself.,Emily won't confuse himself.,morphology,anaphor_agreement,anaphor_gender_agreement,True,True,False,False,495,-26.640527725219727,-25.947233200073242,0
Jason complains about himself.,Jason complains about herself.,morphology,anaphor_agreement,anaphor_gender_agreement,True,True,False,False,496,-24.34964370727539,-26.239303588867188,1
Victoria wasn't approaching herself.,Victoria wasn't approaching itself.,morphology,anaphor_agreement,anaphor_gender_agreement,True,True,False,False,497,-29.65854835510254,-29.468997955322266,0
Liam hadn't returned to himself.,Liam hadn't returned to herself.,morphology,anaphor_agreement,anaphor_gender_agreement,True,True,False,False,498,-39.779502868652344,-39.90485763549805,1
Holly thinks about herself.,Holly thinks about himself.,morphology,anaphor_agreement,anaphor_gender_agreement,True,True,False,False,499,-31.601619720458984,-30.95330238342285,0
David discovered himself.,David discovered herself.,morphology,anaphor_agreement,anaphor_gender_agreement,True,True,False,False,500,-18.291847229003906,-20.329627990722656,1
Every lady does irritate herself.,Every lady does irritate itself.,morphology,anaphor_agreement,anaphor_gender_agreement,True,True,False,False,501,-39.92382049560547,-39.56356430053711,0
Julia boasted about herself.,Julia boasted about itself.,morphology,anaphor_agreement,anaphor_gender_agreement,True,True,False,False,502,-33.08464050292969,-33.61271667480469,1
Jacqueline has disgusted herself.,Jacqueline has disgusted itself.,morphology,anaphor_agreement,anaphor_gender_agreement,True,True,False,False,503,-42.83700942993164,-42.848567962646484,1
The guy doesn't irritate himself.,The guy doesn't irritate herself.,morphology,anaphor_agreement,anaphor_gender_agreement,True,True,False,False,504,-40.161277770996094,-41.695106506347656,1
Chad is admiring himself.,Chad is admiring itself.,morphology,anaphor_agreement,anaphor_gender_agreement,True,True,False,False,505,-36.14348602294922,-37.59662628173828,1
Andrea left herself.,Andrea left itself.,morphology,anaphor_agreement,anaphor_gender_agreement,True,True,False,False,506,-29.66020965576172,-29.133934020996094,0
Melinda cured herself.,Melinda cured himself.,morphology,anaphor_agreement,anaphor_gender_agreement,True,True,False,False,507,-30.600555419921875,-30.1981143951416,0
Meredith has kissed herself.,Meredith has kissed itself.,morphology,anaphor_agreement,anaphor_gender_agreement,True,True,False,False,508,-37.33139419555664,-39.62615203857422,1
April criticized herself.,April criticized itself.,morphology,anaphor_agreement,anaphor_gender_agreement,True,True,False,False,509,-22.364486694335938,-21.441791534423828,0
Sheila won't bother herself.,Sheila won't bother himself.,morphology,anaphor_agreement,anaphor_gender_agreement,True,True,False,False,510,-33.45441436767578,-33.168540954589844,0
Roger should dislike himself.,Roger should dislike itself.,morphology,anaphor_agreement,anaphor_gender_agreement,True,True,False,False,511,-26.649669647216797,-27.49452781677246,1
Rachelle talks to herself.,Rachelle talks to itself.,morphology,anaphor_agreement,anaphor_gender_agreement,True,True,False,False,512,-31.003978729248047,-32.904449462890625,1
Jerry would attack himself.,Jerry would attack itself.,morphology,anaphor_agreement,anaphor_gender_agreement,True,True,False,False,513,-21.469215393066406,-21.46746063232422,0
Julia has listened to herself.,Julia has listened to itself.,morphology,anaphor_agreement,anaphor_gender_agreement,True,True,False,False,514,-28.789966583251953,-31.204326629638672,1
Ronald scared himself.,Ronald scared herself.,morphology,anaphor_agreement,anaphor_gender_agreement,True,True,False,False,515,-31.017269134521484,-31.24734878540039,1
Susan wasn't attacking herself.,Susan wasn't attacking himself.,morphology,anaphor_agreement,anaphor_gender_agreement,True,True,False,False,516,-30.29245376586914,-28.183046340942383,0
Sarah could criticize herself.,Sarah could criticize itself.,morphology,anaphor_agreement,anaphor_gender_agreement,True,True,False,False,517,-26.836978912353516,-26.746925354003906,0
Stacy had hired herself.,Stacy had hired himself.,morphology,anaphor_agreement,anaphor_gender_agreement,True,True,False,False,518,-32.762569427490234,-30.838924407958984,0
Frank has worked with himself.,Frank has worked with itself.,morphology,anaphor_agreement,anaphor_gender_agreement,True,True,False,False,519,-24.35886573791504,-25.702320098876953,1
That actress will irritate herself.,That actress will irritate itself.,morphology,anaphor_agreement,anaphor_gender_agreement,True,True,False,False,520,-44.94528579711914,-43.93547058105469,0
Stephanie has irritated herself.,Stephanie has irritated itself.,morphology,anaphor_agreement,anaphor_gender_agreement,True,True,False,False,521,-40.514015197753906,-41.401283264160156,1
Colleen forgets herself.,Colleen forgets himself.,morphology,anaphor_agreement,anaphor_gender_agreement,True,True,False,False,522,-37.831268310546875,-37.376121520996094,0
Nancy hurt herself.,Nancy hurt itself.,morphology,anaphor_agreement,anaphor_gender_agreement,True,True,False,False,523,-26.910369873046875,-28.767194747924805,1
Deborah hasn't remembered herself.,Deborah hasn't remembered itself.,morphology,anaphor_agreement,anaphor_gender_agreement,True,True,False,False,524,-41.1541862487793,-41.673858642578125,1
Alicia hasn't remembered herself.,Alicia hasn't remembered himself.,morphology,anaphor_agreement,anaphor_gender_agreement,True,True,False,False,525,-45.38956832885742,-44.611141204833984,0
Beverly can respect herself.,Beverly can respect himself.,morphology,anaphor_agreement,anaphor_gender_agreement,True,True,False,False,526,-45.843265533447266,-44.86033630371094,0
Ann has cared for herself.,Ann has cared for himself.,morphology,anaphor_agreement,anaphor_gender_agreement,True,True,False,False,527,-28.200368881225586,-27.010007858276367,0
Edward had disliked himself.,Edward had disliked herself.,morphology,anaphor_agreement,anaphor_gender_agreement,True,True,False,False,528,-24.743343353271484,-26.583538055419922,1
Melanie had returned to herself.,Melanie had returned to itself.,morphology,anaphor_agreement,anaphor_gender_agreement,True,True,False,False,529,-34.40066146850586,-36.07160949707031,1
Alexander scares himself.,Alexander scares herself.,morphology,anaphor_agreement,anaphor_gender_agreement,True,True,False,False,530,-19.855615615844727,-21.287891387939453,1
Ella revealed herself.,Ella revealed itself.,morphology,anaphor_agreement,anaphor_gender_agreement,True,True,False,False,531,-30.92306137084961,-30.916671752929688,0
Samuel hasn't hated himself.,Samuel hasn't hated itself.,morphology,anaphor_agreement,anaphor_gender_agreement,True,True,False,False,532,-39.247310638427734,-41.29368591308594,1
Omar embarrassed himself.,Omar embarrassed herself.,morphology,anaphor_agreement,anaphor_gender_agreement,True,True,False,False,533,-33.57122039794922,-34.05830764770508,1
That boy upset himself.,That boy upset itself.,morphology,anaphor_agreement,anaphor_gender_agreement,True,True,False,False,534,-26.461557388305664,-28.683727264404297,1
Diana respected herself.,Diana respected himself.,morphology,anaphor_agreement,anaphor_gender_agreement,True,True,False,False,535,-33.3236198425293,-31.130861282348633,0
Charles worked with himself.,Charles worked with herself.,morphology,anaphor_agreement,anaphor_gender_agreement,True,True,False,False,536,-20.658239364624023,-21.765625,1
Veronica is shocking herself.,Veronica is shocking itself.,morphology,anaphor_agreement,anaphor_gender_agreement,True,True,False,False,537,-38.56715393066406,-38.07243728637695,0
Lori disgusted herself.,Lori disgusted itself.,morphology,anaphor_agreement,anaphor_gender_agreement,True,True,False,False,538,-34.37767791748047,-35.371559143066406,1
Steven hasn't helped himself.,Steven hasn't helped itself.,morphology,anaphor_agreement,anaphor_gender_agreement,True,True,False,False,539,-26.01434898376465,-28.89841079711914,1
Roger did listen to himself.,Roger did listen to herself.,morphology,anaphor_agreement,anaphor_gender_agreement,True,True,False,False,540,-22.199722290039062,-22.56037139892578,1
Cindy disturbed herself.,Cindy disturbed itself.,morphology,anaphor_agreement,anaphor_gender_agreement,True,True,False,False,541,-32.95753479003906,-33.86194610595703,1
Laura isn't shocking herself.,Laura isn't shocking himself.,morphology,anaphor_agreement,anaphor_gender_agreement,True,True,False,False,542,-30.41822052001953,-30.6534366607666,1
Patrick isn't impressing himself.,Patrick isn't impressing itself.,morphology,anaphor_agreement,anaphor_gender_agreement,True,True,False,False,543,-35.12554931640625,-36.5880241394043,1
Danielle bored herself.,Danielle bored himself.,morphology,anaphor_agreement,anaphor_gender_agreement,True,True,False,False,544,-32.092071533203125,-31.79768943786621,0
Some movie was disagreeing with itself.,Some movie was disagreeing with herself.,morphology,anaphor_agreement,anaphor_gender_agreement,True,True,False,False,545,-39.87235641479492,-39.283573150634766,0
Anna investigated herself.,Anna investigated itself.,morphology,anaphor_agreement,anaphor_gender_agreement,True,True,False,False,546,-22.146665573120117,-22.28909683227539,1
Lissa hired herself.,Lissa hired itself.,morphology,anaphor_agreement,anaphor_gender_agreement,True,True,False,False,547,-30.625469207763672,-32.354469299316406,1
Heidi had stunned herself.,Heidi had stunned himself.,morphology,anaphor_agreement,anaphor_gender_agreement,True,True,False,False,548,-38.462928771972656,-35.90766143798828,0
Theodore boasted about himself.,Theodore boasted about herself.,morphology,anaphor_agreement,anaphor_gender_agreement,True,True,False,False,549,-34.12431335449219,-35.471458435058594,1
Every woman would care for herself.,Every woman would care for himself.,morphology,anaphor_agreement,anaphor_gender_agreement,True,True,False,False,550,-30.444013595581055,-29.769397735595703,0
That lady cured herself.,That lady cured itself.,morphology,anaphor_agreement,anaphor_gender_agreement,True,True,False,False,551,-29.816667556762695,-31.31676483154297,1
Dana was criticizing herself.,Dana was criticizing itself.,morphology,anaphor_agreement,anaphor_gender_agreement,True,True,False,False,552,-36.56674575805664,-37.11970520019531,1
Heidi didn't work with herself.,Heidi didn't work with itself.,morphology,anaphor_agreement,anaphor_gender_agreement,True,True,False,False,553,-38.081626892089844,-38.29526901245117,1
Guy isn't concealing himself.,Guy isn't concealing itself.,morphology,anaphor_agreement,anaphor_gender_agreement,True,True,False,False,554,-36.99625015258789,-37.93914794921875,1
Patricia was approaching herself.,Patricia was approaching himself.,morphology,anaphor_agreement,anaphor_gender_agreement,True,True,False,False,555,-35.490928649902344,-34.14872741699219,0
Alexander insults himself.,Alexander insults itself.,morphology,anaphor_agreement,anaphor_gender_agreement,True,True,False,False,556,-23.31165313720703,-23.561893463134766,1
Irene wasn't listening to herself.,Irene wasn't listening to himself.,morphology,anaphor_agreement,anaphor_gender_agreement,True,True,False,False,557,-40.468475341796875,-40.5029296875,1
Ruth returns to herself.,Ruth returns to itself.,morphology,anaphor_agreement,anaphor_gender_agreement,True,True,False,False,558,-28.254074096679688,-30.43528938293457,1
Joel has hurt himself.,Joel has hurt herself.,morphology,anaphor_agreement,anaphor_gender_agreement,True,True,False,False,559,-29.95330810546875,-31.106727600097656,1
Katherine criticizes herself.,Katherine criticizes himself.,morphology,anaphor_agreement,anaphor_gender_agreement,True,True,False,False,560,-42.334686279296875,-42.077903747558594,0
Steven visited himself.,Steven visited itself.,morphology,anaphor_agreement,anaphor_gender_agreement,True,True,False,False,561,-19.411590576171875,-21.583765029907227,1
Susan knew herself.,Susan knew himself.,morphology,anaphor_agreement,anaphor_gender_agreement,True,True,False,False,562,-17.670866012573242,-15.936360359191895,0
Some report was disagreeing with itself.,Some report was disagreeing with himself.,morphology,anaphor_agreement,anaphor_gender_agreement,True,True,False,False,563,-43.165306091308594,-42.29295349121094,0
Heather is worrying herself.,Heather is worrying himself.,morphology,anaphor_agreement,anaphor_gender_agreement,True,True,False,False,564,-36.66454315185547,-35.56489181518555,0
Thomas reveals himself.,Thomas reveals herself.,morphology,anaphor_agreement,anaphor_gender_agreement,True,True,False,False,565,-20.563203811645508,-23.029048919677734,1
Aaron visits himself.,Aaron visits herself.,morphology,anaphor_agreement,anaphor_gender_agreement,True,True,False,False,566,-21.041032791137695,-22.32012176513672,1
This company had disturbed itself.,This company had disturbed himself.,morphology,anaphor_agreement,anaphor_gender_agreement,True,True,False,False,567,-31.34490394592285,-29.646209716796875,0
Brian hasn't concealed himself.,Brian hasn't concealed herself.,morphology,anaphor_agreement,anaphor_gender_agreement,True,True,False,False,568,-29.25076675415039,-31.413742065429688,1
Carmen works with herself.,Carmen works with himself.,morphology,anaphor_agreement,anaphor_gender_agreement,True,True,False,False,569,-37.89048767089844,-36.76984786987305,0
Kayla does admire herself.,Kayla does admire himself.,morphology,anaphor_agreement,anaphor_gender_agreement,True,True,False,False,570,-38.784507751464844,-37.816925048828125,0
Marla can leave herself.,Marla can leave itself.,morphology,anaphor_agreement,anaphor_gender_agreement,True,True,False,False,571,-31.625511169433594,-31.193315505981445,0
Kristin has cured herself.,Kristin has cured itself.,morphology,anaphor_agreement,anaphor_gender_agreement,True,True,False,False,572,-33.26627731323242,-33.98841094970703,1
This girl has loved herself.,This girl has loved itself.,morphology,anaphor_agreement,anaphor_gender_agreement,True,True,False,False,573,-29.467971801757812,-31.579383850097656,1
David wasn't confusing himself.,David wasn't confusing itself.,morphology,anaphor_agreement,anaphor_gender_agreement,True,True,False,False,574,-28.115127563476562,-29.717689514160156,1
Samantha appreciated herself.,Samantha appreciated itself.,morphology,anaphor_agreement,anaphor_gender_agreement,True,True,False,False,575,-35.38221740722656,-36.8509635925293,1
Deanna wouldn't return to herself.,Deanna wouldn't return to himself.,morphology,anaphor_agreement,anaphor_gender_agreement,True,True,False,False,576,-36.887481689453125,-36.129844665527344,0
Some actress described herself.,Some actress described himself.,morphology,anaphor_agreement,anaphor_gender_agreement,True,True,False,False,577,-31.648849487304688,-30.740543365478516,0
