sentence_good,sentence_bad,field,linguistics_term,UID,simple_LM_method,one_prefix_method,two_prefix_method,lexically_identical,pair_id,good_prob,bad_prob,correct
Adults forget that every actor visits Eric.,Adults forget who every actor visits Eric.,syntax,filler_gap_dependency,wh_vs_that_no_gap,True,False,False,False,219,-61.5541877746582,-66.70451354980469,1
Some patients conceal that some person bikes to some grocery stores.,Some patients conceal what some person bikes to some grocery stores.,syntax,filler_gap_dependency,wh_vs_that_no_gap,True,False,False,False,220,-77.55331420898438,-78.6541748046875,1
Some driver had investigated that the planes weren't alarming Lawrence.,Some driver had investigated who the planes weren't alarming Lawrence.,syntax,filler_gap_dependency,wh_vs_that_no_gap,True,False,False,False,221,-79.38577270507812,-86.15691375732422,1
Donald hasn't remembered that the patient talks to those dancers.,Donald hasn't remembered who the patient talks to those dancers.,syntax,filler_gap_dependency,wh_vs_that_no_gap,True,False,False,False,222,-67.08367919921875,-73.21947479248047,1
Ella had realized that many pedestrians couldn't boycott all hills.,Ella had realized what many pedestrians couldn't boycott all hills.,syntax,filler_gap_dependency,wh_vs_that_no_gap,True,False,False,False,223,-79.24630737304688,-86.92509460449219,1
Committees forget that a driver should praise Theodore.,Committees forget who a driver should praise Theodore.,syntax,filler_gap_dependency,wh_vs_that_no_gap,True,False,False,False,224,-72.89460754394531,-76.48130798339844,1
Melinda figures out that most eggplants impressed Cindy.,Melinda figures out who most eggplants impressed Cindy.,syntax,filler_gap_dependency,wh_vs_that_no_gap,True,False,False,False,225,-87.73631286621094,-90.64958190917969,1
Christina learned that this painting is aggravating Paul.,Christina learned who this painting is aggravating Paul.,syntax,filler_gap_dependency,wh_vs_that_no_gap,True,False,False,False,226,-62.09809494018555,-70.38643646240234,1
This government had investigated that all governments weren't buying dresses.,This government had investigated what all governments weren't buying dresses.,syntax,filler_gap_dependency,wh_vs_that_no_gap,True,False,False,False,227,-71.2166748046875,-75.28204345703125,1
Lawrence reveals that this doctor didn't buy convertibles.,Lawrence reveals what this doctor didn't buy convertibles.,syntax,filler_gap_dependency,wh_vs_that_no_gap,True,False,False,False,228,-68.96707916259766,-73.5526123046875,1
The Impressionists had realized that most doctors aren't breaking the computer.,The Impressionists had realized what most doctors aren't breaking the computer.,syntax,filler_gap_dependency,wh_vs_that_no_gap,True,False,False,False,229,-73.99272155761719,-79.11329650878906,1
George concealed that that guest shouldn't walk through this hill.,George concealed what that guest shouldn't walk through this hill.,syntax,filler_gap_dependency,wh_vs_that_no_gap,True,False,False,False,230,-76.55918884277344,-79.0556640625,1
Pamela hadn't investigated that the woman conceals all dancers.,Pamela hadn't investigated who the woman conceals all dancers.,syntax,filler_gap_dependency,wh_vs_that_no_gap,True,False,False,False,231,-85.85202026367188,-89.27745056152344,1
Phillip shouldn't figure out that broccoli could look like those photographs.,Phillip shouldn't figure out what broccoli could look like those photographs.,syntax,filler_gap_dependency,wh_vs_that_no_gap,True,False,False,False,232,-75.68943786621094,-71.4031982421875,0
Suzanne conceals that some teachers leave April.,Suzanne conceals who some teachers leave April.,syntax,filler_gap_dependency,wh_vs_that_no_gap,True,False,False,False,233,-70.3243408203125,-74.18095397949219,1
A person won't investigate that most men haven't left those restaurants.,A person won't investigate what most men haven't left those restaurants.,syntax,filler_gap_dependency,wh_vs_that_no_gap,True,False,False,False,234,-78.90817260742188,-78.83292388916016,0
These guests figure out that some guy conceals Melissa.,These guests figure out who some guy conceals Melissa.,syntax,filler_gap_dependency,wh_vs_that_no_gap,True,False,False,False,235,-69.52629089355469,-73.14280700683594,1
Some ladies know that that patient was listening to Samantha.,Some ladies know who that patient was listening to Samantha.,syntax,filler_gap_dependency,wh_vs_that_no_gap,True,False,False,False,236,-62.646583557128906,-65.06024169921875,1
Every patient figures out that all teachers hadn't discussed Candice.,Every patient figures out who all teachers hadn't discussed Candice.,syntax,filler_gap_dependency,wh_vs_that_no_gap,True,False,False,False,237,-76.61344146728516,-81.05992126464844,1
Some pedestrians forgot that some woman is skated around cafes.,Some pedestrians forgot what some woman is skated around cafes.,syntax,filler_gap_dependency,wh_vs_that_no_gap,True,False,False,False,238,-81.32503509521484,-83.71566009521484,1
These hospitals find out that every patient escaped from Bill.,These hospitals find out who every patient escaped from Bill.,syntax,filler_gap_dependency,wh_vs_that_no_gap,True,False,False,False,239,-61.35645294189453,-65.44708251953125,1
All drivers reveal that some drivers research these books.,All drivers reveal what some drivers research these books.,syntax,filler_gap_dependency,wh_vs_that_no_gap,True,False,False,False,240,-68.79896545410156,-69.22419738769531,1
Walter could figure out that this child cleans most malls.,Walter could figure out what this child cleans most malls.,syntax,filler_gap_dependency,wh_vs_that_no_gap,True,False,False,False,241,-75.29419708251953,-73.04816436767578,0
Denise has revealed that most customers upset the drivers.,Denise has revealed who most customers upset the drivers.,syntax,filler_gap_dependency,wh_vs_that_no_gap,True,False,False,False,242,-57.04441452026367,-65.53617858886719,1
Ann figured out that many students lift a lot of hamsters.,Ann figured out what many students lift a lot of hamsters.,syntax,filler_gap_dependency,wh_vs_that_no_gap,True,False,False,False,243,-61.928199768066406,-63.87195587158203,1
Travis wouldn't forget that a lot of adults weren't examining the documentary.,Travis wouldn't forget what a lot of adults weren't examining the documentary.,syntax,filler_gap_dependency,wh_vs_that_no_gap,True,False,False,False,244,-78.66437530517578,-79.3338851928711,1
Leslie investigated that all guests ascend some ladders.,Leslie investigated what all guests ascend some ladders.,syntax,filler_gap_dependency,wh_vs_that_no_gap,True,False,False,False,245,-73.24136352539062,-77.20684051513672,1
Sabrina had revealed that every driver returns to Tammy.,Sabrina had revealed who every driver returns to Tammy.,syntax,filler_gap_dependency,wh_vs_that_no_gap,True,False,False,False,246,-65.05021667480469,-73.91305541992188,1
Carolyn discovers that all people visited Maria.,Carolyn discovers who all people visited Maria.,syntax,filler_gap_dependency,wh_vs_that_no_gap,True,False,False,False,247,-53.706268310546875,-61.27785873413086,1
Heidi had known that a waitress kissed Adam.,Heidi had known who a waitress kissed Adam.,syntax,filler_gap_dependency,wh_vs_that_no_gap,True,False,False,False,248,-61.13190460205078,-67.27365112304688,1
Phillip could know that all drivers fled from some drivers.,Phillip could know who all drivers fled from some drivers.,syntax,filler_gap_dependency,wh_vs_that_no_gap,True,False,False,False,249,-65.87579345703125,-69.52581787109375,1
Sabrina hasn't learned that a lot of drivers hadn't broken these convertibles.,Sabrina hasn't learned what a lot of drivers hadn't broken these convertibles.,syntax,filler_gap_dependency,wh_vs_that_no_gap,True,False,False,False,250,-87.83761596679688,-89.83551788330078,1
Ellen investigates that these teachers run around this restaurant.,Ellen investigates what these teachers run around this restaurant.,syntax,filler_gap_dependency,wh_vs_that_no_gap,True,False,False,False,251,-66.43839263916016,-66.59011840820312,1
Peter learned that a lot of women had skated around most lakes.,Peter learned what a lot of women had skated around most lakes.,syntax,filler_gap_dependency,wh_vs_that_no_gap,True,False,False,False,252,-69.79754638671875,-73.79047393798828,1
Travis hadn't remembered that a child tours the grocery stores.,Travis hadn't remembered what a child tours the grocery stores.,syntax,filler_gap_dependency,wh_vs_that_no_gap,True,False,False,False,253,-80.57487487792969,-79.93598937988281,0
Every boy forgets that every lady hadn't worked with the Borgias.,Every boy forgets who every lady hadn't worked with the Borgias.,syntax,filler_gap_dependency,wh_vs_that_no_gap,True,False,False,False,254,-76.48152923583984,-82.75349426269531,1
Paul forgets that that waitress is researching that mountain.,Paul forgets what that waitress is researching that mountain.,syntax,filler_gap_dependency,wh_vs_that_no_gap,True,False,False,False,255,-71.51844787597656,-71.51237487792969,0
Sabrina did forget that all men were boycotting this cafe.,Sabrina did forget what all men were boycotting this cafe.,syntax,filler_gap_dependency,wh_vs_that_no_gap,True,False,False,False,256,-73.4615478515625,-78.17877960205078,1
Derek had learned that all drivers attack Melanie.,Derek had learned who all drivers attack Melanie.,syntax,filler_gap_dependency,wh_vs_that_no_gap,True,False,False,False,257,-67.80235290527344,-76.02906799316406,1
Karla was discovering that many dancers fire Tamara.,Karla was discovering who many dancers fire Tamara.,syntax,filler_gap_dependency,wh_vs_that_no_gap,True,False,False,False,258,-71.50120544433594,-76.32804870605469,1
Those pedestrians learn that that woman has fled from men.,Those pedestrians learn who that woman has fled from men.,syntax,filler_gap_dependency,wh_vs_that_no_gap,True,False,False,False,259,-68.47162628173828,-72.65580749511719,1
Andrew had realized that all associations talk about Linda.,Andrew had realized who all associations talk about Linda.,syntax,filler_gap_dependency,wh_vs_that_no_gap,True,False,False,False,260,-55.67717742919922,-63.817848205566406,1
Renee wasn't discovering that the patients should leave Keith.,Renee wasn't discovering who the patients should leave Keith.,syntax,filler_gap_dependency,wh_vs_that_no_gap,True,False,False,False,261,-70.6075439453125,-75.0099868774414,1
Those pedestrians reveal that every actress talks about Michael.,Those pedestrians reveal who every actress talks about Michael.,syntax,filler_gap_dependency,wh_vs_that_no_gap,True,False,False,False,262,-68.97482299804688,-73.19530487060547,1
Grace knows that a cashier hasn't worn a lot of skirts.,Grace knows what a cashier hasn't worn a lot of skirts.,syntax,filler_gap_dependency,wh_vs_that_no_gap,True,False,False,False,263,-70.51971435546875,-71.4699935913086,1
Daniel could investigate that some mirror hadn't upset Jeffrey.,Daniel could investigate who some mirror hadn't upset Jeffrey.,syntax,filler_gap_dependency,wh_vs_that_no_gap,True,False,False,False,264,-77.63587951660156,-83.17216491699219,1
Regina figures out that all guys were firing Caroline.,Regina figures out who all guys were firing Caroline.,syntax,filler_gap_dependency,wh_vs_that_no_gap,True,False,False,False,265,-76.05694580078125,-79.434814453125,1
The Clintons forget that that tooth upset some guy.,The Clintons forget who that tooth upset some guy.,syntax,filler_gap_dependency,wh_vs_that_no_gap,True,False,False,False,266,-72.25807189941406,-76.75282287597656,1
Roger wouldn't know that every actress will listen to the waiter.,Roger wouldn't know who every actress will listen to the waiter.,syntax,filler_gap_dependency,wh_vs_that_no_gap,True,False,False,False,267,-59.310516357421875,-63.32954406738281,1
The doctor remembered that a committee hasn't talked to Donna.,The doctor remembered who a committee hasn't talked to Donna.,syntax,filler_gap_dependency,wh_vs_that_no_gap,True,False,False,False,268,-70.05210876464844,-78.97442626953125,1
Those teachers forget that a lot of dogs confused these teenagers.,Those teachers forget who a lot of dogs confused these teenagers.,syntax,filler_gap_dependency,wh_vs_that_no_gap,True,False,False,False,269,-66.81444549560547,-72.14241027832031,1
Katherine isn't discovering that that patient drives to a closet.,Katherine isn't discovering what that patient drives to a closet.,syntax,filler_gap_dependency,wh_vs_that_no_gap,True,False,False,False,270,-82.93569946289062,-82.34960174560547,0
Diana hadn't concealed that most actors have sounded like Edward.,Diana hadn't concealed who most actors have sounded like Edward.,syntax,filler_gap_dependency,wh_vs_that_no_gap,True,False,False,False,271,-81.2667236328125,-88.55316925048828,1
Thomas might learn that all dancers were passing that high school.,Thomas might learn what all dancers were passing that high school.,syntax,filler_gap_dependency,wh_vs_that_no_gap,True,False,False,False,272,-68.58111572265625,-71.29412841796875,1
The Borgias forget that senators should cure Caroline.,The Borgias forget who senators should cure Caroline.,syntax,filler_gap_dependency,wh_vs_that_no_gap,True,False,False,False,273,-79.34002685546875,-84.35095977783203,1
These committees know that those men have argued about the Clintons.,These committees know who those men have argued about the Clintons.,syntax,filler_gap_dependency,wh_vs_that_no_gap,True,False,False,False,274,-65.22616577148438,-71.34039306640625,1
Every university hadn't realized that those children complained about Theresa.,Every university hadn't realized who those children complained about Theresa.,syntax,filler_gap_dependency,wh_vs_that_no_gap,True,False,False,False,275,-67.043701171875,-74.42158508300781,1
Lawrence hasn't realized that a senator has approached Samuel.,Lawrence hasn't realized who a senator has approached Samuel.,syntax,filler_gap_dependency,wh_vs_that_no_gap,True,False,False,False,276,-67.01699829101562,-73.08924102783203,1
Gregory revealed that that child boasts about Sharon.,Gregory revealed who that child boasts about Sharon.,syntax,filler_gap_dependency,wh_vs_that_no_gap,True,False,False,False,277,-69.25727081298828,-75.93165588378906,1
The Impressionists forget that these girls mess up some art galleries.,The Impressionists forget what these girls mess up some art galleries.,syntax,filler_gap_dependency,wh_vs_that_no_gap,True,False,False,False,278,-76.7360610961914,-77.94645690917969,1
Every association learns that this child descended every ladder.,Every association learns what this child descended every ladder.,syntax,filler_gap_dependency,wh_vs_that_no_gap,True,False,False,False,279,-69.25764465332031,-73.17460632324219,1
Joseph did know that this man praised Lori.,Joseph did know who this man praised Lori.,syntax,filler_gap_dependency,wh_vs_that_no_gap,True,False,False,False,280,-49.74553680419922,-52.78171157836914,1
Stephanie remembered that this woman isn't curing Bradley.,Stephanie remembered who this woman isn't curing Bradley.,syntax,filler_gap_dependency,wh_vs_that_no_gap,True,False,False,False,281,-75.62907409667969,-83.60462951660156,1
The teenagers forget that these students discuss some high schools.,The teenagers forget what these students discuss some high schools.,syntax,filler_gap_dependency,wh_vs_that_no_gap,True,False,False,False,282,-60.89922332763672,-63.605552673339844,1
Sally could forget that a woman hasn't driven to these grocery stores.,Sally could forget what a woman hasn't driven to these grocery stores.,syntax,filler_gap_dependency,wh_vs_that_no_gap,True,False,False,False,283,-83.2344970703125,-85.25740814208984,1
Paula shouldn't find out that a lot of stimuli resemble some sketches.,Paula shouldn't find out what a lot of stimuli resemble some sketches.,syntax,filler_gap_dependency,wh_vs_that_no_gap,True,False,False,False,284,-81.54940795898438,-80.0822525024414,0
Carlos figured out that this doctor wears the coat.,Carlos figured out what this doctor wears the coat.,syntax,filler_gap_dependency,wh_vs_that_no_gap,True,False,False,False,285,-54.41352081298828,-56.16456604003906,1
Larry hadn't concealed that every guy could approach Pamela.,Larry hadn't concealed who every guy could approach Pamela.,syntax,filler_gap_dependency,wh_vs_that_no_gap,True,False,False,False,286,-73.08710479736328,-80.06266784667969,1
Jeffrey remembered that most students have sold some cafes.,Jeffrey remembered what most students have sold some cafes.,syntax,filler_gap_dependency,wh_vs_that_no_gap,True,False,False,False,287,-64.36994934082031,-68.23887634277344,1
Katherine investigates that some company hires every patient.,Katherine investigates who some company hires every patient.,syntax,filler_gap_dependency,wh_vs_that_no_gap,True,False,False,False,288,-66.282470703125,-72.64530944824219,1
Some customer wasn't realizing that those waiters cleaned a rug.,Some customer wasn't realizing what those waiters cleaned a rug.,syntax,filler_gap_dependency,wh_vs_that_no_gap,True,False,False,False,289,-74.82938385009766,-75.62994384765625,1
Douglas finds out that that boy notices Stephanie.,Douglas finds out who that boy notices Stephanie.,syntax,filler_gap_dependency,wh_vs_that_no_gap,True,False,False,False,290,-67.70624542236328,-70.50614929199219,1
David isn't discovering that some waitress forgot Curtis.,David isn't discovering who some waitress forgot Curtis.,syntax,filler_gap_dependency,wh_vs_that_no_gap,True,False,False,False,291,-67.3402099609375,-71.61959838867188,1
All children had known that these customers do observe many people.,All children had known who these customers do observe many people.,syntax,filler_gap_dependency,wh_vs_that_no_gap,True,False,False,False,292,-67.47097778320312,-74.02025604248047,1
Candice has figured out that an organization doesn't dislike Janet.,Candice has figured out who an organization doesn't dislike Janet.,syntax,filler_gap_dependency,wh_vs_that_no_gap,True,False,False,False,293,-67.38371276855469,-71.15900421142578,1
Laurie found out that all geese descend hills.,Laurie found out what all geese descend hills.,syntax,filler_gap_dependency,wh_vs_that_no_gap,True,False,False,False,294,-72.97464752197266,-76.51953125,1
John wasn't investigating that every guy returned to William.,John wasn't investigating who every guy returned to William.,syntax,filler_gap_dependency,wh_vs_that_no_gap,True,False,False,False,295,-58.75186538696289,-64.53236389160156,1
The Lutherans realize that students haven't cleaned a lake.,The Lutherans realize what students haven't cleaned a lake.,syntax,filler_gap_dependency,wh_vs_that_no_gap,True,False,False,False,296,-72.76434326171875,-77.05681610107422,1
All guys discover that a lot of banks weren't working with Heidi.,All guys discover who a lot of banks weren't working with Heidi.,syntax,filler_gap_dependency,wh_vs_that_no_gap,True,False,False,False,297,-76.59142303466797,-80.16087341308594,1
Jacqueline reveals that these committees weren't arguing about Tamara.,Jacqueline reveals who these committees weren't arguing about Tamara.,syntax,filler_gap_dependency,wh_vs_that_no_gap,True,False,False,False,298,-83.56619262695312,-89.50051879882812,1
Monica would find out that every lady walks through all banks.,Monica would find out what every lady walks through all banks.,syntax,filler_gap_dependency,wh_vs_that_no_gap,True,False,False,False,299,-68.57041931152344,-69.08235931396484,1
Nicole hadn't found out that many pants looked like a lot of prints.,Nicole hadn't found out what many pants looked like a lot of prints.,syntax,filler_gap_dependency,wh_vs_that_no_gap,True,False,False,False,300,-74.8282470703125,-77.27972412109375,1
Those boys should forget that a doctor hates Beverly.,Those boys should forget who a doctor hates Beverly.,syntax,filler_gap_dependency,wh_vs_that_no_gap,True,False,False,False,301,-61.03462600708008,-65.06743621826172,1
Jane figured out that all drivers have fixed most wheelbarrows.,Jane figured out what all drivers have fixed most wheelbarrows.,syntax,filler_gap_dependency,wh_vs_that_no_gap,True,False,False,False,302,-71.70462036132812,-74.65876770019531,1
Todd knows that a lot of girls haven't watched a girl.,Todd knows who a lot of girls haven't watched a girl.,syntax,filler_gap_dependency,wh_vs_that_no_gap,True,False,False,False,303,-52.59205627441406,-57.38698196411133,1
Michelle finds out that actors hadn't concealed many rivers.,Michelle finds out what actors hadn't concealed many rivers.,syntax,filler_gap_dependency,wh_vs_that_no_gap,True,False,False,False,304,-71.12385559082031,-72.70426940917969,1
Ellen can know that some broccoli annoyed Harvard University.,Ellen can know what some broccoli annoyed Harvard University.,syntax,filler_gap_dependency,wh_vs_that_no_gap,True,False,False,False,305,-80.94778442382812,-80.80860900878906,0
The teacher can't discover that many drawings hadn't looked like restaurants.,The teacher can't discover what many drawings hadn't looked like restaurants.,syntax,filler_gap_dependency,wh_vs_that_no_gap,True,False,False,False,306,-80.47372436523438,-82.08718872070312,1
That adult was finding out that most guests astound Dana.,That adult was finding out who most guests astound Dana.,syntax,filler_gap_dependency,wh_vs_that_no_gap,True,False,False,False,307,-78.2855453491211,-81.79542541503906,1
Judy investigated that this play hadn't disagreed with Andrew.,Judy investigated who this play hadn't disagreed with Andrew.,syntax,filler_gap_dependency,wh_vs_that_no_gap,True,False,False,False,308,-69.89955139160156,-74.03327941894531,1
Andrea investigated that every man wore most gloves.,Andrea investigated what every man wore most gloves.,syntax,filler_gap_dependency,wh_vs_that_no_gap,True,False,False,False,309,-65.67158508300781,-68.1834716796875,1
Emily hasn't found out that a lot of men could observe Russell.,Emily hasn't found out who a lot of men could observe Russell.,syntax,filler_gap_dependency,wh_vs_that_no_gap,True,False,False,False,310,-68.36194610595703,-72.39019775390625,1
Some actresses realized that some car irritates these companies.,Some actresses realized what some car irritates these companies.,syntax,filler_gap_dependency,wh_vs_that_no_gap,True,False,False,False,311,-69.92807006835938,-73.94171142578125,1
Mary can't remember that the woman passes a public park.,Mary can't remember what the woman passes a public park.,syntax,filler_gap_dependency,wh_vs_that_no_gap,True,False,False,False,312,-55.591590881347656,-58.4781608581543,1
Some dancers weren't revealing that all senators should complain about politics.,Some dancers weren't revealing what all senators should complain about politics.,syntax,filler_gap_dependency,wh_vs_that_no_gap,True,False,False,False,313,-80.58247375488281,-81.86363220214844,1
A hospital would know that most cakes bothered Randolf.,A hospital would know who most cakes bothered Randolf.,syntax,filler_gap_dependency,wh_vs_that_no_gap,True,False,False,False,314,-86.73145294189453,-90.61076354980469,1
Teresa figured out that every student hid some shirt.,Teresa figured out what every student hid some shirt.,syntax,filler_gap_dependency,wh_vs_that_no_gap,True,False,False,False,315,-67.62979125976562,-70.01007080078125,1
Heather discovered that many children aren't wearing every hat.,Heather discovered what many children aren't wearing every hat.,syntax,filler_gap_dependency,wh_vs_that_no_gap,True,False,False,False,316,-62.85179138183594,-66.64044189453125,1
Kenneth would learn that that screen stunned Kevin.,Kenneth would learn who that screen stunned Kevin.,syntax,filler_gap_dependency,wh_vs_that_no_gap,True,False,False,False,317,-73.77360534667969,-74.80477905273438,1
Alice does conceal that this driver works with some customer.,Alice does conceal who this driver works with some customer.,syntax,filler_gap_dependency,wh_vs_that_no_gap,True,False,False,False,318,-66.03858947753906,-72.71460723876953,1
Kayla is learning that those pamphlets bore Helen.,Kayla is learning who those pamphlets bore Helen.,syntax,filler_gap_dependency,wh_vs_that_no_gap,True,False,False,False,319,-74.60577392578125,-82.17594909667969,1
Jacqueline conceals that every actor didn't exit a movie theater.,Jacqueline conceals what every actor didn't exit a movie theater.,syntax,filler_gap_dependency,wh_vs_that_no_gap,True,False,False,False,320,-81.9020767211914,-86.26945495605469,1
Patricia concealed that most boys are approaching Marla.,Patricia concealed who most boys are approaching Marla.,syntax,filler_gap_dependency,wh_vs_that_no_gap,True,False,False,False,321,-76.9930191040039,-81.22452545166016,1
A lot of waiters find out that that actress escapes from George.,A lot of waiters find out who that actress escapes from George.,syntax,filler_gap_dependency,wh_vs_that_no_gap,True,False,False,False,322,-76.92041778564453,-77.11308288574219,1
These associations forget that some waiters won't conceal the lake.,These associations forget what some waiters won't conceal the lake.,syntax,filler_gap_dependency,wh_vs_that_no_gap,True,False,False,False,323,-78.41559600830078,-82.17451477050781,1
Melanie isn't investigating that the guest sounded like Eric.,Melanie isn't investigating who the guest sounded like Eric.,syntax,filler_gap_dependency,wh_vs_that_no_gap,True,False,False,False,324,-73.68922424316406,-75.86032104492188,1
Some pedestrians figure out that most drivers describe Elizabeth.,Some pedestrians figure out who most drivers describe Elizabeth.,syntax,filler_gap_dependency,wh_vs_that_no_gap,True,False,False,False,325,-64.85072326660156,-67.05642700195312,1
Anne had revealed that some teachers have visited Walter.,Anne had revealed who some teachers have visited Walter.,syntax,filler_gap_dependency,wh_vs_that_no_gap,True,False,False,False,326,-54.524017333984375,-62.292537689208984,1
