sentence_good,sentence_bad,field,linguistics_term,UID,simple_LM_method,one_prefix_method,two_prefix_method,lexically_identical,pair_id,good_prob,bad_prob,correct
Susan revealed herself.,Susan revealed themselves.,morphology,anaphor_agreement,anaphor_number_agreement,True,True,False,True,0,-22.688453674316406,-21.035385131835938,0
Renee hasn't hurt herself.,Renee hasn't hurt themselves.,morphology,anaphor_agreement,anaphor_number_agreement,True,True,False,True,1,-32.26993179321289,-32.63353729248047,1
These patients do respect themselves.,These patients do respect himself.,morphology,anaphor_agreement,anaphor_number_agreement,True,True,False,True,2,-35.60247039794922,-35.86480712890625,1
Mary should criticize herself.,Mary should criticize themselves.,morphology,anaphor_agreement,anaphor_number_agreement,True,True,False,True,3,-27.919788360595703,-26.643360137939453,0
Kristin irritated herself.,Kristin irritated themselves.,morphology,anaphor_agreement,anaphor_number_agreement,True,True,False,True,4,-28.503154754638672,-27.721176147460938,0
Tracy described herself.,Tracy described themselves.,morphology,anaphor_agreement,anaphor_number_agreement,True,True,False,True,5,-28.452564239501953,-27.06707000732422,0
A lot of girls had bothered themselves.,A lot of girls had bothered himself.,morphology,anaphor_agreement,anaphor_number_agreement,True,True,False,True,6,-43.995933532714844,-44.545982360839844,1
Many teenagers were helping themselves.,Many teenagers were helping herself.,morphology,anaphor_agreement,anaphor_number_agreement,True,True,False,True,7,-33.69386291503906,-34.777061462402344,1
Girls talked to themselves.,Girls talked to itself.,morphology,anaphor_agreement,anaphor_number_agreement,True,True,False,True,8,-22.08537483215332,-23.182703018188477,1
All senators listened to themselves.,All senators listened to itself.,morphology,anaphor_agreement,anaphor_number_agreement,True,True,False,True,9,-35.85877227783203,-37.29075622558594,1
Laura hired herself.,Laura hired themselves.,morphology,anaphor_agreement,anaphor_number_agreement,True,True,False,True,10,-21.954692840576172,-21.007734298706055,0
Claire won't conceal herself.,Claire won't conceal themselves.,morphology,anaphor_agreement,anaphor_number_agreement,True,True,False,True,11,-38.62525177001953,-38.06275939941406,0
Becca shouldn't impress herself.,Becca shouldn't impress themselves.,morphology,anaphor_agreement,anaphor_number_agreement,True,True,False,True,12,-41.09089660644531,-39.56682586669922,0
This woman has criticized herself.,This woman has criticized themselves.,morphology,anaphor_agreement,anaphor_number_agreement,True,True,False,True,13,-31.61185073852539,-32.150753021240234,1
Sonia would cure herself.,Sonia would cure themselves.,morphology,anaphor_agreement,anaphor_number_agreement,True,True,False,True,14,-34.85668182373047,-33.417659759521484,0
Most girls hate themselves.,Most girls hate himself.,morphology,anaphor_agreement,anaphor_number_agreement,True,True,False,True,15,-29.35808563232422,-29.970951080322266,1
This legislature worried itself.,This legislature worried themselves.,morphology,anaphor_agreement,anaphor_number_agreement,True,True,False,True,16,-35.579078674316406,-34.893104553222656,0
Florence had left herself.,Florence had left themselves.,morphology,anaphor_agreement,anaphor_number_agreement,True,True,False,True,17,-35.68611145019531,-36.059349060058594,1
The Borgias scare themselves.,The Borgias scare himself.,morphology,anaphor_agreement,anaphor_number_agreement,True,True,False,True,18,-42.94049835205078,-41.876426696777344,0
The adults hadn't forgotten themselves.,The adults hadn't forgotten himself.,morphology,anaphor_agreement,anaphor_number_agreement,True,True,False,True,19,-37.65155792236328,-37.325904846191406,0
The patients disgusted themselves.,The patients disgusted himself.,morphology,anaphor_agreement,anaphor_number_agreement,True,True,False,True,20,-33.13909912109375,-33.39779281616211,1
Thomas complained about himself.,Thomas complained about themselves.,morphology,anaphor_agreement,anaphor_number_agreement,True,True,False,True,21,-23.656475067138672,-24.704631805419922,1
Randolf knew himself.,Randolf knew themselves.,morphology,anaphor_agreement,anaphor_number_agreement,True,True,False,True,22,-28.04401397705078,-29.133827209472656,1
The students shouldn't upset themselves.,The students shouldn't upset herself.,morphology,anaphor_agreement,anaphor_number_agreement,True,True,False,True,23,-39.00410079956055,-40.31649398803711,1
All waiters couldn't criticize themselves.,All waiters couldn't criticize himself.,morphology,anaphor_agreement,anaphor_number_agreement,True,True,False,True,24,-46.463043212890625,-45.17859649658203,0
Ronald can't reference himself.,Ronald can't reference themselves.,morphology,anaphor_agreement,anaphor_number_agreement,True,True,False,True,25,-41.53777313232422,-41.53209686279297,0
Julie hadn't revealed herself.,Julie hadn't revealed themselves.,morphology,anaphor_agreement,anaphor_number_agreement,True,True,False,True,26,-34.01124954223633,-33.939395904541016,0
Many people bothered themselves.,Many people bothered itself.,morphology,anaphor_agreement,anaphor_number_agreement,True,True,False,True,27,-27.32452392578125,-28.61198616027832,1
Most girls annoyed themselves.,Most girls annoyed himself.,morphology,anaphor_agreement,anaphor_number_agreement,True,True,False,True,28,-30.81951332092285,-31.397172927856445,1
Most ladies weren't arguing about themselves.,Most ladies weren't arguing about herself.,morphology,anaphor_agreement,anaphor_number_agreement,True,True,False,True,29,-44.350486755371094,-45.12690734863281,1
The waitresses investigated themselves.,The waitresses investigated itself.,morphology,anaphor_agreement,anaphor_number_agreement,True,True,False,True,30,-45.03402328491211,-45.69166946411133,1
Peter won't fire himself.,Peter won't fire themselves.,morphology,anaphor_agreement,anaphor_number_agreement,True,True,False,True,31,-26.815731048583984,-28.287006378173828,1
Those waitresses had loved themselves.,Those waitresses had loved herself.,morphology,anaphor_agreement,anaphor_number_agreement,True,True,False,True,32,-44.60118103027344,-43.664794921875,0
Cheryl isn't insulting herself.,Cheryl isn't insulting themselves.,morphology,anaphor_agreement,anaphor_number_agreement,True,True,False,True,33,-48.63783645629883,-49.2500114440918,1
Joseph isn't revealing himself.,Joseph isn't revealing themselves.,morphology,anaphor_agreement,anaphor_number_agreement,True,True,False,True,34,-26.67249870300293,-28.139461517333984,1
Most universities aren't scaring themselves.,Most universities aren't scaring herself.,morphology,anaphor_agreement,anaphor_number_agreement,True,True,False,True,35,-43.835845947265625,-44.71930694580078,1
Natalie hadn't fired herself.,Natalie hadn't fired themselves.,morphology,anaphor_agreement,anaphor_number_agreement,True,True,False,True,36,-40.27745819091797,-39.42807388305664,0
Donald had worked with himself.,Donald had worked with themselves.,morphology,anaphor_agreement,anaphor_number_agreement,True,True,False,True,37,-21.662677764892578,-22.923160552978516,1
Kirsten hasn't admired herself.,Kirsten hasn't admired themselves.,morphology,anaphor_agreement,anaphor_number_agreement,True,True,False,True,38,-45.605403900146484,-45.006011962890625,0
Patricia hadn't hated herself.,Patricia hadn't hated themselves.,morphology,anaphor_agreement,anaphor_number_agreement,True,True,False,True,39,-41.775474548339844,-41.42072296142578,0
Most reports disagreed with themselves.,Most reports disagreed with herself.,morphology,anaphor_agreement,anaphor_number_agreement,True,True,False,True,40,-34.040916442871094,-35.955467224121094,1
Dawn could worry herself.,Dawn could worry themselves.,morphology,anaphor_agreement,anaphor_number_agreement,True,True,False,True,41,-36.54208755493164,-36.662593841552734,1
Randolf might approach himself.,Randolf might approach themselves.,morphology,anaphor_agreement,anaphor_number_agreement,True,True,False,True,42,-37.33265686035156,-37.21329879760742,0
Stacy didn't remember herself.,Stacy didn't remember themselves.,morphology,anaphor_agreement,anaphor_number_agreement,True,True,False,True,43,-33.49383544921875,-33.082603454589844,0
Richard returned to himself.,Richard returned to themselves.,morphology,anaphor_agreement,anaphor_number_agreement,True,True,False,True,44,-18.338703155517578,-21.357421875,1
All boys listen to themselves.,All boys listen to herself.,morphology,anaphor_agreement,anaphor_number_agreement,True,True,False,True,45,-31.220787048339844,-30.561750411987305,0
Bruce hadn't discovered himself.,Bruce hadn't discovered themselves.,morphology,anaphor_agreement,anaphor_number_agreement,True,True,False,True,46,-27.14777374267578,-28.33878517150879,1
Many teenagers hadn't found themselves.,Many teenagers hadn't found itself.,morphology,anaphor_agreement,anaphor_number_agreement,True,True,False,True,47,-37.964385986328125,-40.427371978759766,1
Daniel does hate himself.,Daniel does hate themselves.,morphology,anaphor_agreement,anaphor_number_agreement,True,True,False,True,48,-26.64246368408203,-27.64666748046875,1
Most adults have discovered themselves.,Most adults have discovered itself.,morphology,anaphor_agreement,anaphor_number_agreement,True,True,False,True,49,-32.25983428955078,-33.11299514770508,1
Some men could notice themselves.,Some men could notice himself.,morphology,anaphor_agreement,anaphor_number_agreement,True,True,False,True,50,-30.306964874267578,-29.76339340209961,0
These museums should insult themselves.,These museums should insult itself.,morphology,anaphor_agreement,anaphor_number_agreement,True,True,False,True,51,-38.12694549560547,-39.47635269165039,1
All actresses flee from themselves.,All actresses flee from herself.,morphology,anaphor_agreement,anaphor_number_agreement,True,True,False,True,52,-43.16801452636719,-44.904380798339844,1
Carol couldn't criticize herself.,Carol couldn't criticize themselves.,morphology,anaphor_agreement,anaphor_number_agreement,True,True,False,True,53,-38.99997329711914,-38.0604248046875,0
All girls haven't discussed themselves.,All girls haven't discussed himself.,morphology,anaphor_agreement,anaphor_number_agreement,True,True,False,True,54,-37.52103042602539,-37.56010818481445,1
All senators complained about themselves.,All senators complained about himself.,morphology,anaphor_agreement,anaphor_number_agreement,True,True,False,True,55,-37.2711181640625,-37.085670471191406,0
Some actors shock themselves.,Some actors shock herself.,morphology,anaphor_agreement,anaphor_number_agreement,True,True,False,True,56,-34.61397933959961,-36.331748962402344,1
Jane aggravated herself.,Jane aggravated themselves.,morphology,anaphor_agreement,anaphor_number_agreement,True,True,False,True,57,-25.463563919067383,-23.588516235351562,0
Becca praised herself.,Becca praised themselves.,morphology,anaphor_agreement,anaphor_number_agreement,True,True,False,True,58,-33.08746337890625,-32.49579620361328,0
Those students don't confuse themselves.,Those students don't confuse himself.,morphology,anaphor_agreement,anaphor_number_agreement,True,True,False,True,59,-35.97089767456055,-36.101287841796875,1
Jodi left herself.,Jodi left themselves.,morphology,anaphor_agreement,anaphor_number_agreement,True,True,False,True,60,-29.272602081298828,-29.92756462097168,1
The students have thought about themselves.,The students have thought about itself.,morphology,anaphor_agreement,anaphor_number_agreement,True,True,False,True,61,-32.109012603759766,-33.42723083496094,1
A lot of customers weren't returning to themselves.,A lot of customers weren't returning to herself.,morphology,anaphor_agreement,anaphor_number_agreement,True,True,False,True,62,-54.99082946777344,-53.02445983886719,0
Those customers praise themselves.,Those customers praise herself.,morphology,anaphor_agreement,anaphor_number_agreement,True,True,False,True,63,-33.680946350097656,-34.741371154785156,1
David stunned himself.,David stunned themselves.,morphology,anaphor_agreement,anaphor_number_agreement,True,True,False,True,64,-20.90161895751953,-23.448528289794922,1
Beverly disturbed herself.,Beverly disturbed themselves.,morphology,anaphor_agreement,anaphor_number_agreement,True,True,False,True,65,-35.51796340942383,-35.42101287841797,0
Thomas was hurting himself.,Thomas was hurting themselves.,morphology,anaphor_agreement,anaphor_number_agreement,True,True,False,True,66,-20.889598846435547,-22.012126922607422,1
Lori attacked herself.,Lori attacked themselves.,morphology,anaphor_agreement,anaphor_number_agreement,True,True,False,True,67,-31.767986297607422,-29.96558380126953,0
Joel escaped from himself.,Joel escaped from themselves.,morphology,anaphor_agreement,anaphor_number_agreement,True,True,False,True,68,-28.684364318847656,-30.187606811523438,1
The woman had worried herself.,The woman had worried themselves.,morphology,anaphor_agreement,anaphor_number_agreement,True,True,False,True,69,-30.948089599609375,-31.629985809326172,1
Kayla scared herself.,Kayla scared themselves.,morphology,anaphor_agreement,anaphor_number_agreement,True,True,False,True,70,-30.174564361572266,-29.405271530151367,0
Samuel didn't kiss himself.,Samuel didn't kiss themselves.,morphology,anaphor_agreement,anaphor_number_agreement,True,True,False,True,71,-35.23680114746094,-37.15412139892578,1
This government alarms itself.,This government alarms themselves.,morphology,anaphor_agreement,anaphor_number_agreement,True,True,False,True,72,-33.265960693359375,-33.61991882324219,1
Kristin left herself.,Kristin left themselves.,morphology,anaphor_agreement,anaphor_number_agreement,True,True,False,True,73,-22.313182830810547,-22.39834976196289,1
An association annoys itself.,An association annoys themselves.,morphology,anaphor_agreement,anaphor_number_agreement,True,True,False,True,74,-39.454647064208984,-40.664581298828125,1
Many actors thought about themselves.,Many actors thought about itself.,morphology,anaphor_agreement,anaphor_number_agreement,True,True,False,True,75,-32.38542175292969,-33.779502868652344,1
Teresa has scared herself.,Teresa has scared themselves.,morphology,anaphor_agreement,anaphor_number_agreement,True,True,False,True,76,-36.14683532714844,-35.64312744140625,0
Russell hadn't complained about himself.,Russell hadn't complained about themselves.,morphology,anaphor_agreement,anaphor_number_agreement,True,True,False,True,77,-32.101104736328125,-33.14045715332031,1
All cashiers liked themselves.,All cashiers liked itself.,morphology,anaphor_agreement,anaphor_number_agreement,True,True,False,True,78,-43.045650482177734,-44.618247985839844,1
Kendra doesn't shock herself.,Kendra doesn't shock themselves.,morphology,anaphor_agreement,anaphor_number_agreement,True,True,False,True,79,-44.35694885253906,-42.627159118652344,0
Jason hasn't stunned himself.,Jason hasn't stunned themselves.,morphology,anaphor_agreement,anaphor_number_agreement,True,True,False,True,80,-30.072921752929688,-32.129051208496094,1
Children did conceal themselves.,Children did conceal itself.,morphology,anaphor_agreement,anaphor_number_agreement,True,True,False,True,81,-27.543798446655273,-28.551420211791992,1
Cheryl did worry herself.,Cheryl did worry themselves.,morphology,anaphor_agreement,anaphor_number_agreement,True,True,False,True,82,-46.553932189941406,-47.26837158203125,1
Colleen can't impress herself.,Colleen can't impress themselves.,morphology,anaphor_agreement,anaphor_number_agreement,True,True,False,True,83,-37.56541061401367,-36.052459716796875,0
Kendra wasn't thinking about herself.,Kendra wasn't thinking about themselves.,morphology,anaphor_agreement,anaphor_number_agreement,True,True,False,True,84,-39.9411735534668,-39.53628921508789,0
The guests respect themselves.,The guests respect herself.,morphology,anaphor_agreement,anaphor_number_agreement,True,True,False,True,85,-30.01114273071289,-30.369857788085938,1
Kenneth was confusing himself.,Kenneth was confusing themselves.,morphology,anaphor_agreement,anaphor_number_agreement,True,True,False,True,86,-31.237382888793945,-31.68073844909668,1
Some children flee from themselves.,Some children flee from itself.,morphology,anaphor_agreement,anaphor_number_agreement,True,True,False,True,87,-36.433502197265625,-37.80611038208008,1
This organization hadn't aggravated itself.,This organization hadn't aggravated themselves.,morphology,anaphor_agreement,anaphor_number_agreement,True,True,False,True,88,-44.38463592529297,-43.83842468261719,0
Michael can't disturb himself.,Michael can't disturb themselves.,morphology,anaphor_agreement,anaphor_number_agreement,True,True,False,True,89,-23.382709503173828,-25.24417495727539,1
Many universities disgust themselves.,Many universities disgust herself.,morphology,anaphor_agreement,anaphor_number_agreement,True,True,False,True,90,-35.436912536621094,-38.05921173095703,1
Some museums annoy themselves.,Some museums annoy herself.,morphology,anaphor_agreement,anaphor_number_agreement,True,True,False,True,91,-34.21438217163086,-34.72049331665039,1
All waiters cured themselves.,All waiters cured himself.,morphology,anaphor_agreement,anaphor_number_agreement,True,True,False,True,92,-39.86172866821289,-38.254398345947266,0
The teenagers shouldn't bore themselves.,The teenagers shouldn't bore himself.,morphology,anaphor_agreement,anaphor_number_agreement,True,True,False,True,93,-40.694923400878906,-39.85295867919922,0
All cashiers hurt themselves.,All cashiers hurt himself.,morphology,anaphor_agreement,anaphor_number_agreement,True,True,False,True,94,-41.37980651855469,-40.323204040527344,0
The Clintons admired themselves.,The Clintons admired himself.,morphology,anaphor_agreement,anaphor_number_agreement,True,True,False,True,95,-37.74989318847656,-36.76530456542969,0
Cynthia wasn't escaping from herself.,Cynthia wasn't escaping from themselves.,morphology,anaphor_agreement,anaphor_number_agreement,True,True,False,True,96,-53.053977966308594,-53.58294677734375,1
Many banks haven't aggravated themselves.,Many banks haven't aggravated herself.,morphology,anaphor_agreement,anaphor_number_agreement,True,True,False,True,97,-42.09938430786133,-43.84872817993164,1
All organizations have confused themselves.,All organizations have confused herself.,morphology,anaphor_agreement,anaphor_number_agreement,True,True,False,True,98,-37.214271545410156,-38.127403259277344,1
Steven talked about himself.,Steven talked about themselves.,morphology,anaphor_agreement,anaphor_number_agreement,True,True,False,True,99,-21.611282348632812,-21.712278366088867,1
Most men fled from themselves.,Most men fled from itself.,morphology,anaphor_agreement,anaphor_number_agreement,True,True,False,True,100,-31.185556411743164,-32.65354537963867,1
Patrick had cared for himself.,Patrick had cared for themselves.,morphology,anaphor_agreement,anaphor_number_agreement,True,True,False,True,101,-24.56106948852539,-25.992172241210938,1
James can kiss himself.,James can kiss themselves.,morphology,anaphor_agreement,anaphor_number_agreement,True,True,False,True,102,-23.851375579833984,-26.06833267211914,1
Most dancers shouldn't reveal themselves.,Most dancers shouldn't reveal herself.,morphology,anaphor_agreement,anaphor_number_agreement,True,True,False,True,103,-40.307498931884766,-42.6749153137207,1
All waitresses conceal themselves.,All waitresses conceal herself.,morphology,anaphor_agreement,anaphor_number_agreement,True,True,False,True,104,-44.30994415283203,-44.46483612060547,1
Some girls weren't complaining about themselves.,Some girls weren't complaining about itself.,morphology,anaphor_agreement,anaphor_number_agreement,True,True,False,True,105,-41.608821868896484,-43.52241897583008,1
Andrew hugged himself.,Andrew hugged themselves.,morphology,anaphor_agreement,anaphor_number_agreement,True,True,False,True,106,-20.621721267700195,-22.051483154296875,1
These guys are aggravating themselves.,These guys are aggravating himself.,morphology,anaphor_agreement,anaphor_number_agreement,True,True,False,True,107,-38.2181396484375,-38.52900314331055,1
Those teachers are praising themselves.,Those teachers are praising herself.,morphology,anaphor_agreement,anaphor_number_agreement,True,True,False,True,108,-32.870460510253906,-34.014068603515625,1
A lot of actresses visit themselves.,A lot of actresses visit herself.,morphology,anaphor_agreement,anaphor_number_agreement,True,True,False,True,109,-43.6147575378418,-45.30004119873047,1
Carlos attacked himself.,Carlos attacked themselves.,morphology,anaphor_agreement,anaphor_number_agreement,True,True,False,True,110,-25.363277435302734,-26.508996963500977,1
Marla might visit herself.,Marla might visit themselves.,morphology,anaphor_agreement,anaphor_number_agreement,True,True,False,True,111,-35.21353530883789,-34.29758834838867,0
The guests know themselves.,The guests know itself.,morphology,anaphor_agreement,anaphor_number_agreement,True,True,False,True,112,-26.707202911376953,-27.612916946411133,1
Most men hadn't embarrassed themselves.,Most men hadn't embarrassed itself.,morphology,anaphor_agreement,anaphor_number_agreement,True,True,False,True,113,-37.10759735107422,-38.691062927246094,1
Jane hasn't escaped from herself.,Jane hasn't escaped from themselves.,morphology,anaphor_agreement,anaphor_number_agreement,True,True,False,True,114,-34.21839141845703,-34.35747528076172,1
All boys are shocking themselves.,All boys are shocking herself.,morphology,anaphor_agreement,anaphor_number_agreement,True,True,False,True,115,-35.34829330444336,-37.85459899902344,1
Craig hasn't insulted himself.,Craig hasn't insulted themselves.,morphology,anaphor_agreement,anaphor_number_agreement,True,True,False,True,116,-29.616384506225586,-31.637126922607422,1
A lot of ladies impressed themselves.,A lot of ladies impressed itself.,morphology,anaphor_agreement,anaphor_number_agreement,True,True,False,True,117,-43.0476188659668,-44.45491027832031,1
Some school distracts itself.,Some school distracts themselves.,morphology,anaphor_agreement,anaphor_number_agreement,True,True,False,True,118,-44.46382141113281,-45.06901550292969,1
All girls scared themselves.,All girls scared himself.,morphology,anaphor_agreement,anaphor_number_agreement,True,True,False,True,119,-30.806476593017578,-30.822540283203125,1
Homer had worried himself.,Homer had worried themselves.,morphology,anaphor_agreement,anaphor_number_agreement,True,True,False,True,120,-35.79848861694336,-36.101707458496094,1
All men had concealed themselves.,All men had concealed herself.,morphology,anaphor_agreement,anaphor_number_agreement,True,True,False,True,121,-29.148082733154297,-31.570281982421875,1
These pedestrians upset themselves.,These pedestrians upset itself.,morphology,anaphor_agreement,anaphor_number_agreement,True,True,False,True,122,-34.04924392700195,-34.988380432128906,1
These companies wouldn't aggravate themselves.,These companies wouldn't aggravate itself.,morphology,anaphor_agreement,anaphor_number_agreement,True,True,False,True,123,-45.060028076171875,-45.53076171875,1
Many people hired themselves.,Many people hired herself.,morphology,anaphor_agreement,anaphor_number_agreement,True,True,False,True,124,-25.10042381286621,-27.291278839111328,1
The man won't hate himself.,The man won't hate themselves.,morphology,anaphor_agreement,anaphor_number_agreement,True,True,False,True,125,-31.821229934692383,-34.133628845214844,1
Guy is questioning himself.,Guy is questioning themselves.,morphology,anaphor_agreement,anaphor_number_agreement,True,True,False,True,126,-23.264934539794922,-24.591224670410156,1
These doctors help themselves.,These doctors help herself.,morphology,anaphor_agreement,anaphor_number_agreement,True,True,False,True,127,-28.79025650024414,-30.26588249206543,1
The teachers are talking to themselves.,The teachers are talking to itself.,morphology,anaphor_agreement,anaphor_number_agreement,True,True,False,True,128,-31.510202407836914,-32.28437805175781,1
Alicia admired herself.,Alicia admired themselves.,morphology,anaphor_agreement,anaphor_number_agreement,True,True,False,True,129,-38.56983184814453,-38.18109130859375,0
Edward worked with himself.,Edward worked with themselves.,morphology,anaphor_agreement,anaphor_number_agreement,True,True,False,True,130,-20.209386825561523,-21.135147094726562,1
The men couldn't disagree with themselves.,The men couldn't disagree with herself.,morphology,anaphor_agreement,anaphor_number_agreement,True,True,False,True,131,-36.78597640991211,-38.361412048339844,1
The dancers flee from themselves.,The dancers flee from himself.,morphology,anaphor_agreement,anaphor_number_agreement,True,True,False,True,132,-37.2036247253418,-36.03699493408203,0
Valerie hasn't thought about herself.,Valerie hasn't thought about themselves.,morphology,anaphor_agreement,anaphor_number_agreement,True,True,False,True,133,-40.68379592895508,-41.229854583740234,1
The universities are astounding themselves.,The universities are astounding himself.,morphology,anaphor_agreement,anaphor_number_agreement,True,True,False,True,134,-37.88326644897461,-38.926170349121094,1
These cashiers had concealed themselves.,These cashiers had concealed himself.,morphology,anaphor_agreement,anaphor_number_agreement,True,True,False,True,135,-44.756072998046875,-44.342559814453125,0
Michelle was embarrassing herself.,Michelle was embarrassing themselves.,morphology,anaphor_agreement,anaphor_number_agreement,True,True,False,True,136,-25.939010620117188,-24.51675796508789,0
Omar is concealing himself.,Omar is concealing themselves.,morphology,anaphor_agreement,anaphor_number_agreement,True,True,False,True,137,-41.595367431640625,-43.83201599121094,1
Most teachers hurt themselves.,Most teachers hurt herself.,morphology,anaphor_agreement,anaphor_number_agreement,True,True,False,True,138,-28.26819610595703,-28.847312927246094,1
