sentence_good,sentence_bad,field,linguistics_term,UID,simple_LM_method,one_prefix_method,two_prefix_method,lexically_identical,pair_id,good_prob,bad_prob,correct
Katherine can't help herself.,Katherine can't help himself.,morphology,anaphor_agreement,anaphor_gender_agreement,True,True,False,False,0,-31.372310638427734,-30.845462799072266,0
Karla could listen to herself.,Karla could listen to himself.,morphology,anaphor_agreement,anaphor_gender_agreement,True,True,False,False,1,-32.91832733154297,-32.200965881347656,0
Marie won't think about herself.,Marie won't think about itself.,morphology,anaphor_agreement,anaphor_gender_agreement,True,True,False,False,2,-27.696582794189453,-28.56072998046875,1
Mark hasn't discussed himself.,Mark hasn't discussed itself.,morphology,anaphor_agreement,anaphor_gender_agreement,True,True,False,False,3,-29.032360076904297,-29.295791625976562,1
Stephen impressed himself.,Stephen impressed itself.,morphology,anaphor_agreement,anaphor_gender_agreement,True,True,False,False,4,-20.192886352539062,-21.529216766357422,1
Christina boasts about herself.,Christina boasts about himself.,morphology,anaphor_agreement,anaphor_gender_agreement,True,True,False,False,5,-35.103233337402344,-33.759544372558594,0
Suzanne would irritate herself.,Suzanne would irritate itself.,morphology,anaphor_agreement,anaphor_gender_agreement,True,True,False,False,6,-44.052955627441406,-42.250755310058594,0
Rose couldn't reference herself.,Rose couldn't reference itself.,morphology,anaphor_agreement,anaphor_gender_agreement,True,True,False,False,7,-33.41536331176758,-31.820735931396484,0
Paul should stun himself.,Paul should stun herself.,morphology,anaphor_agreement,anaphor_gender_agreement,True,True,False,False,8,-31.161663055419922,-31.638967514038086,1
Kristen praises herself.,Kristen praises himself.,morphology,anaphor_agreement,anaphor_gender_agreement,True,True,False,False,9,-29.942846298217773,-29.674480438232422,0
Tamara might work with herself.,Tamara might work with himself.,morphology,anaphor_agreement,anaphor_gender_agreement,True,True,False,False,10,-37.36045455932617,-36.20343780517578,0
Valerie remembers herself.,Valerie remembers itself.,morphology,anaphor_agreement,anaphor_gender_agreement,True,True,False,False,11,-32.23783493041992,-32.159645080566406,0
Kristen hasn't worked with herself.,Kristen hasn't worked with itself.,morphology,anaphor_agreement,anaphor_gender_agreement,True,True,False,False,12,-36.278141021728516,-36.934940338134766,1
Kendra disturbed herself.,Kendra disturbed himself.,morphology,anaphor_agreement,anaphor_gender_agreement,True,True,False,False,13,-34.07225799560547,-32.28213119506836,0
Lawrence had boasted about himself.,Lawrence had boasted about herself.,morphology,anaphor_agreement,anaphor_gender_agreement,True,True,False,False,14,-40.384765625,-43.35425567626953,1
Jason wasn't listening to himself.,Jason wasn't listening to herself.,morphology,anaphor_agreement,anaphor_gender_agreement,True,True,False,False,15,-25.79111099243164,-26.52588653564453,1
Sabrina disturbs herself.,Sabrina disturbs himself.,morphology,anaphor_agreement,anaphor_gender_agreement,True,True,False,False,16,-42.77229690551758,-42.27448272705078,0
Some essay doesn't disagree with itself.,Some essay doesn't disagree with himself.,morphology,anaphor_agreement,anaphor_gender_agreement,True,True,False,False,17,-43.85535430908203,-43.1544189453125,0
Kenneth wasn't admiring himself.,Kenneth wasn't admiring itself.,morphology,anaphor_agreement,anaphor_gender_agreement,True,True,False,False,18,-39.4059944152832,-42.45731735229492,1
Melanie had referenced herself.,Melanie had referenced itself.,morphology,anaphor_agreement,anaphor_gender_agreement,True,True,False,False,19,-41.1308479309082,-39.43789291381836,0
Larry reveals himself.,Larry reveals itself.,morphology,anaphor_agreement,anaphor_gender_agreement,True,True,False,False,20,-20.02381706237793,-21.661605834960938,1
Samantha isn't watching herself.,Samantha isn't watching itself.,morphology,anaphor_agreement,anaphor_gender_agreement,True,True,False,False,21,-41.04050827026367,-42.42194366455078,1
Rachel should like herself.,Rachel should like himself.,morphology,anaphor_agreement,anaphor_gender_agreement,True,True,False,False,22,-22.04599380493164,-21.76995086669922,0
Heather has helped herself.,Heather has helped itself.,morphology,anaphor_agreement,anaphor_gender_agreement,True,True,False,False,23,-33.43612289428711,-35.181617736816406,1
Lori has found herself.,Lori has found itself.,morphology,anaphor_agreement,anaphor_gender_agreement,True,True,False,False,24,-31.887805938720703,-33.254783630371094,1
Christina hadn't shocked herself.,Christina hadn't shocked itself.,morphology,anaphor_agreement,anaphor_gender_agreement,True,True,False,False,25,-37.907962799072266,-39.38803482055664,1
Theresa wasn't alarming herself.,Theresa wasn't alarming himself.,morphology,anaphor_agreement,anaphor_gender_agreement,True,True,False,False,26,-43.726261138916016,-42.82524108886719,0
Jacqueline works with herself.,Jacqueline works with himself.,morphology,anaphor_agreement,anaphor_gender_agreement,True,True,False,False,27,-37.93307113647461,-37.06034469604492,0
Alan hires himself.,Alan hires herself.,morphology,anaphor_agreement,anaphor_gender_agreement,True,True,False,False,28,-21.335899353027344,-23.631778717041016,1
April isn't complaining about herself.,April isn't complaining about himself.,morphology,anaphor_agreement,anaphor_gender_agreement,True,True,False,False,29,-33.6879997253418,-32.39910888671875,0
Scott had questioned himself.,Scott had questioned herself.,morphology,anaphor_agreement,anaphor_gender_agreement,True,True,False,False,30,-21.301254272460938,-23.13695526123047,1
Wayne helps himself.,Wayne helps itself.,morphology,anaphor_agreement,anaphor_gender_agreement,True,True,False,False,31,-27.293466567993164,-27.821880340576172,1
Amelia heals herself.,Amelia heals himself.,morphology,anaphor_agreement,anaphor_gender_agreement,True,True,False,False,32,-32.935279846191406,-31.541942596435547,0
Debra is disgusting herself.,Debra is disgusting itself.,morphology,anaphor_agreement,anaphor_gender_agreement,True,True,False,False,33,-33.07414245605469,-33.102481842041016,1
Irene has admired herself.,Irene has admired himself.,morphology,anaphor_agreement,anaphor_gender_agreement,True,True,False,False,34,-38.57134246826172,-37.25117492675781,0
Brad distracted himself.,Brad distracted herself.,morphology,anaphor_agreement,anaphor_gender_agreement,True,True,False,False,35,-21.664770126342773,-22.353458404541016,1
Sherry wouldn't cure herself.,Sherry wouldn't cure itself.,morphology,anaphor_agreement,anaphor_gender_agreement,True,True,False,False,36,-40.44951248168945,-40.19150924682617,0
Ronald upset himself.,Ronald upset itself.,morphology,anaphor_agreement,anaphor_gender_agreement,True,True,False,False,37,-29.32484245300293,-31.356395721435547,1
Catherine hasn't noticed herself.,Catherine hasn't noticed himself.,morphology,anaphor_agreement,anaphor_gender_agreement,True,True,False,False,38,-34.63619613647461,-33.193206787109375,0
Susan shouldn't criticize herself.,Susan shouldn't criticize himself.,morphology,anaphor_agreement,anaphor_gender_agreement,True,True,False,False,39,-30.286243438720703,-28.983078002929688,0
Dawn has described herself.,Dawn has described himself.,morphology,anaphor_agreement,anaphor_gender_agreement,True,True,False,False,40,-35.75629425048828,-34.3169059753418,0
Joseph describes himself.,Joseph describes herself.,morphology,anaphor_agreement,anaphor_gender_agreement,True,True,False,False,41,-19.692811965942383,-21.87441635131836,1
Catherine isn't hurting herself.,Catherine isn't hurting himself.,morphology,anaphor_agreement,anaphor_gender_agreement,True,True,False,False,42,-34.88690185546875,-34.19325256347656,0
Tracy alarmed herself.,Tracy alarmed itself.,morphology,anaphor_agreement,anaphor_gender_agreement,True,True,False,False,43,-32.38621520996094,-32.477176666259766,1
Heather has embarrassed herself.,Heather has embarrassed himself.,morphology,anaphor_agreement,anaphor_gender_agreement,True,True,False,False,44,-40.61573791503906,-39.25548553466797,0
Sharon hurt herself.,Sharon hurt itself.,morphology,anaphor_agreement,anaphor_gender_agreement,True,True,False,False,45,-28.32776641845703,-29.284469604492188,1
Marie might admire herself.,Marie might admire himself.,morphology,anaphor_agreement,anaphor_gender_agreement,True,True,False,False,46,-27.65410614013672,-26.948223114013672,0
Susan did love herself.,Susan did love itself.,morphology,anaphor_agreement,anaphor_gender_agreement,True,True,False,False,47,-20.810958862304688,-22.90776824951172,1
Russell hasn't hired himself.,Russell hasn't hired herself.,morphology,anaphor_agreement,anaphor_gender_agreement,True,True,False,False,48,-27.068424224853516,-29.30014419555664,1
Every man insulted himself.,Every man insulted itself.,morphology,anaphor_agreement,anaphor_gender_agreement,True,True,False,False,49,-25.260650634765625,-28.412704467773438,1
Marie had insulted herself.,Marie had insulted himself.,morphology,anaphor_agreement,anaphor_gender_agreement,True,True,False,False,50,-26.164005279541016,-23.969974517822266,0
Steve wasn't describing himself.,Steve wasn't describing itself.,morphology,anaphor_agreement,anaphor_gender_agreement,True,True,False,False,51,-27.01729965209961,-28.68242073059082,1
Roger had known himself.,Roger had known herself.,morphology,anaphor_agreement,anaphor_gender_agreement,True,True,False,False,52,-20.049388885498047,-21.55373764038086,1
Larry boasts about himself.,Larry boasts about herself.,morphology,anaphor_agreement,anaphor_gender_agreement,True,True,False,False,53,-27.338481903076172,-29.019512176513672,1
Kayla complains about herself.,Kayla complains about himself.,morphology,anaphor_agreement,anaphor_gender_agreement,True,True,False,False,54,-33.496360778808594,-32.18937683105469,0
A bird had found itself.,A bird had found herself.,morphology,anaphor_agreement,anaphor_gender_agreement,True,True,False,False,55,-28.666170120239258,-26.438451766967773,0
Ellen wasn't worrying herself.,Ellen wasn't worrying himself.,morphology,anaphor_agreement,anaphor_gender_agreement,True,True,False,False,56,-35.32187271118164,-34.375606536865234,0
Debra wasn't investigating herself.,Debra wasn't investigating itself.,morphology,anaphor_agreement,anaphor_gender_agreement,True,True,False,False,57,-38.58271026611328,-37.490657806396484,0
Larry referenced himself.,Larry referenced herself.,morphology,anaphor_agreement,anaphor_gender_agreement,True,True,False,False,58,-24.58957290649414,-25.75168228149414,1
Joel does complain about himself.,Joel does complain about herself.,morphology,anaphor_agreement,anaphor_gender_agreement,True,True,False,False,59,-37.06641387939453,-38.82791519165039,1
Gregory won't attack himself.,Gregory won't attack itself.,morphology,anaphor_agreement,anaphor_gender_agreement,True,True,False,False,60,-32.56303787231445,-33.54911422729492,1
Christine hasn't questioned herself.,Christine hasn't questioned himself.,morphology,anaphor_agreement,anaphor_gender_agreement,True,True,False,False,61,-36.49394226074219,-35.28470993041992,0
Natalie returned to herself.,Natalie returned to itself.,morphology,anaphor_agreement,anaphor_gender_agreement,True,True,False,False,62,-29.125450134277344,-31.495502471923828,1
Becca was approaching herself.,Becca was approaching himself.,morphology,anaphor_agreement,anaphor_gender_agreement,True,True,False,False,63,-32.335575103759766,-30.622604370117188,0
Rachelle investigated herself.,Rachelle investigated himself.,morphology,anaphor_agreement,anaphor_gender_agreement,True,True,False,False,64,-32.40758514404297,-31.118961334228516,0
Sheila saw herself.,Sheila saw himself.,morphology,anaphor_agreement,anaphor_gender_agreement,True,True,False,False,65,-26.8464412689209,-25.033538818359375,0
Jacqueline likes herself.,Jacqueline likes himself.,morphology,anaphor_agreement,anaphor_gender_agreement,True,True,False,False,66,-34.79971694946289,-34.464080810546875,0
Douglas healed himself.,Douglas healed herself.,morphology,anaphor_agreement,anaphor_gender_agreement,True,True,False,False,67,-32.943626403808594,-33.989315032958984,1
Colleen wasn't concealing herself.,Colleen wasn't concealing itself.,morphology,anaphor_agreement,anaphor_gender_agreement,True,True,False,False,68,-49.18671798706055,-49.118629455566406,0
Catherine disturbed herself.,Catherine disturbed itself.,morphology,anaphor_agreement,anaphor_gender_agreement,True,True,False,False,69,-31.51413345336914,-31.2116641998291,0
Some company astounded itself.,Some company astounded herself.,morphology,anaphor_agreement,anaphor_gender_agreement,True,True,False,False,70,-36.501461029052734,-37.57893371582031,1
Todd likes himself.,Todd likes itself.,morphology,anaphor_agreement,anaphor_gender_agreement,True,True,False,False,71,-20.25135040283203,-21.356861114501953,1
Tamara couldn't flee from herself.,Tamara couldn't flee from himself.,morphology,anaphor_agreement,anaphor_gender_agreement,True,True,False,False,72,-42.141700744628906,-41.777137756347656,0
Rose praised herself.,Rose praised himself.,morphology,anaphor_agreement,anaphor_gender_agreement,True,True,False,False,73,-20.70440101623535,-19.548660278320312,0
Joseph isn't annoying himself.,Joseph isn't annoying herself.,morphology,anaphor_agreement,anaphor_gender_agreement,True,True,False,False,74,-30.61577606201172,-30.865741729736328,1
Jodi liked herself.,Jodi liked itself.,morphology,anaphor_agreement,anaphor_gender_agreement,True,True,False,False,75,-31.001541137695312,-32.34723663330078,1
Ronald fled from himself.,Ronald fled from herself.,morphology,anaphor_agreement,anaphor_gender_agreement,True,True,False,False,76,-31.574865341186523,-33.24176788330078,1
Tina fires herself.,Tina fires himself.,morphology,anaphor_agreement,anaphor_gender_agreement,True,True,False,False,77,-30.074695587158203,-29.41735076904297,0
Michelle saw herself.,Michelle saw itself.,morphology,anaphor_agreement,anaphor_gender_agreement,True,True,False,False,78,-17.424867630004883,-18.269386291503906,1
Renee might admire herself.,Renee might admire itself.,morphology,anaphor_agreement,anaphor_gender_agreement,True,True,False,False,79,-34.34854507446289,-35.90673828125,1
A girl couldn't reveal herself.,A girl couldn't reveal himself.,morphology,anaphor_agreement,anaphor_gender_agreement,True,True,False,False,80,-36.21467208862305,-35.06789016723633,0
Curtis won't describe himself.,Curtis won't describe itself.,morphology,anaphor_agreement,anaphor_gender_agreement,True,True,False,False,81,-42.1746826171875,-43.390987396240234,1
Patricia does respect herself.,Patricia does respect himself.,morphology,anaphor_agreement,anaphor_gender_agreement,True,True,False,False,82,-40.67414855957031,-39.64747619628906,0
Valerie forgets herself.,Valerie forgets itself.,morphology,anaphor_agreement,anaphor_gender_agreement,True,True,False,False,83,-38.672061920166016,-38.21263122558594,0
Deborah had annoyed herself.,Deborah had annoyed himself.,morphology,anaphor_agreement,anaphor_gender_agreement,True,True,False,False,84,-36.34807586669922,-34.65326690673828,0
Clyde hasn't hated himself.,Clyde hasn't hated itself.,morphology,anaphor_agreement,anaphor_gender_agreement,True,True,False,False,85,-47.77974319458008,-50.5889892578125,1
Andrea does kiss herself.,Andrea does kiss itself.,morphology,anaphor_agreement,anaphor_gender_agreement,True,True,False,False,86,-39.398799896240234,-38.66783142089844,0
Irene isn't irritating herself.,Irene isn't irritating itself.,morphology,anaphor_agreement,anaphor_gender_agreement,True,True,False,False,87,-44.586158752441406,-44.990108489990234,1
Stacy hadn't sounded like herself.,Stacy hadn't sounded like itself.,morphology,anaphor_agreement,anaphor_gender_agreement,True,True,False,False,88,-46.029720306396484,-47.62741470336914,1
Rose has shocked herself.,Rose has shocked itself.,morphology,anaphor_agreement,anaphor_gender_agreement,True,True,False,False,89,-27.412853240966797,-26.828079223632812,0
George wasn't hurting himself.,George wasn't hurting itself.,morphology,anaphor_agreement,anaphor_gender_agreement,True,True,False,False,90,-25.87958335876465,-28.601577758789062,1
Amy would question herself.,Amy would question himself.,morphology,anaphor_agreement,anaphor_gender_agreement,True,True,False,False,91,-25.860200881958008,-25.90117835998535,1
Tonya sees herself.,Tonya sees itself.,morphology,anaphor_agreement,anaphor_gender_agreement,True,True,False,False,92,-24.908123016357422,-26.8101863861084,1
Christina hasn't hired herself.,Christina hasn't hired himself.,morphology,anaphor_agreement,anaphor_gender_agreement,True,True,False,False,93,-34.173744201660156,-32.52544403076172,0
Pamela did reveal herself.,Pamela did reveal himself.,morphology,anaphor_agreement,anaphor_gender_agreement,True,True,False,False,94,-43.38058853149414,-40.960365295410156,0
Diane had concealed herself.,Diane had concealed himself.,morphology,anaphor_agreement,anaphor_gender_agreement,True,True,False,False,95,-37.894500732421875,-35.342567443847656,0
Melinda hasn't argued about herself.,Melinda hasn't argued about itself.,morphology,anaphor_agreement,anaphor_gender_agreement,True,True,False,False,96,-45.82196044921875,-46.25735092163086,1
Deanna insults herself.,Deanna insults itself.,morphology,anaphor_agreement,anaphor_gender_agreement,True,True,False,False,97,-34.67669677734375,-32.58833312988281,0
Gregory isn't hurting himself.,Gregory isn't hurting herself.,morphology,anaphor_agreement,anaphor_gender_agreement,True,True,False,False,98,-32.983646392822266,-33.85780334472656,1
Rebecca should shock herself.,Rebecca should shock himself.,morphology,anaphor_agreement,anaphor_gender_agreement,True,True,False,False,99,-42.261985778808594,-41.36106872558594,0
Amanda stunned herself.,Amanda stunned itself.,morphology,anaphor_agreement,anaphor_gender_agreement,True,True,False,False,100,-28.854045867919922,-29.792484283447266,1
That dancer wouldn't aggravate herself.,That dancer wouldn't aggravate himself.,morphology,anaphor_agreement,anaphor_gender_agreement,True,True,False,False,101,-46.029396057128906,-44.95592498779297,0
Colleen talks to herself.,Colleen talks to itself.,morphology,anaphor_agreement,anaphor_gender_agreement,True,True,False,False,102,-30.33882713317871,-31.680099487304688,1
Brian hasn't healed himself.,Brian hasn't healed itself.,morphology,anaphor_agreement,anaphor_gender_agreement,True,True,False,False,103,-31.33530616760254,-32.07149124145508,1
Natalie is curing herself.,Natalie is curing himself.,morphology,anaphor_agreement,anaphor_gender_agreement,True,True,False,False,104,-37.58154296875,-37.02401351928711,0
Rhonda was upsetting herself.,Rhonda was upsetting himself.,morphology,anaphor_agreement,anaphor_gender_agreement,True,True,False,False,105,-34.25254821777344,-32.34529495239258,0
Peter wasn't disgusting himself.,Peter wasn't disgusting herself.,morphology,anaphor_agreement,anaphor_gender_agreement,True,True,False,False,106,-32.383445739746094,-32.17115783691406,0
Kristen isn't aggravating herself.,Kristen isn't aggravating itself.,morphology,anaphor_agreement,anaphor_gender_agreement,True,True,False,False,107,-41.85820007324219,-40.293212890625,0
Victoria hid herself.,Victoria hid himself.,morphology,anaphor_agreement,anaphor_gender_agreement,True,True,False,False,108,-20.200685501098633,-18.815629959106445,0
Becca has seen herself.,Becca has seen himself.,morphology,anaphor_agreement,anaphor_gender_agreement,True,True,False,False,109,-29.59836769104004,-27.9349308013916,0
Sherry can't forget herself.,Sherry can't forget himself.,morphology,anaphor_agreement,anaphor_gender_agreement,True,True,False,False,110,-35.873687744140625,-34.363136291503906,0
Tracy had distracted herself.,Tracy had distracted itself.,morphology,anaphor_agreement,anaphor_gender_agreement,True,True,False,False,111,-34.989803314208984,-35.231109619140625,1
Stephanie is talking to herself.,Stephanie is talking to himself.,morphology,anaphor_agreement,anaphor_gender_agreement,True,True,False,False,112,-35.422733306884766,-34.356689453125,0
Rachelle might return to herself.,Rachelle might return to itself.,morphology,anaphor_agreement,anaphor_gender_agreement,True,True,False,False,113,-34.64435958862305,-36.245052337646484,1
Carl describes himself.,Carl describes herself.,morphology,anaphor_agreement,anaphor_gender_agreement,True,True,False,False,114,-21.167064666748047,-23.481739044189453,1
Jeffrey didn't describe himself.,Jeffrey didn't describe herself.,morphology,anaphor_agreement,anaphor_gender_agreement,True,True,False,False,115,-33.18528366088867,-35.172664642333984,1
Jacqueline hadn't concealed herself.,Jacqueline hadn't concealed itself.,morphology,anaphor_agreement,anaphor_gender_agreement,True,True,False,False,116,-44.89360809326172,-45.28020477294922,1
Tracy isn't upsetting herself.,Tracy isn't upsetting itself.,morphology,anaphor_agreement,anaphor_gender_agreement,True,True,False,False,117,-41.84053039550781,-41.014102935791016,0
Sonia hasn't discovered herself.,Sonia hasn't discovered himself.,morphology,anaphor_agreement,anaphor_gender_agreement,True,True,False,False,118,-38.628231048583984,-37.1204719543457,0
Laura does find herself.,Laura does find himself.,morphology,anaphor_agreement,anaphor_gender_agreement,True,True,False,False,119,-23.285724639892578,-21.748994827270508,0
Jodi is confusing herself.,Jodi is confusing himself.,morphology,anaphor_agreement,anaphor_gender_agreement,True,True,False,False,120,-37.23773956298828,-36.28245162963867,0
Florence disliked herself.,Florence disliked himself.,morphology,anaphor_agreement,anaphor_gender_agreement,True,True,False,False,121,-35.022796630859375,-33.414146423339844,0
Alexander complains about himself.,Alexander complains about herself.,morphology,anaphor_agreement,anaphor_gender_agreement,True,True,False,False,122,-24.39412498474121,-26.50371742248535,1
Melissa complains about herself.,Melissa complains about itself.,morphology,anaphor_agreement,anaphor_gender_agreement,True,True,False,False,123,-35.54779052734375,-35.32987976074219,0
Teresa isn't noticing herself.,Teresa isn't noticing itself.,morphology,anaphor_agreement,anaphor_gender_agreement,True,True,False,False,124,-40.84695816040039,-41.39596176147461,1
Jerry should cure himself.,Jerry should cure herself.,morphology,anaphor_agreement,anaphor_gender_agreement,True,True,False,False,125,-25.58411407470703,-26.835861206054688,1
Tanya was kissing herself.,Tanya was kissing himself.,morphology,anaphor_agreement,anaphor_gender_agreement,True,True,False,False,126,-34.196014404296875,-32.85726547241211,0
Todd was scaring himself.,Todd was scaring itself.,morphology,anaphor_agreement,anaphor_gender_agreement,True,True,False,False,127,-26.583711624145508,-28.682861328125,1
Sheila was noticing herself.,Sheila was noticing himself.,morphology,anaphor_agreement,anaphor_gender_agreement,True,True,False,False,128,-32.916873931884766,-31.69104766845703,0
Marla wasn't distracting herself.,Marla wasn't distracting himself.,morphology,anaphor_agreement,anaphor_gender_agreement,True,True,False,False,129,-39.44547653198242,-38.358253479003906,0
Dana hasn't respected herself.,Dana hasn't respected itself.,morphology,anaphor_agreement,anaphor_gender_agreement,True,True,False,False,130,-38.377105712890625,-39.311973571777344,1
Curtis isn't scaring himself.,Curtis isn't scaring herself.,morphology,anaphor_agreement,anaphor_gender_agreement,True,True,False,False,131,-46.86262130737305,-47.54145050048828,1
Some organization had distracted itself.,Some organization had distracted himself.,morphology,anaphor_agreement,anaphor_gender_agreement,True,True,False,False,132,-36.6976318359375,-35.614845275878906,0
Some dancer has visited herself.,Some dancer has visited himself.,morphology,anaphor_agreement,anaphor_gender_agreement,True,True,False,False,133,-34.49462127685547,-34.2470703125,0
Adam returned to himself.,Adam returned to itself.,morphology,anaphor_agreement,anaphor_gender_agreement,True,True,False,False,134,-19.302419662475586,-22.408920288085938,1
A university won't impress itself.,A university won't impress himself.,morphology,anaphor_agreement,anaphor_gender_agreement,True,True,False,False,135,-41.71562576293945,-39.73984909057617,0
Marla annoyed herself.,Marla annoyed himself.,morphology,anaphor_agreement,anaphor_gender_agreement,True,True,False,False,136,-31.567230224609375,-30.282238006591797,0
Every story would disagree with itself.,Every story would disagree with himself.,morphology,anaphor_agreement,anaphor_gender_agreement,True,True,False,False,137,-37.331260681152344,-35.80336380004883,0
Aaron references himself.,Aaron references itself.,morphology,anaphor_agreement,anaphor_gender_agreement,True,True,False,False,138,-23.643192291259766,-23.367412567138672,0
Caroline isn't impressing herself.,Caroline isn't impressing itself.,morphology,anaphor_agreement,anaphor_gender_agreement,True,True,False,False,139,-43.337242126464844,-43.36743927001953,1
Laurie wasn't questioning herself.,Laurie wasn't questioning itself.,morphology,anaphor_agreement,anaphor_gender_agreement,True,True,False,False,140,-40.616737365722656,-42.282718658447266,1
Alexander would criticize himself.,Alexander would criticize itself.,morphology,anaphor_agreement,anaphor_gender_agreement,True,True,False,False,141,-24.969039916992188,-26.561485290527344,1
Martin couldn't disgust himself.,Martin couldn't disgust herself.,morphology,anaphor_agreement,anaphor_gender_agreement,True,True,False,False,142,-30.53821563720703,-30.380908966064453,0
Danielle embarrassed herself.,Danielle embarrassed himself.,morphology,anaphor_agreement,anaphor_gender_agreement,True,True,False,False,143,-30.72301483154297,-30.30927085876465,0
