sentence_good,sentence_bad,field,linguistics_term,UID,simple_LM_method,one_prefix_method,two_prefix_method,lexically_identical,pair_id,good_prob,bad_prob,correct
Janice hasn't distracted herself.,Janice hasn't distracted itself.,morphology,anaphor_agreement,anaphor_gender_agreement,True,True,False,False,289,-39.114501953125,-39.87734603881836,1
An organization astounded itself.,An organization astounded herself.,morphology,anaphor_agreement,anaphor_gender_agreement,True,True,False,False,290,-39.8453369140625,-40.63142013549805,1
Angela hasn't impressed herself.,Angela hasn't impressed himself.,morphology,anaphor_agreement,anaphor_gender_agreement,True,True,False,False,291,-38.88240051269531,-37.86135482788086,0
Rose conceals herself.,Rose conceals himself.,morphology,anaphor_agreement,anaphor_gender_agreement,True,True,False,False,292,-29.720064163208008,-28.786884307861328,0
Lawrence questioned himself.,Lawrence questioned herself.,morphology,anaphor_agreement,anaphor_gender_agreement,True,True,False,False,293,-28.14202308654785,-30.928768157958984,1
Sarah knows herself.,Sarah knows itself.,morphology,anaphor_agreement,anaphor_gender_agreement,True,True,False,False,294,-18.05541229248047,-18.852825164794922,1
Cindy wasn't astounding herself.,Cindy wasn't astounding himself.,morphology,anaphor_agreement,anaphor_gender_agreement,True,True,False,False,295,-45.963985443115234,-44.543975830078125,0
Andrew is talking to himself.,Andrew is talking to herself.,morphology,anaphor_agreement,anaphor_gender_agreement,True,True,False,False,296,-19.79253387451172,-20.538591384887695,1
Kimberley isn't admiring herself.,Kimberley isn't admiring itself.,morphology,anaphor_agreement,anaphor_gender_agreement,True,True,False,False,297,-48.63168716430664,-50.448978424072266,1
Samantha argued about herself.,Samantha argued about itself.,morphology,anaphor_agreement,anaphor_gender_agreement,True,True,False,False,298,-40.150360107421875,-40.55519104003906,1
Beth had sounded like herself.,Beth had sounded like itself.,morphology,anaphor_agreement,anaphor_gender_agreement,True,True,False,False,299,-36.30253601074219,-38.203269958496094,1
Rachelle aggravated herself.,Rachelle aggravated itself.,morphology,anaphor_agreement,anaphor_gender_agreement,True,True,False,False,300,-33.99293899536133,-33.54729080200195,0
Bruce had noticed himself.,Bruce had noticed itself.,morphology,anaphor_agreement,anaphor_gender_agreement,True,True,False,False,301,-20.78289794921875,-23.09071922302246,1
Heidi talks about herself.,Heidi talks about himself.,morphology,anaphor_agreement,anaphor_gender_agreement,True,True,False,False,302,-33.41282272338867,-31.355867385864258,0
Amy scares herself.,Amy scares himself.,morphology,anaphor_agreement,anaphor_gender_agreement,True,True,False,False,303,-21.398704528808594,-21.72557830810547,1
Donna isn't hiring herself.,Donna isn't hiring itself.,morphology,anaphor_agreement,anaphor_gender_agreement,True,True,False,False,304,-39.10275650024414,-38.51737976074219,0
Eric returned to himself.,Eric returned to herself.,morphology,anaphor_agreement,anaphor_gender_agreement,True,True,False,False,305,-17.91582489013672,-18.975086212158203,1
Lucille should fire herself.,Lucille should fire himself.,morphology,anaphor_agreement,anaphor_gender_agreement,True,True,False,False,306,-39.370609283447266,-38.555206298828125,0
Amelia escaped from herself.,Amelia escaped from himself.,morphology,anaphor_agreement,anaphor_gender_agreement,True,True,False,False,307,-33.24496841430664,-32.28105926513672,0
Katherine bored herself.,Katherine bored himself.,morphology,anaphor_agreement,anaphor_gender_agreement,True,True,False,False,308,-34.32049560546875,-33.98193359375,0
Kirsten wasn't praising herself.,Kirsten wasn't praising itself.,morphology,anaphor_agreement,anaphor_gender_agreement,True,True,False,False,309,-44.99070358276367,-46.415504455566406,1
Valerie works with herself.,Valerie works with himself.,morphology,anaphor_agreement,anaphor_gender_agreement,True,True,False,False,310,-32.84267044067383,-31.83148193359375,0
Teresa was observing herself.,Teresa was observing himself.,morphology,anaphor_agreement,anaphor_gender_agreement,True,True,False,False,311,-36.42015075683594,-34.54143524169922,0
Samuel disagrees with himself.,Samuel disagrees with herself.,morphology,anaphor_agreement,anaphor_gender_agreement,True,True,False,False,312,-33.91859436035156,-34.8564453125,1
Kayla thinks about herself.,Kayla thinks about itself.,morphology,anaphor_agreement,anaphor_gender_agreement,True,True,False,False,313,-31.14670181274414,-31.155487060546875,1
Frank describes himself.,Frank describes herself.,morphology,anaphor_agreement,anaphor_gender_agreement,True,True,False,False,314,-20.480388641357422,-23.19518280029297,1
Tanya wouldn't distract herself.,Tanya wouldn't distract itself.,morphology,anaphor_agreement,anaphor_gender_agreement,True,True,False,False,315,-38.450408935546875,-38.82588195800781,1
Rhonda was shocking herself.,Rhonda was shocking himself.,morphology,anaphor_agreement,anaphor_gender_agreement,True,True,False,False,316,-35.29070281982422,-34.07997512817383,0
Kimberley loved herself.,Kimberley loved himself.,morphology,anaphor_agreement,anaphor_gender_agreement,True,True,False,False,317,-35.248104095458984,-32.612545013427734,0
Amelia can't help herself.,Amelia can't help himself.,morphology,anaphor_agreement,anaphor_gender_agreement,True,True,False,False,318,-30.178760528564453,-29.84967803955078,0
Martin has listened to himself.,Martin has listened to herself.,morphology,anaphor_agreement,anaphor_gender_agreement,True,True,False,False,319,-24.360618591308594,-25.06304359436035,1
Elizabeth will help herself.,Elizabeth will help itself.,morphology,anaphor_agreement,anaphor_gender_agreement,True,True,False,False,320,-20.38597869873047,-20.909481048583984,1
Some man can't describe himself.,Some man can't describe itself.,morphology,anaphor_agreement,anaphor_gender_agreement,True,True,False,False,321,-31.957904815673828,-33.183380126953125,1
Sara observed herself.,Sara observed himself.,morphology,anaphor_agreement,anaphor_gender_agreement,True,True,False,False,322,-27.618946075439453,-26.79366111755371,0
Irene watches herself.,Irene watches itself.,morphology,anaphor_agreement,anaphor_gender_agreement,True,True,False,False,323,-31.069507598876953,-30.826122283935547,0
Jerry impressed himself.,Jerry impressed herself.,morphology,anaphor_agreement,anaphor_gender_agreement,True,True,False,False,324,-20.919818878173828,-22.027673721313477,1
Sharon is watching herself.,Sharon is watching himself.,morphology,anaphor_agreement,anaphor_gender_agreement,True,True,False,False,325,-29.20836067199707,-27.65837287902832,0
Christina observed herself.,Christina observed itself.,morphology,anaphor_agreement,anaphor_gender_agreement,True,True,False,False,326,-25.416423797607422,-26.846904754638672,1
Cynthia distracted herself.,Cynthia distracted itself.,morphology,anaphor_agreement,anaphor_gender_agreement,True,True,False,False,327,-45.069644927978516,-45.269989013671875,1
Samuel had cared for himself.,Samuel had cared for itself.,morphology,anaphor_agreement,anaphor_gender_agreement,True,True,False,False,328,-34.088783264160156,-36.42898178100586,1
Omar would attack himself.,Omar would attack itself.,morphology,anaphor_agreement,anaphor_gender_agreement,True,True,False,False,329,-35.15716552734375,-35.6331672668457,1
Kirsten helps herself.,Kirsten helps himself.,morphology,anaphor_agreement,anaphor_gender_agreement,True,True,False,False,330,-34.98918151855469,-34.35454559326172,0
Janice complained about herself.,Janice complained about itself.,morphology,anaphor_agreement,anaphor_gender_agreement,True,True,False,False,331,-33.47966766357422,-34.0557861328125,1
Tina is insulting herself.,Tina is insulting itself.,morphology,anaphor_agreement,anaphor_gender_agreement,True,True,False,False,332,-32.50990295410156,-32.34978485107422,0
Wayne is attacking himself.,Wayne is attacking herself.,morphology,anaphor_agreement,anaphor_gender_agreement,True,True,False,False,333,-31.26042938232422,-31.916112899780273,1
Meredith was curing herself.,Meredith was curing himself.,morphology,anaphor_agreement,anaphor_gender_agreement,True,True,False,False,334,-42.14194107055664,-40.0494384765625,0
Anne couldn't distract herself.,Anne couldn't distract himself.,morphology,anaphor_agreement,anaphor_gender_agreement,True,True,False,False,335,-28.593982696533203,-27.605587005615234,0
Joseph notices himself.,Joseph notices itself.,morphology,anaphor_agreement,anaphor_gender_agreement,True,True,False,False,336,-20.51677703857422,-20.634288787841797,1
Patricia hugged herself.,Patricia hugged itself.,morphology,anaphor_agreement,anaphor_gender_agreement,True,True,False,False,337,-32.84685134887695,-34.798492431640625,1
Karla has confused herself.,Karla has confused himself.,morphology,anaphor_agreement,anaphor_gender_agreement,True,True,False,False,338,-35.09744644165039,-34.56830596923828,0
Derek is noticing himself.,Derek is noticing itself.,morphology,anaphor_agreement,anaphor_gender_agreement,True,True,False,False,339,-33.008201599121094,-34.95538330078125,1
Edward attacked himself.,Edward attacked herself.,morphology,anaphor_agreement,anaphor_gender_agreement,True,True,False,False,340,-18.35186767578125,-20.126014709472656,1
Roger hadn't stunned himself.,Roger hadn't stunned herself.,morphology,anaphor_agreement,anaphor_gender_agreement,True,True,False,False,341,-29.585834503173828,-30.915367126464844,1
Carlos isn't discussing himself.,Carlos isn't discussing herself.,morphology,anaphor_agreement,anaphor_gender_agreement,True,True,False,False,342,-35.1036376953125,-36.72904586791992,1
Danielle will appreciate herself.,Danielle will appreciate himself.,morphology,anaphor_agreement,anaphor_gender_agreement,True,True,False,False,343,-33.769981384277344,-32.42377471923828,0
Curtis didn't respect himself.,Curtis didn't respect itself.,morphology,anaphor_agreement,anaphor_gender_agreement,True,True,False,False,344,-41.22636413574219,-43.127925872802734,1
Kathleen does investigate herself.,Kathleen does investigate itself.,morphology,anaphor_agreement,anaphor_gender_agreement,True,True,False,False,345,-47.57548904418945,-45.675086975097656,0
Marla isn't approaching herself.,Marla isn't approaching himself.,morphology,anaphor_agreement,anaphor_gender_agreement,True,True,False,False,346,-39.66383361816406,-38.31543731689453,0
Vanessa concealed herself.,Vanessa concealed himself.,morphology,anaphor_agreement,anaphor_gender_agreement,True,True,False,False,347,-32.68077087402344,-30.029573440551758,0
Brett escapes from himself.,Brett escapes from itself.,morphology,anaphor_agreement,anaphor_gender_agreement,True,True,False,False,348,-34.79352569580078,-34.695701599121094,0
Kenneth hadn't seen himself.,Kenneth hadn't seen itself.,morphology,anaphor_agreement,anaphor_gender_agreement,True,True,False,False,349,-30.095787048339844,-33.08942794799805,1
Clyde cared for himself.,Clyde cared for itself.,morphology,anaphor_agreement,anaphor_gender_agreement,True,True,False,False,350,-39.64134216308594,-42.15800094604492,1
Craig wouldn't return to himself.,Craig wouldn't return to herself.,morphology,anaphor_agreement,anaphor_gender_agreement,True,True,False,False,351,-26.92296600341797,-27.551759719848633,1
Jessica has noticed herself.,Jessica has noticed itself.,morphology,anaphor_agreement,anaphor_gender_agreement,True,True,False,False,352,-24.362346649169922,-24.606101989746094,1
Bethany likes herself.,Bethany likes itself.,morphology,anaphor_agreement,anaphor_gender_agreement,True,True,False,False,353,-37.236541748046875,-38.017425537109375,1
Douglas can't visit himself.,Douglas can't visit herself.,morphology,anaphor_agreement,anaphor_gender_agreement,True,True,False,False,354,-36.91680145263672,-37.08356475830078,1
Travis hasn't attacked himself.,Travis hasn't attacked itself.,morphology,anaphor_agreement,anaphor_gender_agreement,True,True,False,False,355,-39.668296813964844,-42.02290344238281,1
Cindy conceals herself.,Cindy conceals itself.,morphology,anaphor_agreement,anaphor_gender_agreement,True,True,False,False,356,-40.83948516845703,-40.395530700683594,0
Julie can't upset herself.,Julie can't upset itself.,morphology,anaphor_agreement,anaphor_gender_agreement,True,True,False,False,357,-30.038005828857422,-31.52421760559082,1
Adam insults himself.,Adam insults itself.,morphology,anaphor_agreement,anaphor_gender_agreement,True,True,False,False,358,-24.082473754882812,-24.339962005615234,1
Grace won't astound herself.,Grace won't astound itself.,morphology,anaphor_agreement,anaphor_gender_agreement,True,True,False,False,359,-46.49086380004883,-46.89690399169922,1
Rebecca hasn't hugged herself.,Rebecca hasn't hugged himself.,morphology,anaphor_agreement,anaphor_gender_agreement,True,True,False,False,360,-41.33967590332031,-40.47981262207031,0
Gregory is questioning himself.,Gregory is questioning herself.,morphology,anaphor_agreement,anaphor_gender_agreement,True,True,False,False,361,-30.967164993286133,-31.61713409423828,1
Carla hasn't praised herself.,Carla hasn't praised himself.,morphology,anaphor_agreement,anaphor_gender_agreement,True,True,False,False,362,-38.787254333496094,-37.44313430786133,0
Lissa thought about herself.,Lissa thought about himself.,morphology,anaphor_agreement,anaphor_gender_agreement,True,True,False,False,363,-33.12839889526367,-31.984254837036133,0
Cindy would hire herself.,Cindy would hire itself.,morphology,anaphor_agreement,anaphor_gender_agreement,True,True,False,False,364,-37.51710510253906,-37.88957214355469,1
Christine hadn't boasted about herself.,Christine hadn't boasted about himself.,morphology,anaphor_agreement,anaphor_gender_agreement,True,True,False,False,365,-44.48979949951172,-42.83790588378906,0
Alice wasn't hugging herself.,Alice wasn't hugging itself.,morphology,anaphor_agreement,anaphor_gender_agreement,True,True,False,False,366,-29.360149383544922,-30.77538299560547,1
A report disagreed with itself.,A report disagreed with herself.,morphology,anaphor_agreement,anaphor_gender_agreement,True,True,False,False,367,-36.784339904785156,-39.11647033691406,1
Amanda will alarm herself.,Amanda will alarm itself.,morphology,anaphor_agreement,anaphor_gender_agreement,True,True,False,False,368,-34.491477966308594,-33.94173812866211,0
Rhonda likes herself.,Rhonda likes itself.,morphology,anaphor_agreement,anaphor_gender_agreement,True,True,False,False,369,-30.523193359375,-30.866661071777344,1
Vincent embarrassed himself.,Vincent embarrassed itself.,morphology,anaphor_agreement,anaphor_gender_agreement,True,True,False,False,370,-34.91724395751953,-36.568603515625,1
The waitress discovers herself.,The waitress discovers himself.,morphology,anaphor_agreement,anaphor_gender_agreement,True,True,False,False,371,-33.3253173828125,-31.9691104888916,0
Jennifer has scared herself.,Jennifer has scared itself.,morphology,anaphor_agreement,anaphor_gender_agreement,True,True,False,False,372,-25.64572525024414,-25.805191040039062,1
Tamara had upset herself.,Tamara had upset himself.,morphology,anaphor_agreement,anaphor_gender_agreement,True,True,False,False,373,-32.47490692138672,-31.83783531188965,0
Tara hadn't seen herself.,Tara hadn't seen himself.,morphology,anaphor_agreement,anaphor_gender_agreement,True,True,False,False,374,-31.052419662475586,-29.621217727661133,0
Every girl isn't referencing herself.,Every girl isn't referencing himself.,morphology,anaphor_agreement,anaphor_gender_agreement,True,True,False,False,375,-37.725379943847656,-37.695899963378906,0
Cynthia might argue about herself.,Cynthia might argue about itself.,morphology,anaphor_agreement,anaphor_gender_agreement,True,True,False,False,376,-54.06822204589844,-53.39029312133789,0
Carmen isn't talking to herself.,Carmen isn't talking to himself.,morphology,anaphor_agreement,anaphor_gender_agreement,True,True,False,False,377,-40.684200286865234,-40.5455322265625,0
Donna dislikes herself.,Donna dislikes itself.,morphology,anaphor_agreement,anaphor_gender_agreement,True,True,False,False,378,-42.12493133544922,-40.674720764160156,0
Sonia isn't discussing herself.,Sonia isn't discussing itself.,morphology,anaphor_agreement,anaphor_gender_agreement,True,True,False,False,379,-39.29895782470703,-38.67998504638672,0
Dana couldn't bother herself.,Dana couldn't bother himself.,morphology,anaphor_agreement,anaphor_gender_agreement,True,True,False,False,380,-32.57255554199219,-32.33099365234375,0
Irene hadn't scared herself.,Irene hadn't scared itself.,morphology,anaphor_agreement,anaphor_gender_agreement,True,True,False,False,381,-42.11360168457031,-43.618896484375,1
Beverly has investigated herself.,Beverly has investigated itself.,morphology,anaphor_agreement,anaphor_gender_agreement,True,True,False,False,382,-44.85870361328125,-43.6845703125,0
Chad complains about himself.,Chad complains about herself.,morphology,anaphor_agreement,anaphor_gender_agreement,True,True,False,False,383,-32.54972839355469,-34.64775085449219,1
Suzanne hadn't known herself.,Suzanne hadn't known himself.,morphology,anaphor_agreement,anaphor_gender_agreement,True,True,False,False,384,-40.82973098754883,-39.724456787109375,0
Sally visited herself.,Sally visited itself.,morphology,anaphor_agreement,anaphor_gender_agreement,True,True,False,False,385,-28.448150634765625,-28.904502868652344,1
Rachelle distracted herself.,Rachelle distracted himself.,morphology,anaphor_agreement,anaphor_gender_agreement,True,True,False,False,386,-32.54075622558594,-32.13734817504883,0
Dawn escaped from herself.,Dawn escaped from itself.,morphology,anaphor_agreement,anaphor_gender_agreement,True,True,False,False,387,-34.04678726196289,-34.221370697021484,1
Omar reveals himself.,Omar reveals itself.,morphology,anaphor_agreement,anaphor_gender_agreement,True,True,False,False,388,-30.9103946685791,-32.64134979248047,1
Rodney had visited himself.,Rodney had visited herself.,morphology,anaphor_agreement,anaphor_gender_agreement,True,True,False,False,389,-29.657773971557617,-31.619338989257812,1
Noah sees himself.,Noah sees herself.,morphology,anaphor_agreement,anaphor_gender_agreement,True,True,False,False,390,-30.93389129638672,-31.03821563720703,1
Gerald has cared for himself.,Gerald has cared for itself.,morphology,anaphor_agreement,anaphor_gender_agreement,True,True,False,False,391,-35.90597915649414,-37.198123931884766,1
Sabrina has remembered herself.,Sabrina has remembered himself.,morphology,anaphor_agreement,anaphor_gender_agreement,True,True,False,False,392,-36.4429931640625,-34.63359451293945,0
Laurie won't like herself.,Laurie won't like himself.,morphology,anaphor_agreement,anaphor_gender_agreement,True,True,False,False,393,-35.36531448364258,-35.26496124267578,0
Richard would annoy himself.,Richard would annoy herself.,morphology,anaphor_agreement,anaphor_gender_agreement,True,True,False,False,394,-25.84729766845703,-26.7943058013916,1
Matt isn't disturbing himself.,Matt isn't disturbing itself.,morphology,anaphor_agreement,anaphor_gender_agreement,True,True,False,False,395,-28.03082275390625,-29.689899444580078,1
Rachel respected herself.,Rachel respected itself.,morphology,anaphor_agreement,anaphor_gender_agreement,True,True,False,False,396,-22.530838012695312,-21.87928009033203,0
Veronica wouldn't work with herself.,Veronica wouldn't work with himself.,morphology,anaphor_agreement,anaphor_gender_agreement,True,True,False,False,397,-41.71184539794922,-40.74332809448242,0
Ronald hadn't bothered himself.,Ronald hadn't bothered herself.,morphology,anaphor_agreement,anaphor_gender_agreement,True,True,False,False,398,-38.58927536010742,-39.3585090637207,1
Phillip had attacked himself.,Phillip had attacked herself.,morphology,anaphor_agreement,anaphor_gender_agreement,True,True,False,False,399,-28.699996948242188,-31.269512176513672,1
Some girl will discuss herself.,Some girl will discuss itself.,morphology,anaphor_agreement,anaphor_gender_agreement,True,True,False,False,400,-32.28863525390625,-33.04792022705078,1
Elaine investigates herself.,Elaine investigates himself.,morphology,anaphor_agreement,anaphor_gender_agreement,True,True,False,False,401,-32.828636169433594,-32.01905822753906,0
Holly isn't attacking herself.,Holly isn't attacking itself.,morphology,anaphor_agreement,anaphor_gender_agreement,True,True,False,False,402,-38.113887786865234,-37.40838623046875,0
Margaret approached herself.,Margaret approached itself.,morphology,anaphor_agreement,anaphor_gender_agreement,True,True,False,False,403,-29.660675048828125,-30.45157241821289,1
Ruth irritated herself.,Ruth irritated itself.,morphology,anaphor_agreement,anaphor_gender_agreement,True,True,False,False,404,-30.744264602661133,-31.863304138183594,1
Florence sounds like herself.,Florence sounds like itself.,morphology,anaphor_agreement,anaphor_gender_agreement,True,True,False,False,405,-36.181304931640625,-37.226585388183594,1
Homer is attacking himself.,Homer is attacking itself.,morphology,anaphor_agreement,anaphor_gender_agreement,True,True,False,False,406,-34.62162780761719,-33.6285400390625,0
Randolf wasn't boring himself.,Randolf wasn't boring itself.,morphology,anaphor_agreement,anaphor_gender_agreement,True,True,False,False,407,-43.31540298461914,-42.81242752075195,0
Guy would insult himself.,Guy would insult herself.,morphology,anaphor_agreement,anaphor_gender_agreement,True,True,False,False,408,-23.665409088134766,-24.874351501464844,1
Colleen doesn't complain about herself.,Colleen doesn't complain about himself.,morphology,anaphor_agreement,anaphor_gender_agreement,True,True,False,False,409,-40.59463119506836,-39.1551628112793,0
Cynthia wouldn't distract herself.,Cynthia wouldn't distract himself.,morphology,anaphor_agreement,anaphor_gender_agreement,True,True,False,False,410,-53.50220489501953,-52.31413650512695,0
Tammy can't scare herself.,Tammy can't scare itself.,morphology,anaphor_agreement,anaphor_gender_agreement,True,True,False,False,411,-30.162525177001953,-31.506908416748047,1
Ruth heals herself.,Ruth heals itself.,morphology,anaphor_agreement,anaphor_gender_agreement,True,True,False,False,412,-31.629133224487305,-30.251657485961914,0
Dennis won't hide himself.,Dennis won't hide herself.,morphology,anaphor_agreement,anaphor_gender_agreement,True,True,False,False,413,-31.899337768554688,-32.99705505371094,1
Natalie confused herself.,Natalie confused itself.,morphology,anaphor_agreement,anaphor_gender_agreement,True,True,False,False,414,-32.90159606933594,-33.220054626464844,1
Travis doesn't find himself.,Travis doesn't find herself.,morphology,anaphor_agreement,anaphor_gender_agreement,True,True,False,False,415,-32.97272872924805,-34.46800994873047,1
Susan visited herself.,Susan visited itself.,morphology,anaphor_agreement,anaphor_gender_agreement,True,True,False,False,416,-20.897428512573242,-20.814300537109375,0
Steve has complained about himself.,Steve has complained about herself.,morphology,anaphor_agreement,anaphor_gender_agreement,True,True,False,False,417,-29.17919921875,-30.569332122802734,1
Tara could scare herself.,Tara could scare himself.,morphology,anaphor_agreement,anaphor_gender_agreement,True,True,False,False,418,-33.07319641113281,-31.826196670532227,0
Bill hires himself.,Bill hires herself.,morphology,anaphor_agreement,anaphor_gender_agreement,True,True,False,False,419,-21.940027236938477,-23.661046981811523,1
Matt found himself.,Matt found herself.,morphology,anaphor_agreement,anaphor_gender_agreement,True,True,False,False,420,-14.361706733703613,-15.817599296569824,1
Travis listened to himself.,Travis listened to itself.,morphology,anaphor_agreement,anaphor_gender_agreement,True,True,False,False,421,-30.810604095458984,-34.13479995727539,1
Kayla forgot herself.,Kayla forgot itself.,morphology,anaphor_agreement,anaphor_gender_agreement,True,True,False,False,422,-28.2833251953125,-30.66787338256836,1
Noah hides himself.,Noah hides herself.,morphology,anaphor_agreement,anaphor_gender_agreement,True,True,False,False,423,-31.59662628173828,-32.50161361694336,1
Dan cured himself.,Dan cured herself.,morphology,anaphor_agreement,anaphor_gender_agreement,True,True,False,False,424,-21.447023391723633,-22.98073959350586,1
Spain was scaring itself.,Spain was scaring herself.,morphology,anaphor_agreement,anaphor_gender_agreement,True,True,False,False,425,-29.2479248046875,-27.68941879272461,0
The library couldn't aggravate itself.,The library couldn't aggravate himself.,morphology,anaphor_agreement,anaphor_gender_agreement,True,True,False,False,426,-44.07475662231445,-43.70783233642578,0
Catherine isn't confusing herself.,Catherine isn't confusing itself.,morphology,anaphor_agreement,anaphor_gender_agreement,True,True,False,False,427,-37.98625946044922,-37.745948791503906,0
Adam doesn't escape from himself.,Adam doesn't escape from herself.,morphology,anaphor_agreement,anaphor_gender_agreement,True,True,False,False,428,-29.883861541748047,-31.075824737548828,1
Steven was impressing himself.,Steven was impressing herself.,morphology,anaphor_agreement,anaphor_gender_agreement,True,True,False,False,429,-27.888336181640625,-29.768932342529297,1
Rebecca has visited herself.,Rebecca has visited itself.,morphology,anaphor_agreement,anaphor_gender_agreement,True,True,False,False,430,-35.573429107666016,-35.35504913330078,0
Todd doesn't see himself.,Todd doesn't see itself.,morphology,anaphor_agreement,anaphor_gender_agreement,True,True,False,False,431,-22.387741088867188,-23.525407791137695,1
Barbara is noticing herself.,Barbara is noticing himself.,morphology,anaphor_agreement,anaphor_gender_agreement,True,True,False,False,432,-31.60455322265625,-30.686445236206055,0
Bruce hasn't irritated himself.,Bruce hasn't irritated herself.,morphology,anaphor_agreement,anaphor_gender_agreement,True,True,False,False,433,-31.194988250732422,-31.862201690673828,1
