sentence_good,sentence_bad,field,linguistics_term,UID,simple_LM_method,one_prefix_method,two_prefix_method,lexically_identical,pair_id,good_prob,bad_prob,correct
Mark figured out that most governments appreciate Steve.,Mark figured out who most governments appreciate Steve.,syntax,filler_gap_dependency,wh_vs_that_no_gap,True,False,False,False,0,-54.67194366455078,-58.215110778808594,1
Danielle finds out that many organizations have alarmed Chad.,Danielle finds out who many organizations have alarmed Chad.,syntax,filler_gap_dependency,wh_vs_that_no_gap,True,False,False,False,1,-66.349609375,-71.68041229248047,1
Veronica investigated that students might remember Julie.,Veronica investigated who students might remember Julie.,syntax,filler_gap_dependency,wh_vs_that_no_gap,True,False,False,False,2,-66.00585174560547,-70.03028869628906,1
The Impressionists learn that some stories can't sound like Carl.,The Impressionists learn who some stories can't sound like Carl.,syntax,filler_gap_dependency,wh_vs_that_no_gap,True,False,False,False,3,-76.4004898071289,-82.49163818359375,1
The waiters learn that most guests wouldn't have every hospital.,The waiters learn what most guests wouldn't have every hospital.,syntax,filler_gap_dependency,wh_vs_that_no_gap,True,False,False,False,4,-70.95924377441406,-71.50184631347656,1
Some girls revealed that all waitresses hadn't cleaned the cup.,Some girls revealed what all waitresses hadn't cleaned the cup.,syntax,filler_gap_dependency,wh_vs_that_no_gap,True,False,False,False,5,-79.51803588867188,-84.35853576660156,1
Sandra was figuring out that these guys saw Douglas.,Sandra was figuring out who these guys saw Douglas.,syntax,filler_gap_dependency,wh_vs_that_no_gap,True,False,False,False,6,-63.84089660644531,-65.64653015136719,1
The Lutherans know that some fungi were alarming that association.,The Lutherans know what some fungi were alarming that association.,syntax,filler_gap_dependency,wh_vs_that_no_gap,True,False,False,False,7,-81.21387481689453,-85.92214965820312,1
Carmen finds out that the customers have run around many cafes.,Carmen finds out what the customers have run around many cafes.,syntax,filler_gap_dependency,wh_vs_that_no_gap,True,False,False,False,8,-79.14869689941406,-78.82144165039062,0
Carrie should find out that some cart disturbs Nancy.,Carrie should find out who some cart disturbs Nancy.,syntax,filler_gap_dependency,wh_vs_that_no_gap,True,False,False,False,9,-76.2577133178711,-78.3543930053711,1
Deborah has forgotten that the offspring ran around the mountains.,Deborah has forgotten what the offspring ran around the mountains.,syntax,filler_gap_dependency,wh_vs_that_no_gap,True,False,False,False,10,-66.24923706054688,-66.81565856933594,1
Katherine found out that that cashier didn't sell some ice cream.,Katherine found out what that cashier didn't sell some ice cream.,syntax,filler_gap_dependency,wh_vs_that_no_gap,True,False,False,False,11,-78.360107421875,-79.11740112304688,1
Connie forgot that the woman doesn't describe some stories.,Connie forgot what the woman doesn't describe some stories.,syntax,filler_gap_dependency,wh_vs_that_no_gap,True,False,False,False,12,-66.15663146972656,-66.56111907958984,1
Randolf has found out that a lot of adults aren't working with these teenagers.,Randolf has found out who a lot of adults aren't working with these teenagers.,syntax,filler_gap_dependency,wh_vs_that_no_gap,True,False,False,False,13,-77.120849609375,-83.99015045166016,1
Rebecca has forgotten that a pepper upset Ronald.,Rebecca has forgotten who a pepper upset Ronald.,syntax,filler_gap_dependency,wh_vs_that_no_gap,True,False,False,False,14,-77.3692626953125,-82.7236328125,1
Margaret knows that all octopi have descended some slopes.,Margaret knows what all octopi have descended some slopes.,syntax,filler_gap_dependency,wh_vs_that_no_gap,True,False,False,False,15,-85.72711181640625,-89.58970642089844,1
Denise does realize that every car isn't shocking Susan.,Denise does realize who every car isn't shocking Susan.,syntax,filler_gap_dependency,wh_vs_that_no_gap,True,False,False,False,16,-72.0399169921875,-79.48629760742188,1
These museums might realize that many senators drove to art galleries.,These museums might realize what many senators drove to art galleries.,syntax,filler_gap_dependency,wh_vs_that_no_gap,True,False,False,False,17,-72.13660430908203,-75.13948822021484,1
Katherine figured out that this bird confused Helen.,Katherine figured out who this bird confused Helen.,syntax,filler_gap_dependency,wh_vs_that_no_gap,True,False,False,False,18,-64.28030395507812,-68.95592498779297,1
Paula figured out that all men resemble this print.,Paula figured out what all men resemble this print.,syntax,filler_gap_dependency,wh_vs_that_no_gap,True,False,False,False,19,-60.394866943359375,-61.7761116027832,1
Alicia hadn't known that that customer is going to that bank.,Alicia hadn't known what that customer is going to that bank.,syntax,filler_gap_dependency,wh_vs_that_no_gap,True,False,False,False,20,-74.90045166015625,-74.31620788574219,0
Students reveal that the spinach had alarmed William.,Students reveal who the spinach had alarmed William.,syntax,filler_gap_dependency,wh_vs_that_no_gap,True,False,False,False,21,-62.22464370727539,-67.5987319946289,1
Natalie investigated that a teenager has aggravated Diane.,Natalie investigated who a teenager has aggravated Diane.,syntax,filler_gap_dependency,wh_vs_that_no_gap,True,False,False,False,22,-68.61637878417969,-75.26958465576172,1
Cheryl was investigating that every guest hadn't exited some banks.,Cheryl was investigating what every guest hadn't exited some banks.,syntax,filler_gap_dependency,wh_vs_that_no_gap,True,False,False,False,23,-92.22470092773438,-94.27680206298828,1
Many senators figure out that those waiters argue about Steve.,Many senators figure out who those waiters argue about Steve.,syntax,filler_gap_dependency,wh_vs_that_no_gap,True,False,False,False,24,-73.1800765991211,-77.16009521484375,1
Many libraries weren't concealing that the dancers arrive at the public park.,Many libraries weren't concealing what the dancers arrive at the public park.,syntax,filler_gap_dependency,wh_vs_that_no_gap,True,False,False,False,25,-85.64388275146484,-86.66067504882812,1
Sandra remembers that a lot of men will find most lakes.,Sandra remembers what a lot of men will find most lakes.,syntax,filler_gap_dependency,wh_vs_that_no_gap,True,False,False,False,26,-69.79155731201172,-71.47232818603516,1
Candice hadn't discovered that a pedestrian bored Martha.,Candice hadn't discovered who a pedestrian bored Martha.,syntax,filler_gap_dependency,wh_vs_that_no_gap,True,False,False,False,27,-71.3116226196289,-78.05961608886719,1
Anna has known that this adult had dropped by a cafe.,Anna has known what this adult had dropped by a cafe.,syntax,filler_gap_dependency,wh_vs_that_no_gap,True,False,False,False,28,-64.61641693115234,-65.37325286865234,1
Larry didn't find out that many eyes distract Alicia.,Larry didn't find out who many eyes distract Alicia.,syntax,filler_gap_dependency,wh_vs_that_no_gap,True,False,False,False,29,-66.64417266845703,-68.04714965820312,1
Tina figures out that most customers could boycott this museum.,Tina figures out what most customers could boycott this museum.,syntax,filler_gap_dependency,wh_vs_that_no_gap,True,False,False,False,30,-74.18739318847656,-74.70547485351562,1
A lot of committees would investigate that some guy wasn't breaking a lot of skateboards.,A lot of committees would investigate what some guy wasn't breaking a lot of skateboards.,syntax,filler_gap_dependency,wh_vs_that_no_gap,True,False,False,False,31,-94.35313415527344,-94.79054260253906,1
Tina had forgotten that a teacher escaped from Ellen.,Tina had forgotten who a teacher escaped from Ellen.,syntax,filler_gap_dependency,wh_vs_that_no_gap,True,False,False,False,32,-64.03072357177734,-69.89703369140625,1
The museums know that some alumnus does scan the play.,The museums know what some alumnus does scan the play.,syntax,filler_gap_dependency,wh_vs_that_no_gap,True,False,False,False,33,-73.01655578613281,-75.843505859375,1
Omar knows that the dancer has broken that window.,Omar knows what the dancer has broken that window.,syntax,filler_gap_dependency,wh_vs_that_no_gap,True,False,False,False,34,-67.02489471435547,-68.51232147216797,1
Phillip knew that most teachers concealed Tonya.,Phillip knew who most teachers concealed Tonya.,syntax,filler_gap_dependency,wh_vs_that_no_gap,True,False,False,False,35,-67.17228698730469,-72.01577758789062,1
Rodney forgot that those actresses run around every hospital.,Rodney forgot what those actresses run around every hospital.,syntax,filler_gap_dependency,wh_vs_that_no_gap,True,False,False,False,36,-72.05841064453125,-72.96068572998047,1
Many dancers investigate that that hamster doesn't embarrass all waiters.,Many dancers investigate who that hamster doesn't embarrass all waiters.,syntax,filler_gap_dependency,wh_vs_that_no_gap,True,False,False,False,37,-92.54142761230469,-94.7607421875,1
These drivers realized that these museums hadn't worked with Carmen.,These drivers realized who these museums hadn't worked with Carmen.,syntax,filler_gap_dependency,wh_vs_that_no_gap,True,False,False,False,38,-74.37122344970703,-81.61396026611328,1
Jerry can't figure out that this driver appreciates Craig.,Jerry can't figure out who this driver appreciates Craig.,syntax,filler_gap_dependency,wh_vs_that_no_gap,True,False,False,False,39,-61.50152587890625,-62.56895065307617,1
Laurie found out that the drivers weren't lifting eggplants.,Laurie found out what the drivers weren't lifting eggplants.,syntax,filler_gap_dependency,wh_vs_that_no_gap,True,False,False,False,40,-82.2898941040039,-83.51133728027344,1
The governments haven't investigated that some chairs disgust April.,The governments haven't investigated who some chairs disgust April.,syntax,filler_gap_dependency,wh_vs_that_no_gap,True,False,False,False,41,-86.53282165527344,-91.21167755126953,1
Eric wasn't concealing that a lot of senators resembled a lot of sketches.,Eric wasn't concealing what a lot of senators resembled a lot of sketches.,syntax,filler_gap_dependency,wh_vs_that_no_gap,True,False,False,False,42,-83.1793212890625,-83.21736145019531,1
This organization isn't figuring out that a man questions the guests.,This organization isn't figuring out who a man questions the guests.,syntax,filler_gap_dependency,wh_vs_that_no_gap,True,False,False,False,43,-73.42660522460938,-74.94032287597656,1
Kevin realizes that a lot of patients descend a lot of stairs.,Kevin realizes what a lot of patients descend a lot of stairs.,syntax,filler_gap_dependency,wh_vs_that_no_gap,True,False,False,False,44,-60.595333099365234,-64.50196838378906,1
Some libraries were discovering that that man criticized Katherine.,Some libraries were discovering who that man criticized Katherine.,syntax,filler_gap_dependency,wh_vs_that_no_gap,True,False,False,False,45,-69.25654602050781,-72.96685791015625,1
That customer was investigating that the legislatures would criticize Andrea.,That customer was investigating who the legislatures would criticize Andrea.,syntax,filler_gap_dependency,wh_vs_that_no_gap,True,False,False,False,46,-73.21515655517578,-77.78395080566406,1
Christina isn't discovering that every man can tour a lot of grocery stores.,Christina isn't discovering what every man can tour a lot of grocery stores.,syntax,filler_gap_dependency,wh_vs_that_no_gap,True,False,False,False,47,-74.38278198242188,-78.31361389160156,1
The schools know that some cilantro had alarmed a child.,The schools know who some cilantro had alarmed a child.,syntax,filler_gap_dependency,wh_vs_that_no_gap,True,False,False,False,48,-70.45370483398438,-75.58502960205078,1
Tammy would learn that that driver couldn't conceal all skirts.,Tammy would learn what that driver couldn't conceal all skirts.,syntax,filler_gap_dependency,wh_vs_that_no_gap,True,False,False,False,49,-83.85099029541016,-83.12236022949219,0
Chad learned that all children talk to Jessica.,Chad learned who all children talk to Jessica.,syntax,filler_gap_dependency,wh_vs_that_no_gap,True,False,False,False,50,-54.13544464111328,-61.67828369140625,1
Those museums realize that that pedestrian does help Theodore.,Those museums realize who that pedestrian does help Theodore.,syntax,filler_gap_dependency,wh_vs_that_no_gap,True,False,False,False,51,-77.80793762207031,-84.58634185791016,1
Cynthia has figured out that an alumnus attacks Bradley.,Cynthia has figured out who an alumnus attacks Bradley.,syntax,filler_gap_dependency,wh_vs_that_no_gap,True,False,False,False,52,-78.54499053955078,-81.85939025878906,1
This school conceals that all men are disagreeing with those customers.,This school conceals who all men are disagreeing with those customers.,syntax,filler_gap_dependency,wh_vs_that_no_gap,True,False,False,False,53,-76.97415161132812,-82.4461669921875,1
Peter knew that all children weren't fixing chairs.,Peter knew what all children weren't fixing chairs.,syntax,filler_gap_dependency,wh_vs_that_no_gap,True,False,False,False,54,-55.621124267578125,-60.60943603515625,1
Amanda did remember that these patients can't care for Melissa.,Amanda did remember who these patients can't care for Melissa.,syntax,filler_gap_dependency,wh_vs_that_no_gap,True,False,False,False,55,-66.124267578125,-74.23922729492188,1
These doctors have revealed that most ladies would heal Brad.,These doctors have revealed who most ladies would heal Brad.,syntax,filler_gap_dependency,wh_vs_that_no_gap,True,False,False,False,56,-68.228515625,-76.86051940917969,1
Christopher concealed that that boy discusses many movies.,Christopher concealed what that boy discusses many movies.,syntax,filler_gap_dependency,wh_vs_that_no_gap,True,False,False,False,57,-66.87771606445312,-67.24380493164062,1
Rachelle remembered that the man could complain about Christine.,Rachelle remembered who the man could complain about Christine.,syntax,filler_gap_dependency,wh_vs_that_no_gap,True,False,False,False,58,-56.5797004699707,-63.95155334472656,1
Those men investigate that this teacher attacks Tamara.,Those men investigate who this teacher attacks Tamara.,syntax,filler_gap_dependency,wh_vs_that_no_gap,True,False,False,False,59,-63.96128845214844,-67.46296691894531,1
Jennifer hadn't learned that dancers had hurt this woman.,Jennifer hadn't learned who dancers had hurt this woman.,syntax,filler_gap_dependency,wh_vs_that_no_gap,True,False,False,False,60,-62.55842590332031,-69.04766845703125,1
Martha does realize that the boys hadn't thought about Gregory.,Martha does realize who the boys hadn't thought about Gregory.,syntax,filler_gap_dependency,wh_vs_that_no_gap,True,False,False,False,61,-71.18850708007812,-78.29138946533203,1
Amelia should remember that that patient wouldn't examine books.,Amelia should remember what that patient wouldn't examine books.,syntax,filler_gap_dependency,wh_vs_that_no_gap,True,False,False,False,62,-76.21786499023438,-77.82841491699219,1
Every museum hasn't remembered that every waitress will hug Pamela.,Every museum hasn't remembered who every waitress will hug Pamela.,syntax,filler_gap_dependency,wh_vs_that_no_gap,True,False,False,False,63,-78.20329284667969,-85.68209075927734,1
Some student had revealed that a lady isn't climbing down many hills.,Some student had revealed what a lady isn't climbing down many hills.,syntax,filler_gap_dependency,wh_vs_that_no_gap,True,False,False,False,64,-78.71456909179688,-82.1260986328125,1
Lisa did investigate that most ladies won't notice those customers.,Lisa did investigate who most ladies won't notice those customers.,syntax,filler_gap_dependency,wh_vs_that_no_gap,True,False,False,False,65,-73.919921875,-79.22327423095703,1
Cashiers forget that these waiters complain about Irene.,Cashiers forget who these waiters complain about Irene.,syntax,filler_gap_dependency,wh_vs_that_no_gap,True,False,False,False,66,-66.74708557128906,-71.78126525878906,1
A lot of patients figure out that this casserole hasn't impressed Jill.,A lot of patients figure out who this casserole hasn't impressed Jill.,syntax,filler_gap_dependency,wh_vs_that_no_gap,True,False,False,False,67,-81.79039764404297,-83.97623443603516,1
Daniel would find out that senators returned to this dancer.,Daniel would find out who senators returned to this dancer.,syntax,filler_gap_dependency,wh_vs_that_no_gap,True,False,False,False,68,-65.09093475341797,-64.42532348632812,0
Jill realizes that many children lift this face.,Jill realizes what many children lift this face.,syntax,filler_gap_dependency,wh_vs_that_no_gap,True,False,False,False,69,-59.79833984375,-63.01544189453125,1
This legislature revealed that a lot of women aggravate Sarah.,This legislature revealed who a lot of women aggravate Sarah.,syntax,filler_gap_dependency,wh_vs_that_no_gap,True,False,False,False,70,-66.36087036132812,-76.26837158203125,1
Guy figures out that the children think about Spain.,Guy figures out what the children think about Spain.,syntax,filler_gap_dependency,wh_vs_that_no_gap,True,False,False,False,71,-51.112388610839844,-49.780006408691406,0
Kendra concealed that these doctors shouldn't discuss Florence.,Kendra concealed who these doctors shouldn't discuss Florence.,syntax,filler_gap_dependency,wh_vs_that_no_gap,True,False,False,False,72,-82.29553985595703,-88.24807739257812,1
Rachelle had revealed that many legislatures praise Colleen.,Rachelle had revealed who many legislatures praise Colleen.,syntax,filler_gap_dependency,wh_vs_that_no_gap,True,False,False,False,73,-67.21756744384766,-75.90036010742188,1
Cynthia is realizing that some pedestrians ascended hills.,Cynthia is realizing what some pedestrians ascended hills.,syntax,filler_gap_dependency,wh_vs_that_no_gap,True,False,False,False,74,-76.1234130859375,-82.20669555664062,1
All men figure out that every boy sees Laurie.,All men figure out who every boy sees Laurie.,syntax,filler_gap_dependency,wh_vs_that_no_gap,True,False,False,False,75,-57.95118713378906,-61.45648193359375,1
Janice will know that pedestrians exited this public park.,Janice will know what pedestrians exited this public park.,syntax,filler_gap_dependency,wh_vs_that_no_gap,True,False,False,False,76,-65.73356628417969,-68.56775665283203,1
Melanie had learned that all drivers hug Cynthia.,Melanie had learned who all drivers hug Cynthia.,syntax,filler_gap_dependency,wh_vs_that_no_gap,True,False,False,False,77,-70.88211822509766,-78.11526489257812,1
Ellen finds out that the patient respects Raymond.,Ellen finds out who the patient respects Raymond.,syntax,filler_gap_dependency,wh_vs_that_no_gap,True,False,False,False,78,-58.88994598388672,-63.88032531738281,1
Meredith shouldn't discover that banks aggravated every student.,Meredith shouldn't discover who banks aggravated every student.,syntax,filler_gap_dependency,wh_vs_that_no_gap,True,False,False,False,79,-78.94799041748047,-80.09825134277344,1
Angela isn't revealing that a lot of waitresses were buying that skirt.,Angela isn't revealing what a lot of waitresses were buying that skirt.,syntax,filler_gap_dependency,wh_vs_that_no_gap,True,False,False,False,80,-93.95050811767578,-93.76395416259766,0
The Impressionists remember that that patient revealed Suzanne.,The Impressionists remember who that patient revealed Suzanne.,syntax,filler_gap_dependency,wh_vs_that_no_gap,True,False,False,False,81,-72.64201354980469,-77.76023864746094,1
Lucille isn't concealing that the unicycles bore Valerie.,Lucille isn't concealing who the unicycles bore Valerie.,syntax,filler_gap_dependency,wh_vs_that_no_gap,True,False,False,False,82,-90.78584289550781,-97.15428161621094,1
Those women remember that this girl explored some cafes.,Those women remember what this girl explored some cafes.,syntax,filler_gap_dependency,wh_vs_that_no_gap,True,False,False,False,83,-59.298065185546875,-62.759986877441406,1
Ella remembers that this offspring had visited Lissa.,Ella remembers who this offspring had visited Lissa.,syntax,filler_gap_dependency,wh_vs_that_no_gap,True,False,False,False,84,-72.49300384521484,-77.4090805053711,1
Those museums find out that some pedestrian cured Bill.,Those museums find out who some pedestrian cured Bill.,syntax,filler_gap_dependency,wh_vs_that_no_gap,True,False,False,False,85,-72.89334869384766,-75.96292114257812,1
Alan hadn't forgotten that these cashiers return to Alice.,Alan hadn't forgotten who these cashiers return to Alice.,syntax,filler_gap_dependency,wh_vs_that_no_gap,True,False,False,False,86,-64.74398040771484,-70.853759765625,1
Laura wouldn't remember that that alumnus did explore that cafe.,Laura wouldn't remember what that alumnus did explore that cafe.,syntax,filler_gap_dependency,wh_vs_that_no_gap,True,False,False,False,87,-77.0128173828125,-76.372314453125,0
Governments learn that this convertible will embarrass that university.,Governments learn what this convertible will embarrass that university.,syntax,filler_gap_dependency,wh_vs_that_no_gap,True,False,False,False,88,-80.18507385253906,-79.29729461669922,0
Becky has forgotten that a lot of universities had upset Carol.,Becky has forgotten who a lot of universities had upset Carol.,syntax,filler_gap_dependency,wh_vs_that_no_gap,True,False,False,False,89,-75.05220031738281,-81.51571655273438,1
All cashiers learn that the customers worried William.,All cashiers learn who the customers worried William.,syntax,filler_gap_dependency,wh_vs_that_no_gap,True,False,False,False,90,-70.87677764892578,-75.73764038085938,1
Regina finds out that those museums talk about waiters.,Regina finds out who those museums talk about waiters.,syntax,filler_gap_dependency,wh_vs_that_no_gap,True,False,False,False,91,-70.8436279296875,-77.35116577148438,1
The companies learn that many fish hadn't embarrassed Randolf.,The companies learn who many fish hadn't embarrassed Randolf.,syntax,filler_gap_dependency,wh_vs_that_no_gap,True,False,False,False,92,-88.91947937011719,-94.01740264892578,1
Women discover that most actors were complaining about Victoria.,Women discover who most actors were complaining about Victoria.,syntax,filler_gap_dependency,wh_vs_that_no_gap,True,False,False,False,93,-59.24675750732422,-64.15438842773438,1
Most cashiers remember that the guys won't ascend some slope.,Most cashiers remember what the guys won't ascend some slope.,syntax,filler_gap_dependency,wh_vs_that_no_gap,True,False,False,False,94,-78.4520263671875,-84.13006591796875,1
Julia would investigate that a man wasn't leaving Marcus.,Julia would investigate who a man wasn't leaving Marcus.,syntax,filler_gap_dependency,wh_vs_that_no_gap,True,False,False,False,95,-69.20600891113281,-73.73676300048828,1
Janice did discover that many children love Lori.,Janice did discover who many children love Lori.,syntax,filler_gap_dependency,wh_vs_that_no_gap,True,False,False,False,96,-58.48970413208008,-64.07644653320312,1
Bill hadn't discovered that that person researched this grocery store.,Bill hadn't discovered what that person researched this grocery store.,syntax,filler_gap_dependency,wh_vs_that_no_gap,True,False,False,False,97,-65.32495880126953,-65.80355072021484,1
Some pedestrians will realize that a lot of actresses have investigated Barbara.,Some pedestrians will realize who a lot of actresses have investigated Barbara.,syntax,filler_gap_dependency,wh_vs_that_no_gap,True,False,False,False,98,-79.9816665649414,-85.6964111328125,1
Melanie couldn't reveal that a lot of teenagers wouldn't wear a coat.,Melanie couldn't reveal what a lot of teenagers wouldn't wear a coat.,syntax,filler_gap_dependency,wh_vs_that_no_gap,True,False,False,False,99,-73.67903137207031,-75.0942153930664,1
Jason discovered that this woman hasn't returned to Raymond.,Jason discovered who this woman hasn't returned to Raymond.,syntax,filler_gap_dependency,wh_vs_that_no_gap,True,False,False,False,100,-53.32188415527344,-61.496734619140625,1
These boys learn that a bank criticizes Susan.,These boys learn who a bank criticizes Susan.,syntax,filler_gap_dependency,wh_vs_that_no_gap,True,False,False,False,101,-62.038726806640625,-67.6567611694336,1
Craig wouldn't conceal that these guys go to most lakes.,Craig wouldn't conceal what these guys go to most lakes.,syntax,filler_gap_dependency,wh_vs_that_no_gap,True,False,False,False,102,-69.16854858398438,-67.9959945678711,0
Cheryl didn't forget that that offspring wouldn't cure Sara.,Cheryl didn't forget who that offspring wouldn't cure Sara.,syntax,filler_gap_dependency,wh_vs_that_no_gap,True,False,False,False,103,-86.98221588134766,-88.83493041992188,1
Liam is discovering that a lot of offspring criticize some students.,Liam is discovering who a lot of offspring criticize some students.,syntax,filler_gap_dependency,wh_vs_that_no_gap,True,False,False,False,104,-76.84584045410156,-82.26533508300781,1
The Impressionists realized that some women descended those steps.,The Impressionists realized what some women descended those steps.,syntax,filler_gap_dependency,wh_vs_that_no_gap,True,False,False,False,105,-67.94281005859375,-72.56594848632812,1
Dennis doesn't forget that this customer can't bike to Spain.,Dennis doesn't forget what this customer can't bike to Spain.,syntax,filler_gap_dependency,wh_vs_that_no_gap,True,False,False,False,106,-75.56072998046875,-77.29582214355469,1
Brett remembers that most doctors respect the doctor.,Brett remembers who most doctors respect the doctor.,syntax,filler_gap_dependency,wh_vs_that_no_gap,True,False,False,False,107,-57.711700439453125,-63.31991958618164,1
These ladies figure out that some customer was hiring Laura.,These ladies figure out who some customer was hiring Laura.,syntax,filler_gap_dependency,wh_vs_that_no_gap,True,False,False,False,108,-65.445068359375,-68.56753540039062,1
