sentence_good,sentence_bad,field,linguistics_term,UID,simple_LM_method,one_prefix_method,two_prefix_method,lexically_identical,pair_id,good_prob,bad_prob,correct
Most actresses flee from themselves.,Most actresses flee from herself.,morphology,anaphor_agreement,anaphor_number_agreement,True,True,False,True,277,-40.944236755371094,-42.86212158203125,1
Gina is listening to herself.,Gina is listening to themselves.,morphology,anaphor_agreement,anaphor_number_agreement,True,True,False,True,278,-29.556690216064453,-31.0773868560791,1
The Impressionists distracted themselves.,The Impressionists distracted himself.,morphology,anaphor_agreement,anaphor_number_agreement,True,True,False,True,279,-53.66650390625,-53.92173767089844,1
Ann hasn't bothered herself.,Ann hasn't bothered themselves.,morphology,anaphor_agreement,anaphor_number_agreement,True,True,False,True,280,-28.888994216918945,-28.517528533935547,0
Samuel hadn't hated himself.,Samuel hadn't hated themselves.,morphology,anaphor_agreement,anaphor_number_agreement,True,True,False,True,281,-37.927642822265625,-39.131744384765625,1
The cashiers shouldn't worry themselves.,The cashiers shouldn't worry itself.,morphology,anaphor_agreement,anaphor_number_agreement,True,True,False,True,282,-48.048118591308594,-48.56098556518555,1
The Borgias have talked about themselves.,The Borgias have talked about himself.,morphology,anaphor_agreement,anaphor_number_agreement,True,True,False,True,283,-45.590606689453125,-45.02461242675781,0
James isn't watching himself.,James isn't watching themselves.,morphology,anaphor_agreement,anaphor_number_agreement,True,True,False,True,284,-24.10628890991211,-27.054967880249023,1
Ruth wasn't discussing herself.,Ruth wasn't discussing themselves.,morphology,anaphor_agreement,anaphor_number_agreement,True,True,False,True,285,-36.95896911621094,-35.427207946777344,0
All doctors discover themselves.,All doctors discover itself.,morphology,anaphor_agreement,anaphor_number_agreement,True,True,False,True,286,-33.03765106201172,-34.30686950683594,1
The doctors described themselves.,The doctors described itself.,morphology,anaphor_agreement,anaphor_number_agreement,True,True,False,True,287,-29.16903305053711,-30.28310775756836,1
All waitresses hurt themselves.,All waitresses hurt herself.,morphology,anaphor_agreement,anaphor_number_agreement,True,True,False,True,288,-41.50168991088867,-41.3974723815918,0
Those children could think about themselves.,Those children could think about itself.,morphology,anaphor_agreement,anaphor_number_agreement,True,True,False,True,289,-32.031166076660156,-33.68705749511719,1
These senators had hated themselves.,These senators had hated herself.,morphology,anaphor_agreement,anaphor_number_agreement,True,True,False,True,290,-35.826881408691406,-37.28323745727539,1
Karen didn't heal herself.,Karen didn't heal themselves.,morphology,anaphor_agreement,anaphor_number_agreement,True,True,False,True,291,-33.39251708984375,-33.605308532714844,1
Linda does talk to herself.,Linda does talk to themselves.,morphology,anaphor_agreement,anaphor_number_agreement,True,True,False,True,292,-32.68534469604492,-35.53424835205078,1
Douglas is visiting himself.,Douglas is visiting themselves.,morphology,anaphor_agreement,anaphor_number_agreement,True,True,False,True,293,-33.507972717285156,-34.29139709472656,1
Todd has aggravated himself.,Todd has aggravated themselves.,morphology,anaphor_agreement,anaphor_number_agreement,True,True,False,True,294,-27.771223068237305,-27.25116729736328,0
Noah can't discover himself.,Noah can't discover themselves.,morphology,anaphor_agreement,anaphor_number_agreement,True,True,False,True,295,-34.82396697998047,-35.396034240722656,1
The organizations bother themselves.,The organizations bother herself.,morphology,anaphor_agreement,anaphor_number_agreement,True,True,False,True,296,-33.70960998535156,-34.91546630859375,1
Boys reference themselves.,Boys reference himself.,morphology,anaphor_agreement,anaphor_number_agreement,True,True,False,True,297,-35.49599075317383,-36.48173904418945,1
Daniel isn't revealing himself.,Daniel isn't revealing themselves.,morphology,anaphor_agreement,anaphor_number_agreement,True,True,False,True,298,-27.678611755371094,-28.940715789794922,1
Tracy hadn't described herself.,Tracy hadn't described themselves.,morphology,anaphor_agreement,anaphor_number_agreement,True,True,False,True,299,-39.54613494873047,-38.32365417480469,0
Tina wasn't curing herself.,Tina wasn't curing themselves.,morphology,anaphor_agreement,anaphor_number_agreement,True,True,False,True,300,-42.107513427734375,-41.827667236328125,0
All dancers have aggravated themselves.,All dancers have aggravated himself.,morphology,anaphor_agreement,anaphor_number_agreement,True,True,False,True,301,-40.38677215576172,-41.22600173950195,1
Cheryl does disgust herself.,Cheryl does disgust themselves.,morphology,anaphor_agreement,anaphor_number_agreement,True,True,False,True,302,-49.442142486572266,-48.71360397338867,0
These boys haven't attacked themselves.,These boys haven't attacked himself.,morphology,anaphor_agreement,anaphor_number_agreement,True,True,False,True,303,-35.666778564453125,-33.758995056152344,0
Steven was hiding himself.,Steven was hiding themselves.,morphology,anaphor_agreement,anaphor_number_agreement,True,True,False,True,304,-21.471939086914062,-22.69774627685547,1
Amelia should notice herself.,Amelia should notice themselves.,morphology,anaphor_agreement,anaphor_number_agreement,True,True,False,True,305,-36.629966735839844,-35.258644104003906,0
Suzanne respected herself.,Suzanne respected themselves.,morphology,anaphor_agreement,anaphor_number_agreement,True,True,False,True,306,-37.42236328125,-35.678977966308594,0
Sarah had boasted about herself.,Sarah had boasted about themselves.,morphology,anaphor_agreement,anaphor_number_agreement,True,True,False,True,307,-30.263980865478516,-30.110933303833008,0
Many dancers are concealing themselves.,Many dancers are concealing itself.,morphology,anaphor_agreement,anaphor_number_agreement,True,True,False,True,308,-42.28589630126953,-43.943580627441406,1
April attacked herself.,April attacked themselves.,morphology,anaphor_agreement,anaphor_number_agreement,True,True,False,True,309,-21.546741485595703,-19.991436004638672,0
This man had worked with himself.,This man had worked with themselves.,morphology,anaphor_agreement,anaphor_number_agreement,True,True,False,True,310,-29.732250213623047,-31.65035057067871,1
The governments embarrassed themselves.,The governments embarrassed herself.,morphology,anaphor_agreement,anaphor_number_agreement,True,True,False,True,311,-33.557918548583984,-35.07201385498047,1
Most libraries are scaring themselves.,Most libraries are scaring himself.,morphology,anaphor_agreement,anaphor_number_agreement,True,True,False,True,312,-39.86408996582031,-39.316368103027344,0
Jill hadn't irritated herself.,Jill hadn't irritated themselves.,morphology,anaphor_agreement,anaphor_number_agreement,True,True,False,True,313,-39.39666748046875,-38.83232879638672,0
Helen praised herself.,Helen praised themselves.,morphology,anaphor_agreement,anaphor_number_agreement,True,True,False,True,314,-28.441810607910156,-27.77735710144043,0
Most pedestrians aren't referencing themselves.,Most pedestrians aren't referencing herself.,morphology,anaphor_agreement,anaphor_number_agreement,True,True,False,True,315,-47.972816467285156,-48.052330017089844,1
Some ladies do talk to themselves.,Some ladies do talk to itself.,morphology,anaphor_agreement,anaphor_number_agreement,True,True,False,True,316,-36.73126983642578,-37.34599304199219,1
Those pedestrians embarrassed themselves.,Those pedestrians embarrassed itself.,morphology,anaphor_agreement,anaphor_number_agreement,True,True,False,True,317,-34.71819305419922,-36.05957794189453,1
Mary has seen herself.,Mary has seen themselves.,morphology,anaphor_agreement,anaphor_number_agreement,True,True,False,True,318,-19.486175537109375,-19.623985290527344,1
The Impressionists haven't hurt themselves.,The Impressionists haven't hurt itself.,morphology,anaphor_agreement,anaphor_number_agreement,True,True,False,True,319,-57.44950866699219,-58.77596664428711,1
Some waitresses had sounded like themselves.,Some waitresses had sounded like itself.,morphology,anaphor_agreement,anaphor_number_agreement,True,True,False,True,320,-52.22007751464844,-54.0107307434082,1
That woman had criticized herself.,That woman had criticized themselves.,morphology,anaphor_agreement,anaphor_number_agreement,True,True,False,True,321,-34.533836364746094,-35.161373138427734,1
A lady hadn't worked with herself.,A lady hadn't worked with themselves.,morphology,anaphor_agreement,anaphor_number_agreement,True,True,False,True,322,-37.794517517089844,-38.543785095214844,1
Becky astounded herself.,Becky astounded themselves.,morphology,anaphor_agreement,anaphor_number_agreement,True,True,False,True,323,-33.57073974609375,-33.39524841308594,0
Some actors investigate themselves.,Some actors investigate himself.,morphology,anaphor_agreement,anaphor_number_agreement,True,True,False,True,324,-33.64820861816406,-33.708534240722656,1
Omar hated himself.,Omar hated themselves.,morphology,anaphor_agreement,anaphor_number_agreement,True,True,False,True,325,-31.750463485717773,-33.24767303466797,1
The cashiers astounded themselves.,The cashiers astounded itself.,morphology,anaphor_agreement,anaphor_number_agreement,True,True,False,True,326,-47.544105529785156,-48.62825012207031,1
Many teenagers distracted themselves.,Many teenagers distracted herself.,morphology,anaphor_agreement,anaphor_number_agreement,True,True,False,True,327,-33.982017517089844,-36.136924743652344,1
Janice will respect herself.,Janice will respect themselves.,morphology,anaphor_agreement,anaphor_number_agreement,True,True,False,True,328,-35.40534973144531,-34.434410095214844,0
A lot of women worry themselves.,A lot of women worry herself.,morphology,anaphor_agreement,anaphor_number_agreement,True,True,False,True,329,-40.20355224609375,-40.57311248779297,1
Derek should hug himself.,Derek should hug themselves.,morphology,anaphor_agreement,anaphor_number_agreement,True,True,False,True,330,-37.010032653808594,-39.262821197509766,1
A lot of people complain about themselves.,A lot of people complain about itself.,morphology,anaphor_agreement,anaphor_number_agreement,True,True,False,True,331,-37.52569580078125,-39.01679992675781,1
Jill thought about herself.,Jill thought about themselves.,morphology,anaphor_agreement,anaphor_number_agreement,True,True,False,True,332,-29.20975112915039,-29.57990074157715,1
The Lutherans could praise themselves.,The Lutherans could praise itself.,morphology,anaphor_agreement,anaphor_number_agreement,True,True,False,True,333,-46.2612419128418,-47.36552047729492,1
A lot of students astounded themselves.,A lot of students astounded itself.,morphology,anaphor_agreement,anaphor_number_agreement,True,True,False,True,334,-48.839874267578125,-50.132808685302734,1
Many teenagers describe themselves.,Many teenagers describe himself.,morphology,anaphor_agreement,anaphor_number_agreement,True,True,False,True,335,-31.42984390258789,-32.79003143310547,1
Anne will discover herself.,Anne will discover themselves.,morphology,anaphor_agreement,anaphor_number_agreement,True,True,False,True,336,-24.725141525268555,-22.929773330688477,0
These guests haven't approached themselves.,These guests haven't approached herself.,morphology,anaphor_agreement,anaphor_number_agreement,True,True,False,True,337,-39.566932678222656,-40.18250274658203,1
Carla annoyed herself.,Carla annoyed themselves.,morphology,anaphor_agreement,anaphor_number_agreement,True,True,False,True,338,-31.24176025390625,-30.608966827392578,0
Edward hasn't bothered himself.,Edward hasn't bothered themselves.,morphology,anaphor_agreement,anaphor_number_agreement,True,True,False,True,339,-28.043872833251953,-28.550785064697266,1
Matt isn't working with himself.,Matt isn't working with themselves.,morphology,anaphor_agreement,anaphor_number_agreement,True,True,False,True,340,-27.74007797241211,-29.028003692626953,1
Guy hadn't left himself.,Guy hadn't left themselves.,morphology,anaphor_agreement,anaphor_number_agreement,True,True,False,True,341,-23.795669555664062,-25.724552154541016,1
The children admired themselves.,The children admired itself.,morphology,anaphor_agreement,anaphor_number_agreement,True,True,False,True,342,-27.53680992126465,-28.74234390258789,1
Larry isn't healing himself.,Larry isn't healing themselves.,morphology,anaphor_agreement,anaphor_number_agreement,True,True,False,True,343,-30.326068878173828,-31.241313934326172,1
A lot of girls discover themselves.,A lot of girls discover itself.,morphology,anaphor_agreement,anaphor_number_agreement,True,True,False,True,344,-40.84558868408203,-42.8138427734375,1
The Clintons worry themselves.,The Clintons worry herself.,morphology,anaphor_agreement,anaphor_number_agreement,True,True,False,True,345,-40.00173568725586,-39.80158233642578,0
These teenagers alarm themselves.,These teenagers alarm itself.,morphology,anaphor_agreement,anaphor_number_agreement,True,True,False,True,346,-36.2318115234375,-35.17356872558594,0
Guy hadn't upset himself.,Guy hadn't upset themselves.,morphology,anaphor_agreement,anaphor_number_agreement,True,True,False,True,347,-27.415771484375,-28.804092407226562,1
A documentary isn't disagreeing with itself.,A documentary isn't disagreeing with themselves.,morphology,anaphor_agreement,anaphor_number_agreement,True,True,False,True,348,-51.81204605102539,-50.142616271972656,0
Veronica was healing herself.,Veronica was healing themselves.,morphology,anaphor_agreement,anaphor_number_agreement,True,True,False,True,349,-40.38459777832031,-37.95330047607422,0
Some pedestrians don't insult themselves.,Some pedestrians don't insult herself.,morphology,anaphor_agreement,anaphor_number_agreement,True,True,False,True,350,-41.671390533447266,-42.48451232910156,1
A lot of cashiers weren't boring themselves.,A lot of cashiers weren't boring herself.,morphology,anaphor_agreement,anaphor_number_agreement,True,True,False,True,351,-64.24220275878906,-64.59288024902344,1
Those dancers had approached themselves.,Those dancers had approached itself.,morphology,anaphor_agreement,anaphor_number_agreement,True,True,False,True,352,-38.22898864746094,-39.82612228393555,1
Some women will insult themselves.,Some women will insult itself.,morphology,anaphor_agreement,anaphor_number_agreement,True,True,False,True,353,-32.778324127197266,-34.028785705566406,1
Bruce found himself.,Bruce found themselves.,morphology,anaphor_agreement,anaphor_number_agreement,True,True,False,True,354,-15.181357383728027,-17.4213924407959,1
Timothy should cure himself.,Timothy should cure themselves.,morphology,anaphor_agreement,anaphor_number_agreement,True,True,False,True,355,-35.68115997314453,-36.67235565185547,1
Stacey was discovering herself.,Stacey was discovering themselves.,morphology,anaphor_agreement,anaphor_number_agreement,True,True,False,True,356,-37.48016357421875,-35.826236724853516,0
The Lutherans know themselves.,The Lutherans know himself.,morphology,anaphor_agreement,anaphor_number_agreement,True,True,False,True,357,-38.36624526977539,-38.101871490478516,0
A lot of drivers do boast about themselves.,A lot of drivers do boast about herself.,morphology,anaphor_agreement,anaphor_number_agreement,True,True,False,True,358,-55.46992492675781,-57.16196060180664,1
Roger kissed himself.,Roger kissed themselves.,morphology,anaphor_agreement,anaphor_number_agreement,True,True,False,True,359,-17.92278480529785,-20.337575912475586,1
Laurie has described herself.,Laurie has described themselves.,morphology,anaphor_agreement,anaphor_number_agreement,True,True,False,True,360,-37.88053894042969,-38.27581024169922,1
Deborah alarmed herself.,Deborah alarmed themselves.,morphology,anaphor_agreement,anaphor_number_agreement,True,True,False,True,361,-32.8574333190918,-33.0987548828125,1
Most girls complained about themselves.,Most girls complained about himself.,morphology,anaphor_agreement,anaphor_number_agreement,True,True,False,True,362,-33.187049865722656,-33.76323699951172,1
Waitresses aren't listening to themselves.,Waitresses aren't listening to itself.,morphology,anaphor_agreement,anaphor_number_agreement,True,True,False,True,363,-43.274539947509766,-44.107749938964844,1
Allison wasn't kissing herself.,Allison wasn't kissing themselves.,morphology,anaphor_agreement,anaphor_number_agreement,True,True,False,True,364,-37.382816314697266,-38.283565521240234,1
Melissa hadn't discussed herself.,Melissa hadn't discussed themselves.,morphology,anaphor_agreement,anaphor_number_agreement,True,True,False,True,365,-39.33000946044922,-38.34014129638672,0
These schools confuse themselves.,These schools confuse herself.,morphology,anaphor_agreement,anaphor_number_agreement,True,True,False,True,366,-31.62251091003418,-34.11235427856445,1
Kevin doesn't care for himself.,Kevin doesn't care for themselves.,morphology,anaphor_agreement,anaphor_number_agreement,True,True,False,True,367,-24.24652862548828,-25.48211097717285,1
Michael isn't astounding himself.,Michael isn't astounding themselves.,morphology,anaphor_agreement,anaphor_number_agreement,True,True,False,True,368,-29.39421272277832,-31.00253677368164,1
Many children talk to themselves.,Many children talk to himself.,morphology,anaphor_agreement,anaphor_number_agreement,True,True,False,True,369,-28.77037811279297,-26.593225479125977,0
Many women found themselves.,Many women found itself.,morphology,anaphor_agreement,anaphor_number_agreement,True,True,False,True,370,-23.272705078125,-25.17911148071289,1
Carlos did talk to himself.,Carlos did talk to themselves.,morphology,anaphor_agreement,anaphor_number_agreement,True,True,False,True,371,-31.09389877319336,-34.767791748046875,1
Heidi was stunning herself.,Heidi was stunning themselves.,morphology,anaphor_agreement,anaphor_number_agreement,True,True,False,True,372,-38.93918228149414,-37.869468688964844,0
Tracy hasn't stunned herself.,Tracy hasn't stunned themselves.,morphology,anaphor_agreement,anaphor_number_agreement,True,True,False,True,373,-40.07209014892578,-39.95802688598633,0
The Lutherans dislike themselves.,The Lutherans dislike itself.,morphology,anaphor_agreement,anaphor_number_agreement,True,True,False,True,374,-41.4553337097168,-42.552146911621094,1
Some men care for themselves.,Some men care for itself.,morphology,anaphor_agreement,anaphor_number_agreement,True,True,False,True,375,-31.805644989013672,-33.708770751953125,1
Many actors are boring themselves.,Many actors are boring himself.,morphology,anaphor_agreement,anaphor_number_agreement,True,True,False,True,376,-37.076507568359375,-38.079524993896484,1
Drivers loved themselves.,Drivers loved himself.,morphology,anaphor_agreement,anaphor_number_agreement,True,True,False,True,377,-28.98457145690918,-28.016395568847656,0
Melanie won't kiss herself.,Melanie won't kiss themselves.,morphology,anaphor_agreement,anaphor_number_agreement,True,True,False,True,378,-37.751155853271484,-38.84217834472656,1
Donald hired himself.,Donald hired themselves.,morphology,anaphor_agreement,anaphor_number_agreement,True,True,False,True,379,-18.87187385559082,-19.867231369018555,1
Carlos approached himself.,Carlos approached themselves.,morphology,anaphor_agreement,anaphor_number_agreement,True,True,False,True,380,-25.736778259277344,-27.225759506225586,1
Meredith was escaping from herself.,Meredith was escaping from themselves.,morphology,anaphor_agreement,anaphor_number_agreement,True,True,False,True,381,-42.30519104003906,-42.49504470825195,1
Stacy astounded herself.,Stacy astounded themselves.,morphology,anaphor_agreement,anaphor_number_agreement,True,True,False,True,382,-36.95454025268555,-36.5081672668457,0
The Clintons scared themselves.,The Clintons scared itself.,morphology,anaphor_agreement,anaphor_number_agreement,True,True,False,True,383,-39.72698211669922,-40.18780517578125,1
Customers would discuss themselves.,Customers would discuss itself.,morphology,anaphor_agreement,anaphor_number_agreement,True,True,False,True,384,-28.942062377929688,-29.471580505371094,1
An association impresses itself.,An association impresses themselves.,morphology,anaphor_agreement,anaphor_number_agreement,True,True,False,True,385,-39.89392852783203,-40.6943473815918,1
Those ladies weren't talking to themselves.,Those ladies weren't talking to itself.,morphology,anaphor_agreement,anaphor_number_agreement,True,True,False,True,386,-39.080909729003906,-40.191871643066406,1
Carl is admiring himself.,Carl is admiring themselves.,morphology,anaphor_agreement,anaphor_number_agreement,True,True,False,True,387,-27.596317291259766,-28.64684295654297,1
Sandra hid herself.,Sandra hid themselves.,morphology,anaphor_agreement,anaphor_number_agreement,True,True,False,True,388,-29.399795532226562,-30.09383773803711,1
Those actors can't question themselves.,Those actors can't question itself.,morphology,anaphor_agreement,anaphor_number_agreement,True,True,False,True,389,-36.57954788208008,-36.9943733215332,1
Jerry is finding himself.,Jerry is finding themselves.,morphology,anaphor_agreement,anaphor_number_agreement,True,True,False,True,390,-21.52475929260254,-21.769676208496094,1
Roger does complain about himself.,Roger does complain about themselves.,morphology,anaphor_agreement,anaphor_number_agreement,True,True,False,True,391,-27.214557647705078,-28.51388931274414,1
Amy has concealed herself.,Amy has concealed themselves.,morphology,anaphor_agreement,anaphor_number_agreement,True,True,False,True,392,-25.602989196777344,-23.668926239013672,0
Edward had distracted himself.,Edward had distracted themselves.,morphology,anaphor_agreement,anaphor_number_agreement,True,True,False,True,393,-24.72088623046875,-25.14312171936035,1
A lot of waitresses complained about themselves.,A lot of waitresses complained about himself.,morphology,anaphor_agreement,anaphor_number_agreement,True,True,False,True,394,-60.163028717041016,-59.2554931640625,0
Most customers won't hate themselves.,Most customers won't hate herself.,morphology,anaphor_agreement,anaphor_number_agreement,True,True,False,True,395,-39.26141357421875,-40.58041763305664,1
Candice liked herself.,Candice liked themselves.,morphology,anaphor_agreement,anaphor_number_agreement,True,True,False,True,396,-29.11992073059082,-28.704566955566406,0
Janet complained about herself.,Janet complained about themselves.,morphology,anaphor_agreement,anaphor_number_agreement,True,True,False,True,397,-31.728734970092773,-31.220073699951172,0
Maria was insulting herself.,Maria was insulting themselves.,morphology,anaphor_agreement,anaphor_number_agreement,True,True,False,True,398,-25.05189323425293,-24.958555221557617,0
All guys are approaching themselves.,All guys are approaching himself.,morphology,anaphor_agreement,anaphor_number_agreement,True,True,False,True,399,-29.84878158569336,-29.834726333618164,0
Most children admired themselves.,Most children admired himself.,morphology,anaphor_agreement,anaphor_number_agreement,True,True,False,True,400,-29.137836456298828,-28.89475440979004,0
A lot of committees have astounded themselves.,A lot of committees have astounded itself.,morphology,anaphor_agreement,anaphor_number_agreement,True,True,False,True,401,-54.448482513427734,-55.752891540527344,1
The Borgias investigated themselves.,The Borgias investigated herself.,morphology,anaphor_agreement,anaphor_number_agreement,True,True,False,True,402,-43.05625915527344,-44.58824157714844,1
Those men question themselves.,Those men question herself.,morphology,anaphor_agreement,anaphor_number_agreement,True,True,False,True,403,-29.751049041748047,-31.176456451416016,1
Charles isn't annoying himself.,Charles isn't annoying themselves.,morphology,anaphor_agreement,anaphor_number_agreement,True,True,False,True,404,-29.060195922851562,-29.971609115600586,1
Some guys were concealing themselves.,Some guys were concealing itself.,morphology,anaphor_agreement,anaphor_number_agreement,True,True,False,True,405,-41.323421478271484,-43.25429153442383,1
These guests weren't boring themselves.,These guests weren't boring herself.,morphology,anaphor_agreement,anaphor_number_agreement,True,True,False,True,406,-42.596641540527344,-43.01531982421875,1
Carla can talk to herself.,Carla can talk to themselves.,morphology,anaphor_agreement,anaphor_number_agreement,True,True,False,True,407,-30.235326766967773,-32.26844024658203,1
A lot of teenagers hadn't attacked themselves.,A lot of teenagers hadn't attacked himself.,morphology,anaphor_agreement,anaphor_number_agreement,True,True,False,True,408,-51.472389221191406,-50.4238166809082,0
Some lady couldn't return to herself.,Some lady couldn't return to themselves.,morphology,anaphor_agreement,anaphor_number_agreement,True,True,False,True,409,-37.34253692626953,-39.73844909667969,1
A lot of associations do upset themselves.,A lot of associations do upset himself.,morphology,anaphor_agreement,anaphor_number_agreement,True,True,False,True,410,-51.91838836669922,-51.859832763671875,0
Some boys weren't concealing themselves.,Some boys weren't concealing himself.,morphology,anaphor_agreement,anaphor_number_agreement,True,True,False,True,411,-44.94666290283203,-43.08409118652344,0
Peter worried himself.,Peter worried themselves.,morphology,anaphor_agreement,anaphor_number_agreement,True,True,False,True,412,-21.980571746826172,-21.96816062927246,0
Cindy does praise herself.,Cindy does praise themselves.,morphology,anaphor_agreement,anaphor_number_agreement,True,True,False,True,413,-40.64246368408203,-40.50096130371094,0
A book hasn't disagreed with itself.,A book hasn't disagreed with themselves.,morphology,anaphor_agreement,anaphor_number_agreement,True,True,False,True,414,-45.20299530029297,-43.647701263427734,0
