sentence_good,sentence_bad,field,linguistics_term,UID,simple_LM_method,one_prefix_method,two_prefix_method,lexically_identical,pair_id,good_prob,bad_prob,correct
Irene had messed up whose rug?,Whose had Irene messed up rug?,syntax,island_effects,left_branch_island_echo_question,True,False,True,True,0,-54.72929000854492,-61.43801498413086,1
Edward has returned to which customers?,Which has Edward returned to customers?,syntax,island_effects,left_branch_island_echo_question,True,False,True,True,1,-40.8310546875,-46.35457229614258,1
Holly is taking which blouse?,Which is Holly taking blouse?,syntax,island_effects,left_branch_island_echo_question,True,False,True,True,2,-46.870277404785156,-45.620750427246094,0
All women had known what teachers?,What had all women known teachers?,syntax,island_effects,left_branch_island_echo_question,True,False,True,True,3,-41.90888595581055,-46.621612548828125,1
That truck will hurt which senator?,Which will that truck hurt senator?,syntax,island_effects,left_branch_island_echo_question,True,False,True,True,4,-46.892921447753906,-49.1240119934082,1
Helen did drive to whose glacier?,Whose did Helen drive to glacier?,syntax,island_effects,left_branch_island_echo_question,True,False,True,True,5,-52.88591003417969,-58.174949645996094,1
Some documentary has disagreed with what commentaries?,What has some documentary disagreed with commentaries?,syntax,island_effects,left_branch_island_echo_question,True,False,True,True,6,-68.32337951660156,-68.72151184082031,1
Cheryl is selling what malls?,What is Cheryl selling malls?,syntax,island_effects,left_branch_island_echo_question,True,False,True,True,7,-58.361473083496094,-48.4140625,0
David would cure what snake?,What would David cure snake?,syntax,island_effects,left_branch_island_echo_question,True,False,True,True,8,-35.523582458496094,-44.58496856689453,1
Theresa did scare which men?,Which did Theresa scare men?,syntax,island_effects,left_branch_island_echo_question,True,False,True,True,9,-49.18290710449219,-42.20886993408203,0
Some chairs should embarrass what guys?,What should some chairs embarrass guys?,syntax,island_effects,left_branch_island_echo_question,True,False,True,True,10,-50.34812927246094,-51.19169998168945,1
This committee can shock which student?,Which can this committee shock student?,syntax,island_effects,left_branch_island_echo_question,True,False,True,True,11,-49.8508415222168,-49.32490921020508,0
Jane can discover whose dogs?,Whose can Jane discover dogs?,syntax,island_effects,left_branch_island_echo_question,True,False,True,True,12,-36.756568908691406,-54.3792839050293,1
Julia is boycotting what mountain?,What is Julia boycotting mountain?,syntax,island_effects,left_branch_island_echo_question,True,False,True,True,13,-53.40245819091797,-53.41162109375,1
Carla had argued about what series?,What had Carla argued about series?,syntax,island_effects,left_branch_island_echo_question,True,False,True,True,14,-51.636817932128906,-57.52093505859375,1
Amanda was investigating whose hospitals?,Whose was Amanda investigating hospitals?,syntax,island_effects,left_branch_island_echo_question,True,False,True,True,15,-47.9395751953125,-57.58501434326172,1
All actresses are exploring which college campus?,Which are all actresses exploring college campus?,syntax,island_effects,left_branch_island_echo_question,True,False,True,True,16,-62.606689453125,-61.81026840209961,0
Most schools have looked like what drawings?,What have most schools looked like drawings?,syntax,island_effects,left_branch_island_echo_question,True,False,True,True,17,-50.67218017578125,-53.486846923828125,1
April is talking about which movies?,Which is April talking about movies?,syntax,island_effects,left_branch_island_echo_question,True,False,True,True,18,-34.68871307373047,-36.67329788208008,1
Tara will fix whose skateboards?,Whose will Tara fix skateboards?,syntax,island_effects,left_branch_island_echo_question,True,False,True,True,19,-58.159637451171875,-68.6011962890625,1
Carla was lifting which pamphlet?,Which was Carla lifting pamphlet?,syntax,island_effects,left_branch_island_echo_question,True,False,True,True,20,-51.72382354736328,-55.11382293701172,1
A lot of hats do confuse whose committees?,Whose do a lot of hats confuse committees?,syntax,island_effects,left_branch_island_echo_question,True,False,True,True,21,-64.9891357421875,-65.50209045410156,1
Tina might boast about whose bases?,Whose might Tina boast about bases?,syntax,island_effects,left_branch_island_echo_question,True,False,True,True,22,-56.134761810302734,-63.905677795410156,1
A woman had concealed whose skateboards?,Whose had a woman concealed skateboards?,syntax,island_effects,left_branch_island_echo_question,True,False,True,True,23,-61.47719192504883,-64.65313720703125,1
Caroline has worried what people?,What has Caroline worried people?,syntax,island_effects,left_branch_island_echo_question,True,False,True,True,24,-42.10379409790039,-40.602691650390625,0
Galileo will sound like which woman?,Which will Galileo sound like woman?,syntax,island_effects,left_branch_island_echo_question,True,False,True,True,25,-56.41172409057617,-49.621192932128906,0
Those actresses will love which movies?,Which will those actresses love movies?,syntax,island_effects,left_branch_island_echo_question,True,False,True,True,26,-48.39524841308594,-51.9134521484375,1
Peter did run around whose museum?,Whose did Peter run around museum?,syntax,island_effects,left_branch_island_echo_question,True,False,True,True,27,-44.72357177734375,-56.87586212158203,1
Lucille was wearing which scarf?,Which was Lucille wearing scarf?,syntax,island_effects,left_branch_island_echo_question,True,False,True,True,28,-47.497623443603516,-50.38819122314453,1
Monet has aggravated what waitresses?,What has Monet aggravated waitresses?,syntax,island_effects,left_branch_island_echo_question,True,False,True,True,29,-60.4141731262207,-65.95703125,1
Most gloves might disturb what women?,What might most gloves disturb women?,syntax,island_effects,left_branch_island_echo_question,True,False,True,True,30,-46.11616897583008,-51.30527877807617,1
Kayla has attacked which patients?,Which has Kayla attacked patients?,syntax,island_effects,left_branch_island_echo_question,True,False,True,True,31,-46.363380432128906,-53.52302551269531,1
Spain had worked with what doctors?,What had Spain worked with doctors?,syntax,island_effects,left_branch_island_echo_question,True,False,True,True,32,-38.5749626159668,-45.13726043701172,1
Guy should explore which oasis?,Which should Guy explore oasis?,syntax,island_effects,left_branch_island_echo_question,True,False,True,True,33,-46.99860382080078,-56.48037338256836,1
The Lutherans do boast about what person?,What do the Lutherans boast about person?,syntax,island_effects,left_branch_island_echo_question,True,False,True,True,34,-62.95496368408203,-63.01739501953125,1
A waiter was thinking about which horses?,Which was a waiter thinking about horses?,syntax,island_effects,left_branch_island_echo_question,True,False,True,True,35,-46.41028594970703,-42.76033401489258,0
The Balkans could shock what doctors?,What could the Balkans shock doctors?,syntax,island_effects,left_branch_island_echo_question,True,False,True,True,36,-52.82246398925781,-49.80583953857422,0
Many children can annoy what children?,What can many children annoy children?,syntax,island_effects,left_branch_island_echo_question,True,False,True,True,37,-40.900142669677734,-44.2400016784668,1
Laurie might criticize what brochures?,What might Laurie criticize brochures?,syntax,island_effects,left_branch_island_echo_question,True,False,True,True,38,-67.3311538696289,-61.10835266113281,0
Denise had known what boy?,What had Denise known boy?,syntax,island_effects,left_branch_island_echo_question,True,False,True,True,39,-37.518157958984375,-43.455787658691406,1
Deanna has hidden which lamp?,Which has Deanna hidden lamp?,syntax,island_effects,left_branch_island_echo_question,True,False,True,True,40,-49.43533706665039,-53.35651397705078,1
Most cakes should upset what school?,What should most cakes upset school?,syntax,island_effects,left_branch_island_echo_question,True,False,True,True,41,-42.24552536010742,-46.448158264160156,1
A movie could disagree with which lady?,Which could a movie disagree with lady?,syntax,island_effects,left_branch_island_echo_question,True,False,True,True,42,-52.691471099853516,-51.124019622802734,0
This student had investigated which guest?,Which had this student investigated guest?,syntax,island_effects,left_branch_island_echo_question,True,False,True,True,43,-51.478851318359375,-50.73893737792969,0
Deborah would impress which senator?,Which would Deborah impress senator?,syntax,island_effects,left_branch_island_echo_question,True,False,True,True,44,-51.60719680786133,-48.000267028808594,0
Todd was complaining about which guy?,Which was Todd complaining about guy?,syntax,island_effects,left_branch_island_echo_question,True,False,True,True,45,-39.58607864379883,-45.24958038330078,1
Curtis has dropped by whose mountains?,Whose has Curtis dropped by mountains?,syntax,island_effects,left_branch_island_echo_question,True,False,True,True,46,-60.36062240600586,-59.09815216064453,0
Bradley is hiding which lights?,Which is Bradley hiding lights?,syntax,island_effects,left_branch_island_echo_question,True,False,True,True,47,-41.978485107421875,-40.12926483154297,0
A lot of grocery stores could disgust what patients?,What could a lot of grocery stores disgust patients?,syntax,island_effects,left_branch_island_echo_question,True,False,True,True,48,-74.54673767089844,-67.35114288330078,0
Those dancers can disagree with what newspaper article?,What can those dancers disagree with newspaper article?,syntax,island_effects,left_branch_island_echo_question,True,False,True,True,49,-66.675537109375,-68.6058578491211,1
Lisa can love which dancers?,Which can Lisa love dancers?,syntax,island_effects,left_branch_island_echo_question,True,False,True,True,50,-39.77850341796875,-43.160888671875,1
Catherine should hate which synopsis?,Which should Catherine hate synopsis?,syntax,island_effects,left_branch_island_echo_question,True,False,True,True,51,-55.943138122558594,-52.41497039794922,0
Richard was buying whose octopus?,Whose was Richard buying octopus?,syntax,island_effects,left_branch_island_echo_question,True,False,True,True,52,-44.76005554199219,-60.73738098144531,1
Julie is disturbing what cashiers?,What is Julie disturbing cashiers?,syntax,island_effects,left_branch_island_echo_question,True,False,True,True,53,-53.814395904541016,-53.78293228149414,0
Every waiter was arriving at whose hill?,Whose was every waiter arriving at hill?,syntax,island_effects,left_branch_island_echo_question,True,False,True,True,54,-53.010414123535156,-63.32707977294922,1
Some bicycles were confusing which senator?,Which were some bicycles confusing senator?,syntax,island_effects,left_branch_island_echo_question,True,False,True,True,55,-50.97626495361328,-53.10604476928711,1
Debra was examining whose books?,Whose was Debra examining books?,syntax,island_effects,left_branch_island_echo_question,True,False,True,True,56,-46.43021774291992,-60.39228057861328,1
Brett has investigated which customer?,Which has Brett investigated customer?,syntax,island_effects,left_branch_island_echo_question,True,False,True,True,57,-52.58431625366211,-45.69581604003906,0
Victoria has cleaned what candles?,What has Victoria cleaned candles?,syntax,island_effects,left_branch_island_echo_question,True,False,True,True,58,-39.17823791503906,-46.262393951416016,1
Bill should dislike what pedestrians?,What should Bill dislike pedestrians?,syntax,island_effects,left_branch_island_echo_question,True,False,True,True,59,-41.67469024658203,-47.48430633544922,1
Marla has brought what lake?,What has Marla brought lake?,syntax,island_effects,left_branch_island_echo_question,True,False,True,True,60,-42.22724151611328,-49.61396026611328,1
Thomas does exit whose public park?,Whose does Thomas exit public park?,syntax,island_effects,left_branch_island_echo_question,True,False,True,True,61,-51.366432189941406,-62.566505432128906,1
Christine might observe which doctor?,Which might Christine observe doctor?,syntax,island_effects,left_branch_island_echo_question,True,False,True,True,62,-47.8217658996582,-48.232215881347656,1
Claire was visiting which doctor?,Which was Claire visiting doctor?,syntax,island_effects,left_branch_island_echo_question,True,False,True,True,63,-46.97210693359375,-41.879173278808594,0
Linda has thought about what mushrooms?,What has Linda thought about mushrooms?,syntax,island_effects,left_branch_island_echo_question,True,False,True,True,64,-44.31632995605469,-45.943782806396484,1
Tina can stun what men?,What can Tina stun men?,syntax,island_effects,left_branch_island_echo_question,True,False,True,True,65,-45.949241638183594,-43.953712463378906,0
Edward could kiss which actress?,Which could Edward kiss actress?,syntax,island_effects,left_branch_island_echo_question,True,False,True,True,66,-38.76622009277344,-47.85340881347656,1
Caroline is praising which alumnus?,Which is Caroline praising alumnus?,syntax,island_effects,left_branch_island_echo_question,True,False,True,True,67,-64.1961441040039,-57.191253662109375,0
Candice will run around which schools?,Which will Candice run around schools?,syntax,island_effects,left_branch_island_echo_question,True,False,True,True,68,-47.78154754638672,-56.470699310302734,1
Sabrina had dropped by what high schools?,What had Sabrina dropped by high schools?,syntax,island_effects,left_branch_island_echo_question,True,False,True,True,69,-60.930904388427734,-65.2448959350586,1
The museums are stunning whose universities?,Whose are the museums stunning universities?,syntax,island_effects,left_branch_island_echo_question,True,False,True,True,70,-53.6596794128418,-61.04486083984375,1
Some doctor is selling whose tomato?,Whose is some doctor selling tomato?,syntax,island_effects,left_branch_island_echo_question,True,False,True,True,71,-46.890403747558594,-55.78376007080078,1
Bradley is thinking about what box?,What is Bradley thinking about box?,syntax,island_effects,left_branch_island_echo_question,True,False,True,True,72,-38.43297576904297,-43.617103576660156,1
The books had worried what teacher?,What had the books worried teacher?,syntax,island_effects,left_branch_island_echo_question,True,False,True,True,73,-44.10092544555664,-43.19818115234375,0
Kenneth has attacked which alumni?,Which has Kenneth attacked alumni?,syntax,island_effects,left_branch_island_echo_question,True,False,True,True,74,-50.937774658203125,-45.649070739746094,0
A boy might run around whose oases?,Whose might a boy run around oases?,syntax,island_effects,left_branch_island_echo_question,True,False,True,True,75,-60.269187927246094,-63.96331787109375,1
Diane has worn whose shawls?,Whose has Diane worn shawls?,syntax,island_effects,left_branch_island_echo_question,True,False,True,True,76,-65.5511703491211,-69.85548400878906,1
Marla has noticed which bread?,Which has Marla noticed bread?,syntax,island_effects,left_branch_island_echo_question,True,False,True,True,77,-44.68281555175781,-49.37523651123047,1
Caroline is arguing about which customer?,Which is Caroline arguing about customer?,syntax,island_effects,left_branch_island_echo_question,True,False,True,True,78,-50.96394348144531,-47.00016784667969,0
Marla might hug which woman?,Which might Marla hug woman?,syntax,island_effects,left_branch_island_echo_question,True,False,True,True,79,-47.80218505859375,-51.94591522216797,1
Those dancers had respected what art galleries?,What had those dancers respected art galleries?,syntax,island_effects,left_branch_island_echo_question,True,False,True,True,80,-61.903587341308594,-63.07075881958008,1
Benjamin was researching whose books?,Whose was Benjamin researching books?,syntax,island_effects,left_branch_island_echo_question,True,False,True,True,81,-51.08407211303711,-53.96745681762695,1
Phillip will watch what waitresses?,What will Phillip watch waitresses?,syntax,island_effects,left_branch_island_echo_question,True,False,True,True,82,-54.638160705566406,-54.862586975097656,1
Paula can bike to which schools?,Which can Paula bike to schools?,syntax,island_effects,left_branch_island_echo_question,True,False,True,True,83,-49.291439056396484,-50.554229736328125,1
Monet does take what deer?,What does Monet take deer?,syntax,island_effects,left_branch_island_echo_question,True,False,True,True,84,-41.535255432128906,-48.283470153808594,1
Melanie was skated around what closet?,What was Melanie skated around closet?,syntax,island_effects,left_branch_island_echo_question,True,False,True,True,85,-61.51743698120117,-57.58989334106445,0
Lucille had arrived at whose movie theater?,Whose had Lucille arrived at movie theater?,syntax,island_effects,left_branch_island_echo_question,True,False,True,True,86,-61.33481979370117,-73.24319458007812,1
This actor is touring what oasis?,What is this actor touring oasis?,syntax,island_effects,left_branch_island_echo_question,True,False,True,True,87,-56.342838287353516,-55.54637908935547,0
Kayla has remembered which brochure?,Which has Kayla remembered brochure?,syntax,island_effects,left_branch_island_echo_question,True,False,True,True,88,-55.60348892211914,-63.70746612548828,1
Victoria could talk to which doctor?,Which could Victoria talk to doctor?,syntax,island_effects,left_branch_island_echo_question,True,False,True,True,89,-36.73899841308594,-45.43487548828125,1
That teacher will aggravate what alumnus?,What will that teacher aggravate alumnus?,syntax,island_effects,left_branch_island_echo_question,True,False,True,True,90,-70.18548583984375,-70.12918090820312,0
Carol had listened to which students?,Which had Carol listened to students?,syntax,island_effects,left_branch_island_echo_question,True,False,True,True,91,-50.94846725463867,-46.816505432128906,0
Larry is observing which woman?,Which is Larry observing woman?,syntax,island_effects,left_branch_island_echo_question,True,False,True,True,92,-36.35533142089844,-40.072479248046875,1
April will climb up which slope?,Which will April climb up slope?,syntax,island_effects,left_branch_island_echo_question,True,False,True,True,93,-41.491268157958984,-50.893035888671875,1
Jacqueline might astound what government?,What might Jacqueline astound government?,syntax,island_effects,left_branch_island_echo_question,True,False,True,True,94,-63.75520324707031,-65.61453247070312,1
Diane has known what guys?,What has Diane known guys?,syntax,island_effects,left_branch_island_echo_question,True,False,True,True,95,-42.647911071777344,-44.727088928222656,1
Some men were revealing what children?,What were some men revealing children?,syntax,island_effects,left_branch_island_echo_question,True,False,True,True,96,-41.278846740722656,-41.828636169433594,1
Rodney has hidden which actors?,Which has Rodney hidden actors?,syntax,island_effects,left_branch_island_echo_question,True,False,True,True,97,-47.33734893798828,-46.840171813964844,0
Every window would bother what committees?,What would every window bother committees?,syntax,island_effects,left_branch_island_echo_question,True,False,True,True,98,-48.17500305175781,-53.02903747558594,1
George is scanning what essay?,What is George scanning essay?,syntax,island_effects,left_branch_island_echo_question,True,False,True,True,99,-38.77344512939453,-43.486083984375,1
Daniel was observing what men?,What was Daniel observing men?,syntax,island_effects,left_branch_island_echo_question,True,False,True,True,100,-34.75416564941406,-41.871337890625,1
The Clintons have talked to what men?,What have the Clintons talked to men?,syntax,island_effects,left_branch_island_echo_question,True,False,True,True,101,-49.58995056152344,-47.052310943603516,0
Some libraries could praise what play?,What could some libraries praise play?,syntax,island_effects,left_branch_island_echo_question,True,False,True,True,102,-50.66542053222656,-52.22262191772461,1
Claire might hide whose rivers?,Whose might Claire hide rivers?,syntax,island_effects,left_branch_island_echo_question,True,False,True,True,103,-52.61244201660156,-58.45367431640625,1
Kimberley might disgust whose committee?,Whose might Kimberley disgust committee?,syntax,island_effects,left_branch_island_echo_question,True,False,True,True,104,-61.411415100097656,-69.00453186035156,1
Joel was descending what steps?,What was Joel descending steps?,syntax,island_effects,left_branch_island_echo_question,True,False,True,True,105,-44.853248596191406,-45.25401306152344,1
Benjamin has remembered whose lake?,Whose has Benjamin remembered lake?,syntax,island_effects,left_branch_island_echo_question,True,False,True,True,106,-50.06977844238281,-57.506038665771484,1
Danielle might fire what children?,What might Danielle fire children?,syntax,island_effects,left_branch_island_echo_question,True,False,True,True,107,-47.29083251953125,-44.37517547607422,0
Scott has cared for which student?,Which has Scott cared for student?,syntax,island_effects,left_branch_island_echo_question,True,False,True,True,108,-40.16065979003906,-47.44818878173828,1
Carl might hide what newspaper article?,What might Carl hide newspaper article?,syntax,island_effects,left_branch_island_echo_question,True,False,True,True,109,-50.85882568359375,-58.36918258666992,1
These mushrooms had looked like whose prints?,Whose had these mushrooms looked like prints?,syntax,island_effects,left_branch_island_echo_question,True,False,True,True,110,-54.15351867675781,-64.67752838134766,1
Tina was describing which boys?,Which was Tina describing boys?,syntax,island_effects,left_branch_island_echo_question,True,False,True,True,111,-45.06855010986328,-43.99842834472656,0
Diana had lifted which shawl?,Which had Diana lifted shawl?,syntax,island_effects,left_branch_island_echo_question,True,False,True,True,112,-59.72194290161133,-52.067359924316406,0
A lot of trucks do embarrass which cashiers?,Which do a lot of trucks embarrass cashiers?,syntax,island_effects,left_branch_island_echo_question,True,False,True,True,113,-72.05889129638672,-65.38214111328125,0
Candice would boast about what waitresses?,What would Candice boast about waitresses?,syntax,island_effects,left_branch_island_echo_question,True,False,True,True,114,-59.07611083984375,-68.09349060058594,1
Skateboards did upset what organization?,What did skateboards upset organization?,syntax,island_effects,left_branch_island_echo_question,True,False,True,True,115,-58.30722427368164,-56.142539978027344,0
Lisa did kiss what guys?,What did Lisa kiss guys?,syntax,island_effects,left_branch_island_echo_question,True,False,True,True,116,-35.21045684814453,-38.84175491333008,1
Carl is thinking about whose apples?,Whose is Carl thinking about apples?,syntax,island_effects,left_branch_island_echo_question,True,False,True,True,117,-38.94304656982422,-51.827117919921875,1
Nina should visit what cafe?,What should Nina visit cafe?,syntax,island_effects,left_branch_island_echo_question,True,False,True,True,118,-44.27707290649414,-46.57936096191406,1
These dresses are astounding which guest?,Which are these dresses astounding guest?,syntax,island_effects,left_branch_island_echo_question,True,False,True,True,119,-50.4693603515625,-50.44136428833008,0
Sara has climbed up which ladders?,Which has Sara climbed up ladders?,syntax,island_effects,left_branch_island_echo_question,True,False,True,True,120,-50.38924026489258,-48.58056640625,0
Every waitress has astounded what drivers?,What has every waitress astounded drivers?,syntax,island_effects,left_branch_island_echo_question,True,False,True,True,121,-60.20944595336914,-61.02062225341797,1
Alan is talking about whose essay?,Whose is Alan talking about essay?,syntax,island_effects,left_branch_island_echo_question,True,False,True,True,122,-36.983131408691406,-51.31962585449219,1
Caroline had brought what gloves?,What had Caroline brought gloves?,syntax,island_effects,left_branch_island_echo_question,True,False,True,True,123,-44.34236145019531,-40.11958312988281,0
Deborah should see which movie theater?,Which should Deborah see movie theater?,syntax,island_effects,left_branch_island_echo_question,True,False,True,True,124,-55.260597229003906,-55.859230041503906,1
Tiffany can investigate which museums?,Which can Tiffany investigate museums?,syntax,island_effects,left_branch_island_echo_question,True,False,True,True,125,-57.71721649169922,-51.62092590332031,0
Frank would cure which rabbits?,Which would Frank cure rabbits?,syntax,island_effects,left_branch_island_echo_question,True,False,True,True,126,-38.45806884765625,-43.902793884277344,1
This committee had bothered what hospitals?,What had this committee bothered hospitals?,syntax,island_effects,left_branch_island_echo_question,True,False,True,True,127,-47.82515335083008,-49.874176025390625,1
Theresa does wear which sweaters?,Which does Theresa wear sweaters?,syntax,island_effects,left_branch_island_echo_question,True,False,True,True,128,-61.191307067871094,-54.796016693115234,0
Sally is fleeing from what waitress?,What is Sally fleeing from waitress?,syntax,island_effects,left_branch_island_echo_question,True,False,True,True,129,-52.93459701538086,-52.831871032714844,0
Sherry was looking like whose sketch?,Whose was Sherry looking like sketch?,syntax,island_effects,left_branch_island_echo_question,True,False,True,True,130,-53.811927795410156,-68.97509765625,1
Amelia was looking like which photographs?,Which was Amelia looking like photographs?,syntax,island_effects,left_branch_island_echo_question,True,False,True,True,131,-49.54935073852539,-48.407508850097656,0
Ann was thinking about what customer?,What was Ann thinking about customer?,syntax,island_effects,left_branch_island_echo_question,True,False,True,True,132,-34.682151794433594,-44.300086975097656,1
