sentence_good,sentence_bad,field,linguistics_term,UID,simple_LM_method,one_prefix_method,two_prefix_method,lexically_identical,pair_id,good_prob,bad_prob,correct
Erin arrived at several libraries and Richard's teachers arrived at a few popular libraries.,Erin arrived at several bad libraries and Richard's teachers arrived at a few popular.,syntax,ellipsis,ellipsis_n_bar_2,True,False,False,False,181,-103.54542541503906,-103.21586608886719,0
A projector impresses one senator and that hat impresses more busy senator.,A projector impresses one employed senator and that hat impresses more busy.,syntax,ellipsis,ellipsis_n_bar_2,True,False,False,False,182,-124.54299926757812,-128.3417510986328,1
Kendra's brothers walk through a few museums and Brian's colleagues walk through several bad museums.,Kendra's brothers walk through a few small museums and Brian's colleagues walk through several bad.,syntax,ellipsis,ellipsis_n_bar_2,True,False,False,False,183,-124.19871520996094,-122.55844116210938,0
Allison's colleague isn't disagreeing with three guys and this grandmother of Paul isn't disagreeing with more standing guys.,Allison's colleague isn't disagreeing with three unsure guys and this grandmother of Paul isn't disagreeing with more standing.,syntax,ellipsis,ellipsis_n_bar_2,True,False,False,False,184,-155.87442016601562,-162.39324951171875,1
Joseph was bringing three hills and every waiter was bringing more bad hills.,Joseph was bringing three hard hills and every waiter was bringing more bad.,syntax,ellipsis,ellipsis_n_bar_2,True,False,False,False,185,-85.03426361083984,-87.30470275878906,1
Stacey hadn't talked to one son and those cashiers hadn't talked to four clever son.,Stacey hadn't talked to one old son and those cashiers hadn't talked to four clever.,syntax,ellipsis,ellipsis_n_bar_2,True,False,False,False,186,-125.25736999511719,-121.47003173828125,0
These cashiers argue about one niece and Thomas's ex-husbands argue about many sick niece.,These cashiers argue about one excited niece and Thomas's ex-husbands argue about many sick.,syntax,ellipsis,ellipsis_n_bar_2,True,False,False,False,187,-154.13206481933594,-154.95635986328125,1
Carla returned to one cousin and Sandra returned to several unsure cousin.,Carla returned to one nice cousin and Sandra returned to several unsure.,syntax,ellipsis,ellipsis_n_bar_2,True,False,False,False,188,-90.89067077636719,-88.66548156738281,0
Many dancers weren't breaking several planes and Jill's handyman isn't breaking a few orange planes.,Many dancers weren't breaking several red planes and Jill's handyman isn't breaking a few orange.,syntax,ellipsis,ellipsis_n_bar_2,True,False,False,False,189,-132.031982421875,-131.25106811523438,0
Carla was hugging three dancers and Laura was hugging fewer important dancers.,Carla was hugging three unemployed dancers and Laura was hugging fewer important.,syntax,ellipsis,ellipsis_n_bar_2,True,False,False,False,190,-99.97074890136719,-104.26879119873047,1
A lot of friends of Kirsten shocks three sisters and this convertible shocks at least as many small sisters.,A lot of friends of Kirsten shocks three young sisters and this convertible shocks at least as many small.,syntax,ellipsis,ellipsis_n_bar_2,True,False,False,False,191,-137.9427032470703,-139.40530395507812,1
Those teachers' mentee didn't remember three cousins of and Stacy didn't remember more exposed cousins of.,Those teachers' mentee didn't remember three lucky cousins of and Stacy didn't remember more exposed.,syntax,ellipsis,ellipsis_n_bar_2,True,False,False,False,192,-144.3291015625,-135.55056762695312,0
Some play about current events embarrasses one doctor and the Borgias embarrasses four hidden doctor.,Some play about current events embarrasses one delighted doctor and the Borgias embarrasses four hidden.,syntax,ellipsis,ellipsis_n_bar_2,True,False,False,False,193,-152.03334045410156,-158.56301879882812,1
This customer went to one river and Anne went to some hard river.,This customer went to one exposed river and Anne went to some hard.,syntax,ellipsis,ellipsis_n_bar_2,True,False,False,False,194,-79.47156524658203,-85.79653930664062,1
Daniel drops by one library and Liam drops by several popular library.,Daniel drops by one red library and Liam drops by several popular.,syntax,ellipsis,ellipsis_n_bar_2,True,False,False,False,195,-85.07530212402344,-85.1175537109375,1
Naomi's handymen have cleaned one high school and Thomas's best friend has cleaned some gray high school.,Naomi's handymen have cleaned one small high school and Thomas's best friend has cleaned some gray.,syntax,ellipsis,ellipsis_n_bar_2,True,False,False,False,196,-139.08348083496094,-137.4044189453125,0
Amy bored three mentees and the libraries bored fewer happy mentees.,Amy bored three lost mentees and the libraries bored fewer happy.,syntax,ellipsis,ellipsis_n_bar_2,True,False,False,False,197,-120.850341796875,-109.5081787109375,0
Heidi's sister loves a lot of contractors and Dennis loves a few serious contractors.,Heidi's sister loves a lot of nice contractors and Dennis loves a few serious.,syntax,ellipsis,ellipsis_n_bar_2,True,False,False,False,198,-108.17646026611328,-107.22758483886719,0
Laura's podiatrists weren't approaching many granddaughters and most men weren't approaching few scared granddaughters.,Laura's podiatrists weren't approaching many hidden granddaughters and most men weren't approaching few scared.,syntax,ellipsis,ellipsis_n_bar_2,True,False,False,False,199,-184.27886962890625,-171.43475341796875,0
Charles's partners do bring three rugs and Mark's students do bring more purple rugs.,Charles's partners do bring three orange rugs and Mark's students do bring more purple.,syntax,ellipsis,ellipsis_n_bar_2,True,False,False,False,200,-128.56674194335938,-122.72196197509766,0
Douglas's ex-husbands love one sister of and the governments love some exposed sister of.,Douglas's ex-husbands love one happy sister of and the governments love some exposed.,syntax,ellipsis,ellipsis_n_bar_2,True,False,False,False,201,-149.61802673339844,-140.11997985839844,0
The documentary about Monet had stunned a lot of handymen and that drawing of a cucumber had stunned a few unlucky handymen.,The documentary about Monet had stunned a lot of happy handymen and that drawing of a cucumber had stunned a few unlucky.,syntax,ellipsis,ellipsis_n_bar_2,True,False,False,False,202,-176.94290161132812,-168.72933959960938,0
Karen isn't hiring two nieces of and the Lutherans are hiring three concealed nieces of.,Karen isn't hiring two excited nieces of and the Lutherans are hiring three concealed.,syntax,ellipsis,ellipsis_n_bar_2,True,False,False,False,203,-169.75851440429688,-146.42648315429688,0
Anne can't break three unicycles and Martin can't break at least as many rough unicycles.,Anne can't break three red unicycles and Martin can't break at least as many rough.,syntax,ellipsis,ellipsis_n_bar_2,True,False,False,False,204,-136.10166931152344,-118.1283187866211,0
Every guy's oncologists researched one ex-husband and Claire researched at least as many standing ex-husband.,Every guy's oncologists researched one old ex-husband and Claire researched at least as many standing.,syntax,ellipsis,ellipsis_n_bar_2,True,False,False,False,205,-161.73696899414062,-147.3302459716797,0
Timothy's senator isn't questioning one cousin of and Renee isn't questioning a lot employed cousin of.,Timothy's senator isn't questioning one excited cousin of and Renee isn't questioning a lot employed.,syntax,ellipsis,ellipsis_n_bar_2,True,False,False,False,206,-153.08665466308594,-144.37103271484375,0
That grandfather of Irene investigates one university and this guy investigates many popular university.,That grandfather of Irene investigates one good university and this guy investigates many popular.,syntax,ellipsis,ellipsis_n_bar_2,True,False,False,False,207,-114.91073608398438,-114.65779113769531,0
That guest kisses one partner and Mary kisses three long partner.,That guest kisses one young partner and Mary kisses three long.,syntax,ellipsis,ellipsis_n_bar_2,True,False,False,False,208,-89.54247283935547,-88.147216796875,0
That son of Heidi forgot one play and Karen's cousin forgot few popular play.,That son of Heidi forgot one good play and Karen's cousin forgot few popular.,syntax,ellipsis,ellipsis_n_bar_2,True,False,False,False,209,-115.63385009765625,-113.06522369384766,0
That grocery store aggravates one husband and many teachers aggravates five busy husband.,That grocery store aggravates one lucky husband and many teachers aggravates five busy.,syntax,ellipsis,ellipsis_n_bar_2,True,False,False,False,210,-128.55929565429688,-129.07815551757812,1
Lucille's oncologists see one woman and Heather's nephews see few unemployed woman.,Lucille's oncologists see one popular woman and Heather's nephews see few unemployed.,syntax,ellipsis,ellipsis_n_bar_2,True,False,False,False,211,-135.24949645996094,-135.99984741210938,1
All girls' teacher is discovering one turtle and Chad is discovering a lot red turtle.,All girls' teacher is discovering one purple turtle and Chad is discovering a lot red.,syntax,ellipsis,ellipsis_n_bar_2,True,False,False,False,212,-117.61822509765625,-118.25284576416016,1
Andrea explores one lake and Kendra explores few rough lake.,Andrea explores one out in the open lake and Kendra explores few rough.,syntax,ellipsis,ellipsis_n_bar_2,True,False,False,False,213,-106.74378204345703,-115.93360137939453,1
The picture looked like one tutor and this print looked like five displeased tutor.,The picture looked like one uncertain tutor and this print looked like five displeased.,syntax,ellipsis,ellipsis_n_bar_2,True,False,False,False,214,-115.14042663574219,-112.43267822265625,0
Clyde wouldn't disgust one brother and this ladder wouldn't disgust many confident brother.,Clyde wouldn't disgust one content brother and this ladder wouldn't disgust many confident.,syntax,ellipsis,ellipsis_n_bar_2,True,False,False,False,215,-132.01358032226562,-135.93565368652344,1
Most cousins of Eric lifted four screens and Marla's ex-husbands lifted five red screens.,Most cousins of Eric lifted four big screens and Marla's ex-husbands lifted five red.,syntax,ellipsis,ellipsis_n_bar_2,True,False,False,False,216,-153.416259765625,-152.98379516601562,0
Carl disliked three waiters and the waiter disliked almost as many hidden waiters.,Carl disliked three uncertain waiters and the waiter disliked almost as many hidden.,syntax,ellipsis,ellipsis_n_bar_2,True,False,False,False,217,-110.96749114990234,-105.91682434082031,0
Stacy is breaking a few chairs and Ruth is breaking a lot lost chairs.,Stacy is breaking a few red chairs and Ruth is breaking a lot lost.,syntax,ellipsis,ellipsis_n_bar_2,True,False,False,False,218,-94.50218200683594,-92.86083221435547,0
Liam arrives at no rivers and Samantha arrives at some yellow rivers.,Liam arrives at no hard rivers and Samantha arrives at some yellow.,syntax,ellipsis,ellipsis_n_bar_2,True,False,False,False,219,-93.22996520996094,-94.31686401367188,1
The adult found a few waiters and Vincent found a lot good waiters.,The adult found a few scared waiters and Vincent found a lot good.,syntax,ellipsis,ellipsis_n_bar_2,True,False,False,False,220,-96.88277435302734,-94.51150512695312,0
Many paintings look like one casserole and a lot of pictures look like a few hidden casserole.,Many paintings look like one gray casserole and a lot of pictures look like a few hidden.,syntax,ellipsis,ellipsis_n_bar_2,True,False,False,False,221,-126.85657501220703,-115.01820373535156,0
Donald hasn't boycotted few mountains and Kevin hasn't boycotted many concealed mountains.,Donald hasn't boycotted few yellow mountains and Kevin hasn't boycotted many concealed.,syntax,ellipsis,ellipsis_n_bar_2,True,False,False,False,222,-139.22312927246094,-138.68026733398438,0
Kristin can scare three organizations and every documentary can scare two popular organizations.,Kristin can scare three good organizations and every documentary can scare two popular.,syntax,ellipsis,ellipsis_n_bar_2,True,False,False,False,223,-106.91560363769531,-106.26918029785156,0
David runs around two cafes and Ellen runs around three old cafes.,David runs around two brown cafes and Ellen runs around three old.,syntax,ellipsis,ellipsis_n_bar_2,True,False,False,False,224,-85.87641143798828,-82.78849029541016,0
Those girls' sisters aren't walking through one school and Martin was walking through at least as many purple school.,Those girls' sisters aren't walking through one exposed school and Martin was walking through at least as many purple.,syntax,ellipsis,ellipsis_n_bar_2,True,False,False,False,225,-123.93115234375,-131.57582092285156,1
Every patient's ex-wives should tour one bank and David should tour few red bank.,Every patient's ex-wives should tour one green bank and David should tour few red.,syntax,ellipsis,ellipsis_n_bar_2,True,False,False,False,226,-132.01983642578125,-133.9087677001953,1
Derek talks about one story about and Sarah's colleague talks about two long story about.,Derek talks about one good story about and Sarah's colleague talks about two long.,syntax,ellipsis,ellipsis_n_bar_2,True,False,False,False,227,-104.02931213378906,-99.28374481201172,0
Gerald's friends can care for one tutor and those grandmothers of these guests can care for a few serious tutor.,Gerald's friends can care for one unlucky tutor and those grandmothers of these guests can care for a few serious.,syntax,ellipsis,ellipsis_n_bar_2,True,False,False,False,228,-143.108642578125,-148.5470428466797,1
Candice's boyfriend wasn't driving to a few closets and Martin wasn't driving to a lot black closets.,Candice's boyfriend wasn't driving to a few popular closets and Martin wasn't driving to a lot black.,syntax,ellipsis,ellipsis_n_bar_2,True,False,False,False,229,-134.28338623046875,-129.22317504882812,0
Connie criticizes three stories about and Kathleen criticizes fewer good stories about.,Connie criticizes three bad stories about and Kathleen criticizes fewer good.,syntax,ellipsis,ellipsis_n_bar_2,True,False,False,False,230,-123.5814437866211,-119.81635284423828,0
Vincent's plumber wasn't walking through three lakes and Carolyn's daughter wasn't walking through at least as many big lakes.,Vincent's plumber wasn't walking through three hidden lakes and Carolyn's daughter wasn't walking through at least as many big.,syntax,ellipsis,ellipsis_n_bar_2,True,False,False,False,231,-158.1586151123047,-161.54998779296875,1
Some beef doesn't astound no customers and Allison doesn't astound some smart customers.,Some beef doesn't astound no sick customers and Allison doesn't astound some smart.,syntax,ellipsis,ellipsis_n_bar_2,True,False,False,False,232,-128.37527465820312,-128.76007080078125,1
Erin shouldn't forget one guest and Theodore shouldn't forget three hopeful guest.,Erin shouldn't forget one employed guest and Theodore shouldn't forget three hopeful.,syntax,ellipsis,ellipsis_n_bar_2,True,False,False,False,233,-105.98306274414062,-106.89073944091797,1
Susan's associates shouldn't escape from one actress and Brenda's ex-wife shouldn't escape from two exposed actress.,Susan's associates shouldn't escape from one hopeful actress and Brenda's ex-wife shouldn't escape from two exposed.,syntax,ellipsis,ellipsis_n_bar_2,True,False,False,False,234,-142.52220153808594,-144.53219604492188,1
Angela talked about many ex-boyfriends and Carla's podiatrists talked about few big ex-boyfriends.,Angela talked about many nice ex-boyfriends and Carla's podiatrists talked about few big.,syntax,ellipsis,ellipsis_n_bar_2,True,False,False,False,235,-185.69775390625,-164.806640625,0
Beverly's grandmothers ascend three slopes and that dancer's grandsons ascend almost as many lost slopes.,Beverly's grandmothers ascend three smooth slopes and that dancer's grandsons ascend almost as many lost.,syntax,ellipsis,ellipsis_n_bar_2,True,False,False,False,236,-169.78128051757812,-168.8260955810547,0
A lot of muffins astound three sisters of and many skateboards astound two small sisters of.,A lot of muffins astound three busy sisters of and many skateboards astound two small.,syntax,ellipsis,ellipsis_n_bar_2,True,False,False,False,237,-154.34518432617188,-150.48663330078125,0
Christopher is describing a lot of restaurants and Martin is describing a few good restaurants.,Christopher is describing a lot of hidden restaurants and Martin is describing a few good.,syntax,ellipsis,ellipsis_n_bar_2,True,False,False,False,238,-85.17862701416016,-88.07304382324219,1
All women watch one spouse and senators watch at least as many fast spouse.,All women watch one small spouse and senators watch at least as many fast.,syntax,ellipsis,ellipsis_n_bar_2,True,False,False,False,239,-106.9125747680664,-102.45418548583984,0
Steve's grandmothers sounded like one book about and Cynthia sounded like five big book about.,Steve's grandmothers sounded like one black book about and Cynthia sounded like five big.,syntax,ellipsis,ellipsis_n_bar_2,True,False,False,False,240,-103.98310852050781,-102.81167602539062,0
Many forks aggravated one girl and the photographs of the chair aggravated some important girl.,Many forks aggravated one smart girl and the photographs of the chair aggravated some important.,syntax,ellipsis,ellipsis_n_bar_2,True,False,False,False,241,-109.90281677246094,-114.59376525878906,1
This story about current events scared three nephews and these plays about the Great Lakes scared fewer long nephews.,This story about current events scared three troubled nephews and these plays about the Great Lakes scared fewer long.,syntax,ellipsis,ellipsis_n_bar_2,True,False,False,False,242,-158.5636444091797,-156.25634765625,0
Organizations embarrass four associates and the Great Lakes embarrass five content associates.,Organizations embarrass four lucky associates and the Great Lakes embarrass five content.,syntax,ellipsis,ellipsis_n_bar_2,True,False,False,False,243,-119.65563201904297,-118.88331604003906,0
Some commentary sounded like three boys and Edward sounded like at least as many hidden boys.,Some commentary sounded like three employed boys and Edward sounded like at least as many hidden.,syntax,ellipsis,ellipsis_n_bar_2,True,False,False,False,244,-103.38377380371094,-110.21041870117188,1
Bruce wasn't taking one eggplant and Nicole wasn't taking few black eggplant.,Bruce wasn't taking one gray eggplant and Nicole wasn't taking few black.,syntax,ellipsis,ellipsis_n_bar_2,True,False,False,False,245,-120.37797546386719,-107.23462677001953,0
Sheila's doctor isn't hiding one nose and that senator isn't hiding at least as many lost nose.,Sheila's doctor isn't hiding one out in the open nose and that senator isn't hiding at least as many lost.,syntax,ellipsis,ellipsis_n_bar_2,True,False,False,False,246,-134.28909301757812,-141.00216674804688,1
Liam didn't disturb one niece of and Donna's mentees didn't disturb some hidden niece of.,Liam didn't disturb one unconvinced niece of and Donna's mentees didn't disturb some hidden.,syntax,ellipsis,ellipsis_n_bar_2,True,False,False,False,247,-150.73458862304688,-159.11126708984375,1
Stacy's associate hasn't passed a lot of grocery stores and the girls' doctor hasn't passed a few white grocery stores.,Stacy's associate hasn't passed a lot of dirty grocery stores and the girls' doctor hasn't passed a few white.,syntax,ellipsis,ellipsis_n_bar_2,True,False,False,False,248,-153.95877075195312,-146.12750244140625,0
This university loved one tutor and Donald loved four nice tutor.,This university loved one upset tutor and Donald loved four nice.,syntax,ellipsis,ellipsis_n_bar_2,True,False,False,False,249,-94.56494903564453,-96.33387756347656,1
This pedestrian does question one employee and Randolf does question four clever employee.,This pedestrian does question one sick employee and Randolf does question four clever.,syntax,ellipsis,ellipsis_n_bar_2,True,False,False,False,250,-126.00772857666016,-127.18795776367188,1
Rodney's husband loved one friend of and Jeffrey loved more sick friend of.,Rodney's husband loved one serious friend of and Jeffrey loved more sick.,syntax,ellipsis,ellipsis_n_bar_2,True,False,False,False,251,-110.68702697753906,-101.91622924804688,0
Adam has run around several closets and Andrew has run around a few big closets.,Adam has run around several brown closets and Andrew has run around a few big.,syntax,ellipsis,ellipsis_n_bar_2,True,False,False,False,252,-102.65303039550781,-98.86538696289062,0
Stacy leaves a few lawyers and Ruth leaves a lot confident lawyers.,Stacy leaves a few good lawyers and Ruth leaves a lot confident.,syntax,ellipsis,ellipsis_n_bar_2,True,False,False,False,253,-92.855712890625,-90.46174621582031,0
Jacqueline was bothering one senator and a lot of plays are bothering four unlucky senator.,Jacqueline was bothering one unemployed senator and a lot of plays are bothering four unlucky.,syntax,ellipsis,ellipsis_n_bar_2,True,False,False,False,254,-128.76840209960938,-131.36468505859375,1
Samuel isn't taking one mall and Kayla isn't taking several exposed mall.,Samuel isn't taking one bad mall and Kayla isn't taking several exposed.,syntax,ellipsis,ellipsis_n_bar_2,True,False,False,False,255,-112.7325439453125,-108.45526123046875,0
These people have hugged a few ex-girlfriends and Naomi's tutor hadn't hugged several delighted ex-girlfriends.,These people have hugged a few big ex-girlfriends and Naomi's tutor hadn't hugged several delighted.,syntax,ellipsis,ellipsis_n_bar_2,True,False,False,False,256,-148.29737854003906,-133.1292724609375,0
Granddaughters of Colleen are irritating a lot of legislatures and this niece of Margaret isn't irritating a few popular legislatures.,Granddaughters of Colleen are irritating a lot of good legislatures and this niece of Margaret isn't irritating a few popular.,syntax,ellipsis,ellipsis_n_bar_2,True,False,False,False,257,-170.94337463378906,-167.47018432617188,0
Most nieces of Bill escape from three cousins and Christine's handymen escape from almost as many nice cousins.,Most nieces of Bill escape from three happy cousins and Christine's handymen escape from almost as many nice.,syntax,ellipsis,ellipsis_n_bar_2,True,False,False,False,258,-160.84768676757812,-162.6602783203125,1
Julia should bore five grandmothers and Renee should bore four fast grandmothers.,Julia should bore five bad grandmothers and Renee should bore four fast.,syntax,ellipsis,ellipsis_n_bar_2,True,False,False,False,259,-124.0098876953125,-117.47517395019531,0
Many jackets did alarm no granddaughters and Daniel did alarm some happy granddaughters.,Many jackets did alarm no troubled granddaughters and Daniel did alarm some happy.,syntax,ellipsis,ellipsis_n_bar_2,True,False,False,False,260,-138.86984252929688,-124.64108276367188,0
Rachelle did disturb one tutor and the Impressionists did disturb four old tutor.,Rachelle did disturb one unemployed tutor and the Impressionists did disturb four old.,syntax,ellipsis,ellipsis_n_bar_2,True,False,False,False,261,-129.06414794921875,-132.43692016601562,1
The hospital does criticize one brother of and those girls might criticize several excited brother of.,The hospital does criticize one clever brother of and those girls might criticize several excited.,syntax,ellipsis,ellipsis_n_bar_2,True,False,False,False,262,-126.79933166503906,-118.28923797607422,0
Michelle cured one girl and Rachelle cured at least as many lucky girl.,Michelle cured one unemployed girl and Rachelle cured at least as many lucky.,syntax,ellipsis,ellipsis_n_bar_2,True,False,False,False,263,-98.21688842773438,-110.12583923339844,1
Brad is ascending one mountain and Tiffany's mentee is ascending several popular mountain.,Brad is ascending one hard mountain and Tiffany's mentee is ascending several popular.,syntax,ellipsis,ellipsis_n_bar_2,True,False,False,False,264,-109.15807342529297,-108.76498413085938,0
Many sisters of Cindy shouldn't discover four wheelbarrows and Gregory shouldn't discover five exposed wheelbarrows.,Many sisters of Cindy shouldn't discover four popular wheelbarrows and Gregory shouldn't discover five exposed.,syntax,ellipsis,ellipsis_n_bar_2,True,False,False,False,265,-165.92910766601562,-150.00477600097656,0
The actor's sister hadn't questioned two piano teachers and Dana hadn't questioned three confident piano teachers.,The actor's sister hadn't questioned two smart piano teachers and Dana hadn't questioned three confident.,syntax,ellipsis,ellipsis_n_bar_2,True,False,False,False,266,-143.6232147216797,-133.78115844726562,0
The Lutherans describe three ex-husbands and these fathers of Rhonda describe more young ex-husbands.,The Lutherans describe three hopeful ex-husbands and these fathers of Rhonda describe more young.,syntax,ellipsis,ellipsis_n_bar_2,True,False,False,False,267,-178.56494140625,-159.19876098632812,0
Travis tours three mountains and Keith tours fewer white mountains.,Travis tours three important mountains and Keith tours fewer white.,syntax,ellipsis,ellipsis_n_bar_2,True,False,False,False,268,-95.19403076171875,-103.4132080078125,1
A lot of waitresses are watching one father of and Martha's senator was watching several busy father of.,A lot of waitresses are watching one scared father of and Martha's senator was watching several busy.,syntax,ellipsis,ellipsis_n_bar_2,True,False,False,False,269,-151.4221954345703,-145.2500762939453,0
That picture looks like one library and that print looks like two dirty library.,That picture looks like one clean library and that print looks like two dirty.,syntax,ellipsis,ellipsis_n_bar_2,True,False,False,False,270,-91.65109252929688,-91.59707641601562,0
That niece of some doctor thinks about three tomatoes and Mary thinks about almost as many brown tomatoes.,That niece of some doctor thinks about three small tomatoes and Mary thinks about almost as many brown.,syntax,ellipsis,ellipsis_n_bar_2,True,False,False,False,271,-122.68296813964844,-118.05286407470703,0
