sentence_good,sentence_bad,field,linguistics_term,UID,simple_LM_method,one_prefix_method,two_prefix_method,lexically_identical,pair_id,good_prob,bad_prob,correct
Some waiters broke this lost foot.,Some waiters broke this lost feet.,morphology,determiner_noun_agreement,determiner_noun_agreement_with_adj_irregular_1,True,True,False,True,0,-50.02496337890625,-51.34302520751953,1
The company talks about those big women.,The company talks about those big woman.,morphology,determiner_noun_agreement,determiner_noun_agreement_with_adj_irregular_1,True,True,False,True,1,-41.57731628417969,-45.96770095825195,1
This blouse astounds this lost woman.,This blouse astounds this lost women.,morphology,determiner_noun_agreement,determiner_noun_agreement_with_adj_irregular_1,True,True,False,True,2,-62.927635192871094,-63.84211730957031,1
David wasn't kissing these standing children.,David wasn't kissing these standing child.,morphology,determiner_noun_agreement,determiner_noun_agreement_with_adj_irregular_1,True,True,False,True,3,-48.904457092285156,-50.2962646484375,1
This person shouldn't criticize this upset child.,This person shouldn't criticize this upset children.,morphology,determiner_noun_agreement,determiner_noun_agreement_with_adj_irregular_1,True,True,False,True,4,-49.73875427246094,-51.42533874511719,1
These tomatoes astound that concealed person.,These tomatoes astound that concealed people.,morphology,determiner_noun_agreement,determiner_noun_agreement_with_adj_irregular_1,True,True,False,True,5,-60.733009338378906,-58.85675048828125,0
Sally hasn't cleaned these white oxen.,Sally hasn't cleaned these white ox.,morphology,determiner_noun_agreement,determiner_noun_agreement_with_adj_irregular_1,True,True,False,True,6,-65.76170349121094,-63.767852783203125,0
These doors would astound those happy children.,These doors would astound those happy child.,morphology,determiner_noun_agreement,determiner_noun_agreement_with_adj_irregular_1,True,True,False,True,7,-58.001407623291016,-60.72441864013672,1
Katherine is biking to these red oases.,Katherine is biking to these red oasis.,morphology,determiner_noun_agreement,determiner_noun_agreement_with_adj_irregular_1,True,True,False,True,8,-65.69744873046875,-61.78569793701172,0
Katherine hadn't praised this lost man.,Katherine hadn't praised this lost men.,morphology,determiner_noun_agreement,determiner_noun_agreement_with_adj_irregular_1,True,True,False,True,9,-56.4849739074707,-59.45793914794922,1
The driver sees that unlucky person.,The driver sees that unlucky people.,morphology,determiner_noun_agreement,determiner_noun_agreement_with_adj_irregular_1,True,True,False,True,10,-45.84206771850586,-45.11335754394531,0
Edward hadn't described this nice woman.,Edward hadn't described this nice women.,morphology,determiner_noun_agreement,determiner_noun_agreement_with_adj_irregular_1,True,True,False,True,11,-43.02446746826172,-47.392578125,1
Heidi returns to that big woman.,Heidi returns to that big women.,morphology,determiner_noun_agreement,determiner_noun_agreement_with_adj_irregular_1,True,True,False,True,12,-48.872962951660156,-48.305912017822266,0
Sara listened to that unconvinced person.,Sara listened to that unconvinced people.,morphology,determiner_noun_agreement,determiner_noun_agreement_with_adj_irregular_1,True,True,False,True,13,-61.39878463745117,-58.95085144042969,0
Samuel had listened to these concealed people.,Samuel had listened to these concealed person.,morphology,determiner_noun_agreement,determiner_noun_agreement_with_adj_irregular_1,True,True,False,True,14,-55.91444778442383,-58.869789123535156,1
Richard flees from those unconvinced men.,Richard flees from those unconvinced man.,morphology,determiner_noun_agreement,determiner_noun_agreement_with_adj_irregular_1,True,True,False,True,15,-52.90752029418945,-52.90327072143555,0
Monica is cleaning that hidden axis.,Monica is cleaning that hidden axes.,morphology,determiner_noun_agreement,determiner_noun_agreement_with_adj_irregular_1,True,True,False,True,16,-56.020904541015625,-56.12748718261719,1
Veronica does break those hard teeth.,Veronica does break those hard tooth.,morphology,determiner_noun_agreement,determiner_noun_agreement_with_adj_irregular_1,True,True,False,True,17,-52.50928497314453,-56.64858627319336,1
Rachel drove to those blue oases.,Rachel drove to those blue oasis.,morphology,determiner_noun_agreement,determiner_noun_agreement_with_adj_irregular_1,True,True,False,True,18,-49.16379165649414,-44.188743591308594,0
These cashiers do break this whole tooth.,These cashiers do break this whole teeth.,morphology,determiner_noun_agreement,determiner_noun_agreement_with_adj_irregular_1,True,True,False,True,19,-54.57610321044922,-54.92576599121094,1
Rose dislikes this bad synopsis.,Rose dislikes this bad synopses.,morphology,determiner_noun_agreement,determiner_noun_agreement_with_adj_irregular_1,True,True,False,True,20,-43.66071319580078,-58.19902801513672,1
Becky had fixed this hard foot.,Becky had fixed this hard feet.,morphology,determiner_noun_agreement,determiner_noun_agreement_with_adj_irregular_1,True,True,False,True,21,-48.56341552734375,-49.460350036621094,1
Gerald questioned those unconvinced men.,Gerald questioned those unconvinced man.,morphology,determiner_noun_agreement,determiner_noun_agreement_with_adj_irregular_1,True,True,False,True,22,-58.10346221923828,-58.93918991088867,1
Stacy doesn't impress this determined person.,Stacy doesn't impress this determined people.,morphology,determiner_noun_agreement,determiner_noun_agreement_with_adj_irregular_1,True,True,False,True,23,-55.80604553222656,-57.32017517089844,1
Nina won't run around this smooth oasis.,Nina won't run around this smooth oases.,morphology,determiner_noun_agreement,determiner_noun_agreement_with_adj_irregular_1,True,True,False,True,24,-60.34904861450195,-66.30198669433594,1
That committee works with those out in the open women.,That committee works with those out in the open woman.,morphology,determiner_noun_agreement,determiner_noun_agreement_with_adj_irregular_1,True,True,False,True,25,-59.248939514160156,-61.05934143066406,1
Most teenagers had complained about these scared men.,Most teenagers had complained about these scared man.,morphology,determiner_noun_agreement,determiner_noun_agreement_with_adj_irregular_1,True,True,False,True,26,-46.769615173339844,-47.75828552246094,1
Bill cures those unsure alumni.,Bill cures those unsure alumnus.,morphology,determiner_noun_agreement,determiner_noun_agreement_with_adj_irregular_1,True,True,False,True,27,-48.206905364990234,-49.93387222290039,1
Derek walked through this smooth oasis.,Derek walked through this smooth oases.,morphology,determiner_noun_agreement,determiner_noun_agreement_with_adj_irregular_1,True,True,False,True,28,-50.75821304321289,-56.507755279541016,1
Some waiters work with this hidden person.,Some waiters work with this hidden people.,morphology,determiner_noun_agreement,determiner_noun_agreement_with_adj_irregular_1,True,True,False,True,29,-48.64295959472656,-48.589088439941406,0
Dennis hasn't healed these unconvinced women.,Dennis hasn't healed these unconvinced woman.,morphology,determiner_noun_agreement,determiner_noun_agreement_with_adj_irregular_1,True,True,False,True,30,-64.68478393554688,-66.48915100097656,1
Kathleen has this exposed thesis.,Kathleen has this exposed theses.,morphology,determiner_noun_agreement,determiner_noun_agreement_with_adj_irregular_1,True,True,False,True,31,-50.26762008666992,-56.848209381103516,1
Sheila loved those determined people.,Sheila loved those determined person.,morphology,determiner_noun_agreement,determiner_noun_agreement_with_adj_irregular_1,True,True,False,True,32,-50.02107238769531,-53.11223220825195,1
Guy has toured this green oasis.,Guy has toured this green oases.,morphology,determiner_noun_agreement,determiner_noun_agreement_with_adj_irregular_1,True,True,False,True,33,-43.663089752197266,-49.89996337890625,1
Some senators go to that purple oasis.,Some senators go to that purple oases.,morphology,determiner_noun_agreement,determiner_noun_agreement_with_adj_irregular_1,True,True,False,True,34,-57.389739990234375,-61.500919342041016,1
Anna should scan that bad analysis.,Anna should scan that bad analyses.,morphology,determiner_noun_agreement,determiner_noun_agreement_with_adj_irregular_1,True,True,False,True,35,-44.706214904785156,-48.493247985839844,1
Most waitresses notice that red stimulus.,Most waitresses notice that red stimuli.,morphology,determiner_noun_agreement,determiner_noun_agreement_with_adj_irregular_1,True,True,False,True,36,-58.40952682495117,-58.165489196777344,0
Diana cured those standing alumni.,Diana cured those standing alumnus.,morphology,determiner_noun_agreement,determiner_noun_agreement_with_adj_irregular_1,True,True,False,True,37,-59.38199996948242,-57.08795928955078,0
Ronald discussed that nice man.,Ronald discussed that nice men.,morphology,determiner_noun_agreement,determiner_noun_agreement_with_adj_irregular_1,True,True,False,True,38,-46.37810134887695,-49.5964241027832,1
Tonya won't buy that brown oasis.,Tonya won't buy that brown oases.,morphology,determiner_noun_agreement,determiner_noun_agreement_with_adj_irregular_1,True,True,False,True,39,-55.70232391357422,-59.63249206542969,1
Marie argued about that good synopsis.,Marie argued about that good synopses.,morphology,determiner_noun_agreement,determiner_noun_agreement_with_adj_irregular_1,True,True,False,True,40,-46.97940444946289,-57.655784606933594,1
Bradley wasn't skated around that out in the open oasis.,Bradley wasn't skated around that out in the open oases.,morphology,determiner_noun_agreement,determiner_noun_agreement_with_adj_irregular_1,True,True,False,True,41,-73.3037109375,-79.23564147949219,1
Jacqueline wasn't finding that hidden man.,Jacqueline wasn't finding that hidden men.,morphology,determiner_noun_agreement,determiner_noun_agreement_with_adj_irregular_1,True,True,False,True,42,-56.307884216308594,-57.27320861816406,1
Most commentaries hadn't impressed those clever men.,Most commentaries hadn't impressed those clever man.,morphology,determiner_noun_agreement,determiner_noun_agreement_with_adj_irregular_1,True,True,False,True,43,-67.88430786132812,-69.72301483154297,1
Bruce has worked with this lost child.,Bruce has worked with this lost children.,morphology,determiner_noun_agreement,determiner_noun_agreement_with_adj_irregular_1,True,True,False,True,44,-39.358009338378906,-39.40855026245117,1
Karla exits these orange oases.,Karla exits these orange oasis.,morphology,determiner_noun_agreement,determiner_noun_agreement_with_adj_irregular_1,True,True,False,True,45,-59.560333251953125,-55.38241195678711,0
Joseph doesn't sound like these hard theses.,Joseph doesn't sound like these hard thesis.,morphology,determiner_noun_agreement,determiner_noun_agreement_with_adj_irregular_1,True,True,False,True,46,-52.77935028076172,-46.490089416503906,0
Martha had talked to that out in the open person.,Martha had talked to that out in the open people.,morphology,determiner_noun_agreement,determiner_noun_agreement_with_adj_irregular_1,True,True,False,True,47,-60.18031311035156,-60.08039855957031,0
The vase impresses that excited woman.,The vase impresses that excited women.,morphology,determiner_noun_agreement,determiner_noun_agreement_with_adj_irregular_1,True,True,False,True,48,-54.53285217285156,-53.64672088623047,0
Kevin cleans this purple foot.,Kevin cleans this purple feet.,morphology,determiner_noun_agreement,determiner_noun_agreement_with_adj_irregular_1,True,True,False,True,49,-39.719573974609375,-39.31661605834961,0
Sheila could observe this big woman.,Sheila could observe this big women.,morphology,determiner_noun_agreement,determiner_noun_agreement_with_adj_irregular_1,True,True,False,True,50,-50.844215393066406,-52.2374153137207,1
Lisa hugs that young man.,Lisa hugs that young men.,morphology,determiner_noun_agreement,determiner_noun_agreement_with_adj_irregular_1,True,True,False,True,51,-31.524505615234375,-31.561115264892578,1
This waitress explores these black oases.,This waitress explores these black oasis.,morphology,determiner_noun_agreement,determiner_noun_agreement_with_adj_irregular_1,True,True,False,True,52,-53.9506721496582,-50.370513916015625,0
Janet boasts about that fast person.,Janet boasts about that fast people.,morphology,determiner_noun_agreement,determiner_noun_agreement_with_adj_irregular_1,True,True,False,True,53,-55.33131790161133,-53.384681701660156,0
Scott won't confuse these big people.,Scott won't confuse these big person.,morphology,determiner_noun_agreement,determiner_noun_agreement_with_adj_irregular_1,True,True,False,True,54,-40.32029724121094,-45.08221435546875,1
The movie theater was impressing that sick woman.,The movie theater was impressing that sick women.,morphology,determiner_noun_agreement,determiner_noun_agreement_with_adj_irregular_1,True,True,False,True,55,-58.533843994140625,-59.07855987548828,1
Every carriage hadn't annoyed this sick alumnus.,Every carriage hadn't annoyed this sick alumni.,morphology,determiner_noun_agreement,determiner_noun_agreement_with_adj_irregular_1,True,True,False,True,56,-68.29624938964844,-68.1527328491211,0
Ronald hadn't discussed those scared people.,Ronald hadn't discussed those scared person.,morphology,determiner_noun_agreement,determiner_noun_agreement_with_adj_irregular_1,True,True,False,True,57,-58.799156188964844,-61.92729187011719,1
This hair upsets this determined alumnus.,This hair upsets this determined alumni.,morphology,determiner_noun_agreement,determiner_noun_agreement_with_adj_irregular_1,True,True,False,True,58,-53.71314239501953,-52.619049072265625,0
Some men have lifted those exposed lice.,Some men have lifted those exposed louse.,morphology,determiner_noun_agreement,determiner_noun_agreement_with_adj_irregular_1,True,True,False,True,59,-56.40797424316406,-61.236602783203125,1
Matt was criticizing that smart man.,Matt was criticizing that smart men.,morphology,determiner_noun_agreement,determiner_noun_agreement_with_adj_irregular_1,True,True,False,True,60,-40.682891845703125,-43.92626190185547,1
Karen didn't buy this blue nucleus.,Karen didn't buy this blue nuclei.,morphology,determiner_noun_agreement,determiner_noun_agreement_with_adj_irregular_1,True,True,False,True,61,-52.93822479248047,-54.03546142578125,1
Deanna might dislike this good analysis.,Deanna might dislike this good analyses.,morphology,determiner_noun_agreement,determiner_noun_agreement_with_adj_irregular_1,True,True,False,True,62,-53.10069274902344,-57.62397384643555,1
Helen approached this busy woman.,Helen approached this busy women.,morphology,determiner_noun_agreement,determiner_noun_agreement_with_adj_irregular_1,True,True,False,True,63,-43.17488098144531,-44.795570373535156,1
Florence wasn't approaching this unconvinced woman.,Florence wasn't approaching this unconvinced women.,morphology,determiner_noun_agreement,determiner_noun_agreement_with_adj_irregular_1,True,True,False,True,64,-69.56986999511719,-70.53084564208984,1
Rachelle can't appreciate those good synopses.,Rachelle can't appreciate those good synopsis.,morphology,determiner_noun_agreement,determiner_noun_agreement_with_adj_irregular_1,True,True,False,True,65,-64.93221282958984,-53.68742370605469,0
Jennifer hadn't thought about these out in the open octopi.,Jennifer hadn't thought about these out in the open octopus.,morphology,determiner_noun_agreement,determiner_noun_agreement_with_adj_irregular_1,True,True,False,True,66,-72.52064514160156,-61.198158264160156,0
Larry described these delighted children.,Larry described these delighted child.,morphology,determiner_noun_agreement,determiner_noun_agreement_with_adj_irregular_1,True,True,False,True,67,-38.58592224121094,-42.63468551635742,1
Many ladies arrive at that black oasis.,Many ladies arrive at that black oases.,morphology,determiner_noun_agreement,determiner_noun_agreement_with_adj_irregular_1,True,True,False,True,68,-52.98902130126953,-56.265220642089844,1
Sally admires those fast women.,Sally admires those fast woman.,morphology,determiner_noun_agreement,determiner_noun_agreement_with_adj_irregular_1,True,True,False,True,69,-50.97563552856445,-53.69805908203125,1
Leslie wouldn't investigate that sick woman.,Leslie wouldn't investigate that sick women.,morphology,determiner_noun_agreement,determiner_noun_agreement_with_adj_irregular_1,True,True,False,True,70,-56.988800048828125,-57.54442596435547,1
All essays did hurt that exposed person.,All essays did hurt that exposed people.,morphology,determiner_noun_agreement,determiner_noun_agreement_with_adj_irregular_1,True,True,False,True,71,-60.023658752441406,-58.84749221801758,0
Guy wouldn't sell that hard oasis.,Guy wouldn't sell that hard oases.,morphology,determiner_noun_agreement,determiner_noun_agreement_with_adj_irregular_1,True,True,False,True,72,-47.94301986694336,-52.04917907714844,1
Some woman hated that clever man.,Some woman hated that clever men.,morphology,determiner_noun_agreement,determiner_noun_agreement_with_adj_irregular_1,True,True,False,True,73,-43.22260284423828,-44.573997497558594,1
Amelia walks through this red oasis.,Amelia walks through this red oases.,morphology,determiner_noun_agreement,determiner_noun_agreement_with_adj_irregular_1,True,True,False,True,74,-50.56526184082031,-57.752479553222656,1
Susan did clean these yellow stimuli.,Susan did clean these yellow stimulus.,morphology,determiner_noun_agreement,determiner_noun_agreement_with_adj_irregular_1,True,True,False,True,75,-49.03902053833008,-49.8294677734375,1
Kristen observed that hopeful woman.,Kristen observed that hopeful women.,morphology,determiner_noun_agreement,determiner_noun_agreement_with_adj_irregular_1,True,True,False,True,76,-44.83762741088867,-44.732513427734375,0
Claire was messing up this small foot.,Claire was messing up this small feet.,morphology,determiner_noun_agreement,determiner_noun_agreement_with_adj_irregular_1,True,True,False,True,77,-49.67420196533203,-51.00543212890625,1
Some waiter hires that unemployed child.,Some waiter hires that unemployed children.,morphology,determiner_noun_agreement,determiner_noun_agreement_with_adj_irregular_1,True,True,False,True,78,-53.33577346801758,-50.60383224487305,0
Diana isn't running around that orange oasis.,Diana isn't running around that orange oases.,morphology,determiner_noun_agreement,determiner_noun_agreement_with_adj_irregular_1,True,True,False,True,79,-62.62123107910156,-67.30340576171875,1
This closet hasn't scared that lucky child.,This closet hasn't scared that lucky children.,morphology,determiner_noun_agreement,determiner_noun_agreement_with_adj_irregular_1,True,True,False,True,80,-61.94023132324219,-60.976898193359375,0
That doctor had hugged that confident woman.,That doctor had hugged that confident women.,morphology,determiner_noun_agreement,determiner_noun_agreement_with_adj_irregular_1,True,True,False,True,81,-53.93838882446289,-54.81505584716797,1
The waitresses research those red theses.,The waitresses research those red thesis.,morphology,determiner_noun_agreement,determiner_noun_agreement_with_adj_irregular_1,True,True,False,True,82,-69.39657592773438,-67.85000610351562,0
Many bananas confuse these displeased women.,Many bananas confuse these displeased woman.,morphology,determiner_noun_agreement,determiner_noun_agreement_with_adj_irregular_1,True,True,False,True,83,-54.534908294677734,-56.916873931884766,1
Committees loved this red thesis.,Committees loved this red theses.,morphology,determiner_noun_agreement,determiner_noun_agreement_with_adj_irregular_1,True,True,False,True,84,-49.7911376953125,-55.006473541259766,1
Deborah observes that lost alumnus.,Deborah observes that lost alumni.,morphology,determiner_noun_agreement,determiner_noun_agreement_with_adj_irregular_1,True,True,False,True,85,-48.87456512451172,-50.126220703125,1
Marla could break those whole feet.,Marla could break those whole foot.,morphology,determiner_noun_agreement,determiner_noun_agreement_with_adj_irregular_1,True,True,False,True,86,-52.1019287109375,-51.78197479248047,0
Regina alarmed these standing alumni.,Regina alarmed these standing alumnus.,morphology,determiner_noun_agreement,determiner_noun_agreement_with_adj_irregular_1,True,True,False,True,87,-57.047332763671875,-56.82456970214844,0
Kristen cures this scared child.,Kristen cures this scared children.,morphology,determiner_noun_agreement,determiner_noun_agreement_with_adj_irregular_1,True,True,False,True,88,-46.99674987792969,-48.869300842285156,1
All screens astound these unlucky people.,All screens astound these unlucky person.,morphology,determiner_noun_agreement,determiner_noun_agreement_with_adj_irregular_1,True,True,False,True,89,-59.74817657470703,-64.60709381103516,1
Curtis knew these confident men.,Curtis knew these confident man.,morphology,determiner_noun_agreement,determiner_noun_agreement_with_adj_irregular_1,True,True,False,True,90,-50.358734130859375,-52.039642333984375,1
Some lakes confused this unlucky woman.,Some lakes confused this unlucky women.,morphology,determiner_noun_agreement,determiner_noun_agreement_with_adj_irregular_1,True,True,False,True,91,-52.037193298339844,-53.95287322998047,1
Most men lift these blue fungi.,Most men lift these blue fungus.,morphology,determiner_noun_agreement,determiner_noun_agreement_with_adj_irregular_1,True,True,False,True,92,-46.979434967041016,-47.121192932128906,1
Kendra kissed those happy alumni.,Kendra kissed those happy alumnus.,morphology,determiner_noun_agreement,determiner_noun_agreement_with_adj_irregular_1,True,True,False,True,93,-58.212730407714844,-58.33796691894531,1
Most cakes did distract this unsure child.,Most cakes did distract this unsure children.,morphology,determiner_noun_agreement,determiner_noun_agreement_with_adj_irregular_1,True,True,False,True,94,-65.05523681640625,-66.0302734375,1
Katherine runs around that hard oasis.,Katherine runs around that hard oases.,morphology,determiner_noun_agreement,determiner_noun_agreement_with_adj_irregular_1,True,True,False,True,95,-58.523006439208984,-63.614051818847656,1
The Impressionists pass those black oases.,The Impressionists pass those black oasis.,morphology,determiner_noun_agreement,determiner_noun_agreement_with_adj_irregular_1,True,True,False,True,96,-67.13333129882812,-63.20945739746094,0
Andrea hadn't insulted this good woman.,Andrea hadn't insulted this good women.,morphology,determiner_noun_agreement,determiner_noun_agreement_with_adj_irregular_1,True,True,False,True,97,-57.179710388183594,-59.748355865478516,1
Beth will like these happy men.,Beth will like these happy man.,morphology,determiner_noun_agreement,determiner_noun_agreement_with_adj_irregular_1,True,True,False,True,98,-49.40159606933594,-50.689857482910156,1
Clyde broke that new foot.,Clyde broke that new feet.,morphology,determiner_noun_agreement,determiner_noun_agreement_with_adj_irregular_1,True,True,False,True,99,-50.65064239501953,-53.2401237487793,1
Bradley was watching these unsure men.,Bradley was watching these unsure man.,morphology,determiner_noun_agreement,determiner_noun_agreement_with_adj_irregular_1,True,True,False,True,100,-51.058677673339844,-50.73289489746094,0
The Clintons watch this confident man.,The Clintons watch this confident men.,morphology,determiner_noun_agreement,determiner_noun_agreement_with_adj_irregular_1,True,True,False,True,101,-46.65825653076172,-47.78196716308594,1
Debra had explored those gray oases.,Debra had explored those gray oasis.,morphology,determiner_noun_agreement,determiner_noun_agreement_with_adj_irregular_1,True,True,False,True,102,-60.517818450927734,-55.385459899902344,0
Homer was driving to this smooth oasis.,Homer was driving to this smooth oases.,morphology,determiner_noun_agreement,determiner_noun_agreement_with_adj_irregular_1,True,True,False,True,103,-54.34979248046875,-59.30645751953125,1
Some girl left that sick woman.,Some girl left that sick women.,morphology,determiner_noun_agreement,determiner_noun_agreement_with_adj_irregular_1,True,True,False,True,104,-41.44970703125,-43.223052978515625,1
Those cafes confuse this old man.,Those cafes confuse this old men.,morphology,determiner_noun_agreement,determiner_noun_agreement_with_adj_irregular_1,True,True,False,True,105,-44.70411682128906,-49.69244384765625,1
Vanessa wasn't driving to that green oasis.,Vanessa wasn't driving to that green oases.,morphology,determiner_noun_agreement,determiner_noun_agreement_with_adj_irregular_1,True,True,False,True,106,-63.996559143066406,-70.15702819824219,1
Nicole has referenced these long analyses.,Nicole has referenced these long analysis.,morphology,determiner_noun_agreement,determiner_noun_agreement_with_adj_irregular_1,True,True,False,True,107,-55.76528549194336,-56.49630355834961,1
Irene doesn't bore those hopeful women.,Irene doesn't bore those hopeful woman.,morphology,determiner_noun_agreement,determiner_noun_agreement_with_adj_irregular_1,True,True,False,True,108,-59.14543151855469,-61.56535720825195,1
Colleen didn't scare this old woman.,Colleen didn't scare this old women.,morphology,determiner_noun_agreement,determiner_noun_agreement_with_adj_irregular_1,True,True,False,True,109,-47.61323928833008,-51.024757385253906,1
Most sketches have looked like this green louse.,Most sketches have looked like this green lice.,morphology,determiner_noun_agreement,determiner_noun_agreement_with_adj_irregular_1,True,True,False,True,110,-56.968170166015625,-55.40418243408203,0
Sonia can't hug those hopeful children.,Sonia can't hug those hopeful child.,morphology,determiner_noun_agreement,determiner_noun_agreement_with_adj_irregular_1,True,True,False,True,111,-61.96786117553711,-63.287410736083984,1
Helen had shocked these hopeful children.,Helen had shocked these hopeful child.,morphology,determiner_noun_agreement,determiner_noun_agreement_with_adj_irregular_1,True,True,False,True,112,-52.22108459472656,-53.974151611328125,1
