sentence_good,sentence_bad,field,linguistics_term,UID,simple_LM_method,one_prefix_method,two_prefix_method,lexically_identical,pair_id,good_prob,bad_prob,correct
Melissa might ascend which stairs?,Which might Melissa ascend stairs?,syntax,island_effects,left_branch_island_echo_question,True,False,True,True,265,-49.918922424316406,-46.786460876464844,0
April was astounding which actress?,Which was April astounding actress?,syntax,island_effects,left_branch_island_echo_question,True,False,True,True,266,-43.080482482910156,-40.337486267089844,0
Patricia had bought whose snake?,Whose had Patricia bought snake?,syntax,island_effects,left_branch_island_echo_question,True,False,True,True,267,-51.754188537597656,-53.40306854248047,1
Steve has impressed whose companies?,Whose has Steve impressed companies?,syntax,island_effects,left_branch_island_echo_question,True,False,True,True,268,-38.16077423095703,-55.630409240722656,1
Carolyn had boasted about which actors?,Which had Carolyn boasted about actors?,syntax,island_effects,left_branch_island_echo_question,True,False,True,True,269,-58.09265899658203,-51.79659652709961,0
Helen would conceal which analyses?,Which would Helen conceal analyses?,syntax,island_effects,left_branch_island_echo_question,True,False,True,True,270,-51.9512939453125,-51.546993255615234,0
Alicia will walk through whose river?,Whose will Alicia walk through river?,syntax,island_effects,left_branch_island_echo_question,True,False,True,True,271,-60.22205352783203,-60.45880126953125,1
Jodi has worn whose skirt?,Whose has Jodi worn skirt?,syntax,island_effects,left_branch_island_echo_question,True,False,True,True,272,-49.97129440307617,-63.19940948486328,1
Christine might find whose wheelbarrow?,Whose might Christine find wheelbarrow?,syntax,island_effects,left_branch_island_echo_question,True,False,True,True,273,-62.9003791809082,-71.24263000488281,1
Some customers might respect what waiters?,What might some customers respect waiters?,syntax,island_effects,left_branch_island_echo_question,True,False,True,True,274,-53.234561920166016,-56.49939727783203,1
Amanda is firing what person?,What is Amanda firing person?,syntax,island_effects,left_branch_island_echo_question,True,False,True,True,275,-41.49202346801758,-41.77348327636719,1
This actor would worry which man?,Which would this actor worry man?,syntax,island_effects,left_branch_island_echo_question,True,False,True,True,276,-45.36499786376953,-48.1097526550293,1
Gina does describe what boys?,What does Gina describe boys?,syntax,island_effects,left_branch_island_echo_question,True,False,True,True,277,-41.681663513183594,-45.051841735839844,1
Tamara had observed which doctor?,Which had Tamara observed doctor?,syntax,island_effects,left_branch_island_echo_question,True,False,True,True,278,-47.15509033203125,-51.556297302246094,1
Some adults are lifting what window?,What are some adults lifting window?,syntax,island_effects,left_branch_island_echo_question,True,False,True,True,279,-47.97850799560547,-46.67997741699219,0
Galileo had researched what lake?,What had Galileo researched lake?,syntax,island_effects,left_branch_island_echo_question,True,False,True,True,280,-56.449981689453125,-50.691490173339844,0
Benjamin has loved what cashier?,What has Benjamin loved cashier?,syntax,island_effects,left_branch_island_echo_question,True,False,True,True,281,-56.57998275756836,-53.77149200439453,0
Jessica is lifting whose mushrooms?,Whose is Jessica lifting mushrooms?,syntax,island_effects,left_branch_island_echo_question,True,False,True,True,282,-39.99773025512695,-54.962303161621094,1
Adam has argued about what offspring?,What has Adam argued about offspring?,syntax,island_effects,left_branch_island_echo_question,True,False,True,True,283,-44.690155029296875,-51.807647705078125,1
Stacey had seen whose movie theater?,Whose had Stacey seen movie theater?,syntax,island_effects,left_branch_island_echo_question,True,False,True,True,284,-55.713382720947266,-72.47785949707031,1
Randolf could escape from what public parks?,What could Randolf escape from public parks?,syntax,island_effects,left_branch_island_echo_question,True,False,True,True,285,-64.85404205322266,-72.54255676269531,1
That customer can heal what louse?,What can that customer heal louse?,syntax,island_effects,left_branch_island_echo_question,True,False,True,True,286,-50.870933532714844,-54.475669860839844,1
Michael is hurting which ladies?,Which is Michael hurting ladies?,syntax,island_effects,left_branch_island_echo_question,True,False,True,True,287,-35.84349822998047,-39.741825103759766,1
Connie might hug what students?,What might Connie hug students?,syntax,island_effects,left_branch_island_echo_question,True,False,True,True,288,-49.971588134765625,-49.522247314453125,0
Heidi is concealing whose essay?,Whose is Heidi concealing essay?,syntax,island_effects,left_branch_island_echo_question,True,False,True,True,289,-63.32606506347656,-64.11750793457031,1
The Impressionists had worn what sock?,What had the Impressionists worn sock?,syntax,island_effects,left_branch_island_echo_question,True,False,True,True,290,-67.49385070800781,-67.91838073730469,1
All blouses have stunned what customers?,What have all blouses stunned customers?,syntax,island_effects,left_branch_island_echo_question,True,False,True,True,291,-57.223480224609375,-59.668724060058594,1
Martha would lift whose broccoli?,Whose would Martha lift broccoli?,syntax,island_effects,left_branch_island_echo_question,True,False,True,True,292,-50.0007438659668,-56.743953704833984,1
Charles is working with which man?,Which is Charles working with man?,syntax,island_effects,left_branch_island_echo_question,True,False,True,True,293,-33.68461990356445,-41.201637268066406,1
Doctors had bought which dog?,Which had doctors bought dog?,syntax,island_effects,left_branch_island_echo_question,True,False,True,True,294,-35.566566467285156,-37.90311813354492,1
Brian had hated what adult?,What had Brian hated adult?,syntax,island_effects,left_branch_island_echo_question,True,False,True,True,295,-37.989715576171875,-44.74848175048828,1
James had astounded what cashier?,What had James astounded cashier?,syntax,island_effects,left_branch_island_echo_question,True,False,True,True,296,-55.14419937133789,-59.436988830566406,1
Some guests are concealing which patient?,Which are some guests concealing patient?,syntax,island_effects,left_branch_island_echo_question,True,False,True,True,297,-57.33351135253906,-59.14662551879883,1
A guest can return to whose hospitals?,Whose can a guest return to hospitals?,syntax,island_effects,left_branch_island_echo_question,True,False,True,True,298,-54.61969757080078,-59.3060302734375,1
All ladders could disturb what governments?,What could all ladders disturb governments?,syntax,island_effects,left_branch_island_echo_question,True,False,True,True,299,-55.4086799621582,-58.49848937988281,1
Natalie had attacked what waitress?,What had Natalie attacked waitress?,syntax,island_effects,left_branch_island_echo_question,True,False,True,True,300,-50.89726638793945,-49.2720947265625,0
Nancy is annoying what people?,What is Nancy annoying people?,syntax,island_effects,left_branch_island_echo_question,True,False,True,True,301,-39.01865005493164,-38.94551086425781,0
The Clintons were stunning which senators?,Which were the Clintons stunning senators?,syntax,island_effects,left_branch_island_echo_question,True,False,True,True,302,-58.50529479980469,-55.86134719848633,0
Kevin does cure which pedestrian?,Which does Kevin cure pedestrian?,syntax,island_effects,left_branch_island_echo_question,True,False,True,True,303,-43.30107879638672,-48.79545593261719,1
Victoria was going to which school?,Which was Victoria going to school?,syntax,island_effects,left_branch_island_echo_question,True,False,True,True,304,-33.93254470825195,-34.99173355102539,1
Julie might clean what fork?,What might Julie clean fork?,syntax,island_effects,left_branch_island_echo_question,True,False,True,True,305,-45.00967025756836,-46.221229553222656,1
Christina had broken what tooth?,What had Christina broken tooth?,syntax,island_effects,left_branch_island_echo_question,True,False,True,True,306,-42.65731430053711,-45.30995178222656,1
Denise will have whose pictures?,Whose will Denise have pictures?,syntax,island_effects,left_branch_island_echo_question,True,False,True,True,307,-39.05604553222656,-47.55984878540039,1
Alexander is dropping by whose public parks?,Whose is Alexander dropping by public parks?,syntax,island_effects,left_branch_island_echo_question,True,False,True,True,308,-52.12147521972656,-67.21216583251953,1
These fish are ascending which stairs?,Which are these fish ascending stairs?,syntax,island_effects,left_branch_island_echo_question,True,False,True,True,309,-44.99790954589844,-46.357749938964844,1
Douglas is astounding what child?,What is Douglas astounding child?,syntax,island_effects,left_branch_island_echo_question,True,False,True,True,310,-48.69844436645508,-42.52300262451172,0
Carl had exited what hill?,What had Carl exited hill?,syntax,island_effects,left_branch_island_echo_question,True,False,True,True,311,-41.209049224853516,-45.287872314453125,1
Jacqueline was concealing which boy?,Which was Jacqueline concealing boy?,syntax,island_effects,left_branch_island_echo_question,True,False,True,True,312,-62.542266845703125,-61.20037841796875,0
Brian was boasting about what alumnus?,What was Brian boasting about alumnus?,syntax,island_effects,left_branch_island_echo_question,True,False,True,True,313,-59.145118713378906,-65.73628234863281,1
Brett is kissing which doctor?,Which is Brett kissing doctor?,syntax,island_effects,left_branch_island_echo_question,True,False,True,True,314,-47.65086364746094,-40.406734466552734,0
Andrew should visit which children?,Which should Andrew visit children?,syntax,island_effects,left_branch_island_echo_question,True,False,True,True,315,-34.690208435058594,-44.88275909423828,1
Tiffany is watching which adult?,Which is Tiffany watching adult?,syntax,island_effects,left_branch_island_echo_question,True,False,True,True,316,-52.75559616088867,-42.25407409667969,0
Diane does bring whose windows?,Whose does Diane bring windows?,syntax,island_effects,left_branch_island_echo_question,True,False,True,True,317,-49.211814880371094,-52.68816375732422,1
Some drivers have bored which waitress?,Which have some drivers bored waitress?,syntax,island_effects,left_branch_island_echo_question,True,False,True,True,318,-51.06489562988281,-52.48796081542969,1
Andrea has hugged what dancer?,What has Andrea hugged dancer?,syntax,island_effects,left_branch_island_echo_question,True,False,True,True,319,-53.21983337402344,-48.478904724121094,0
Helen is annoying what man?,What is Helen annoying man?,syntax,island_effects,left_branch_island_echo_question,True,False,True,True,320,-38.873355865478516,-36.28367233276367,0
A lot of dancers had embarrassed what pedestrian?,What had a lot of dancers embarrassed pedestrian?,syntax,island_effects,left_branch_island_echo_question,True,False,True,True,321,-63.89946746826172,-58.98761749267578,0
Gregory could break what computers?,What could Gregory break computers?,syntax,island_effects,left_branch_island_echo_question,True,False,True,True,322,-45.725406646728516,-47.603111267089844,1
That senator could think about what face?,What could that senator think about face?,syntax,island_effects,left_branch_island_echo_question,True,False,True,True,323,-47.958744049072266,-51.10575866699219,1
Steve has investigated which cashiers?,Which has Steve investigated cashiers?,syntax,island_effects,left_branch_island_echo_question,True,False,True,True,324,-47.29103469848633,-54.61420440673828,1
Wendy has descended what ladders?,What has Wendy descended ladders?,syntax,island_effects,left_branch_island_echo_question,True,False,True,True,325,-52.152015686035156,-50.86676788330078,0
A lady might bike to whose art gallery?,Whose might a lady bike to art gallery?,syntax,island_effects,left_branch_island_echo_question,True,False,True,True,326,-66.042724609375,-67.62367248535156,1
This jacket can annoy what doctor?,What can this jacket annoy doctor?,syntax,island_effects,left_branch_island_echo_question,True,False,True,True,327,-49.57310485839844,-50.34564208984375,1
Rebecca is hiding what actors?,What is Rebecca hiding actors?,syntax,island_effects,left_branch_island_echo_question,True,False,True,True,328,-45.04558181762695,-41.54794692993164,0
Some dancer had worked with which customer?,Which had some dancer worked with customer?,syntax,island_effects,left_branch_island_echo_question,True,False,True,True,329,-50.423519134521484,-50.89460754394531,1
The casseroles did alarm which actresses?,Which did the casseroles alarm actresses?,syntax,island_effects,left_branch_island_echo_question,True,False,True,True,330,-72.95870971679688,-68.8385009765625,0
Becky should fix what screen?,What should Becky fix screen?,syntax,island_effects,left_branch_island_echo_question,True,False,True,True,331,-39.25755310058594,-43.52463150024414,1
Sara has insulted what stories?,What has Sara insulted stories?,syntax,island_effects,left_branch_island_echo_question,True,False,True,True,332,-44.63917541503906,-44.17082214355469,0
Thomas should find which truck?,Which should Thomas find truck?,syntax,island_effects,left_branch_island_echo_question,True,False,True,True,333,-33.85987854003906,-40.5730094909668,1
Omar has thought about which synopsis?,Which has Omar thought about synopsis?,syntax,island_effects,left_branch_island_echo_question,True,False,True,True,334,-55.7328987121582,-54.82139587402344,0
Dawn would bike to whose hospitals?,Whose would Dawn bike to hospitals?,syntax,island_effects,left_branch_island_echo_question,True,False,True,True,335,-59.17219543457031,-60.545047760009766,1
Chad had broken which carts?,Which had Chad broken carts?,syntax,island_effects,left_branch_island_echo_question,True,False,True,True,336,-47.31828689575195,-47.440521240234375,1
A pedestrian had hired what teenager?,What had a pedestrian hired teenager?,syntax,island_effects,left_branch_island_echo_question,True,False,True,True,337,-54.34891891479492,-52.965293884277344,0
Carolyn had examined what thesis?,What had Carolyn examined thesis?,syntax,island_effects,left_branch_island_echo_question,True,False,True,True,338,-52.54706573486328,-49.723724365234375,0
Every actress has brought whose lakes?,Whose has every actress brought lakes?,syntax,island_effects,left_branch_island_echo_question,True,False,True,True,339,-52.81097412109375,-61.86686706542969,1
Elaine had referenced what analyses?,What had Elaine referenced analyses?,syntax,island_effects,left_branch_island_echo_question,True,False,True,True,340,-57.037330627441406,-53.01351547241211,0
All pictures will look like whose ladders?,Whose will all pictures look like ladders?,syntax,island_effects,left_branch_island_echo_question,True,False,True,True,341,-53.14537811279297,-62.501922607421875,1
Clyde is arguing about which customers?,Which is Clyde arguing about customers?,syntax,island_effects,left_branch_island_echo_question,True,False,True,True,342,-64.85067749023438,-49.3354377746582,0
Samuel has bored what cashier?,What has Samuel bored cashier?,syntax,island_effects,left_branch_island_echo_question,True,False,True,True,343,-58.81271743774414,-55.59432601928711,0
Rodney had praised whose theses?,Whose had Rodney praised theses?,syntax,island_effects,left_branch_island_echo_question,True,False,True,True,344,-57.535438537597656,-61.649131774902344,1
Brian had thought about which museum?,Which had Brian thought about museum?,syntax,island_effects,left_branch_island_echo_question,True,False,True,True,345,-40.15614318847656,-46.2252197265625,1
Benjamin had returned to which oases?,Which had Benjamin returned to oases?,syntax,island_effects,left_branch_island_echo_question,True,False,True,True,346,-57.45475387573242,-52.907676696777344,0
All men were attacking what cashiers?,What were all men attacking cashiers?,syntax,island_effects,left_branch_island_echo_question,True,False,True,True,347,-54.613800048828125,-53.68811798095703,0
Victoria did forget what dancers?,What did Victoria forget dancers?,syntax,island_effects,left_branch_island_echo_question,True,False,True,True,348,-38.04909896850586,-46.32884979248047,1
Some hospital is boring what child?,What is some hospital boring child?,syntax,island_effects,left_branch_island_echo_question,True,False,True,True,349,-41.87812423706055,-42.93891525268555,1
Some tomatoes did look like whose painting?,Whose did some tomatoes look like painting?,syntax,island_effects,left_branch_island_echo_question,True,False,True,True,350,-51.50416946411133,-56.29448699951172,1
A lot of actors have known which men?,Which have a lot of actors known men?,syntax,island_effects,left_branch_island_echo_question,True,False,True,True,351,-52.38267135620117,-47.89593505859375,0
Karen did praise what offspring?,What did Karen praise offspring?,syntax,island_effects,left_branch_island_echo_question,True,False,True,True,352,-49.30356979370117,-45.11962127685547,0
Christina is concealing what people?,What is Christina concealing people?,syntax,island_effects,left_branch_island_echo_question,True,False,True,True,353,-49.847084045410156,-51.95853805541992,1
That actor had criticized which girl?,Which had that actor criticized girl?,syntax,island_effects,left_branch_island_echo_question,True,False,True,True,354,-50.4942626953125,-48.69266128540039,0
Beth would look like what prints?,What would Beth look like prints?,syntax,island_effects,left_branch_island_echo_question,True,False,True,True,355,-46.966922760009766,-47.76557159423828,1
Brian should tour whose art galleries?,Whose should Brian tour art galleries?,syntax,island_effects,left_branch_island_echo_question,True,False,True,True,356,-51.41007995605469,-67.41062927246094,1
All organizations are discussing which patient?,Which are all organizations discussing patient?,syntax,island_effects,left_branch_island_echo_question,True,False,True,True,357,-48.871917724609375,-50.080596923828125,1
Sarah might think about which boys?,Which might Sarah think about boys?,syntax,island_effects,left_branch_island_echo_question,True,False,True,True,358,-37.392906188964844,-44.27725601196289,1
Patients might praise which person?,Which might patients praise person?,syntax,island_effects,left_branch_island_echo_question,True,False,True,True,359,-51.977630615234375,-45.46965789794922,0
Cindy is observing what men?,What is Cindy observing men?,syntax,island_effects,left_branch_island_echo_question,True,False,True,True,360,-45.29900360107422,-43.275535583496094,0
Gina was running around whose glacier?,Whose was Gina running around glacier?,syntax,island_effects,left_branch_island_echo_question,True,False,True,True,361,-50.81877899169922,-61.52690124511719,1
Elizabeth is attacking which teachers?,Which is Elizabeth attacking teachers?,syntax,island_effects,left_branch_island_echo_question,True,False,True,True,362,-35.57353591918945,-41.97757339477539,1
Kenneth has biked to whose library?,Whose has Kenneth biked to library?,syntax,island_effects,left_branch_island_echo_question,True,False,True,True,363,-61.32905578613281,-65.53672790527344,1
Marla has arrived at which public park?,Which has Marla arrived at public park?,syntax,island_effects,left_branch_island_echo_question,True,False,True,True,364,-53.95307922363281,-59.06293487548828,1
Ann is boycotting which museum?,Which is Ann boycotting museum?,syntax,island_effects,left_branch_island_echo_question,True,False,True,True,365,-48.05789566040039,-50.35946273803711,1
Phillip had investigated which drivers?,Which had Phillip investigated drivers?,syntax,island_effects,left_branch_island_echo_question,True,False,True,True,366,-50.412193298339844,-46.707672119140625,0
The car was shocking what actresses?,What was the car shocking actresses?,syntax,island_effects,left_branch_island_echo_question,True,False,True,True,367,-50.65663528442383,-45.2158317565918,0
Patricia had fixed whose cars?,Whose had Patricia fixed cars?,syntax,island_effects,left_branch_island_echo_question,True,False,True,True,368,-50.74676513671875,-51.40886688232422,1
Patricia has bought whose bikes?,Whose has Patricia bought bikes?,syntax,island_effects,left_branch_island_echo_question,True,False,True,True,369,-53.26151657104492,-54.83849334716797,1
Veronica will think about what peppers?,What will Veronica think about peppers?,syntax,island_effects,left_branch_island_echo_question,True,False,True,True,370,-49.34984588623047,-49.08284378051758,0
Christopher might break which cup?,Which might Christopher break cup?,syntax,island_effects,left_branch_island_echo_question,True,False,True,True,371,-36.609798431396484,-42.99842071533203,1
Homer has fired which man?,Which has Homer fired man?,syntax,island_effects,left_branch_island_echo_question,True,False,True,True,372,-46.70011901855469,-42.644649505615234,0
Catherine can research what brochure?,What can Catherine research brochure?,syntax,island_effects,left_branch_island_echo_question,True,False,True,True,373,-61.30857849121094,-55.02980041503906,0
Janice had fled from which child?,Which had Janice fled from child?,syntax,island_effects,left_branch_island_echo_question,True,False,True,True,374,-46.64997100830078,-52.30952453613281,1
These commentaries were disagreeing with what boys?,What were these commentaries disagreeing with boys?,syntax,island_effects,left_branch_island_echo_question,True,False,True,True,375,-67.50072479248047,-71.47708129882812,1
Mark had visited which grocery store?,Which had Mark visited grocery store?,syntax,island_effects,left_branch_island_echo_question,True,False,True,True,376,-48.64398193359375,-51.811710357666016,1
Amy does ascend which mountains?,Which does Amy ascend mountains?,syntax,island_effects,left_branch_island_echo_question,True,False,True,True,377,-43.40040588378906,-47.06982421875,1
Veronica would research whose stories?,Whose would Veronica research stories?,syntax,island_effects,left_branch_island_echo_question,True,False,True,True,378,-53.09663391113281,-53.04172897338867,0
Dennis was complaining about what women?,What was Dennis complaining about women?,syntax,island_effects,left_branch_island_echo_question,True,False,True,True,379,-45.49278259277344,-44.461116790771484,0
Dan is boring what dancer?,What is Dan boring dancer?,syntax,island_effects,left_branch_island_echo_question,True,False,True,True,380,-34.50928497314453,-41.123260498046875,1
The blouses were bothering what senator?,What were the blouses bothering senator?,syntax,island_effects,left_branch_island_echo_question,True,False,True,True,381,-56.82077407836914,-57.12845230102539,1
Angela had ascended whose mountain?,Whose had Angela ascended mountain?,syntax,island_effects,left_branch_island_echo_question,True,False,True,True,382,-52.47237777709961,-57.79695510864258,1
Nina can love which alumnus?,Which can Nina love alumnus?,syntax,island_effects,left_branch_island_echo_question,True,False,True,True,383,-57.09625244140625,-57.70887756347656,1
Travis had fixed which couches?,Which had Travis fixed couches?,syntax,island_effects,left_branch_island_echo_question,True,False,True,True,384,-58.514591217041016,-52.64109420776367,0
Amelia has healed which guests?,Which has Amelia healed guests?,syntax,island_effects,left_branch_island_echo_question,True,False,True,True,385,-50.11533737182617,-47.64986801147461,0
Bradley does sell which coats?,Which does Bradley sell coats?,syntax,island_effects,left_branch_island_echo_question,True,False,True,True,386,-48.27088928222656,-46.40979766845703,0
Gregory was scanning whose analysis?,Whose was Gregory scanning analysis?,syntax,island_effects,left_branch_island_echo_question,True,False,True,True,387,-49.06311798095703,-58.16428756713867,1
Janet could ascend which slopes?,Which could Janet ascend slopes?,syntax,island_effects,left_branch_island_echo_question,True,False,True,True,388,-50.350685119628906,-53.03486251831055,1
A hospital could appreciate whose libraries?,Whose could a hospital appreciate libraries?,syntax,island_effects,left_branch_island_echo_question,True,False,True,True,389,-55.22468185424805,-63.118751525878906,1
Joseph has sold whose closet?,Whose has Joseph sold closet?,syntax,island_effects,left_branch_island_echo_question,True,False,True,True,390,-38.40669250488281,-53.877723693847656,1
Many girls had fired what teenagers?,What had many girls fired teenagers?,syntax,island_effects,left_branch_island_echo_question,True,False,True,True,391,-45.047340393066406,-47.65226745605469,1
Larry has worried what children?,What has Larry worried children?,syntax,island_effects,left_branch_island_echo_question,True,False,True,True,392,-34.47407150268555,-42.663360595703125,1
Claire was questioning what government?,What was Claire questioning government?,syntax,island_effects,left_branch_island_echo_question,True,False,True,True,393,-47.5185432434082,-45.364173889160156,0
Becca has fired which girl?,Which has Becca fired girl?,syntax,island_effects,left_branch_island_echo_question,True,False,True,True,394,-47.95222473144531,-52.50277328491211,1
The drawings were looking like what octopi?,What were the drawings looking like octopi?,syntax,island_effects,left_branch_island_echo_question,True,False,True,True,395,-61.21309280395508,-64.10491180419922,1
Some drawing does look like whose sketches?,Whose does some drawing look like sketches?,syntax,island_effects,left_branch_island_echo_question,True,False,True,True,396,-52.637691497802734,-59.669456481933594,1
Sally has referenced which customer?,Which has Sally referenced customer?,syntax,island_effects,left_branch_island_echo_question,True,False,True,True,397,-50.22068786621094,-47.175865173339844,0
These waiters are concealing which analyses?,Which are these waiters concealing analyses?,syntax,island_effects,left_branch_island_echo_question,True,False,True,True,398,-71.4861068725586,-72.25180053710938,1
