sentence_good,sentence_bad,field,linguistics_term,UID,simple_LM_method,one_prefix_method,two_prefix_method,lexically_identical,pair_id,good_prob,bad_prob,correct
Carol's supervisors had disturbed one best friend and every sister of these customers had disturbed few exposed best friend.,Carol's supervisors had disturbed one small best friend and every sister of these customers had disturbed few exposed.,syntax,ellipsis,ellipsis_n_bar_2,True,False,False,False,732,-160.02886962890625,-156.2364501953125,0
Samuel had criticized four associates and Edward's colleague had criticized five unconvinced associates.,Samuel had criticized four employed associates and Edward's colleague had criticized five unconvinced.,syntax,ellipsis,ellipsis_n_bar_2,True,False,False,False,733,-134.94644165039062,-138.81637573242188,1
Frank wouldn't leave one dermatologist and Janice wouldn't leave two standing dermatologist.,Frank wouldn't leave one excited dermatologist and Janice wouldn't leave two standing.,syntax,ellipsis,ellipsis_n_bar_2,True,False,False,False,734,-118.03498840332031,-108.85887145996094,0
Some nieces of every actress investigated a few granddaughters and Florence investigated a lot busy granddaughters.,Some nieces of every actress investigated a few concealed granddaughters and Florence investigated a lot busy.,syntax,ellipsis,ellipsis_n_bar_2,True,False,False,False,735,-167.1109619140625,-157.40045166015625,0
Reports about art hadn't bored one daughter of and Julie hadn't bored some concealed daughter of.,Reports about art hadn't bored one ill daughter of and Julie hadn't bored some concealed.,syntax,ellipsis,ellipsis_n_bar_2,True,False,False,False,736,-137.63150024414062,-129.110595703125,0
Brian talks to one grandson of and some person's grandfather talks to a lot serious grandson of.,Brian talks to one unsure grandson of and some person's grandfather talks to a lot serious.,syntax,ellipsis,ellipsis_n_bar_2,True,False,False,False,737,-113.45126342773438,-112.33642578125,0
Noah can't hide one lake and Jeffrey's fathers can't hide some important lake.,Noah can't hide one new lake and Jeffrey's fathers can't hide some important.,syntax,ellipsis,ellipsis_n_bar_2,True,False,False,False,738,-111.05245971679688,-107.83838653564453,0
This projector did bore one sister of and a lot of glasses did bore more fast sister of.,This projector did bore one unemployed sister of and a lot of glasses did bore more fast.,syntax,ellipsis,ellipsis_n_bar_2,True,False,False,False,739,-138.1737060546875,-132.46417236328125,0
Companies hate several sons and the Clintons hate a few uncertain sons.,Companies hate several clever sons and the Clintons hate a few uncertain.,syntax,ellipsis,ellipsis_n_bar_2,True,False,False,False,740,-90.07124328613281,-99.26393127441406,1
That documentary distracts no dancers and all men distracts some important dancers.,That documentary distracts no bad dancers and all men distracts some important.,syntax,ellipsis,ellipsis_n_bar_2,True,False,False,False,741,-109.14339447021484,-107.09361267089844,0
The Impressionists disgusts one association and every candle disgusts more bad association.,The Impressionists disgusts one good association and every candle disgusts more bad.,syntax,ellipsis,ellipsis_n_bar_2,True,False,False,False,742,-126.58564758300781,-124.30807495117188,0
Candice wasn't exploring three mountains and Catherine wasn't exploring at least as many red mountains.,Candice wasn't exploring three cheap mountains and Catherine wasn't exploring at least as many red.,syntax,ellipsis,ellipsis_n_bar_2,True,False,False,False,743,-111.18424987792969,-117.0295639038086,1
These companies upset one man and the cakes upset five exposed man.,These companies upset one clever man and the cakes upset five exposed.,syntax,ellipsis,ellipsis_n_bar_2,True,False,False,False,744,-94.63461303710938,-99.59571838378906,1
Some coat isn't aggravating one electrician and Tiffany isn't aggravating two nice electrician.,Some coat isn't aggravating one content electrician and Tiffany isn't aggravating two nice.,syntax,ellipsis,ellipsis_n_bar_2,True,False,False,False,745,-141.3643341064453,-134.22860717773438,0
Kevin's employee was cleaning five turtles and the people aren't cleaning four red turtles.,Kevin's employee was cleaning five exposed turtles and the people aren't cleaning four red.,syntax,ellipsis,ellipsis_n_bar_2,True,False,False,False,746,-108.77227020263672,-114.05520629882812,1
Bruce hasn't exited one restaurant and Renee's nephew hasn't exited a few messy restaurant.,Bruce hasn't exited one white restaurant and Renee's nephew hasn't exited a few messy.,syntax,ellipsis,ellipsis_n_bar_2,True,False,False,False,747,-124.4667739868164,-124.37200164794922,0
A daughter of Marcus remembered two lawyers and that sister of Clyde remembered three fast lawyers.,A daughter of Marcus remembered two unlucky lawyers and that sister of Clyde remembered three fast.,syntax,ellipsis,ellipsis_n_bar_2,True,False,False,False,748,-125.53541564941406,-127.02706146240234,1
Carol's piano teachers remember three mentees and Beth's podiatrists remember at least as many scared mentees.,Carol's piano teachers remember three unemployed mentees and Beth's podiatrists remember at least as many scared.,syntax,ellipsis,ellipsis_n_bar_2,True,False,False,False,749,-195.99349975585938,-184.45069885253906,0
All grandmothers of Becky concealed few lawyers and Kenneth concealed many good lawyers.,All grandmothers of Becky concealed few determined lawyers and Kenneth concealed many good.,syntax,ellipsis,ellipsis_n_bar_2,True,False,False,False,750,-115.32742309570312,-118.22784423828125,1
Children forget two men and the Clintons forget three confident men.,Children forget two smart men and the Clintons forget three confident.,syntax,ellipsis,ellipsis_n_bar_2,True,False,False,False,751,-84.81541442871094,-92.13168334960938,1
Travis has upset no doctors and every car has upset some happy doctors.,Travis has upset no lucky doctors and every car has upset some happy.,syntax,ellipsis,ellipsis_n_bar_2,True,False,False,False,752,-103.42215728759766,-104.06593322753906,1
Some boy's handyman appreciates one hill and Bethany appreciates two purple hill.,Some boy's handyman appreciates one hard hill and Bethany appreciates two purple.,syntax,ellipsis,ellipsis_n_bar_2,True,False,False,False,753,-127.86339569091797,-129.00125122070312,1
Amy would run around a lot of libraries and Susan would run around a few old libraries.,Amy would run around a lot of black libraries and Susan would run around a few old.,syntax,ellipsis,ellipsis_n_bar_2,True,False,False,False,754,-94.45323944091797,-90.77885437011719,0
Melissa forgot one newspaper article and Florence's girlfriend forgot four smooth newspaper article.,Melissa forgot one white newspaper article and Florence's girlfriend forgot four smooth.,syntax,ellipsis,ellipsis_n_bar_2,True,False,False,False,755,-120.5596694946289,-110.7373046875,0
Robert bothered one podiatrist and Samuel bothered four long podiatrist.,Robert bothered one unemployed podiatrist and Samuel bothered four long.,syntax,ellipsis,ellipsis_n_bar_2,True,False,False,False,756,-139.63136291503906,-115.04522705078125,0
Cynthia had walked through five high schools and David had walked through four out in the open high schools.,Cynthia had walked through five blue high schools and David had walked through four out in the open.,syntax,ellipsis,ellipsis_n_bar_2,True,False,False,False,757,-133.51744079589844,-127.588134765625,0
Every sister of Phillip could sound like one cafe and Brenda could sound like many important cafe.,Every sister of Phillip could sound like one rough cafe and Brenda could sound like many important.,syntax,ellipsis,ellipsis_n_bar_2,True,False,False,False,758,-119.10684967041016,-117.27751159667969,0
Kirsten's sisters have upset five banks and Alicia hadn't upset four orange banks.,Kirsten's sisters have upset five green banks and Alicia hadn't upset four orange.,syntax,ellipsis,ellipsis_n_bar_2,True,False,False,False,759,-132.42526245117188,-129.64947509765625,0
A lot of teachers annoy one bank and a lot of commentaries annoy a lot purple bank.,A lot of teachers annoy one orange bank and a lot of commentaries annoy a lot purple.,syntax,ellipsis,ellipsis_n_bar_2,True,False,False,False,760,-125.36040496826172,-128.32838439941406,1
Cynthia praised a few books and Stacy praised a lot rough books.,Cynthia praised a few exposed books and Stacy praised a lot rough.,syntax,ellipsis,ellipsis_n_bar_2,True,False,False,False,761,-99.2047348022461,-108.75802612304688,1
Joel hasn't remembered one documentary and Rhonda's electrician hasn't remembered three long documentary.,Joel hasn't remembered one bad documentary and Rhonda's electrician hasn't remembered three long.,syntax,ellipsis,ellipsis_n_bar_2,True,False,False,False,762,-138.6233673095703,-134.41709899902344,0
Sheila hasn't disgusted many women and Tammy hasn't disgusted few uncertain women.,Sheila hasn't disgusted many determined women and Tammy hasn't disgusted few uncertain.,syntax,ellipsis,ellipsis_n_bar_2,True,False,False,False,763,-108.8623275756836,-116.74749755859375,1
Randolf's partner talks to three actors and Jane talks to at least as many exposed actors.,Randolf's partner talks to three bad actors and Jane talks to at least as many exposed.,syntax,ellipsis,ellipsis_n_bar_2,True,False,False,False,764,-119.52413177490234,-121.5486831665039,1
Many fathers of George couldn't sell three slopes and the children couldn't sell almost as many bad slopes.,Many fathers of George couldn't sell three yellow slopes and the children couldn't sell almost as many bad.,syntax,ellipsis,ellipsis_n_bar_2,True,False,False,False,765,-127.79116821289062,-124.43406677246094,0
Jennifer's grandmothers go to two high schools and Alicia's doctors go to three concealed high schools.,Jennifer's grandmothers go to two clean high schools and Alicia's doctors go to three concealed.,syntax,ellipsis,ellipsis_n_bar_2,True,False,False,False,766,-125.71424102783203,-120.14214324951172,0
All pies alarm few pedestrians and all lamps alarm many unconvinced pedestrians.,All pies alarm few busy pedestrians and all lamps alarm many unconvinced.,syntax,ellipsis,ellipsis_n_bar_2,True,False,False,False,767,-130.61782836914062,-131.4154815673828,1
A library talked to three daughters of and Spain talked to at least as many standing daughters of.,A library talked to three ill daughters of and Spain talked to at least as many standing.,syntax,ellipsis,ellipsis_n_bar_2,True,False,False,False,768,-120.9162826538086,-116.589111328125,0
Some children weren't leaving five grocery stores and Edward wasn't leaving four messy grocery stores.,Some children weren't leaving five clean grocery stores and Edward wasn't leaving four messy.,syntax,ellipsis,ellipsis_n_bar_2,True,False,False,False,769,-131.0975799560547,-120.91187286376953,0
The daughters of Daniel return to a few customers and Chad's best friends return to several scared customers.,The daughters of Daniel return to a few determined customers and Chad's best friends return to several scared.,syntax,ellipsis,ellipsis_n_bar_2,True,False,False,False,770,-132.57704162597656,-134.8470916748047,1
Bradley couldn't break few skateboards and Carrie couldn't break many small skateboards.,Bradley couldn't break few hidden skateboards and Carrie couldn't break many small.,syntax,ellipsis,ellipsis_n_bar_2,True,False,False,False,771,-117.36396026611328,-113.0411148071289,0
Andrea has argued about a few movies and Jacqueline has argued about a lot important movies.,Andrea has argued about a few popular movies and Jacqueline has argued about a lot important.,syntax,ellipsis,ellipsis_n_bar_2,True,False,False,False,772,-107.94003295898438,-113.70857238769531,1
Gina might forget one student and Elizabeth might forget five lucky student.,Gina might forget one clever student and Elizabeth might forget five lucky.,syntax,ellipsis,ellipsis_n_bar_2,True,False,False,False,773,-95.23167419433594,-95.68742370605469,1
A lot of men don't forget one sister and Carol might forget at least as many exposed sister.,A lot of men don't forget one standing sister and Carol might forget at least as many exposed.,syntax,ellipsis,ellipsis_n_bar_2,True,False,False,False,774,-117.38713073730469,-121.44992065429688,1
Elaine shouldn't scan many friends of and every lady shouldn't scan few displeased friends of.,Elaine shouldn't scan many clever friends of and every lady shouldn't scan few displeased.,syntax,ellipsis,ellipsis_n_bar_2,True,False,False,False,775,-139.54837036132812,-136.19808959960938,0
Kevin arrives at three college campuses and Holly's doctor arrives at two hidden college campuses.,Kevin arrives at three important college campuses and Holly's doctor arrives at two hidden.,syntax,ellipsis,ellipsis_n_bar_2,True,False,False,False,776,-123.44148254394531,-113.68125915527344,0
Kristin's senators see one guest and Theresa's dentists see a few standing guest.,Kristin's senators see one sick guest and Theresa's dentists see a few standing.,syntax,ellipsis,ellipsis_n_bar_2,True,False,False,False,777,-129.84378051757812,-131.24842834472656,1
That friend of Gary is bothering a few ex-wives and Kendra is bothering several young ex-wives.,That friend of Gary is bothering a few ill ex-wives and Kendra is bothering several young.,syntax,ellipsis,ellipsis_n_bar_2,True,False,False,False,778,-145.84255981445312,-139.88597106933594,0
David wasn't referencing five girls and Rhonda wasn't referencing four busy girls.,David wasn't referencing five hopeful girls and Rhonda wasn't referencing four busy.,syntax,ellipsis,ellipsis_n_bar_2,True,False,False,False,779,-115.62334442138672,-120.53599548339844,1
That doctor did discuss one movie theater and many grandmothers of Lori did discuss more old movie theater.,That doctor did discuss one smooth movie theater and many grandmothers of Lori did discuss more old.,syntax,ellipsis,ellipsis_n_bar_2,True,False,False,False,780,-145.90577697753906,-143.85284423828125,0
Every father of Melanie would break one couch and Cheryl would break many exposed couch.,Every father of Melanie would break one messy couch and Cheryl would break many exposed.,syntax,ellipsis,ellipsis_n_bar_2,True,False,False,False,781,-112.8426284790039,-113.94652557373047,1
Patricia wasn't boring one partner and Ann's partner wasn't boring some fast partner.,Patricia wasn't boring one clever partner and Ann's partner wasn't boring some fast.,syntax,ellipsis,ellipsis_n_bar_2,True,False,False,False,782,-120.75082397460938,-120.63137817382812,0
Karen goes to one cafe and Deanna goes to a few bad cafe.,Karen goes to one rough cafe and Deanna goes to a few bad.,syntax,ellipsis,ellipsis_n_bar_2,True,False,False,False,783,-95.6993637084961,-97.47407531738281,1
Those movie theaters scared four nephews of and Leslie's boyfriend scared five unlucky nephews of.,Those movie theaters scared four small nephews of and Leslie's boyfriend scared five unlucky.,syntax,ellipsis,ellipsis_n_bar_2,True,False,False,False,784,-147.35693359375,-133.0205078125,0
Some guest wasn't visiting one friend of and James's husband wasn't visiting two displeased friend of.,Some guest wasn't visiting one small friend of and James's husband wasn't visiting two displeased.,syntax,ellipsis,ellipsis_n_bar_2,True,False,False,False,785,-134.728515625,-125.94182586669922,0
That lady hasn't fired one sister and Theresa hasn't fired a few hidden sister.,That lady hasn't fired one long sister and Theresa hasn't fired a few hidden.,syntax,ellipsis,ellipsis_n_bar_2,True,False,False,False,786,-106.53768920898438,-105.69648742675781,0
Todd's classmates biked to one glacier and Eric biked to three white glacier.,Todd's classmates biked to one small glacier and Eric biked to three white.,syntax,ellipsis,ellipsis_n_bar_2,True,False,False,False,787,-123.30470275878906,-118.48454284667969,0
Timothy wasn't hugging one father and this adult's French teacher wasn't hugging many long father.,Timothy wasn't hugging one displeased father and this adult's French teacher wasn't hugging many long.,syntax,ellipsis,ellipsis_n_bar_2,True,False,False,False,788,-138.54833984375,-148.2969207763672,1
Every truck isn't worrying one company and Daniel isn't worrying five important company.,Every truck isn't worrying one popular company and Daniel isn't worrying five important.,syntax,ellipsis,ellipsis_n_bar_2,True,False,False,False,789,-102.85038757324219,-106.5067138671875,1
Heather leaves a few children and Sandra leaves a lot out in the open children.,Heather leaves a few content children and Sandra leaves a lot out in the open.,syntax,ellipsis,ellipsis_n_bar_2,True,False,False,False,790,-95.23391723632812,-103.46507263183594,1
Jeffrey's teachers should scare one teacher and these bicycles should scare many sick teacher.,Jeffrey's teachers should scare one unlucky teacher and these bicycles should scare many sick.,syntax,ellipsis,ellipsis_n_bar_2,True,False,False,False,791,-121.23309326171875,-124.64927673339844,1
These sons of Carmen can disgust one grandfather of and all skateboards can disgust many happy grandfather of.,These sons of Carmen can disgust one lost grandfather of and all skateboards can disgust many happy.,syntax,ellipsis,ellipsis_n_bar_2,True,False,False,False,792,-157.61123657226562,-149.89791870117188,0
Winston Churchill doesn't confuse one niece of and all pictures should confuse many lost niece of.,Winston Churchill doesn't confuse one serious niece of and all pictures should confuse many lost.,syntax,ellipsis,ellipsis_n_bar_2,True,False,False,False,793,-145.76943969726562,-131.13070678710938,0
Valerie's grandfather isn't scanning one ex-wife and the lady's associates aren't scanning a few exposed ex-wife.,Valerie's grandfather isn't scanning one scared ex-wife and the lady's associates aren't scanning a few exposed.,syntax,ellipsis,ellipsis_n_bar_2,True,False,False,False,794,-161.82029724121094,-157.43359375,0
That boy couldn't resemble five sketches of and these hats couldn't resemble four small sketches of.,That boy couldn't resemble five smooth sketches of and these hats couldn't resemble four small.,syntax,ellipsis,ellipsis_n_bar_2,True,False,False,False,795,-135.02545166015625,-127.86482238769531,0
Martha was attacking one ex-husband and Sarah was attacking three displeased ex-husband.,Martha was attacking one fast ex-husband and Sarah was attacking three displeased.,syntax,ellipsis,ellipsis_n_bar_2,True,False,False,False,796,-121.76994323730469,-113.03086853027344,0
Wendy can argue about no adults and Pamela can argue about some upset adults.,Wendy can argue about no lucky adults and Pamela can argue about some upset.,syntax,ellipsis,ellipsis_n_bar_2,True,False,False,False,797,-111.69621276855469,-110.50877380371094,0
Helen biked to one bank and Sandra biked to many concealed bank.,Helen biked to one white bank and Sandra biked to many concealed.,syntax,ellipsis,ellipsis_n_bar_2,True,False,False,False,798,-106.41404724121094,-105.75814056396484,0
Theresa's spouse leaves one associate and Monica leaves four old associate.,Theresa's spouse leaves one small associate and Monica leaves four old.,syntax,ellipsis,ellipsis_n_bar_2,True,False,False,False,799,-111.64044189453125,-106.66494750976562,0
Julie attacks five brothers and all customers' tutor attacks four upset brothers.,Julie attacks five ill brothers and all customers' tutor attacks four upset.,syntax,ellipsis,ellipsis_n_bar_2,True,False,False,False,800,-114.74846649169922,-116.80084228515625,1
These waiters don't remember one guest and Marla's granddaughter will remember a lot hidden guest.,These waiters don't remember one young guest and Marla's granddaughter will remember a lot hidden.,syntax,ellipsis,ellipsis_n_bar_2,True,False,False,False,801,-124.61446380615234,-124.44679260253906,0
Gina cleaned three cucumbers and that patient cleaned almost as many purple cucumbers.,Gina cleaned three big cucumbers and that patient cleaned almost as many purple.,syntax,ellipsis,ellipsis_n_bar_2,True,False,False,False,802,-118.59185791015625,-107.7499771118164,0
Tonya examined one brother of and Julia examined at least as many exposed brother of.,Tonya examined one scared brother of and Julia examined at least as many exposed.,syntax,ellipsis,ellipsis_n_bar_2,True,False,False,False,803,-117.58660888671875,-112.82630157470703,0
A mother of Paul irritated three men and Donald irritated at least as many smart men.,A mother of Paul irritated three lucky men and Donald irritated at least as many smart.,syntax,ellipsis,ellipsis_n_bar_2,True,False,False,False,804,-109.61993408203125,-115.87373352050781,1
Vanessa's dentist admires no cakes and that government admires some important cakes.,Vanessa's dentist admires no white cakes and that government admires some important.,syntax,ellipsis,ellipsis_n_bar_2,True,False,False,False,805,-128.88076782226562,-126.61929321289062,0
Every cousin of Michael hadn't cared for one student and Homer's teachers hadn't cared for two unconvinced student.,Every cousin of Michael hadn't cared for one old student and Homer's teachers hadn't cared for two unconvinced.,syntax,ellipsis,ellipsis_n_bar_2,True,False,False,False,806,-148.6512451171875,-146.12579345703125,0
Sonia was descending five stairs and Andrew's friends weren't descending four smooth stairs.,Sonia was descending five purple stairs and Andrew's friends weren't descending four smooth.,syntax,ellipsis,ellipsis_n_bar_2,True,False,False,False,807,-116.83981323242188,-117.91271209716797,1
Some sons of Daniel were describing one electrician and Melissa was describing five content electrician.,Some sons of Daniel were describing one sick electrician and Melissa was describing five content.,syntax,ellipsis,ellipsis_n_bar_2,True,False,False,False,808,-134.33233642578125,-123.02461242675781,0
The waitresses discover several contractors and teenagers discover a few determined contractors.,The waitresses discover several big contractors and teenagers discover a few determined.,syntax,ellipsis,ellipsis_n_bar_2,True,False,False,False,809,-112.5315933227539,-111.33737182617188,0
Patients disgusts few mothers of and Aaron's sons disgusts many nice mothers of.,Patients disgusts few content mothers of and Aaron's sons disgusts many nice.,syntax,ellipsis,ellipsis_n_bar_2,True,False,False,False,810,-139.44906616210938,-135.64895629882812,0
Nina's daughter had referenced three lawyers and Walter had referenced at least as many lost lawyers.,Nina's daughter had referenced three clever lawyers and Walter had referenced at least as many lost.,syntax,ellipsis,ellipsis_n_bar_2,True,False,False,False,811,-119.32698059082031,-123.75770568847656,1
Danielle's girlfriend can remember four essays about and Kendra can remember five bad essays about.,Danielle's girlfriend can remember four long essays about and Kendra can remember five bad.,syntax,ellipsis,ellipsis_n_bar_2,True,False,False,False,812,-135.97622680664062,-125.80403137207031,0
Jessica hasn't scanned few cousins and Barbara hasn't scanned many upset cousins.,Jessica hasn't scanned few delighted cousins and Barbara hasn't scanned many upset.,syntax,ellipsis,ellipsis_n_bar_2,True,False,False,False,813,-107.7764663696289,-108.31365966796875,1
The teenager had messed up one chair and Bill had messed up two purple chair.,The teenager had messed up one old chair and Bill had messed up two purple.,syntax,ellipsis,ellipsis_n_bar_2,True,False,False,False,814,-92.33833312988281,-95.41328430175781,1
Some daughter of Helen questions four friends and Curtis's oncologist questions five ill friends.,Some daughter of Helen questions four out in the open friends and Curtis's oncologist questions five ill.,syntax,ellipsis,ellipsis_n_bar_2,True,False,False,False,815,-137.76756286621094,-154.69192504882812,1
Teresa flees from one hospital and Craig flees from at least as many smooth hospital.,Teresa flees from one exposed hospital and Craig flees from at least as many smooth.,syntax,ellipsis,ellipsis_n_bar_2,True,False,False,False,816,-131.2579345703125,-136.16799926757812,1
Most cousins of Veronica examine one father of and these boys examine more bad father of.,Most cousins of Veronica examine one uncertain father of and these boys examine more bad.,syntax,ellipsis,ellipsis_n_bar_2,True,False,False,False,817,-128.95228576660156,-124.10829162597656,0
This dress upset five piano teachers and Katherine upset four concealed piano teachers.,This dress upset five unlucky piano teachers and Katherine upset four concealed.,syntax,ellipsis,ellipsis_n_bar_2,True,False,False,False,818,-119.25248718261719,-114.01490783691406,0
Some lady wouldn't impress many supervisors and Tammy's dermatologist wouldn't impress few scared supervisors.,Some lady wouldn't impress many ill supervisors and Tammy's dermatologist wouldn't impress few scared.,syntax,ellipsis,ellipsis_n_bar_2,True,False,False,False,819,-151.4264678955078,-145.17962646484375,0
Some guests' cousins were fixing three forks and Christine was fixing more cheap forks.,Some guests' cousins were fixing three hard forks and Christine was fixing more cheap.,syntax,ellipsis,ellipsis_n_bar_2,True,False,False,False,820,-118.94486999511719,-117.58478546142578,0
Regina's girlfriend was shocking no fathers and some scarf was shocking some unemployed fathers.,Regina's girlfriend was shocking no exposed fathers and some scarf was shocking some unemployed.,syntax,ellipsis,ellipsis_n_bar_2,True,False,False,False,821,-125.22128295898438,-125.10743713378906,0
Bruce's mother was looking like three photographs of and every glass was looking like at least as many rough photographs of.,Bruce's mother was looking like three exposed photographs of and every glass was looking like at least as many rough.,syntax,ellipsis,ellipsis_n_bar_2,True,False,False,False,822,-132.72760009765625,-129.6563720703125,0
