sentence_good,sentence_bad,field,linguistics_term,UID,simple_LM_method,one_prefix_method,two_prefix_method,lexically_identical,pair_id,good_prob,bad_prob,correct
Dennis wouldn't hate this standing woman.,Dennis wouldn't hate this standing women.,morphology,determiner_noun_agreement,determiner_noun_agreement_with_adj_irregular_1,True,True,False,True,225,-56.47601318359375,-57.901302337646484,1
Naomi exited that cheap oasis.,Naomi exited that cheap oases.,morphology,determiner_noun_agreement,determiner_noun_agreement_with_adj_irregular_1,True,True,False,True,226,-58.461910247802734,-63.42676544189453,1
Diane had appreciated that displeased man.,Diane had appreciated that displeased men.,morphology,determiner_noun_agreement,determiner_noun_agreement_with_adj_irregular_1,True,True,False,True,227,-55.83400344848633,-56.520660400390625,1
Stacy questioned those concealed alumni.,Stacy questioned those concealed alumnus.,morphology,determiner_noun_agreement,determiner_noun_agreement_with_adj_irregular_1,True,True,False,True,228,-59.24190902709961,-58.56658935546875,0
Denise lifted these sick lice.,Denise lifted these sick louse.,morphology,determiner_noun_agreement,determiner_noun_agreement_with_adj_irregular_1,True,True,False,True,229,-51.66679382324219,-56.60526657104492,1
Florence visited that hard oasis.,Florence visited that hard oases.,morphology,determiner_noun_agreement,determiner_noun_agreement_with_adj_irregular_1,True,True,False,True,230,-56.25270080566406,-61.716705322265625,1
Many projectors are confusing this smart man.,Many projectors are confusing this smart men.,morphology,determiner_noun_agreement,determiner_noun_agreement_with_adj_irregular_1,True,True,False,True,231,-55.72947311401367,-61.4969596862793,1
James breaks those purple teeth.,James breaks those purple tooth.,morphology,determiner_noun_agreement,determiner_noun_agreement_with_adj_irregular_1,True,True,False,True,232,-40.904415130615234,-43.00410461425781,1
Thomas has hidden those small teeth.,Thomas has hidden those small tooth.,morphology,determiner_noun_agreement,determiner_noun_agreement_with_adj_irregular_1,True,True,False,True,233,-42.18067169189453,-45.4081916809082,1
Kristin cured that old man.,Kristin cured that old men.,morphology,determiner_noun_agreement,determiner_noun_agreement_with_adj_irregular_1,True,True,False,True,234,-44.08001708984375,-46.65241241455078,1
Cynthia explored that orange oasis.,Cynthia explored that orange oases.,morphology,determiner_noun_agreement,determiner_noun_agreement_with_adj_irregular_1,True,True,False,True,235,-58.20680618286133,-62.75299072265625,1
Donna escapes from these scared men.,Donna escapes from these scared man.,morphology,determiner_noun_agreement,determiner_noun_agreement_with_adj_irregular_1,True,True,False,True,236,-48.58067321777344,-49.03255844116211,1
Some students astounded that excited person.,Some students astounded that excited people.,morphology,determiner_noun_agreement,determiner_noun_agreement_with_adj_irregular_1,True,True,False,True,237,-55.003448486328125,-54.118080139160156,0
Steven isn't visiting these displeased people.,Steven isn't visiting these displeased person.,morphology,determiner_noun_agreement,determiner_noun_agreement_with_adj_irregular_1,True,True,False,True,238,-51.384422302246094,-54.977420806884766,1
Many pedestrians disagreed with this lost woman.,Many pedestrians disagreed with this lost women.,morphology,determiner_noun_agreement,determiner_noun_agreement_with_adj_irregular_1,True,True,False,True,239,-48.79893493652344,-50.40375518798828,1
Some guys hug these good men.,Some guys hug these good man.,morphology,determiner_noun_agreement,determiner_noun_agreement_with_adj_irregular_1,True,True,False,True,240,-43.81299591064453,-44.123573303222656,1
Robert had those big cacti.,Robert had those big cactus.,morphology,determiner_noun_agreement,determiner_noun_agreement_with_adj_irregular_1,True,True,False,True,241,-47.53690719604492,-39.564414978027344,0
Jeffrey has examined that bad synopsis.,Jeffrey has examined that bad synopses.,morphology,determiner_noun_agreement,determiner_noun_agreement_with_adj_irregular_1,True,True,False,True,242,-53.80238342285156,-63.749168395996094,1
Jodi might upset these old children.,Jodi might upset these old child.,morphology,determiner_noun_agreement,determiner_noun_agreement_with_adj_irregular_1,True,True,False,True,243,-52.065208435058594,-53.40061569213867,1
Brenda helped those bad women.,Brenda helped those bad woman.,morphology,determiner_noun_agreement,determiner_noun_agreement_with_adj_irregular_1,True,True,False,True,244,-42.969635009765625,-46.369239807128906,1
All waiters aren't listening to that happy alumnus.,All waiters aren't listening to that happy alumni.,morphology,determiner_noun_agreement,determiner_noun_agreement_with_adj_irregular_1,True,True,False,True,245,-65.15176391601562,-61.400856018066406,0
The girl disagrees with this good man.,The girl disagrees with this good men.,morphology,determiner_noun_agreement,determiner_noun_agreement_with_adj_irregular_1,True,True,False,True,246,-41.20956802368164,-44.67702102661133,1
Jill conceals that excited person.,Jill conceals that excited people.,morphology,determiner_noun_agreement,determiner_noun_agreement_with_adj_irregular_1,True,True,False,True,247,-51.95066452026367,-51.88043975830078,0
Julia remembered this young person.,Julia remembered this young people.,morphology,determiner_noun_agreement,determiner_noun_agreement_with_adj_irregular_1,True,True,False,True,248,-38.15211486816406,-39.372779846191406,1
Bruce disliked these confident alumni.,Bruce disliked these confident alumnus.,morphology,determiner_noun_agreement,determiner_noun_agreement_with_adj_irregular_1,True,True,False,True,249,-45.56719970703125,-47.619693756103516,1
These teachers cure these sick people.,These teachers cure these sick person.,morphology,determiner_noun_agreement,determiner_noun_agreement_with_adj_irregular_1,True,True,False,True,250,-44.79499435424805,-46.867347717285156,1
Karla does fix these red feet.,Karla does fix these red foot.,morphology,determiner_noun_agreement,determiner_noun_agreement_with_adj_irregular_1,True,True,False,True,251,-52.01969909667969,-54.66022491455078,1
Judy hadn't attacked that nice woman.,Judy hadn't attacked that nice women.,morphology,determiner_noun_agreement,determiner_noun_agreement_with_adj_irregular_1,True,True,False,True,252,-52.518516540527344,-54.43989181518555,1
The apple disgusted that sick child.,The apple disgusted that sick children.,morphology,determiner_noun_agreement,determiner_noun_agreement_with_adj_irregular_1,True,True,False,True,253,-52.53661346435547,-52.30033874511719,0
Charles upset this content child.,Charles upset this content children.,morphology,determiner_noun_agreement,determiner_noun_agreement_with_adj_irregular_1,True,True,False,True,254,-40.38149642944336,-43.1434326171875,1
The waiters disagree with this fast person.,The waiters disagree with this fast people.,morphology,determiner_noun_agreement,determiner_noun_agreement_with_adj_irregular_1,True,True,False,True,255,-51.30644226074219,-50.211021423339844,0
Christopher isn't hiring this determined man.,Christopher isn't hiring this determined men.,morphology,determiner_noun_agreement,determiner_noun_agreement_with_adj_irregular_1,True,True,False,True,256,-47.80713653564453,-51.29381561279297,1
Elaine couldn't exit those rough oases.,Elaine couldn't exit those rough oasis.,morphology,determiner_noun_agreement,determiner_noun_agreement_with_adj_irregular_1,True,True,False,True,257,-69.01887512207031,-64.86359405517578,0
Jason wouldn't like those exposed lice.,Jason wouldn't like those exposed louse.,morphology,determiner_noun_agreement,determiner_noun_agreement_with_adj_irregular_1,True,True,False,True,258,-50.69593048095703,-53.16502380371094,1
Sherry hadn't insulted those clever alumni.,Sherry hadn't insulted those clever alumnus.,morphology,determiner_noun_agreement,determiner_noun_agreement_with_adj_irregular_1,True,True,False,True,259,-68.9185562133789,-68.91252899169922,0
Amanda has hidden these yellow cacti.,Amanda has hidden these yellow cactus.,morphology,determiner_noun_agreement,determiner_noun_agreement_with_adj_irregular_1,True,True,False,True,260,-65.9413833618164,-57.14500427246094,0
Paula thinks about these green lice.,Paula thinks about these green louse.,morphology,determiner_noun_agreement,determiner_noun_agreement_with_adj_irregular_1,True,True,False,True,261,-52.97437286376953,-54.368385314941406,1
All doctors argue about those long analyses.,All doctors argue about those long analysis.,morphology,determiner_noun_agreement,determiner_noun_agreement_with_adj_irregular_1,True,True,False,True,262,-52.391990661621094,-52.893131256103516,1
Heidi can break this out in the open foot.,Heidi can break this out in the open feet.,morphology,determiner_noun_agreement,determiner_noun_agreement_with_adj_irregular_1,True,True,False,True,263,-57.621978759765625,-59.81916809082031,1
Carla hugged those young children.,Carla hugged those young child.,morphology,determiner_noun_agreement,determiner_noun_agreement_with_adj_irregular_1,True,True,False,True,264,-45.28737258911133,-47.0523681640625,1
A guest was attacking those confident men.,A guest was attacking those confident man.,morphology,determiner_noun_agreement,determiner_noun_agreement_with_adj_irregular_1,True,True,False,True,265,-53.91392517089844,-54.872005462646484,1
The Impressionists boycott those hard oases.,The Impressionists boycott those hard oasis.,morphology,determiner_noun_agreement,determiner_noun_agreement_with_adj_irregular_1,True,True,False,True,266,-69.02519226074219,-64.11104583740234,0
Katherine isn't disgusting this out in the open alumnus.,Katherine isn't disgusting this out in the open alumni.,morphology,determiner_noun_agreement,determiner_noun_agreement_with_adj_irregular_1,True,True,False,True,267,-71.54804992675781,-75.4992446899414,1
A window is bothering those popular men.,A window is bothering those popular man.,morphology,determiner_noun_agreement,determiner_noun_agreement_with_adj_irregular_1,True,True,False,True,268,-52.931114196777344,-53.477508544921875,1
A lot of cashiers discover that smart man.,A lot of cashiers discover that smart men.,morphology,determiner_noun_agreement,determiner_noun_agreement_with_adj_irregular_1,True,True,False,True,269,-55.202842712402344,-57.69927978515625,1
Jodi approaches that unlucky woman.,Jodi approaches that unlucky women.,morphology,determiner_noun_agreement,determiner_noun_agreement_with_adj_irregular_1,True,True,False,True,270,-50.7021598815918,-49.1605224609375,0
Jesus discussed that fast child.,Jesus discussed that fast children.,morphology,determiner_noun_agreement,determiner_noun_agreement_with_adj_irregular_1,True,True,False,True,271,-41.907203674316406,-41.03705596923828,0
Carts hadn't disgusted those content men.,Carts hadn't disgusted those content man.,morphology,determiner_noun_agreement,determiner_noun_agreement_with_adj_irregular_1,True,True,False,True,272,-68.86365509033203,-69.86213684082031,1
Deborah talks about these smart men.,Deborah talks about these smart man.,morphology,determiner_noun_agreement,determiner_noun_agreement_with_adj_irregular_1,True,True,False,True,273,-45.813560485839844,-46.03765106201172,1
Thomas was returning to that unsure man.,Thomas was returning to that unsure men.,morphology,determiner_noun_agreement,determiner_noun_agreement_with_adj_irregular_1,True,True,False,True,274,-46.119815826416016,-48.733985900878906,1
Every student will break this clean tooth.,Every student will break this clean teeth.,morphology,determiner_noun_agreement,determiner_noun_agreement_with_adj_irregular_1,True,True,False,True,275,-47.07227325439453,-47.601356506347656,1
Valerie talks about this young woman.,Valerie talks about this young women.,morphology,determiner_noun_agreement,determiner_noun_agreement_with_adj_irregular_1,True,True,False,True,276,-40.414276123046875,-41.92192840576172,1
The Clintons discuss this yellow thesis.,The Clintons discuss this yellow theses.,morphology,determiner_noun_agreement,determiner_noun_agreement_with_adj_irregular_1,True,True,False,True,277,-48.203269958496094,-55.24953842163086,1
These cashiers break those dirty feet.,These cashiers break those dirty foot.,morphology,determiner_noun_agreement,determiner_noun_agreement_with_adj_irregular_1,True,True,False,True,278,-50.8924560546875,-53.89840316772461,1
Noah exited these concealed oases.,Noah exited these concealed oasis.,morphology,determiner_noun_agreement,determiner_noun_agreement_with_adj_irregular_1,True,True,False,True,279,-63.46141052246094,-61.048118591308594,0
Elaine toured that rough oasis.,Elaine toured that rough oases.,morphology,determiner_noun_agreement,determiner_noun_agreement_with_adj_irregular_1,True,True,False,True,280,-58.281471252441406,-63.88777542114258,1
Allison hides that gray mouse.,Allison hides that gray mice.,morphology,determiner_noun_agreement,determiner_noun_agreement_with_adj_irregular_1,True,True,False,True,281,-48.80419158935547,-49.32626724243164,1
All vases irritated that hopeful man.,All vases irritated that hopeful men.,morphology,determiner_noun_agreement,determiner_noun_agreement_with_adj_irregular_1,True,True,False,True,282,-57.196922302246094,-59.69798278808594,1
Chad boycotted that smooth oasis.,Chad boycotted that smooth oases.,morphology,determiner_noun_agreement,determiner_noun_agreement_with_adj_irregular_1,True,True,False,True,283,-68.42298126220703,-73.6048583984375,1
The Clintons drive to these green oases.,The Clintons drive to these green oasis.,morphology,determiner_noun_agreement,determiner_noun_agreement_with_adj_irregular_1,True,True,False,True,284,-64.31420135498047,-59.61588668823242,0
Many ladies aren't concealing that brown louse.,Many ladies aren't concealing that brown lice.,morphology,determiner_noun_agreement,determiner_noun_agreement_with_adj_irregular_1,True,True,False,True,285,-67.71135711669922,-64.92630004882812,0
Brenda couldn't hire this serious child.,Brenda couldn't hire this serious children.,morphology,determiner_noun_agreement,determiner_noun_agreement_with_adj_irregular_1,True,True,False,True,286,-49.01287078857422,-52.66852569580078,1
Pamela sounds like that displeased person.,Pamela sounds like that displeased people.,morphology,determiner_noun_agreement,determiner_noun_agreement_with_adj_irregular_1,True,True,False,True,287,-55.51482391357422,-54.474220275878906,0
Eva doesn't arrive at these gray oases.,Eva doesn't arrive at these gray oasis.,morphology,determiner_noun_agreement,determiner_noun_agreement_with_adj_irregular_1,True,True,False,True,288,-54.94859313964844,-51.753684997558594,0
Raymond hurt that old alumnus.,Raymond hurt that old alumni.,morphology,determiner_noun_agreement,determiner_noun_agreement_with_adj_irregular_1,True,True,False,True,289,-53.66531753540039,-54.40765380859375,1
Most waitresses don't observe these exposed alumni.,Most waitresses don't observe these exposed alumnus.,morphology,determiner_noun_agreement,determiner_noun_agreement_with_adj_irregular_1,True,True,False,True,290,-67.742919921875,-68.00420379638672,1
Edward finds these gray oases.,Edward finds these gray oasis.,morphology,determiner_noun_agreement,determiner_noun_agreement_with_adj_irregular_1,True,True,False,True,291,-42.65198516845703,-39.185298919677734,0
Becky fixes that small foot.,Becky fixes that small feet.,morphology,determiner_noun_agreement,determiner_noun_agreement_with_adj_irregular_1,True,True,False,True,292,-43.76593017578125,-44.563140869140625,1
Erin will conceal these nice alumni.,Erin will conceal these nice alumnus.,morphology,determiner_noun_agreement,determiner_noun_agreement_with_adj_irregular_1,True,True,False,True,293,-56.808494567871094,-58.253265380859375,1
Denise isn't shocking these serious alumni.,Denise isn't shocking these serious alumnus.,morphology,determiner_noun_agreement,determiner_noun_agreement_with_adj_irregular_1,True,True,False,True,294,-61.49142837524414,-60.7058219909668,0
Martin isn't curing these concealed oxen.,Martin isn't curing these concealed ox.,morphology,determiner_noun_agreement,determiner_noun_agreement_with_adj_irregular_1,True,True,False,True,295,-59.94648742675781,-59.31405258178711,0
Lori wasn't watching this clever woman.,Lori wasn't watching this clever women.,morphology,determiner_noun_agreement,determiner_noun_agreement_with_adj_irregular_1,True,True,False,True,296,-56.100921630859375,-58.91645812988281,1
These wheelbarrows disgust these sick men.,These wheelbarrows disgust these sick man.,morphology,determiner_noun_agreement,determiner_noun_agreement_with_adj_irregular_1,True,True,False,True,297,-66.15866088867188,-66.0771484375,0
These women discuss that confident woman.,These women discuss that confident women.,morphology,determiner_noun_agreement,determiner_noun_agreement_with_adj_irregular_1,True,True,False,True,298,-40.94501495361328,-37.025367736816406,0
Noah hadn't remembered these bad analyses.,Noah hadn't remembered these bad analysis.,morphology,determiner_noun_agreement,determiner_noun_agreement_with_adj_irregular_1,True,True,False,True,299,-59.216304779052734,-56.40453338623047,0
Nina is boring this smart child.,Nina is boring this smart children.,morphology,determiner_noun_agreement,determiner_noun_agreement_with_adj_irregular_1,True,True,False,True,300,-50.89208221435547,-54.148277282714844,1
The Lutherans like these scared people.,The Lutherans like these scared person.,morphology,determiner_noun_agreement,determiner_noun_agreement_with_adj_irregular_1,True,True,False,True,301,-49.94636535644531,-54.65880584716797,1
Leslie could return to those lost people.,Leslie could return to those lost person.,morphology,determiner_noun_agreement,determiner_noun_agreement_with_adj_irregular_1,True,True,False,True,302,-53.29056167602539,-54.609039306640625,1
Galileo liked this small child.,Galileo liked this small children.,morphology,determiner_noun_agreement,determiner_noun_agreement_with_adj_irregular_1,True,True,False,True,303,-51.14542007446289,-51.79467010498047,1
Denise was talking about that determined person.,Denise was talking about that determined people.,morphology,determiner_noun_agreement,determiner_noun_agreement_with_adj_irregular_1,True,True,False,True,304,-54.920814514160156,-53.66529083251953,0
Andrew respected that white oasis.,Andrew respected that white oases.,morphology,determiner_noun_agreement,determiner_noun_agreement_with_adj_irregular_1,True,True,False,True,305,-41.58429718017578,-46.52330017089844,1
Renee has dropped by these old oases.,Renee has dropped by these old oasis.,morphology,determiner_noun_agreement,determiner_noun_agreement_with_adj_irregular_1,True,True,False,True,306,-57.94292449951172,-54.930091857910156,0
That bread shouldn't aggravate this unconvinced alumnus.,That bread shouldn't aggravate this unconvinced alumni.,morphology,determiner_noun_agreement,determiner_noun_agreement_with_adj_irregular_1,True,True,False,True,307,-72.26055145263672,-73.1197509765625,1
All ladies appreciate these brown oases.,All ladies appreciate these brown oasis.,morphology,determiner_noun_agreement,determiner_noun_agreement_with_adj_irregular_1,True,True,False,True,308,-53.685447692871094,-51.5275764465332,0
A doctor drives to this out in the open oasis.,A doctor drives to this out in the open oases.,morphology,determiner_noun_agreement,determiner_noun_agreement_with_adj_irregular_1,True,True,False,True,309,-64.67549133300781,-69.5844955444336,1
The teenagers tour these black oases.,The teenagers tour these black oasis.,morphology,determiner_noun_agreement,determiner_noun_agreement_with_adj_irregular_1,True,True,False,True,310,-57.976829528808594,-54.67095947265625,0
Becca didn't think about those out in the open oxen.,Becca didn't think about those out in the open ox.,morphology,determiner_noun_agreement,determiner_noun_agreement_with_adj_irregular_1,True,True,False,True,311,-71.71060943603516,-71.43618774414062,0
Eric hadn't loved that exposed person.,Eric hadn't loved that exposed people.,morphology,determiner_noun_agreement,determiner_noun_agreement_with_adj_irregular_1,True,True,False,True,312,-49.82256317138672,-47.269832611083984,0
Every person wasn't hiding those black axes.,Every person wasn't hiding those black axis.,morphology,determiner_noun_agreement,determiner_noun_agreement_with_adj_irregular_1,True,True,False,True,313,-53.56105041503906,-54.30926513671875,1
Tina respected that unemployed child.,Tina respected that unemployed children.,morphology,determiner_noun_agreement,determiner_noun_agreement_with_adj_irregular_1,True,True,False,True,314,-50.982810974121094,-48.85767364501953,0
Broccoli astounds this unemployed child.,Broccoli astounds this unemployed children.,morphology,determiner_noun_agreement,determiner_noun_agreement_with_adj_irregular_1,True,True,False,True,315,-55.235198974609375,-57.58983612060547,1
The waitresses break this cheap foot.,The waitresses break this cheap feet.,morphology,determiner_noun_agreement,determiner_noun_agreement_with_adj_irregular_1,True,True,False,True,316,-58.217647552490234,-60.5411376953125,1
Janice brought this brown nucleus.,Janice brought this brown nuclei.,morphology,determiner_noun_agreement,determiner_noun_agreement_with_adj_irregular_1,True,True,False,True,317,-49.47012710571289,-51.849212646484375,1
Gerald wasn't dropping by these old oases.,Gerald wasn't dropping by these old oasis.,morphology,determiner_noun_agreement,determiner_noun_agreement_with_adj_irregular_1,True,True,False,True,318,-68.94111633300781,-66.02352905273438,0
These slopes haven't astounded those unemployed alumni.,These slopes haven't astounded those unemployed alumnus.,morphology,determiner_noun_agreement,determiner_noun_agreement_with_adj_irregular_1,True,True,False,True,319,-75.17276763916016,-78.34358978271484,1
Ellen was astounding these unsure men.,Ellen was astounding these unsure man.,morphology,determiner_noun_agreement,determiner_noun_agreement_with_adj_irregular_1,True,True,False,True,320,-58.755123138427734,-58.25651550292969,0
That story will annoy this fast person.,That story will annoy this fast people.,morphology,determiner_noun_agreement,determiner_noun_agreement_with_adj_irregular_1,True,True,False,True,321,-49.120033264160156,-49.15254211425781,1
Most photographs look like those clever children.,Most photographs look like those clever child.,morphology,determiner_noun_agreement,determiner_noun_agreement_with_adj_irregular_1,True,True,False,True,322,-48.20370101928711,-52.601348876953125,1
These screens distracted that young alumnus.,These screens distracted that young alumni.,morphology,determiner_noun_agreement,determiner_noun_agreement_with_adj_irregular_1,True,True,False,True,323,-57.861473083496094,-54.72882843017578,0
Craig does distract this small woman.,Craig does distract this small women.,morphology,determiner_noun_agreement,determiner_noun_agreement_with_adj_irregular_1,True,True,False,True,324,-45.246925354003906,-48.07521438598633,1
Monet arrived at those blue oases.,Monet arrived at those blue oasis.,morphology,determiner_noun_agreement,determiner_noun_agreement_with_adj_irregular_1,True,True,False,True,325,-57.72184753417969,-52.95270538330078,0
The ladies lift those blue feet.,The ladies lift those blue foot.,morphology,determiner_noun_agreement,determiner_noun_agreement_with_adj_irregular_1,True,True,False,True,326,-47.60429763793945,-50.70650100708008,1
A grocery store does confuse this displeased woman.,A grocery store does confuse this displeased women.,morphology,determiner_noun_agreement,determiner_noun_agreement_with_adj_irregular_1,True,True,False,True,327,-65.09078979492188,-66.73397827148438,1
Douglas was escaping from those unlucky children.,Douglas was escaping from those unlucky child.,morphology,determiner_noun_agreement,determiner_noun_agreement_with_adj_irregular_1,True,True,False,True,328,-52.59245300292969,-55.48684310913086,1
Brenda had returned to these scared alumni.,Brenda had returned to these scared alumnus.,morphology,determiner_noun_agreement,determiner_noun_agreement_with_adj_irregular_1,True,True,False,True,329,-53.74474334716797,-55.55486297607422,1
Alicia scans these good synopses.,Alicia scans these good synopsis.,morphology,determiner_noun_agreement,determiner_noun_agreement_with_adj_irregular_1,True,True,False,True,330,-65.96790313720703,-57.21360778808594,0
Some senators attack those confident men.,Some senators attack those confident man.,morphology,determiner_noun_agreement,determiner_noun_agreement_with_adj_irregular_1,True,True,False,True,331,-47.903167724609375,-50.2548942565918,1
Some fish shocked those small people.,Some fish shocked those small person.,morphology,determiner_noun_agreement,determiner_noun_agreement_with_adj_irregular_1,True,True,False,True,332,-47.15129470825195,-51.305625915527344,1
Timothy had cared for these fast men.,Timothy had cared for these fast man.,morphology,determiner_noun_agreement,determiner_noun_agreement_with_adj_irregular_1,True,True,False,True,333,-50.7608757019043,-50.99399185180664,1
Lucille hasn't run around those concealed oases.,Lucille hasn't run around those concealed oasis.,morphology,determiner_noun_agreement,determiner_noun_agreement_with_adj_irregular_1,True,True,False,True,334,-71.95585632324219,-68.0053482055664,0
Tonya observed that fast alumnus.,Tonya observed that fast alumni.,morphology,determiner_noun_agreement,determiner_noun_agreement_with_adj_irregular_1,True,True,False,True,335,-50.786041259765625,-50.92610168457031,1
Every picture was astounding this lucky alumnus.,Every picture was astounding this lucky alumni.,morphology,determiner_noun_agreement,determiner_noun_agreement_with_adj_irregular_1,True,True,False,True,336,-61.21221923828125,-55.602508544921875,0
