sentence_good,sentence_bad,field,linguistics_term,UID,simple_LM_method,one_prefix_method,two_prefix_method,lexically_identical,pair_id,good_prob,bad_prob,correct
A friend of Pamela hasn't attacked one person and Ann hasn't attacked more unsure person.,A friend of Pamela hasn't attacked one unemployed person and Ann hasn't attacked more unsure.,syntax,ellipsis,ellipsis_n_bar_2,True,False,False,False,0,-118.11676025390625,-121.41107940673828,1
Larry talked to five dermatologists and Rose talked to four displeased dermatologists.,Larry talked to five small dermatologists and Rose talked to four displeased.,syntax,ellipsis,ellipsis_n_bar_2,True,False,False,False,1,-120.504150390625,-104.58857727050781,0
That legislature has three peppers and Charles has at least as many small peppers.,That legislature has three hidden peppers and Charles has at least as many small.,syntax,ellipsis,ellipsis_n_bar_2,True,False,False,False,2,-93.86322784423828,-95.54351806640625,1
A picture does look like four shawls and the photographs of Douglas couldn't look like five red shawls.,A picture does look like four blue shawls and the photographs of Douglas couldn't look like five red.,syntax,ellipsis,ellipsis_n_bar_2,True,False,False,False,3,-138.44752502441406,-126.45828247070312,0
Bill's associate fires a lot of adults and Galileo fires a few old adults.,Bill's associate fires a lot of popular adults and Galileo fires a few old.,syntax,ellipsis,ellipsis_n_bar_2,True,False,False,False,4,-99.94779968261719,-103.4072036743164,1
Melissa's granddaughter complained about four friends of and some people complained about five big friends of.,Melissa's granddaughter complained about four unemployed friends of and some people complained about five big.,syntax,ellipsis,ellipsis_n_bar_2,True,False,False,False,5,-114.00300598144531,-116.74028015136719,1
Roger isn't exploring one college campus and some friend of Dan isn't exploring a lot red college campus.,Roger isn't exploring one smooth college campus and some friend of Dan isn't exploring a lot red.,syntax,ellipsis,ellipsis_n_bar_2,True,False,False,False,6,-141.02639770507812,-134.4189453125,0
Curtis's boss discussed four sons and Andrew discussed five sick sons.,Curtis's boss discussed four happy sons and Andrew discussed five sick.,syntax,ellipsis,ellipsis_n_bar_2,True,False,False,False,7,-110.54112243652344,-115.93508911132812,1
Robert's best friend helped one dentist and some universities helped more displeased dentist.,Robert's best friend helped one hopeful dentist and some universities helped more displeased.,syntax,ellipsis,ellipsis_n_bar_2,True,False,False,False,8,-110.52708435058594,-110.74085235595703,1
A waitress's mentee isn't climbing down three mountains and Charles isn't climbing down at least as many exposed mountains.,A waitress's mentee isn't climbing down three important mountains and Charles isn't climbing down at least as many exposed.,syntax,ellipsis,ellipsis_n_bar_2,True,False,False,False,9,-154.7108154296875,-156.90292358398438,1
Renee helps one girlfriend and Roger helps a few ill girlfriend.,Renee helps one unlucky girlfriend and Roger helps a few ill.,syntax,ellipsis,ellipsis_n_bar_2,True,False,False,False,10,-93.66020202636719,-95.25833129882812,1
That newspaper article about Winston Churchill astounded one waitress and Donald astounded several unemployed waitress.,That newspaper article about Winston Churchill astounded one confident waitress and Donald astounded several unemployed.,syntax,ellipsis,ellipsis_n_bar_2,True,False,False,False,11,-147.40084838867188,-150.48435974121094,1
Jodi's plumbers climb down no mountains and the snakes climb down some rough mountains.,Jodi's plumbers climb down no small mountains and the snakes climb down some rough.,syntax,ellipsis,ellipsis_n_bar_2,True,False,False,False,12,-117.36587524414062,-117.54695129394531,1
A lady fixes a lot of bicycles and Bethany's spouse fixes a few concealed bicycles.,A lady fixes a lot of purple bicycles and Bethany's spouse fixes a few concealed.,syntax,ellipsis,ellipsis_n_bar_2,True,False,False,False,13,-123.27133178710938,-122.54917907714844,0
A lot of patients' girlfriend sells one popsicle and Steve sells few concealed popsicle.,A lot of patients' girlfriend sells one red popsicle and Steve sells few concealed.,syntax,ellipsis,ellipsis_n_bar_2,True,False,False,False,14,-139.84083557128906,-126.0057373046875,0
Every guy's nephews research three closets and teenagers' mentees research fewer blue closets.,Every guy's nephews research three new closets and teenagers' mentees research fewer blue.,syntax,ellipsis,ellipsis_n_bar_2,True,False,False,False,15,-153.13848876953125,-144.10394287109375,0
Allison's doctor didn't astound one associate and Vincent's mothers didn't astound a few concealed associate.,Allison's doctor didn't astound one small associate and Vincent's mothers didn't astound a few concealed.,syntax,ellipsis,ellipsis_n_bar_2,True,False,False,False,16,-166.67747497558594,-161.78128051757812,0
A patient's hairdressers wouldn't forget no brothers of and a lot of women's grandson wouldn't forget some serious brothers of.,A patient's hairdressers wouldn't forget no unemployed brothers of and a lot of women's grandson wouldn't forget some serious.,syntax,ellipsis,ellipsis_n_bar_2,True,False,False,False,17,-159.1634521484375,-154.90316772460938,0
The Borgias disgusts a few grandfathers of and some committee disgusts a lot determined grandfathers of.,The Borgias disgusts a few uncertain grandfathers of and some committee disgusts a lot determined.,syntax,ellipsis,ellipsis_n_bar_2,True,False,False,False,18,-156.65660095214844,-142.71707153320312,0
Stephen's French teacher hasn't worried one teenager and Roger hasn't worried a lot old teenager.,Stephen's French teacher hasn't worried one important teenager and Roger hasn't worried a lot old.,syntax,ellipsis,ellipsis_n_bar_2,True,False,False,False,19,-116.95730590820312,-114.06901550292969,0
A senator escapes from no plumbers and Sonia escapes from some confident plumbers.,A senator escapes from no concealed plumbers and Sonia escapes from some confident.,syntax,ellipsis,ellipsis_n_bar_2,True,False,False,False,20,-115.16493225097656,-110.83673095703125,0
Suzanne had climbed down one slope and Martha had climbed down three lost slope.,Suzanne had climbed down one smooth slope and Martha had climbed down three lost.,syntax,ellipsis,ellipsis_n_bar_2,True,False,False,False,21,-108.55787658691406,-105.81703186035156,0
Most pedestrians' ex-wife doesn't arrive at one high school and these waiters' son doesn't arrive at two new high school.,Most pedestrians' ex-wife doesn't arrive at one hard high school and these waiters' son doesn't arrive at two new.,syntax,ellipsis,ellipsis_n_bar_2,True,False,False,False,22,-161.60055541992188,-163.807861328125,1
Dennis wasn't boycotting one college campus and Laurie wasn't boycotting some blue college campus.,Dennis wasn't boycotting one orange college campus and Laurie wasn't boycotting some blue.,syntax,ellipsis,ellipsis_n_bar_2,True,False,False,False,23,-140.93377685546875,-129.73480224609375,0
Holly disgusted one employee and mirrors disgusted some lucky employee.,Holly disgusted one clever employee and mirrors disgusted some lucky.,syntax,ellipsis,ellipsis_n_bar_2,True,False,False,False,24,-95.37078094482422,-96.05703735351562,1
Tonya isn't attacking three brothers and Frank isn't attacking fewer bad brothers.,Tonya isn't attacking three employed brothers and Frank isn't attacking fewer bad.,syntax,ellipsis,ellipsis_n_bar_2,True,False,False,False,25,-104.55559539794922,-110.08797454833984,1
Ellen's partners work with five cashiers and most boys work with four uncertain cashiers.,Ellen's partners work with five big cashiers and most boys work with four uncertain.,syntax,ellipsis,ellipsis_n_bar_2,True,False,False,False,26,-129.4478759765625,-115.8294677734375,0
Homer would confuse four teachers and a mother of Melissa would confuse five clever teachers.,Homer would confuse four hopeful teachers and a mother of Melissa would confuse five clever.,syntax,ellipsis,ellipsis_n_bar_2,True,False,False,False,27,-124.12336730957031,-127.59201049804688,1
Samantha's doctors reference several fathers of and Tara's partners reference a few unconvinced fathers of.,Samantha's doctors reference several ill fathers of and Tara's partners reference a few unconvinced.,syntax,ellipsis,ellipsis_n_bar_2,True,False,False,False,28,-171.12823486328125,-165.9088592529297,0
Brad isn't listening to several grandmothers and Colleen isn't listening to a few upset grandmothers.,Brad isn't listening to several employed grandmothers and Colleen isn't listening to a few upset.,syntax,ellipsis,ellipsis_n_bar_2,True,False,False,False,29,-125.23797607421875,-120.07279968261719,0
Timothy's grandfathers are scanning one piano teacher and a child's fathers are scanning some busy piano teacher.,Timothy's grandfathers are scanning one scared piano teacher and a child's fathers are scanning some busy.,syntax,ellipsis,ellipsis_n_bar_2,True,False,False,False,30,-148.54071044921875,-142.62631225585938,0
Nina has disgusted three women and a lot of unicycles had disgusted almost as many unlucky women.,Nina has disgusted three sick women and a lot of unicycles had disgusted almost as many unlucky.,syntax,ellipsis,ellipsis_n_bar_2,True,False,False,False,31,-132.6220245361328,-136.6472625732422,1
Monica's daughters examine one French teacher and all grandfathers of Walter examine several unsure French teacher.,Monica's daughters examine one displeased French teacher and all grandfathers of Walter examine several unsure.,syntax,ellipsis,ellipsis_n_bar_2,True,False,False,False,32,-155.1280517578125,-154.53565979003906,0
Meredith is praising a few fathers of and Barbara is praising several exposed fathers of.,Meredith is praising a few lost fathers of and Barbara is praising several exposed.,syntax,ellipsis,ellipsis_n_bar_2,True,False,False,False,33,-130.39556884765625,-124.51419067382812,0
A lady's contractors bore a lot of grandmothers of and those essays bore a few upset grandmothers of.,A lady's contractors bore a lot of unconvinced grandmothers of and those essays bore a few upset.,syntax,ellipsis,ellipsis_n_bar_2,True,False,False,False,34,-149.28866577148438,-152.97560119628906,1
Alicia's supervisors hadn't found one pedestrian and Benjamin hadn't found a few confident pedestrian.,Alicia's supervisors hadn't found one fast pedestrian and Benjamin hadn't found a few confident.,syntax,ellipsis,ellipsis_n_bar_2,True,False,False,False,35,-133.78321838378906,-130.2588653564453,0
Phillip has irritated one organization and many documentaries about Winston Churchill had irritated a few important organization.,Phillip has irritated one bad organization and many documentaries about Winston Churchill had irritated a few important.,syntax,ellipsis,ellipsis_n_bar_2,True,False,False,False,36,-132.84912109375,-133.53976440429688,1
Winston Churchill is admiring one chair and Linda is admiring five dirty chair.,Winston Churchill is admiring one old chair and Linda is admiring five dirty.,syntax,ellipsis,ellipsis_n_bar_2,True,False,False,False,37,-116.63088989257812,-117.01327514648438,1
Vincent wore one shirt and Matt wore some big shirt.,Vincent wore one hidden shirt and Matt wore some big.,syntax,ellipsis,ellipsis_n_bar_2,True,False,False,False,38,-76.87370300292969,-82.82290649414062,1
Linda's French teachers aren't boasting about one show about and Julie isn't boasting about three bad show about.,Linda's French teachers aren't boasting about one good show about and Julie isn't boasting about three bad.,syntax,ellipsis,ellipsis_n_bar_2,True,False,False,False,39,-147.04954528808594,-140.02406311035156,0
The guests observe one friend and Adam's plumbers observe many fast friend.,The guests observe one unsure friend and Adam's plumbers observe many fast.,syntax,ellipsis,ellipsis_n_bar_2,True,False,False,False,40,-110.46052551269531,-118.72118377685547,1
Cousins of a lot of women love one grandson of and Mary's plumbers love three out in the open grandson of.,Cousins of a lot of women love one determined grandson of and Mary's plumbers love three out in the open.,syntax,ellipsis,ellipsis_n_bar_2,True,False,False,False,41,-167.71319580078125,-157.3369140625,0
That muffin bores three senators and this bicycle bores two unsure senators.,That muffin bores three young senators and this bicycle bores two unsure.,syntax,ellipsis,ellipsis_n_bar_2,True,False,False,False,42,-127.0161361694336,-121.27252197265625,0
Most mothers of Keith would love one actor and all cashiers would love three determined actor.,Most mothers of Keith would love one young actor and all cashiers would love three determined.,syntax,ellipsis,ellipsis_n_bar_2,True,False,False,False,43,-130.74839782714844,-124.16101837158203,0
Most men worried a few grandmothers and Alicia worried a lot sick grandmothers.,Most men worried a few standing grandmothers and Alicia worried a lot sick.,syntax,ellipsis,ellipsis_n_bar_2,True,False,False,False,44,-106.30491638183594,-104.09664916992188,0
Brett's best friend shouldn't impress one ex-wife and Meredith's ex-wives shouldn't impress a few ill ex-wife.,Brett's best friend shouldn't impress one busy ex-wife and Meredith's ex-wives shouldn't impress a few ill.,syntax,ellipsis,ellipsis_n_bar_2,True,False,False,False,45,-176.05970764160156,-168.24099731445312,0
Craig took one drawing and Christopher's colleague took at least as many concealed drawing.,Craig took one small drawing and Christopher's colleague took at least as many concealed.,syntax,ellipsis,ellipsis_n_bar_2,True,False,False,False,46,-104.30503845214844,-102.45259094238281,0
The pedestrian's nieces climb up three steps and some teenagers climb up fewer black steps.,The pedestrian's nieces climb up three hidden steps and some teenagers climb up fewer black.,syntax,ellipsis,ellipsis_n_bar_2,True,False,False,False,47,-131.9009552001953,-140.5251007080078,1
Lori can't descend one ladder and Aaron can't descend four smooth ladder.,Lori can't descend one black ladder and Aaron can't descend four smooth.,syntax,ellipsis,ellipsis_n_bar_2,True,False,False,False,48,-105.21429443359375,-104.35968017578125,0
Most waiters complain about one grandson and the cousins of Jeffrey complain about a few clever grandson.,Most waiters complain about one good grandson and the cousins of Jeffrey complain about a few clever.,syntax,ellipsis,ellipsis_n_bar_2,True,False,False,False,49,-133.16622924804688,-129.94235229492188,0
Samantha isn't arriving at no glaciers and Tracy isn't arriving at some small glaciers.,Samantha isn't arriving at no concealed glaciers and Tracy isn't arriving at some small.,syntax,ellipsis,ellipsis_n_bar_2,True,False,False,False,50,-121.28018188476562,-123.7759780883789,1
A lot of dancers' French teacher escapes from three brothers of and Eric escapes from at least as many lost brothers of.,A lot of dancers' French teacher escapes from three hidden brothers of and Eric escapes from at least as many lost.,syntax,ellipsis,ellipsis_n_bar_2,True,False,False,False,51,-164.53909301757812,-158.3678436279297,0
Allison is visiting one brother and Brett's brother is visiting a few big brother.,Allison is visiting one unlucky brother and Brett's brother is visiting a few big.,syntax,ellipsis,ellipsis_n_bar_2,True,False,False,False,52,-97.03760528564453,-104.94916534423828,1
A lot of men skate around a few museums and the Borgias skate around several important museums.,A lot of men skate around a few messy museums and the Borgias skate around several important.,syntax,ellipsis,ellipsis_n_bar_2,True,False,False,False,53,-129.17111206054688,-134.58216857910156,1
Lawrence's doctors couldn't kiss three associates and Cynthia couldn't kiss at least as many happy associates.,Lawrence's doctors couldn't kiss three old associates and Cynthia couldn't kiss at least as many happy.,syntax,ellipsis,ellipsis_n_bar_2,True,False,False,False,54,-137.40298461914062,-129.4385223388672,0
Russell's supervisor boasts about three dentists and Julia boasts about almost as many concealed dentists.,Russell's supervisor boasts about three hopeful dentists and Julia boasts about almost as many concealed.,syntax,ellipsis,ellipsis_n_bar_2,True,False,False,False,55,-135.5931396484375,-133.50479125976562,0
Brad's electricians haven't bought a few rugs and Kathleen has bought a lot hard rugs.,Brad's electricians haven't bought a few blue rugs and Kathleen has bought a lot hard.,syntax,ellipsis,ellipsis_n_bar_2,True,False,False,False,56,-123.42221069335938,-118.43079376220703,0
Carolyn praises one spouse and Robert's ex-husband praises two scared spouse.,Carolyn praises one good spouse and Robert's ex-husband praises two scared.,syntax,ellipsis,ellipsis_n_bar_2,True,False,False,False,57,-131.8155517578125,-124.58491516113281,0
Sherry had annoyed a few supervisors and some movie about art had annoyed several nice supervisors.,Sherry had annoyed a few bad supervisors and some movie about art had annoyed several nice.,syntax,ellipsis,ellipsis_n_bar_2,True,False,False,False,58,-132.73977661132812,-128.04888916015625,0
The Clintons can admire one best friend and Holly's oncologist can admire several lucky best friend.,The Clintons can admire one lost best friend and Holly's oncologist can admire several lucky.,syntax,ellipsis,ellipsis_n_bar_2,True,False,False,False,59,-154.33192443847656,-153.37115478515625,0
Elaine isn't observing three friends of and Marla isn't observing more delighted friends of.,Elaine isn't observing three old friends of and Marla isn't observing more delighted.,syntax,ellipsis,ellipsis_n_bar_2,True,False,False,False,60,-127.6299819946289,-114.88381958007812,0
Erin's piano teacher is climbing up several ladders and Christine is climbing up a few gray ladders.,Erin's piano teacher is climbing up several smooth ladders and Christine is climbing up a few gray.,syntax,ellipsis,ellipsis_n_bar_2,True,False,False,False,61,-133.68450927734375,-135.3187713623047,1
This painting scared three actresses and that blouse scared more upset actresses.,This painting scared three fast actresses and that blouse scared more upset.,syntax,ellipsis,ellipsis_n_bar_2,True,False,False,False,62,-107.32417297363281,-105.31183624267578,0
Raymond was exiting one public park and a teacher was exiting a few bad public park.,Raymond was exiting one purple public park and a teacher was exiting a few bad.,syntax,ellipsis,ellipsis_n_bar_2,True,False,False,False,63,-121.1099853515625,-116.59324645996094,0
Liam leaves one grandfather and many teachers' father leaves four fast grandfather.,Liam leaves one hidden grandfather and many teachers' father leaves four fast.,syntax,ellipsis,ellipsis_n_bar_2,True,False,False,False,64,-107.40718841552734,-107.05535888671875,0
The children can hug a few cousins and Gregory can hug a lot small cousins.,The children can hug a few busy cousins and Gregory can hug a lot small.,syntax,ellipsis,ellipsis_n_bar_2,True,False,False,False,65,-102.07685852050781,-105.25940704345703,1
Karla's daughters investigate one niece of and Peter's dermatologists investigate at least as many long niece of.,Karla's daughters investigate one serious niece of and Peter's dermatologists investigate at least as many long.,syntax,ellipsis,ellipsis_n_bar_2,True,False,False,False,66,-167.8899688720703,-154.60260009765625,0
Every woman talks about one movie theater and Dan's tutor talks about some big movie theater.,Every woman talks about one new movie theater and Dan's tutor talks about some big.,syntax,ellipsis,ellipsis_n_bar_2,True,False,False,False,67,-115.52912902832031,-105.68800354003906,0
Curtis didn't leave few mentors and James didn't leave many displeased mentors.,Curtis didn't leave few determined mentors and James didn't leave many displeased.,syntax,ellipsis,ellipsis_n_bar_2,True,False,False,False,68,-125.44828796386719,-122.87523651123047,0
The Lutherans' daughters scan five grandfathers and these waiters scan four lucky grandfathers.,The Lutherans' daughters scan five busy grandfathers and these waiters scan four lucky.,syntax,ellipsis,ellipsis_n_bar_2,True,False,False,False,69,-156.0001678466797,-153.41859436035156,0
Some computer astounds three ex-boyfriends and Jennifer's dermatologists astounds at least as many displeased ex-boyfriends.,Some computer astounds three excited ex-boyfriends and Jennifer's dermatologists astounds at least as many displeased.,syntax,ellipsis,ellipsis_n_bar_2,True,False,False,False,70,-205.42933654785156,-182.58006286621094,0
These pedestrians aren't arguing about one doctor and Bradley was arguing about some troubled doctor.,These pedestrians aren't arguing about one confident doctor and Bradley was arguing about some troubled.,syntax,ellipsis,ellipsis_n_bar_2,True,False,False,False,71,-112.94688415527344,-114.55996704101562,1
Judy wore four sweaters and Emily wore five big sweaters.,Judy wore four brown sweaters and Emily wore five big.,syntax,ellipsis,ellipsis_n_bar_2,True,False,False,False,72,-95.55104064941406,-88.52879333496094,0
Some man's colleague goes to two schools and Gregory goes to three orange schools.,Some man's colleague goes to two blue schools and Gregory goes to three orange.,syntax,ellipsis,ellipsis_n_bar_2,True,False,False,False,73,-98.20995330810547,-101.59719848632812,1
A lady cleans no hospitals and Amelia cleans some hidden hospitals.,A lady cleans no red hospitals and Amelia cleans some hidden.,syntax,ellipsis,ellipsis_n_bar_2,True,False,False,False,74,-93.95986938476562,-92.65650177001953,0
Peter remembers one grandfather and Tanya remembers few concealed grandfather.,Peter remembers one uncertain grandfather and Tanya remembers few concealed.,syntax,ellipsis,ellipsis_n_bar_2,True,False,False,False,75,-96.73487091064453,-98.69877624511719,1
Many dishes hadn't impressed no waiters and some water hadn't impressed some unlucky waiters.,Many dishes hadn't impressed no ill waiters and some water hadn't impressed some unlucky.,syntax,ellipsis,ellipsis_n_bar_2,True,False,False,False,76,-128.359375,-119.59944152832031,0
Jason was passing one museum and that woman was passing several dirty museum.,Jason was passing one messy museum and that woman was passing several dirty.,syntax,ellipsis,ellipsis_n_bar_2,True,False,False,False,77,-85.77613830566406,-92.0958251953125,1
Patricia isn't complaining about one guest and Roger isn't complaining about five uncertain guest.,Patricia isn't complaining about one exposed guest and Roger isn't complaining about five uncertain.,syntax,ellipsis,ellipsis_n_bar_2,True,False,False,False,78,-108.8781967163086,-111.9678955078125,1
Amy has driven to one hospital and Carla has driven to some messy hospital.,Amy has driven to one purple hospital and Carla has driven to some messy.,syntax,ellipsis,ellipsis_n_bar_2,True,False,False,False,79,-98.12728118896484,-101.60459899902344,1
Marie works with five people and Leslie works with four concealed people.,Marie works with five uncertain people and Leslie works with four concealed.,syntax,ellipsis,ellipsis_n_bar_2,True,False,False,False,80,-79.15431213378906,-86.18775939941406,1
Marcus exited one hospital and Heidi exited several concealed hospital.,Marcus exited one white hospital and Heidi exited several concealed.,syntax,ellipsis,ellipsis_n_bar_2,True,False,False,False,81,-88.9705810546875,-89.30364990234375,1
The dishes disturb two daughters of and all plays about Monet disturb three delighted daughters of.,The dishes disturb two lost daughters of and all plays about Monet disturb three delighted.,syntax,ellipsis,ellipsis_n_bar_2,True,False,False,False,82,-143.900146484375,-138.71893310546875,0
Julia is hugging one best friend and Becca is hugging at least as many excited best friend.,Julia is hugging one content best friend and Becca is hugging at least as many excited.,syntax,ellipsis,ellipsis_n_bar_2,True,False,False,False,83,-126.1640853881836,-124.78202056884766,0
Michelle conceals three hills and that guy conceals at least as many out in the open hills.,Michelle conceals three black hills and that guy conceals at least as many out in the open.,syntax,ellipsis,ellipsis_n_bar_2,True,False,False,False,84,-124.08462524414062,-125.61134338378906,1
Stacy had respected one doctor and Grace had respected many unsure doctor.,Stacy had respected one lost doctor and Grace had respected many unsure.,syntax,ellipsis,ellipsis_n_bar_2,True,False,False,False,85,-97.88935852050781,-98.33953857421875,1
Women shouldn't appreciate one ex-husband and Becky shouldn't appreciate two long ex-husband.,Women shouldn't appreciate one confident ex-husband and Becky shouldn't appreciate two long.,syntax,ellipsis,ellipsis_n_bar_2,True,False,False,False,86,-116.79750061035156,-106.07876586914062,0
Phillip's ex-girlfriends examine four newspaper articles and Tamara's ex-wives examine five smooth newspaper articles.,Phillip's ex-girlfriends examine four black newspaper articles and Tamara's ex-wives examine five smooth.,syntax,ellipsis,ellipsis_n_bar_2,True,False,False,False,87,-179.66989135742188,-168.42759704589844,0
Meredith wasn't cleaning one nose and Carolyn's ex-boyfriends weren't cleaning three out in the open nose.,Meredith wasn't cleaning one purple nose and Carolyn's ex-boyfriends weren't cleaning three out in the open.,syntax,ellipsis,ellipsis_n_bar_2,True,False,False,False,88,-153.58322143554688,-156.75535583496094,1
Andrea's dentists mess up three malls and Susan's ex-boyfriends mess up fewer green malls.,Andrea's dentists mess up three big malls and Susan's ex-boyfriends mess up fewer green.,syntax,ellipsis,ellipsis_n_bar_2,True,False,False,False,89,-171.46237182617188,-166.28445434570312,0
Beth saw one piano teacher and Kristin saw several content piano teacher.,Beth saw one ill piano teacher and Kristin saw several content.,syntax,ellipsis,ellipsis_n_bar_2,True,False,False,False,90,-109.90734100341797,-100.41055297851562,0
