sentence_good,sentence_bad,field,linguistics_term,UID,simple_LM_method,one_prefix_method,two_prefix_method,lexically_identical,pair_id,good_prob,bad_prob,correct
Carl can bother himself.,Carl can bother themselves.,morphology,anaphor_agreement,anaphor_number_agreement,True,True,False,True,691,-24.12943458557129,-24.984336853027344,1
Tamara hasn't kissed herself.,Tamara hasn't kissed themselves.,morphology,anaphor_agreement,anaphor_number_agreement,True,True,False,True,692,-34.984886169433594,-36.80303955078125,1
Edward couldn't praise himself.,Edward couldn't praise themselves.,morphology,anaphor_agreement,anaphor_number_agreement,True,True,False,True,693,-27.5113525390625,-28.90619659423828,1
Most guys might stun themselves.,Most guys might stun itself.,morphology,anaphor_agreement,anaphor_number_agreement,True,True,False,True,694,-36.88041305541992,-38.049903869628906,1
A lot of teachers will worry themselves.,A lot of teachers will worry itself.,morphology,anaphor_agreement,anaphor_number_agreement,True,True,False,True,695,-44.308631896972656,-45.271297454833984,1
Brenda wasn't concealing herself.,Brenda wasn't concealing themselves.,morphology,anaphor_agreement,anaphor_number_agreement,True,True,False,True,696,-40.952491760253906,-41.162132263183594,1
A lot of women would flee from themselves.,A lot of women would flee from itself.,morphology,anaphor_agreement,anaphor_number_agreement,True,True,False,True,697,-49.20362091064453,-50.20277404785156,1
The Lutherans had scared themselves.,The Lutherans had scared itself.,morphology,anaphor_agreement,anaphor_number_agreement,True,True,False,True,698,-44.15407180786133,-45.2641487121582,1
A lot of girls weren't shocking themselves.,A lot of girls weren't shocking herself.,morphology,anaphor_agreement,anaphor_number_agreement,True,True,False,True,699,-51.731754302978516,-52.506126403808594,1
All adults thought about themselves.,All adults thought about himself.,morphology,anaphor_agreement,anaphor_number_agreement,True,True,False,True,700,-32.8341178894043,-32.57524871826172,0
This dancer shouldn't aggravate herself.,This dancer shouldn't aggravate themselves.,morphology,anaphor_agreement,anaphor_number_agreement,True,True,False,True,701,-48.79026794433594,-47.4070930480957,0
Most doctors are hurting themselves.,Most doctors are hurting itself.,morphology,anaphor_agreement,anaphor_number_agreement,True,True,False,True,702,-31.772464752197266,-33.386756896972656,1
The drivers hadn't returned to themselves.,The drivers hadn't returned to herself.,morphology,anaphor_agreement,anaphor_number_agreement,True,True,False,True,703,-43.01947784423828,-41.96583557128906,0
Nicole should complain about herself.,Nicole should complain about themselves.,morphology,anaphor_agreement,anaphor_number_agreement,True,True,False,True,704,-38.03372573852539,-36.874385833740234,0
Heather remembered herself.,Heather remembered themselves.,morphology,anaphor_agreement,anaphor_number_agreement,True,True,False,True,705,-31.08812141418457,-30.260807037353516,0
The school bothers itself.,The school bothers themselves.,morphology,anaphor_agreement,anaphor_number_agreement,True,True,False,True,706,-31.215011596679688,-30.54605484008789,0
The guy distracted himself.,The guy distracted themselves.,morphology,anaphor_agreement,anaphor_number_agreement,True,True,False,True,707,-30.046485900878906,-31.674762725830078,1
Walter stunned himself.,Walter stunned themselves.,morphology,anaphor_agreement,anaphor_number_agreement,True,True,False,True,708,-28.138071060180664,-30.291244506835938,1
Some guy returned to himself.,Some guy returned to themselves.,morphology,anaphor_agreement,anaphor_number_agreement,True,True,False,True,709,-28.331432342529297,-31.6998233795166,1
Tonya helped herself.,Tonya helped themselves.,morphology,anaphor_agreement,anaphor_number_agreement,True,True,False,True,710,-26.26563262939453,-25.46331024169922,0
Michael was hiding himself.,Michael was hiding themselves.,morphology,anaphor_agreement,anaphor_number_agreement,True,True,False,True,711,-19.470840454101562,-21.16585350036621,1
Many ladies conceal themselves.,Many ladies conceal herself.,morphology,anaphor_agreement,anaphor_number_agreement,True,True,False,True,712,-32.16763687133789,-32.8822135925293,1
Some cashiers talk about themselves.,Some cashiers talk about himself.,morphology,anaphor_agreement,anaphor_number_agreement,True,True,False,True,713,-42.75878143310547,-41.659080505371094,0
All actors will dislike themselves.,All actors will dislike itself.,morphology,anaphor_agreement,anaphor_number_agreement,True,True,False,True,714,-36.73699951171875,-38.330291748046875,1
Margaret healed herself.,Margaret healed themselves.,morphology,anaphor_agreement,anaphor_number_agreement,True,True,False,True,715,-31.23578453063965,-31.249317169189453,1
Most cashiers have distracted themselves.,Most cashiers have distracted himself.,morphology,anaphor_agreement,anaphor_number_agreement,True,True,False,True,716,-46.20357131958008,-46.16987991333008,0
Adults worked with themselves.,Adults worked with itself.,morphology,anaphor_agreement,anaphor_number_agreement,True,True,False,True,717,-31.396482467651367,-32.50415802001953,1
Rose doesn't reveal herself.,Rose doesn't reveal themselves.,morphology,anaphor_agreement,anaphor_number_agreement,True,True,False,True,718,-27.672698974609375,-26.409208297729492,0
Kendra impressed herself.,Kendra impressed themselves.,morphology,anaphor_agreement,anaphor_number_agreement,True,True,False,True,719,-36.03481674194336,-34.56909942626953,0
Melissa will approach herself.,Melissa will approach themselves.,morphology,anaphor_agreement,anaphor_number_agreement,True,True,False,True,720,-36.00361251831055,-34.24485397338867,0
Those cashiers had sounded like themselves.,Those cashiers had sounded like himself.,morphology,anaphor_agreement,anaphor_number_agreement,True,True,False,True,721,-52.59906005859375,-52.157447814941406,0
The teenagers annoyed themselves.,The teenagers annoyed herself.,morphology,anaphor_agreement,anaphor_number_agreement,True,True,False,True,722,-34.030128479003906,-34.99333190917969,1
Most guys were hiding themselves.,Most guys were hiding himself.,morphology,anaphor_agreement,anaphor_number_agreement,True,True,False,True,723,-31.971460342407227,-31.3273983001709,0
Many actors haven't listened to themselves.,Many actors haven't listened to himself.,morphology,anaphor_agreement,anaphor_number_agreement,True,True,False,True,724,-41.341819763183594,-38.929588317871094,0
Most pedestrians might observe themselves.,Most pedestrians might observe itself.,morphology,anaphor_agreement,anaphor_number_agreement,True,True,False,True,725,-38.522438049316406,-40.21636199951172,1
Craig wasn't attacking himself.,Craig wasn't attacking themselves.,morphology,anaphor_agreement,anaphor_number_agreement,True,True,False,True,726,-28.8787841796875,-30.038400650024414,1
Becca has embarrassed herself.,Becca has embarrassed themselves.,morphology,anaphor_agreement,anaphor_number_agreement,True,True,False,True,727,-36.40887451171875,-35.58502197265625,0
Some guests conceal themselves.,Some guests conceal himself.,morphology,anaphor_agreement,anaphor_number_agreement,True,True,False,True,728,-33.66487503051758,-33.394927978515625,0
Tina remembered herself.,Tina remembered themselves.,morphology,anaphor_agreement,anaphor_number_agreement,True,True,False,True,729,-30.037708282470703,-29.931785583496094,0
Thomas couldn't investigate himself.,Thomas couldn't investigate themselves.,morphology,anaphor_agreement,anaphor_number_agreement,True,True,False,True,730,-27.641685485839844,-28.861717224121094,1
Waiters impressed themselves.,Waiters impressed itself.,morphology,anaphor_agreement,anaphor_number_agreement,True,True,False,True,731,-28.93582534790039,-29.94013214111328,1
The Lutherans found themselves.,The Lutherans found itself.,morphology,anaphor_agreement,anaphor_number_agreement,True,True,False,True,732,-35.6591682434082,-37.16950988769531,1
Kristen shouldn't heal herself.,Kristen shouldn't heal themselves.,morphology,anaphor_agreement,anaphor_number_agreement,True,True,False,True,733,-34.64284896850586,-34.01311492919922,0
The Borgias hadn't listened to themselves.,The Borgias hadn't listened to itself.,morphology,anaphor_agreement,anaphor_number_agreement,True,True,False,True,734,-53.197998046875,-54.12715530395508,1
Dana astounded herself.,Dana astounded themselves.,morphology,anaphor_agreement,anaphor_number_agreement,True,True,False,True,735,-37.41228103637695,-37.27430725097656,0
All people loved themselves.,All people loved itself.,morphology,anaphor_agreement,anaphor_number_agreement,True,True,False,True,736,-25.739765167236328,-27.86800765991211,1
Some guests have fired themselves.,Some guests have fired herself.,morphology,anaphor_agreement,anaphor_number_agreement,True,True,False,True,737,-35.226470947265625,-35.624446868896484,1
Elizabeth hadn't worried herself.,Elizabeth hadn't worried themselves.,morphology,anaphor_agreement,anaphor_number_agreement,True,True,False,True,738,-28.821969985961914,-28.35308837890625,0
Most pedestrians have kissed themselves.,Most pedestrians have kissed herself.,morphology,anaphor_agreement,anaphor_number_agreement,True,True,False,True,739,-38.51780700683594,-37.801429748535156,0
These banks aggravate themselves.,These banks aggravate itself.,morphology,anaphor_agreement,anaphor_number_agreement,True,True,False,True,740,-38.59191131591797,-38.917877197265625,1
The Clintons impressed themselves.,The Clintons impressed itself.,morphology,anaphor_agreement,anaphor_number_agreement,True,True,False,True,741,-38.99818801879883,-39.38323974609375,1
Claire wasn't talking to herself.,Claire wasn't talking to themselves.,morphology,anaphor_agreement,anaphor_number_agreement,True,True,False,True,742,-35.307743072509766,-37.837890625,1
Many cashiers hadn't worked with themselves.,Many cashiers hadn't worked with herself.,morphology,anaphor_agreement,anaphor_number_agreement,True,True,False,True,743,-52.84724426269531,-53.321327209472656,1
Alicia concealed herself.,Alicia concealed themselves.,morphology,anaphor_agreement,anaphor_number_agreement,True,True,False,True,744,-38.81114196777344,-37.21098327636719,0
Bradley isn't talking about himself.,Bradley isn't talking about themselves.,morphology,anaphor_agreement,anaphor_number_agreement,True,True,False,True,745,-36.979270935058594,-38.10211181640625,1
Steven has hurt himself.,Steven has hurt themselves.,morphology,anaphor_agreement,anaphor_number_agreement,True,True,False,True,746,-22.50226593017578,-23.74996566772461,1
Many men are impressing themselves.,Many men are impressing himself.,morphology,anaphor_agreement,anaphor_number_agreement,True,True,False,True,747,-35.33973693847656,-35.329078674316406,0
Many boys were healing themselves.,Many boys were healing himself.,morphology,anaphor_agreement,anaphor_number_agreement,True,True,False,True,748,-34.03290939331055,-34.798831939697266,1
Jessica is scaring herself.,Jessica is scaring themselves.,morphology,anaphor_agreement,anaphor_number_agreement,True,True,False,True,749,-27.744529724121094,-27.94363784790039,1
Carol does worry herself.,Carol does worry themselves.,morphology,anaphor_agreement,anaphor_number_agreement,True,True,False,True,750,-37.917388916015625,-37.60735321044922,0
Dennis would watch himself.,Dennis would watch themselves.,morphology,anaphor_agreement,anaphor_number_agreement,True,True,False,True,751,-33.17567443847656,-34.61913299560547,1
Samuel had concealed himself.,Samuel had concealed themselves.,morphology,anaphor_agreement,anaphor_number_agreement,True,True,False,True,752,-34.12476348876953,-34.8287467956543,1
Most senators healed themselves.,Most senators healed itself.,morphology,anaphor_agreement,anaphor_number_agreement,True,True,False,True,753,-33.61865997314453,-34.32829284667969,1
A lot of girls could observe themselves.,A lot of girls could observe herself.,morphology,anaphor_agreement,anaphor_number_agreement,True,True,False,True,754,-42.81368637084961,-43.539981842041016,1
Gerald hasn't astounded himself.,Gerald hasn't astounded themselves.,morphology,anaphor_agreement,anaphor_number_agreement,True,True,False,True,755,-46.17203140258789,-47.483558654785156,1
Elizabeth shouldn't remember herself.,Elizabeth shouldn't remember themselves.,morphology,anaphor_agreement,anaphor_number_agreement,True,True,False,True,756,-27.003231048583984,-25.611892700195312,0
Steve insulted himself.,Steve insulted themselves.,morphology,anaphor_agreement,anaphor_number_agreement,True,True,False,True,757,-19.83108901977539,-22.072668075561523,1
Laurie was hiding herself.,Laurie was hiding themselves.,morphology,anaphor_agreement,anaphor_number_agreement,True,True,False,True,758,-36.957584381103516,-37.68528747558594,1
The Lutherans distracted themselves.,The Lutherans distracted herself.,morphology,anaphor_agreement,anaphor_number_agreement,True,True,False,True,759,-42.378074645996094,-44.20551300048828,1
Regina was upsetting herself.,Regina was upsetting themselves.,morphology,anaphor_agreement,anaphor_number_agreement,True,True,False,True,760,-31.69468116760254,-31.05156707763672,0
Jacqueline disgusted herself.,Jacqueline disgusted themselves.,morphology,anaphor_agreement,anaphor_number_agreement,True,True,False,True,761,-37.01393127441406,-37.102935791015625,1
Carolyn was concealing herself.,Carolyn was concealing themselves.,morphology,anaphor_agreement,anaphor_number_agreement,True,True,False,True,762,-44.81235122680664,-43.78498840332031,0
Senators haven't embarrassed themselves.,Senators haven't embarrassed itself.,morphology,anaphor_agreement,anaphor_number_agreement,True,True,False,True,763,-38.63262176513672,-40.10413360595703,1
Richard disgusted himself.,Richard disgusted themselves.,morphology,anaphor_agreement,anaphor_number_agreement,True,True,False,True,764,-20.859268188476562,-21.700790405273438,1
Kenneth had embarrassed himself.,Kenneth had embarrassed themselves.,morphology,anaphor_agreement,anaphor_number_agreement,True,True,False,True,765,-30.701324462890625,-31.418663024902344,1
Most girls conceal themselves.,Most girls conceal herself.,morphology,anaphor_agreement,anaphor_number_agreement,True,True,False,True,766,-31.900827407836914,-32.15035629272461,1
Paula watched herself.,Paula watched themselves.,morphology,anaphor_agreement,anaphor_number_agreement,True,True,False,True,767,-27.423627853393555,-26.61542510986328,0
The Impressionists escape from themselves.,The Impressionists escape from itself.,morphology,anaphor_agreement,anaphor_number_agreement,True,True,False,True,768,-54.51093673706055,-55.03069305419922,1
The actresses notice themselves.,The actresses notice himself.,morphology,anaphor_agreement,anaphor_number_agreement,True,True,False,True,769,-33.21018600463867,-32.98303985595703,0
Sharon wasn't disgusting herself.,Sharon wasn't disgusting themselves.,morphology,anaphor_agreement,anaphor_number_agreement,True,True,False,True,770,-43.469783782958984,-44.03893280029297,1
This company aggravates itself.,This company aggravates themselves.,morphology,anaphor_agreement,anaphor_number_agreement,True,True,False,True,771,-38.373313903808594,-38.07573699951172,0
The fish found themselves.,The fish found himself.,morphology,anaphor_agreement,anaphor_number_agreement,True,True,False,True,772,-24.47883415222168,-22.981416702270508,0
Teenagers hadn't complained about themselves.,Teenagers hadn't complained about itself.,morphology,anaphor_agreement,anaphor_number_agreement,True,True,False,True,773,-44.52802276611328,-46.15293884277344,1
Bill is discovering himself.,Bill is discovering themselves.,morphology,anaphor_agreement,anaphor_number_agreement,True,True,False,True,774,-24.761428833007812,-25.154422760009766,1
Most guys criticize themselves.,Most guys criticize itself.,morphology,anaphor_agreement,anaphor_number_agreement,True,True,False,True,775,-30.88570785522461,-32.048648834228516,1
A lot of cashiers aren't working with themselves.,A lot of cashiers aren't working with himself.,morphology,anaphor_agreement,anaphor_number_agreement,True,True,False,True,776,-60.414066314697266,-60.54800796508789,1
Charles couldn't hate himself.,Charles couldn't hate themselves.,morphology,anaphor_agreement,anaphor_number_agreement,True,True,False,True,777,-25.437829971313477,-26.751617431640625,1
Joseph hasn't disturbed himself.,Joseph hasn't disturbed themselves.,morphology,anaphor_agreement,anaphor_number_agreement,True,True,False,True,778,-27.524553298950195,-29.24245834350586,1
Senators might talk about themselves.,Senators might talk about itself.,morphology,anaphor_agreement,anaphor_number_agreement,True,True,False,True,779,-34.56480407714844,-35.66775131225586,1
Laura hasn't hugged herself.,Laura hasn't hugged themselves.,morphology,anaphor_agreement,anaphor_number_agreement,True,True,False,True,780,-28.633106231689453,-29.382904052734375,1
The teenagers think about themselves.,The teenagers think about herself.,morphology,anaphor_agreement,anaphor_number_agreement,True,True,False,True,781,-34.1376953125,-35.37987518310547,1
Carlos hasn't referenced himself.,Carlos hasn't referenced themselves.,morphology,anaphor_agreement,anaphor_number_agreement,True,True,False,True,782,-38.18444061279297,-38.63822937011719,1
Steven had returned to himself.,Steven had returned to themselves.,morphology,anaphor_agreement,anaphor_number_agreement,True,True,False,True,783,-22.756206512451172,-25.231782913208008,1
A lot of waiters were listening to themselves.,A lot of waiters were listening to herself.,morphology,anaphor_agreement,anaphor_number_agreement,True,True,False,True,784,-55.25578308105469,-53.38640594482422,0
Steve is helping himself.,Steve is helping themselves.,morphology,anaphor_agreement,anaphor_number_agreement,True,True,False,True,785,-19.098003387451172,-21.19599151611328,1
Colleen will aggravate herself.,Colleen will aggravate themselves.,morphology,anaphor_agreement,anaphor_number_agreement,True,True,False,True,786,-43.36072540283203,-41.505210876464844,0
Noah shouldn't argue about himself.,Noah shouldn't argue about themselves.,morphology,anaphor_agreement,anaphor_number_agreement,True,True,False,True,787,-41.42491912841797,-42.21699905395508,1
Travis won't approach himself.,Travis won't approach themselves.,morphology,anaphor_agreement,anaphor_number_agreement,True,True,False,True,788,-39.442604064941406,-40.25690460205078,1
Candice hadn't thought about herself.,Candice hadn't thought about themselves.,morphology,anaphor_agreement,anaphor_number_agreement,True,True,False,True,789,-38.03046798706055,-38.5588264465332,1
Every waitress boasted about herself.,Every waitress boasted about themselves.,morphology,anaphor_agreement,anaphor_number_agreement,True,True,False,True,790,-39.24734115600586,-37.99340057373047,0
Guests concealed themselves.,Guests concealed herself.,morphology,anaphor_agreement,anaphor_number_agreement,True,True,False,True,791,-30.984512329101562,-33.16807174682617,1
Melissa had bored herself.,Melissa had bored themselves.,morphology,anaphor_agreement,anaphor_number_agreement,True,True,False,True,792,-35.26143264770508,-35.293495178222656,1
Meredith hasn't revealed herself.,Meredith hasn't revealed themselves.,morphology,anaphor_agreement,anaphor_number_agreement,True,True,False,True,793,-42.37544631958008,-41.891422271728516,0
The actors were observing themselves.,The actors were observing herself.,morphology,anaphor_agreement,anaphor_number_agreement,True,True,False,True,794,-33.46235275268555,-34.758480072021484,1
Many teenagers haven't forgotten themselves.,Many teenagers haven't forgotten herself.,morphology,anaphor_agreement,anaphor_number_agreement,True,True,False,True,795,-38.449607849121094,-39.642215728759766,1
Those museums are stunning themselves.,Those museums are stunning himself.,morphology,anaphor_agreement,anaphor_number_agreement,True,True,False,True,796,-36.911376953125,-38.47803497314453,1
Most girls didn't aggravate themselves.,Most girls didn't aggravate himself.,morphology,anaphor_agreement,anaphor_number_agreement,True,True,False,True,797,-42.54609680175781,-42.5031623840332,0
Kevin wasn't disturbing himself.,Kevin wasn't disturbing themselves.,morphology,anaphor_agreement,anaphor_number_agreement,True,True,False,True,798,-26.894771575927734,-28.380794525146484,1
Most patients have investigated themselves.,Most patients have investigated itself.,morphology,anaphor_agreement,anaphor_number_agreement,True,True,False,True,799,-32.550559997558594,-33.33588409423828,1
Gina didn't see herself.,Gina didn't see themselves.,morphology,anaphor_agreement,anaphor_number_agreement,True,True,False,True,800,-28.665081024169922,-28.613882064819336,0
The man praised himself.,The man praised themselves.,morphology,anaphor_agreement,anaphor_number_agreement,True,True,False,True,801,-23.67511558532715,-26.65375518798828,1
Rachelle hasn't healed herself.,Rachelle hasn't healed themselves.,morphology,anaphor_agreement,anaphor_number_agreement,True,True,False,True,802,-39.59455108642578,-39.46078109741211,0
Carolyn approached herself.,Carolyn approached themselves.,morphology,anaphor_agreement,anaphor_number_agreement,True,True,False,True,803,-33.340213775634766,-32.544349670410156,0
Gary was scaring himself.,Gary was scaring themselves.,morphology,anaphor_agreement,anaphor_number_agreement,True,True,False,True,804,-27.30113983154297,-29.136070251464844,1
The Borgias were admiring themselves.,The Borgias were admiring herself.,morphology,anaphor_agreement,anaphor_number_agreement,True,True,False,True,805,-47.26512908935547,-47.893638610839844,1
People can't approach themselves.,People can't approach himself.,morphology,anaphor_agreement,anaphor_number_agreement,True,True,False,True,806,-24.94359016418457,-24.588659286499023,0
Those people should remember themselves.,Those people should remember herself.,morphology,anaphor_agreement,anaphor_number_agreement,True,True,False,True,807,-28.002466201782227,-30.208614349365234,1
Most women weren't helping themselves.,Most women weren't helping itself.,morphology,anaphor_agreement,anaphor_number_agreement,True,True,False,True,808,-35.137535095214844,-37.438812255859375,1
Most actors hug themselves.,Most actors hug herself.,morphology,anaphor_agreement,anaphor_number_agreement,True,True,False,True,809,-33.26192855834961,-33.389617919921875,1
The Clintons couldn't conceal themselves.,The Clintons couldn't conceal himself.,morphology,anaphor_agreement,anaphor_number_agreement,True,True,False,True,810,-46.518531799316406,-45.40300750732422,0
All banks had upset themselves.,All banks had upset himself.,morphology,anaphor_agreement,anaphor_number_agreement,True,True,False,True,811,-38.063018798828125,-37.76721954345703,0
Kimberley had cured herself.,Kimberley had cured themselves.,morphology,anaphor_agreement,anaphor_number_agreement,True,True,False,True,812,-39.96997833251953,-38.84918212890625,0
David is questioning himself.,David is questioning themselves.,morphology,anaphor_agreement,anaphor_number_agreement,True,True,False,True,813,-23.94219970703125,-25.38329315185547,1
Most waitresses wouldn't sound like themselves.,Most waitresses wouldn't sound like himself.,morphology,anaphor_agreement,anaphor_number_agreement,True,True,False,True,814,-53.78626251220703,-52.955291748046875,0
Renee bothered herself.,Renee bothered themselves.,morphology,anaphor_agreement,anaphor_number_agreement,True,True,False,True,815,-31.164794921875,-30.059629440307617,0
Homer fired himself.,Homer fired themselves.,morphology,anaphor_agreement,anaphor_number_agreement,True,True,False,True,816,-29.239940643310547,-30.72315216064453,1
The Impressionists haven't found themselves.,The Impressionists haven't found himself.,morphology,anaphor_agreement,anaphor_number_agreement,True,True,False,True,817,-57.315887451171875,-56.34757995605469,0
Andrea didn't dislike herself.,Andrea didn't dislike themselves.,morphology,anaphor_agreement,anaphor_number_agreement,True,True,False,True,818,-41.037513732910156,-39.698768615722656,0
Girls kiss themselves.,Girls kiss himself.,morphology,anaphor_agreement,anaphor_number_agreement,True,True,False,True,819,-21.414257049560547,-19.62904930114746,0
These organizations stunned themselves.,These organizations stunned himself.,morphology,anaphor_agreement,anaphor_number_agreement,True,True,False,True,820,-35.656585693359375,-35.970882415771484,1
Rebecca hired herself.,Rebecca hired themselves.,morphology,anaphor_agreement,anaphor_number_agreement,True,True,False,True,821,-31.08704376220703,-30.173446655273438,0
Patrick approached himself.,Patrick approached themselves.,morphology,anaphor_agreement,anaphor_number_agreement,True,True,False,True,822,-18.756364822387695,-20.172861099243164,1
Mark hasn't referenced himself.,Mark hasn't referenced themselves.,morphology,anaphor_agreement,anaphor_number_agreement,True,True,False,True,823,-32.27055358886719,-32.59605026245117,1
Many adults have hired themselves.,Many adults have hired herself.,morphology,anaphor_agreement,anaphor_number_agreement,True,True,False,True,824,-32.37166213989258,-33.253971099853516,1
A lot of people escaped from themselves.,A lot of people escaped from itself.,morphology,anaphor_agreement,anaphor_number_agreement,True,True,False,True,825,-39.182159423828125,-40.1636848449707,1
Some students shouldn't remember themselves.,Some students shouldn't remember herself.,morphology,anaphor_agreement,anaphor_number_agreement,True,True,False,True,826,-34.401710510253906,-36.52114486694336,1
Those students listen to themselves.,Those students listen to herself.,morphology,anaphor_agreement,anaphor_number_agreement,True,True,False,True,827,-32.51372528076172,-32.41966247558594,0
Stephanie will hurt herself.,Stephanie will hurt themselves.,morphology,anaphor_agreement,anaphor_number_agreement,True,True,False,True,828,-37.59634017944336,-38.42957305908203,1
