sentence_good,sentence_bad,field,linguistics_term,UID,simple_LM_method,one_prefix_method,two_prefix_method,lexically_identical,pair_id,good_prob,bad_prob,correct
The public park had astounded whose hospital?,Whose had the public park astounded hospital?,syntax,island_effects,left_branch_island_echo_question,True,False,True,True,531,-67.65643310546875,-71.29994201660156,1
The drawing is looking like which guests?,Which is the drawing looking like guests?,syntax,island_effects,left_branch_island_echo_question,True,False,True,True,532,-48.468475341796875,-44.362491607666016,0
All senators had hurt what guests?,What had all senators hurt guests?,syntax,island_effects,left_branch_island_echo_question,True,False,True,True,533,-50.192535400390625,-51.059181213378906,1
The teenager should ascend what slope?,What should the teenager ascend slope?,syntax,island_effects,left_branch_island_echo_question,True,False,True,True,534,-56.705955505371094,-53.84229278564453,0
Tanya can visit what bank?,What can Tanya visit bank?,syntax,island_effects,left_branch_island_echo_question,True,False,True,True,535,-45.387332916259766,-51.236915588378906,1
Sheila was looking like whose photographs?,Whose was Sheila looking like photographs?,syntax,island_effects,left_branch_island_echo_question,True,False,True,True,536,-52.241943359375,-59.57817077636719,1
Rose was concealing which waiters?,Which was Rose concealing waiters?,syntax,island_effects,left_branch_island_echo_question,True,False,True,True,537,-55.58369827270508,-59.1419677734375,1
Noah does scan which essay?,Which does Noah scan essay?,syntax,island_effects,left_branch_island_echo_question,True,False,True,True,538,-51.46289825439453,-46.36186981201172,0
Julie might notice whose dress?,Whose might Julie notice dress?,syntax,island_effects,left_branch_island_echo_question,True,False,True,True,539,-41.99159622192383,-56.659053802490234,1
Jodi is attacking what men?,What is Jodi attacking men?,syntax,island_effects,left_branch_island_echo_question,True,False,True,True,540,-42.97539138793945,-47.62071228027344,1
Caroline will shock what adults?,What will Caroline shock adults?,syntax,island_effects,left_branch_island_echo_question,True,False,True,True,541,-48.74904251098633,-44.966373443603516,0
Timothy has respected whose libraries?,Whose has Timothy respected libraries?,syntax,island_effects,left_branch_island_echo_question,True,False,True,True,542,-52.56717300415039,-60.26232147216797,1
Roger would descend which mountain?,Which would Roger descend mountain?,syntax,island_effects,left_branch_island_echo_question,True,False,True,True,543,-40.00395965576172,-48.04603576660156,1
Bradley had kissed which dancers?,Which had Bradley kissed dancers?,syntax,island_effects,left_branch_island_echo_question,True,False,True,True,544,-48.91674041748047,-46.25933074951172,0
All waitresses should listen to what man?,What should all waitresses listen to man?,syntax,island_effects,left_branch_island_echo_question,True,False,True,True,545,-55.123165130615234,-54.41315841674805,0
Connie was investigating what woman?,What was Connie investigating woman?,syntax,island_effects,left_branch_island_echo_question,True,False,True,True,546,-43.19556427001953,-45.69516372680664,1
Maria has passed what glaciers?,What has Maria passed glaciers?,syntax,island_effects,left_branch_island_echo_question,True,False,True,True,547,-39.08810806274414,-49.357215881347656,1
The doctors would heal what actor?,What would the doctors heal actor?,syntax,island_effects,left_branch_island_echo_question,True,False,True,True,548,-47.46491241455078,-49.38114547729492,1
Every dancer was referencing whose analyses?,Whose was every dancer referencing analyses?,syntax,island_effects,left_branch_island_echo_question,True,False,True,True,549,-57.31901550292969,-69.7384033203125,1
A woman had investigated whose hospitals?,Whose had a woman investigated hospitals?,syntax,island_effects,left_branch_island_echo_question,True,False,True,True,550,-50.94073486328125,-55.279273986816406,1
Eva should discuss what waiter?,What should Eva discuss waiter?,syntax,island_effects,left_branch_island_echo_question,True,False,True,True,551,-36.89139175415039,-48.02550506591797,1
Many dancers had insulted whose libraries?,Whose had many dancers insulted libraries?,syntax,island_effects,left_branch_island_echo_question,True,False,True,True,552,-54.53599548339844,-65.83710479736328,1
Those steps do irritate which dancers?,Which do those steps irritate dancers?,syntax,island_effects,left_branch_island_echo_question,True,False,True,True,553,-60.91680145263672,-59.540771484375,0
Patrick should observe which dancers?,Which should Patrick observe dancers?,syntax,island_effects,left_branch_island_echo_question,True,False,True,True,554,-41.431217193603516,-50.16917419433594,1
Tammy has attacked what student?,What has Tammy attacked student?,syntax,island_effects,left_branch_island_echo_question,True,False,True,True,555,-44.523468017578125,-48.43155288696289,1
Every turtle is ascending what stairs?,What is every turtle ascending stairs?,syntax,island_effects,left_branch_island_echo_question,True,False,True,True,556,-48.63685607910156,-50.66548156738281,1
Lucille does drive to what lakes?,What does Lucille drive to lakes?,syntax,island_effects,left_branch_island_echo_question,True,False,True,True,557,-51.57476806640625,-55.66453170776367,1
That person had lifted whose chicken?,Whose had that person lifted chicken?,syntax,island_effects,left_branch_island_echo_question,True,False,True,True,558,-48.932830810546875,-53.96855163574219,1
Many boys have fired what pedestrian?,What have many boys fired pedestrian?,syntax,island_effects,left_branch_island_echo_question,True,False,True,True,559,-48.61885452270508,-49.482879638671875,1
Martin does appreciate which dancers?,Which does Martin appreciate dancers?,syntax,island_effects,left_branch_island_echo_question,True,False,True,True,560,-43.34151840209961,-48.23249053955078,1
Travel does annoy which waiter?,Which does travel annoy waiter?,syntax,island_effects,left_branch_island_echo_question,True,False,True,True,561,-43.450645446777344,-44.44354248046875,1
Patricia had remembered which woman?,Which had Patricia remembered woman?,syntax,island_effects,left_branch_island_echo_question,True,False,True,True,562,-50.27250289916992,-43.053253173828125,0
The Borgias could hug which actor?,Which could the Borgias hug actor?,syntax,island_effects,left_branch_island_echo_question,True,False,True,True,563,-61.98423385620117,-62.0740852355957,1
The doctor has fired what girls?,What has the doctor fired girls?,syntax,island_effects,left_branch_island_echo_question,True,False,True,True,564,-39.88606262207031,-41.58197784423828,1
Julie is descending which hills?,Which is Julie descending hills?,syntax,island_effects,left_branch_island_echo_question,True,False,True,True,565,-47.187442779541016,-44.758506774902344,0
Marie might sound like what waitresses?,What might Marie sound like waitresses?,syntax,island_effects,left_branch_island_echo_question,True,False,True,True,566,-52.63697052001953,-57.79001998901367,1
Most guys are fixing whose convertible?,Whose are most guys fixing convertible?,syntax,island_effects,left_branch_island_echo_question,True,False,True,True,567,-47.274009704589844,-61.81312561035156,1
Karen should examine whose reports?,Whose should Karen examine reports?,syntax,island_effects,left_branch_island_echo_question,True,False,True,True,568,-50.96771240234375,-59.88262939453125,1
A senator had hugged which actors?,Which had a senator hugged actors?,syntax,island_effects,left_branch_island_echo_question,True,False,True,True,569,-56.50447082519531,-51.14906692504883,0
These children were praising which student?,Which were these children praising student?,syntax,island_effects,left_branch_island_echo_question,True,False,True,True,570,-46.341064453125,-48.7142333984375,1
These trucks are upsetting which patients?,Which are these trucks upsetting patients?,syntax,island_effects,left_branch_island_echo_question,True,False,True,True,571,-47.656715393066406,-49.09532165527344,1
Karla can descend which ladders?,Which can Karla descend ladders?,syntax,island_effects,left_branch_island_echo_question,True,False,True,True,572,-52.5813102722168,-59.514617919921875,1
Michael might approach what girls?,What might Michael approach girls?,syntax,island_effects,left_branch_island_echo_question,True,False,True,True,573,-34.070945739746094,-45.33066177368164,1
Colleen had fixed what chairs?,What had Colleen fixed chairs?,syntax,island_effects,left_branch_island_echo_question,True,False,True,True,574,-46.11737823486328,-52.745155334472656,1
Helen has investigated which girl?,Which has Helen investigated girl?,syntax,island_effects,left_branch_island_echo_question,True,False,True,True,575,-45.57836151123047,-42.83814239501953,0
Christopher could break what carriages?,What could Christopher break carriages?,syntax,island_effects,left_branch_island_echo_question,True,False,True,True,576,-43.80854415893555,-53.90342330932617,1
Rebecca did buy which lakes?,Which did Rebecca buy lakes?,syntax,island_effects,left_branch_island_echo_question,True,False,True,True,577,-50.987213134765625,-44.55710220336914,0
Ann had loved which adult?,Which had Ann loved adult?,syntax,island_effects,left_branch_island_echo_question,True,False,True,True,578,-38.48997116088867,-43.01567840576172,1
Some bicycle had looked like which drawing?,Which had some bicycle looked like drawing?,syntax,island_effects,left_branch_island_echo_question,True,False,True,True,579,-51.18933868408203,-46.32685852050781,0
Karen can walk through whose restaurant?,Whose can Karen walk through restaurant?,syntax,island_effects,left_branch_island_echo_question,True,False,True,True,580,-50.10706329345703,-58.927162170410156,1
Thomas will disgust which customers?,Which will Thomas disgust customers?,syntax,island_effects,left_branch_island_echo_question,True,False,True,True,581,-43.3448371887207,-46.3698844909668,1
Sheila did like what newspaper article?,What did Sheila like newspaper article?,syntax,island_effects,left_branch_island_echo_question,True,False,True,True,582,-56.260257720947266,-52.05550765991211,0
Samantha was working with which boys?,Which was Samantha working with boys?,syntax,island_effects,left_branch_island_echo_question,True,False,True,True,583,-53.896636962890625,-42.450435638427734,0
The Lutherans have examined what stories?,What have the Lutherans examined stories?,syntax,island_effects,left_branch_island_echo_question,True,False,True,True,584,-56.67689514160156,-57.870670318603516,1
Richard might sell which cilantro?,Which might Richard sell cilantro?,syntax,island_effects,left_branch_island_echo_question,True,False,True,True,585,-50.84321975708008,-57.21003723144531,1
Sabrina would love which report?,Which would Sabrina love report?,syntax,island_effects,left_branch_island_echo_question,True,False,True,True,586,-44.96145248413086,-54.45872497558594,1
This eye is disturbing whose hospitals?,Whose is this eye disturbing hospitals?,syntax,island_effects,left_branch_island_echo_question,True,False,True,True,587,-50.10908508300781,-58.242919921875,1
Andrea was curing what sheep?,What was Andrea curing sheep?,syntax,island_effects,left_branch_island_echo_question,True,False,True,True,588,-53.552101135253906,-45.365745544433594,0
A candle is scaring what teenager?,What is a candle scaring teenager?,syntax,island_effects,left_branch_island_echo_question,True,False,True,True,589,-54.7287712097168,-49.24327087402344,0
Many teachers had helped which patient?,Which had many teachers helped patient?,syntax,island_effects,left_branch_island_echo_question,True,False,True,True,590,-47.07570266723633,-46.99760437011719,0
Patrick had noticed which ladies?,Which had Patrick noticed ladies?,syntax,island_effects,left_branch_island_echo_question,True,False,True,True,591,-34.4301872253418,-42.6826171875,1
Mark has investigated which boy?,Which has Mark investigated boy?,syntax,island_effects,left_branch_island_echo_question,True,False,True,True,592,-39.12767028808594,-41.856239318847656,1
Marie was cleaning what mouth?,What was Marie cleaning mouth?,syntax,island_effects,left_branch_island_echo_question,True,False,True,True,593,-34.41219711303711,-38.40409469604492,1
Beth was visiting which men?,Which was Beth visiting men?,syntax,island_effects,left_branch_island_echo_question,True,False,True,True,594,-46.43766784667969,-39.75599670410156,0
Holly had biked to which mall?,Which had Holly biked to mall?,syntax,island_effects,left_branch_island_echo_question,True,False,True,True,595,-58.999385833740234,-55.466217041015625,0
Brian had taken what skateboards?,What had Brian taken skateboards?,syntax,island_effects,left_branch_island_echo_question,True,False,True,True,596,-44.90435791015625,-54.53864288330078,1
Jacqueline had revealed what drivers?,What had Jacqueline revealed drivers?,syntax,island_effects,left_branch_island_echo_question,True,False,True,True,597,-52.7998046875,-56.56985092163086,1
Randolf does climb down whose mountains?,Whose does Randolf climb down mountains?,syntax,island_effects,left_branch_island_echo_question,True,False,True,True,598,-57.933013916015625,-73.97921752929688,1
Becky should sound like whose newspaper articles?,Whose should Becky sound like newspaper articles?,syntax,island_effects,left_branch_island_echo_question,True,False,True,True,599,-60.14839172363281,-72.21625518798828,1
Most hills are impressing which guests?,Which are most hills impressing guests?,syntax,island_effects,left_branch_island_echo_question,True,False,True,True,600,-56.24985885620117,-59.402923583984375,1
The guest was talking about what restaurants?,What was the guest talking about restaurants?,syntax,island_effects,left_branch_island_echo_question,True,False,True,True,601,-45.66423034667969,-45.794761657714844,1
Karla has approached what doctors?,What has Karla approached doctors?,syntax,island_effects,left_branch_island_echo_question,True,False,True,True,602,-46.182491302490234,-56.633575439453125,1
Walter does help what actresses?,What does Walter help actresses?,syntax,island_effects,left_branch_island_echo_question,True,False,True,True,603,-44.182655334472656,-45.8488883972168,1
Martha did conceal what eye?,What did Martha conceal eye?,syntax,island_effects,left_branch_island_echo_question,True,False,True,True,604,-47.077274322509766,-41.796146392822266,0
Naomi can have what truck?,What can Naomi have truck?,syntax,island_effects,left_branch_island_echo_question,True,False,True,True,605,-37.234291076660156,-36.681400299072266,0
Christopher will reference what teacher?,What will Christopher reference teacher?,syntax,island_effects,left_branch_island_echo_question,True,False,True,True,606,-38.44892883300781,-43.442649841308594,1
Every dancer does reveal which dancer?,Which does every dancer reveal dancer?,syntax,island_effects,left_branch_island_echo_question,True,False,True,True,607,-50.59696578979492,-54.45804977416992,1
The dress is worrying what schools?,What is the dress worrying schools?,syntax,island_effects,left_branch_island_echo_question,True,False,True,True,608,-45.38605499267578,-44.409584045410156,0
Those doors were astounding which teacher?,Which were those doors astounding teacher?,syntax,island_effects,left_branch_island_echo_question,True,False,True,True,609,-48.677345275878906,-48.78118133544922,1
Kevin is disturbing what university?,What is Kevin disturbing university?,syntax,island_effects,left_branch_island_echo_question,True,False,True,True,610,-35.836368560791016,-44.799583435058594,1
Every sock can shock what lady?,What can every sock shock lady?,syntax,island_effects,left_branch_island_echo_question,True,False,True,True,611,-46.07264709472656,-49.87613296508789,1
Gerald is astounding which patients?,Which is Gerald astounding patients?,syntax,island_effects,left_branch_island_echo_question,True,False,True,True,612,-49.69813919067383,-44.33306884765625,0
Andrea does lift what schools?,What does Andrea lift schools?,syntax,island_effects,left_branch_island_echo_question,True,False,True,True,613,-51.78571319580078,-46.62661361694336,0
Cindy does take which convertibles?,Which does Cindy take convertibles?,syntax,island_effects,left_branch_island_echo_question,True,False,True,True,614,-65.57542419433594,-61.08457946777344,0
Dawn can observe what children?,What can Dawn observe children?,syntax,island_effects,left_branch_island_echo_question,True,False,True,True,615,-41.21030044555664,-43.32798767089844,1
That sketch had looked like whose dresses?,Whose had that sketch looked like dresses?,syntax,island_effects,left_branch_island_echo_question,True,False,True,True,616,-55.49020004272461,-63.421836853027344,1
A doctor was cleaning what fork?,What was a doctor cleaning fork?,syntax,island_effects,left_branch_island_echo_question,True,False,True,True,617,-44.75044631958008,-39.20916748046875,0
Those guests were passing whose libraries?,Whose were those guests passing libraries?,syntax,island_effects,left_branch_island_echo_question,True,False,True,True,618,-50.77522277832031,-61.03688049316406,1
Lissa did question what senator?,What did Lissa question senator?,syntax,island_effects,left_branch_island_echo_question,True,False,True,True,619,-46.76354217529297,-49.376644134521484,1
Sally was finding which chairs?,Which was Sally finding chairs?,syntax,island_effects,left_branch_island_echo_question,True,False,True,True,620,-45.94052505493164,-39.27143478393555,0
Connie has insulted which guys?,Which has Connie insulted guys?,syntax,island_effects,left_branch_island_echo_question,True,False,True,True,621,-48.195674896240234,-46.736473083496094,0
This doctor is returning to which oases?,Which is this doctor returning to oases?,syntax,island_effects,left_branch_island_echo_question,True,False,True,True,622,-53.829063415527344,-55.5900764465332,1
Sherry was climbing up which ladder?,Which was Sherry climbing up ladder?,syntax,island_effects,left_branch_island_echo_question,True,False,True,True,623,-49.64356231689453,-53.239356994628906,1
Dennis was passing whose closet?,Whose was Dennis passing closet?,syntax,island_effects,left_branch_island_echo_question,True,False,True,True,624,-48.53663635253906,-54.37532424926758,1
Denise was selling whose bananas?,Whose was Denise selling bananas?,syntax,island_effects,left_branch_island_echo_question,True,False,True,True,625,-47.08810806274414,-54.125244140625,1
Carlos did bring what shirts?,What did Carlos bring shirts?,syntax,island_effects,left_branch_island_echo_question,True,False,True,True,626,-44.105735778808594,-41.623626708984375,0
Monica has walked through which closet?,Which has Monica walked through closet?,syntax,island_effects,left_branch_island_echo_question,True,False,True,True,627,-52.118350982666016,-50.059837341308594,0
The mirror can worry what cashier?,What can the mirror worry cashier?,syntax,island_effects,left_branch_island_echo_question,True,False,True,True,628,-52.558433532714844,-55.64468765258789,1
Brian will dislike which waitresses?,Which will Brian dislike waitresses?,syntax,island_effects,left_branch_island_echo_question,True,False,True,True,629,-49.6156005859375,-59.89787673950195,1
John did lift what hamsters?,What did John lift hamsters?,syntax,island_effects,left_branch_island_echo_question,True,False,True,True,630,-47.827125549316406,-48.96315383911133,1
Russell would bore which person?,Which would Russell bore person?,syntax,island_effects,left_branch_island_echo_question,True,False,True,True,631,-38.2778205871582,-44.0659065246582,1
Becca has admired what birds?,What has Becca admired birds?,syntax,island_effects,left_branch_island_echo_question,True,False,True,True,632,-48.654808044433594,-53.146575927734375,1
Dennis could fix which windows?,Which could Dennis fix windows?,syntax,island_effects,left_branch_island_echo_question,True,False,True,True,633,-47.498741149902344,-45.517250061035156,0
Ella would wear which skirt?,Which would Ella wear skirt?,syntax,island_effects,left_branch_island_echo_question,True,False,True,True,634,-47.159175872802734,-45.44306945800781,0
Stephen should clean whose turtle?,Whose should Stephen clean turtle?,syntax,island_effects,left_branch_island_echo_question,True,False,True,True,635,-38.30485916137695,-55.75556945800781,1
Keith is escaping from what guests?,What is Keith escaping from guests?,syntax,island_effects,left_branch_island_echo_question,True,False,True,True,636,-40.58784866333008,-49.12195587158203,1
Erin should know what doctors?,What should Erin know doctors?,syntax,island_effects,left_branch_island_echo_question,True,False,True,True,637,-39.00392150878906,-40.410770416259766,1
Judy might discover which actors?,Which might Judy discover actors?,syntax,island_effects,left_branch_island_echo_question,True,False,True,True,638,-46.059959411621094,-49.27054977416992,1
That dancer might sound like what offspring?,What might that dancer sound like offspring?,syntax,island_effects,left_branch_island_echo_question,True,False,True,True,639,-54.41511917114258,-54.2868537902832,0
William can leave which school?,Which can William leave school?,syntax,island_effects,left_branch_island_echo_question,True,False,True,True,640,-31.833906173706055,-40.85430908203125,1
Grace would mess up what rug?,What would Grace mess up rug?,syntax,island_effects,left_branch_island_echo_question,True,False,True,True,641,-47.96517562866211,-47.421722412109375,0
Ellen is dropping by what malls?,What is Ellen dropping by malls?,syntax,island_effects,left_branch_island_echo_question,True,False,True,True,642,-52.777950286865234,-52.69813537597656,0
Colleen had escaped from which guys?,Which had Colleen escaped from guys?,syntax,island_effects,left_branch_island_echo_question,True,False,True,True,643,-50.36037826538086,-57.996864318847656,1
An actress does boast about what waiters?,What does an actress boast about waiters?,syntax,island_effects,left_branch_island_echo_question,True,False,True,True,644,-62.11510467529297,-61.998130798339844,0
Beverly should bring which bicycles?,Which should Beverly bring bicycles?,syntax,island_effects,left_branch_island_echo_question,True,False,True,True,645,-53.806419372558594,-48.603328704833984,0
Dana had shocked which teenagers?,Which had Dana shocked teenagers?,syntax,island_effects,left_branch_island_echo_question,True,False,True,True,646,-48.917808532714844,-48.38243103027344,0
That bird is stunning what offspring?,What is that bird stunning offspring?,syntax,island_effects,left_branch_island_echo_question,True,False,True,True,647,-49.986549377441406,-46.7618408203125,0
All patients have distracted which libraries?,Which have all patients distracted libraries?,syntax,island_effects,left_branch_island_echo_question,True,False,True,True,648,-52.491859436035156,-52.93389892578125,1
Danielle had forgotten what waiters?,What had Danielle forgotten waiters?,syntax,island_effects,left_branch_island_echo_question,True,False,True,True,649,-50.594085693359375,-52.53528594970703,1
Lucille has cured which boys?,Which has Lucille cured boys?,syntax,island_effects,left_branch_island_echo_question,True,False,True,True,650,-47.140106201171875,-52.636783599853516,1
Rose has fixed whose bicycle?,Whose has Rose fixed bicycle?,syntax,island_effects,left_branch_island_echo_question,True,False,True,True,651,-38.48748779296875,-54.1369514465332,1
Claire will ascend what hill?,What will Claire ascend hill?,syntax,island_effects,left_branch_island_echo_question,True,False,True,True,652,-47.62648010253906,-45.632110595703125,0
Sara is irritating what adult?,What is Sara irritating adult?,syntax,island_effects,left_branch_island_echo_question,True,False,True,True,653,-45.091514587402344,-44.11091613769531,0
Bikes had annoyed whose banks?,Whose had bikes annoyed banks?,syntax,island_effects,left_branch_island_echo_question,True,False,True,True,654,-52.698089599609375,-59.003868103027344,1
Catherine has boasted about which waiters?,Which has Catherine boasted about waiters?,syntax,island_effects,left_branch_island_echo_question,True,False,True,True,655,-61.90460968017578,-59.05812454223633,0
Anne has annoyed what legislatures?,What has Anne annoyed legislatures?,syntax,island_effects,left_branch_island_echo_question,True,False,True,True,656,-43.02790451049805,-50.75038146972656,1
Joseph has broken whose truck?,Whose has Joseph broken truck?,syntax,island_effects,left_branch_island_echo_question,True,False,True,True,657,-35.23243713378906,-49.958099365234375,1
Martha is breaking which mirror?,Which is Martha breaking mirror?,syntax,island_effects,left_branch_island_echo_question,True,False,True,True,658,-43.865234375,-40.56525802612305,0
Travis can approach which adult?,Which can Travis approach adult?,syntax,island_effects,left_branch_island_echo_question,True,False,True,True,659,-52.37995147705078,-47.22117614746094,0
Catherine was messing up whose malls?,Whose was Catherine messing up malls?,syntax,island_effects,left_branch_island_echo_question,True,False,True,True,660,-57.43267822265625,-63.5383415222168,1
Some dancers have remembered what teacher?,What have some dancers remembered teacher?,syntax,island_effects,left_branch_island_echo_question,True,False,True,True,661,-47.82233428955078,-48.40342712402344,1
Peter had disgusted whose museums?,Whose had Peter disgusted museums?,syntax,island_effects,left_branch_island_echo_question,True,False,True,True,662,-41.51744842529297,-57.933414459228516,1
Tracy should sell what newspaper articles?,What should Tracy sell newspaper articles?,syntax,island_effects,left_branch_island_echo_question,True,False,True,True,663,-58.712158203125,-57.69453430175781,0
Anna could help what waitresses?,What could Anna help waitresses?,syntax,island_effects,left_branch_island_echo_question,True,False,True,True,664,-43.35775375366211,-51.69562530517578,1
