sentence_good,sentence_bad,field,linguistics_term,UID,simple_LM_method,one_prefix_method,two_prefix_method,lexically_identical,pair_id,good_prob,bad_prob,correct
Sheila hasn't watched herself.,Sheila hasn't watched himself.,morphology,anaphor_agreement,anaphor_gender_agreement,True,True,False,False,578,-36.46116638183594,-35.380836486816406,0
Susan leaves herself.,Susan leaves himself.,morphology,anaphor_agreement,anaphor_gender_agreement,True,True,False,False,579,-19.340843200683594,-19.15218162536621,0
That woman hasn't described herself.,That woman hasn't described itself.,morphology,anaphor_agreement,anaphor_gender_agreement,True,True,False,False,580,-36.20769500732422,-37.337398529052734,1
Christina discussed herself.,Christina discussed itself.,morphology,anaphor_agreement,anaphor_gender_agreement,True,True,False,False,581,-28.7039794921875,-27.946712493896484,0
Douglas should respect himself.,Douglas should respect herself.,morphology,anaphor_agreement,anaphor_gender_agreement,True,True,False,False,582,-37.84597396850586,-38.43427658081055,1
Karen worked with herself.,Karen worked with itself.,morphology,anaphor_agreement,anaphor_gender_agreement,True,True,False,False,583,-28.256511688232422,-28.611427307128906,1
Elaine can reveal herself.,Elaine can reveal itself.,morphology,anaphor_agreement,anaphor_gender_agreement,True,True,False,False,584,-37.48737716674805,-36.02922821044922,0
Rhonda has referenced herself.,Rhonda has referenced itself.,morphology,anaphor_agreement,anaphor_gender_agreement,True,True,False,False,585,-38.88214111328125,-37.232276916503906,0
Emily had hated herself.,Emily had hated itself.,morphology,anaphor_agreement,anaphor_gender_agreement,True,True,False,False,586,-23.363906860351562,-24.43415641784668,1
Vanessa complained about herself.,Vanessa complained about itself.,morphology,anaphor_agreement,anaphor_gender_agreement,True,True,False,False,587,-34.380592346191406,-35.14828109741211,1
Jessica is impressing herself.,Jessica is impressing himself.,morphology,anaphor_agreement,anaphor_gender_agreement,True,True,False,False,588,-31.926971435546875,-30.189838409423828,0
Carrie describes herself.,Carrie describes itself.,morphology,anaphor_agreement,anaphor_gender_agreement,True,True,False,False,589,-30.202651977539062,-28.85790252685547,0
Melanie wasn't discovering herself.,Melanie wasn't discovering himself.,morphology,anaphor_agreement,anaphor_gender_agreement,True,True,False,False,590,-41.76411437988281,-40.45856857299805,0
William is discovering himself.,William is discovering itself.,morphology,anaphor_agreement,anaphor_gender_agreement,True,True,False,False,591,-23.282352447509766,-24.239883422851562,1
Elaine observes herself.,Elaine observes himself.,morphology,anaphor_agreement,anaphor_gender_agreement,True,True,False,False,592,-31.741966247558594,-30.752532958984375,0
Ellen was hiring herself.,Ellen was hiring itself.,morphology,anaphor_agreement,anaphor_gender_agreement,True,True,False,False,593,-34.4649658203125,-33.16258239746094,0
Wendy hasn't worried herself.,Wendy hasn't worried itself.,morphology,anaphor_agreement,anaphor_gender_agreement,True,True,False,False,594,-41.699562072753906,-42.712059020996094,1
Claire had concealed herself.,Claire had concealed itself.,morphology,anaphor_agreement,anaphor_gender_agreement,True,True,False,False,595,-35.43720626831055,-34.587127685546875,0
David visited himself.,David visited herself.,morphology,anaphor_agreement,anaphor_gender_agreement,True,True,False,False,596,-18.899879455566406,-21.107013702392578,1
Suzanne thought about herself.,Suzanne thought about himself.,morphology,anaphor_agreement,anaphor_gender_agreement,True,True,False,False,597,-36.03019714355469,-34.78150939941406,0
Carla notices herself.,Carla notices itself.,morphology,anaphor_agreement,anaphor_gender_agreement,True,True,False,False,598,-29.03360366821289,-27.984149932861328,0
Derek wasn't describing himself.,Derek wasn't describing herself.,morphology,anaphor_agreement,anaphor_gender_agreement,True,True,False,False,599,-38.74664306640625,-40.493141174316406,1
Angela can't stun herself.,Angela can't stun itself.,morphology,anaphor_agreement,anaphor_gender_agreement,True,True,False,False,600,-40.006736755371094,-39.16350555419922,0
Some story hasn't disagreed with itself.,Some story hasn't disagreed with himself.,morphology,anaphor_agreement,anaphor_gender_agreement,True,True,False,False,601,-43.68380355834961,-43.008689880371094,0
Amy has helped herself.,Amy has helped itself.,morphology,anaphor_agreement,anaphor_gender_agreement,True,True,False,False,602,-21.543373107910156,-23.807998657226562,1
Ronald does see himself.,Ronald does see itself.,morphology,anaphor_agreement,anaphor_gender_agreement,True,True,False,False,603,-32.62424850463867,-33.50547790527344,1
Susan hid herself.,Susan hid itself.,morphology,anaphor_agreement,anaphor_gender_agreement,True,True,False,False,604,-18.898046493530273,-20.14752197265625,1
Laurie boasted about herself.,Laurie boasted about itself.,morphology,anaphor_agreement,anaphor_gender_agreement,True,True,False,False,605,-39.63783264160156,-40.556800842285156,1
Kayla upset herself.,Kayla upset itself.,morphology,anaphor_agreement,anaphor_gender_agreement,True,True,False,False,606,-30.156837463378906,-31.74399757385254,1
Debra was listening to herself.,Debra was listening to itself.,morphology,anaphor_agreement,anaphor_gender_agreement,True,True,False,False,607,-29.07677459716797,-31.636089324951172,1
Stacey hasn't watched herself.,Stacey hasn't watched itself.,morphology,anaphor_agreement,anaphor_gender_agreement,True,True,False,False,608,-38.07666778564453,-39.003379821777344,1
Travis wasn't firing himself.,Travis wasn't firing itself.,morphology,anaphor_agreement,anaphor_gender_agreement,True,True,False,False,609,-39.754180908203125,-40.94462966918945,1
Wayne praises himself.,Wayne praises itself.,morphology,anaphor_agreement,anaphor_gender_agreement,True,True,False,False,610,-30.09486198425293,-28.72152328491211,0
Every commentary had disagreed with itself.,Every commentary had disagreed with herself.,morphology,anaphor_agreement,anaphor_gender_agreement,True,True,False,False,611,-42.70099639892578,-43.40330505371094,1
Steven complains about himself.,Steven complains about itself.,morphology,anaphor_agreement,anaphor_gender_agreement,True,True,False,False,612,-24.72287368774414,-26.301616668701172,1
Connie hadn't alarmed herself.,Connie hadn't alarmed himself.,morphology,anaphor_agreement,anaphor_gender_agreement,True,True,False,False,613,-38.428863525390625,-38.530555725097656,1
Meredith can't see herself.,Meredith can't see itself.,morphology,anaphor_agreement,anaphor_gender_agreement,True,True,False,False,614,-35.27437973022461,-35.21749496459961,0
Peter wouldn't alarm himself.,Peter wouldn't alarm itself.,morphology,anaphor_agreement,anaphor_gender_agreement,True,True,False,False,615,-30.23974609375,-30.890098571777344,1
Eva has respected herself.,Eva has respected itself.,morphology,anaphor_agreement,anaphor_gender_agreement,True,True,False,False,616,-27.17181396484375,-25.798316955566406,0
Kristen has noticed herself.,Kristen has noticed himself.,morphology,anaphor_agreement,anaphor_gender_agreement,True,True,False,False,617,-29.68351936340332,-28.414945602416992,0
Raymond was criticizing himself.,Raymond was criticizing herself.,morphology,anaphor_agreement,anaphor_gender_agreement,True,True,False,False,618,-34.22698974609375,-35.243186950683594,1
Stacey isn't alarming herself.,Stacey isn't alarming itself.,morphology,anaphor_agreement,anaphor_gender_agreement,True,True,False,False,619,-44.58968734741211,-43.794593811035156,0
Janet hasn't scared herself.,Janet hasn't scared himself.,morphology,anaphor_agreement,anaphor_gender_agreement,True,True,False,False,620,-36.47925567626953,-35.772518157958984,0
The lady hasn't hired herself.,The lady hasn't hired itself.,morphology,anaphor_agreement,anaphor_gender_agreement,True,True,False,False,621,-35.010318756103516,-37.663333892822266,1
Becca describes herself.,Becca describes itself.,morphology,anaphor_agreement,anaphor_gender_agreement,True,True,False,False,622,-32.621978759765625,-31.63775634765625,0
Tara hadn't remembered herself.,Tara hadn't remembered itself.,morphology,anaphor_agreement,anaphor_gender_agreement,True,True,False,False,623,-36.52718734741211,-37.50894546508789,1
Ann might worry herself.,Ann might worry himself.,morphology,anaphor_agreement,anaphor_gender_agreement,True,True,False,False,624,-28.79458999633789,-28.87395668029785,1
Barbara hadn't referenced herself.,Barbara hadn't referenced itself.,morphology,anaphor_agreement,anaphor_gender_agreement,True,True,False,False,625,-43.685279846191406,-42.84328079223633,0
Joel has hugged himself.,Joel has hugged itself.,morphology,anaphor_agreement,anaphor_gender_agreement,True,True,False,False,626,-31.056135177612305,-34.115447998046875,1
Sheila revealed herself.,Sheila revealed itself.,morphology,anaphor_agreement,anaphor_gender_agreement,True,True,False,False,627,-29.910888671875,-30.201324462890625,1
Suzanne hurt herself.,Suzanne hurt itself.,morphology,anaphor_agreement,anaphor_gender_agreement,True,True,False,False,628,-33.1230354309082,-33.9433708190918,1
Dan talks about himself.,Dan talks about herself.,morphology,anaphor_agreement,anaphor_gender_agreement,True,True,False,False,629,-21.093534469604492,-22.278610229492188,1
Bethany was confusing herself.,Bethany was confusing himself.,morphology,anaphor_agreement,anaphor_gender_agreement,True,True,False,False,630,-42.63673400878906,-41.2249755859375,0
Guy was referencing himself.,Guy was referencing herself.,morphology,anaphor_agreement,anaphor_gender_agreement,True,True,False,False,631,-27.275081634521484,-28.925601959228516,1
Julia isn't healing herself.,Julia isn't healing itself.,morphology,anaphor_agreement,anaphor_gender_agreement,True,True,False,False,632,-37.88895034790039,-36.28096008300781,0
Clyde might like himself.,Clyde might like itself.,morphology,anaphor_agreement,anaphor_gender_agreement,True,True,False,False,633,-41.560523986816406,-43.69789123535156,1
Craig forgets himself.,Craig forgets itself.,morphology,anaphor_agreement,anaphor_gender_agreement,True,True,False,False,634,-28.234630584716797,-28.146129608154297,0
Joseph won't admire himself.,Joseph won't admire itself.,morphology,anaphor_agreement,anaphor_gender_agreement,True,True,False,False,635,-27.75583267211914,-30.964473724365234,1
Irene had described herself.,Irene had described itself.,morphology,anaphor_agreement,anaphor_gender_agreement,True,True,False,False,636,-36.016197204589844,-36.51372528076172,1
Robert had fled from himself.,Robert had fled from itself.,morphology,anaphor_agreement,anaphor_gender_agreement,True,True,False,False,637,-24.0655574798584,-25.45606803894043,1
Clyde hadn't noticed himself.,Clyde hadn't noticed itself.,morphology,anaphor_agreement,anaphor_gender_agreement,True,True,False,False,638,-45.525390625,-48.05665588378906,1
Martin hasn't visited himself.,Martin hasn't visited itself.,morphology,anaphor_agreement,anaphor_gender_agreement,True,True,False,False,639,-28.90084457397461,-30.854644775390625,1
Ella criticized herself.,Ella criticized itself.,morphology,anaphor_agreement,anaphor_gender_agreement,True,True,False,False,640,-31.72757339477539,-32.08677291870117,1
Barbara was watching herself.,Barbara was watching himself.,morphology,anaphor_agreement,anaphor_gender_agreement,True,True,False,False,641,-29.483505249023438,-27.91897201538086,0
Kirsten has shocked herself.,Kirsten has shocked himself.,morphology,anaphor_agreement,anaphor_gender_agreement,True,True,False,False,642,-42.17289733886719,-40.940799713134766,0
Ella insulted herself.,Ella insulted itself.,morphology,anaphor_agreement,anaphor_gender_agreement,True,True,False,False,643,-32.08381652832031,-33.47539520263672,1
Every actress shouldn't aggravate herself.,Every actress shouldn't aggravate himself.,morphology,anaphor_agreement,anaphor_gender_agreement,True,True,False,False,644,-47.13140106201172,-46.189453125,0
Dennis observed himself.,Dennis observed herself.,morphology,anaphor_agreement,anaphor_gender_agreement,True,True,False,False,645,-26.920616149902344,-28.200048446655273,1
Aaron was discussing himself.,Aaron was discussing herself.,morphology,anaphor_agreement,anaphor_gender_agreement,True,True,False,False,646,-22.04370880126953,-23.812477111816406,1
Holly hasn't sounded like herself.,Holly hasn't sounded like itself.,morphology,anaphor_agreement,anaphor_gender_agreement,True,True,False,False,647,-41.74049377441406,-43.33665084838867,1
Pamela hasn't criticized herself.,Pamela hasn't criticized itself.,morphology,anaphor_agreement,anaphor_gender_agreement,True,True,False,False,648,-49.1795768737793,-49.96044158935547,1
Tina irritated herself.,Tina irritated himself.,morphology,anaphor_agreement,anaphor_gender_agreement,True,True,False,False,649,-29.676362991333008,-29.499916076660156,0
Donald references himself.,Donald references itself.,morphology,anaphor_agreement,anaphor_gender_agreement,True,True,False,False,650,-23.131671905517578,-22.910633087158203,0
Connie wasn't hiring herself.,Connie wasn't hiring itself.,morphology,anaphor_agreement,anaphor_gender_agreement,True,True,False,False,651,-38.891117095947266,-39.04951858520508,1
Stacey admires herself.,Stacey admires himself.,morphology,anaphor_agreement,anaphor_gender_agreement,True,True,False,False,652,-41.385337829589844,-39.797157287597656,0
Kristin should think about herself.,Kristin should think about itself.,morphology,anaphor_agreement,anaphor_gender_agreement,True,True,False,False,653,-31.05735206604004,-31.444135665893555,1
Scott returns to himself.,Scott returns to itself.,morphology,anaphor_agreement,anaphor_gender_agreement,True,True,False,False,654,-19.524232864379883,-21.886383056640625,1
Samantha was hugging herself.,Samantha was hugging himself.,morphology,anaphor_agreement,anaphor_gender_agreement,True,True,False,False,655,-36.03040313720703,-34.05179214477539,0
Linda appreciated herself.,Linda appreciated itself.,morphology,anaphor_agreement,anaphor_gender_agreement,True,True,False,False,656,-29.00881004333496,-30.659666061401367,1
Holly fires herself.,Holly fires himself.,morphology,anaphor_agreement,anaphor_gender_agreement,True,True,False,False,657,-31.791452407836914,-31.39720916748047,0
Samantha should reveal herself.,Samantha should reveal himself.,morphology,anaphor_agreement,anaphor_gender_agreement,True,True,False,False,658,-41.431304931640625,-38.663047790527344,0
Sandra is referencing herself.,Sandra is referencing itself.,morphology,anaphor_agreement,anaphor_gender_agreement,True,True,False,False,659,-37.52201843261719,-37.34296417236328,0
Susan has scared herself.,Susan has scared himself.,morphology,anaphor_agreement,anaphor_gender_agreement,True,True,False,False,660,-25.119102478027344,-24.979228973388672,0
Bill cured himself.,Bill cured herself.,morphology,anaphor_agreement,anaphor_gender_agreement,True,True,False,False,661,-21.13798713684082,-22.150482177734375,1
Jill hadn't praised herself.,Jill hadn't praised itself.,morphology,anaphor_agreement,anaphor_gender_agreement,True,True,False,False,662,-39.604000091552734,-40.77565002441406,1
Alice shouldn't know herself.,Alice shouldn't know himself.,morphology,anaphor_agreement,anaphor_gender_agreement,True,True,False,False,663,-25.903043746948242,-25.602352142333984,0
Vincent does attack himself.,Vincent does attack itself.,morphology,anaphor_agreement,anaphor_gender_agreement,True,True,False,False,664,-40.66841506958008,-39.93047332763672,0
Charles is confusing himself.,Charles is confusing itself.,morphology,anaphor_agreement,anaphor_gender_agreement,True,True,False,False,665,-26.701175689697266,-25.684894561767578,0
Bradley won't discover himself.,Bradley won't discover itself.,morphology,anaphor_agreement,anaphor_gender_agreement,True,True,False,False,666,-31.450960159301758,-33.508628845214844,1
Becca has criticized herself.,Becca has criticized itself.,morphology,anaphor_agreement,anaphor_gender_agreement,True,True,False,False,667,-36.100189208984375,-35.92323303222656,0
Denise might upset herself.,Denise might upset himself.,morphology,anaphor_agreement,anaphor_gender_agreement,True,True,False,False,668,-37.979949951171875,-37.26860046386719,0
Laurie might help herself.,Laurie might help itself.,morphology,anaphor_agreement,anaphor_gender_agreement,True,True,False,False,669,-34.32095718383789,-35.723907470703125,1
Naomi hasn't concealed herself.,Naomi hasn't concealed itself.,morphology,anaphor_agreement,anaphor_gender_agreement,True,True,False,False,670,-40.1065673828125,-39.66136932373047,0
Anne is helping herself.,Anne is helping himself.,morphology,anaphor_agreement,anaphor_gender_agreement,True,True,False,False,671,-22.326744079589844,-20.957185745239258,0
Karla talked about herself.,Karla talked about itself.,morphology,anaphor_agreement,anaphor_gender_agreement,True,True,False,False,672,-29.672988891601562,-29.768848419189453,1
Catherine was curing herself.,Catherine was curing itself.,morphology,anaphor_agreement,anaphor_gender_agreement,True,True,False,False,673,-37.484859466552734,-36.264869689941406,0
William had admired himself.,William had admired herself.,morphology,anaphor_agreement,anaphor_gender_agreement,True,True,False,False,674,-21.956392288208008,-23.775611877441406,1
Sabrina isn't escaping from herself.,Sabrina isn't escaping from itself.,morphology,anaphor_agreement,anaphor_gender_agreement,True,True,False,False,675,-43.642860412597656,-42.51366424560547,0
Karla isn't finding herself.,Karla isn't finding himself.,morphology,anaphor_agreement,anaphor_gender_agreement,True,True,False,False,676,-36.306575775146484,-34.610130310058594,0
Gerald had worried himself.,Gerald had worried herself.,morphology,anaphor_agreement,anaphor_gender_agreement,True,True,False,False,677,-33.15351867675781,-35.1328239440918,1
A lady hasn't visited herself.,A lady hasn't visited himself.,morphology,anaphor_agreement,anaphor_gender_agreement,True,True,False,False,678,-37.983680725097656,-37.44438552856445,0
Renee hadn't alarmed herself.,Renee hadn't alarmed himself.,morphology,anaphor_agreement,anaphor_gender_agreement,True,True,False,False,679,-38.09016418457031,-36.97985076904297,0
Sarah fires herself.,Sarah fires itself.,morphology,anaphor_agreement,anaphor_gender_agreement,True,True,False,False,680,-23.004240036010742,-22.244773864746094,0
Sara hadn't fled from herself.,Sara hadn't fled from himself.,morphology,anaphor_agreement,anaphor_gender_agreement,True,True,False,False,681,-43.09130859375,-41.91680145263672,0
Anne upset herself.,Anne upset himself.,morphology,anaphor_agreement,anaphor_gender_agreement,True,True,False,False,682,-20.389408111572266,-20.25204086303711,0
Richard hadn't bored himself.,Richard hadn't bored herself.,morphology,anaphor_agreement,anaphor_gender_agreement,True,True,False,False,683,-33.925296783447266,-34.21118927001953,1
Rachel watched herself.,Rachel watched itself.,morphology,anaphor_agreement,anaphor_gender_agreement,True,True,False,False,684,-17.09383773803711,-18.462854385375977,1
Samuel describes himself.,Samuel describes herself.,morphology,anaphor_agreement,anaphor_gender_agreement,True,True,False,False,685,-29.07782554626465,-31.066438674926758,1
Natalie is shocking herself.,Natalie is shocking itself.,morphology,anaphor_agreement,anaphor_gender_agreement,True,True,False,False,686,-35.47906494140625,-34.94015884399414,0
Karen didn't see herself.,Karen didn't see itself.,morphology,anaphor_agreement,anaphor_gender_agreement,True,True,False,False,687,-27.62485694885254,-28.538501739501953,1
Andrew did annoy himself.,Andrew did annoy itself.,morphology,anaphor_agreement,anaphor_gender_agreement,True,True,False,False,688,-25.355985641479492,-27.370738983154297,1
Meredith was disgusting herself.,Meredith was disgusting himself.,morphology,anaphor_agreement,anaphor_gender_agreement,True,True,False,False,689,-41.11768341064453,-40.221710205078125,0
Margaret won't heal herself.,Margaret won't heal himself.,morphology,anaphor_agreement,anaphor_gender_agreement,True,True,False,False,690,-36.113006591796875,-35.0311164855957,0
Raymond hasn't referenced himself.,Raymond hasn't referenced herself.,morphology,anaphor_agreement,anaphor_gender_agreement,True,True,False,False,691,-41.9919548034668,-42.71168899536133,1
Lawrence disturbed himself.,Lawrence disturbed itself.,morphology,anaphor_agreement,anaphor_gender_agreement,True,True,False,False,692,-31.243022918701172,-32.66034698486328,1
Clyde stunned himself.,Clyde stunned herself.,morphology,anaphor_agreement,anaphor_gender_agreement,True,True,False,False,693,-39.72029495239258,-41.87610626220703,1
Kevin hadn't concealed himself.,Kevin hadn't concealed itself.,morphology,anaphor_agreement,anaphor_gender_agreement,True,True,False,False,694,-29.14523696899414,-30.99891471862793,1
Veronica isn't attacking herself.,Veronica isn't attacking itself.,morphology,anaphor_agreement,anaphor_gender_agreement,True,True,False,False,695,-43.96518325805664,-42.69660568237305,0
Larry discovered himself.,Larry discovered itself.,morphology,anaphor_agreement,anaphor_gender_agreement,True,True,False,False,696,-18.616886138916016,-20.796669006347656,1
Natalie hadn't impressed herself.,Natalie hadn't impressed himself.,morphology,anaphor_agreement,anaphor_gender_agreement,True,True,False,False,697,-39.765201568603516,-38.85181427001953,0
Leslie hated herself.,Leslie hated himself.,morphology,anaphor_agreement,anaphor_gender_agreement,True,True,False,False,698,-29.295909881591797,-27.93265151977539,0
Andrea isn't kissing herself.,Andrea isn't kissing himself.,morphology,anaphor_agreement,anaphor_gender_agreement,True,True,False,False,699,-40.39278793334961,-39.37934112548828,0
Carrie noticed herself.,Carrie noticed itself.,morphology,anaphor_agreement,anaphor_gender_agreement,True,True,False,False,700,-29.44528579711914,-30.17119598388672,1
Beth has concealed herself.,Beth has concealed itself.,morphology,anaphor_agreement,anaphor_gender_agreement,True,True,False,False,701,-35.23147201538086,-33.81689453125,0
Colleen was concealing herself.,Colleen was concealing itself.,morphology,anaphor_agreement,anaphor_gender_agreement,True,True,False,False,702,-44.90578079223633,-44.364505767822266,0
Nicole had annoyed herself.,Nicole had annoyed itself.,morphology,anaphor_agreement,anaphor_gender_agreement,True,True,False,False,703,-33.10186004638672,-33.96919250488281,1
Charles isn't thinking about himself.,Charles isn't thinking about herself.,morphology,anaphor_agreement,anaphor_gender_agreement,True,True,False,False,704,-28.96686553955078,-30.377365112304688,1
Some lady isn't bothering herself.,Some lady isn't bothering himself.,morphology,anaphor_agreement,anaphor_gender_agreement,True,True,False,False,705,-37.291419982910156,-37.47728729248047,1
Douglas wouldn't confuse himself.,Douglas wouldn't confuse itself.,morphology,anaphor_agreement,anaphor_gender_agreement,True,True,False,False,706,-38.74889373779297,-39.74797439575195,1
Ann can shock herself.,Ann can shock himself.,morphology,anaphor_agreement,anaphor_gender_agreement,True,True,False,False,707,-31.101896286010742,-30.77674674987793,0
Noah knows himself.,Noah knows herself.,morphology,anaphor_agreement,anaphor_gender_agreement,True,True,False,False,708,-29.476104736328125,-30.484615325927734,1
Eva heals herself.,Eva heals itself.,morphology,anaphor_agreement,anaphor_gender_agreement,True,True,False,False,709,-24.182083129882812,-22.36943817138672,0
Theodore wasn't revealing himself.,Theodore wasn't revealing herself.,morphology,anaphor_agreement,anaphor_gender_agreement,True,True,False,False,710,-39.251869201660156,-40.44984817504883,1
Donna hasn't observed herself.,Donna hasn't observed itself.,morphology,anaphor_agreement,anaphor_gender_agreement,True,True,False,False,711,-37.25387954711914,-38.31071472167969,1
Vincent will alarm himself.,Vincent will alarm herself.,morphology,anaphor_agreement,anaphor_gender_agreement,True,True,False,False,712,-40.49444580078125,-41.063636779785156,1
Connie has returned to herself.,Connie has returned to itself.,morphology,anaphor_agreement,anaphor_gender_agreement,True,True,False,False,713,-30.687957763671875,-32.998374938964844,1
Amanda insults herself.,Amanda insults himself.,morphology,anaphor_agreement,anaphor_gender_agreement,True,True,False,False,714,-30.643291473388672,-29.46636390686035,0
Eva was disturbing herself.,Eva was disturbing itself.,morphology,anaphor_agreement,anaphor_gender_agreement,True,True,False,False,715,-23.332229614257812,-23.01249885559082,0
Tamara has found herself.,Tamara has found himself.,morphology,anaphor_agreement,anaphor_gender_agreement,True,True,False,False,716,-29.715787887573242,-28.880905151367188,0
Todd isn't talking to himself.,Todd isn't talking to itself.,morphology,anaphor_agreement,anaphor_gender_agreement,True,True,False,False,717,-26.030136108398438,-28.838912963867188,1
Elizabeth shouldn't argue about herself.,Elizabeth shouldn't argue about himself.,morphology,anaphor_agreement,anaphor_gender_agreement,True,True,False,False,718,-32.46601104736328,-31.042545318603516,0
Kevin hasn't found himself.,Kevin hasn't found itself.,morphology,anaphor_agreement,anaphor_gender_agreement,True,True,False,False,719,-23.306808471679688,-26.245059967041016,1
That lady praises herself.,That lady praises himself.,morphology,anaphor_agreement,anaphor_gender_agreement,True,True,False,False,720,-31.00760269165039,-31.407634735107422,1
Donna is scaring herself.,Donna is scaring himself.,morphology,anaphor_agreement,anaphor_gender_agreement,True,True,False,False,721,-34.88105773925781,-33.821434020996094,0
That guy hasn't respected himself.,That guy hasn't respected itself.,morphology,anaphor_agreement,anaphor_gender_agreement,True,True,False,False,722,-36.14061737060547,-38.294700622558594,1
