sentence_good,sentence_bad,field,linguistics_term,UID,simple_LM_method,one_prefix_method,two_prefix_method,lexically_identical,pair_id,good_prob,bad_prob,correct
Sketches upset these fast alumni.,Sketches upset these fast alumnus.,morphology,determiner_noun_agreement,determiner_noun_agreement_with_adj_irregular_1,True,True,False,True,670,-63.10245132446289,-63.744693756103516,1
Derek can't care for this employed child.,Derek can't care for this employed children.,morphology,determiner_noun_agreement,determiner_noun_agreement_with_adj_irregular_1,True,True,False,True,671,-57.43231201171875,-55.500953674316406,0
Lissa wasn't driving to that white oasis.,Lissa wasn't driving to that white oases.,morphology,determiner_noun_agreement,determiner_noun_agreement_with_adj_irregular_1,True,True,False,True,672,-65.01152038574219,-67.18487548828125,1
The customers have exited this old oasis.,The customers have exited this old oases.,morphology,determiner_noun_agreement,determiner_noun_agreement_with_adj_irregular_1,True,True,False,True,673,-50.976783752441406,-53.96179962158203,1
Guy was leaving this confident child.,Guy was leaving this confident children.,morphology,determiner_noun_agreement,determiner_noun_agreement_with_adj_irregular_1,True,True,False,True,674,-42.786338806152344,-43.86566925048828,1
Keith goes to this rough oasis.,Keith goes to this rough oases.,morphology,determiner_noun_agreement,determiner_noun_agreement_with_adj_irregular_1,True,True,False,True,675,-39.645050048828125,-43.4385986328125,1
Most cashiers complain about those old men.,Most cashiers complain about those old man.,morphology,determiner_noun_agreement,determiner_noun_agreement_with_adj_irregular_1,True,True,False,True,676,-51.34172058105469,-53.695594787597656,1
Vincent shouldn't scare that busy person.,Vincent shouldn't scare that busy people.,morphology,determiner_noun_agreement,determiner_noun_agreement_with_adj_irregular_1,True,True,False,True,677,-57.570587158203125,-54.21890640258789,0
Beth hugged that nice child.,Beth hugged that nice children.,morphology,determiner_noun_agreement,determiner_noun_agreement_with_adj_irregular_1,True,True,False,True,678,-49.01277542114258,-48.40019607543945,0
Guy shouldn't praise these smart people.,Guy shouldn't praise these smart person.,morphology,determiner_noun_agreement,determiner_noun_agreement_with_adj_irregular_1,True,True,False,True,679,-43.545753479003906,-48.440956115722656,1
Florence sells these small feet.,Florence sells these small foot.,morphology,determiner_noun_agreement,determiner_noun_agreement_with_adj_irregular_1,True,True,False,True,680,-45.6337890625,-50.57680892944336,1
Walter didn't know this out in the open woman.,Walter didn't know this out in the open women.,morphology,determiner_noun_agreement,determiner_noun_agreement_with_adj_irregular_1,True,True,False,True,681,-56.001625061035156,-59.72283935546875,1
Barbara has messed up those broken teeth.,Barbara has messed up those broken tooth.,morphology,determiner_noun_agreement,determiner_noun_agreement_with_adj_irregular_1,True,True,False,True,682,-52.698036193847656,-57.177513122558594,1
Carl will help these busy men.,Carl will help these busy man.,morphology,determiner_noun_agreement,determiner_noun_agreement_with_adj_irregular_1,True,True,False,True,683,-34.263694763183594,-39.738037109375,1
This guest could hire these nice men.,This guest could hire these nice man.,morphology,determiner_noun_agreement,determiner_noun_agreement_with_adj_irregular_1,True,True,False,True,684,-49.66450500488281,-52.08793258666992,1
Rodney wasn't bothering this small alumnus.,Rodney wasn't bothering this small alumni.,morphology,determiner_noun_agreement,determiner_noun_agreement_with_adj_irregular_1,True,True,False,True,685,-57.99582290649414,-58.91287612915039,1
These students break these messy teeth.,These students break these messy tooth.,morphology,determiner_noun_agreement,determiner_noun_agreement_with_adj_irregular_1,True,True,False,True,686,-42.29057312011719,-47.27080535888672,1
April wasn't biking to those hard oases.,April wasn't biking to those hard oasis.,morphology,determiner_noun_agreement,determiner_noun_agreement_with_adj_irregular_1,True,True,False,True,687,-65.8908462524414,-62.92101287841797,0
Stephanie hated those fast alumni.,Stephanie hated those fast alumnus.,morphology,determiner_noun_agreement,determiner_noun_agreement_with_adj_irregular_1,True,True,False,True,688,-58.44380187988281,-59.34885787963867,1
Dawn has disturbed these ill men.,Dawn has disturbed these ill man.,morphology,determiner_noun_agreement,determiner_noun_agreement_with_adj_irregular_1,True,True,False,True,689,-53.69352722167969,-56.109405517578125,1
Chad questioned this unsure child.,Chad questioned this unsure children.,morphology,determiner_noun_agreement,determiner_noun_agreement_with_adj_irregular_1,True,True,False,True,690,-51.19316864013672,-51.32913589477539,1
That shirt disgusted this busy woman.,That shirt disgusted this busy women.,morphology,determiner_noun_agreement,determiner_noun_agreement_with_adj_irregular_1,True,True,False,True,691,-52.26099395751953,-55.20341491699219,1
Daniel has toured that red oasis.,Daniel has toured that red oases.,morphology,determiner_noun_agreement,determiner_noun_agreement_with_adj_irregular_1,True,True,False,True,692,-46.215919494628906,-49.4101676940918,1
Joel finds those hidden men.,Joel finds those hidden man.,morphology,determiner_noun_agreement,determiner_noun_agreement_with_adj_irregular_1,True,True,False,True,693,-42.8475227355957,-44.670066833496094,1
Some adult did arrive at that old oasis.,Some adult did arrive at that old oases.,morphology,determiner_noun_agreement,determiner_noun_agreement_with_adj_irregular_1,True,True,False,True,694,-60.32192611694336,-64.55638122558594,1
A lot of carriages weren't alarming that employed woman.,A lot of carriages weren't alarming that employed women.,morphology,determiner_noun_agreement,determiner_noun_agreement_with_adj_irregular_1,True,True,False,True,695,-74.41089630126953,-69.56424713134766,0
Tina wasn't observing these unemployed children.,Tina wasn't observing these unemployed child.,morphology,determiner_noun_agreement,determiner_noun_agreement_with_adj_irregular_1,True,True,False,True,696,-52.93010711669922,-60.4289665222168,1
All dresses aggravate these important men.,All dresses aggravate these important man.,morphology,determiner_noun_agreement,determiner_noun_agreement_with_adj_irregular_1,True,True,False,True,697,-50.83980178833008,-55.27430725097656,1
This car had disturbed those important men.,This car had disturbed those important man.,morphology,determiner_noun_agreement,determiner_noun_agreement_with_adj_irregular_1,True,True,False,True,698,-51.807003021240234,-54.515567779541016,1
Florence will return to that confident person.,Florence will return to that confident people.,morphology,determiner_noun_agreement,determiner_noun_agreement_with_adj_irregular_1,True,True,False,True,699,-53.47932052612305,-51.88301467895508,0
Some cashiers criticized those uncertain women.,Some cashiers criticized those uncertain woman.,morphology,determiner_noun_agreement,determiner_noun_agreement_with_adj_irregular_1,True,True,False,True,700,-59.43283462524414,-62.938438415527344,1
Meredith investigated this excited child.,Meredith investigated this excited children.,morphology,determiner_noun_agreement,determiner_noun_agreement_with_adj_irregular_1,True,True,False,True,701,-53.3120231628418,-53.35127639770508,1
Sarah is concealing that busy woman.,Sarah is concealing that busy women.,morphology,determiner_noun_agreement,determiner_noun_agreement_with_adj_irregular_1,True,True,False,True,702,-43.87098693847656,-43.439056396484375,0
Janice criticizes this good analysis.,Janice criticizes this good analyses.,morphology,determiner_noun_agreement,determiner_noun_agreement_with_adj_irregular_1,True,True,False,True,703,-45.587337493896484,-50.55009460449219,1
Many guys weren't noticing this lost child.,Many guys weren't noticing this lost children.,morphology,determiner_noun_agreement,determiner_noun_agreement_with_adj_irregular_1,True,True,False,True,704,-57.07133483886719,-56.384765625,0
Homer can pass that concealed oasis.,Homer can pass that concealed oases.,morphology,determiner_noun_agreement,determiner_noun_agreement_with_adj_irregular_1,True,True,False,True,705,-60.498409271240234,-62.90605163574219,1
The drivers hide this concealed fungus.,The drivers hide this concealed fungi.,morphology,determiner_noun_agreement,determiner_noun_agreement_with_adj_irregular_1,True,True,False,True,706,-50.39825439453125,-51.33977508544922,1
Marla had investigated that content person.,Marla had investigated that content people.,morphology,determiner_noun_agreement,determiner_noun_agreement_with_adj_irregular_1,True,True,False,True,707,-54.22050857543945,-52.53312683105469,0
The Borgias explore this white oasis.,The Borgias explore this white oases.,morphology,determiner_noun_agreement,determiner_noun_agreement_with_adj_irregular_1,True,True,False,True,708,-56.96082305908203,-60.150630950927734,1
Heather brought this black tooth.,Heather brought this black teeth.,morphology,determiner_noun_agreement,determiner_noun_agreement_with_adj_irregular_1,True,True,False,True,709,-46.436317443847656,-48.92765808105469,1
Walter doesn't drop by those smooth oases.,Walter doesn't drop by those smooth oasis.,morphology,determiner_noun_agreement,determiner_noun_agreement_with_adj_irregular_1,True,True,False,True,710,-59.4710693359375,-58.47962951660156,0
Sharon knows this hopeful man.,Sharon knows this hopeful men.,morphology,determiner_noun_agreement,determiner_noun_agreement_with_adj_irregular_1,True,True,False,True,711,-46.75904846191406,-52.00313949584961,1
The companies irritate this ill child.,The companies irritate this ill children.,morphology,determiner_noun_agreement,determiner_noun_agreement_with_adj_irregular_1,True,True,False,True,712,-48.957603454589844,-46.89485168457031,0
Alice is noticing those orange mice.,Alice is noticing those orange mouse.,morphology,determiner_noun_agreement,determiner_noun_agreement_with_adj_irregular_1,True,True,False,True,713,-44.50320053100586,-47.5743408203125,1
Kimberley loves this nice woman.,Kimberley loves this nice women.,morphology,determiner_noun_agreement,determiner_noun_agreement_with_adj_irregular_1,True,True,False,True,714,-46.5953369140625,-50.95013427734375,1
The Borgias have examined this purple thesis.,The Borgias have examined this purple theses.,morphology,determiner_noun_agreement,determiner_noun_agreement_with_adj_irregular_1,True,True,False,True,715,-66.05874633789062,-71.06806945800781,1
Douglas went to this concealed oasis.,Douglas went to this concealed oases.,morphology,determiner_noun_agreement,determiner_noun_agreement_with_adj_irregular_1,True,True,False,True,716,-53.680809020996094,-55.89421844482422,1
Ladies scan these long synopses.,Ladies scan these long synopsis.,morphology,determiner_noun_agreement,determiner_noun_agreement_with_adj_irregular_1,True,True,False,True,717,-63.400516510009766,-54.05221939086914,0
Adam can question that lost woman.,Adam can question that lost women.,morphology,determiner_noun_agreement,determiner_noun_agreement_with_adj_irregular_1,True,True,False,True,718,-43.956787109375,-42.844425201416016,0
George fixes those purple teeth.,George fixes those purple tooth.,morphology,determiner_noun_agreement,determiner_noun_agreement_with_adj_irregular_1,True,True,False,True,719,-40.59397506713867,-44.14334487915039,1
The Clintons praise these long analyses.,The Clintons praise these long analysis.,morphology,determiner_noun_agreement,determiner_noun_agreement_with_adj_irregular_1,True,True,False,True,720,-55.280372619628906,-55.58027648925781,1
Craig shouldn't bike to these yellow oases.,Craig shouldn't bike to these yellow oasis.,morphology,determiner_noun_agreement,determiner_noun_agreement_with_adj_irregular_1,True,True,False,True,721,-65.25115203857422,-62.81122589111328,0
The child hasn't loved these good synopses.,The child hasn't loved these good synopsis.,morphology,determiner_noun_agreement,determiner_noun_agreement_with_adj_irregular_1,True,True,False,True,722,-61.77140426635742,-54.63084030151367,0
These waitresses might reference this out in the open alumnus.,These waitresses might reference this out in the open alumni.,morphology,determiner_noun_agreement,determiner_noun_agreement_with_adj_irregular_1,True,True,False,True,723,-72.05838012695312,-70.921630859375,0
Phillip questions this young child.,Phillip questions this young children.,morphology,determiner_noun_agreement,determiner_noun_agreement_with_adj_irregular_1,True,True,False,True,724,-41.29438781738281,-39.88347625732422,0
Jodi hadn't impressed that excited woman.,Jodi hadn't impressed that excited women.,morphology,determiner_noun_agreement,determiner_noun_agreement_with_adj_irregular_1,True,True,False,True,725,-57.25239562988281,-58.5809440612793,1
Guys break those out in the open teeth.,Guys break those out in the open tooth.,morphology,determiner_noun_agreement,determiner_noun_agreement_with_adj_irregular_1,True,True,False,True,726,-50.40573501586914,-53.41411209106445,1
Joel saw these lost mice.,Joel saw these lost mouse.,morphology,determiner_noun_agreement,determiner_noun_agreement_with_adj_irregular_1,True,True,False,True,727,-44.98320007324219,-47.270057678222656,1
The Impressionists were fixing those gray teeth.,The Impressionists were fixing those gray tooth.,morphology,determiner_noun_agreement,determiner_noun_agreement_with_adj_irregular_1,True,True,False,True,728,-60.108612060546875,-64.07613372802734,1
Kristen has discussed those good analyses.,Kristen has discussed those good analysis.,morphology,determiner_noun_agreement,determiner_noun_agreement_with_adj_irregular_1,True,True,False,True,729,-47.64683532714844,-47.30596160888672,0
The girls had described those upset people.,The girls had described those upset person.,morphology,determiner_noun_agreement,determiner_noun_agreement_with_adj_irregular_1,True,True,False,True,730,-51.164852142333984,-55.798370361328125,1
Veronica approaches those small women.,Veronica approaches those small woman.,morphology,determiner_noun_agreement,determiner_noun_agreement_with_adj_irregular_1,True,True,False,True,731,-45.166709899902344,-49.53302001953125,1
Robert hugs this scared person.,Robert hugs this scared people.,morphology,determiner_noun_agreement,determiner_noun_agreement_with_adj_irregular_1,True,True,False,True,732,-41.37501525878906,-37.49859619140625,0
Mitchell had bought this concealed cactus.,Mitchell had bought this concealed cacti.,morphology,determiner_noun_agreement,determiner_noun_agreement_with_adj_irregular_1,True,True,False,True,733,-56.08233642578125,-63.87042236328125,1
A pepper shocked these displeased alumni.,A pepper shocked these displeased alumnus.,morphology,determiner_noun_agreement,determiner_noun_agreement_with_adj_irregular_1,True,True,False,True,734,-64.29241943359375,-63.896812438964844,0
Timothy walked through these new oases.,Timothy walked through these new oasis.,morphology,determiner_noun_agreement,determiner_noun_agreement_with_adj_irregular_1,True,True,False,True,735,-50.54706573486328,-50.21508026123047,0
Janice did clean these smooth teeth.,Janice did clean these smooth tooth.,morphology,determiner_noun_agreement,determiner_noun_agreement_with_adj_irregular_1,True,True,False,True,736,-47.61631774902344,-50.922279357910156,1
Andrew had approached that small man.,Andrew had approached that small men.,morphology,determiner_noun_agreement,determiner_noun_agreement_with_adj_irregular_1,True,True,False,True,737,-36.51493453979492,-35.73191833496094,0
Wendy hides these red cacti.,Wendy hides these red cactus.,morphology,determiner_noun_agreement,determiner_noun_agreement_with_adj_irregular_1,True,True,False,True,738,-59.652015686035156,-50.81926345825195,0
Leslie visits that sick man.,Leslie visits that sick men.,morphology,determiner_noun_agreement,determiner_noun_agreement_with_adj_irregular_1,True,True,False,True,739,-48.7419548034668,-47.98038101196289,0
Those girls exit this brown oasis.,Those girls exit this brown oases.,morphology,determiner_noun_agreement,determiner_noun_agreement_with_adj_irregular_1,True,True,False,True,740,-54.89574432373047,-57.1353645324707,1
Christopher liked this red nucleus.,Christopher liked this red nuclei.,morphology,determiner_noun_agreement,determiner_noun_agreement_with_adj_irregular_1,True,True,False,True,741,-39.87425231933594,-41.74977111816406,1
Florence might forget this sick woman.,Florence might forget this sick women.,morphology,determiner_noun_agreement,determiner_noun_agreement_with_adj_irregular_1,True,True,False,True,742,-53.821434020996094,-56.849700927734375,1
These ladies sell that green cactus.,These ladies sell that green cacti.,morphology,determiner_noun_agreement,determiner_noun_agreement_with_adj_irregular_1,True,True,False,True,743,-49.60063552856445,-58.62675094604492,1
A lot of blouses disgust that uncertain alumnus.,A lot of blouses disgust that uncertain alumni.,morphology,determiner_noun_agreement,determiner_noun_agreement_with_adj_irregular_1,True,True,False,True,744,-75.64349365234375,-75.33853149414062,0
Patrick had exited those hidden oases.,Patrick had exited those hidden oasis.,morphology,determiner_noun_agreement,determiner_noun_agreement_with_adj_irregular_1,True,True,False,True,745,-52.23482894897461,-52.4876823425293,1
Gina was taking this big stimulus.,Gina was taking this big stimuli.,morphology,determiner_noun_agreement,determiner_noun_agreement_with_adj_irregular_1,True,True,False,True,746,-44.79970169067383,-48.270835876464844,1
A lot of pictures look like this uncertain child.,A lot of pictures look like this uncertain children.,morphology,determiner_noun_agreement,determiner_noun_agreement_with_adj_irregular_1,True,True,False,True,747,-53.390350341796875,-54.37983703613281,1
Adam passes this exposed oasis.,Adam passes this exposed oases.,morphology,determiner_noun_agreement,determiner_noun_agreement_with_adj_irregular_1,True,True,False,True,748,-43.768707275390625,-46.256919860839844,1
Some drawings shock that hidden woman.,Some drawings shock that hidden women.,morphology,determiner_noun_agreement,determiner_noun_agreement_with_adj_irregular_1,True,True,False,True,749,-58.473854064941406,-57.69416046142578,0
Nina has boycotted those small oases.,Nina has boycotted those small oasis.,morphology,determiner_noun_agreement,determiner_noun_agreement_with_adj_irregular_1,True,True,False,True,750,-75.56243896484375,-73.2196044921875,0
Bruce exits that white oasis.,Bruce exits that white oases.,morphology,determiner_noun_agreement,determiner_noun_agreement_with_adj_irregular_1,True,True,False,True,751,-42.260616302490234,-43.529884338378906,1
Mary investigated this unsure woman.,Mary investigated this unsure women.,morphology,determiner_noun_agreement,determiner_noun_agreement_with_adj_irregular_1,True,True,False,True,752,-43.10337829589844,-45.28434371948242,1
Diane criticized that bad synopsis.,Diane criticized that bad synopses.,morphology,determiner_noun_agreement,determiner_noun_agreement_with_adj_irregular_1,True,True,False,True,753,-50.87666320800781,-59.38087844848633,1
Those sketches stun this fast child.,Those sketches stun this fast children.,morphology,determiner_noun_agreement,determiner_noun_agreement_with_adj_irregular_1,True,True,False,True,754,-58.11882781982422,-56.51576232910156,0
Vanessa shouldn't observe these determined women.,Vanessa shouldn't observe these determined woman.,morphology,determiner_noun_agreement,determiner_noun_agreement_with_adj_irregular_1,True,True,False,True,755,-63.79143524169922,-66.76499938964844,1
Jill doesn't reference those clever children.,Jill doesn't reference those clever child.,morphology,determiner_noun_agreement,determiner_noun_agreement_with_adj_irregular_1,True,True,False,True,756,-59.51303482055664,-62.02544403076172,1
Every driver ran around that green oasis.,Every driver ran around that green oases.,morphology,determiner_noun_agreement,determiner_noun_agreement_with_adj_irregular_1,True,True,False,True,757,-55.996009826660156,-58.97639465332031,1
Many guys question this unlucky person.,Many guys question this unlucky people.,morphology,determiner_noun_agreement,determiner_noun_agreement_with_adj_irregular_1,True,True,False,True,758,-51.91868591308594,-51.024696350097656,0
Laura won't heal that concealed man.,Laura won't heal that concealed men.,morphology,determiner_noun_agreement,determiner_noun_agreement_with_adj_irregular_1,True,True,False,True,759,-46.58156967163086,-46.43949508666992,0
A lot of people care for that unemployed person.,A lot of people care for that unemployed people.,morphology,determiner_noun_agreement,determiner_noun_agreement_with_adj_irregular_1,True,True,False,True,760,-46.17918014526367,-40.42523956298828,0
Natalie liked those small lice.,Natalie liked those small louse.,morphology,determiner_noun_agreement,determiner_noun_agreement_with_adj_irregular_1,True,True,False,True,761,-53.53522491455078,-54.93230438232422,1
An eggplant bores those small women.,An eggplant bores those small woman.,morphology,determiner_noun_agreement,determiner_noun_agreement_with_adj_irregular_1,True,True,False,True,762,-56.28090286254883,-60.71958541870117,1
A lot of waiters admire this big louse.,A lot of waiters admire this big lice.,morphology,determiner_noun_agreement,determiner_noun_agreement_with_adj_irregular_1,True,True,False,True,763,-63.33424758911133,-63.74521255493164,1
These students conceal those standing children.,These students conceal those standing child.,morphology,determiner_noun_agreement,determiner_noun_agreement_with_adj_irregular_1,True,True,False,True,764,-48.19976806640625,-49.633026123046875,1
The customers appreciate those happy people.,The customers appreciate those happy person.,morphology,determiner_noun_agreement,determiner_noun_agreement_with_adj_irregular_1,True,True,False,True,765,-34.072296142578125,-40.3978271484375,1
Ronald has scared this popular child.,Ronald has scared this popular children.,morphology,determiner_noun_agreement,determiner_noun_agreement_with_adj_irregular_1,True,True,False,True,766,-54.16477966308594,-56.589942932128906,1
Matt hadn't walked through those hidden oases.,Matt hadn't walked through those hidden oasis.,morphology,determiner_noun_agreement,determiner_noun_agreement_with_adj_irregular_1,True,True,False,True,767,-56.28315734863281,-56.34680938720703,1
Barbara couldn't walk through those old oases.,Barbara couldn't walk through those old oasis.,morphology,determiner_noun_agreement,determiner_noun_agreement_with_adj_irregular_1,True,True,False,True,768,-59.78205108642578,-58.60880661010742,0
These actors messed up that messy foot.,These actors messed up that messy feet.,morphology,determiner_noun_agreement,determiner_noun_agreement_with_adj_irregular_1,True,True,False,True,769,-54.165863037109375,-51.48518371582031,0
Donald conceals those red cacti.,Donald conceals those red cactus.,morphology,determiner_noun_agreement,determiner_noun_agreement_with_adj_irregular_1,True,True,False,True,770,-54.27915954589844,-46.094303131103516,0
Many commentaries shock those happy men.,Many commentaries shock those happy man.,morphology,determiner_noun_agreement,determiner_noun_agreement_with_adj_irregular_1,True,True,False,True,771,-58.16881561279297,-60.188941955566406,1
Every guy hugged this lucky child.,Every guy hugged this lucky children.,morphology,determiner_noun_agreement,determiner_noun_agreement_with_adj_irregular_1,True,True,False,True,772,-47.60126495361328,-49.97317123413086,1
Janice should hire this unsure alumnus.,Janice should hire this unsure alumni.,morphology,determiner_noun_agreement,determiner_noun_agreement_with_adj_irregular_1,True,True,False,True,773,-59.5540771484375,-57.772972106933594,0
Many organizations haven't fired those big men.,Many organizations haven't fired those big man.,morphology,determiner_noun_agreement,determiner_noun_agreement_with_adj_irregular_1,True,True,False,True,774,-48.810142517089844,-52.422943115234375,1
Ice cream alarmed that unsure man.,Ice cream alarmed that unsure men.,morphology,determiner_noun_agreement,determiner_noun_agreement_with_adj_irregular_1,True,True,False,True,775,-55.61797332763672,-55.982627868652344,1
Carol wasn't returning to these displeased people.,Carol wasn't returning to these displeased person.,morphology,determiner_noun_agreement,determiner_noun_agreement_with_adj_irregular_1,True,True,False,True,776,-59.769813537597656,-63.832088470458984,1
Robert has thought about this unsure person.,Robert has thought about this unsure people.,morphology,determiner_noun_agreement,determiner_noun_agreement_with_adj_irregular_1,True,True,False,True,777,-46.7403564453125,-47.190975189208984,1
Karen explores those green oases.,Karen explores those green oasis.,morphology,determiner_noun_agreement,determiner_noun_agreement_with_adj_irregular_1,True,True,False,True,778,-55.218666076660156,-52.4763069152832,0
Every child hasn't scared this determined child.,Every child hasn't scared this determined children.,morphology,determiner_noun_agreement,determiner_noun_agreement_with_adj_irregular_1,True,True,False,True,779,-53.805171966552734,-54.83771514892578,1
Some couch aggravates this excited child.,Some couch aggravates this excited children.,morphology,determiner_noun_agreement,determiner_noun_agreement_with_adj_irregular_1,True,True,False,True,780,-52.5130615234375,-52.45948028564453,0
The Impressionists had hired these confident alumni.,The Impressionists had hired these confident alumnus.,morphology,determiner_noun_agreement,determiner_noun_agreement_with_adj_irregular_1,True,True,False,True,781,-61.192283630371094,-66.62541961669922,1
