sentence_good,sentence_bad,field,linguistics_term,UID,simple_LM_method,one_prefix_method,two_prefix_method,lexically_identical,pair_id,good_prob,bad_prob,correct
Every library impresses itself.,Every library impresses themselves.,morphology,anaphor_agreement,anaphor_number_agreement,True,True,False,True,554,-39.91569137573242,-40.10806655883789,1
Michelle hasn't concealed herself.,Michelle hasn't concealed themselves.,morphology,anaphor_agreement,anaphor_number_agreement,True,True,False,True,555,-31.360965728759766,-29.906890869140625,0
Linda stunned herself.,Linda stunned themselves.,morphology,anaphor_agreement,anaphor_number_agreement,True,True,False,True,556,-31.801509857177734,-32.16900634765625,1
Some men were approaching themselves.,Some men were approaching herself.,morphology,anaphor_agreement,anaphor_number_agreement,True,True,False,True,557,-28.57404899597168,-30.989213943481445,1
All ladies work with themselves.,All ladies work with itself.,morphology,anaphor_agreement,anaphor_number_agreement,True,True,False,True,558,-32.633392333984375,-34.194297790527344,1
Those guys have concealed themselves.,Those guys have concealed itself.,morphology,anaphor_agreement,anaphor_number_agreement,True,True,False,True,559,-31.51087188720703,-32.44606018066406,1
Homer can find himself.,Homer can find themselves.,morphology,anaphor_agreement,anaphor_number_agreement,True,True,False,True,560,-28.526287078857422,-30.114883422851562,1
Those pedestrians bored themselves.,Those pedestrians bored himself.,morphology,anaphor_agreement,anaphor_number_agreement,True,True,False,True,561,-34.951637268066406,-35.06755828857422,1
Sandra could upset herself.,Sandra could upset themselves.,morphology,anaphor_agreement,anaphor_number_agreement,True,True,False,True,562,-39.233062744140625,-38.70985412597656,0
Heidi has distracted herself.,Heidi has distracted themselves.,morphology,anaphor_agreement,anaphor_number_agreement,True,True,False,True,563,-37.808536529541016,-36.72674560546875,0
Peter isn't kissing himself.,Peter isn't kissing themselves.,morphology,anaphor_agreement,anaphor_number_agreement,True,True,False,True,564,-25.42285919189453,-27.561641693115234,1
These students aren't aggravating themselves.,These students aren't aggravating itself.,morphology,anaphor_agreement,anaphor_number_agreement,True,True,False,True,565,-45.49640655517578,-46.278167724609375,1
Guy bothered himself.,Guy bothered themselves.,morphology,anaphor_agreement,anaphor_number_agreement,True,True,False,True,566,-22.285438537597656,-22.56975555419922,1
Tara wasn't concealing herself.,Tara wasn't concealing themselves.,morphology,anaphor_agreement,anaphor_number_agreement,True,True,False,True,567,-46.583309173583984,-47.15369415283203,1
Most teachers concealed themselves.,Most teachers concealed himself.,morphology,anaphor_agreement,anaphor_number_agreement,True,True,False,True,568,-30.907032012939453,-31.66924285888672,1
The university can't astound itself.,The university can't astound themselves.,morphology,anaphor_agreement,anaphor_number_agreement,True,True,False,True,569,-49.8254508972168,-49.000362396240234,0
Some waiters do visit themselves.,Some waiters do visit itself.,morphology,anaphor_agreement,anaphor_number_agreement,True,True,False,True,570,-47.941341400146484,-48.72544860839844,1
Those cashiers have concealed themselves.,Those cashiers have concealed himself.,morphology,anaphor_agreement,anaphor_number_agreement,True,True,False,True,571,-46.77550506591797,-47.009429931640625,1
The children can know themselves.,The children can know itself.,morphology,anaphor_agreement,anaphor_number_agreement,True,True,False,True,572,-28.080585479736328,-29.231895446777344,1
Jacqueline couldn't love herself.,Jacqueline couldn't love themselves.,morphology,anaphor_agreement,anaphor_number_agreement,True,True,False,True,573,-40.39958572387695,-41.581756591796875,1
All drivers would praise themselves.,All drivers would praise herself.,morphology,anaphor_agreement,anaphor_number_agreement,True,True,False,True,574,-39.045833587646484,-41.306427001953125,1
Catherine does complain about herself.,Catherine does complain about themselves.,morphology,anaphor_agreement,anaphor_number_agreement,True,True,False,True,575,-38.886268615722656,-38.33007049560547,0
Beth had upset herself.,Beth had upset themselves.,morphology,anaphor_agreement,anaphor_number_agreement,True,True,False,True,576,-34.38146209716797,-34.39000701904297,1
These senators had seen themselves.,These senators had seen herself.,morphology,anaphor_agreement,anaphor_number_agreement,True,True,False,True,577,-30.986845016479492,-33.21747589111328,1
Those schools don't irritate themselves.,Those schools don't irritate itself.,morphology,anaphor_agreement,anaphor_number_agreement,True,True,False,True,578,-42.71736526489258,-43.02313232421875,1
Waitresses irritate themselves.,Waitresses irritate himself.,morphology,anaphor_agreement,anaphor_number_agreement,True,True,False,True,579,-37.657318115234375,-36.8428840637207,0
A lot of teenagers have visited themselves.,A lot of teenagers have visited himself.,morphology,anaphor_agreement,anaphor_number_agreement,True,True,False,True,580,-44.793922424316406,-45.3763427734375,1
All adults worked with themselves.,All adults worked with herself.,morphology,anaphor_agreement,anaphor_number_agreement,True,True,False,True,581,-33.78594207763672,-34.138092041015625,1
The teenagers scared themselves.,The teenagers scared itself.,morphology,anaphor_agreement,anaphor_number_agreement,True,True,False,True,582,-33.797149658203125,-34.537784576416016,1
Valerie wasn't embarrassing herself.,Valerie wasn't embarrassing themselves.,morphology,anaphor_agreement,anaphor_number_agreement,True,True,False,True,583,-42.3370475769043,-41.92425537109375,0
Rhonda does flee from herself.,Rhonda does flee from themselves.,morphology,anaphor_agreement,anaphor_number_agreement,True,True,False,True,584,-45.209869384765625,-43.7702751159668,0
All patients care for themselves.,All patients care for herself.,morphology,anaphor_agreement,anaphor_number_agreement,True,True,False,True,585,-33.74197006225586,-34.595237731933594,1
Sara can visit herself.,Sara can visit themselves.,morphology,anaphor_agreement,anaphor_number_agreement,True,True,False,True,586,-32.6315803527832,-31.47606658935547,0
All doctors wouldn't distract themselves.,All doctors wouldn't distract herself.,morphology,anaphor_agreement,anaphor_number_agreement,True,True,False,True,587,-39.06000900268555,-40.19367599487305,1
Russell sounds like himself.,Russell sounds like themselves.,morphology,anaphor_agreement,anaphor_number_agreement,True,True,False,True,588,-21.662944793701172,-21.901065826416016,1
All actresses approached themselves.,All actresses approached himself.,morphology,anaphor_agreement,anaphor_number_agreement,True,True,False,True,589,-35.90635299682617,-35.12417221069336,0
These people had revealed themselves.,These people had revealed himself.,morphology,anaphor_agreement,anaphor_number_agreement,True,True,False,True,590,-30.44591522216797,-30.816646575927734,1
James isn't talking to himself.,James isn't talking to themselves.,morphology,anaphor_agreement,anaphor_number_agreement,True,True,False,True,591,-25.927324295043945,-29.01527214050293,1
Jennifer is concealing herself.,Jennifer is concealing themselves.,morphology,anaphor_agreement,anaphor_number_agreement,True,True,False,True,592,-32.925743103027344,-32.661399841308594,0
Debra is discovering herself.,Debra is discovering themselves.,morphology,anaphor_agreement,anaphor_number_agreement,True,True,False,True,593,-33.49176025390625,-31.60683250427246,0
Brett thought about himself.,Brett thought about themselves.,morphology,anaphor_agreement,anaphor_number_agreement,True,True,False,True,594,-34.048194885253906,-34.82312774658203,1
Jane had upset herself.,Jane had upset themselves.,morphology,anaphor_agreement,anaphor_number_agreement,True,True,False,True,595,-23.541770935058594,-24.206195831298828,1
All doctors haven't respected themselves.,All doctors haven't respected itself.,morphology,anaphor_agreement,anaphor_number_agreement,True,True,False,True,596,-39.592193603515625,-41.38347244262695,1
Marla won't hurt herself.,Marla won't hurt themselves.,morphology,anaphor_agreement,anaphor_number_agreement,True,True,False,True,597,-32.063392639160156,-32.8724365234375,1
These cashiers aren't concealing themselves.,These cashiers aren't concealing himself.,morphology,anaphor_agreement,anaphor_number_agreement,True,True,False,True,598,-57.366615295410156,-55.73352813720703,0
The Impressionists haven't respected themselves.,The Impressionists haven't respected itself.,morphology,anaphor_agreement,anaphor_number_agreement,True,True,False,True,599,-61.00615692138672,-62.779075622558594,1
Teresa has remembered herself.,Teresa has remembered themselves.,morphology,anaphor_agreement,anaphor_number_agreement,True,True,False,True,600,-35.22087097167969,-34.45342254638672,0
Jessica had fired herself.,Jessica had fired themselves.,morphology,anaphor_agreement,anaphor_number_agreement,True,True,False,True,601,-24.25679588317871,-23.20570945739746,0
Mark doesn't flee from himself.,Mark doesn't flee from themselves.,morphology,anaphor_agreement,anaphor_number_agreement,True,True,False,True,602,-32.45956039428711,-35.03527069091797,1
Some museum distracted itself.,Some museum distracted themselves.,morphology,anaphor_agreement,anaphor_number_agreement,True,True,False,True,603,-35.8489990234375,-34.45124816894531,0
Most children aren't upsetting themselves.,Most children aren't upsetting herself.,morphology,anaphor_agreement,anaphor_number_agreement,True,True,False,True,604,-37.05365753173828,-37.33452606201172,1
The company upsets itself.,The company upsets themselves.,morphology,anaphor_agreement,anaphor_number_agreement,True,True,False,True,605,-37.32063293457031,-37.000267028808594,0
Noah would conceal himself.,Noah would conceal themselves.,morphology,anaphor_agreement,anaphor_number_agreement,True,True,False,True,606,-35.44208526611328,-36.80902862548828,1
Kendra might shock herself.,Kendra might shock themselves.,morphology,anaphor_agreement,anaphor_number_agreement,True,True,False,True,607,-43.434722900390625,-41.6686897277832,0
The teachers weren't arguing about themselves.,The teachers weren't arguing about itself.,morphology,anaphor_agreement,anaphor_number_agreement,True,True,False,True,608,-44.10475158691406,-45.09505844116211,1
Most universities upset themselves.,Most universities upset himself.,morphology,anaphor_agreement,anaphor_number_agreement,True,True,False,True,609,-32.668357849121094,-33.205081939697266,1
Some bank distracts itself.,Some bank distracts themselves.,morphology,anaphor_agreement,anaphor_number_agreement,True,True,False,True,610,-42.96680450439453,-43.64949417114258,1
These students don't boast about themselves.,These students don't boast about itself.,morphology,anaphor_agreement,anaphor_number_agreement,True,True,False,True,611,-40.63959884643555,-42.40597915649414,1
Candice shouldn't know herself.,Candice shouldn't know themselves.,morphology,anaphor_agreement,anaphor_number_agreement,True,True,False,True,612,-34.89850616455078,-34.19296646118164,0
Melinda concealed herself.,Melinda concealed themselves.,morphology,anaphor_agreement,anaphor_number_agreement,True,True,False,True,613,-30.796062469482422,-30.061267852783203,0
Natalie wouldn't hurt herself.,Natalie wouldn't hurt themselves.,morphology,anaphor_agreement,anaphor_number_agreement,True,True,False,True,614,-35.3222770690918,-36.368656158447266,1
Sandra fled from herself.,Sandra fled from themselves.,morphology,anaphor_agreement,anaphor_number_agreement,True,True,False,True,615,-37.15816116333008,-36.0194206237793,0
April kissed herself.,April kissed themselves.,morphology,anaphor_agreement,anaphor_number_agreement,True,True,False,True,616,-19.493206024169922,-20.47004508972168,1
Travis approached himself.,Travis approached themselves.,morphology,anaphor_agreement,anaphor_number_agreement,True,True,False,True,617,-32.105403900146484,-34.2822265625,1
A lot of senators watched themselves.,A lot of senators watched herself.,morphology,anaphor_agreement,anaphor_number_agreement,True,True,False,True,618,-43.666202545166016,-46.069969177246094,1
Grace cared for herself.,Grace cared for themselves.,morphology,anaphor_agreement,anaphor_number_agreement,True,True,False,True,619,-29.708499908447266,-31.062366485595703,1
That company annoys itself.,That company annoys themselves.,morphology,anaphor_agreement,anaphor_number_agreement,True,True,False,True,620,-37.24665451049805,-38.19472885131836,1
Teenagers were working with themselves.,Teenagers were working with itself.,morphology,anaphor_agreement,anaphor_number_agreement,True,True,False,True,621,-34.54920196533203,-36.74382019042969,1
Children haven't appreciated themselves.,Children haven't appreciated himself.,morphology,anaphor_agreement,anaphor_number_agreement,True,True,False,True,622,-29.75936508178711,-28.532451629638672,0
Candice isn't visiting herself.,Candice isn't visiting themselves.,morphology,anaphor_agreement,anaphor_number_agreement,True,True,False,True,623,-38.86968231201172,-39.08683776855469,1
Many libraries are stunning themselves.,Many libraries are stunning herself.,morphology,anaphor_agreement,anaphor_number_agreement,True,True,False,True,624,-36.680850982666016,-38.95467758178711,1
Matt doesn't find himself.,Matt doesn't find themselves.,morphology,anaphor_agreement,anaphor_number_agreement,True,True,False,True,625,-20.628860473632812,-22.283851623535156,1
The girls hadn't scared themselves.,The girls hadn't scared himself.,morphology,anaphor_agreement,anaphor_number_agreement,True,True,False,True,626,-34.59551239013672,-33.71500015258789,0
Tiffany isn't criticizing herself.,Tiffany isn't criticizing themselves.,morphology,anaphor_agreement,anaphor_number_agreement,True,True,False,True,627,-49.04356384277344,-47.61933898925781,0
Bill can reference himself.,Bill can reference themselves.,morphology,anaphor_agreement,anaphor_number_agreement,True,True,False,True,628,-32.360565185546875,-30.933347702026367,0
Spain worries itself.,Spain worries themselves.,morphology,anaphor_agreement,anaphor_number_agreement,True,True,False,True,629,-23.21581268310547,-22.199474334716797,0
Lawrence had thought about himself.,Lawrence had thought about themselves.,morphology,anaphor_agreement,anaphor_number_agreement,True,True,False,True,630,-35.72536849975586,-37.0887336730957,1
Connie isn't boasting about herself.,Connie isn't boasting about themselves.,morphology,anaphor_agreement,anaphor_number_agreement,True,True,False,True,631,-44.33509826660156,-43.91141128540039,0
Todd isn't revealing himself.,Todd isn't revealing themselves.,morphology,anaphor_agreement,anaphor_number_agreement,True,True,False,True,632,-27.29924964904785,-28.76220703125,1
Mark had talked about himself.,Mark had talked about themselves.,morphology,anaphor_agreement,anaphor_number_agreement,True,True,False,True,633,-23.813772201538086,-24.274749755859375,1
The Borgias were escaping from themselves.,The Borgias were escaping from himself.,morphology,anaphor_agreement,anaphor_number_agreement,True,True,False,True,634,-48.70744323730469,-47.5655517578125,0
Phillip hasn't impressed himself.,Phillip hasn't impressed themselves.,morphology,anaphor_agreement,anaphor_number_agreement,True,True,False,True,635,-34.03683090209961,-35.67243194580078,1
Beverly hated herself.,Beverly hated themselves.,morphology,anaphor_agreement,anaphor_number_agreement,True,True,False,True,636,-35.63206481933594,-36.1358757019043,1
Students are working with themselves.,Students are working with itself.,morphology,anaphor_agreement,anaphor_number_agreement,True,True,False,True,637,-22.919586181640625,-24.26885223388672,1
The Clintons shouldn't conceal themselves.,The Clintons shouldn't conceal himself.,morphology,anaphor_agreement,anaphor_number_agreement,True,True,False,True,638,-47.273094177246094,-46.27207565307617,0
These men kiss themselves.,These men kiss herself.,morphology,anaphor_agreement,anaphor_number_agreement,True,True,False,True,639,-27.6881160736084,-27.76152992248535,1
That play isn't disagreeing with itself.,That play isn't disagreeing with themselves.,morphology,anaphor_agreement,anaphor_number_agreement,True,True,False,True,640,-49.2662353515625,-47.643310546875,0
Guests haven't questioned themselves.,Guests haven't questioned herself.,morphology,anaphor_agreement,anaphor_number_agreement,True,True,False,True,641,-39.95850372314453,-39.391971588134766,0
James distracted himself.,James distracted themselves.,morphology,anaphor_agreement,anaphor_number_agreement,True,True,False,True,642,-22.305849075317383,-23.109764099121094,1
Most girls knew themselves.,Most girls knew himself.,morphology,anaphor_agreement,anaphor_number_agreement,True,True,False,True,643,-27.024127960205078,-27.041540145874023,1
All men can hug themselves.,All men can hug himself.,morphology,anaphor_agreement,anaphor_number_agreement,True,True,False,True,644,-32.22970962524414,-30.243772506713867,0
Those actors admired themselves.,Those actors admired itself.,morphology,anaphor_agreement,anaphor_number_agreement,True,True,False,True,645,-31.86695098876953,-33.33482360839844,1
A documentary should disagree with itself.,A documentary should disagree with themselves.,morphology,anaphor_agreement,anaphor_number_agreement,True,True,False,True,646,-45.23682403564453,-43.07610321044922,0
The guy had admired himself.,The guy had admired themselves.,morphology,anaphor_agreement,anaphor_number_agreement,True,True,False,True,647,-31.2686767578125,-32.94554901123047,1
Dancers sounded like themselves.,Dancers sounded like herself.,morphology,anaphor_agreement,anaphor_number_agreement,True,True,False,True,648,-36.50535583496094,-36.79851150512695,1
Lissa might notice herself.,Lissa might notice themselves.,morphology,anaphor_agreement,anaphor_number_agreement,True,True,False,True,649,-36.56902313232422,-34.750587463378906,0
Some essay is disagreeing with itself.,Some essay is disagreeing with themselves.,morphology,anaphor_agreement,anaphor_number_agreement,True,True,False,True,650,-47.85225296020508,-46.15794372558594,0
Susan wasn't talking about herself.,Susan wasn't talking about themselves.,morphology,anaphor_agreement,anaphor_number_agreement,True,True,False,True,651,-26.860000610351562,-27.025205612182617,1
Amanda would stun herself.,Amanda would stun themselves.,morphology,anaphor_agreement,anaphor_number_agreement,True,True,False,True,652,-38.849708557128906,-37.77101516723633,0
Melanie would reference herself.,Melanie would reference themselves.,morphology,anaphor_agreement,anaphor_number_agreement,True,True,False,True,653,-42.76667785644531,-41.097679138183594,0
The cashiers help themselves.,The cashiers help herself.,morphology,anaphor_agreement,anaphor_number_agreement,True,True,False,True,654,-39.47343826293945,-40.030242919921875,1
The adults can return to themselves.,The adults can return to itself.,morphology,anaphor_agreement,anaphor_number_agreement,True,True,False,True,655,-33.807342529296875,-34.883689880371094,1
Holly hadn't worked with herself.,Holly hadn't worked with themselves.,morphology,anaphor_agreement,anaphor_number_agreement,True,True,False,True,656,-37.95790100097656,-38.69941711425781,1
Jessica won't impress herself.,Jessica won't impress themselves.,morphology,anaphor_agreement,anaphor_number_agreement,True,True,False,True,657,-27.546981811523438,-26.97290802001953,0
A lot of waitresses astound themselves.,A lot of waitresses astound itself.,morphology,anaphor_agreement,anaphor_number_agreement,True,True,False,True,658,-63.82951736450195,-64.28044128417969,1
A lot of actors might visit themselves.,A lot of actors might visit herself.,morphology,anaphor_agreement,anaphor_number_agreement,True,True,False,True,659,-47.029945373535156,-48.592994689941406,1
Actresses hadn't hidden themselves.,Actresses hadn't hidden himself.,morphology,anaphor_agreement,anaphor_number_agreement,True,True,False,True,660,-40.291751861572266,-38.479454040527344,0
Those adults hadn't irritated themselves.,Those adults hadn't irritated itself.,morphology,anaphor_agreement,anaphor_number_agreement,True,True,False,True,661,-41.3616943359375,-42.42888641357422,1
Some actresses discover themselves.,Some actresses discover herself.,morphology,anaphor_agreement,anaphor_number_agreement,True,True,False,True,662,-34.912559509277344,-37.89081573486328,1
Stephanie couldn't talk to herself.,Stephanie couldn't talk to themselves.,morphology,anaphor_agreement,anaphor_number_agreement,True,True,False,True,663,-39.549072265625,-42.63868713378906,1
Many universities haven't worried themselves.,Many universities haven't worried himself.,morphology,anaphor_agreement,anaphor_number_agreement,True,True,False,True,664,-40.22441482543945,-40.61125946044922,1
Dancers hated themselves.,Dancers hated himself.,morphology,anaphor_agreement,anaphor_number_agreement,True,True,False,True,665,-33.55006790161133,-32.8575553894043,0
Homer hadn't remembered himself.,Homer hadn't remembered themselves.,morphology,anaphor_agreement,anaphor_number_agreement,True,True,False,True,666,-37.929744720458984,-39.0739631652832,1
All actors wouldn't forget themselves.,All actors wouldn't forget itself.,morphology,anaphor_agreement,anaphor_number_agreement,True,True,False,True,667,-36.58042907714844,-37.77541732788086,1
A lot of girls hadn't hidden themselves.,A lot of girls hadn't hidden himself.,morphology,anaphor_agreement,anaphor_number_agreement,True,True,False,True,668,-47.064056396484375,-46.38946533203125,0
All dancers discussed themselves.,All dancers discussed herself.,morphology,anaphor_agreement,anaphor_number_agreement,True,True,False,True,669,-33.654815673828125,-36.272090911865234,1
Dana impressed herself.,Dana impressed themselves.,morphology,anaphor_agreement,anaphor_number_agreement,True,True,False,True,670,-31.660959243774414,-31.710758209228516,1
Some waitress did discuss herself.,Some waitress did discuss themselves.,morphology,anaphor_agreement,anaphor_number_agreement,True,True,False,True,671,-42.52708435058594,-41.0987548828125,0
Heather wasn't healing herself.,Heather wasn't healing themselves.,morphology,anaphor_agreement,anaphor_number_agreement,True,True,False,True,672,-42.65620422363281,-41.385284423828125,0
Some ladies aren't worrying themselves.,Some ladies aren't worrying herself.,morphology,anaphor_agreement,anaphor_number_agreement,True,True,False,True,673,-37.046810150146484,-37.62953186035156,1
A lot of drivers fired themselves.,A lot of drivers fired itself.,morphology,anaphor_agreement,anaphor_number_agreement,True,True,False,True,674,-43.240753173828125,-44.44551086425781,1
Most committees had astounded themselves.,Most committees had astounded itself.,morphology,anaphor_agreement,anaphor_number_agreement,True,True,False,True,675,-43.96955108642578,-44.94638442993164,1
Most adults disgusted themselves.,Most adults disgusted himself.,morphology,anaphor_agreement,anaphor_number_agreement,True,True,False,True,676,-32.06929016113281,-32.88090896606445,1
Many cashiers cured themselves.,Many cashiers cured himself.,morphology,anaphor_agreement,anaphor_number_agreement,True,True,False,True,677,-43.739288330078125,-43.36157989501953,0
Debra was scaring herself.,Debra was scaring themselves.,morphology,anaphor_agreement,anaphor_number_agreement,True,True,False,True,678,-35.546897888183594,-35.25969314575195,0
Some universities aren't bothering themselves.,Some universities aren't bothering himself.,morphology,anaphor_agreement,anaphor_number_agreement,True,True,False,True,679,-40.47909164428711,-40.301597595214844,0
Vincent astounded himself.,Vincent astounded themselves.,morphology,anaphor_agreement,anaphor_number_agreement,True,True,False,True,680,-38.41877746582031,-39.577293395996094,1
Those students could return to themselves.,Those students could return to herself.,morphology,anaphor_agreement,anaphor_number_agreement,True,True,False,True,681,-34.223731994628906,-34.61606979370117,1
Alice might confuse herself.,Alice might confuse themselves.,morphology,anaphor_agreement,anaphor_number_agreement,True,True,False,True,682,-26.843494415283203,-26.2297420501709,0
All cashiers aggravated themselves.,All cashiers aggravated itself.,morphology,anaphor_agreement,anaphor_number_agreement,True,True,False,True,683,-45.75269317626953,-45.767364501953125,1
Deborah can't conceal herself.,Deborah can't conceal themselves.,morphology,anaphor_agreement,anaphor_number_agreement,True,True,False,True,684,-38.20923614501953,-37.097049713134766,0
A lot of drivers return to themselves.,A lot of drivers return to itself.,morphology,anaphor_agreement,anaphor_number_agreement,True,True,False,True,685,-45.74054718017578,-46.887794494628906,1
Carlos had discussed himself.,Carlos had discussed themselves.,morphology,anaphor_agreement,anaphor_number_agreement,True,True,False,True,686,-30.940242767333984,-31.318342208862305,1
A lot of girls can watch themselves.,A lot of girls can watch herself.,morphology,anaphor_agreement,anaphor_number_agreement,True,True,False,True,687,-40.249427795410156,-40.51812744140625,1
Karla hadn't hurt herself.,Karla hadn't hurt themselves.,morphology,anaphor_agreement,anaphor_number_agreement,True,True,False,True,688,-32.87769317626953,-33.696922302246094,1
Jessica escaped from herself.,Jessica escaped from themselves.,morphology,anaphor_agreement,anaphor_number_agreement,True,True,False,True,689,-25.058382034301758,-24.758575439453125,0
The Impressionists weren't appreciating themselves.,The Impressionists weren't appreciating herself.,morphology,anaphor_agreement,anaphor_number_agreement,True,True,False,True,690,-69.57765197753906,-71.85398864746094,1
