sentence_good,sentence_bad,field,linguistics_term,UID,simple_LM_method,one_prefix_method,two_prefix_method,lexically_identical,pair_id,good_prob,bad_prob,correct
Vanessa has exited what lakes?,What has Vanessa exited lakes?,syntax,island_effects,left_branch_island_echo_question,True,False,True,True,665,-53.053924560546875,-50.12019729614258,0
This student has seen which mirrors?,Which has this student seen mirrors?,syntax,island_effects,left_branch_island_echo_question,True,False,True,True,666,-46.96315002441406,-49.251033782958984,1
Mary had dropped by what grocery stores?,What had Mary dropped by grocery stores?,syntax,island_effects,left_branch_island_echo_question,True,False,True,True,667,-53.176353454589844,-56.842811584472656,1
That cafe was stunning which alumnus?,Which was that cafe stunning alumnus?,syntax,island_effects,left_branch_island_echo_question,True,False,True,True,668,-68.8782958984375,-66.37317657470703,0
Carol should conceal whose tooth?,Whose should Carol conceal tooth?,syntax,island_effects,left_branch_island_echo_question,True,False,True,True,669,-52.41008377075195,-57.51788330078125,1
Carlos had hated which person?,Which had Carlos hated person?,syntax,island_effects,left_branch_island_echo_question,True,False,True,True,670,-48.580955505371094,-44.52826690673828,0
Steve is working with what senators?,What is Steve working with senators?,syntax,island_effects,left_branch_island_echo_question,True,False,True,True,671,-36.76701736450195,-44.251976013183594,1
Gerald was climbing down which hill?,Which was Gerald climbing down hill?,syntax,island_effects,left_branch_island_echo_question,True,False,True,True,672,-48.6478271484375,-45.30152893066406,0
Omar is visiting what glacier?,What is Omar visiting glacier?,syntax,island_effects,left_branch_island_echo_question,True,False,True,True,673,-48.69999694824219,-48.21306610107422,0
The adult was disgusting what cashiers?,What was the adult disgusting cashiers?,syntax,island_effects,left_branch_island_echo_question,True,False,True,True,674,-61.240318298339844,-55.52452850341797,0
Barbara has broken which wheelbarrow?,Which has Barbara broken wheelbarrow?,syntax,island_effects,left_branch_island_echo_question,True,False,True,True,675,-63.48320388793945,-58.66482162475586,0
Teresa could examine what pamphlet?,What could Teresa examine pamphlet?,syntax,island_effects,left_branch_island_echo_question,True,False,True,True,676,-53.15106964111328,-52.797889709472656,0
Patricia could kiss which boy?,Which could Patricia kiss boy?,syntax,island_effects,left_branch_island_echo_question,True,False,True,True,677,-49.56156539916992,-43.30390167236328,0
Some casseroles had irritated what customers?,What had some casseroles irritated customers?,syntax,island_effects,left_branch_island_echo_question,True,False,True,True,678,-70.51614379882812,-69.151123046875,0
Every dancer might complain about which girls?,Which might every dancer complain about girls?,syntax,island_effects,left_branch_island_echo_question,True,False,True,True,679,-50.73576736450195,-55.35292053222656,1
Some customer had boycotted which art galleries?,Which had some customer boycotted art galleries?,syntax,island_effects,left_branch_island_echo_question,True,False,True,True,680,-82.822265625,-76.26333618164062,0
Stacey has climbed up whose steps?,Whose has Stacey climbed up steps?,syntax,island_effects,left_branch_island_echo_question,True,False,True,True,681,-51.60896682739258,-62.99842071533203,1
Carl does lift which door?,Which does Carl lift door?,syntax,island_effects,left_branch_island_echo_question,True,False,True,True,682,-37.1996955871582,-40.75899887084961,1
Marie should alarm whose organization?,Whose should Marie alarm organization?,syntax,island_effects,left_branch_island_echo_question,True,False,True,True,683,-43.20156478881836,-56.2803840637207,1
The woman has talked about which cashiers?,Which has the woman talked about cashiers?,syntax,island_effects,left_branch_island_echo_question,True,False,True,True,684,-57.5070686340332,-56.853302001953125,0
Larry can remember what teacher?,What can Larry remember teacher?,syntax,island_effects,left_branch_island_echo_question,True,False,True,True,685,-29.32182502746582,-40.60108184814453,1
Nicole will drop by what museum?,What will Nicole drop by museum?,syntax,island_effects,left_branch_island_echo_question,True,False,True,True,686,-50.801876068115234,-50.86326599121094,1
Naomi is scanning which pamphlet?,Which is Naomi scanning pamphlet?,syntax,island_effects,left_branch_island_echo_question,True,False,True,True,687,-49.042144775390625,-47.620113372802734,0
Amanda was boycotting whose malls?,Whose was Amanda boycotting malls?,syntax,island_effects,left_branch_island_echo_question,True,False,True,True,688,-61.603050231933594,-68.74139404296875,1
Some dancer had talked to what dancers?,What had some dancer talked to dancers?,syntax,island_effects,left_branch_island_echo_question,True,False,True,True,689,-50.42313766479492,-51.477333068847656,1
Kenneth had shocked which guy?,Which had Kenneth shocked guy?,syntax,island_effects,left_branch_island_echo_question,True,False,True,True,690,-47.67159652709961,-43.755455017089844,0
Dennis can run around whose movie theaters?,Whose can Dennis run around movie theaters?,syntax,island_effects,left_branch_island_echo_question,True,False,True,True,691,-67.1793441772461,-71.90782165527344,1
Gary is working with which men?,Which is Gary working with men?,syntax,island_effects,left_branch_island_echo_question,True,False,True,True,692,-33.45635986328125,-39.28847122192383,1
Rachel has disgusted which men?,Which has Rachel disgusted men?,syntax,island_effects,left_branch_island_echo_question,True,False,True,True,693,-36.961692810058594,-43.57587432861328,1
Laurie has forgotten which thesis?,Which has Laurie forgotten thesis?,syntax,island_effects,left_branch_island_echo_question,True,False,True,True,694,-52.33441162109375,-48.522422790527344,0
Dawn might discover whose museum?,Whose might Dawn discover museum?,syntax,island_effects,left_branch_island_echo_question,True,False,True,True,695,-53.65583801269531,-61.71010971069336,1
Alice had talked to what guy?,What had Alice talked to guy?,syntax,island_effects,left_branch_island_echo_question,True,False,True,True,696,-33.724891662597656,-40.815269470214844,1
Regina had hired what men?,What had Regina hired men?,syntax,island_effects,left_branch_island_echo_question,True,False,True,True,697,-40.359886169433594,-44.620811462402344,1
Wendy was exiting whose museum?,Whose was Wendy exiting museum?,syntax,island_effects,left_branch_island_echo_question,True,False,True,True,698,-55.43144989013672,-58.96226119995117,1
Bradley had seen what dancers?,What had Bradley seen dancers?,syntax,island_effects,left_branch_island_echo_question,True,False,True,True,699,-41.28977966308594,-46.18735885620117,1
These reports had disturbed what waitress?,What had these reports disturbed waitress?,syntax,island_effects,left_branch_island_echo_question,True,False,True,True,700,-51.98567199707031,-53.69423294067383,1
Noah is watching what actress?,What is Noah watching actress?,syntax,island_effects,left_branch_island_echo_question,True,False,True,True,701,-40.35109329223633,-42.3170166015625,1
Helen has complained about whose hypotheses?,Whose has Helen complained about hypotheses?,syntax,island_effects,left_branch_island_echo_question,True,False,True,True,702,-55.63970947265625,-62.482627868652344,1
Helen has discovered whose chairs?,Whose has Helen discovered chairs?,syntax,island_effects,left_branch_island_echo_question,True,False,True,True,703,-44.813323974609375,-54.23057174682617,1
A lot of teachers had admired which reports?,Which had a lot of teachers admired reports?,syntax,island_effects,left_branch_island_echo_question,True,False,True,True,704,-58.89679718017578,-51.943397521972656,0
Amelia does know which woman?,Which does Amelia know woman?,syntax,island_effects,left_branch_island_echo_question,True,False,True,True,705,-43.684234619140625,-43.52342224121094,0
Cynthia has run around which oasis?,Which has Cynthia run around oasis?,syntax,island_effects,left_branch_island_echo_question,True,False,True,True,706,-71.96202087402344,-56.736122131347656,0
Bethany was exploring what lakes?,What was Bethany exploring lakes?,syntax,island_effects,left_branch_island_echo_question,True,False,True,True,707,-62.7379264831543,-55.51191711425781,0
The Impressionists could boast about whose ellipses?,Whose could the Impressionists boast about ellipses?,syntax,island_effects,left_branch_island_echo_question,True,False,True,True,708,-94.20481872558594,-105.26486206054688,1
Suzanne had healed which rabbits?,Which had Suzanne healed rabbits?,syntax,island_effects,left_branch_island_echo_question,True,False,True,True,709,-52.75753402709961,-45.913490295410156,0
Benjamin has fled from what men?,What has Benjamin fled from men?,syntax,island_effects,left_branch_island_echo_question,True,False,True,True,710,-49.57299041748047,-48.05393981933594,0
Carrie had listened to what offspring?,What had Carrie listened to offspring?,syntax,island_effects,left_branch_island_echo_question,True,False,True,True,711,-51.6822509765625,-47.67153549194336,0
Some essay was distracting what children?,What was some essay distracting children?,syntax,island_effects,left_branch_island_echo_question,True,False,True,True,712,-50.62391662597656,-49.720252990722656,0
Susan had cleaned what schools?,What had Susan cleaned schools?,syntax,island_effects,left_branch_island_echo_question,True,False,True,True,713,-38.73492431640625,-44.005672454833984,1
Naomi has walked through what bank?,What has Naomi walked through bank?,syntax,island_effects,left_branch_island_echo_question,True,False,True,True,714,-49.96689224243164,-50.039039611816406,1
Christopher was boycotting which museums?,Which was Christopher boycotting museums?,syntax,island_effects,left_branch_island_echo_question,True,False,True,True,715,-51.415771484375,-53.454959869384766,1
The book had bothered what senators?,What had the book bothered senators?,syntax,island_effects,left_branch_island_echo_question,True,False,True,True,716,-48.73173904418945,-46.64710235595703,0
Brenda would help what student?,What would Brenda help student?,syntax,island_effects,left_branch_island_echo_question,True,False,True,True,717,-37.04948425292969,-44.483154296875,1
This cashier is revealing whose college campus?,Whose is this cashier revealing college campus?,syntax,island_effects,left_branch_island_echo_question,True,False,True,True,718,-69.29216766357422,-76.17748260498047,1
Irene had walked through what bank?,What had Irene walked through bank?,syntax,island_effects,left_branch_island_echo_question,True,False,True,True,719,-54.25905990600586,-51.878753662109375,0
Pamela had watched what pedestrians?,What had Pamela watched pedestrians?,syntax,island_effects,left_branch_island_echo_question,True,False,True,True,720,-56.40945816040039,-46.662574768066406,0
This pedestrian has insulted which customers?,Which has this pedestrian insulted customers?,syntax,island_effects,left_branch_island_echo_question,True,False,True,True,721,-55.0746955871582,-54.02477264404297,0
Wayne had returned to what ladies?,What had Wayne returned to ladies?,syntax,island_effects,left_branch_island_echo_question,True,False,True,True,722,-44.80680465698242,-44.481040954589844,0
Helen is bringing whose newspaper article?,Whose is Helen bringing newspaper article?,syntax,island_effects,left_branch_island_echo_question,True,False,True,True,723,-55.96199417114258,-65.35160064697266,1
Brad was passing whose libraries?,Whose was Brad passing libraries?,syntax,island_effects,left_branch_island_echo_question,True,False,True,True,724,-40.7935676574707,-57.7608528137207,1
The casserole was shocking which patient?,Which was the casserole shocking patient?,syntax,island_effects,left_branch_island_echo_question,True,False,True,True,725,-65.92060089111328,-61.46064376831055,0
Karen might stun whose museums?,Whose might Karen stun museums?,syntax,island_effects,left_branch_island_echo_question,True,False,True,True,726,-56.89482498168945,-60.13258361816406,1
That boy is leaving what hills?,What is that boy leaving hills?,syntax,island_effects,left_branch_island_echo_question,True,False,True,True,727,-42.27907180786133,-44.471221923828125,1
Eric was scaring what men?,What was Eric scaring men?,syntax,island_effects,left_branch_island_echo_question,True,False,True,True,728,-40.040687561035156,-45.67319107055664,1
William could research which mall?,Which could William research mall?,syntax,island_effects,left_branch_island_echo_question,True,False,True,True,729,-43.56904220581055,-46.48647689819336,1
Meredith had looked like what picture?,What had Meredith looked like picture?,syntax,island_effects,left_branch_island_echo_question,True,False,True,True,730,-49.38890075683594,-45.45515441894531,0
Frank will visit whose schools?,Whose will Frank visit schools?,syntax,island_effects,left_branch_island_echo_question,True,False,True,True,731,-38.58142852783203,-54.95866775512695,1
A child was disturbing what cashiers?,What was a child disturbing cashiers?,syntax,island_effects,left_branch_island_echo_question,True,False,True,True,732,-58.0464973449707,-52.66608810424805,0
Julia has cared for which waitress?,Which has Julia cared for waitress?,syntax,island_effects,left_branch_island_echo_question,True,False,True,True,733,-47.36461639404297,-47.959495544433594,1
Carlos did talk about which lady?,Which did Carlos talk about lady?,syntax,island_effects,left_branch_island_echo_question,True,False,True,True,734,-45.40141296386719,-44.886695861816406,0
Sherry has worried whose schools?,Whose has Sherry worried schools?,syntax,island_effects,left_branch_island_echo_question,True,False,True,True,735,-49.902950286865234,-63.952430725097656,1
Some ladder can worry which child?,Which can some ladder worry child?,syntax,island_effects,left_branch_island_echo_question,True,False,True,True,736,-45.80174255371094,-50.63388442993164,1
Laura was curing what cats?,What was Laura curing cats?,syntax,island_effects,left_branch_island_echo_question,True,False,True,True,737,-38.4959602355957,-42.806907653808594,1
Sarah could heal which student?,Which could Sarah heal student?,syntax,island_effects,left_branch_island_echo_question,True,False,True,True,738,-40.60640335083008,-47.73847961425781,1
Ella has respected whose art galleries?,Whose has Ella respected art galleries?,syntax,island_effects,left_branch_island_echo_question,True,False,True,True,739,-59.982948303222656,-71.09452819824219,1
Pamela can hate what men?,What can Pamela hate men?,syntax,island_effects,left_branch_island_echo_question,True,False,True,True,740,-48.326908111572266,-41.576515197753906,0
Samantha is firing what woman?,What is Samantha firing woman?,syntax,island_effects,left_branch_island_echo_question,True,False,True,True,741,-50.556976318359375,-42.11188507080078,0
Rodney could discover what people?,What could Rodney discover people?,syntax,island_effects,left_branch_island_echo_question,True,False,True,True,742,-39.30642318725586,-44.11956024169922,1
Regina had worried whose schools?,Whose had Regina worried schools?,syntax,island_effects,left_branch_island_echo_question,True,False,True,True,743,-46.68174362182617,-58.32964324951172,1
Tiffany had kissed what people?,What had Tiffany kissed people?,syntax,island_effects,left_branch_island_echo_question,True,False,True,True,744,-52.32463073730469,-42.33366775512695,0
Those women were exiting whose school?,Whose were those women exiting school?,syntax,island_effects,left_branch_island_echo_question,True,False,True,True,745,-47.53424072265625,-57.55670166015625,1
A lot of children have complained about which medium?,Which have a lot of children complained about medium?,syntax,island_effects,left_branch_island_echo_question,True,False,True,True,746,-60.2186279296875,-53.90399169921875,0
Clyde would reveal which waitresses?,Which would Clyde reveal waitresses?,syntax,island_effects,left_branch_island_echo_question,True,False,True,True,747,-69.00662231445312,-59.212188720703125,0
Rebecca is firing what pedestrian?,What is Rebecca firing pedestrian?,syntax,island_effects,left_branch_island_echo_question,True,False,True,True,748,-49.96570587158203,-46.49165344238281,0
The people were selling what eyes?,What were the people selling eyes?,syntax,island_effects,left_branch_island_echo_question,True,False,True,True,749,-39.27474594116211,-38.41379165649414,0
Sonia would listen to what offspring?,What would Sonia listen to offspring?,syntax,island_effects,left_branch_island_echo_question,True,False,True,True,750,-46.039703369140625,-48.0399284362793,1
Meredith had passed what museums?,What had Meredith passed museums?,syntax,island_effects,left_branch_island_echo_question,True,False,True,True,751,-50.88147735595703,-47.25429153442383,0
Leslie will describe what drivers?,What will Leslie describe drivers?,syntax,island_effects,left_branch_island_echo_question,True,False,True,True,752,-43.49733352661133,-44.76853561401367,1
Those doctors are lifting whose coat?,Whose are those doctors lifting coat?,syntax,island_effects,left_branch_island_echo_question,True,False,True,True,753,-46.479488372802734,-57.827110290527344,1
Many banks have fired which students?,Which have many banks fired students?,syntax,island_effects,left_branch_island_echo_question,True,False,True,True,754,-48.48091125488281,-50.86557388305664,1
Rachelle can annoy what company?,What can Rachelle annoy company?,syntax,island_effects,left_branch_island_echo_question,True,False,True,True,755,-46.40535354614258,-52.27132034301758,1
The waiters were aggravating which banks?,Which were the waiters aggravating banks?,syntax,island_effects,left_branch_island_echo_question,True,False,True,True,756,-63.86964416503906,-63.211158752441406,0
Tracy had known which dancer?,Which had Tracy known dancer?,syntax,island_effects,left_branch_island_echo_question,True,False,True,True,757,-47.79725646972656,-44.13733673095703,0
Mitchell did see what alumni?,What did Mitchell see alumni?,syntax,island_effects,left_branch_island_echo_question,True,False,True,True,758,-48.27842712402344,-46.30916213989258,0
Alan was lifting which teeth?,Which was Alan lifting teeth?,syntax,island_effects,left_branch_island_echo_question,True,False,True,True,759,-38.7974739074707,-41.62502670288086,1
James would examine whose newspaper article?,Whose would James examine newspaper article?,syntax,island_effects,left_branch_island_echo_question,True,False,True,True,760,-52.24807357788086,-68.63741302490234,1
Harvard University did hire what actresses?,What did Harvard University hire actresses?,syntax,island_effects,left_branch_island_echo_question,True,False,True,True,761,-63.83049774169922,-56.75696563720703,0
Most hamsters have looked like what photographs?,What have most hamsters looked like photographs?,syntax,island_effects,left_branch_island_echo_question,True,False,True,True,762,-60.15408706665039,-60.75115203857422,1
Michelle would impress what ladies?,What would Michelle impress ladies?,syntax,island_effects,left_branch_island_echo_question,True,False,True,True,763,-35.97865676879883,-46.226463317871094,1
Carla has talked about what cafe?,What has Carla talked about cafe?,syntax,island_effects,left_branch_island_echo_question,True,False,True,True,764,-45.884796142578125,-53.74372863769531,1
The cashiers had disgusted which actress?,Which had the cashiers disgusted actress?,syntax,island_effects,left_branch_island_echo_question,True,False,True,True,765,-62.03085708618164,-59.33722686767578,0
Deanna has talked to which driver?,Which has Deanna talked to driver?,syntax,island_effects,left_branch_island_echo_question,True,False,True,True,766,-48.41181945800781,-51.070491790771484,1
These jackets were astounding what child?,What were these jackets astounding child?,syntax,island_effects,left_branch_island_echo_question,True,False,True,True,767,-51.24748992919922,-51.503814697265625,1
Tracy has brought which carts?,Which has Tracy brought carts?,syntax,island_effects,left_branch_island_echo_question,True,False,True,True,768,-48.54240798950195,-44.66213607788086,0
A woman was dropping by which schools?,Which was a woman dropping by schools?,syntax,island_effects,left_branch_island_echo_question,True,False,True,True,769,-49.64927291870117,-45.52790451049805,0
Tara can complain about which girl?,Which can Tara complain about girl?,syntax,island_effects,left_branch_island_echo_question,True,False,True,True,770,-46.88233947753906,-49.971248626708984,1
Some reports would disagree with what story?,What would some reports disagree with story?,syntax,island_effects,left_branch_island_echo_question,True,False,True,True,771,-50.74689865112305,-55.10491180419922,1
Leslie was finding what waitress?,What was Leslie finding waitress?,syntax,island_effects,left_branch_island_echo_question,True,False,True,True,772,-46.08945083618164,-45.60796356201172,0
A pedestrian was running around what schools?,What was a pedestrian running around schools?,syntax,island_effects,left_branch_island_echo_question,True,False,True,True,773,-53.74504852294922,-50.10871505737305,0
Donald was referencing which senators?,Which was Donald referencing senators?,syntax,island_effects,left_branch_island_echo_question,True,False,True,True,774,-44.34999084472656,-46.48431396484375,1
Gregory would shock what boys?,What would Gregory shock boys?,syntax,island_effects,left_branch_island_echo_question,True,False,True,True,775,-46.50006866455078,-44.757240295410156,0
Joel is noticing which offspring?,Which is Joel noticing offspring?,syntax,island_effects,left_branch_island_echo_question,True,False,True,True,776,-45.05785369873047,-45.764366149902344,1
Jessica had disgusted whose association?,Whose had Jessica disgusted association?,syntax,island_effects,left_branch_island_echo_question,True,False,True,True,777,-42.579864501953125,-59.350067138671875,1
Eric would help what cashiers?,What would Eric help cashiers?,syntax,island_effects,left_branch_island_echo_question,True,False,True,True,778,-40.935829162597656,-53.462249755859375,1
Brenda was discussing what lady?,What was Brenda discussing lady?,syntax,island_effects,left_branch_island_echo_question,True,False,True,True,779,-38.823631286621094,-43.496089935302734,1
Randolf had ascended what slopes?,What had Randolf ascended slopes?,syntax,island_effects,left_branch_island_echo_question,True,False,True,True,780,-55.262447357177734,-62.314144134521484,1
This pie does bore what drivers?,What does this pie bore drivers?,syntax,island_effects,left_branch_island_echo_question,True,False,True,True,781,-50.760154724121094,-46.731658935546875,0
Debra had climbed up whose slope?,Whose had Debra climbed up slope?,syntax,island_effects,left_branch_island_echo_question,True,False,True,True,782,-51.39141845703125,-66.04081726074219,1
Charles would descend whose hill?,Whose would Charles descend hill?,syntax,island_effects,left_branch_island_echo_question,True,False,True,True,783,-40.46318817138672,-58.301910400390625,1
Eva did talk to which alumnus?,Which did Eva talk to alumnus?,syntax,island_effects,left_branch_island_echo_question,True,False,True,True,784,-53.05579376220703,-58.994606018066406,1
Naomi has disliked which pedestrians?,Which has Naomi disliked pedestrians?,syntax,island_effects,left_branch_island_echo_question,True,False,True,True,785,-52.380271911621094,-49.657554626464844,0
Those men have hurt which waitress?,Which have those men hurt waitress?,syntax,island_effects,left_branch_island_echo_question,True,False,True,True,786,-46.3199577331543,-47.60690689086914,1
Wendy is examining which analysis?,Which is Wendy examining analysis?,syntax,island_effects,left_branch_island_echo_question,True,False,True,True,787,-50.31401824951172,-45.24831771850586,0
The Great Lakes were impressing what men?,What were the Great Lakes impressing men?,syntax,island_effects,left_branch_island_echo_question,True,False,True,True,788,-64.02189636230469,-59.66508483886719,0
Alice did alarm what doctor?,What did Alice alarm doctor?,syntax,island_effects,left_branch_island_echo_question,True,False,True,True,789,-38.259132385253906,-39.85957336425781,1
Erin is helping which waiter?,Which is Erin helping waiter?,syntax,island_effects,left_branch_island_echo_question,True,False,True,True,790,-45.44306945800781,-42.69879913330078,0
Carol has skated around whose mountains?,Whose has Carol skated around mountains?,syntax,island_effects,left_branch_island_echo_question,True,False,True,True,791,-64.86663818359375,-67.9630126953125,1
Some pedestrian does annoy what committee?,What does some pedestrian annoy committee?,syntax,island_effects,left_branch_island_echo_question,True,False,True,True,792,-53.20816421508789,-53.60820007324219,1
Some movies would disagree with what child?,What would some movies disagree with child?,syntax,island_effects,left_branch_island_echo_question,True,False,True,True,793,-49.85751724243164,-55.124916076660156,1
Galileo was talking to which women?,Which was Galileo talking to women?,syntax,island_effects,left_branch_island_echo_question,True,False,True,True,794,-49.94779968261719,-41.93904495239258,0
Katherine was dropping by whose school?,Whose was Katherine dropping by school?,syntax,island_effects,left_branch_island_echo_question,True,False,True,True,795,-49.102848052978516,-56.218318939208984,1
Carrie had biked to whose library?,Whose had Carrie biked to library?,syntax,island_effects,left_branch_island_echo_question,True,False,True,True,796,-62.85774230957031,-66.02181243896484,1
Sharon might fire which guests?,Which might Sharon fire guests?,syntax,island_effects,left_branch_island_echo_question,True,False,True,True,797,-52.87877655029297,-46.48237609863281,0
