sentence_good,sentence_bad,field,linguistics_term,UID,simple_LM_method,one_prefix_method,two_prefix_method,lexically_identical,pair_id,good_prob,bad_prob,correct
Cashiers disagreed with these concealed people.,Cashiers disagreed with these concealed person.,morphology,determiner_noun_agreement,determiner_noun_agreement_with_adj_irregular_1,True,True,False,True,448,-50.59880828857422,-51.14115524291992,1
Denise noticed that red nucleus.,Denise noticed that red nuclei.,morphology,determiner_noun_agreement,determiner_noun_agreement_with_adj_irregular_1,True,True,False,True,449,-46.4088020324707,-47.7883186340332,1
Thomas was exploring those orange oases.,Thomas was exploring those orange oasis.,morphology,determiner_noun_agreement,determiner_noun_agreement_with_adj_irregular_1,True,True,False,True,450,-50.801795959472656,-48.497161865234375,0
Alexander could exit those smooth oases.,Alexander could exit those smooth oasis.,morphology,determiner_noun_agreement,determiner_noun_agreement_with_adj_irregular_1,True,True,False,True,451,-54.49043273925781,-52.445003509521484,0
Most schools are describing this long analysis.,Most schools are describing this long analyses.,morphology,determiner_noun_agreement,determiner_noun_agreement_with_adj_irregular_1,True,True,False,True,452,-48.437599182128906,-52.626617431640625,1
Martin described those bad analyses.,Martin described those bad analysis.,morphology,determiner_noun_agreement,determiner_noun_agreement_with_adj_irregular_1,True,True,False,True,453,-41.83647155761719,-39.75938034057617,0
Joel has boycotted these smooth oases.,Joel has boycotted these smooth oasis.,morphology,determiner_noun_agreement,determiner_noun_agreement_with_adj_irregular_1,True,True,False,True,454,-76.62968444824219,-75.85569763183594,0
Jerry discovers these out in the open geese.,Jerry discovers these out in the open goose.,morphology,determiner_noun_agreement,determiner_noun_agreement_with_adj_irregular_1,True,True,False,True,455,-54.865966796875,-51.8273811340332,0
Stacy drove to this white oasis.,Stacy drove to this white oases.,morphology,determiner_noun_agreement,determiner_noun_agreement_with_adj_irregular_1,True,True,False,True,456,-51.463191986083984,-54.00218963623047,1
Maria hadn't admired that gray goose.,Maria hadn't admired that gray geese.,morphology,determiner_noun_agreement,determiner_noun_agreement_with_adj_irregular_1,True,True,False,True,457,-53.32496643066406,-54.392433166503906,1
Gerald describes those good analyses.,Gerald describes those good analysis.,morphology,determiner_noun_agreement,determiner_noun_agreement_with_adj_irregular_1,True,True,False,True,458,-48.418968200683594,-46.718048095703125,0
Becky doesn't argue about those determined alumni.,Becky doesn't argue about those determined alumnus.,morphology,determiner_noun_agreement,determiner_noun_agreement_with_adj_irregular_1,True,True,False,True,459,-59.256778717041016,-62.285987854003906,1
Kayla isn't breaking those small teeth.,Kayla isn't breaking those small tooth.,morphology,determiner_noun_agreement,determiner_noun_agreement_with_adj_irregular_1,True,True,False,True,460,-51.612396240234375,-57.201812744140625,1
Wayne broke that purple tooth.,Wayne broke that purple teeth.,morphology,determiner_noun_agreement,determiner_noun_agreement_with_adj_irregular_1,True,True,False,True,461,-48.066253662109375,-48.01572036743164,0
Randolf had run around those blue oases.,Randolf had run around those blue oasis.,morphology,determiner_noun_agreement,determiner_noun_agreement_with_adj_irregular_1,True,True,False,True,462,-67.671142578125,-66.17007446289062,0
Monet hadn't concealed that content alumnus.,Monet hadn't concealed that content alumni.,morphology,determiner_noun_agreement,determiner_noun_agreement_with_adj_irregular_1,True,True,False,True,463,-70.03421020507812,-68.14692687988281,0
Kirsten irritated those happy alumni.,Kirsten irritated those happy alumnus.,morphology,determiner_noun_agreement,determiner_noun_agreement_with_adj_irregular_1,True,True,False,True,464,-61.39422607421875,-63.48046112060547,1
The teenager approached that fast child.,The teenager approached that fast children.,morphology,determiner_noun_agreement,determiner_noun_agreement_with_adj_irregular_1,True,True,False,True,465,-48.343536376953125,-46.213768005371094,0
Tracy kissed this unconvinced woman.,Tracy kissed this unconvinced women.,morphology,determiner_noun_agreement,determiner_noun_agreement_with_adj_irregular_1,True,True,False,True,466,-52.14148712158203,-54.19001007080078,1
Most associations argued about those long analyses.,Most associations argued about those long analysis.,morphology,determiner_noun_agreement,determiner_noun_agreement_with_adj_irregular_1,True,True,False,True,467,-57.250457763671875,-56.19036102294922,0
The waiters discover that brown stimulus.,The waiters discover that brown stimuli.,morphology,determiner_noun_agreement,determiner_noun_agreement_with_adj_irregular_1,True,True,False,True,468,-54.5200080871582,-55.24402618408203,1
Brett talks to these young women.,Brett talks to these young woman.,morphology,determiner_noun_agreement,determiner_noun_agreement_with_adj_irregular_1,True,True,False,True,469,-42.76496124267578,-47.921791076660156,1
Some popsicle scares those content children.,Some popsicle scares those content child.,morphology,determiner_noun_agreement,determiner_noun_agreement_with_adj_irregular_1,True,True,False,True,470,-59.68046569824219,-63.64049530029297,1
Women find that hidden mouse.,Women find that hidden mice.,morphology,determiner_noun_agreement,determiner_noun_agreement_with_adj_irregular_1,True,True,False,True,471,-37.803470611572266,-39.98662567138672,1
Those pedestrians return to these nice children.,Those pedestrians return to these nice child.,morphology,determiner_noun_agreement,determiner_noun_agreement_with_adj_irregular_1,True,True,False,True,472,-47.547889709472656,-52.241886138916016,1
Jodi scans those bad synopses.,Jodi scans those bad synopsis.,morphology,determiner_noun_agreement,determiner_noun_agreement_with_adj_irregular_1,True,True,False,True,473,-64.57405090332031,-54.16194152832031,0
Ellen is leaving that busy woman.,Ellen is leaving that busy women.,morphology,determiner_noun_agreement,determiner_noun_agreement_with_adj_irregular_1,True,True,False,True,474,-42.13091278076172,-41.97285842895508,0
Peter had known these big men.,Peter had known these big man.,morphology,determiner_noun_agreement,determiner_noun_agreement_with_adj_irregular_1,True,True,False,True,475,-34.3905143737793,-37.524227142333984,1
Brett is thinking about those gray cacti.,Brett is thinking about those gray cactus.,morphology,determiner_noun_agreement,determiner_noun_agreement_with_adj_irregular_1,True,True,False,True,476,-69.04335021972656,-60.75849533081055,0
The Lutherans heal these ill geese.,The Lutherans heal these ill goose.,morphology,determiner_noun_agreement,determiner_noun_agreement_with_adj_irregular_1,True,True,False,True,477,-62.277591705322266,-62.30957794189453,1
Lissa might sound like that good child.,Lissa might sound like that good children.,morphology,determiner_noun_agreement,determiner_noun_agreement_with_adj_irregular_1,True,True,False,True,478,-52.962486267089844,-50.59425354003906,0
Most mouths might stun those busy children.,Most mouths might stun those busy child.,morphology,determiner_noun_agreement,determiner_noun_agreement_with_adj_irregular_1,True,True,False,True,479,-54.83428192138672,-60.65565872192383,1
Kayla has that orange axis.,Kayla has that orange axes.,morphology,determiner_noun_agreement,determiner_noun_agreement_with_adj_irregular_1,True,True,False,True,480,-47.36695861816406,-48.87505340576172,1
Cynthia doesn't heal that clever man.,Cynthia doesn't heal that clever men.,morphology,determiner_noun_agreement,determiner_noun_agreement_with_adj_irregular_1,True,True,False,True,481,-62.60425567626953,-63.18567657470703,1
Homer returns to that exposed man.,Homer returns to that exposed men.,morphology,determiner_noun_agreement,determiner_noun_agreement_with_adj_irregular_1,True,True,False,True,482,-53.74966812133789,-52.48414611816406,0
People remember those uncertain people.,People remember those uncertain person.,morphology,determiner_noun_agreement,determiner_noun_agreement_with_adj_irregular_1,True,True,False,True,483,-36.08728790283203,-39.91429901123047,1
Theodore hasn't broken those concealed feet.,Theodore hasn't broken those concealed foot.,morphology,determiner_noun_agreement,determiner_noun_agreement_with_adj_irregular_1,True,True,False,True,484,-63.051143646240234,-64.35124206542969,1
Tonya had disturbed that popular man.,Tonya had disturbed that popular men.,morphology,determiner_noun_agreement,determiner_noun_agreement_with_adj_irregular_1,True,True,False,True,485,-48.21385955810547,-48.80987548828125,1
This customer couldn't pass that black oasis.,This customer couldn't pass that black oases.,morphology,determiner_noun_agreement,determiner_noun_agreement_with_adj_irregular_1,True,True,False,True,486,-57.62800979614258,-58.02793502807617,1
William hides that exposed stimulus.,William hides that exposed stimuli.,morphology,determiner_noun_agreement,determiner_noun_agreement_with_adj_irregular_1,True,True,False,True,487,-41.623409271240234,-41.64132308959961,1
Ruth exits that big oasis.,Ruth exits that big oases.,morphology,determiner_noun_agreement,determiner_noun_agreement_with_adj_irregular_1,True,True,False,True,488,-50.89276885986328,-54.07199478149414,1
Judy can discover that red mouse.,Judy can discover that red mice.,morphology,determiner_noun_agreement,determiner_noun_agreement_with_adj_irregular_1,True,True,False,True,489,-51.502628326416016,-50.07618713378906,0
Candice didn't stun that serious alumnus.,Candice didn't stun that serious alumni.,morphology,determiner_noun_agreement,determiner_noun_agreement_with_adj_irregular_1,True,True,False,True,490,-63.40629196166992,-61.21896743774414,0
Jodi hadn't visited these green oases.,Jodi hadn't visited these green oasis.,morphology,determiner_noun_agreement,determiner_noun_agreement_with_adj_irregular_1,True,True,False,True,491,-59.435340881347656,-58.35420227050781,0
Rose doesn't hate these bad analyses.,Rose doesn't hate these bad analysis.,morphology,determiner_noun_agreement,determiner_noun_agreement_with_adj_irregular_1,True,True,False,True,492,-45.176490783691406,-43.50012969970703,0
These men can help that lost alumnus.,These men can help that lost alumni.,morphology,determiner_noun_agreement,determiner_noun_agreement_with_adj_irregular_1,True,True,False,True,493,-54.03801727294922,-51.6952018737793,0
Thomas hadn't arrived at those red oases.,Thomas hadn't arrived at those red oasis.,morphology,determiner_noun_agreement,determiner_noun_agreement_with_adj_irregular_1,True,True,False,True,494,-54.730255126953125,-53.644073486328125,0
A lot of companies remembered this unlucky alumnus.,A lot of companies remembered this unlucky alumni.,morphology,determiner_noun_agreement,determiner_noun_agreement_with_adj_irregular_1,True,True,False,True,495,-64.04569244384766,-61.40212631225586,0
Women fire these content women.,Women fire these content woman.,morphology,determiner_noun_agreement,determiner_noun_agreement_with_adj_irregular_1,True,True,False,True,496,-44.065155029296875,-46.93882369995117,1
George will remember those good synopses.,George will remember those good synopsis.,morphology,determiner_noun_agreement,determiner_noun_agreement_with_adj_irregular_1,True,True,False,True,497,-52.39562225341797,-43.74970626831055,0
The glacier wasn't embarrassing those unlucky people.,The glacier wasn't embarrassing those unlucky person.,morphology,determiner_noun_agreement,determiner_noun_agreement_with_adj_irregular_1,True,True,False,True,498,-62.40074920654297,-67.42579650878906,1
Guy visits that happy woman.,Guy visits that happy women.,morphology,determiner_noun_agreement,determiner_noun_agreement_with_adj_irregular_1,True,True,False,True,499,-38.86207962036133,-38.751251220703125,0
Steven investigates this employed person.,Steven investigates this employed people.,morphology,determiner_noun_agreement,determiner_noun_agreement_with_adj_irregular_1,True,True,False,True,500,-40.86071014404297,-40.863975524902344,1
John didn't conceal those young men.,John didn't conceal those young man.,morphology,determiner_noun_agreement,determiner_noun_agreement_with_adj_irregular_1,True,True,False,True,501,-40.05466079711914,-43.67003631591797,1
Martin hadn't gone to that gray oasis.,Martin hadn't gone to that gray oases.,morphology,determiner_noun_agreement,determiner_noun_agreement_with_adj_irregular_1,True,True,False,True,502,-52.22991943359375,-53.95286560058594,1
The cashiers weren't breaking these brown feet.,The cashiers weren't breaking these brown foot.,morphology,determiner_noun_agreement,determiner_noun_agreement_with_adj_irregular_1,True,True,False,True,503,-65.21751403808594,-70.44854736328125,1
The pedestrians might complain about this small oasis.,The pedestrians might complain about this small oases.,morphology,determiner_noun_agreement,determiner_noun_agreement_with_adj_irregular_1,True,True,False,True,504,-55.19536590576172,-59.05148696899414,1
Tamara won't bike to those exposed oases.,Tamara won't bike to those exposed oasis.,morphology,determiner_noun_agreement,determiner_noun_agreement_with_adj_irregular_1,True,True,False,True,505,-74.13316345214844,-71.4730224609375,0
Jennifer does discuss those purple oases.,Jennifer does discuss those purple oasis.,morphology,determiner_noun_agreement,determiner_noun_agreement_with_adj_irregular_1,True,True,False,True,506,-52.49310302734375,-50.44061279296875,0
Naomi does investigate those clever people.,Naomi does investigate those clever person.,morphology,determiner_noun_agreement,determiner_noun_agreement_with_adj_irregular_1,True,True,False,True,507,-52.50457763671875,-55.55230712890625,1
Beverly wasn't hiding this blue mouse.,Beverly wasn't hiding this blue mice.,morphology,determiner_noun_agreement,determiner_noun_agreement_with_adj_irregular_1,True,True,False,True,508,-63.78791809082031,-63.91883850097656,1
Every sketch astounds that hidden child.,Every sketch astounds that hidden children.,morphology,determiner_noun_agreement,determiner_noun_agreement_with_adj_irregular_1,True,True,False,True,509,-60.967803955078125,-59.465641021728516,0
Christine talks to that determined child.,Christine talks to that determined children.,morphology,determiner_noun_agreement,determiner_noun_agreement_with_adj_irregular_1,True,True,False,True,510,-51.695533752441406,-49.10991287231445,0
Jesus can hire that smart man.,Jesus can hire that smart men.,morphology,determiner_noun_agreement,determiner_noun_agreement_with_adj_irregular_1,True,True,False,True,511,-41.12962341308594,-40.12006378173828,0
These drivers kiss this exposed alumnus.,These drivers kiss this exposed alumni.,morphology,determiner_noun_agreement,determiner_noun_agreement_with_adj_irregular_1,True,True,False,True,512,-55.404876708984375,-54.15102767944336,0
Diane respected those unemployed alumni.,Diane respected those unemployed alumnus.,morphology,determiner_noun_agreement,determiner_noun_agreement_with_adj_irregular_1,True,True,False,True,513,-50.96269989013672,-58.22581481933594,1
Theodore hasn't argued about these unsure people.,Theodore hasn't argued about these unsure person.,morphology,determiner_noun_agreement,determiner_noun_agreement_with_adj_irregular_1,True,True,False,True,514,-63.59317398071289,-66.99645233154297,1
Nina reveals these red theses.,Nina reveals these red thesis.,morphology,determiner_noun_agreement,determiner_noun_agreement_with_adj_irregular_1,True,True,False,True,515,-54.372459411621094,-48.915191650390625,0
Meredith complains about those popular women.,Meredith complains about those popular woman.,morphology,determiner_noun_agreement,determiner_noun_agreement_with_adj_irregular_1,True,True,False,True,516,-52.10723114013672,-55.76559829711914,1
That government hadn't discussed these good synopses.,That government hadn't discussed these good synopsis.,morphology,determiner_noun_agreement,determiner_noun_agreement_with_adj_irregular_1,True,True,False,True,517,-64.84313201904297,-57.603553771972656,0
Colleen had broken that big tooth.,Colleen had broken that big teeth.,morphology,determiner_noun_agreement,determiner_noun_agreement_with_adj_irregular_1,True,True,False,True,518,-52.030975341796875,-50.67002487182617,0
Catherine was revealing that exposed tooth.,Catherine was revealing that exposed teeth.,morphology,determiner_noun_agreement,determiner_noun_agreement_with_adj_irregular_1,True,True,False,True,519,-54.83488464355469,-51.00813293457031,0
A lot of actresses are skated around these purple oases.,A lot of actresses are skated around these purple oasis.,morphology,determiner_noun_agreement,determiner_noun_agreement_with_adj_irregular_1,True,True,False,True,520,-72.8597412109375,-70.92668151855469,0
Most pedestrians criticize these bad men.,Most pedestrians criticize these bad man.,morphology,determiner_noun_agreement,determiner_noun_agreement_with_adj_irregular_1,True,True,False,True,521,-45.429771423339844,-48.653709411621094,1
John hadn't scared that clever man.,John hadn't scared that clever men.,morphology,determiner_noun_agreement,determiner_noun_agreement_with_adj_irregular_1,True,True,False,True,522,-48.86640167236328,-50.33386993408203,1
Julia has astounded that nice child.,Julia has astounded that nice children.,morphology,determiner_noun_agreement,determiner_noun_agreement_with_adj_irregular_1,True,True,False,True,523,-52.548377990722656,-49.4576530456543,0
Laurie has dropped by those cheap oases.,Laurie has dropped by those cheap oasis.,morphology,determiner_noun_agreement,determiner_noun_agreement_with_adj_irregular_1,True,True,False,True,524,-63.42793655395508,-61.79487991333008,0
Rose wouldn't bike to those small oases.,Rose wouldn't bike to those small oasis.,morphology,determiner_noun_agreement,determiner_noun_agreement_with_adj_irregular_1,True,True,False,True,525,-61.08346176147461,-57.99843978881836,0
Holly did observe that unconvinced person.,Holly did observe that unconvinced people.,morphology,determiner_noun_agreement,determiner_noun_agreement_with_adj_irregular_1,True,True,False,True,526,-61.314491271972656,-58.34986877441406,0
Stacy isn't healing this big child.,Stacy isn't healing this big children.,morphology,determiner_noun_agreement,determiner_noun_agreement_with_adj_irregular_1,True,True,False,True,527,-52.233577728271484,-53.21319580078125,1
Every actor complains about this small thesis.,Every actor complains about this small theses.,morphology,determiner_noun_agreement,determiner_noun_agreement_with_adj_irregular_1,True,True,False,True,528,-51.45295715332031,-61.3345947265625,1
Some teacher dislikes this determined alumnus.,Some teacher dislikes this determined alumni.,morphology,determiner_noun_agreement,determiner_noun_agreement_with_adj_irregular_1,True,True,False,True,529,-55.74734878540039,-53.953712463378906,0
This driver remembers that scared woman.,This driver remembers that scared women.,morphology,determiner_noun_agreement,determiner_noun_agreement_with_adj_irregular_1,True,True,False,True,530,-47.36084747314453,-47.651214599609375,1
Thomas hadn't aggravated that fast man.,Thomas hadn't aggravated that fast men.,morphology,determiner_noun_agreement,determiner_noun_agreement_with_adj_irregular_1,True,True,False,True,531,-49.109580993652344,-51.08144760131836,1
Tracy messed up those orange feet.,Tracy messed up those orange foot.,morphology,determiner_noun_agreement,determiner_noun_agreement_with_adj_irregular_1,True,True,False,True,532,-48.4890022277832,-51.96766662597656,1
Matt hasn't bothered those employed men.,Matt hasn't bothered those employed man.,morphology,determiner_noun_agreement,determiner_noun_agreement_with_adj_irregular_1,True,True,False,True,533,-51.040794372558594,-53.007171630859375,1
Sharon isn't criticizing those standing children.,Sharon isn't criticizing those standing child.,morphology,determiner_noun_agreement,determiner_noun_agreement_with_adj_irregular_1,True,True,False,True,534,-60.20472717285156,-61.32337951660156,1
Noah admired this hard louse.,Noah admired this hard lice.,morphology,determiner_noun_agreement,determiner_noun_agreement_with_adj_irregular_1,True,True,False,True,535,-53.16364288330078,-52.23379135131836,0
The popsicle confuses this concealed child.,The popsicle confuses this concealed children.,morphology,determiner_noun_agreement,determiner_noun_agreement_with_adj_irregular_1,True,True,False,True,536,-60.59817123413086,-60.189266204833984,0
That apple worried those important people.,That apple worried those important person.,morphology,determiner_noun_agreement,determiner_noun_agreement_with_adj_irregular_1,True,True,False,True,537,-50.27889633178711,-55.036869049072266,1
Robert couldn't like those old feet.,Robert couldn't like those old foot.,morphology,determiner_noun_agreement,determiner_noun_agreement_with_adj_irregular_1,True,True,False,True,538,-41.23597717285156,-46.213069915771484,1
All legislatures help those lucky children.,All legislatures help those lucky child.,morphology,determiner_noun_agreement,determiner_noun_agreement_with_adj_irregular_1,True,True,False,True,539,-45.83575439453125,-52.059814453125,1
This spinach wasn't scaring that exposed child.,This spinach wasn't scaring that exposed children.,morphology,determiner_noun_agreement,determiner_noun_agreement_with_adj_irregular_1,True,True,False,True,540,-71.86614990234375,-68.09793090820312,0
The teenager returned to those black oases.,The teenager returned to those black oasis.,morphology,determiner_noun_agreement,determiner_noun_agreement_with_adj_irregular_1,True,True,False,True,541,-54.258522033691406,-52.48143005371094,0
Jill is hiring this small man.,Jill is hiring this small men.,morphology,determiner_noun_agreement,determiner_noun_agreement_with_adj_irregular_1,True,True,False,True,542,-46.32759094238281,-48.5827522277832,1
Jeffrey hasn't watched those clever alumni.,Jeffrey hasn't watched those clever alumnus.,morphology,determiner_noun_agreement,determiner_noun_agreement_with_adj_irregular_1,True,True,False,True,543,-59.60153579711914,-62.38763427734375,1
Danielle helps that happy person.,Danielle helps that happy people.,morphology,determiner_noun_agreement,determiner_noun_agreement_with_adj_irregular_1,True,True,False,True,544,-39.41315460205078,-37.02958297729492,0
The Borgias escape from that troubled woman.,The Borgias escape from that troubled women.,morphology,determiner_noun_agreement,determiner_noun_agreement_with_adj_irregular_1,True,True,False,True,545,-61.13329315185547,-57.82809066772461,0
The Borgias wouldn't break that smooth tooth.,The Borgias wouldn't break that smooth teeth.,morphology,determiner_noun_agreement,determiner_noun_agreement_with_adj_irregular_1,True,True,False,True,546,-71.37284851074219,-68.42436981201172,0
Most waiters conceal those smart men.,Most waiters conceal those smart man.,morphology,determiner_noun_agreement,determiner_noun_agreement_with_adj_irregular_1,True,True,False,True,547,-49.88533020019531,-53.97909927368164,1
Kathleen couldn't talk about these good analyses.,Kathleen couldn't talk about these good analysis.,morphology,determiner_noun_agreement,determiner_noun_agreement_with_adj_irregular_1,True,True,False,True,548,-57.7261962890625,-56.29125213623047,0
Veronica hadn't noticed those lost lice.,Veronica hadn't noticed those lost louse.,morphology,determiner_noun_agreement,determiner_noun_agreement_with_adj_irregular_1,True,True,False,True,549,-64.76002502441406,-66.6138916015625,1
Rachel had found those hard cacti.,Rachel had found those hard cactus.,morphology,determiner_noun_agreement,determiner_noun_agreement_with_adj_irregular_1,True,True,False,True,550,-50.7087516784668,-42.88249206542969,0
Denise sounds like that confident person.,Denise sounds like that confident people.,morphology,determiner_noun_agreement,determiner_noun_agreement_with_adj_irregular_1,True,True,False,True,551,-45.892669677734375,-44.67770767211914,0
Many mouths stunned this nice person.,Many mouths stunned this nice people.,morphology,determiner_noun_agreement,determiner_noun_agreement_with_adj_irregular_1,True,True,False,True,552,-51.45977783203125,-52.72022247314453,1
Most adults love these content women.,Most adults love these content woman.,morphology,determiner_noun_agreement,determiner_noun_agreement_with_adj_irregular_1,True,True,False,True,553,-44.71746063232422,-48.50157165527344,1
Donald is hurting these unemployed people.,Donald is hurting these unemployed person.,morphology,determiner_noun_agreement,determiner_noun_agreement_with_adj_irregular_1,True,True,False,True,554,-33.93934631347656,-39.43248748779297,1
Those students reference those smart people.,Those students reference those smart person.,morphology,determiner_noun_agreement,determiner_noun_agreement_with_adj_irregular_1,True,True,False,True,555,-43.570709228515625,-49.38898849487305,1
Jerry shouldn't listen to those serious alumni.,Jerry shouldn't listen to those serious alumnus.,morphology,determiner_noun_agreement,determiner_noun_agreement_with_adj_irregular_1,True,True,False,True,556,-45.25611114501953,-49.144615173339844,1
Many dancers skate around these smooth oases.,Many dancers skate around these smooth oasis.,morphology,determiner_noun_agreement,determiner_noun_agreement_with_adj_irregular_1,True,True,False,True,557,-61.524253845214844,-59.06367874145508,0
Judy liked this determined man.,Judy liked this determined men.,morphology,determiner_noun_agreement,determiner_noun_agreement_with_adj_irregular_1,True,True,False,True,558,-45.948692321777344,-48.00202941894531,1
