sentence_good,sentence_bad,field,linguistics_term,UID,simple_LM_method,one_prefix_method,two_prefix_method,lexically_identical,pair_id,good_prob,bad_prob,correct
Sally hadn't noticed three gloves and Phillip hadn't noticed fewer rough gloves.,Sally hadn't noticed three important gloves and Phillip hadn't noticed fewer rough.,syntax,ellipsis,ellipsis_n_bar_2,True,False,False,False,458,-104.30609130859375,-107.75447845458984,1
The nieces of Tonya appreciate one museum and Julie's podiatrists appreciate few popular museum.,The nieces of Tonya appreciate one dirty museum and Julie's podiatrists appreciate few popular.,syntax,ellipsis,ellipsis_n_bar_2,True,False,False,False,459,-171.27828979492188,-171.22396850585938,0
That driver toured one art gallery and a waitress toured three exposed art gallery.,That driver toured one out in the open art gallery and a waitress toured three exposed.,syntax,ellipsis,ellipsis_n_bar_2,True,False,False,False,460,-119.76535034179688,-118.56036376953125,0
Anna remembered three sisters and Beth remembered more unemployed sisters.,Anna remembered three unsure sisters and Beth remembered more unemployed.,syntax,ellipsis,ellipsis_n_bar_2,True,False,False,False,461,-77.9537353515625,-84.62662506103516,1
Liam hasn't attacked one grandmother and Connie hasn't attacked two unlucky grandmother.,Liam hasn't attacked one clever grandmother and Connie hasn't attacked two unlucky.,syntax,ellipsis,ellipsis_n_bar_2,True,False,False,False,462,-110.63600158691406,-109.98065185546875,0
Douglas's best friends scan one supervisor and Barbara's bosses scan a few unlucky supervisor.,Douglas's best friends scan one lucky supervisor and Barbara's bosses scan a few unlucky.,syntax,ellipsis,ellipsis_n_bar_2,True,False,False,False,463,-134.7783203125,-135.7410888671875,1
Adam is lifting four books and Sara is lifting five popular books.,Adam is lifting four brown books and Sara is lifting five popular.,syntax,ellipsis,ellipsis_n_bar_2,True,False,False,False,464,-88.6851806640625,-90.38336181640625,1
Every niece of Meredith wasn't researching one best friend and Steven's ex-girlfriend wasn't researching some unconvinced best friend.,Every niece of Meredith wasn't researching one out in the open best friend and Steven's ex-girlfriend wasn't researching some unconvinced.,syntax,ellipsis,ellipsis_n_bar_2,True,False,False,False,465,-176.7186279296875,-180.7119140625,1
Jacqueline cleaned one dress and Stacey's boyfriend cleaned a few gray dress.,Jacqueline cleaned one brown dress and Stacey's boyfriend cleaned a few gray.,syntax,ellipsis,ellipsis_n_bar_2,True,False,False,False,466,-111.9395751953125,-113.97103118896484,1
Some plates aggravate one ex-girlfriend and some gates aggravate more scared ex-girlfriend.,Some plates aggravate one hopeful ex-girlfriend and some gates aggravate more scared.,syntax,ellipsis,ellipsis_n_bar_2,True,False,False,False,467,-139.91641235351562,-128.28602600097656,0
Noah's handyman wasn't talking to one teacher and that granddaughter of Aaron wasn't talking to a lot standing teacher.,Noah's handyman wasn't talking to one fast teacher and that granddaughter of Aaron wasn't talking to a lot standing.,syntax,ellipsis,ellipsis_n_bar_2,True,False,False,False,468,-149.06053161621094,-150.53594970703125,1
Some girls confuses several partners and the doctor's bosses confuses a few hidden partners.,Some girls confuses several content partners and the doctor's bosses confuses a few hidden.,syntax,ellipsis,ellipsis_n_bar_2,True,False,False,False,469,-124.82821655273438,-128.80264282226562,1
Jennifer's girlfriend hugged many granddaughters of and Melanie hugged few unconvinced granddaughters of.,Jennifer's girlfriend hugged many concealed granddaughters of and Melanie hugged few unconvinced.,syntax,ellipsis,ellipsis_n_bar_2,True,False,False,False,470,-172.02630615234375,-150.06845092773438,0
Valerie wasn't healing one lawyer and the waiter wasn't healing at least as many uncertain lawyer.,Valerie wasn't healing one lost lawyer and the waiter wasn't healing at least as many uncertain.,syntax,ellipsis,ellipsis_n_bar_2,True,False,False,False,471,-128.72752380371094,-131.56698608398438,1
Katherine wasn't praising a few grandmothers and Omar wasn't praising several lucky grandmothers.,Katherine wasn't praising a few lost grandmothers and Omar wasn't praising several lucky.,syntax,ellipsis,ellipsis_n_bar_2,True,False,False,False,472,-129.69134521484375,-123.83074951171875,0
Many dancers' spouse didn't exit one art gallery and Meredith didn't exit a lot cheap art gallery.,Many dancers' spouse didn't exit one old art gallery and Meredith didn't exit a lot cheap.,syntax,ellipsis,ellipsis_n_bar_2,True,False,False,False,473,-157.8814697265625,-143.8452606201172,0
Susan isn't watching several hairdressers and a man's mentee isn't watching a few content hairdressers.,Susan isn't watching several uncertain hairdressers and a man's mentee isn't watching a few content.,syntax,ellipsis,ellipsis_n_bar_2,True,False,False,False,474,-149.039794921875,-133.74917602539062,0
The boys' ex-husbands brought one coat and Angela brought some green coat.,The boys' ex-husbands brought one orange coat and Angela brought some green.,syntax,ellipsis,ellipsis_n_bar_2,True,False,False,False,475,-115.23442840576172,-117.65785217285156,1
The child's bosses aren't descending three hills and that customer was descending almost as many bad hills.,The child's bosses aren't descending three rough hills and that customer was descending almost as many bad.,syntax,ellipsis,ellipsis_n_bar_2,True,False,False,False,476,-129.32485961914062,-130.01327514648438,1
Carlos's lawyer should bore one sister of and every play should bore three unconvinced sister of.,Carlos's lawyer should bore one troubled sister of and every play should bore three unconvinced.,syntax,ellipsis,ellipsis_n_bar_2,True,False,False,False,477,-158.86669921875,-152.17422485351562,0
Patrick's teacher cleaned one restaurant and sisters of that senator cleaned a lot gray restaurant.,Patrick's teacher cleaned one rough restaurant and sisters of that senator cleaned a lot gray.,syntax,ellipsis,ellipsis_n_bar_2,True,False,False,False,478,-118.82647705078125,-122.57249450683594,1
Some children did scan three oncologists and Tamara did scan more lucky oncologists.,Some children did scan three displeased oncologists and Tamara did scan more lucky.,syntax,ellipsis,ellipsis_n_bar_2,True,False,False,False,479,-151.33848571777344,-140.4737548828125,0
Some lady hasn't admired two nephews of and Samantha hasn't admired three smart nephews of.,Some lady hasn't admired two young nephews of and Samantha hasn't admired three smart.,syntax,ellipsis,ellipsis_n_bar_2,True,False,False,False,480,-133.15728759765625,-119.858642578125,0
Wendy's plumbers hadn't passed one river and Bill's sons hadn't passed few purple river.,Wendy's plumbers hadn't passed one cheap river and Bill's sons hadn't passed few purple.,syntax,ellipsis,ellipsis_n_bar_2,True,False,False,False,481,-147.52053833007812,-149.17124938964844,1
Patrick approaches one customer and some driver approaches at least as many happy customer.,Patrick approaches one big customer and some driver approaches at least as many happy.,syntax,ellipsis,ellipsis_n_bar_2,True,False,False,False,482,-100.29773712158203,-99.0447998046875,0
Tracy impressed three classmates and the bank impressed almost as many delighted classmates.,Tracy impressed three upset classmates and the bank impressed almost as many delighted.,syntax,ellipsis,ellipsis_n_bar_2,True,False,False,False,483,-111.71648406982422,-112.55517578125,1
Tiffany was upsetting three actors and Gary was upsetting more content actors.,Tiffany was upsetting three busy actors and Gary was upsetting more content.,syntax,ellipsis,ellipsis_n_bar_2,True,False,False,False,484,-109.58531951904297,-111.61344146728516,1
Katherine explored four grocery stores and Carrie's ex-wives explored five purple grocery stores.,Katherine explored four smooth grocery stores and Carrie's ex-wives explored five purple.,syntax,ellipsis,ellipsis_n_bar_2,True,False,False,False,485,-140.69729614257812,-131.91688537597656,0
Bruce conceals one glass and Veronica conceals a few broken glass.,Bruce conceals one hard glass and Veronica conceals a few broken.,syntax,ellipsis,ellipsis_n_bar_2,True,False,False,False,486,-99.22649383544922,-101.76165771484375,1
Sabrina's sisters weren't arriving at one college campus and Martin is arriving at more blue college campus.,Sabrina's sisters weren't arriving at one new college campus and Martin is arriving at more blue.,syntax,ellipsis,ellipsis_n_bar_2,True,False,False,False,487,-143.20855712890625,-130.48593139648438,0
Carlos will investigate three nephews and some senator will investigate almost as many small nephews.,Carlos will investigate three happy nephews and some senator will investigate almost as many small.,syntax,ellipsis,ellipsis_n_bar_2,True,False,False,False,488,-114.05338287353516,-113.95879364013672,0
Roger had a few banks and children had a lot gray banks.,Roger had a few cheap banks and children had a lot gray.,syntax,ellipsis,ellipsis_n_bar_2,True,False,False,False,489,-66.94102478027344,-69.69698333740234,1
Brian's friend attacks one partner and Stacy attacks several uncertain partner.,Brian's friend attacks one displeased partner and Stacy attacks several uncertain.,syntax,ellipsis,ellipsis_n_bar_2,True,False,False,False,490,-93.82882690429688,-107.80122375488281,1
Diana's dentists dislike one actress and some women's employees dislike at least as many popular actress.,Diana's dentists dislike one fast actress and some women's employees dislike at least as many popular.,syntax,ellipsis,ellipsis_n_bar_2,True,False,False,False,491,-136.6187744140625,-141.268310546875,1
Lawrence's doctors have exited one hill and Diana's ex-husband hadn't exited two red hill.,Lawrence's doctors have exited one black hill and Diana's ex-husband hadn't exited two red.,syntax,ellipsis,ellipsis_n_bar_2,True,False,False,False,492,-144.762451171875,-146.80653381347656,1
Larry's nephews have two paintings of and most senators have three small paintings of.,Larry's nephews have two big paintings of and most senators have three small.,syntax,ellipsis,ellipsis_n_bar_2,True,False,False,False,493,-103.22769927978516,-94.8953857421875,0
Every senator's classmates haven't questioned three girls and these pedestrians haven't questioned almost as many concealed girls.,Every senator's classmates haven't questioned three good girls and these pedestrians haven't questioned almost as many concealed.,syntax,ellipsis,ellipsis_n_bar_2,True,False,False,False,494,-140.2211151123047,-143.71359252929688,1
That cashier approaches one brother and Karla approaches three fast brother.,That cashier approaches one determined brother and Karla approaches three fast.,syntax,ellipsis,ellipsis_n_bar_2,True,False,False,False,495,-113.31910705566406,-116.34281921386719,1
Many ladders alarm several tutors and a lot of essays alarm a few smart tutors.,Many ladders alarm several busy tutors and a lot of essays alarm a few smart.,syntax,ellipsis,ellipsis_n_bar_2,True,False,False,False,496,-128.85897827148438,-127.34601593017578,0
Jesus's employees should know one man and Heidi should know more busy man.,Jesus's employees should know one exposed man and Heidi should know more busy.,syntax,ellipsis,ellipsis_n_bar_2,True,False,False,False,497,-89.69761657714844,-98.23090362548828,1
Sherry could heal four cousins of and Nina could heal five smart cousins of.,Sherry could heal four ill cousins of and Nina could heal five smart.,syntax,ellipsis,ellipsis_n_bar_2,True,False,False,False,498,-123.8469467163086,-117.754150390625,0
Jacqueline's supervisors had arrived at a lot of rivers and every grandson of Jane had arrived at a few popular rivers.,Jacqueline's supervisors had arrived at a lot of bad rivers and every grandson of Jane had arrived at a few popular.,syntax,ellipsis,ellipsis_n_bar_2,True,False,False,False,499,-141.27694702148438,-142.8628387451172,1
Some lady passed one public park and that senator passed some yellow public park.,Some lady passed one good public park and that senator passed some yellow.,syntax,ellipsis,ellipsis_n_bar_2,True,False,False,False,500,-102.79859924316406,-94.07325744628906,0
Theresa's piano teachers conceal many doctors and a lot of sons of Janet conceal few serious doctors.,Theresa's piano teachers conceal many troubled doctors and a lot of sons of Janet conceal few serious.,syntax,ellipsis,ellipsis_n_bar_2,True,False,False,False,501,-145.4176025390625,-151.18035888671875,1
Clyde was lifting many rivers and Nicole was lifting few red rivers.,Clyde was lifting many rough rivers and Nicole was lifting few red.,syntax,ellipsis,ellipsis_n_bar_2,True,False,False,False,502,-103.02220153808594,-105.19573974609375,1
Many committees would have three slopes and a hospital would have almost as many hidden slopes.,Many committees would have three small slopes and a hospital would have almost as many hidden.,syntax,ellipsis,ellipsis_n_bar_2,True,False,False,False,503,-97.57927703857422,-92.89739990234375,0
Brenda worked with one piano teacher and Amelia worked with five clever piano teacher.,Brenda worked with one bad piano teacher and Amelia worked with five clever.,syntax,ellipsis,ellipsis_n_bar_2,True,False,False,False,504,-102.25418853759766,-91.463134765625,0
These granddaughters of Monet boast about three senators and most banks boast about at least as many uncertain senators.,These granddaughters of Monet boast about three excited senators and most banks boast about at least as many uncertain.,syntax,ellipsis,ellipsis_n_bar_2,True,False,False,False,505,-157.8069305419922,-159.69113159179688,1
This man knew a few podiatrists and Colleen's supervisor knew several scared podiatrists.,This man knew a few serious podiatrists and Colleen's supervisor knew several scared.,syntax,ellipsis,ellipsis_n_bar_2,True,False,False,False,506,-169.46536254882812,-139.73757934570312,0
The fathers of Derek weren't buying three eyes and a child isn't buying more black eyes.,The fathers of Derek weren't buying three bad eyes and a child isn't buying more black.,syntax,ellipsis,ellipsis_n_bar_2,True,False,False,False,507,-113.23660278320312,-118.58836364746094,1
Rhonda doesn't buy five hospitals and Marla doesn't buy four hard hospitals.,Rhonda doesn't buy five dirty hospitals and Marla doesn't buy four hard.,syntax,ellipsis,ellipsis_n_bar_2,True,False,False,False,508,-101.74961853027344,-101.77207946777344,1
Christine's grandson has alarmed one piano teacher and every actor has alarmed at least as many unemployed piano teacher.,Christine's grandson has alarmed one exposed piano teacher and every actor has alarmed at least as many unemployed.,syntax,ellipsis,ellipsis_n_bar_2,True,False,False,False,509,-149.5924072265625,-141.558349609375,0
Barbara is healing four senators and Amelia is healing five popular senators.,Barbara is healing four upset senators and Amelia is healing five popular.,syntax,ellipsis,ellipsis_n_bar_2,True,False,False,False,510,-109.37655639648438,-114.85193634033203,1
Bill's dentists have cleaned three windows and those brothers of Beverly have cleaned at least as many brown windows.,Bill's dentists have cleaned three exposed windows and those brothers of Beverly have cleaned at least as many brown.,syntax,ellipsis,ellipsis_n_bar_2,True,False,False,False,511,-139.22987365722656,-147.224853515625,1
The Impressionists disagreed with a few patients and some reports about the Clintons disagreed with a lot good patients.,The Impressionists disagreed with a few unemployed patients and some reports about the Clintons disagreed with a lot good.,syntax,ellipsis,ellipsis_n_bar_2,True,False,False,False,512,-139.13345336914062,-144.9818115234375,1
Sara did reveal a few reports and Naomi did reveal several brown reports.,Sara did reveal a few out in the open reports and Naomi did reveal several brown.,syntax,ellipsis,ellipsis_n_bar_2,True,False,False,False,513,-105.32376098632812,-118.56880950927734,1
The dancer's husband observed a few employees and Natalie observed a lot troubled employees.,The dancer's husband observed a few unemployed employees and Natalie observed a lot troubled.,syntax,ellipsis,ellipsis_n_bar_2,True,False,False,False,514,-107.20614624023438,-111.77764892578125,1
The bikes alarm two teachers and Leslie's nieces alarm three hopeful teachers.,The bikes alarm two small teachers and Leslie's nieces alarm three hopeful.,syntax,ellipsis,ellipsis_n_bar_2,True,False,False,False,515,-124.41505432128906,-123.99796295166016,0
Every fish descends one hill and Suzanne descends a lot good hill.,Every fish descends one out in the open hill and Suzanne descends a lot good.,syntax,ellipsis,ellipsis_n_bar_2,True,False,False,False,516,-101.35403442382812,-112.45042419433594,1
These people go to no malls and these nephews of Gregory go to some bad malls.,These people go to no smooth malls and these nephews of Gregory go to some bad.,syntax,ellipsis,ellipsis_n_bar_2,True,False,False,False,517,-112.56341552734375,-112.30325317382812,0
Carlos hadn't criticized a few electricians and a lot of drivers hadn't criticized a lot clever electricians.,Carlos hadn't criticized a few hidden electricians and a lot of drivers hadn't criticized a lot clever.,syntax,ellipsis,ellipsis_n_bar_2,True,False,False,False,518,-142.184326171875,-135.12571716308594,0
Michael's ex-girlfriends leave three high schools and Andrea's lawyers leave more black high schools.,Michael's ex-girlfriends leave three popular high schools and Andrea's lawyers leave more black.,syntax,ellipsis,ellipsis_n_bar_2,True,False,False,False,519,-133.98648071289062,-128.81210327148438,0
Stacey was concealing one doctor and that actor's piano teachers are concealing several ill doctor.,Stacey was concealing one content doctor and that actor's piano teachers are concealing several ill.,syntax,ellipsis,ellipsis_n_bar_2,True,False,False,False,520,-147.22274780273438,-149.5869903564453,1
Phillip's tutor had seen two banks and those mothers of Paula had seen three smooth banks.,Phillip's tutor had seen two important banks and those mothers of Paula had seen three smooth.,syntax,ellipsis,ellipsis_n_bar_2,True,False,False,False,521,-125.16992950439453,-127.32899475097656,1
Tracy's son fired one girlfriend and grandsons of Eva fired several displeased girlfriend.,Tracy's son fired one upset girlfriend and grandsons of Eva fired several displeased.,syntax,ellipsis,ellipsis_n_bar_2,True,False,False,False,522,-139.58648681640625,-140.86605834960938,1
Jessica's grandfathers wear several sweaters and these pedestrians wear a few white sweaters.,Jessica's grandfathers wear several brown sweaters and these pedestrians wear a few white.,syntax,ellipsis,ellipsis_n_bar_2,True,False,False,False,523,-122.55168151855469,-116.93225860595703,0
Steven did admire one glass and some woman did admire a lot white glass.,Steven did admire one lost glass and some woman did admire a lot white.,syntax,ellipsis,ellipsis_n_bar_2,True,False,False,False,524,-97.01077270507812,-102.39801025390625,1
These children's tutor disagrees with three ex-boyfriends and the actress disagrees with more lost ex-boyfriends.,These children's tutor disagrees with three clever ex-boyfriends and the actress disagrees with more lost.,syntax,ellipsis,ellipsis_n_bar_2,True,False,False,False,525,-165.34902954101562,-144.0050048828125,0
Deanna is talking about three cousins of and Samuel is talking about at least as many good cousins of.,Deanna is talking about three upset cousins of and Samuel is talking about at least as many good.,syntax,ellipsis,ellipsis_n_bar_2,True,False,False,False,526,-124.10173797607422,-121.40465545654297,0
The pedestrians' ex-husband had observed one son and most waiters' colleague had observed many busy son.,The pedestrians' ex-husband had observed one uncertain son and most waiters' colleague had observed many busy.,syntax,ellipsis,ellipsis_n_bar_2,True,False,False,False,527,-153.595703125,-156.26678466796875,1
Some drawings bore two mothers and a lot of ladies bore three nice mothers.,Some drawings bore two standing mothers and a lot of ladies bore three nice.,syntax,ellipsis,ellipsis_n_bar_2,True,False,False,False,528,-99.25875854492188,-105.81787109375,1
A lot of dishes have distracted one ex-boyfriend and Sarah's handyman has distracted two hidden ex-boyfriend.,A lot of dishes have distracted one scared ex-boyfriend and Sarah's handyman has distracted two hidden.,syntax,ellipsis,ellipsis_n_bar_2,True,False,False,False,529,-183.92376708984375,-167.52877807617188,0
All actresses were scaring a few governments and some grandmother of Rachelle isn't scaring a lot good governments.,All actresses were scaring a few important governments and some grandmother of Rachelle isn't scaring a lot good.,syntax,ellipsis,ellipsis_n_bar_2,True,False,False,False,530,-155.40469360351562,-152.6796112060547,0
Raymond does observe a lot of students and Danielle does observe a few small students.,Raymond does observe a lot of out in the open students and Danielle does observe a few small.,syntax,ellipsis,ellipsis_n_bar_2,True,False,False,False,531,-102.43264770507812,-122.13941192626953,1
Alexander appreciates one nephew of and Melissa appreciates two hidden nephew of.,Alexander appreciates one bad nephew of and Melissa appreciates two hidden.,syntax,ellipsis,ellipsis_n_bar_2,True,False,False,False,532,-115.88103485107422,-104.5586929321289,0
Cindy's employee hasn't attacked one supervisor and Gerald hasn't attacked a few busy supervisor.,Cindy's employee hasn't attacked one hopeful supervisor and Gerald hasn't attacked a few busy.,syntax,ellipsis,ellipsis_n_bar_2,True,False,False,False,533,-130.76837158203125,-131.84716796875,1
Holly might boast about three commentaries about and Daniel might boast about more bad commentaries about.,Holly might boast about three long commentaries about and Daniel might boast about more bad.,syntax,ellipsis,ellipsis_n_bar_2,True,False,False,False,534,-153.78704833984375,-129.05902099609375,0
Nicole thought about three associates and Pamela thought about fewer lucky associates.,Nicole thought about three small associates and Pamela thought about fewer lucky.,syntax,ellipsis,ellipsis_n_bar_2,True,False,False,False,535,-98.13934326171875,-94.20259857177734,0
Regina can go to many closets and the waiters can go to few red closets.,Regina can go to many bad closets and the waiters can go to few red.,syntax,ellipsis,ellipsis_n_bar_2,True,False,False,False,536,-115.44877624511719,-108.66127014160156,0
Kenneth drives to one hospital and some sister of Cindy drives to several purple hospital.,Kenneth drives to one good hospital and some sister of Cindy drives to several purple.,syntax,ellipsis,ellipsis_n_bar_2,True,False,False,False,537,-117.5386962890625,-114.48230743408203,0
This teenager ascends one ladder and Frank's daughter ascends more hard ladder.,This teenager ascends one smooth ladder and Frank's daughter ascends more hard.,syntax,ellipsis,ellipsis_n_bar_2,True,False,False,False,538,-119.1368408203125,-117.83564758300781,0
Every patient hadn't returned to one man and Stephen's classmate hadn't returned to some troubled man.,Every patient hadn't returned to one out in the open man and Stephen's classmate hadn't returned to some troubled.,syntax,ellipsis,ellipsis_n_bar_2,True,False,False,False,539,-115.60917663574219,-130.44200134277344,1
Margaret's nieces haven't questioned few customers and Kenneth's teachers haven't questioned many fast customers.,Margaret's nieces haven't questioned few out in the open customers and Kenneth's teachers haven't questioned many fast.,syntax,ellipsis,ellipsis_n_bar_2,True,False,False,False,540,-154.0761260986328,-165.68154907226562,1
Some grandsons of Adam alarms three ladies and some drawing alarms fewer exposed ladies.,Some grandsons of Adam alarms three busy ladies and some drawing alarms fewer exposed.,syntax,ellipsis,ellipsis_n_bar_2,True,False,False,False,541,-132.84536743164062,-136.66651916503906,1
Theodore's best friends aren't annoying one husband and all doctors' wife isn't annoying four big husband.,Theodore's best friends aren't annoying one good husband and all doctors' wife isn't annoying four big.,syntax,ellipsis,ellipsis_n_bar_2,True,False,False,False,542,-135.6592254638672,-136.3502197265625,1
Those women disagree with no daughters and reports disagree with some happy daughters.,Those women disagree with no lost daughters and reports disagree with some happy.,syntax,ellipsis,ellipsis_n_bar_2,True,False,False,False,543,-88.87158966064453,-92.0235595703125,1
Suzanne's grandmother discussed four ex-wives and Gregory discussed five nice ex-wives.,Suzanne's grandmother discussed four hidden ex-wives and Gregory discussed five nice.,syntax,ellipsis,ellipsis_n_bar_2,True,False,False,False,544,-132.52365112304688,-121.68701171875,0
Stacey talked about one pedestrian and Eric's ex-husband talked about more big pedestrian.,Stacey talked about one excited pedestrian and Eric's ex-husband talked about more big.,syntax,ellipsis,ellipsis_n_bar_2,True,False,False,False,545,-119.02757263183594,-123.50436401367188,1
The cilantro upsets one mentee and these pedestrians upsets few delighted mentee.,The cilantro upsets one long mentee and these pedestrians upsets few delighted.,syntax,ellipsis,ellipsis_n_bar_2,True,False,False,False,546,-154.15301513671875,-139.14947509765625,0
Steven hasn't bored one waiter and Nina hasn't bored few troubled waiter.,Steven hasn't bored one hopeful waiter and Nina hasn't bored few troubled.,syntax,ellipsis,ellipsis_n_bar_2,True,False,False,False,547,-107.11030578613281,-107.00448608398438,0
