sentence_good,sentence_bad,field,linguistics_term,UID,simple_LM_method,one_prefix_method,two_prefix_method,lexically_identical,pair_id,good_prob,bad_prob,correct
Many boys discover that a driver talked about many restaurants.,Many boys discover what a driver talked about many restaurants.,syntax,filler_gap_dependency,wh_vs_that_no_gap,True,False,False,False,437,-64.60787200927734,-63.46603775024414,0
Bradley forgot that a man saw the ladies.,Bradley forgot who a man saw the ladies.,syntax,filler_gap_dependency,wh_vs_that_no_gap,True,False,False,False,438,-53.94866943359375,-58.85772705078125,1
Kristen conceals that the actor observes Dennis.,Kristen conceals who the actor observes Dennis.,syntax,filler_gap_dependency,wh_vs_that_no_gap,True,False,False,False,439,-63.01517105102539,-66.59317016601562,1
Becky reveals that the doctors did hug Douglas.,Becky reveals who the doctors did hug Douglas.,syntax,filler_gap_dependency,wh_vs_that_no_gap,True,False,False,False,440,-62.00574493408203,-67.43083953857422,1
Those customers found out that these students weren't observing Brenda.,Those customers found out who these students weren't observing Brenda.,syntax,filler_gap_dependency,wh_vs_that_no_gap,True,False,False,False,441,-74.93187713623047,-79.21168518066406,1
John investigates that the book hasn't sounded like Erin.,John investigates who the book hasn't sounded like Erin.,syntax,filler_gap_dependency,wh_vs_that_no_gap,True,False,False,False,442,-62.539039611816406,-68.32870483398438,1
The banks had revealed that the offspring had gone to some museum.,The banks had revealed what the offspring had gone to some museum.,syntax,filler_gap_dependency,wh_vs_that_no_gap,True,False,False,False,443,-71.15283203125,-74.41645050048828,1
Kirsten reveals that some girls cared for Tammy.,Kirsten reveals who some girls cared for Tammy.,syntax,filler_gap_dependency,wh_vs_that_no_gap,True,False,False,False,444,-63.96731948852539,-70.73760986328125,1
Carmen is realizing that a customer skates around this hill.,Carmen is realizing what a customer skates around this hill.,syntax,filler_gap_dependency,wh_vs_that_no_gap,True,False,False,False,445,-80.102783203125,-82.401611328125,1
A lot of waiters learn that those men didn't wear this glove.,A lot of waiters learn what those men didn't wear this glove.,syntax,filler_gap_dependency,wh_vs_that_no_gap,True,False,False,False,446,-74.23946380615234,-73.79847717285156,0
Beverly hadn't known that the teenagers boast about Carla.,Beverly hadn't known who the teenagers boast about Carla.,syntax,filler_gap_dependency,wh_vs_that_no_gap,True,False,False,False,447,-82.60531616210938,-86.20600891113281,1
Beth hadn't known that some painting looked like Diane.,Beth hadn't known who some painting looked like Diane.,syntax,filler_gap_dependency,wh_vs_that_no_gap,True,False,False,False,448,-68.994140625,-74.21744537353516,1
Russell was finding out that that student hadn't argued about every story.,Russell was finding out what that student hadn't argued about every story.,syntax,filler_gap_dependency,wh_vs_that_no_gap,True,False,False,False,449,-76.50753784179688,-76.44639587402344,0
Bill shouldn't discover that some men drive to the public parks.,Bill shouldn't discover what some men drive to the public parks.,syntax,filler_gap_dependency,wh_vs_that_no_gap,True,False,False,False,450,-63.239906311035156,-64.66497802734375,1
Judy hasn't learned that a lot of analyses hadn't stunned most drivers.,Judy hasn't learned who a lot of analyses hadn't stunned most drivers.,syntax,filler_gap_dependency,wh_vs_that_no_gap,True,False,False,False,451,-89.07737731933594,-95.40840148925781,1
Marcus won't investigate that this sheep has distracted those drivers.,Marcus won't investigate who this sheep has distracted those drivers.,syntax,filler_gap_dependency,wh_vs_that_no_gap,True,False,False,False,452,-82.00148010253906,-85.63728332519531,1
Kirsten did realize that all pedestrians drive to that glacier.,Kirsten did realize what all pedestrians drive to that glacier.,syntax,filler_gap_dependency,wh_vs_that_no_gap,True,False,False,False,453,-78.58648681640625,-85.7647705078125,1
Vincent was investigating that the book hasn't resembled every drawing.,Vincent was investigating what the book hasn't resembled every drawing.,syntax,filler_gap_dependency,wh_vs_that_no_gap,True,False,False,False,454,-81.79266357421875,-83.25570678710938,1
Christina could know that this boy questions the Clintons.,Christina could know who this boy questions the Clintons.,syntax,filler_gap_dependency,wh_vs_that_no_gap,True,False,False,False,455,-68.64633178710938,-69.82456970214844,1
Keith learned that some glasses confused every student.,Keith learned who some glasses confused every student.,syntax,filler_gap_dependency,wh_vs_that_no_gap,True,False,False,False,456,-60.95270919799805,-68.01680755615234,1
Denise has remembered that the octopi broke every screen.,Denise has remembered what the octopi broke every screen.,syntax,filler_gap_dependency,wh_vs_that_no_gap,True,False,False,False,457,-80.31179809570312,-81.18537902832031,1
This child couldn't figure out that all senators have visited Kayla.,This child couldn't figure out who all senators have visited Kayla.,syntax,filler_gap_dependency,wh_vs_that_no_gap,True,False,False,False,458,-74.77976989746094,-76.42320251464844,1
Barbara finds out that all people cleaned most icicles.,Barbara finds out what all people cleaned most icicles.,syntax,filler_gap_dependency,wh_vs_that_no_gap,True,False,False,False,459,-73.06510925292969,-75.4161376953125,1
Every hospital had found out that this girl investigates the senator.,Every hospital had found out who this girl investigates the senator.,syntax,filler_gap_dependency,wh_vs_that_no_gap,True,False,False,False,460,-69.698974609375,-77.43598937988281,1
Spain hadn't discovered that an alumnus scans a movie.,Spain hadn't discovered what an alumnus scans a movie.,syntax,filler_gap_dependency,wh_vs_that_no_gap,True,False,False,False,461,-64.9488525390625,-67.01182556152344,1
Marie finds out that some people hadn't ascended that mountain.,Marie finds out what some people hadn't ascended that mountain.,syntax,filler_gap_dependency,wh_vs_that_no_gap,True,False,False,False,462,-62.28117370605469,-64.20230102539062,1
Most cashiers reveal that some adults hadn't ascended all ladders.,Most cashiers reveal what some adults hadn't ascended all ladders.,syntax,filler_gap_dependency,wh_vs_that_no_gap,True,False,False,False,463,-89.20852661132812,-94.34573364257812,1
Karla realized that this teenager reveals every dish.,Karla realized what this teenager reveals every dish.,syntax,filler_gap_dependency,wh_vs_that_no_gap,True,False,False,False,464,-62.81346893310547,-65.40423583984375,1
Stephanie discovers that these boys reveal these guys.,Stephanie discovers who these boys reveal these guys.,syntax,filler_gap_dependency,wh_vs_that_no_gap,True,False,False,False,465,-63.879817962646484,-69.07794189453125,1
Marcus remembers that guests work with the Clintons.,Marcus remembers who guests work with the Clintons.,syntax,filler_gap_dependency,wh_vs_that_no_gap,True,False,False,False,466,-49.88136291503906,-51.449729919433594,1
Most associations conceal that every student discovered many malls.,Most associations conceal what every student discovered many malls.,syntax,filler_gap_dependency,wh_vs_that_no_gap,True,False,False,False,467,-76.45179748535156,-78.63330078125,1
These adults forget that these guests reveal the plate.,These adults forget what these guests reveal the plate.,syntax,filler_gap_dependency,wh_vs_that_no_gap,True,False,False,False,468,-59.88419723510742,-61.13298034667969,1
Michelle knew that a lot of girls could bring the shoe.,Michelle knew what a lot of girls could bring the shoe.,syntax,filler_gap_dependency,wh_vs_that_no_gap,True,False,False,False,469,-51.987754821777344,-54.12614822387695,1
Adam wouldn't conceal that this mouth had irritated Adam.,Adam wouldn't conceal who this mouth had irritated Adam.,syntax,filler_gap_dependency,wh_vs_that_no_gap,True,False,False,False,470,-71.50133514404297,-76.28448486328125,1
Connie had forgotten that every man is appreciating Rodney.,Connie had forgotten who every man is appreciating Rodney.,syntax,filler_gap_dependency,wh_vs_that_no_gap,True,False,False,False,471,-72.2999496459961,-79.11341857910156,1
This legislature figures out that these men describe John.,This legislature figures out who these men describe John.,syntax,filler_gap_dependency,wh_vs_that_no_gap,True,False,False,False,472,-64.80728149414062,-69.36056518554688,1
Governments know that that man can go to some banks.,Governments know what that man can go to some banks.,syntax,filler_gap_dependency,wh_vs_that_no_gap,True,False,False,False,473,-63.19393539428711,-63.062034606933594,0
Maria discovered that a lot of snakes ascend all stairs.,Maria discovered what a lot of snakes ascend all stairs.,syntax,filler_gap_dependency,wh_vs_that_no_gap,True,False,False,False,474,-62.97978210449219,-67.32577514648438,1
Russell found out that rivers should annoy Douglas.,Russell found out who rivers should annoy Douglas.,syntax,filler_gap_dependency,wh_vs_that_no_gap,True,False,False,False,475,-64.38347625732422,-67.68545532226562,1
April had discovered that many teenagers leave some people.,April had discovered who many teenagers leave some people.,syntax,filler_gap_dependency,wh_vs_that_no_gap,True,False,False,False,476,-54.11738586425781,-63.189598083496094,1
Kayla discovered that some casserole hasn't upset James.,Kayla discovered who some casserole hasn't upset James.,syntax,filler_gap_dependency,wh_vs_that_no_gap,True,False,False,False,477,-75.51838684082031,-84.9973373413086,1
Gerald could find out that every boy discovers Becca.,Gerald could find out who every boy discovers Becca.,syntax,filler_gap_dependency,wh_vs_that_no_gap,True,False,False,False,478,-67.77359008789062,-70.84329223632812,1
Some man realized that this senator hadn't climbed up this ladder.,Some man realized what this senator hadn't climbed up this ladder.,syntax,filler_gap_dependency,wh_vs_that_no_gap,True,False,False,False,479,-70.70841979980469,-75.51077270507812,1
Those committees figure out that that boy had loved Raymond.,Those committees figure out who that boy had loved Raymond.,syntax,filler_gap_dependency,wh_vs_that_no_gap,True,False,False,False,480,-71.28153991699219,-73.65798950195312,1
Caroline was learning that the cashiers lift all shawls.,Caroline was learning what the cashiers lift all shawls.,syntax,filler_gap_dependency,wh_vs_that_no_gap,True,False,False,False,481,-86.43972778320312,-88.24345397949219,1
Theodore conceals that a computer was alarming Bill.,Theodore conceals who a computer was alarming Bill.,syntax,filler_gap_dependency,wh_vs_that_no_gap,True,False,False,False,482,-76.00041198730469,-82.0051040649414,1
Thomas discovers that all children will praise Linda.,Thomas discovers who all children will praise Linda.,syntax,filler_gap_dependency,wh_vs_that_no_gap,True,False,False,False,483,-47.563045501708984,-54.17182159423828,1
Sheila remembers that the university boasts about the boy.,Sheila remembers who the university boasts about the boy.,syntax,filler_gap_dependency,wh_vs_that_no_gap,True,False,False,False,484,-64.7384033203125,-69.43206024169922,1
These patients weren't investigating that this school hadn't concealed Rhonda.,These patients weren't investigating who this school hadn't concealed Rhonda.,syntax,filler_gap_dependency,wh_vs_that_no_gap,True,False,False,False,485,-88.36845397949219,-92.2427978515625,1
Some students conceal that that child returned to museums.,Some students conceal what that child returned to museums.,syntax,filler_gap_dependency,wh_vs_that_no_gap,True,False,False,False,486,-68.14034271240234,-66.49998474121094,0
Frank is finding out that every association conceals Julia.,Frank is finding out who every association conceals Julia.,syntax,filler_gap_dependency,wh_vs_that_no_gap,True,False,False,False,487,-66.23866271972656,-69.65770721435547,1
Tiffany is remembering that every newspaper article astounded some waitresses.,Tiffany is remembering who every newspaper article astounded some waitresses.,syntax,filler_gap_dependency,wh_vs_that_no_gap,True,False,False,False,488,-102.70508575439453,-110.14527893066406,1
April hadn't concealed that the unicycles weren't boring the boy.,April hadn't concealed who the unicycles weren't boring the boy.,syntax,filler_gap_dependency,wh_vs_that_no_gap,True,False,False,False,489,-88.00224304199219,-94.8023681640625,1
That student couldn't know that an eye hurt Marcus.,That student couldn't know who an eye hurt Marcus.,syntax,filler_gap_dependency,wh_vs_that_no_gap,True,False,False,False,490,-63.86094284057617,-64.9852523803711,1
Margaret should discover that many guys can conceal Donald.,Margaret should discover who many guys can conceal Donald.,syntax,filler_gap_dependency,wh_vs_that_no_gap,True,False,False,False,491,-74.04751586914062,-77.96356201171875,1
Vanessa wasn't forgetting that many offspring aren't working with Janice.,Vanessa wasn't forgetting who many offspring aren't working with Janice.,syntax,filler_gap_dependency,wh_vs_that_no_gap,True,False,False,False,492,-80.49809265136719,-84.30101013183594,1
Barbara conceals that this girl disagrees with Cindy.,Barbara conceals who this girl disagrees with Cindy.,syntax,filler_gap_dependency,wh_vs_that_no_gap,True,False,False,False,493,-67.60096740722656,-71.32986450195312,1
Those guys know that those banks wouldn't sell every shawl.,Those guys know what those banks wouldn't sell every shawl.,syntax,filler_gap_dependency,wh_vs_that_no_gap,True,False,False,False,494,-75.00585174560547,-75.93775939941406,1
Galileo remembers that every guest wasn't scanning this movie.,Galileo remembers what every guest wasn't scanning this movie.,syntax,filler_gap_dependency,wh_vs_that_no_gap,True,False,False,False,495,-77.64836120605469,-80.55331420898438,1
Martha remembers that some grocery stores could shock Brian.,Martha remembers who some grocery stores could shock Brian.,syntax,filler_gap_dependency,wh_vs_that_no_gap,True,False,False,False,496,-74.74268341064453,-80.8033447265625,1
Ruth conceals that those dancers were touring every art gallery.,Ruth conceals what those dancers were touring every art gallery.,syntax,filler_gap_dependency,wh_vs_that_no_gap,True,False,False,False,497,-84.29698181152344,-86.45491027832031,1
Thomas remembered that this drawing hadn't looked like every eggplant.,Thomas remembered what this drawing hadn't looked like every eggplant.,syntax,filler_gap_dependency,wh_vs_that_no_gap,True,False,False,False,498,-68.15765380859375,-71.06156158447266,1
Many girls investigate that students were approaching Kristin.,Many girls investigate who students were approaching Kristin.,syntax,filler_gap_dependency,wh_vs_that_no_gap,True,False,False,False,499,-63.789794921875,-66.0753402709961,1
Kayla does realize that every patient hasn't talked about these commentaries.,Kayla does realize what every patient hasn't talked about these commentaries.,syntax,filler_gap_dependency,wh_vs_that_no_gap,True,False,False,False,500,-74.70750427246094,-80.4065933227539,1
A library hadn't forgotten that the person is cleaning these jackets.,A library hadn't forgotten what the person is cleaning these jackets.,syntax,filler_gap_dependency,wh_vs_that_no_gap,True,False,False,False,501,-72.41233825683594,-72.2635498046875,0
Daniel is learning that that waitress hadn't ascended this slope.,Daniel is learning what that waitress hadn't ascended this slope.,syntax,filler_gap_dependency,wh_vs_that_no_gap,True,False,False,False,502,-78.4072036743164,-78.90447235107422,1
A lot of customers find out that some doctor had driven to those closets.,A lot of customers find out what some doctor had driven to those closets.,syntax,filler_gap_dependency,wh_vs_that_no_gap,True,False,False,False,503,-82.0992431640625,-80.50698852539062,0
Leslie hadn't forgotten that most waiters disagree with Patricia.,Leslie hadn't forgotten who most waiters disagree with Patricia.,syntax,filler_gap_dependency,wh_vs_that_no_gap,True,False,False,False,504,-80.43722534179688,-83.99391174316406,1
Kendra forgets that the teenagers hire the doctors.,Kendra forgets who the teenagers hire the doctors.,syntax,filler_gap_dependency,wh_vs_that_no_gap,True,False,False,False,505,-64.21028900146484,-70.90068054199219,1
A legislature hasn't remembered that this government did talk to Amy.,A legislature hasn't remembered who this government did talk to Amy.,syntax,filler_gap_dependency,wh_vs_that_no_gap,True,False,False,False,506,-74.28921508789062,-81.01243591308594,1
Guy investigates that most guys researched these libraries.,Guy investigates what most guys researched these libraries.,syntax,filler_gap_dependency,wh_vs_that_no_gap,True,False,False,False,507,-61.695560455322266,-61.945068359375,1
The Clintons haven't found out that a lot of men biked to a closet.,The Clintons haven't found out what a lot of men biked to a closet.,syntax,filler_gap_dependency,wh_vs_that_no_gap,True,False,False,False,508,-81.84770202636719,-82.33692932128906,1
Gina discovers that a print was shocking Theresa.,Gina discovers who a print was shocking Theresa.,syntax,filler_gap_dependency,wh_vs_that_no_gap,True,False,False,False,509,-67.28863525390625,-73.08248901367188,1
The Borgias reveal that a child will dislike most senators.,The Borgias reveal who a child will dislike most senators.,syntax,filler_gap_dependency,wh_vs_that_no_gap,True,False,False,False,510,-78.75652313232422,-86.45011901855469,1
The patients learn that some pedestrian was boycotting these high schools.,The patients learn what some pedestrian was boycotting these high schools.,syntax,filler_gap_dependency,wh_vs_that_no_gap,True,False,False,False,511,-83.04342651367188,-83.65740203857422,1
Clyde wasn't finding out that this alumnus bikes to hills.,Clyde wasn't finding out what this alumnus bikes to hills.,syntax,filler_gap_dependency,wh_vs_that_no_gap,True,False,False,False,512,-91.69156646728516,-93.08006286621094,1
Elaine can figure out that the child can embarrass Steven.,Elaine can figure out who the child can embarrass Steven.,syntax,filler_gap_dependency,wh_vs_that_no_gap,True,False,False,False,513,-68.5020980834961,-70.43563079833984,1
Most companies conceal that the guest can't research travel.,Most companies conceal what the guest can't research travel.,syntax,filler_gap_dependency,wh_vs_that_no_gap,True,False,False,False,514,-75.94461059570312,-74.28164672851562,0
Meredith figures out that a lot of syntheses do shock the organizations.,Meredith figures out what a lot of syntheses do shock the organizations.,syntax,filler_gap_dependency,wh_vs_that_no_gap,True,False,False,False,515,-91.52670288085938,-93.29399871826172,1
Steve is investigating that this restaurant hasn't hurt the Clintons.,Steve is investigating who this restaurant hasn't hurt the Clintons.,syntax,filler_gap_dependency,wh_vs_that_no_gap,True,False,False,False,516,-64.69499206542969,-68.86619567871094,1
Eric hadn't revealed that a lot of newspaper articles disagree with Linda.,Eric hadn't revealed who a lot of newspaper articles disagree with Linda.,syntax,filler_gap_dependency,wh_vs_that_no_gap,True,False,False,False,517,-70.77650451660156,-78.13003540039062,1
Some boy knows that a legislature confuses those banks.,Some boy knows what a legislature confuses those banks.,syntax,filler_gap_dependency,wh_vs_that_no_gap,True,False,False,False,518,-69.82998657226562,-70.30177307128906,1
These women figure out that some waitresses won't explore a mountain.,These women figure out what some waitresses won't explore a mountain.,syntax,filler_gap_dependency,wh_vs_that_no_gap,True,False,False,False,519,-81.1758804321289,-82.2191162109375,1
Suzanne would realize that this story impresses some companies.,Suzanne would realize what this story impresses some companies.,syntax,filler_gap_dependency,wh_vs_that_no_gap,True,False,False,False,520,-68.89580535888672,-73.25349426269531,1
Lawrence remembered that students see Heather.,Lawrence remembered who students see Heather.,syntax,filler_gap_dependency,wh_vs_that_no_gap,True,False,False,False,521,-54.02517318725586,-58.972145080566406,1
Homer hasn't investigated that a lot of actresses wouldn't criticize Daniel.,Homer hasn't investigated who a lot of actresses wouldn't criticize Daniel.,syntax,filler_gap_dependency,wh_vs_that_no_gap,True,False,False,False,522,-84.3440170288086,-89.6268310546875,1
Peter investigated that these senators dislike Lori.,Peter investigated who these senators dislike Lori.,syntax,filler_gap_dependency,wh_vs_that_no_gap,True,False,False,False,523,-55.78497314453125,-60.66188049316406,1
Karla discovered that dancers attacked Claire.,Karla discovered who dancers attacked Claire.,syntax,filler_gap_dependency,wh_vs_that_no_gap,True,False,False,False,524,-55.80684280395508,-61.45964813232422,1
The Lutherans forget that every pedestrian fled from Kimberley.,The Lutherans forget who every pedestrian fled from Kimberley.,syntax,filler_gap_dependency,wh_vs_that_no_gap,True,False,False,False,525,-75.8428726196289,-84.17210388183594,1
Kristin should figure out that the fish resemble paintings.,Kristin should figure out what the fish resemble paintings.,syntax,filler_gap_dependency,wh_vs_that_no_gap,True,False,False,False,526,-64.9346694946289,-61.78424072265625,0
Patrick figured out that those sketches looked like Anna.,Patrick figured out who those sketches looked like Anna.,syntax,filler_gap_dependency,wh_vs_that_no_gap,True,False,False,False,527,-55.39724349975586,-59.763092041015625,1
Phillip can't reveal that many doctors weren't hugging Joel.,Phillip can't reveal who many doctors weren't hugging Joel.,syntax,filler_gap_dependency,wh_vs_that_no_gap,True,False,False,False,528,-77.61836242675781,-79.79243469238281,1
Many schools have forgotten that this dancer hadn't dropped by every movie theater.,Many schools have forgotten what this dancer hadn't dropped by every movie theater.,syntax,filler_gap_dependency,wh_vs_that_no_gap,True,False,False,False,529,-84.22238159179688,-85.52023315429688,1
Raymond concealed that this cake embarrasses Tanya.,Raymond concealed who this cake embarrasses Tanya.,syntax,filler_gap_dependency,wh_vs_that_no_gap,True,False,False,False,530,-77.94108581542969,-84.01898193359375,1
The girl will know that patients will shock Karen.,The girl will know who patients will shock Karen.,syntax,filler_gap_dependency,wh_vs_that_no_gap,True,False,False,False,531,-60.1070556640625,-62.63456726074219,1
Many adults learn that some library has sold those mirrors.,Many adults learn what some library has sold those mirrors.,syntax,filler_gap_dependency,wh_vs_that_no_gap,True,False,False,False,532,-72.68366241455078,-74.26695251464844,1
Paul does discover that some teachers were taking that rice.,Paul does discover what some teachers were taking that rice.,syntax,filler_gap_dependency,wh_vs_that_no_gap,True,False,False,False,533,-67.27323913574219,-69.2081298828125,1
The Borgias reveal that every child goes to some lakes.,The Borgias reveal what every child goes to some lakes.,syntax,filler_gap_dependency,wh_vs_that_no_gap,True,False,False,False,534,-71.46894836425781,-76.691650390625,1
Erin doesn't find out that the patients alarmed Sharon.,Erin doesn't find out who the patients alarmed Sharon.,syntax,filler_gap_dependency,wh_vs_that_no_gap,True,False,False,False,535,-69.91000366210938,-70.469970703125,1
Stacy revealed that all waiters bothers Anna.,Stacy revealed who all waiters bothers Anna.,syntax,filler_gap_dependency,wh_vs_that_no_gap,True,False,False,False,536,-72.83808898925781,-80.99372863769531,1
That organization won't conceal that an offspring likes the malls.,That organization won't conceal what an offspring likes the malls.,syntax,filler_gap_dependency,wh_vs_that_no_gap,True,False,False,False,537,-81.07403564453125,-79.05664825439453,0
Gerald hadn't remembered that the women did explore Spain.,Gerald hadn't remembered what the women did explore Spain.,syntax,filler_gap_dependency,wh_vs_that_no_gap,True,False,False,False,538,-71.29832458496094,-72.37114715576172,1
All patients concealed that all men visit some closet.,All patients concealed what all men visit some closet.,syntax,filler_gap_dependency,wh_vs_that_no_gap,True,False,False,False,539,-71.4619140625,-75.50688171386719,1
That association concealed that some lady listens to an adult.,That association concealed who some lady listens to an adult.,syntax,filler_gap_dependency,wh_vs_that_no_gap,True,False,False,False,540,-67.62542724609375,-73.77096557617188,1
Frank does find out that some doctor was returning to a child.,Frank does find out who some doctor was returning to a child.,syntax,filler_gap_dependency,wh_vs_that_no_gap,True,False,False,False,541,-61.68357849121094,-63.57679748535156,1
Steven was forgetting that some mushrooms disgust Tiffany.,Steven was forgetting who some mushrooms disgust Tiffany.,syntax,filler_gap_dependency,wh_vs_that_no_gap,True,False,False,False,542,-72.03713989257812,-77.22467041015625,1
Thomas found out that feet impressed George.,Thomas found out who feet impressed George.,syntax,filler_gap_dependency,wh_vs_that_no_gap,True,False,False,False,543,-52.72616958618164,-54.69029235839844,1
Larry concealed that some dancer has ascended that hill.,Larry concealed what some dancer has ascended that hill.,syntax,filler_gap_dependency,wh_vs_that_no_gap,True,False,False,False,544,-76.04589080810547,-79.453125,1
Angela wasn't revealing that the students aggravates Winston Churchill.,Angela wasn't revealing who the students aggravates Winston Churchill.,syntax,filler_gap_dependency,wh_vs_that_no_gap,True,False,False,False,545,-78.17212677001953,-82.93939971923828,1
