sentence_good,sentence_bad,field,linguistics_term,UID,simple_LM_method,one_prefix_method,two_prefix_method,lexically_identical,pair_id,good_prob,bad_prob,correct
Some waiters broke this lost foot.,Some waiters broke this lost feet.,morphology,determiner_noun_agreement,determiner_noun_agreement_with_adj_irregular_1,True,True,False,True,0,-52.80204772949219,-54.54578399658203,1
The company talks about those big women.,The company talks about those big woman.,morphology,determiner_noun_agreement,determiner_noun_agreement_with_adj_irregular_1,True,True,False,True,1,-38.401710510253906,-43.77177429199219,1
This blouse astounds this lost woman.,This blouse astounds this lost women.,morphology,determiner_noun_agreement,determiner_noun_agreement_with_adj_irregular_1,True,True,False,True,2,-58.87723922729492,-58.757347106933594,0
David wasn't kissing these standing children.,David wasn't kissing these standing child.,morphology,determiner_noun_agreement,determiner_noun_agreement_with_adj_irregular_1,True,True,False,True,3,-54.61870193481445,-55.35839080810547,1
This person shouldn't criticize this upset child.,This person shouldn't criticize this upset children.,morphology,determiner_noun_agreement,determiner_noun_agreement_with_adj_irregular_1,True,True,False,True,4,-50.668941497802734,-50.33100891113281,0
These tomatoes astound that concealed person.,These tomatoes astound that concealed people.,morphology,determiner_noun_agreement,determiner_noun_agreement_with_adj_irregular_1,True,True,False,True,5,-65.04862213134766,-63.1585693359375,0
Sally hasn't cleaned these white oxen.,Sally hasn't cleaned these white ox.,morphology,determiner_noun_agreement,determiner_noun_agreement_with_adj_irregular_1,True,True,False,True,6,-60.73394012451172,-59.210418701171875,0
These doors would astound those happy children.,These doors would astound those happy child.,morphology,determiner_noun_agreement,determiner_noun_agreement_with_adj_irregular_1,True,True,False,True,7,-54.929771423339844,-59.511016845703125,1
Katherine is biking to these red oases.,Katherine is biking to these red oasis.,morphology,determiner_noun_agreement,determiner_noun_agreement_with_adj_irregular_1,True,True,False,True,8,-64.60538482666016,-62.02406311035156,0
Katherine hadn't praised this lost man.,Katherine hadn't praised this lost men.,morphology,determiner_noun_agreement,determiner_noun_agreement_with_adj_irregular_1,True,True,False,True,9,-55.73709487915039,-58.36209487915039,1
The driver sees that unlucky person.,The driver sees that unlucky people.,morphology,determiner_noun_agreement,determiner_noun_agreement_with_adj_irregular_1,True,True,False,True,10,-44.25326156616211,-42.53913879394531,0
Edward hadn't described this nice woman.,Edward hadn't described this nice women.,morphology,determiner_noun_agreement,determiner_noun_agreement_with_adj_irregular_1,True,True,False,True,11,-44.693763732910156,-50.369384765625,1
Heidi returns to that big woman.,Heidi returns to that big women.,morphology,determiner_noun_agreement,determiner_noun_agreement_with_adj_irregular_1,True,True,False,True,12,-45.932716369628906,-44.88446807861328,0
Sara listened to that unconvinced person.,Sara listened to that unconvinced people.,morphology,determiner_noun_agreement,determiner_noun_agreement_with_adj_irregular_1,True,True,False,True,13,-59.699180603027344,-57.491600036621094,0
Samuel had listened to these concealed people.,Samuel had listened to these concealed person.,morphology,determiner_noun_agreement,determiner_noun_agreement_with_adj_irregular_1,True,True,False,True,14,-54.255393981933594,-56.8857421875,1
Richard flees from those unconvinced men.,Richard flees from those unconvinced man.,morphology,determiner_noun_agreement,determiner_noun_agreement_with_adj_irregular_1,True,True,False,True,15,-56.35329055786133,-60.19359588623047,1
Monica is cleaning that hidden axis.,Monica is cleaning that hidden axes.,morphology,determiner_noun_agreement,determiner_noun_agreement_with_adj_irregular_1,True,True,False,True,16,-55.19324493408203,-56.755924224853516,1
Veronica does break those hard teeth.,Veronica does break those hard tooth.,morphology,determiner_noun_agreement,determiner_noun_agreement_with_adj_irregular_1,True,True,False,True,17,-53.206634521484375,-59.49748229980469,1
Rachel drove to those blue oases.,Rachel drove to those blue oasis.,morphology,determiner_noun_agreement,determiner_noun_agreement_with_adj_irregular_1,True,True,False,True,18,-45.47282409667969,-44.10951232910156,0
These cashiers do break this whole tooth.,These cashiers do break this whole teeth.,morphology,determiner_noun_agreement,determiner_noun_agreement_with_adj_irregular_1,True,True,False,True,19,-59.64022445678711,-59.447078704833984,0
Rose dislikes this bad synopsis.,Rose dislikes this bad synopses.,morphology,determiner_noun_agreement,determiner_noun_agreement_with_adj_irregular_1,True,True,False,True,20,-43.60084915161133,-52.72972869873047,1
Becky had fixed this hard foot.,Becky had fixed this hard feet.,morphology,determiner_noun_agreement,determiner_noun_agreement_with_adj_irregular_1,True,True,False,True,21,-44.553749084472656,-46.544700622558594,1
Gerald questioned those unconvinced men.,Gerald questioned those unconvinced man.,morphology,determiner_noun_agreement,determiner_noun_agreement_with_adj_irregular_1,True,True,False,True,22,-54.9351921081543,-58.023521423339844,1
Stacy doesn't impress this determined person.,Stacy doesn't impress this determined people.,morphology,determiner_noun_agreement,determiner_noun_agreement_with_adj_irregular_1,True,True,False,True,23,-55.83289337158203,-57.00579071044922,1
Nina won't run around this smooth oasis.,Nina won't run around this smooth oases.,morphology,determiner_noun_agreement,determiner_noun_agreement_with_adj_irregular_1,True,True,False,True,24,-59.42950439453125,-62.445674896240234,1
That committee works with those out in the open women.,That committee works with those out in the open woman.,morphology,determiner_noun_agreement,determiner_noun_agreement_with_adj_irregular_1,True,True,False,True,25,-62.74699020385742,-63.09645462036133,1
Most teenagers had complained about these scared men.,Most teenagers had complained about these scared man.,morphology,determiner_noun_agreement,determiner_noun_agreement_with_adj_irregular_1,True,True,False,True,26,-51.56794357299805,-53.74522018432617,1
Bill cures those unsure alumni.,Bill cures those unsure alumnus.,morphology,determiner_noun_agreement,determiner_noun_agreement_with_adj_irregular_1,True,True,False,True,27,-46.5141487121582,-49.73198699951172,1
Derek walked through this smooth oasis.,Derek walked through this smooth oases.,morphology,determiner_noun_agreement,determiner_noun_agreement_with_adj_irregular_1,True,True,False,True,28,-53.29679870605469,-54.686012268066406,1
Some waiters work with this hidden person.,Some waiters work with this hidden people.,morphology,determiner_noun_agreement,determiner_noun_agreement_with_adj_irregular_1,True,True,False,True,29,-50.32841491699219,-50.62291717529297,1
Dennis hasn't healed these unconvinced women.,Dennis hasn't healed these unconvinced woman.,morphology,determiner_noun_agreement,determiner_noun_agreement_with_adj_irregular_1,True,True,False,True,30,-65.59174346923828,-68.23207092285156,1
Kathleen has this exposed thesis.,Kathleen has this exposed theses.,morphology,determiner_noun_agreement,determiner_noun_agreement_with_adj_irregular_1,True,True,False,True,31,-50.431541442871094,-55.008209228515625,1
Sheila loved those determined people.,Sheila loved those determined person.,morphology,determiner_noun_agreement,determiner_noun_agreement_with_adj_irregular_1,True,True,False,True,32,-47.49714660644531,-51.57374572753906,1
Guy has toured this green oasis.,Guy has toured this green oases.,morphology,determiner_noun_agreement,determiner_noun_agreement_with_adj_irregular_1,True,True,False,True,33,-44.85878372192383,-47.62849044799805,1
Some senators go to that purple oasis.,Some senators go to that purple oases.,morphology,determiner_noun_agreement,determiner_noun_agreement_with_adj_irregular_1,True,True,False,True,34,-56.76152038574219,-60.23921203613281,1
Anna should scan that bad analysis.,Anna should scan that bad analyses.,morphology,determiner_noun_agreement,determiner_noun_agreement_with_adj_irregular_1,True,True,False,True,35,-44.35271453857422,-47.285247802734375,1
Most waitresses notice that red stimulus.,Most waitresses notice that red stimuli.,morphology,determiner_noun_agreement,determiner_noun_agreement_with_adj_irregular_1,True,True,False,True,36,-57.40375518798828,-57.69910430908203,1
Diana cured those standing alumni.,Diana cured those standing alumnus.,morphology,determiner_noun_agreement,determiner_noun_agreement_with_adj_irregular_1,True,True,False,True,37,-57.83893966674805,-56.666526794433594,0
Ronald discussed that nice man.,Ronald discussed that nice men.,morphology,determiner_noun_agreement,determiner_noun_agreement_with_adj_irregular_1,True,True,False,True,38,-45.659576416015625,-46.460838317871094,1
Tonya won't buy that brown oasis.,Tonya won't buy that brown oases.,morphology,determiner_noun_agreement,determiner_noun_agreement_with_adj_irregular_1,True,True,False,True,39,-51.75492858886719,-53.95967102050781,1
Marie argued about that good synopsis.,Marie argued about that good synopses.,morphology,determiner_noun_agreement,determiner_noun_agreement_with_adj_irregular_1,True,True,False,True,40,-47.42581558227539,-55.319374084472656,1
Bradley wasn't skated around that out in the open oasis.,Bradley wasn't skated around that out in the open oases.,morphology,determiner_noun_agreement,determiner_noun_agreement_with_adj_irregular_1,True,True,False,True,41,-74.44297790527344,-77.29859924316406,1
Jacqueline wasn't finding that hidden man.,Jacqueline wasn't finding that hidden men.,morphology,determiner_noun_agreement,determiner_noun_agreement_with_adj_irregular_1,True,True,False,True,42,-61.97950744628906,-63.11561584472656,1
Most commentaries hadn't impressed those clever men.,Most commentaries hadn't impressed those clever man.,morphology,determiner_noun_agreement,determiner_noun_agreement_with_adj_irregular_1,True,True,False,True,43,-67.09810638427734,-69.1396713256836,1
Bruce has worked with this lost child.,Bruce has worked with this lost children.,morphology,determiner_noun_agreement,determiner_noun_agreement_with_adj_irregular_1,True,True,False,True,44,-38.65830993652344,-39.17168426513672,1
Karla exits these orange oases.,Karla exits these orange oasis.,morphology,determiner_noun_agreement,determiner_noun_agreement_with_adj_irregular_1,True,True,False,True,45,-54.81583786010742,-52.69427490234375,0
Joseph doesn't sound like these hard theses.,Joseph doesn't sound like these hard thesis.,morphology,determiner_noun_agreement,determiner_noun_agreement_with_adj_irregular_1,True,True,False,True,46,-52.312557220458984,-48.654449462890625,0
Martha had talked to that out in the open person.,Martha had talked to that out in the open people.,morphology,determiner_noun_agreement,determiner_noun_agreement_with_adj_irregular_1,True,True,False,True,47,-63.813385009765625,-64.129150390625,1
The vase impresses that excited woman.,The vase impresses that excited women.,morphology,determiner_noun_agreement,determiner_noun_agreement_with_adj_irregular_1,True,True,False,True,48,-54.656394958496094,-53.736968994140625,0
Kevin cleans this purple foot.,Kevin cleans this purple feet.,morphology,determiner_noun_agreement,determiner_noun_agreement_with_adj_irregular_1,True,True,False,True,49,-41.7880859375,-42.703636169433594,1
Sheila could observe this big woman.,Sheila could observe this big women.,morphology,determiner_noun_agreement,determiner_noun_agreement_with_adj_irregular_1,True,True,False,True,50,-46.248291015625,-49.35419845581055,1
Lisa hugs that young man.,Lisa hugs that young men.,morphology,determiner_noun_agreement,determiner_noun_agreement_with_adj_irregular_1,True,True,False,True,51,-32.11457824707031,-30.59636116027832,0
This waitress explores these black oases.,This waitress explores these black oasis.,morphology,determiner_noun_agreement,determiner_noun_agreement_with_adj_irregular_1,True,True,False,True,52,-53.86244201660156,-52.28322982788086,0
Janet boasts about that fast person.,Janet boasts about that fast people.,morphology,determiner_noun_agreement,determiner_noun_agreement_with_adj_irregular_1,True,True,False,True,53,-56.164485931396484,-54.23954772949219,0
Scott won't confuse these big people.,Scott won't confuse these big person.,morphology,determiner_noun_agreement,determiner_noun_agreement_with_adj_irregular_1,True,True,False,True,54,-36.348487854003906,-41.26116180419922,1
The movie theater was impressing that sick woman.,The movie theater was impressing that sick women.,morphology,determiner_noun_agreement,determiner_noun_agreement_with_adj_irregular_1,True,True,False,True,55,-58.098304748535156,-57.27423095703125,0
Every carriage hadn't annoyed this sick alumnus.,Every carriage hadn't annoyed this sick alumni.,morphology,determiner_noun_agreement,determiner_noun_agreement_with_adj_irregular_1,True,True,False,True,56,-71.32172393798828,-70.45514678955078,0
Ronald hadn't discussed those scared people.,Ronald hadn't discussed those scared person.,morphology,determiner_noun_agreement,determiner_noun_agreement_with_adj_irregular_1,True,True,False,True,57,-55.8623046875,-61.70720672607422,1
This hair upsets this determined alumnus.,This hair upsets this determined alumni.,morphology,determiner_noun_agreement,determiner_noun_agreement_with_adj_irregular_1,True,True,False,True,58,-57.19633483886719,-55.7584228515625,0
Some men have lifted those exposed lice.,Some men have lifted those exposed louse.,morphology,determiner_noun_agreement,determiner_noun_agreement_with_adj_irregular_1,True,True,False,True,59,-60.157711029052734,-62.034156799316406,1
Matt was criticizing that smart man.,Matt was criticizing that smart men.,morphology,determiner_noun_agreement,determiner_noun_agreement_with_adj_irregular_1,True,True,False,True,60,-41.10182189941406,-41.077640533447266,0
Karen didn't buy this blue nucleus.,Karen didn't buy this blue nuclei.,morphology,determiner_noun_agreement,determiner_noun_agreement_with_adj_irregular_1,True,True,False,True,61,-55.86973190307617,-56.41899108886719,1
Deanna might dislike this good analysis.,Deanna might dislike this good analyses.,morphology,determiner_noun_agreement,determiner_noun_agreement_with_adj_irregular_1,True,True,False,True,62,-50.210235595703125,-55.226802825927734,1
Helen approached this busy woman.,Helen approached this busy women.,morphology,determiner_noun_agreement,determiner_noun_agreement_with_adj_irregular_1,True,True,False,True,63,-40.480262756347656,-44.4327507019043,1
Florence wasn't approaching this unconvinced woman.,Florence wasn't approaching this unconvinced women.,morphology,determiner_noun_agreement,determiner_noun_agreement_with_adj_irregular_1,True,True,False,True,64,-68.09008026123047,-70.2272720336914,1
Rachelle can't appreciate those good synopses.,Rachelle can't appreciate those good synopsis.,morphology,determiner_noun_agreement,determiner_noun_agreement_with_adj_irregular_1,True,True,False,True,65,-59.063011169433594,-52.26908874511719,0
Jennifer hadn't thought about these out in the open octopi.,Jennifer hadn't thought about these out in the open octopus.,morphology,determiner_noun_agreement,determiner_noun_agreement_with_adj_irregular_1,True,True,False,True,66,-72.8516845703125,-62.83684539794922,0
Larry described these delighted children.,Larry described these delighted child.,morphology,determiner_noun_agreement,determiner_noun_agreement_with_adj_irregular_1,True,True,False,True,67,-38.31573486328125,-42.800819396972656,1
Many ladies arrive at that black oasis.,Many ladies arrive at that black oases.,morphology,determiner_noun_agreement,determiner_noun_agreement_with_adj_irregular_1,True,True,False,True,68,-50.460540771484375,-54.54261779785156,1
Sally admires those fast women.,Sally admires those fast woman.,morphology,determiner_noun_agreement,determiner_noun_agreement_with_adj_irregular_1,True,True,False,True,69,-47.60448455810547,-48.89292907714844,1
Leslie wouldn't investigate that sick woman.,Leslie wouldn't investigate that sick women.,morphology,determiner_noun_agreement,determiner_noun_agreement_with_adj_irregular_1,True,True,False,True,70,-54.60060501098633,-54.42882537841797,0
All essays did hurt that exposed person.,All essays did hurt that exposed people.,morphology,determiner_noun_agreement,determiner_noun_agreement_with_adj_irregular_1,True,True,False,True,71,-59.524147033691406,-56.19794464111328,0
Guy wouldn't sell that hard oasis.,Guy wouldn't sell that hard oases.,morphology,determiner_noun_agreement,determiner_noun_agreement_with_adj_irregular_1,True,True,False,True,72,-47.386009216308594,-49.5139045715332,1
Some woman hated that clever man.,Some woman hated that clever men.,morphology,determiner_noun_agreement,determiner_noun_agreement_with_adj_irregular_1,True,True,False,True,73,-46.46934509277344,-46.578521728515625,1
Amelia walks through this red oasis.,Amelia walks through this red oases.,morphology,determiner_noun_agreement,determiner_noun_agreement_with_adj_irregular_1,True,True,False,True,74,-49.93223190307617,-52.23419952392578,1
Susan did clean these yellow stimuli.,Susan did clean these yellow stimulus.,morphology,determiner_noun_agreement,determiner_noun_agreement_with_adj_irregular_1,True,True,False,True,75,-47.19776153564453,-49.160240173339844,1
Kristen observed that hopeful woman.,Kristen observed that hopeful women.,morphology,determiner_noun_agreement,determiner_noun_agreement_with_adj_irregular_1,True,True,False,True,76,-42.10520553588867,-42.686912536621094,1
Claire was messing up this small foot.,Claire was messing up this small feet.,morphology,determiner_noun_agreement,determiner_noun_agreement_with_adj_irregular_1,True,True,False,True,77,-52.14543533325195,-52.59992218017578,1
Some waiter hires that unemployed child.,Some waiter hires that unemployed children.,morphology,determiner_noun_agreement,determiner_noun_agreement_with_adj_irregular_1,True,True,False,True,78,-54.30562973022461,-48.21010208129883,0
Diana isn't running around that orange oasis.,Diana isn't running around that orange oases.,morphology,determiner_noun_agreement,determiner_noun_agreement_with_adj_irregular_1,True,True,False,True,79,-64.10699462890625,-67.3008804321289,1
This closet hasn't scared that lucky child.,This closet hasn't scared that lucky children.,morphology,determiner_noun_agreement,determiner_noun_agreement_with_adj_irregular_1,True,True,False,True,80,-61.07749557495117,-59.970394134521484,0
That doctor had hugged that confident woman.,That doctor had hugged that confident women.,morphology,determiner_noun_agreement,determiner_noun_agreement_with_adj_irregular_1,True,True,False,True,81,-53.74853515625,-56.690818786621094,1
The waitresses research those red theses.,The waitresses research those red thesis.,morphology,determiner_noun_agreement,determiner_noun_agreement_with_adj_irregular_1,True,True,False,True,82,-67.18072509765625,-63.622642517089844,0
Many bananas confuse these displeased women.,Many bananas confuse these displeased woman.,morphology,determiner_noun_agreement,determiner_noun_agreement_with_adj_irregular_1,True,True,False,True,83,-54.228172302246094,-57.55413818359375,1
Committees loved this red thesis.,Committees loved this red theses.,morphology,determiner_noun_agreement,determiner_noun_agreement_with_adj_irregular_1,True,True,False,True,84,-51.84901428222656,-59.96424102783203,1
Deborah observes that lost alumnus.,Deborah observes that lost alumni.,morphology,determiner_noun_agreement,determiner_noun_agreement_with_adj_irregular_1,True,True,False,True,85,-51.32151794433594,-49.87876892089844,0
Marla could break those whole feet.,Marla could break those whole foot.,morphology,determiner_noun_agreement,determiner_noun_agreement_with_adj_irregular_1,True,True,False,True,86,-48.83515167236328,-51.452003479003906,1
Regina alarmed these standing alumni.,Regina alarmed these standing alumnus.,morphology,determiner_noun_agreement,determiner_noun_agreement_with_adj_irregular_1,True,True,False,True,87,-54.847015380859375,-56.40653991699219,1
Kristen cures this scared child.,Kristen cures this scared children.,morphology,determiner_noun_agreement,determiner_noun_agreement_with_adj_irregular_1,True,True,False,True,88,-44.69499206542969,-43.09876251220703,0
All screens astound these unlucky people.,All screens astound these unlucky person.,morphology,determiner_noun_agreement,determiner_noun_agreement_with_adj_irregular_1,True,True,False,True,89,-57.3271484375,-62.369110107421875,1
Curtis knew these confident men.,Curtis knew these confident man.,morphology,determiner_noun_agreement,determiner_noun_agreement_with_adj_irregular_1,True,True,False,True,90,-54.972721099853516,-56.83940505981445,1
Some lakes confused this unlucky woman.,Some lakes confused this unlucky women.,morphology,determiner_noun_agreement,determiner_noun_agreement_with_adj_irregular_1,True,True,False,True,91,-55.49516296386719,-58.81047058105469,1
Most men lift these blue fungi.,Most men lift these blue fungus.,morphology,determiner_noun_agreement,determiner_noun_agreement_with_adj_irregular_1,True,True,False,True,92,-48.131736755371094,-48.29682922363281,1
Kendra kissed those happy alumni.,Kendra kissed those happy alumnus.,morphology,determiner_noun_agreement,determiner_noun_agreement_with_adj_irregular_1,True,True,False,True,93,-51.45243453979492,-54.159080505371094,1
Most cakes did distract this unsure child.,Most cakes did distract this unsure children.,morphology,determiner_noun_agreement,determiner_noun_agreement_with_adj_irregular_1,True,True,False,True,94,-63.35198974609375,-64.03912353515625,1
Katherine runs around that hard oasis.,Katherine runs around that hard oases.,morphology,determiner_noun_agreement,determiner_noun_agreement_with_adj_irregular_1,True,True,False,True,95,-53.37433624267578,-57.925636291503906,1
The Impressionists pass those black oases.,The Impressionists pass those black oasis.,morphology,determiner_noun_agreement,determiner_noun_agreement_with_adj_irregular_1,True,True,False,True,96,-55.8729362487793,-54.44123077392578,0
Andrea hadn't insulted this good woman.,Andrea hadn't insulted this good women.,morphology,determiner_noun_agreement,determiner_noun_agreement_with_adj_irregular_1,True,True,False,True,97,-57.118534088134766,-59.844852447509766,1
Beth will like these happy men.,Beth will like these happy man.,morphology,determiner_noun_agreement,determiner_noun_agreement_with_adj_irregular_1,True,True,False,True,98,-45.29689025878906,-49.076759338378906,1
Clyde broke that new foot.,Clyde broke that new feet.,morphology,determiner_noun_agreement,determiner_noun_agreement_with_adj_irregular_1,True,True,False,True,99,-53.79648208618164,-55.24767303466797,1
Bradley was watching these unsure men.,Bradley was watching these unsure man.,morphology,determiner_noun_agreement,determiner_noun_agreement_with_adj_irregular_1,True,True,False,True,100,-52.22844314575195,-52.569007873535156,1
The Clintons watch this confident man.,The Clintons watch this confident men.,morphology,determiner_noun_agreement,determiner_noun_agreement_with_adj_irregular_1,True,True,False,True,101,-46.23635482788086,-49.07221984863281,1
Debra had explored those gray oases.,Debra had explored those gray oasis.,morphology,determiner_noun_agreement,determiner_noun_agreement_with_adj_irregular_1,True,True,False,True,102,-56.33810806274414,-55.1405143737793,0
Homer was driving to this smooth oasis.,Homer was driving to this smooth oases.,morphology,determiner_noun_agreement,determiner_noun_agreement_with_adj_irregular_1,True,True,False,True,103,-60.19883728027344,-63.12451171875,1
Some girl left that sick woman.,Some girl left that sick women.,morphology,determiner_noun_agreement,determiner_noun_agreement_with_adj_irregular_1,True,True,False,True,104,-42.49566650390625,-43.858848571777344,1
Those cafes confuse this old man.,Those cafes confuse this old men.,morphology,determiner_noun_agreement,determiner_noun_agreement_with_adj_irregular_1,True,True,False,True,105,-47.200103759765625,-51.43526840209961,1
Vanessa wasn't driving to that green oasis.,Vanessa wasn't driving to that green oases.,morphology,determiner_noun_agreement,determiner_noun_agreement_with_adj_irregular_1,True,True,False,True,106,-61.352447509765625,-64.8001708984375,1
Nicole has referenced these long analyses.,Nicole has referenced these long analysis.,morphology,determiner_noun_agreement,determiner_noun_agreement_with_adj_irregular_1,True,True,False,True,107,-52.39861297607422,-52.78060531616211,1
Irene doesn't bore those hopeful women.,Irene doesn't bore those hopeful woman.,morphology,determiner_noun_agreement,determiner_noun_agreement_with_adj_irregular_1,True,True,False,True,108,-61.65854263305664,-64.76776123046875,1
Colleen didn't scare this old woman.,Colleen didn't scare this old women.,morphology,determiner_noun_agreement,determiner_noun_agreement_with_adj_irregular_1,True,True,False,True,109,-47.3192138671875,-53.00702667236328,1
Most sketches have looked like this green louse.,Most sketches have looked like this green lice.,morphology,determiner_noun_agreement,determiner_noun_agreement_with_adj_irregular_1,True,True,False,True,110,-60.84984588623047,-61.54667282104492,1
Sonia can't hug those hopeful children.,Sonia can't hug those hopeful child.,morphology,determiner_noun_agreement,determiner_noun_agreement_with_adj_irregular_1,True,True,False,True,111,-59.03502655029297,-63.08638000488281,1
Helen had shocked these hopeful children.,Helen had shocked these hopeful child.,morphology,determiner_noun_agreement,determiner_noun_agreement_with_adj_irregular_1,True,True,False,True,112,-50.96759796142578,-54.55952453613281,1
