sentence_good,sentence_bad,field,linguistics_term,UID,simple_LM_method,one_prefix_method,two_prefix_method,lexically_identical,pair_id,good_prob,bad_prob,correct
Matt investigates that a lot of boys hate Jason.,Matt investigates who a lot of boys hate Jason.,syntax,filler_gap_dependency,wh_vs_that_no_gap,True,False,False,False,764,-59.37459182739258,-64.6748275756836,1
Alexander figured out that the senators are observing Carolyn.,Alexander figured out who the senators are observing Carolyn.,syntax,filler_gap_dependency,wh_vs_that_no_gap,True,False,False,False,765,-61.19367980957031,-65.2588119506836,1
Sabrina reveals that the banks embarrass Renee.,Sabrina reveals who the banks embarrass Renee.,syntax,filler_gap_dependency,wh_vs_that_no_gap,True,False,False,False,766,-63.578941345214844,-68.268798828125,1
Denise is finding out that some offspring hadn't approached Alice.,Denise is finding out who some offspring hadn't approached Alice.,syntax,filler_gap_dependency,wh_vs_that_no_gap,True,False,False,False,767,-78.64625549316406,-79.67183685302734,1
Alice had learned that this museum appreciates Regina.,Alice had learned who this museum appreciates Regina.,syntax,filler_gap_dependency,wh_vs_that_no_gap,True,False,False,False,768,-55.93028259277344,-64.81404113769531,1
Russell wasn't remembering that actresses cleaned a horse.,Russell wasn't remembering what actresses cleaned a horse.,syntax,filler_gap_dependency,wh_vs_that_no_gap,True,False,False,False,769,-63.8385009765625,-64.10572814941406,1
Some senator hasn't known that that child doesn't walk through some mountain.,Some senator hasn't known what that child doesn't walk through some mountain.,syntax,filler_gap_dependency,wh_vs_that_no_gap,True,False,False,False,770,-80.61251068115234,-80.03626251220703,0
A lot of committees investigate that a lot of children aren't listening to Meredith.,A lot of committees investigate who a lot of children aren't listening to Meredith.,syntax,filler_gap_dependency,wh_vs_that_no_gap,True,False,False,False,771,-84.08706665039062,-87.9814453125,1
Ann was forgetting that this person would scare every dancer.,Ann was forgetting who this person would scare every dancer.,syntax,filler_gap_dependency,wh_vs_that_no_gap,True,False,False,False,772,-61.76551818847656,-67.31168365478516,1
The guests learn that the brochures don't shock Brenda.,The guests learn who the brochures don't shock Brenda.,syntax,filler_gap_dependency,wh_vs_that_no_gap,True,False,False,False,773,-75.2792739868164,-83.11480712890625,1
Carlos can find out that some nose bores Emily.,Carlos can find out who some nose bores Emily.,syntax,filler_gap_dependency,wh_vs_that_no_gap,True,False,False,False,774,-72.9932861328125,-74.44815063476562,1
Jesus is forgetting that those drivers are walking through that bank.,Jesus is forgetting what those drivers are walking through that bank.,syntax,filler_gap_dependency,wh_vs_that_no_gap,True,False,False,False,775,-62.75245666503906,-64.66880798339844,1
Many boys realize that most people do watch Becky.,Many boys realize who most people do watch Becky.,syntax,filler_gap_dependency,wh_vs_that_no_gap,True,False,False,False,776,-56.59344482421875,-65.08084869384766,1
Becky realized that a man could go to this hospital.,Becky realized what a man could go to this hospital.,syntax,filler_gap_dependency,wh_vs_that_no_gap,True,False,False,False,777,-50.71196365356445,-53.819419860839844,1
That guest found out that girls climb up most ladders.,That guest found out what girls climb up most ladders.,syntax,filler_gap_dependency,wh_vs_that_no_gap,True,False,False,False,778,-67.5751724243164,-70.16354370117188,1
Sarah is remembering that the legislature helps Rebecca.,Sarah is remembering who the legislature helps Rebecca.,syntax,filler_gap_dependency,wh_vs_that_no_gap,True,False,False,False,779,-58.48752975463867,-62.352867126464844,1
William is forgetting that every boy passes every library.,William is forgetting what every boy passes every library.,syntax,filler_gap_dependency,wh_vs_that_no_gap,True,False,False,False,780,-58.95517349243164,-62.189598083496094,1
A museum doesn't conceal that every senator is referencing Donna.,A museum doesn't conceal who every senator is referencing Donna.,syntax,filler_gap_dependency,wh_vs_that_no_gap,True,False,False,False,781,-79.60584259033203,-86.24827575683594,1
Dawn is finding out that some dog couldn't find the apple.,Dawn is finding out what some dog couldn't find the apple.,syntax,filler_gap_dependency,wh_vs_that_no_gap,True,False,False,False,782,-73.64939880371094,-73.22273254394531,0
Those ladies forget that a dancer lifts ladders.,Those ladies forget what a dancer lifts ladders.,syntax,filler_gap_dependency,wh_vs_that_no_gap,True,False,False,False,783,-63.02943420410156,-62.65876388549805,0
These senators don't discover that many teachers drop by some hospitals.,These senators don't discover what many teachers drop by some hospitals.,syntax,filler_gap_dependency,wh_vs_that_no_gap,True,False,False,False,784,-78.13153076171875,-79.32157135009766,1
The museums figure out that most pedestrians will lift a lot of glasses.,The museums figure out what most pedestrians will lift a lot of glasses.,syntax,filler_gap_dependency,wh_vs_that_no_gap,True,False,False,False,785,-78.34344482421875,-79.52433776855469,1
A lot of waitresses realize that the adults have boycotted the Lutherans.,A lot of waitresses realize who the adults have boycotted the Lutherans.,syntax,filler_gap_dependency,wh_vs_that_no_gap,True,False,False,False,786,-108.76606750488281,-116.86073303222656,1
Sarah isn't learning that every girl hadn't fled from Lisa.,Sarah isn't learning who every girl hadn't fled from Lisa.,syntax,filler_gap_dependency,wh_vs_that_no_gap,True,False,False,False,787,-67.08312225341797,-74.54137420654297,1
Ladies remember that that woman had complained about Homer.,Ladies remember who that woman had complained about Homer.,syntax,filler_gap_dependency,wh_vs_that_no_gap,True,False,False,False,788,-64.47477722167969,-69.328369140625,1
Every person doesn't reveal that the alumnus escapes from all malls.,Every person doesn't reveal what the alumnus escapes from all malls.,syntax,filler_gap_dependency,wh_vs_that_no_gap,True,False,False,False,789,-78.29237365722656,-78.70829772949219,1
Renee had revealed that some student climbed up many hills.,Renee had revealed what some student climbed up many hills.,syntax,filler_gap_dependency,wh_vs_that_no_gap,True,False,False,False,790,-68.08358001708984,-74.08522033691406,1
Those dancers investigated that that dancer can't skate around the Great Lakes.,Those dancers investigated what that dancer can't skate around the Great Lakes.,syntax,filler_gap_dependency,wh_vs_that_no_gap,True,False,False,False,791,-86.46572875976562,-87.90193939208984,1
William has known that some doctor referenced Alicia.,William has known who some doctor referenced Alicia.,syntax,filler_gap_dependency,wh_vs_that_no_gap,True,False,False,False,792,-56.48157501220703,-62.268455505371094,1
A lot of men reveal that a man noticed most sweaters.,A lot of men reveal what a man noticed most sweaters.,syntax,filler_gap_dependency,wh_vs_that_no_gap,True,False,False,False,793,-62.984004974365234,-64.29020690917969,1
James is remembering that all students have those art galleries.,James is remembering what all students have those art galleries.,syntax,filler_gap_dependency,wh_vs_that_no_gap,True,False,False,False,794,-55.8206901550293,-59.42729187011719,1
Nicole won't remember that a woman hadn't walked through the public parks.,Nicole won't remember what a woman hadn't walked through the public parks.,syntax,filler_gap_dependency,wh_vs_that_no_gap,True,False,False,False,795,-74.71721649169922,-76.04802703857422,1
A lot of people discover that that library references Sheila.,A lot of people discover who that library references Sheila.,syntax,filler_gap_dependency,wh_vs_that_no_gap,True,False,False,False,796,-68.08724975585938,-70.35858917236328,1
Stephen found out that all senators won't research a photograph.,Stephen found out what all senators won't research a photograph.,syntax,filler_gap_dependency,wh_vs_that_no_gap,True,False,False,False,797,-68.13996887207031,-73.66348266601562,1
These actresses figure out that all cashiers hadn't respected Martin.,These actresses figure out who all cashiers hadn't respected Martin.,syntax,filler_gap_dependency,wh_vs_that_no_gap,True,False,False,False,798,-85.77550506591797,-87.90870666503906,1
Carl conceals that a dancer had worn this shawl.,Carl conceals what a dancer had worn this shawl.,syntax,filler_gap_dependency,wh_vs_that_no_gap,True,False,False,False,799,-70.0052490234375,-72.17192077636719,1
Caroline hadn't found out that some adult scanned a lot of books.,Caroline hadn't found out what some adult scanned a lot of books.,syntax,filler_gap_dependency,wh_vs_that_no_gap,True,False,False,False,800,-79.58526611328125,-81.0478744506836,1
The Impressionists realize that this chair doesn't impress Kendra.,The Impressionists realize who this chair doesn't impress Kendra.,syntax,filler_gap_dependency,wh_vs_that_no_gap,True,False,False,False,801,-76.37901306152344,-84.38874053955078,1
The museums discover that some dancers kiss Patrick.,The museums discover who some dancers kiss Patrick.,syntax,filler_gap_dependency,wh_vs_that_no_gap,True,False,False,False,802,-69.13630676269531,-73.56793212890625,1
Meredith reveals that the patient would boast about every teenager.,Meredith reveals who the patient would boast about every teenager.,syntax,filler_gap_dependency,wh_vs_that_no_gap,True,False,False,False,803,-66.13455200195312,-73.22825622558594,1
Victoria does figure out that some women praise Carla.,Victoria does figure out who some women praise Carla.,syntax,filler_gap_dependency,wh_vs_that_no_gap,True,False,False,False,804,-61.29814529418945,-63.57514572143555,1
That patient discovered that the hill bothered Kenneth.,That patient discovered who the hill bothered Kenneth.,syntax,filler_gap_dependency,wh_vs_that_no_gap,True,False,False,False,805,-69.98980712890625,-78.17001342773438,1
Grace has investigated that the committee will boast about all senators.,Grace has investigated who the committee will boast about all senators.,syntax,filler_gap_dependency,wh_vs_that_no_gap,True,False,False,False,806,-72.07477569580078,-78.92752075195312,1
Patricia reveals that those children sell every bird.,Patricia reveals what those children sell every bird.,syntax,filler_gap_dependency,wh_vs_that_no_gap,True,False,False,False,807,-62.44622039794922,-65.23432922363281,1
Alicia wasn't remembering that some girl boasted about Kimberley.,Alicia wasn't remembering who some girl boasted about Kimberley.,syntax,filler_gap_dependency,wh_vs_that_no_gap,True,False,False,False,808,-81.19586944580078,-85.88241577148438,1
Melanie finds out that a student can't visit those closets.,Melanie finds out what a student can't visit those closets.,syntax,filler_gap_dependency,wh_vs_that_no_gap,True,False,False,False,809,-74.32402038574219,-74.61490631103516,1
Todd shouldn't forget that these students couldn't bike to some hill.,Todd shouldn't forget what these students couldn't bike to some hill.,syntax,filler_gap_dependency,wh_vs_that_no_gap,True,False,False,False,810,-77.4951171875,-79.2613525390625,1
Pedestrians conceal that some ice irritates Heather.,Pedestrians conceal who some ice irritates Heather.,syntax,filler_gap_dependency,wh_vs_that_no_gap,True,False,False,False,811,-77.93431091308594,-83.15052795410156,1
Catherine investigates that this waitress can reveal Heidi.,Catherine investigates who this waitress can reveal Heidi.,syntax,filler_gap_dependency,wh_vs_that_no_gap,True,False,False,False,812,-77.77569580078125,-82.77229309082031,1
Galileo will remember that many theses shocked Wendy.,Galileo will remember who many theses shocked Wendy.,syntax,filler_gap_dependency,wh_vs_that_no_gap,True,False,False,False,813,-84.85907745361328,-89.0088882446289,1
Patrick found out that all guys boast about Angela.,Patrick found out who all guys boast about Angela.,syntax,filler_gap_dependency,wh_vs_that_no_gap,True,False,False,False,814,-55.4079704284668,-59.50950241088867,1
All adults forget that that library had admired Colleen.,All adults forget who that library had admired Colleen.,syntax,filler_gap_dependency,wh_vs_that_no_gap,True,False,False,False,815,-75.73674011230469,-80.32855224609375,1
Some museum won't remember that a cashier should go to a mountain.,Some museum won't remember what a cashier should go to a mountain.,syntax,filler_gap_dependency,wh_vs_that_no_gap,True,False,False,False,816,-72.04045104980469,-71.44119262695312,0
A museum figures out that that customer couldn't admire these books.,A museum figures out what that customer couldn't admire these books.,syntax,filler_gap_dependency,wh_vs_that_no_gap,True,False,False,False,817,-80.88390350341797,-80.46184539794922,0
Dana was investigating that the museum impressed Clyde.,Dana was investigating who the museum impressed Clyde.,syntax,filler_gap_dependency,wh_vs_that_no_gap,True,False,False,False,818,-67.14879608154297,-73.67729187011719,1
Sherry concealed that most ladies escaped from Stacey.,Sherry concealed who most ladies escaped from Stacey.,syntax,filler_gap_dependency,wh_vs_that_no_gap,True,False,False,False,819,-74.43113708496094,-79.23390197753906,1
A lot of teachers discover that a lot of steps astounded Brenda.,A lot of teachers discover who a lot of steps astounded Brenda.,syntax,filler_gap_dependency,wh_vs_that_no_gap,True,False,False,False,820,-74.9722900390625,-78.91980743408203,1
The Clintons figure out that these doctors returned to Randolf.,The Clintons figure out who these doctors returned to Randolf.,syntax,filler_gap_dependency,wh_vs_that_no_gap,True,False,False,False,821,-76.78770446777344,-80.36595153808594,1
Randolf realized that a carriage is stunning Heidi.,Randolf realized who a carriage is stunning Heidi.,syntax,filler_gap_dependency,wh_vs_that_no_gap,True,False,False,False,822,-69.75376892089844,-79.43894958496094,1
Some person can discover that this fish finds that ice cream.,Some person can discover what this fish finds that ice cream.,syntax,filler_gap_dependency,wh_vs_that_no_gap,True,False,False,False,823,-64.7247543334961,-64.09615325927734,0
Bruce realizes that the man could fire Gregory.,Bruce realizes who the man could fire Gregory.,syntax,filler_gap_dependency,wh_vs_that_no_gap,True,False,False,False,824,-52.51689910888672,-59.57255554199219,1
Bethany would reveal that some students could heal the Impressionists.,Bethany would reveal who some students could heal the Impressionists.,syntax,filler_gap_dependency,wh_vs_that_no_gap,True,False,False,False,825,-81.84980010986328,-86.2133560180664,1
A lot of men figure out that every student appreciates Michael.,A lot of men figure out who every student appreciates Michael.,syntax,filler_gap_dependency,wh_vs_that_no_gap,True,False,False,False,826,-62.85832214355469,-65.02166748046875,1
Rodney can't conceal that schools worry Wayne.,Rodney can't conceal who schools worry Wayne.,syntax,filler_gap_dependency,wh_vs_that_no_gap,True,False,False,False,827,-80.0743637084961,-81.30296325683594,1
Cindy can know that boys broke dishes.,Cindy can know what boys broke dishes.,syntax,filler_gap_dependency,wh_vs_that_no_gap,True,False,False,False,828,-69.20487213134766,-68.41087341308594,0
Carrie does investigate that some dancer wore every hat.,Carrie does investigate what some dancer wore every hat.,syntax,filler_gap_dependency,wh_vs_that_no_gap,True,False,False,False,829,-75.85240173339844,-77.46248626708984,1
Teresa knows that most children can't leave Danielle.,Teresa knows who most children can't leave Danielle.,syntax,filler_gap_dependency,wh_vs_that_no_gap,True,False,False,False,830,-60.24600601196289,-65.95466613769531,1
The dancers figure out that many theses praised Chad.,The dancers figure out who many theses praised Chad.,syntax,filler_gap_dependency,wh_vs_that_no_gap,True,False,False,False,831,-75.90550231933594,-78.47513580322266,1
The Clintons know that a lot of rugs resemble the paintings.,The Clintons know what a lot of rugs resemble the paintings.,syntax,filler_gap_dependency,wh_vs_that_no_gap,True,False,False,False,832,-63.469566345214844,-66.89164733886719,1
Those patients find out that every candle had confused these banks.,Those patients find out what every candle had confused these banks.,syntax,filler_gap_dependency,wh_vs_that_no_gap,True,False,False,False,833,-76.20419311523438,-76.35795593261719,1
Stacey revealed that this actor would find every hospital.,Stacey revealed what this actor would find every hospital.,syntax,filler_gap_dependency,wh_vs_that_no_gap,True,False,False,False,834,-68.19499206542969,-71.85983276367188,1
Some student has realized that a lot of boys hire Donna.,Some student has realized who a lot of boys hire Donna.,syntax,filler_gap_dependency,wh_vs_that_no_gap,True,False,False,False,835,-63.1837043762207,-72.569091796875,1
Bradley shouldn't know that those teenagers couldn't see Brian.,Bradley shouldn't know who those teenagers couldn't see Brian.,syntax,filler_gap_dependency,wh_vs_that_no_gap,True,False,False,False,836,-68.95502471923828,-70.1885986328125,1
Some bank hasn't revealed that an actor breaks some cup.,Some bank hasn't revealed what an actor breaks some cup.,syntax,filler_gap_dependency,wh_vs_that_no_gap,True,False,False,False,837,-72.66079711914062,-74.13015747070312,1
Thomas figures out that every guest can escape from Theodore.,Thomas figures out who every guest can escape from Theodore.,syntax,filler_gap_dependency,wh_vs_that_no_gap,True,False,False,False,838,-64.74629211425781,-70.06399536132812,1
Dan realized that this student has criticized the movie theater.,Dan realized what this student has criticized the movie theater.,syntax,filler_gap_dependency,wh_vs_that_no_gap,True,False,False,False,839,-57.59178161621094,-61.82948303222656,1
Some hospital realized that a company won't know Sherry.,Some hospital realized who a company won't know Sherry.,syntax,filler_gap_dependency,wh_vs_that_no_gap,True,False,False,False,840,-65.83531188964844,-76.49816131591797,1
Many hospitals figure out that all feet couldn't bother Deanna.,Many hospitals figure out who all feet couldn't bother Deanna.,syntax,filler_gap_dependency,wh_vs_that_no_gap,True,False,False,False,841,-74.00934600830078,-77.17001342773438,1
The Clintons concealed that this dog would break chairs.,The Clintons concealed what this dog would break chairs.,syntax,filler_gap_dependency,wh_vs_that_no_gap,True,False,False,False,842,-71.7363510131836,-74.31741333007812,1
Many ladies did remember that this actor had discovered Candice.,Many ladies did remember who this actor had discovered Candice.,syntax,filler_gap_dependency,wh_vs_that_no_gap,True,False,False,False,843,-70.15560150146484,-74.78163146972656,1
These customers figure out that some pedestrians care for Steven.,These customers figure out who some pedestrians care for Steven.,syntax,filler_gap_dependency,wh_vs_that_no_gap,True,False,False,False,844,-69.30311584472656,-72.22650146484375,1
Phillip hadn't found out that actors didn't listen to Brad.,Phillip hadn't found out who actors didn't listen to Brad.,syntax,filler_gap_dependency,wh_vs_that_no_gap,True,False,False,False,845,-67.3004150390625,-69.74069213867188,1
Theresa wouldn't realize that that carriage hadn't worried Scott.,Theresa wouldn't realize who that carriage hadn't worried Scott.,syntax,filler_gap_dependency,wh_vs_that_no_gap,True,False,False,False,846,-87.21852111816406,-90.76886749267578,1
Many committees find out that all doctors research this essay.,Many committees find out what all doctors research this essay.,syntax,filler_gap_dependency,wh_vs_that_no_gap,True,False,False,False,847,-68.1812744140625,-68.30961608886719,1
The Impressionists know that some casserole hadn't scared some organization.,The Impressionists know what some casserole hadn't scared some organization.,syntax,filler_gap_dependency,wh_vs_that_no_gap,True,False,False,False,848,-88.97225189208984,-90.62532043457031,1
Kimberley does figure out that many drivers hadn't approached a lot of women.,Kimberley does figure out who many drivers hadn't approached a lot of women.,syntax,filler_gap_dependency,wh_vs_that_no_gap,True,False,False,False,849,-88.75729370117188,-90.27215576171875,1
That library isn't realizing that dogs look like a photograph.,That library isn't realizing what dogs look like a photograph.,syntax,filler_gap_dependency,wh_vs_that_no_gap,True,False,False,False,850,-62.34864044189453,-61.17127990722656,0
An adult does remember that a lot of senators shocked Karla.,An adult does remember who a lot of senators shocked Karla.,syntax,filler_gap_dependency,wh_vs_that_no_gap,True,False,False,False,851,-79.88389587402344,-85.92640686035156,1
Monica discovers that that guest might escape from Ellen.,Monica discovers who that guest might escape from Ellen.,syntax,filler_gap_dependency,wh_vs_that_no_gap,True,False,False,False,852,-72.3400650024414,-76.9620590209961,1
Clyde conceals that some senators hadn't cured Eric.,Clyde conceals who some senators hadn't cured Eric.,syntax,filler_gap_dependency,wh_vs_that_no_gap,True,False,False,False,853,-88.69413757324219,-93.5958023071289,1
Dan figured out that all pedestrians haven't gone to a lot of schools.,Dan figured out what all pedestrians haven't gone to a lot of schools.,syntax,filler_gap_dependency,wh_vs_that_no_gap,True,False,False,False,854,-67.85181427001953,-71.23690795898438,1
William wasn't forgetting that the actresses couldn't disturb Amelia.,William wasn't forgetting who the actresses couldn't disturb Amelia.,syntax,filler_gap_dependency,wh_vs_that_no_gap,True,False,False,False,855,-67.88832092285156,-72.14851379394531,1
That committee wasn't realizing that the child notices Tina.,That committee wasn't realizing who the child notices Tina.,syntax,filler_gap_dependency,wh_vs_that_no_gap,True,False,False,False,856,-69.69278717041016,-73.90199279785156,1
Dawn wasn't figuring out that these pedestrians drive to the cafe.,Dawn wasn't figuring out what these pedestrians drive to the cafe.,syntax,filler_gap_dependency,wh_vs_that_no_gap,True,False,False,False,857,-76.68705749511719,-75.05081176757812,0
These people knew that the photograph couldn't look like that dog.,These people knew what the photograph couldn't look like that dog.,syntax,filler_gap_dependency,wh_vs_that_no_gap,True,False,False,False,858,-61.35032272338867,-64.09394836425781,1
Carolyn will investigate that many boys hadn't worn this blouse.,Carolyn will investigate what many boys hadn't worn this blouse.,syntax,filler_gap_dependency,wh_vs_that_no_gap,True,False,False,False,859,-80.47357177734375,-81.6795425415039,1
A student knows that the teacher didn't talk about some waiter.,A student knows who the teacher didn't talk about some waiter.,syntax,filler_gap_dependency,wh_vs_that_no_gap,True,False,False,False,860,-62.94200897216797,-68.49662017822266,1
Most banks remember that many teachers can't like that mountain.,Most banks remember what many teachers can't like that mountain.,syntax,filler_gap_dependency,wh_vs_that_no_gap,True,False,False,False,861,-74.43927001953125,-77.8844985961914,1
Many dancers figure out that sheep had climbed down some stairs.,Many dancers figure out what sheep had climbed down some stairs.,syntax,filler_gap_dependency,wh_vs_that_no_gap,True,False,False,False,862,-68.78845977783203,-67.50870513916016,0
April hadn't learned that all windows did irritate Michael.,April hadn't learned who all windows did irritate Michael.,syntax,filler_gap_dependency,wh_vs_that_no_gap,True,False,False,False,863,-75.66692352294922,-83.50286865234375,1
Sarah remembered that most students skate around this bank.,Sarah remembered what most students skate around this bank.,syntax,filler_gap_dependency,wh_vs_that_no_gap,True,False,False,False,864,-59.98225402832031,-63.183799743652344,1
Some library might remember that that boy praises April.,Some library might remember who that boy praises April.,syntax,filler_gap_dependency,wh_vs_that_no_gap,True,False,False,False,865,-69.10997009277344,-72.33979797363281,1
The Impressionists reveal that that student was walking through the art gallery.,The Impressionists reveal what that student was walking through the art gallery.,syntax,filler_gap_dependency,wh_vs_that_no_gap,True,False,False,False,866,-74.14022827148438,-74.66363525390625,1
Gary can remember that many pedestrians didn't observe Kimberley.,Gary can remember who many pedestrians didn't observe Kimberley.,syntax,filler_gap_dependency,wh_vs_that_no_gap,True,False,False,False,867,-63.44761276245117,-67.19768524169922,1
These adults knew that some man investigates Donna.,These adults knew who some man investigates Donna.,syntax,filler_gap_dependency,wh_vs_that_no_gap,True,False,False,False,868,-62.53582000732422,-68.60883331298828,1
Harvard University isn't forgetting that all teenagers are fixing some glass.,Harvard University isn't forgetting what all teenagers are fixing some glass.,syntax,filler_gap_dependency,wh_vs_that_no_gap,True,False,False,False,869,-82.8823013305664,-85.96212768554688,1
Denise found out that that customer hasn't discovered the pepper.,Denise found out what that customer hasn't discovered the pepper.,syntax,filler_gap_dependency,wh_vs_that_no_gap,True,False,False,False,870,-76.35823059082031,-76.4007797241211,1
Tina reveals that this guy had researched this committee.,Tina reveals what this guy had researched this committee.,syntax,filler_gap_dependency,wh_vs_that_no_gap,True,False,False,False,871,-61.510162353515625,-63.52427673339844,1
Many libraries weren't revealing that every senator healed Dana.,Many libraries weren't revealing who every senator healed Dana.,syntax,filler_gap_dependency,wh_vs_that_no_gap,True,False,False,False,872,-78.13560485839844,-82.8104248046875,1
