sentence_good,sentence_bad,field,linguistics_term,UID,simple_LM_method,one_prefix_method,two_prefix_method,lexically_identical,pair_id,good_prob,bad_prob,correct
Cashiers disagreed with these concealed people.,Cashiers disagreed with these concealed person.,morphology,determiner_noun_agreement,determiner_noun_agreement_with_adj_irregular_1,True,True,False,True,448,-51.901466369628906,-54.89982223510742,1
Denise noticed that red nucleus.,Denise noticed that red nuclei.,morphology,determiner_noun_agreement,determiner_noun_agreement_with_adj_irregular_1,True,True,False,True,449,-48.511444091796875,-48.85402297973633,1
Thomas was exploring those orange oases.,Thomas was exploring those orange oasis.,morphology,determiner_noun_agreement,determiner_noun_agreement_with_adj_irregular_1,True,True,False,True,450,-51.81529235839844,-46.55988311767578,0
Alexander could exit those smooth oases.,Alexander could exit those smooth oasis.,morphology,determiner_noun_agreement,determiner_noun_agreement_with_adj_irregular_1,True,True,False,True,451,-57.11601257324219,-53.1546630859375,0
Most schools are describing this long analysis.,Most schools are describing this long analyses.,morphology,determiner_noun_agreement,determiner_noun_agreement_with_adj_irregular_1,True,True,False,True,452,-47.150569915771484,-49.221580505371094,1
Martin described those bad analyses.,Martin described those bad analysis.,morphology,determiner_noun_agreement,determiner_noun_agreement_with_adj_irregular_1,True,True,False,True,453,-38.51495361328125,-36.89054489135742,0
Joel has boycotted these smooth oases.,Joel has boycotted these smooth oasis.,morphology,determiner_noun_agreement,determiner_noun_agreement_with_adj_irregular_1,True,True,False,True,454,-80.90614318847656,-76.45952606201172,0
Jerry discovers these out in the open geese.,Jerry discovers these out in the open goose.,morphology,determiner_noun_agreement,determiner_noun_agreement_with_adj_irregular_1,True,True,False,True,455,-57.17401123046875,-54.86840057373047,0
Stacy drove to this white oasis.,Stacy drove to this white oases.,morphology,determiner_noun_agreement,determiner_noun_agreement_with_adj_irregular_1,True,True,False,True,456,-52.422691345214844,-58.47145080566406,1
Maria hadn't admired that gray goose.,Maria hadn't admired that gray geese.,morphology,determiner_noun_agreement,determiner_noun_agreement_with_adj_irregular_1,True,True,False,True,457,-52.81520080566406,-54.58917999267578,1
Gerald describes those good analyses.,Gerald describes those good analysis.,morphology,determiner_noun_agreement,determiner_noun_agreement_with_adj_irregular_1,True,True,False,True,458,-49.69422912597656,-49.22052764892578,0
Becky doesn't argue about those determined alumni.,Becky doesn't argue about those determined alumnus.,morphology,determiner_noun_agreement,determiner_noun_agreement_with_adj_irregular_1,True,True,False,True,459,-60.19214630126953,-61.60533905029297,1
Kayla isn't breaking those small teeth.,Kayla isn't breaking those small tooth.,morphology,determiner_noun_agreement,determiner_noun_agreement_with_adj_irregular_1,True,True,False,True,460,-53.38186264038086,-56.41762924194336,1
Wayne broke that purple tooth.,Wayne broke that purple teeth.,morphology,determiner_noun_agreement,determiner_noun_agreement_with_adj_irregular_1,True,True,False,True,461,-48.56895446777344,-49.02329635620117,1
Randolf had run around those blue oases.,Randolf had run around those blue oasis.,morphology,determiner_noun_agreement,determiner_noun_agreement_with_adj_irregular_1,True,True,False,True,462,-65.57156372070312,-62.227420806884766,0
Monet hadn't concealed that content alumnus.,Monet hadn't concealed that content alumni.,morphology,determiner_noun_agreement,determiner_noun_agreement_with_adj_irregular_1,True,True,False,True,463,-66.48211669921875,-64.97822570800781,0
Kirsten irritated those happy alumni.,Kirsten irritated those happy alumnus.,morphology,determiner_noun_agreement,determiner_noun_agreement_with_adj_irregular_1,True,True,False,True,464,-62.82497024536133,-63.70256805419922,1
The teenager approached that fast child.,The teenager approached that fast children.,morphology,determiner_noun_agreement,determiner_noun_agreement_with_adj_irregular_1,True,True,False,True,465,-49.8730354309082,-50.05152893066406,1
Tracy kissed this unconvinced woman.,Tracy kissed this unconvinced women.,morphology,determiner_noun_agreement,determiner_noun_agreement_with_adj_irregular_1,True,True,False,True,466,-58.47795867919922,-57.88674545288086,0
Most associations argued about those long analyses.,Most associations argued about those long analysis.,morphology,determiner_noun_agreement,determiner_noun_agreement_with_adj_irregular_1,True,True,False,True,467,-54.0888557434082,-54.153656005859375,1
The waiters discover that brown stimulus.,The waiters discover that brown stimuli.,morphology,determiner_noun_agreement,determiner_noun_agreement_with_adj_irregular_1,True,True,False,True,468,-59.01702880859375,-58.684356689453125,0
Brett talks to these young women.,Brett talks to these young woman.,morphology,determiner_noun_agreement,determiner_noun_agreement_with_adj_irregular_1,True,True,False,True,469,-46.063011169433594,-50.630367279052734,1
Some popsicle scares those content children.,Some popsicle scares those content child.,morphology,determiner_noun_agreement,determiner_noun_agreement_with_adj_irregular_1,True,True,False,True,470,-62.20120620727539,-62.67816925048828,1
Women find that hidden mouse.,Women find that hidden mice.,morphology,determiner_noun_agreement,determiner_noun_agreement_with_adj_irregular_1,True,True,False,True,471,-36.00515365600586,-35.84367370605469,0
Those pedestrians return to these nice children.,Those pedestrians return to these nice child.,morphology,determiner_noun_agreement,determiner_noun_agreement_with_adj_irregular_1,True,True,False,True,472,-49.01799774169922,-52.196353912353516,1
Jodi scans those bad synopses.,Jodi scans those bad synopsis.,morphology,determiner_noun_agreement,determiner_noun_agreement_with_adj_irregular_1,True,True,False,True,473,-61.91539764404297,-52.16557312011719,0
Ellen is leaving that busy woman.,Ellen is leaving that busy women.,morphology,determiner_noun_agreement,determiner_noun_agreement_with_adj_irregular_1,True,True,False,True,474,-50.13609313964844,-48.941505432128906,0
Peter had known these big men.,Peter had known these big man.,morphology,determiner_noun_agreement,determiner_noun_agreement_with_adj_irregular_1,True,True,False,True,475,-37.984764099121094,-39.43552780151367,1
Brett is thinking about those gray cacti.,Brett is thinking about those gray cactus.,morphology,determiner_noun_agreement,determiner_noun_agreement_with_adj_irregular_1,True,True,False,True,476,-68.2004165649414,-60.68341064453125,0
The Lutherans heal these ill geese.,The Lutherans heal these ill goose.,morphology,determiner_noun_agreement,determiner_noun_agreement_with_adj_irregular_1,True,True,False,True,477,-64.71739196777344,-62.70320510864258,0
Lissa might sound like that good child.,Lissa might sound like that good children.,morphology,determiner_noun_agreement,determiner_noun_agreement_with_adj_irregular_1,True,True,False,True,478,-51.4163818359375,-53.086204528808594,1
Most mouths might stun those busy children.,Most mouths might stun those busy child.,morphology,determiner_noun_agreement,determiner_noun_agreement_with_adj_irregular_1,True,True,False,True,479,-54.573280334472656,-57.113746643066406,1
Kayla has that orange axis.,Kayla has that orange axes.,morphology,determiner_noun_agreement,determiner_noun_agreement_with_adj_irregular_1,True,True,False,True,480,-44.724998474121094,-46.40312194824219,1
Cynthia doesn't heal that clever man.,Cynthia doesn't heal that clever men.,morphology,determiner_noun_agreement,determiner_noun_agreement_with_adj_irregular_1,True,True,False,True,481,-60.35315704345703,-61.01241683959961,1
Homer returns to that exposed man.,Homer returns to that exposed men.,morphology,determiner_noun_agreement,determiner_noun_agreement_with_adj_irregular_1,True,True,False,True,482,-50.97148132324219,-51.19328689575195,1
People remember those uncertain people.,People remember those uncertain person.,morphology,determiner_noun_agreement,determiner_noun_agreement_with_adj_irregular_1,True,True,False,True,483,-36.39351272583008,-39.846641540527344,1
Theodore hasn't broken those concealed feet.,Theodore hasn't broken those concealed foot.,morphology,determiner_noun_agreement,determiner_noun_agreement_with_adj_irregular_1,True,True,False,True,484,-59.315208435058594,-61.34755325317383,1
Tonya had disturbed that popular man.,Tonya had disturbed that popular men.,morphology,determiner_noun_agreement,determiner_noun_agreement_with_adj_irregular_1,True,True,False,True,485,-47.84422302246094,-48.4080810546875,1
This customer couldn't pass that black oasis.,This customer couldn't pass that black oases.,morphology,determiner_noun_agreement,determiner_noun_agreement_with_adj_irregular_1,True,True,False,True,486,-58.56969451904297,-60.90238952636719,1
William hides that exposed stimulus.,William hides that exposed stimuli.,morphology,determiner_noun_agreement,determiner_noun_agreement_with_adj_irregular_1,True,True,False,True,487,-42.88526153564453,-39.174903869628906,0
Ruth exits that big oasis.,Ruth exits that big oases.,morphology,determiner_noun_agreement,determiner_noun_agreement_with_adj_irregular_1,True,True,False,True,488,-54.41209411621094,-59.05042266845703,1
Judy can discover that red mouse.,Judy can discover that red mice.,morphology,determiner_noun_agreement,determiner_noun_agreement_with_adj_irregular_1,True,True,False,True,489,-49.822052001953125,-50.262367248535156,1
Candice didn't stun that serious alumnus.,Candice didn't stun that serious alumni.,morphology,determiner_noun_agreement,determiner_noun_agreement_with_adj_irregular_1,True,True,False,True,490,-62.11743927001953,-64.38134765625,1
Jodi hadn't visited these green oases.,Jodi hadn't visited these green oasis.,morphology,determiner_noun_agreement,determiner_noun_agreement_with_adj_irregular_1,True,True,False,True,491,-62.83184051513672,-58.286277770996094,0
Rose doesn't hate these bad analyses.,Rose doesn't hate these bad analysis.,morphology,determiner_noun_agreement,determiner_noun_agreement_with_adj_irregular_1,True,True,False,True,492,-45.524330139160156,-43.780418395996094,0
These men can help that lost alumnus.,These men can help that lost alumni.,morphology,determiner_noun_agreement,determiner_noun_agreement_with_adj_irregular_1,True,True,False,True,493,-51.34027099609375,-51.120269775390625,0
Thomas hadn't arrived at those red oases.,Thomas hadn't arrived at those red oasis.,morphology,determiner_noun_agreement,determiner_noun_agreement_with_adj_irregular_1,True,True,False,True,494,-55.97599411010742,-51.4210205078125,0
A lot of companies remembered this unlucky alumnus.,A lot of companies remembered this unlucky alumni.,morphology,determiner_noun_agreement,determiner_noun_agreement_with_adj_irregular_1,True,True,False,True,495,-58.75932693481445,-56.79911422729492,0
Women fire these content women.,Women fire these content woman.,morphology,determiner_noun_agreement,determiner_noun_agreement_with_adj_irregular_1,True,True,False,True,496,-43.280250549316406,-45.625099182128906,1
George will remember those good synopses.,George will remember those good synopsis.,morphology,determiner_noun_agreement,determiner_noun_agreement_with_adj_irregular_1,True,True,False,True,497,-56.52116394042969,-47.31424331665039,0
The glacier wasn't embarrassing those unlucky people.,The glacier wasn't embarrassing those unlucky person.,morphology,determiner_noun_agreement,determiner_noun_agreement_with_adj_irregular_1,True,True,False,True,498,-59.649169921875,-63.44866180419922,1
Guy visits that happy woman.,Guy visits that happy women.,morphology,determiner_noun_agreement,determiner_noun_agreement_with_adj_irregular_1,True,True,False,True,499,-37.75971984863281,-37.62846374511719,0
Steven investigates this employed person.,Steven investigates this employed people.,morphology,determiner_noun_agreement,determiner_noun_agreement_with_adj_irregular_1,True,True,False,True,500,-40.598602294921875,-41.39457321166992,1
John didn't conceal those young men.,John didn't conceal those young man.,morphology,determiner_noun_agreement,determiner_noun_agreement_with_adj_irregular_1,True,True,False,True,501,-43.109840393066406,-44.41027069091797,1
Martin hadn't gone to that gray oasis.,Martin hadn't gone to that gray oases.,morphology,determiner_noun_agreement,determiner_noun_agreement_with_adj_irregular_1,True,True,False,True,502,-51.86968994140625,-56.683448791503906,1
The cashiers weren't breaking these brown feet.,The cashiers weren't breaking these brown foot.,morphology,determiner_noun_agreement,determiner_noun_agreement_with_adj_irregular_1,True,True,False,True,503,-59.71913146972656,-62.66033935546875,1
The pedestrians might complain about this small oasis.,The pedestrians might complain about this small oases.,morphology,determiner_noun_agreement,determiner_noun_agreement_with_adj_irregular_1,True,True,False,True,504,-52.92559051513672,-59.08869552612305,1
Tamara won't bike to those exposed oases.,Tamara won't bike to those exposed oasis.,morphology,determiner_noun_agreement,determiner_noun_agreement_with_adj_irregular_1,True,True,False,True,505,-73.98133850097656,-69.04402160644531,0
Jennifer does discuss those purple oases.,Jennifer does discuss those purple oasis.,morphology,determiner_noun_agreement,determiner_noun_agreement_with_adj_irregular_1,True,True,False,True,506,-55.785099029541016,-52.61698913574219,0
Naomi does investigate those clever people.,Naomi does investigate those clever person.,morphology,determiner_noun_agreement,determiner_noun_agreement_with_adj_irregular_1,True,True,False,True,507,-54.871299743652344,-57.681617736816406,1
Beverly wasn't hiding this blue mouse.,Beverly wasn't hiding this blue mice.,morphology,determiner_noun_agreement,determiner_noun_agreement_with_adj_irregular_1,True,True,False,True,508,-58.7826042175293,-60.737342834472656,1
Every sketch astounds that hidden child.,Every sketch astounds that hidden children.,morphology,determiner_noun_agreement,determiner_noun_agreement_with_adj_irregular_1,True,True,False,True,509,-62.027957916259766,-59.57422637939453,0
Christine talks to that determined child.,Christine talks to that determined children.,morphology,determiner_noun_agreement,determiner_noun_agreement_with_adj_irregular_1,True,True,False,True,510,-52.06847381591797,-50.469139099121094,0
Jesus can hire that smart man.,Jesus can hire that smart men.,morphology,determiner_noun_agreement,determiner_noun_agreement_with_adj_irregular_1,True,True,False,True,511,-41.940528869628906,-44.475807189941406,1
These drivers kiss this exposed alumnus.,These drivers kiss this exposed alumni.,morphology,determiner_noun_agreement,determiner_noun_agreement_with_adj_irregular_1,True,True,False,True,512,-55.890113830566406,-56.554561614990234,1
Diane respected those unemployed alumni.,Diane respected those unemployed alumnus.,morphology,determiner_noun_agreement,determiner_noun_agreement_with_adj_irregular_1,True,True,False,True,513,-55.45939636230469,-58.42678451538086,1
Theodore hasn't argued about these unsure people.,Theodore hasn't argued about these unsure person.,morphology,determiner_noun_agreement,determiner_noun_agreement_with_adj_irregular_1,True,True,False,True,514,-64.41989135742188,-68.15151977539062,1
Nina reveals these red theses.,Nina reveals these red thesis.,morphology,determiner_noun_agreement,determiner_noun_agreement_with_adj_irregular_1,True,True,False,True,515,-54.1790885925293,-49.166969299316406,0
Meredith complains about those popular women.,Meredith complains about those popular woman.,morphology,determiner_noun_agreement,determiner_noun_agreement_with_adj_irregular_1,True,True,False,True,516,-48.181739807128906,-52.25944137573242,1
That government hadn't discussed these good synopses.,That government hadn't discussed these good synopsis.,morphology,determiner_noun_agreement,determiner_noun_agreement_with_adj_irregular_1,True,True,False,True,517,-69.52421569824219,-57.7518196105957,0
Colleen had broken that big tooth.,Colleen had broken that big teeth.,morphology,determiner_noun_agreement,determiner_noun_agreement_with_adj_irregular_1,True,True,False,True,518,-47.588592529296875,-46.334571838378906,0
Catherine was revealing that exposed tooth.,Catherine was revealing that exposed teeth.,morphology,determiner_noun_agreement,determiner_noun_agreement_with_adj_irregular_1,True,True,False,True,519,-53.520362854003906,-53.193538665771484,0
A lot of actresses are skated around these purple oases.,A lot of actresses are skated around these purple oasis.,morphology,determiner_noun_agreement,determiner_noun_agreement_with_adj_irregular_1,True,True,False,True,520,-80.23005676269531,-75.48873901367188,0
Most pedestrians criticize these bad men.,Most pedestrians criticize these bad man.,morphology,determiner_noun_agreement,determiner_noun_agreement_with_adj_irregular_1,True,True,False,True,521,-45.96644592285156,-46.09931564331055,1
John hadn't scared that clever man.,John hadn't scared that clever men.,morphology,determiner_noun_agreement,determiner_noun_agreement_with_adj_irregular_1,True,True,False,True,522,-48.074405670166016,-50.67932891845703,1
Julia has astounded that nice child.,Julia has astounded that nice children.,morphology,determiner_noun_agreement,determiner_noun_agreement_with_adj_irregular_1,True,True,False,True,523,-54.700721740722656,-55.109771728515625,1
Laurie has dropped by those cheap oases.,Laurie has dropped by those cheap oasis.,morphology,determiner_noun_agreement,determiner_noun_agreement_with_adj_irregular_1,True,True,False,True,524,-65.03970336914062,-60.937469482421875,0
Rose wouldn't bike to those small oases.,Rose wouldn't bike to those small oasis.,morphology,determiner_noun_agreement,determiner_noun_agreement_with_adj_irregular_1,True,True,False,True,525,-61.336402893066406,-57.25809860229492,0
Holly did observe that unconvinced person.,Holly did observe that unconvinced people.,morphology,determiner_noun_agreement,determiner_noun_agreement_with_adj_irregular_1,True,True,False,True,526,-64.46439361572266,-63.34980773925781,0
Stacy isn't healing this big child.,Stacy isn't healing this big children.,morphology,determiner_noun_agreement,determiner_noun_agreement_with_adj_irregular_1,True,True,False,True,527,-54.321800231933594,-57.66497802734375,1
Every actor complains about this small thesis.,Every actor complains about this small theses.,morphology,determiner_noun_agreement,determiner_noun_agreement_with_adj_irregular_1,True,True,False,True,528,-46.784671783447266,-55.436763763427734,1
Some teacher dislikes this determined alumnus.,Some teacher dislikes this determined alumni.,morphology,determiner_noun_agreement,determiner_noun_agreement_with_adj_irregular_1,True,True,False,True,529,-57.3315315246582,-55.12940979003906,0
This driver remembers that scared woman.,This driver remembers that scared women.,morphology,determiner_noun_agreement,determiner_noun_agreement_with_adj_irregular_1,True,True,False,True,530,-45.948326110839844,-47.3554801940918,1
Thomas hadn't aggravated that fast man.,Thomas hadn't aggravated that fast men.,morphology,determiner_noun_agreement,determiner_noun_agreement_with_adj_irregular_1,True,True,False,True,531,-49.56504821777344,-51.963722229003906,1
Tracy messed up those orange feet.,Tracy messed up those orange foot.,morphology,determiner_noun_agreement,determiner_noun_agreement_with_adj_irregular_1,True,True,False,True,532,-48.581626892089844,-50.67057418823242,1
Matt hasn't bothered those employed men.,Matt hasn't bothered those employed man.,morphology,determiner_noun_agreement,determiner_noun_agreement_with_adj_irregular_1,True,True,False,True,533,-51.25830841064453,-51.639892578125,1
Sharon isn't criticizing those standing children.,Sharon isn't criticizing those standing child.,morphology,determiner_noun_agreement,determiner_noun_agreement_with_adj_irregular_1,True,True,False,True,534,-58.587303161621094,-60.2095947265625,1
Noah admired this hard louse.,Noah admired this hard lice.,morphology,determiner_noun_agreement,determiner_noun_agreement_with_adj_irregular_1,True,True,False,True,535,-58.06250762939453,-56.698951721191406,0
The popsicle confuses this concealed child.,The popsicle confuses this concealed children.,morphology,determiner_noun_agreement,determiner_noun_agreement_with_adj_irregular_1,True,True,False,True,536,-59.06292724609375,-59.759483337402344,1
That apple worried those important people.,That apple worried those important person.,morphology,determiner_noun_agreement,determiner_noun_agreement_with_adj_irregular_1,True,True,False,True,537,-51.06840133666992,-54.73039245605469,1
Robert couldn't like those old feet.,Robert couldn't like those old foot.,morphology,determiner_noun_agreement,determiner_noun_agreement_with_adj_irregular_1,True,True,False,True,538,-41.48869323730469,-44.61353302001953,1
All legislatures help those lucky children.,All legislatures help those lucky child.,morphology,determiner_noun_agreement,determiner_noun_agreement_with_adj_irregular_1,True,True,False,True,539,-48.8568115234375,-52.99106979370117,1
This spinach wasn't scaring that exposed child.,This spinach wasn't scaring that exposed children.,morphology,determiner_noun_agreement,determiner_noun_agreement_with_adj_irregular_1,True,True,False,True,540,-68.141845703125,-66.62660217285156,0
The teenager returned to those black oases.,The teenager returned to those black oasis.,morphology,determiner_noun_agreement,determiner_noun_agreement_with_adj_irregular_1,True,True,False,True,541,-54.21137619018555,-50.319217681884766,0
Jill is hiring this small man.,Jill is hiring this small men.,morphology,determiner_noun_agreement,determiner_noun_agreement_with_adj_irregular_1,True,True,False,True,542,-46.784095764160156,-49.37776565551758,1
Jeffrey hasn't watched those clever alumni.,Jeffrey hasn't watched those clever alumnus.,morphology,determiner_noun_agreement,determiner_noun_agreement_with_adj_irregular_1,True,True,False,True,543,-58.341896057128906,-60.956817626953125,1
Danielle helps that happy person.,Danielle helps that happy people.,morphology,determiner_noun_agreement,determiner_noun_agreement_with_adj_irregular_1,True,True,False,True,544,-43.50725173950195,-42.735599517822266,0
The Borgias escape from that troubled woman.,The Borgias escape from that troubled women.,morphology,determiner_noun_agreement,determiner_noun_agreement_with_adj_irregular_1,True,True,False,True,545,-60.623165130615234,-59.70709228515625,0
The Borgias wouldn't break that smooth tooth.,The Borgias wouldn't break that smooth teeth.,morphology,determiner_noun_agreement,determiner_noun_agreement_with_adj_irregular_1,True,True,False,True,546,-72.73622131347656,-71.31788635253906,0
Most waiters conceal those smart men.,Most waiters conceal those smart man.,morphology,determiner_noun_agreement,determiner_noun_agreement_with_adj_irregular_1,True,True,False,True,547,-58.67521667480469,-59.39488983154297,1
Kathleen couldn't talk about these good analyses.,Kathleen couldn't talk about these good analysis.,morphology,determiner_noun_agreement,determiner_noun_agreement_with_adj_irregular_1,True,True,False,True,548,-60.542091369628906,-58.775604248046875,0
Veronica hadn't noticed those lost lice.,Veronica hadn't noticed those lost louse.,morphology,determiner_noun_agreement,determiner_noun_agreement_with_adj_irregular_1,True,True,False,True,549,-63.776397705078125,-68.06022644042969,1
Rachel had found those hard cacti.,Rachel had found those hard cactus.,morphology,determiner_noun_agreement,determiner_noun_agreement_with_adj_irregular_1,True,True,False,True,550,-50.5025634765625,-43.58650588989258,0
Denise sounds like that confident person.,Denise sounds like that confident people.,morphology,determiner_noun_agreement,determiner_noun_agreement_with_adj_irregular_1,True,True,False,True,551,-48.69172668457031,-48.9471321105957,1
Many mouths stunned this nice person.,Many mouths stunned this nice people.,morphology,determiner_noun_agreement,determiner_noun_agreement_with_adj_irregular_1,True,True,False,True,552,-51.23970413208008,-53.15675354003906,1
Most adults love these content women.,Most adults love these content woman.,morphology,determiner_noun_agreement,determiner_noun_agreement_with_adj_irregular_1,True,True,False,True,553,-44.50914764404297,-46.823089599609375,1
Donald is hurting these unemployed people.,Donald is hurting these unemployed person.,morphology,determiner_noun_agreement,determiner_noun_agreement_with_adj_irregular_1,True,True,False,True,554,-37.64748001098633,-39.77574157714844,1
Those students reference those smart people.,Those students reference those smart person.,morphology,determiner_noun_agreement,determiner_noun_agreement_with_adj_irregular_1,True,True,False,True,555,-48.9332275390625,-51.3245849609375,1
Jerry shouldn't listen to those serious alumni.,Jerry shouldn't listen to those serious alumnus.,morphology,determiner_noun_agreement,determiner_noun_agreement_with_adj_irregular_1,True,True,False,True,556,-49.27953338623047,-51.430580139160156,1
Many dancers skate around these smooth oases.,Many dancers skate around these smooth oasis.,morphology,determiner_noun_agreement,determiner_noun_agreement_with_adj_irregular_1,True,True,False,True,557,-62.97101974487305,-60.25535583496094,0
Judy liked this determined man.,Judy liked this determined men.,morphology,determiner_noun_agreement,determiner_noun_agreement_with_adj_irregular_1,True,True,False,True,558,-40.358985900878906,-43.38187789916992,1
