sentence_good,sentence_bad,field,linguistics_term,UID,simple_LM_method,one_prefix_method,two_prefix_method,lexically_identical,pair_id,good_prob,bad_prob,correct
Sketches upset these fast alumni.,Sketches upset these fast alumnus.,morphology,determiner_noun_agreement,determiner_noun_agreement_with_adj_irregular_1,True,True,False,True,670,-60.18157958984375,-62.32560729980469,1
Derek can't care for this employed child.,Derek can't care for this employed children.,morphology,determiner_noun_agreement,determiner_noun_agreement_with_adj_irregular_1,True,True,False,True,671,-55.09660720825195,-56.05078887939453,1
Lissa wasn't driving to that white oasis.,Lissa wasn't driving to that white oases.,morphology,determiner_noun_agreement,determiner_noun_agreement_with_adj_irregular_1,True,True,False,True,672,-66.75601196289062,-71.18257141113281,1
The customers have exited this old oasis.,The customers have exited this old oases.,morphology,determiner_noun_agreement,determiner_noun_agreement_with_adj_irregular_1,True,True,False,True,673,-50.624610900878906,-56.09907913208008,1
Guy was leaving this confident child.,Guy was leaving this confident children.,morphology,determiner_noun_agreement,determiner_noun_agreement_with_adj_irregular_1,True,True,False,True,674,-41.05270767211914,-42.555023193359375,1
Keith goes to this rough oasis.,Keith goes to this rough oases.,morphology,determiner_noun_agreement,determiner_noun_agreement_with_adj_irregular_1,True,True,False,True,675,-40.34969711303711,-45.611961364746094,1
Most cashiers complain about those old men.,Most cashiers complain about those old man.,morphology,determiner_noun_agreement,determiner_noun_agreement_with_adj_irregular_1,True,True,False,True,676,-48.62034606933594,-48.105865478515625,0
Vincent shouldn't scare that busy person.,Vincent shouldn't scare that busy people.,morphology,determiner_noun_agreement,determiner_noun_agreement_with_adj_irregular_1,True,True,False,True,677,-57.82789611816406,-56.113075256347656,0
Beth hugged that nice child.,Beth hugged that nice children.,morphology,determiner_noun_agreement,determiner_noun_agreement_with_adj_irregular_1,True,True,False,True,678,-53.47793960571289,-53.24982452392578,0
Guy shouldn't praise these smart people.,Guy shouldn't praise these smart person.,morphology,determiner_noun_agreement,determiner_noun_agreement_with_adj_irregular_1,True,True,False,True,679,-45.69305419921875,-50.91604232788086,1
Florence sells these small feet.,Florence sells these small foot.,morphology,determiner_noun_agreement,determiner_noun_agreement_with_adj_irregular_1,True,True,False,True,680,-48.59007263183594,-50.993099212646484,1
Walter didn't know this out in the open woman.,Walter didn't know this out in the open women.,morphology,determiner_noun_agreement,determiner_noun_agreement_with_adj_irregular_1,True,True,False,True,681,-57.178504943847656,-56.788490295410156,0
Barbara has messed up those broken teeth.,Barbara has messed up those broken tooth.,morphology,determiner_noun_agreement,determiner_noun_agreement_with_adj_irregular_1,True,True,False,True,682,-53.695762634277344,-57.54353332519531,1
Carl will help these busy men.,Carl will help these busy man.,morphology,determiner_noun_agreement,determiner_noun_agreement_with_adj_irregular_1,True,True,False,True,683,-40.28854751586914,-42.1947135925293,1
This guest could hire these nice men.,This guest could hire these nice man.,morphology,determiner_noun_agreement,determiner_noun_agreement_with_adj_irregular_1,True,True,False,True,684,-51.612335205078125,-52.58787536621094,1
Rodney wasn't bothering this small alumnus.,Rodney wasn't bothering this small alumni.,morphology,determiner_noun_agreement,determiner_noun_agreement_with_adj_irregular_1,True,True,False,True,685,-60.95429992675781,-61.988502502441406,1
These students break these messy teeth.,These students break these messy tooth.,morphology,determiner_noun_agreement,determiner_noun_agreement_with_adj_irregular_1,True,True,False,True,686,-42.54545211791992,-46.919830322265625,1
April wasn't biking to those hard oases.,April wasn't biking to those hard oasis.,morphology,determiner_noun_agreement,determiner_noun_agreement_with_adj_irregular_1,True,True,False,True,687,-63.492469787597656,-59.575531005859375,0
Stephanie hated those fast alumni.,Stephanie hated those fast alumnus.,morphology,determiner_noun_agreement,determiner_noun_agreement_with_adj_irregular_1,True,True,False,True,688,-59.01670837402344,-60.167171478271484,1
Dawn has disturbed these ill men.,Dawn has disturbed these ill man.,morphology,determiner_noun_agreement,determiner_noun_agreement_with_adj_irregular_1,True,True,False,True,689,-53.47370147705078,-54.064735412597656,1
Chad questioned this unsure child.,Chad questioned this unsure children.,morphology,determiner_noun_agreement,determiner_noun_agreement_with_adj_irregular_1,True,True,False,True,690,-51.017784118652344,-53.203094482421875,1
That shirt disgusted this busy woman.,That shirt disgusted this busy women.,morphology,determiner_noun_agreement,determiner_noun_agreement_with_adj_irregular_1,True,True,False,True,691,-49.55845260620117,-51.801700592041016,1
Daniel has toured that red oasis.,Daniel has toured that red oases.,morphology,determiner_noun_agreement,determiner_noun_agreement_with_adj_irregular_1,True,True,False,True,692,-48.37944030761719,-53.72492218017578,1
Joel finds those hidden men.,Joel finds those hidden man.,morphology,determiner_noun_agreement,determiner_noun_agreement_with_adj_irregular_1,True,True,False,True,693,-46.38294982910156,-47.281005859375,1
Some adult did arrive at that old oasis.,Some adult did arrive at that old oases.,morphology,determiner_noun_agreement,determiner_noun_agreement_with_adj_irregular_1,True,True,False,True,694,-57.3620491027832,-61.49137496948242,1
A lot of carriages weren't alarming that employed woman.,A lot of carriages weren't alarming that employed women.,morphology,determiner_noun_agreement,determiner_noun_agreement_with_adj_irregular_1,True,True,False,True,695,-74.83174896240234,-71.577880859375,0
Tina wasn't observing these unemployed children.,Tina wasn't observing these unemployed child.,morphology,determiner_noun_agreement,determiner_noun_agreement_with_adj_irregular_1,True,True,False,True,696,-55.59019470214844,-58.501747131347656,1
All dresses aggravate these important men.,All dresses aggravate these important man.,morphology,determiner_noun_agreement,determiner_noun_agreement_with_adj_irregular_1,True,True,False,True,697,-54.385616302490234,-56.51048278808594,1
This car had disturbed those important men.,This car had disturbed those important man.,morphology,determiner_noun_agreement,determiner_noun_agreement_with_adj_irregular_1,True,True,False,True,698,-54.00548553466797,-54.667755126953125,1
Florence will return to that confident person.,Florence will return to that confident people.,morphology,determiner_noun_agreement,determiner_noun_agreement_with_adj_irregular_1,True,True,False,True,699,-55.830528259277344,-56.003692626953125,1
Some cashiers criticized those uncertain women.,Some cashiers criticized those uncertain woman.,morphology,determiner_noun_agreement,determiner_noun_agreement_with_adj_irregular_1,True,True,False,True,700,-53.57081604003906,-56.21845245361328,1
Meredith investigated this excited child.,Meredith investigated this excited children.,morphology,determiner_noun_agreement,determiner_noun_agreement_with_adj_irregular_1,True,True,False,True,701,-50.28602600097656,-52.01177978515625,1
Sarah is concealing that busy woman.,Sarah is concealing that busy women.,morphology,determiner_noun_agreement,determiner_noun_agreement_with_adj_irregular_1,True,True,False,True,702,-47.372337341308594,-46.57999801635742,0
Janice criticizes this good analysis.,Janice criticizes this good analyses.,morphology,determiner_noun_agreement,determiner_noun_agreement_with_adj_irregular_1,True,True,False,True,703,-49.909019470214844,-55.40261459350586,1
Many guys weren't noticing this lost child.,Many guys weren't noticing this lost children.,morphology,determiner_noun_agreement,determiner_noun_agreement_with_adj_irregular_1,True,True,False,True,704,-54.26214599609375,-55.529266357421875,1
Homer can pass that concealed oasis.,Homer can pass that concealed oases.,morphology,determiner_noun_agreement,determiner_noun_agreement_with_adj_irregular_1,True,True,False,True,705,-58.04713439941406,-61.335384368896484,1
The drivers hide this concealed fungus.,The drivers hide this concealed fungi.,morphology,determiner_noun_agreement,determiner_noun_agreement_with_adj_irregular_1,True,True,False,True,706,-50.584815979003906,-51.82194519042969,1
Marla had investigated that content person.,Marla had investigated that content people.,morphology,determiner_noun_agreement,determiner_noun_agreement_with_adj_irregular_1,True,True,False,True,707,-56.34178161621094,-56.629112243652344,1
The Borgias explore this white oasis.,The Borgias explore this white oases.,morphology,determiner_noun_agreement,determiner_noun_agreement_with_adj_irregular_1,True,True,False,True,708,-58.42238235473633,-64.17680358886719,1
Heather brought this black tooth.,Heather brought this black teeth.,morphology,determiner_noun_agreement,determiner_noun_agreement_with_adj_irregular_1,True,True,False,True,709,-43.214324951171875,-45.027408599853516,1
Walter doesn't drop by those smooth oases.,Walter doesn't drop by those smooth oasis.,morphology,determiner_noun_agreement,determiner_noun_agreement_with_adj_irregular_1,True,True,False,True,710,-66.32616424560547,-63.16729736328125,0
Sharon knows this hopeful man.,Sharon knows this hopeful men.,morphology,determiner_noun_agreement,determiner_noun_agreement_with_adj_irregular_1,True,True,False,True,711,-42.35893249511719,-46.11761474609375,1
The companies irritate this ill child.,The companies irritate this ill children.,morphology,determiner_noun_agreement,determiner_noun_agreement_with_adj_irregular_1,True,True,False,True,712,-51.37074661254883,-49.92938995361328,0
Alice is noticing those orange mice.,Alice is noticing those orange mouse.,morphology,determiner_noun_agreement,determiner_noun_agreement_with_adj_irregular_1,True,True,False,True,713,-47.6530647277832,-46.81275939941406,0
Kimberley loves this nice woman.,Kimberley loves this nice women.,morphology,determiner_noun_agreement,determiner_noun_agreement_with_adj_irregular_1,True,True,False,True,714,-42.21601104736328,-45.144126892089844,1
The Borgias have examined this purple thesis.,The Borgias have examined this purple theses.,morphology,determiner_noun_agreement,determiner_noun_agreement_with_adj_irregular_1,True,True,False,True,715,-65.34361267089844,-70.762939453125,1
Douglas went to this concealed oasis.,Douglas went to this concealed oases.,morphology,determiner_noun_agreement,determiner_noun_agreement_with_adj_irregular_1,True,True,False,True,716,-55.423851013183594,-60.42592239379883,1
Ladies scan these long synopses.,Ladies scan these long synopsis.,morphology,determiner_noun_agreement,determiner_noun_agreement_with_adj_irregular_1,True,True,False,True,717,-63.13539123535156,-52.89653015136719,0
Adam can question that lost woman.,Adam can question that lost women.,morphology,determiner_noun_agreement,determiner_noun_agreement_with_adj_irregular_1,True,True,False,True,718,-44.06981658935547,-44.21955108642578,1
George fixes those purple teeth.,George fixes those purple tooth.,morphology,determiner_noun_agreement,determiner_noun_agreement_with_adj_irregular_1,True,True,False,True,719,-41.96439743041992,-44.584442138671875,1
The Clintons praise these long analyses.,The Clintons praise these long analysis.,morphology,determiner_noun_agreement,determiner_noun_agreement_with_adj_irregular_1,True,True,False,True,720,-52.94239044189453,-53.031105041503906,1
Craig shouldn't bike to these yellow oases.,Craig shouldn't bike to these yellow oasis.,morphology,determiner_noun_agreement,determiner_noun_agreement_with_adj_irregular_1,True,True,False,True,721,-64.68744659423828,-61.48981475830078,0
The child hasn't loved these good synopses.,The child hasn't loved these good synopsis.,morphology,determiner_noun_agreement,determiner_noun_agreement_with_adj_irregular_1,True,True,False,True,722,-64.08111572265625,-55.48060607910156,0
These waitresses might reference this out in the open alumnus.,These waitresses might reference this out in the open alumni.,morphology,determiner_noun_agreement,determiner_noun_agreement_with_adj_irregular_1,True,True,False,True,723,-73.8386001586914,-76.39668273925781,1
Phillip questions this young child.,Phillip questions this young children.,morphology,determiner_noun_agreement,determiner_noun_agreement_with_adj_irregular_1,True,True,False,True,724,-44.988800048828125,-46.57197189331055,1
Jodi hadn't impressed that excited woman.,Jodi hadn't impressed that excited women.,morphology,determiner_noun_agreement,determiner_noun_agreement_with_adj_irregular_1,True,True,False,True,725,-58.48078918457031,-59.00129699707031,1
Guys break those out in the open teeth.,Guys break those out in the open tooth.,morphology,determiner_noun_agreement,determiner_noun_agreement_with_adj_irregular_1,True,True,False,True,726,-54.16747283935547,-53.92131423950195,0
Joel saw these lost mice.,Joel saw these lost mouse.,morphology,determiner_noun_agreement,determiner_noun_agreement_with_adj_irregular_1,True,True,False,True,727,-46.28530502319336,-48.364112854003906,1
The Impressionists were fixing those gray teeth.,The Impressionists were fixing those gray tooth.,morphology,determiner_noun_agreement,determiner_noun_agreement_with_adj_irregular_1,True,True,False,True,728,-64.01069641113281,-66.2278060913086,1
Kristen has discussed those good analyses.,Kristen has discussed those good analysis.,morphology,determiner_noun_agreement,determiner_noun_agreement_with_adj_irregular_1,True,True,False,True,729,-46.24107360839844,-45.6596794128418,0
The girls had described those upset people.,The girls had described those upset person.,morphology,determiner_noun_agreement,determiner_noun_agreement_with_adj_irregular_1,True,True,False,True,730,-51.114463806152344,-53.06627655029297,1
Veronica approaches those small women.,Veronica approaches those small woman.,morphology,determiner_noun_agreement,determiner_noun_agreement_with_adj_irregular_1,True,True,False,True,731,-48.157867431640625,-51.2002067565918,1
Robert hugs this scared person.,Robert hugs this scared people.,morphology,determiner_noun_agreement,determiner_noun_agreement_with_adj_irregular_1,True,True,False,True,732,-38.53917694091797,-39.651695251464844,1
Mitchell had bought this concealed cactus.,Mitchell had bought this concealed cacti.,morphology,determiner_noun_agreement,determiner_noun_agreement_with_adj_irregular_1,True,True,False,True,733,-56.69391632080078,-64.51741027832031,1
A pepper shocked these displeased alumni.,A pepper shocked these displeased alumnus.,morphology,determiner_noun_agreement,determiner_noun_agreement_with_adj_irregular_1,True,True,False,True,734,-63.60182189941406,-62.70695877075195,0
Timothy walked through these new oases.,Timothy walked through these new oasis.,morphology,determiner_noun_agreement,determiner_noun_agreement_with_adj_irregular_1,True,True,False,True,735,-54.56752014160156,-49.6260986328125,0
Janice did clean these smooth teeth.,Janice did clean these smooth tooth.,morphology,determiner_noun_agreement,determiner_noun_agreement_with_adj_irregular_1,True,True,False,True,736,-52.780521392822266,-56.10334396362305,1
Andrew had approached that small man.,Andrew had approached that small men.,morphology,determiner_noun_agreement,determiner_noun_agreement_with_adj_irregular_1,True,True,False,True,737,-39.81241226196289,-40.53289794921875,1
Wendy hides these red cacti.,Wendy hides these red cactus.,morphology,determiner_noun_agreement,determiner_noun_agreement_with_adj_irregular_1,True,True,False,True,738,-57.44940948486328,-48.98622512817383,0
Leslie visits that sick man.,Leslie visits that sick men.,morphology,determiner_noun_agreement,determiner_noun_agreement_with_adj_irregular_1,True,True,False,True,739,-47.32781982421875,-48.04420471191406,1
Those girls exit this brown oasis.,Those girls exit this brown oases.,morphology,determiner_noun_agreement,determiner_noun_agreement_with_adj_irregular_1,True,True,False,True,740,-51.7017936706543,-54.839080810546875,1
Christopher liked this red nucleus.,Christopher liked this red nuclei.,morphology,determiner_noun_agreement,determiner_noun_agreement_with_adj_irregular_1,True,True,False,True,741,-37.0672607421875,-39.324058532714844,1
Florence might forget this sick woman.,Florence might forget this sick women.,morphology,determiner_noun_agreement,determiner_noun_agreement_with_adj_irregular_1,True,True,False,True,742,-53.049991607666016,-55.58216094970703,1
These ladies sell that green cactus.,These ladies sell that green cacti.,morphology,determiner_noun_agreement,determiner_noun_agreement_with_adj_irregular_1,True,True,False,True,743,-49.19983673095703,-56.96753692626953,1
A lot of blouses disgust that uncertain alumnus.,A lot of blouses disgust that uncertain alumni.,morphology,determiner_noun_agreement,determiner_noun_agreement_with_adj_irregular_1,True,True,False,True,744,-71.41282653808594,-74.07960510253906,1
Patrick had exited those hidden oases.,Patrick had exited those hidden oasis.,morphology,determiner_noun_agreement,determiner_noun_agreement_with_adj_irregular_1,True,True,False,True,745,-54.518062591552734,-50.925743103027344,0
Gina was taking this big stimulus.,Gina was taking this big stimuli.,morphology,determiner_noun_agreement,determiner_noun_agreement_with_adj_irregular_1,True,True,False,True,746,-46.17138671875,-47.62598419189453,1
A lot of pictures look like this uncertain child.,A lot of pictures look like this uncertain children.,morphology,determiner_noun_agreement,determiner_noun_agreement_with_adj_irregular_1,True,True,False,True,747,-55.6229362487793,-55.74251174926758,1
Adam passes this exposed oasis.,Adam passes this exposed oases.,morphology,determiner_noun_agreement,determiner_noun_agreement_with_adj_irregular_1,True,True,False,True,748,-43.698944091796875,-47.703468322753906,1
Some drawings shock that hidden woman.,Some drawings shock that hidden women.,morphology,determiner_noun_agreement,determiner_noun_agreement_with_adj_irregular_1,True,True,False,True,749,-54.25514221191406,-54.20545959472656,0
Nina has boycotted those small oases.,Nina has boycotted those small oasis.,morphology,determiner_noun_agreement,determiner_noun_agreement_with_adj_irregular_1,True,True,False,True,750,-78.49816131591797,-73.22262573242188,0
Bruce exits that white oasis.,Bruce exits that white oases.,morphology,determiner_noun_agreement,determiner_noun_agreement_with_adj_irregular_1,True,True,False,True,751,-43.90748596191406,-47.83125686645508,1
Mary investigated this unsure woman.,Mary investigated this unsure women.,morphology,determiner_noun_agreement,determiner_noun_agreement_with_adj_irregular_1,True,True,False,True,752,-42.802581787109375,-45.30213928222656,1
Diane criticized that bad synopsis.,Diane criticized that bad synopses.,morphology,determiner_noun_agreement,determiner_noun_agreement_with_adj_irregular_1,True,True,False,True,753,-55.40302276611328,-66.46525573730469,1
Those sketches stun this fast child.,Those sketches stun this fast children.,morphology,determiner_noun_agreement,determiner_noun_agreement_with_adj_irregular_1,True,True,False,True,754,-55.82109832763672,-56.157005310058594,1
Vanessa shouldn't observe these determined women.,Vanessa shouldn't observe these determined woman.,morphology,determiner_noun_agreement,determiner_noun_agreement_with_adj_irregular_1,True,True,False,True,755,-61.51826477050781,-63.90831756591797,1
Jill doesn't reference those clever children.,Jill doesn't reference those clever child.,morphology,determiner_noun_agreement,determiner_noun_agreement_with_adj_irregular_1,True,True,False,True,756,-60.60662841796875,-62.7205696105957,1
Every driver ran around that green oasis.,Every driver ran around that green oases.,morphology,determiner_noun_agreement,determiner_noun_agreement_with_adj_irregular_1,True,True,False,True,757,-57.52169418334961,-62.83786392211914,1
Many guys question this unlucky person.,Many guys question this unlucky people.,morphology,determiner_noun_agreement,determiner_noun_agreement_with_adj_irregular_1,True,True,False,True,758,-46.60783386230469,-49.03068542480469,1
Laura won't heal that concealed man.,Laura won't heal that concealed men.,morphology,determiner_noun_agreement,determiner_noun_agreement_with_adj_irregular_1,True,True,False,True,759,-50.516319274902344,-51.16929626464844,1
A lot of people care for that unemployed person.,A lot of people care for that unemployed people.,morphology,determiner_noun_agreement,determiner_noun_agreement_with_adj_irregular_1,True,True,False,True,760,-49.99239730834961,-46.58625030517578,0
Natalie liked those small lice.,Natalie liked those small louse.,morphology,determiner_noun_agreement,determiner_noun_agreement_with_adj_irregular_1,True,True,False,True,761,-55.483314514160156,-57.47882080078125,1
An eggplant bores those small women.,An eggplant bores those small woman.,morphology,determiner_noun_agreement,determiner_noun_agreement_with_adj_irregular_1,True,True,False,True,762,-54.45091247558594,-58.03887939453125,1
A lot of waiters admire this big louse.,A lot of waiters admire this big lice.,morphology,determiner_noun_agreement,determiner_noun_agreement_with_adj_irregular_1,True,True,False,True,763,-65.22220611572266,-63.337276458740234,0
These students conceal those standing children.,These students conceal those standing child.,morphology,determiner_noun_agreement,determiner_noun_agreement_with_adj_irregular_1,True,True,False,True,764,-49.61358642578125,-50.10777282714844,1
The customers appreciate those happy people.,The customers appreciate those happy person.,morphology,determiner_noun_agreement,determiner_noun_agreement_with_adj_irregular_1,True,True,False,True,765,-38.89126205444336,-43.1328010559082,1
Ronald has scared this popular child.,Ronald has scared this popular children.,morphology,determiner_noun_agreement,determiner_noun_agreement_with_adj_irregular_1,True,True,False,True,766,-50.68555450439453,-53.617408752441406,1
Matt hadn't walked through those hidden oases.,Matt hadn't walked through those hidden oasis.,morphology,determiner_noun_agreement,determiner_noun_agreement_with_adj_irregular_1,True,True,False,True,767,-56.651771545410156,-52.96573257446289,0
Barbara couldn't walk through those old oases.,Barbara couldn't walk through those old oasis.,morphology,determiner_noun_agreement,determiner_noun_agreement_with_adj_irregular_1,True,True,False,True,768,-65.81281280517578,-61.11865234375,0
These actors messed up that messy foot.,These actors messed up that messy feet.,morphology,determiner_noun_agreement,determiner_noun_agreement_with_adj_irregular_1,True,True,False,True,769,-55.033897399902344,-53.85453796386719,0
Donald conceals those red cacti.,Donald conceals those red cactus.,morphology,determiner_noun_agreement,determiner_noun_agreement_with_adj_irregular_1,True,True,False,True,770,-52.45618438720703,-45.11266326904297,0
Many commentaries shock those happy men.,Many commentaries shock those happy man.,morphology,determiner_noun_agreement,determiner_noun_agreement_with_adj_irregular_1,True,True,False,True,771,-57.95134353637695,-57.831443786621094,0
Every guy hugged this lucky child.,Every guy hugged this lucky children.,morphology,determiner_noun_agreement,determiner_noun_agreement_with_adj_irregular_1,True,True,False,True,772,-45.21227264404297,-46.44105529785156,1
Janice should hire this unsure alumnus.,Janice should hire this unsure alumni.,morphology,determiner_noun_agreement,determiner_noun_agreement_with_adj_irregular_1,True,True,False,True,773,-62.18913650512695,-59.20826721191406,0
Many organizations haven't fired those big men.,Many organizations haven't fired those big man.,morphology,determiner_noun_agreement,determiner_noun_agreement_with_adj_irregular_1,True,True,False,True,774,-50.14387512207031,-51.489784240722656,1
Ice cream alarmed that unsure man.,Ice cream alarmed that unsure men.,morphology,determiner_noun_agreement,determiner_noun_agreement_with_adj_irregular_1,True,True,False,True,775,-51.00841522216797,-52.80510711669922,1
Carol wasn't returning to these displeased people.,Carol wasn't returning to these displeased person.,morphology,determiner_noun_agreement,determiner_noun_agreement_with_adj_irregular_1,True,True,False,True,776,-61.58252716064453,-63.93174743652344,1
Robert has thought about this unsure person.,Robert has thought about this unsure people.,morphology,determiner_noun_agreement,determiner_noun_agreement_with_adj_irregular_1,True,True,False,True,777,-45.3181037902832,-46.39716339111328,1
Karen explores those green oases.,Karen explores those green oasis.,morphology,determiner_noun_agreement,determiner_noun_agreement_with_adj_irregular_1,True,True,False,True,778,-55.7511100769043,-49.873504638671875,0
Every child hasn't scared this determined child.,Every child hasn't scared this determined children.,morphology,determiner_noun_agreement,determiner_noun_agreement_with_adj_irregular_1,True,True,False,True,779,-55.23407745361328,-56.35884094238281,1
Some couch aggravates this excited child.,Some couch aggravates this excited children.,morphology,determiner_noun_agreement,determiner_noun_agreement_with_adj_irregular_1,True,True,False,True,780,-51.20555114746094,-53.08686828613281,1
The Impressionists had hired these confident alumni.,The Impressionists had hired these confident alumnus.,morphology,determiner_noun_agreement,determiner_noun_agreement_with_adj_irregular_1,True,True,False,True,781,-70.99920654296875,-71.95977783203125,1
