sentence_good,sentence_bad,field,linguistics_term,UID,simple_LM_method,one_prefix_method,two_prefix_method,lexically_identical,pair_id,good_prob,bad_prob,correct
Dennis wouldn't hate this standing woman.,Dennis wouldn't hate this standing women.,morphology,determiner_noun_agreement,determiner_noun_agreement_with_adj_irregular_1,True,True,False,True,225,-59.91938400268555,-62.440460205078125,1
Naomi exited that cheap oasis.,Naomi exited that cheap oases.,morphology,determiner_noun_agreement,determiner_noun_agreement_with_adj_irregular_1,True,True,False,True,226,-54.29587936401367,-58.35750961303711,1
Diane had appreciated that displeased man.,Diane had appreciated that displeased men.,morphology,determiner_noun_agreement,determiner_noun_agreement_with_adj_irregular_1,True,True,False,True,227,-59.64970016479492,-59.491111755371094,0
Stacy questioned those concealed alumni.,Stacy questioned those concealed alumnus.,morphology,determiner_noun_agreement,determiner_noun_agreement_with_adj_irregular_1,True,True,False,True,228,-58.117950439453125,-58.33756637573242,1
Denise lifted these sick lice.,Denise lifted these sick louse.,morphology,determiner_noun_agreement,determiner_noun_agreement_with_adj_irregular_1,True,True,False,True,229,-54.631309509277344,-56.4354133605957,1
Florence visited that hard oasis.,Florence visited that hard oases.,morphology,determiner_noun_agreement,determiner_noun_agreement_with_adj_irregular_1,True,True,False,True,230,-52.70534896850586,-56.8839225769043,1
Many projectors are confusing this smart man.,Many projectors are confusing this smart men.,morphology,determiner_noun_agreement,determiner_noun_agreement_with_adj_irregular_1,True,True,False,True,231,-59.10429000854492,-61.85057830810547,1
James breaks those purple teeth.,James breaks those purple tooth.,morphology,determiner_noun_agreement,determiner_noun_agreement_with_adj_irregular_1,True,True,False,True,232,-38.80065155029297,-42.11774826049805,1
Thomas has hidden those small teeth.,Thomas has hidden those small tooth.,morphology,determiner_noun_agreement,determiner_noun_agreement_with_adj_irregular_1,True,True,False,True,233,-38.84686279296875,-44.81990051269531,1
Kristin cured that old man.,Kristin cured that old men.,morphology,determiner_noun_agreement,determiner_noun_agreement_with_adj_irregular_1,True,True,False,True,234,-41.57782745361328,-41.745086669921875,1
Cynthia explored that orange oasis.,Cynthia explored that orange oases.,morphology,determiner_noun_agreement,determiner_noun_agreement_with_adj_irregular_1,True,True,False,True,235,-57.71459197998047,-60.24816131591797,1
Donna escapes from these scared men.,Donna escapes from these scared man.,morphology,determiner_noun_agreement,determiner_noun_agreement_with_adj_irregular_1,True,True,False,True,236,-45.04254913330078,-46.52725601196289,1
Some students astounded that excited person.,Some students astounded that excited people.,morphology,determiner_noun_agreement,determiner_noun_agreement_with_adj_irregular_1,True,True,False,True,237,-53.272884368896484,-49.818843841552734,0
Steven isn't visiting these displeased people.,Steven isn't visiting these displeased person.,morphology,determiner_noun_agreement,determiner_noun_agreement_with_adj_irregular_1,True,True,False,True,238,-51.79304504394531,-54.79374313354492,1
Many pedestrians disagreed with this lost woman.,Many pedestrians disagreed with this lost women.,morphology,determiner_noun_agreement,determiner_noun_agreement_with_adj_irregular_1,True,True,False,True,239,-55.14183807373047,-56.08698272705078,1
Some guys hug these good men.,Some guys hug these good man.,morphology,determiner_noun_agreement,determiner_noun_agreement_with_adj_irregular_1,True,True,False,True,240,-40.342079162597656,-42.37946319580078,1
Robert had those big cacti.,Robert had those big cactus.,morphology,determiner_noun_agreement,determiner_noun_agreement_with_adj_irregular_1,True,True,False,True,241,-46.81062316894531,-38.10722351074219,0
Jeffrey has examined that bad synopsis.,Jeffrey has examined that bad synopses.,morphology,determiner_noun_agreement,determiner_noun_agreement_with_adj_irregular_1,True,True,False,True,242,-50.50059127807617,-61.004913330078125,1
Jodi might upset these old children.,Jodi might upset these old child.,morphology,determiner_noun_agreement,determiner_noun_agreement_with_adj_irregular_1,True,True,False,True,243,-51.16852569580078,-54.745418548583984,1
Brenda helped those bad women.,Brenda helped those bad woman.,morphology,determiner_noun_agreement,determiner_noun_agreement_with_adj_irregular_1,True,True,False,True,244,-39.75920104980469,-42.129310607910156,1
All waiters aren't listening to that happy alumnus.,All waiters aren't listening to that happy alumni.,morphology,determiner_noun_agreement,determiner_noun_agreement_with_adj_irregular_1,True,True,False,True,245,-63.4238166809082,-58.00237274169922,0
The girl disagrees with this good man.,The girl disagrees with this good men.,morphology,determiner_noun_agreement,determiner_noun_agreement_with_adj_irregular_1,True,True,False,True,246,-41.33331298828125,-44.204315185546875,1
Jill conceals that excited person.,Jill conceals that excited people.,morphology,determiner_noun_agreement,determiner_noun_agreement_with_adj_irregular_1,True,True,False,True,247,-53.62163543701172,-51.14481735229492,0
Julia remembered this young person.,Julia remembered this young people.,morphology,determiner_noun_agreement,determiner_noun_agreement_with_adj_irregular_1,True,True,False,True,248,-38.33958435058594,-39.051666259765625,1
Bruce disliked these confident alumni.,Bruce disliked these confident alumnus.,morphology,determiner_noun_agreement,determiner_noun_agreement_with_adj_irregular_1,True,True,False,True,249,-44.374481201171875,-47.30916976928711,1
These teachers cure these sick people.,These teachers cure these sick person.,morphology,determiner_noun_agreement,determiner_noun_agreement_with_adj_irregular_1,True,True,False,True,250,-40.30741882324219,-45.60951614379883,1
Karla does fix these red feet.,Karla does fix these red foot.,morphology,determiner_noun_agreement,determiner_noun_agreement_with_adj_irregular_1,True,True,False,True,251,-51.67179870605469,-53.32176208496094,1
Judy hadn't attacked that nice woman.,Judy hadn't attacked that nice women.,morphology,determiner_noun_agreement,determiner_noun_agreement_with_adj_irregular_1,True,True,False,True,252,-52.02662658691406,-54.3364143371582,1
The apple disgusted that sick child.,The apple disgusted that sick children.,morphology,determiner_noun_agreement,determiner_noun_agreement_with_adj_irregular_1,True,True,False,True,253,-52.06782913208008,-49.99943542480469,0
Charles upset this content child.,Charles upset this content children.,morphology,determiner_noun_agreement,determiner_noun_agreement_with_adj_irregular_1,True,True,False,True,254,-44.86931228637695,-45.01404571533203,1
The waiters disagree with this fast person.,The waiters disagree with this fast people.,morphology,determiner_noun_agreement,determiner_noun_agreement_with_adj_irregular_1,True,True,False,True,255,-52.895118713378906,-50.975860595703125,0
Christopher isn't hiring this determined man.,Christopher isn't hiring this determined men.,morphology,determiner_noun_agreement,determiner_noun_agreement_with_adj_irregular_1,True,True,False,True,256,-48.56452178955078,-50.853328704833984,1
Elaine couldn't exit those rough oases.,Elaine couldn't exit those rough oasis.,morphology,determiner_noun_agreement,determiner_noun_agreement_with_adj_irregular_1,True,True,False,True,257,-60.74638366699219,-59.72191619873047,0
Jason wouldn't like those exposed lice.,Jason wouldn't like those exposed louse.,morphology,determiner_noun_agreement,determiner_noun_agreement_with_adj_irregular_1,True,True,False,True,258,-52.83283996582031,-54.2231559753418,1
Sherry hadn't insulted those clever alumni.,Sherry hadn't insulted those clever alumnus.,morphology,determiner_noun_agreement,determiner_noun_agreement_with_adj_irregular_1,True,True,False,True,259,-71.88264465332031,-72.57293701171875,1
Amanda has hidden these yellow cacti.,Amanda has hidden these yellow cactus.,morphology,determiner_noun_agreement,determiner_noun_agreement_with_adj_irregular_1,True,True,False,True,260,-60.046600341796875,-52.637542724609375,0
Paula thinks about these green lice.,Paula thinks about these green louse.,morphology,determiner_noun_agreement,determiner_noun_agreement_with_adj_irregular_1,True,True,False,True,261,-53.17841339111328,-54.584510803222656,1
All doctors argue about those long analyses.,All doctors argue about those long analysis.,morphology,determiner_noun_agreement,determiner_noun_agreement_with_adj_irregular_1,True,True,False,True,262,-54.90746307373047,-54.07006072998047,0
Heidi can break this out in the open foot.,Heidi can break this out in the open feet.,morphology,determiner_noun_agreement,determiner_noun_agreement_with_adj_irregular_1,True,True,False,True,263,-52.711368560791016,-54.17585372924805,1
Carla hugged those young children.,Carla hugged those young child.,morphology,determiner_noun_agreement,determiner_noun_agreement_with_adj_irregular_1,True,True,False,True,264,-38.94462585449219,-43.49969482421875,1
A guest was attacking those confident men.,A guest was attacking those confident man.,morphology,determiner_noun_agreement,determiner_noun_agreement_with_adj_irregular_1,True,True,False,True,265,-55.15064239501953,-55.652122497558594,1
The Impressionists boycott those hard oases.,The Impressionists boycott those hard oasis.,morphology,determiner_noun_agreement,determiner_noun_agreement_with_adj_irregular_1,True,True,False,True,266,-60.71030044555664,-57.04753875732422,0
Katherine isn't disgusting this out in the open alumnus.,Katherine isn't disgusting this out in the open alumni.,morphology,determiner_noun_agreement,determiner_noun_agreement_with_adj_irregular_1,True,True,False,True,267,-73.33299255371094,-72.20155334472656,0
A window is bothering those popular men.,A window is bothering those popular man.,morphology,determiner_noun_agreement,determiner_noun_agreement_with_adj_irregular_1,True,True,False,True,268,-55.41913604736328,-56.46311950683594,1
A lot of cashiers discover that smart man.,A lot of cashiers discover that smart men.,morphology,determiner_noun_agreement,determiner_noun_agreement_with_adj_irregular_1,True,True,False,True,269,-57.42262649536133,-56.15627670288086,0
Jodi approaches that unlucky woman.,Jodi approaches that unlucky women.,morphology,determiner_noun_agreement,determiner_noun_agreement_with_adj_irregular_1,True,True,False,True,270,-50.479164123535156,-49.63310623168945,0
Jesus discussed that fast child.,Jesus discussed that fast children.,morphology,determiner_noun_agreement,determiner_noun_agreement_with_adj_irregular_1,True,True,False,True,271,-42.932342529296875,-40.38990020751953,0
Carts hadn't disgusted those content men.,Carts hadn't disgusted those content man.,morphology,determiner_noun_agreement,determiner_noun_agreement_with_adj_irregular_1,True,True,False,True,272,-67.65391540527344,-68.89366149902344,1
Deborah talks about these smart men.,Deborah talks about these smart man.,morphology,determiner_noun_agreement,determiner_noun_agreement_with_adj_irregular_1,True,True,False,True,273,-40.10331344604492,-43.55602264404297,1
Thomas was returning to that unsure man.,Thomas was returning to that unsure men.,morphology,determiner_noun_agreement,determiner_noun_agreement_with_adj_irregular_1,True,True,False,True,274,-50.25267028808594,-51.07693099975586,1
Every student will break this clean tooth.,Every student will break this clean teeth.,morphology,determiner_noun_agreement,determiner_noun_agreement_with_adj_irregular_1,True,True,False,True,275,-47.92784881591797,-48.56376647949219,1
Valerie talks about this young woman.,Valerie talks about this young women.,morphology,determiner_noun_agreement,determiner_noun_agreement_with_adj_irregular_1,True,True,False,True,276,-39.60490798950195,-40.79072189331055,1
The Clintons discuss this yellow thesis.,The Clintons discuss this yellow theses.,morphology,determiner_noun_agreement,determiner_noun_agreement_with_adj_irregular_1,True,True,False,True,277,-50.81831359863281,-60.377525329589844,1
These cashiers break those dirty feet.,These cashiers break those dirty foot.,morphology,determiner_noun_agreement,determiner_noun_agreement_with_adj_irregular_1,True,True,False,True,278,-55.261653900146484,-59.19369888305664,1
Noah exited these concealed oases.,Noah exited these concealed oasis.,morphology,determiner_noun_agreement,determiner_noun_agreement_with_adj_irregular_1,True,True,False,True,279,-59.24399948120117,-59.46405792236328,1
Elaine toured that rough oasis.,Elaine toured that rough oases.,morphology,determiner_noun_agreement,determiner_noun_agreement_with_adj_irregular_1,True,True,False,True,280,-53.05679702758789,-56.935821533203125,1
Allison hides that gray mouse.,Allison hides that gray mice.,morphology,determiner_noun_agreement,determiner_noun_agreement_with_adj_irregular_1,True,True,False,True,281,-55.41486358642578,-54.02767562866211,0
All vases irritated that hopeful man.,All vases irritated that hopeful men.,morphology,determiner_noun_agreement,determiner_noun_agreement_with_adj_irregular_1,True,True,False,True,282,-57.88199234008789,-58.85575866699219,1
Chad boycotted that smooth oasis.,Chad boycotted that smooth oases.,morphology,determiner_noun_agreement,determiner_noun_agreement_with_adj_irregular_1,True,True,False,True,283,-67.07952117919922,-70.51017761230469,1
The Clintons drive to these green oases.,The Clintons drive to these green oasis.,morphology,determiner_noun_agreement,determiner_noun_agreement_with_adj_irregular_1,True,True,False,True,284,-65.29857635498047,-62.47002029418945,0
Many ladies aren't concealing that brown louse.,Many ladies aren't concealing that brown lice.,morphology,determiner_noun_agreement,determiner_noun_agreement_with_adj_irregular_1,True,True,False,True,285,-70.36835479736328,-68.93260192871094,0
Brenda couldn't hire this serious child.,Brenda couldn't hire this serious children.,morphology,determiner_noun_agreement,determiner_noun_agreement_with_adj_irregular_1,True,True,False,True,286,-46.853294372558594,-49.3121223449707,1
Pamela sounds like that displeased person.,Pamela sounds like that displeased people.,morphology,determiner_noun_agreement,determiner_noun_agreement_with_adj_irregular_1,True,True,False,True,287,-58.337257385253906,-55.484458923339844,0
Eva doesn't arrive at these gray oases.,Eva doesn't arrive at these gray oasis.,morphology,determiner_noun_agreement,determiner_noun_agreement_with_adj_irregular_1,True,True,False,True,288,-53.71491241455078,-51.707645416259766,0
Raymond hurt that old alumnus.,Raymond hurt that old alumni.,morphology,determiner_noun_agreement,determiner_noun_agreement_with_adj_irregular_1,True,True,False,True,289,-51.05781936645508,-50.528690338134766,0
Most waitresses don't observe these exposed alumni.,Most waitresses don't observe these exposed alumnus.,morphology,determiner_noun_agreement,determiner_noun_agreement_with_adj_irregular_1,True,True,False,True,290,-66.17171478271484,-69.25458526611328,1
Edward finds these gray oases.,Edward finds these gray oasis.,morphology,determiner_noun_agreement,determiner_noun_agreement_with_adj_irregular_1,True,True,False,True,291,-43.021732330322266,-42.64000701904297,0
Becky fixes that small foot.,Becky fixes that small feet.,morphology,determiner_noun_agreement,determiner_noun_agreement_with_adj_irregular_1,True,True,False,True,292,-44.27582550048828,-41.388404846191406,0
Erin will conceal these nice alumni.,Erin will conceal these nice alumnus.,morphology,determiner_noun_agreement,determiner_noun_agreement_with_adj_irregular_1,True,True,False,True,293,-53.093963623046875,-53.7963752746582,1
Denise isn't shocking these serious alumni.,Denise isn't shocking these serious alumnus.,morphology,determiner_noun_agreement,determiner_noun_agreement_with_adj_irregular_1,True,True,False,True,294,-58.83442306518555,-61.00392150878906,1
Martin isn't curing these concealed oxen.,Martin isn't curing these concealed ox.,morphology,determiner_noun_agreement,determiner_noun_agreement_with_adj_irregular_1,True,True,False,True,295,-60.89446258544922,-58.67572784423828,0
Lori wasn't watching this clever woman.,Lori wasn't watching this clever women.,morphology,determiner_noun_agreement,determiner_noun_agreement_with_adj_irregular_1,True,True,False,True,296,-55.616233825683594,-58.562557220458984,1
These wheelbarrows disgust these sick men.,These wheelbarrows disgust these sick man.,morphology,determiner_noun_agreement,determiner_noun_agreement_with_adj_irregular_1,True,True,False,True,297,-65.15548706054688,-67.4524917602539,1
These women discuss that confident woman.,These women discuss that confident women.,morphology,determiner_noun_agreement,determiner_noun_agreement_with_adj_irregular_1,True,True,False,True,298,-43.93963623046875,-39.82395935058594,0
Noah hadn't remembered these bad analyses.,Noah hadn't remembered these bad analysis.,morphology,determiner_noun_agreement,determiner_noun_agreement_with_adj_irregular_1,True,True,False,True,299,-59.63029479980469,-58.466407775878906,0
Nina is boring this smart child.,Nina is boring this smart children.,morphology,determiner_noun_agreement,determiner_noun_agreement_with_adj_irregular_1,True,True,False,True,300,-48.961334228515625,-50.48666000366211,1
The Lutherans like these scared people.,The Lutherans like these scared person.,morphology,determiner_noun_agreement,determiner_noun_agreement_with_adj_irregular_1,True,True,False,True,301,-47.66797637939453,-54.078575134277344,1
Leslie could return to those lost people.,Leslie could return to those lost person.,morphology,determiner_noun_agreement,determiner_noun_agreement_with_adj_irregular_1,True,True,False,True,302,-47.15245819091797,-49.24501037597656,1
Galileo liked this small child.,Galileo liked this small children.,morphology,determiner_noun_agreement,determiner_noun_agreement_with_adj_irregular_1,True,True,False,True,303,-50.22249221801758,-51.095558166503906,1
Denise was talking about that determined person.,Denise was talking about that determined people.,morphology,determiner_noun_agreement,determiner_noun_agreement_with_adj_irregular_1,True,True,False,True,304,-52.73517608642578,-51.30535125732422,0
Andrew respected that white oasis.,Andrew respected that white oases.,morphology,determiner_noun_agreement,determiner_noun_agreement_with_adj_irregular_1,True,True,False,True,305,-42.948974609375,-45.754268646240234,1
Renee has dropped by these old oases.,Renee has dropped by these old oasis.,morphology,determiner_noun_agreement,determiner_noun_agreement_with_adj_irregular_1,True,True,False,True,306,-53.84971237182617,-52.876190185546875,0
That bread shouldn't aggravate this unconvinced alumnus.,That bread shouldn't aggravate this unconvinced alumni.,morphology,determiner_noun_agreement,determiner_noun_agreement_with_adj_irregular_1,True,True,False,True,307,-70.45145416259766,-69.65519714355469,0
All ladies appreciate these brown oases.,All ladies appreciate these brown oasis.,morphology,determiner_noun_agreement,determiner_noun_agreement_with_adj_irregular_1,True,True,False,True,308,-50.83611297607422,-49.694602966308594,0
A doctor drives to this out in the open oasis.,A doctor drives to this out in the open oases.,morphology,determiner_noun_agreement,determiner_noun_agreement_with_adj_irregular_1,True,True,False,True,309,-65.54946899414062,-67.26818084716797,1
The teenagers tour these black oases.,The teenagers tour these black oasis.,morphology,determiner_noun_agreement,determiner_noun_agreement_with_adj_irregular_1,True,True,False,True,310,-56.68391799926758,-54.31880569458008,0
Becca didn't think about those out in the open oxen.,Becca didn't think about those out in the open ox.,morphology,determiner_noun_agreement,determiner_noun_agreement_with_adj_irregular_1,True,True,False,True,311,-75.12467193603516,-72.21455383300781,0
Eric hadn't loved that exposed person.,Eric hadn't loved that exposed people.,morphology,determiner_noun_agreement,determiner_noun_agreement_with_adj_irregular_1,True,True,False,True,312,-48.10084533691406,-44.68744659423828,0
Every person wasn't hiding those black axes.,Every person wasn't hiding those black axis.,morphology,determiner_noun_agreement,determiner_noun_agreement_with_adj_irregular_1,True,True,False,True,313,-57.595664978027344,-57.87468338012695,1
Tina respected that unemployed child.,Tina respected that unemployed children.,morphology,determiner_noun_agreement,determiner_noun_agreement_with_adj_irregular_1,True,True,False,True,314,-52.76563262939453,-46.47157287597656,0
Broccoli astounds this unemployed child.,Broccoli astounds this unemployed children.,morphology,determiner_noun_agreement,determiner_noun_agreement_with_adj_irregular_1,True,True,False,True,315,-58.88948059082031,-57.392154693603516,0
The waitresses break this cheap foot.,The waitresses break this cheap feet.,morphology,determiner_noun_agreement,determiner_noun_agreement_with_adj_irregular_1,True,True,False,True,316,-55.26359558105469,-55.26780700683594,1
Janice brought this brown nucleus.,Janice brought this brown nuclei.,morphology,determiner_noun_agreement,determiner_noun_agreement_with_adj_irregular_1,True,True,False,True,317,-47.199554443359375,-49.136077880859375,1
Gerald wasn't dropping by these old oases.,Gerald wasn't dropping by these old oasis.,morphology,determiner_noun_agreement,determiner_noun_agreement_with_adj_irregular_1,True,True,False,True,318,-67.04684448242188,-67.09297180175781,1
These slopes haven't astounded those unemployed alumni.,These slopes haven't astounded those unemployed alumnus.,morphology,determiner_noun_agreement,determiner_noun_agreement_with_adj_irregular_1,True,True,False,True,319,-72.21737670898438,-79.19978332519531,1
Ellen was astounding these unsure men.,Ellen was astounding these unsure man.,morphology,determiner_noun_agreement,determiner_noun_agreement_with_adj_irregular_1,True,True,False,True,320,-56.20698547363281,-56.55609893798828,1
That story will annoy this fast person.,That story will annoy this fast people.,morphology,determiner_noun_agreement,determiner_noun_agreement_with_adj_irregular_1,True,True,False,True,321,-48.05950927734375,-45.26899719238281,0
Most photographs look like those clever children.,Most photographs look like those clever child.,morphology,determiner_noun_agreement,determiner_noun_agreement_with_adj_irregular_1,True,True,False,True,322,-47.77119064331055,-53.09123992919922,1
These screens distracted that young alumnus.,These screens distracted that young alumni.,morphology,determiner_noun_agreement,determiner_noun_agreement_with_adj_irregular_1,True,True,False,True,323,-56.51130294799805,-53.472312927246094,0
Craig does distract this small woman.,Craig does distract this small women.,morphology,determiner_noun_agreement,determiner_noun_agreement_with_adj_irregular_1,True,True,False,True,324,-40.98031997680664,-42.490360260009766,1
Monet arrived at those blue oases.,Monet arrived at those blue oasis.,morphology,determiner_noun_agreement,determiner_noun_agreement_with_adj_irregular_1,True,True,False,True,325,-56.04597854614258,-53.4665641784668,0
The ladies lift those blue feet.,The ladies lift those blue foot.,morphology,determiner_noun_agreement,determiner_noun_agreement_with_adj_irregular_1,True,True,False,True,326,-45.92469024658203,-49.12623977661133,1
A grocery store does confuse this displeased woman.,A grocery store does confuse this displeased women.,morphology,determiner_noun_agreement,determiner_noun_agreement_with_adj_irregular_1,True,True,False,True,327,-63.86140441894531,-65.79019165039062,1
Douglas was escaping from those unlucky children.,Douglas was escaping from those unlucky child.,morphology,determiner_noun_agreement,determiner_noun_agreement_with_adj_irregular_1,True,True,False,True,328,-51.72332000732422,-55.21368408203125,1
Brenda had returned to these scared alumni.,Brenda had returned to these scared alumnus.,morphology,determiner_noun_agreement,determiner_noun_agreement_with_adj_irregular_1,True,True,False,True,329,-52.5536994934082,-53.69450759887695,1
Alicia scans these good synopses.,Alicia scans these good synopsis.,morphology,determiner_noun_agreement,determiner_noun_agreement_with_adj_irregular_1,True,True,False,True,330,-63.56123733520508,-57.18555450439453,0
Some senators attack those confident men.,Some senators attack those confident man.,morphology,determiner_noun_agreement,determiner_noun_agreement_with_adj_irregular_1,True,True,False,True,331,-50.3511848449707,-52.28171157836914,1
Some fish shocked those small people.,Some fish shocked those small person.,morphology,determiner_noun_agreement,determiner_noun_agreement_with_adj_irregular_1,True,True,False,True,332,-43.84050750732422,-48.68243408203125,1
Timothy had cared for these fast men.,Timothy had cared for these fast man.,morphology,determiner_noun_agreement,determiner_noun_agreement_with_adj_irregular_1,True,True,False,True,333,-55.541053771972656,-56.807594299316406,1
Lucille hasn't run around those concealed oases.,Lucille hasn't run around those concealed oasis.,morphology,determiner_noun_agreement,determiner_noun_agreement_with_adj_irregular_1,True,True,False,True,334,-72.25177001953125,-71.22718048095703,0
Tonya observed that fast alumnus.,Tonya observed that fast alumni.,morphology,determiner_noun_agreement,determiner_noun_agreement_with_adj_irregular_1,True,True,False,True,335,-46.51102828979492,-47.108612060546875,1
Every picture was astounding this lucky alumnus.,Every picture was astounding this lucky alumni.,morphology,determiner_noun_agreement,determiner_noun_agreement_with_adj_irregular_1,True,True,False,True,336,-58.01788330078125,-55.63053894042969,0
