sentence_good,sentence_bad,field,linguistics_term,UID,simple_LM_method,one_prefix_method,two_prefix_method,lexically_identical,pair_id,good_prob,bad_prob,correct
The students perform.,The student perform.,morphology,subject_verb_agreement,regular_plural_subject_verb_agreement_2,True,False,True,False,0,-23.25590705871582,-24.383556365966797,1
The associations talk about Stacey.,The association talk about Stacey.,morphology,subject_verb_agreement,regular_plural_subject_verb_agreement_2,True,False,True,False,1,-42.791507720947266,-41.6340446472168,0
The glove tightens.,The gloves tightens.,morphology,subject_verb_agreement,regular_plural_subject_verb_agreement_2,True,False,True,False,2,-30.467544555664062,-32.068031311035156,1
The actresses compromise.,The actress compromise.,morphology,subject_verb_agreement,regular_plural_subject_verb_agreement_2,True,False,True,False,3,-28.70367431640625,-26.922325134277344,0
The customer is suffering.,The customers is suffering.,morphology,subject_verb_agreement,regular_plural_subject_verb_agreement_2,True,False,True,False,4,-24.29494857788086,-27.265201568603516,1
The cashiers marry.,The cashier marry.,morphology,subject_verb_agreement,regular_plural_subject_verb_agreement_2,True,False,True,False,5,-36.17073440551758,-36.474952697753906,1
The hospital appreciates Claire.,The hospitals appreciates Claire.,morphology,subject_verb_agreement,regular_plural_subject_verb_agreement_2,True,False,True,False,6,-41.81129455566406,-44.35428237915039,1
The dress crumples.,The dresses crumples.,morphology,subject_verb_agreement,regular_plural_subject_verb_agreement_2,True,False,True,False,7,-37.6609992980957,-38.34265899658203,1
The customers haven't whispered.,The customer haven't whispered.,morphology,subject_verb_agreement,regular_plural_subject_verb_agreement_2,True,False,True,False,8,-33.1156120300293,-33.99479675292969,1
The adult talks.,The adults talks.,morphology,subject_verb_agreement,regular_plural_subject_verb_agreement_2,True,False,True,False,9,-21.52938461303711,-22.539569854736328,1
The universities aren't working hard.,The university aren't working hard.,morphology,subject_verb_agreement,regular_plural_subject_verb_agreement_2,True,False,True,False,10,-37.3888053894043,-36.24473190307617,0
The adult has concealed all stories.,The adults has concealed all stories.,morphology,subject_verb_agreement,regular_plural_subject_verb_agreement_2,True,False,True,False,11,-42.95091247558594,-43.30279541015625,1
The universities appreciate all teenagers.,The university appreciate all teenagers.,morphology,subject_verb_agreement,regular_plural_subject_verb_agreement_2,True,False,True,False,12,-40.31999206542969,-40.00954055786133,0
The teachers weren't murmuring.,The teacher weren't murmuring.,morphology,subject_verb_agreement,regular_plural_subject_verb_agreement_2,True,False,True,False,13,-37.61513137817383,-38.0493049621582,1
The couch has tipped over.,The couchs has tipped over.,morphology,subject_verb_agreement,regular_plural_subject_verb_agreement_2,True,False,True,False,14,-34.56666946411133,-41.34128189086914,1
The boy conceals every cup.,The boys conceals every cup.,morphology,subject_verb_agreement,regular_plural_subject_verb_agreement_2,True,False,True,False,15,-43.721397399902344,-42.331119537353516,0
The organization wasn't corresponding.,The organizations wasn't corresponding.,morphology,subject_verb_agreement,regular_plural_subject_verb_agreement_2,True,False,True,False,16,-37.089908599853516,-38.89182662963867,1
The libraries weren't hurting Ellen.,The library weren't hurting Ellen.,morphology,subject_verb_agreement,regular_plural_subject_verb_agreement_2,True,False,True,False,17,-47.078826904296875,-44.11473083496094,0
The organizations know Larry.,The organization know Larry.,morphology,subject_verb_agreement,regular_plural_subject_verb_agreement_2,True,False,True,False,18,-34.63679885864258,-33.487464904785156,0
The pedestrian heals the dogs.,The pedestrians heals the dogs.,morphology,subject_verb_agreement,regular_plural_subject_verb_agreement_2,True,False,True,False,19,-38.43644714355469,-39.67741394042969,1
The actress responds.,The actresses responds.,morphology,subject_verb_agreement,regular_plural_subject_verb_agreement_2,True,False,True,False,20,-25.896873474121094,-27.32741928100586,1
The skirt is disturbing Debra.,The skirts is disturbing Debra.,morphology,subject_verb_agreement,regular_plural_subject_verb_agreement_2,True,False,True,False,21,-47.49475860595703,-49.618648529052734,1
The cashiers haven't testified.,The cashier haven't testified.,morphology,subject_verb_agreement,regular_plural_subject_verb_agreement_2,True,False,True,False,22,-45.84354782104492,-47.61548614501953,1
The legislature has loved a lot of stories.,The legislatures has loved a lot of stories.,morphology,subject_verb_agreement,regular_plural_subject_verb_agreement_2,True,False,True,False,23,-45.00055694580078,-47.680259704589844,1
The chair has embarrassed most drivers.,The chairs has embarrassed most drivers.,morphology,subject_verb_agreement,regular_plural_subject_verb_agreement_2,True,False,True,False,24,-47.732582092285156,-50.451332092285156,1
The patients haven't debated.,The patient haven't debated.,morphology,subject_verb_agreement,regular_plural_subject_verb_agreement_2,True,False,True,False,25,-34.164833068847656,-35.01677703857422,1
The adults have talked to Angela.,The adult have talked to Angela.,morphology,subject_verb_agreement,regular_plural_subject_verb_agreement_2,True,False,True,False,26,-36.96171569824219,-40.79742431640625,1
The pedestrians haven't ascended that mountain.,The pedestrian haven't ascended that mountain.,morphology,subject_verb_agreement,regular_plural_subject_verb_agreement_2,True,False,True,False,27,-53.18549728393555,-52.59650421142578,0
The senator knows Elaine.,The senators knows Elaine.,morphology,subject_verb_agreement,regular_plural_subject_verb_agreement_2,True,False,True,False,28,-35.18806838989258,-35.687721252441406,1
The children smile.,The child smile.,morphology,subject_verb_agreement,regular_plural_subject_verb_agreement_2,True,False,True,False,29,-19.490848541259766,-17.93948745727539,0
The teenager plays.,The teenagers plays.,morphology,subject_verb_agreement,regular_plural_subject_verb_agreement_2,True,False,True,False,30,-23.315326690673828,-23.892200469970703,1
The dish has alarmed Sara.,The dishs has alarmed Sara.,morphology,subject_verb_agreement,regular_plural_subject_verb_agreement_2,True,False,True,False,31,-40.60381317138672,-45.92045593261719,1
The waitress cries.,The waitresses cries.,morphology,subject_verb_agreement,regular_plural_subject_verb_agreement_2,True,False,True,False,32,-25.96834945678711,-35.21630859375,1
The customers cheer.,The customer cheer.,morphology,subject_verb_agreement,regular_plural_subject_verb_agreement_2,True,False,True,False,33,-26.39612579345703,-24.690364837646484,0
The governments distract Suzanne.,The government distract Suzanne.,morphology,subject_verb_agreement,regular_plural_subject_verb_agreement_2,True,False,True,False,34,-38.31939697265625,-36.74081802368164,0
The senators watch Kristin.,The senator watch Kristin.,morphology,subject_verb_agreement,regular_plural_subject_verb_agreement_2,True,False,True,False,35,-40.682350158691406,-40.80448532104492,1
The ladies weren't fleeing from Michael.,The lady weren't fleeing from Michael.,morphology,subject_verb_agreement,regular_plural_subject_verb_agreement_2,True,False,True,False,36,-46.9996337890625,-45.81871795654297,0
The customers have profited.,The customer have profited.,morphology,subject_verb_agreement,regular_plural_subject_verb_agreement_2,True,False,True,False,37,-35.386863708496094,-36.48306655883789,1
The bank has reunited.,The banks has reunited.,morphology,subject_verb_agreement,regular_plural_subject_verb_agreement_2,True,False,True,False,38,-28.452011108398438,-29.15108871459961,1
The jackets haven't shrunk.,The jacket haven't shrunk.,morphology,subject_verb_agreement,regular_plural_subject_verb_agreement_2,True,False,True,False,39,-35.87637710571289,-34.239200592041016,0
The universities were boasting.,The university were boasting.,morphology,subject_verb_agreement,regular_plural_subject_verb_agreement_2,True,False,True,False,40,-27.826854705810547,-27.90945816040039,1
The adults have fled from all dancers.,The adult have fled from all dancers.,morphology,subject_verb_agreement,regular_plural_subject_verb_agreement_2,True,False,True,False,41,-45.11370849609375,-48.51868438720703,1
The patients laugh.,The patient laugh.,morphology,subject_verb_agreement,regular_plural_subject_verb_agreement_2,True,False,True,False,42,-23.520864486694336,-20.064393997192383,0
The nose bothers Alicia.,The noses bothers Alicia.,morphology,subject_verb_agreement,regular_plural_subject_verb_agreement_2,True,False,True,False,43,-37.3431510925293,-39.77776336669922,1
The actors were smiling.,The actor were smiling.,morphology,subject_verb_agreement,regular_plural_subject_verb_agreement_2,True,False,True,False,44,-25.771839141845703,-26.68536376953125,1
The senator isn't falling asleep.,The senators isn't falling asleep.,morphology,subject_verb_agreement,regular_plural_subject_verb_agreement_2,True,False,True,False,45,-37.131690979003906,-37.69780349731445,1
The university negotiates.,The universities negotiates.,morphology,subject_verb_agreement,regular_plural_subject_verb_agreement_2,True,False,True,False,46,-33.93760681152344,-35.04667663574219,1
The patient isn't referencing Thomas.,The patients isn't referencing Thomas.,morphology,subject_verb_agreement,regular_plural_subject_verb_agreement_2,True,False,True,False,47,-43.48182678222656,-46.649261474609375,1
The guests aren't cooking.,The guest aren't cooking.,morphology,subject_verb_agreement,regular_plural_subject_verb_agreement_2,True,False,True,False,48,-32.0643310546875,-31.139312744140625,0
The dancer hasn't lifted a sock.,The dancers hasn't lifted a sock.,morphology,subject_verb_agreement,regular_plural_subject_verb_agreement_2,True,False,True,False,49,-43.73686218261719,-45.19385528564453,1
The adult has discovered this teenager.,The adults has discovered this teenager.,morphology,subject_verb_agreement,regular_plural_subject_verb_agreement_2,True,False,True,False,50,-41.756988525390625,-42.67613983154297,1
The boys complain about some drivers.,The boy complain about some drivers.,morphology,subject_verb_agreement,regular_plural_subject_verb_agreement_2,True,False,True,False,51,-36.9031982421875,-39.5330810546875,1
The guests are passing this glacier.,The guest are passing this glacier.,morphology,subject_verb_agreement,regular_plural_subject_verb_agreement_2,True,False,True,False,52,-41.316925048828125,-42.45626449584961,1
The senators haven't complained about Kendra.,The senator haven't complained about Kendra.,morphology,subject_verb_agreement,regular_plural_subject_verb_agreement_2,True,False,True,False,53,-57.44083786010742,-58.27545166015625,1
The drivers skate around college campuses.,The driver skate around college campuses.,morphology,subject_verb_agreement,regular_plural_subject_verb_agreement_2,True,False,True,False,54,-52.55982971191406,-51.61835479736328,0
The actor sounds like the Clintons.,The actors sounds like the Clintons.,morphology,subject_verb_agreement,regular_plural_subject_verb_agreement_2,True,False,True,False,55,-43.5700798034668,-44.696495056152344,1
The guests were approving.,The guest were approving.,morphology,subject_verb_agreement,regular_plural_subject_verb_agreement_2,True,False,True,False,56,-29.052579879760742,-29.448307037353516,1
The children haven't whispered.,The child haven't whispered.,morphology,subject_verb_agreement,regular_plural_subject_verb_agreement_2,True,False,True,False,57,-28.71255111694336,-28.80779266357422,1
The companies aren't coping.,The company aren't coping.,morphology,subject_verb_agreement,regular_plural_subject_verb_agreement_2,True,False,True,False,58,-35.06144714355469,-33.69572067260742,0
The guest hasn't exited a closet.,The guests hasn't exited a closet.,morphology,subject_verb_agreement,regular_plural_subject_verb_agreement_2,True,False,True,False,59,-49.132484436035156,-50.22232437133789,1
The committee succeeds.,The committees succeeds.,morphology,subject_verb_agreement,regular_plural_subject_verb_agreement_2,True,False,True,False,60,-25.099559783935547,-28.18628692626953,1
The couches distract Samuel.,The couch distract Samuel.,morphology,subject_verb_agreement,regular_plural_subject_verb_agreement_2,True,False,True,False,61,-43.75200653076172,-38.88543701171875,0
The pedestrian concurs.,The pedestrians concurs.,morphology,subject_verb_agreement,regular_plural_subject_verb_agreement_2,True,False,True,False,62,-34.73102951049805,-37.34962463378906,1
The pedestrians litter.,The pedestrian litter.,morphology,subject_verb_agreement,regular_plural_subject_verb_agreement_2,True,False,True,False,63,-30.070472717285156,-27.868955612182617,0
The skirts have twisted.,The skirt have twisted.,morphology,subject_verb_agreement,regular_plural_subject_verb_agreement_2,True,False,True,False,64,-31.399322509765625,-31.798887252807617,1
The association hates Melinda.,The associations hates Melinda.,morphology,subject_verb_agreement,regular_plural_subject_verb_agreement_2,True,False,True,False,65,-44.937137603759766,-45.60369110107422,1
The waiters disagree with Natalie.,The waiter disagree with Natalie.,morphology,subject_verb_agreement,regular_plural_subject_verb_agreement_2,True,False,True,False,66,-49.332366943359375,-42.33043670654297,0
The guest hasn't hugged Grace.,The guests hasn't hugged Grace.,morphology,subject_verb_agreement,regular_plural_subject_verb_agreement_2,True,False,True,False,67,-44.181400299072266,-44.69843292236328,1
The glass bothers those senators.,The glasses bothers those senators.,morphology,subject_verb_agreement,regular_plural_subject_verb_agreement_2,True,False,True,False,68,-42.73577880859375,-44.48966979980469,1
The shoe isn't shrinking.,The shoes isn't shrinking.,morphology,subject_verb_agreement,regular_plural_subject_verb_agreement_2,True,False,True,False,69,-32.300106048583984,-33.69186019897461,1
The bird worries Sharon.,The birds worries Sharon.,morphology,subject_verb_agreement,regular_plural_subject_verb_agreement_2,True,False,True,False,70,-35.38677215576172,-35.942413330078125,1
The girl drinks.,The girls drinks.,morphology,subject_verb_agreement,regular_plural_subject_verb_agreement_2,True,False,True,False,71,-19.394756317138672,-19.600791931152344,1
The pedestrians help Andrew.,The pedestrian help Andrew.,morphology,subject_verb_agreement,regular_plural_subject_verb_agreement_2,True,False,True,False,72,-39.67461013793945,-38.8084831237793,0
The ladies aren't walking through every closet.,The lady aren't walking through every closet.,morphology,subject_verb_agreement,regular_plural_subject_verb_agreement_2,True,False,True,False,73,-49.266563415527344,-46.09743118286133,0
The gloves fray.,The glove fray.,morphology,subject_verb_agreement,regular_plural_subject_verb_agreement_2,True,False,True,False,74,-28.11219024658203,-26.892559051513672,0
The cashier wasn't concealing this dress.,The cashiers wasn't concealing this dress.,morphology,subject_verb_agreement,regular_plural_subject_verb_agreement_2,True,False,True,False,75,-64.00885772705078,-63.73588562011719,0
The actor has approached Eva.,The actors has approached Eva.,morphology,subject_verb_agreement,regular_plural_subject_verb_agreement_2,True,False,True,False,76,-39.24900817871094,-40.59662628173828,1
The guest hasn't talked about James.,The guests hasn't talked about James.,morphology,subject_verb_agreement,regular_plural_subject_verb_agreement_2,True,False,True,False,77,-42.32451248168945,-43.26344680786133,1
The sock disturbs Clyde.,The socks disturbs Clyde.,morphology,subject_verb_agreement,regular_plural_subject_verb_agreement_2,True,False,True,False,78,-47.10693359375,-48.256187438964844,1
The guys have healed Russell.,The guy have healed Russell.,morphology,subject_verb_agreement,regular_plural_subject_verb_agreement_2,True,False,True,False,79,-40.937103271484375,-43.04347610473633,1
The companies have worked hard.,The company have worked hard.,morphology,subject_verb_agreement,regular_plural_subject_verb_agreement_2,True,False,True,False,80,-30.182899475097656,-29.21502685546875,0
The boys yawn.,The boy yawn.,morphology,subject_verb_agreement,regular_plural_subject_verb_agreement_2,True,False,True,False,81,-20.165359497070312,-20.754013061523438,1
The dancers aren't marrying.,The dancer aren't marrying.,morphology,subject_verb_agreement,regular_plural_subject_verb_agreement_2,True,False,True,False,82,-35.29020690917969,-35.065635681152344,0
The college campuses were disturbing those drivers.,The college campus were disturbing those drivers.,morphology,subject_verb_agreement,regular_plural_subject_verb_agreement_2,True,False,True,False,83,-54.117645263671875,-53.12858200073242,0
The legislature hasn't fired Peter.,The legislatures hasn't fired Peter.,morphology,subject_verb_agreement,regular_plural_subject_verb_agreement_2,True,False,True,False,84,-43.70604705810547,-46.21373748779297,1
The students climb down every ladder.,The student climb down every ladder.,morphology,subject_verb_agreement,regular_plural_subject_verb_agreement_2,True,False,True,False,85,-40.7603874206543,-42.04221725463867,1
The boys flirt.,The boy flirt.,morphology,subject_verb_agreement,regular_plural_subject_verb_agreement_2,True,False,True,False,86,-22.95443344116211,-24.128482818603516,1
The pedestrian observes every lady.,The pedestrians observes every lady.,morphology,subject_verb_agreement,regular_plural_subject_verb_agreement_2,True,False,True,False,87,-43.60300827026367,-44.44506072998047,1
The guests aren't grinning.,The guest aren't grinning.,morphology,subject_verb_agreement,regular_plural_subject_verb_agreement_2,True,False,True,False,88,-34.215965270996094,-33.122066497802734,0
The waitresses have gotten fired.,The waitress have gotten fired.,morphology,subject_verb_agreement,regular_plural_subject_verb_agreement_2,True,False,True,False,89,-45.81407165527344,-37.260765075683594,0
The drivers watch Raymond.,The driver watch Raymond.,morphology,subject_verb_agreement,regular_plural_subject_verb_agreement_2,True,False,True,False,90,-34.19994354248047,-31.179767608642578,0
The ladies weren't conspiring.,The lady weren't conspiring.,morphology,subject_verb_agreement,regular_plural_subject_verb_agreement_2,True,False,True,False,91,-33.84423828125,-33.28860092163086,0
The libraries aren't boasting.,The library aren't boasting.,morphology,subject_verb_agreement,regular_plural_subject_verb_agreement_2,True,False,True,False,92,-37.100006103515625,-35.26679229736328,0
The girl concurs.,The girls concurs.,morphology,subject_verb_agreement,regular_plural_subject_verb_agreement_2,True,False,True,False,93,-31.226789474487305,-28.84137725830078,0
The patient scans the report.,The patients scans the report.,morphology,subject_verb_agreement,regular_plural_subject_verb_agreement_2,True,False,True,False,94,-38.54558563232422,-39.15386962890625,1
The teacher suffers.,The teachers suffers.,morphology,subject_verb_agreement,regular_plural_subject_verb_agreement_2,True,False,True,False,95,-23.807018280029297,-24.97991371154785,1
The teachers move.,The teacher move.,morphology,subject_verb_agreement,regular_plural_subject_verb_agreement_2,True,False,True,False,96,-21.6639404296875,-21.973365783691406,1
The waiter swallows.,The waiters swallows.,morphology,subject_verb_agreement,regular_plural_subject_verb_agreement_2,True,False,True,False,97,-31.729703903198242,-37.57929229736328,1
The adult has worn some coats.,The adults has worn some coats.,morphology,subject_verb_agreement,regular_plural_subject_verb_agreement_2,True,False,True,False,98,-42.048255920410156,-43.364540100097656,1
The student has escaped.,The students has escaped.,morphology,subject_verb_agreement,regular_plural_subject_verb_agreement_2,True,False,True,False,99,-24.5848331451416,-26.362211227416992,1
The doctors haven't met.,The doctor haven't met.,morphology,subject_verb_agreement,regular_plural_subject_verb_agreement_2,True,False,True,False,100,-30.808353424072266,-30.10895347595215,0
The library disturbs some guy.,The libraries disturbs some guy.,morphology,subject_verb_agreement,regular_plural_subject_verb_agreement_2,True,False,True,False,101,-47.848121643066406,-50.977378845214844,1
The students have cleaned a mall.,The student have cleaned a mall.,morphology,subject_verb_agreement,regular_plural_subject_verb_agreement_2,True,False,True,False,102,-39.28596496582031,-42.0079460144043,1
The teenager wasn't messing up this art gallery.,The teenagers wasn't messing up this art gallery.,morphology,subject_verb_agreement,regular_plural_subject_verb_agreement_2,True,False,True,False,103,-63.04834747314453,-65.0078125,1
The actresses have embraced.,The actress have embraced.,morphology,subject_verb_agreement,regular_plural_subject_verb_agreement_2,True,False,True,False,104,-34.58606719970703,-33.89588165283203,0
The patients haven't resembled a lot of photographs.,The patient haven't resembled a lot of photographs.,morphology,subject_verb_agreement,regular_plural_subject_verb_agreement_2,True,False,True,False,105,-48.873443603515625,-50.20162582397461,1
The grocery store wasn't falling.,The grocery stores wasn't falling.,morphology,subject_verb_agreement,regular_plural_subject_verb_agreement_2,True,False,True,False,106,-38.57899475097656,-41.47866439819336,1
The ladies aren't attacking Alice.,The lady aren't attacking Alice.,morphology,subject_verb_agreement,regular_plural_subject_verb_agreement_2,True,False,True,False,107,-41.489933013916016,-38.51266098022461,0
The ladies haven't fled from Pamela.,The lady haven't fled from Pamela.,morphology,subject_verb_agreement,regular_plural_subject_verb_agreement_2,True,False,True,False,108,-46.05180358886719,-44.165740966796875,0
The guy has driven to Spain.,The guys has driven to Spain.,morphology,subject_verb_agreement,regular_plural_subject_verb_agreement_2,True,False,True,False,109,-36.50282669067383,-38.870018005371094,1
The student lifts most jackets.,The students lifts most jackets.,morphology,subject_verb_agreement,regular_plural_subject_verb_agreement_2,True,False,True,False,110,-42.63631057739258,-42.73492431640625,1
The committees were responding.,The committee were responding.,morphology,subject_verb_agreement,regular_plural_subject_verb_agreement_2,True,False,True,False,111,-29.115558624267578,-26.992923736572266,0
The universities correspond.,The university correspond.,morphology,subject_verb_agreement,regular_plural_subject_verb_agreement_2,True,False,True,False,112,-26.430505752563477,-26.033523559570312,0
The boys flee from Marcus.,The boy flee from Marcus.,morphology,subject_verb_agreement,regular_plural_subject_verb_agreement_2,True,False,True,False,113,-36.855037689208984,-37.77162170410156,1
The waitresses have trained.,The waitress have trained.,morphology,subject_verb_agreement,regular_plural_subject_verb_agreement_2,True,False,True,False,114,-40.9550666809082,-31.959186553955078,0
The girls weren't examining some book.,The girl weren't examining some book.,morphology,subject_verb_agreement,regular_plural_subject_verb_agreement_2,True,False,True,False,115,-41.11913299560547,-42.22758483886719,1
The drivers have spoken up.,The driver have spoken up.,morphology,subject_verb_agreement,regular_plural_subject_verb_agreement_2,True,False,True,False,116,-30.156749725341797,-29.727210998535156,0
The rug irritates Helen.,The rugs irritates Helen.,morphology,subject_verb_agreement,regular_plural_subject_verb_agreement_2,True,False,True,False,117,-41.68822479248047,-44.0445556640625,1
The boy hates Melanie.,The boys hates Melanie.,morphology,subject_verb_agreement,regular_plural_subject_verb_agreement_2,True,False,True,False,118,-31.28607940673828,-32.579124450683594,1
The bird upsets Timothy.,The birds upsets Timothy.,morphology,subject_verb_agreement,regular_plural_subject_verb_agreement_2,True,False,True,False,119,-39.512908935546875,-40.057647705078125,1
The movies disturb Randolf.,The movie disturb Randolf.,morphology,subject_verb_agreement,regular_plural_subject_verb_agreement_2,True,False,True,False,120,-47.54573059082031,-45.76201629638672,0
The actresses were exploring that school.,The actress were exploring that school.,morphology,subject_verb_agreement,regular_plural_subject_verb_agreement_2,True,False,True,False,121,-40.110469818115234,-40.35706329345703,1
The museums weren't changing.,The museum weren't changing.,morphology,subject_verb_agreement,regular_plural_subject_verb_agreement_2,True,False,True,False,122,-34.88832092285156,-32.37736892700195,0
The museums are joking around.,The museum are joking around.,morphology,subject_verb_agreement,regular_plural_subject_verb_agreement_2,True,False,True,False,123,-34.151031494140625,-32.49101257324219,0
The children care for Phillip.,The child care for Phillip.,morphology,subject_verb_agreement,regular_plural_subject_verb_agreement_2,True,False,True,False,124,-35.502342224121094,-36.43059158325195,1
The customer was yelling.,The customers was yelling.,morphology,subject_verb_agreement,regular_plural_subject_verb_agreement_2,True,False,True,False,125,-26.925735473632812,-29.778453826904297,1
The actress climbs down that hill.,The actresses climbs down that hill.,morphology,subject_verb_agreement,regular_plural_subject_verb_agreement_2,True,False,True,False,126,-40.989166259765625,-41.41737365722656,1
The senators hide.,The senator hide.,morphology,subject_verb_agreement,regular_plural_subject_verb_agreement_2,True,False,True,False,127,-24.61414909362793,-25.212169647216797,1
The boy has some jackets.,The boys has some jackets.,morphology,subject_verb_agreement,regular_plural_subject_verb_agreement_2,True,False,True,False,128,-30.24329376220703,-31.625240325927734,1
