sentence_good,sentence_bad,field,linguistics_term,UID,simple_LM_method,one_prefix_method,two_prefix_method,lexically_identical,pair_id,good_prob,bad_prob,correct
The ladies negotiate.,The lady negotiate.,morphology,subject_verb_agreement,regular_plural_subject_verb_agreement_2,True,False,True,False,513,-25.528779983520508,-24.62021255493164,0
The teenagers like that movie theater.,The teenager like that movie theater.,morphology,subject_verb_agreement,regular_plural_subject_verb_agreement_2,True,False,True,False,514,-40.153682708740234,-40.412445068359375,1
The dancer hasn't arrived at the mountains.,The dancers hasn't arrived at the mountains.,morphology,subject_verb_agreement,regular_plural_subject_verb_agreement_2,True,False,True,False,515,-43.07994842529297,-43.54539108276367,1
The customers aren't boring Raymond.,The customer aren't boring Raymond.,morphology,subject_verb_agreement,regular_plural_subject_verb_agreement_2,True,False,True,False,516,-45.71075439453125,-45.70405578613281,0
The guys drink.,The guy drink.,morphology,subject_verb_agreement,regular_plural_subject_verb_agreement_2,True,False,True,False,517,-21.529495239257812,-22.5748291015625,1
The patients are saluting.,The patient are saluting.,morphology,subject_verb_agreement,regular_plural_subject_verb_agreement_2,True,False,True,False,518,-36.70894241333008,-37.67768478393555,1
The couches chip.,The couch chip.,morphology,subject_verb_agreement,regular_plural_subject_verb_agreement_2,True,False,True,False,519,-31.27849578857422,-25.152074813842773,0
The adult visits an actress.,The adults visits an actress.,morphology,subject_verb_agreement,regular_plural_subject_verb_agreement_2,True,False,True,False,520,-36.91182327270508,-38.60458755493164,1
The governments haven't interacted.,The government haven't interacted.,morphology,subject_verb_agreement,regular_plural_subject_verb_agreement_2,True,False,True,False,521,-37.796234130859375,-36.88969421386719,0
The waiters aren't approving.,The waiter aren't approving.,morphology,subject_verb_agreement,regular_plural_subject_verb_agreement_2,True,False,True,False,522,-44.932281494140625,-37.33980941772461,0
The actors compromise.,The actor compromise.,morphology,subject_verb_agreement,regular_plural_subject_verb_agreement_2,True,False,True,False,523,-26.213436126708984,-26.324615478515625,1
The teachers suffer.,The teacher suffer.,morphology,subject_verb_agreement,regular_plural_subject_verb_agreement_2,True,False,True,False,524,-23.517379760742188,-23.68610191345215,1
The shirt isn't annoying Craig.,The shirts isn't annoying Craig.,morphology,subject_verb_agreement,regular_plural_subject_verb_agreement_2,True,False,True,False,525,-44.35348892211914,-45.39257049560547,1
The dancers irritate Emily.,The dancer irritate Emily.,morphology,subject_verb_agreement,regular_plural_subject_verb_agreement_2,True,False,True,False,526,-42.824073791503906,-41.7145881652832,0
The committee discusses some teacher.,The committees discusses some teacher.,morphology,subject_verb_agreement,regular_plural_subject_verb_agreement_2,True,False,True,False,527,-39.741355895996094,-43.9896240234375,1
The dancers exit the grocery stores.,The dancer exit the grocery stores.,morphology,subject_verb_agreement,regular_plural_subject_verb_agreement_2,True,False,True,False,528,-48.74673080444336,-48.361392974853516,0
The adults assemble.,The adult assemble.,morphology,subject_verb_agreement,regular_plural_subject_verb_agreement_2,True,False,True,False,529,-25.32491111755371,-24.719629287719727,0
The dancer was questioning Martha.,The dancers was questioning Martha.,morphology,subject_verb_agreement,regular_plural_subject_verb_agreement_2,True,False,True,False,530,-40.511661529541016,-42.92851257324219,1
The boy murmurs.,The boys murmurs.,morphology,subject_verb_agreement,regular_plural_subject_verb_agreement_2,True,False,True,False,531,-26.259851455688477,-26.232812881469727,0
The actress hasn't gotten a job.,The actresses hasn't gotten a job.,morphology,subject_verb_agreement,regular_plural_subject_verb_agreement_2,True,False,True,False,532,-37.12705993652344,-41.76355743408203,1
The students haven't assembled.,The student haven't assembled.,morphology,subject_verb_agreement,regular_plural_subject_verb_agreement_2,True,False,True,False,533,-32.255340576171875,-34.953277587890625,1
The waitresses haven't discussed every cashier.,The waitress haven't discussed every cashier.,morphology,subject_verb_agreement,regular_plural_subject_verb_agreement_2,True,False,True,False,534,-68.46720886230469,-59.16474151611328,0
The pedestrians tour most hospitals.,The pedestrian tour most hospitals.,morphology,subject_verb_agreement,regular_plural_subject_verb_agreement_2,True,False,True,False,535,-45.466583251953125,-44.11141586303711,0
The pictures haven't looked like some women.,The picture haven't looked like some women.,morphology,subject_verb_agreement,regular_plural_subject_verb_agreement_2,True,False,True,False,536,-44.482879638671875,-44.39450454711914,0
The governments haven't described Kristin.,The government haven't described Kristin.,morphology,subject_verb_agreement,regular_plural_subject_verb_agreement_2,True,False,True,False,537,-50.088531494140625,-48.47270965576172,0
The library hasn't fired Melinda.,The libraries hasn't fired Melinda.,morphology,subject_verb_agreement,regular_plural_subject_verb_agreement_2,True,False,True,False,538,-52.88166427612305,-56.066917419433594,1
The patients dislike the teacher.,The patient dislike the teacher.,morphology,subject_verb_agreement,regular_plural_subject_verb_agreement_2,True,False,True,False,539,-36.69740295410156,-34.681396484375,0
The teacher wasn't escaping from Tina.,The teachers wasn't escaping from Tina.,morphology,subject_verb_agreement,regular_plural_subject_verb_agreement_2,True,False,True,False,540,-48.3426513671875,-49.57275390625,1
The waiter was skated around glaciers.,The waiters was skated around glaciers.,morphology,subject_verb_agreement,regular_plural_subject_verb_agreement_2,True,False,True,False,541,-50.157230377197266,-58.260589599609375,1
The museum is admiring many boys.,The museums is admiring many boys.,morphology,subject_verb_agreement,regular_plural_subject_verb_agreement_2,True,False,True,False,542,-45.088966369628906,-48.2501335144043,1
The girls aren't waving.,The girl aren't waving.,morphology,subject_verb_agreement,regular_plural_subject_verb_agreement_2,True,False,True,False,543,-28.42525863647461,-29.087858200073242,1
The photographs were looking like Deanna.,The photograph were looking like Deanna.,morphology,subject_verb_agreement,regular_plural_subject_verb_agreement_2,True,False,True,False,544,-47.40843963623047,-48.470298767089844,1
The shawl appears.,The shawls appears.,morphology,subject_verb_agreement,regular_plural_subject_verb_agreement_2,True,False,True,False,545,-32.81763458251953,-34.650169372558594,1
The actors were baking.,The actor were baking.,morphology,subject_verb_agreement,regular_plural_subject_verb_agreement_2,True,False,True,False,546,-29.27682113647461,-30.760269165039062,1
The bank has forfeited.,The banks has forfeited.,morphology,subject_verb_agreement,regular_plural_subject_verb_agreement_2,True,False,True,False,547,-33.78925323486328,-34.443397521972656,1
The association was fighting.,The associations was fighting.,morphology,subject_verb_agreement,regular_plural_subject_verb_agreement_2,True,False,True,False,548,-24.078311920166016,-24.715511322021484,1
The organization isn't explaining everything.,The organizations isn't explaining everything.,morphology,subject_verb_agreement,regular_plural_subject_verb_agreement_2,True,False,True,False,549,-38.662254333496094,-40.785728454589844,1
The doctor sees Pamela.,The doctors sees Pamela.,morphology,subject_verb_agreement,regular_plural_subject_verb_agreement_2,True,False,True,False,550,-31.506181716918945,-33.80805969238281,1
The senators embarrasses Martin.,The senator embarrasses Martin.,morphology,subject_verb_agreement,regular_plural_subject_verb_agreement_2,True,False,True,False,551,-44.17581558227539,-44.98086929321289,1
The lady researches the play.,The ladies researches the play.,morphology,subject_verb_agreement,regular_plural_subject_verb_agreement_2,True,False,True,False,552,-40.26555252075195,-42.596378326416016,1
The universities have clashed.,The university have clashed.,morphology,subject_verb_agreement,regular_plural_subject_verb_agreement_2,True,False,True,False,553,-31.44868278503418,-31.952224731445312,1
The association hasn't loved the documentaries.,The associations hasn't loved the documentaries.,morphology,subject_verb_agreement,regular_plural_subject_verb_agreement_2,True,False,True,False,554,-48.020477294921875,-48.781280517578125,1
The adult testifies.,The adults testifies.,morphology,subject_verb_agreement,regular_plural_subject_verb_agreement_2,True,False,True,False,555,-33.33106231689453,-35.26921463012695,1
The cashier has complained about Susan.,The cashiers has complained about Susan.,morphology,subject_verb_agreement,regular_plural_subject_verb_agreement_2,True,False,True,False,556,-53.536895751953125,-53.73725891113281,1
The girl has explained everything.,The girls has explained everything.,morphology,subject_verb_agreement,regular_plural_subject_verb_agreement_2,True,False,True,False,557,-30.92678451538086,-33.44664001464844,1
The glasses weren't slipping.,The glass weren't slipping.,morphology,subject_verb_agreement,regular_plural_subject_verb_agreement_2,True,False,True,False,558,-34.18639373779297,-33.2208251953125,0
The guy has washed.,The guys has washed.,morphology,subject_verb_agreement,regular_plural_subject_verb_agreement_2,True,False,True,False,559,-25.489768981933594,-28.305070877075195,1
The waiters sneeze.,The waiter sneeze.,morphology,subject_verb_agreement,regular_plural_subject_verb_agreement_2,True,False,True,False,560,-39.924922943115234,-33.9407844543457,0
The coat has wrinkled.,The coats has wrinkled.,morphology,subject_verb_agreement,regular_plural_subject_verb_agreement_2,True,False,True,False,561,-31.805099487304688,-34.17750549316406,1
The patient messes up these hospitals.,The patients messes up these hospitals.,morphology,subject_verb_agreement,regular_plural_subject_verb_agreement_2,True,False,True,False,562,-53.3038215637207,-53.42121505737305,1
The adults were surrendering.,The adult were surrendering.,morphology,subject_verb_agreement,regular_plural_subject_verb_agreement_2,True,False,True,False,563,-31.78784942626953,-34.345298767089844,1
The customer cleans those glasses.,The customers cleans those glasses.,morphology,subject_verb_agreement,regular_plural_subject_verb_agreement_2,True,False,True,False,564,-40.130008697509766,-42.770050048828125,1
The legislatures haven't worried.,The legislature haven't worried.,morphology,subject_verb_agreement,regular_plural_subject_verb_agreement_2,True,False,True,False,565,-34.23387145996094,-32.52466583251953,0
The adults have approved.,The adult have approved.,morphology,subject_verb_agreement,regular_plural_subject_verb_agreement_2,True,False,True,False,566,-27.1672420501709,-30.263919830322266,1
The children are debating.,The child are debating.,morphology,subject_verb_agreement,regular_plural_subject_verb_agreement_2,True,False,True,False,567,-23.862770080566406,-26.477872848510742,1
The guy worries.,The guys worries.,morphology,subject_verb_agreement,regular_plural_subject_verb_agreement_2,True,False,True,False,568,-24.83541488647461,-24.658660888671875,0
The customer investigates Edward.,The customers investigates Edward.,morphology,subject_verb_agreement,regular_plural_subject_verb_agreement_2,True,False,True,False,569,-40.08456802368164,-41.65195846557617,1
The university conceals Marla.,The universities conceals Marla.,morphology,subject_verb_agreement,regular_plural_subject_verb_agreement_2,True,False,True,False,570,-49.14263153076172,-50.00806427001953,1
The customer hates Ella.,The customers hates Ella.,morphology,subject_verb_agreement,regular_plural_subject_verb_agreement_2,True,False,True,False,571,-39.092830657958984,-41.84954071044922,1
The actresses die.,The actress die.,morphology,subject_verb_agreement,regular_plural_subject_verb_agreement_2,True,False,True,False,572,-24.646072387695312,-23.01139259338379,0
The guy flees from Carla.,The guys flees from Carla.,morphology,subject_verb_agreement,regular_plural_subject_verb_agreement_2,True,False,True,False,573,-52.66225814819336,-52.66496276855469,1
The company knows all waitresses.,The companies knows all waitresses.,morphology,subject_verb_agreement,regular_plural_subject_verb_agreement_2,True,False,True,False,574,-45.314414978027344,-47.942508697509766,1
The guys shout.,The guy shout.,morphology,subject_verb_agreement,regular_plural_subject_verb_agreement_2,True,False,True,False,575,-22.772546768188477,-23.502721786499023,1
The girl has sat down.,The girls has sat down.,morphology,subject_verb_agreement,regular_plural_subject_verb_agreement_2,True,False,True,False,576,-24.176467895507812,-26.52733612060547,1
The brochures aren't disturbing Brian.,The brochure aren't disturbing Brian.,morphology,subject_verb_agreement,regular_plural_subject_verb_agreement_2,True,False,True,False,577,-53.71828842163086,-55.53791427612305,1
The girl hasn't written.,The girls hasn't written.,morphology,subject_verb_agreement,regular_plural_subject_verb_agreement_2,True,False,True,False,578,-26.73924446105957,-28.006362915039062,1
The senators haven't seen those shirts.,The senator haven't seen those shirts.,morphology,subject_verb_agreement,regular_plural_subject_verb_agreement_2,True,False,True,False,579,-42.389583587646484,-43.738372802734375,1
The jackets fray.,The jacket fray.,morphology,subject_verb_agreement,regular_plural_subject_verb_agreement_2,True,False,True,False,580,-28.822723388671875,-27.699851989746094,0
The drivers have admired some movie theater.,The driver have admired some movie theater.,morphology,subject_verb_agreement,regular_plural_subject_verb_agreement_2,True,False,True,False,581,-53.42563247680664,-52.45123291015625,0
The banks worry Tracy.,The bank worry Tracy.,morphology,subject_verb_agreement,regular_plural_subject_verb_agreement_2,True,False,True,False,582,-34.65125274658203,-34.780250549316406,1
The ladies shock Thomas.,The lady shock Thomas.,morphology,subject_verb_agreement,regular_plural_subject_verb_agreement_2,True,False,True,False,583,-34.116371154785156,-31.703323364257812,0
The committees irritate George.,The committee irritate George.,morphology,subject_verb_agreement,regular_plural_subject_verb_agreement_2,True,False,True,False,584,-43.82374572753906,-40.58549499511719,0
The teachers haven't boycotted that hospital.,The teacher haven't boycotted that hospital.,morphology,subject_verb_agreement,regular_plural_subject_verb_agreement_2,True,False,True,False,585,-63.030555725097656,-63.47014617919922,1
The lady has watched Tara.,The ladies has watched Tara.,morphology,subject_verb_agreement,regular_plural_subject_verb_agreement_2,True,False,True,False,586,-36.0600700378418,-40.125099182128906,1
The blouses have stretched.,The blouse have stretched.,morphology,subject_verb_agreement,regular_plural_subject_verb_agreement_2,True,False,True,False,587,-37.348487854003906,-35.8544921875,0
The waiters were hiding away.,The waiter were hiding away.,morphology,subject_verb_agreement,regular_plural_subject_verb_agreement_2,True,False,True,False,588,-35.10322570800781,-27.70816993713379,0
The boys hug Christina.,The boy hug Christina.,morphology,subject_verb_agreement,regular_plural_subject_verb_agreement_2,True,False,True,False,589,-31.866619110107422,-31.783920288085938,0
The dancers annoy this dancer.,The dancer annoy this dancer.,morphology,subject_verb_agreement,regular_plural_subject_verb_agreement_2,True,False,True,False,590,-40.64976119995117,-39.962745666503906,0
The cashier helps some people.,The cashiers helps some people.,morphology,subject_verb_agreement,regular_plural_subject_verb_agreement_2,True,False,True,False,591,-42.83580017089844,-42.91016387939453,1
The girl wasn't examining a report.,The girls wasn't examining a report.,morphology,subject_verb_agreement,regular_plural_subject_verb_agreement_2,True,False,True,False,592,-40.26102828979492,-41.58352279663086,1
The patients haven't upset Cheryl.,The patient haven't upset Cheryl.,morphology,subject_verb_agreement,regular_plural_subject_verb_agreement_2,True,False,True,False,593,-45.29803466796875,-45.28396987915039,0
The boy appreciates most children.,The boys appreciates most children.,morphology,subject_verb_agreement,regular_plural_subject_verb_agreement_2,True,False,True,False,594,-42.17006301879883,-40.90237045288086,0
The pedestrians chuckle.,The pedestrian chuckle.,morphology,subject_verb_agreement,regular_plural_subject_verb_agreement_2,True,False,True,False,595,-28.86585235595703,-26.810009002685547,0
The shoe loosens.,The shoes loosens.,morphology,subject_verb_agreement,regular_plural_subject_verb_agreement_2,True,False,True,False,596,-30.577720642089844,-31.222192764282227,1
The senators scan this documentary.,The senator scan this documentary.,morphology,subject_verb_agreement,regular_plural_subject_verb_agreement_2,True,False,True,False,597,-42.94208908081055,-42.38013458251953,0
The ladies were insulting Dan.,The lady were insulting Dan.,morphology,subject_verb_agreement,regular_plural_subject_verb_agreement_2,True,False,True,False,598,-37.16184997558594,-37.018524169921875,0
The patients haven't spoken up.,The patient haven't spoken up.,morphology,subject_verb_agreement,regular_plural_subject_verb_agreement_2,True,False,True,False,599,-35.566436767578125,-36.360443115234375,1
The waiter cooks.,The waiters cooks.,morphology,subject_verb_agreement,regular_plural_subject_verb_agreement_2,True,False,True,False,600,-24.118059158325195,-32.038692474365234,1
The rabbits climb up the ladders.,The rabbit climb up the ladders.,morphology,subject_verb_agreement,regular_plural_subject_verb_agreement_2,True,False,True,False,601,-36.60295104980469,-34.72502517700195,0
The socks are twisting.,The sock are twisting.,morphology,subject_verb_agreement,regular_plural_subject_verb_agreement_2,True,False,True,False,602,-29.644092559814453,-31.735694885253906,1
The doctors haven't collaborated.,The doctor haven't collaborated.,morphology,subject_verb_agreement,regular_plural_subject_verb_agreement_2,True,False,True,False,603,-35.693275451660156,-36.38129425048828,1
The teenagers clash.,The teenager clash.,morphology,subject_verb_agreement,regular_plural_subject_verb_agreement_2,True,False,True,False,604,-28.566810607910156,-28.78314971923828,1
The couches have slipped.,The couch have slipped.,morphology,subject_verb_agreement,regular_plural_subject_verb_agreement_2,True,False,True,False,605,-34.0804557800293,-30.006446838378906,0
The waiter has respected Bruce.,The waiters has respected Bruce.,morphology,subject_verb_agreement,regular_plural_subject_verb_agreement_2,True,False,True,False,606,-41.73358154296875,-51.22030258178711,1
The actress hasn't concurred.,The actresses hasn't concurred.,morphology,subject_verb_agreement,regular_plural_subject_verb_agreement_2,True,False,True,False,607,-44.05580139160156,-47.2066764831543,1
The teachers haven't disagreed.,The teacher haven't disagreed.,morphology,subject_verb_agreement,regular_plural_subject_verb_agreement_2,True,False,True,False,608,-32.83220672607422,-33.897865295410156,1
The senators were scanning these books.,The senator were scanning these books.,morphology,subject_verb_agreement,regular_plural_subject_verb_agreement_2,True,False,True,False,609,-39.249755859375,-41.25806427001953,1
The pedestrian slumps over.,The pedestrians slumps over.,morphology,subject_verb_agreement,regular_plural_subject_verb_agreement_2,True,False,True,False,610,-36.16864013671875,-37.22303009033203,1
The driver protests.,The drivers protests.,morphology,subject_verb_agreement,regular_plural_subject_verb_agreement_2,True,False,True,False,611,-22.39557647705078,-24.36754608154297,1
The cashiers help Wendy.,The cashier help Wendy.,morphology,subject_verb_agreement,regular_plural_subject_verb_agreement_2,True,False,True,False,612,-44.552711486816406,-45.54411315917969,1
The dresses loosen.,The dress loosen.,morphology,subject_verb_agreement,regular_plural_subject_verb_agreement_2,True,False,True,False,613,-29.203760147094727,-27.72403335571289,0
The cafe embarrasses Steve.,The cafes embarrasses Steve.,morphology,subject_verb_agreement,regular_plural_subject_verb_agreement_2,True,False,True,False,614,-46.84109878540039,-48.10718536376953,1
The waiters have complained about politics.,The waiter have complained about politics.,morphology,subject_verb_agreement,regular_plural_subject_verb_agreement_2,True,False,True,False,615,-49.78343200683594,-43.761940002441406,0
The ladies have biked to some grocery store.,The lady have biked to some grocery store.,morphology,subject_verb_agreement,regular_plural_subject_verb_agreement_2,True,False,True,False,616,-58.71071243286133,-57.561790466308594,0
The student breaks many couches.,The students breaks many couches.,morphology,subject_verb_agreement,regular_plural_subject_verb_agreement_2,True,False,True,False,617,-46.279762268066406,-46.892860412597656,1
The coat isn't wrinkling.,The coats isn't wrinkling.,morphology,subject_verb_agreement,regular_plural_subject_verb_agreement_2,True,False,True,False,618,-34.34409713745117,-36.65446472167969,1
The patients work with Martha.,The patient work with Martha.,morphology,subject_verb_agreement,regular_plural_subject_verb_agreement_2,True,False,True,False,619,-36.16131591796875,-34.29627227783203,0
The drivers have hugged.,The driver have hugged.,morphology,subject_verb_agreement,regular_plural_subject_verb_agreement_2,True,False,True,False,620,-30.80455207824707,-29.980146408081055,0
The shawl hasn't frayed.,The shawls hasn't frayed.,morphology,subject_verb_agreement,regular_plural_subject_verb_agreement_2,True,False,True,False,621,-51.251953125,-51.92249298095703,1
The adults aren't clashing.,The adult aren't clashing.,morphology,subject_verb_agreement,regular_plural_subject_verb_agreement_2,True,False,True,False,622,-37.55595016479492,-35.400733947753906,0
The hospitals were working with Steve.,The hospital were working with Steve.,morphology,subject_verb_agreement,regular_plural_subject_verb_agreement_2,True,False,True,False,623,-39.4178581237793,-36.75164794921875,0
The committees are retaliating.,The committee are retaliating.,morphology,subject_verb_agreement,regular_plural_subject_verb_agreement_2,True,False,True,False,624,-36.680213928222656,-34.33795166015625,0
The students haven't gone to every school.,The student haven't gone to every school.,morphology,subject_verb_agreement,regular_plural_subject_verb_agreement_2,True,False,True,False,625,-41.405616760253906,-44.5022087097168,1
The schools weren't disturbing a lot of actors.,The school weren't disturbing a lot of actors.,morphology,subject_verb_agreement,regular_plural_subject_verb_agreement_2,True,False,True,False,626,-51.78435516357422,-50.47541046142578,0
The company has argued about Maria.,The companies has argued about Maria.,morphology,subject_verb_agreement,regular_plural_subject_verb_agreement_2,True,False,True,False,627,-42.61350631713867,-45.57502746582031,1
The fork disturbs Tina.,The forks disturbs Tina.,morphology,subject_verb_agreement,regular_plural_subject_verb_agreement_2,True,False,True,False,628,-46.52436828613281,-47.801597595214844,1
The guys have whispered.,The guy have whispered.,morphology,subject_verb_agreement,regular_plural_subject_verb_agreement_2,True,False,True,False,629,-28.05794334411621,-29.890121459960938,1
The art galleries resemble some photographs.,The art gallery resemble some photographs.,morphology,subject_verb_agreement,regular_plural_subject_verb_agreement_2,True,False,True,False,630,-47.43470764160156,-47.99156188964844,1
The patients haven't married.,The patient haven't married.,morphology,subject_verb_agreement,regular_plural_subject_verb_agreement_2,True,False,True,False,631,-30.85772132873535,-31.343372344970703,1
The cat leaves.,The cats leaves.,morphology,subject_verb_agreement,regular_plural_subject_verb_agreement_2,True,False,True,False,632,-17.089324951171875,-19.991016387939453,1
The actress reacts.,The actresses reacts.,morphology,subject_verb_agreement,regular_plural_subject_verb_agreement_2,True,False,True,False,633,-25.875288009643555,-26.673789978027344,1
The waitresses attack the girl.,The waitress attack the girl.,morphology,subject_verb_agreement,regular_plural_subject_verb_agreement_2,True,False,True,False,634,-45.697547912597656,-36.21324920654297,0
The senators arrive at high schools.,The senator arrive at high schools.,morphology,subject_verb_agreement,regular_plural_subject_verb_agreement_2,True,False,True,False,635,-41.87620162963867,-42.28312683105469,1
The shirts are soaking.,The shirt are soaking.,morphology,subject_verb_agreement,regular_plural_subject_verb_agreement_2,True,False,True,False,636,-29.262386322021484,-31.15530014038086,1
The customer messes up the cup.,The customers messes up the cup.,morphology,subject_verb_agreement,regular_plural_subject_verb_agreement_2,True,False,True,False,637,-47.25749206542969,-48.037025451660156,1
The schools profit.,The school profit.,morphology,subject_verb_agreement,regular_plural_subject_verb_agreement_2,True,False,True,False,638,-25.61410903930664,-23.596899032592773,0
The boys sigh.,The boy sigh.,morphology,subject_verb_agreement,regular_plural_subject_verb_agreement_2,True,False,True,False,639,-19.33469009399414,-19.349430084228516,1
The teenagers exercise.,The teenager exercise.,morphology,subject_verb_agreement,regular_plural_subject_verb_agreement_2,True,False,True,False,640,-25.669795989990234,-26.030643463134766,1
