sentence_good,sentence_bad,field,linguistics_term,UID,simple_LM_method,one_prefix_method,two_prefix_method,lexically_identical,pair_id,good_prob,bad_prob,correct
The hamster scares Rhonda.,The hamsters scares Rhonda.,morphology,subject_verb_agreement,regular_plural_subject_verb_agreement_2,True,False,True,False,641,-54.29033660888672,-56.601104736328125,1
The boy stands up.,The boys stands up.,morphology,subject_verb_agreement,regular_plural_subject_verb_agreement_2,True,False,True,False,642,-20.7873592376709,-20.93094825744629,1
The boy flees from some restaurant.,The boys flees from some restaurant.,morphology,subject_verb_agreement,regular_plural_subject_verb_agreement_2,True,False,True,False,643,-48.01511764526367,-47.00403594970703,0
The libraries haven't answered.,The library haven't answered.,morphology,subject_verb_agreement,regular_plural_subject_verb_agreement_2,True,False,True,False,644,-35.207035064697266,-33.51118469238281,0
The cup confuses some teenager.,The cups confuses some teenager.,morphology,subject_verb_agreement,regular_plural_subject_verb_agreement_2,True,False,True,False,645,-48.692588806152344,-49.271209716796875,1
The committee isn't coping.,The committees isn't coping.,morphology,subject_verb_agreement,regular_plural_subject_verb_agreement_2,True,False,True,False,646,-32.95402908325195,-37.42742156982422,1
The drivers compromise.,The driver compromise.,morphology,subject_verb_agreement,regular_plural_subject_verb_agreement_2,True,False,True,False,647,-26.43999481201172,-25.636009216308594,0
The actress isn't spinning around.,The actresses isn't spinning around.,morphology,subject_verb_agreement,regular_plural_subject_verb_agreement_2,True,False,True,False,648,-36.178924560546875,-39.624549865722656,1
The blouses disturb Kendra.,The blouse disturb Kendra.,morphology,subject_verb_agreement,regular_plural_subject_verb_agreement_2,True,False,True,False,649,-54.72454071044922,-53.47151184082031,0
The actresses are bringing that cilantro.,The actress are bringing that cilantro.,morphology,subject_verb_agreement,regular_plural_subject_verb_agreement_2,True,False,True,False,650,-53.36319351196289,-53.4505500793457,1
The organizations know Alexander.,The organization know Alexander.,morphology,subject_verb_agreement,regular_plural_subject_verb_agreement_2,True,False,True,False,651,-35.51422882080078,-33.93811798095703,0
The car is falling.,The cars is falling.,morphology,subject_verb_agreement,regular_plural_subject_verb_agreement_2,True,False,True,False,652,-21.717952728271484,-25.48562240600586,1
The reports have scared George.,The report have scared George.,morphology,subject_verb_agreement,regular_plural_subject_verb_agreement_2,True,False,True,False,653,-40.43716049194336,-38.263282775878906,0
The students have helped Sara.,The student have helped Sara.,morphology,subject_verb_agreement,regular_plural_subject_verb_agreement_2,True,False,True,False,654,-35.42417907714844,-37.57630920410156,1
The ladies fight.,The lady fight.,morphology,subject_verb_agreement,regular_plural_subject_verb_agreement_2,True,False,True,False,655,-21.487398147583008,-19.466732025146484,0
The waiter complains about Frank.,The waiters complains about Frank.,morphology,subject_verb_agreement,regular_plural_subject_verb_agreement_2,True,False,True,False,656,-40.19043731689453,-49.2662353515625,1
The legislature profits.,The legislatures profits.,morphology,subject_verb_agreement,regular_plural_subject_verb_agreement_2,True,False,True,False,657,-26.677967071533203,-28.92656707763672,1
The patient hasn't played.,The patients hasn't played.,morphology,subject_verb_agreement,regular_plural_subject_verb_agreement_2,True,False,True,False,658,-30.302766799926758,-32.354835510253906,1
The ladies alarms Gina.,The lady alarms Gina.,morphology,subject_verb_agreement,regular_plural_subject_verb_agreement_2,True,False,True,False,659,-38.51837921142578,-35.447425842285156,0
The guys stand up.,The guy stand up.,morphology,subject_verb_agreement,regular_plural_subject_verb_agreement_2,True,False,True,False,660,-21.481422424316406,-23.706850051879883,1
The plates are tipping over.,The plate are tipping over.,morphology,subject_verb_agreement,regular_plural_subject_verb_agreement_2,True,False,True,False,661,-32.549407958984375,-34.35266876220703,1
The senator hasn't revealed Keith.,The senators hasn't revealed Keith.,morphology,subject_verb_agreement,regular_plural_subject_verb_agreement_2,True,False,True,False,662,-46.49535369873047,-46.83747863769531,1
The movies sound like Kayla.,The movie sound like Kayla.,morphology,subject_verb_agreement,regular_plural_subject_verb_agreement_2,True,False,True,False,663,-43.573631286621094,-40.83966064453125,0
The companies annoy Ann.,The company annoy Ann.,morphology,subject_verb_agreement,regular_plural_subject_verb_agreement_2,True,False,True,False,664,-36.11017990112305,-34.00669860839844,0
The actor isn't attacking Rhonda.,The actors isn't attacking Rhonda.,morphology,subject_verb_agreement,regular_plural_subject_verb_agreement_2,True,False,True,False,665,-52.2341194152832,-53.60911560058594,1
The teachers haven't exited all movie theaters.,The teacher haven't exited all movie theaters.,morphology,subject_verb_agreement,regular_plural_subject_verb_agreement_2,True,False,True,False,666,-62.734039306640625,-63.754905700683594,1
The senator wakes up.,The senators wakes up.,morphology,subject_verb_agreement,regular_plural_subject_verb_agreement_2,True,False,True,False,667,-26.06673240661621,-25.922773361206055,0
The schools impress Jeffrey.,The school impress Jeffrey.,morphology,subject_verb_agreement,regular_plural_subject_verb_agreement_2,True,False,True,False,668,-38.073158264160156,-35.78374099731445,0
The teacher runs around the bank.,The teachers runs around the bank.,morphology,subject_verb_agreement,regular_plural_subject_verb_agreement_2,True,False,True,False,669,-31.45486068725586,-32.92657470703125,1
The schools protest.,The school protest.,morphology,subject_verb_agreement,regular_plural_subject_verb_agreement_2,True,False,True,False,670,-25.716344833374023,-22.680435180664062,0
The teachers observe Amanda.,The teacher observe Amanda.,morphology,subject_verb_agreement,regular_plural_subject_verb_agreement_2,True,False,True,False,671,-36.28044891357422,-35.955078125,0
The dancers haven't slumped over.,The dancer haven't slumped over.,morphology,subject_verb_agreement,regular_plural_subject_verb_agreement_2,True,False,True,False,672,-40.084510803222656,-39.777565002441406,0
The chairs are dropping.,The chair are dropping.,morphology,subject_verb_agreement,regular_plural_subject_verb_agreement_2,True,False,True,False,673,-26.311805725097656,-26.16854476928711,0
The customer scratches.,The customers scratches.,morphology,subject_verb_agreement,regular_plural_subject_verb_agreement_2,True,False,True,False,674,-25.006145477294922,-26.561328887939453,1
The drivers haven't criticized Vanessa.,The driver haven't criticized Vanessa.,morphology,subject_verb_agreement,regular_plural_subject_verb_agreement_2,True,False,True,False,675,-48.82514190673828,-47.643672943115234,0
The waiters meet.,The waiter meet.,morphology,subject_verb_agreement,regular_plural_subject_verb_agreement_2,True,False,True,False,676,-31.497180938720703,-25.513710021972656,0
The patient hasn't gone to a movie theater.,The patients hasn't gone to a movie theater.,morphology,subject_verb_agreement,regular_plural_subject_verb_agreement_2,True,False,True,False,677,-51.45844650268555,-52.63127899169922,1
The teacher responds.,The teachers responds.,morphology,subject_verb_agreement,regular_plural_subject_verb_agreement_2,True,False,True,False,678,-24.202861785888672,-25.16524314880371,1
The museum annoys all children.,The museums annoys all children.,morphology,subject_verb_agreement,regular_plural_subject_verb_agreement_2,True,False,True,False,679,-39.49336242675781,-42.910179138183594,1
The associations are working hard.,The association are working hard.,morphology,subject_verb_agreement,regular_plural_subject_verb_agreement_2,True,False,True,False,680,-29.38473129272461,-29.480674743652344,1
The waitress was protesting.,The waitresses was protesting.,morphology,subject_verb_agreement,regular_plural_subject_verb_agreement_2,True,False,True,False,681,-29.18524932861328,-40.55827331542969,1
The organizations respect Diane.,The organization respect Diane.,morphology,subject_verb_agreement,regular_plural_subject_verb_agreement_2,True,False,True,False,682,-38.142677307128906,-36.717041015625,0
The senators aren't disagreeing with Edward.,The senator aren't disagreeing with Edward.,morphology,subject_verb_agreement,regular_plural_subject_verb_agreement_2,True,False,True,False,683,-53.28497314453125,-53.3322868347168,1
The patient isn't breaking that bicycle.,The patients isn't breaking that bicycle.,morphology,subject_verb_agreement,regular_plural_subject_verb_agreement_2,True,False,True,False,684,-45.32966995239258,-48.354408264160156,1
The drivers date.,The driver date.,morphology,subject_verb_agreement,regular_plural_subject_verb_agreement_2,True,False,True,False,685,-23.908939361572266,-22.108665466308594,0
The waiter approves.,The waiters approves.,morphology,subject_verb_agreement,regular_plural_subject_verb_agreement_2,True,False,True,False,686,-28.602096557617188,-35.802696228027344,1
The guest was fixing these screens.,The guests was fixing these screens.,morphology,subject_verb_agreement,regular_plural_subject_verb_agreement_2,True,False,True,False,687,-43.6771125793457,-44.57415771484375,1
The adults aren't embracing.,The adult aren't embracing.,morphology,subject_verb_agreement,regular_plural_subject_verb_agreement_2,True,False,True,False,688,-36.71001434326172,-35.735076904296875,0
The teachers haven't visited Kathleen.,The teacher haven't visited Kathleen.,morphology,subject_verb_agreement,regular_plural_subject_verb_agreement_2,True,False,True,False,689,-43.29469299316406,-43.83317947387695,1
The guy cleans a rug.,The guys cleans a rug.,morphology,subject_verb_agreement,regular_plural_subject_verb_agreement_2,True,False,True,False,690,-36.04475402832031,-38.72035217285156,1
The teacher hasn't broken a lot of convertibles.,The teachers hasn't broken a lot of convertibles.,morphology,subject_verb_agreement,regular_plural_subject_verb_agreement_2,True,False,True,False,691,-63.20460510253906,-63.848114013671875,1
The actors weren't touring Harvard University.,The actor weren't touring Harvard University.,morphology,subject_verb_agreement,regular_plural_subject_verb_agreement_2,True,False,True,False,692,-52.51786804199219,-50.559810638427734,0
The dish slips.,The dishs slips.,morphology,subject_verb_agreement,regular_plural_subject_verb_agreement_2,True,False,True,False,693,-22.993408203125,-27.476043701171875,1
The reports aren't confusing Stephen.,The report aren't confusing Stephen.,morphology,subject_verb_agreement,regular_plural_subject_verb_agreement_2,True,False,True,False,694,-50.52387619018555,-47.866397857666016,0
The pedestrians discover Lisa.,The pedestrian discover Lisa.,morphology,subject_verb_agreement,regular_plural_subject_verb_agreement_2,True,False,True,False,695,-40.728294372558594,-39.9700813293457,0
The actors weren't surrendering.,The actor weren't surrendering.,morphology,subject_verb_agreement,regular_plural_subject_verb_agreement_2,True,False,True,False,696,-39.15614318847656,-37.457855224609375,0
The senators were approving.,The senator were approving.,morphology,subject_verb_agreement,regular_plural_subject_verb_agreement_2,True,False,True,False,697,-28.894550323486328,-29.86766242980957,1
The adult is departing.,The adults is departing.,morphology,subject_verb_agreement,regular_plural_subject_verb_agreement_2,True,False,True,False,698,-28.12651824951172,-30.150161743164062,1
The customer swallows.,The customers swallows.,morphology,subject_verb_agreement,regular_plural_subject_verb_agreement_2,True,False,True,False,699,-30.49282455444336,-31.973373413085938,1
The actresses flee from Alicia.,The actress flee from Alicia.,morphology,subject_verb_agreement,regular_plural_subject_verb_agreement_2,True,False,True,False,700,-43.61174774169922,-40.06629943847656,0
The actresses were studying.,The actress were studying.,morphology,subject_verb_agreement,regular_plural_subject_verb_agreement_2,True,False,True,False,701,-26.169652938842773,-27.05994987487793,1
The girl boasts about every actress.,The girls boasts about every actress.,morphology,subject_verb_agreement,regular_plural_subject_verb_agreement_2,True,False,True,False,702,-46.065887451171875,-45.5723762512207,0
The pedestrian is taking some vase.,The pedestrians is taking some vase.,morphology,subject_verb_agreement,regular_plural_subject_verb_agreement_2,True,False,True,False,703,-47.02294158935547,-48.144500732421875,1
The girls hate George.,The girl hate George.,morphology,subject_verb_agreement,regular_plural_subject_verb_agreement_2,True,False,True,False,704,-29.3856258392334,-30.83642578125,1
The guest investigates Andrea.,The guests investigates Andrea.,morphology,subject_verb_agreement,regular_plural_subject_verb_agreement_2,True,False,True,False,705,-40.00431442260742,-41.38919448852539,1
The actresses weren't murmuring.,The actress weren't murmuring.,morphology,subject_verb_agreement,regular_plural_subject_verb_agreement_2,True,False,True,False,706,-42.546852111816406,-39.69676208496094,0
The dishes crack.,The dish crack.,morphology,subject_verb_agreement,regular_plural_subject_verb_agreement_2,True,False,True,False,707,-23.831207275390625,-22.251903533935547,0
The teachers have biked to all grocery stores.,The teacher have biked to all grocery stores.,morphology,subject_verb_agreement,regular_plural_subject_verb_agreement_2,True,False,True,False,708,-64.61446380615234,-65.29012298583984,1
The museum cooperates.,The museums cooperates.,morphology,subject_verb_agreement,regular_plural_subject_verb_agreement_2,True,False,True,False,709,-30.493152618408203,-33.87168502807617,1
The patient cures Martha.,The patients cures Martha.,morphology,subject_verb_agreement,regular_plural_subject_verb_agreement_2,True,False,True,False,710,-39.343971252441406,-41.702144622802734,1
The guest looks like this photograph.,The guests looks like this photograph.,morphology,subject_verb_agreement,regular_plural_subject_verb_agreement_2,True,False,True,False,711,-33.8204345703125,-36.25074005126953,1
The gloves haven't shrunk.,The glove haven't shrunk.,morphology,subject_verb_agreement,regular_plural_subject_verb_agreement_2,True,False,True,False,712,-35.795658111572266,-34.9998664855957,0
The banks admire Raymond.,The bank admire Raymond.,morphology,subject_verb_agreement,regular_plural_subject_verb_agreement_2,True,False,True,False,713,-33.657447814941406,-34.198673248291016,1
The guest has healed Sabrina.,The guests has healed Sabrina.,morphology,subject_verb_agreement,regular_plural_subject_verb_agreement_2,True,False,True,False,714,-50.01510238647461,-50.770442962646484,1
The sock unfolds.,The socks unfolds.,morphology,subject_verb_agreement,regular_plural_subject_verb_agreement_2,True,False,True,False,715,-26.86542510986328,-27.26342010498047,1
The universities were hiring Martha.,The university were hiring Martha.,morphology,subject_verb_agreement,regular_plural_subject_verb_agreement_2,True,False,True,False,716,-42.654335021972656,-41.746551513671875,0
The waiters aren't sighing.,The waiter aren't sighing.,morphology,subject_verb_agreement,regular_plural_subject_verb_agreement_2,True,False,True,False,717,-45.909706115722656,-38.103294372558594,0
The patients hire Derek.,The patient hire Derek.,morphology,subject_verb_agreement,regular_plural_subject_verb_agreement_2,True,False,True,False,718,-36.32219696044922,-36.76579284667969,1
The dancer suffers.,The dancers suffers.,morphology,subject_verb_agreement,regular_plural_subject_verb_agreement_2,True,False,True,False,719,-25.803932189941406,-25.406862258911133,0
The blouse wasn't soaking.,The blouses wasn't soaking.,morphology,subject_verb_agreement,regular_plural_subject_verb_agreement_2,True,False,True,False,720,-41.08814239501953,-43.046875,1
The story sounds like Janice.,The stories sounds like Janice.,morphology,subject_verb_agreement,regular_plural_subject_verb_agreement_2,True,False,True,False,721,-36.90663528442383,-41.23149490356445,1
The senators go to Spain.,The senator go to Spain.,morphology,subject_verb_agreement,regular_plural_subject_verb_agreement_2,True,False,True,False,722,-31.300086975097656,-31.538782119750977,1
The stories have alarmed Vanessa.,The story have alarmed Vanessa.,morphology,subject_verb_agreement,regular_plural_subject_verb_agreement_2,True,False,True,False,723,-41.282135009765625,-41.2391357421875,0
The students cry.,The student cry.,morphology,subject_verb_agreement,regular_plural_subject_verb_agreement_2,True,False,True,False,724,-22.746688842773438,-22.91325569152832,1
The actresses explore every library.,The actress explore every library.,morphology,subject_verb_agreement,regular_plural_subject_verb_agreement_2,True,False,True,False,725,-42.806312561035156,-41.16704559326172,0
The committees argue about Marie.,The committee argue about Marie.,morphology,subject_verb_agreement,regular_plural_subject_verb_agreement_2,True,False,True,False,726,-42.44928741455078,-38.75318145751953,0
The customer has explored Spain.,The customers has explored Spain.,morphology,subject_verb_agreement,regular_plural_subject_verb_agreement_2,True,False,True,False,727,-39.24890899658203,-41.928306579589844,1
The adults have hugged Alexander.,The adult have hugged Alexander.,morphology,subject_verb_agreement,regular_plural_subject_verb_agreement_2,True,False,True,False,728,-39.21800994873047,-43.65041732788086,1
The students donate.,The student donate.,morphology,subject_verb_agreement,regular_plural_subject_verb_agreement_2,True,False,True,False,729,-27.499879837036133,-28.295560836791992,1
The waitresses observe Rachel.,The waitress observe Rachel.,morphology,subject_verb_agreement,regular_plural_subject_verb_agreement_2,True,False,True,False,730,-49.92890930175781,-40.42317581176758,0
The museum isn't communicating.,The museums isn't communicating.,morphology,subject_verb_agreement,regular_plural_subject_verb_agreement_2,True,False,True,False,731,-32.55813217163086,-36.09573745727539,1
The girl gets a job.,The girls gets a job.,morphology,subject_verb_agreement,regular_plural_subject_verb_agreement_2,True,False,True,False,732,-25.06454849243164,-26.773366928100586,1
The dancer concurs.,The dancers concurs.,morphology,subject_verb_agreement,regular_plural_subject_verb_agreement_2,True,False,True,False,733,-34.51495361328125,-34.48921203613281,0
The brochures embarrass Gerald.,The brochure embarrass Gerald.,morphology,subject_verb_agreement,regular_plural_subject_verb_agreement_2,True,False,True,False,734,-47.29702377319336,-47.04958724975586,0
The schools discuss Theresa.,The school discuss Theresa.,morphology,subject_verb_agreement,regular_plural_subject_verb_agreement_2,True,False,True,False,735,-38.21728515625,-38.38178634643555,1
The guy fixes this couch.,The guys fixes this couch.,morphology,subject_verb_agreement,regular_plural_subject_verb_agreement_2,True,False,True,False,736,-37.17440414428711,-38.876644134521484,1
The patients haven't explored the lakes.,The patient haven't explored the lakes.,morphology,subject_verb_agreement,regular_plural_subject_verb_agreement_2,True,False,True,False,737,-46.190093994140625,-47.12889862060547,1
The waitresses have escaped from Veronica.,The waitress have escaped from Veronica.,morphology,subject_verb_agreement,regular_plural_subject_verb_agreement_2,True,False,True,False,738,-55.6357536315918,-45.75091552734375,0
The patients have chuckled.,The patient have chuckled.,morphology,subject_verb_agreement,regular_plural_subject_verb_agreement_2,True,False,True,False,739,-30.52454376220703,-30.94102668762207,1
The essay disagrees with most pedestrians.,The essays disagrees with most pedestrians.,morphology,subject_verb_agreement,regular_plural_subject_verb_agreement_2,True,False,True,False,740,-47.2412109375,-50.634490966796875,1
The drivers haven't played.,The driver haven't played.,morphology,subject_verb_agreement,regular_plural_subject_verb_agreement_2,True,False,True,False,741,-32.641441345214844,-30.63205337524414,0
The jacket wrinkles.,The jackets wrinkles.,morphology,subject_verb_agreement,regular_plural_subject_verb_agreement_2,True,False,True,False,742,-25.70330810546875,-27.906665802001953,1
The cup hasn't fallen apart.,The cups hasn't fallen apart.,morphology,subject_verb_agreement,regular_plural_subject_verb_agreement_2,True,False,True,False,743,-36.161842346191406,-37.74441909790039,1
The dancers weren't chuckling.,The dancer weren't chuckling.,morphology,subject_verb_agreement,regular_plural_subject_verb_agreement_2,True,False,True,False,744,-35.44715881347656,-36.131072998046875,1
The customers remember the actress.,The customer remember the actress.,morphology,subject_verb_agreement,regular_plural_subject_verb_agreement_2,True,False,True,False,745,-35.20252990722656,-36.386810302734375,1
The adult gets fired.,The adults gets fired.,morphology,subject_verb_agreement,regular_plural_subject_verb_agreement_2,True,False,True,False,746,-27.964994430541992,-29.285648345947266,1
The pedestrians haven't concealed that public park.,The pedestrian haven't concealed that public park.,morphology,subject_verb_agreement,regular_plural_subject_verb_agreement_2,True,False,True,False,747,-61.65087127685547,-61.22846984863281,0
The dancer changes.,The dancers changes.,morphology,subject_verb_agreement,regular_plural_subject_verb_agreement_2,True,False,True,False,748,-23.699487686157227,-23.250083923339844,0
The teachers were going fishing.,The teacher were going fishing.,morphology,subject_verb_agreement,regular_plural_subject_verb_agreement_2,True,False,True,False,749,-28.854278564453125,-30.735088348388672,1
The government is profiting.,The governments is profiting.,morphology,subject_verb_agreement,regular_plural_subject_verb_agreement_2,True,False,True,False,750,-33.6328010559082,-34.94757843017578,1
The committee hasn't reacted.,The committees hasn't reacted.,morphology,subject_verb_agreement,regular_plural_subject_verb_agreement_2,True,False,True,False,751,-35.49193572998047,-39.71473693847656,1
The adults watch Candice.,The adult watch Candice.,morphology,subject_verb_agreement,regular_plural_subject_verb_agreement_2,True,False,True,False,752,-38.392723083496094,-38.79312515258789,1
The chairs weren't falling apart.,The chair weren't falling apart.,morphology,subject_verb_agreement,regular_plural_subject_verb_agreement_2,True,False,True,False,753,-37.30372619628906,-36.1185302734375,0
The driver isn't thinking about Helen.,The drivers isn't thinking about Helen.,morphology,subject_verb_agreement,regular_plural_subject_verb_agreement_2,True,False,True,False,754,-39.794105529785156,-44.20680618286133,1
The ladies aren't scanning every documentary.,The lady aren't scanning every documentary.,morphology,subject_verb_agreement,regular_plural_subject_verb_agreement_2,True,False,True,False,755,-52.217674255371094,-49.78297805786133,0
The boy hasn't fled from these hills.,The boys hasn't fled from these hills.,morphology,subject_verb_agreement,regular_plural_subject_verb_agreement_2,True,False,True,False,756,-45.49958038330078,-45.754119873046875,1
The teachers have conspired.,The teacher have conspired.,morphology,subject_verb_agreement,regular_plural_subject_verb_agreement_2,True,False,True,False,757,-35.53186798095703,-36.11973571777344,1
The waiter has escaped.,The waiters has escaped.,morphology,subject_verb_agreement,regular_plural_subject_verb_agreement_2,True,False,True,False,758,-27.042369842529297,-36.15101623535156,1
The shoes aggravate Ellen.,The shoe aggravate Ellen.,morphology,subject_verb_agreement,regular_plural_subject_verb_agreement_2,True,False,True,False,759,-41.43431854248047,-41.21371841430664,0
The waitress fires Rodney.,The waitresses fires Rodney.,morphology,subject_verb_agreement,regular_plural_subject_verb_agreement_2,True,False,True,False,760,-40.64238357543945,-50.0992546081543,1
The cashiers aren't whispering.,The cashier aren't whispering.,morphology,subject_verb_agreement,regular_plural_subject_verb_agreement_2,True,False,True,False,761,-43.394805908203125,-45.03297805786133,1
The actress appreciates every customer.,The actresses appreciates every customer.,morphology,subject_verb_agreement,regular_plural_subject_verb_agreement_2,True,False,True,False,762,-45.28473663330078,-46.992279052734375,1
The guy hasn't toured a hill.,The guys hasn't toured a hill.,morphology,subject_verb_agreement,regular_plural_subject_verb_agreement_2,True,False,True,False,763,-44.95841598510742,-46.7816047668457,1
The teenager heals Irene.,The teenagers heals Irene.,morphology,subject_verb_agreement,regular_plural_subject_verb_agreement_2,True,False,True,False,764,-40.875816345214844,-42.46495056152344,1
The governments describe Sonia.,The government describe Sonia.,morphology,subject_verb_agreement,regular_plural_subject_verb_agreement_2,True,False,True,False,765,-35.45744323730469,-34.6098518371582,0
The waiters approach Beth.,The waiter approach Beth.,morphology,subject_verb_agreement,regular_plural_subject_verb_agreement_2,True,False,True,False,766,-44.55907440185547,-36.46754455566406,0
The cashiers have fixed some mirror.,The cashier have fixed some mirror.,morphology,subject_verb_agreement,regular_plural_subject_verb_agreement_2,True,False,True,False,767,-50.422760009765625,-51.58677673339844,1
The pedestrians haven't sneezed.,The pedestrian haven't sneezed.,morphology,subject_verb_agreement,regular_plural_subject_verb_agreement_2,True,False,True,False,768,-45.51268768310547,-44.934104919433594,0
