sentence_good,sentence_bad,field,linguistics_term,UID,simple_LM_method,one_prefix_method,two_prefix_method,lexically_identical,pair_id,good_prob,bad_prob,correct
The drivers are bringing skateboards.,The driver are bringing skateboards.,morphology,subject_verb_agreement,regular_plural_subject_verb_agreement_2,True,False,True,False,257,-41.26368713378906,-40.996315002441406,0
The customers hire Amy.,The customer hire Amy.,morphology,subject_verb_agreement,regular_plural_subject_verb_agreement_2,True,False,True,False,258,-36.57514953613281,-36.810997009277344,1
The guests sit down.,The guest sit down.,morphology,subject_verb_agreement,regular_plural_subject_verb_agreement_2,True,False,True,False,259,-23.750202178955078,-24.21778106689453,1
The guests move.,The guest move.,morphology,subject_verb_agreement,regular_plural_subject_verb_agreement_2,True,False,True,False,260,-22.56511116027832,-21.762802124023438,0
The patient leaves.,The patients leaves.,morphology,subject_verb_agreement,regular_plural_subject_verb_agreement_2,True,False,True,False,261,-19.95500946044922,-23.274864196777344,1
The libraries are changing.,The library are changing.,morphology,subject_verb_agreement,regular_plural_subject_verb_agreement_2,True,False,True,False,262,-25.743732452392578,-26.9916934967041,1
The actress cries.,The actresses cries.,morphology,subject_verb_agreement,regular_plural_subject_verb_agreement_2,True,False,True,False,263,-23.97460174560547,-25.201738357543945,1
The students aren't suffering.,The student aren't suffering.,morphology,subject_verb_agreement,regular_plural_subject_verb_agreement_2,True,False,True,False,264,-30.282760620117188,-32.40138244628906,1
The actress explains everything.,The actresses explains everything.,morphology,subject_verb_agreement,regular_plural_subject_verb_agreement_2,True,False,True,False,265,-30.027591705322266,-32.09025955200195,1
The students mess up these forks.,The student mess up these forks.,morphology,subject_verb_agreement,regular_plural_subject_verb_agreement_2,True,False,True,False,266,-43.340110778808594,-44.045738220214844,1
The ladies talk to Paul.,The lady talk to Paul.,morphology,subject_verb_agreement,regular_plural_subject_verb_agreement_2,True,False,True,False,267,-30.775543212890625,-30.257831573486328,0
The dancers look like some prints.,The dancer look like some prints.,morphology,subject_verb_agreement,regular_plural_subject_verb_agreement_2,True,False,True,False,268,-39.3123893737793,-39.28876876831055,0
The actress practices.,The actresses practices.,morphology,subject_verb_agreement,regular_plural_subject_verb_agreement_2,True,False,True,False,269,-24.668071746826172,-25.83554458618164,1
The dancers were biking to a museum.,The dancer were biking to a museum.,morphology,subject_verb_agreement,regular_plural_subject_verb_agreement_2,True,False,True,False,270,-41.455535888671875,-43.14864730834961,1
The teenager isn't shouting.,The teenagers isn't shouting.,morphology,subject_verb_agreement,regular_plural_subject_verb_agreement_2,True,False,True,False,271,-30.901763916015625,-33.40318298339844,1
The waitresses think about this book.,The waitress think about this book.,morphology,subject_verb_agreement,regular_plural_subject_verb_agreement_2,True,False,True,False,272,-45.68362808227539,-36.69369888305664,0
The pedestrian wasn't shocking a driver.,The pedestrians wasn't shocking a driver.,morphology,subject_verb_agreement,regular_plural_subject_verb_agreement_2,True,False,True,False,273,-52.03799057006836,-52.35224914550781,1
The pedestrian has returned to Homer.,The pedestrians has returned to Homer.,morphology,subject_verb_agreement,regular_plural_subject_verb_agreement_2,True,False,True,False,274,-41.96549987792969,-43.38151168823242,1
The customer hides.,The customers hides.,morphology,subject_verb_agreement,regular_plural_subject_verb_agreement_2,True,False,True,False,275,-25.22635841369629,-26.52959442138672,1
The actresses cope.,The actress cope.,morphology,subject_verb_agreement,regular_plural_subject_verb_agreement_2,True,False,True,False,276,-28.822437286376953,-27.60802459716797,0
The ladies climb down this mountain.,The lady climb down this mountain.,morphology,subject_verb_agreement,regular_plural_subject_verb_agreement_2,True,False,True,False,277,-38.311161041259766,-37.297523498535156,0
The actors weren't healing Galileo.,The actor weren't healing Galileo.,morphology,subject_verb_agreement,regular_plural_subject_verb_agreement_2,True,False,True,False,278,-47.968505859375,-47.39952087402344,0
The adult talks to Winston Churchill.,The adults talks to Winston Churchill.,morphology,subject_verb_agreement,regular_plural_subject_verb_agreement_2,True,False,True,False,279,-46.643096923828125,-45.83525848388672,0
The senators testify.,The senator testify.,morphology,subject_verb_agreement,regular_plural_subject_verb_agreement_2,True,False,True,False,280,-26.765689849853516,-26.875192642211914,1
The actor scans that report.,The actors scans that report.,morphology,subject_verb_agreement,regular_plural_subject_verb_agreement_2,True,False,True,False,281,-39.654052734375,-39.562355041503906,0
The malls have shocked Susan.,The mall have shocked Susan.,morphology,subject_verb_agreement,regular_plural_subject_verb_agreement_2,True,False,True,False,282,-44.10466766357422,-43.36371612548828,0
The guest hasn't protested.,The guests hasn't protested.,morphology,subject_verb_agreement,regular_plural_subject_verb_agreement_2,True,False,True,False,283,-33.98677444458008,-34.6937255859375,1
The museums shock Kathleen.,The museum shock Kathleen.,morphology,subject_verb_agreement,regular_plural_subject_verb_agreement_2,True,False,True,False,284,-39.55805206298828,-36.42610549926758,0
The ladies were performing.,The lady were performing.,morphology,subject_verb_agreement,regular_plural_subject_verb_agreement_2,True,False,True,False,285,-24.806255340576172,-23.949607849121094,0
The dancers haven't yawned.,The dancer haven't yawned.,morphology,subject_verb_agreement,regular_plural_subject_verb_agreement_2,True,False,True,False,286,-37.33967590332031,-37.138023376464844,0
The teenager isn't admiring Samuel.,The teenagers isn't admiring Samuel.,morphology,subject_verb_agreement,regular_plural_subject_verb_agreement_2,True,False,True,False,287,-50.2553825378418,-52.558536529541016,1
The actress wasn't painting.,The actresses wasn't painting.,morphology,subject_verb_agreement,regular_plural_subject_verb_agreement_2,True,False,True,False,288,-31.927146911621094,-35.37909698486328,1
The customer wasn't revealing the gates.,The customers wasn't revealing the gates.,morphology,subject_verb_agreement,regular_plural_subject_verb_agreement_2,True,False,True,False,289,-46.052833557128906,-47.122623443603516,1
The libraries admire a lot of birds.,The library admire a lot of birds.,morphology,subject_verb_agreement,regular_plural_subject_verb_agreement_2,True,False,True,False,290,-43.519222259521484,-41.1586799621582,0
The cashier has bought the ice cream.,The cashiers has bought the ice cream.,morphology,subject_verb_agreement,regular_plural_subject_verb_agreement_2,True,False,True,False,291,-49.82921600341797,-50.06913757324219,1
The driver hasn't slumped over.,The drivers hasn't slumped over.,morphology,subject_verb_agreement,regular_plural_subject_verb_agreement_2,True,False,True,False,292,-37.97644805908203,-41.248748779296875,1
The customers have chatted.,The customer have chatted.,morphology,subject_verb_agreement,regular_plural_subject_verb_agreement_2,True,False,True,False,293,-34.852149963378906,-35.001041412353516,1
The bird hasn't worried Cynthia.,The birds hasn't worried Cynthia.,morphology,subject_verb_agreement,regular_plural_subject_verb_agreement_2,True,False,True,False,294,-42.62208557128906,-44.00275421142578,1
The dancers astounds Holly.,The dancer astounds Holly.,morphology,subject_verb_agreement,regular_plural_subject_verb_agreement_2,True,False,True,False,295,-47.364463806152344,-46.662750244140625,0
The driver scans many commentaries.,The drivers scans many commentaries.,morphology,subject_verb_agreement,regular_plural_subject_verb_agreement_2,True,False,True,False,296,-56.1553955078125,-56.369564056396484,1
The cashiers have played.,The cashier have played.,morphology,subject_verb_agreement,regular_plural_subject_verb_agreement_2,True,False,True,False,297,-37.02854919433594,-37.95173263549805,1
The customer conceals every bicycle.,The customers conceals every bicycle.,morphology,subject_verb_agreement,regular_plural_subject_verb_agreement_2,True,False,True,False,298,-50.20737075805664,-50.261356353759766,1
The guys disagree with Ellen.,The guy disagree with Ellen.,morphology,subject_verb_agreement,regular_plural_subject_verb_agreement_2,True,False,True,False,299,-35.405181884765625,-36.13166046142578,1
The doctor hasn't gotten fired.,The doctors hasn't gotten fired.,morphology,subject_verb_agreement,regular_plural_subject_verb_agreement_2,True,False,True,False,300,-36.12065887451172,-38.678958892822266,1
The lady is hugging Janice.,The ladies is hugging Janice.,morphology,subject_verb_agreement,regular_plural_subject_verb_agreement_2,True,False,True,False,301,-42.743309020996094,-47.66309356689453,1
The actors walk through that mall.,The actor walk through that mall.,morphology,subject_verb_agreement,regular_plural_subject_verb_agreement_2,True,False,True,False,302,-44.160736083984375,-44.22892379760742,1
The doctors arrive at most museums.,The doctor arrive at most museums.,morphology,subject_verb_agreement,regular_plural_subject_verb_agreement_2,True,False,True,False,303,-41.7780647277832,-43.37757110595703,1
The painting looks like Guy.,The paintings looks like Guy.,morphology,subject_verb_agreement,regular_plural_subject_verb_agreement_2,True,False,True,False,304,-32.45511245727539,-33.379554748535156,1
The school knows Craig.,The schools knows Craig.,morphology,subject_verb_agreement,regular_plural_subject_verb_agreement_2,True,False,True,False,305,-33.340782165527344,-35.78913497924805,1
The guys reveal Tina.,The guy reveal Tina.,morphology,subject_verb_agreement,regular_plural_subject_verb_agreement_2,True,False,True,False,306,-36.923885345458984,-37.767391204833984,1
The children were flirting.,The child were flirting.,morphology,subject_verb_agreement,regular_plural_subject_verb_agreement_2,True,False,True,False,307,-27.206127166748047,-29.630165100097656,1
The association is responding.,The associations is responding.,morphology,subject_verb_agreement,regular_plural_subject_verb_agreement_2,True,False,True,False,308,-27.73237419128418,-28.852680206298828,1
The cashier remembers this driver.,The cashiers remembers this driver.,morphology,subject_verb_agreement,regular_plural_subject_verb_agreement_2,True,False,True,False,309,-46.91046142578125,-46.421546936035156,0
The teachers were falling asleep.,The teacher were falling asleep.,morphology,subject_verb_agreement,regular_plural_subject_verb_agreement_2,True,False,True,False,310,-28.186847686767578,-29.18231201171875,1
The dancers visit Claire.,The dancer visit Claire.,morphology,subject_verb_agreement,regular_plural_subject_verb_agreement_2,True,False,True,False,311,-35.20536804199219,-35.09173583984375,0
The students conceal all icicles.,The student conceal all icicles.,morphology,subject_verb_agreement,regular_plural_subject_verb_agreement_2,True,False,True,False,312,-50.425777435302734,-51.518856048583984,1
The actresses stand up.,The actress stand up.,morphology,subject_verb_agreement,regular_plural_subject_verb_agreement_2,True,False,True,False,313,-26.786794662475586,-25.506019592285156,0
The waiters get a job.,The waiter get a job.,morphology,subject_verb_agreement,regular_plural_subject_verb_agreement_2,True,False,True,False,314,-36.28365707397461,-29.961610794067383,0
The waitresses murmur.,The waitress murmur.,morphology,subject_verb_agreement,regular_plural_subject_verb_agreement_2,True,False,True,False,315,-42.33979797363281,-33.968231201171875,0
The girl grins.,The girls grins.,morphology,subject_verb_agreement,regular_plural_subject_verb_agreement_2,True,False,True,False,316,-24.92416763305664,-24.81711769104004,0
The waitresses sit down.,The waitress sit down.,morphology,subject_verb_agreement,regular_plural_subject_verb_agreement_2,True,False,True,False,317,-35.496280670166016,-26.463809967041016,0
The teachers weren't disagreeing.,The teacher weren't disagreeing.,morphology,subject_verb_agreement,regular_plural_subject_verb_agreement_2,True,False,True,False,318,-35.18895721435547,-35.117984771728516,0
The adult sneezes.,The adults sneezes.,morphology,subject_verb_agreement,regular_plural_subject_verb_agreement_2,True,False,True,False,319,-29.849437713623047,-31.354537963867188,1
The guys have embarrassed the actresses.,The guy have embarrassed the actresses.,morphology,subject_verb_agreement,regular_plural_subject_verb_agreement_2,True,False,True,False,320,-43.95306396484375,-45.92979431152344,1
The girls appear.,The girl appear.,morphology,subject_verb_agreement,regular_plural_subject_verb_agreement_2,True,False,True,False,321,-19.624980926513672,-21.315326690673828,1
The companies weren't lying.,The company weren't lying.,morphology,subject_verb_agreement,regular_plural_subject_verb_agreement_2,True,False,True,False,322,-32.83524703979492,-30.071807861328125,0
The waiter hasn't yawned.,The waiters hasn't yawned.,morphology,subject_verb_agreement,regular_plural_subject_verb_agreement_2,True,False,True,False,323,-37.05091857910156,-46.262882232666016,1
The plays have sounded like Patrick.,The play have sounded like Patrick.,morphology,subject_verb_agreement,regular_plural_subject_verb_agreement_2,True,False,True,False,324,-44.56298065185547,-40.6806526184082,0
The pedestrians have gotten a job.,The pedestrian have gotten a job.,morphology,subject_verb_agreement,regular_plural_subject_verb_agreement_2,True,False,True,False,325,-39.54627227783203,-40.10564041137695,1
The shawl warps.,The shawls warps.,morphology,subject_verb_agreement,regular_plural_subject_verb_agreement_2,True,False,True,False,326,-41.86833953857422,-43.66399383544922,1
The dress has twisted.,The dresses has twisted.,morphology,subject_verb_agreement,regular_plural_subject_verb_agreement_2,True,False,True,False,327,-29.356887817382812,-30.076210021972656,1
The teachers perform.,The teacher perform.,morphology,subject_verb_agreement,regular_plural_subject_verb_agreement_2,True,False,True,False,328,-24.47017478942871,-24.61239242553711,1
The doctors forget these guests.,The doctor forget these guests.,morphology,subject_verb_agreement,regular_plural_subject_verb_agreement_2,True,False,True,False,329,-35.65190124511719,-34.956459045410156,0
The girl talks about Beth.,The girls talks about Beth.,morphology,subject_verb_agreement,regular_plural_subject_verb_agreement_2,True,False,True,False,330,-31.66693687438965,-31.261756896972656,0
The boy hasn't cured Rachelle.,The boys hasn't cured Rachelle.,morphology,subject_verb_agreement,regular_plural_subject_verb_agreement_2,True,False,True,False,331,-51.15045928955078,-52.6134033203125,1
The legislature embarrasses some universities.,The legislatures embarrasses some universities.,morphology,subject_verb_agreement,regular_plural_subject_verb_agreement_2,True,False,True,False,332,-50.346832275390625,-52.83451461791992,1
The teenager forfeits.,The teenagers forfeits.,morphology,subject_verb_agreement,regular_plural_subject_verb_agreement_2,True,False,True,False,333,-35.1136474609375,-35.046077728271484,0
The dancer writes.,The dancers writes.,morphology,subject_verb_agreement,regular_plural_subject_verb_agreement_2,True,False,True,False,334,-23.97277069091797,-24.7230224609375,1
The girls complain.,The girl complain.,morphology,subject_verb_agreement,regular_plural_subject_verb_agreement_2,True,False,True,False,335,-21.686519622802734,-22.776147842407227,1
The senator reveals Alan.,The senators reveals Alan.,morphology,subject_verb_agreement,regular_plural_subject_verb_agreement_2,True,False,True,False,336,-35.36699676513672,-36.61517333984375,1
The adults explore Spain.,The adult explore Spain.,morphology,subject_verb_agreement,regular_plural_subject_verb_agreement_2,True,False,True,False,337,-32.6075439453125,-34.38027572631836,1
The cups weren't cracking.,The cup weren't cracking.,morphology,subject_verb_agreement,regular_plural_subject_verb_agreement_2,True,False,True,False,338,-34.60758972167969,-33.17854309082031,0
The waitresses have scared some companies.,The waitress have scared some companies.,morphology,subject_verb_agreement,regular_plural_subject_verb_agreement_2,True,False,True,False,339,-56.59383773803711,-46.56133270263672,0
The pedestrians write.,The pedestrian write.,morphology,subject_verb_agreement,regular_plural_subject_verb_agreement_2,True,False,True,False,340,-28.9681396484375,-27.6455135345459,0
The pedestrians weren't singing.,The pedestrian weren't singing.,morphology,subject_verb_agreement,regular_plural_subject_verb_agreement_2,True,False,True,False,341,-36.938148498535156,-37.218292236328125,1
The patient hasn't boycotted closets.,The patients hasn't boycotted closets.,morphology,subject_verb_agreement,regular_plural_subject_verb_agreement_2,True,False,True,False,342,-63.374942779541016,-65.32463073730469,1
The adults haven't examined a newspaper article.,The adult haven't examined a newspaper article.,morphology,subject_verb_agreement,regular_plural_subject_verb_agreement_2,True,False,True,False,343,-55.05125427246094,-55.788246154785156,1
The students weren't arguing about Mary.,The student weren't arguing about Mary.,morphology,subject_verb_agreement,regular_plural_subject_verb_agreement_2,True,False,True,False,344,-45.85161590576172,-48.179443359375,1
The dancer wasn't vanishing.,The dancers wasn't vanishing.,morphology,subject_verb_agreement,regular_plural_subject_verb_agreement_2,True,False,True,False,345,-34.61895751953125,-35.87965393066406,1
The actress investigates Travis.,The actresses investigates Travis.,morphology,subject_verb_agreement,regular_plural_subject_verb_agreement_2,True,False,True,False,346,-38.79358673095703,-41.72408676147461,1
The plates tip over.,The plate tip over.,morphology,subject_verb_agreement,regular_plural_subject_verb_agreement_2,True,False,True,False,347,-29.0498046875,-29.048500061035156,0
The libraries embarrass Holly.,The library embarrass Holly.,morphology,subject_verb_agreement,regular_plural_subject_verb_agreement_2,True,False,True,False,348,-38.7618522644043,-37.857872009277344,0
The adult discovers Colleen.,The adults discovers Colleen.,morphology,subject_verb_agreement,regular_plural_subject_verb_agreement_2,True,False,True,False,349,-44.8313102722168,-45.053340911865234,1
The coat was unfolding.,The coats was unfolding.,morphology,subject_verb_agreement,regular_plural_subject_verb_agreement_2,True,False,True,False,350,-28.987335205078125,-30.981708526611328,1
The birds disturb Meredith.,The bird disturb Meredith.,morphology,subject_verb_agreement,regular_plural_subject_verb_agreement_2,True,False,True,False,351,-36.80448913574219,-37.55883026123047,1
The patients love some guest.,The patient love some guest.,morphology,subject_verb_agreement,regular_plural_subject_verb_agreement_2,True,False,True,False,352,-36.244102478027344,-35.11925506591797,0
The students haven't hugged Janet.,The student haven't hugged Janet.,morphology,subject_verb_agreement,regular_plural_subject_verb_agreement_2,True,False,True,False,353,-45.3585205078125,-47.305694580078125,1
The teacher hasn't disappeared.,The teachers hasn't disappeared.,morphology,subject_verb_agreement,regular_plural_subject_verb_agreement_2,True,False,True,False,354,-28.92385482788086,-29.859052658081055,1
The universities have discussed these pedestrians.,The university have discussed these pedestrians.,morphology,subject_verb_agreement,regular_plural_subject_verb_agreement_2,True,False,True,False,355,-44.62416076660156,-45.465267181396484,1
The girl scans that newspaper article.,The girls scans that newspaper article.,morphology,subject_verb_agreement,regular_plural_subject_verb_agreement_2,True,False,True,False,356,-48.35373306274414,-47.939369201660156,0
The essays have hurt Florence.,The essay have hurt Florence.,morphology,subject_verb_agreement,regular_plural_subject_verb_agreement_2,True,False,True,False,357,-38.980712890625,-37.68385314941406,0
The senators have watched Jodi.,The senator have watched Jodi.,morphology,subject_verb_agreement,regular_plural_subject_verb_agreement_2,True,False,True,False,358,-45.794044494628906,-47.03514862060547,1
The teenager is thinking about Beverly.,The teenagers is thinking about Beverly.,morphology,subject_verb_agreement,regular_plural_subject_verb_agreement_2,True,False,True,False,359,-41.54631042480469,-43.180702209472656,1
The sketches look like some scarf.,The sketch look like some scarf.,morphology,subject_verb_agreement,regular_plural_subject_verb_agreement_2,True,False,True,False,360,-39.256656646728516,-40.26082992553711,1
The couches fall apart.,The couch fall apart.,morphology,subject_verb_agreement,regular_plural_subject_verb_agreement_2,True,False,True,False,361,-33.094970703125,-28.153461456298828,0
The boys hunt.,The boy hunt.,morphology,subject_verb_agreement,regular_plural_subject_verb_agreement_2,True,False,True,False,362,-18.393836975097656,-19.663501739501953,1
The actresses have discovered the snake.,The actress have discovered the snake.,morphology,subject_verb_agreement,regular_plural_subject_verb_agreement_2,True,False,True,False,363,-39.064456939697266,-39.84749984741211,1
The coat unfolds.,The coats unfolds.,morphology,subject_verb_agreement,regular_plural_subject_verb_agreement_2,True,False,True,False,364,-25.36554718017578,-26.485130310058594,1
The students haven't hidden away.,The student haven't hidden away.,morphology,subject_verb_agreement,regular_plural_subject_verb_agreement_2,True,False,True,False,365,-34.357181549072266,-36.004234313964844,1
The girls lift this coat.,The girl lift this coat.,morphology,subject_verb_agreement,regular_plural_subject_verb_agreement_2,True,False,True,False,366,-32.8508415222168,-33.32966613769531,1
The waiters were descending a lot of ladders.,The waiter were descending a lot of ladders.,morphology,subject_verb_agreement,regular_plural_subject_verb_agreement_2,True,False,True,False,367,-56.79578399658203,-49.44059371948242,0
The cashier has discovered Danielle.,The cashiers has discovered Danielle.,morphology,subject_verb_agreement,regular_plural_subject_verb_agreement_2,True,False,True,False,368,-51.08807373046875,-50.96232604980469,0
The guests arrive at some hill.,The guest arrive at some hill.,morphology,subject_verb_agreement,regular_plural_subject_verb_agreement_2,True,False,True,False,369,-38.58186340332031,-39.377723693847656,1
The ladies haven't examined a lot of movies.,The lady haven't examined a lot of movies.,morphology,subject_verb_agreement,regular_plural_subject_verb_agreement_2,True,False,True,False,370,-49.74020004272461,-48.59731674194336,0
The dancer talks about Kirsten.,The dancers talks about Kirsten.,morphology,subject_verb_agreement,regular_plural_subject_verb_agreement_2,True,False,True,False,371,-38.8570671081543,-40.35945129394531,1
The doctor has left.,The doctors has left.,morphology,subject_verb_agreement,regular_plural_subject_verb_agreement_2,True,False,True,False,372,-22.167003631591797,-24.44397735595703,1
The waitresses have spun around.,The waitress have spun around.,morphology,subject_verb_agreement,regular_plural_subject_verb_agreement_2,True,False,True,False,373,-48.39567565917969,-38.17815017700195,0
The skirts embarrass Wayne.,The skirt embarrass Wayne.,morphology,subject_verb_agreement,regular_plural_subject_verb_agreement_2,True,False,True,False,374,-39.45977783203125,-39.04255676269531,0
The actor has loved Kristen.,The actors has loved Kristen.,morphology,subject_verb_agreement,regular_plural_subject_verb_agreement_2,True,False,True,False,375,-38.737815856933594,-40.39080047607422,1
The waitress has explained everything.,The waitresses has explained everything.,morphology,subject_verb_agreement,regular_plural_subject_verb_agreement_2,True,False,True,False,376,-36.81077194213867,-48.550262451171875,1
The organization has interacted.,The organizations has interacted.,morphology,subject_verb_agreement,regular_plural_subject_verb_agreement_2,True,False,True,False,377,-32.11537551879883,-34.02476501464844,1
The guys swallow.,The guy swallow.,morphology,subject_verb_agreement,regular_plural_subject_verb_agreement_2,True,False,True,False,378,-24.530715942382812,-26.222381591796875,1
The senators have disagreed with Diane.,The senator have disagreed with Diane.,morphology,subject_verb_agreement,regular_plural_subject_verb_agreement_2,True,False,True,False,379,-43.61093521118164,-45.129730224609375,1
The bank was listening to Veronica.,The banks was listening to Veronica.,morphology,subject_verb_agreement,regular_plural_subject_verb_agreement_2,True,False,True,False,380,-37.794151306152344,-39.38902282714844,1
The cats fall asleep.,The cat fall asleep.,morphology,subject_verb_agreement,regular_plural_subject_verb_agreement_2,True,False,True,False,381,-24.928598403930664,-22.750703811645508,0
The teenagers change.,The teenager change.,morphology,subject_verb_agreement,regular_plural_subject_verb_agreement_2,True,False,True,False,382,-23.664949417114258,-24.586074829101562,1
The hat hasn't frayed.,The hats hasn't frayed.,morphology,subject_verb_agreement,regular_plural_subject_verb_agreement_2,True,False,True,False,383,-39.17441940307617,-41.79158401489258,1
The association replies.,The associations replies.,morphology,subject_verb_agreement,regular_plural_subject_verb_agreement_2,True,False,True,False,384,-23.01778221130371,-26.02066421508789,1
