sentence_good,sentence_bad,field,linguistics_term,UID,simple_LM_method,one_prefix_method,two_prefix_method,lexically_identical,pair_id,good_prob,bad_prob,correct
Who had all people's praising Theresa worried.,Who had all people's praising worried Theresa.,syntax,island_effects,sentential_subject_island,True,False,False,True,472,-62.34947967529297,-65.72000122070312,1
Who would actresses' hiding most guests stun.,Who would actresses' hiding stun most guests.,syntax,island_effects,sentential_subject_island,True,False,False,True,473,-72.0752944946289,-73.37588500976562,1
Who are the students' discussing Carlos astounding.,Who are the students' discussing astounding Carlos.,syntax,island_effects,sentential_subject_island,True,False,False,True,474,-62.217315673828125,-59.95240020751953,0
Who did a lot of ladies' appreciating Stephanie aggravate.,Who did a lot of ladies' appreciating aggravate Stephanie.,syntax,island_effects,sentential_subject_island,True,False,False,True,475,-72.99119567871094,-72.88520812988281,0
Who could a lot of dancers' selling many libraries annoy.,Who could a lot of dancers' selling annoy many libraries.,syntax,island_effects,sentential_subject_island,True,False,False,True,476,-80.23039245605469,-75.70443725585938,0
Who was a river's boring Carlos disgusting.,Who was a river's boring disgusting Carlos.,syntax,island_effects,sentential_subject_island,True,False,False,True,477,-61.242191314697266,-61.854652404785156,1
Who can a boy's returning to George scare.,Who can a boy's returning to scare George.,syntax,island_effects,sentential_subject_island,True,False,False,True,478,-63.22630310058594,-58.07455062866211,0
Who might all teenagers' hiring Bill aggravate.,Who might all teenagers' hiring aggravate Bill.,syntax,island_effects,sentential_subject_island,True,False,False,True,479,-69.97373962402344,-71.51324462890625,1
Who had these patients' running around many museums upset.,Who had these patients' running around upset many museums.,syntax,island_effects,sentential_subject_island,True,False,False,True,480,-71.69147491455078,-71.81477355957031,1
Who might most people's cleaning the books sound like.,Who might most people's cleaning sound like the books.,syntax,island_effects,sentential_subject_island,True,False,False,True,481,-65.38905334472656,-59.00859832763672,0
Who did those waiters' watching Wendy bother.,Who did those waiters' watching bother Wendy.,syntax,island_effects,sentential_subject_island,True,False,False,True,482,-73.20442199707031,-74.16288757324219,1
Who have many men's researching this high school sounded like.,Who have many men's researching sounded like this high school.,syntax,island_effects,sentential_subject_island,True,False,False,True,483,-66.20172882080078,-65.383056640625,0
Who is that government's firing James aggravating.,Who is that government's firing aggravating James.,syntax,island_effects,sentential_subject_island,True,False,False,True,484,-61.99055862426758,-61.81096267700195,0
What should most students' bringing the newspaper article sound like.,What should most students' bringing sound like the newspaper article.,syntax,island_effects,sentential_subject_island,True,False,False,True,485,-73.26594543457031,-72.1572265625,0
Who could the company's confusing Wendy annoy.,Who could the company's confusing annoy Wendy.,syntax,island_effects,sentential_subject_island,True,False,False,True,486,-62.6370964050293,-61.780181884765625,0
Who should these organizations' describing Patricia hurt.,Who should these organizations' describing hurt Patricia.,syntax,island_effects,sentential_subject_island,True,False,False,True,487,-69.48802185058594,-71.60006713867188,1
Who had these fish' hurting Galileo disgusted.,Who had these fish' hurting disgusted Galileo.,syntax,island_effects,sentential_subject_island,True,False,False,True,488,-71.48149871826172,-72.19436645507812,1
Who are the boys' biking to a school scaring.,Who are the boys' biking to scaring a school.,syntax,island_effects,sentential_subject_island,True,False,False,True,489,-65.71512603759766,-65.68864440917969,0
Who have the dancers' attacking Tammy astounded.,Who have the dancers' attacking astounded Tammy.,syntax,island_effects,sentential_subject_island,True,False,False,True,490,-73.3243408203125,-72.50213623046875,0
Who had some dresses' aggravating Alan worried.,Who had some dresses' aggravating worried Alan.,syntax,island_effects,sentential_subject_island,True,False,False,True,491,-72.06094360351562,-74.89036560058594,1
Who had this museum's firing Paul embarrassed.,Who had this museum's firing embarrassed Paul.,syntax,island_effects,sentential_subject_island,True,False,False,True,492,-63.025611877441406,-66.61032104492188,1
Who will waitresses' visiting many ladies bother.,Who will waitresses' visiting bother many ladies.,syntax,island_effects,sentential_subject_island,True,False,False,True,493,-76.32923889160156,-75.1081314086914,0
Who are all drawings' looking like Melinda disgusting.,Who are all drawings' looking like disgusting Melinda.,syntax,island_effects,sentential_subject_island,True,False,False,True,494,-77.29336547851562,-78.69786071777344,1
Who were many children' thinking about a bank embarrassing.,Who were many children' thinking about embarrassing a bank.,syntax,island_effects,sentential_subject_island,True,False,False,True,495,-63.31940460205078,-64.65477752685547,1
Who had all mountains' disturbing Rhonda irritated.,Who had all mountains' disturbing irritated Rhonda.,syntax,island_effects,sentential_subject_island,True,False,False,True,496,-77.46896362304688,-76.05134582519531,0
Who should the ladies' approaching some teenagers disgust.,Who should the ladies' approaching disgust some teenagers.,syntax,island_effects,sentential_subject_island,True,False,False,True,497,-71.09600067138672,-73.38536071777344,1
Who were these schools' listening to Becky irritating.,Who were these schools' listening to irritating Becky.,syntax,island_effects,sentential_subject_island,True,False,False,True,498,-69.76530456542969,-68.65524291992188,0
Who was that hat's astounding Anne impressing.,Who was that hat's astounding impressing Anne.,syntax,island_effects,sentential_subject_island,True,False,False,True,499,-68.72657775878906,-67.88162231445312,0
Who have all children' lifting every library bothered.,Who have all children' lifting bothered every library.,syntax,island_effects,sentential_subject_island,True,False,False,True,500,-66.90060424804688,-65.80073547363281,0
Who has this girl's referencing Joseph shocked.,Who has this girl's referencing shocked Joseph.,syntax,island_effects,sentential_subject_island,True,False,False,True,501,-61.46562957763672,-64.03392028808594,1
Who were most drivers' exploring a library astounding.,Who were most drivers' exploring astounding a library.,syntax,island_effects,sentential_subject_island,True,False,False,True,502,-72.090576171875,-69.66926574707031,0
Who should many actresses' discovering Jane bother.,Who should many actresses' discovering bother Jane.,syntax,island_effects,sentential_subject_island,True,False,False,True,503,-72.4434814453125,-71.4340591430664,0
Who had some boys' visiting Jennifer disturbed.,Who had some boys' visiting disturbed Jennifer.,syntax,island_effects,sentential_subject_island,True,False,False,True,504,-62.850685119628906,-64.27696228027344,1
Who were the actresses' helping Holly distracting.,Who were the actresses' helping distracting Holly.,syntax,island_effects,sentential_subject_island,True,False,False,True,505,-65.13628387451172,-67.53241729736328,1
Who did that beef's worrying the Impressionists impress.,Who did that beef's worrying impress the Impressionists.,syntax,island_effects,sentential_subject_island,True,False,False,True,506,-89.65426635742188,-87.00476837158203,0
Who are most schools' firing Cindy embarrassing.,Who are most schools' firing embarrassing Cindy.,syntax,island_effects,sentential_subject_island,True,False,False,True,507,-67.15461730957031,-64.45893096923828,0
Who might every cafe's bothering Carmen impress.,Who might every cafe's bothering impress Carmen.,syntax,island_effects,sentential_subject_island,True,False,False,True,508,-74.48110961914062,-74.1029281616211,0
Who had these cars' irritating Marla disgusted.,Who had these cars' irritating disgusted Marla.,syntax,island_effects,sentential_subject_island,True,False,False,True,509,-75.37811279296875,-75.11376953125,0
Who do most glasses' stunning Jane astound.,Who do most glasses' stunning astound Jane.,syntax,island_effects,sentential_subject_island,True,False,False,True,510,-74.32081604003906,-71.325439453125,0
Who was this dancer's exiting that museum confusing.,Who was this dancer's exiting confusing that museum.,syntax,island_effects,sentential_subject_island,True,False,False,True,511,-72.99150085449219,-70.774169921875,0
Who are a lot of dancers' noticing Dan aggravating.,Who are a lot of dancers' noticing aggravating Dan.,syntax,island_effects,sentential_subject_island,True,False,False,True,512,-66.94799041748047,-68.69279479980469,1
Who did the waiters' healing Lucille aggravate.,Who did the waiters' healing aggravate Lucille.,syntax,island_effects,sentential_subject_island,True,False,False,True,513,-80.90394592285156,-77.87373352050781,0
Who had those turtles' boring Heather shocked.,Who had those turtles' boring shocked Heather.,syntax,island_effects,sentential_subject_island,True,False,False,True,514,-72.09745788574219,-73.60762786865234,1
Who had a lot of jackets' disgusting Kirsten confused.,Who had a lot of jackets' disgusting confused Kirsten.,syntax,island_effects,sentential_subject_island,True,False,False,True,515,-73.46469116210938,-74.72115325927734,1
Who had a boy's finding those women shocked.,Who had a boy's finding shocked those women.,syntax,island_effects,sentential_subject_island,True,False,False,True,516,-57.74384689331055,-59.609432220458984,1
Who have a lot of customers' exploring the school impressed.,Who have a lot of customers' exploring impressed the school.,syntax,island_effects,sentential_subject_island,True,False,False,True,517,-61.70479202270508,-64.57704162597656,1
What might some grocery store's irritating Jessica sound like.,What might some grocery store's irritating sound like Jessica.,syntax,island_effects,sentential_subject_island,True,False,False,True,518,-78.133056640625,-73.68363189697266,0
Who were most teachers' curing Rodney alarming.,Who were most teachers' curing alarming Rodney.,syntax,island_effects,sentential_subject_island,True,False,False,True,519,-69.9169921875,-72.39287567138672,1
Who can most shawls' irritating Nina disagree with.,Who can most shawls' irritating disagree with Nina.,syntax,island_effects,sentential_subject_island,True,False,False,True,520,-88.36930847167969,-88.21990966796875,0
Who have those teachers' curing Richard upset.,Who have those teachers' curing upset Richard.,syntax,island_effects,sentential_subject_island,True,False,False,True,521,-64.83578491210938,-64.72169494628906,0
Who is an actress's fleeing from Carmen disturbing.,Who is an actress's fleeing from disturbing Carmen.,syntax,island_effects,sentential_subject_island,True,False,False,True,522,-65.67042541503906,-66.23637390136719,1
Who have these dancers' escaping from most pedestrians scared.,Who have these dancers' escaping from scared most pedestrians.,syntax,island_effects,sentential_subject_island,True,False,False,True,523,-75.95478820800781,-76.86906433105469,1
Who are those ladies' messing up those museums aggravating.,Who are those ladies' messing up aggravating those museums.,syntax,island_effects,sentential_subject_island,True,False,False,True,524,-74.85832214355469,-72.79759216308594,0
Who were a lot of girls' describing Ella annoying.,Who were a lot of girls' describing annoying Ella.,syntax,island_effects,sentential_subject_island,True,False,False,True,525,-70.47193908691406,-70.3956298828125,0
Who did a lot of dancers' concealing Regina upset.,Who did a lot of dancers' concealing upset Regina.,syntax,island_effects,sentential_subject_island,True,False,False,True,526,-74.25835418701172,-74.56005859375,1
Who were these teenagers' thinking about Christopher impressing.,Who were these teenagers' thinking about impressing Christopher.,syntax,island_effects,sentential_subject_island,True,False,False,True,527,-72.23484802246094,-76.17083740234375,1
Who are a lot of women's lifting a lot of schools disgusting.,Who are a lot of women's lifting disgusting a lot of schools.,syntax,island_effects,sentential_subject_island,True,False,False,True,528,-63.33824157714844,-65.85581970214844,1
Who could a lot of patients' leaving Nancy confuse.,Who could a lot of patients' leaving confuse Nancy.,syntax,island_effects,sentential_subject_island,True,False,False,True,529,-71.60759735107422,-71.81732177734375,1
Who would those pedestrians' messing up some hospital aggravate.,Who would those pedestrians' messing up aggravate some hospital.,syntax,island_effects,sentential_subject_island,True,False,False,True,530,-79.17172241210938,-80.436279296875,1
Who was the legislature's hiring Homer stunning.,Who was the legislature's hiring stunning Homer.,syntax,island_effects,sentential_subject_island,True,False,False,True,531,-62.16907501220703,-61.475608825683594,0
Who do these waitresses' revealing Anne upset.,Who do these waitresses' revealing upset Anne.,syntax,island_effects,sentential_subject_island,True,False,False,True,532,-80.53289794921875,-80.7100601196289,1
Who have the people's hurting Daniel bothered.,Who have the people's hurting bothered Daniel.,syntax,island_effects,sentential_subject_island,True,False,False,True,533,-57.44188690185547,-58.153324127197266,1
Who was some car's disgusting Carlos scaring.,Who was some car's disgusting scaring Carlos.,syntax,island_effects,sentential_subject_island,True,False,False,True,534,-71.81521606445312,-70.57978820800781,0
Who are a lot of lamps' shocking Julie upsetting.,Who are a lot of lamps' shocking upsetting Julie.,syntax,island_effects,sentential_subject_island,True,False,False,True,535,-69.60052490234375,-71.66243743896484,1
Who are the cars' confusing governments worrying.,Who are the cars' confusing worrying governments.,syntax,island_effects,sentential_subject_island,True,False,False,True,536,-62.72518539428711,-61.32392120361328,0
Who were all dancers' skated around Spain shocking.,Who were all dancers' skated around shocking Spain.,syntax,island_effects,sentential_subject_island,True,False,False,True,537,-74.7387924194336,-76.97958374023438,1
Who had some pedestrians' messing up the museums worried.,Who had some pedestrians' messing up worried the museums.,syntax,island_effects,sentential_subject_island,True,False,False,True,538,-76.4429931640625,-77.15593719482422,1
Who was that actress's researching Spain irritating.,Who was that actress's researching irritating Spain.,syntax,island_effects,sentential_subject_island,True,False,False,True,539,-64.33159637451172,-63.488365173339844,0
Who was this woman's messing up this school aggravating.,Who was this woman's messing up aggravating this school.,syntax,island_effects,sentential_subject_island,True,False,False,True,540,-71.04228973388672,-71.12049865722656,1
Who were most boys' admiring Curtis astounding.,Who were most boys' admiring astounding Curtis.,syntax,island_effects,sentential_subject_island,True,False,False,True,541,-75.58778381347656,-72.46023559570312,0
Who have most drivers' arguing about Heather sounded like.,Who have most drivers' arguing about sounded like Heather.,syntax,island_effects,sentential_subject_island,True,False,False,True,542,-71.51123046875,-71.66960906982422,1
Who was some glacier's astounding Valerie alarming.,Who was some glacier's astounding alarming Valerie.,syntax,island_effects,sentential_subject_island,True,False,False,True,543,-71.14065551757812,-75.58810424804688,1
Who did many senators' lifting all hospitals astound.,Who did many senators' lifting astound all hospitals.,syntax,island_effects,sentential_subject_island,True,False,False,True,544,-79.89230346679688,-79.82179260253906,0
Who did some guy's cleaning all libraries upset.,Who did some guy's cleaning upset all libraries.,syntax,island_effects,sentential_subject_island,True,False,False,True,545,-69.2808609008789,-68.37727355957031,0
Who had all customers' thinking about Sonia annoyed.,Who had all customers' thinking about annoyed Sonia.,syntax,island_effects,sentential_subject_island,True,False,False,True,546,-67.03620910644531,-67.60590362548828,1
Who were drivers' driving to many banks shocking.,Who were drivers' driving to shocking many banks.,syntax,island_effects,sentential_subject_island,True,False,False,True,547,-69.2935791015625,-70.38359069824219,1
Who had these hats' disturbing Carmen bored.,Who had these hats' disturbing bored Carmen.,syntax,island_effects,sentential_subject_island,True,False,False,True,548,-73.307861328125,-74.44253540039062,1
Who would that woman's visiting the Borgias sound like.,Who would that woman's visiting sound like the Borgias.,syntax,island_effects,sentential_subject_island,True,False,False,True,549,-77.23432159423828,-74.80110931396484,0
Who are most guys' noticing Derek upsetting.,Who are most guys' noticing upsetting Derek.,syntax,island_effects,sentential_subject_island,True,False,False,True,550,-64.24905395507812,-66.67835998535156,1
Who does this lady's researching the company astound.,Who does this lady's researching astound the company.,syntax,island_effects,sentential_subject_island,True,False,False,True,551,-67.46336364746094,-67.42066955566406,0
Who has the snake's astounding Becca worried.,Who has the snake's astounding worried Becca.,syntax,island_effects,sentential_subject_island,True,False,False,True,552,-73.8360824584961,-72.86073303222656,0
Who will some dancer's working with Christopher irritate.,Who will some dancer's working with irritate Christopher.,syntax,island_effects,sentential_subject_island,True,False,False,True,553,-70.47267150878906,-78.53427124023438,1
Who could that actress's discovering Janice alarm.,Who could that actress's discovering alarm Janice.,syntax,island_effects,sentential_subject_island,True,False,False,True,554,-72.97322082519531,-74.5892333984375,1
Who are most ladies' messing up some banks distracting.,Who are most ladies' messing up distracting some banks.,syntax,island_effects,sentential_subject_island,True,False,False,True,555,-71.85753631591797,-73.10374450683594,1
Who is this woman's walking through many banks impressing.,Who is this woman's walking through impressing many banks.,syntax,island_effects,sentential_subject_island,True,False,False,True,556,-70.11421203613281,-68.72868347167969,0
Who were a lot of dancers' investigating Michelle stunning.,Who were a lot of dancers' investigating stunning Michelle.,syntax,island_effects,sentential_subject_island,True,False,False,True,557,-66.50316619873047,-69.20555877685547,1
Who can all carriages' stunning Katherine disturb.,Who can all carriages' stunning disturb Katherine.,syntax,island_effects,sentential_subject_island,True,False,False,True,558,-78.70646667480469,-75.31565856933594,0
Who was some actress's disturbing Ellen scaring.,Who was some actress's disturbing scaring Ellen.,syntax,island_effects,sentential_subject_island,True,False,False,True,559,-72.316650390625,-71.64192199707031,0
Who had some photograph's embarrassing Christopher embarrassed.,Who had some photograph's embarrassing embarrassed Christopher.,syntax,island_effects,sentential_subject_island,True,False,False,True,560,-69.01464080810547,-74.26683044433594,1
Who should these actresses' thinking about Joseph irritate.,Who should these actresses' thinking about irritate Joseph.,syntax,island_effects,sentential_subject_island,True,False,False,True,561,-72.24989318847656,-75.92646026611328,1
Who should customers' finding Laurie upset.,Who should customers' finding upset Laurie.,syntax,island_effects,sentential_subject_island,True,False,False,True,562,-63.20321273803711,-63.07183837890625,0
Who do those guys' dropping by the schools disturb.,Who do those guys' dropping by disturb the schools.,syntax,island_effects,sentential_subject_island,True,False,False,True,563,-73.73949432373047,-68.23164367675781,0
Who have many girls' investigating Brett impressed.,Who have many girls' investigating impressed Brett.,syntax,island_effects,sentential_subject_island,True,False,False,True,564,-62.88310241699219,-65.68020629882812,1
Who can blouses' confusing Bethany scare.,Who can blouses' confusing scare Bethany.,syntax,island_effects,sentential_subject_island,True,False,False,True,565,-78.41642761230469,-75.05052185058594,0
Who have a lot of associations' astounding Rebecca disturbed.,Who have a lot of associations' astounding disturbed Rebecca.,syntax,island_effects,sentential_subject_island,True,False,False,True,566,-70.7999267578125,-69.75102233886719,0
Who have cafes' upsetting Angela distracted.,Who have cafes' upsetting distracted Angela.,syntax,island_effects,sentential_subject_island,True,False,False,True,567,-69.76011657714844,-71.6016845703125,1
Who had that hair's stunning Randolf stunned.,Who had that hair's stunning stunned Randolf.,syntax,island_effects,sentential_subject_island,True,False,False,True,568,-78.50965881347656,-77.46453857421875,0
Who is the snake's astounding Caroline irritating.,Who is the snake's astounding irritating Caroline.,syntax,island_effects,sentential_subject_island,True,False,False,True,569,-64.88143920898438,-64.18955993652344,0
Who had every woman's appreciating Beth irritated.,Who had every woman's appreciating irritated Beth.,syntax,island_effects,sentential_subject_island,True,False,False,True,570,-67.71315002441406,-68.51831817626953,1
Who were teachers' revealing Lucille confusing.,Who were teachers' revealing confusing Lucille.,syntax,island_effects,sentential_subject_island,True,False,False,True,571,-69.29953002929688,-67.84821319580078,0
Who were all actresses' disagreeing with Robert shocking.,Who were all actresses' disagreeing with shocking Robert.,syntax,island_effects,sentential_subject_island,True,False,False,True,572,-78.5050048828125,-80.14131164550781,1
Who was the lady's watching Mark worrying.,Who was the lady's watching worrying Mark.,syntax,island_effects,sentential_subject_island,True,False,False,True,573,-56.55845260620117,-57.54512023925781,1
Who has this hospital's appreciating Liam distracted.,Who has this hospital's appreciating distracted Liam.,syntax,island_effects,sentential_subject_island,True,False,False,True,574,-72.94076538085938,-73.32469177246094,1
Who are those women's kissing Vanessa disgusting.,Who are those women's kissing disgusting Vanessa.,syntax,island_effects,sentential_subject_island,True,False,False,True,575,-60.284461975097656,-61.179603576660156,1
What can a lady's examining most books disagree with.,What can a lady's examining disagree with most books.,syntax,island_effects,sentential_subject_island,True,False,False,True,576,-74.07109832763672,-71.43006896972656,0
Who had organizations' talking about Brenda alarmed.,Who had organizations' talking about alarmed Brenda.,syntax,island_effects,sentential_subject_island,True,False,False,True,577,-64.81875610351562,-67.95683288574219,1
Who is the guy's listening to Carlos irritating.,Who is the guy's listening to irritating Carlos.,syntax,island_effects,sentential_subject_island,True,False,False,True,578,-58.22193908691406,-57.689666748046875,0
Who should many waitresses' cleaning some library aggravate.,Who should many waitresses' cleaning aggravate some library.,syntax,island_effects,sentential_subject_island,True,False,False,True,579,-92.74786376953125,-91.02874755859375,0
Who have some patients' bringing those libraries astounded.,Who have some patients' bringing astounded those libraries.,syntax,island_effects,sentential_subject_island,True,False,False,True,580,-72.42025756835938,-71.22218322753906,0
Who had most children' shocking Anne disgusted.,Who had most children' shocking disgusted Anne.,syntax,island_effects,sentential_subject_island,True,False,False,True,581,-65.67449188232422,-68.13761901855469,1
Who are those mouths' scaring many men annoying.,Who are those mouths' scaring annoying many men.,syntax,island_effects,sentential_subject_island,True,False,False,True,582,-74.27877044677734,-76.76448822021484,1
Who do many girls' observing Anna annoy.,Who do many girls' observing annoy Anna.,syntax,island_effects,sentential_subject_island,True,False,False,True,583,-66.83293151855469,-66.0634765625,0
Who will the boys' finding Becca aggravate.,Who will the boys' finding aggravate Becca.,syntax,island_effects,sentential_subject_island,True,False,False,True,584,-73.64614868164062,-71.78205871582031,0
Who are a lot of guests' bringing that hospital upsetting.,Who are a lot of guests' bringing upsetting that hospital.,syntax,island_effects,sentential_subject_island,True,False,False,True,585,-67.69538116455078,-67.11624908447266,0
Who had a lot of pies' boring Patricia disturbed.,Who had a lot of pies' boring disturbed Patricia.,syntax,island_effects,sentential_subject_island,True,False,False,True,586,-73.54230499267578,-72.20245361328125,0
Who did this actress's researching the university bother.,Who did this actress's researching bother the university.,syntax,island_effects,sentential_subject_island,True,False,False,True,587,-64.72384643554688,-65.25823974609375,1
Who have those women's describing Claire irritated.,Who have those women's describing irritated Claire.,syntax,island_effects,sentential_subject_island,True,False,False,True,588,-64.47575378417969,-62.85826110839844,0
Who will the screen's stunning Matt upset.,Who will the screen's stunning upset Matt.,syntax,island_effects,sentential_subject_island,True,False,False,True,589,-59.73518753051758,-59.474910736083984,0
