sentence_good,sentence_bad,field,linguistics_term,UID,simple_LM_method,one_prefix_method,two_prefix_method,lexically_identical,pair_id,good_prob,bad_prob,correct
Who will the cake's aggravating Mary upset.,Who will the cake's aggravating upset Mary.,syntax,island_effects,sentential_subject_island,True,False,False,True,707,-70.0300521850586,-69.11893463134766,0
Who might these waitresses' driving to Harvard University disturb.,Who might these waitresses' driving to disturb Harvard University.,syntax,island_effects,sentential_subject_island,True,False,False,True,708,-99.27863311767578,-89.44583129882812,0
Who does a boy's buying a lot of college campuses sound like.,Who does a boy's buying sound like a lot of college campuses.,syntax,island_effects,sentential_subject_island,True,False,False,True,709,-75.05654907226562,-70.47044372558594,0
Who should the guys' attacking Rhonda confuse.,Who should the guys' attacking confuse Rhonda.,syntax,island_effects,sentential_subject_island,True,False,False,True,710,-78.31903076171875,-76.93485260009766,0
Who is some actress's watching Matt confusing.,Who is some actress's watching confusing Matt.,syntax,island_effects,sentential_subject_island,True,False,False,True,711,-60.03136444091797,-62.60204315185547,1
Who had all plays' impressing Bill confused.,Who had all plays' impressing confused Bill.,syntax,island_effects,sentential_subject_island,True,False,False,True,712,-72.82699584960938,-72.8818359375,1
Who can some boy's describing Paula distract.,Who can some boy's describing distract Paula.,syntax,island_effects,sentential_subject_island,True,False,False,True,713,-67.10745239257812,-66.78579711914062,0
Who should the dancers' leaving Dan impress.,Who should the dancers' leaving impress Dan.,syntax,island_effects,sentential_subject_island,True,False,False,True,714,-66.07646179199219,-68.88015747070312,1
Who were men's walking through that library shocking.,Who were men's walking through shocking that library.,syntax,island_effects,sentential_subject_island,True,False,False,True,715,-67.40694427490234,-65.99911499023438,0
Who had that waitress's driving to college campuses sounded like.,Who had that waitress's driving to sounded like college campuses.,syntax,island_effects,sentential_subject_island,True,False,False,True,716,-78.76398468017578,-78.90223693847656,1
Who were those actresses' researching Jesus boring.,Who were those actresses' researching boring Jesus.,syntax,island_effects,sentential_subject_island,True,False,False,True,717,-64.7828598022461,-67.95807647705078,1
Who have some dancers' escaping from Wayne disgusted.,Who have some dancers' escaping from disgusted Wayne.,syntax,island_effects,sentential_subject_island,True,False,False,True,718,-70.52845764160156,-72.66954040527344,1
Who were all patients' firing Colleen aggravating.,Who were all patients' firing aggravating Colleen.,syntax,island_effects,sentential_subject_island,True,False,False,True,719,-73.40900421142578,-71.78373718261719,0
Who can all organizations' working with these ladies astound.,Who can all organizations' working with astound these ladies.,syntax,island_effects,sentential_subject_island,True,False,False,True,720,-71.53691101074219,-71.03280639648438,0
Who are some dogs' hurting Monet disgusting.,Who are some dogs' hurting disgusting Monet.,syntax,island_effects,sentential_subject_island,True,False,False,True,721,-68.94023132324219,-67.72345733642578,0
Who is a waitress's revealing the Borgias astounding.,Who is a waitress's revealing astounding the Borgias.,syntax,island_effects,sentential_subject_island,True,False,False,True,722,-76.32667541503906,-76.7742691040039,1
Who have many hospitals' referencing a dancer hurt.,Who have many hospitals' referencing hurt a dancer.,syntax,island_effects,sentential_subject_island,True,False,False,True,723,-67.44854736328125,-67.84230041503906,1
Who have these actresses' kissing Frank alarmed.,Who have these actresses' kissing alarmed Frank.,syntax,island_effects,sentential_subject_island,True,False,False,True,724,-67.73526763916016,-69.22219848632812,1
Who had many women's firing many guests disturbed.,Who had many women's firing disturbed many guests.,syntax,island_effects,sentential_subject_island,True,False,False,True,725,-65.59561920166016,-62.86439514160156,0
Who are the actresses' approaching Carlos bothering.,Who are the actresses' approaching bothering Carlos.,syntax,island_effects,sentential_subject_island,True,False,False,True,726,-64.8012466430664,-64.29655456542969,0
Who have these cashiers' attacking many pedestrians shocked.,Who have these cashiers' attacking shocked many pedestrians.,syntax,island_effects,sentential_subject_island,True,False,False,True,727,-83.96847534179688,-85.57533264160156,1
Who are all women's discussing Elizabeth astounding.,Who are all women's discussing astounding Elizabeth.,syntax,island_effects,sentential_subject_island,True,False,False,True,728,-58.51237869262695,-58.36215591430664,0
Who had some horses' stunning some teachers alarmed.,Who had some horses' stunning alarmed some teachers.,syntax,island_effects,sentential_subject_island,True,False,False,True,729,-73.75694274902344,-71.40278625488281,0
Who have these boys' kissing Natalie hurt.,Who have these boys' kissing hurt Natalie.,syntax,island_effects,sentential_subject_island,True,False,False,True,730,-60.969635009765625,-62.05516815185547,1
Who is every projector's scaring Amelia embarrassing.,Who is every projector's scaring embarrassing Amelia.,syntax,island_effects,sentential_subject_island,True,False,False,True,731,-79.04093170166016,-78.9637451171875,0
Who have many cashiers' escaping from Vincent irritated.,Who have many cashiers' escaping from irritated Vincent.,syntax,island_effects,sentential_subject_island,True,False,False,True,732,-80.15876770019531,-81.03584289550781,1
Who did many women's investigating Debra disgust.,Who did many women's investigating disgust Debra.,syntax,island_effects,sentential_subject_island,True,False,False,True,733,-63.42613220214844,-66.25545501708984,1
Who did these waitresses' attacking Dawn confuse.,Who did these waitresses' attacking confuse Dawn.,syntax,island_effects,sentential_subject_island,True,False,False,True,734,-87.22257232666016,-85.44380950927734,0
Who are some people's discussing Florence disturbing.,Who are some people's discussing disturbing Florence.,syntax,island_effects,sentential_subject_island,True,False,False,True,735,-59.96183776855469,-57.94503402709961,0
Who is that committee's bothering Gerald bothering.,Who is that committee's bothering bothering Gerald.,syntax,island_effects,sentential_subject_island,True,False,False,True,736,-66.58531188964844,-65.41981506347656,0
Who should that screen's worrying Ella shock.,Who should that screen's worrying shock Ella.,syntax,island_effects,sentential_subject_island,True,False,False,True,737,-72.16288757324219,-72.3315658569336,1
Who does some girl's selling all hospitals disgust.,Who does some girl's selling disgust all hospitals.,syntax,island_effects,sentential_subject_island,True,False,False,True,738,-70.90679168701172,-72.1429214477539,1
Who could many associations' selling a lot of banks irritate.,Who could many associations' selling irritate a lot of banks.,syntax,island_effects,sentential_subject_island,True,False,False,True,739,-76.48248291015625,-76.91451263427734,1
Who have most teachers' passing a lot of banks upset.,Who have most teachers' passing upset a lot of banks.,syntax,island_effects,sentential_subject_island,True,False,False,True,740,-71.15364837646484,-70.76420593261719,0
Who do a lot of governments' helping Frank disagree with.,Who do a lot of governments' helping disagree with Frank.,syntax,island_effects,sentential_subject_island,True,False,False,True,741,-71.67549896240234,-70.50753784179688,0
Who have girls' questioning the waitress confused.,Who have girls' questioning confused the waitress.,syntax,island_effects,sentential_subject_island,True,False,False,True,742,-60.833709716796875,-61.475685119628906,1
Who might some skirt's irritating Sally scare.,Who might some skirt's irritating scare Sally.,syntax,island_effects,sentential_subject_island,True,False,False,True,743,-73.78275299072266,-71.75169372558594,0
Who was the government's firing Rodney scaring.,Who was the government's firing scaring Rodney.,syntax,island_effects,sentential_subject_island,True,False,False,True,744,-63.11170959472656,-63.76146697998047,1
What could the association's arguing about Russell sound like.,What could the association's arguing about sound like Russell.,syntax,island_effects,sentential_subject_island,True,False,False,True,745,-71.13948059082031,-67.92778778076172,0
Who has a school's criticizing Irene worried.,Who has a school's criticizing worried Irene.,syntax,island_effects,sentential_subject_island,True,False,False,True,746,-66.72697448730469,-65.88653564453125,0
Who should a lot of dancers' driving to Harvard University confuse.,Who should a lot of dancers' driving to confuse Harvard University.,syntax,island_effects,sentential_subject_island,True,False,False,True,747,-82.29078674316406,-73.60383605957031,0
Who are many men's kissing Linda hurting.,Who are many men's kissing hurting Linda.,syntax,island_effects,sentential_subject_island,True,False,False,True,748,-55.411582946777344,-54.76276779174805,0
Who were these committees' distracting Stephen disagreeing with.,Who were these committees' distracting disagreeing with Stephen.,syntax,island_effects,sentential_subject_island,True,False,False,True,749,-84.73907470703125,-83.12535858154297,0
Who was an actress's bringing schools astounding.,Who was an actress's bringing astounding schools.,syntax,island_effects,sentential_subject_island,True,False,False,True,750,-60.78078079223633,-56.25887680053711,0
Who do many schools' concealing Stacy bother.,Who do many schools' concealing bother Stacy.,syntax,island_effects,sentential_subject_island,True,False,False,True,751,-76.37432861328125,-74.46575927734375,0
Who had some teachers' returning to Steve distracted.,Who had some teachers' returning to distracted Steve.,syntax,island_effects,sentential_subject_island,True,False,False,True,752,-65.92183685302734,-66.3668441772461,1
Who have many actors' dropping by every bank upset.,Who have many actors' dropping by upset every bank.,syntax,island_effects,sentential_subject_island,True,False,False,True,753,-69.98163604736328,-70.33292388916016,1
Who were ladies' arriving at a library distracting.,Who were ladies' arriving at distracting a library.,syntax,island_effects,sentential_subject_island,True,False,False,True,754,-66.47015380859375,-66.27802276611328,0
Who were the boys' researching a university annoying.,Who were the boys' researching annoying a university.,syntax,island_effects,sentential_subject_island,True,False,False,True,755,-65.33434295654297,-65.27179718017578,0
Who have a lot of paintings' looking like Tanya annoyed.,Who have a lot of paintings' looking like annoyed Tanya.,syntax,island_effects,sentential_subject_island,True,False,False,True,756,-76.31644439697266,-74.5538330078125,0
Who have the companies' firing Aaron alarmed.,Who have the companies' firing alarmed Aaron.,syntax,island_effects,sentential_subject_island,True,False,False,True,757,-64.80906677246094,-66.52571105957031,1
Who has every lady's firing Stephen alarmed.,Who has every lady's firing alarmed Stephen.,syntax,island_effects,sentential_subject_island,True,False,False,True,758,-66.82012939453125,-67.99488830566406,1
Who has some museum's embarrassing Amelia confused.,Who has some museum's embarrassing confused Amelia.,syntax,island_effects,sentential_subject_island,True,False,False,True,759,-67.3894271850586,-69.78311920166016,1
Who are all children' messing up that hospital embarrassing.,Who are all children' messing up embarrassing that hospital.,syntax,island_effects,sentential_subject_island,True,False,False,True,760,-64.90980529785156,-64.80311584472656,0
Who is every girl's dropping by the libraries astounding.,Who is every girl's dropping by astounding the libraries.,syntax,island_effects,sentential_subject_island,True,False,False,True,761,-68.29165649414062,-67.84223937988281,0
Who do those museums' listening to Homer astound.,Who do those museums' listening to astound Homer.,syntax,island_effects,sentential_subject_island,True,False,False,True,762,-76.64105224609375,-73.59649658203125,0
Who should most lakes' irritating Craig distract.,Who should most lakes' irritating distract Craig.,syntax,island_effects,sentential_subject_island,True,False,False,True,763,-73.10736083984375,-72.88886260986328,0
Who would some projector's alarming Lori bore.,Who would some projector's alarming bore Lori.,syntax,island_effects,sentential_subject_island,True,False,False,True,764,-71.26870727539062,-72.81135559082031,1
Who will that glove's astounding most libraries stun.,Who will that glove's astounding stun most libraries.,syntax,island_effects,sentential_subject_island,True,False,False,True,765,-81.80384826660156,-80.02803039550781,0
Who have most cashiers' running around the library embarrassed.,Who have most cashiers' running around embarrassed the library.,syntax,island_effects,sentential_subject_island,True,False,False,True,766,-80.3019027709961,-84.45306396484375,1
Who might many snakes' distracting the museums scare.,Who might many snakes' distracting scare the museums.,syntax,island_effects,sentential_subject_island,True,False,False,True,767,-80.41748046875,-74.30950164794922,0
Who was every girl's leaving Kevin boring.,Who was every girl's leaving boring Kevin.,syntax,island_effects,sentential_subject_island,True,False,False,True,768,-57.63186264038086,-60.0096549987793,1
Who had many companies' describing Nancy worried.,Who had many companies' describing worried Nancy.,syntax,island_effects,sentential_subject_island,True,False,False,True,769,-63.15556335449219,-65.50447082519531,1
Who should that guy's buying some hospital impress.,Who should that guy's buying impress some hospital.,syntax,island_effects,sentential_subject_island,True,False,False,True,770,-65.80677795410156,-66.5855941772461,1
Who should some guys' bringing a lot of banks annoy.,Who should some guys' bringing annoy a lot of banks.,syntax,island_effects,sentential_subject_island,True,False,False,True,771,-76.48896026611328,-74.27542877197266,0
Who had most drivers' hiring Noah annoyed.,Who had most drivers' hiring annoyed Noah.,syntax,island_effects,sentential_subject_island,True,False,False,True,772,-69.28462982177734,-69.57754516601562,1
Who could the adults' criticizing Alan bore.,Who could the adults' criticizing bore Alan.,syntax,island_effects,sentential_subject_island,True,False,False,True,773,-63.91792297363281,-67.78300476074219,1
Who had all gates' aggravating this girl aggravated.,Who had all gates' aggravating aggravated this girl.,syntax,island_effects,sentential_subject_island,True,False,False,True,774,-78.3360824584961,-77.00816345214844,0
Who were a lot of dancers' returning to Gerald distracting.,Who were a lot of dancers' returning to distracting Gerald.,syntax,island_effects,sentential_subject_island,True,False,False,True,775,-70.44956970214844,-71.72273254394531,1
Who have museums' buying these libraries embarrassed.,Who have museums' buying embarrassed these libraries.,syntax,island_effects,sentential_subject_island,True,False,False,True,776,-68.30327606201172,-69.02324676513672,1
Who were all paintings' looking like Monet disgusting.,Who were all paintings' looking like disgusting Monet.,syntax,island_effects,sentential_subject_island,True,False,False,True,777,-74.4306640625,-75.46581268310547,1
Who had some ladies' cleaning most libraries embarrassed.,Who had some ladies' cleaning embarrassed most libraries.,syntax,island_effects,sentential_subject_island,True,False,False,True,778,-71.95098114013672,-70.62557983398438,0
Who were a lot of cars' distracting those actresses irritating.,Who were a lot of cars' distracting irritating those actresses.,syntax,island_effects,sentential_subject_island,True,False,False,True,779,-76.09989166259766,-74.40861511230469,0
Who had some people's criticizing Laurie alarmed.,Who had some people's criticizing alarmed Laurie.,syntax,island_effects,sentential_subject_island,True,False,False,True,780,-63.82328796386719,-67.5705337524414,1
Who were girls' finding the Lutherans disgusting.,Who were girls' finding disgusting the Lutherans.,syntax,island_effects,sentential_subject_island,True,False,False,True,781,-75.16532135009766,-78.3576431274414,1
Who is that cilantro's disgusting Steve stunning.,Who is that cilantro's disgusting stunning Steve.,syntax,island_effects,sentential_subject_island,True,False,False,True,782,-68.32506561279297,-71.12849426269531,1
Who were the dogs' finding Kristen impressing.,Who were the dogs' finding impressing Kristen.,syntax,island_effects,sentential_subject_island,True,False,False,True,783,-69.42660522460938,-68.86447143554688,0
Who are some libraries' praising the man embarrassing.,Who are some libraries' praising embarrassing the man.,syntax,island_effects,sentential_subject_island,True,False,False,True,784,-66.65179443359375,-70.57611846923828,1
Who would the government's insulting Deborah irritate.,Who would the government's insulting irritate Deborah.,syntax,island_effects,sentential_subject_island,True,False,False,True,785,-64.61929321289062,-67.09651947021484,1
Who had the actors' praising Marla disgusted.,Who had the actors' praising disgusted Marla.,syntax,island_effects,sentential_subject_island,True,False,False,True,786,-71.29803466796875,-71.1390380859375,0
Who were a lot of guys' discussing Edward irritating.,Who were a lot of guys' discussing irritating Edward.,syntax,island_effects,sentential_subject_island,True,False,False,True,787,-66.5140380859375,-68.01749420166016,1
Who is every school's disgusting Sarah impressing.,Who is every school's disgusting impressing Sarah.,syntax,island_effects,sentential_subject_island,True,False,False,True,788,-65.85381317138672,-67.51107788085938,1
Who are many drawings' looking like Nicole astounding.,Who are many drawings' looking like astounding Nicole.,syntax,island_effects,sentential_subject_island,True,False,False,True,789,-69.50215911865234,-70.72090148925781,1
Who has some committee's distracting Heather hurt.,Who has some committee's distracting hurt Heather.,syntax,island_effects,sentential_subject_island,True,False,False,True,790,-66.67698669433594,-68.02523803710938,1
Who were some men's arriving at a bank astounding.,Who were some men's arriving at astounding a bank.,syntax,island_effects,sentential_subject_island,True,False,False,True,791,-63.68470001220703,-63.50716781616211,0
Who has this painting's stunning Bethany scared.,Who has this painting's stunning scared Bethany.,syntax,island_effects,sentential_subject_island,True,False,False,True,792,-70.97505187988281,-71.51773071289062,1
Who had some man's talking to Theodore stunned.,Who had some man's talking to stunned Theodore.,syntax,island_effects,sentential_subject_island,True,False,False,True,793,-62.079383850097656,-65.683837890625,1
Who were most students' concealing April upsetting.,Who were most students' concealing upsetting April.,syntax,island_effects,sentential_subject_island,True,False,False,True,794,-71.52955627441406,-71.04156494140625,0
Who had those men's talking about Adam scared.,Who had those men's talking about scared Adam.,syntax,island_effects,sentential_subject_island,True,False,False,True,795,-57.21710968017578,-58.803714752197266,1
Who are many children' bringing the school astounding.,Who are many children' bringing astounding the school.,syntax,island_effects,sentential_subject_island,True,False,False,True,796,-54.879905700683594,-55.89039611816406,1
Who is this book's stunning Kevin distracting.,Who is this book's stunning distracting Kevin.,syntax,island_effects,sentential_subject_island,True,False,False,True,797,-57.22541427612305,-57.383811950683594,1
What has every movie's disagreeing with Carlos disagreed with.,What has every movie's disagreeing with disagreed with Carlos.,syntax,island_effects,sentential_subject_island,True,False,False,True,798,-83.57807922363281,-82.062744140625,0
Who might the boy's appreciating Maria shock.,Who might the boy's appreciating shock Maria.,syntax,island_effects,sentential_subject_island,True,False,False,True,799,-66.453857421875,-67.12553405761719,1
Who does a girl's praising Colleen distract.,Who does a girl's praising distract Colleen.,syntax,island_effects,sentential_subject_island,True,False,False,True,800,-70.66989135742188,-69.5105209350586,0
Who was that lady's investigating that company distracting.,Who was that lady's investigating distracting that company.,syntax,island_effects,sentential_subject_island,True,False,False,True,801,-65.58416748046875,-64.78411865234375,0
Who have some eyes' irritating Douglas aggravated.,Who have some eyes' irritating aggravated Douglas.,syntax,island_effects,sentential_subject_island,True,False,False,True,802,-70.48188018798828,-65.14897918701172,0
Who have many men's helping Tonya disturbed.,Who have many men's helping disturbed Tonya.,syntax,island_effects,sentential_subject_island,True,False,False,True,803,-66.94685363769531,-64.21437072753906,0
Who should a man's fleeing from Katherine worry.,Who should a man's fleeing from worry Katherine.,syntax,island_effects,sentential_subject_island,True,False,False,True,804,-66.70289611816406,-68.73451232910156,1
Who has that bank's criticizing James disturbed.,Who has that bank's criticizing disturbed James.,syntax,island_effects,sentential_subject_island,True,False,False,True,805,-65.88248443603516,-68.07806396484375,1
Who are those slopes' stunning associations astounding.,Who are those slopes' stunning astounding associations.,syntax,island_effects,sentential_subject_island,True,False,False,True,806,-68.26127624511719,-63.97216796875,0
Who will many doctors' arriving at Harvard University aggravate.,Who will many doctors' arriving at aggravate Harvard University.,syntax,island_effects,sentential_subject_island,True,False,False,True,807,-70.76383972167969,-73.59764099121094,1
Who have these guests' arriving at a lot of libraries irritated.,Who have these guests' arriving at irritated a lot of libraries.,syntax,island_effects,sentential_subject_island,True,False,False,True,808,-75.470703125,-75.47380828857422,1
Who has some museum's criticizing Donald confused.,Who has some museum's criticizing confused Donald.,syntax,island_effects,sentential_subject_island,True,False,False,True,809,-65.29794311523438,-69.63934326171875,1
Who are some customers' arriving at a bank confusing.,Who are some customers' arriving at confusing a bank.,syntax,island_effects,sentential_subject_island,True,False,False,True,810,-62.84729766845703,-67.59264373779297,1
Who had a lot of associations' criticizing Deanna bothered.,Who had a lot of associations' criticizing bothered Deanna.,syntax,island_effects,sentential_subject_island,True,False,False,True,811,-76.69556427001953,-78.29255676269531,1
Who had some window's bothering Carmen stunned.,Who had some window's bothering stunned Carmen.,syntax,island_effects,sentential_subject_island,True,False,False,True,812,-71.76545715332031,-73.67295837402344,1
Who should pasta's astounding many teachers upset.,Who should pasta's astounding upset many teachers.,syntax,island_effects,sentential_subject_island,True,False,False,True,813,-71.2821044921875,-67.62738800048828,0
Who have some students' arriving at libraries disgusted.,Who have some students' arriving at disgusted libraries.,syntax,island_effects,sentential_subject_island,True,False,False,True,814,-67.10962677001953,-65.84683227539062,0
Who has that sweater's irritating Spain impressed.,Who has that sweater's irritating impressed Spain.,syntax,island_effects,sentential_subject_island,True,False,False,True,815,-70.31832122802734,-71.24545288085938,1
Who have a lot of ladies' escaping from Deanna scared.,Who have a lot of ladies' escaping from scared Deanna.,syntax,island_effects,sentential_subject_island,True,False,False,True,816,-72.83163452148438,-72.32134246826172,0
Who has every eggplant's distracting Dawn sounded like.,Who has every eggplant's distracting sounded like Dawn.,syntax,island_effects,sentential_subject_island,True,False,False,True,817,-84.3237533569336,-82.4583511352539,0
Who had some window's distracting Frank disgusted.,Who had some window's distracting disgusted Frank.,syntax,island_effects,sentential_subject_island,True,False,False,True,818,-69.96751403808594,-73.23571014404297,1
Who can all men's cleaning a lot of schools irritate.,Who can all men's cleaning irritate a lot of schools.,syntax,island_effects,sentential_subject_island,True,False,False,True,819,-68.48573303222656,-68.31318664550781,0
Who have those shawls' bothering Catherine shocked.,Who have those shawls' bothering shocked Catherine.,syntax,island_effects,sentential_subject_island,True,False,False,True,820,-81.36793518066406,-84.90312957763672,1
Who has every eggplant's impressing Russell annoyed.,Who has every eggplant's impressing annoyed Russell.,syntax,island_effects,sentential_subject_island,True,False,False,True,821,-85.19696044921875,-84.06015014648438,0
Who would the pedestrians' noticing Russell disturb.,Who would the pedestrians' noticing disturb Russell.,syntax,island_effects,sentential_subject_island,True,False,False,True,822,-73.57634735107422,-71.80937957763672,0
Who can this dancer's escaping from a lot of ladies annoy.,Who can this dancer's escaping from annoy a lot of ladies.,syntax,island_effects,sentential_subject_island,True,False,False,True,823,-80.18515014648438,-79.62495422363281,0
