sentence_good,sentence_bad,field,linguistics_term,UID,simple_LM_method,one_prefix_method,two_prefix_method,lexically_identical,pair_id,good_prob,bad_prob,correct
Who have teachers' cleaning many museums upset.,Who have teachers' cleaning upset many museums.,syntax,island_effects,sentential_subject_island,True,False,False,True,236,-67.20531463623047,-64.11598205566406,0
What had these waiters' talking about Lucille sounded like.,What had these waiters' talking about sounded like Lucille.,syntax,island_effects,sentential_subject_island,True,False,False,True,237,-85.01470947265625,-84.83802795410156,0
Who should every dancer's firing Cynthia annoy.,Who should every dancer's firing annoy Cynthia.,syntax,island_effects,sentential_subject_island,True,False,False,True,238,-75.35321807861328,-74.61454772949219,0
Who had a lot of dancers' discussing Jodi irritated.,Who had a lot of dancers' discussing irritated Jodi.,syntax,island_effects,sentential_subject_island,True,False,False,True,239,-74.6258773803711,-73.0848617553711,0
Who does this computer's bothering many boys worry.,Who does this computer's bothering worry many boys.,syntax,island_effects,sentential_subject_island,True,False,False,True,240,-66.62648010253906,-69.59255981445312,1
Who would many men's driving to the hospital scare.,Who would many men's driving to scare the hospital.,syntax,island_effects,sentential_subject_island,True,False,False,True,241,-63.51818084716797,-55.377662658691406,0
Who had a lot of doctors' hiring Raymond irritated.,Who had a lot of doctors' hiring irritated Raymond.,syntax,island_effects,sentential_subject_island,True,False,False,True,242,-69.98719787597656,-68.11578369140625,0
Who was the association's insulting Pamela annoying.,Who was the association's insulting annoying Pamela.,syntax,island_effects,sentential_subject_island,True,False,False,True,243,-66.61111450195312,-69.9859619140625,1
Who are those students' going to every school alarming.,Who are those students' going to alarming every school.,syntax,island_effects,sentential_subject_island,True,False,False,True,244,-60.54586410522461,-60.29631805419922,0
Who are the guests' working with Steven astounding.,Who are the guests' working with astounding Steven.,syntax,island_effects,sentential_subject_island,True,False,False,True,245,-63.937957763671875,-65.52166748046875,1
Who does that hill's bothering that man sound like.,Who does that hill's bothering sound like that man.,syntax,island_effects,sentential_subject_island,True,False,False,True,246,-70.46035766601562,-70.35726928710938,0
Who has some woman's cleaning all hospitals annoyed.,Who has some woman's cleaning annoyed all hospitals.,syntax,island_effects,sentential_subject_island,True,False,False,True,247,-70.54197692871094,-69.23747253417969,0
Who will some actresses' walking through these libraries scare.,Who will some actresses' walking through scare these libraries.,syntax,island_effects,sentential_subject_island,True,False,False,True,248,-79.97062683105469,-77.2451400756836,0
Who is the association's working with a woman hurting.,Who is the association's working with hurting a woman.,syntax,island_effects,sentential_subject_island,True,False,False,True,249,-58.119544982910156,-57.95148849487305,0
Who has the boy's running around some hospital sounded like.,Who has the boy's running around sounded like some hospital.,syntax,island_effects,sentential_subject_island,True,False,False,True,250,-67.96308135986328,-67.20001220703125,0
What were these girls' complaining about Melissa disagreeing with.,What were these girls' complaining about disagreeing with Melissa.,syntax,island_effects,sentential_subject_island,True,False,False,True,251,-82.52083587646484,-82.00373840332031,0
Who would the waitress's returning to Dennis aggravate.,Who would the waitress's returning to aggravate Dennis.,syntax,island_effects,sentential_subject_island,True,False,False,True,252,-68.444580078125,-67.5731201171875,0
Who had many boys' revealing Pamela stunned.,Who had many boys' revealing stunned Pamela.,syntax,island_effects,sentential_subject_island,True,False,False,True,253,-65.11654663085938,-68.7650146484375,1
What are libraries' insulting Gary disagreeing with.,What are libraries' insulting disagreeing with Gary.,syntax,island_effects,sentential_subject_island,True,False,False,True,254,-76.8414306640625,-75.17655944824219,0
Who have those children' complaining about Amy irritated.,Who have those children' complaining about irritated Amy.,syntax,island_effects,sentential_subject_island,True,False,False,True,255,-65.93597412109375,-65.69353485107422,0
Who had some associations' selling most banks disturbed.,Who had some associations' selling disturbed most banks.,syntax,island_effects,sentential_subject_island,True,False,False,True,256,-74.6833267211914,-74.18700408935547,0
Who had all stories' disagreeing with Tiffany scared.,Who had all stories' disagreeing with scared Tiffany.,syntax,island_effects,sentential_subject_island,True,False,False,True,257,-76.07537078857422,-76.51676177978516,1
Who was this school's concealing Karen annoying.,Who was this school's concealing annoying Karen.,syntax,island_effects,sentential_subject_island,True,False,False,True,258,-69.97118377685547,-72.09024047851562,1
Who had some boy's observing Becca impressed.,Who had some boy's observing impressed Becca.,syntax,island_effects,sentential_subject_island,True,False,False,True,259,-70.5808334350586,-72.42999267578125,1
Who would the men's appreciating Sara disturb.,Who would the men's appreciating disturb Sara.,syntax,island_effects,sentential_subject_island,True,False,False,True,260,-70.02093505859375,-67.53459167480469,0
Who did these men's discovering some school embarrass.,Who did these men's discovering embarrass some school.,syntax,island_effects,sentential_subject_island,True,False,False,True,261,-68.48057556152344,-66.32024383544922,0
Who are some pedestrians' noticing Tonya disturbing.,Who are some pedestrians' noticing disturbing Tonya.,syntax,island_effects,sentential_subject_island,True,False,False,True,262,-73.37984466552734,-72.13203430175781,0
Who have many schools' appreciating Rachelle disgusted.,Who have many schools' appreciating disgusted Rachelle.,syntax,island_effects,sentential_subject_island,True,False,False,True,263,-76.0223388671875,-77.28472900390625,1
Who are all waiters' dropping by those banks shocking.,Who are all waiters' dropping by shocking those banks.,syntax,island_effects,sentential_subject_island,True,False,False,True,264,-76.508544921875,-75.5755844116211,0
Who are most organizations' working with these cashiers astounding.,Who are most organizations' working with astounding these cashiers.,syntax,island_effects,sentential_subject_island,True,False,False,True,265,-76.59092712402344,-74.69413757324219,0
Who are some girls' hiding Russell disagreeing with.,Who are some girls' hiding disagreeing with Russell.,syntax,island_effects,sentential_subject_island,True,False,False,True,266,-75.230224609375,-75.12313079833984,0
Who is this legislature's talking about Connie distracting.,Who is this legislature's talking about distracting Connie.,syntax,island_effects,sentential_subject_island,True,False,False,True,267,-65.57488250732422,-66.2503890991211,1
Who can some restaurant's alarming the school sound like.,Who can some restaurant's alarming sound like the school.,syntax,island_effects,sentential_subject_island,True,False,False,True,268,-71.00326538085938,-65.67758178710938,0
Who are actresses' thinking about Tracy shocking.,Who are actresses' thinking about shocking Tracy.,syntax,island_effects,sentential_subject_island,True,False,False,True,269,-63.15879440307617,-64.49409484863281,1
What had all cashiers' selling a newspaper article disagreed with.,What had all cashiers' selling disagreed with a newspaper article.,syntax,island_effects,sentential_subject_island,True,False,False,True,270,-89.35302734375,-85.70724487304688,0
Who had people's bringing a lot of schools upset.,Who had people's bringing upset a lot of schools.,syntax,island_effects,sentential_subject_island,True,False,False,True,271,-61.51832580566406,-61.1396369934082,0
Who are those actresses' questioning Bill distracting.,Who are those actresses' questioning distracting Bill.,syntax,island_effects,sentential_subject_island,True,False,False,True,272,-65.65750885009766,-66.90511322021484,1
Who could those organizations' working with Carmen stun.,Who could those organizations' working with stun Carmen.,syntax,island_effects,sentential_subject_island,True,False,False,True,273,-69.96334075927734,-67.77079772949219,0
Who was that blouse's bothering a school upsetting.,Who was that blouse's bothering upsetting a school.,syntax,island_effects,sentential_subject_island,True,False,False,True,274,-71.9439697265625,-72.59246826171875,1
Who would a lot of dancers' buying some libraries scare.,Who would a lot of dancers' buying scare some libraries.,syntax,island_effects,sentential_subject_island,True,False,False,True,275,-76.51580047607422,-75.17000579833984,0
Who would a dancer's exploring some library upset.,Who would a dancer's exploring upset some library.,syntax,island_effects,sentential_subject_island,True,False,False,True,276,-69.52217864990234,-69.36068725585938,0
Who has every lady's visiting Maria distracted.,Who has every lady's visiting distracted Maria.,syntax,island_effects,sentential_subject_island,True,False,False,True,277,-63.53472900390625,-65.65275573730469,1
What did a lot of adults' watching Adam sound like.,What did a lot of adults' watching sound like Adam.,syntax,island_effects,sentential_subject_island,True,False,False,True,278,-65.35679626464844,-62.84074020385742,0
Who could many actresses' touring that museum scare.,Who could many actresses' touring scare that museum.,syntax,island_effects,sentential_subject_island,True,False,False,True,279,-79.36337280273438,-75.84526062011719,0
What are a lot of schools' embarrassing some drivers disagreeing with.,What are a lot of schools' embarrassing disagreeing with some drivers.,syntax,island_effects,sentential_subject_island,True,False,False,True,280,-83.04158782958984,-77.31665802001953,0
Who has a waitress's returning to Lissa irritated.,Who has a waitress's returning to irritated Lissa.,syntax,island_effects,sentential_subject_island,True,False,False,True,281,-76.31344604492188,-74.11689758300781,0
Who are all customers' referencing Kristin distracting.,Who are all customers' referencing distracting Kristin.,syntax,island_effects,sentential_subject_island,True,False,False,True,282,-63.28269958496094,-63.93827819824219,1
Who have those women's lifting a lot of banks scared.,Who have those women's lifting scared a lot of banks.,syntax,island_effects,sentential_subject_island,True,False,False,True,283,-68.58575439453125,-68.0279769897461,0
Who has this girl's firing Kristen bothered.,Who has this girl's firing bothered Kristen.,syntax,island_effects,sentential_subject_island,True,False,False,True,284,-65.00819396972656,-65.32833099365234,1
Who could this dancer's noticing Dennis annoy.,Who could this dancer's noticing annoy Dennis.,syntax,island_effects,sentential_subject_island,True,False,False,True,285,-71.69807434082031,-70.3957748413086,0
Who are the adults' kissing Donna irritating.,Who are the adults' kissing irritating Donna.,syntax,island_effects,sentential_subject_island,True,False,False,True,286,-62.26563262939453,-61.19101333618164,0
Who might the library's criticizing Todd hurt.,Who might the library's criticizing hurt Todd.,syntax,island_effects,sentential_subject_island,True,False,False,True,287,-65.83731079101562,-69.00187683105469,1
Who will the convertible's confusing those women worry.,Who will the convertible's confusing worry those women.,syntax,island_effects,sentential_subject_island,True,False,False,True,288,-70.537841796875,-73.25048828125,1
Who had a lot of guests' talking to Carmen disgusted.,Who had a lot of guests' talking to disgusted Carmen.,syntax,island_effects,sentential_subject_island,True,False,False,True,289,-72.2289047241211,-74.1181869506836,1
Who was every man's investigating some actress shocking.,Who was every man's investigating shocking some actress.,syntax,island_effects,sentential_subject_island,True,False,False,True,290,-68.84634399414062,-70.47053527832031,1
Who had all pedestrians' noticing Kimberley confused.,Who had all pedestrians' noticing confused Kimberley.,syntax,island_effects,sentential_subject_island,True,False,False,True,291,-76.36097717285156,-73.89226531982422,0
Who had a woman's running around a hospital irritated.,Who had a woman's running around irritated a hospital.,syntax,island_effects,sentential_subject_island,True,False,False,True,292,-60.69965362548828,-61.402557373046875,1
Who is the waitress's healing Amanda embarrassing.,Who is the waitress's healing embarrassing Amanda.,syntax,island_effects,sentential_subject_island,True,False,False,True,293,-61.96226501464844,-61.897071838378906,0
Who had many pedestrians' noticing every bank worried.,Who had many pedestrians' noticing worried every bank.,syntax,island_effects,sentential_subject_island,True,False,False,True,294,-72.59827423095703,-74.25469970703125,1
Who had that legislature's buying those banks impressed.,Who had that legislature's buying impressed those banks.,syntax,island_effects,sentential_subject_island,True,False,False,True,295,-67.43467712402344,-68.6548843383789,1
Who is broccoli's worrying Sara disagreeing with.,Who is broccoli's worrying disagreeing with Sara.,syntax,island_effects,sentential_subject_island,True,False,False,True,296,-79.31070709228516,-75.2589111328125,0
Who do guys' noticing Joel confuse.,Who do guys' noticing confuse Joel.,syntax,island_effects,sentential_subject_island,True,False,False,True,297,-61.778831481933594,-61.42193603515625,0
Who do students' approaching Elizabeth bore.,Who do students' approaching bore Elizabeth.,syntax,island_effects,sentential_subject_island,True,False,False,True,298,-55.11553192138672,-58.270198822021484,1
Who were all people's watching cashiers worrying.,Who were all people's watching worrying cashiers.,syntax,island_effects,sentential_subject_island,True,False,False,True,299,-67.40248107910156,-65.96981048583984,0
Who have some children' passing a school shocked.,Who have some children' passing shocked a school.,syntax,island_effects,sentential_subject_island,True,False,False,True,300,-61.31940841674805,-62.509437561035156,1
Who could these doctors' talking to Christina confuse.,Who could these doctors' talking to confuse Christina.,syntax,island_effects,sentential_subject_island,True,False,False,True,301,-73.97517395019531,-68.69462585449219,0
Who have actresses' healing all ladies irritated.,Who have actresses' healing irritated all ladies.,syntax,island_effects,sentential_subject_island,True,False,False,True,302,-70.46282958984375,-68.49794006347656,0
Who could a lot of guests' leaving Donald distract.,Who could a lot of guests' leaving distract Donald.,syntax,island_effects,sentential_subject_island,True,False,False,True,303,-68.73026275634766,-70.25379943847656,1
Who are all teachers' healing this lady upsetting.,Who are all teachers' healing upsetting this lady.,syntax,island_effects,sentential_subject_island,True,False,False,True,304,-65.23854064941406,-66.10137939453125,1
Who did most children' concealing Connie embarrass.,Who did most children' concealing embarrass Connie.,syntax,island_effects,sentential_subject_island,True,False,False,True,305,-77.17610931396484,-75.09235382080078,0
Who does a lady's firing many drivers astound.,Who does a lady's firing astound many drivers.,syntax,island_effects,sentential_subject_island,True,False,False,True,306,-76.02145385742188,-73.3007583618164,0
Who are many children' curing Grace worrying.,Who are many children' curing worrying Grace.,syntax,island_effects,sentential_subject_island,True,False,False,True,307,-59.72406005859375,-60.078582763671875,1
Who should some museum's arguing about Donna alarm.,Who should some museum's arguing about alarm Donna.,syntax,island_effects,sentential_subject_island,True,False,False,True,308,-74.22053527832031,-76.37477111816406,1
Who have many sketches' looking like all boys embarrassed.,Who have many sketches' looking like embarrassed all boys.,syntax,island_effects,sentential_subject_island,True,False,False,True,309,-70.82049560546875,-73.93791198730469,1
Who were girls' dropping by this hospital shocking.,Who were girls' dropping by shocking this hospital.,syntax,island_effects,sentential_subject_island,True,False,False,True,310,-66.27128601074219,-67.34181213378906,1
Who were the actresses' observing Bethany annoying.,Who were the actresses' observing annoying Bethany.,syntax,island_effects,sentential_subject_island,True,False,False,True,311,-74.76221466064453,-76.28292846679688,1
Who are a lot of legislatures' helping Larry embarrassing.,Who are a lot of legislatures' helping embarrassing Larry.,syntax,island_effects,sentential_subject_island,True,False,False,True,312,-74.40116882324219,-73.0797119140625,0
Who do the children' researching these companies disgust.,Who do the children' researching disgust these companies.,syntax,island_effects,sentential_subject_island,True,False,False,True,313,-62.80432891845703,-65.0455322265625,1
Who had the man's investigating Sherry annoyed.,Who had the man's investigating annoyed Sherry.,syntax,island_effects,sentential_subject_island,True,False,False,True,314,-64.33354187011719,-63.427024841308594,0
Who have those waitresses' bringing that bank annoyed.,Who have those waitresses' bringing annoyed that bank.,syntax,island_effects,sentential_subject_island,True,False,False,True,315,-85.78231048583984,-87.04560089111328,1
Who had these doctors' cleaning the hospital irritated.,Who had these doctors' cleaning irritated the hospital.,syntax,island_effects,sentential_subject_island,True,False,False,True,316,-68.59233093261719,-65.32842254638672,0
Who were some libraries' taking many schools embarrassing.,Who were some libraries' taking embarrassing many schools.,syntax,island_effects,sentential_subject_island,True,False,False,True,317,-72.45327758789062,-70.32740783691406,0
Who would many students' disagreeing with the adults confuse.,Who would many students' disagreeing with confuse the adults.,syntax,island_effects,sentential_subject_island,True,False,False,True,318,-82.21006774902344,-79.06986236572266,0
Who does this actress's appreciating Martin worry.,Who does this actress's appreciating worry Martin.,syntax,island_effects,sentential_subject_island,True,False,False,True,319,-69.27743530273438,-71.08110046386719,1
Who can a man's questioning the people irritate.,Who can a man's questioning irritate the people.,syntax,island_effects,sentential_subject_island,True,False,False,True,320,-57.523399353027344,-57.38343048095703,0
Who do universities' admiring the Borgias hurt.,Who do universities' admiring hurt the Borgias.,syntax,island_effects,sentential_subject_island,True,False,False,True,321,-82.52662658691406,-82.9691162109375,1
Who are most boys' helping Teresa disturbing.,Who are most boys' helping disturbing Teresa.,syntax,island_effects,sentential_subject_island,True,False,False,True,322,-63.00286102294922,-62.43992614746094,0
Who have some governments' referencing the doctors stunned.,Who have some governments' referencing stunned the doctors.,syntax,island_effects,sentential_subject_island,True,False,False,True,323,-68.04206848144531,-68.63836669921875,1
Who have these adults' exploring every school worried.,Who have these adults' exploring worried every school.,syntax,island_effects,sentential_subject_island,True,False,False,True,324,-65.1994857788086,-66.537841796875,1
Who should some dancers' questioning Kirsten scare.,Who should some dancers' questioning scare Kirsten.,syntax,island_effects,sentential_subject_island,True,False,False,True,325,-79.81103515625,-75.47749328613281,0
Who had the lady's kissing Larry stunned.,Who had the lady's kissing stunned Larry.,syntax,island_effects,sentential_subject_island,True,False,False,True,326,-59.51580810546875,-60.69471740722656,1
Who are the dancers' leaving Cheryl aggravating.,Who are the dancers' leaving aggravating Cheryl.,syntax,island_effects,sentential_subject_island,True,False,False,True,327,-62.423622131347656,-63.43421173095703,1
Who are these guys' aggravating Laurie shocking.,Who are these guys' aggravating shocking Laurie.,syntax,island_effects,sentential_subject_island,True,False,False,True,328,-66.15542602539062,-66.84276580810547,1
Who had these adults' cleaning a school scared.,Who had these adults' cleaning scared a school.,syntax,island_effects,sentential_subject_island,True,False,False,True,329,-67.26667785644531,-66.65320587158203,0
Who are a lot of movies' alarming Bradley hurting.,Who are a lot of movies' alarming hurting Bradley.,syntax,island_effects,sentential_subject_island,True,False,False,True,330,-67.85611724853516,-64.54814147949219,0
Who did most teenagers' dropping by the hills sound like.,Who did most teenagers' dropping by sound like the hills.,syntax,island_effects,sentential_subject_island,True,False,False,True,331,-72.25521850585938,-70.2303466796875,0
Who had a lot of ladies' cleaning some hospital confused.,Who had a lot of ladies' cleaning confused some hospital.,syntax,island_effects,sentential_subject_island,True,False,False,True,332,-70.10018920898438,-69.04998016357422,0
What had some guy's examining this commentary sounded like.,What had some guy's examining sounded like this commentary.,syntax,island_effects,sentential_subject_island,True,False,False,True,333,-71.53155517578125,-68.38771057128906,0
Who are all teachers' listening to Randolf boring.,Who are all teachers' listening to boring Randolf.,syntax,island_effects,sentential_subject_island,True,False,False,True,334,-71.87225341796875,-74.76405334472656,1
Who did those guests' kissing Nancy confuse.,Who did those guests' kissing confuse Nancy.,syntax,island_effects,sentential_subject_island,True,False,False,True,335,-68.07748413085938,-67.94706726074219,0
Who can some boy's thinking about Rose impress.,Who can some boy's thinking about impress Rose.,syntax,island_effects,sentential_subject_island,True,False,False,True,336,-61.35542297363281,-62.83997344970703,1
Who were many waiters' researching the legislatures impressing.,Who were many waiters' researching impressing the legislatures.,syntax,island_effects,sentential_subject_island,True,False,False,True,337,-83.35624694824219,-83.1529541015625,0
Who will some pie's disgusting Tammy disturb.,Who will some pie's disgusting disturb Tammy.,syntax,island_effects,sentential_subject_island,True,False,False,True,338,-75.1500473022461,-72.80260467529297,0
Who were all cars' worrying Winston Churchill scaring.,Who were all cars' worrying scaring Winston Churchill.,syntax,island_effects,sentential_subject_island,True,False,False,True,339,-83.80679321289062,-84.1358642578125,1
What had the patients' examining most reports sounded like.,What had the patients' examining sounded like most reports.,syntax,island_effects,sentential_subject_island,True,False,False,True,340,-74.90899658203125,-70.87731170654297,0
Who are some students' approaching William worrying.,Who are some students' approaching worrying William.,syntax,island_effects,sentential_subject_island,True,False,False,True,341,-59.95018768310547,-61.494529724121094,1
Who has a guy's thinking about Dan impressed.,Who has a guy's thinking about impressed Dan.,syntax,island_effects,sentential_subject_island,True,False,False,True,342,-55.11439895629883,-58.71540832519531,1
Who have some waitresses' irritating the dancer stunned.,Who have some waitresses' irritating stunned the dancer.,syntax,island_effects,sentential_subject_island,True,False,False,True,343,-83.2082748413086,-84.49871063232422,1
Who did most children' approaching Monet worry.,Who did most children' approaching worry Monet.,syntax,island_effects,sentential_subject_island,True,False,False,True,344,-67.63835144042969,-68.71458435058594,1
Who could a lot of students' touring these libraries shock.,Who could a lot of students' touring shock these libraries.,syntax,island_effects,sentential_subject_island,True,False,False,True,345,-74.46283721923828,-70.17546081542969,0
Who is the boy's watching Gerald worrying.,Who is the boy's watching worrying Gerald.,syntax,island_effects,sentential_subject_island,True,False,False,True,346,-55.77264404296875,-56.76213455200195,1
What are cashiers' aggravating Caroline disagreeing with.,What are cashiers' aggravating disagreeing with Caroline.,syntax,island_effects,sentential_subject_island,True,False,False,True,347,-92.04283905029297,-91.3210678100586,0
Who were most dancers' finding Ronald annoying.,Who were most dancers' finding annoying Ronald.,syntax,island_effects,sentential_subject_island,True,False,False,True,348,-67.49736785888672,-68.79820251464844,1
Who have these dancers' irritating Angela disagreed with.,Who have these dancers' irritating disagreed with Angela.,syntax,island_effects,sentential_subject_island,True,False,False,True,349,-70.40475463867188,-71.76220703125,1
Who were all patients' discovering Jason irritating.,Who were all patients' discovering irritating Jason.,syntax,island_effects,sentential_subject_island,True,False,False,True,350,-61.21635818481445,-61.43986892700195,1
Who were many schools' helping James upsetting.,Who were many schools' helping upsetting James.,syntax,island_effects,sentential_subject_island,True,False,False,True,351,-63.268768310546875,-66.01516723632812,1
Who have most guys' exploring all banks scared.,Who have most guys' exploring scared all banks.,syntax,island_effects,sentential_subject_island,True,False,False,True,352,-69.47354125976562,-71.1043701171875,1
