sentence_good,sentence_bad,field,linguistics_term,UID,simple_LM_method,one_prefix_method,two_prefix_method,lexically_identical,pair_id,good_prob,bad_prob,correct
Who had the patients' cleaning those banks upset.,Who had the patients' cleaning upset those banks.,syntax,island_effects,sentential_subject_island,True,False,False,True,0,-67.08905029296875,-64.88296508789062,0
Who has the waitress's observing Christine bothered.,Who has the waitress's observing bothered Christine.,syntax,island_effects,sentential_subject_island,True,False,False,True,1,-65.97290802001953,-68.71104431152344,1
Who have a lot of adults' scanning this play disagreed with.,Who have a lot of adults' scanning disagreed with this play.,syntax,island_effects,sentential_subject_island,True,False,False,True,2,-71.20291900634766,-67.9038314819336,0
Who have many women's touring Spain embarrassed.,Who have many women's touring embarrassed Spain.,syntax,island_effects,sentential_subject_island,True,False,False,True,3,-58.03874588012695,-60.05664825439453,1
Who should pedestrians' curing Deanna scare.,Who should pedestrians' curing scare Deanna.,syntax,island_effects,sentential_subject_island,True,False,False,True,4,-78.82693481445312,-74.20367431640625,0
Who are a lot of guys' kissing Heather aggravating.,Who are a lot of guys' kissing aggravating Heather.,syntax,island_effects,sentential_subject_island,True,False,False,True,5,-65.64413452148438,-67.3271255493164,1
Who should a woman's selling the bank distract.,Who should a woman's selling distract the bank.,syntax,island_effects,sentential_subject_island,True,False,False,True,6,-60.75345993041992,-58.741065979003906,0
Who will a lot of waiters' attacking Claire irritate.,Who will a lot of waiters' attacking irritate Claire.,syntax,island_effects,sentential_subject_island,True,False,False,True,7,-82.13655090332031,-82.97647857666016,1
Who have these girls' complaining about Phillip aggravated.,Who have these girls' complaining about aggravated Phillip.,syntax,island_effects,sentential_subject_island,True,False,False,True,8,-71.1282958984375,-67.24742126464844,0
Who had most girls' kissing a lady annoyed.,Who had most girls' kissing annoyed a lady.,syntax,island_effects,sentential_subject_island,True,False,False,True,9,-66.09796905517578,-65.22306823730469,0
Who would those carriages' shocking Sara worry.,Who would those carriages' shocking worry Sara.,syntax,island_effects,sentential_subject_island,True,False,False,True,10,-76.63231658935547,-78.8467025756836,1
Who should all shoes' boring Judy impress.,Who should all shoes' boring impress Judy.,syntax,island_effects,sentential_subject_island,True,False,False,True,11,-70.2431640625,-71.84794616699219,1
Who have all senators' admiring William distracted.,Who have all senators' admiring distracted William.,syntax,island_effects,sentential_subject_island,True,False,False,True,12,-71.40377807617188,-75.21412658691406,1
Who should many guests' thinking about Leslie scare.,Who should many guests' thinking about scare Leslie.,syntax,island_effects,sentential_subject_island,True,False,False,True,13,-71.9430923461914,-69.29330444335938,0
Who had every museum's boasting about Dana impressed.,Who had every museum's boasting about impressed Dana.,syntax,island_effects,sentential_subject_island,True,False,False,True,14,-70.74485778808594,-75.71014404296875,1
Who have governments' selling the hospital confused.,Who have governments' selling confused the hospital.,syntax,island_effects,sentential_subject_island,True,False,False,True,15,-59.12678146362305,-58.344871520996094,0
Who were a lot of students' embarrassing Becky disgusting.,Who were a lot of students' embarrassing disgusting Becky.,syntax,island_effects,sentential_subject_island,True,False,False,True,16,-66.97571563720703,-64.97176361083984,0
Who will all ladders' irritating most boys embarrass.,Who will all ladders' irritating embarrass most boys.,syntax,island_effects,sentential_subject_island,True,False,False,True,17,-85.27751159667969,-82.57783508300781,0
Who had all ladies' running around Harvard University astounded.,Who had all ladies' running around astounded Harvard University.,syntax,island_effects,sentential_subject_island,True,False,False,True,18,-81.04437255859375,-78.72256469726562,0
Who are many mushrooms' distracting those girls alarming.,Who are many mushrooms' distracting alarming those girls.,syntax,island_effects,sentential_subject_island,True,False,False,True,19,-71.0291748046875,-71.80217742919922,1
Who have the people's walking through Harvard University embarrassed.,Who have the people's walking through embarrassed Harvard University.,syntax,island_effects,sentential_subject_island,True,False,False,True,20,-66.07359313964844,-67.84725952148438,1
Who were these guests' escaping from Tanya shocking.,Who were these guests' escaping from shocking Tanya.,syntax,island_effects,sentential_subject_island,True,False,False,True,21,-73.29547119140625,-73.67010498046875,1
Who had all rabbits' finding Carrie annoyed.,Who had all rabbits' finding annoyed Carrie.,syntax,island_effects,sentential_subject_island,True,False,False,True,22,-69.09687805175781,-68.51678466796875,0
Who have children' investigating Joel alarmed.,Who have children' investigating alarmed Joel.,syntax,island_effects,sentential_subject_island,True,False,False,True,23,-59.363555908203125,-60.5592155456543,1
Who did the man's healing Melinda hurt.,Who did the man's healing hurt Melinda.,syntax,island_effects,sentential_subject_island,True,False,False,True,24,-62.922183990478516,-62.62727355957031,0
Who did students' leaving Jennifer astound.,Who did students' leaving astound Jennifer.,syntax,island_effects,sentential_subject_island,True,False,False,True,25,-65.19083404541016,-64.91072845458984,0
Who would the waiters' questioning Joel upset.,Who would the waiters' questioning upset Joel.,syntax,island_effects,sentential_subject_island,True,False,False,True,26,-72.16201782226562,-71.98348999023438,0
Who is some waitress's researching some universities disturbing.,Who is some waitress's researching disturbing some universities.,syntax,island_effects,sentential_subject_island,True,False,False,True,27,-73.42158508300781,-74.02632904052734,1
Who has a girl's lifting that report sounded like.,Who has a girl's lifting sounded like that report.,syntax,island_effects,sentential_subject_island,True,False,False,True,28,-64.21351623535156,-61.858211517333984,0
Who had some lady's passing this school worried.,Who had some lady's passing worried this school.,syntax,island_effects,sentential_subject_island,True,False,False,True,29,-63.651275634765625,-66.39854431152344,1
Who was this dancer's exploring those hospitals disturbing.,Who was this dancer's exploring disturbing those hospitals.,syntax,island_effects,sentential_subject_island,True,False,False,True,30,-73.29310607910156,-71.09844970703125,0
Who were these pedestrians' cleaning many libraries astounding.,Who were these pedestrians' cleaning astounding many libraries.,syntax,island_effects,sentential_subject_island,True,False,False,True,31,-76.92999267578125,-74.74186706542969,0
Who were those governments' talking about Jason astounding.,Who were those governments' talking about astounding Jason.,syntax,island_effects,sentential_subject_island,True,False,False,True,32,-68.88029479980469,-66.96536254882812,0
Who had many teenagers' lifting that school disturbed.,Who had many teenagers' lifting disturbed that school.,syntax,island_effects,sentential_subject_island,True,False,False,True,33,-72.79847717285156,-69.52213287353516,0
Who should this boy's aggravating Curtis worry.,Who should this boy's aggravating worry Curtis.,syntax,island_effects,sentential_subject_island,True,False,False,True,34,-71.97442626953125,-72.8177261352539,1
Who were those teachers' hugging Brett bothering.,Who were those teachers' hugging bothering Brett.,syntax,island_effects,sentential_subject_island,True,False,False,True,35,-68.25706481933594,-67.17082214355469,0
Who have those guests' walking through some libraries astounded.,Who have those guests' walking through astounded some libraries.,syntax,island_effects,sentential_subject_island,True,False,False,True,36,-79.7786636352539,-79.82460021972656,1
Who had the projector's confusing Sandra worried.,Who had the projector's confusing worried Sandra.,syntax,island_effects,sentential_subject_island,True,False,False,True,37,-63.72517395019531,-66.19734191894531,1
Who was some committee's taking the hospitals upsetting.,Who was some committee's taking upsetting the hospitals.,syntax,island_effects,sentential_subject_island,True,False,False,True,38,-66.50985717773438,-66.68342590332031,1
Who were most patients' revealing Douglas impressing.,Who were most patients' revealing impressing Douglas.,syntax,island_effects,sentential_subject_island,True,False,False,True,39,-66.92503356933594,-66.28341674804688,0
Who has this actress's cleaning those schools worried.,Who has this actress's cleaning worried those schools.,syntax,island_effects,sentential_subject_island,True,False,False,True,40,-68.99991607666016,-69.97488403320312,1
Who are many customers' concealing Sonia worrying.,Who are many customers' concealing worrying Sonia.,syntax,island_effects,sentential_subject_island,True,False,False,True,41,-69.313232421875,-70.93297576904297,1
Who have all senators' complaining about Mary irritated.,Who have all senators' complaining about irritated Mary.,syntax,island_effects,sentential_subject_island,True,False,False,True,42,-69.19068908691406,-68.13679504394531,0
Who have the drivers' listening to Jodi scared.,Who have the drivers' listening to scared Jodi.,syntax,island_effects,sentential_subject_island,True,False,False,True,43,-69.39573669433594,-68.9776840209961,0
Who was a dancer's concealing Homer shocking.,Who was a dancer's concealing shocking Homer.,syntax,island_effects,sentential_subject_island,True,False,False,True,44,-69.15266418457031,-68.74144744873047,0
Who could those children' approaching Natalie scare.,Who could those children' approaching scare Natalie.,syntax,island_effects,sentential_subject_island,True,False,False,True,45,-68.37519836425781,-65.54490661621094,0
Who would a lot of peppers' scaring Brian disgust.,Who would a lot of peppers' scaring disgust Brian.,syntax,island_effects,sentential_subject_island,True,False,False,True,46,-77.75698852539062,-80.21543884277344,1
Who had a lot of senators' returning to a man irritated.,Who had a lot of senators' returning to irritated a man.,syntax,island_effects,sentential_subject_island,True,False,False,True,47,-69.11476135253906,-69.69933319091797,1
Who would this university's praising Becca bother.,Who would this university's praising bother Becca.,syntax,island_effects,sentential_subject_island,True,False,False,True,48,-76.91609191894531,-75.58174896240234,0
Who are all pedestrians' revealing the Lutherans distracting.,Who are all pedestrians' revealing distracting the Lutherans.,syntax,island_effects,sentential_subject_island,True,False,False,True,49,-79.8599853515625,-81.68022155761719,1
Who could a lot of children' discovering many girls worry.,Who could a lot of children' discovering worry many girls.,syntax,island_effects,sentential_subject_island,True,False,False,True,50,-66.23589324951172,-69.83402252197266,1
Who have a lot of guys' hugging the cashiers disgusted.,Who have a lot of guys' hugging disgusted the cashiers.,syntax,island_effects,sentential_subject_island,True,False,False,True,51,-80.709228515625,-80.81623077392578,1
Who are these teenagers' approaching Judy confusing.,Who are these teenagers' approaching confusing Judy.,syntax,island_effects,sentential_subject_island,True,False,False,True,52,-67.26948547363281,-69.49090576171875,1
Who had many windows' worrying Christopher scared.,Who had many windows' worrying scared Christopher.,syntax,island_effects,sentential_subject_island,True,False,False,True,53,-71.30262756347656,-72.92515563964844,1
Who did all libraries' firing Derek alarm.,Who did all libraries' firing alarm Derek.,syntax,island_effects,sentential_subject_island,True,False,False,True,54,-68.96234893798828,-69.70362854003906,1
Who had many cars' upsetting Beverly upset.,Who had many cars' upsetting upset Beverly.,syntax,island_effects,sentential_subject_island,True,False,False,True,55,-67.86180114746094,-70.65032196044922,1
Who had all adults' observing these adults bothered.,Who had all adults' observing bothered these adults.,syntax,island_effects,sentential_subject_island,True,False,False,True,56,-68.46183776855469,-69.68730926513672,1
Who can that museum's discussing Karla scare.,Who can that museum's discussing scare Karla.,syntax,island_effects,sentential_subject_island,True,False,False,True,57,-77.94893646240234,-73.56214904785156,0
Who might these adults' fleeing from Natalie annoy.,Who might these adults' fleeing from annoy Natalie.,syntax,island_effects,sentential_subject_island,True,False,False,True,58,-75.93502807617188,-73.12432861328125,0
Who should a dancer's concealing Patricia distract.,Who should a dancer's concealing distract Patricia.,syntax,island_effects,sentential_subject_island,True,False,False,True,59,-76.52545166015625,-74.9617691040039,0
Who were those dancers' hiding this lady shocking.,Who were those dancers' hiding shocking this lady.,syntax,island_effects,sentential_subject_island,True,False,False,True,60,-67.78311920166016,-70.84172058105469,1
Who is this pasta's upsetting Alice aggravating.,Who is this pasta's upsetting aggravating Alice.,syntax,island_effects,sentential_subject_island,True,False,False,True,61,-72.1150894165039,-71.27220916748047,0
Who are all drivers' investigating Andrea disturbing.,Who are all drivers' investigating disturbing Andrea.,syntax,island_effects,sentential_subject_island,True,False,False,True,62,-65.05997467041016,-66.66648864746094,1
Who was the waitress's passing some museum upsetting.,Who was the waitress's passing upsetting some museum.,syntax,island_effects,sentential_subject_island,True,False,False,True,63,-66.81640625,-67.8861312866211,1
What will those waitresses' listening to the teachers disagree with.,What will those waitresses' listening to disagree with the teachers.,syntax,island_effects,sentential_subject_island,True,False,False,True,64,-87.250732421875,-81.53675079345703,0
Who did some girl's biking to hospitals confuse.,Who did some girl's biking to confuse hospitals.,syntax,island_effects,sentential_subject_island,True,False,False,True,65,-74.05902099609375,-66.37816619873047,0
Who have these waiters' disgusting Grace disturbed.,Who have these waiters' disgusting disturbed Grace.,syntax,island_effects,sentential_subject_island,True,False,False,True,66,-78.63255310058594,-77.63914489746094,0
Who will some organization's concealing Barbara disturb.,Who will some organization's concealing disturb Barbara.,syntax,island_effects,sentential_subject_island,True,False,False,True,67,-79.07170104980469,-77.0017318725586,0
Who should some dancers' researching Jesus irritate.,Who should some dancers' researching irritate Jesus.,syntax,island_effects,sentential_subject_island,True,False,False,True,68,-70.67071533203125,-70.09432983398438,0
Who had some waitress's questioning Russell bored.,Who had some waitress's questioning bored Russell.,syntax,island_effects,sentential_subject_island,True,False,False,True,69,-67.95634460449219,-70.4007568359375,1
Who was every dancer's concealing Tamara impressing.,Who was every dancer's concealing impressing Tamara.,syntax,island_effects,sentential_subject_island,True,False,False,True,70,-84.5726089477539,-82.11079406738281,0
Who had guests' finding Jason aggravated.,Who had guests' finding aggravated Jason.,syntax,island_effects,sentential_subject_island,True,False,False,True,71,-63.32212448120117,-61.69139862060547,0
Who were cats' shocking Noah aggravating.,Who were cats' shocking aggravating Noah.,syntax,island_effects,sentential_subject_island,True,False,False,True,72,-65.74747467041016,-67.32266998291016,1
Who are many guests' arguing about John scaring.,Who are many guests' arguing about scaring John.,syntax,island_effects,sentential_subject_island,True,False,False,True,73,-64.74763488769531,-66.47241973876953,1
What would most guests' concealing Janet disagree with.,What would most guests' concealing disagree with Janet.,syntax,island_effects,sentential_subject_island,True,False,False,True,74,-79.5050277709961,-80.4566421508789,1
Who were many women's discussing Debra hurting.,Who were many women's discussing hurting Debra.,syntax,island_effects,sentential_subject_island,True,False,False,True,75,-64.59825897216797,-61.527889251708984,0
Who are all plays' disagreeing with Margaret hurting.,Who are all plays' disagreeing with hurting Margaret.,syntax,island_effects,sentential_subject_island,True,False,False,True,76,-80.20462799072266,-78.36067199707031,0
Who have most cups' disgusting the Impressionists scared.,Who have most cups' disgusting scared the Impressionists.,syntax,island_effects,sentential_subject_island,True,False,False,True,77,-95.04141998291016,-90.53924560546875,0
Who were these students' discovering Tonya boring.,Who were these students' discovering boring Tonya.,syntax,island_effects,sentential_subject_island,True,False,False,True,78,-69.38818359375,-69.83245849609375,1
Who are these mushrooms' upsetting Jane astounding.,Who are these mushrooms' upsetting astounding Jane.,syntax,island_effects,sentential_subject_island,True,False,False,True,79,-71.54423522949219,-70.83226013183594,0
Who were some guys' approaching Claire scaring.,Who were some guys' approaching scaring Claire.,syntax,island_effects,sentential_subject_island,True,False,False,True,80,-69.24121856689453,-69.65187072753906,1
Who had patients' watching Heidi annoyed.,Who had patients' watching annoyed Heidi.,syntax,island_effects,sentential_subject_island,True,False,False,True,81,-59.850013732910156,-60.45884323120117,1
Who have those guests' describing Margaret impressed.,Who have those guests' describing impressed Margaret.,syntax,island_effects,sentential_subject_island,True,False,False,True,82,-66.25273895263672,-67.85840606689453,1
Who is a shoe's bothering Amy irritating.,Who is a shoe's bothering irritating Amy.,syntax,island_effects,sentential_subject_island,True,False,False,True,83,-59.76604080200195,-61.17242431640625,1
Who did the guests' questioning Amanda stun.,Who did the guests' questioning stun Amanda.,syntax,island_effects,sentential_subject_island,True,False,False,True,84,-66.09065246582031,-65.55154418945312,0
Who were those doctors' noticing a lot of doctors boring.,Who were those doctors' noticing boring a lot of doctors.,syntax,island_effects,sentential_subject_island,True,False,False,True,85,-71.63624572753906,-72.62368774414062,1
Who would every museum's concealing Susan stun.,Who would every museum's concealing stun Susan.,syntax,island_effects,sentential_subject_island,True,False,False,True,86,-76.59918212890625,-76.47454833984375,0
Who have many pedestrians' referencing James astounded.,Who have many pedestrians' referencing astounded James.,syntax,island_effects,sentential_subject_island,True,False,False,True,87,-74.9081039428711,-74.28123474121094,0
Who should the actress's bringing all schools aggravate.,Who should the actress's bringing aggravate all schools.,syntax,island_effects,sentential_subject_island,True,False,False,True,88,-69.68671417236328,-67.92639923095703,0
Who have a lot of companies' hiring Veronica embarrassed.,Who have a lot of companies' hiring embarrassed Veronica.,syntax,island_effects,sentential_subject_island,True,False,False,True,89,-65.69183349609375,-68.74224853515625,1
Who might some lady's noticing Carolyn disagree with.,Who might some lady's noticing disagree with Carolyn.,syntax,island_effects,sentential_subject_island,True,False,False,True,90,-73.84798431396484,-74.1336669921875,1
Who can every pepper's shocking Carmen disturb.,Who can every pepper's shocking disturb Carmen.,syntax,island_effects,sentential_subject_island,True,False,False,True,91,-76.02345275878906,-73.7559814453125,0
Who were all art galleries' scaring Dana disturbing.,Who were all art galleries' scaring disturbing Dana.,syntax,island_effects,sentential_subject_island,True,False,False,True,92,-82.49868774414062,-84.65656280517578,1
Who were most guests' observing Donna confusing.,Who were most guests' observing confusing Donna.,syntax,island_effects,sentential_subject_island,True,False,False,True,93,-67.68235778808594,-67.86009216308594,1
Who did these governments' listening to these teenagers disgust.,Who did these governments' listening to disgust these teenagers.,syntax,island_effects,sentential_subject_island,True,False,False,True,94,-71.58195495605469,-73.59831237792969,1
Who can all organizations' listening to Marie upset.,Who can all organizations' listening to upset Marie.,syntax,island_effects,sentential_subject_island,True,False,False,True,95,-64.55157470703125,-62.026641845703125,0
Who are many guests' arriving at Harvard University stunning.,Who are many guests' arriving at stunning Harvard University.,syntax,island_effects,sentential_subject_island,True,False,False,True,96,-61.680355072021484,-61.92689514160156,1
Who has this actress's insulting Craig confused.,Who has this actress's insulting confused Craig.,syntax,island_effects,sentential_subject_island,True,False,False,True,97,-64.70928955078125,-67.91505432128906,1
Who were some guys' running around some hospital annoying.,Who were some guys' running around annoying some hospital.,syntax,island_effects,sentential_subject_island,True,False,False,True,98,-71.43344116210938,-73.66034698486328,1
Who have all sweaters' impressing Christopher annoyed.,Who have all sweaters' impressing annoyed Christopher.,syntax,island_effects,sentential_subject_island,True,False,False,True,99,-79.49342346191406,-79.98023986816406,1
Who are these libraries' describing Melinda upsetting.,Who are these libraries' describing upsetting Melinda.,syntax,island_effects,sentential_subject_island,True,False,False,True,100,-75.27867126464844,-77.26898193359375,1
Who could these students' astounding Mark confuse.,Who could these students' astounding confuse Mark.,syntax,island_effects,sentential_subject_island,True,False,False,True,101,-69.59428405761719,-68.78773498535156,0
Who was that dancer's curing Stephen stunning.,Who was that dancer's curing stunning Stephen.,syntax,island_effects,sentential_subject_island,True,False,False,True,102,-66.54165649414062,-67.41390991210938,1
Who is this girl's approaching Nicole disagreeing with.,Who is this girl's approaching disagreeing with Nicole.,syntax,island_effects,sentential_subject_island,True,False,False,True,103,-74.65545654296875,-74.3721923828125,0
Who did all senators' hiring Meredith distract.,Who did all senators' hiring distract Meredith.,syntax,island_effects,sentential_subject_island,True,False,False,True,104,-69.39698791503906,-69.45654296875,1
Who have the actresses' hiring Rachelle bored.,Who have the actresses' hiring bored Rachelle.,syntax,island_effects,sentential_subject_island,True,False,False,True,105,-72.70738983154297,-75.31266784667969,1
Who could many people's lifting this library impress.,Who could many people's lifting impress this library.,syntax,island_effects,sentential_subject_island,True,False,False,True,106,-66.05107116699219,-63.43528747558594,0
Who are the guys' biking to some hospital bothering.,Who are the guys' biking to bothering some hospital.,syntax,island_effects,sentential_subject_island,True,False,False,True,107,-72.31779479980469,-67.85383605957031,0
Who has the dancer's buying some bank confused.,Who has the dancer's buying confused some bank.,syntax,island_effects,sentential_subject_island,True,False,False,True,108,-65.11732482910156,-68.65013122558594,1
Who will a legislature's aggravating Anna hurt.,Who will a legislature's aggravating hurt Anna.,syntax,island_effects,sentential_subject_island,True,False,False,True,109,-70.02543640136719,-69.79768371582031,0
Who have those boys' healing the guests distracted.,Who have those boys' healing distracted the guests.,syntax,island_effects,sentential_subject_island,True,False,False,True,110,-64.78352355957031,-61.727867126464844,0
Who is that bank's talking about Irene disgusting.,Who is that bank's talking about disgusting Irene.,syntax,island_effects,sentential_subject_island,True,False,False,True,111,-67.97886657714844,-66.94160461425781,0
Who were legislatures' insulting Amanda disagreeing with.,Who were legislatures' insulting disagreeing with Amanda.,syntax,island_effects,sentential_subject_island,True,False,False,True,112,-82.44052124023438,-80.09794616699219,0
Who had those pedestrians' attacking Rebecca scared.,Who had those pedestrians' attacking scared Rebecca.,syntax,island_effects,sentential_subject_island,True,False,False,True,113,-68.00849914550781,-71.49510955810547,1
Who should the museums' stunning Angela worry.,Who should the museums' stunning worry Angela.,syntax,island_effects,sentential_subject_island,True,False,False,True,114,-67.73799133300781,-71.8076171875,1
Who would these women's lifting all schools disgust.,Who would these women's lifting disgust all schools.,syntax,island_effects,sentential_subject_island,True,False,False,True,115,-67.935791015625,-68.44792175292969,1
Who have some patients' firing Cindy aggravated.,Who have some patients' firing aggravated Cindy.,syntax,island_effects,sentential_subject_island,True,False,False,True,116,-70.81158447265625,-64.4056396484375,0
Who is every waitress's discovering Matt confusing.,Who is every waitress's discovering confusing Matt.,syntax,island_effects,sentential_subject_island,True,False,False,True,117,-66.14933776855469,-66.3203125,1
